play_id,sequence_number,type,description,away_score,home_score,period,clock,scoring_play,team_id,timestamp_utc
401823724113719018,113719018,Jumpball,Start game,0,0,1st Half,20:00,False,,2025-11-05T00:02:29Z
401823724113719020,113719020,Jumpball,Jump Ball won by Sacred Heart,0,0,1st Half,19:58,False,2529,2025-11-05T00:02:31Z
401823724113719023,113719023,Jumpball,Jump Ball lost by Merchant Marine Academy,0,0,1st Half,19:58,False,2383,2025-11-05T00:02:31Z
401823724113719140,113719140,PersonalFoul,Foul on Colin Hart.,0,0,1st Half,19:44,False,2383,2025-11-05T00:02:48Z
401823724113719152,113719152,MadeFreeThrow,Anquan Hill made Free Throw.,0,1,1st Half,19:44,True,2529,2025-11-05T00:03:11Z
401823724113719213,113719213,MadeFreeThrow,Anquan Hill missed Free Throw.,0,1,1st Half,19:41,False,2529,2025-11-05T00:03:27Z
401823724113719214,113719214,Offensive Rebound,Yann Farell Offensive Rebound.,0,1,1st Half,19:41,False,2529,2025-11-05T00:03:28Z
401823724113719215,113719215,JumpShot,Anquan Hill made Three Point Jumper. Assisted by Yann Farell.,0,4,1st Half,19:39,True,2529,2025-11-05T00:03:30Z
401823724113719312,113719312,Lost Ball Turnover,Mason Lavergne Turnover.,0,4,1st Half,19:10,False,2383,2025-11-05T00:03:59Z
401823724113719316,113719316,Steal,Dashon Gittens Steal.,0,4,1st Half,19:10,False,2529,2025-11-05T00:03:59Z
401823724113719318,113719318,LayUpShot,Dashon Gittens made Layup.,0,6,1st Half,19:06,True,2529,2025-11-05T00:04:04Z
401823724113719433,113719433,LayUpShot,Mason Lavergne made Layup. Assisted by Colin Hart.,2,6,1st Half,18:38,True,2383,2025-11-05T00:04:31Z
401823724113719519,113719519,JumpShot,Yann Farell made Three Point Jumper. Assisted by Nyle Ralph-Beyer.,2,9,1st Half,18:25,True,2529,2025-11-05T00:04:45Z
401823724113719706,113719706,Lost Ball Turnover,Merchant Marine Academy  Turnover.,2,9,1st Half,17:50,False,2383,2025-11-05T00:05:39Z
401823724113719846,113719846,JumpShot,Nyle Ralph-Beyer missed Three Point Jumper.,2,9,1st Half,17:28,False,2529,2025-11-05T00:06:23Z
401823724113719863,113719863,Defensive Rebound,Tim Barton Defensive Rebound.,2,9,1st Half,17:22,False,2383,2025-11-05T00:06:25Z
401823724113719864,113719864,Lost Ball Turnover,Tim Barton Turnover.,2,9,1st Half,17:19,False,2383,2025-11-05T00:06:29Z
401823724113719865,113719865,Steal,Anquan Hill Steal.,2,9,1st Half,17:19,False,2529,2025-11-05T00:06:29Z
401823724113719989,113719989,Lost Ball Turnover,Dashon Gittens Turnover.,2,9,1st Half,17:09,False,2529,2025-11-05T00:06:56Z
401823724113719993,113719993,Steal,Jack Flannery Steal.,2,9,1st Half,17:09,False,2383,2025-11-05T00:06:56Z
401823724113720051,113720051,LayUpShot,Tim Barton made Layup. Assisted by Colin Hart.,4,9,1st Half,16:52,True,2383,2025-11-05T00:07:13Z
401823724113720188,113720188,JumpShot,Mekhi Conner made Three Point Jumper. Assisted by Nyle Ralph-Beyer.,4,12,1st Half,16:37,True,2529,2025-11-05T00:07:46Z
401823724113720190,113720190,PersonalFoul,Foul on Aaron Zalescik.,4,12,1st Half,16:35,False,2383,2025-11-05T00:07:50Z
401823724113720290,113720290,MadeFreeThrow,Mekhi Conner missed Free Throw.,4,12,1st Half,16:32,False,2529,2025-11-05T00:08:23Z
401823724113720343,113720343,Defensive Rebound,Merchant Marine Academy Defensive Rebound.,4,12,1st Half,16:32,False,2383,2025-11-05T00:08:30Z
401823724113720507,113720507,Lost Ball Turnover,Merchant Marine Academy  Turnover.,4,12,1st Half,16:02,False,2383,2025-11-05T00:09:07Z
401823724113720625,113720625,JumpShot,Mekhi Conner missed Three Point Jumper.,4,12,1st Half,15:50,False,2529,2025-11-05T00:09:38Z
401823724113720628,113720628,Offensive Rebound,Anquan Hill Offensive Rebound.,4,12,1st Half,15:46,False,2529,2025-11-05T00:09:39Z
401823724113720653,113720653,JumpShot,Anquan Hill made Jumper.,4,14,1st Half,15:41,True,2529,2025-11-05T00:09:45Z
401823724113720745,113720745,Lost Ball Turnover,Mason Lavergne Turnover.,4,14,1st Half,15:14,False,2383,2025-11-05T00:10:11Z
401823724113720748,113720748,Steal,Dashon Gittens Steal.,4,14,1st Half,15:14,False,2529,2025-11-05T00:10:11Z
401823724113720770,113720770,Lost Ball Turnover,Yann Farell Turnover.,4,14,1st Half,15:10,False,2529,2025-11-05T00:10:15Z
401823724113720773,113720773,Steal,Mason Lavergne Steal.,4,14,1st Half,15:10,False,2383,2025-11-05T00:10:15Z
401823724113720775,113720775,Lost Ball Turnover,Mason Lavergne Turnover.,4,14,1st Half,15:05,False,2383,2025-11-05T00:10:20Z
401823724113720780,113720780,Steal,Anquan Hill Steal.,4,14,1st Half,15:05,False,2529,2025-11-05T00:10:20Z
401823724113720798,113720798,JumpShot,Yann Farell missed Three Point Jumper.,4,14,1st Half,15:01,False,2529,2025-11-05T00:10:26Z
401823724113720800,113720800,Defensive Rebound,Jack Flannery Defensive Rebound.,4,14,1st Half,14:57,False,2383,2025-11-05T00:10:28Z
401823724113720900,113720900,JumpShot,Tim Barton made Three Point Jumper. Assisted by Jack Flannery.,7,14,1st Half,14:41,True,2383,2025-11-05T00:10:46Z
401823724113720929,113720929,JumpShot,Dashon Gittens made Three Point Jumper. Assisted by Mekhi Conner.,7,17,1st Half,14:24,True,2529,2025-11-05T00:11:02Z
401823724113721063,113721063,PersonalFoul,Foul on Dashon Gittens.,7,17,1st Half,14:02,False,2529,2025-11-05T00:11:25Z
401823724113721097,113721097,OfficialTVTimeOut,Official TV Timeout,7,17,1st Half,14:01,False,,2025-11-05T00:11:46Z
401823724113721504,113721504,Substitution,Nyle Ralph-Beyer subbing out for Sacred Heart,7,17,1st Half,14:01,False,2529,2025-11-05T00:13:51Z
401823724113721505,113721505,Substitution,Dashon Gittens subbing out for Sacred Heart,7,17,1st Half,14:01,False,2529,2025-11-05T00:13:51Z
401823724113721526,113721526,Substitution,Yann Farell subbing out for Sacred Heart,7,17,1st Half,14:01,False,2529,2025-11-05T00:13:51Z
401823724113721528,113721528,Substitution,Taj Bryant subbing in for Sacred Heart,7,17,1st Half,14:01,False,2529,2025-11-05T00:13:51Z
401823724113721531,113721531,Substitution,Abdou Yadd subbing in for Sacred Heart,7,17,1st Half,14:01,False,2529,2025-11-05T00:13:51Z
401823724113721533,113721533,Substitution,Fallou Gueye subbing in for Sacred Heart,7,17,1st Half,14:01,False,2529,2025-11-05T00:13:51Z
401823724113721534,113721534,Substitution,Aaron Zalescik subbing out for Merchant Marine Academy,7,17,1st Half,14:01,False,2383,2025-11-05T00:13:51Z
401823724113721536,113721536,Substitution,Colin Hart subbing out for Merchant Marine Academy,7,17,1st Half,14:01,False,2383,2025-11-05T00:13:51Z
401823724113721539,113721539,Substitution,Richard Sykes subbing in for Merchant Marine Academy,7,17,1st Half,14:01,False,2383,2025-11-05T00:13:51Z
401823724113721542,113721542,Substitution,Talan Dawkins subbing in for Merchant Marine Academy,7,17,1st Half,14:01,False,2383,2025-11-05T00:13:51Z
401823724113721632,113721632,MadeFreeThrow,Jack Flannery missed Free Throw.,7,17,1st Half,14:01,False,2383,2025-11-05T00:14:17Z
401823724113721633,113721633,Dead Ball Rebound,Merchant Marine Academy Deadball Team Rebound.,7,17,1st Half,14:01,False,2383,2025-11-05T00:14:17Z
401823724113721634,113721634,MadeFreeThrow,Jack Flannery made Free Throw.,8,17,1st Half,14:01,True,2383,2025-11-05T00:14:24Z
401823724113721740,113721740,JumpShot,Mekhi Conner missed Three Point Jumper.,8,17,1st Half,13:40,False,2529,2025-11-05T00:14:48Z
401823724113721742,113721742,Offensive Rebound,Taj Bryant Offensive Rebound.,8,17,1st Half,13:36,False,2529,2025-11-05T00:14:51Z
401823724113721744,113721744,JumpShot,Anquan Hill missed Three Point Jumper.,8,17,1st Half,13:35,False,2529,2025-11-05T00:14:54Z
401823724113721781,113721781,Defensive Rebound,Richard Sykes Defensive Rebound.,8,17,1st Half,13:30,False,2383,2025-11-05T00:14:57Z
401823724113721864,113721864,PersonalFoul,Foul on Taj Bryant.,8,17,1st Half,13:14,False,2529,2025-11-05T00:15:16Z
401823724113721961,113721961,JumpShot,Talan Dawkins missed Three Point Jumper.,8,17,1st Half,13:14,False,2383,2025-11-05T00:15:37Z
401823724113721963,113721963,Defensive Rebound,Mekhi Conner Defensive Rebound.,8,17,1st Half,13:14,False,2529,2025-11-05T00:15:39Z
401823724113722013,113722013,JumpShot,Abdou Yadd made Three Point Jumper. Assisted by Taj Bryant.,8,20,1st Half,13:14,True,2529,2025-11-05T00:15:48Z
401823724113722051,113722051,LayUpShot,Jack Flannery missed Layup.,8,20,1st Half,13:14,False,2383,2025-11-05T00:16:05Z
401823724113722095,113722095,Defensive Rebound,Abdou Yadd Defensive Rebound.,8,20,1st Half,13:14,False,2529,2025-11-05T00:16:08Z
401823724113722097,113722097,PersonalFoul,Foul on Mason Lavergne.,8,20,1st Half,13:12,False,2383,2025-11-05T00:16:11Z
401823724113722232,113722232,PersonalFoul,Foul on Richard Sykes.,8,20,1st Half,12:27,False,2383,2025-11-05T00:16:40Z
401823724113722295,113722295,Substitution,Jack Flannery subbing out for Merchant Marine Academy,8,20,1st Half,12:27,False,2383,2025-11-05T00:16:55Z
401823724113722298,113722298,Substitution,Jack van de Erve subbing in for Merchant Marine Academy,8,20,1st Half,12:27,False,2383,2025-11-05T00:16:55Z
401823724113722403,113722403,JumpShot,Fallou Gueye missed Three Point Jumper.,8,20,1st Half,12:15,False,2529,2025-11-05T00:17:16Z
401823724113722404,113722404,Defensive Rebound,Richard Sykes Defensive Rebound.,8,20,1st Half,12:11,False,2383,2025-11-05T00:17:19Z
401823724113722405,113722405,LayUpShot,Tim Barton made Layup. Assisted by Richard Sykes.,10,20,1st Half,12:09,True,2383,2025-11-05T00:17:22Z
401823724113722435,113722435,PersonalFoul,Foul on Mekhi Conner.,10,20,1st Half,12:09,False,2529,2025-11-05T00:17:27Z
401823724113722505,113722505,MadeFreeThrow,Tim Barton made Free Throw.,11,20,1st Half,12:09,True,2383,2025-11-05T00:17:50Z
401823724113722583,113722583,DunkShot,Anquan Hill made Dunk. Assisted by Mekhi Conner.,11,22,1st Half,11:56,True,2529,2025-11-05T00:18:05Z
401823724113722643,113722643,LayUpShot,Mason Lavergne missed Layup.,11,22,1st Half,11:39,False,2383,2025-11-05T00:18:22Z
401823724113722669,113722669,Offensive Rebound,Talan Dawkins Offensive Rebound.,11,22,1st Half,11:34,False,2383,2025-11-05T00:18:27Z
401823724113722671,113722671,Lost Ball Turnover,Talan Dawkins Turnover.,11,22,1st Half,11:33,False,2383,2025-11-05T00:18:28Z
401823724113722714,113722714,Steal,Taj Bryant Steal.,11,22,1st Half,11:33,False,2529,2025-11-05T00:18:28Z
401823724113722773,113722773,JumpShot,Abdou Yadd missed Three Point Jumper.,11,22,1st Half,11:14,False,2529,2025-11-05T00:18:48Z
401823724113722822,113722822,Offensive Rebound,Fallou Gueye Offensive Rebound.,11,22,1st Half,11:09,False,2529,2025-11-05T00:18:58Z
401823724113722824,113722824,TipShot,Fallou Gueye missed Two Point Tip Shot.,11,22,1st Half,11:09,False,2529,2025-11-05T00:18:58Z
401823724113722827,113722827,Block Shot,Tim Barton Block.,11,22,1st Half,11:09,False,2383,2025-11-05T00:18:58Z
401823724113722831,113722831,Offensive Rebound,Sacred Heart Offensive Rebound.,11,22,1st Half,11:09,False,2529,2025-11-05T00:19:03Z
401823724113723352,113723352,Substitution,Mekhi Conner subbing out for Sacred Heart,11,22,1st Half,11:09,False,2529,2025-11-05T00:21:39Z
401823724113723355,113723355,Substitution,Anquan Hill subbing out for Sacred Heart,11,22,1st Half,11:09,False,2529,2025-11-05T00:21:39Z
401823724113723358,113723358,Substitution,Dashon Gittens subbing in for Sacred Heart,11,22,1st Half,11:09,False,2529,2025-11-05T00:21:39Z
401823724113723360,113723360,Substitution,Yann Farell subbing in for Sacred Heart,11,22,1st Half,11:09,False,2529,2025-11-05T00:21:39Z
401823724113723363,113723363,Substitution,Mason Lavergne subbing out for Merchant Marine Academy,11,22,1st Half,11:09,False,2383,2025-11-05T00:21:39Z
401823724113723366,113723366,Substitution,Noah Brown subbing in for Merchant Marine Academy,11,22,1st Half,11:09,False,2383,2025-11-05T00:21:39Z
401823724113723413,113723413,LayUpShot,Yann Farell missed Layup.,11,22,1st Half,11:02,False,2529,2025-11-05T00:22:01Z
401823724113723416,113723416,Offensive Rebound,Yann Farell Offensive Rebound.,11,22,1st Half,10:58,False,2529,2025-11-05T00:22:05Z
401823724113723419,113723419,TipShot,Yann Farell missed Two Point Tip Shot.,11,22,1st Half,10:58,False,2529,2025-11-05T00:22:05Z
401823724113723443,113723443,Defensive Rebound,Noah Brown Defensive Rebound.,11,22,1st Half,10:55,False,2383,2025-11-05T00:22:07Z
401823724113723502,113723502,JumpShot,Tim Barton made Three Point Jumper. Assisted by Noah Brown.,14,22,1st Half,10:33,True,2383,2025-11-05T00:22:32Z
401823724113723581,113723581,JumpShot,Yann Farell missed Three Point Jumper.,14,22,1st Half,10:09,False,2529,2025-11-05T00:22:56Z
401823724113723583,113723583,Offensive Rebound,Dashon Gittens Offensive Rebound.,14,22,1st Half,10:01,False,2529,2025-11-05T00:23:01Z
401823724113723585,113723585,TipShot,Dashon Gittens made Two Point Tip Shot.,14,24,1st Half,10:01,True,2529,2025-11-05T00:23:01Z
401823724113723622,113723622,Lost Ball Turnover,Richard Sykes Turnover.,14,24,1st Half,9:49,False,2383,2025-11-05T00:23:14Z
401823724113723636,113723636,Steal,Taj Bryant Steal.,14,24,1st Half,9:49,False,2529,2025-11-05T00:23:14Z
401823724113723639,113723639,LayUpShot,Taj Bryant missed Layup.,14,24,1st Half,9:43,False,2529,2025-11-05T00:23:20Z
401823724113723641,113723641,Defensive Rebound,Talan Dawkins Defensive Rebound.,14,24,1st Half,9:40,False,2383,2025-11-05T00:23:23Z
401823724113723658,113723658,LayUpShot,Tim Barton missed Layup.,14,24,1st Half,9:36,False,2383,2025-11-05T00:23:28Z
401823724113723659,113723659,Defensive Rebound,Fallou Gueye Defensive Rebound.,14,24,1st Half,9:32,False,2529,2025-11-05T00:23:31Z
401823724113723710,113723710,JumpShot,Yann Farell made Three Point Jumper. Assisted by Taj Bryant.,14,27,1st Half,9:29,True,2529,2025-11-05T00:23:35Z
401823724113723742,113723742,JumpShot,Tim Barton made Three Point Jumper.,17,27,1st Half,9:01,True,2383,2025-11-05T00:24:03Z
401823724113723796,113723796,LayUpShot,Abdou Yadd made Layup.,17,29,1st Half,8:45,True,2529,2025-11-05T00:24:18Z
401823724113723861,113723861,Lost Ball Turnover,Jack van de Erve Turnover.,17,29,1st Half,8:15,False,2383,2025-11-05T00:24:49Z
401823724113723863,113723863,Steal,Fallou Gueye Steal.,17,29,1st Half,8:15,False,2529,2025-11-05T00:24:49Z
401823724113723865,113723865,LayUpShot,Fallou Gueye made Layup.,17,31,1st Half,8:11,True,2529,2025-11-05T00:24:52Z
401823724113723922,113723922,Lost Ball Turnover,Noah Brown Turnover.,17,31,1st Half,7:51,False,2383,2025-11-05T00:25:13Z
401823724113723956,113723956,Steal,Dashon Gittens Steal.,17,31,1st Half,7:51,False,2529,2025-11-05T00:25:13Z
401823724113723958,113723958,DunkShot,Dashon Gittens made Dunk.,17,33,1st Half,7:46,True,2529,2025-11-05T00:25:17Z
401823724113724030,113724030,LayUpShot,Talan Dawkins missed Layup.,17,33,1st Half,7:20,False,2383,2025-11-05T00:25:44Z
401823724113724061,113724061,Defensive Rebound,Abdou Yadd Defensive Rebound.,17,33,1st Half,7:16,False,2529,2025-11-05T00:25:47Z
401823724113724063,113724063,LayUpShot,Fallou Gueye made Layup. Assisted by Dashon Gittens.,17,35,1st Half,7:14,True,2529,2025-11-05T00:25:49Z
401823724113724128,113724128,ShortTimeOut,Merchant Marine Academy Timeout,17,35,1st Half,7:08,False,2383,2025-11-05T00:26:06Z
401823724113724636,113724636,Substitution,Yann Farell subbing out for Sacred Heart,17,35,1st Half,7:08,False,2529,2025-11-05T00:29:02Z
401823724113724638,113724638,Substitution,Abdou Yadd subbing out for Sacred Heart,17,35,1st Half,7:08,False,2529,2025-11-05T00:29:02Z
401823724113724641,113724641,Substitution,Nyle Ralph-Beyer subbing in for Sacred Heart,17,35,1st Half,7:08,False,2529,2025-11-05T00:29:02Z
401823724113724642,113724642,Substitution,Anquan Hill subbing in for Sacred Heart,17,35,1st Half,7:08,False,2529,2025-11-05T00:29:02Z
401823724113724644,113724644,Substitution,Tim Barton subbing out for Merchant Marine Academy,17,35,1st Half,7:08,False,2383,2025-11-05T00:29:02Z
401823724113724649,113724649,Substitution,Jack van de Erve subbing out for Merchant Marine Academy,17,35,1st Half,7:08,False,2383,2025-11-05T00:29:02Z
401823724113724654,113724654,Substitution,Talan Dawkins subbing out for Merchant Marine Academy,17,35,1st Half,7:08,False,2383,2025-11-05T00:29:02Z
401823724113724655,113724655,Substitution,Noah Brown subbing out for Merchant Marine Academy,17,35,1st Half,7:08,False,2383,2025-11-05T00:29:02Z
401823724113724656,113724656,Substitution,Mason Lavergne subbing in for Merchant Marine Academy,17,35,1st Half,7:08,False,2383,2025-11-05T00:29:02Z
401823724113724657,113724657,Substitution,Aaron Zalescik subbing in for Merchant Marine Academy,17,35,1st Half,7:08,False,2383,2025-11-05T00:29:02Z
401823724113724658,113724658,Substitution,Aaron Braxton subbing in for Merchant Marine Academy,17,35,1st Half,7:08,False,2383,2025-11-05T00:29:02Z
401823724113724659,113724659,Substitution,Jack Flannery subbing in for Merchant Marine Academy,17,35,1st Half,7:08,False,2383,2025-11-05T00:29:02Z
401823724113724683,113724683,LayUpShot,Richard Sykes missed Layup.,17,35,1st Half,6:50,False,2383,2025-11-05T00:29:15Z
401823724113724730,113724730,Block Shot,Dashon Gittens Block.,17,35,1st Half,6:50,False,2529,2025-11-05T00:29:15Z
401823724113724732,113724732,Offensive Rebound,Merchant Marine Academy Offensive Rebound.,17,35,1st Half,6:49,False,2383,2025-11-05T00:29:19Z
401823724113724805,113724805,Lost Ball Turnover,Merchant Marine Academy  Turnover.,17,35,1st Half,6:40,False,2383,2025-11-05T00:29:44Z
401823724113724985,113724985,Lost Ball Turnover,Taj Bryant Turnover.,17,35,1st Half,6:16,False,2529,2025-11-05T00:30:28Z
401823724113724986,113724986,Steal,Richard Sykes Steal.,17,35,1st Half,6:16,False,2383,2025-11-05T00:30:28Z
401823724113725042,113725042,JumpShot,Jack Flannery missed Three Point Jumper.,17,35,1st Half,5:54,False,2383,2025-11-05T00:30:51Z
401823724113725045,113725045,Defensive Rebound,Sacred Heart Defensive Rebound.,17,35,1st Half,5:52,False,2529,2025-11-05T00:30:54Z
401823724113725084,113725084,Substitution,Taj Bryant subbing out for Sacred Heart,17,35,1st Half,5:52,False,2529,2025-11-05T00:31:05Z
401823724113725086,113725086,Substitution,Fallou Gueye subbing out for Sacred Heart,17,35,1st Half,5:52,False,2529,2025-11-05T00:31:05Z
401823724113725088,113725088,Substitution,Mekhi Conner subbing in for Sacred Heart,17,35,1st Half,5:52,False,2529,2025-11-05T00:31:05Z
401823724113725091,113725091,Substitution,Jaden Slaughter subbing in for Sacred Heart,17,35,1st Half,5:52,False,2529,2025-11-05T00:31:05Z
401823724113725131,113725131,Substitution,Richard Sykes subbing out for Merchant Marine Academy,17,35,1st Half,5:51,False,2383,2025-11-05T00:31:18Z
401823724113725133,113725133,Substitution,Tim Barton subbing in for Merchant Marine Academy,17,35,1st Half,5:51,False,2383,2025-11-05T00:31:18Z
401823724113725212,113725212,JumpShot,Nyle Ralph-Beyer made Three Point Jumper. Assisted by Mekhi Conner.,17,38,1st Half,5:37,True,2529,2025-11-05T00:31:38Z
401823724113725335,113725335,JumpShot,Jack Flannery made Jumper. Assisted by Aaron Braxton.,19,38,1st Half,5:06,True,2383,2025-11-05T00:32:08Z
401823724113725356,113725356,LayUpShot,Nyle Ralph-Beyer made Layup.,19,40,1st Half,4:55,True,2529,2025-11-05T00:32:19Z
401823724113725427,113725427,LayUpShot,Aaron Zalescik missed Layup.,19,40,1st Half,4:35,False,2383,2025-11-05T00:32:38Z
401823724113725433,113725433,Offensive Rebound,Merchant Marine Academy Offensive Rebound.,19,40,1st Half,4:34,False,2383,2025-11-05T00:32:41Z
401823724113725535,113725535,JumpShot,Jack Flannery made Three Point Jumper. Assisted by Tim Barton.,22,40,1st Half,4:28,True,2383,2025-11-05T00:33:02Z
401823724113725584,113725584,JumpShot,Nyle Ralph-Beyer missed Jumper.,22,40,1st Half,4:13,False,2529,2025-11-05T00:33:18Z
401823724113725588,113725588,Offensive Rebound,Anquan Hill Offensive Rebound.,22,40,1st Half,4:08,False,2529,2025-11-05T00:33:23Z
401823724113725590,113725590,TipShot,Anquan Hill missed Two Point Tip Shot.,22,40,1st Half,4:08,False,2529,2025-11-05T00:33:23Z
401823724113725591,113725591,Defensive Rebound,Aaron Zalescik Defensive Rebound.,22,40,1st Half,4:07,False,2383,2025-11-05T00:33:23Z
401823724113725631,113725631,PersonalFoul,Foul on Jaden Slaughter.,22,40,1st Half,4:01,False,2529,2025-11-05T00:33:42Z
401823724113725687,113725687,Substitution,Dashon Gittens subbing out for Sacred Heart,22,40,1st Half,4:01,False,2529,2025-11-05T00:34:01Z
401823724113725688,113725688,Substitution,Yann Farell subbing in for Sacred Heart,22,40,1st Half,4:01,False,2529,2025-11-05T00:34:01Z
401823724113725816,113725816,LayUpShot,Tim Barton missed Layup.,22,40,1st Half,3:43,False,2383,2025-11-05T00:34:21Z
401823724113725817,113725817,Defensive Rebound,Yann Farell Defensive Rebound.,22,40,1st Half,3:39,False,2529,2025-11-05T00:34:25Z
401823724113725856,113725856,Lost Ball Turnover,Mekhi Conner Turnover.,22,40,1st Half,3:36,False,2529,2025-11-05T00:34:32Z
401823724113725877,113725877,OfficialTVTimeOut,Official TV Timeout,22,40,1st Half,3:34,False,,2025-11-05T00:34:43Z
401823724113726523,113726523,LayUpShot,Aaron Braxton missed Layup.,22,40,1st Half,3:17,False,2383,2025-11-05T00:37:23Z
401823724113726525,113726525,Defensive Rebound,Anquan Hill Defensive Rebound.,22,40,1st Half,3:14,False,2529,2025-11-05T00:37:25Z
401823724113726550,113726550,JumpShot,Nyle Ralph-Beyer missed Three Point Jumper.,22,40,1st Half,3:12,False,2529,2025-11-05T00:37:28Z
401823724113726552,113726552,Defensive Rebound,Aaron Zalescik Defensive Rebound.,22,40,1st Half,3:10,False,2383,2025-11-05T00:37:29Z
401823724113726632,113726632,LayUpShot,Jack Flannery missed Layup.,22,40,1st Half,2:52,False,2383,2025-11-05T00:37:48Z
401823724113726636,113726636,Defensive Rebound,Mekhi Conner Defensive Rebound.,22,40,1st Half,2:47,False,2529,2025-11-05T00:37:52Z
401823724113726667,113726667,DunkShot,Anquan Hill made Dunk. Assisted by Mekhi Conner.,22,42,1st Half,2:42,True,2529,2025-11-05T00:37:58Z
401823724113726735,113726735,Lost Ball Turnover,Jack Flannery Turnover.,22,42,1st Half,2:20,False,2383,2025-11-05T00:38:21Z
401823724113726786,113726786,Steal,Yann Farell Steal.,22,42,1st Half,2:20,False,2529,2025-11-05T00:38:21Z
401823724113726788,113726788,Lost Ball Turnover,Yann Farell Turnover.,22,42,1st Half,2:18,False,2529,2025-11-05T00:38:30Z
401823724113726819,113726819,Substitution,Anquan Hill subbing out for Sacred Heart,22,42,1st Half,2:18,False,2529,2025-11-05T00:38:40Z
401823724113726821,113726821,Substitution,Abdou Yadd subbing in for Sacred Heart,22,42,1st Half,2:18,False,2529,2025-11-05T00:38:40Z
401823724113726901,113726901,PersonalFoul,Foul on Jaden Slaughter.,22,42,1st Half,2:18,False,2529,2025-11-05T00:39:00Z
401823724113726947,113726947,Substitution,Jaden Slaughter subbing out for Sacred Heart,22,42,1st Half,2:18,False,2529,2025-11-05T00:39:14Z
401823724113726949,113726949,Substitution,Dashon Gittens subbing in for Sacred Heart,22,42,1st Half,2:18,False,2529,2025-11-05T00:39:14Z
401823724113727045,113727045,JumpShot,Jack Flannery made Three Point Jumper. Assisted by Tim Barton.,25,42,1st Half,1:56,True,2383,2025-11-05T00:39:42Z
401823724113727098,113727098,JumpShot,Nyle Ralph-Beyer missed Jumper.,25,42,1st Half,1:49,False,2529,2025-11-05T00:39:50Z
401823724113727100,113727100,Defensive Rebound,Jack Flannery Defensive Rebound.,25,42,1st Half,1:46,False,2383,2025-11-05T00:39:52Z
401823724113727118,113727118,JumpShot,Aaron Braxton missed Three Point Jumper.,25,42,1st Half,1:34,False,2383,2025-11-05T00:40:06Z
401823724113727158,113727158,Defensive Rebound,Abdou Yadd Defensive Rebound.,25,42,1st Half,1:30,False,2529,2025-11-05T00:40:08Z
401823724113727172,113727172,JumpShot,Mekhi Conner missed Three Point Jumper.,25,42,1st Half,1:19,False,2529,2025-11-05T00:40:22Z
401823724113727173,113727173,Defensive Rebound,Aaron Zalescik Defensive Rebound.,25,42,1st Half,1:14,False,2383,2025-11-05T00:40:23Z
401823724113727208,113727208,JumpShot,Mason Lavergne missed Three Point Jumper.,25,42,1st Half,1:06,False,2383,2025-11-05T00:40:33Z
401823724113727209,113727209,Defensive Rebound,Nyle Ralph-Beyer Defensive Rebound.,25,42,1st Half,1:03,False,2529,2025-11-05T00:40:35Z
401823724113727218,113727218,JumpShot,Nyle Ralph-Beyer missed Three Point Jumper.,25,42,1st Half,0:57,False,2529,2025-11-05T00:40:42Z
401823724113727257,113727257,Offensive Rebound,Dashon Gittens Offensive Rebound.,25,42,1st Half,0:51,False,2529,2025-11-05T00:40:47Z
401823724113727258,113727258,JumpShot,Abdou Yadd missed Three Point Jumper.,25,42,1st Half,0:43,False,2529,2025-11-05T00:40:56Z
401823724113727305,113727305,Offensive Rebound,Yann Farell Offensive Rebound.,25,42,1st Half,0:39,False,2529,2025-11-05T00:40:59Z
401823724113727341,113727341,PersonalFoul,Foul on Jack Flannery.,25,42,1st Half,0:30,False,2383,2025-11-05T00:41:15Z
401823724113727401,113727401,Substitution,Nyle Ralph-Beyer subbing out for Sacred Heart,25,42,1st Half,0:30,False,2529,2025-11-05T00:41:36Z
401823724113727402,113727402,Substitution,Dashon Gittens subbing out for Sacred Heart,25,42,1st Half,0:30,False,2529,2025-11-05T00:41:36Z
401823724113727405,113727405,Substitution,Taj Bryant subbing in for Sacred Heart,25,42,1st Half,0:30,False,2529,2025-11-05T00:41:36Z
401823724113727426,113727426,Substitution,Fallou Gueye subbing in for Sacred Heart,25,42,1st Half,0:30,False,2529,2025-11-05T00:41:36Z
401823724113727429,113727429,Substitution,Aaron Zalescik subbing out for Merchant Marine Academy,25,42,1st Half,0:30,False,2383,2025-11-05T00:41:36Z
401823724113727431,113727431,Substitution,Jack Flannery subbing out for Merchant Marine Academy,25,42,1st Half,0:30,False,2383,2025-11-05T00:41:36Z
401823724113727433,113727433,Substitution,Richard Sykes subbing in for Merchant Marine Academy,25,42,1st Half,0:30,False,2383,2025-11-05T00:41:36Z
401823724113727436,113727436,Substitution,Talan Dawkins subbing in for Merchant Marine Academy,25,42,1st Half,0:30,False,2383,2025-11-05T00:41:36Z
401823724113727472,113727472,JumpShot,Taj Bryant made Three Point Jumper. Assisted by Fallou Gueye.,25,45,1st Half,0:24,True,2529,2025-11-05T00:41:43Z
401823724113727519,113727519,JumpShot,Aaron Braxton missed Three Point Jumper.,25,45,1st Half,0:04,False,2383,2025-11-05T00:42:03Z
