play_id,sequence_number,type,description,away_score,home_score,period,clock,scoring_play,team_id,timestamp_utc
401827189114485221,114485221,JumpShot,Tahj Staveskie made Jumper.,50,57,2nd Half,4:15,True,2916,2025-11-17T00:15:12Z
401827189114485225,114485225,ShortTimeOut,Incarnate Word Timeout,50,57,2nd Half,4:13,False,2916,2025-11-17T00:15:17Z
401827189114485226,114485226,OfficialTVTimeOut,Official TV Timeout,50,57,2nd Half,4:13,False,,2025-11-17T00:15:20Z
401827189114485285,114485285,Substitution,Marcus Glover subbing out for Incarnate Word,50,57,2nd Half,4:13,False,2916,2025-11-17T00:18:00Z
401827189114485286,114485286,Substitution,Mihael Tomic subbing in for Incarnate Word,50,57,2nd Half,4:13,False,2916,2025-11-17T00:18:00Z
401827189114485381,114485381,LayUpShot,Tayton Conerway made Layup.,50,59,2nd Half,3:58,True,84,2025-11-17T00:18:28Z
401827189114485570,114485570,JumpShot,Tahj Staveskie made Jumper.,52,59,2nd Half,3:32,True,2916,2025-11-17T00:18:55Z
401827189114485699,114485699,JumpShot,Tucker DeVries made Jumper. Assisted by Conor Enright.,52,61,2nd Half,3:05,True,84,2025-11-17T00:19:22Z
401827189114485903,114485903,JumpShot,Tahj Staveskie made Jumper.,54,61,2nd Half,2:42,True,2916,2025-11-17T00:19:45Z
401827189114485933,114485933,JumpShot,Tucker DeVries made Three Point Jumper. Assisted by Sam Alexis.,54,64,2nd Half,2:22,True,84,2025-11-17T00:20:05Z
401827189114485939,114485939,JumpShot,Jordan Pyke made Three Point Jumper. Assisted by Tahj Staveskie.,57,64,2nd Half,1:56,True,2916,2025-11-17T00:20:31Z
401827189114485950,114485950,LayUpShot,Tayton Conerway missed Layup.,57,64,2nd Half,1:29,False,84,2025-11-17T00:20:58Z
401827189114485951,114485951,Defensive Rebound,Mihael Tomic Defensive Rebound.,57,64,2nd Half,1:26,False,2916,2025-11-17T00:21:00Z
401827189114485955,114485955,JumpShot,Tahj Staveskie made Jumper.,59,64,2nd Half,1:21,True,2916,2025-11-17T00:21:05Z
401827189114485956,114485956,RegularTimeOut,Incarnate Word Timeout,59,64,2nd Half,1:21,False,2916,2025-11-17T00:21:10Z
401827189114485991,114485991,Substitution,Mihael Tomic subbing out for Incarnate Word,59,64,2nd Half,1:21,False,2916,2025-11-17T00:22:51Z
401827189114485992,114485992,Substitution,Marcus Glover subbing in for Incarnate Word,59,64,2nd Half,1:21,False,2916,2025-11-17T00:22:51Z
401827189114486008,114486008,PersonalFoul,Foul on Harrison Reede.,59,64,2nd Half,1:00,False,2916,2025-11-17T00:23:35Z
401827189114486021,114486021,MadeFreeThrow,Tucker DeVries missed Free Throw.,59,64,2nd Half,1:00,False,84,2025-11-17T00:24:02Z
401827189114486022,114486022,Dead Ball Rebound,Indiana Deadball Team Rebound.,59,64,2nd Half,1:00,False,84,2025-11-17T00:24:02Z
401827189114486028,114486028,MadeFreeThrow,Tucker DeVries missed Free Throw.,59,64,2nd Half,1:00,False,84,2025-11-17T00:24:15Z
401827189114486029,114486029,Defensive Rebound,Jordan Pyke Defensive Rebound.,59,64,2nd Half,0:59,False,2916,2025-11-17T00:24:17Z
401827189114486033,114486033,JumpShot,Davion Bailey missed Three Point Jumper.,59,64,2nd Half,0:36,False,2916,2025-11-17T00:24:41Z
401827189114486037,114486037,Defensive Rebound,Indiana Defensive Rebound.,59,64,2nd Half,0:34,False,84,2025-11-17T00:24:44Z
401827189114486075,114486075,ShortTimeOut,Indiana Timeout,59,64,2nd Half,0:26,False,84,2025-11-17T00:25:24Z
401827189114486097,114486097,PersonalFoul,Foul on Tahj Staveskie.,59,64,2nd Half,0:24,False,2916,2025-11-17T00:26:32Z
401827189114486100,114486100,MadeFreeThrow,Lamar Wilkerson made Free Throw.,59,65,2nd Half,0:24,True,84,2025-11-17T00:26:57Z
401827189114486104,114486104,MadeFreeThrow,Lamar Wilkerson made Free Throw.,59,66,2nd Half,0:24,True,84,2025-11-17T00:27:14Z
401827189114486105,114486105,LayUpShot,Jordan Pyke made Layup.,61,66,2nd Half,0:14,True,2916,2025-11-17T00:27:28Z
401827189114486111,114486111,PersonalFoul,Foul on Marcus Glover.,61,66,2nd Half,0:13,False,2916,2025-11-17T00:27:45Z
401827189114486113,114486113,MadeFreeThrow,Sam Alexis missed Free Throw.,61,66,2nd Half,0:13,False,84,2025-11-17T00:28:13Z
401827189114486114,114486114,Dead Ball Rebound,Indiana Deadball Team Rebound.,61,66,2nd Half,0:13,False,84,2025-11-17T00:28:13Z
401827189114486128,114486128,MadeFreeThrow,Sam Alexis made Free Throw.,61,67,2nd Half,0:13,True,84,2025-11-17T00:28:42Z
401827189114486141,114486141,JumpShot,Davion Bailey missed Three Point Jumper.,61,67,2nd Half,0:03,False,2916,2025-11-17T00:28:57Z
401827189114486142,114486142,Defensive Rebound,Lamar Wilkerson Defensive Rebound.,61,67,2nd Half,0:01,False,84,2025-11-17T00:28:59Z
401827189114486145,114486145,PersonalFoul,Foul on Tahj Staveskie.,61,67,2nd Half,0:01,False,2916,2025-11-17T00:29:05Z
401827189114486174,114486174,MadeFreeThrow,Lamar Wilkerson made Free Throw.,61,68,2nd Half,0:01,True,84,2025-11-17T00:29:33Z
401827189114486179,114486179,MadeFreeThrow,Lamar Wilkerson made Free Throw.,61,69,2nd Half,0:01,True,84,2025-11-17T00:29:45Z
401827189114486182,114486182,End Period,End of 2nd half,61,69,2nd Half,0:00,False,,2025-11-17T00:29:55Z
401827189114486183,114486183,End Game,End of Game,61,69,2nd Half,0:00,False,,2025-11-17T00:30:03Z
