play_id,sequence_number,type,description,away_score,home_score,period,clock,scoring_play,team_id,timestamp_utc
401823325114799594,114799594,End Period,End of 1st half,30,28,1st Half,0:00,False,,2025-11-22T22:45:45Z
401823325114800603,114800603,Substitution,Tyrique Brooks subbing out for Missouri State,30,28,2nd Half,20:00,False,2623,2025-11-22T23:00:34Z
401823325114800604,114800604,Substitution,Darrion Sutton subbing out for Missouri State,30,28,2nd Half,20:00,False,2623,2025-11-22T23:00:34Z
401823325114800605,114800605,Substitution,Zaxton King subbing in for Missouri State,30,28,2nd Half,20:00,False,2623,2025-11-22T23:00:34Z
401823325114800666,114800666,Substitution,Michael Osei-Bonsu subbing in for Missouri State,30,28,2nd Half,20:00,False,2623,2025-11-22T23:00:34Z
401823325114800667,114800667,Substitution,Jaylen Washington subbing out for UT Rio Grande Valley,30,28,2nd Half,20:00,False,292,2025-11-22T23:00:34Z
401823325114800668,114800668,Substitution,Zae Blake subbing out for UT Rio Grande Valley,30,28,2nd Half,20:00,False,292,2025-11-22T23:00:34Z
401823325114800669,114800669,Substitution,Kwo Agwa subbing out for UT Rio Grande Valley,30,28,2nd Half,20:00,False,292,2025-11-22T23:00:34Z
401823325114800670,114800670,Substitution,Always Wright subbing in for UT Rio Grande Valley,30,28,2nd Half,20:00,False,292,2025-11-22T23:00:34Z
401823325114800672,114800672,Substitution,Koree Cotton subbing in for UT Rio Grande Valley,30,28,2nd Half,20:00,False,292,2025-11-22T23:00:34Z
401823325114800674,114800674,Substitution,Filip Brankovic subbing in for UT Rio Grande Valley,30,28,2nd Half,20:00,False,292,2025-11-22T23:00:34Z
401823325114800810,114800810,LayUpShot,Filip Brankovic made Layup. Assisted by Koree Cotton.,32,28,2nd Half,19:38,True,292,2025-11-22T23:02:09Z
401823325114800822,114800822,LayUpShot,Michael Osei-Bonsu made Layup. Assisted by Zaxton King.,32,30,2nd Half,19:20,True,2623,2025-11-22T23:02:27Z
401823325114800897,114800897,JumpShot,Always Wright made Jumper.,34,30,2nd Half,19:03,True,292,2025-11-22T23:02:44Z
401823325114800948,114800948,LayUpShot,Michael Osei-Bonsu made Layup. Assisted by Kobi Williams.,34,32,2nd Half,18:43,True,2623,2025-11-22T23:03:04Z
401823325114800961,114800961,PersonalFoul,Foul on Michael Osei-Bonsu.,34,32,2nd Half,18:33,False,2623,2025-11-22T23:03:18Z
401823325114801004,114801004,MadeFreeThrow,Koree Cotton missed Free Throw.,34,32,2nd Half,18:33,False,292,2025-11-22T23:03:38Z
401823325114801005,114801005,Dead Ball Rebound,UT Rio Grande Valley Deadball Team Rebound.,34,32,2nd Half,18:33,False,292,2025-11-22T23:03:38Z
401823325114801014,114801014,Substitution,Michael Osei-Bonsu subbing out for Missouri State,34,32,2nd Half,18:33,False,2623,2025-11-22T23:03:42Z
401823325114801015,114801015,Substitution,Cameron Boone subbing in for Missouri State,34,32,2nd Half,18:33,False,2623,2025-11-22T23:03:42Z
401823325114801024,114801024,MadeFreeThrow,Koree Cotton made Free Throw.,35,32,2nd Half,18:33,True,292,2025-11-22T23:03:57Z
401823325114801056,114801056,JumpShot,Trey Williams Jr. missed Three Point Jumper.,35,32,2nd Half,18:10,False,2623,2025-11-22T23:04:24Z
401823325114801058,114801058,Defensive Rebound,Marvin McGhee III Defensive Rebound.,35,32,2nd Half,18:06,False,292,2025-11-22T23:04:27Z
401823325114801113,114801113,JumpShot,Always Wright missed Three Point Jumper.,35,32,2nd Half,17:52,False,292,2025-11-22T23:04:44Z
401823325114801115,114801115,Defensive Rebound,Keith Palek III Defensive Rebound.,35,32,2nd Half,17:48,False,2623,2025-11-22T23:04:46Z
401823325114801150,114801150,JumpShot,Keith Palek III missed Three Point Jumper.,35,32,2nd Half,17:31,False,2623,2025-11-22T23:05:04Z
401823325114801151,114801151,Defensive Rebound,Always Wright Defensive Rebound.,35,32,2nd Half,17:26,False,292,2025-11-22T23:05:07Z
401823325114801158,114801158,Substitution,Cameron Boone subbing out for Missouri State,35,32,2nd Half,17:23,False,2623,2025-11-22T23:05:20Z
401823325114801159,114801159,Substitution,Darrion Sutton subbing in for Missouri State,35,32,2nd Half,17:23,False,2623,2025-11-22T23:05:20Z
401823325114801203,114801203,Lost Ball Turnover,Filip Brankovic Turnover.,35,32,2nd Half,17:23,False,292,2025-11-22T23:05:34Z
401823325114801204,114801204,Steal,Keith Palek III Steal.,35,32,2nd Half,17:23,False,2623,2025-11-22T23:05:34Z
401823325114801233,114801233,Lost Ball Turnover,Darrion Sutton Turnover.,35,32,2nd Half,17:19,False,2623,2025-11-22T23:05:44Z
401823325114801263,114801263,Substitution,Trey Williams Jr. subbing out for Missouri State,35,32,2nd Half,17:13,False,2623,2025-11-22T23:06:08Z
401823325114801265,114801265,Substitution,Tyrique Brooks subbing in for Missouri State,35,32,2nd Half,17:13,False,2623,2025-11-22T23:06:08Z
401823325114801266,114801266,Substitution,Always Wright subbing out for UT Rio Grande Valley,35,32,2nd Half,17:13,False,292,2025-11-22T23:06:08Z
401823325114801267,114801267,Substitution,Kye Dickson subbing out for UT Rio Grande Valley,35,32,2nd Half,17:13,False,292,2025-11-22T23:06:08Z
401823325114801268,114801268,Substitution,Filip Brankovic subbing out for UT Rio Grande Valley,35,32,2nd Half,17:13,False,292,2025-11-22T23:06:08Z
401823325114801269,114801269,Substitution,Jaylen Washington subbing in for UT Rio Grande Valley,35,32,2nd Half,17:13,False,292,2025-11-22T23:06:08Z
401823325114801270,114801270,Substitution,Zae Blake subbing in for UT Rio Grande Valley,35,32,2nd Half,17:13,False,292,2025-11-22T23:06:08Z
401823325114801271,114801271,Substitution,Kwo Agwa subbing in for UT Rio Grande Valley,35,32,2nd Half,17:13,False,292,2025-11-22T23:06:08Z
401823325114801334,114801334,JumpShot,Jaylen Washington missed Jumper.,35,32,2nd Half,16:47,False,292,2025-11-22T23:06:37Z
401823325114801335,114801335,Defensive Rebound,Keith Palek III Defensive Rebound.,35,32,2nd Half,16:43,False,2623,2025-11-22T23:06:39Z
401823325114801367,114801367,LayUpShot,Darrion Sutton made Layup. Assisted by Keith Palek III.,35,34,2nd Half,16:34,True,2623,2025-11-22T23:06:49Z
401823325114801382,114801382,JumpShot,Kwo Agwa made Jumper.,37,34,2nd Half,16:23,True,292,2025-11-22T23:07:04Z
401823325114801383,114801383,PersonalFoul,Foul on Keith Palek III.,37,34,2nd Half,16:23,False,2623,2025-11-22T23:07:07Z
401823325114801424,114801424,MadeFreeThrow,Kwo Agwa made Free Throw.,38,34,2nd Half,16:23,True,292,2025-11-22T23:07:25Z
401823325114801451,114801451,Substitution,Zaxton King subbing out for Missouri State,38,34,2nd Half,16:23,False,2623,2025-11-22T23:07:34Z
401823325114801452,114801452,Substitution,Trey Williams Jr. subbing in for Missouri State,38,34,2nd Half,16:23,False,2623,2025-11-22T23:07:34Z
401823325114801476,114801476,JumpShot,Keith Palek III made Three Point Jumper. Assisted by Kobi Williams.,38,37,2nd Half,16:08,True,2623,2025-11-22T23:07:54Z
401823325114801527,114801527,LayUpShot,Koree Cotton made Layup. Assisted by Zae Blake.,40,37,2nd Half,15:45,True,292,2025-11-22T23:08:17Z
401823325114801535,114801535,JumpShot,Keith Palek III missed Three Point Jumper.,40,37,2nd Half,15:33,False,2623,2025-11-22T23:08:30Z
401823325114801543,114801543,Defensive Rebound,Marvin McGhee III Defensive Rebound.,40,37,2nd Half,15:30,False,292,2025-11-22T23:08:32Z
401823325114801580,114801580,JumpShot,Marvin McGhee III missed Three Point Jumper.,40,37,2nd Half,15:20,False,292,2025-11-22T23:08:43Z
401823325114801581,114801581,Defensive Rebound,Trey Williams Jr. Defensive Rebound.,40,37,2nd Half,15:17,False,2623,2025-11-22T23:08:45Z
401823325114801582,114801582,JumpShot,Kobi Williams missed Three Point Jumper.,40,37,2nd Half,15:13,False,2623,2025-11-22T23:08:49Z
401823325114801583,114801583,Defensive Rebound,Marvin McGhee III Defensive Rebound.,40,37,2nd Half,15:10,False,292,2025-11-22T23:08:52Z
401823325114801616,114801616,LayUpShot,Marvin McGhee III made Layup. Assisted by Zae Blake.,42,37,2nd Half,15:04,True,292,2025-11-22T23:08:58Z
401823325114801625,114801625,ShortTimeOut,Missouri State Timeout,42,37,2nd Half,15:01,False,2623,2025-11-22T23:09:07Z
401823325114801626,114801626,OfficialTVTimeOut,Official TV Timeout,42,37,2nd Half,15:01,False,,2025-11-22T23:09:10Z
401823325114801758,114801758,Substitution,Kobi Williams subbing out for Missouri State,42,37,2nd Half,15:01,False,2623,2025-11-22T23:11:27Z
401823325114801759,114801759,Substitution,Tyrique Brooks subbing out for Missouri State,42,37,2nd Half,15:01,False,2623,2025-11-22T23:11:27Z
401823325114801760,114801760,Substitution,Logan Epes subbing in for Missouri State,42,37,2nd Half,15:01,False,2623,2025-11-22T23:11:27Z
401823325114801761,114801761,Substitution,Zaxton King subbing in for Missouri State,42,37,2nd Half,15:01,False,2623,2025-11-22T23:11:27Z
401823325114801762,114801762,Substitution,Koree Cotton subbing out for UT Rio Grande Valley,42,37,2nd Half,15:01,False,292,2025-11-22T23:11:27Z
401823325114801763,114801763,Substitution,Marvin McGhee III subbing out for UT Rio Grande Valley,42,37,2nd Half,15:01,False,292,2025-11-22T23:11:27Z
401823325114801765,114801765,Substitution,Dane Christensen subbing in for UT Rio Grande Valley,42,37,2nd Half,15:01,False,292,2025-11-22T23:11:27Z
401823325114801786,114801786,Substitution,Julien Gomez subbing in for UT Rio Grande Valley,42,37,2nd Half,15:01,False,292,2025-11-22T23:11:27Z
401823325114801849,114801849,JumpShot,Keith Palek III made Jumper.,42,39,2nd Half,14:44,True,2623,2025-11-22T23:12:04Z
401823325114801922,114801922,PersonalFoul,Foul on Keith Palek III.,42,39,2nd Half,14:14,False,2623,2025-11-22T23:12:47Z
401823325114801936,114801936,OfficialTVTimeOut,Official TV Timeout,42,39,2nd Half,14:14,False,,2025-11-22T23:12:55Z
401823325114802202,114802202,Substitution,Logan Epes subbing out for Missouri State,42,39,2nd Half,14:14,False,2623,2025-11-22T23:15:17Z
401823325114802203,114802203,Substitution,Kobi Williams subbing in for Missouri State,42,39,2nd Half,14:14,False,2623,2025-11-22T23:15:17Z
401823325114802221,114802221,JumpShot,Julien Gomez missed Three Point Jumper.,42,39,2nd Half,14:09,False,292,2025-11-22T23:15:36Z
401823325114802222,114802222,Offensive Rebound,Dane Christensen Offensive Rebound.,42,39,2nd Half,14:04,False,292,2025-11-22T23:15:39Z
401823325114802255,114802255,JumpShot,Jaylen Washington missed Jumper.,42,39,2nd Half,14:01,False,292,2025-11-22T23:15:42Z
401823325114802256,114802256,Offensive Rebound,Jaylen Washington Offensive Rebound.,42,39,2nd Half,13:59,False,292,2025-11-22T23:15:44Z
401823325114802262,114802262,JumpShot,Zae Blake made Three Point Jumper. Assisted by Dane Christensen.,45,39,2nd Half,13:48,True,292,2025-11-22T23:15:55Z
401823325114802301,114802301,PersonalFoul,Foul on Dane Christensen.,45,39,2nd Half,13:34,False,292,2025-11-22T23:16:17Z
401823325114802328,114802328,MadeFreeThrow,Keith Palek III missed Free Throw.,45,39,2nd Half,13:34,False,2623,2025-11-22T23:16:30Z
401823325114802329,114802329,Dead Ball Rebound,Missouri State Deadball Team Rebound.,45,39,2nd Half,13:34,False,2623,2025-11-22T23:16:30Z
401823325114802343,114802343,MadeFreeThrow,Keith Palek III made Free Throw.,45,40,2nd Half,13:34,True,2623,2025-11-22T23:16:41Z
401823325114802422,114802422,JumpShot,Julien Gomez missed Jumper.,45,40,2nd Half,13:06,False,292,2025-11-22T23:17:12Z
401823325114802423,114802423,Defensive Rebound,Keith Palek III Defensive Rebound.,45,40,2nd Half,13:02,False,2623,2025-11-22T23:17:16Z
401823325114802440,114802440,LayUpShot,Darrion Sutton made Layup.,45,42,2nd Half,12:44,True,2623,2025-11-22T23:17:35Z
401823325114802506,114802506,JumpShot,Dane Christensen missed Jumper.,45,42,2nd Half,12:15,False,292,2025-11-22T23:18:03Z
401823325114802547,114802547,Substitution,Keith Palek III subbing out for Missouri State,45,42,2nd Half,12:14,False,2623,2025-11-22T23:18:21Z
401823325114802549,114802549,Substitution,Michael Osei-Bonsu subbing in for Missouri State,45,42,2nd Half,12:14,False,2623,2025-11-22T23:18:21Z
401823325114802550,114802550,Substitution,Kwo Agwa subbing out for UT Rio Grande Valley,45,42,2nd Half,12:14,False,292,2025-11-22T23:18:21Z
401823325114802551,114802551,Substitution,Filip Brankovic subbing in for UT Rio Grande Valley,45,42,2nd Half,12:14,False,292,2025-11-22T23:18:21Z
401823325114802508,114802508,Offensive Rebound,UT Rio Grande Valley Offensive Rebound.,45,42,2nd Half,12:13,False,292,2025-11-22T23:18:07Z
401823325114802557,114802557,JumpShot,Dane Christensen missed Three Point Jumper.,45,42,2nd Half,12:10,False,292,2025-11-22T23:18:31Z
401823325114802569,114802569,Offensive Rebound,Jaylen Washington Offensive Rebound.,45,42,2nd Half,12:07,False,292,2025-11-22T23:18:33Z
401823325114802573,114802573,JumpShot,Julien Gomez made Jumper.,47,42,2nd Half,11:54,True,292,2025-11-22T23:18:47Z
401823325114802600,114802600,JumpShot,Darrion Sutton missed Jumper.,47,42,2nd Half,11:33,False,2623,2025-11-22T23:19:08Z
401823325114802626,114802626,Defensive Rebound,Dane Christensen Defensive Rebound.,47,42,2nd Half,11:27,False,292,2025-11-22T23:19:13Z
401823325114802627,114802627,JumpShot,Zae Blake missed Jumper.,47,42,2nd Half,11:25,False,292,2025-11-22T23:19:15Z
401823325114802628,114802628,Offensive Rebound,Filip Brankovic Offensive Rebound.,47,42,2nd Half,11:23,False,292,2025-11-22T23:19:17Z
401823325114802629,114802629,JumpShot,Filip Brankovic made Jumper.,49,42,2nd Half,11:20,True,292,2025-11-22T23:19:21Z
401823325114802640,114802640,JumpShot,Darrion Sutton made Three Point Jumper. Assisted by Trey Williams Jr..,49,45,2nd Half,11:04,True,2623,2025-11-22T23:19:36Z
401823325114802731,114802731,PersonalFoul,Foul on Michael Osei-Bonsu.,49,45,2nd Half,10:46,False,2623,2025-11-22T23:20:01Z
401823325114802733,114802733,OfficialTVTimeOut,Official TV Timeout,49,45,2nd Half,10:46,False,,2025-11-22T23:20:07Z
401823325114802986,114802986,Substitution,Michael Osei-Bonsu subbing out for Missouri State,49,45,2nd Half,10:46,False,2623,2025-11-22T23:22:52Z
401823325114802988,114802988,Substitution,Keith Palek III subbing in for Missouri State,49,45,2nd Half,10:46,False,2623,2025-11-22T23:22:52Z
401823325114802989,114802989,Substitution,Jaylen Washington subbing out for UT Rio Grande Valley,49,45,2nd Half,10:46,False,292,2025-11-22T23:22:52Z
401823325114802990,114802990,Substitution,Dane Christensen subbing out for UT Rio Grande Valley,49,45,2nd Half,10:46,False,292,2025-11-22T23:22:52Z
401823325114802991,114802991,Substitution,Julien Gomez subbing out for UT Rio Grande Valley,49,45,2nd Half,10:46,False,292,2025-11-22T23:22:52Z
401823325114802992,114802992,Substitution,Always Wright subbing in for UT Rio Grande Valley,49,45,2nd Half,10:46,False,292,2025-11-22T23:22:52Z
401823325114802993,114802993,Substitution,Koree Cotton subbing in for UT Rio Grande Valley,49,45,2nd Half,10:46,False,292,2025-11-22T23:22:52Z
401823325114802994,114802994,Substitution,Marvin McGhee III subbing in for UT Rio Grande Valley,49,45,2nd Half,10:46,False,292,2025-11-22T23:22:52Z
401823325114803031,114803031,LayUpShot,Koree Cotton made Layup.,51,45,2nd Half,10:41,True,292,2025-11-22T23:23:07Z
401823325114803055,114803055,PersonalFoul,Foul on Marvin McGhee III.,51,45,2nd Half,10:27,False,292,2025-11-22T23:23:27Z
401823325114803111,114803111,JumpShot,Trey Williams Jr. missed Three Point Jumper.,51,45,2nd Half,10:23,False,2623,2025-11-22T23:23:49Z
401823325114803147,114803147,Offensive Rebound,Kobi Williams Offensive Rebound.,51,45,2nd Half,10:19,False,2623,2025-11-22T23:23:52Z
401823325114803148,114803148,JumpShot,Keith Palek III missed Jumper.,51,45,2nd Half,10:14,False,2623,2025-11-22T23:23:59Z
401823325114803149,114803149,Block Shot,Filip Brankovic Block.,51,45,2nd Half,10:14,False,292,2025-11-22T23:23:59Z
401823325114803150,114803150,Offensive Rebound,Missouri State Offensive Rebound.,51,45,2nd Half,10:14,False,2623,2025-11-22T23:24:02Z
401823325114803191,114803191,JumpShot,Zaxton King missed Three Point Jumper.,51,45,2nd Half,10:03,False,2623,2025-11-22T23:24:24Z
401823325114803192,114803192,Defensive Rebound,Koree Cotton Defensive Rebound.,51,45,2nd Half,10:00,False,292,2025-11-22T23:24:26Z
401823325114803196,114803196,JumpShot,Koree Cotton made Three Point Jumper. Assisted by Zae Blake.,54,45,2nd Half,9:48,True,292,2025-11-22T23:24:40Z
401823325114803247,114803247,ShortTimeOut,Missouri State Timeout,54,45,2nd Half,9:38,False,2623,2025-11-22T23:24:57Z
401823325114803298,114803298,Substitution,Darrion Sutton subbing out for Missouri State,54,45,2nd Half,9:38,False,2623,2025-11-22T23:25:45Z
401823325114803299,114803299,Substitution,Cameron Boone subbing in for Missouri State,54,45,2nd Half,9:38,False,2623,2025-11-22T23:25:45Z
401823325114803333,114803333,DunkShot,Cameron Boone made Dunk. Assisted by Kobi Williams.,54,47,2nd Half,9:26,True,2623,2025-11-22T23:26:06Z
401823325114803374,114803374,PersonalFoul,Foul on Kobi Williams.,54,47,2nd Half,9:04,False,2623,2025-11-22T23:26:33Z
401823325114803408,114803408,MadeFreeThrow,Koree Cotton missed Free Throw.,54,47,2nd Half,9:04,False,292,2025-11-22T23:26:51Z
401823325114803409,114803409,Dead Ball Rebound,UT Rio Grande Valley Deadball Team Rebound.,54,47,2nd Half,9:04,False,292,2025-11-22T23:26:51Z
401823325114803424,114803424,MadeFreeThrow,Koree Cotton made Free Throw.,55,47,2nd Half,9:04,True,292,2025-11-22T23:27:07Z
401823325114803462,114803462,LayUpShot,Kobi Williams made Layup. Assisted by Keith Palek III.,55,49,2nd Half,8:53,True,2623,2025-11-22T23:27:24Z
401823325114803499,114803499,JumpShot,Filip Brankovic made Jumper.,57,49,2nd Half,8:27,True,292,2025-11-22T23:27:50Z
401823325114803558,114803558,JumpShot,Keith Palek III made Three Point Jumper. Assisted by Kobi Williams.,57,52,2nd Half,8:06,True,2623,2025-11-22T23:28:11Z
401823325114803623,114803623,JumpShot,Marvin McGhee III made Jumper.,59,52,2nd Half,7:43,True,292,2025-11-22T23:28:34Z
401823325114803635,114803635,JumpShot,Keith Palek III missed Three Point Jumper.,59,52,2nd Half,7:18,False,2623,2025-11-22T23:29:01Z
401823325114803643,114803643,Defensive Rebound,UT Rio Grande Valley Defensive Rebound.,59,52,2nd Half,7:17,False,292,2025-11-22T23:29:04Z
401823325114803645,114803645,OfficialTVTimeOut,Official TV Timeout,59,52,2nd Half,7:17,False,,2025-11-22T23:29:07Z
401823325114803830,114803830,Substitution,Kobi Williams subbing out for Missouri State,59,52,2nd Half,7:17,False,2623,2025-11-22T23:31:12Z
401823325114803831,114803831,Substitution,Darrion Sutton subbing in for Missouri State,59,52,2nd Half,7:17,False,2623,2025-11-22T23:31:12Z
401823325114803832,114803832,Substitution,Marvin McGhee III subbing out for UT Rio Grande Valley,59,52,2nd Half,7:17,False,292,2025-11-22T23:31:12Z
401823325114803833,114803833,Substitution,Julien Gomez subbing in for UT Rio Grande Valley,59,52,2nd Half,7:17,False,292,2025-11-22T23:31:12Z
401823325114803861,114803861,JumpShot,Zae Blake missed Jumper.,59,52,2nd Half,6:58,False,292,2025-11-22T23:31:51Z
401823325114803892,114803892,Offensive Rebound,UT Rio Grande Valley Offensive Rebound.,59,52,2nd Half,6:57,False,292,2025-11-22T23:31:54Z
401823325114803920,114803920,PersonalFoul,Foul on Keith Palek III.,59,52,2nd Half,6:53,False,2623,2025-11-22T23:32:31Z
401823325114803967,114803967,JumpShot,Koree Cotton missed Three Point Jumper.,59,52,2nd Half,6:35,False,292,2025-11-22T23:33:10Z
401823325114803969,114803969,Defensive Rebound,Cameron Boone Defensive Rebound.,59,52,2nd Half,6:32,False,2623,2025-11-22T23:33:12Z
401823325114803988,114803988,JumpShot,Keith Palek III missed Three Point Jumper.,59,52,2nd Half,6:17,False,2623,2025-11-22T23:33:29Z
401823325114803990,114803990,Defensive Rebound,Filip Brankovic Defensive Rebound.,59,52,2nd Half,6:14,False,292,2025-11-22T23:33:31Z
401823325114804030,114804030,PersonalFoul,Foul on Cameron Boone.,59,52,2nd Half,6:02,False,2623,2025-11-22T23:33:46Z
401823325114804057,114804057,MadeFreeThrow,Zae Blake made Free Throw.,60,52,2nd Half,6:02,True,292,2025-11-22T23:34:08Z
401823325114804094,114804094,MadeFreeThrow,Zae Blake made Free Throw.,61,52,2nd Half,6:02,True,292,2025-11-22T23:34:24Z
401823325114804095,114804095,Substitution,Cameron Boone subbing out for Missouri State,61,52,2nd Half,6:02,False,2623,2025-11-22T23:34:29Z
401823325114804096,114804096,Substitution,Michael Osei-Bonsu subbing in for Missouri State,61,52,2nd Half,6:02,False,2623,2025-11-22T23:34:29Z
401823325114804152,114804152,PersonalFoul,Foul on Julien Gomez.,61,52,2nd Half,5:47,False,292,2025-11-22T23:34:56Z
401823325114804160,114804160,Substitution,Darrion Sutton subbing out for Missouri State,61,52,2nd Half,5:47,False,2623,2025-11-22T23:35:06Z
401823325114804161,114804161,Substitution,Kobi Williams subbing in for Missouri State,61,52,2nd Half,5:47,False,2623,2025-11-22T23:35:06Z
401823325114804162,114804162,Substitution,Julien Gomez subbing out for UT Rio Grande Valley,61,52,2nd Half,5:47,False,292,2025-11-22T23:35:06Z
401823325114804163,114804163,Substitution,Marvin McGhee III subbing in for UT Rio Grande Valley,61,52,2nd Half,5:47,False,292,2025-11-22T23:35:06Z
401823325114804176,114804176,JumpShot,Kobi Williams missed Three Point Jumper.,61,52,2nd Half,5:42,False,2623,2025-11-22T23:35:19Z
401823325114804177,114804177,Defensive Rebound,Always Wright Defensive Rebound.,61,52,2nd Half,5:40,False,292,2025-11-22T23:35:20Z
401823325114804226,114804226,JumpShot,Koree Cotton missed Jumper.,61,52,2nd Half,5:20,False,292,2025-11-22T23:35:41Z
401823325114804227,114804227,Offensive Rebound,Koree Cotton Offensive Rebound.,61,52,2nd Half,5:19,False,292,2025-11-22T23:35:42Z
401823325114804250,114804250,PersonalFoul,Foul on Trey Williams Jr..,61,52,2nd Half,5:19,False,2623,2025-11-22T23:35:46Z
401823325114804262,114804262,MadeFreeThrow,Koree Cotton made Free Throw.,62,52,2nd Half,5:19,True,292,2025-11-22T23:36:06Z
401823325114804282,114804282,MadeFreeThrow,Koree Cotton made Free Throw.,63,52,2nd Half,5:19,True,292,2025-11-22T23:36:21Z
401823325114804330,114804330,JumpShot,Kobi Williams missed Three Point Jumper.,63,52,2nd Half,5:19,False,2623,2025-11-22T23:36:34Z
401823325114804331,114804331,Defensive Rebound,Koree Cotton Defensive Rebound.,63,52,2nd Half,5:19,False,292,2025-11-22T23:36:38Z
401823325114804333,114804333,LayUpShot,Marvin McGhee III made Layup. Assisted by Koree Cotton.,65,52,2nd Half,5:19,True,292,2025-11-22T23:36:41Z
401823325114804397,114804397,PersonalFoul,Foul on Always Wright.,65,52,2nd Half,5:17,False,292,2025-11-22T23:37:05Z
401823325114804411,114804411,JumpShot,Zaxton King missed Three Point Jumper.,65,52,2nd Half,4:43,False,2623,2025-11-22T23:37:17Z
401823325114804412,114804412,Offensive Rebound,Keith Palek III Offensive Rebound.,65,52,2nd Half,4:40,False,2623,2025-11-22T23:37:19Z
401823325114804421,114804421,PersonalFoul,Foul on Koree Cotton.,65,52,2nd Half,4:38,False,292,2025-11-22T23:37:25Z
401823325114804432,114804432,MadeFreeThrow,Keith Palek III made Free Throw.,65,53,2nd Half,4:38,True,2623,2025-11-22T23:37:40Z
401823325114804457,114804457,Substitution,Michael Osei-Bonsu subbing out for Missouri State,65,53,2nd Half,4:38,False,2623,2025-11-22T23:37:56Z
401823325114804458,114804458,Substitution,Darrion Sutton subbing in for Missouri State,65,53,2nd Half,4:38,False,2623,2025-11-22T23:37:56Z
401823325114804459,114804459,MadeFreeThrow,Keith Palek III made Free Throw.,65,54,2nd Half,4:38,True,2623,2025-11-22T23:38:02Z
401823325114804480,114804480,JumpShot,Zae Blake missed Three Point Jumper.,65,54,2nd Half,4:26,False,292,2025-11-22T23:38:21Z
401823325114804516,114804516,Defensive Rebound,Keith Palek III Defensive Rebound.,65,54,2nd Half,4:22,False,2623,2025-11-22T23:38:23Z
401823325114804535,114804535,PersonalFoul,Foul on Always Wright.,65,54,2nd Half,4:18,False,292,2025-11-22T23:38:32Z
401823325114804568,114804568,MadeFreeThrow,Keith Palek III made Free Throw.,65,55,2nd Half,4:18,True,2623,2025-11-22T23:38:53Z
401823325114804569,114804569,Substitution,Trey Williams Jr. subbing out for Missouri State,65,55,2nd Half,4:18,False,2623,2025-11-22T23:38:59Z
401823325114804570,114804570,Substitution,Logan Epes subbing in for Missouri State,65,55,2nd Half,4:18,False,2623,2025-11-22T23:38:59Z
401823325114804591,114804591,Substitution,Always Wright subbing out for UT Rio Grande Valley,65,55,2nd Half,4:18,False,292,2025-11-22T23:39:07Z
401823325114804592,114804592,Substitution,Jaylen Washington subbing in for UT Rio Grande Valley,65,55,2nd Half,4:18,False,292,2025-11-22T23:39:07Z
401823325114804593,114804593,MadeFreeThrow,Keith Palek III made Free Throw.,65,56,2nd Half,4:18,True,2623,2025-11-22T23:39:10Z
401823325114804637,114804637,JumpShot,Zae Blake missed Three Point Jumper.,65,56,2nd Half,3:50,False,292,2025-11-22T23:39:47Z
401823325114804638,114804638,Offensive Rebound,Jaylen Washington Offensive Rebound.,65,56,2nd Half,3:47,False,292,2025-11-22T23:39:49Z
401823325114804639,114804639,Lost Ball Turnover,Jaylen Washington Turnover.,65,56,2nd Half,3:47,False,292,2025-11-22T23:39:52Z
401823325114804646,114804646,OfficialTVTimeOut,Official TV Timeout,65,56,2nd Half,3:47,False,,2025-11-22T23:39:56Z
401823325114804672,114804672,Substitution,Logan Epes subbing out for Missouri State,65,56,2nd Half,3:47,False,2623,2025-11-22T23:40:15Z
401823325114804673,114804673,Substitution,Darrion Sutton subbing out for Missouri State,65,56,2nd Half,3:47,False,2623,2025-11-22T23:40:15Z
401823325114804674,114804674,Substitution,Trey Williams Jr. subbing in for Missouri State,65,56,2nd Half,3:47,False,2623,2025-11-22T23:40:15Z
401823325114804675,114804675,Substitution,Michael Osei-Bonsu subbing in for Missouri State,65,56,2nd Half,3:47,False,2623,2025-11-22T23:40:15Z
401823325114804847,114804847,Substitution,Marvin McGhee III subbing out for UT Rio Grande Valley,65,56,2nd Half,3:47,False,292,2025-11-22T23:42:31Z
401823325114804848,114804848,Substitution,Kye Dickson subbing in for UT Rio Grande Valley,65,56,2nd Half,3:47,False,292,2025-11-22T23:42:31Z
401823325114804862,114804862,JumpShot,Kobi Williams missed Three Point Jumper.,65,56,2nd Half,3:36,False,2623,2025-11-22T23:42:51Z
