play_id,sequence_number,type,description,away_score,home_score,period,clock,scoring_play,team_id,timestamp_utc
401827189114481465,114481465,JumpShot,Love Bettis missed Three Point Jumper.,17,33,1st Half,1:13,False,2916,2025-11-16T23:17:18Z
401827189114481495,114481495,Defensive Rebound,Indiana Defensive Rebound.,17,33,1st Half,1:10,False,84,2025-11-16T23:17:22Z
401827189114481559,114481559,Substitution,Trent Sisley subbing out for Indiana,17,33,1st Half,1:10,False,84,2025-11-16T23:17:34Z
401827189114481560,114481560,Substitution,Lamar Wilkerson subbing in for Indiana,17,33,1st Half,1:10,False,84,2025-11-16T23:17:34Z
401827189114481625,114481625,PersonalFoul,Foul on Mihael Tomic.,17,33,1st Half,0:48,False,2916,2025-11-16T23:18:15Z
401827189114481668,114481668,MadeFreeThrow,Sam Alexis made Free Throw.,17,34,1st Half,0:48,True,84,2025-11-16T23:18:36Z
401827189114481671,114481671,Substitution,Lamar Wilkerson subbing out for Indiana,17,34,1st Half,0:48,False,84,2025-11-16T23:18:42Z
401827189114481672,114481672,Substitution,Tucker DeVries subbing out for Indiana,17,34,1st Half,0:48,False,84,2025-11-16T23:18:42Z
401827189114481673,114481673,Substitution,Jasai Miles subbing in for Indiana,17,34,1st Half,0:48,False,84,2025-11-16T23:18:42Z
401827189114481674,114481674,Substitution,Nick Dorn subbing in for Indiana,17,34,1st Half,0:48,False,84,2025-11-16T23:18:42Z
401827189114481681,114481681,MadeFreeThrow,Sam Alexis made Free Throw.,17,35,1st Half,0:48,True,84,2025-11-16T23:18:57Z
401827189114481706,114481706,Substitution,Love Bettis subbing out for Incarnate Word,17,35,1st Half,0:48,False,2916,2025-11-16T23:19:02Z
401827189114481707,114481707,Substitution,Jordan Pyke subbing in for Incarnate Word,17,35,1st Half,0:48,False,2916,2025-11-16T23:19:02Z
401827189114481775,114481775,PersonalFoul,Foul on Conor Enright.,17,35,1st Half,0:28,False,84,2025-11-16T23:19:37Z
401827189114481811,114481811,MadeFreeThrow,Jordan Pyke made Free Throw.,18,35,1st Half,0:28,True,2916,2025-11-16T23:19:59Z
401827189114481818,114481818,Substitution,Jasai Miles subbing out for Indiana,18,35,1st Half,0:28,False,84,2025-11-16T23:20:08Z
401827189114481819,114481819,Substitution,Conor Enright subbing out for Indiana,18,35,1st Half,0:28,False,84,2025-11-16T23:20:08Z
401827189114481820,114481820,Substitution,Lamar Wilkerson subbing in for Indiana,18,35,1st Half,0:28,False,84,2025-11-16T23:20:08Z
401827189114481821,114481821,Substitution,Tucker DeVries subbing in for Indiana,18,35,1st Half,0:28,False,84,2025-11-16T23:20:08Z
401827189114481855,114481855,MadeFreeThrow,Jordan Pyke made Free Throw.,19,35,1st Half,0:28,True,2916,2025-11-16T23:20:22Z
401827189114481856,114481856,Substitution,Jordan Pyke subbing out for Incarnate Word,19,35,1st Half,0:28,False,2916,2025-11-16T23:20:27Z
401827189114481857,114481857,Substitution,Esteban Mann subbing in for Incarnate Word,19,35,1st Half,0:28,False,2916,2025-11-16T23:20:27Z
401827189114481901,114481901,JumpShot,Nick Dorn missed Three Point Jumper.,19,35,1st Half,0:01,False,84,2025-11-16T23:21:03Z
401827189114481902,114481902,Defensive Rebound,Davion Bailey Defensive Rebound.,19,35,1st Half,0:00,False,2916,2025-11-16T23:21:05Z
401827189114481903,114481903,End Period,End of 1st half,19,35,1st Half,0:00,False,,2025-11-16T23:21:06Z
401827189114483174,114483174,Substitution,Sam Alexis subbing out for Indiana,19,35,2nd Half,20:00,False,84,2025-11-16T23:36:54Z
401827189114483175,114483175,Substitution,Nick Dorn subbing out for Indiana,19,35,2nd Half,20:00,False,84,2025-11-16T23:36:54Z
401827189114483176,114483176,Substitution,Reed Bailey subbing in for Indiana,19,35,2nd Half,20:00,False,84,2025-11-16T23:36:54Z
401827189114483177,114483177,Substitution,Conor Enright subbing in for Indiana,19,35,2nd Half,20:00,False,84,2025-11-16T23:36:54Z
401827189114483178,114483178,Substitution,Esteban Mann subbing out for Incarnate Word,19,35,2nd Half,20:00,False,2916,2025-11-16T23:36:54Z
401827189114483179,114483179,Substitution,Mihael Tomic subbing out for Incarnate Word,19,35,2nd Half,20:00,False,2916,2025-11-16T23:36:54Z
401827189114483180,114483180,Substitution,Jordan Pyke subbing in for Incarnate Word,19,35,2nd Half,20:00,False,2916,2025-11-16T23:36:54Z
401827189114483181,114483181,Substitution,Marcus Glover subbing in for Incarnate Word,19,35,2nd Half,20:00,False,2916,2025-11-16T23:36:54Z
401827189114483266,114483266,JumpShot,Jordan Pyke made Jumper.,21,35,2nd Half,19:43,True,2916,2025-11-16T23:38:05Z
401827189114483313,114483313,LayUpShot,Conor Enright made Layup. Assisted by Reed Bailey.,21,37,2nd Half,19:22,True,84,2025-11-16T23:38:26Z
401827189114483345,114483345,Lost Ball Turnover,Jordan Pyke Turnover.,21,37,2nd Half,18:59,False,2916,2025-11-16T23:38:49Z
401827189114483377,114483377,Steal,Lamar Wilkerson Steal.,21,37,2nd Half,18:59,False,84,2025-11-16T23:38:49Z
401827189114483415,114483415,Lost Ball Turnover,Tayton Conerway Turnover.,21,37,2nd Half,18:48,False,84,2025-11-16T23:39:19Z
401827189114483416,114483416,Steal,Harold Woods Steal.,21,37,2nd Half,18:48,False,2916,2025-11-16T23:39:19Z
401827189114483429,114483429,LayUpShot,Davion Bailey missed Layup.,21,37,2nd Half,18:42,False,2916,2025-11-16T23:39:25Z
401827189114483430,114483430,Block Shot,Tayton Conerway Block.,21,37,2nd Half,18:42,False,84,2025-11-16T23:39:25Z
401827189114483431,114483431,Defensive Rebound,Tayton Conerway Defensive Rebound.,21,37,2nd Half,18:38,False,84,2025-11-16T23:39:29Z
401827189114483442,114483442,DunkShot,Reed Bailey made Dunk. Assisted by Tucker DeVries.,21,39,2nd Half,18:35,True,84,2025-11-16T23:39:31Z
401827189114483487,114483487,JumpShot,Davion Bailey made Three Point Jumper. Assisted by Tahj Staveskie.,24,39,2nd Half,18:16,True,2916,2025-11-16T23:39:52Z
401827189114483523,114483523,Lost Ball Turnover,Indiana  Turnover.,24,39,2nd Half,17:41,False,84,2025-11-16T23:40:28Z
401827189114483580,114483580,JumpShot,Jordan Pyke missed Three Point Jumper.,24,39,2nd Half,17:20,False,2916,2025-11-16T23:40:58Z
401827189114483608,114483608,Defensive Rebound,Lamar Wilkerson Defensive Rebound.,24,39,2nd Half,17:16,False,84,2025-11-16T23:41:01Z
401827189114483609,114483609,LayUpShot,Reed Bailey made Layup. Assisted by Tucker DeVries.,24,41,2nd Half,17:11,True,84,2025-11-16T23:41:07Z
401827189114483631,114483631,JumpShot,Davion Bailey missed Three Point Jumper.,24,41,2nd Half,16:47,False,2916,2025-11-16T23:41:31Z
401827189114483632,114483632,Offensive Rebound,Incarnate Word Offensive Rebound.,24,41,2nd Half,16:45,False,2916,2025-11-16T23:41:34Z
401827189114483638,114483638,Substitution,Reed Bailey subbing out for Indiana,24,41,2nd Half,16:45,False,84,2025-11-16T23:41:44Z
401827189114483639,114483639,Substitution,Tayton Conerway subbing out for Indiana,24,41,2nd Half,16:45,False,84,2025-11-16T23:41:44Z
401827189114483640,114483640,Substitution,Sam Alexis subbing in for Indiana,24,41,2nd Half,16:45,False,84,2025-11-16T23:41:44Z
401827189114483641,114483641,Substitution,Trent Sisley subbing in for Indiana,24,41,2nd Half,16:45,False,84,2025-11-16T23:41:44Z
401827189114483642,114483642,Substitution,Marcus Glover subbing out for Incarnate Word,24,41,2nd Half,16:45,False,2916,2025-11-16T23:41:44Z
401827189114483643,114483643,Substitution,Mihael Tomic subbing in for Incarnate Word,24,41,2nd Half,16:45,False,2916,2025-11-16T23:41:44Z
401827189114483675,114483675,JumpShot,Davion Bailey made Jumper. Assisted by Tahj Staveskie.,26,41,2nd Half,16:38,True,2916,2025-11-16T23:42:05Z
401827189114483717,114483717,LayUpShot,Sam Alexis missed Layup.,26,41,2nd Half,16:17,False,84,2025-11-16T23:42:26Z
401827189114483718,114483718,Defensive Rebound,Jordan Pyke Defensive Rebound.,26,41,2nd Half,16:15,False,2916,2025-11-16T23:42:28Z
401827189114483732,114483732,LayUpShot,Harold Woods made Layup.,28,41,2nd Half,15:58,True,2916,2025-11-16T23:42:45Z
401827189114483768,114483768,JumpShot,Conor Enright missed Three Point Jumper.,28,41,2nd Half,15:38,False,84,2025-11-16T23:43:06Z
401827189114483769,114483769,Defensive Rebound,Jordan Pyke Defensive Rebound.,28,41,2nd Half,15:33,False,2916,2025-11-16T23:43:09Z
401827189114483807,114483807,PersonalFoul,Foul on Conor Enright.,28,41,2nd Half,15:29,False,84,2025-11-16T23:43:30Z
401827189114483809,114483809,OfficialTVTimeOut,Official TV Timeout,28,41,2nd Half,15:29,False,,2025-11-16T23:43:34Z
401827189114483904,114483904,Substitution,Conor Enright subbing out for Indiana,28,41,2nd Half,15:29,False,84,2025-11-16T23:45:56Z
401827189114483946,114483946,Substitution,Tayton Conerway subbing in for Indiana,28,41,2nd Half,15:29,False,84,2025-11-16T23:45:56Z
401827189114483949,114483949,Substitution,Jordan Pyke subbing out for Incarnate Word,28,41,2nd Half,15:29,False,2916,2025-11-16T23:45:56Z
401827189114483951,114483951,Substitution,Esteban Mann subbing in for Incarnate Word,28,41,2nd Half,15:29,False,2916,2025-11-16T23:45:56Z
401827189114483963,114483963,PersonalFoul,Foul on Lamar Wilkerson.,28,41,2nd Half,15:21,False,84,2025-11-16T23:46:21Z
401827189114483994,114483994,JumpShot,Davion Bailey missed Jumper.,28,41,2nd Half,15:14,False,2916,2025-11-16T23:46:42Z
401827189114483995,114483995,Offensive Rebound,Mihael Tomic Offensive Rebound.,28,41,2nd Half,15:08,False,2916,2025-11-16T23:46:48Z
401827189114483998,114483998,JumpShot,Tahj Staveskie missed Three Point Jumper.,28,41,2nd Half,14:59,False,2916,2025-11-16T23:46:57Z
401827189114483999,114483999,Defensive Rebound,Sam Alexis Defensive Rebound.,28,41,2nd Half,14:56,False,84,2025-11-16T23:46:59Z
401827189114484032,114484032,JumpShot,Trent Sisley made Three Point Jumper. Assisted by Tayton Conerway.,28,44,2nd Half,14:33,True,84,2025-11-16T23:47:24Z
401827189114484074,114484074,JumpShot,Tahj Staveskie missed Jumper.,28,44,2nd Half,14:00,False,2916,2025-11-16T23:47:57Z
401827189114484075,114484075,Dead Ball Rebound,Incarnate Word Deadball Team Rebound.,28,44,2nd Half,14:00,False,2916,2025-11-16T23:48:01Z
401827189114484364,114484364,Block Shot,Sam Alexis Block.,28,44,2nd Half,14:00,False,84,2025-11-16T23:47:57Z
401827189114484076,114484076,Lost Ball Turnover,Incarnate Word  Turnover.,28,44,2nd Half,13:59,False,2916,2025-11-16T23:48:01Z
401827189114484082,114484082,Substitution,Esteban Mann subbing out for Incarnate Word,28,44,2nd Half,13:59,False,2916,2025-11-16T23:48:08Z
401827189114484083,114484083,Substitution,Jordan Pyke subbing in for Incarnate Word,28,44,2nd Half,13:59,False,2916,2025-11-16T23:48:08Z
401827189114484094,114484094,PersonalFoul,Foul on Davion Bailey.,28,44,2nd Half,13:50,False,2916,2025-11-16T23:48:29Z
401827189114484142,114484142,MadeFreeThrow,Tayton Conerway made Free Throw.,28,45,2nd Half,13:50,True,84,2025-11-16T23:48:56Z
401827189114484145,114484145,Substitution,Lamar Wilkerson subbing out for Indiana,28,45,2nd Half,13:50,False,84,2025-11-16T23:49:03Z
401827189114484146,114484146,Substitution,Jasai Miles subbing in for Indiana,28,45,2nd Half,13:50,False,84,2025-11-16T23:49:03Z
401827189114484150,114484150,MadeFreeThrow,Tayton Conerway made Free Throw.,28,46,2nd Half,13:50,True,84,2025-11-16T23:49:14Z
401827189114484188,114484188,JumpShot,Davion Bailey missed Jumper.,28,46,2nd Half,13:32,False,2916,2025-11-16T23:49:37Z
401827189114484189,114484189,Defensive Rebound,Tucker DeVries Defensive Rebound.,28,46,2nd Half,13:31,False,84,2025-11-16T23:49:40Z
401827189114484195,114484195,PersonalFoul,Foul on Mihael Tomic.,28,46,2nd Half,13:31,False,2916,2025-11-16T23:49:42Z
401827189114484197,114484197,Substitution,Mihael Tomic subbing out for Incarnate Word,28,46,2nd Half,13:31,False,2916,2025-11-16T23:49:49Z
401827189114484198,114484198,Substitution,Marcus Glover subbing in for Incarnate Word,28,46,2nd Half,13:31,False,2916,2025-11-16T23:49:49Z
401827189114484230,114484230,JumpShot,Tayton Conerway missed Three Point Jumper.,28,46,2nd Half,13:12,False,84,2025-11-16T23:50:13Z
401827189114484231,114484231,Defensive Rebound,Tahj Staveskie Defensive Rebound.,28,46,2nd Half,13:08,False,2916,2025-11-16T23:50:15Z
401827189114484241,114484241,PersonalFoul,Foul on Jasai Miles.,28,46,2nd Half,13:01,False,84,2025-11-16T23:50:25Z
401827189114484268,114484268,MadeFreeThrow,Marcus Glover made Free Throw.,29,46,2nd Half,13:01,True,2916,2025-11-16T23:50:56Z
401827189114484269,114484269,Substitution,Tahj Staveskie subbing out for Incarnate Word,29,46,2nd Half,13:01,False,2916,2025-11-16T23:51:00Z
401827189114484270,114484270,Substitution,Love Bettis subbing in for Incarnate Word,29,46,2nd Half,13:01,False,2916,2025-11-16T23:51:00Z
401827189114484280,114484280,MadeFreeThrow,Marcus Glover missed Free Throw.,29,46,2nd Half,13:01,False,2916,2025-11-16T23:51:16Z
401827189114484281,114484281,Defensive Rebound,Sam Alexis Defensive Rebound.,29,46,2nd Half,12:59,False,84,2025-11-16T23:51:19Z
401827189114484308,114484308,PersonalFoul,Foul on Marcus Glover.,29,46,2nd Half,12:47,False,2916,2025-11-16T23:51:37Z
401827189114484324,114484324,MadeFreeThrow,Tucker DeVries made Free Throw.,29,47,2nd Half,12:47,True,84,2025-11-16T23:52:09Z
401827189114484353,114484353,Substitution,Davion Bailey subbing out for Incarnate Word,29,47,2nd Half,12:47,False,2916,2025-11-16T23:52:30Z
401827189114484354,114484354,Substitution,Marcus Glover subbing out for Incarnate Word,29,47,2nd Half,12:47,False,2916,2025-11-16T23:52:30Z
401827189114484355,114484355,Substitution,Harrison Reede subbing in for Incarnate Word,29,47,2nd Half,12:47,False,2916,2025-11-16T23:52:30Z
401827189114484356,114484356,Substitution,Mihael Tomic subbing in for Incarnate Word,29,47,2nd Half,12:47,False,2916,2025-11-16T23:52:30Z
401827189114484359,114484359,MadeFreeThrow,Tucker DeVries made Free Throw.,29,48,2nd Half,12:47,True,84,2025-11-16T23:52:35Z
401827189114484360,114484360,Substitution,Tucker DeVries subbing out for Indiana,29,48,2nd Half,12:47,False,84,2025-11-16T23:52:40Z
401827189114484361,114484361,Substitution,Conor Enright subbing in for Indiana,29,48,2nd Half,12:47,False,84,2025-11-16T23:52:40Z
401827189114484370,114484370,JumpShot,Jordan Pyke made Jumper.,31,48,2nd Half,12:26,True,2916,2025-11-16T23:53:08Z
401827189114484384,114484384,PersonalFoul,Foul on Jordan Pyke.,31,48,2nd Half,12:07,False,2916,2025-11-16T23:53:31Z
401827189114484409,114484409,Substitution,Tayton Conerway subbing out for Indiana,31,48,2nd Half,12:07,False,84,2025-11-16T23:53:50Z
401827189114484410,114484410,Substitution,Lamar Wilkerson subbing in for Indiana,31,48,2nd Half,12:07,False,84,2025-11-16T23:53:50Z
401827189114484411,114484411,Substitution,Jordan Pyke subbing out for Incarnate Word,31,48,2nd Half,12:07,False,2916,2025-11-16T23:53:50Z
401827189114484412,114484412,Substitution,Esteban Mann subbing in for Incarnate Word,31,48,2nd Half,12:07,False,2916,2025-11-16T23:53:50Z
401827189114484446,114484446,OfficialTVTimeOut,Official TV Timeout,31,48,2nd Half,12:00,False,,2025-11-16T23:54:12Z
401827189114484569,114484569,Lost Ball Turnover,Sam Alexis Turnover.,31,48,2nd Half,11:51,False,84,2025-11-16T23:57:38Z
401827189114484574,114484574,Substitution,Esteban Mann subbing out for Incarnate Word,31,48,2nd Half,11:51,False,2916,2025-11-16T23:58:00Z
401827189114484575,114484575,Substitution,Harold Woods subbing out for Incarnate Word,31,48,2nd Half,11:51,False,2916,2025-11-16T23:58:00Z
401827189114484576,114484576,Substitution,Tahj Staveskie subbing in for Incarnate Word,31,48,2nd Half,11:51,False,2916,2025-11-16T23:58:00Z
401827189114484577,114484577,Substitution,Jordan Pyke subbing in for Incarnate Word,31,48,2nd Half,11:51,False,2916,2025-11-16T23:58:00Z
401827189114484579,114484579,LayUpShot,Tahj Staveskie made Layup.,33,48,2nd Half,11:27,True,2916,2025-11-16T23:58:22Z
401827189114484609,114484609,PersonalFoul,Foul on Love Bettis.,33,48,2nd Half,11:10,False,2916,2025-11-16T23:58:48Z
401827189114484630,114484630,Substitution,Jasai Miles subbing out for Indiana,33,48,2nd Half,11:10,False,84,2025-11-16T23:58:55Z
401827189114484632,114484632,Substitution,Tucker DeVries subbing in for Indiana,33,48,2nd Half,11:10,False,84,2025-11-16T23:58:55Z
401827189114484640,114484640,JumpShot,Lamar Wilkerson missed Three Point Jumper.,33,48,2nd Half,11:00,False,84,2025-11-16T23:59:19Z
401827189114484641,114484641,Defensive Rebound,Love Bettis Defensive Rebound.,33,48,2nd Half,10:58,False,2916,2025-11-16T23:59:21Z
401827189114484642,114484642,JumpShot,Jordan Pyke missed Jumper.,33,48,2nd Half,10:50,False,2916,2025-11-16T23:59:29Z
401827189114484643,114484643,Defensive Rebound,Conor Enright Defensive Rebound.,33,48,2nd Half,10:47,False,84,2025-11-16T23:59:32Z
401827189114484652,114484652,Lost Ball Turnover,Lamar Wilkerson Turnover.,33,48,2nd Half,10:43,False,84,2025-11-16T23:59:39Z
401827189114484666,114484666,JumpShot,Jordan Pyke missed Jumper.,33,48,2nd Half,10:24,False,2916,2025-11-17T00:00:08Z
401827189114484667,114484667,Defensive Rebound,Tucker DeVries Defensive Rebound.,33,48,2nd Half,10:21,False,84,2025-11-17T00:00:10Z
401827189114484678,114484678,JumpShot,Tucker DeVries missed Three Point Jumper.,33,48,2nd Half,10:11,False,84,2025-11-17T00:00:22Z
401827189114484679,114484679,Offensive Rebound,Conor Enright Offensive Rebound.,33,48,2nd Half,10:08,False,84,2025-11-17T00:00:24Z
401827189114484680,114484680,LayUpShot,Conor Enright made Layup.,33,50,2nd Half,10:07,True,84,2025-11-17T00:00:26Z
401827189114484692,114484692,JumpShot,Love Bettis missed Jumper.,33,50,2nd Half,9:38,False,2916,2025-11-17T00:00:55Z
401827189114484693,114484693,Defensive Rebound,Sam Alexis Defensive Rebound.,33,50,2nd Half,9:34,False,84,2025-11-17T00:00:57Z
401827189114484694,114484694,JumpShot,Tucker DeVries missed Three Point Jumper.,33,50,2nd Half,9:31,False,84,2025-11-17T00:01:02Z
401827189114484695,114484695,Offensive Rebound,Sam Alexis Offensive Rebound.,33,50,2nd Half,9:27,False,84,2025-11-17T00:01:05Z
401827189114484696,114484696,Lost Ball Turnover,Sam Alexis Turnover.,33,50,2nd Half,9:26,False,84,2025-11-17T00:01:06Z
401827189114484697,114484697,Steal,Tahj Staveskie Steal.,33,50,2nd Half,9:26,False,2916,2025-11-17T00:01:06Z
401827189114484698,114484698,Lost Ball Turnover,Tahj Staveskie Turnover.,33,50,2nd Half,9:23,False,2916,2025-11-17T00:01:09Z
401827189114484699,114484699,Steal,Tucker DeVries Steal.,33,50,2nd Half,9:23,False,84,2025-11-17T00:01:09Z
401827189114484701,114484701,JumpShot,Trent Sisley missed Three Point Jumper.,33,50,2nd Half,9:20,False,84,2025-11-17T00:01:13Z
401827189114484702,114484702,Defensive Rebound,Harrison Reede Defensive Rebound.,33,50,2nd Half,9:17,False,2916,2025-11-17T00:01:15Z
401827189114484705,114484705,JumpShot,Harrison Reede made Three Point Jumper. Assisted by Jordan Pyke.,36,50,2nd Half,9:07,True,2916,2025-11-17T00:01:25Z
401827189114484707,114484707,ShortTimeOut,Incarnate Word Timeout,36,50,2nd Half,9:04,False,2916,2025-11-17T00:01:32Z
401827189114484708,114484708,OfficialTVTimeOut,Official TV Timeout,36,50,2nd Half,9:04,False,,2025-11-17T00:01:35Z
401827189114484793,114484793,Substitution,Sam Alexis subbing out for Indiana,36,50,2nd Half,9:04,False,84,2025-11-17T00:04:12Z
401827189114484794,114484794,Substitution,Reed Bailey subbing in for Indiana,36,50,2nd Half,9:04,False,84,2025-11-17T00:04:12Z
401827189114484797,114484797,Substitution,Love Bettis subbing out for Incarnate Word,36,50,2nd Half,9:04,False,2916,2025-11-17T00:04:12Z
401827189114484798,114484798,Substitution,Jordan Pyke subbing out for Incarnate Word,36,50,2nd Half,9:04,False,2916,2025-11-17T00:04:12Z
401827189114484799,114484799,Substitution,Mihael Tomic subbing out for Incarnate Word,36,50,2nd Half,9:04,False,2916,2025-11-17T00:04:12Z
401827189114484800,114484800,Substitution,Davion Bailey subbing in for Incarnate Word,36,50,2nd Half,9:04,False,2916,2025-11-17T00:04:12Z
401827189114484801,114484801,Substitution,Marcus Glover subbing in for Incarnate Word,36,50,2nd Half,9:04,False,2916,2025-11-17T00:04:12Z
401827189114484802,114484802,Substitution,Harold Woods subbing in for Incarnate Word,36,50,2nd Half,9:04,False,2916,2025-11-17T00:04:12Z
401827189114484807,114484807,LayUpShot,Lamar Wilkerson made Layup. Assisted by Reed Bailey.,36,52,2nd Half,8:48,True,84,2025-11-17T00:04:37Z
401827189114484810,114484810,JumpShot,Harrison Reede made Three Point Jumper. Assisted by Davion Bailey.,39,52,2nd Half,8:35,True,2916,2025-11-17T00:04:52Z
401827189114484814,114484814,PersonalFoul,Foul on Trent Sisley.,39,52,2nd Half,8:35,False,84,2025-11-17T00:04:58Z
401827189114484816,114484816,Substitution,Trent Sisley subbing out for Indiana,39,52,2nd Half,8:35,False,84,2025-11-17T00:05:11Z
401827189114484817,114484817,Substitution,Tayton Conerway subbing in for Indiana,39,52,2nd Half,8:35,False,84,2025-11-17T00:05:11Z
401827189114484819,114484819,MadeFreeThrow,Harrison Reede made Free Throw.,40,52,2nd Half,8:35,True,2916,2025-11-17T00:05:20Z
401827189114484824,114484824,LayUpShot,Conor Enright missed Layup.,40,52,2nd Half,8:18,False,84,2025-11-17T00:05:40Z
401827189114484847,114484847,Block Shot,Harold Woods Block.,40,52,2nd Half,8:18,False,2916,2025-11-17T00:05:40Z
401827189114484848,114484848,Offensive Rebound,Conor Enright Offensive Rebound.,40,52,2nd Half,8:14,False,84,2025-11-17T00:05:43Z
401827189114484849,114484849,PersonalFoul,Foul on Tahj Staveskie.,40,52,2nd Half,8:14,False,2916,2025-11-17T00:05:47Z
401827189114484859,114484859,MadeFreeThrow,Reed Bailey missed Free Throw.,40,52,2nd Half,8:14,False,84,2025-11-17T00:06:07Z
401827189114484860,114484860,Dead Ball Rebound,Indiana Deadball Team Rebound.,40,52,2nd Half,8:14,False,84,2025-11-17T00:06:07Z
401827189114484865,114484865,MadeFreeThrow,Reed Bailey made Free Throw.,40,53,2nd Half,8:14,True,84,2025-11-17T00:06:19Z
401827189114484890,114484890,JumpShot,Harold Woods missed Three Point Jumper.,40,53,2nd Half,7:57,False,2916,2025-11-17T00:06:38Z
401827189114484891,114484891,Defensive Rebound,Tayton Conerway Defensive Rebound.,40,53,2nd Half,7:54,False,84,2025-11-17T00:06:40Z
401827189114484895,114484895,JumpShot,Lamar Wilkerson missed Three Point Jumper.,40,53,2nd Half,7:51,False,84,2025-11-17T00:06:45Z
401827189114484896,114484896,Offensive Rebound,Conor Enright Offensive Rebound.,40,53,2nd Half,7:48,False,84,2025-11-17T00:06:46Z
401827189114484899,114484899,JumpShot,Tucker DeVries missed Jumper.,40,53,2nd Half,7:29,False,84,2025-11-17T00:07:06Z
401827189114484900,114484900,Defensive Rebound,Harold Woods Defensive Rebound.,40,53,2nd Half,7:25,False,2916,2025-11-17T00:07:09Z
401827189114484920,114484920,LayUpShot,Harold Woods made Layup. Assisted by Davion Bailey.,42,53,2nd Half,7:16,True,2916,2025-11-17T00:07:19Z
401827189114484930,114484930,JumpShot,Tucker DeVries missed Three Point Jumper.,42,53,2nd Half,7:02,False,84,2025-11-17T00:07:35Z
401827189114484931,114484931,Defensive Rebound,Tahj Staveskie Defensive Rebound.,42,53,2nd Half,6:58,False,2916,2025-11-17T00:07:37Z
401827189114484938,114484938,PersonalFoul,Foul on Conor Enright.,42,53,2nd Half,6:53,False,84,2025-11-17T00:07:47Z
401827189114484945,114484945,OfficialTVTimeOut,Official TV Timeout,42,53,2nd Half,6:53,False,,2025-11-17T00:07:53Z
401827189114485028,114485028,Substitution,Reed Bailey subbing out for Indiana,42,53,2nd Half,6:53,False,84,2025-11-17T00:10:33Z
401827189114485029,114485029,Substitution,Sam Alexis subbing in for Indiana,42,53,2nd Half,6:53,False,84,2025-11-17T00:10:33Z
401827189114485030,114485030,Substitution,Harold Woods subbing out for Incarnate Word,42,53,2nd Half,6:53,False,2916,2025-11-17T00:10:33Z
401827189114485031,114485031,Substitution,Jordan Pyke subbing in for Incarnate Word,42,53,2nd Half,6:53,False,2916,2025-11-17T00:10:33Z
401827189114485035,114485035,JumpShot,Tahj Staveskie made Three Point Jumper. Assisted by Marcus Glover.,45,53,2nd Half,6:50,True,2916,2025-11-17T00:10:45Z
401827189114485047,114485047,PersonalFoul,Foul on Davion Bailey.,45,53,2nd Half,6:23,False,2916,2025-11-17T00:11:15Z
401827189114485057,114485057,MadeFreeThrow,Lamar Wilkerson made Free Throw.,45,54,2nd Half,6:23,True,84,2025-11-17T00:11:39Z
401827189114485064,114485064,MadeFreeThrow,Lamar Wilkerson missed Free Throw.,45,54,2nd Half,6:23,False,84,2025-11-17T00:11:53Z
401827189114485086,114485086,Defensive Rebound,Marcus Glover Defensive Rebound.,45,54,2nd Half,6:21,False,2916,2025-11-17T00:11:54Z
401827189114485092,114485092,Lost Ball Turnover,Davion Bailey Turnover.,45,54,2nd Half,6:10,False,2916,2025-11-17T00:12:08Z
401827189114485093,114485093,Steal,Lamar Wilkerson Steal.,45,54,2nd Half,6:10,False,84,2025-11-17T00:12:08Z
401827189114485097,114485097,Lost Ball Turnover,Lamar Wilkerson Turnover.,45,54,2nd Half,6:01,False,84,2025-11-17T00:12:20Z
401827189114485114,114485114,Steal,Marcus Glover Steal.,45,54,2nd Half,6:01,False,2916,2025-11-17T00:12:20Z
401827189114485108,114485108,JumpShot,Davion Bailey made Three Point Jumper. Assisted by Tahj Staveskie.,48,54,2nd Half,5:43,True,2916,2025-11-17T00:12:50Z
401827189114485120,114485120,JumpShot,Tucker DeVries missed Three Point Jumper.,48,54,2nd Half,5:18,False,84,2025-11-17T00:13:15Z
401827189114485122,114485122,Offensive Rebound,Tayton Conerway Offensive Rebound.,48,54,2nd Half,5:16,False,84,2025-11-17T00:13:18Z
401827189114485128,114485128,PersonalFoul,Foul on Tahj Staveskie.,48,54,2nd Half,5:16,False,2916,2025-11-17T00:13:20Z
401827189114485139,114485139,MadeFreeThrow,Tayton Conerway missed Free Throw.,48,54,2nd Half,5:16,False,84,2025-11-17T00:13:49Z
401827189114485141,114485141,Dead Ball Rebound,Indiana Deadball Team Rebound.,48,54,2nd Half,5:16,False,84,2025-11-17T00:13:49Z
401827189114485170,114485170,MadeFreeThrow,Tayton Conerway made Free Throw.,48,55,2nd Half,5:16,True,84,2025-11-17T00:14:07Z
401827189114485180,114485180,JumpShot,Davion Bailey missed Three Point Jumper.,48,55,2nd Half,4:56,False,2916,2025-11-17T00:14:31Z
401827189114485184,114485184,Defensive Rebound,Sam Alexis Defensive Rebound.,48,55,2nd Half,4:53,False,84,2025-11-17T00:14:33Z
401827189114485214,114485214,DunkShot,Sam Alexis made Dunk. Assisted by Tayton Conerway.,48,57,2nd Half,4:44,True,84,2025-11-17T00:14:43Z
