play_id,sequence_number,type,description,away_score,home_score,period,clock,scoring_play,team_id,timestamp_utc
401823724113727520,113727520,Defensive Rebound,Fallou Gueye Defensive Rebound.,25,45,1st Half,0:00,False,2529,2025-11-05T00:42:06Z
401823724113727552,113727552,End Period,End of 1st half,25,45,1st Half,0:00,False,,2025-11-05T00:42:10Z
401823724113729832,113729832,Substitution,Taj Bryant subbing out for Sacred Heart,25,45,2nd Half,20:00,False,2529,2025-11-05T00:58:41Z
401823724113729834,113729834,Substitution,Abdou Yadd subbing out for Sacred Heart,25,45,2nd Half,20:00,False,2529,2025-11-05T00:58:41Z
401823724113729835,113729835,Substitution,Fallou Gueye subbing out for Sacred Heart,25,45,2nd Half,20:00,False,2529,2025-11-05T00:58:41Z
401823724113729836,113729836,Substitution,Nyle Ralph-Beyer subbing in for Sacred Heart,25,45,2nd Half,20:00,False,2529,2025-11-05T00:58:41Z
401823724113729837,113729837,Substitution,Dashon Gittens subbing in for Sacred Heart,25,45,2nd Half,20:00,False,2529,2025-11-05T00:58:41Z
401823724113729838,113729838,Substitution,Anquan Hill subbing in for Sacred Heart,25,45,2nd Half,20:00,False,2529,2025-11-05T00:58:41Z
401823724113729839,113729839,Substitution,Richard Sykes subbing out for Merchant Marine Academy,25,45,2nd Half,20:00,False,2383,2025-11-05T00:58:41Z
401823724113729840,113729840,Substitution,Aaron Braxton subbing out for Merchant Marine Academy,25,45,2nd Half,20:00,False,2383,2025-11-05T00:58:41Z
401823724113729841,113729841,Substitution,Talan Dawkins subbing out for Merchant Marine Academy,25,45,2nd Half,20:00,False,2383,2025-11-05T00:58:41Z
401823724113729843,113729843,Substitution,Aaron Zalescik subbing in for Merchant Marine Academy,25,45,2nd Half,20:00,False,2383,2025-11-05T00:58:41Z
401823724113729845,113729845,Substitution,Colin Hart subbing in for Merchant Marine Academy,25,45,2nd Half,20:00,False,2383,2025-11-05T00:58:41Z
401823724113729848,113729848,Substitution,Jack Flannery subbing in for Merchant Marine Academy,25,45,2nd Half,20:00,False,2383,2025-11-05T00:58:41Z
401823724113729918,113729918,PersonalFoul,Foul on Mekhi Conner.,25,45,2nd Half,19:39,False,2529,2025-11-05T00:59:24Z
401823724113729956,113729956,MadeFreeThrow,Aaron Zalescik missed Free Throw.,25,45,2nd Half,19:39,False,2383,2025-11-05T00:59:51Z
401823724113729957,113729957,Dead Ball Rebound,Merchant Marine Academy Deadball Team Rebound.,25,45,2nd Half,19:39,False,2383,2025-11-05T00:59:51Z
401823724113729998,113729998,MadeFreeThrow,Aaron Zalescik missed Free Throw.,25,45,2nd Half,19:38,False,2383,2025-11-05T01:00:10Z
401823724113729999,113729999,Defensive Rebound,Anquan Hill Defensive Rebound.,25,45,2nd Half,19:36,False,2529,2025-11-05T01:00:11Z
401823724113730028,113730028,Lost Ball Turnover,Dashon Gittens Turnover.,25,45,2nd Half,19:28,False,2529,2025-11-05T01:00:20Z
401823724113730031,113730031,Steal,Aaron Zalescik Steal.,25,45,2nd Half,19:28,False,2383,2025-11-05T01:00:20Z
401823724113730044,113730044,PersonalFoul,Foul on Dashon Gittens.,25,45,2nd Half,19:13,False,2529,2025-11-05T01:00:37Z
401823724113730094,113730094,LayUpShot,Jack Flannery missed Layup.,25,45,2nd Half,19:02,False,2383,2025-11-05T01:01:03Z
401823724113730095,113730095,Offensive Rebound,Aaron Zalescik Offensive Rebound.,25,45,2nd Half,19:02,False,2383,2025-11-05T01:01:06Z
401823724113730129,113730129,PersonalFoul,Foul on Yann Farell.,25,45,2nd Half,19:02,False,2529,2025-11-05T01:01:07Z
401823724113730173,113730173,MadeFreeThrow,Aaron Zalescik made Free Throw.,26,45,2nd Half,19:02,True,2383,2025-11-05T01:01:53Z
401823724113730175,113730175,MadeFreeThrow,Aaron Zalescik made Free Throw.,27,45,2nd Half,19:02,True,2383,2025-11-05T01:01:53Z
401823724113730229,113730229,PersonalFoul,Foul on Aaron Zalescik.,27,45,2nd Half,18:50,False,2383,2025-11-05T01:02:09Z
401823724113730276,113730276,MadeFreeThrow,Nyle Ralph-Beyer made Free Throw.,27,46,2nd Half,18:50,True,2529,2025-11-05T01:02:44Z
401823724113730378,113730378,MadeFreeThrow,Nyle Ralph-Beyer made Free Throw.,27,47,2nd Half,18:50,True,2529,2025-11-05T01:03:05Z
401823724113730429,113730429,JumpShot,Colin Hart missed Three Point Jumper.,27,47,2nd Half,18:32,False,2383,2025-11-05T01:03:27Z
401823724113730473,113730473,Defensive Rebound,Anquan Hill Defensive Rebound.,27,47,2nd Half,18:29,False,2529,2025-11-05T01:03:29Z
401823724113730481,113730481,JumpShot,Mekhi Conner missed Three Point Jumper.,27,47,2nd Half,18:25,False,2529,2025-11-05T01:03:37Z
401823724113730482,113730482,Offensive Rebound,Yann Farell Offensive Rebound.,27,47,2nd Half,18:18,False,2529,2025-11-05T01:03:41Z
401823724113730483,113730483,TipShot,Yann Farell made Two Point Tip Shot.,27,49,2nd Half,18:18,True,2529,2025-11-05T01:03:41Z
401823724113730571,113730571,Lost Ball Turnover,Mason Lavergne Turnover.,27,49,2nd Half,17:59,False,2383,2025-11-05T01:04:00Z
401823724113730572,113730572,Steal,Yann Farell Steal.,27,49,2nd Half,17:59,False,2529,2025-11-05T01:04:00Z
401823724113730627,113730627,JumpShot,Nyle Ralph-Beyer made Three Point Jumper. Assisted by Yann Farell.,27,52,2nd Half,17:53,True,2529,2025-11-05T01:04:08Z
401823724113730809,113730809,LayUpShot,Mason Lavergne missed Layup.,27,52,2nd Half,17:02,False,2383,2025-11-05T01:04:58Z
401823724113730810,113730810,Defensive Rebound,Anquan Hill Defensive Rebound.,27,52,2nd Half,17:00,False,2529,2025-11-05T01:05:00Z
401823724113730811,113730811,JumpShot,Nyle Ralph-Beyer missed Three Point Jumper.,27,52,2nd Half,16:56,False,2529,2025-11-05T01:05:05Z
401823724113730813,113730813,Offensive Rebound,Anquan Hill Offensive Rebound.,27,52,2nd Half,16:52,False,2529,2025-11-05T01:05:07Z
401823724113730839,113730839,DunkShot,Nyle Ralph-Beyer missed Dunk.,27,52,2nd Half,16:46,False,2529,2025-11-05T01:05:13Z
401823724113730841,113730841,Offensive Rebound,Mekhi Conner Offensive Rebound.,27,52,2nd Half,16:42,False,2529,2025-11-05T01:05:17Z
401823724113730878,113730878,JumpShot,Yann Farell missed Three Point Jumper.,27,52,2nd Half,16:38,False,2529,2025-11-05T01:05:21Z
401823724113730879,113730879,Offensive Rebound,Anquan Hill Offensive Rebound.,27,52,2nd Half,16:35,False,2529,2025-11-05T01:05:24Z
401823724113730880,113730880,TipShot,Anquan Hill missed Two Point Tip Shot.,27,52,2nd Half,16:35,False,2529,2025-11-05T01:05:24Z
401823724113730881,113730881,Defensive Rebound,Aaron Zalescik Defensive Rebound.,27,52,2nd Half,16:34,False,2383,2025-11-05T01:05:25Z
401823724113730928,113730928,Lost Ball Turnover,Tim Barton Turnover.,27,52,2nd Half,16:29,False,2383,2025-11-05T01:05:31Z
401823724113730930,113730930,Steal,Dashon Gittens Steal.,27,52,2nd Half,16:29,False,2529,2025-11-05T01:05:31Z
401823724113730932,113730932,DunkShot,Anquan Hill made Dunk. Assisted by Dashon Gittens.,27,54,2nd Half,16:24,True,2529,2025-11-05T01:05:36Z
401823724113731073,113731073,JumpShot,Jack Flannery missed Three Point Jumper.,27,54,2nd Half,15:52,False,2383,2025-11-05T01:06:08Z
401823724113731074,113731074,Defensive Rebound,Mekhi Conner Defensive Rebound.,27,54,2nd Half,15:50,False,2529,2025-11-05T01:06:09Z
401823724113731075,113731075,LayUpShot,Dashon Gittens made Layup. Assisted by Mekhi Conner.,27,56,2nd Half,15:46,True,2529,2025-11-05T01:06:15Z
401823724113731133,113731133,PersonalFoul,Foul on Tim Barton.,27,56,2nd Half,15:46,False,2383,2025-11-05T01:06:19Z
401823724113731256,113731256,MadeFreeThrow,Dashon Gittens missed Free Throw.,27,56,2nd Half,15:46,False,2529,2025-11-05T01:06:48Z
401823724113731257,113731257,Defensive Rebound,Aaron Zalescik Defensive Rebound.,27,56,2nd Half,15:46,False,2383,2025-11-05T01:06:50Z
401823724113731325,113731325,JumpShot,Tim Barton missed Three Point Jumper.,27,56,2nd Half,15:35,False,2383,2025-11-05T01:07:16Z
401823724113731377,113731377,Defensive Rebound,Dashon Gittens Defensive Rebound.,27,56,2nd Half,15:32,False,2529,2025-11-05T01:07:19Z
401823724113731684,113731684,OfficialTVTimeOut,Official TV Timeout,27,56,2nd Half,15:27,False,,2025-11-05T01:08:31Z
401823724113732120,113732120,Substitution,Colin Hart subbing out for Merchant Marine Academy,27,56,2nd Half,15:27,False,2383,2025-11-05T01:10:21Z
401823724113732121,113732121,Substitution,Talan Dawkins subbing in for Merchant Marine Academy,27,56,2nd Half,15:27,False,2383,2025-11-05T01:10:21Z
401823724113732267,113732267,JumpShot,Yann Farell made Three Point Jumper. Assisted by Mekhi Conner.,27,59,2nd Half,15:17,True,2529,2025-11-05T01:10:49Z
401823724113732381,113732381,JumpShot,Mason Lavergne missed Jumper.,27,59,2nd Half,14:55,False,2383,2025-11-05T01:11:10Z
401823724113732384,113732384,Defensive Rebound,Anquan Hill Defensive Rebound.,27,59,2nd Half,14:52,False,2529,2025-11-05T01:11:12Z
401823724113732431,113732431,JumpShot,Dashon Gittens missed Three Point Jumper.,27,59,2nd Half,14:44,False,2529,2025-11-05T01:11:21Z
401823724113732432,113732432,Offensive Rebound,Anquan Hill Offensive Rebound.,27,59,2nd Half,14:41,False,2529,2025-11-05T01:11:23Z
401823724113732433,113732433,LayUpShot,Anquan Hill made Layup.,27,61,2nd Half,14:39,True,2529,2025-11-05T01:11:27Z
401823724113732505,113732505,JumpShot,Jack Flannery missed Three Point Jumper.,27,61,2nd Half,14:23,False,2383,2025-11-05T01:11:42Z
401823724113732546,113732546,Defensive Rebound,Anquan Hill Defensive Rebound.,27,61,2nd Half,14:20,False,2529,2025-11-05T01:11:44Z
401823724113732560,113732560,DunkShot,Anquan Hill made Dunk. Assisted by Mekhi Conner.,27,63,2nd Half,14:14,True,2529,2025-11-05T01:11:51Z
401823724113732613,113732613,LayUpShot,Mason Lavergne missed Layup.,27,63,2nd Half,14:03,False,2383,2025-11-05T01:12:01Z
401823724113732614,113732614,Defensive Rebound,Sacred Heart Defensive Rebound.,27,63,2nd Half,14:01,False,2529,2025-11-05T01:12:06Z
401823724113732678,113732678,Substitution,Nyle Ralph-Beyer subbing out for Sacred Heart,27,63,2nd Half,14:01,False,2529,2025-11-05T01:12:17Z
401823724113732680,113732680,Substitution,Mekhi Conner subbing out for Sacred Heart,27,63,2nd Half,14:01,False,2529,2025-11-05T01:12:17Z
401823724113732682,113732682,Substitution,Dashon Gittens subbing out for Sacred Heart,27,63,2nd Half,14:01,False,2529,2025-11-05T01:12:17Z
401823724113732683,113732683,Substitution,Yann Farell subbing out for Sacred Heart,27,63,2nd Half,14:01,False,2529,2025-11-05T01:12:17Z
401823724113732684,113732684,Substitution,Anquan Hill subbing out for Sacred Heart,27,63,2nd Half,14:01,False,2529,2025-11-05T01:12:17Z
401823724113732685,113732685,Substitution,Jaden Slaughter subbing in for Sacred Heart,27,63,2nd Half,14:01,False,2529,2025-11-05T01:12:17Z
401823724113732706,113732706,Substitution,Taj Bryant subbing in for Sacred Heart,27,63,2nd Half,14:01,False,2529,2025-11-05T01:12:17Z
401823724113732708,113732708,Substitution,Abdou Yadd subbing in for Sacred Heart,27,63,2nd Half,14:01,False,2529,2025-11-05T01:12:17Z
401823724113732710,113732710,Substitution,Fallou Gueye subbing in for Sacred Heart,27,63,2nd Half,14:01,False,2529,2025-11-05T01:12:17Z
401823724113732711,113732711,Substitution,Lucius Gibson-Savadel subbing in for Sacred Heart,27,63,2nd Half,14:01,False,2529,2025-11-05T01:12:17Z
401823724113732811,113732811,Lost Ball Turnover,Fallou Gueye Turnover.,27,63,2nd Half,13:44,False,2529,2025-11-05T01:12:44Z
401823724113732896,113732896,Substitution,Aaron Zalescik subbing out for Merchant Marine Academy,27,63,2nd Half,13:44,False,2383,2025-11-05T01:12:57Z
401823724113732897,113732897,Substitution,Richard Sykes subbing in for Merchant Marine Academy,27,63,2nd Half,13:44,False,2383,2025-11-05T01:12:57Z
401823724113732959,113732959,JumpShot,Jack Flannery made Three Point Jumper. Assisted by Mason Lavergne.,30,63,2nd Half,13:27,True,2383,2025-11-05T01:13:14Z
401823724113733075,113733075,PersonalFoul,Foul on Jack Flannery.,30,63,2nd Half,13:12,False,2383,2025-11-05T01:13:37Z
401823724113733143,113733143,LayUpShot,Abdou Yadd missed Layup.,30,63,2nd Half,13:01,False,2529,2025-11-05T01:14:04Z
401823724113733144,113733144,Offensive Rebound,Abdou Yadd Offensive Rebound.,30,63,2nd Half,12:58,False,2529,2025-11-05T01:14:06Z
401823724113733145,113733145,TipShot,Abdou Yadd made Two Point Tip Shot.,30,65,2nd Half,12:58,True,2529,2025-11-05T01:14:06Z
401823724113733216,113733216,LayUpShot,Mason Lavergne missed Layup.,30,65,2nd Half,12:43,False,2383,2025-11-05T01:14:22Z
401823724113733220,113733220,Defensive Rebound,Lucius Gibson-Savadel Defensive Rebound.,30,65,2nd Half,12:43,False,2529,2025-11-05T01:14:27Z
401823724113733282,113733282,JumpShot,Abdou Yadd made Three Point Jumper. Assisted by Taj Bryant.,30,68,2nd Half,12:28,True,2529,2025-11-05T01:14:37Z
401823724113733396,113733396,LayUpShot,Tim Barton made Layup.,32,68,2nd Half,12:09,True,2383,2025-11-05T01:14:56Z
401823724113733452,113733452,PersonalFoul,Foul on Lucius Gibson-Savadel.,32,68,2nd Half,11:52,False,2529,2025-11-05T01:15:14Z
401823724113733454,113733454,Lost Ball Turnover,Lucius Gibson-Savadel Turnover.,32,68,2nd Half,11:52,False,2529,2025-11-05T01:15:14Z
401823724113733561,113733561,OfficialTVTimeOut,Official TV Timeout,32,68,2nd Half,11:52,False,,2025-11-05T01:15:30Z
401823724113734199,113734199,Substitution,Mason Lavergne subbing out for Merchant Marine Academy,32,68,2nd Half,11:52,False,2383,2025-11-05T01:17:42Z
401823724113734201,113734201,Substitution,Ronnie Fazio subbing in for Merchant Marine Academy,32,68,2nd Half,11:52,False,2383,2025-11-05T01:17:42Z
401823724113734310,113734310,LayUpShot,Tim Barton made Layup.,34,68,2nd Half,11:37,True,2383,2025-11-05T01:18:14Z
401823724113734444,113734444,Lost Ball Turnover,Jaden Slaughter Turnover.,34,68,2nd Half,11:15,False,2529,2025-11-05T01:18:42Z
401823724113734468,113734468,Steal,Richard Sykes Steal.,34,68,2nd Half,11:15,False,2383,2025-11-05T01:18:42Z
401823724113734573,113734573,PersonalFoul,Foul on Fallou Gueye.,34,68,2nd Half,11:01,False,2529,2025-11-05T01:19:11Z
401823724113734685,113734685,JumpShot,Jack Flannery missed Three Point Jumper.,34,68,2nd Half,10:53,False,2383,2025-11-05T01:19:40Z
401823724113734707,113734707,Defensive Rebound,Taj Bryant Defensive Rebound.,34,68,2nd Half,10:51,False,2529,2025-11-05T01:19:42Z
401823724113734786,113734786,LayUpShot,Fallou Gueye made Layup. Assisted by Taj Bryant.,34,70,2nd Half,10:34,True,2529,2025-11-05T01:19:59Z
401823724113734877,113734877,JumpShot,Richard Sykes missed Three Point Jumper.,34,70,2nd Half,10:07,False,2383,2025-11-05T01:20:27Z
401823724113734937,113734937,Defensive Rebound,Taj Bryant Defensive Rebound.,34,70,2nd Half,10:03,False,2529,2025-11-05T01:20:30Z
401823724113734959,113734959,JumpShot,Fallou Gueye made Three Point Jumper. Assisted by Taj Bryant.,34,73,2nd Half,9:46,True,2529,2025-11-05T01:20:47Z
401823724113735071,113735071,LayUpShot,Tim Barton missed Layup.,34,73,2nd Half,9:25,False,2383,2025-11-05T01:21:08Z
401823724113735074,113735074,Defensive Rebound,Lucius Gibson-Savadel Defensive Rebound.,34,73,2nd Half,9:23,False,2529,2025-11-05T01:21:10Z
401823724113735076,113735076,LayUpShot,Jaden Slaughter made Layup.,34,75,2nd Half,9:17,True,2529,2025-11-05T01:21:17Z
401823724113735150,113735150,ShortTimeOut,Merchant Marine Academy Timeout,34,75,2nd Half,9:14,False,2383,2025-11-05T01:21:30Z
401823724113735561,113735561,Substitution,Tim Barton subbing out for Merchant Marine Academy,34,75,2nd Half,9:13,False,2383,2025-11-05T01:23:38Z
401823724113735563,113735563,Substitution,Jack Flannery subbing out for Merchant Marine Academy,34,75,2nd Half,9:13,False,2383,2025-11-05T01:23:38Z
401823724113735616,113735616,Substitution,Jack van de Erve subbing in for Merchant Marine Academy,34,75,2nd Half,9:13,False,2383,2025-11-05T01:23:38Z
401823724113735617,113735617,Substitution,Aaron Braxton subbing in for Merchant Marine Academy,34,75,2nd Half,9:13,False,2383,2025-11-05T01:23:38Z
401823724113735702,113735702,Lost Ball Turnover,Aaron Braxton Turnover.,34,75,2nd Half,9:12,False,2383,2025-11-05T01:24:01Z
401823724113735723,113735723,Substitution,Abdou Yadd subbing out for Sacred Heart,34,75,2nd Half,9:12,False,2529,2025-11-05T01:24:15Z
401823724113735725,113735725,Substitution,Lucius Gibson-Savadel subbing out for Sacred Heart,34,75,2nd Half,9:12,False,2529,2025-11-05T01:24:15Z
401823724113735746,113735746,Substitution,Yann Farell subbing in for Sacred Heart,34,75,2nd Half,9:12,False,2529,2025-11-05T01:24:15Z
401823724113735749,113735749,Substitution,Anquan Hill subbing in for Sacred Heart,34,75,2nd Half,9:12,False,2529,2025-11-05T01:24:15Z
401823724113735789,113735789,Substitution,Richard Sykes subbing out for Merchant Marine Academy,34,75,2nd Half,9:12,False,2383,2025-11-05T01:24:25Z
401823724113735791,113735791,Substitution,Colin Hart subbing in for Merchant Marine Academy,34,75,2nd Half,9:12,False,2383,2025-11-05T01:24:25Z
401823724113735887,113735887,PersonalFoul,Foul on Colin Hart.,34,75,2nd Half,9:04,False,2383,2025-11-05T01:24:47Z
401823724113735988,113735988,JumpShot,Fallou Gueye missed Three Point Jumper.,34,75,2nd Half,8:53,False,2529,2025-11-05T01:25:11Z
401823724113736037,113736037,Offensive Rebound,Yann Farell Offensive Rebound.,34,75,2nd Half,8:48,False,2529,2025-11-05T01:25:20Z
401823724113736147,113736147,JumpShot,Anquan Hill missed Three Point Jumper.,34,75,2nd Half,8:37,False,2529,2025-11-05T01:25:50Z
401823724113736149,113736149,Offensive Rebound,Yann Farell Offensive Rebound.,34,75,2nd Half,8:35,False,2529,2025-11-05T01:25:52Z
401823724113736151,113736151,JumpShot,Jaden Slaughter missed Three Point Jumper.,34,75,2nd Half,8:31,False,2529,2025-11-05T01:25:57Z
401823724113736238,113736238,Dead Ball Rebound,Sacred Heart Deadball Team Rebound.,34,75,2nd Half,8:29,False,2529,2025-11-05T01:26:09Z
401823724113736239,113736239,Lost Ball Turnover,Sacred Heart  Turnover.,34,75,2nd Half,8:29,False,2529,2025-11-05T01:26:09Z
401823724113736240,113736240,Substitution,Ronnie Fazio subbing out for Merchant Marine Academy,34,75,2nd Half,8:29,False,2383,2025-11-05T01:26:17Z
401823724113736241,113736241,Substitution,Noah Brown subbing in for Merchant Marine Academy,34,75,2nd Half,8:29,False,2383,2025-11-05T01:26:17Z
401823724113736367,113736367,LayUpShot,Colin Hart missed Layup.,34,75,2nd Half,8:08,False,2383,2025-11-05T01:26:44Z
401823724113736369,113736369,Offensive Rebound,Noah Brown Offensive Rebound.,34,75,2nd Half,8:04,False,2383,2025-11-05T01:26:47Z
401823724113736400,113736400,JumpShot,Noah Brown missed Jumper.,34,75,2nd Half,8:03,False,2383,2025-11-05T01:26:49Z
401823724113736401,113736401,Defensive Rebound,Taj Bryant Defensive Rebound.,34,75,2nd Half,8:00,False,2529,2025-11-05T01:26:51Z
401823724113736468,113736468,DunkShot,Anquan Hill made Dunk. Assisted by Taj Bryant.,34,77,2nd Half,7:54,True,2529,2025-11-05T01:26:58Z
401823724113736494,113736494,PersonalFoul,Foul on Jack van de Erve.,34,77,2nd Half,7:54,False,2383,2025-11-05T01:27:04Z
401823724113737031,113737031,Substitution,Jaden Slaughter subbing out for Sacred Heart,34,77,2nd Half,7:54,False,2529,2025-11-05T01:29:39Z
401823724113737032,113737032,Substitution,Taj Bryant subbing out for Sacred Heart,34,77,2nd Half,7:54,False,2529,2025-11-05T01:29:39Z
401823724113737033,113737033,Substitution,Fallou Gueye subbing out for Sacred Heart,34,77,2nd Half,7:54,False,2529,2025-11-05T01:29:39Z
401823724113737034,113737034,Substitution,Nyle Ralph-Beyer subbing in for Sacred Heart,34,77,2nd Half,7:54,False,2529,2025-11-05T01:29:39Z
401823724113737035,113737035,Substitution,Mekhi Conner subbing in for Sacred Heart,34,77,2nd Half,7:54,False,2529,2025-11-05T01:29:39Z
401823724113737036,113737036,Substitution,Dashon Gittens subbing in for Sacred Heart,34,77,2nd Half,7:54,False,2529,2025-11-05T01:29:39Z
401823724113737038,113737038,Substitution,Colin Hart subbing out for Merchant Marine Academy,34,77,2nd Half,7:54,False,2383,2025-11-05T01:29:39Z
401823724113737039,113737039,Substitution,Jack Flannery subbing in for Merchant Marine Academy,34,77,2nd Half,7:54,False,2383,2025-11-05T01:29:39Z
401823724113737095,113737095,MadeFreeThrow,Anquan Hill made Free Throw.,34,78,2nd Half,7:54,True,2529,2025-11-05T01:29:54Z
401823724113737127,113737127,Lost Ball Turnover,Aaron Braxton Turnover.,34,78,2nd Half,7:45,False,2383,2025-11-05T01:30:06Z
401823724113737153,113737153,Steal,Anquan Hill Steal.,34,78,2nd Half,7:45,False,2529,2025-11-05T01:30:06Z
401823724113737154,113737154,LayUpShot,Anquan Hill made Layup.,34,80,2nd Half,7:42,True,2529,2025-11-05T01:30:10Z
401823724113737216,113737216,JumpShot,Talan Dawkins made Three Point Jumper. Assisted by Jack van de Erve.,37,80,2nd Half,7:16,True,2383,2025-11-05T01:30:36Z
401823724113737315,113737315,Lost Ball Turnover,Nyle Ralph-Beyer Turnover.,37,80,2nd Half,7:03,False,2529,2025-11-05T01:31:00Z
401823724113737317,113737317,Steal,Noah Brown Steal.,37,80,2nd Half,7:03,False,2383,2025-11-05T01:31:00Z
401823724113737318,113737318,Substitution,Jack Flannery subbing out for Merchant Marine Academy,37,80,2nd Half,7:03,False,2383,2025-11-05T01:31:05Z
401823724113737319,113737319,Substitution,Colin Hart subbing in for Merchant Marine Academy,37,80,2nd Half,7:03,False,2383,2025-11-05T01:31:05Z
401823724113737371,113737371,Lost Ball Turnover,Colin Hart Turnover.,37,80,2nd Half,7:03,False,2383,2025-11-05T01:31:28Z
401823724113737382,113737382,Steal,Nyle Ralph-Beyer Steal.,37,80,2nd Half,7:03,False,2529,2025-11-05T01:31:28Z
401823724113737384,113737384,DunkShot,Nyle Ralph-Beyer made Dunk. Assisted by Mekhi Conner.,37,82,2nd Half,7:03,True,2529,2025-11-05T01:31:32Z
401823724113737437,113737437,Lost Ball Turnover,Aaron Braxton Turnover.,37,82,2nd Half,7:02,False,2383,2025-11-05T01:31:47Z
401823724113737486,113737486,Steal,Dashon Gittens Steal.,37,82,2nd Half,7:02,False,2529,2025-11-05T01:31:47Z
401823724113737487,113737487,DunkShot,Dashon Gittens made Dunk.,37,84,2nd Half,6:58,True,2529,2025-11-05T01:31:52Z
401823724113737493,113737493,JumpShot,Noah Brown missed Jumper.,37,84,2nd Half,6:20,False,2383,2025-11-05T01:32:05Z
401823724113737495,113737495,Offensive Rebound,Noah Brown Offensive Rebound.,37,84,2nd Half,6:17,False,2383,2025-11-05T01:32:08Z
401823724113737572,113737572,LayUpShot,Noah Brown missed Layup.,37,84,2nd Half,5:58,False,2383,2025-11-05T01:32:13Z
401823724113737574,113737574,Defensive Rebound,Nyle Ralph-Beyer Defensive Rebound.,37,84,2nd Half,5:56,False,2529,2025-11-05T01:32:15Z
401823724113737579,113737579,JumpShot,Dashon Gittens made Three Point Jumper. Assisted by Mekhi Conner.,37,87,2nd Half,5:45,True,2529,2025-11-05T01:32:22Z
401823724113737657,113737657,LayUpShot,Talan Dawkins missed Layup.,37,87,2nd Half,5:23,False,2383,2025-11-05T01:32:44Z
401823724113737658,113737658,Defensive Rebound,Nyle Ralph-Beyer Defensive Rebound.,37,87,2nd Half,5:20,False,2529,2025-11-05T01:32:47Z
401823724113737755,113737755,JumpShot,Yann Farell missed Three Point Jumper.,37,87,2nd Half,5:05,False,2529,2025-11-05T01:33:03Z
401823724113737756,113737756,Offensive Rebound,Anquan Hill Offensive Rebound.,37,87,2nd Half,5:00,False,2529,2025-11-05T01:33:07Z
401823724113737757,113737757,TipShot,Anquan Hill missed Two Point Tip Shot.,37,87,2nd Half,5:00,False,2529,2025-11-05T01:33:07Z
401823724113737763,113737763,Offensive Rebound,Dashon Gittens Offensive Rebound.,37,87,2nd Half,4:58,False,2529,2025-11-05T01:33:12Z
401823724113737765,113737765,TipShot,Dashon Gittens made Two Point Tip Shot.,37,89,2nd Half,4:58,True,2529,2025-11-05T01:33:12Z
401823724113737842,113737842,ShortTimeOut,Sacred Heart Timeout,37,89,2nd Half,4:57,False,2529,2025-11-05T01:33:21Z
401823724113737893,113737893,Substitution,Nyle Ralph-Beyer subbing out for Sacred Heart,37,89,2nd Half,4:57,False,2529,2025-11-05T01:33:38Z
401823724113737894,113737894,Substitution,Mekhi Conner subbing out for Sacred Heart,37,89,2nd Half,4:57,False,2529,2025-11-05T01:33:38Z
401823724113737895,113737895,Substitution,Dashon Gittens subbing out for Sacred Heart,37,89,2nd Half,4:57,False,2529,2025-11-05T01:33:38Z
401823724113737896,113737896,Substitution,Yann Farell subbing out for Sacred Heart,37,89,2nd Half,4:57,False,2529,2025-11-05T01:33:38Z
401823724113737897,113737897,Substitution,Anquan Hill subbing out for Sacred Heart,37,89,2nd Half,4:57,False,2529,2025-11-05T01:33:38Z
401823724113737898,113737898,Substitution,Jaden Slaughter subbing in for Sacred Heart,37,89,2nd Half,4:57,False,2529,2025-11-05T01:33:38Z
401823724113737899,113737899,Substitution,Taj Bryant subbing in for Sacred Heart,37,89,2nd Half,4:57,False,2529,2025-11-05T01:33:38Z
401823724113737900,113737900,Substitution,Abdou Yadd subbing in for Sacred Heart,37,89,2nd Half,4:57,False,2529,2025-11-05T01:33:38Z
401823724113737901,113737901,Substitution,Fallou Gueye subbing in for Sacred Heart,37,89,2nd Half,4:57,False,2529,2025-11-05T01:33:38Z
401823724113737902,113737902,Substitution,Lucius Gibson-Savadel subbing in for Sacred Heart,37,89,2nd Half,4:57,False,2529,2025-11-05T01:33:38Z
401823724113737903,113737903,Substitution,Jack van de Erve subbing out for Merchant Marine Academy,37,89,2nd Half,4:57,False,2383,2025-11-05T01:33:38Z
401823724113737904,113737904,Substitution,Aaron Braxton subbing out for Merchant Marine Academy,37,89,2nd Half,4:57,False,2383,2025-11-05T01:33:38Z
401823724113737905,113737905,Substitution,Talan Dawkins subbing out for Merchant Marine Academy,37,89,2nd Half,4:57,False,2383,2025-11-05T01:33:38Z
401823724113737946,113737946,Substitution,Noah Brown subbing out for Merchant Marine Academy,37,89,2nd Half,4:57,False,2383,2025-11-05T01:33:38Z
401823724113737953,113737953,Substitution,Tim Barton subbing in for Merchant Marine Academy,37,89,2nd Half,4:57,False,2383,2025-11-05T01:33:38Z
401823724113737954,113737954,Substitution,Mason Lavergne subbing in for Merchant Marine Academy,37,89,2nd Half,4:57,False,2383,2025-11-05T01:33:38Z
401823724113737955,113737955,Substitution,Aaron Zalescik subbing in for Merchant Marine Academy,37,89,2nd Half,4:57,False,2383,2025-11-05T01:33:38Z
401823724113737956,113737956,Substitution,Jack Flannery subbing in for Merchant Marine Academy,37,89,2nd Half,4:57,False,2383,2025-11-05T01:33:38Z
