play_id,sequence_number,type,description,away_score,home_score,period,clock,scoring_play,team_id,timestamp_utc
401826785113995826,113995826,Defensive Rebound,Coen Carr Defensive Rebound.,31,32,1st Half,3:10,False,127,2025-11-09T00:45:15Z
401826785113995842,113995842,JumpShot,Jaxon Kohler missed Jumper.,31,32,1st Half,2:58,False,127,2025-11-09T00:45:28Z
401826785113995844,113995844,Defensive Rebound,Nick Pringle Defensive Rebound.,31,32,1st Half,2:55,False,8,2025-11-09T00:45:30Z
401826785113995845,113995845,JumpShot,D.J. Wagner missed Three Point Jumper.,31,32,1st Half,2:48,False,8,2025-11-09T00:45:38Z
401826785113995858,113995858,Defensive Rebound,Jeremy Fears Jr. Defensive Rebound.,31,32,1st Half,2:46,False,127,2025-11-09T00:45:39Z
401826785113995864,113995864,PersonalFoul,Foul on Darius Acuff Jr..,31,32,1st Half,2:42,False,8,2025-11-09T00:45:49Z
401826785113995875,113995875,Substitution,D.J. Wagner subbing out for Arkansas,31,32,1st Half,2:42,False,8,2025-11-09T00:46:06Z
401826785113995876,113995876,Substitution,Karter Knox subbing in for Arkansas,31,32,1st Half,2:42,False,8,2025-11-09T00:46:06Z
401826785113995887,113995887,MadeFreeThrow,Jeremy Fears Jr. missed Free Throw.,31,32,1st Half,2:42,False,127,2025-11-09T00:46:22Z
401826785113995888,113995888,Defensive Rebound,Karter Knox Defensive Rebound.,31,32,1st Half,2:41,False,8,2025-11-09T00:46:23Z
401826785113995905,113995905,JumpShot,Darius Acuff Jr. made Jumper.,33,32,1st Half,2:24,True,8,2025-11-09T00:46:40Z
401826785113995918,113995918,JumpShot,Jaxon Kohler missed Jumper.,33,32,1st Half,2:06,False,127,2025-11-09T00:46:58Z
401826785113995920,113995920,Offensive Rebound,Cam Ward Offensive Rebound.,33,32,1st Half,2:03,False,127,2025-11-09T00:47:00Z
401826785113995921,113995921,JumpShot,Cam Ward missed Jumper.,33,32,1st Half,2:02,False,127,2025-11-09T00:47:03Z
401826785113995922,113995922,Block Shot,Billy Richmond III Block.,33,32,1st Half,2:02,False,8,2025-11-09T00:47:03Z
401826785113995923,113995923,Defensive Rebound,Billy Richmond III Defensive Rebound.,33,32,1st Half,1:58,False,8,2025-11-09T00:47:06Z
401826785113995934,113995934,LayUpShot,Darius Acuff Jr. missed Layup.,33,32,1st Half,1:56,False,8,2025-11-09T00:47:09Z
401826785113995935,113995935,Offensive Rebound,Meleek Thomas Offensive Rebound.,33,32,1st Half,1:51,False,8,2025-11-09T00:47:15Z
401826785113995936,113995936,TipShot,Meleek Thomas made Two Point Tip Shot.,35,32,1st Half,1:51,True,8,2025-11-09T00:47:15Z
401826785113995944,113995944,ShortTimeOut,Michigan State Timeout,35,32,1st Half,1:51,False,127,2025-11-09T00:47:19Z
401826785113996048,113996048,PersonalFoul,Foul on Nick Pringle.,35,32,1st Half,1:42,False,8,2025-11-09T00:49:09Z
401826785113996062,113996062,MadeFreeThrow,Jordan Scott made Free Throw.,35,33,1st Half,1:42,True,127,2025-11-09T00:49:23Z
401826785113996076,113996076,MadeFreeThrow,Jordan Scott made Free Throw.,35,34,1st Half,1:42,True,127,2025-11-09T00:49:37Z
401826785113996094,113996094,Lost Ball Turnover,Darius Acuff Jr. Turnover.,35,34,1st Half,1:34,False,8,2025-11-09T00:49:50Z
401826785113996095,113996095,Steal,Coen Carr Steal.,35,34,1st Half,1:34,False,127,2025-11-09T00:49:50Z
401826785113996127,113996127,Lost Ball Turnover,Coen Carr Turnover.,35,34,1st Half,1:26,False,127,2025-11-09T00:49:58Z
401826785113996128,113996128,Steal,Nick Pringle Steal.,35,34,1st Half,1:26,False,8,2025-11-09T00:49:58Z
401826785113996146,113996146,PersonalFoul,Foul on Jeremy Fears Jr..,35,34,1st Half,1:22,False,127,2025-11-09T00:50:07Z
401826785113996152,113996152,MadeFreeThrow,Billy Richmond III missed Free Throw.,35,34,1st Half,1:22,False,8,2025-11-09T00:50:28Z
401826785113996154,113996154,Dead Ball Rebound,Arkansas Deadball Team Rebound.,35,34,1st Half,1:22,False,8,2025-11-09T00:50:28Z
401826785113996176,113996176,Substitution,Nick Pringle subbing out for Arkansas,35,34,1st Half,1:22,False,8,2025-11-09T00:50:40Z
401826785113996178,113996178,Substitution,Malique Ewin subbing in for Arkansas,35,34,1st Half,1:22,False,8,2025-11-09T00:50:40Z
401826785113996183,113996183,MadeFreeThrow,Billy Richmond III made Free Throw.,36,34,1st Half,1:22,True,8,2025-11-09T00:50:51Z
401826785113996198,113996198,JumpShot,Jeremy Fears Jr. missed Jumper.,36,34,1st Half,1:09,False,127,2025-11-09T00:51:09Z
401826785113996199,113996199,Offensive Rebound,Jeremy Fears Jr. Offensive Rebound.,36,34,1st Half,1:06,False,127,2025-11-09T00:51:11Z
401826785113996200,113996200,LayUpShot,Jeremy Fears Jr. missed Layup.,36,34,1st Half,1:05,False,127,2025-11-09T00:51:13Z
401826785113996202,113996202,Offensive Rebound,Jaxon Kohler Offensive Rebound.,36,34,1st Half,1:03,False,127,2025-11-09T00:51:14Z
401826785113996203,113996203,Lost Ball Turnover,Jaxon Kohler Turnover.,36,34,1st Half,0:59,False,127,2025-11-09T00:51:17Z
401826785113996217,113996217,Steal,Meleek Thomas Steal.,36,34,1st Half,0:59,False,8,2025-11-09T00:51:17Z
401826785113996230,113996230,Lost Ball Turnover,Meleek Thomas Turnover.,36,34,1st Half,0:51,False,8,2025-11-09T00:51:31Z
401826785113996231,113996231,Steal,Cam Ward Steal.,36,34,1st Half,0:51,False,127,2025-11-09T00:51:31Z
401826785113996233,113996233,PersonalFoul,Foul on Meleek Thomas.,36,34,1st Half,0:51,False,8,2025-11-09T00:51:34Z
401826785113996258,113996258,MadeFreeThrow,Cam Ward missed Free Throw.,36,34,1st Half,0:51,False,127,2025-11-09T00:51:58Z
401826785113996259,113996259,Dead Ball Rebound,Michigan State Deadball Team Rebound.,36,34,1st Half,0:51,False,127,2025-11-09T00:51:58Z
401826785113996268,113996268,Substitution,Meleek Thomas subbing out for Arkansas,36,34,1st Half,0:51,False,8,2025-11-09T00:52:02Z
401826785113996269,113996269,Substitution,D.J. Wagner subbing in for Arkansas,36,34,1st Half,0:51,False,8,2025-11-09T00:52:02Z
401826785113996288,113996288,MadeFreeThrow,Cam Ward missed Free Throw.,36,34,1st Half,0:51,False,127,2025-11-09T00:52:23Z
401826785113996290,113996290,Defensive Rebound,Billy Richmond III Defensive Rebound.,36,34,1st Half,0:50,False,8,2025-11-09T00:52:25Z
401826785113996299,113996299,JumpShot,Darius Acuff Jr. made Three Point Jumper. Assisted by D.J. Wagner.,39,34,1st Half,0:34,True,8,2025-11-09T00:52:42Z
401826785113996320,113996320,JumpShot,Jeremy Fears Jr. missed Jumper.,39,34,1st Half,0:02,False,127,2025-11-09T00:53:13Z
401826785113996322,113996322,Offensive Rebound,Jaxon Kohler Offensive Rebound.,39,34,1st Half,0:00,False,127,2025-11-09T00:53:15Z
401826785113996324,113996324,JumpShot,Jaxon Kohler made Jumper.,39,36,1st Half,0:00,True,127,2025-11-09T00:53:16Z
401826785113996351,113996351,End Period,End of 1st half,39,36,1st Half,0:00,False,,2025-11-09T00:53:25Z
401826785113997321,113997321,Substitution,Cam Ward subbing out for Michigan State,39,36,2nd Half,20:00,False,127,2025-11-09T01:09:46Z
401826785113997324,113997324,Substitution,Carson Cooper subbing in for Michigan State,39,36,2nd Half,20:00,False,127,2025-11-09T01:09:46Z
401826785113997325,113997325,Substitution,Karter Knox subbing out for Arkansas,39,36,2nd Half,20:00,False,8,2025-11-09T01:09:46Z
401826785113997326,113997326,Substitution,Malique Ewin subbing out for Arkansas,39,36,2nd Half,20:00,False,8,2025-11-09T01:09:46Z
401826785113997327,113997327,Substitution,Trevon Brazile subbing in for Arkansas,39,36,2nd Half,20:00,False,8,2025-11-09T01:09:46Z
401826785113997328,113997328,Substitution,Nick Pringle subbing in for Arkansas,39,36,2nd Half,20:00,False,8,2025-11-09T01:09:46Z
401826785113997382,113997382,JumpShot,Trevon Brazile missed Jumper.,39,36,2nd Half,19:40,False,8,2025-11-09T01:10:26Z
401826785113997388,113997388,Offensive Rebound,Billy Richmond III Offensive Rebound.,39,36,2nd Half,19:36,False,8,2025-11-09T01:10:29Z
401826785113997403,113997403,Lost Ball Turnover,Nick Pringle Turnover.,39,36,2nd Half,19:21,False,8,2025-11-09T01:10:46Z
401826785113997439,113997439,JumpShot,Jaxon Kohler missed Three Point Jumper.,39,36,2nd Half,19:10,False,127,2025-11-09T01:11:04Z
401826785113997441,113997441,Offensive Rebound,Jordan Scott Offensive Rebound.,39,36,2nd Half,19:07,False,127,2025-11-09T01:11:06Z
401826785113997444,113997444,JumpShot,Jordan Scott missed Jumper.,39,36,2nd Half,19:05,False,127,2025-11-09T01:11:08Z
401826785113997476,113997476,Defensive Rebound,Trevon Brazile Defensive Rebound.,39,36,2nd Half,19:03,False,8,2025-11-09T01:11:10Z
401826785113997495,113997495,Lost Ball Turnover,Trevon Brazile Turnover.,39,36,2nd Half,18:49,False,8,2025-11-09T01:11:32Z
401826785113997496,113997496,Steal,Jeremy Fears Jr. Steal.,39,36,2nd Half,18:49,False,127,2025-11-09T01:11:32Z
401826785113997540,113997540,PersonalFoul,Foul on Trevon Brazile.,39,36,2nd Half,18:49,False,8,2025-11-09T01:12:03Z
401826785113997609,113997609,Substitution,Trevon Brazile subbing out for Arkansas,39,36,2nd Half,18:49,False,8,2025-11-09T01:12:29Z
401826785113997610,113997610,Substitution,Karter Knox subbing in for Arkansas,39,36,2nd Half,18:49,False,8,2025-11-09T01:12:29Z
401826785113997661,113997661,DunkShot,Carson Cooper made Dunk. Assisted by Jeremy Fears Jr..,39,38,2nd Half,18:22,True,127,2025-11-09T01:13:02Z
401826785113997673,113997673,PersonalFoul,Foul on Coen Carr.,39,38,2nd Half,18:10,False,127,2025-11-09T01:13:16Z
401826785113997772,113997772,JumpShot,Billy Richmond III missed Three Point Jumper.,39,38,2nd Half,18:01,False,8,2025-11-09T01:13:50Z
401826785113997773,113997773,Offensive Rebound,Nick Pringle Offensive Rebound.,39,38,2nd Half,17:58,False,8,2025-11-09T01:13:57Z
401826785113997792,113997792,PersonalFoul,Foul on Jordan Scott.,39,38,2nd Half,17:58,False,127,2025-11-09T01:13:59Z
401826785113997805,113997805,LayUpShot,D.J. Wagner made Layup. Assisted by Darius Acuff Jr..,41,38,2nd Half,17:56,True,8,2025-11-09T01:14:18Z
401826785113997856,113997856,JumpShot,Jaxon Kohler made Jumper.,41,40,2nd Half,17:33,True,127,2025-11-09T01:14:41Z
401826785113997917,113997917,PersonalFoul,Foul on Coen Carr.,41,40,2nd Half,17:09,False,127,2025-11-09T01:15:12Z
401826785113997973,113997973,MadeFreeThrow,Darius Acuff Jr. made Free Throw.,42,40,2nd Half,17:09,True,8,2025-11-09T01:15:30Z
401826785113997974,113997974,Substitution,Coen Carr subbing out for Michigan State,42,40,2nd Half,17:09,False,127,2025-11-09T01:15:36Z
401826785113997976,113997976,Substitution,Trey Fort subbing in for Michigan State,42,40,2nd Half,17:09,False,127,2025-11-09T01:15:36Z
401826785113997990,113997990,MadeFreeThrow,Darius Acuff Jr. missed Free Throw.,42,40,2nd Half,17:09,False,8,2025-11-09T01:15:45Z
401826785113997993,113997993,Defensive Rebound,Trey Fort Defensive Rebound.,42,40,2nd Half,17:08,False,127,2025-11-09T01:15:47Z
401826785113998012,113998012,LayUpShot,Carson Cooper missed Layup.,42,40,2nd Half,16:57,False,127,2025-11-09T01:15:58Z
401826785113998026,113998026,Offensive Rebound,Carson Cooper Offensive Rebound.,42,40,2nd Half,16:54,False,127,2025-11-09T01:16:01Z
401826785113998027,113998027,JumpShot,Trey Fort missed Jumper.,42,40,2nd Half,16:53,False,127,2025-11-09T01:16:02Z
401826785113998030,113998030,Offensive Rebound,Jaxon Kohler Offensive Rebound.,42,40,2nd Half,16:51,False,127,2025-11-09T01:16:04Z
401826785113998041,113998041,JumpShot,Trey Fort made Three Point Jumper. Assisted by Jeremy Fears Jr..,42,43,2nd Half,16:44,True,127,2025-11-09T01:16:11Z
401826785113998051,113998051,JumpShot,Darius Acuff Jr. missed Jumper.,42,43,2nd Half,16:33,False,8,2025-11-09T01:16:22Z
401826785113998054,113998054,Block Shot,Trey Fort Block.,42,43,2nd Half,16:33,False,127,2025-11-09T01:16:22Z
401826785113998056,113998056,Defensive Rebound,Carson Cooper Defensive Rebound.,42,43,2nd Half,16:30,False,127,2025-11-09T01:16:25Z
401826785113998057,113998057,LayUpShot,Jaxon Kohler made Layup. Assisted by Jeremy Fears Jr..,42,45,2nd Half,16:28,True,127,2025-11-09T01:16:27Z
401826785113998088,113998088,ShortTimeOut,Arkansas Timeout,42,45,2nd Half,16:27,False,8,2025-11-09T01:16:36Z
401826785113998090,113998090,OfficialTVTimeOut,Official TV Timeout,42,45,2nd Half,16:27,False,,2025-11-09T01:16:38Z
401826785113998439,113998439,Substitution,Darius Acuff Jr. subbing out for Arkansas,42,45,2nd Half,16:27,False,8,2025-11-09T01:19:53Z
401826785113998440,113998440,Substitution,Meleek Thomas subbing in for Arkansas,42,45,2nd Half,16:27,False,8,2025-11-09T01:19:53Z
401826785113998490,113998490,PersonalFoul,Foul on Jordan Scott.,42,45,2nd Half,16:12,False,127,2025-11-09T01:20:26Z
401826785113998502,113998502,MadeFreeThrow,Meleek Thomas made Free Throw.,43,45,2nd Half,16:12,True,8,2025-11-09T01:20:49Z
401826785113998531,113998531,MadeFreeThrow,Meleek Thomas made Free Throw.,44,45,2nd Half,16:12,True,8,2025-11-09T01:21:01Z
401826785113998558,113998558,Lost Ball Turnover,Trey Fort Turnover.,44,45,2nd Half,15:43,False,127,2025-11-09T01:21:33Z
401826785113998559,113998559,Steal,Nick Pringle Steal.,44,45,2nd Half,15:43,False,8,2025-11-09T01:21:33Z
401826785113998566,113998566,Lost Ball Turnover,Karter Knox Turnover.,44,45,2nd Half,15:38,False,8,2025-11-09T01:21:43Z
401826785113998574,113998574,OfficialTVTimeOut,Official TV Timeout,44,45,2nd Half,15:37,False,,2025-11-09T01:21:51Z
401826785113998865,113998865,Substitution,Jaxon Kohler subbing out for Michigan State,44,45,2nd Half,15:37,False,127,2025-11-09T01:24:59Z
401826785113998867,113998867,Substitution,Trey Fort subbing out for Michigan State,44,45,2nd Half,15:37,False,127,2025-11-09T01:24:59Z
401826785113998869,113998869,Substitution,Cam Ward subbing in for Michigan State,44,45,2nd Half,15:37,False,127,2025-11-09T01:24:59Z
401826785113998872,113998872,Substitution,Divine Ugochukwu subbing in for Michigan State,44,45,2nd Half,15:37,False,127,2025-11-09T01:24:59Z
401826785113998875,113998875,Substitution,Nick Pringle subbing out for Arkansas,44,45,2nd Half,15:37,False,8,2025-11-09T01:24:59Z
401826785113998876,113998876,Substitution,Malique Ewin subbing in for Arkansas,44,45,2nd Half,15:37,False,8,2025-11-09T01:24:59Z
401826785113998926,113998926,LayUpShot,Jordan Scott made Layup. Assisted by Carson Cooper.,44,47,2nd Half,15:24,True,127,2025-11-09T01:25:30Z
401826785113998966,113998966,JumpShot,Karter Knox missed Three Point Jumper.,44,47,2nd Half,14:57,False,8,2025-11-09T01:25:58Z
401826785113998968,113998968,Defensive Rebound,Cam Ward Defensive Rebound.,44,47,2nd Half,14:54,False,127,2025-11-09T01:25:59Z
401826785113999008,113999008,PersonalFoul,Foul on D.J. Wagner.,44,47,2nd Half,14:35,False,8,2025-11-09T01:26:22Z
401826785113999071,113999071,MadeFreeThrow,Carson Cooper made Free Throw.,44,48,2nd Half,14:35,True,127,2025-11-09T01:26:52Z
401826785113999074,113999074,Substitution,Jordan Scott subbing out for Michigan State,44,48,2nd Half,14:35,False,127,2025-11-09T01:26:59Z
401826785113999083,113999083,Substitution,Trey Fort subbing in for Michigan State,44,48,2nd Half,14:35,False,127,2025-11-09T01:26:59Z
401826785113999084,113999084,Substitution,Karter Knox subbing out for Arkansas,44,48,2nd Half,14:35,False,8,2025-11-09T01:26:59Z
401826785113999087,113999087,Substitution,D.J. Wagner subbing out for Arkansas,44,48,2nd Half,14:35,False,8,2025-11-09T01:26:59Z
401826785113999090,113999090,Substitution,Darius Acuff Jr. subbing in for Arkansas,44,48,2nd Half,14:35,False,8,2025-11-09T01:26:59Z
401826785113999093,113999093,Substitution,Trevon Brazile subbing in for Arkansas,44,48,2nd Half,14:35,False,8,2025-11-09T01:26:59Z
401826785113999105,113999105,MadeFreeThrow,Carson Cooper made Free Throw.,44,49,2nd Half,14:35,True,127,2025-11-09T01:27:14Z
401826785113999129,113999129,JumpShot,Meleek Thomas missed Three Point Jumper.,44,49,2nd Half,14:17,False,8,2025-11-09T01:27:36Z
401826785113999131,113999131,Defensive Rebound,Cam Ward Defensive Rebound.,44,49,2nd Half,14:14,False,127,2025-11-09T01:27:37Z
401826785113999137,113999137,JumpShot,Trey Fort missed Three Point Jumper.,44,49,2nd Half,14:08,False,127,2025-11-09T01:27:45Z
401826785113999139,113999139,Defensive Rebound,Meleek Thomas Defensive Rebound.,44,49,2nd Half,14:05,False,8,2025-11-09T01:27:47Z
401826785113999168,113999168,LayUpShot,Darius Acuff Jr. made Layup.,46,49,2nd Half,14:00,True,8,2025-11-09T01:27:52Z
401826785113999201,113999201,PersonalFoul,Foul on Meleek Thomas.,46,49,2nd Half,13:31,False,8,2025-11-09T01:28:23Z
401826785113999243,113999243,MadeFreeThrow,Cam Ward made Free Throw.,46,50,2nd Half,13:31,True,127,2025-11-09T01:28:49Z
401826785113999257,113999257,Substitution,Carson Cooper subbing out for Michigan State,46,50,2nd Half,13:31,False,127,2025-11-09T01:28:53Z
401826785113999259,113999259,Substitution,Jaxon Kohler subbing in for Michigan State,46,50,2nd Half,13:31,False,127,2025-11-09T01:28:53Z
401826785113999269,113999269,MadeFreeThrow,Cam Ward made Free Throw.,46,51,2nd Half,13:31,True,127,2025-11-09T01:29:08Z
401826785113999284,113999284,JumpShot,Malique Ewin missed Jumper.,46,51,2nd Half,13:15,False,8,2025-11-09T01:29:27Z
401826785113999318,113999318,Defensive Rebound,Cam Ward Defensive Rebound.,46,51,2nd Half,13:12,False,127,2025-11-09T01:29:30Z
401826785113999319,113999319,Lost Ball Turnover,Cam Ward Turnover.,46,51,2nd Half,13:05,False,127,2025-11-09T01:29:37Z
401826785113999321,113999321,Steal,Trevon Brazile Steal.,46,51,2nd Half,13:05,False,8,2025-11-09T01:29:37Z
401826785113999327,113999327,PersonalFoul,Foul on Jeremy Fears Jr..,46,51,2nd Half,12:59,False,127,2025-11-09T01:29:45Z
401826785113999383,113999383,MadeFreeThrow,Meleek Thomas made Free Throw.,47,51,2nd Half,12:59,True,8,2025-11-09T01:30:17Z
401826785113999423,113999423,Substitution,Jeremy Fears Jr. subbing out for Michigan State,47,51,2nd Half,12:59,False,127,2025-11-09T01:30:24Z
401826785113999425,113999425,Substitution,Jordan Scott subbing in for Michigan State,47,51,2nd Half,12:59,False,127,2025-11-09T01:30:24Z
401826785113999438,113999438,MadeFreeThrow,Meleek Thomas made Free Throw.,48,51,2nd Half,12:59,True,8,2025-11-09T01:30:41Z
401826785113999506,113999506,JumpShot,Trey Fort missed Three Point Jumper.,48,51,2nd Half,12:35,False,127,2025-11-09T01:31:12Z
401826785113999508,113999508,Offensive Rebound,Jordan Scott Offensive Rebound.,48,51,2nd Half,12:33,False,127,2025-11-09T01:31:14Z
401826785113999510,113999510,LayUpShot,Jordan Scott made Layup.,48,53,2nd Half,12:32,True,127,2025-11-09T01:31:14Z
401826785113999525,113999525,JumpShot,Meleek Thomas missed Three Point Jumper.,48,53,2nd Half,12:10,False,8,2025-11-09T01:31:37Z
401826785113999526,113999526,Defensive Rebound,Cam Ward Defensive Rebound.,48,53,2nd Half,12:08,False,127,2025-11-09T01:31:38Z
401826785113999544,113999544,OfficialTVTimeOut,Official TV Timeout,48,53,2nd Half,11:53,False,,2025-11-09T01:31:54Z
401826785113999962,113999962,Substitution,Divine Ugochukwu subbing out for Michigan State,48,53,2nd Half,11:53,False,127,2025-11-09T01:35:52Z
401826785113999963,113999963,Substitution,Jeremy Fears Jr. subbing in for Michigan State,48,53,2nd Half,11:53,False,127,2025-11-09T01:35:52Z
401826785113999964,113999964,Substitution,Billy Richmond III subbing out for Arkansas,48,53,2nd Half,11:53,False,8,2025-11-09T01:35:52Z
401826785113999965,113999965,Substitution,D.J. Wagner subbing in for Arkansas,48,53,2nd Half,11:53,False,8,2025-11-09T01:35:52Z
401826785113999981,113999981,Lost Ball Turnover,Trey Fort Turnover.,48,53,2nd Half,11:52,False,127,2025-11-09T01:36:16Z
401826785114000049,114000049,JumpShot,Malique Ewin made Jumper. Assisted by Meleek Thomas.,50,53,2nd Half,11:36,True,8,2025-11-09T01:36:40Z
401826785114000061,114000061,JumpShot,Jaxon Kohler missed Three Point Jumper.,50,53,2nd Half,11:19,False,127,2025-11-09T01:36:57Z
401826785114000062,114000062,Offensive Rebound,Trey Fort Offensive Rebound.,50,53,2nd Half,11:16,False,127,2025-11-09T01:36:59Z
401826785114000074,114000074,DunkShot,Cam Ward made Dunk. Assisted by Jaxon Kohler.,50,55,2nd Half,11:10,True,127,2025-11-09T01:37:05Z
401826785114000151,114000151,JumpShot,Darius Acuff Jr. missed Three Point Jumper.,50,55,2nd Half,10:39,False,8,2025-11-09T01:37:36Z
401826785114000153,114000153,Defensive Rebound,Jordan Scott Defensive Rebound.,50,55,2nd Half,10:36,False,127,2025-11-09T01:37:39Z
401826785114000161,114000161,Lost Ball Turnover,Jeremy Fears Jr. Turnover.,50,55,2nd Half,10:30,False,127,2025-11-09T01:37:45Z
401826785114000162,114000162,Steal,D.J. Wagner Steal.,50,55,2nd Half,10:30,False,8,2025-11-09T01:37:45Z
401826785114000163,114000163,DunkShot,Trevon Brazile made Dunk. Assisted by D.J. Wagner.,52,55,2nd Half,10:26,True,8,2025-11-09T01:37:49Z
401826785114000199,114000199,Substitution,Cam Ward subbing out for Michigan State,52,55,2nd Half,10:24,False,127,2025-11-09T01:38:08Z
401826785114000201,114000201,Substitution,Trey Fort subbing out for Michigan State,52,55,2nd Half,10:24,False,127,2025-11-09T01:38:08Z
401826785114000203,114000203,Substitution,Carson Cooper subbing in for Michigan State,52,55,2nd Half,10:24,False,127,2025-11-09T01:38:08Z
401826785114000204,114000204,Substitution,Coen Carr subbing in for Michigan State,52,55,2nd Half,10:24,False,127,2025-11-09T01:38:08Z
401826785114000229,114000229,JumpShot,Jaxon Kohler made Jumper. Assisted by Carson Cooper.,52,57,2nd Half,10:09,True,127,2025-11-09T01:38:29Z
401826785114000285,114000285,PersonalFoul,Foul on Jaxon Kohler.,52,57,2nd Half,9:41,False,127,2025-11-09T01:39:04Z
401826785114000319,114000319,MadeFreeThrow,Darius Acuff Jr. made Free Throw.,53,57,2nd Half,9:41,True,8,2025-11-09T01:39:25Z
401826785114000338,114000338,Substitution,D.J. Wagner subbing out for Arkansas,53,57,2nd Half,9:41,False,8,2025-11-09T01:39:42Z
401826785114000339,114000339,Substitution,Karter Knox subbing in for Arkansas,53,57,2nd Half,9:41,False,8,2025-11-09T01:39:42Z
401826785114000351,114000351,MadeFreeThrow,Darius Acuff Jr. missed Free Throw.,53,57,2nd Half,9:41,False,8,2025-11-09T01:39:52Z
401826785114000352,114000352,Offensive Rebound,Malique Ewin Offensive Rebound.,53,57,2nd Half,9:40,False,8,2025-11-09T01:39:54Z
401826785114000353,114000353,JumpShot,Meleek Thomas missed Three Point Jumper.,53,57,2nd Half,9:38,False,8,2025-11-09T01:39:58Z
401826785114000354,114000354,Defensive Rebound,Coen Carr Defensive Rebound.,53,57,2nd Half,9:35,False,127,2025-11-09T01:39:59Z
401826785114000408,114000408,DunkShot,Carson Cooper made Dunk. Assisted by Jeremy Fears Jr..,53,59,2nd Half,9:18,True,127,2025-11-09T01:40:16Z
401826785114000437,114000437,ShortTimeOut,Arkansas Timeout,53,59,2nd Half,9:05,False,8,2025-11-09T01:40:33Z
401826785114000536,114000536,Substitution,Karter Knox subbing out for Arkansas,53,59,2nd Half,9:05,False,8,2025-11-09T01:41:32Z
401826785114000537,114000537,Substitution,Billy Richmond III subbing in for Arkansas,53,59,2nd Half,9:05,False,8,2025-11-09T01:41:32Z
401826785114000569,114000569,JumpShot,Trevon Brazile missed Jumper.,53,59,2nd Half,8:54,False,8,2025-11-09T01:41:57Z
401826785114000570,114000570,Defensive Rebound,Jordan Scott Defensive Rebound.,53,59,2nd Half,8:51,False,127,2025-11-09T01:41:59Z
401826785114000579,114000579,LayUpShot,Jaxon Kohler missed Layup.,53,59,2nd Half,8:40,False,127,2025-11-09T01:42:10Z
401826785114000615,114000615,Block Shot,Trevon Brazile Block.,53,59,2nd Half,8:40,False,8,2025-11-09T01:42:10Z
401826785114000617,114000617,Offensive Rebound,Michigan State Offensive Rebound.,53,59,2nd Half,8:39,False,127,2025-11-09T01:42:14Z
401826785114000628,114000628,Substitution,Malique Ewin subbing out for Arkansas,53,59,2nd Half,8:39,False,8,2025-11-09T01:42:26Z
401826785114000629,114000629,Substitution,Nick Pringle subbing in for Arkansas,53,59,2nd Half,8:39,False,8,2025-11-09T01:42:26Z
401826785114000692,114000692,Lost Ball Turnover,Jeremy Fears Jr. Turnover.,53,59,2nd Half,8:22,False,127,2025-11-09T01:42:56Z
401826785114000737,114000737,JumpShot,Billy Richmond III missed Three Point Jumper.,53,59,2nd Half,8:00,False,8,2025-11-09T01:43:25Z
401826785114000738,114000738,Defensive Rebound,Michigan State Defensive Rebound.,53,59,2nd Half,7:56,False,127,2025-11-09T01:43:30Z
401826785114000749,114000749,OfficialTVTimeOut,Official TV Timeout,53,59,2nd Half,7:56,False,,2025-11-09T01:43:31Z
401826785114001026,114001026,Substitution,Jeremy Fears Jr. subbing out for Michigan State,53,59,2nd Half,7:56,False,127,2025-11-09T01:46:48Z
401826785114001027,114001027,Substitution,Divine Ugochukwu subbing in for Michigan State,53,59,2nd Half,7:56,False,127,2025-11-09T01:46:48Z
401826785114001088,114001088,PersonalFoul,Foul on Trevon Brazile.,53,59,2nd Half,7:37,False,8,2025-11-09T01:47:31Z
401826785114001096,114001096,Substitution,Cam Ward subbing in for Michigan State,53,59,2nd Half,7:37,False,127,2025-11-09T01:47:54Z
401826785114001097,114001097,Substitution,Trevon Brazile subbing out for Arkansas,53,59,2nd Half,7:37,False,8,2025-11-09T01:47:54Z
401826785114001098,114001098,Substitution,Karter Knox subbing in for Arkansas,53,59,2nd Half,7:37,False,8,2025-11-09T01:47:54Z
401826785114001099,114001099,Substitution,Jaxon Kohler subbing out for Michigan State,53,59,2nd Half,7:37,False,127,2025-11-09T01:47:59Z
401826785114001104,114001104,JumpShot,Divine Ugochukwu missed Jumper.,53,59,2nd Half,7:19,False,127,2025-11-09T01:48:19Z
401826785114001171,114001171,Block Shot,Nick Pringle Block.,53,59,2nd Half,7:19,False,8,2025-11-09T01:48:19Z
401826785114001172,114001172,Offensive Rebound,Divine Ugochukwu Offensive Rebound.,53,59,2nd Half,7:16,False,127,2025-11-09T01:48:22Z
401826785114001173,114001173,LayUpShot,Divine Ugochukwu missed Layup.,53,59,2nd Half,7:16,False,127,2025-11-09T01:48:23Z
401826785114001174,114001174,Offensive Rebound,Cam Ward Offensive Rebound.,53,59,2nd Half,7:13,False,127,2025-11-09T01:48:25Z
401826785114001227,114001227,PersonalFoul,Foul on Billy Richmond III.,53,59,2nd Half,7:06,False,8,2025-11-09T01:48:46Z
401826785114001239,114001239,MadeFreeThrow,Coen Carr made Free Throw.,53,60,2nd Half,7:06,True,127,2025-11-09T01:48:59Z
401826785114001243,114001243,Substitution,Billy Richmond III subbing out for Arkansas,53,60,2nd Half,7:06,False,8,2025-11-09T01:49:03Z
401826785114001244,114001244,Substitution,D.J. Wagner subbing in for Arkansas,53,60,2nd Half,7:06,False,8,2025-11-09T01:49:03Z
