play_id,sequence_number,type,description,away_score,home_score,period,clock,scoring_play,team_id,timestamp_utc
401823724113738016,113738016,JumpShot,Mason Lavergne made Three Point Jumper. Assisted by Tim Barton.,40,89,2nd Half,4:36,True,2383,2025-11-05T01:34:06Z
401823724113738109,113738109,JumpShot,Fallou Gueye missed Three Point Jumper.,40,89,2nd Half,4:22,False,2529,2025-11-05T01:34:20Z
401823724113738110,113738110,Defensive Rebound,Jack Flannery Defensive Rebound.,40,89,2nd Half,4:18,False,2383,2025-11-05T01:34:23Z
401823724113738190,113738190,LayUpShot,Mason Lavergne made Layup.,42,89,2nd Half,4:01,True,2383,2025-11-05T01:34:40Z
401823724113738296,113738296,JumpShot,Abdou Yadd missed Three Point Jumper.,42,89,2nd Half,3:42,False,2529,2025-11-05T01:35:13Z
401823724113738298,113738298,Offensive Rebound,Abdou Yadd Offensive Rebound.,42,89,2nd Half,3:40,False,2529,2025-11-05T01:35:15Z
401823724113738369,113738369,JumpShot,Taj Bryant made Three Point Jumper. Assisted by Abdou Yadd.,42,92,2nd Half,3:36,True,2529,2025-11-05T01:35:19Z
401823724113738379,113738379,JumpShot,Tim Barton missed Jumper.,42,92,2nd Half,3:24,False,2383,2025-11-05T01:35:31Z
401823724113738380,113738380,Defensive Rebound,Lucius Gibson-Savadel Defensive Rebound.,42,92,2nd Half,3:22,False,2529,2025-11-05T01:35:33Z
401823724113738381,113738381,DunkShot,Jaden Slaughter made Dunk. Assisted by Lucius Gibson-Savadel.,42,94,2nd Half,3:19,True,2529,2025-11-05T01:35:36Z
401823724113738531,113738531,RegularTimeOut,Sacred Heart Timeout,42,94,2nd Half,3:16,False,2529,2025-11-05T01:36:02Z
401823724113738918,113738918,Substitution,Taj Bryant subbing out for Sacred Heart,42,94,2nd Half,3:16,False,2529,2025-11-05T01:37:47Z
401823724113738920,113738920,Substitution,Abdou Yadd subbing out for Sacred Heart,42,94,2nd Half,3:16,False,2529,2025-11-05T01:37:47Z
401823724113738921,113738921,Substitution,Jeremiah Jacobs subbing in for Sacred Heart,42,94,2nd Half,3:16,False,2529,2025-11-05T01:37:47Z
401823724113738922,113738922,Substitution,Malik Sheppard subbing in for Sacred Heart,42,94,2nd Half,3:16,False,2529,2025-11-05T01:37:47Z
401823724113739057,113739057,JumpShot,Colin Hart missed Three Point Jumper.,42,94,2nd Half,3:03,False,2383,2025-11-05T01:38:12Z
401823724113739058,113739058,Defensive Rebound,Jeremiah Jacobs Defensive Rebound.,42,94,2nd Half,3:00,False,2529,2025-11-05T01:38:14Z
401823724113739127,113739127,JumpShot,Jaden Slaughter made Three Point Jumper. Assisted by Lucius Gibson-Savadel.,42,97,2nd Half,2:50,True,2529,2025-11-05T01:38:27Z
401823724113739253,113739253,PersonalFoul,Foul on Fallou Gueye.,42,97,2nd Half,2:26,False,2529,2025-11-05T01:38:55Z
401823724113739296,113739296,Substitution,Lucius Gibson-Savadel subbing out for Sacred Heart,42,97,2nd Half,2:26,False,2529,2025-11-05T01:39:09Z
401823724113739297,113739297,Substitution,Alex Woodring subbing in for Sacred Heart,42,97,2nd Half,2:26,False,2529,2025-11-05T01:39:09Z
401823724113739375,113739375,Lost Ball Turnover,Tim Barton Turnover.,42,97,2nd Half,2:21,False,2383,2025-11-05T01:39:22Z
401823724113739464,113739464,JumpShot,Malik Sheppard missed Three Point Jumper.,42,97,2nd Half,2:03,False,2529,2025-11-05T01:39:53Z
401823724113739465,113739465,Defensive Rebound,Aaron Zalescik Defensive Rebound.,42,97,2nd Half,2:00,False,2383,2025-11-05T01:39:55Z
401823724113739587,113739587,Lost Ball Turnover,Colin Hart Turnover.,42,97,2nd Half,1:38,False,2383,2025-11-05T01:40:18Z
401823724113739715,113739715,LayUpShot,Jeremiah Jacobs made Layup.,42,99,2nd Half,1:25,True,2529,2025-11-05T01:40:39Z
401823724113739770,113739770,JumpShot,Aaron Zalescik made Three Point Jumper. Assisted by Tim Barton.,45,99,2nd Half,1:05,True,2383,2025-11-05T01:41:00Z
401823724113739843,113739843,JumpShot,Jeremiah Jacobs made Jumper.,45,101,2nd Half,0:44,True,2529,2025-11-05T01:41:20Z
401823724113739897,113739897,Lost Ball Turnover,Aaron Zalescik Turnover.,45,101,2nd Half,0:32,False,2383,2025-11-05T01:41:33Z
401823724113739898,113739898,Steal,Fallou Gueye Steal.,45,101,2nd Half,0:32,False,2529,2025-11-05T01:41:33Z
401823724113739899,113739899,DunkShot,Fallou Gueye made Dunk.,45,103,2nd Half,0:29,True,2529,2025-11-05T01:41:35Z
401823724113739948,113739948,JumpShot,Tim Barton missed Three Point Jumper.,45,103,2nd Half,0:24,False,2383,2025-11-05T01:41:42Z
401823724113739951,113739951,Offensive Rebound,Colin Hart Offensive Rebound.,45,103,2nd Half,0:20,False,2383,2025-11-05T01:41:48Z
401823724113739959,113739959,PersonalFoul,Foul on Malik Sheppard.,45,103,2nd Half,0:20,False,2529,2025-11-05T01:41:55Z
401823724113740087,113740087,MadeFreeThrow,Jack Flannery missed Free Throw.,45,103,2nd Half,0:20,False,2383,2025-11-05T01:42:09Z
401823724113740089,113740089,Dead Ball Rebound,Merchant Marine Academy Deadball Team Rebound.,45,103,2nd Half,0:20,False,2383,2025-11-05T01:42:09Z
401823724113740100,113740100,Substitution,Tim Barton subbing out for Merchant Marine Academy,45,103,2nd Half,0:20,False,2383,2025-11-05T01:42:32Z
401823724113740102,113740102,Substitution,Mason Lavergne subbing out for Merchant Marine Academy,45,103,2nd Half,0:20,False,2383,2025-11-05T01:42:32Z
401823724113740104,113740104,Substitution,Colin Hart subbing out for Merchant Marine Academy,45,103,2nd Half,0:20,False,2383,2025-11-05T01:42:32Z
401823724113740105,113740105,Substitution,Jack van de Erve subbing in for Merchant Marine Academy,45,103,2nd Half,0:20,False,2383,2025-11-05T01:42:32Z
401823724113740146,113740146,Substitution,Aaron Braxton subbing in for Merchant Marine Academy,45,103,2nd Half,0:20,False,2383,2025-11-05T01:42:32Z
401823724113740147,113740147,Substitution,Ronnie Fazio subbing in for Merchant Marine Academy,45,103,2nd Half,0:20,False,2383,2025-11-05T01:42:32Z
401823724113740154,113740154,MadeFreeThrow,Jack Flannery made Free Throw.,46,103,2nd Half,0:20,True,2383,2025-11-05T01:42:41Z
401823724113740319,113740319,End Period,End of 2nd half,46,103,2nd Half,0:00,False,,2025-11-05T01:43:23Z
401823724113740325,113740325,End Game,End of Game,46,103,2nd Half,0:00,False,,2025-11-05T01:43:39Z
