play_id,sequence_number,type,description,away_score,home_score,period,clock,scoring_play,team_id,timestamp_utc
401823325114804890,114804890,Offensive Rebound,Michael Osei-Bonsu Offensive Rebound.,65,56,2nd Half,3:32,False,2623,2025-11-22T23:42:53Z
401823325114804891,114804891,JumpShot,Michael Osei-Bonsu missed Jumper.,65,56,2nd Half,3:31,False,2623,2025-11-22T23:42:55Z
401823325114804892,114804892,Defensive Rebound,Filip Brankovic Defensive Rebound.,65,56,2nd Half,3:28,False,292,2025-11-22T23:42:58Z
401823325114804907,114804907,Lost Ball Turnover,Filip Brankovic Turnover.,65,56,2nd Half,3:18,False,292,2025-11-22T23:43:12Z
401823325114804942,114804942,PersonalFoul,Foul on Filip Brankovic.,65,56,2nd Half,3:07,False,292,2025-11-22T23:43:34Z
401823325114804968,114804968,MadeFreeThrow,Michael Osei-Bonsu made Free Throw.,65,57,2nd Half,3:07,True,2623,2025-11-22T23:43:55Z
401823325114805045,114805045,MadeFreeThrow,Michael Osei-Bonsu missed Free Throw.,65,57,2nd Half,3:07,False,2623,2025-11-22T23:44:34Z
401823325114805067,114805067,Offensive Rebound,Keith Palek III Offensive Rebound.,65,57,2nd Half,3:06,False,2623,2025-11-22T23:44:35Z
401823325114805069,114805069,JumpShot,Keith Palek III made Three Point Jumper. Assisted by Zaxton King.,65,60,2nd Half,3:03,True,2623,2025-11-22T23:44:39Z
401823325114805172,114805172,PersonalFoul,Foul on Kye Dickson.,65,60,2nd Half,2:33,False,292,2025-11-22T23:45:15Z
401823325114805173,114805173,Lost Ball Turnover,Kye Dickson Turnover.,65,60,2nd Half,2:33,False,292,2025-11-22T23:45:15Z
401823325114805213,114805213,Substitution,Kye Dickson subbing out for UT Rio Grande Valley,65,60,2nd Half,2:33,False,292,2025-11-22T23:45:32Z
401823325114805214,114805214,Substitution,Filip Brankovic subbing out for UT Rio Grande Valley,65,60,2nd Half,2:33,False,292,2025-11-22T23:45:32Z
401823325114805215,114805215,Substitution,Dane Christensen subbing in for UT Rio Grande Valley,65,60,2nd Half,2:33,False,292,2025-11-22T23:45:32Z
401823325114805216,114805216,Substitution,Marvin McGhee III subbing in for UT Rio Grande Valley,65,60,2nd Half,2:33,False,292,2025-11-22T23:45:32Z
401823325114805245,114805245,JumpShot,Kobi Williams made Three Point Jumper. Assisted by Keith Palek III.,65,63,2nd Half,2:23,True,2623,2025-11-22T23:45:51Z
401823325114805268,114805268,LayUpShot,Koree Cotton made Layup.,67,63,2nd Half,2:05,True,292,2025-11-22T23:46:07Z
401823325114805289,114805289,JumpShot,Trey Williams Jr. missed Three Point Jumper.,67,63,2nd Half,1:46,False,2623,2025-11-22T23:46:27Z
401823325114805290,114805290,Dead Ball Rebound,Missouri State Deadball Team Rebound.,67,63,2nd Half,1:43,False,2623,2025-11-22T23:46:33Z
401823325114805297,114805297,PersonalFoul,Foul on Dane Christensen.,67,63,2nd Half,1:43,False,292,2025-11-22T23:46:34Z
401823325114805333,114805333,MadeFreeThrow,Michael Osei-Bonsu made Free Throw.,67,64,2nd Half,1:43,True,2623,2025-11-22T23:46:56Z
401823325114805397,114805397,MadeFreeThrow,Michael Osei-Bonsu missed Free Throw.,67,64,2nd Half,1:43,False,2623,2025-11-22T23:47:17Z
401823325114805398,114805398,Offensive Rebound,Missouri State Offensive Rebound.,67,64,2nd Half,1:42,False,2623,2025-11-22T23:47:21Z
401823325114805542,114805542,LayUpShot,Michael Osei-Bonsu made Layup.,67,66,2nd Half,1:35,True,2623,2025-11-22T23:50:01Z
401823325114805573,114805573,PersonalFoul,Foul on Zae Blake.,67,66,2nd Half,1:17,False,292,2025-11-22T23:50:25Z
401823325114805574,114805574,Lost Ball Turnover,Zae Blake Turnover.,67,66,2nd Half,1:17,False,292,2025-11-22T23:50:25Z
401823325114805630,114805630,ShortTimeOut,UT Rio Grande Valley Timeout,67,66,2nd Half,1:17,False,292,2025-11-22T23:50:49Z
401823325114805710,114805710,PersonalFoul,Foul on Zae Blake.,67,66,2nd Half,1:09,False,292,2025-11-22T23:52:01Z
401823325114805723,114805723,MadeFreeThrow,Kobi Williams made Free Throw.,67,67,2nd Half,1:09,True,2623,2025-11-22T23:52:20Z
401823325114805749,114805749,Substitution,Dane Christensen subbing out for UT Rio Grande Valley,67,67,2nd Half,1:09,False,292,2025-11-22T23:52:27Z
401823325114805750,114805750,Substitution,Filip Brankovic subbing in for UT Rio Grande Valley,67,67,2nd Half,1:09,False,292,2025-11-22T23:52:27Z
401823325114805759,114805759,MadeFreeThrow,Kobi Williams made Free Throw.,67,68,2nd Half,1:09,True,2623,2025-11-22T23:52:40Z
401823325114805762,114805762,ShortTimeOut,Missouri State Timeout,67,68,2nd Half,1:09,False,2623,2025-11-22T23:52:51Z
401823325114805861,114805861,Lost Ball Turnover,Zae Blake Turnover.,67,68,2nd Half,0:45,False,292,2025-11-22T23:54:06Z
401823325114805862,114805862,Steal,Keith Palek III Steal.,67,68,2nd Half,0:45,False,2623,2025-11-22T23:54:06Z
401823325114805869,114805869,PersonalFoul,Foul on Koree Cotton.,67,68,2nd Half,0:30,False,292,2025-11-22T23:54:26Z
401823325114805882,114805882,MadeFreeThrow,Keith Palek III made Free Throw.,67,69,2nd Half,0:30,True,2623,2025-11-22T23:54:46Z
401823325114805922,114805922,MadeFreeThrow,Keith Palek III made Free Throw.,67,70,2nd Half,0:30,True,2623,2025-11-22T23:55:05Z
401823325114805972,114805972,RegularTimeOut,UT Rio Grande Valley Timeout,67,70,2nd Half,0:27,False,292,2025-11-22T23:55:20Z
401823325114806105,114806105,JumpShot,Marvin McGhee III missed Three Point Jumper.,67,70,2nd Half,0:16,False,292,2025-11-22T23:56:51Z
401823325114806106,114806106,Defensive Rebound,Keith Palek III Defensive Rebound.,67,70,2nd Half,0:14,False,2623,2025-11-22T23:56:54Z
401823325114806123,114806123,PersonalFoul,Foul on Jaylen Washington.,67,70,2nd Half,0:14,False,292,2025-11-22T23:56:57Z
401823325114806153,114806153,MadeFreeThrow,Keith Palek III made Free Throw.,67,71,2nd Half,0:14,True,2623,2025-11-22T23:57:18Z
401823325114806162,114806162,MadeFreeThrow,Keith Palek III made Free Throw.,67,72,2nd Half,0:14,True,2623,2025-11-22T23:57:32Z
401823325114806189,114806189,JumpShot,Koree Cotton missed Three Point Jumper.,67,72,2nd Half,0:10,False,292,2025-11-22T23:57:42Z
401823325114806194,114806194,Defensive Rebound,Zaxton King Defensive Rebound.,67,72,2nd Half,0:06,False,2623,2025-11-22T23:57:47Z
401823325114806197,114806197,PersonalFoul,Foul on Jaylen Washington.,67,72,2nd Half,0:06,False,292,2025-11-22T23:57:52Z
401823325114806208,114806208,MadeFreeThrow,Zaxton King made Free Throw.,67,73,2nd Half,0:06,True,2623,2025-11-22T23:58:16Z
401823325114806212,114806212,MadeFreeThrow,Zaxton King made Free Throw.,67,74,2nd Half,0:06,True,2623,2025-11-22T23:58:31Z
401823325114806216,114806216,JumpShot,Zae Blake missed Three Point Jumper.,67,74,2nd Half,0:01,False,292,2025-11-22T23:58:43Z
401823325114806221,114806221,Dead Ball Rebound,Missouri State Deadball Team Rebound.,67,74,2nd Half,0:00,False,2623,2025-11-22T23:58:46Z
401823325114806222,114806222,End Period,End of 2nd half,67,74,2nd Half,0:00,False,,2025-11-22T23:58:50Z
401823325114806223,114806223,End Game,End of Game,67,74,2nd Half,0:00,False,,2025-11-22T23:58:53Z
