play_id,sequence_number,type,description,away_score,home_score,period,clock,scoring_play,team_id,timestamp_utc
401826785114001271,114001271,MadeFreeThrow,Coen Carr made Free Throw.,53,61,2nd Half,7:06,True,127,2025-11-09T01:49:16Z
401826785114001278,114001278,JumpShot,D.J. Wagner made Three Point Jumper. Assisted by Darius Acuff Jr..,56,61,2nd Half,6:55,True,8,2025-11-09T01:49:32Z
401826785114001351,114001351,DunkShot,Cam Ward made Dunk. Assisted by Divine Ugochukwu.,56,63,2nd Half,6:26,True,127,2025-11-09T01:50:00Z
401826785114001361,114001361,PersonalFoul,Foul on Divine Ugochukwu.,56,63,2nd Half,6:13,False,127,2025-11-09T01:50:15Z
401826785114001389,114001389,Substitution,Divine Ugochukwu subbing out for Michigan State,56,63,2nd Half,6:13,False,127,2025-11-09T01:50:23Z
401826785114001390,114001390,Substitution,Jeremy Fears Jr. subbing in for Michigan State,56,63,2nd Half,6:13,False,127,2025-11-09T01:50:23Z
401826785114001399,114001399,MadeFreeThrow,Darius Acuff Jr. made Free Throw.,57,63,2nd Half,6:13,True,8,2025-11-09T01:50:46Z
401826785114001402,114001402,MadeFreeThrow,Darius Acuff Jr. made Free Throw.,58,63,2nd Half,6:13,True,8,2025-11-09T01:50:59Z
401826785114001451,114001451,JumpShot,Carson Cooper made Jumper. Assisted by Jeremy Fears Jr..,58,65,2nd Half,6:02,True,127,2025-11-09T01:51:14Z
401826785114001453,114001453,JumpShot,Darius Acuff Jr. missed Three Point Jumper.,58,65,2nd Half,5:52,False,8,2025-11-09T01:51:23Z
401826785114001454,114001454,Defensive Rebound,Coen Carr Defensive Rebound.,58,65,2nd Half,5:49,False,127,2025-11-09T01:51:27Z
401826785114001506,114001506,PersonalFoul,Foul on Nick Pringle.,58,65,2nd Half,5:49,False,8,2025-11-09T01:51:39Z
401826785114001571,114001571,Substitution,Jordan Scott subbing out for Michigan State,58,65,2nd Half,5:49,False,127,2025-11-09T01:52:53Z
401826785114001572,114001572,Substitution,Divine Ugochukwu subbing in for Michigan State,58,65,2nd Half,5:49,False,127,2025-11-09T01:52:53Z
401826785114001677,114001677,Substitution,Karter Knox subbing out for Arkansas,58,65,2nd Half,5:49,False,8,2025-11-09T01:54:08Z
401826785114001678,114001678,Substitution,Malique Ewin subbing in for Arkansas,58,65,2nd Half,5:49,False,8,2025-11-09T01:54:08Z
401826785114001564,114001564,LayUpShot,Cam Ward missed Layup.,58,65,2nd Half,5:31,False,127,2025-11-09T01:52:21Z
401826785114001565,114001565,Block Shot,Malique Ewin Block.,58,65,2nd Half,5:31,False,8,2025-11-09T01:52:21Z
401826785114001566,114001566,Offensive Rebound,Michigan State Offensive Rebound.,58,65,2nd Half,5:31,False,127,2025-11-09T01:52:27Z
401826785114001758,114001758,Substitution,Cam Ward subbing out for Michigan State,58,65,2nd Half,5:31,False,127,2025-11-09T01:55:42Z
401826785114001759,114001759,Substitution,Jaxon Kohler subbing in for Michigan State,58,65,2nd Half,5:31,False,127,2025-11-09T01:55:42Z
401826785114001790,114001790,PersonalFoul,Foul on D.J. Wagner.,58,65,2nd Half,5:21,False,8,2025-11-09T01:56:11Z
401826785114001804,114001804,MadeFreeThrow,Coen Carr missed Free Throw.,58,65,2nd Half,5:21,False,127,2025-11-09T01:56:33Z
401826785114001805,114001805,Dead Ball Rebound,Michigan State Deadball Team Rebound.,58,65,2nd Half,5:21,False,127,2025-11-09T01:56:33Z
401826785114001810,114001810,MadeFreeThrow,Coen Carr made Free Throw.,58,66,2nd Half,5:21,True,127,2025-11-09T01:56:48Z
401826785114001821,114001821,DunkShot,Malique Ewin made Dunk. Assisted by Darius Acuff Jr..,60,66,2nd Half,5:09,True,8,2025-11-09T01:57:03Z
401826785114001830,114001830,Lost Ball Turnover,Coen Carr Turnover.,60,66,2nd Half,4:46,False,127,2025-11-09T01:57:25Z
401826785114001831,114001831,Steal,Darius Acuff Jr. Steal.,60,66,2nd Half,4:46,False,8,2025-11-09T01:57:25Z
401826785114001832,114001832,LayUpShot,Darius Acuff Jr. missed Layup.,60,66,2nd Half,4:41,False,8,2025-11-09T01:57:30Z
401826785114001838,114001838,Block Shot,Carson Cooper Block.,60,66,2nd Half,4:41,False,127,2025-11-09T01:57:30Z
401826785114001839,114001839,Offensive Rebound,Arkansas Offensive Rebound.,60,66,2nd Half,4:39,False,8,2025-11-09T01:57:34Z
401826785114001866,114001866,Substitution,Divine Ugochukwu subbing out for Michigan State,60,66,2nd Half,4:39,False,127,2025-11-09T01:57:43Z
401826785114001867,114001867,Substitution,Jordan Scott subbing in for Michigan State,60,66,2nd Half,4:39,False,127,2025-11-09T01:57:43Z
401826785114001876,114001876,Lost Ball Turnover,D.J. Wagner Turnover.,60,66,2nd Half,4:28,False,8,2025-11-09T01:58:06Z
401826785114001877,114001877,Steal,Carson Cooper Steal.,60,66,2nd Half,4:28,False,127,2025-11-09T01:58:06Z
401826785114001889,114001889,JumpShot,Jordan Scott missed Three Point Jumper.,60,66,2nd Half,4:11,False,127,2025-11-09T01:58:23Z
401826785114001890,114001890,Defensive Rebound,Meleek Thomas Defensive Rebound.,60,66,2nd Half,4:09,False,8,2025-11-09T01:58:25Z
401826785114001891,114001891,JumpShot,Meleek Thomas missed Jumper.,60,66,2nd Half,4:04,False,8,2025-11-09T01:58:30Z
401826785114001893,114001893,Offensive Rebound,Meleek Thomas Offensive Rebound.,60,66,2nd Half,4:01,False,8,2025-11-09T01:58:33Z
401826785114001894,114001894,JumpShot,Meleek Thomas made Three Point Jumper.,63,66,2nd Half,3:58,True,8,2025-11-09T01:58:36Z
401826785114001902,114001902,JumpShot,Jeremy Fears Jr. missed Three Point Jumper.,63,66,2nd Half,3:37,False,127,2025-11-09T01:58:58Z
401826785114001903,114001903,Defensive Rebound,Nick Pringle Defensive Rebound.,63,66,2nd Half,3:34,False,8,2025-11-09T01:59:00Z
401826785114001913,114001913,JumpShot,Meleek Thomas missed Three Point Jumper.,63,66,2nd Half,3:18,False,8,2025-11-09T01:59:16Z
401826785114001915,114001915,Defensive Rebound,Jordan Scott Defensive Rebound.,63,66,2nd Half,3:15,False,127,2025-11-09T01:59:18Z
401826785114001947,114001947,Lost Ball Turnover,Jaxon Kohler Turnover.,63,66,2nd Half,2:55,False,127,2025-11-09T01:59:39Z
401826785114001949,114001949,Steal,D.J. Wagner Steal.,63,66,2nd Half,2:55,False,8,2025-11-09T01:59:39Z
401826785114001953,114001953,PersonalFoul,Foul on Jeremy Fears Jr..,63,66,2nd Half,2:51,False,127,2025-11-09T01:59:44Z
401826785114001955,114001955,OfficialTVTimeOut,Official TV Timeout,63,66,2nd Half,2:51,False,,2025-11-09T01:59:48Z
401826785114002138,114002138,Substitution,Jaxon Kohler subbing out for Michigan State,63,66,2nd Half,2:51,False,127,2025-11-09T02:03:14Z
401826785114002139,114002139,Substitution,Jordan Scott subbing out for Michigan State,63,66,2nd Half,2:51,False,127,2025-11-09T02:03:14Z
401826785114002140,114002140,Substitution,Cam Ward subbing in for Michigan State,63,66,2nd Half,2:51,False,127,2025-11-09T02:03:14Z
401826785114002141,114002141,Substitution,Divine Ugochukwu subbing in for Michigan State,63,66,2nd Half,2:51,False,127,2025-11-09T02:03:14Z
401826785114002167,114002167,MadeFreeThrow,Darius Acuff Jr. missed Free Throw.,63,66,2nd Half,2:51,False,8,2025-11-09T02:03:29Z
401826785114002169,114002169,Offensive Rebound,Malique Ewin Offensive Rebound.,63,66,2nd Half,2:49,False,8,2025-11-09T02:03:31Z
401826785114002170,114002170,DunkShot,Nick Pringle made Dunk. Assisted by Meleek Thomas.,65,66,2nd Half,2:43,True,8,2025-11-09T02:03:38Z
401826785114002211,114002211,Lost Ball Turnover,Cam Ward Turnover.,65,66,2nd Half,2:09,False,127,2025-11-09T02:04:29Z
401826785114002215,114002215,Steal,Malique Ewin Steal.,65,66,2nd Half,2:09,False,8,2025-11-09T02:04:29Z
401826785114002267,114002267,PersonalFoul,Foul on Carson Cooper.,65,66,2nd Half,1:41,False,127,2025-11-09T02:05:00Z
401826785114002350,114002350,MadeFreeThrow,Nick Pringle missed Free Throw.,65,66,2nd Half,1:41,False,8,2025-11-09T02:05:53Z
401826785114002351,114002351,Dead Ball Rebound,Arkansas Deadball Team Rebound.,65,66,2nd Half,1:41,False,8,2025-11-09T02:05:53Z
401826785114002356,114002356,Substitution,Cam Ward subbing out for Michigan State,65,66,2nd Half,1:41,False,127,2025-11-09T02:06:01Z
401826785114002357,114002357,Substitution,Jaxon Kohler subbing in for Michigan State,65,66,2nd Half,1:41,False,127,2025-11-09T02:06:01Z
401826785114002401,114002401,MadeFreeThrow,Nick Pringle made Free Throw.,66,66,2nd Half,1:41,True,8,2025-11-09T02:06:42Z
401826785114002429,114002429,PersonalFoul,Foul on Nick Pringle.,66,66,2nd Half,1:21,False,8,2025-11-09T02:07:07Z
401826785114002437,114002437,MadeFreeThrow,Carson Cooper missed Free Throw.,66,66,2nd Half,1:21,False,127,2025-11-09T02:07:31Z
401826785114002438,114002438,Dead Ball Rebound,Michigan State Deadball Team Rebound.,66,66,2nd Half,1:21,False,127,2025-11-09T02:07:31Z
401826785114002466,114002466,Substitution,Divine Ugochukwu subbing out for Michigan State,66,66,2nd Half,1:21,False,127,2025-11-09T02:07:36Z
401826785114002467,114002467,Substitution,Jordan Scott subbing in for Michigan State,66,66,2nd Half,1:21,False,127,2025-11-09T02:07:36Z
401826785114002485,114002485,MadeFreeThrow,Carson Cooper made Free Throw.,66,67,2nd Half,1:21,True,127,2025-11-09T02:07:47Z
401826785114002491,114002491,JumpShot,Darius Acuff Jr. missed Jumper.,66,67,2nd Half,1:13,False,8,2025-11-09T02:07:59Z
401826785114002492,114002492,Block Shot,Carson Cooper Block.,66,67,2nd Half,1:13,False,127,2025-11-09T02:07:59Z
401826785114002498,114002498,Defensive Rebound,Jaxon Kohler Defensive Rebound.,66,67,2nd Half,1:09,False,127,2025-11-09T02:08:02Z
401826785114002505,114002505,RegularTimeOut,Michigan State Timeout,66,67,2nd Half,1:04,False,127,2025-11-09T02:08:14Z
401826785114002637,114002637,PersonalFoul,Foul on Darius Acuff Jr..,66,67,2nd Half,0:43,False,8,2025-11-09T02:10:29Z
401826785114002697,114002697,MadeFreeThrow,Jeremy Fears Jr. made Free Throw.,66,68,2nd Half,0:43,True,127,2025-11-09T02:10:58Z
401826785114002739,114002739,MadeFreeThrow,Jeremy Fears Jr. missed Free Throw.,66,68,2nd Half,0:43,False,127,2025-11-09T02:11:14Z
401826785114002740,114002740,Dead Ball Rebound,Michigan State Deadball Team Rebound.,66,68,2nd Half,0:43,False,127,2025-11-09T02:11:14Z
401826785114002773,114002773,MadeFreeThrow,Jeremy Fears Jr. made Free Throw.,66,69,2nd Half,0:43,True,127,2025-11-09T02:11:30Z
401826785114002815,114002815,RegularTimeOut,Arkansas Timeout,66,69,2nd Half,0:38,False,8,2025-11-09T02:11:56Z
401826785114002951,114002951,JumpShot,Meleek Thomas missed Three Point Jumper.,66,69,2nd Half,0:27,False,8,2025-11-09T02:13:45Z
401826785114002952,114002952,Offensive Rebound,Nick Pringle Offensive Rebound.,66,69,2nd Half,0:23,False,8,2025-11-09T02:13:47Z
401826785114002953,114002953,JumpShot,Meleek Thomas missed Jumper.,66,69,2nd Half,0:19,False,8,2025-11-09T02:13:52Z
401826785114002954,114002954,Defensive Rebound,Jordan Scott Defensive Rebound.,66,69,2nd Half,0:17,False,127,2025-11-09T02:13:53Z
401826785114002955,114002955,PersonalFoul,Foul on Nick Pringle.,66,69,2nd Half,0:15,False,8,2025-11-09T02:14:01Z
401826785114002964,114002964,Substitution,Nick Pringle subbing out for Arkansas,66,69,2nd Half,0:15,False,8,2025-11-09T02:14:14Z
401826785114002965,114002965,Substitution,Trevon Brazile subbing in for Arkansas,66,69,2nd Half,0:15,False,8,2025-11-09T02:14:14Z
401826785114003069,114003069,MadeFreeThrow,Jordan Scott missed Free Throw.,66,69,2nd Half,0:15,False,127,2025-11-09T02:15:16Z
401826785114003070,114003070,Dead Ball Rebound,Michigan State Deadball Team Rebound.,66,69,2nd Half,0:15,False,127,2025-11-09T02:15:16Z
401826785114003077,114003077,MadeFreeThrow,Jordan Scott missed Free Throw.,66,69,2nd Half,0:15,False,127,2025-11-09T02:15:31Z
401826785114003081,114003081,Defensive Rebound,D.J. Wagner Defensive Rebound.,66,69,2nd Half,0:14,False,8,2025-11-09T02:15:33Z
401826785114003082,114003082,JumpShot,Darius Acuff Jr. missed Three Point Jumper.,66,69,2nd Half,0:07,False,8,2025-11-09T02:15:41Z
401826785114003087,114003087,Offensive Rebound,Arkansas Offensive Rebound.,66,69,2nd Half,0:04,False,8,2025-11-09T02:15:47Z
401826785114003137,114003137,ShortTimeOut,Michigan State Timeout,66,69,2nd Half,0:04,False,127,2025-11-09T02:16:05Z
401826785114003368,114003368,Substitution,Jaxon Kohler subbing out for Michigan State,66,69,2nd Half,0:04,False,127,2025-11-09T02:18:50Z
401826785114003369,114003369,Substitution,Cam Ward subbing in for Michigan State,66,69,2nd Half,0:04,False,127,2025-11-09T02:18:50Z
401826785114003382,114003382,JumpShot,Trevon Brazile missed Three Point Jumper.,66,69,2nd Half,0:02,False,8,2025-11-09T02:19:10Z
401826785114003417,114003417,Defensive Rebound,Michigan State Defensive Rebound.,66,69,2nd Half,0:00,False,127,2025-11-09T02:19:24Z
401826785114003454,114003454,ShortTimeOut,Michigan State Timeout,66,69,2nd Half,0:00,False,127,2025-11-09T02:20:00Z
401826785114003538,114003538,End Period,End of 2nd half,66,69,2nd Half,0:00,False,,2025-11-09T02:21:31Z
401826785114003545,114003545,End Game,End of Game,66,69,2nd Half,0:00,False,,2025-11-09T02:21:40Z
