play_id,sequence_number,type,description,away_score,home_score,period,clock,scoring_play,team_id,timestamp_utc
401823325114795111,114795111,Jumpball,Start game,0,0,1st Half,20:00,False,,2025-11-22T22:02:40Z
401823325114795112,114795112,Jumpball,Jump Ball won by Missouri State,0,0,1st Half,19:59,False,2623,2025-11-22T22:02:41Z
401823325114795113,114795113,Jumpball,Jump Ball lost by UT Rio Grande Valley,0,0,1st Half,19:59,False,292,2025-11-22T22:02:41Z
401823325114795132,114795132,JumpShot,Trey Williams Jr. missed Three Point Jumper.,0,0,1st Half,19:46,False,2623,2025-11-22T22:02:55Z
401823325114795133,114795133,Offensive Rebound,Michael Osei-Bonsu Offensive Rebound.,0,0,1st Half,19:43,False,2623,2025-11-22T22:02:57Z
401823325114795141,114795141,Lost Ball Turnover,Michael Osei-Bonsu Turnover.,0,0,1st Half,19:41,False,2623,2025-11-22T22:03:00Z
401823325114795142,114795142,Steal,Marvin McGhee III Steal.,0,0,1st Half,19:41,False,292,2025-11-22T22:03:00Z
401823325114795156,114795156,LayUpShot,Always Wright made Layup. Assisted by Filip Brankovic.,2,0,1st Half,19:22,True,292,2025-11-22T22:03:19Z
401823325114795212,114795212,JumpShot,Kobi Williams missed Three Point Jumper.,2,0,1st Half,18:58,False,2623,2025-11-22T22:03:44Z
401823325114795213,114795213,Defensive Rebound,Marvin McGhee III Defensive Rebound.,2,0,1st Half,18:54,False,292,2025-11-22T22:03:46Z
401823325114795247,114795247,JumpShot,Marvin McGhee III missed Three Point Jumper.,2,0,1st Half,18:36,False,292,2025-11-22T22:04:06Z
401823325114795248,114795248,Defensive Rebound,Michael Osei-Bonsu Defensive Rebound.,2,0,1st Half,18:32,False,2623,2025-11-22T22:04:08Z
401823325114795256,114795256,JumpShot,Keith Palek III missed Jumper.,2,0,1st Half,18:25,False,2623,2025-11-22T22:04:15Z
401823325114795257,114795257,Defensive Rebound,Koree Cotton Defensive Rebound.,2,0,1st Half,18:22,False,292,2025-11-22T22:04:18Z
401823325114795300,114795300,JumpShot,Filip Brankovic missed Jumper.,2,0,1st Half,18:06,False,292,2025-11-22T22:04:35Z
401823325114795301,114795301,Defensive Rebound,Michael Osei-Bonsu Defensive Rebound.,2,0,1st Half,18:04,False,2623,2025-11-22T22:04:37Z
401823325114795311,114795311,LayUpShot,Michael Osei-Bonsu made Layup.,2,2,1st Half,17:52,True,2623,2025-11-22T22:04:49Z
401823325114795347,114795347,Lost Ball Turnover,Filip Brankovic Turnover.,2,2,1st Half,17:38,False,292,2025-11-22T22:05:03Z
401823325114795349,114795349,Steal,Michael Osei-Bonsu Steal.,2,2,1st Half,17:38,False,2623,2025-11-22T22:05:03Z
401823325114795350,114795350,LayUpShot,Zaxton King made Layup. Assisted by Michael Osei-Bonsu.,2,4,1st Half,17:34,True,2623,2025-11-22T22:05:07Z
401823325114795416,114795416,PersonalFoul,Foul on Michael Osei-Bonsu.,2,4,1st Half,17:06,False,2623,2025-11-22T22:05:39Z
401823325114795470,114795470,MadeFreeThrow,Always Wright missed Free Throw.,2,4,1st Half,17:06,False,292,2025-11-22T22:06:01Z
401823325114795471,114795471,Dead Ball Rebound,UT Rio Grande Valley Deadball Team Rebound.,2,4,1st Half,17:06,False,292,2025-11-22T22:06:01Z
401823325114795489,114795489,MadeFreeThrow,Always Wright made Free Throw.,3,4,1st Half,17:06,True,292,2025-11-22T22:06:16Z
401823325114795531,114795531,JumpShot,Trey Williams Jr. missed Three Point Jumper.,3,4,1st Half,16:44,False,2623,2025-11-22T22:06:42Z
401823325114795532,114795532,Defensive Rebound,Marvin McGhee III Defensive Rebound.,3,4,1st Half,16:42,False,292,2025-11-22T22:06:44Z
401823325114795543,114795543,Lost Ball Turnover,Koree Cotton Turnover.,3,4,1st Half,16:32,False,292,2025-11-22T22:06:55Z
401823325114795544,114795544,Steal,Kobi Williams Steal.,3,4,1st Half,16:32,False,2623,2025-11-22T22:06:55Z
401823325114795576,114795576,JumpShot,Keith Palek III missed Three Point Jumper.,3,4,1st Half,16:19,False,2623,2025-11-22T22:07:07Z
401823325114795577,114795577,Defensive Rebound,Kye Dickson Defensive Rebound.,3,4,1st Half,16:17,False,292,2025-11-22T22:07:09Z
401823325114795599,114795599,Lost Ball Turnover,Kye Dickson Turnover.,3,4,1st Half,16:14,False,292,2025-11-22T22:07:12Z
401823325114795600,114795600,Steal,Zaxton King Steal.,3,4,1st Half,16:14,False,2623,2025-11-22T22:07:12Z
401823325114795608,114795608,JumpShot,Zaxton King made Three Point Jumper. Assisted by Keith Palek III.,3,7,1st Half,16:07,True,2623,2025-11-22T22:07:20Z
401823325114795642,114795642,JumpShot,Koree Cotton missed Jumper.,3,7,1st Half,15:34,False,292,2025-11-22T22:07:52Z
401823325114795643,114795643,Offensive Rebound,Marvin McGhee III Offensive Rebound.,3,7,1st Half,15:30,False,292,2025-11-22T22:07:56Z
401823325114795678,114795678,JumpShot,Always Wright made Three Point Jumper. Assisted by Marvin McGhee III.,6,7,1st Half,15:25,True,292,2025-11-22T22:08:02Z
401823325114795699,114795699,JumpShot,Zaxton King missed Three Point Jumper.,6,7,1st Half,15:01,False,2623,2025-11-22T22:08:26Z
401823325114795701,114795701,Defensive Rebound,Always Wright Defensive Rebound.,6,7,1st Half,14:57,False,292,2025-11-22T22:08:28Z
401823325114795748,114795748,LayUpShot,Filip Brankovic made Layup. Assisted by Koree Cotton.,8,7,1st Half,14:40,True,292,2025-11-22T22:08:46Z
401823325114795761,114795761,JumpShot,Kobi Williams made Three Point Jumper. Assisted by Trey Williams Jr..,8,10,1st Half,14:24,True,2623,2025-11-22T22:09:03Z
401823325114795790,114795790,JumpShot,Koree Cotton missed Jumper.,8,10,1st Half,14:00,False,292,2025-11-22T22:09:27Z
401823325114795791,114795791,Defensive Rebound,Michael Osei-Bonsu Defensive Rebound.,8,10,1st Half,13:57,False,2623,2025-11-22T22:09:29Z
401823325114795805,114795805,PersonalFoul,Foul on Filip Brankovic.,8,10,1st Half,13:46,False,292,2025-11-22T22:09:43Z
401823325114795814,114795814,OfficialTVTimeOut,Official TV Timeout,8,10,1st Half,13:46,False,,2025-11-22T22:09:50Z
401823325114796234,114796234,Substitution,Trey Williams Jr. subbing out for Missouri State,8,10,1st Half,13:46,False,2623,2025-11-22T22:12:42Z
401823325114796235,114796235,Substitution,Keith Palek III subbing out for Missouri State,8,10,1st Half,13:46,False,2623,2025-11-22T22:12:42Z
401823325114796236,114796236,Substitution,Michael Osei-Bonsu subbing out for Missouri State,8,10,1st Half,13:46,False,2623,2025-11-22T22:12:42Z
401823325114796237,114796237,Substitution,Tyrique Brooks subbing in for Missouri State,8,10,1st Half,13:46,False,2623,2025-11-22T22:12:42Z
401823325114796238,114796238,Substitution,Darrion Sutton subbing in for Missouri State,8,10,1st Half,13:46,False,2623,2025-11-22T22:12:42Z
401823325114796239,114796239,Substitution,Cameron Boone subbing in for Missouri State,8,10,1st Half,13:46,False,2623,2025-11-22T22:12:42Z
401823325114796240,114796240,Substitution,Always Wright subbing out for UT Rio Grande Valley,8,10,1st Half,13:46,False,292,2025-11-22T22:12:42Z
401823325114796242,114796242,Substitution,Koree Cotton subbing out for UT Rio Grande Valley,8,10,1st Half,13:46,False,292,2025-11-22T22:12:42Z
401823325114796243,114796243,Substitution,Filip Brankovic subbing out for UT Rio Grande Valley,8,10,1st Half,13:46,False,292,2025-11-22T22:12:42Z
401823325114796244,114796244,Substitution,Jaylen Washington subbing in for UT Rio Grande Valley,8,10,1st Half,13:46,False,292,2025-11-22T22:12:42Z
401823325114796245,114796245,Substitution,Zae Blake subbing in for UT Rio Grande Valley,8,10,1st Half,13:46,False,292,2025-11-22T22:12:42Z
401823325114796246,114796246,Substitution,Marshal Destremau subbing in for UT Rio Grande Valley,8,10,1st Half,13:46,False,292,2025-11-22T22:12:42Z
401823325114796260,114796260,MadeFreeThrow,Kobi Williams missed Free Throw.,8,10,1st Half,13:46,False,2623,2025-11-22T22:12:54Z
401823325114796261,114796261,Dead Ball Rebound,Missouri State Deadball Team Rebound.,8,10,1st Half,13:46,False,2623,2025-11-22T22:12:54Z
401823325114796276,114796276,MadeFreeThrow,Kobi Williams made Free Throw.,8,11,1st Half,13:46,True,2623,2025-11-22T22:13:08Z
401823325114796294,114796294,PersonalFoul,Foul on Tyrique Brooks.,8,11,1st Half,13:42,False,2623,2025-11-22T22:13:18Z
401823325114796335,114796335,Substitution,Kye Dickson subbing out for UT Rio Grande Valley,8,11,1st Half,13:42,False,292,2025-11-22T22:13:30Z
401823325114796338,114796338,Substitution,Dane Christensen subbing in for UT Rio Grande Valley,8,11,1st Half,13:42,False,292,2025-11-22T22:13:30Z
401823325114796413,114796413,LayUpShot,Zae Blake made Layup. Assisted by Dane Christensen.,10,11,1st Half,13:17,True,292,2025-11-22T22:14:01Z
401823325114796438,114796438,JumpShot,Kobi Williams missed Jumper.,10,11,1st Half,12:55,False,2623,2025-11-22T22:14:23Z
401823325114796439,114796439,Defensive Rebound,Marvin McGhee III Defensive Rebound.,10,11,1st Half,12:51,False,292,2025-11-22T22:14:27Z
401823325114796497,114796497,LayUpShot,Marvin McGhee III missed Layup.,10,11,1st Half,12:32,False,292,2025-11-22T22:14:46Z
401823325114796498,114796498,Block Shot,Darrion Sutton Block.,10,11,1st Half,12:32,False,2623,2025-11-22T22:14:46Z
401823325114796515,114796515,Defensive Rebound,Darrion Sutton Defensive Rebound.,10,11,1st Half,12:27,False,2623,2025-11-22T22:14:50Z
401823325114796516,114796516,LayUpShot,Zaxton King made Layup.,10,13,1st Half,12:21,True,2623,2025-11-22T22:14:57Z
401823325114796521,114796521,JumpShot,Marshal Destremau missed Three Point Jumper.,10,13,1st Half,12:11,False,292,2025-11-22T22:15:07Z
401823325114796522,114796522,Defensive Rebound,Darrion Sutton Defensive Rebound.,10,13,1st Half,12:08,False,2623,2025-11-22T22:15:10Z
401823325114796532,114796532,JumpShot,Zaxton King made Three Point Jumper.,10,16,1st Half,12:00,True,2623,2025-11-22T22:15:18Z
401823325114796548,114796548,ShortTimeOut,UT Rio Grande Valley Timeout,10,16,1st Half,11:55,False,292,2025-11-22T22:15:26Z
401823325114796549,114796549,OfficialTVTimeOut,Official TV Timeout,10,16,1st Half,11:55,False,,2025-11-22T22:15:29Z
401823325114796738,114796738,Substitution,Kobi Williams subbing out for Missouri State,10,16,1st Half,11:55,False,2623,2025-11-22T22:17:39Z
401823325114796739,114796739,Substitution,Cameron Boone subbing out for Missouri State,10,16,1st Half,11:55,False,2623,2025-11-22T22:17:39Z
401823325114796740,114796740,Substitution,Trey Williams Jr. subbing in for Missouri State,10,16,1st Half,11:55,False,2623,2025-11-22T22:17:39Z
401823325114796741,114796741,Substitution,Michael Osei-Bonsu subbing in for Missouri State,10,16,1st Half,11:55,False,2623,2025-11-22T22:17:39Z
401823325114796742,114796742,Substitution,Marvin McGhee III subbing out for UT Rio Grande Valley,10,16,1st Half,11:55,False,292,2025-11-22T22:17:39Z
401823325114796743,114796743,Substitution,Julien Gomez subbing in for UT Rio Grande Valley,10,16,1st Half,11:55,False,292,2025-11-22T22:17:39Z
401823325114796775,114796775,Lost Ball Turnover,Julien Gomez Turnover.,10,16,1st Half,11:34,False,292,2025-11-22T22:18:08Z
401823325114796793,114796793,Steal,Zaxton King Steal.,10,16,1st Half,11:34,False,2623,2025-11-22T22:18:08Z
401823325114796806,114796806,PersonalFoul,Foul on Jaylen Washington.,10,16,1st Half,11:31,False,292,2025-11-22T22:18:19Z
401823325114796846,114796846,Lost Ball Turnover,Michael Osei-Bonsu Turnover.,10,16,1st Half,11:14,False,2623,2025-11-22T22:18:50Z
401823325114796861,114796861,Steal,Julien Gomez Steal.,10,16,1st Half,11:14,False,292,2025-11-22T22:18:50Z
401823325114796878,114796878,LayUpShot,Jaylen Washington missed Layup.,10,16,1st Half,10:54,False,292,2025-11-22T22:19:09Z
401823325114796894,114796894,Defensive Rebound,Zaxton King Defensive Rebound.,10,16,1st Half,10:51,False,2623,2025-11-22T22:19:12Z
401823325114796905,114796905,JumpShot,Trey Williams Jr. made Jumper.,10,18,1st Half,10:44,True,2623,2025-11-22T22:19:20Z
401823325114796934,114796934,JumpShot,Marshal Destremau missed Jumper.,10,18,1st Half,10:23,False,292,2025-11-22T22:19:41Z
401823325114796935,114796935,Block Shot,Darrion Sutton Block.,10,18,1st Half,10:23,False,2623,2025-11-22T22:19:41Z
401823325114796936,114796936,Offensive Rebound,UT Rio Grande Valley Offensive Rebound.,10,18,1st Half,10:23,False,292,2025-11-22T22:19:45Z
401823325114796944,114796944,Substitution,Tyrique Brooks subbing out for Missouri State,10,18,1st Half,10:22,False,2623,2025-11-22T22:19:55Z
401823325114796945,114796945,Substitution,Zaxton King subbing out for Missouri State,10,18,1st Half,10:22,False,2623,2025-11-22T22:19:55Z
401823325114796946,114796946,Substitution,Kobi Williams subbing in for Missouri State,10,18,1st Half,10:22,False,2623,2025-11-22T22:19:55Z
401823325114796947,114796947,Substitution,Logan Epes subbing in for Missouri State,10,18,1st Half,10:22,False,2623,2025-11-22T22:19:55Z
401823325114796948,114796948,Substitution,Marshal Destremau subbing out for UT Rio Grande Valley,10,18,1st Half,10:22,False,292,2025-11-22T22:19:55Z
401823325114796949,114796949,Substitution,Kwo Agwa subbing in for UT Rio Grande Valley,10,18,1st Half,10:22,False,292,2025-11-22T22:19:55Z
401823325114796978,114796978,JumpShot,Zae Blake made Three Point Jumper. Assisted by Dane Christensen.,13,18,1st Half,10:20,True,292,2025-11-22T22:20:11Z
401823325114797009,114797009,PersonalFoul,Foul on Kwo Agwa.,13,18,1st Half,9:54,False,292,2025-11-22T22:20:39Z
401823325114797031,114797031,MadeFreeThrow,Michael Osei-Bonsu missed Free Throw.,13,18,1st Half,9:54,False,2623,2025-11-22T22:20:59Z
401823325114797032,114797032,Dead Ball Rebound,Missouri State Deadball Team Rebound.,13,18,1st Half,9:54,False,2623,2025-11-22T22:20:59Z
401823325114797054,114797054,MadeFreeThrow,Michael Osei-Bonsu missed Free Throw.,13,18,1st Half,9:54,False,2623,2025-11-22T22:21:14Z
401823325114797055,114797055,Offensive Rebound,Darrion Sutton Offensive Rebound.,13,18,1st Half,9:54,False,2623,2025-11-22T22:21:16Z
401823325114797079,114797079,Lost Ball Turnover,Logan Epes Turnover.,13,18,1st Half,9:43,False,2623,2025-11-22T22:21:31Z
401823325114797099,114797099,LayUpShot,Jaylen Washington made Layup.,15,18,1st Half,9:26,True,292,2025-11-22T22:21:52Z
401823325114797146,114797146,Substitution,Kobi Williams subbing out for Missouri State,15,18,1st Half,9:00,False,2623,2025-11-22T22:22:28Z
401823325114797147,114797147,Substitution,Darrion Sutton subbing out for Missouri State,15,18,1st Half,9:00,False,2623,2025-11-22T22:22:28Z
401823325114797148,114797148,Substitution,Keith Palek III subbing in for Missouri State,15,18,1st Half,9:00,False,2623,2025-11-22T22:22:28Z
401823325114797149,114797149,Substitution,Zaxton King subbing in for Missouri State,15,18,1st Half,9:00,False,2623,2025-11-22T22:22:28Z
401823325114797230,114797230,PersonalFoul,Foul on Dane Christensen.,15,18,1st Half,9:00,False,292,2025-11-22T22:22:55Z
401823325114797286,114797286,JumpShot,Trey Williams Jr. missed Three Point Jumper.,15,18,1st Half,8:57,False,2623,2025-11-22T22:23:10Z
401823325114797287,114797287,Defensive Rebound,Zae Blake Defensive Rebound.,15,18,1st Half,8:53,False,292,2025-11-22T22:23:12Z
401823325114797299,114797299,LayUpShot,Kwo Agwa made Layup. Assisted by Jaylen Washington.,17,18,1st Half,8:41,True,292,2025-11-22T22:23:26Z
401823325114797339,114797339,JumpShot,Michael Osei-Bonsu missed Jumper.,17,18,1st Half,8:19,False,2623,2025-11-22T22:23:47Z
401823325114797340,114797340,Offensive Rebound,Michael Osei-Bonsu Offensive Rebound.,17,18,1st Half,8:17,False,2623,2025-11-22T22:23:48Z
401823325114797349,114797349,JumpShot,Logan Epes missed Three Point Jumper.,17,18,1st Half,8:14,False,2623,2025-11-22T22:23:52Z
401823325114797350,114797350,Defensive Rebound,Zae Blake Defensive Rebound.,17,18,1st Half,8:11,False,292,2025-11-22T22:23:54Z
401823325114797368,114797368,Lost Ball Turnover,Zae Blake Turnover.,17,18,1st Half,7:58,False,292,2025-11-22T22:24:11Z
401823325114797369,114797369,OfficialTVTimeOut,Official TV Timeout,17,18,1st Half,7:57,False,,2025-11-22T22:24:16Z
401823325114797484,114797484,Substitution,Logan Epes subbing out for Missouri State,17,18,1st Half,7:57,False,2623,2025-11-22T22:26:53Z
401823325114797485,114797485,Substitution,Michael Osei-Bonsu subbing out for Missouri State,17,18,1st Half,7:57,False,2623,2025-11-22T22:26:53Z
401823325114797606,114797606,Substitution,Kobi Williams subbing in for Missouri State,17,18,1st Half,7:57,False,2623,2025-11-22T22:26:53Z
401823325114797607,114797607,Substitution,Cameron Boone subbing in for Missouri State,17,18,1st Half,7:57,False,2623,2025-11-22T22:26:53Z
401823325114797608,114797608,Substitution,Jaylen Washington subbing out for UT Rio Grande Valley,17,18,1st Half,7:57,False,292,2025-11-22T22:26:53Z
401823325114797609,114797609,Substitution,Dane Christensen subbing out for UT Rio Grande Valley,17,18,1st Half,7:57,False,292,2025-11-22T22:26:53Z
401823325114797610,114797610,Substitution,Kwo Agwa subbing out for UT Rio Grande Valley,17,18,1st Half,7:57,False,292,2025-11-22T22:26:53Z
401823325114797611,114797611,Substitution,Always Wright subbing in for UT Rio Grande Valley,17,18,1st Half,7:57,False,292,2025-11-22T22:26:53Z
401823325114797612,114797612,Substitution,Koree Cotton subbing in for UT Rio Grande Valley,17,18,1st Half,7:57,False,292,2025-11-22T22:26:53Z
401823325114797613,114797613,Substitution,Filip Brankovic subbing in for UT Rio Grande Valley,17,18,1st Half,7:57,False,292,2025-11-22T22:26:53Z
401823325114797620,114797620,Lost Ball Turnover,Keith Palek III Turnover.,17,18,1st Half,7:35,False,2623,2025-11-22T22:27:25Z
401823325114797621,114797621,Steal,Koree Cotton Steal.,17,18,1st Half,7:35,False,292,2025-11-22T22:27:25Z
401823325114797622,114797622,PersonalFoul,Foul on Kobi Williams.,17,18,1st Half,7:33,False,2623,2025-11-22T22:27:36Z
401823325114797688,114797688,MadeFreeThrow,Julien Gomez made Free Throw.,18,18,1st Half,7:33,True,292,2025-11-22T22:27:53Z
401823325114797690,114797690,MadeFreeThrow,Julien Gomez made Free Throw.,19,18,1st Half,7:33,True,292,2025-11-22T22:28:06Z
401823325114797699,114797699,JumpShot,Trey Williams Jr. missed Jumper.,19,18,1st Half,7:06,False,2623,2025-11-22T22:28:36Z
401823325114797701,114797701,Defensive Rebound,Zae Blake Defensive Rebound.,19,18,1st Half,7:03,False,292,2025-11-22T22:28:38Z
401823325114797775,114797775,LayUpShot,Koree Cotton missed Layup.,19,18,1st Half,6:47,False,292,2025-11-22T22:28:55Z
401823325114797776,114797776,Defensive Rebound,Keith Palek III Defensive Rebound.,19,18,1st Half,6:44,False,2623,2025-11-22T22:28:57Z
401823325114797826,114797826,PersonalFoul,Foul on Cameron Boone.,19,18,1st Half,6:35,False,2623,2025-11-22T22:29:13Z
401823325114797827,114797827,Lost Ball Turnover,Cameron Boone Turnover.,19,18,1st Half,6:35,False,2623,2025-11-22T22:29:13Z
401823325114797838,114797838,Substitution,Cameron Boone subbing out for Missouri State,19,18,1st Half,6:35,False,2623,2025-11-22T22:29:27Z
401823325114797839,114797839,Substitution,Michael Osei-Bonsu subbing in for Missouri State,19,18,1st Half,6:35,False,2623,2025-11-22T22:29:27Z
401823325114797891,114797891,JumpShot,Filip Brankovic made Three Point Jumper. Assisted by Koree Cotton.,22,18,1st Half,6:10,True,292,2025-11-22T22:29:58Z
401823325114797897,114797897,JumpShot,Kobi Williams missed Three Point Jumper.,22,18,1st Half,5:50,False,2623,2025-11-22T22:30:18Z
401823325114797898,114797898,Defensive Rebound,Koree Cotton Defensive Rebound.,22,18,1st Half,5:47,False,292,2025-11-22T22:30:20Z
401823325114797966,114797966,PersonalFoul,Foul on Zaxton King.,22,18,1st Half,5:39,False,2623,2025-11-22T22:30:32Z
401823325114797975,114797975,MadeFreeThrow,Julien Gomez made Free Throw.,23,18,1st Half,5:39,True,292,2025-11-22T22:30:53Z
401823325114797977,114797977,MadeFreeThrow,Julien Gomez made Free Throw.,24,18,1st Half,5:39,True,292,2025-11-22T22:31:06Z
401823325114798050,114798050,PersonalFoul,Foul on Koree Cotton.,24,18,1st Half,5:30,False,292,2025-11-22T22:31:23Z
401823325114798060,114798060,JumpShot,Kobi Williams missed Three Point Jumper.,24,18,1st Half,5:21,False,2623,2025-11-22T22:31:46Z
401823325114798061,114798061,Offensive Rebound,Missouri State Offensive Rebound.,24,18,1st Half,5:18,False,2623,2025-11-22T22:31:49Z
401823325114798152,114798152,JumpShot,Michael Osei-Bonsu missed Jumper.,24,18,1st Half,5:07,False,2623,2025-11-22T22:32:15Z
401823325114798155,114798155,Defensive Rebound,Filip Brankovic Defensive Rebound.,24,18,1st Half,5:07,False,292,2025-11-22T22:32:28Z
401823325114798159,114798159,PersonalFoul,Foul on Michael Osei-Bonsu.,24,18,1st Half,5:07,False,2623,2025-11-22T22:32:29Z
401823325114798227,114798227,Substitution,Michael Osei-Bonsu subbing out for Missouri State,24,18,1st Half,5:07,False,2623,2025-11-22T22:32:39Z
401823325114798228,114798228,Substitution,Darrion Sutton subbing in for Missouri State,24,18,1st Half,5:07,False,2623,2025-11-22T22:32:39Z
401823325114798323,114798323,Lost Ball Turnover,UT Rio Grande Valley  Turnover.,24,18,1st Half,4:36,False,292,2025-11-22T22:35:06Z
401823325114798486,114798486,Substitution,Julien Gomez subbing out for UT Rio Grande Valley,24,18,1st Half,4:36,False,292,2025-11-22T22:35:18Z
401823325114798487,114798487,Substitution,Marvin McGhee III subbing in for UT Rio Grande Valley,24,18,1st Half,4:36,False,292,2025-11-22T22:35:18Z
401823325114798490,114798490,JumpShot,Trey Williams Jr. missed Three Point Jumper.,24,18,1st Half,4:22,False,2623,2025-11-22T22:35:40Z
401823325114798495,114798495,Defensive Rebound,Zae Blake Defensive Rebound.,24,18,1st Half,4:19,False,292,2025-11-22T22:35:42Z
401823325114798501,114798501,Lost Ball Turnover,Koree Cotton Turnover.,24,18,1st Half,4:06,False,292,2025-11-22T22:35:57Z
401823325114798632,114798632,PersonalFoul,Foul on Filip Brankovic.,24,18,1st Half,3:47,False,292,2025-11-22T22:36:26Z
401823325114798634,114798634,OfficialTVTimeOut,Official TV Timeout,24,18,1st Half,3:47,False,,2025-11-22T22:36:34Z
401823325114798847,114798847,Substitution,Filip Brankovic subbing out for UT Rio Grande Valley,24,18,1st Half,3:47,False,292,2025-11-22T22:38:39Z
401823325114798848,114798848,Substitution,Kwo Agwa subbing in for UT Rio Grande Valley,24,18,1st Half,3:47,False,292,2025-11-22T22:38:39Z
401823325114798852,114798852,MadeFreeThrow,Keith Palek III made Free Throw.,24,19,1st Half,3:47,True,2623,2025-11-22T22:38:47Z
401823325114798854,114798854,MadeFreeThrow,Keith Palek III missed Free Throw.,24,19,1st Half,3:47,False,2623,2025-11-22T22:38:57Z
401823325114798855,114798855,Defensive Rebound,Marvin McGhee III Defensive Rebound.,24,19,1st Half,3:45,False,292,2025-11-22T22:39:01Z
401823325114798967,114798967,JumpShot,Always Wright missed Three Point Jumper.,24,19,1st Half,3:26,False,292,2025-11-22T22:39:20Z
401823325114798972,114798972,Defensive Rebound,Keith Palek III Defensive Rebound.,24,19,1st Half,3:22,False,2623,2025-11-22T22:39:23Z
401823325114798973,114798973,LayUpShot,Trey Williams Jr. made Layup. Assisted by Keith Palek III.,24,21,1st Half,3:18,True,2623,2025-11-22T22:39:28Z
401823325114798978,114798978,Lost Ball Turnover,Marvin McGhee III Turnover.,24,21,1st Half,2:58,False,292,2025-11-22T22:39:50Z
401823325114799048,114799048,Substitution,Trey Williams Jr. subbing out for Missouri State,24,21,1st Half,2:57,False,2623,2025-11-22T22:40:01Z
401823325114799049,114799049,Substitution,Tyrique Brooks subbing in for Missouri State,24,21,1st Half,2:57,False,2623,2025-11-22T22:40:01Z
401823325114799050,114799050,Substitution,Always Wright subbing out for UT Rio Grande Valley,24,21,1st Half,2:57,False,292,2025-11-22T22:40:01Z
401823325114799051,114799051,Substitution,Jaylen Washington subbing in for UT Rio Grande Valley,24,21,1st Half,2:57,False,292,2025-11-22T22:40:01Z
401823325114799058,114799058,JumpShot,Keith Palek III made Jumper.,24,23,1st Half,2:41,True,2623,2025-11-22T22:40:23Z
401823325114799064,114799064,JumpShot,Koree Cotton missed Three Point Jumper.,24,23,1st Half,2:17,False,292,2025-11-22T22:40:47Z
401823325114799129,114799129,Offensive Rebound,Marvin McGhee III Offensive Rebound.,24,23,1st Half,2:15,False,292,2025-11-22T22:40:52Z
401823325114799130,114799130,PersonalFoul,Foul on Darrion Sutton.,24,23,1st Half,2:15,False,2623,2025-11-22T22:40:56Z
401823325114799134,114799134,Substitution,Koree Cotton subbing out for UT Rio Grande Valley,24,23,1st Half,2:15,False,292,2025-11-22T22:41:07Z
401823325114799135,114799135,Substitution,Kye Dickson subbing in for UT Rio Grande Valley,24,23,1st Half,2:15,False,292,2025-11-22T22:41:07Z
401823325114799186,114799186,MadeFreeThrow,Marvin McGhee III made Free Throw.,25,23,1st Half,2:15,True,292,2025-11-22T22:41:30Z
401823325114799194,114799194,MadeFreeThrow,Marvin McGhee III made Free Throw.,26,23,1st Half,2:15,True,292,2025-11-22T22:41:45Z
401823325114799204,114799204,JumpShot,Keith Palek III made Three Point Jumper. Assisted by Darrion Sutton.,26,26,1st Half,1:55,True,2623,2025-11-22T22:42:09Z
401823325114799308,114799308,PersonalFoul,Foul on Zaxton King.,26,26,1st Half,1:32,False,2623,2025-11-22T22:42:38Z
401823325114799313,114799313,Substitution,Zaxton King subbing out for Missouri State,26,26,1st Half,1:32,False,2623,2025-11-22T22:42:54Z
401823325114799314,114799314,Substitution,Trey Williams Jr. subbing in for Missouri State,26,26,1st Half,1:32,False,2623,2025-11-22T22:42:54Z
401823325114799346,114799346,MadeFreeThrow,Marvin McGhee III made Free Throw.,27,26,1st Half,1:32,True,292,2025-11-22T22:43:12Z
401823325114799348,114799348,MadeFreeThrow,Marvin McGhee III made Free Throw.,28,26,1st Half,1:32,True,292,2025-11-22T22:43:26Z
401823325114799354,114799354,PersonalFoul,Foul on Zae Blake.,28,26,1st Half,1:21,False,292,2025-11-22T22:43:43Z
401823325114799432,114799432,MadeFreeThrow,Keith Palek III made Free Throw.,28,27,1st Half,1:21,True,2623,2025-11-22T22:44:03Z
401823325114799470,114799470,MadeFreeThrow,Keith Palek III made Free Throw.,28,28,1st Half,1:21,True,2623,2025-11-22T22:44:14Z
401823325114799475,114799475,DunkShot,Kye Dickson made Dunk. Assisted by Jaylen Washington.,30,28,1st Half,0:52,True,292,2025-11-22T22:44:50Z
401823325114799588,114799588,JumpShot,Keith Palek III missed Jumper.,30,28,1st Half,0:20,False,2623,2025-11-22T22:45:22Z
401823325114799589,114799589,Defensive Rebound,Zae Blake Defensive Rebound.,30,28,1st Half,0:17,False,292,2025-11-22T22:45:23Z
