play_id,sequence_number,type,description,away_score,home_score,period,clock,scoring_play,team_id,timestamp_utc
401709975102875201,102875201,Defensive Rebound,Andrew Nagy Defensive Rebound.,55,45,2nd Half,12:47,False,299,2024-11-28T04:15:10Z
401709975102875901,102875901,JumpShot,Devin Askew missed Jumper.,55,45,2nd Half,12:40,False,299,2024-11-28T04:15:16Z
401709975102876101,102876101,Defensive Rebound,Sadaidriene Hall Defensive Rebound.,55,45,2nd Half,12:38,False,23,2024-11-28T04:15:16Z
401709975102878501,102878501,JumpShot,Will McClendon missed Three Point Jumper.,55,45,2nd Half,12:14,False,23,2024-11-28T04:15:43Z
401709975102878601,102878601,Offensive Rebound,Sadraque NgaNga Offensive Rebound.,55,45,2nd Half,12:13,False,23,2024-11-28T04:15:43Z
401709975102878602,102878602,PersonalFoul,Foul on Kam Martin.,55,45,2nd Half,12:13,False,299,2024-11-28T04:15:43Z
401709975102879501,102879501,PersonalFoul,Foul on Andrew Nagy.,55,45,2nd Half,12:04,False,299,2024-11-28T04:16:14Z
401709975102879701,102879701,MadeFreeThrow,Latrell Davis made Free Throw.,56,45,2nd Half,12:02,True,23,2024-11-28T04:16:14Z
401709975102879702,102879702,MadeFreeThrow,Latrell Davis missed Free Throw.,56,45,2nd Half,12:02,False,23,2024-11-28T04:16:14Z
401709975102879703,102879703,Offensive Rebound,San José State Offensive Rebound.,56,45,2nd Half,12:02,False,23,2024-11-28T04:16:14Z
401709975102879704,102879704,MadeFreeThrow,Latrell Davis missed Free Throw.,56,45,2nd Half,12:02,False,23,2024-11-28T04:16:14Z
401709975102879801,102879801,Defensive Rebound,Derrick Michael Xzavierro Defensive Rebound.,56,45,2nd Half,12:01,False,299,2024-11-28T04:17:20Z
401709975102885101,102885101,OfficialTVTimeOut, Official TV Timeout,56,45,2nd Half,11:48,False,,2024-11-28T04:17:35Z
401709975102886801,102886801,JumpShot,Kam Martin missed Jumper.,56,45,2nd Half,11:31,False,299,2024-11-28T04:20:20Z
401709975102887101,102887101,Defensive Rebound,Latrell Davis Defensive Rebound.,56,45,2nd Half,11:28,False,23,2024-11-28T04:20:20Z
401709975102888901,102888901,JumpShot,Donavan Yap missed Three Point Jumper.,56,45,2nd Half,11:10,False,23,2024-11-28T04:20:42Z
401709975102889301,102889301,Defensive Rebound,Devin Askew Defensive Rebound.,56,45,2nd Half,11:06,False,299,2024-11-28T04:20:42Z
401709975102889701,102889701,JumpShot,Varick Lewis missed Three Point Jumper.,56,45,2nd Half,11:02,False,299,2024-11-28T04:20:48Z
401709975102894301,102894301,Defensive Rebound,Sadaidriene Hall Defensive Rebound.,56,45,2nd Half,10:56,False,23,2024-11-28T04:20:53Z
401709975102895101,102895101,LayUpShot,Latrell Davis made Layup.,58,45,2nd Half,10:48,True,23,2024-11-28T04:21:03Z
401709975102895102,102895102,PersonalFoul,Foul on Derrick Michael Xzavierro.,58,45,2nd Half,10:48,False,299,2024-11-28T04:21:03Z
401709975102895103,102895103,MadeFreeThrow,Latrell Davis missed Free Throw.,58,45,2nd Half,10:48,False,23,2024-11-28T04:21:03Z
401709975102895301,102895301,Defensive Rebound,Cam Denson Defensive Rebound.,58,45,2nd Half,10:46,False,299,2024-11-28T04:21:03Z
401709975102896901,102896901,LayUpShot,Austin Johnson made Layup.,58,47,2nd Half,10:30,True,299,2024-11-28T04:22:02Z
401709975102899601,102899601,LayUpShot,Latrell Davis made Layup.,60,47,2nd Half,10:03,True,23,2024-11-28T04:22:29Z
401709975102904801,102904801,JumpShot,Kam Martin missed Three Point Jumper.,60,47,2nd Half,9:51,False,299,2024-11-28T04:22:55Z
401709975102905201,102905201,Defensive Rebound,Robert Vaihola Defensive Rebound.,60,47,2nd Half,9:47,False,23,2024-11-28T04:22:55Z
401709975102907301,102907301,PersonalFoul,Foul on Eli Djordjevic.,60,47,2nd Half,9:26,False,299,2024-11-28T04:23:06Z
401709975102907302,102907302,MadeFreeThrow,Robert Vaihola missed Free Throw.,60,47,2nd Half,9:26,False,23,2024-11-28T04:23:06Z
401709975102907303,102907303,Offensive Rebound,San José State Offensive Rebound.,60,47,2nd Half,9:26,False,23,2024-11-28T04:23:06Z
401709975102907304,102907304,MadeFreeThrow,Robert Vaihola made Free Throw.,61,47,2nd Half,9:26,True,23,2024-11-28T04:23:06Z
401709975102909001,102909001,LayUpShot,Devin Askew missed Layup.,61,47,2nd Half,9:09,False,299,2024-11-28T04:24:10Z
401709975102909201,102909201,Defensive Rebound,Jermaine Washington Defensive Rebound.,61,47,2nd Half,9:07,False,23,2024-11-28T04:24:10Z
401709975102914001,102914001,LayUpShot,Latrell Davis made Layup.,63,47,2nd Half,8:59,True,23,2024-11-28T04:24:19Z
401709975102914501,102914501,ShortTimeOut,Long Beach State  Timeout,63,47,2nd Half,8:54,False,299,2024-11-28T04:24:25Z
401709975102916601,102916601,JumpShot,Devin Askew made Three Point Jumper.,63,50,2nd Half,8:33,True,299,2024-11-28T04:25:52Z
401709975102919101,102919101,Lost Ball Turnover,Latrell Davis Turnover.,63,50,2nd Half,8:08,False,23,2024-11-28T04:26:17Z
401709975102919102,102919102,Steal,Cam Denson Steal.,63,50,2nd Half,8:08,False,299,2024-11-28T04:26:17Z
401709975102919601,102919601,PersonalFoul,Foul on Josh Uduje.,63,50,2nd Half,8:03,False,23,2024-11-28T04:26:20Z
401709975102919602,102919602,MadeFreeThrow,Cam Denson missed Free Throw.,63,50,2nd Half,8:03,False,299,2024-11-28T04:26:20Z
401709975102919603,102919603,Offensive Rebound,Long Beach State Offensive Rebound.,63,50,2nd Half,8:03,False,299,2024-11-28T04:26:20Z
401709975102919604,102919604,MadeFreeThrow,Cam Denson missed Free Throw.,63,50,2nd Half,8:03,False,299,2024-11-28T04:26:20Z
401709975102919801,102919801,Defensive Rebound,Sadaidriene Hall Defensive Rebound.,63,50,2nd Half,8:01,False,23,2024-11-28T04:27:19Z
401709975102919802,102919802,PersonalFoul,Foul on Andrew Nagy.,63,50,2nd Half,8:01,False,299,2024-11-28T04:27:19Z
401709975102926301,102926301,LayUpShot,Latrell Davis made Layup. Assisted by Donavan Yap.,65,50,2nd Half,7:36,True,23,2024-11-28T04:28:03Z
401709975102927501,102927501,JumpShot,Devin Askew missed Three Point Jumper.,65,50,2nd Half,7:24,False,299,2024-11-28T04:28:16Z
401709975102927801,102927801,Defensive Rebound,Sadaidriene Hall Defensive Rebound.,65,50,2nd Half,7:21,False,23,2024-11-28T04:28:16Z
401709975102929501,102929501,LayUpShot,Will McClendon missed Layup.,65,50,2nd Half,7:04,False,23,2024-11-28T04:28:35Z
401709975102929601,102929601,Offensive Rebound,San José State Offensive Rebound.,65,50,2nd Half,7:03,False,23,2024-11-28T04:28:35Z
401709975102929602,102929602,OfficialTVTimeOut, Official TV Timeout,65,50,2nd Half,7:03,False,,2024-11-28T04:28:35Z
401709975102934801,102934801,Lost Ball Turnover,San José State  Turnover.,65,50,2nd Half,6:51,False,23,2024-11-28T04:31:12Z
401709975102936701,102936701,JumpShot,Devin Askew missed Three Point Jumper.,65,50,2nd Half,6:32,False,299,2024-11-28T04:31:41Z
401709975102937101,102937101,Defensive Rebound,Will McClendon Defensive Rebound.,65,50,2nd Half,6:28,False,23,2024-11-28T04:31:44Z
401709975102939101,102939101,LayUpShot,Will McClendon made Layup. Assisted by Latrell Davis.,67,50,2nd Half,6:08,True,23,2024-11-28T04:32:04Z
401709975102944801,102944801,LayUpShot,Eli Djordjevic made Layup. Assisted by Kam Martin.,67,52,2nd Half,5:51,True,299,2024-11-28T04:32:22Z
401709975102947601,102947601,Lost Ball Turnover,Sadaidriene Hall Turnover.,67,52,2nd Half,5:23,False,23,2024-11-28T04:32:51Z
401709975102947602,102947602,Steal,Kam Martin Steal.,67,52,2nd Half,5:23,False,299,2024-11-28T04:32:51Z
401709975102948101,102948101,LayUpShot,Kam Martin missed Layup.,67,52,2nd Half,5:18,False,299,2024-11-28T04:32:57Z
401709975102948501,102948501,Offensive Rebound,Eli Djordjevic Offensive Rebound.,67,52,2nd Half,5:14,False,299,2024-11-28T04:32:57Z
401709975102948502,102948502,JumpShot,Eli Djordjevic made Jumper.,67,54,2nd Half,5:14,True,299,2024-11-28T04:32:57Z
401709975102954101,102954101,JumpShot,Will McClendon made Three Point Jumper. Assisted by Sadaidriene Hall.,70,54,2nd Half,4:58,True,23,2024-11-28T04:33:15Z
401709975102954301,102954301,ShortTimeOut,San José State  Timeout,70,54,2nd Half,4:56,False,23,2024-11-28T04:33:15Z
401709975102955901,102955901,JumpShot,Eli Djordjevic missed Three Point Jumper.,70,54,2nd Half,4:40,False,299,2024-11-28T04:34:25Z
401709975102956201,102956201,Defensive Rebound,Will McClendon Defensive Rebound.,70,54,2nd Half,4:37,False,23,2024-11-28T04:34:25Z
401709975102958401,102958401,LayUpShot,Robert Vaihola made Layup. Assisted by Donavan Yap.,72,54,2nd Half,4:15,True,23,2024-11-28T04:34:49Z
401709975102964501,102964501,PersonalFoul,Foul on Donavan Yap.,72,54,2nd Half,3:54,False,23,2024-11-28T04:35:11Z
401709975102964502,102964502,OfficialTVTimeOut, Official TV Timeout,72,54,2nd Half,3:54,False,,2024-11-28T04:35:11Z
401709975102965001,102965001,LayUpShot,Derrick Michael Xzavierro made Layup. Assisted by Kam Martin.,72,56,2nd Half,3:49,True,299,2024-11-28T04:37:28Z
401709975102968701,102968701,LayUpShot,Will McClendon missed Layup.,72,56,2nd Half,3:12,False,23,2024-11-28T04:38:03Z
401709975102968801,102968801,Defensive Rebound,Derrick Michael Xzavierro Defensive Rebound.,72,56,2nd Half,3:11,False,299,2024-11-28T04:38:03Z
401709975102968802,102968802,PersonalFoul,Foul on Will McClendon.,72,56,2nd Half,3:11,False,23,2024-11-28T04:38:03Z
401709975102975101,102975101,JumpShot,Devin Askew missed Jumper.,72,56,2nd Half,2:48,False,299,2024-11-28T04:38:48Z
401709975102975501,102975501,Defensive Rebound,Robert Vaihola Defensive Rebound.,72,56,2nd Half,2:44,False,23,2024-11-28T04:38:51Z
401709975102978101,102978101,LayUpShot,Josh Uduje missed Layup.,72,56,2nd Half,2:18,False,23,2024-11-28T04:39:18Z
401709975102978301,102978301,Defensive Rebound,Derrick Michael Xzavierro Defensive Rebound.,72,56,2nd Half,2:16,False,299,2024-11-28T04:39:18Z
401709975102978801,102978801,PersonalFoul,Foul on Robert Vaihola.,72,56,2nd Half,2:11,False,23,2024-11-28T04:39:28Z
401709975102978802,102978802,MadeFreeThrow,Devin Askew made Free Throw.,72,57,2nd Half,2:11,True,299,2024-11-28T04:39:28Z
401709975102978803,102978803,MadeFreeThrow,Devin Askew made Free Throw.,72,58,2nd Half,2:11,True,299,2024-11-28T04:39:28Z
401709975102985101,102985101,LayUpShot,Robert Vaihola made Layup. Assisted by Will McClendon.,74,58,2nd Half,1:48,True,23,2024-11-28T04:40:36Z
401709975102985701,102985701,PersonalFoul,Foul on Donavan Yap.,74,58,2nd Half,1:42,False,23,2024-11-28T04:40:42Z
401709975102985702,102985702,MadeFreeThrow,Kam Martin made Free Throw.,74,59,2nd Half,1:42,True,299,2024-11-28T04:40:42Z
401709975102985703,102985703,MadeFreeThrow,Kam Martin made Free Throw.,74,60,2nd Half,1:42,True,299,2024-11-28T04:40:42Z
401709975102985704,102985704,RegularTimeOut,Long Beach State  Timeout,74,60,2nd Half,1:42,False,299,2024-11-28T04:40:42Z
401709975102986201,102986201,LayUpShot,Josh Uduje made Layup.,76,60,2nd Half,1:37,True,23,2024-11-28T04:43:05Z
401709975102986202,102986202,PersonalFoul,Foul on Austin Johnson.,76,60,2nd Half,1:37,False,299,2024-11-28T04:43:05Z
401709975102986203,102986203,MadeFreeThrow,Josh Uduje made Free Throw.,77,60,2nd Half,1:37,True,23,2024-11-28T04:43:05Z
401709975102987901,102987901,JumpShot,Kam Martin made Jumper.,77,62,2nd Half,1:20,True,299,2024-11-28T04:43:51Z
401709975102994001,102994001,LayUpShot,Josh Uduje made Layup. Assisted by Will McClendon.,79,62,2nd Half,0:59,True,23,2024-11-28T04:44:11Z
401709975102994701,102994701,LayUpShot,Devin Askew made Layup.,79,64,2nd Half,0:52,True,299,2024-11-28T04:44:17Z
401709975102995401,102995401,PersonalFoul,Foul on Kam Martin.,79,64,2nd Half,0:45,False,299,2024-11-28T04:44:31Z
401709975102995402,102995402,MadeFreeThrow,Latrell Davis missed Free Throw.,79,64,2nd Half,0:45,False,23,2024-11-28T04:44:31Z
401709975102995501,102995501,Defensive Rebound,Devin Askew Defensive Rebound.,79,64,2nd Half,0:44,False,299,2024-11-28T04:45:06Z
401709975102995901,102995901,LayUpShot,Devin Askew made Layup.,79,66,2nd Half,0:40,True,299,2024-11-28T04:45:12Z
401709975102998701,102998701,JumpShot,Will McClendon made Three Point Jumper.,82,66,2nd Half,0:12,True,23,2024-11-28T04:45:52Z
401709975102999601,102999601,JumpShot,Devin Askew missed Jumper.,82,66,2nd Half,0:03,False,299,2024-11-28T04:46:04Z
401709975102999901,102999901,Defensive Rebound,Robert Vaihola Defensive Rebound.,82,66,2nd Half,0:00,False,23,2024-11-28T04:46:06Z
401709975102999902,102999902,End Period,End of 2nd half,82,66,2nd Half,0:00,False,,2024-11-28T04:46:04Z
401709975102999903,102999903,End Game,End of Game,82,66,2nd Half,0:00,False,,2024-11-28T04:46:04Z
