play_id,sequence_number,type,description,away_score,home_score,period,clock,scoring_play,team_id,timestamp_utc
401700469102868902,102868902,Block Shot,Tre'Von Spillers Block.,38,47,2nd Half,13:10,False,154,2024-12-18T01:25:19Z
401700469102869101,102869101,Offensive Rebound,Ebenezer Dowuona Offensive Rebound.,38,47,2nd Half,13:08,False,256,2024-12-18T01:25:19Z
401700469102869102,102869102,PersonalFoul,Foul on Cameron Hildreth.,38,47,2nd Half,13:08,False,154,2024-12-18T01:25:19Z
401700469102869103,102869103,MadeFreeThrow,Ebenezer Dowuona missed Free Throw.,38,47,2nd Half,13:08,False,256,2024-12-18T01:25:19Z
401700469102869104,102869104,Dead Ball Rebound,James Madison Deadball Team Rebound.,38,47,2nd Half,13:08,False,256,2024-12-18T01:25:19Z
401700469102869105,102869105,MadeFreeThrow,Ebenezer Dowuona missed Free Throw.,38,47,2nd Half,13:08,False,256,2024-12-18T01:25:19Z
401700469102869106,102869106,Defensive Rebound,Churchill Abass Defensive Rebound.,38,47,2nd Half,13:08,False,154,2024-12-18T01:25:19Z
401700469102875401,102875401,JumpShot,Davin Cosby made Three Point Jumper. Assisted by Cameron Hildreth.,38,50,2nd Half,12:45,True,154,2024-12-18T01:26:37Z
401700469102877701,102877701,JumpShot,Eddie Ricks III made Three Point Jumper. Assisted by Bryce Lindsay.,41,50,2nd Half,12:22,True,256,2024-12-18T01:26:59Z
401700469102885201,102885201,JumpShot,Hunter Sallis missed Jumper.,41,50,2nd Half,11:47,False,154,2024-12-18T01:27:45Z
401700469102885401,102885401,Offensive Rebound,Churchill Abass Offensive Rebound.,41,50,2nd Half,11:45,False,154,2024-12-18T01:27:45Z
401700469102885501,102885501,LayUpShot,Churchill Abass missed Layup.,41,50,2nd Half,11:44,False,154,2024-12-18T01:27:45Z
401700469102885601,102885601,Offensive Rebound,Hunter Sallis Offensive Rebound.,41,50,2nd Half,11:43,False,154,2024-12-18T01:27:45Z
401700469102885701,102885701,LayUpShot,Hunter Sallis made Layup.,41,52,2nd Half,11:42,True,154,2024-12-18T01:27:45Z
401700469102886901,102886901,Lost Ball Turnover,Xavier Brown Turnover.,41,52,2nd Half,11:30,False,256,2024-12-18T01:27:54Z
401700469102886902,102886902,Steal,Hunter Sallis Steal.,41,52,2nd Half,11:30,False,154,2024-12-18T01:27:57Z
401700469102888001,102888001,JumpShot,Hunter Sallis made Jumper.,41,54,2nd Half,11:19,True,154,2024-12-18T01:28:04Z
401700469102894101,102894101,PersonalFoul,Foul on Ebenezer Dowuona.,41,54,2nd Half,10:58,False,256,2024-12-18T01:28:22Z
401700469102894102,102894102,Lost Ball Turnover,Ebenezer Dowuona Turnover.,41,54,2nd Half,10:58,False,256,2024-12-18T01:28:22Z
401700469102894103,102894103,OfficialTVTimeOut, Official TV Timeout,41,54,2nd Half,10:58,False,,2024-12-18T01:28:22Z
401700469102896001,102896001,JumpShot,Davin Cosby made Three Point Jumper. Assisted by Efton Reid III.,41,57,2nd Half,10:39,True,154,2024-12-18T01:32:27Z
401700469102898001,102898001,JumpShot,Elijah Hutchins-Everett missed Three Point Jumper.,41,57,2nd Half,10:19,False,256,2024-12-18T01:32:47Z
401700469102898401,102898401,Defensive Rebound,Cameron Hildreth Defensive Rebound.,41,57,2nd Half,10:15,False,154,2024-12-18T01:32:51Z
401700469102904901,102904901,JumpShot,Davin Cosby missed Three Point Jumper.,41,57,2nd Half,9:50,False,154,2024-12-18T01:32:51Z
401700469102905201,102905201,Offensive Rebound,Tre'Von Spillers Offensive Rebound.,41,57,2nd Half,9:47,False,154,2024-12-18T01:33:31Z
401700469102905501,102905501,JumpShot,Davin Cosby missed Three Point Jumper.,41,57,2nd Half,9:44,False,154,2024-12-18T01:33:31Z
401700469102905801,102905801,Offensive Rebound,Davin Cosby Offensive Rebound.,41,57,2nd Half,9:41,False,154,2024-12-18T01:33:31Z
401700469102906101,102906101,LayUpShot,Davin Cosby made Layup.,41,59,2nd Half,9:38,True,154,2024-12-18T01:33:31Z
401700469102907601,102907601,JumpShot,AJ Smith missed Three Point Jumper.,41,59,2nd Half,9:23,False,256,2024-12-18T01:34:30Z
401700469102908001,102908001,Offensive Rebound,Eddie Ricks III Offensive Rebound.,41,59,2nd Half,9:19,False,256,2024-12-18T01:34:35Z
401700469102914001,102914001,JumpShot,Justin Taylor missed Three Point Jumper.,41,59,2nd Half,8:59,False,256,2024-12-18T01:34:57Z
401700469102914301,102914301,Defensive Rebound,Davin Cosby Defensive Rebound.,41,59,2nd Half,8:56,False,154,2024-12-18T01:34:57Z
401700469102916701,102916701,LayUpShot,Tre'Von Spillers missed Layup.,41,59,2nd Half,8:32,False,154,2024-12-18T01:35:21Z
401700469102916702,102916702,Block Shot,Eddie Ricks III Block.,41,59,2nd Half,8:32,False,256,2024-12-18T01:35:21Z
401700469102916901,102916901,Defensive Rebound,AJ Smith Defensive Rebound.,41,59,2nd Half,8:30,False,256,2024-12-18T01:35:24Z
401700469102917501,102917501,JumpShot,Xavier Brown made Jumper.,43,59,2nd Half,8:24,True,256,2024-12-18T01:35:28Z
401700469102919401,102919401,JumpShot,Hunter Sallis missed Jumper.,43,59,2nd Half,8:05,False,154,2024-12-18T01:35:51Z
401700469102919701,102919701,Offensive Rebound,Wake Forest Offensive Rebound.,43,59,2nd Half,8:02,False,154,2024-12-18T01:35:51Z
401700469102924401,102924401,JumpShot,Hunter Sallis missed Three Point Jumper.,43,59,2nd Half,7:55,False,154,2024-12-18T01:36:33Z
401700469102924701,102924701,Offensive Rebound,Tre'Von Spillers Offensive Rebound.,43,59,2nd Half,7:52,False,154,2024-12-18T01:36:33Z
401700469102925601,102925601,JumpShot,Efton Reid III made Jumper. Assisted by Hunter Sallis.,43,61,2nd Half,7:43,True,154,2024-12-18T01:36:41Z
401700469102927701,102927701,JumpShot,Mark Freeman missed Jumper.,43,61,2nd Half,7:22,False,256,2024-12-18T01:37:07Z
401700469102927901,102927901,OfficialTVTimeOut, Official TV Timeout,43,61,2nd Half,7:20,False,,2024-12-18T01:37:05Z
401700469102928001,102928001,Defensive Rebound,Wake Forest Defensive Rebound.,43,61,2nd Half,7:19,False,154,2024-12-18T01:37:07Z
401700469102934001,102934001,LayUpShot,Efton Reid III made Layup. Assisted by Hunter Sallis.,43,63,2nd Half,6:59,True,154,2024-12-18T01:41:11Z
401700469102935301,102935301,JumpShot,Luke Anderson made Three Point Jumper. Assisted by Bryce Lindsay.,46,63,2nd Half,6:46,True,256,2024-12-18T01:41:26Z
401700469102938501,102938501,JumpShot,Efton Reid III missed Three Point Jumper.,46,63,2nd Half,6:14,False,154,2024-12-18T01:41:58Z
401700469102938701,102938701,Offensive Rebound,Tre'Von Spillers Offensive Rebound.,46,63,2nd Half,6:12,False,154,2024-12-18T01:41:58Z
401700469102944901,102944901,JumpShot,Hunter Sallis made Jumper.,46,65,2nd Half,5:50,True,154,2024-12-18T01:42:21Z
401700469102946401,102946401,PersonalFoul,Foul on Cameron Hildreth.,46,65,2nd Half,5:35,False,154,2024-12-18T01:42:35Z
401700469102948301,102948301,JumpShot,Eddie Ricks III missed Three Point Jumper.,46,65,2nd Half,5:16,False,256,2024-12-18T01:44:05Z
401700469102948601,102948601,Offensive Rebound,James Madison Offensive Rebound.,46,65,2nd Half,5:13,False,256,2024-12-18T01:44:10Z
401700469102949201,102949201,Lost Ball Turnover,Mark Freeman Turnover.,46,65,2nd Half,5:07,False,256,2024-12-18T01:44:27Z
401700469102949202,102949202,Steal,Tre'Von Spillers Steal.,46,65,2nd Half,5:07,False,154,2024-12-18T01:44:27Z
401700469102954501,102954501,LayUpShot,Efton Reid III made Layup. Assisted by Davin Cosby.,46,67,2nd Half,4:54,True,154,2024-12-18T01:44:41Z
401700469102956901,102956901,JumpShot,Bryce Lindsay missed Three Point Jumper.,46,67,2nd Half,4:30,False,256,2024-12-18T01:45:06Z
401700469102957201,102957201,Defensive Rebound,Hunter Sallis Defensive Rebound.,46,67,2nd Half,4:27,False,154,2024-12-18T01:45:06Z
401700469102959501,102959501,JumpShot,Cameron Hildreth missed Jumper.,46,67,2nd Half,4:04,False,154,2024-12-18T01:45:31Z
401700469102959902,102959902,Defensive Rebound,Luke Anderson Defensive Rebound.,46,67,2nd Half,4:00,False,256,2024-12-18T01:45:35Z
401700469102964801,102964801,JumpShot,Luke Anderson made Three Point Jumper. Assisted by Bryce Lindsay.,49,67,2nd Half,3:51,True,256,2024-12-18T01:45:43Z
401700469102964901,102964901,ShortTimeOut,Wake Forest  Timeout,49,67,2nd Half,3:50,False,154,2024-12-18T01:45:43Z
401700469102964902,102964902,OfficialTVTimeOut, Official TV Timeout,49,67,2nd Half,3:50,False,,2024-12-18T01:45:43Z
401700469102966901,102966901,Lost Ball Turnover,Davin Cosby Turnover.,49,67,2nd Half,3:30,False,154,2024-12-18T01:49:34Z
401700469102966902,102966902,Steal,Bryce Lindsay Steal.,49,67,2nd Half,3:30,False,256,2024-12-18T01:49:34Z
401700469102967201,102967201,PersonalFoul,Foul on Cameron Hildreth.,49,67,2nd Half,3:27,False,154,2024-12-18T01:49:34Z
401700469102967202,102967202,MadeFreeThrow,Mark Freeman made Free Throw.,50,67,2nd Half,3:27,True,256,2024-12-18T01:49:34Z
401700469102967203,102967203,MadeFreeThrow,Mark Freeman made Free Throw.,51,67,2nd Half,3:27,True,256,2024-12-18T01:49:34Z
401700469102969101,102969101,Lost Ball Turnover,Efton Reid III Turnover.,51,67,2nd Half,3:08,False,154,2024-12-18T01:51:03Z
401700469102969102,102969102,Steal,Eddie Ricks III Steal.,51,67,2nd Half,3:08,False,256,2024-12-18T01:51:06Z
401700469102974601,102974601,JumpShot,Mark Freeman missed Jumper.,51,67,2nd Half,2:53,False,256,2024-12-18T01:51:55Z
401700469102974801,102974801,Defensive Rebound,Tre'Von Spillers Defensive Rebound.,51,67,2nd Half,2:51,False,154,2024-12-18T01:51:55Z
401700469102976201,102976201,JumpShot,Davin Cosby missed Three Point Jumper.,51,67,2nd Half,2:37,False,154,2024-12-18T01:51:58Z
401700469102976701,102976701,Offensive Rebound,Tre'Von Spillers Offensive Rebound.,51,67,2nd Half,2:32,False,154,2024-12-18T01:51:58Z
401700469102976702,102976702,JumpShot,Hunter Sallis made Three Point Jumper. Assisted by Tre'Von Spillers.,51,70,2nd Half,2:32,True,154,2024-12-18T01:51:58Z
401700469102978601,102978601,JumpShot,Luke Anderson made Three Point Jumper. Assisted by Mark Freeman.,54,70,2nd Half,2:13,True,256,2024-12-18T01:52:02Z
401700469102978801,102978801,ShortTimeOut,James Madison  Timeout,54,70,2nd Half,2:11,False,256,2024-12-18T01:52:02Z
401700469102984201,102984201,JumpShot,Tre'Von Spillers missed Three Point Jumper.,54,70,2nd Half,1:57,False,154,2024-12-18T01:53:42Z
401700469102984601,102984601,Defensive Rebound,Eddie Ricks III Defensive Rebound.,54,70,2nd Half,1:53,False,256,2024-12-18T01:53:42Z
401700469102986101,102986101,PersonalFoul,Foul on Cameron Hildreth.,54,70,2nd Half,1:38,False,154,2024-12-18T01:54:17Z
401700469102986102,102986102,MadeFreeThrow,Bryce Lindsay made Free Throw.,55,70,2nd Half,1:38,True,256,2024-12-18T01:54:17Z
401700469102986103,102986103,MadeFreeThrow,Bryce Lindsay made Free Throw.,56,70,2nd Half,1:38,True,256,2024-12-18T01:54:17Z
401700469102988401,102988401,JumpShot,Hunter Sallis made Three Point Jumper. Assisted by Efton Reid III.,56,73,2nd Half,1:15,True,154,2024-12-18T01:55:14Z
401700469102994401,102994401,JumpShot,Luke Anderson missed Three Point Jumper.,56,73,2nd Half,0:55,False,256,2024-12-18T01:55:17Z
401700469102994701,102994701,Defensive Rebound,Efton Reid III Defensive Rebound.,56,73,2nd Half,0:52,False,154,2024-12-18T01:55:17Z
401700469102996201,102996201,LayUpShot,Cameron Hildreth made Layup.,56,75,2nd Half,0:37,True,154,2024-12-18T01:55:34Z
401700469102997601,102997601,JumpShot,Redd Thompson Jr. missed Three Point Jumper.,56,75,2nd Half,0:23,False,256,2024-12-18T01:55:54Z
401700469102997901,102997901,Offensive Rebound,Luke Anderson Offensive Rebound.,56,75,2nd Half,0:20,False,256,2024-12-18T01:55:54Z
401700469102998001,102998001,LayUpShot,Luke Anderson made Layup.,58,75,2nd Half,0:19,True,256,2024-12-18T01:55:57Z
401700469102999901,102999901,End Period,End of 2nd half,58,75,2nd Half,0:00,False,,2024-12-18T01:55:57Z
401700469102999902,102999902,End Game,End of Game,58,75,2nd Half,0:00,False,,2024-12-18T01:55:57Z
