play_id,sequence_number,type,description,away_score,home_score,period,clock,scoring_play,team_id,timestamp_utc
401743879113293037,113293037,Substitution,Jerome Hunter subbing in for Xavier,84,82,2nd Half,0:15,False,2752,2025-03-13T20:32:33Z
401743879113293044,113293044,PersonalFoul,Foul on Dailyn Swain.,84,82,2nd Half,0:14,False,2752,2025-03-13T20:33:04Z
401743879113293095,113293095,RegularTimeOut,Marquette Timeout,84,82,2nd Half,0:14,False,269,2025-03-13T20:33:34Z
401743879113293206,113293206,PersonalFoul,Foul on Ryan Conwell.,84,82,2nd Half,0:12,False,2752,2025-03-13T20:35:28Z
401743879113293231,113293231,PersonalFoul,Foul on Jerome Hunter.,84,82,2nd Half,0:10,False,2752,2025-03-13T20:36:02Z
401743879113293240,113293240,PersonalFoul,Foul on Dailyn Swain.,84,82,2nd Half,0:10,False,2752,2025-03-13T20:36:26Z
401743879113293269,113293269,Substitution,Jerome Hunter subbing out for Xavier,84,82,2nd Half,0:10,False,2752,2025-03-13T20:36:33Z
401743879113293270,113293270,Substitution,Zach Freemantle subbing in for Xavier,84,82,2nd Half,0:10,False,2752,2025-03-13T20:36:33Z
401743879113293285,113293285,MadeFreeThrow,Ben Gold made Free Throw.,85,82,2nd Half,0:10,True,269,2025-03-13T20:37:00Z
401743879113293295,113293295,MadeFreeThrow,Ben Gold missed Free Throw.,85,82,2nd Half,0:10,False,269,2025-03-13T20:37:22Z
401743879113293296,113293296,Defensive Rebound,Marcus Foster Defensive Rebound.,85,82,2nd Half,0:09,False,2752,2025-03-13T20:37:23Z
401743879113293299,113293299,PersonalFoul,Foul on Kam Jones.,85,82,2nd Half,0:06,False,269,2025-03-13T20:37:30Z
401743879113293317,113293317,MadeFreeThrow,Ryan Conwell made Free Throw.,85,83,2nd Half,0:06,True,2752,2025-03-13T20:38:00Z
401743879113293434,113293434,MadeFreeThrow,Ryan Conwell made Free Throw.,85,84,2nd Half,0:06,True,2752,2025-03-13T20:38:22Z
401743879113293435,113293435,Substitution,Zach Freemantle subbing out for Xavier,85,84,2nd Half,0:06,False,2752,2025-03-13T20:38:25Z
401743879113293437,113293437,Substitution,Jerome Hunter subbing in for Xavier,85,84,2nd Half,0:06,False,2752,2025-03-13T20:38:25Z
401743879113293696,113293696,PersonalFoul,Foul on Dailyn Swain.,85,84,2nd Half,0:06,False,2752,2025-03-13T20:38:50Z
401743879113293729,113293729,Substitution,Jerome Hunter subbing out for Xavier,85,84,2nd Half,0:06,False,2752,2025-03-13T20:40:16Z
401743879113293730,113293730,Substitution,Dailyn Swain subbing out for Xavier,85,84,2nd Half,0:06,False,2752,2025-03-13T20:40:16Z
401743879113293732,113293732,Substitution,Dante Maddox Jr. subbing in for Xavier,85,84,2nd Half,0:06,False,2752,2025-03-13T20:40:16Z
401743879113293733,113293733,Substitution,Zach Freemantle subbing in for Xavier,85,84,2nd Half,0:06,False,2752,2025-03-13T20:40:16Z
401743879113293790,113293790,MadeFreeThrow,Stevie Mitchell made Free Throw.,86,84,2nd Half,0:06,True,269,2025-03-13T20:40:05Z
401743879113293810,113293810,Substitution,Kam Jones subbing out for Marquette,86,84,2nd Half,0:06,False,269,2025-03-13T20:40:23Z
401743879113293811,113293811,Substitution,David Joplin subbing out for Marquette,86,84,2nd Half,0:06,False,269,2025-03-13T20:40:23Z
401743879113293812,113293812,Substitution,Tre Norman subbing in for Marquette,86,84,2nd Half,0:06,False,269,2025-03-13T20:40:23Z
401743879113293813,113293813,Substitution,Zaide Lowery subbing in for Marquette,86,84,2nd Half,0:06,False,269,2025-03-13T20:40:23Z
401743879113293824,113293824,MadeFreeThrow,Stevie Mitchell made Free Throw.,87,84,2nd Half,0:06,True,269,2025-03-13T20:40:35Z
401743879113293834,113293834,PersonalFoul,Foul on Chase Ross.,87,84,2nd Half,0:04,False,269,2025-03-13T20:40:44Z
401743879113293843,113293843,Substitution,Tre Norman subbing out for Marquette,87,84,2nd Half,0:04,False,269,2025-03-13T20:41:29Z
401743879113293845,113293845,Substitution,Zaide Lowery subbing out for Marquette,87,84,2nd Half,0:04,False,269,2025-03-13T20:41:29Z
401743879113293867,113293867,Substitution,Kam Jones subbing in for Marquette,87,84,2nd Half,0:04,False,269,2025-03-13T20:41:29Z
401743879113293868,113293868,Substitution,David Joplin subbing in for Marquette,87,84,2nd Half,0:04,False,269,2025-03-13T20:41:29Z
401743879113293912,113293912,MadeFreeThrow,Ryan Conwell missed Free Throw.,87,84,2nd Half,0:03,False,2752,2025-03-13T20:41:39Z
401743879113293917,113293917,Defensive Rebound,Chase Ross Defensive Rebound.,87,84,2nd Half,0:03,False,269,2025-03-13T20:41:44Z
401743879113293919,113293919,PersonalFoul,Foul on Marcus Foster.,87,84,2nd Half,0:02,False,2752,2025-03-13T20:41:47Z
401743879113293970,113293970,MadeFreeThrow,Chase Ross made Free Throw.,88,84,2nd Half,0:02,True,269,2025-03-13T20:42:39Z
401743879113293981,113293981,MadeFreeThrow,Chase Ross made Free Throw.,89,84,2nd Half,0:02,True,269,2025-03-13T20:42:59Z
401743879113294014,113294014,JumpShot,Ryan Conwell made Three Point Jumper.,89,87,2nd Half,0:00,True,2752,2025-03-13T20:43:07Z
401743879113294020,113294020,End Period,End of 2nd half,89,87,2nd Half,0:00,False,,2025-03-13T20:43:11Z
401743879113294021,113294021,End Game,End of Game,89,87,2nd Half,0:00,False,,2025-03-13T20:43:13Z
