play_id,sequence_number,type,description,away_score,home_score,period,clock,scoring_play,team_id,timestamp_utc
401706679101805401,101805401,LayUpShot,Jermaine Ballisager Webb made Layup. Assisted by Max Mackinnon.,0,2,1st Half,19:45,True,2501,2025-01-05T03:03:35Z
401706679101806801,101806801,LayUpShot,Mitchell Saxen made Layup. Assisted by Augustas Marciulionis.,2,2,1st Half,19:31,True,2608,2025-01-05T03:03:50Z
401706679101808701,101808701,JumpShot,Austin Rapp missed Three Point Jumper.,2,2,1st Half,19:12,False,2501,2025-01-05T03:04:10Z
401706679101809101,101809101,Offensive Rebound,Bol Dengdit Offensive Rebound.,2,2,1st Half,19:08,False,2501,2025-01-05T03:04:12Z
401706679101814301,101814301,JumpShot,Bol Dengdit made Jumper.,2,4,1st Half,18:56,True,2501,2025-01-05T03:04:25Z
401706679101816901,101816901,LayUpShot,Mitchell Saxen missed Layup.,2,4,1st Half,18:30,False,2608,2025-01-05T03:04:51Z
401706679101817301,101817301,Offensive Rebound,Paulius Murauskas Offensive Rebound.,2,4,1st Half,18:26,False,2608,2025-01-05T03:04:51Z
401706679101817302,101817302,JumpShot,Paulius Murauskas missed Jumper.,2,4,1st Half,18:26,False,2608,2025-01-05T03:04:55Z
401706679101817303,101817303,LayUpShot,Paulius Murauskas missed Layup.,2,4,1st Half,18:26,False,2608,2025-01-05T03:48:51Z
401706679101817304,101817304,Offensive Rebound,Paulius Murauskas Offensive Rebound.,2,4,1st Half,18:26,False,2608,2025-01-05T03:48:51Z
401706679101817305,101817305,LayUpShot,Paulius Murauskas missed Layup.,2,4,1st Half,18:26,False,2608,2025-01-05T03:48:51Z
401706679101817306,101817306,Offensive Rebound,Paulius Murauskas Offensive Rebound.,2,4,1st Half,18:26,False,2608,2025-01-05T03:48:51Z
401706679101817701,101817701,Defensive Rebound,Austin Rapp Defensive Rebound.,2,4,1st Half,18:22,False,2501,2025-01-05T03:04:57Z
401706679101818301,101818301,Lost Ball Turnover,Vincent Delano Turnover.,2,4,1st Half,18:16,False,2501,2025-01-05T03:05:05Z
401706679101818302,101818302,Steal,Paulius Murauskas Steal.,2,4,1st Half,18:16,False,2608,2025-01-05T03:05:05Z
401706679101818401,101818401,PersonalFoul,Foul on Bol Dengdit.,2,4,1st Half,18:15,False,2501,2025-01-05T03:05:05Z
401706679101824901,101824901,LayUpShot,Mitchell Saxen missed Layup.,2,4,1st Half,17:50,False,2608,2025-01-05T03:05:51Z
401706679101825201,101825201,Defensive Rebound,Vincent Delano Defensive Rebound.,2,4,1st Half,17:47,False,2501,2025-01-05T03:05:53Z
401706679101825601,101825601,JumpShot,Max Mackinnon made Three Point Jumper. Assisted by Vincent Delano.,2,7,1st Half,17:43,True,2501,2025-01-05T03:05:58Z
401706679101828501,101828501,PersonalFoul,Foul on Austin Rapp.,2,7,1st Half,17:14,False,2501,2025-01-05T03:06:29Z
401706679101829901,101829901,JumpShot,Jordan Ross made Three Point Jumper. Assisted by Paulius Murauskas.,5,7,1st Half,17:00,True,2608,2025-01-05T03:07:05Z
401706679101836101,101836101,Lost Ball Turnover,Max Mackinnon Turnover.,5,7,1st Half,16:38,False,2501,2025-01-05T03:07:26Z
401706679101836102,101836102,Steal,Augustas Marciulionis Steal.,5,7,1st Half,16:38,False,2608,2025-01-05T03:07:26Z
401706679101836901,101836901,JumpShot,Luke Barrett missed Three Point Jumper.,5,7,1st Half,16:30,False,2608,2025-01-05T03:07:35Z
401706679101837101,101837101,Defensive Rebound,Portland Defensive Rebound.,5,7,1st Half,16:28,False,2501,2025-01-05T03:07:37Z
401706679101838601,101838601,JumpShot,Vincent Delano missed Three Point Jumper.,5,7,1st Half,16:13,False,2501,2025-01-05T03:08:07Z
401706679101839001,101839001,Defensive Rebound,Augustas Marciulionis Defensive Rebound.,5,7,1st Half,16:09,False,2608,2025-01-05T03:08:09Z
401706679101844401,101844401,JumpShot,Luke Barrett missed Three Point Jumper.,5,7,1st Half,15:55,False,2608,2025-01-05T03:08:26Z
401706679101844801,101844801,Offensive Rebound,Paulius Murauskas Offensive Rebound.,5,7,1st Half,15:51,False,2608,2025-01-05T03:08:28Z
401706679101844802,101844802,PersonalFoul,Foul on Jermaine Ballisager Webb.,5,7,1st Half,15:51,False,2501,2025-01-05T03:08:28Z
401706679101844803,101844803,OfficialTVTimeOut, Official TV Timeout,5,7,1st Half,15:51,False,,2025-01-05T03:08:28Z
401706679101844804,101844804,MadeFreeThrow,Paulius Murauskas missed Free Throw.,5,7,1st Half,15:51,False,2608,2025-01-05T03:11:14Z
401706679101844805,101844805,Offensive Rebound,Saint Mary's Offensive Rebound.,5,7,1st Half,15:51,False,2608,2025-01-05T03:11:14Z
401706679101844806,101844806,MadeFreeThrow,Paulius Murauskas made Free Throw.,6,7,1st Half,15:51,True,2608,2025-01-05T03:11:14Z
401706679101845801,101845801,LayUpShot,Max Mackinnon made Layup. Assisted by Austin Rapp.,6,9,1st Half,15:41,True,2501,2025-01-05T03:12:01Z
401706679101848701,101848701,LayUpShot,Paulius Murauskas made Layup.,8,9,1st Half,15:12,True,2608,2025-01-05T03:12:28Z
401706679101854101,101854101,LayUpShot,Austin Rapp missed Layup.,8,9,1st Half,14:58,False,2501,2025-01-05T03:12:48Z
401706679101854501,101854501,Offensive Rebound,Kelson Gebbers Offensive Rebound.,8,9,1st Half,14:54,False,2501,2025-01-05T03:12:43Z
401706679101855501,101855501,JumpShot,Austin Rapp missed Three Point Jumper.,8,9,1st Half,14:44,False,2501,2025-01-05T03:12:57Z
401706679101855901,101855901,Offensive Rebound,Vincent Delano Offensive Rebound.,8,9,1st Half,14:40,False,2501,2025-01-05T03:12:59Z
401706679101856101,101856101,LayUpShot,Vincent Delano missed Layup.,8,9,1st Half,14:38,False,2501,2025-01-05T03:13:02Z
401706679101856102,101856102,Block Shot,Mitchell Saxen Block.,8,9,1st Half,14:38,False,2608,2025-01-05T03:13:02Z
401706679101856103,101856103,Offensive Rebound,Portland Offensive Rebound.,8,9,1st Half,14:38,False,2501,2025-01-05T03:13:02Z
401706679101857801,101857801,JumpShot,Vincent Delano missed Three Point Jumper.,8,9,1st Half,14:21,False,2501,2025-01-05T03:13:54Z
401706679101858001,101858001,Offensive Rebound,Portland Offensive Rebound.,8,9,1st Half,14:19,False,2501,2025-01-05T03:13:54Z
401706679101858002,101858002,Lost Ball Turnover,Portland  Turnover.,8,9,1st Half,14:19,False,2501,2025-01-05T03:13:54Z
401706679101859501,101859501,JumpShot,Augustas Marciulionis made Three Point Jumper. Assisted by Mitchell Saxen.,11,9,1st Half,14:04,True,2608,2025-01-05T03:14:24Z
401706679101866601,101866601,JumpShot,Bol Dengdit missed Three Point Jumper.,11,9,1st Half,13:33,False,2501,2025-01-05T03:15:24Z
401706679101867001,101867001,Defensive Rebound,Augustas Marciulionis Defensive Rebound.,11,9,1st Half,13:29,False,2608,2025-01-05T03:15:26Z
401706679101869001,101869001,Lost Ball Turnover,Luke Barrett Turnover.,11,9,1st Half,13:09,False,2608,2025-01-05T03:15:48Z
401706679101874801,101874801,PersonalFoul,Foul on Mitchell Saxen.,11,9,1st Half,12:51,False,2608,2025-01-05T03:16:23Z
401706679101875701,101875701,Lost Ball Turnover,Mikah Ballew Turnover.,11,9,1st Half,12:42,False,2501,2025-01-05T03:16:59Z
401706679101875702,101875702,Steal,Mikey Lewis Steal.,11,9,1st Half,12:42,False,2608,2025-01-05T03:16:54Z
401706679101876401,101876401,JumpShot,Mikey Lewis missed Jumper.,11,9,1st Half,12:35,False,2608,2025-01-05T03:16:59Z
401706679101876801,101876801,Defensive Rebound,Austin Rapp Defensive Rebound.,11,9,1st Half,12:31,False,2501,2025-01-05T03:17:04Z
401706679101877701,101877701,JumpShot,Kelson Gebbers missed Three Point Jumper.,11,9,1st Half,12:22,False,2501,2025-01-05T03:17:15Z
401706679101878101,101878101,Defensive Rebound,Luke Barrett Defensive Rebound.,11,9,1st Half,12:18,False,2608,2025-01-05T03:17:17Z
401706679101879301,101879301,LayUpShot,Mitchell Saxen missed Layup.,11,9,1st Half,12:06,False,2608,2025-01-05T03:17:32Z
401706679101879701,101879701,Offensive Rebound,Mitchell Saxen Offensive Rebound.,11,9,1st Half,12:02,False,2608,2025-01-05T03:17:32Z
401706679101884101,101884101,JumpShot,Paulius Murauskas missed Three Point Jumper.,11,9,1st Half,11:58,False,2608,2025-01-05T03:17:39Z
401706679101884801,101884801,Offensive Rebound,Luke Barrett Offensive Rebound.,11,9,1st Half,11:51,False,2608,2025-01-05T03:17:43Z
401706679101884802,101884802,LayUpShot,Luke Barrett missed Layup.,11,9,1st Half,11:51,False,2608,2025-01-05T03:17:43Z
401706679101885301,101885301,Defensive Rebound,Max Mackinnon Defensive Rebound.,11,9,1st Half,11:46,False,2501,2025-01-05T03:17:49Z
401706679101886001,101886001,Lost Ball Turnover,Max Mackinnon Turnover.,11,9,1st Half,11:39,False,2501,2025-01-05T03:17:57Z
401706679101886002,101886002,Steal,Augustas Marciulionis Steal.,11,9,1st Half,11:39,False,2608,2025-01-05T03:17:57Z
401706679101886501,101886501,LayUpShot,Mikey Lewis missed Layup.,11,9,1st Half,11:34,False,2608,2025-01-05T03:18:04Z
401706679101887201,101887201,Defensive Rebound,Austin Rapp Defensive Rebound.,11,9,1st Half,11:27,False,2501,2025-01-05T03:18:11Z
401706679101887301,101887301,ShortTimeOut,Portland  Timeout,11,9,1st Half,11:26,False,2501,2025-01-05T03:18:09Z
401706679101887302,101887302,OfficialTVTimeOut, Official TV Timeout,11,9,1st Half,11:26,False,,2025-01-05T03:18:09Z
401706679101887303,101887303,JumpShot,Austin Rapp missed Three Point Jumper.,11,9,1st Half,11:26,False,2501,2025-01-05T03:18:09Z
401706679101888401,101888401,Defensive Rebound,Mitchell Saxen Defensive Rebound.,11,9,1st Half,11:15,False,2608,2025-01-05T03:24:10Z
401706679101894001,101894001,PersonalFoul,Foul on Mitchell Saxen.,11,9,1st Half,10:59,False,2608,2025-01-05T03:21:54Z
401706679101894002,101894002,Lost Ball Turnover,Mitchell Saxen Turnover.,11,9,1st Half,10:59,False,2608,2025-01-05T03:21:54Z
401706679101895301,101895301,LayUpShot,Vukasin Masic missed Layup.,11,9,1st Half,10:46,False,2501,2025-01-05T03:22:17Z
401706679101895302,101895302,Block Shot,Harry Wessels Block.,11,9,1st Half,10:46,False,2608,2025-01-05T03:22:17Z
401706679101895901,101895901,Defensive Rebound,Harry Wessels Defensive Rebound.,11,9,1st Half,10:40,False,2608,2025-01-05T03:22:22Z
401706679101895902,101895902,PersonalFoul,Foul on Mezziah Oakman.,11,9,1st Half,10:40,False,2501,2025-01-05T03:22:22Z
401706679101897201,101897201,PersonalFoul,Foul on Kelson Gebbers.,11,9,1st Half,10:27,False,2501,2025-01-05T03:23:03Z
401706679101897301,101897301,Lost Ball Turnover,Augustas Marciulionis Turnover.,11,9,1st Half,10:26,False,2608,2025-01-05T03:23:23Z
401706679101897302,101897302,Steal,Mikah Ballew Steal.,11,9,1st Half,10:26,False,2501,2025-01-05T03:23:23Z
401706679101897601,101897601,Lost Ball Turnover,Mikah Ballew Turnover.,11,9,1st Half,10:23,False,2501,2025-01-05T03:23:28Z
401706679101897602,101897602,Steal,Mikey Lewis Steal.,11,9,1st Half,10:23,False,2608,2025-01-05T03:23:28Z
401706679101898101,101898101,JumpShot,Augustas Marciulionis missed Three Point Jumper.,11,9,1st Half,10:18,False,2608,2025-01-05T03:23:34Z
401706679101898501,101898501,Offensive Rebound,Luke Barrett Offensive Rebound.,11,9,1st Half,10:14,False,2608,2025-01-05T03:23:36Z
401706679101898801,101898801,JumpShot,Mikey Lewis missed Three Point Jumper.,11,9,1st Half,10:11,False,2608,2025-01-05T03:23:41Z
401706679101898802,101898802,Defensive Rebound,Portland Defensive Rebound.,11,9,1st Half,10:11,False,2501,2025-01-05T03:23:41Z
401706679101898803,101898803,PersonalFoul,Foul on Harry Wessels.,11,9,1st Half,10:11,False,2608,2025-01-05T03:23:41Z
401706679101904301,101904301,LayUpShot,Vukasin Masic made Layup.,11,11,1st Half,9:56,True,2501,2025-01-05T03:24:10Z
401706679101906001,101906001,LayUpShot,Harry Wessels made Layup. Assisted by Augustas Marciulionis.,13,11,1st Half,9:39,True,2608,2025-01-05T03:24:28Z
401706679101908301,101908301,LayUpShot,Kelson Gebbers made Layup. Assisted by Austin Rapp.,13,13,1st Half,9:16,True,2501,2025-01-05T03:24:52Z
401706679101914101,101914101,LayUpShot,Augustas Marciulionis missed Layup.,13,13,1st Half,8:58,False,2608,2025-01-05T03:25:12Z
401706679101914102,101914102,Offensive Rebound,Saint Mary's Offensive Rebound.,13,13,1st Half,8:58,False,2608,2025-01-05T03:25:12Z
401706679101914501,101914501,LayUpShot,Harry Wessels missed Layup.,13,13,1st Half,8:54,False,2608,2025-01-05T03:25:44Z
401706679101914801,101914801,Defensive Rebound,Bol Dengdit Defensive Rebound.,13,13,1st Half,8:51,False,2501,2025-01-05T03:25:49Z
401706679101915301,101915301,JumpShot,Vukasin Masic missed Jumper.,13,13,1st Half,8:46,False,2501,2025-01-05T03:25:56Z
401706679101915601,101915601,Offensive Rebound,Mikah Ballew Offensive Rebound.,13,13,1st Half,8:43,False,2501,2025-01-05T03:25:58Z
401706679101917201,101917201,PersonalFoul,Foul on Paulius Murauskas.,13,13,1st Half,8:27,False,2608,2025-01-05T03:26:14Z
401706679101917801,101917801,JumpShot,Jermaine Ballisager Webb missed Jumper.,13,13,1st Half,8:21,False,2501,2025-01-05T03:26:41Z
401706679101917901,101917901,Offensive Rebound,Bol Dengdit Offensive Rebound.,13,13,1st Half,8:20,False,2501,2025-01-05T03:26:41Z
401706679101917902,101917902,PersonalFoul,Foul on Mikey Lewis.,13,13,1st Half,8:20,False,2608,2025-01-05T03:26:41Z
401706679101919201,101919201,JumpShot,Max Mackinnon missed Three Point Jumper.,13,13,1st Half,8:07,False,2501,2025-01-05T03:27:39Z
401706679101919601,101919601,Defensive Rebound,Andrew McKeever Defensive Rebound.,13,13,1st Half,8:03,False,2608,2025-01-05T03:27:41Z
401706679101925101,101925101,JumpShot,Mikey Lewis missed Three Point Jumper.,13,13,1st Half,7:48,False,2608,2025-01-05T03:27:59Z
401706679101925501,101925501,Offensive Rebound,Andrew McKeever Offensive Rebound.,13,13,1st Half,7:44,False,2608,2025-01-05T03:28:01Z
401706679101927301,101927301,JumpShot,Andrew McKeever made Jumper.,15,13,1st Half,7:26,True,2608,2025-01-05T03:28:32Z
401706679101929901,101929901,JumpShot,Bol Dengdit missed Jumper.,15,13,1st Half,7:00,False,2501,2025-01-05T03:28:46Z
401706679101934401,101934401,Defensive Rebound,Mikey Lewis Defensive Rebound.,15,13,1st Half,6:55,False,2608,2025-01-05T03:28:46Z
401706679101936201,101936201,JumpShot,Andrew McKeever missed Jumper.,15,13,1st Half,6:37,False,2608,2025-01-05T03:29:09Z
401706679101936501,101936501,Defensive Rebound,Vukasin Masic Defensive Rebound.,15,13,1st Half,6:34,False,2501,2025-01-05T03:29:11Z
401706679101937602,101937602,PersonalFoul,Foul on Jordan Ross.,15,13,1st Half,6:23,False,2608,2025-01-05T03:29:24Z
401706679101937603,101937603,OfficialTVTimeOut, Official TV Timeout,15,13,1st Half,6:23,False,,2025-01-05T03:29:24Z
401706679101937604,101937604,MadeFreeThrow,Max Mackinnon made Free Throw.,15,14,1st Half,6:23,True,2501,2025-01-05T03:29:24Z
401706679101937605,101937605,MadeFreeThrow,Max Mackinnon made Free Throw.,15,15,1st Half,6:23,True,2501,2025-01-05T03:29:24Z
401706679101937901,101937901,ShortTimeOut,Saint Mary's  Timeout,15,15,1st Half,6:20,False,2608,2025-01-05T03:33:08Z
401706679101944201,101944201,JumpShot,Luke Barrett missed Three Point Jumper.,15,15,1st Half,5:57,False,2608,2025-01-05T03:34:37Z
401706679101944801,101944801,Defensive Rebound,Austin Rapp Defensive Rebound.,15,15,1st Half,5:51,False,2501,2025-01-05T03:34:40Z
401706679101946301,101946301,Lost Ball Turnover,Max Mackinnon Turnover.,15,15,1st Half,5:36,False,2501,2025-01-05T03:34:57Z
401706679101946302,101946302,Steal,Andrew McKeever Steal.,15,15,1st Half,5:36,False,2608,2025-01-05T03:34:57Z
401706679101948101,101948101,JumpShot,Augustas Marciulionis made Three Point Jumper. Assisted by Jordan Ross.,18,15,1st Half,5:18,True,2608,2025-01-05T03:35:16Z
401706679101949601,101949601,Lost Ball Turnover,Austin Rapp Turnover.,18,15,1st Half,5:03,False,2501,2025-01-05T03:35:31Z
401706679101955601,101955601,LayUpShot,Mitchell Saxen missed Layup.,18,15,1st Half,4:43,False,2608,2025-01-05T03:36:12Z
401706679101956001,101956001,Offensive Rebound,Mitchell Saxen Offensive Rebound.,18,15,1st Half,4:39,False,2608,2025-01-05T03:36:15Z
401706679101956002,101956002,JumpShot,Mitchell Saxen missed Jumper.,18,15,1st Half,4:39,False,2608,2025-01-05T03:36:15Z
401706679101956101,101956101,Defensive Rebound,Jermaine Ballisager Webb Defensive Rebound.,18,15,1st Half,4:38,False,2501,2025-01-05T03:36:17Z
401706679101958301,101958301,JumpShot,Jermaine Ballisager Webb missed Jumper.,18,15,1st Half,4:16,False,2501,2025-01-05T03:36:39Z
401706679101958701,101958701,Defensive Rebound,Augustas Marciulionis Defensive Rebound.,18,15,1st Half,4:12,False,2608,2025-01-05T03:36:42Z
401706679101958901,101958901,PersonalFoul,Foul on Max Mackinnon.,18,15,1st Half,4:10,False,2501,2025-01-05T03:36:46Z
401706679101958902,101958902,MadeFreeThrow,Mitchell Saxen made Free Throw.,19,15,1st Half,4:10,True,2608,2025-01-05T03:36:46Z
401706679101958903,101958903,MadeFreeThrow,Mitchell Saxen missed Free Throw.,19,15,1st Half,4:10,False,2608,2025-01-05T03:36:46Z
401706679101958904,101958904,Defensive Rebound,Max Mackinnon Defensive Rebound.,19,15,1st Half,4:10,False,2501,2025-01-05T03:36:46Z
401706679101964601,101964601,JumpShot,Bol Dengdit missed Three Point Jumper.,19,15,1st Half,3:53,False,2501,2025-01-05T03:38:01Z
401706679101964602,101964602,Block Shot,Ashton Hardaway Block.,19,15,1st Half,3:53,False,2608,2025-01-05T03:38:04Z
401706679101965101,101965101,Defensive Rebound,Mitchell Saxen Defensive Rebound.,19,15,1st Half,3:48,False,2608,2025-01-05T03:38:04Z
401706679101966701,101966701,PersonalFoul,Foul on Jermaine Ballisager Webb.,19,15,1st Half,3:32,False,2501,2025-01-05T03:38:22Z
401706679101966702,101966702,OfficialTVTimeOut, Official TV Timeout,19,15,1st Half,3:32,False,,2025-01-05T03:38:22Z
401706679101966703,101966703,MadeFreeThrow,Jordan Ross made Free Throw.,20,15,1st Half,3:32,True,2608,2025-01-05T03:41:09Z
401706679101966704,101966704,MadeFreeThrow,Jordan Ross made Free Throw.,21,15,1st Half,3:32,True,2608,2025-01-05T03:41:09Z
401706679101967801,101967801,LayUpShot,Max Mackinnon missed Layup.,21,15,1st Half,3:21,False,2501,2025-01-05T03:41:54Z
401706679101968101,101968101,Defensive Rebound,Jordan Ross Defensive Rebound.,21,15,1st Half,3:18,False,2608,2025-01-05T03:41:56Z
401706679101968501,101968501,JumpShot,Jordan Ross made Three Point Jumper. Assisted by Augustas Marciulionis.,24,15,1st Half,3:14,True,2608,2025-01-05T03:42:02Z
401706679101968701,101968701,ShortTimeOut,Portland  Timeout,24,15,1st Half,3:12,False,2501,2025-01-05T03:43:11Z
401706679101969901,101969901,JumpShot,Vincent Delano made Jumper.,24,17,1st Half,3:00,True,2501,2025-01-05T03:43:11Z
401706679101976601,101976601,LayUpShot,Augustas Marciulionis missed Layup.,24,17,1st Half,2:33,False,2608,2025-01-05T03:43:37Z
401706679101976901,101976901,Defensive Rebound,Vincent Delano Defensive Rebound.,24,17,1st Half,2:30,False,2501,2025-01-05T03:43:40Z
401706679101977301,101977301,PersonalFoul,Foul on Luke Barrett.,24,17,1st Half,2:26,False,2608,2025-01-05T03:43:45Z
401706679101977302,101977302,MadeFreeThrow,Austin Rapp made Free Throw.,24,18,1st Half,2:26,True,2501,2025-01-05T03:43:45Z
401706679101977303,101977303,MadeFreeThrow,Austin Rapp made Free Throw.,24,19,1st Half,2:26,True,2501,2025-01-05T03:43:45Z
401706679101978301,101978301,JumpShot,Luke Barrett missed Three Point Jumper.,24,19,1st Half,2:16,False,2608,2025-01-05T03:44:50Z
401706679101978801,101978801,Offensive Rebound,Jordan Ross Offensive Rebound.,24,19,1st Half,2:11,False,2608,2025-01-05T03:44:53Z
401706679101978901,101978901,PersonalFoul,Foul on Kelson Gebbers.,24,19,1st Half,2:10,False,2501,2025-01-05T03:44:55Z
401706679101978902,101978902,MadeFreeThrow,Paulius Murauskas missed Free Throw.,24,19,1st Half,2:10,False,2608,2025-01-05T03:44:55Z
401706679101978903,101978903,Defensive Rebound,Austin Rapp Defensive Rebound.,24,19,1st Half,2:10,False,2501,2025-01-05T03:44:55Z
401706679101984301,101984301,LayUpShot,Austin Rapp missed Layup.,24,19,1st Half,1:56,False,2501,2025-01-05T03:45:44Z
401706679101984501,101984501,Offensive Rebound,Austin Rapp Offensive Rebound.,24,19,1st Half,1:54,False,2501,2025-01-05T03:45:44Z
401706679101984601,101984601,LayUpShot,Austin Rapp missed Layup.,24,19,1st Half,1:53,False,2501,2025-01-05T03:45:47Z
401706679101984801,101984801,Defensive Rebound,Augustas Marciulionis Defensive Rebound.,24,19,1st Half,1:51,False,2608,2025-01-05T03:45:47Z
401706679101985201,101985201,LayUpShot,Augustas Marciulionis missed Layup.,24,19,1st Half,1:47,False,2608,2025-01-05T03:45:52Z
401706679101986001,101986001,Offensive Rebound,Luke Barrett Offensive Rebound.,24,19,1st Half,1:39,False,2608,2025-01-05T03:45:52Z
401706679101986002,101986002,JumpShot,Luke Barrett made Jumper.,26,19,1st Half,1:39,True,2608,2025-01-05T03:45:52Z
401706679101987901,101987901,PersonalFoul,Foul on Todd Jones.,26,19,1st Half,1:20,False,2501,2025-01-05T03:46:20Z
401706679101987902,101987902,Lost Ball Turnover,Todd Jones Turnover.,26,19,1st Half,1:20,False,2501,2025-01-05T03:46:20Z
401706679101989001,101989001,Lost Ball Turnover,Luke Barrett Turnover.,26,19,1st Half,1:09,False,2608,2025-01-05T03:46:54Z
401706679101989002,101989002,Steal,Vincent Delano Steal.,26,19,1st Half,1:09,False,2501,2025-01-05T03:46:54Z
401706679101994201,101994201,PersonalFoul,Foul on Mitchell Saxen.,26,19,1st Half,0:57,False,2608,2025-01-05T03:47:08Z
401706679101994202,101994202,MadeFreeThrow,Todd Jones missed Free Throw.,26,19,1st Half,0:57,False,2501,2025-01-05T03:47:08Z
401706679101994203,101994203,Offensive Rebound,Portland Offensive Rebound.,26,19,1st Half,0:57,False,2501,2025-01-05T03:47:08Z
401706679101994204,101994204,MadeFreeThrow,Todd Jones missed Free Throw.,26,19,1st Half,0:57,False,2501,2025-01-05T03:47:08Z
401706679101994205,101994205,Defensive Rebound,Luke Barrett Defensive Rebound.,26,19,1st Half,0:57,False,2608,2025-01-05T03:47:08Z
401706679101996701,101996701,JumpShot,Jordan Ross made Jumper.,28,19,1st Half,0:32,True,2608,2025-01-05T03:48:22Z
401706679101999501,101999501,JumpShot,Vincent Delano missed Jumper.,28,19,1st Half,0:04,False,2501,2025-01-05T03:48:51Z
401706679101999502,101999502,Block Shot,Jordan Ross Block.,28,19,1st Half,0:04,False,2608,2025-01-05T03:48:51Z
401706679101999701,101999701,Offensive Rebound,Portland Offensive Rebound.,28,19,1st Half,0:02,False,2501,2025-01-05T03:48:51Z
401706679101999902,101999902,JumpShot,Max Mackinnon missed Three Point Jumper.,28,19,1st Half,0:00,False,2501,2025-01-05T03:48:51Z
401706679101999904,101999904,Defensive Rebound,Andrew McKeever Defensive Rebound.,28,19,1st Half,0:00,False,2608,2025-01-05T03:48:51Z
401706679101999901,101999901,End Period,End of 1st half,28,19,1st Half,0:00,False,,2025-01-05T03:48:51Z
401706679102806901,102806901,LayUpShot,Augustas Marciulionis made Layup.,30,19,2nd Half,19:30,True,2608,
401706679102808701,102808701,LayUpShot,Austin Rapp made Layup. Assisted by Max Mackinnon.,30,21,2nd Half,19:12,True,2501,2025-01-05T04:07:14Z
401706679102808702,102808702,PersonalFoul,Foul on Luke Barrett.,30,21,2nd Half,19:12,False,2608,2025-01-05T04:07:14Z
401706679102808703,102808703,MadeFreeThrow,Austin Rapp made Free Throw.,30,22,2nd Half,19:12,True,2501,2025-01-05T04:07:14Z
401706679102814901,102814901,JumpShot,Jordan Ross missed Three Point Jumper.,30,22,2nd Half,18:50,False,2608,2025-01-05T04:07:46Z
401706679102815101,102815101,Offensive Rebound,Jordan Ross Offensive Rebound.,30,22,2nd Half,18:48,False,2608,2025-01-05T04:07:46Z
401706679102815301,102815301,JumpShot,Luke Barrett missed Three Point Jumper.,30,22,2nd Half,18:46,False,2608,2025-01-05T04:07:52Z
401706679102815801,102815801,Defensive Rebound,Bol Dengdit Defensive Rebound.,30,22,2nd Half,18:41,False,2501,2025-01-05T04:07:52Z
401706679102816201,102816201,Lost Ball Turnover,Vincent Delano Turnover.,30,22,2nd Half,18:37,False,2501,2025-01-05T04:07:58Z
401706679102817501,102817501,JumpShot,Augustas Marciulionis made Jumper.,32,22,2nd Half,18:24,True,2608,2025-01-05T04:08:20Z
401706679102817502,102817502,PersonalFoul,Foul on Jermaine Ballisager Webb.,32,22,2nd Half,18:24,False,2501,2025-01-05T04:08:20Z
401706679102817503,102817503,MadeFreeThrow,Augustas Marciulionis made Free Throw.,33,22,2nd Half,18:24,True,2608,2025-01-05T04:08:20Z
401706679102819401,102819401,LayUpShot,Vincent Delano missed Layup.,33,22,2nd Half,18:05,False,2501,2025-01-05T04:09:10Z
401706679102819901,102819901,Offensive Rebound,Jermaine Ballisager Webb Offensive Rebound.,33,22,2nd Half,18:00,False,2501,2025-01-05T04:09:17Z
401706679102819902,102819902,JumpShot,Jermaine Ballisager Webb missed Jumper.,33,22,2nd Half,18:00,False,2501,2025-01-05T04:09:17Z
401706679102824101,102824101,Defensive Rebound,Jordan Ross Defensive Rebound.,33,22,2nd Half,17:58,False,2608,2025-01-05T04:09:19Z
401706679102824601,102824601,JumpShot,Augustas Marciulionis missed Jumper.,33,22,2nd Half,17:53,False,2608,2025-01-05T04:09:25Z
401706679102825001,102825001,JumpShot,Augustas Marciulionis made Jumper.,35,22,2nd Half,17:49,True,2608,2025-01-05T04:12:20Z
401706679102825002,102825002,ShortTimeOut,Portland  Timeout,35,22,2nd Half,17:49,False,2501,2025-01-05T04:12:20Z
401706679102825003,102825003,OfficialTVTimeOut, Official TV Timeout,35,22,2nd Half,17:49,False,,2025-01-05T04:12:20Z
401706679102825101,102825101,Offensive Rebound,Augustas Marciulionis Offensive Rebound.,35,22,2nd Half,17:48,False,2608,2025-01-05T04:12:20Z
401706679102825901,102825901,JumpShot,Max Mackinnon made Three Point Jumper. Assisted by Austin Rapp.,35,25,2nd Half,17:40,True,2501,2025-01-05T04:12:23Z
401706679102828501,102828501,JumpShot,Augustas Marciulionis made Three Point Jumper. Assisted by Mitchell Saxen.,38,25,2nd Half,17:14,True,2608,2025-01-05T04:12:50Z
401706679102829301,102829301,PersonalFoul,Foul on Austin Rapp.,38,25,2nd Half,17:06,False,2501,2025-01-05T04:12:57Z
401706679102829302,102829302,Lost Ball Turnover,Austin Rapp Turnover.,38,25,2nd Half,17:06,False,2501,2025-01-05T04:12:57Z
401706679102834601,102834601,DunkShot,Mitchell Saxen made Dunk. Assisted by Jordan Ross.,40,25,2nd Half,16:53,True,2608,2025-01-05T04:13:32Z
401706679102835601,102835601,PersonalFoul,Foul on Luke Barrett.,40,25,2nd Half,16:43,False,2608,2025-01-05T04:13:41Z
401706679102836301,102836301,LayUpShot,Austin Rapp missed Layup.,40,25,2nd Half,16:36,False,2501,2025-01-05T04:14:20Z
401706679102836601,102836601,Defensive Rebound,Luke Barrett Defensive Rebound.,40,25,2nd Half,16:33,False,2608,2025-01-05T04:14:23Z
