play_id,sequence_number,type,description,away_score,home_score,period,clock,scoring_play,team_id,timestamp_utc
401714466102874102,102874102,Block Shot,KJ Debrick Block.,38,46,2nd Half,12:58,False,325,2025-01-16T01:20:13Z
401714466102874601,102874601,Defensive Rebound,KJ Debrick Defensive Rebound.,38,46,2nd Half,12:53,False,325,2025-01-16T01:20:13Z
401714466102875001,102875001,PersonalFoul,Foul on Keeyan Itejere.,38,46,2nd Half,12:49,False,94,2025-01-16T01:20:13Z
401714466102875002,102875002,MadeFreeThrow,Je'Shawn Stevenson made Free Throw.,38,47,2nd Half,12:49,True,325,2025-01-16T01:20:13Z
401714466102875003,102875003,MadeFreeThrow,Je'Shawn Stevenson made Free Throw.,38,48,2nd Half,12:49,True,325,2025-01-16T01:20:13Z
401714466102876201,102876201,JumpShot,Hubertas Pivorius made Three Point Jumper. Assisted by Randall Pettus II.,41,48,2nd Half,12:37,True,94,2025-01-16T01:22:14Z
401714466102878301,102878301,PersonalFoul,Foul on Cesar Tchilombo.,41,48,2nd Half,12:16,False,94,2025-01-16T01:22:14Z
401714466102878302,102878302,MadeFreeThrow,Reece Robinson made Free Throw.,41,49,2nd Half,12:16,True,325,2025-01-16T01:22:14Z
401714466102878501,102878501,MadeFreeThrow,Reece Robinson missed Free Throw.,41,49,2nd Half,12:14,False,325,2025-01-16T01:22:33Z
401714466102878701,102878701,Offensive Rebound,Reece Robinson Offensive Rebound.,41,49,2nd Half,12:12,False,325,2025-01-16T01:22:33Z
401714466102879001,102879001,JumpShot,Tahj Staveskie made Three Point Jumper. Assisted by Reece Robinson.,41,52,2nd Half,12:09,True,325,2025-01-16T01:22:52Z
401714466102879601,102879601,Lost Ball Turnover,Josh Dilling Turnover.,41,52,2nd Half,12:03,False,94,2025-01-16T01:22:52Z
401714466102879602,102879602,ShortTimeOut,Northern Kentucky  Timeout,41,52,2nd Half,12:03,False,94,2025-01-16T01:22:52Z
401714466102879603,102879603,OfficialTVTimeOut, Official TV Timeout,41,52,2nd Half,12:03,False,,2025-01-16T01:22:52Z
401714466102885701,102885701,JumpShot,Chase Robinson made Jumper.,41,54,2nd Half,11:42,True,325,2025-01-16T01:26:14Z
401714466102888201,102888201,JumpShot,Keeyan Itejere missed Jumper.,41,54,2nd Half,11:17,False,94,2025-01-16T01:26:35Z
401714466102888701,102888701,Defensive Rebound,Reece Robinson Defensive Rebound.,41,54,2nd Half,11:12,False,325,2025-01-16T01:27:12Z
401714466102889001,102889001,JumpShot,Tahj Staveskie missed Three Point Jumper.,41,54,2nd Half,11:09,False,325,2025-01-16T01:27:12Z
401714466102889301,102889301,Defensive Rebound,Keeyan Itejere Defensive Rebound.,41,54,2nd Half,11:06,False,94,2025-01-16T01:27:12Z
401714466102894501,102894501,JumpShot,Keeyan Itejere made Jumper. Assisted by Randall Pettus II.,43,54,2nd Half,10:54,True,94,2025-01-16T01:27:12Z
401714466102897001,102897001,JumpShot,Tahj Staveskie missed Jumper.,43,54,2nd Half,10:29,False,325,2025-01-16T01:28:15Z
401714466102897101,102897101,Defensive Rebound,Keeyan Itejere Defensive Rebound.,43,54,2nd Half,10:28,False,94,2025-01-16T01:28:15Z
401714466102897102,102897102,PersonalFoul,Foul on KJ Debrick.,43,54,2nd Half,10:28,False,325,2025-01-16T01:28:15Z
401714466102897103,102897103,OfficialTVTimeOut, Official TV Timeout,43,54,2nd Half,10:28,False,,2025-01-16T01:28:15Z
401714466102899101,102899101,JumpShot,Randall Pettus II made Jumper.,45,54,2nd Half,10:08,True,94,2025-01-16T01:31:07Z
401714466102905101,102905101,LayUpShot,Je'Shawn Stevenson missed Layup.,45,54,2nd Half,9:48,False,325,2025-01-16T01:32:13Z
401714466102905102,102905102,Block Shot,Randall Pettus II Block.,45,54,2nd Half,9:48,False,94,2025-01-16T01:32:13Z
401714466102905501,102905501,Defensive Rebound,Keeyan Itejere Defensive Rebound.,45,54,2nd Half,9:44,False,94,2025-01-16T01:32:13Z
401714466102906301,102906301,Lost Ball Turnover,Keeyan Itejere Turnover.,45,54,2nd Half,9:36,False,94,2025-01-16T01:32:13Z
401714466102908701,102908701,LayUpShot,Je'Shawn Stevenson made Layup. Assisted by KJ Debrick.,45,56,2nd Half,9:12,True,325,2025-01-16T01:32:13Z
401714466102914101,102914101,JumpShot,Keeyan Itejere made Jumper. Assisted by Sam Vinson.,47,56,2nd Half,8:58,True,94,2025-01-16T01:32:13Z
401714466102916801,102916801,PersonalFoul,Foul on Josh Dilling.,47,56,2nd Half,8:31,False,94,2025-01-16T01:32:51Z
401714466102916802,102916802,MadeFreeThrow,Chase Robinson made Free Throw.,47,57,2nd Half,8:31,True,325,2025-01-16T01:32:51Z
401714466102916803,102916803,MadeFreeThrow,Chase Robinson made Free Throw.,47,58,2nd Half,8:31,True,325,2025-01-16T01:32:51Z
401714466102918001,102918001,LayUpShot,Keeyan Itejere made Layup.,49,58,2nd Half,8:19,True,94,2025-01-16T01:34:28Z
401714466102924801,102924801,JumpShot,Tevin Smith missed Jumper.,49,58,2nd Half,7:51,False,325,2025-01-16T01:34:28Z
401714466102925101,102925101,Offensive Rebound,KJ Debrick Offensive Rebound.,49,58,2nd Half,7:48,False,325,2025-01-16T01:34:28Z
401714466102925201,102925201,LayUpShot,KJ Debrick made Layup.,49,60,2nd Half,7:47,True,325,2025-01-16T01:34:28Z
401714466102926601,102926601,OfficialTVTimeOut, Official TV Timeout,49,60,2nd Half,7:33,False,,2025-01-16T01:34:28Z
401714466102927001,102927001,PersonalFoul,Foul on Je'Shawn Stevenson.,49,60,2nd Half,7:29,False,325,2025-01-16T01:38:12Z
401714466102928201,102928201,JumpShot,Sam Vinson missed Jumper.,49,60,2nd Half,7:17,False,94,2025-01-16T01:38:30Z
401714466102928202,102928202,Block Shot,KJ Debrick Block.,49,60,2nd Half,7:17,False,325,2025-01-16T01:38:30Z
401714466102928301,102928301,Offensive Rebound,Northern Kentucky Offensive Rebound.,49,60,2nd Half,7:16,False,94,2025-01-16T01:38:30Z
401714466102929301,102929301,JumpShot,Josh Dilling missed Three Point Jumper.,49,60,2nd Half,7:06,False,94,2025-01-16T01:39:07Z
401714466102929601,102929601,Defensive Rebound,Tevin Smith Defensive Rebound.,49,60,2nd Half,7:03,False,325,2025-01-16T01:39:07Z
401714466102934901,102934901,Lost Ball Turnover,Je'Shawn Stevenson Turnover.,49,60,2nd Half,6:50,False,325,2025-01-16T01:40:32Z
401714466102934902,102934902,Steal,Sam Vinson Steal.,49,60,2nd Half,6:50,False,94,2025-01-16T01:40:32Z
401714466102935301,102935301,PersonalFoul,Foul on Je'Shawn Stevenson.,49,60,2nd Half,6:46,False,325,2025-01-16T01:40:32Z
401714466102935302,102935302,MadeFreeThrow,Sam Vinson made Free Throw.,50,60,2nd Half,6:46,True,94,2025-01-16T01:40:32Z
401714466102935303,102935303,MadeFreeThrow,Sam Vinson made Free Throw.,51,60,2nd Half,6:46,True,94,2025-01-16T01:40:32Z
401714466102938101,102938101,JumpShot,Tevin Smith missed Jumper.,51,60,2nd Half,6:18,False,325,2025-01-16T01:40:47Z
401714466102938401,102938401,Defensive Rebound,Sam Vinson Defensive Rebound.,51,60,2nd Half,6:15,False,94,2025-01-16T01:40:47Z
401714466102938801,102938801,JumpShot,Sam Vinson missed Jumper.,51,60,2nd Half,6:11,False,94,2025-01-16T01:40:47Z
401714466102939201,102939201,Defensive Rebound,Chase Robinson Defensive Rebound.,51,60,2nd Half,6:07,False,325,2025-01-16T01:41:07Z
401714466102939601,102939601,JumpShot,Chase Robinson missed Jumper.,51,60,2nd Half,6:03,False,325,2025-01-16T01:41:07Z
401714466102944001,102944001,Offensive Rebound,Reece Robinson Offensive Rebound.,51,60,2nd Half,5:59,False,325,2025-01-16T01:41:07Z
401714466102944101,102944101,LayUpShot,Reece Robinson made Layup.,51,62,2nd Half,5:58,True,325,2025-01-16T01:41:07Z
401714466102945101,102945101,Lost Ball Turnover,Josh Dilling Turnover.,51,62,2nd Half,5:48,False,94,2025-01-16T01:42:30Z
401714466102945102,102945102,Steal,Chase Robinson Steal.,51,62,2nd Half,5:48,False,325,2025-01-16T01:42:30Z
401714466102945601,102945601,DunkShot,Chase Robinson made Dunk.,51,64,2nd Half,5:43,True,325,2025-01-16T01:42:30Z
401714466102945701,102945701,ShortTimeOut,Northern Kentucky  Timeout,51,64,2nd Half,5:42,False,94,2025-01-16T01:42:30Z
401714466102947701,102947701,JumpShot,Randall Pettus II missed Jumper.,51,64,2nd Half,5:22,False,94,2025-01-16T01:43:04Z
401714466102947702,102947702,Block Shot,Reece Robinson Block.,51,64,2nd Half,5:22,False,325,2025-01-16T01:43:04Z
401714466102948101,102948101,Defensive Rebound,Reece Robinson Defensive Rebound.,51,64,2nd Half,5:18,False,325,2025-01-16T01:43:04Z
401714466102949301,102949301,Lost Ball Turnover,Chase Robinson Turnover.,51,64,2nd Half,5:06,False,325,2025-01-16T01:44:13Z
401714466102954601,102954601,LayUpShot,Trey Robinson missed Layup.,51,64,2nd Half,4:53,False,94,2025-01-16T01:44:13Z
401714466102954901,102954901,Defensive Rebound,Je'Shawn Stevenson Defensive Rebound.,51,64,2nd Half,4:50,False,325,2025-01-16T01:44:13Z
401714466102956101,102956101,JumpShot,Tahj Staveskie missed Three Point Jumper.,51,64,2nd Half,4:38,False,325,2025-01-16T01:44:13Z
401714466102956301,102956301,Defensive Rebound,Keeyan Itejere Defensive Rebound.,51,64,2nd Half,4:36,False,94,2025-01-16T01:44:13Z
401714466102956302,102956302,PersonalFoul,Foul on Reece Robinson.,51,64,2nd Half,4:36,False,325,2025-01-16T01:44:13Z
401714466102956303,102956303,MadeFreeThrow,Keeyan Itejere made Free Throw.,52,64,2nd Half,4:36,True,94,2025-01-16T01:44:13Z
401714466102956401,102956401,MadeFreeThrow,Keeyan Itejere missed Free Throw.,52,64,2nd Half,4:35,False,94,2025-01-16T01:45:08Z
401714466102956501,102956501,Defensive Rebound,Je'Shawn Stevenson Defensive Rebound.,52,64,2nd Half,4:34,False,325,2025-01-16T01:45:08Z
401714466102957801,102957801,Lost Ball Turnover,Je'Shawn Stevenson Turnover.,52,64,2nd Half,4:21,False,325,2025-01-16T01:46:12Z
401714466102957802,102957802,Steal,Trey Robinson Steal.,52,64,2nd Half,4:21,False,94,2025-01-16T01:46:12Z
401714466102959001,102959001,JumpShot,Trey Robinson missed Three Point Jumper.,52,64,2nd Half,4:09,False,94,2025-01-16T01:46:12Z
401714466102959301,102959301,Defensive Rebound,Dylan Arnett Defensive Rebound.,52,64,2nd Half,4:06,False,325,2025-01-16T01:46:12Z
401714466102964701,102964701,Lost Ball Turnover,Tahj Staveskie Turnover.,52,64,2nd Half,3:52,False,325,2025-01-16T01:46:12Z
401714466102964702,102964702,OfficialTVTimeOut, Official TV Timeout,52,64,2nd Half,3:52,False,,2025-01-16T01:46:12Z
401714466102967801,102967801,JumpShot,Trey Robinson missed Three Point Jumper.,52,64,2nd Half,3:21,False,94,2025-01-16T01:50:13Z
401714466102968201,102968201,Offensive Rebound,Keeyan Itejere Offensive Rebound.,52,64,2nd Half,3:17,False,94,2025-01-16T01:50:13Z
401714466102968501,102968501,JumpShot,Trey Robinson made Jumper.,54,64,2nd Half,3:14,True,94,2025-01-16T01:50:13Z
401714466102968502,102968502,PersonalFoul,Foul on Ebrima Dibba.,54,64,2nd Half,3:14,False,325,2025-01-16T01:50:13Z
401714466102968503,102968503,MadeFreeThrow,Trey Robinson made Free Throw.,55,64,2nd Half,3:14,True,94,2025-01-16T01:50:13Z
401714466102974501,102974501,LayUpShot,Tevin Smith made Layup. Assisted by Ebrima Dibba.,55,66,2nd Half,2:54,True,325,2025-01-16T01:50:29Z
401714466102977501,102977501,Lost Ball Turnover,Hubertas Pivorius Turnover.,55,66,2nd Half,2:24,False,94,2025-01-16T01:51:05Z
401714466102977502,102977502,Steal,Dylan Arnett Steal.,55,66,2nd Half,2:24,False,325,2025-01-16T01:51:05Z
401714466102978001,102978001,LayUpShot,Tevin Smith made Layup. Assisted by Ebrima Dibba.,55,68,2nd Half,2:19,True,325,2025-01-16T01:51:05Z
401714466102979801,102979801,PersonalFoul,Foul on Dylan Arnett.,55,68,2nd Half,2:01,False,325,2025-01-16T01:52:16Z
401714466102979802,102979802,MadeFreeThrow,Trey Robinson missed Free Throw.,55,68,2nd Half,2:01,False,94,2025-01-16T01:52:16Z
401714466102979803,102979803,Offensive Rebound,Northern Kentucky Offensive Rebound.,55,68,2nd Half,2:01,False,94,2025-01-16T01:52:16Z
401714466102979804,102979804,MadeFreeThrow,Trey Robinson made Free Throw.,56,68,2nd Half,2:01,True,94,2025-01-16T01:52:16Z
401714466102984701,102984701,DunkShot,Dylan Arnett made Dunk. Assisted by Tevin Smith.,56,70,2nd Half,1:52,True,325,2025-01-16T01:52:48Z
401714466102986101,102986101,PersonalFoul,Foul on Tevin Smith.,56,70,2nd Half,1:38,False,325,2025-01-16T01:53:00Z
401714466102986102,102986102,MadeFreeThrow,Trey Robinson made Free Throw.,57,70,2nd Half,1:38,True,94,2025-01-16T01:54:12Z
401714466102986103,102986103,MadeFreeThrow,Trey Robinson made Free Throw.,58,70,2nd Half,1:38,True,94,2025-01-16T01:54:12Z
401714466102988901,102988901,JumpShot,Chase Robinson made Jumper.,58,72,2nd Half,1:10,True,325,2025-01-16T01:54:42Z
401714466102989601,102989601,Lost Ball Turnover,Jake Evans Turnover.,58,72,2nd Half,1:03,False,94,2025-01-16T01:54:42Z
401714466102995501,102995501,JumpShot,Ebrima Dibba made Jumper.,58,74,2nd Half,0:44,True,325,2025-01-16T01:56:27Z
401714466102996201,102996201,JumpShot,Josh Dilling missed Three Point Jumper.,58,74,2nd Half,0:37,False,94,2025-01-16T01:56:27Z
401714466102996501,102996501,Defensive Rebound,Tahj Staveskie Defensive Rebound.,58,74,2nd Half,0:34,False,325,2025-01-16T01:56:27Z
401714466102999001,102999001,JumpShot,Ebrima Dibba made Jumper.,58,76,2nd Half,0:09,True,325,2025-01-16T01:56:27Z
401714466102999901,102999901,End Period,End of 2nd half,58,76,2nd Half,0:00,False,,2025-01-16T01:56:27Z
401714466102999902,102999902,End Game,End of Game,58,76,2nd Half,0:00,False,,2025-01-16T01:56:27Z
