play_id,sequence_number,type,description,away_score,home_score,period,clock,scoring_play,team_id,timestamp_utc
401719664101806201,101806201,JumpShot,Malik Moore made Three Point Jumper. Assisted by Te'Jon Sawyer.,0,3,1st Half,19:37,True,149,2025-01-31T02:03:23Z
401719664101809301,101809301,JumpShot,Qiant Myers missed Three Point Jumper.,0,3,1st Half,19:06,False,2502,2025-01-31T02:03:55Z
401719664101809901,101809901,Defensive Rebound,Te'Jon Sawyer Defensive Rebound.,0,3,1st Half,19:00,False,149,2025-01-31T02:03:58Z
401719664101814701,101814701,LayUpShot,Joe Pridgen missed Layup.,0,3,1st Half,18:52,False,149,2025-01-31T02:04:07Z
401719664101815001,101815001,Defensive Rebound,Jaylin Henderson Defensive Rebound.,0,3,1st Half,18:49,False,2502,2025-01-31T02:04:08Z
401719664101817401,101817401,JumpShot,Qiant Myers missed Three Point Jumper.,0,3,1st Half,18:25,False,2502,2025-01-31T02:04:55Z
401719664101817801,101817801,Defensive Rebound,Te'Jon Sawyer Defensive Rebound.,0,3,1st Half,18:21,False,149,2025-01-31T02:04:57Z
401719664101824001,101824001,JumpShot,Kai Johnson missed Jumper.,0,3,1st Half,17:59,False,149,2025-01-31T02:05:19Z
401719664101824002,101824002,Block Shot,Qiant Myers Block.,0,3,1st Half,17:59,False,2502,2025-01-31T02:05:24Z
401719664101824701,101824701,Offensive Rebound,Kai Johnson Offensive Rebound.,0,3,1st Half,17:52,False,149,2025-01-31T02:05:24Z
401719664101824801,101824801,JumpShot,Kai Johnson made Jumper.,0,5,1st Half,17:51,True,149,2025-01-31T02:05:26Z
401719664101826201,101826201,JumpShot,Terri Miller Jr. made Three Point Jumper. Assisted by Qiant Myers.,3,5,1st Half,17:37,True,2502,2025-01-31T02:05:58Z
401719664101829101,101829101,Lost Ball Turnover,Joe Pridgen Turnover.,3,5,1st Half,17:08,False,149,2025-01-31T02:06:28Z
401719664101829501,101829501,DunkShot,Jaylin Henderson made Dunk. Assisted by Isaiah Johnson.,5,5,1st Half,17:04,True,2502,2025-01-31T02:06:30Z
401719664101836301,101836301,LayUpShot,Joe Pridgen made Layup. Assisted by Malik Moore.,5,7,1st Half,16:36,True,149,2025-01-31T02:06:59Z
401719664101837401,101837401,JumpShot,Terri Miller Jr. made Three Point Jumper. Assisted by Qiant Myers.,8,7,1st Half,16:25,True,2502,2025-01-31T02:07:10Z
401719664101839801,101839801,LayUpShot,Malik Moore made Layup.,8,9,1st Half,16:01,True,149,2025-01-31T02:07:34Z
401719664101846301,101846301,JumpShot,Terri Miller Jr. missed Jumper.,8,9,1st Half,15:36,False,2502,2025-01-31T02:08:22Z
401719664101846601,101846601,Defensive Rebound,Money Williams Defensive Rebound.,8,9,1st Half,15:33,False,149,2025-01-31T02:08:25Z
401719664101847101,101847101,JumpShot,Malik Moore made Three Point Jumper. Assisted by Money Williams.,8,12,1st Half,15:28,True,149,2025-01-31T02:08:32Z
401719664101849301,101849301,PersonalFoul,Foul on Joe Pridgen.,8,12,1st Half,15:06,False,149,2025-01-31T02:08:52Z
401719664101849302,101849302,OfficialTVTimeOut,Official TV Timeout,8,12,1st Half,15:06,False,,2025-01-31T02:08:52Z
401719664101849303,101849303,MadeFreeThrow,Isaiah Johnson made Free Throw.,9,12,1st Half,15:06,True,2502,2025-01-31T02:08:52Z
401719664101849304,101849304,MadeFreeThrow,Isaiah Johnson made Free Throw.,10,12,1st Half,15:06,True,2502,2025-01-31T02:08:52Z
401719664101854501,101854501,JumpShot,Malik Moore made Three Point Jumper.,10,15,1st Half,14:54,True,149,2025-01-31T02:12:07Z
401719664101856201,101856201,JumpShot,Jaylin Henderson missed Jumper.,10,15,1st Half,14:37,False,2502,2025-01-31T02:12:25Z
401719664101856202,101856202,Block Shot,Malik Moore Block.,10,15,1st Half,14:37,False,149,2025-01-31T02:12:25Z
401719664101856701,101856701,Defensive Rebound,Money Williams Defensive Rebound.,10,15,1st Half,14:32,False,149,2025-01-31T02:12:25Z
401719664101857001,101857001,JumpShot,Malik Moore missed Three Point Jumper.,10,15,1st Half,14:29,False,149,2025-01-31T02:12:32Z
401719664101857301,101857301,Defensive Rebound,Terri Miller Jr. Defensive Rebound.,10,15,1st Half,14:26,False,2502,2025-01-31T02:12:32Z
401719664101858101,101858101,LayUpShot,Terri Miller Jr. made Layup. Assisted by Isaiah Johnson.,12,15,1st Half,14:18,True,2502,2025-01-31T02:12:42Z
401719664101865201,101865201,JumpShot,Money Williams missed Three Point Jumper.,12,15,1st Half,13:47,False,149,2025-01-31T02:13:14Z
401719664101865501,101865501,Defensive Rebound,Terri Miller Jr. Defensive Rebound.,12,15,1st Half,13:44,False,2502,2025-01-31T02:13:14Z
401719664101866301,101866301,LayUpShot,Terri Miller Jr. made Layup.,14,15,1st Half,13:36,True,2502,2025-01-31T02:13:25Z
401719664101867901,101867901,PersonalFoul,Foul on Terri Miller Jr..,14,15,1st Half,13:20,False,2502,2025-01-31T02:13:40Z
401719664101869301,101869301,JumpShot,Brandon Whitney missed Jumper.,14,15,1st Half,13:06,False,149,2025-01-31T02:14:34Z
401719664101869302,101869302,Block Shot,Shane Nowell Block.,14,15,1st Half,13:06,False,2502,2025-01-31T02:14:36Z
401719664101869701,101869701,Defensive Rebound,Shane Nowell Defensive Rebound.,14,15,1st Half,13:02,False,2502,2025-01-31T02:14:36Z
401719664101875101,101875101,JumpShot,Qiant Myers missed Jumper.,14,15,1st Half,12:48,False,2502,2025-01-31T02:14:52Z
401719664101875501,101875501,Defensive Rebound,Te'Jon Sawyer Defensive Rebound.,14,15,1st Half,12:44,False,149,2025-01-31T02:14:55Z
401719664101877401,101877401,JumpShot,Austin Patterson made Three Point Jumper. Assisted by Money Williams.,14,18,1st Half,12:25,True,149,2025-01-31T02:15:15Z
401719664101879801,101879801,Lost Ball Turnover,Tre-Vaughn Minott Turnover.,14,18,1st Half,12:01,False,2502,2025-01-31T02:15:41Z
401719664101886201,101886201,JumpShot,Money Williams missed Jumper.,14,18,1st Half,11:37,False,149,2025-01-31T02:16:21Z
401719664101886601,101886601,Offensive Rebound,Joe Pridgen Offensive Rebound.,14,18,1st Half,11:33,False,149,2025-01-31T02:16:24Z
401719664101886701,101886701,LayUpShot,Joe Pridgen missed Layup.,14,18,1st Half,11:32,False,149,2025-01-31T02:16:27Z
401719664101886901,101886901,Defensive Rebound,Tre-Vaughn Minott Defensive Rebound.,14,18,1st Half,11:30,False,2502,2025-01-31T02:16:27Z
401719664101887701,101887701,LayUpShot,Kelcy Phipps missed Layup.,14,18,1st Half,11:22,False,2502,2025-01-31T02:16:36Z
401719664101887702,101887702,Block Shot,Joe Pridgen Block.,14,18,1st Half,11:22,False,149,2025-01-31T02:16:38Z
401719664101888201,101888201,Defensive Rebound,Money Williams Defensive Rebound.,14,18,1st Half,11:17,False,149,2025-01-31T02:16:39Z
401719664101888501,101888501,JumpShot,Te'Jon Sawyer made Three Point Jumper. Assisted by Money Williams.,14,21,1st Half,11:14,True,149,2025-01-31T02:16:43Z
401719664101894701,101894701,LayUpShot,Cole Farrell made Layup.,16,21,1st Half,10:52,True,2502,2025-01-31T02:17:05Z
401719664101894702,101894702,PersonalFoul,Foul on Te'Jon Sawyer.,16,21,1st Half,10:52,False,149,2025-01-31T02:17:05Z
401719664101894703,101894703,OfficialTVTimeOut,Official TV Timeout,16,21,1st Half,10:52,False,,2025-01-31T02:17:05Z
401719664101894704,101894704,MadeFreeThrow,Cole Farrell made Free Throw.,17,21,1st Half,10:52,True,2502,2025-01-31T02:22:03Z
401719664101895901,101895901,DunkShot,Joe Pridgen made Dunk. Assisted by Malik Moore.,17,23,1st Half,10:40,True,149,2025-01-31T02:22:19Z
401719664101897401,101897401,JumpShot,Terri Miller Jr. made Jumper. Assisted by Qiant Myers.,19,23,1st Half,10:25,True,2502,2025-01-31T02:22:35Z
401719664101898801,101898801,LayUpShot,Joe Pridgen missed Layup.,19,23,1st Half,10:11,False,149,2025-01-31T02:22:47Z
401719664101898802,101898802,Block Shot,Terri Miller Jr. Block.,19,23,1st Half,10:11,False,2502,2025-01-31T02:22:47Z
401719664101898803,101898803,Defensive Rebound,Portland State Defensive Rebound.,19,23,1st Half,10:11,False,2502,2025-01-31T02:22:47Z
401719664101904101,101904101,LayUpShot,Qiant Myers made Layup.,21,23,1st Half,9:58,True,2502,2025-01-31T02:23:21Z
401719664101906801,101906801,Lost Ball Turnover,Kai Johnson Turnover.,21,23,1st Half,9:31,False,149,2025-01-31T02:23:48Z
401719664101909201,101909201,JumpShot,Cole Farrell missed Jumper.,21,23,1st Half,9:07,False,2502,2025-01-31T02:24:25Z
401719664101909701,101909701,Offensive Rebound,Isaiah Johnson Offensive Rebound.,21,23,1st Half,9:02,False,2502,2025-01-31T02:24:28Z
401719664101914901,101914901,LayUpShot,Terri Miller Jr. made Layup. Assisted by Jaylin Henderson.,23,23,1st Half,8:50,True,2502,2025-01-31T02:24:40Z
401719664101916801,101916801,Lost Ball Turnover,Austin Patterson Turnover.,23,23,1st Half,8:31,False,149,2025-01-31T02:25:01Z
401719664101916802,101916802,Steal,Isaiah Johnson Steal.,23,23,1st Half,8:31,False,2502,2025-01-31T02:25:03Z
401719664101917301,101917301,LayUpShot,Isaiah Johnson missed Layup.,23,23,1st Half,8:26,False,2502,2025-01-31T02:25:03Z
401719664101917302,101917302,Defensive Rebound,Montana Defensive Rebound.,23,23,1st Half,8:26,False,149,2025-01-31T02:25:03Z
401719664101918501,101918501,LayUpShot,Money Williams made Layup.,23,25,1st Half,8:14,True,149,2025-01-31T02:25:42Z
401719664101924401,101924401,JumpShot,Qiant Myers missed Three Point Jumper.,23,25,1st Half,7:55,False,2502,2025-01-31T02:26:01Z
401719664101924901,101924901,Defensive Rebound,Money Williams Defensive Rebound.,23,25,1st Half,7:50,False,149,2025-01-31T02:26:04Z
401719664101925001,101925001,Lost Ball Turnover,Malik Moore Turnover.,23,25,1st Half,7:49,False,149,2025-01-31T02:26:07Z
401719664101925002,101925002,Steal,Isaiah Johnson Steal.,23,25,1st Half,7:49,False,2502,2025-01-31T02:26:07Z
401719664101925201,101925201,PersonalFoul,Foul on Malik Moore.,23,25,1st Half,7:47,False,149,2025-01-31T02:26:07Z
401719664101925202,101925202,OfficialTVTimeOut,Official TV Timeout,23,25,1st Half,7:47,False,,2025-01-31T02:26:07Z
401719664101925901,101925901,Lost Ball Turnover,Qiant Myers Turnover.,23,25,1st Half,7:40,False,2502,2025-01-31T02:29:07Z
401719664101925902,101925902,Steal,Money Williams Steal.,23,25,1st Half,7:40,False,149,2025-01-31T02:29:07Z
401719664101926501,101926501,LayUpShot,Money Williams missed Layup.,23,25,1st Half,7:34,False,149,2025-01-31T02:29:13Z
401719664101926701,101926701,Offensive Rebound,Brandon Whitney Offensive Rebound.,23,25,1st Half,7:32,False,149,2025-01-31T02:29:13Z
401719664101926901,101926901,LayUpShot,Brandon Whitney made Layup. Assisted by Money Williams.,23,27,1st Half,7:30,True,149,2025-01-31T02:29:43Z
401719664101934401,101934401,JumpShot,Qiant Myers missed Three Point Jumper.,23,27,1st Half,6:55,False,2502,2025-01-31T02:30:18Z
401719664101934701,101934701,Defensive Rebound,Amari Jedkins Defensive Rebound.,23,27,1st Half,6:52,False,149,2025-01-31T02:30:18Z
401719664101935401,101935401,LayUpShot,Money Williams made Layup.,23,29,1st Half,6:45,True,149,2025-01-31T02:30:28Z
401719664101938601,101938601,PersonalFoul,Foul on Terri Miller Jr..,23,29,1st Half,6:13,False,2502,2025-01-31T02:30:58Z
401719664101938602,101938602,Lost Ball Turnover,Terri Miller Jr. Turnover.,23,29,1st Half,6:13,False,2502,2025-01-31T02:30:58Z
401719664101939201,101939201,LayUpShot,Te'Jon Sawyer made Layup. Assisted by Money Williams.,23,31,1st Half,6:07,True,149,2025-01-31T02:31:44Z
401719664101945301,101945301,JumpShot,Qiant Myers made Jumper.,25,31,1st Half,5:46,True,2502,2025-01-31T02:32:04Z
401719664101947101,101947101,LayUpShot,Money Williams made Layup.,25,33,1st Half,5:28,True,149,2025-01-31T02:32:22Z
401719664101948401,101948401,PersonalFoul,Foul on Joe Pridgen.,25,33,1st Half,5:15,False,149,2025-01-31T02:32:34Z
401719664101948402,101948402,MadeFreeThrow,Qiant Myers made Free Throw.,26,33,1st Half,5:15,True,2502,2025-01-31T02:33:03Z
401719664101948403,101948403,MadeFreeThrow,Qiant Myers missed Free Throw.,26,33,1st Half,5:15,False,2502,2025-01-31T02:33:03Z
401719664101948501,101948501,Defensive Rebound,Jalen Foy Defensive Rebound.,26,33,1st Half,5:14,False,149,2025-01-31T02:33:25Z
401719664101949601,101949601,Lost Ball Turnover,Money Williams Turnover.,26,33,1st Half,5:03,False,149,2025-01-31T02:33:37Z
401719664101954101,101954101,JumpShot,Jaylin Henderson missed Three Point Jumper.,26,33,1st Half,4:58,False,2502,2025-01-31T02:33:44Z
401719664101954501,101954501,Defensive Rebound,Money Williams Defensive Rebound.,26,33,1st Half,4:54,False,149,2025-01-31T02:33:46Z
401719664101954901,101954901,LayUpShot,Money Williams missed Layup.,26,33,1st Half,4:50,False,149,2025-01-31T02:33:53Z
401719664101955201,101955201,Defensive Rebound,Tre-Vaughn Minott Defensive Rebound.,26,33,1st Half,4:47,False,2502,2025-01-31T02:33:53Z
401719664101955601,101955601,JumpShot,Cole Farrell missed Three Point Jumper.,26,33,1st Half,4:43,False,2502,2025-01-31T02:33:57Z
401719664101956001,101956001,Offensive Rebound,Tre-Vaughn Minott Offensive Rebound.,26,33,1st Half,4:39,False,2502,2025-01-31T02:34:01Z
401719664101957601,101957601,PersonalFoul,Foul on Money Williams.,26,33,1st Half,4:23,False,149,2025-01-31T02:34:17Z
401719664101957602,101957602,MadeFreeThrow,Qiant Myers made Free Throw.,27,33,1st Half,4:23,True,2502,2025-01-31T02:34:17Z
401719664101957603,101957603,MadeFreeThrow,Qiant Myers made Free Throw.,28,33,1st Half,4:23,True,2502,2025-01-31T02:34:17Z
401719664101959401,101959401,JumpShot,Malik Moore missed Jumper.,28,33,1st Half,4:05,False,149,2025-01-31T02:35:24Z
401719664101959701,101959701,Defensive Rebound,Jaylin Henderson Defensive Rebound.,28,33,1st Half,4:02,False,2502,2025-01-31T02:35:26Z
401719664101964001,101964001,JumpShot,Jaylin Henderson missed Jumper.,28,33,1st Half,3:59,False,2502,2025-01-31T02:35:32Z
401719664101964002,101964002,Defensive Rebound,Amari Jedkins Defensive Rebound.,28,33,1st Half,3:59,False,149,2025-01-31T02:35:32Z
401719664101964003,101964003,PersonalFoul,Foul on Cole Farrell.,28,33,1st Half,3:59,False,2502,2025-01-31T02:35:32Z
401719664101964004,101964004,OfficialTVTimeOut,Official TV Timeout,28,33,1st Half,3:59,False,,2025-01-31T02:35:32Z
401719664101964701,101964701,DunkShot,Money Williams made Dunk.,28,35,1st Half,3:52,True,149,2025-01-31T02:38:58Z
401719664101967001,101967001,JumpShot,Isaiah Johnson missed Jumper.,28,35,1st Half,3:29,False,2502,2025-01-31T02:39:22Z
401719664101967401,101967401,Offensive Rebound,Tre-Vaughn Minott Offensive Rebound.,28,35,1st Half,3:25,False,2502,2025-01-31T02:39:25Z
401719664101967501,101967501,LayUpShot,Tre-Vaughn Minott missed Layup.,28,35,1st Half,3:24,False,2502,2025-01-31T02:39:25Z
401719664101967502,101967502,Block Shot,Amari Jedkins Block.,28,35,1st Half,3:24,False,149,2025-01-31T02:39:25Z
401719664101968001,101968001,Defensive Rebound,Jalen Foy Defensive Rebound.,28,35,1st Half,3:19,False,149,2025-01-31T02:39:31Z
401719664101968002,101968002,JumpShot,Money Williams missed Three Point Jumper.,28,35,1st Half,3:19,False,149,2025-01-31T02:39:34Z
401719664101968401,101968401,Defensive Rebound,Qiant Myers Defensive Rebound.,28,35,1st Half,3:15,False,2502,2025-01-31T02:39:34Z
401719664101968901,101968901,Lost Ball Turnover,Qiant Myers Turnover.,28,35,1st Half,3:10,False,2502,2025-01-31T02:39:40Z
401719664101969801,101969801,JumpShot,Kai Johnson made Three Point Jumper. Assisted by Money Williams.,28,38,1st Half,3:01,True,149,2025-01-31T02:40:09Z
401719664101975701,101975701,PersonalFoul,Foul on Jalen Foy.,28,38,1st Half,2:42,False,149,2025-01-31T02:40:25Z
401719664101977001,101977001,JumpShot,Qiant Myers made Three Point Jumper.,31,38,1st Half,2:29,True,2502,2025-01-31T02:41:08Z
401719664101977901,101977901,PersonalFoul,Foul on Qiant Myers.,31,38,1st Half,2:20,False,2502,2025-01-31T02:41:17Z
401719664101978501,101978501,JumpShot,Money Williams missed Three Point Jumper.,31,38,1st Half,2:14,False,149,2025-01-31T02:41:42Z
401719664101978801,101978801,Defensive Rebound,Tre-Vaughn Minott Defensive Rebound.,31,38,1st Half,2:11,False,2502,2025-01-31T02:41:42Z
401719664101979601,101979601,JumpShot,Qiant Myers missed Jumper.,31,38,1st Half,2:03,False,2502,2025-01-31T02:41:53Z
401719664101984001,101984001,Defensive Rebound,Kai Johnson Defensive Rebound.,31,38,1st Half,1:59,False,149,2025-01-31T02:41:56Z
401719664101984401,101984401,LayUpShot,Kai Johnson made Layup.,31,40,1st Half,1:55,True,149,2025-01-31T02:41:59Z
401719664101986001,101986001,LayUpShot,Qiant Myers made Layup.,33,40,1st Half,1:39,True,2502,2025-01-31T02:42:16Z
401719664101986201,101986201,ShortTimeOut,Montana Timeout,33,40,1st Half,1:37,False,149,2025-01-31T02:42:16Z
401719664101987501,101987501,LayUpShot,Money Williams made Layup.,33,42,1st Half,1:24,True,149,2025-01-31T02:43:35Z
401719664101994701,101994701,Lost Ball Turnover,Cole Farrell Turnover.,33,42,1st Half,0:52,False,2502,2025-01-31T02:44:05Z
401719664101994702,101994702,Steal,Kai Johnson Steal.,33,42,1st Half,0:52,False,149,2025-01-31T02:44:05Z
401719664101996601,101996601,PersonalFoul,Foul on Jaylin Henderson.,33,42,1st Half,0:33,False,2502,2025-01-31T02:45:34Z
401719664101996602,101996602,MadeFreeThrow,Money Williams made Free Throw.,33,43,1st Half,0:33,True,149,2025-01-31T02:45:34Z
401719664101996603,101996603,MadeFreeThrow,Money Williams made Free Throw.,33,44,1st Half,0:33,True,149,2025-01-31T02:45:34Z
401719664101999301,101999301,JumpShot,Terri Miller Jr. missed Three Point Jumper.,33,44,1st Half,0:06,False,2502,2025-01-31T02:46:13Z
401719664101999601,101999601,Defensive Rebound,Malik Moore Defensive Rebound.,33,44,1st Half,0:03,False,149,2025-01-31T02:46:16Z
401719664101999801,101999801,LayUpShot,Kai Johnson missed Layup.,33,44,1st Half,0:01,False,149,2025-01-31T02:46:16Z
401719664101999902,101999902,Offensive Rebound,Montana Offensive Rebound.,33,44,1st Half,0:00,False,149,2025-01-31T02:46:16Z
401719664101999901,101999901,End Period,End of 1st half,33,44,1st Half,0:00,False,,2025-01-31T02:46:16Z
401719664102804701,102804701,Lost Ball Turnover,Qiant Myers Turnover.,33,44,2nd Half,19:52,False,2502,
401719664102804702,102804702,Steal,Te'Jon Sawyer Steal.,33,44,2nd Half,19:52,False,149,
401719664102806101,102806101,JumpShot,Malik Moore made Jumper. Assisted by Brandon Whitney.,33,46,2nd Half,19:38,True,149,2025-01-31T03:02:42Z
401719664102807401,102807401,LayUpShot,Qiant Myers made Layup.,35,46,2nd Half,19:25,True,2502,2025-01-31T03:02:53Z
401719664102809701,102809701,JumpShot,Joe Pridgen missed Jumper.,35,46,2nd Half,19:02,False,149,2025-01-31T03:03:15Z
401719664102809901,102809901,Defensive Rebound,Terri Miller Jr. Defensive Rebound.,35,46,2nd Half,19:00,False,2502,2025-01-31T03:03:15Z
401719664102814901,102814901,Lost Ball Turnover,Qiant Myers Turnover.,35,46,2nd Half,18:50,False,2502,2025-01-31T03:03:28Z
401719664102814902,102814902,Steal,Brandon Whitney Steal.,35,46,2nd Half,18:50,False,149,2025-01-31T03:03:28Z
401719664102815701,102815701,JumpShot,Brandon Whitney made Jumper.,35,48,2nd Half,18:42,True,149,2025-01-31T03:03:34Z
401719664102818501,102818501,Lost Ball Turnover,Terri Miller Jr. Turnover.,35,48,2nd Half,18:14,False,2502,2025-01-31T03:04:04Z
401719664102818502,102818502,Steal,Malik Moore Steal.,35,48,2nd Half,18:14,False,149,2025-01-31T03:04:04Z
401719664102819201,102819201,Lost Ball Turnover,Malik Moore Turnover.,35,48,2nd Half,18:07,False,149,2025-01-31T03:04:09Z
401719664102826101,102826101,LayUpShot,Tre-Vaughn Minott made Layup. Assisted by Terri Miller Jr..,37,48,2nd Half,17:38,True,2502,2025-01-31T03:05:25Z
401719664102827601,102827601,PersonalFoul,Foul on Tre-Vaughn Minott.,37,48,2nd Half,17:23,False,2502,2025-01-31T03:05:41Z
401719664102828001,102828001,PersonalFoul,Foul on Tre-Vaughn Minott.,37,48,2nd Half,17:19,False,2502,2025-01-31T03:06:04Z
401719664102828002,102828002,MadeFreeThrow,Joe Pridgen made Free Throw.,37,49,2nd Half,17:19,True,149,2025-01-31T03:06:32Z
401719664102828003,102828003,MadeFreeThrow,Joe Pridgen made Free Throw.,37,50,2nd Half,17:19,True,149,2025-01-31T03:06:32Z
401719664102829701,102829701,LayUpShot,Qiant Myers made Layup.,39,50,2nd Half,17:02,True,2502,2025-01-31T03:07:05Z
401719664102835801,102835801,JumpShot,Kai Johnson missed Jumper.,39,50,2nd Half,16:41,False,149,2025-01-31T03:07:27Z
401719664102836501,102836501,Offensive Rebound,Kai Johnson Offensive Rebound.,39,50,2nd Half,16:34,False,149,2025-01-31T03:07:34Z
401719664102836502,102836502,JumpShot,Kai Johnson made Jumper.,39,52,2nd Half,16:34,True,149,2025-01-31T03:07:34Z
401719664102836801,102836801,PersonalFoul,Foul on Tre-Vaughn Minott.,39,52,2nd Half,16:31,False,2502,2025-01-31T03:07:41Z
401719664102836901,102836901,MadeFreeThrow,Kai Johnson made Free Throw.,39,53,2nd Half,16:30,True,149,2025-01-31T03:50:06Z
401719664102838301,102838301,LayUpShot,Qiant Myers made Layup.,41,53,2nd Half,16:16,True,2502,2025-01-31T03:50:06Z
401719664102838901,102838901,JumpShot,Te'Jon Sawyer made Three Point Jumper. Assisted by Malik Moore.,41,56,2nd Half,16:10,True,149,2025-01-31T03:08:31Z
401719664102845801,102845801,JumpShot,Terri Miller Jr. made Three Point Jumper. Assisted by Isaiah Johnson.,44,56,2nd Half,15:41,True,2502,2025-01-31T03:08:59Z
401719664102848701,102848701,JumpShot,Kai Johnson missed Three Point Jumper.,44,56,2nd Half,15:12,False,149,2025-01-31T03:09:29Z
401719664102849001,102849001,Defensive Rebound,Jaylin Henderson Defensive Rebound.,44,56,2nd Half,15:09,False,2502,2025-01-31T03:09:29Z
401719664102849601,102849601,PersonalFoul,Foul on Te'Jon Sawyer.,44,56,2nd Half,15:03,False,149,2025-01-31T03:09:35Z
401719664102849602,102849602,OfficialTVTimeOut,Official TV Timeout,44,56,2nd Half,15:03,False,,2025-01-31T03:09:35Z
401719664102855501,102855501,PersonalFoul,Foul on Amari Jedkins.,44,56,2nd Half,14:44,False,149,2025-01-31T03:12:35Z
401719664102856001,102856001,LayUpShot,Terri Miller Jr. made Layup.,46,56,2nd Half,14:39,True,2502,2025-01-31T03:13:05Z
401719664102857701,102857701,Lost Ball Turnover,Money Williams Turnover.,46,56,2nd Half,14:22,False,149,2025-01-31T03:13:19Z
401719664102857702,102857702,Steal,Jaylin Henderson Steal.,46,56,2nd Half,14:22,False,2502,2025-01-31T03:13:19Z
401719664102858101,102858101,PersonalFoul,Foul on Malik Moore.,46,56,2nd Half,14:18,False,149,2025-01-31T03:13:22Z
401719664102858102,102858102,MadeFreeThrow,Qiant Myers missed Free Throw.,46,56,2nd Half,14:18,False,2502,2025-01-31T03:13:22Z
401719664102858103,102858103,Offensive Rebound,Portland State Offensive Rebound.,46,56,2nd Half,14:18,False,2502,2025-01-31T03:13:22Z
401719664102858104,102858104,MadeFreeThrow,Qiant Myers made Free Throw.,47,56,2nd Half,14:18,True,2502,2025-01-31T03:13:22Z
401719664102859301,102859301,JumpShot,Austin Patterson made Three Point Jumper. Assisted by Amari Jedkins.,47,59,2nd Half,14:06,True,149,2025-01-31T03:14:28Z
401719664102864601,102864601,LayUpShot,Qiant Myers made Layup.,49,59,2nd Half,13:53,True,2502,2025-01-31T03:14:41Z
401719664102866801,102866801,PersonalFoul,Foul on Cole Farrell.,49,59,2nd Half,13:31,False,2502,2025-01-31T03:15:02Z
401719664102867701,102867701,LayUpShot,Brandon Whitney made Layup.,49,61,2nd Half,13:22,True,149,2025-01-31T03:15:35Z
401719664102869801,102869801,DunkShot,Isaiah Johnson made Dunk. Assisted by Cole Farrell.,51,61,2nd Half,13:01,True,2502,2025-01-31T03:15:59Z
401719664102876701,102876701,JumpShot,Amari Jedkins made Three Point Jumper. Assisted by Brandon Whitney.,51,64,2nd Half,12:32,True,149,2025-01-31T03:16:25Z
401719664102878401,102878401,LayUpShot,Terri Miller Jr. missed Layup.,51,64,2nd Half,12:15,False,2502,2025-01-31T03:16:42Z
401719664102878701,102878701,Defensive Rebound,Money Williams Defensive Rebound.,51,64,2nd Half,12:12,False,149,2025-01-31T03:16:42Z
401719664102879801,102879801,PersonalFoul,Foul on Isaiah Johnson.,51,64,2nd Half,12:01,False,2502,2025-01-31T03:16:55Z
401719664102884801,102884801,LayUpShot,Joe Pridgen made Layup.,51,66,2nd Half,11:51,True,149,2025-01-31T03:17:34Z
401719664102887301,102887301,OfficialTVTimeOut,Official TV Timeout,51,66,2nd Half,11:26,False,,2025-01-31T03:17:58Z
401719664102889201,102889201,JumpShot,Jaylin Henderson made Jumper.,53,66,2nd Half,11:07,True,2502,2025-01-31T03:21:08Z
401719664102895401,102895401,LayUpShot,Joe Pridgen made Layup. Assisted by Amari Jedkins.,53,68,2nd Half,10:45,True,149,2025-01-31T03:21:30Z
401719664102895402,102895402,PersonalFoul,Foul on Kelcy Phipps.,53,68,2nd Half,10:45,False,2502,2025-01-31T03:50:06Z
401719664102895403,102895403,MadeFreeThrow,Joe Pridgen missed Free Throw.,53,68,2nd Half,10:45,False,149,2025-01-31T03:50:06Z
401719664102895404,102895404,Defensive Rebound,Kelcy Phipps Defensive Rebound.,53,68,2nd Half,10:45,False,2502,2025-01-31T03:50:06Z
401719664102897201,102897201,JumpShot,Terri Miller Jr. made Jumper.,55,68,2nd Half,10:27,True,2502,2025-01-31T03:22:27Z
401719664102904001,102904001,PersonalFoul,Foul on Kelcy Phipps.,55,68,2nd Half,9:59,False,2502,2025-01-31T03:22:50Z
401719664102904002,102904002,MadeFreeThrow,Austin Patterson made Free Throw.,55,69,2nd Half,9:59,True,149,2025-01-31T03:22:50Z
401719664102904003,102904003,MadeFreeThrow,Austin Patterson made Free Throw.,55,70,2nd Half,9:59,True,149,2025-01-31T03:22:50Z
401719664102905501,102905501,PersonalFoul,Foul on Austin Patterson.,55,70,2nd Half,9:44,False,149,2025-01-31T03:23:59Z
401719664102906701,102906701,JumpShot,Qiant Myers missed Three Point Jumper.,55,70,2nd Half,9:32,False,2502,2025-01-31T03:25:53Z
401719664102907101,102907101,Offensive Rebound,Terri Miller Jr. Offensive Rebound.,55,70,2nd Half,9:28,False,2502,2025-01-31T03:25:53Z
401719664102907401,102907401,JumpShot,Terri Miller Jr. made Jumper.,57,70,2nd Half,9:25,True,2502,2025-01-31T03:25:53Z
401719664102909501,102909501,Lost Ball Turnover,Money Williams Turnover.,57,70,2nd Half,9:04,False,149,2025-01-31T03:25:53Z
401719664102909502,102909502,Steal,Shane Nowell Steal.,57,70,2nd Half,9:04,False,2502,2025-01-31T03:25:53Z
401719664102914201,102914201,JumpShot,Qiant Myers made Jumper.,59,70,2nd Half,8:57,True,2502,2025-01-31T03:24:59Z
401719664102914202,102914202,PersonalFoul,Foul on Joe Pridgen.,59,70,2nd Half,8:57,False,149,2025-01-31T03:24:59Z
401719664102914203,102914203,MadeFreeThrow,Qiant Myers missed Free Throw.,59,70,2nd Half,8:57,False,2502,2025-01-31T03:24:59Z
401719664102914301,102914301,Defensive Rebound,Joe Pridgen Defensive Rebound.,59,70,2nd Half,8:56,False,149,2025-01-31T03:25:36Z
