play_id,sequence_number,type,description,away_score,home_score,period,clock,scoring_play,team_id,timestamp_utc
401700205101805501,101805501,PersonalFoul,Foul on Cameron Huefner.,0,0,1st Half,19:44,False,2534,2025-01-25T20:33:24Z
401700205101805502,101805502,MadeFreeThrow,Enoch Kalambay made Free Throw.,1,0,1st Half,19:44,True,98,2025-01-25T20:33:50Z
401700205101805503,101805503,MadeFreeThrow,Enoch Kalambay missed Free Throw.,1,0,1st Half,19:44,False,98,2025-01-25T20:33:50Z
401700205101805801,101805801,Offensive Rebound,Tyrone Marshall Jr. Offensive Rebound.,1,0,1st Half,19:41,False,98,2025-01-25T20:34:07Z
401700205101805901,101805901,JumpShot,Tyrone Marshall Jr. missed Three Point Jumper.,1,0,1st Half,19:40,False,98,2025-01-25T20:34:07Z
401700205101806301,101806301,Defensive Rebound,Cameron Huefner Defensive Rebound.,1,0,1st Half,19:36,False,2534,2025-01-25T20:34:12Z
401700205101806701,101806701,JumpShot,Lamar Wilkerson missed Three Point Jumper.,1,0,1st Half,19:32,False,2534,2025-01-25T20:34:17Z
401700205101807001,101807001,Offensive Rebound,Cameron Huefner Offensive Rebound.,1,0,1st Half,19:29,False,2534,2025-01-25T20:34:20Z
401700205101807201,101807201,JumpShot,Cameron Huefner missed Jumper.,1,0,1st Half,19:27,False,2534,2025-01-25T20:34:20Z
401700205101807202,101807202,Offensive Rebound,Cameron Huefner Offensive Rebound.,1,0,1st Half,19:27,False,2534,2025-01-25T20:34:20Z
401700205101807203,101807203,PersonalFoul,Foul on Jalen Jackson.,1,0,1st Half,19:27,False,98,2025-01-25T20:34:20Z
401700205101808001,101808001,JumpShot,Marcus Boykin made Jumper.,1,2,1st Half,19:19,True,2534,2025-01-25T20:34:49Z
401700205101809701,101809701,LayUpShot,Blaise Keita missed Layup.,1,2,1st Half,19:02,False,98,2025-01-25T20:35:06Z
401700205101814001,101814001,Defensive Rebound,Lamar Wilkerson Defensive Rebound.,1,2,1st Half,18:59,False,2534,2025-01-25T20:35:08Z
401700205101815001,101815001,JumpShot,Cameron Huefner made Three Point Jumper. Assisted by Josiah Hammons.,1,5,1st Half,18:49,True,2534,2025-01-25T20:35:22Z
401700205101815201,101815201,ShortTimeOut,Western Kentucky  Timeout,1,5,1st Half,18:47,False,98,2025-01-25T20:35:20Z
401700205101817901,101817901,JumpShot,Tyrone Marshall Jr. made Jumper.,3,5,1st Half,18:20,True,98,2025-01-25T20:36:49Z
401700205101819801,101819801,JumpShot,Cameron Huefner made Three Point Jumper. Assisted by Marcus Boykin.,3,8,1st Half,18:01,True,2534,2025-01-25T20:37:09Z
401700205101824901,101824901,JumpShot,Tyrone Marshall Jr. missed Three Point Jumper.,3,8,1st Half,17:50,False,98,2025-01-25T20:37:20Z
401700205101825301,101825301,Defensive Rebound,Cheikh Ndiaye Defensive Rebound.,3,8,1st Half,17:46,False,2534,2025-01-25T20:37:23Z
401700205101825601,101825601,JumpShot,Josiah Hammons missed Three Point Jumper.,3,8,1st Half,17:43,False,2534,2025-01-25T20:37:27Z
401700205101825901,101825901,Defensive Rebound,Western Kentucky Defensive Rebound.,3,8,1st Half,17:40,False,98,2025-01-25T20:37:27Z
401700205101827901,101827901,JumpShot,Braxton Bayless missed Jumper.,3,8,1st Half,17:20,False,98,2025-01-25T20:38:08Z
401700205101827902,101827902,Block Shot,Kalifa Sakho Block.,3,8,1st Half,17:20,False,2534,2025-01-25T20:38:11Z
401700205101828401,101828401,Defensive Rebound,Kalifa Sakho Defensive Rebound.,3,8,1st Half,17:15,False,2534,2025-01-25T20:38:11Z
401700205101828901,101828901,JumpShot,Marcus Boykin missed Jumper.,3,8,1st Half,17:10,False,2534,2025-01-25T20:38:19Z
401700205101829401,101829401,Defensive Rebound,Don McHenry Defensive Rebound.,3,8,1st Half,17:05,False,98,2025-01-25T20:38:22Z
401700205101829901,101829901,JumpShot,Don McHenry made Three Point Jumper.,6,8,1st Half,17:00,True,98,2025-01-25T20:38:28Z
401700205101835801,101835801,DunkShot,Kalifa Sakho made Dunk. Assisted by Marcus Boykin.,6,10,1st Half,16:41,True,2534,2025-01-25T20:38:46Z
401700205101837001,101837001,Lost Ball Turnover,Enoch Kalambay Turnover.,6,10,1st Half,16:29,False,98,2025-01-25T20:38:58Z
401700205101838201,101838201,JumpShot,Josiah Hammons missed Three Point Jumper.,6,10,1st Half,16:17,False,2534,2025-01-25T20:39:26Z
401700205101838501,101838501,Defensive Rebound,Blaise Keita Defensive Rebound.,6,10,1st Half,16:14,False,98,2025-01-25T20:39:30Z
401700205101839201,101839201,JumpShot,Don McHenry missed Jumper.,6,10,1st Half,16:07,False,98,2025-01-25T20:39:37Z
401700205101839601,101839601,Offensive Rebound,Blaise Keita Offensive Rebound.,6,10,1st Half,16:03,False,98,2025-01-25T20:39:37Z
401700205101839901,101839901,JumpShot,Don McHenry missed Three Point Jumper.,6,10,1st Half,16:00,False,98,2025-01-25T20:39:46Z
401700205101844301,101844301,Offensive Rebound,Don McHenry Offensive Rebound.,6,10,1st Half,15:56,False,98,2025-01-25T20:39:46Z
401700205101844401,101844401,JumpShot,Don McHenry missed Jumper.,6,10,1st Half,15:55,False,98,2025-01-25T20:39:50Z
401700205101844701,101844701,Defensive Rebound,Cameron Huefner Defensive Rebound.,6,10,1st Half,15:52,False,2534,2025-01-25T20:39:50Z
401700205101845001,101845001,Lost Ball Turnover,Marcus Boykin Turnover.,6,10,1st Half,15:49,False,2534,2025-01-25T20:39:55Z
401700205101845002,101845002,Steal,Braxton Bayless Steal.,6,10,1st Half,15:49,False,98,2025-01-25T20:39:55Z
401700205101845401,101845401,LayUpShot,Braxton Bayless made Layup.,8,10,1st Half,15:45,True,98,2025-01-25T20:39:57Z
401700205101847901,101847901,JumpShot,Lamar Wilkerson missed Jumper.,8,10,1st Half,15:20,False,2534,2025-01-25T20:40:25Z
401700205101848201,101848201,Defensive Rebound,Blaise Keita Defensive Rebound.,8,10,1st Half,15:17,False,98,2025-01-25T20:40:27Z
401700205101849701,101849701,LayUpShot,Don McHenry missed Layup.,8,10,1st Half,15:02,False,98,2025-01-25T20:40:41Z
401700205101854001,101854001,Defensive Rebound,Marcus Boykin Defensive Rebound.,8,10,1st Half,14:59,False,2534,2025-01-25T20:40:44Z
401700205101854301,101854301,JumpShot,Cameron Huefner missed Three Point Jumper.,8,10,1st Half,14:56,False,2534,2025-01-25T20:40:48Z
401700205101854601,101854601,Offensive Rebound,Sam Houston Offensive Rebound.,8,10,1st Half,14:53,False,2534,2025-01-25T20:40:50Z
401700205101854602,101854602,OfficialTVTimeOut, Official TV Timeout,8,10,1st Half,14:53,False,,2025-01-25T20:40:50Z
401700205101855801,101855801,JumpShot,Dorian Finister missed Jumper.,8,10,1st Half,14:41,False,2534,2025-01-25T20:43:32Z
401700205101856201,101856201,Defensive Rebound,Enoch Kalambay Defensive Rebound.,8,10,1st Half,14:37,False,98,2025-01-25T20:43:35Z
401700205101856701,101856701,JumpShot,Enoch Kalambay made Jumper. Assisted by Khristian Lander.,10,10,1st Half,14:32,True,98,2025-01-25T20:43:41Z
401700205101859101,101859101,PersonalFoul,Foul on Jack Edelen.,10,10,1st Half,14:08,False,98,2025-01-25T20:44:03Z
401700205101864501,101864501,JumpShot,Brennen Burns missed Jumper.,10,10,1st Half,13:54,False,2534,2025-01-25T20:44:39Z
401700205101864801,101864801,Defensive Rebound,Khristian Lander Defensive Rebound.,10,10,1st Half,13:51,False,98,2025-01-25T20:44:39Z
401700205101865501,101865501,JumpShot,Enoch Kalambay missed Jumper.,10,10,1st Half,13:44,False,98,2025-01-25T20:44:49Z
401700205101865901,101865901,Defensive Rebound,Jaxson Ford Defensive Rebound.,10,10,1st Half,13:40,False,2534,2025-01-25T20:44:52Z
401700205101867301,101867301,PersonalFoul,Foul on Khristian Lander.,10,10,1st Half,13:26,False,98,2025-01-25T20:45:08Z
401700205101867302,101867302,PersonalFoul,Foul on Dorian Finister.,10,10,1st Half,13:26,False,2534,2025-01-25T20:45:08Z
401700205101869101,101869101,JumpShot,Khristian Lander missed Jumper.,10,10,1st Half,13:08,False,98,2025-01-25T20:46:11Z
401700205101869401,101869401,Offensive Rebound,Blaise Keita Offensive Rebound.,10,10,1st Half,13:05,False,98,2025-01-25T20:46:14Z
401700205101869801,101869801,JumpShot,Khristian Lander missed Three Point Jumper.,10,10,1st Half,13:01,False,98,2025-01-25T20:46:19Z
401700205101874101,101874101,Offensive Rebound,Jalen Jackson Offensive Rebound.,10,10,1st Half,12:58,False,98,2025-01-25T20:46:22Z
401700205101874301,101874301,LayUpShot,Jalen Jackson missed Layup.,10,10,1st Half,12:56,False,98,2025-01-25T20:46:22Z
401700205101874302,101874302,Block Shot,Jaxson Ford Block.,10,10,1st Half,12:56,False,2534,2025-01-25T20:46:22Z
401700205101874303,101874303,Offensive Rebound,Western Kentucky Offensive Rebound.,10,10,1st Half,12:56,False,98,2025-01-25T20:46:22Z
401700205101874401,101874401,JumpShot,Tyrone Marshall Jr. missed Three Point Jumper.,10,10,1st Half,12:55,False,98,2025-01-25T20:46:41Z
401700205101875001,101875001,Offensive Rebound,Khristian Lander Offensive Rebound.,10,10,1st Half,12:49,False,98,2025-01-25T20:46:41Z
401700205101875101,101875101,JumpShot,Tyrone Marshall Jr. missed Jumper.,10,10,1st Half,12:48,False,98,2025-01-25T20:46:49Z
401700205101875301,101875301,Defensive Rebound,Kalifa Sakho Defensive Rebound.,10,10,1st Half,12:46,False,2534,2025-01-25T20:46:49Z
401700205101875302,101875302,PersonalFoul,Foul on Tyrone Marshall Jr..,10,10,1st Half,12:46,False,98,2025-01-25T20:46:49Z
401700205101876701,101876701,JumpShot,Kalifa Sakho made Jumper. Assisted by Brennen Burns.,10,12,1st Half,12:32,True,2534,2025-01-25T20:47:28Z
401700205101877601,101877601,PersonalFoul,Foul on Kalifa Sakho.,10,12,1st Half,12:23,False,2534,2025-01-25T20:47:35Z
401700205101877602,101877602,MadeFreeThrow,Tyrone Marshall Jr. missed Free Throw.,10,12,1st Half,12:23,False,98,2025-01-25T20:47:53Z
401700205101877603,101877603,Offensive Rebound,Western Kentucky Offensive Rebound.,10,12,1st Half,12:23,False,98,2025-01-25T20:47:53Z
401700205101877604,101877604,MadeFreeThrow,Tyrone Marshall Jr. missed Free Throw.,10,12,1st Half,12:23,False,98,2025-01-25T20:47:53Z
401700205101877605,101877605,Defensive Rebound,Cheikh Ndiaye Defensive Rebound.,10,12,1st Half,12:23,False,2534,2025-01-25T20:47:53Z
401700205101879501,101879501,LayUpShot,Cheikh Ndiaye missed Layup.,10,12,1st Half,12:04,False,2534,2025-01-25T20:48:50Z
401700205101879502,101879502,Block Shot,Tyrone Marshall Jr. Block.,10,12,1st Half,12:04,False,98,2025-01-25T20:48:53Z
401700205101879901,101879901,Offensive Rebound,Cameron Huefner Offensive Rebound.,10,12,1st Half,12:00,False,2534,2025-01-25T20:48:53Z
401700205101884001,101884001,LayUpShot,Cameron Huefner made Layup.,10,14,1st Half,11:59,True,2534,2025-01-25T20:48:53Z
401700205101885201,101885201,JumpShot,Braxton Bayless made Three Point Jumper.,13,14,1st Half,11:47,True,98,2025-01-25T20:50:09Z
401700205101887701,101887701,LayUpShot,Brennen Burns made Layup.,13,16,1st Half,11:22,True,2534,2025-01-25T20:49:32Z
401700205101889001,101889001,JumpShot,Jack Edelen made Three Point Jumper. Assisted by Braxton Bayless.,16,16,1st Half,11:09,True,98,2025-01-25T20:49:46Z
401700205101895501,101895501,OfficialTVTimeOut, Official TV Timeout,16,16,1st Half,10:44,False,,2025-01-25T20:50:09Z
401700205101896401,101896401,JumpShot,Lamar Wilkerson missed Three Point Jumper.,16,16,1st Half,10:35,False,2534,2025-01-25T20:53:17Z
401700205101896901,101896901,Defensive Rebound,Don McHenry Defensive Rebound.,16,16,1st Half,10:30,False,98,2025-01-25T20:53:17Z
401700205101897601,101897601,JumpShot,Tyrone Marshall Jr. missed Three Point Jumper.,16,16,1st Half,10:23,False,98,2025-01-25T20:53:26Z
401700205101898101,101898101,Offensive Rebound,Braxton Bayless Offensive Rebound.,16,16,1st Half,10:18,False,98,2025-01-25T20:53:29Z
401700205101898401,101898401,LayUpShot,Don McHenry missed Layup.,16,16,1st Half,10:15,False,98,2025-01-25T20:53:35Z
401700205101898801,101898801,Defensive Rebound,Cameron Huefner Defensive Rebound.,16,16,1st Half,10:11,False,2534,2025-01-25T20:53:37Z
401700205101899501,101899501,LayUpShot,Cheikh Ndiaye missed Layup.,16,16,1st Half,10:04,False,2534,2025-01-25T20:53:44Z
401700205101899801,101899801,Defensive Rebound,Blaise Keita Defensive Rebound.,16,16,1st Half,10:01,False,98,2025-01-25T20:53:48Z
401700205101905001,101905001,PersonalFoul,Foul on Tyrone Marshall Jr..,16,16,1st Half,9:49,False,98,2025-01-25T20:53:58Z
401700205101905002,101905002,Lost Ball Turnover,Tyrone Marshall Jr. Turnover.,16,16,1st Half,9:49,False,98,2025-01-25T20:53:58Z
401700205101906401,101906401,Lost Ball Turnover,Brennen Burns Turnover.,16,16,1st Half,9:35,False,2534,2025-01-25T20:54:41Z
401700205101906402,101906402,Steal,Enoch Kalambay Steal.,16,16,1st Half,9:35,False,98,2025-01-25T20:54:41Z
401700205101907301,101907301,JumpShot,Khristian Lander missed Three Point Jumper.,16,16,1st Half,9:26,False,98,2025-01-25T20:54:50Z
401700205101907601,101907601,Offensive Rebound,Braxton Bayless Offensive Rebound.,16,16,1st Half,9:23,False,98,2025-01-25T20:54:50Z
401700205101908401,101908401,Lost Ball Turnover,Enoch Kalambay Turnover.,16,16,1st Half,9:15,False,98,2025-01-25T20:55:01Z
401700205101908402,101908402,Steal,Cameron Huefner Steal.,16,16,1st Half,9:15,False,2534,2025-01-25T20:55:01Z
401700205101909101,101909101,PersonalFoul,Foul on Khristian Lander.,16,16,1st Half,9:08,False,98,2025-01-25T20:55:08Z
401700205101909201,101909201,MadeFreeThrow,Cameron Huefner missed Free Throw.,16,16,1st Half,9:07,False,2534,2025-01-25T20:55:08Z
401700205101909202,101909202,Offensive Rebound,Sam Houston Offensive Rebound.,16,16,1st Half,9:07,False,2534,2025-01-25T20:55:08Z
401700205101909203,101909203,MadeFreeThrow,Cameron Huefner made Free Throw.,16,17,1st Half,9:07,True,2534,2025-01-25T20:55:08Z
401700205101909204,101909204,MadeFreeThrow,Cameron Huefner made Free Throw.,16,18,1st Half,9:07,True,2534,2025-01-25T20:56:18Z
401700205101915601,101915601,Lost Ball Turnover,Enoch Kalambay Turnover.,16,18,1st Half,8:43,False,98,2025-01-25T20:56:44Z
401700205101915602,101915602,Steal,Marcus Boykin Steal.,16,18,1st Half,8:43,False,2534,2025-01-25T20:56:48Z
401700205101915801,101915801,PersonalFoul,Foul on Jalen Jackson.,16,18,1st Half,8:41,False,98,2025-01-25T20:56:48Z
401700205101915802,101915802,MadeFreeThrow,Brennen Burns made Free Throw.,16,19,1st Half,8:41,True,2534,2025-01-25T20:56:48Z
401700205101915803,101915803,MadeFreeThrow,Brennen Burns made Free Throw.,16,20,1st Half,8:41,True,2534,2025-01-25T20:56:48Z
401700205101917101,101917101,JumpShot,Braxton Bayless made Jumper. Assisted by Leeroy Odiahi.,18,20,1st Half,8:28,True,98,2025-01-25T20:58:04Z
401700205101919401,101919401,JumpShot,Josiah Hammons made Three Point Jumper. Assisted by Lamar Wilkerson.,18,23,1st Half,8:05,True,2534,2025-01-25T20:58:26Z
401700205101924501,101924501,LayUpShot,Jalen Jackson missed Layup.,18,23,1st Half,7:54,False,98,2025-01-25T20:58:36Z
401700205101924801,101924801,Defensive Rebound,Cameron Huefner Defensive Rebound.,18,23,1st Half,7:51,False,2534,2025-01-25T20:58:40Z
401700205101925401,101925401,JumpShot,Cameron Huefner missed Three Point Jumper.,18,23,1st Half,7:45,False,2534,2025-01-25T20:58:46Z
401700205101925701,101925701,Defensive Rebound,Western Kentucky Defensive Rebound.,18,23,1st Half,7:42,False,98,2025-01-25T20:58:46Z
401700205101925702,101925702,OfficialTVTimeOut, Official TV Timeout,18,23,1st Half,7:42,False,,2025-01-25T20:58:46Z
401700205101926701,101926701,LayUpShot,Leeroy Odiahi made Layup. Assisted by Braxton Bayless.,20,23,1st Half,7:32,True,98,2025-01-25T21:01:32Z
401700205101928401,101928401,PersonalFoul,Foul on Lamar Wilkerson.,20,23,1st Half,7:15,False,2534,2025-01-25T21:01:49Z
401700205101928402,101928402,Lost Ball Turnover,Lamar Wilkerson Turnover.,20,23,1st Half,7:15,False,2534,2025-01-25T21:01:49Z
401700205101929602,101929602,PersonalFoul,Foul on Tyrone Marshall Jr..,20,23,1st Half,7:03,False,98,2025-01-25T21:02:16Z
401700205101929603,101929603,Lost Ball Turnover,Tyrone Marshall Jr. Turnover.,20,23,1st Half,7:03,False,98,2025-01-25T21:02:16Z
401700205101935101,101935101,JumpShot,Cameron Huefner made Three Point Jumper. Assisted by Marcus Boykin.,20,26,1st Half,6:48,True,2534,2025-01-25T21:02:53Z
401700205101938301,101938301,JumpShot,Don McHenry missed Three Point Jumper.,20,26,1st Half,6:16,False,98,2025-01-25T21:03:24Z
401700205101938901,101938901,Offensive Rebound,Braxton Bayless Offensive Rebound.,20,26,1st Half,6:10,False,98,2025-01-25T21:03:30Z
401700205101939001,101939001,JumpShot,Braxton Bayless made Three Point Jumper.,23,26,1st Half,6:09,True,98,2025-01-25T21:03:30Z
401700205101944501,101944501,Lost Ball Turnover,Marcus Boykin Turnover.,23,26,1st Half,5:54,False,2534,2025-01-25T21:03:47Z
401700205101945001,101945001,LayUpShot,Jalen Jackson made Layup.,25,26,1st Half,5:49,True,98,2025-01-25T21:03:50Z
401700205101945101,101945101,ShortTimeOut,Sam Houston  Timeout,25,26,1st Half,5:48,False,2534,2025-01-25T21:03:50Z
401700205101947201,101947201,JumpShot,Dorian Finister missed Three Point Jumper.,25,26,1st Half,5:27,False,2534,2025-01-25T21:05:23Z
401700205101947501,101947501,Offensive Rebound,Kalifa Sakho Offensive Rebound.,25,26,1st Half,5:24,False,2534,2025-01-25T21:05:23Z
401700205101947701,101947701,PersonalFoul,Foul on Leeroy Odiahi.,25,26,1st Half,5:22,False,98,2025-01-25T21:05:30Z
401700205101947702,101947702,MadeFreeThrow,Kalifa Sakho made Free Throw.,25,27,1st Half,5:22,True,2534,2025-01-25T21:05:30Z
401700205101947703,101947703,MadeFreeThrow,Kalifa Sakho made Free Throw.,25,28,1st Half,5:22,True,2534,2025-01-25T21:05:30Z
401700205101948701,101948701,Lost Ball Turnover,Braxton Bayless Turnover.,25,28,1st Half,5:12,False,98,2025-01-25T21:06:45Z
401700205101954201,101954201,JumpShot,Dorian Finister made Jumper.,25,30,1st Half,4:57,True,2534,2025-01-25T21:07:22Z
401700205101955301,101955301,JumpShot,Braxton Bayless missed Three Point Jumper.,25,30,1st Half,4:46,False,98,2025-01-25T21:07:33Z
401700205101955501,101955501,Defensive Rebound,Sam Houston Defensive Rebound.,25,30,1st Half,4:44,False,2534,2025-01-25T21:07:33Z
401700205101956601,101956601,JumpShot,Lamar Wilkerson missed Three Point Jumper.,25,30,1st Half,4:33,False,2534,2025-01-25T21:08:05Z
401700205101957001,101957001,Defensive Rebound,Enoch Kalambay Defensive Rebound.,25,30,1st Half,4:29,False,98,2025-01-25T21:08:08Z
401700205101957901,101957901,LayUpShot,Khristian Lander made Layup. Assisted by Enoch Kalambay.,27,30,1st Half,4:20,True,98,2025-01-25T21:08:17Z
401700205101965001,101965001,JumpShot,Marcus Boykin missed Three Point Jumper.,27,30,1st Half,3:49,False,2534,2025-01-25T21:08:49Z
401700205101965401,101965401,Offensive Rebound,Dorian Finister Offensive Rebound.,27,30,1st Half,3:45,False,2534,2025-01-25T21:08:52Z
401700205101965601,101965601,JumpShot,Dorian Finister missed Jumper.,27,30,1st Half,3:43,False,2534,2025-01-25T21:08:52Z
401700205101966001,101966001,Defensive Rebound,Enoch Kalambay Defensive Rebound.,27,30,1st Half,3:39,False,98,2025-01-25T21:08:58Z
401700205101966801,101966801,JumpShot,Don McHenry missed Three Point Jumper.,27,30,1st Half,3:31,False,98,2025-01-25T21:09:08Z
401700205101967201,101967201,Defensive Rebound,Marcus Boykin Defensive Rebound.,27,30,1st Half,3:27,False,2534,2025-01-25T21:09:10Z
401700205101968201,101968201,JumpShot,Marcus Boykin made Jumper.,27,32,1st Half,3:17,True,2534,2025-01-25T21:09:20Z
401700205101969101,101969101,PersonalFoul,Foul on Kalifa Sakho.,27,32,1st Half,3:08,False,2534,2025-01-25T21:09:31Z
401700205101969102,101969102,OfficialTVTimeOut, Official TV Timeout,27,32,1st Half,3:08,False,,2025-01-25T21:09:31Z
401700205101969103,101969103,MadeFreeThrow,Don McHenry made Free Throw.,28,32,1st Half,3:08,True,98,2025-01-25T21:09:31Z
401700205101969104,101969104,MadeFreeThrow,Don McHenry made Free Throw.,29,32,1st Half,3:08,True,98,2025-01-25T21:09:31Z
401700205101974701,101974701,JumpShot,Marcus Boykin missed Three Point Jumper.,29,32,1st Half,2:52,False,2534,2025-01-25T21:12:48Z
401700205101975101,101975101,Defensive Rebound,Blaise Keita Defensive Rebound.,29,32,1st Half,2:48,False,98,2025-01-25T21:12:52Z
401700205101976001,101976001,LayUpShot,Khristian Lander made Layup.,31,32,1st Half,2:39,True,98,2025-01-25T21:13:01Z
401700205101977301,101977301,LayUpShot,Marcus Boykin made Layup.,31,34,1st Half,2:26,True,2534,2025-01-25T21:13:14Z
401700205101978101,101978101,LayUpShot,Enoch Kalambay missed Layup.,31,34,1st Half,2:18,False,98,2025-01-25T21:13:23Z
401700205101978201,101978201,Offensive Rebound,Western Kentucky Offensive Rebound.,31,34,1st Half,2:17,False,98,2025-01-25T21:13:23Z
401700205101978801,101978801,JumpShot,Enoch Kalambay made Three Point Jumper. Assisted by Khristian Lander.,34,34,1st Half,2:11,True,98,2025-01-25T21:13:46Z
401700205101984901,101984901,JumpShot,Marcus Boykin missed Jumper.,34,34,1st Half,1:50,False,2534,2025-01-25T21:14:06Z
401700205101985301,101985301,Defensive Rebound,Jack Edelen Defensive Rebound.,34,34,1st Half,1:46,False,98,2025-01-25T21:14:10Z
401700205101987401,101987401,JumpShot,Enoch Kalambay missed Three Point Jumper.,34,34,1st Half,1:25,False,98,2025-01-25T21:14:32Z
401700205101987801,101987801,Defensive Rebound,Marcus Boykin Defensive Rebound.,34,34,1st Half,1:21,False,2534,2025-01-25T21:14:35Z
401700205101994601,101994601,JumpShot,Cheikh Ndiaye missed Jumper.,34,34,1st Half,0:53,False,2534,2025-01-25T21:15:20Z
401700205101994901,101994901,Defensive Rebound,Leeroy Odiahi Defensive Rebound.,34,34,1st Half,0:50,False,98,2025-01-25T21:15:23Z
401700205101995401,101995401,JumpShot,Don McHenry missed Three Point Jumper.,34,34,1st Half,0:45,False,98,2025-01-25T21:15:30Z
401700205101995801,101995801,Defensive Rebound,Cheikh Ndiaye Defensive Rebound.,34,34,1st Half,0:41,False,2534,2025-01-25T21:15:30Z
401700205101998201,101998201,JumpShot,Cameron Huefner missed Three Point Jumper.,34,34,1st Half,0:17,False,2534,2025-01-25T21:15:57Z
401700205101998501,101998501,PersonalFoul,Foul on Leeroy Odiahi.,34,34,1st Half,0:14,False,98,2025-01-25T21:17:12Z
401700205101998502,101998502,MadeFreeThrow,Cheikh Ndiaye missed Free Throw.,34,34,1st Half,0:14,False,2534,2025-01-25T21:17:12Z
401700205101998503,101998503,Offensive Rebound,Sam Houston Offensive Rebound.,34,34,1st Half,0:14,False,2534,2025-01-25T21:17:12Z
401700205101998504,101998504,MadeFreeThrow,Cheikh Ndiaye missed Free Throw.,34,34,1st Half,0:14,False,2534,2025-01-25T21:17:12Z
401700205101998602,101998602,Defensive Rebound,Enoch Kalambay Defensive Rebound.,34,34,1st Half,0:13,False,98,2025-01-25T21:17:12Z
401700205101998603,101998603,Offensive Rebound,Cheikh Ndiaye Offensive Rebound.,34,34,1st Half,0:13,False,2534,2025-01-25T21:17:12Z
401700205101999601,101999601,LayUpShot,Khristian Lander made Layup.,36,34,1st Half,0:03,True,98,2025-01-25T21:17:23Z
401700205101999901,101999901,End Period,End of 1st half,36,34,1st Half,0:00,False,,2025-01-25T21:17:23Z
401700205102806001,102806001,PersonalFoul,Foul on Jalen Jackson.,36,34,2nd Half,19:39,False,98,
401700205102807001,102807001,DunkShot,Kalifa Sakho made Dunk. Assisted by Marcus Boykin.,36,36,2nd Half,19:29,True,2534,
401700205102808901,102808901,PersonalFoul,Foul on Cameron Huefner.,36,36,2nd Half,19:10,False,2534,2025-01-25T21:34:37Z
401700205102808902,102808902,MadeFreeThrow,Enoch Kalambay made Free Throw.,37,36,2nd Half,19:10,True,98,2025-01-25T21:34:37Z
401700205102808903,102808903,MadeFreeThrow,Enoch Kalambay made Free Throw.,38,36,2nd Half,19:10,True,98,2025-01-25T21:34:37Z
401700205102814201,102814201,PersonalFoul,Foul on Marcus Boykin.,38,36,2nd Half,18:57,False,2534,2025-01-25T21:35:36Z
401700205102814202,102814202,Lost Ball Turnover,Marcus Boykin Turnover.,38,36,2nd Half,18:57,False,2534,2025-01-25T21:35:36Z
401700205102816401,102816401,JumpShot,Khristian Lander missed Three Point Jumper.,38,36,2nd Half,18:35,False,98,2025-01-25T21:36:20Z
401700205102816801,102816801,Defensive Rebound,Cameron Huefner Defensive Rebound.,38,36,2nd Half,18:31,False,2534,2025-01-25T21:36:23Z
401700205102817601,102817601,JumpShot,Marcus Boykin made Jumper.,38,38,2nd Half,18:23,True,2534,2025-01-25T21:36:31Z
401700205102819001,102819001,JumpShot,Tyrone Marshall Jr. made Three Point Jumper. Assisted by Jalen Jackson.,41,38,2nd Half,18:09,True,98,2025-01-25T21:36:45Z
401700205102825001,102825001,JumpShot,Lamar Wilkerson made Three Point Jumper. Assisted by Marcus Boykin.,41,41,2nd Half,17:49,True,2534,2025-01-25T21:37:04Z
401700205102826101,102826101,Lost Ball Turnover,Blaise Keita Turnover.,41,41,2nd Half,17:38,False,98,2025-01-25T21:37:16Z
401700205102826102,102826102,Steal,Marcus Boykin Steal.,41,41,2nd Half,17:38,False,2534,2025-01-25T21:37:16Z
401700205102826901,102826901,JumpShot,Cameron Huefner missed Three Point Jumper.,41,41,2nd Half,17:30,False,2534,2025-01-25T21:37:26Z
401700205102827401,102827401,Offensive Rebound,Cameron Huefner Offensive Rebound.,41,41,2nd Half,17:25,False,2534,2025-01-25T21:37:26Z
401700205102827402,102827402,ShortTimeOut,Sam Houston  Timeout,41,41,2nd Half,17:25,False,2534,2025-01-25T21:37:26Z
401700205102827403,102827403,OfficialTVTimeOut, Official TV Timeout,41,41,2nd Half,17:25,False,,2025-01-25T21:37:26Z
401700205102829101,102829101,JumpShot,Marcus Boykin missed Three Point Jumper.,41,41,2nd Half,17:08,False,2534,2025-01-25T21:41:10Z
401700205102829501,102829501,Defensive Rebound,Blaise Keita Defensive Rebound.,41,41,2nd Half,17:04,False,98,2025-01-25T21:41:12Z
401700205102834901,102834901,Lost Ball Turnover,Blaise Keita Turnover.,41,41,2nd Half,16:50,False,98,2025-01-25T21:41:26Z
401700205102837001,102837001,DunkShot,Kalifa Sakho made Dunk. Assisted by Cameron Huefner.,41,43,2nd Half,16:29,True,2534,2025-01-25T21:42:07Z
401700205102838801,102838801,JumpShot,Braxton Bayless made Jumper.,43,43,2nd Half,16:11,True,98,2025-01-25T21:42:24Z
401700205102844201,102844201,JumpShot,Cameron Huefner missed Three Point Jumper.,43,43,2nd Half,15:57,False,2534,2025-01-25T21:42:39Z
401700205102844601,102844601,Offensive Rebound,Kalifa Sakho Offensive Rebound.,43,43,2nd Half,15:53,False,2534,2025-01-25T21:42:42Z
401700205102844901,102844901,PersonalFoul,Foul on Jalen Jackson.,43,43,2nd Half,15:50,False,98,2025-01-25T21:42:42Z
401700205102844902,102844902,OfficialTVTimeOut, Official TV Timeout,43,43,2nd Half,15:50,False,,2025-01-25T21:42:55Z
401700205102844903,102844903,MadeFreeThrow,Lamar Wilkerson made Free Throw.,43,44,2nd Half,15:50,True,2534,2025-01-25T21:42:55Z
