play_id,sequence_number,type,description,away_score,home_score,period,clock,scoring_play,team_id,timestamp_utc
401722520101807101,101807101,Lost Ball Turnover,Missouri State  Turnover.,0,0,1st Half,19:28,False,2623,2025-02-08T22:03:21Z
401722520101808201,101808201,JumpShot,Tyler Lundblade made Three Point Jumper. Assisted by Carter Whitt.,0,3,1st Half,19:17,True,2057,2025-02-08T22:03:52Z
401722520101815301,101815301,LayUpShot,Michael Osei-Bonsu made Layup.,2,3,1st Half,18:46,True,2623,2025-02-08T22:04:22Z
401722520101816401,101816401,Lost Ball Turnover,Isaiah Walker Turnover.,2,3,1st Half,18:35,False,2057,2025-02-08T22:04:33Z
401722520101817701,101817701,PersonalFoul,Foul on Michael Osei-Bonsu.,2,3,1st Half,18:22,False,2623,2025-02-08T22:04:55Z
401722520101817702,101817702,Lost Ball Turnover,Michael Osei-Bonsu Turnover.,2,3,1st Half,18:22,False,2623,2025-02-08T22:04:55Z
401722520101818801,101818801,LayUpShot,Brigham Rogers made Layup. Assisted by Carter Whitt.,2,5,1st Half,18:11,True,2057,2025-02-08T22:05:21Z
401722520101824701,101824701,JumpShot,Zaxton King made Three Point Jumper. Assisted by Michael Osei-Bonsu.,5,5,1st Half,17:52,True,2623,2025-02-08T22:05:43Z
401722520101826801,101826801,LayUpShot,Jonathan Pierre made Layup. Assisted by Carter Whitt.,5,7,1st Half,17:31,True,2057,2025-02-08T22:06:01Z
401722520101828201,101828201,Lost Ball Turnover,Vincent Brady II Turnover.,5,7,1st Half,17:17,False,2623,2025-02-08T22:06:15Z
401722520101828202,101828202,Steal,Brigham Rogers Steal.,5,7,1st Half,17:17,False,2057,2025-02-08T22:06:15Z
401722520101828501,101828501,LayUpShot,Brigham Rogers missed Layup.,5,7,1st Half,17:14,False,2057,2025-02-08T22:06:17Z
401722520101828502,101828502,Block Shot,Dez White Block.,5,7,1st Half,17:14,False,2623,2025-02-08T22:06:17Z
401722520101828503,101828503,Offensive Rebound,Belmont Offensive Rebound.,5,7,1st Half,17:14,False,2057,2025-02-08T22:06:17Z
401722520101834001,101834001,LayUpShot,Isaiah Walker missed Layup.,5,7,1st Half,16:59,False,2057,2025-02-08T22:06:54Z
401722520101834301,101834301,Defensive Rebound,Michael Osei-Bonsu Defensive Rebound.,5,7,1st Half,16:56,False,2623,2025-02-08T22:06:56Z
401722520101835501,101835501,JumpShot,Zaxton King missed Three Point Jumper.,5,7,1st Half,16:44,False,2623,2025-02-08T22:07:09Z
401722520101835801,101835801,Defensive Rebound,Carter Whitt Defensive Rebound.,5,7,1st Half,16:41,False,2057,2025-02-08T22:07:12Z
401722520101836301,101836301,JumpShot,Tyler Lundblade made Three Point Jumper. Assisted by Carter Whitt.,5,10,1st Half,16:36,True,2057,2025-02-08T22:07:18Z
401722520101838301,101838301,JumpShot,Chase Martin missed ,5,10,1st Half,16:16,False,2623,2025-02-08T22:07:42Z
401722520101838701,101838701,Defensive Rebound,Brigham Rogers Defensive Rebound.,5,10,1st Half,16:12,False,2057,2025-02-08T22:07:42Z
401722520101839001,101839001,JumpShot,Jonathan Pierre missed Three Point Jumper.,5,10,1st Half,16:09,False,2057,2025-02-08T22:07:46Z
401722520101839201,101839201,Defensive Rebound,Chase Martin Defensive Rebound.,5,10,1st Half,16:07,False,2623,2025-02-08T22:07:46Z
401722520101844001,101844001,Lost Ball Turnover,Vincent Brady II Turnover.,5,10,1st Half,15:59,False,2623,2025-02-08T22:07:55Z
401722520101844002,101844002,Steal,Brigham Rogers Steal.,5,10,1st Half,15:59,False,2057,2025-02-08T22:07:55Z
401722520101845101,101845101,LayUpShot,Isaiah Walker missed Layup.,5,10,1st Half,15:48,False,2057,2025-02-08T22:08:04Z
401722520101845102,101845102,Defensive Rebound,Missouri State Defensive Rebound.,5,10,1st Half,15:48,False,2623,2025-02-08T22:08:04Z
401722520101845103,101845103,OfficialTVTimeOut,Official TV Timeout,5,10,1st Half,15:48,False,,2025-02-08T22:08:04Z
401722520101845104,101845104,Block Shot,Chase Martin Block.,5,10,1st Half,15:48,False,2623,2025-02-08T22:08:04Z
401722520101846501,101846501,JumpShot,Michael Osei-Bonsu made Layup.,7,10,1st Half,15:34,True,2623,2025-02-08T22:10:49Z
401722520101847701,101847701,JumpShot,Tyler Lundblade made Three Point Jumper. Assisted by Brigham Rogers.,7,13,1st Half,15:22,True,2057,2025-02-08T22:11:01Z
401722520101849701,101849701,Lost Ball Turnover,Vincent Brady II Turnover.,7,13,1st Half,15:02,False,2623,2025-02-08T22:11:22Z
401722520101849702,101849702,Steal,Brody Peebles Steal.,7,13,1st Half,15:02,False,2057,2025-02-08T22:11:22Z
401722520101854401,101854401,Lost Ball Turnover,Carter Whitt Turnover.,7,13,1st Half,14:55,False,2057,2025-02-08T22:11:29Z
401722520101854402,101854402,Steal,Wesley Oba Steal.,7,13,1st Half,14:55,False,2623,2025-02-08T22:11:29Z
401722520101855401,101855401,LayUpShot,Wesley Oba made Layup. Assisted by Vincent Brady II.,9,13,1st Half,14:45,True,2623,2025-02-08T22:11:38Z
401722520101857501,101857501,JumpShot,Aidan Noyes made Three Point Jumper. Assisted by Tyler Lundblade.,9,16,1st Half,14:24,True,2057,2025-02-08T22:12:02Z
401722520101859301,101859301,JumpShot,Vincent Brady II missed Three Point Jumper.,9,16,1st Half,14:06,False,2623,2025-02-08T22:12:18Z
401722520101859501,101859501,Offensive Rebound,Michael Osei-Bonsu Offensive Rebound.,9,16,1st Half,14:04,False,2623,2025-02-08T22:12:22Z
401722520101859701,101859701,LayUpShot,Michael Osei-Bonsu made Layup.,11,16,1st Half,14:02,True,2623,2025-02-08T22:12:23Z
401722520101866601,101866601,JumpShot,Tyler Lundblade made Three Point Jumper. Assisted by Brigham Rogers.,11,19,1st Half,13:33,True,2057,2025-02-08T22:12:52Z
401722520101868901,101868901,JumpShot,Zaxton King missed Three Point Jumper.,11,19,1st Half,13:10,False,2623,2025-02-08T22:13:16Z
401722520101869001,101869001,Defensive Rebound,Belmont Defensive Rebound.,11,19,1st Half,13:09,False,2057,2025-02-08T22:13:16Z
401722520101875601,101875601,LayUpShot,Isaiah Walker missed Layup.,11,19,1st Half,12:43,False,2057,2025-02-08T22:14:11Z
401722520101876001,101876001,Offensive Rebound,Isaiah Walker Offensive Rebound.,11,19,1st Half,12:39,False,2057,2025-02-08T22:14:11Z
401722520101876002,101876002,TipShot,Isaiah Walker made Two Point Tip Shot.,11,21,1st Half,12:39,True,2057,2025-02-08T22:14:15Z
401722520101876901,101876901,JumpShot,Dez White missed Three Point Jumper.,11,21,1st Half,12:30,False,2623,2025-02-08T22:14:24Z
401722520101877101,101877101,Defensive Rebound,Belmont Defensive Rebound.,11,21,1st Half,12:28,False,2057,2025-02-08T22:14:26Z
401722520101878801,101878801,LayUpShot,Brody Peebles made Layup.,11,23,1st Half,12:11,True,2057,2025-02-08T22:15:02Z
401722520101879701,101879701,Lost Ball Turnover,Mozae Downing-Rivers Turnover.,11,23,1st Half,12:02,False,2623,2025-02-08T22:16:15Z
401722520101879702,101879702,Steal,Brody Peebles Steal.,11,23,1st Half,12:02,False,2057,2025-02-08T22:15:12Z
401722520101884502,101884502,Lost Ball Turnover,Brody Peebles Turnover.,11,23,1st Half,11:54,False,2057,2025-02-08T22:15:21Z
401722520101884503,101884503,Steal,Wesley Oba Steal.,11,23,1st Half,11:54,False,2623,2025-02-08T22:15:24Z
401722520101884901,101884901,LayUpShot,Wesley Oba missed Layup.,11,23,1st Half,11:50,False,2623,2025-02-08T22:15:24Z
401722520101885501,101885501,Defensive Rebound,Win Miller Defensive Rebound.,11,23,1st Half,11:44,False,2057,2025-02-08T22:15:28Z
401722520101886301,101886301,LayUpShot,Brody Peebles missed Layup.,11,23,1st Half,11:36,False,2057,2025-02-08T22:15:44Z
401722520101886701,101886701,Defensive Rebound,Wesley Oba Defensive Rebound.,11,23,1st Half,11:32,False,2623,2025-02-08T22:15:44Z
401722520101888501,101888501,JumpShot,Chase Martin made Jumper.,13,23,1st Half,11:14,True,2623,2025-02-08T22:15:59Z
401722520101894101,101894101,PersonalFoul,Foul on Mozae Downing-Rivers.,13,23,1st Half,10:58,False,2623,2025-02-08T22:16:15Z
401722520101894102,101894102,OfficialTVTimeOut,Official TV Timeout,13,23,1st Half,10:58,False,,2025-02-08T22:16:15Z
401722520101895601,101895601,LayUpShot,Aidan Noyes missed Layup.,13,23,1st Half,10:43,False,2057,2025-02-08T22:19:05Z
401722520101895602,101895602,Block Shot,Dez White Block.,13,23,1st Half,10:43,False,2623,2025-02-08T22:19:05Z
401722520101896001,101896001,Defensive Rebound,Michael Osei-Bonsu Defensive Rebound.,13,23,1st Half,10:39,False,2623,2025-02-08T22:19:11Z
401722520101896601,101896601,JumpShot,Dez White made Jumper.,15,23,1st Half,10:33,True,2623,2025-02-08T22:19:15Z
401722520101897501,101897501,Lost Ball Turnover,Carter Whitt Turnover.,15,23,1st Half,10:24,False,2057,2025-02-08T22:19:26Z
401722520101897502,101897502,Steal,Mozae Downing-Rivers Steal.,15,23,1st Half,10:24,False,2623,2025-02-08T22:19:26Z
401722520101897901,101897901,LayUpShot,Jalen Hampton made Layup. Assisted by Mozae Downing-Rivers.,17,23,1st Half,10:20,True,2623,2025-02-08T22:19:28Z
401722520101898001,101898001,ShortTimeOut,Belmont Timeout,17,23,1st Half,10:19,False,2057,2025-02-08T22:19:28Z
401722520101899701,101899701,JumpShot,Brody Peebles made Three Point Jumper. Assisted by Jonathan Pierre.,17,26,1st Half,10:02,True,2057,2025-02-08T22:20:43Z
401722520101905101,101905101,JumpShot,Dez White made Jumper.,19,26,1st Half,9:48,True,2623,2025-02-08T22:21:12Z
401722520101906601,101906601,LayUpShot,Brody Peebles missed Layup.,19,26,1st Half,9:33,False,2057,2025-02-08T22:21:12Z
401722520101907001,101907001,Defensive Rebound,Michael Osei-Bonsu Defensive Rebound.,19,26,1st Half,9:29,False,2623,2025-02-08T22:21:17Z
401722520101907601,101907601,PersonalFoul,Foul on Jonathan Pierre.,19,26,1st Half,9:23,False,2057,2025-02-08T22:21:24Z
401722520101908201,101908201,JumpShot,Dez White made Three Point Jumper. Assisted by Vincent Brady II.,22,26,1st Half,9:17,True,2623,2025-02-08T22:21:53Z
401722520101914201,101914201,DunkShot,Brigham Rogers made Dunk. Assisted by Carter Whitt.,22,28,1st Half,8:57,True,2057,2025-02-08T22:22:07Z
401722520101915201,101915201,PersonalFoul,Foul on Michael Osei-Bonsu.,22,28,1st Half,8:47,False,2623,2025-02-08T22:22:17Z
401722520101915202,101915202,Lost Ball Turnover,Michael Osei-Bonsu Turnover.,22,28,1st Half,8:47,False,2623,2025-02-08T22:22:17Z
401722520101916501,101916501,LayUpShot,Aidan Noyes made Layup. Assisted by Brigham Rogers.,22,30,1st Half,8:34,True,2057,2025-02-08T22:23:02Z
401722520101918001,101918001,LayUpShot,Wesley Oba made Layup. Assisted by Dez White.,24,30,1st Half,8:19,True,2623,2025-02-08T22:23:16Z
401722520101924401,101924401,LayUpShot,Aidan Noyes made Layup. Assisted by Jonathan Pierre.,24,32,1st Half,7:55,True,2057,2025-02-08T22:23:46Z
401722520101926001,101926001,LayUpShot,Jalen Hampton made Layup. Assisted by Dez White.,26,32,1st Half,7:39,True,2623,2025-02-08T22:23:56Z
401722520101926002,101926002,PersonalFoul,Foul on Jonathan Pierre.,26,32,1st Half,7:39,False,2057,2025-02-08T22:23:56Z
401722520101926003,101926003,OfficialTVTimeOut,Official TV Timeout,26,32,1st Half,7:39,False,,2025-02-08T22:23:56Z
401722520101926004,101926004,MadeFreeThrow,Jalen Hampton made Free Throw.,27,32,1st Half,7:39,True,2623,2025-02-08T22:23:56Z
401722520101928101,101928101,LayUpShot,Isaiah Walker made Layup.,27,34,1st Half,7:18,True,2057,2025-02-08T22:27:41Z
401722520101929601,101929601,LayUpShot,Jalen Hampton made Layup. Assisted by Vincent Brady II.,29,34,1st Half,7:03,True,2623,2025-02-08T22:27:56Z
401722520101935201,101935201,Lost Ball Turnover,Carter Whitt Turnover.,29,34,1st Half,6:47,False,2057,2025-02-08T22:28:12Z
401722520101935202,101935202,Steal,Jalen Hampton Steal.,29,34,1st Half,6:47,False,2623,2025-02-08T22:28:12Z
401722520101935501,101935501,DunkShot,Jalen Hampton made Dunk.,31,34,1st Half,6:44,True,2623,2025-02-08T22:28:16Z
401722520101937601,101937601,JumpShot,Tyler Lundblade missed Three Point Jumper.,31,34,1st Half,6:23,False,2057,2025-02-08T22:28:37Z
401722520101938001,101938001,Defensive Rebound,Vincent Brady II Defensive Rebound.,31,34,1st Half,6:19,False,2623,2025-02-08T22:28:40Z
401722520101938201,101938201,JumpShot,Dez White missed Three Point Jumper.,31,34,1st Half,6:17,False,2623,2025-02-08T22:28:45Z
401722520101938401,101938401,Offensive Rebound,Missouri State Offensive Rebound.,31,34,1st Half,6:15,False,2623,2025-02-08T22:28:45Z
401722520101944201,101944201,JumpShot,Wesley Oba missed Three Point Jumper.,31,34,1st Half,5:57,False,2623,2025-02-08T22:29:17Z
401722520101944301,101944301,Defensive Rebound,Belmont Defensive Rebound.,31,34,1st Half,5:56,False,2057,2025-02-08T22:29:20Z
401722520101946301,101946301,JumpShot,Carter Whitt made Three Point Jumper. Assisted by Jonathan Pierre.,31,37,1st Half,5:36,True,2057,2025-02-08T22:29:57Z
401722520101949201,101949201,DunkShot,Wesley Oba made Dunk. Assisted by Vincent Brady II.,33,37,1st Half,5:07,True,2623,2025-02-08T22:30:26Z
401722520101955501,101955501,JumpShot,Carter Whitt missed Three Point Jumper.,33,37,1st Half,4:44,False,2057,2025-02-08T22:30:48Z
401722520101955701,101955701,Defensive Rebound,Vincent Brady II Defensive Rebound.,33,37,1st Half,4:42,False,2623,2025-02-08T22:30:52Z
401722520101956801,101956801,JumpShot,Dez White made Jumper.,35,37,1st Half,4:31,True,2623,2025-02-08T22:31:02Z
401722520101959201,101959201,Lost Ball Turnover,Jonathan Pierre Turnover.,35,37,1st Half,4:07,False,2057,2025-02-08T22:31:26Z
401722520101959202,101959202,Steal,Wesley Oba Steal.,35,37,1st Half,4:07,False,2623,2025-02-08T22:31:26Z
401722520101959701,101959701,LayUpShot,Vincent Brady II missed Layup.,35,37,1st Half,4:02,False,2623,2025-02-08T22:31:31Z
401722520101964101,101964101,Offensive Rebound,Jalen Hampton Offensive Rebound.,35,37,1st Half,3:58,False,2623,2025-02-08T22:31:35Z
401722520101964102,101964102,TipShot,Jalen Hampton made Two Point Tip Shot.,37,37,1st Half,3:58,True,2623,2025-02-08T22:31:35Z
401722520101965901,101965901,LayUpShot,Isaiah Walker made Layup. Assisted by Carter Whitt.,37,39,1st Half,3:40,True,2057,2025-02-08T22:31:52Z
401722520101967601,101967601,JumpShot,Dez White made Three Point Jumper. Assisted by Vincent Brady II.,40,39,1st Half,3:23,True,2623,2025-02-08T22:32:10Z
401722520101969001,101969001,PersonalFoul,Foul on Dez White.,40,39,1st Half,3:09,False,2623,2025-02-08T22:32:23Z
401722520101969002,101969002,OfficialTVTimeOut,Official TV Timeout,40,39,1st Half,3:09,False,,2025-02-08T22:32:23Z
401722520101969003,101969003,MadeFreeThrow,Brigham Rogers missed Free Throw.,40,39,1st Half,3:09,False,2057,2025-02-08T22:35:00Z
401722520101969004,101969004,Dead Ball Rebound,Belmont Deadball Team Rebound.,40,39,1st Half,3:09,False,2057,2025-02-08T22:35:00Z
401722520101969005,101969005,MadeFreeThrow,Brigham Rogers made Free Throw.,40,40,1st Half,3:09,True,2057,2025-02-08T22:35:00Z
401722520101975101,101975101,Lost Ball Turnover,Vincent Brady II Turnover.,40,40,1st Half,2:48,False,2623,2025-02-08T22:36:11Z
401722520101975102,101975102,Steal,Carter Whitt Steal.,40,40,1st Half,2:48,False,2057,2025-02-08T22:36:11Z
401722520101975501,101975501,LayUpShot,Carter Whitt missed Layup.,40,40,1st Half,2:44,False,2057,2025-02-08T22:36:16Z
401722520101976001,101976001,Defensive Rebound,Logan Epes Defensive Rebound.,40,40,1st Half,2:39,False,2623,2025-02-08T22:36:21Z
401722520101977201,101977201,JumpShot,Chase Martin missed Jumper.,40,40,1st Half,2:27,False,2623,2025-02-08T22:36:32Z
401722520101977401,101977401,Offensive Rebound,Chase Martin Offensive Rebound.,40,40,1st Half,2:25,False,2623,2025-02-08T22:36:35Z
401722520101977701,101977701,Lost Ball Turnover,Chase Martin Turnover.,40,40,1st Half,2:22,False,2623,2025-02-08T22:36:36Z
401722520101977702,101977702,Steal,Brigham Rogers Steal.,40,40,1st Half,2:22,False,2057,2025-02-08T22:36:36Z
401722520101977901,101977901,PersonalFoul,Foul on Wesley Oba.,40,40,1st Half,2:20,False,2623,2025-02-08T22:36:40Z
401722520101979601,101979601,Lost Ball Turnover,Isaiah Walker Turnover.,40,40,1st Half,2:03,False,2057,2025-02-08T22:38:05Z
401722520101985701,101985701,LayUpShot,Chase Martin missed Layup.,40,40,1st Half,1:42,False,2623,2025-02-08T22:38:39Z
401722520101985702,101985702,Defensive Rebound,Aidan Noyes Defensive Rebound.,40,40,1st Half,1:42,False,2057,2025-02-08T22:38:39Z
401722520101985703,101985703,Block Shot,Brigham Rogers Block.,40,40,1st Half,1:42,False,2057,2025-02-08T22:38:39Z
401722520101985903,101985903,PersonalFoul,Foul on Chase Martin.,40,40,1st Half,1:40,False,2623,2025-02-08T22:38:43Z
401722520101987501,101987501,LayUpShot,Aidan Noyes made Layup. Assisted by Carter Whitt.,40,42,1st Half,1:24,True,2057,2025-02-08T22:39:17Z
401722520101989201,101989201,PersonalFoul,Foul on Aidan Noyes.,40,42,1st Half,1:07,False,2057,2025-02-08T22:39:36Z
401722520101994101,101994101,LayUpShot,Zaxton King made Layup.,42,42,1st Half,0:58,True,2623,2025-02-08T22:39:59Z
401722520101995601,101995601,Lost Ball Turnover,Brigham Rogers Turnover.,42,42,1st Half,0:43,False,2057,2025-02-08T22:40:13Z
401722520101997001,101997001,LayUpShot,Jalen Hampton made Layup. Assisted by Dez White.,44,42,1st Half,0:29,True,2623,2025-02-08T22:41:05Z
401722520101997002,101997002,PersonalFoul,Foul on Aidan Noyes.,44,42,1st Half,0:29,False,2057,2025-02-08T22:41:05Z
401722520101997003,101997003,MadeFreeThrow,Jalen Hampton missed Free Throw.,44,42,1st Half,0:29,False,2623,2025-02-08T22:41:05Z
401722520101997101,101997101,Defensive Rebound,Isaiah Walker Defensive Rebound.,44,42,1st Half,0:28,False,2057,2025-02-08T22:41:32Z
401722520101999601,101999601,JumpShot,Tyler Lundblade made Three Point Jumper. Assisted by Carter Whitt.,44,45,1st Half,0:03,True,2057,2025-02-08T22:41:56Z
401722520101999901,101999901,End Period,End of 1st half,44,45,1st Half,0:00,False,,2025-02-08T22:41:56Z
401722520102806201,102806201,JumpShot,Carter Whitt missed Jumper.,44,45,2nd Half,19:37,False,2057,
401722520102806701,102806701,Defensive Rebound,Jalen Hampton Defensive Rebound.,44,45,2nd Half,19:32,False,2623,
401722520102808601,102808601,JumpShot,Dez White missed Jumper.,44,45,2nd Half,19:13,False,2623,2025-02-08T22:59:17Z
401722520102808901,102808901,Defensive Rebound,Jonathan Pierre Defensive Rebound.,44,45,2nd Half,19:10,False,2057,2025-02-08T22:59:17Z
401722520102809901,102809901,JumpShot,Tyler Lundblade missed Three Point Jumper.,44,45,2nd Half,19:00,False,2057,2025-02-08T22:59:29Z
401722520102814201,102814201,Defensive Rebound,Michael Osei-Bonsu Defensive Rebound.,44,45,2nd Half,18:57,False,2623,2025-02-08T22:59:29Z
401722520102815201,102815201,JumpShot,Vincent Brady II made Jumper.,46,45,2nd Half,18:47,True,2623,2025-02-08T22:59:38Z
401722520102817201,102817201,JumpShot,Tyler Lundblade made Three Point Jumper. Assisted by Isaiah Walker.,46,48,2nd Half,18:27,True,2057,2025-02-08T22:59:59Z
401722520102819801,102819801,Lost Ball Turnover,Michael Osei-Bonsu Turnover.,46,48,2nd Half,18:01,False,2623,2025-02-08T23:00:24Z
401722520102826301,102826301,DunkShot,Brigham Rogers made Dunk.,46,50,2nd Half,17:36,True,2057,2025-02-08T23:01:11Z
401722520102828601,102828601,Lost Ball Turnover,Dez White Turnover.,46,50,2nd Half,17:13,False,2623,2025-02-08T23:01:34Z
401722520102828602,102828602,Steal,Brigham Rogers Steal.,46,50,2nd Half,17:13,False,2057,2025-02-08T23:01:34Z
401722520102835401,102835401,LayUpShot,Brody Peebles missed Layup.,46,50,2nd Half,16:45,False,2057,2025-02-08T23:02:12Z
401722520102835901,102835901,Offensive Rebound,Brigham Rogers Offensive Rebound.,46,50,2nd Half,16:40,False,2057,2025-02-08T23:02:12Z
401722520102835902,102835902,TipShot,Brigham Rogers missed Two Point Tip Shot.,46,50,2nd Half,16:40,False,2057,2025-02-08T23:02:20Z
401722520102836001,102836001,Defensive Rebound,Michael Osei-Bonsu Defensive Rebound.,46,50,2nd Half,16:39,False,2623,2025-02-08T23:02:20Z
401722520102836801,102836801,PersonalFoul,Foul on Brody Peebles.,46,50,2nd Half,16:31,False,2057,2025-02-08T23:02:27Z
401722520102836802,102836802,MadeFreeThrow,Vincent Brady II made Free Throw.,47,50,2nd Half,16:31,True,2623,2025-02-08T23:02:27Z
401722520102836803,102836803,MadeFreeThrow,Vincent Brady II made Free Throw.,48,50,2nd Half,16:31,True,2623,2025-02-08T23:02:27Z
401722520102838101,102838101,JumpShot,Jonathan Pierre missed Three Point Jumper.,48,50,2nd Half,16:18,False,2057,2025-02-08T23:03:44Z
401722520102838401,102838401,Defensive Rebound,Jalen Hampton Defensive Rebound.,48,50,2nd Half,16:15,False,2623,2025-02-08T23:03:50Z
401722520102844001,102844001,Lost Ball Turnover,Wesley Oba Turnover.,48,50,2nd Half,15:59,False,2623,2025-02-08T23:04:03Z
401722520102844002,102844002,OfficialTVTimeOut,Official TV Timeout,48,50,2nd Half,15:59,False,,2025-02-08T23:04:03Z
401722520102844901,102844901,JumpShot,Tyler Lundblade missed Three Point Jumper.,48,50,2nd Half,15:50,False,2057,2025-02-08T23:07:14Z
401722520102845201,102845201,Defensive Rebound,Vincent Brady II Defensive Rebound.,48,50,2nd Half,15:47,False,2623,2025-02-08T23:07:18Z
401722520102845801,102845801,JumpShot,Vincent Brady II made Three Point Jumper. Assisted by Dez White.,51,50,2nd Half,15:41,True,2623,2025-02-08T23:07:23Z
401722520102848801,102848801,LayUpShot,Isaiah Walker made Layup. Assisted by Jonathan Pierre.,51,52,2nd Half,15:11,True,2057,2025-02-08T23:07:53Z
401722520102854701,102854701,JumpShot,Vincent Brady II missed Three Point Jumper.,51,52,2nd Half,14:52,False,2623,2025-02-08T23:08:15Z
401722520102855001,102855001,Defensive Rebound,Aidan Noyes Defensive Rebound.,51,52,2nd Half,14:49,False,2057,2025-02-08T23:08:15Z
401722520102856801,102856801,LayUpShot,Isaiah Walker made Layup. Assisted by Jonathan Pierre.,51,54,2nd Half,14:31,True,2057,2025-02-08T23:08:32Z
401722520102858101,102858101,LayUpShot,Jalen Hampton made Layup. Assisted by Michael Osei-Bonsu.,53,54,2nd Half,14:18,True,2623,2025-02-08T23:08:45Z
401722520102865001,102865001,JumpShot,Aidan Noyes missed Three Point Jumper.,53,54,2nd Half,13:49,False,2057,2025-02-08T23:09:18Z
401722520102865301,102865301,Defensive Rebound,Jalen Hampton Defensive Rebound.,53,54,2nd Half,13:46,False,2623,2025-02-08T23:09:18Z
401722520102866001,102866001,JumpShot,Dez White missed Three Point Jumper.,53,54,2nd Half,13:39,False,2623,2025-02-08T23:09:25Z
401722520102866401,102866401,Offensive Rebound,Michael Osei-Bonsu Offensive Rebound.,53,54,2nd Half,13:35,False,2623,2025-02-08T23:09:29Z
401722520102867301,102867301,LayUpShot,Michael Osei-Bonsu missed Layup.,53,54,2nd Half,13:26,False,2623,2025-02-08T23:10:17Z
401722520102867302,102867302,Block Shot,Brigham Rogers Block.,53,54,2nd Half,13:26,False,2057,2025-02-08T23:10:17Z
401722520102867701,102867701,Defensive Rebound,Carter Whitt Defensive Rebound.,53,54,2nd Half,13:22,False,2057,2025-02-08T23:10:22Z
401722520102869201,102869201,JumpShot,Tyler Lundblade made Three Point Jumper. Assisted by Carter Whitt.,53,57,2nd Half,13:07,True,2057,2025-02-08T23:10:36Z
401722520102874401,102874401,JumpShot,Vincent Brady II made Jumper.,55,57,2nd Half,12:55,True,2623,2025-02-08T23:10:47Z
401722520102876101,102876101,JumpShot,Aidan Noyes missed Three Point Jumper.,55,57,2nd Half,12:38,False,2057,2025-02-08T23:11:05Z
401722520102876201,102876201,Defensive Rebound,Missouri State Defensive Rebound.,55,57,2nd Half,12:37,False,2623,2025-02-08T23:11:05Z
401722520102879001,102879001,PersonalFoul,Foul on Brigham Rogers.,55,57,2nd Half,12:09,False,2057,2025-02-08T23:11:43Z
401722520102879002,102879002,MadeFreeThrow,Vincent Brady II missed Free Throw.,55,57,2nd Half,12:09,False,2623,2025-02-08T23:11:43Z
401722520102879003,102879003,Dead Ball Rebound,Missouri State Deadball Team Rebound.,55,57,2nd Half,12:09,False,2623,2025-02-08T23:11:43Z
401722520102879004,102879004,MadeFreeThrow,Vincent Brady II made Free Throw.,56,57,2nd Half,12:09,True,2623,2025-02-08T23:11:43Z
401722520102884701,102884701,LayUpShot,Aidan Noyes made Layup. Assisted by Carter Whitt.,56,59,2nd Half,11:52,True,2057,2025-02-08T23:12:55Z
401722520102885601,102885601,PersonalFoul,Foul on Vincent Brady II.,56,59,2nd Half,11:43,False,2623,2025-02-08T23:13:04Z
401722520102885602,102885602,Lost Ball Turnover,Vincent Brady II Turnover.,56,59,2nd Half,11:43,False,2623,2025-02-08T23:13:04Z
401722520102885603,102885603,OfficialTVTimeOut,Official TV Timeout,56,59,2nd Half,11:43,False,,2025-02-08T23:13:04Z
401722520102886901,102886901,JumpShot,Tyler Lundblade missed Three Point Jumper.,56,59,2nd Half,11:30,False,2057,2025-02-08T23:16:52Z
401722520102887101,102887101,Defensive Rebound,Dez White Defensive Rebound.,56,59,2nd Half,11:28,False,2623,2025-02-08T23:16:52Z
401722520102888101,102888101,PersonalFoul,Foul on Michael Osei-Bonsu.,56,59,2nd Half,11:18,False,2623,2025-02-08T23:17:01Z
401722520102888102,102888102,Lost Ball Turnover,Michael Osei-Bonsu Turnover.,56,59,2nd Half,11:18,False,2623,2025-02-08T23:17:01Z
401722520102894301,102894301,JumpShot,Tyler Lundblade made Three Point Jumper. Assisted by Carter Whitt.,56,62,2nd Half,10:56,True,2057,2025-02-08T23:17:47Z
401722520102896001,102896001,LayUpShot,Jalen Hampton made Layup.,58,62,2nd Half,10:39,True,2623,2025-02-08T23:18:02Z
401722520102898401,102898401,LayUpShot,Brigham Rogers made Layup. Assisted by Carter Whitt.,58,64,2nd Half,10:15,True,2057,2025-02-08T23:18:27Z
401722520102904701,102904701,LayUpShot,Wesley Oba missed Layup.,58,64,2nd Half,9:52,False,2623,2025-02-08T23:18:49Z
401722520102905101,102905101,Offensive Rebound,Jalen Hampton Offensive Rebound.,58,64,2nd Half,9:48,False,2623,2025-02-08T23:18:53Z
401722520102905102,102905102,PersonalFoul,Foul on Isaiah Walker.,58,64,2nd Half,9:48,False,2057,2025-02-08T23:18:53Z
401722520102905103,102905103,MadeFreeThrow,Jalen Hampton missed Free Throw.,58,64,2nd Half,9:48,False,2623,2025-02-08T23:18:53Z
401722520102905104,102905104,MadeFreeThrow,Jalen Hampton missed Free Throw.,58,64,2nd Half,9:48,False,2623,2025-02-08T23:18:53Z
401722520102905106,102905106,Defensive Rebound,Tyler Lundblade Defensive Rebound.,58,64,2nd Half,9:48,False,2057,2025-02-08T23:18:53Z
401722520102905107,102905107,Dead Ball Rebound,Missouri State Deadball Team Rebound.,58,64,2nd Half,9:48,False,2623,2025-02-08T23:18:53Z
401722520102906801,102906801,Lost Ball Turnover,Carter Whitt Turnover.,58,64,2nd Half,9:31,False,2057,2025-02-08T23:23:46Z
401722520102906802,102906802,Steal,Jalen Hampton Steal.,58,64,2nd Half,9:31,False,2623,2025-02-08T23:23:46Z
