play_id,sequence_number,type,description,away_score,home_score,period,clock,scoring_play,team_id,timestamp_utc
401708341102825205,102825205,Offensive Rebound,Alabama Offensive Rebound.,39,52,2nd Half,17:47,False,333,2025-01-22T01:15:08Z
401708341102825206,102825206,MadeFreeThrow,Labaron Philon made Free Throw.,39,53,2nd Half,17:47,True,333,2025-01-22T01:15:08Z
401708341102827801,102827801,JumpShot,Chris Manon missed Three Point Jumper.,39,53,2nd Half,17:21,False,238,2025-01-22T01:16:35Z
401708341102828101,102828101,Defensive Rebound,Mark Sears Defensive Rebound.,39,53,2nd Half,17:18,False,333,2025-01-22T01:16:35Z
401708341102828601,102828601,LayUpShot,Labaron Philon missed Layup.,39,53,2nd Half,17:13,False,333,2025-01-22T01:16:42Z
401708341102828801,102828801,Defensive Rebound,Devin McGlockton Defensive Rebound.,39,53,2nd Half,17:11,False,238,2025-01-22T01:16:42Z
401708341102829201,102829201,JumpShot,Tyler Nickel made Three Point Jumper. Assisted by AJ Hoggard.,42,53,2nd Half,17:07,True,238,2025-01-22T01:16:49Z
401708341102835601,102835601,LayUpShot,Mark Sears missed Layup.,42,53,2nd Half,16:43,False,333,2025-01-22T01:17:13Z
401708341102835602,102835602,Block Shot,Chris Manon Block.,42,53,2nd Half,16:43,False,238,2025-01-22T01:17:16Z
401708341102836001,102836001,Defensive Rebound,Jason Edwards Defensive Rebound.,42,53,2nd Half,16:39,False,238,2025-01-22T01:17:16Z
401708341102836601,102836601,JumpShot,AJ Hoggard missed Three Point Jumper.,42,53,2nd Half,16:33,False,238,2025-01-22T01:17:24Z
401708341102836801,102836801,Defensive Rebound,Grant Nelson Defensive Rebound.,42,53,2nd Half,16:31,False,333,2025-01-22T01:17:24Z
401708341102837201,102837201,PersonalFoul,Foul on Jarin Stevenson.,42,53,2nd Half,16:27,False,333,2025-01-22T01:17:28Z
401708341102837202,102837202,Lost Ball Turnover,Jarin Stevenson Turnover.,42,53,2nd Half,16:27,False,333,2025-01-22T01:17:28Z
401708341102839401,102839401,LayUpShot,Chris Manon missed Layup.,42,53,2nd Half,16:05,False,238,2025-01-22T01:18:29Z
401708341102839801,102839801,Defensive Rebound,Jarin Stevenson Defensive Rebound.,42,53,2nd Half,16:01,False,333,2025-01-22T01:18:33Z
401708341102844201,102844201,JumpShot,Mouhamed Dioubate made Jumper.,42,55,2nd Half,15:57,True,333,2025-01-22T01:18:36Z
401708341102844202,102844202,PersonalFoul,Foul on Tyler Nickel.,42,55,2nd Half,15:57,False,238,2025-01-22T01:18:36Z
401708341102844203,102844203,OfficialTVTimeOut, Official TV Timeout,42,55,2nd Half,15:57,False,,2025-01-22T01:18:36Z
401708341102844204,102844204,MadeFreeThrow,Mouhamed Dioubate missed Free Throw.,42,55,2nd Half,15:57,False,333,2025-01-22T01:18:36Z
401708341102844205,102844205,Defensive Rebound,Tyler Nickel Defensive Rebound.,42,55,2nd Half,15:57,False,238,2025-01-22T01:18:36Z
401708341102844206,102844206,PersonalFoul,Foul on Chris Youngblood.,42,55,2nd Half,15:57,False,333,2025-01-22T01:18:36Z
401708341102845201,102845201,JumpShot,Devin McGlockton made Three Point Jumper. Assisted by Grant Huffman.,45,55,2nd Half,15:47,True,238,2025-01-22T01:22:18Z
401708341102847301,102847301,JumpShot,Aden Holloway missed Three Point Jumper.,45,55,2nd Half,15:26,False,333,2025-01-22T01:22:36Z
401708341102847601,102847601,Defensive Rebound,Devin McGlockton Defensive Rebound.,45,55,2nd Half,15:23,False,238,2025-01-22T01:22:40Z
401708341102854501,102854501,JumpShot,Grant Huffman missed Jumper.,45,55,2nd Half,14:54,False,238,2025-01-22T01:23:09Z
401708341102854701,102854701,Defensive Rebound,Mouhamed Dioubate Defensive Rebound.,45,55,2nd Half,14:52,False,333,2025-01-22T01:23:09Z
401708341102854702,102854702,Lost Ball Turnover,Mouhamed Dioubate Turnover.,45,55,2nd Half,14:52,False,333,2025-01-22T01:23:09Z
401708341102855601,102855601,LayUpShot,Jason Edwards missed Layup.,45,55,2nd Half,14:43,False,238,2025-01-22T01:23:43Z
401708341102855602,102855602,Block Shot,Mouhamed Dioubate Block.,45,55,2nd Half,14:43,False,333,2025-01-22T01:23:43Z
401708341102855603,102855603,Offensive Rebound,Vanderbilt Offensive Rebound.,45,55,2nd Half,14:43,False,238,2025-01-22T01:23:43Z
401708341102856001,102856001,Lost Ball Turnover,Tyler Nickel Turnover.,45,55,2nd Half,14:39,False,238,2025-01-22T01:24:09Z
401708341102856002,102856002,Steal,Mouhamed Dioubate Steal.,45,55,2nd Half,14:39,False,333,2025-01-22T01:24:09Z
401708341102856601,102856601,PersonalFoul,Foul on Tyler Nickel.,45,55,2nd Half,14:33,False,238,2025-01-22T01:24:13Z
401708341102856602,102856602,MadeFreeThrow,Chris Youngblood missed Free Throw.,45,55,2nd Half,14:33,False,333,2025-01-22T01:24:13Z
401708341102856603,102856603,Offensive Rebound,Alabama Offensive Rebound.,45,55,2nd Half,14:33,False,333,2025-01-22T01:24:13Z
401708341102856604,102856604,MadeFreeThrow,Chris Youngblood made Free Throw.,45,56,2nd Half,14:33,True,333,2025-01-22T01:24:13Z
401708341102857901,102857901,JumpShot,Jason Edwards missed Jumper.,45,56,2nd Half,14:20,False,238,2025-01-22T01:25:22Z
401708341102858201,102858201,Defensive Rebound,Aiden Sherrell Defensive Rebound.,45,56,2nd Half,14:17,False,333,2025-01-22T01:25:22Z
401708341102859201,102859201,JumpShot,Aden Holloway made Three Point Jumper.,45,59,2nd Half,14:07,True,333,2025-01-22T01:25:36Z
401708341102865701,102865701,Lost Ball Turnover,Jaylen Carey Turnover.,45,59,2nd Half,13:42,False,238,2025-01-22T01:26:00Z
401708341102865702,102865702,Steal,Aiden Sherrell Steal.,45,59,2nd Half,13:42,False,333,2025-01-22T01:26:05Z
401708341102866201,102866201,JumpShot,Chris Youngblood made Three Point Jumper. Assisted by Mark Sears.,45,62,2nd Half,13:37,True,333,2025-01-22T01:26:09Z
401708341102866301,102866301,ShortTimeOut,Vanderbilt  Timeout,45,62,2nd Half,13:36,False,238,2025-01-22T01:26:05Z
401708341102866302,102866302,OfficialTVTimeOut, Official TV Timeout,45,62,2nd Half,13:36,False,,2025-01-22T01:26:05Z
401708341102867801,102867801,JumpShot,Devin McGlockton missed Jumper.,45,62,2nd Half,13:21,False,238,2025-01-22T01:29:29Z
401708341102868001,102868001,PersonalFoul,Foul on Aiden Sherrell.,45,62,2nd Half,13:19,False,333,2025-01-22T01:29:33Z
401708341102868101,102868101,Offensive Rebound,Devin McGlockton Offensive Rebound.,45,62,2nd Half,13:18,False,238,2025-01-22T01:29:33Z
401708341102868701,102868701,JumpShot,MJ Collins Jr. missed Jumper.,45,62,2nd Half,13:12,False,238,2025-01-22T01:30:26Z
401708341102869001,102869001,Defensive Rebound,Aiden Sherrell Defensive Rebound.,45,62,2nd Half,13:09,False,333,2025-01-22T01:30:30Z
401708341102874301,102874301,LayUpShot,Mouhamed Dioubate made Layup.,45,64,2nd Half,12:56,True,333,2025-01-22T01:30:42Z
401708341102876201,102876201,Lost Ball Turnover,Jaylen Carey Turnover.,45,64,2nd Half,12:37,False,238,2025-01-22T01:31:00Z
401708341102877701,102877701,JumpShot,Chris Youngblood made Three Point Jumper. Assisted by Mark Sears.,45,67,2nd Half,12:22,True,333,2025-01-22T01:31:27Z
401708341102884501,102884501,JumpShot,Devin McGlockton made Three Point Jumper. Assisted by Grant Huffman.,48,67,2nd Half,11:54,True,238,2025-01-22T01:31:55Z
401708341102885801,102885801,JumpShot,Aiden Sherrell missed Three Point Jumper.,48,67,2nd Half,11:41,False,333,2025-01-22T01:32:09Z
401708341102885802,102885802,PersonalFoul,Foul on Mouhamed Dioubate.,48,67,2nd Half,11:41,False,333,2025-01-22T01:35:19Z
401708341102885803,102885803,OfficialTVTimeOut, Official TV Timeout,48,67,2nd Half,11:41,False,,2025-01-22T01:35:19Z
401708341102886101,102886101,Defensive Rebound,Devin McGlockton Defensive Rebound.,48,67,2nd Half,11:38,False,238,2025-01-22T01:32:09Z
401708341102887301,102887301,LayUpShot,Devin McGlockton missed Layup.,48,67,2nd Half,11:26,False,238,2025-01-22T01:35:19Z
401708341102887302,102887302,Block Shot,Clifford Omoruyi Block.,48,67,2nd Half,11:26,False,333,2025-01-22T01:35:24Z
401708341102887701,102887701,Defensive Rebound,Chris Youngblood Defensive Rebound.,48,67,2nd Half,11:22,False,333,2025-01-22T01:35:24Z
401708341102888101,102888101,JumpShot,Chris Youngblood missed Three Point Jumper.,48,67,2nd Half,11:18,False,333,2025-01-22T01:35:27Z
401708341102888301,102888301,Offensive Rebound,Jarin Stevenson Offensive Rebound.,48,67,2nd Half,11:16,False,333,2025-01-22T01:35:27Z
401708341102888302,102888302,PersonalFoul,Foul on Devin McGlockton.,48,67,2nd Half,11:16,False,238,2025-01-22T01:35:27Z
401708341102888303,102888303,MadeFreeThrow,Jarin Stevenson missed Free Throw.,48,67,2nd Half,11:16,False,333,2025-01-22T01:35:27Z
401708341102888304,102888304,Offensive Rebound,Alabama Offensive Rebound.,48,67,2nd Half,11:16,False,333,2025-01-22T01:35:27Z
401708341102888305,102888305,MadeFreeThrow,Jarin Stevenson made Free Throw.,48,68,2nd Half,11:16,True,333,2025-01-22T01:35:27Z
401708341102889501,102889501,JumpShot,Tyler Nickel missed Three Point Jumper.,48,68,2nd Half,11:04,False,238,2025-01-22T01:36:33Z
401708341102889801,102889801,Defensive Rebound,Aden Holloway Defensive Rebound.,48,68,2nd Half,11:01,False,333,2025-01-22T01:36:37Z
401708341102894401,102894401,JumpShot,Aden Holloway missed Jumper.,48,68,2nd Half,10:55,False,333,2025-01-22T01:36:42Z
401708341102894701,102894701,Defensive Rebound,Tyler Nickel Defensive Rebound.,48,68,2nd Half,10:52,False,238,2025-01-22T01:36:46Z
401708341102895601,102895601,JumpShot,Jason Edwards made Jumper.,50,68,2nd Half,10:43,True,238,2025-01-22T01:36:55Z
401708341102896901,102896901,PersonalFoul,Foul on Devin McGlockton.,50,68,2nd Half,10:30,False,238,2025-01-22T01:37:06Z
401708341102896902,102896902,MadeFreeThrow,Chris Youngblood missed Free Throw.,50,68,2nd Half,10:30,False,333,2025-01-22T01:37:06Z
401708341102896903,102896903,Offensive Rebound,Alabama Offensive Rebound.,50,68,2nd Half,10:30,False,333,2025-01-22T01:37:06Z
401708341102896904,102896904,MadeFreeThrow,Chris Youngblood made Free Throw.,50,69,2nd Half,10:30,True,333,2025-01-22T01:37:06Z
401708341102898301,102898301,JumpShot,AJ Hoggard missed Jumper.,50,69,2nd Half,10:16,False,238,2025-01-22T01:38:10Z
401708341102898302,102898302,Offensive Rebound,Jaylen Carey Offensive Rebound.,50,69,2nd Half,10:16,False,238,2025-01-22T01:38:20Z
401708341102898303,102898303,PersonalFoul,Foul on Jarin Stevenson.,50,69,2nd Half,10:16,False,333,2025-01-22T01:38:20Z
401708341102898801,102898801,LayUpShot,Jaylen Carey missed Layup.,50,69,2nd Half,10:11,False,238,2025-01-22T01:38:57Z
401708341102899201,102899201,Offensive Rebound,Jaylen Carey Offensive Rebound.,50,69,2nd Half,10:07,False,238,2025-01-22T01:38:57Z
401708341102899202,102899202,JumpShot,Jaylen Carey missed Jumper.,50,69,2nd Half,10:07,False,238,2025-01-22T01:38:57Z
401708341102899401,102899401,Offensive Rebound,Jaylen Carey Offensive Rebound.,50,69,2nd Half,10:05,False,238,2025-01-22T01:39:01Z
401708341102899402,102899402,JumpShot,Jaylen Carey made Jumper.,52,69,2nd Half,10:05,True,238,2025-01-22T01:39:01Z
401708341102904301,102904301,DunkShot,Clifford Omoruyi made Dunk. Assisted by Mark Sears.,52,71,2nd Half,9:56,True,333,2025-01-22T01:39:08Z
401708341102906301,102906301,JumpShot,MJ Collins Jr. made Jumper.,54,71,2nd Half,9:36,True,238,2025-01-22T01:39:29Z
401708341102909701,102909701,JumpShot,Mark Sears missed Jumper.,54,71,2nd Half,9:02,False,333,2025-01-22T01:40:02Z
401708341102909702,102909702,Defensive Rebound,Jason Edwards Defensive Rebound.,54,71,2nd Half,9:02,False,238,2025-01-22T01:40:02Z
401708341102909703,102909703,PersonalFoul,Foul on Chris Youngblood.,54,71,2nd Half,9:02,False,333,2025-01-22T01:40:02Z
401708341102909704,102909704,MadeFreeThrow,Jason Edwards made Free Throw.,55,71,2nd Half,9:02,True,238,2025-01-22T01:40:02Z
401708341102909705,102909705,MadeFreeThrow,Jason Edwards missed Free Throw.,55,71,2nd Half,9:02,False,238,2025-01-22T01:40:02Z
401708341102909801,102909801,Defensive Rebound,Grant Nelson Defensive Rebound.,55,71,2nd Half,9:01,False,333,2025-01-22T01:41:05Z
401708341102914801,102914801,LayUpShot,Labaron Philon made Layup.,55,73,2nd Half,8:51,True,333,2025-01-22T01:41:14Z
401708341102915801,102915801,LayUpShot,AJ Hoggard made Layup.,57,73,2nd Half,8:41,True,238,2025-01-22T01:41:24Z
401708341102915802,102915802,PersonalFoul,Foul on Aden Holloway.,57,73,2nd Half,8:41,False,333,2025-01-22T01:41:24Z
401708341102915803,102915803,MadeFreeThrow,AJ Hoggard made Free Throw.,58,73,2nd Half,8:41,True,238,2025-01-22T01:41:24Z
401708341102917001,102917001,JumpShot,Aden Holloway missed Three Point Jumper.,58,73,2nd Half,8:29,False,333,2025-01-22T01:42:50Z
401708341102917401,102917401,Defensive Rebound,AJ Hoggard Defensive Rebound.,58,73,2nd Half,8:25,False,238,2025-01-22T01:42:54Z
401708341102918201,102918201,LayUpShot,Jaylen Carey missed Layup.,58,73,2nd Half,8:17,False,238,2025-01-22T01:43:01Z
401708341102918202,102918202,Block Shot,Grant Nelson Block.,58,73,2nd Half,8:17,False,333,2025-01-22T01:43:05Z
401708341102918701,102918701,Defensive Rebound,Labaron Philon Defensive Rebound.,58,73,2nd Half,8:12,False,333,2025-01-22T01:43:05Z
401708341102918702,102918702,LayUpShot,Mouhamed Dioubate made Layup.,58,75,2nd Half,8:12,True,333,2025-01-22T01:43:05Z
401708341102918703,102918703,PersonalFoul,Foul on Jason Edwards.,58,75,2nd Half,8:12,False,238,2025-01-22T01:43:05Z
401708341102918704,102918704,MadeFreeThrow,Mouhamed Dioubate made Free Throw.,58,76,2nd Half,8:12,True,333,2025-01-22T01:43:05Z
401708341102924301,102924301,JumpShot,MJ Collins Jr. made Jumper.,60,76,2nd Half,7:56,True,238,2025-01-22T01:43:59Z
401708341102925801,102925801,Lost Ball Turnover,Labaron Philon Turnover.,60,76,2nd Half,7:41,False,333,2025-01-22T01:44:13Z
401708341102925802,102925802,Steal,Chris Manon Steal.,60,76,2nd Half,7:41,False,238,2025-01-22T01:44:18Z
401708341102926401,102926401,JumpShot,Jason Edwards missed Three Point Jumper.,60,76,2nd Half,7:35,False,238,2025-01-22T01:44:18Z
401708341102926801,102926801,Offensive Rebound,MJ Collins Jr. Offensive Rebound.,60,76,2nd Half,7:31,False,238,2025-01-22T01:44:22Z
401708341102926802,102926802,JumpShot,MJ Collins Jr. made Jumper.,62,76,2nd Half,7:31,True,238,2025-01-22T01:44:22Z
401708341102927201,102927201,JumpShot,Aden Holloway made Three Point Jumper. Assisted by Labaron Philon.,62,79,2nd Half,7:27,True,333,2025-01-22T01:44:25Z
401708341102929001,102929001,JumpShot,AJ Hoggard missed Jumper.,62,79,2nd Half,7:09,False,238,2025-01-22T01:44:45Z
401708341102929501,102929501,Offensive Rebound,MJ Collins Jr. Offensive Rebound.,62,79,2nd Half,7:04,False,238,2025-01-22T01:44:49Z
401708341102929701,102929701,Lost Ball Turnover,AJ Hoggard Turnover.,62,79,2nd Half,7:02,False,238,2025-01-22T01:44:53Z
401708341102929702,102929702,Steal,Labaron Philon Steal.,62,79,2nd Half,7:02,False,333,2025-01-22T01:44:53Z
401708341102934301,102934301,JumpShot,Labaron Philon missed Three Point Jumper.,62,79,2nd Half,6:56,False,333,2025-01-22T01:45:01Z
401708341102934601,102934601,Offensive Rebound,Alabama Offensive Rebound.,62,79,2nd Half,6:53,False,333,2025-01-22T01:45:01Z
401708341102934602,102934602,OfficialTVTimeOut, Official TV Timeout,62,79,2nd Half,6:53,False,,2025-01-22T01:45:01Z
401708341102935201,102935201,LayUpShot,Grant Nelson made Layup.,62,81,2nd Half,6:47,True,333,2025-01-22T01:48:50Z
401708341102936701,102936701,JumpShot,Tyler Nickel made Three Point Jumper. Assisted by Chris Manon.,65,81,2nd Half,6:32,True,238,2025-01-22T01:49:03Z
401708341102936702,102936702,PersonalFoul,Foul on Chris Youngblood.,65,81,2nd Half,6:32,False,333,2025-01-22T01:49:03Z
401708341102936703,102936703,MadeFreeThrow,Tyler Nickel missed Free Throw.,65,81,2nd Half,6:32,False,238,2025-01-22T01:49:03Z
401708341102936901,102936901,Defensive Rebound,Clifford Omoruyi Defensive Rebound.,65,81,2nd Half,6:30,False,333,2025-01-22T01:49:45Z
401708341102938501,102938501,JumpShot,Labaron Philon missed Three Point Jumper.,65,81,2nd Half,6:14,False,333,2025-01-22T01:50:00Z
401708341102938601,102938601,Defensive Rebound,Tyler Nickel Defensive Rebound.,65,81,2nd Half,6:13,False,238,2025-01-22T01:50:00Z
401708341102938602,102938602,PersonalFoul,Foul on Clifford Omoruyi.,65,81,2nd Half,6:13,False,333,2025-01-22T01:50:00Z
401708341102938603,102938603,MadeFreeThrow,Chris Manon made Free Throw.,66,81,2nd Half,6:13,True,238,2025-01-22T01:50:00Z
401708341102938604,102938604,MadeFreeThrow,Chris Manon made Free Throw.,67,81,2nd Half,6:13,True,238,2025-01-22T01:50:00Z
401708341102944101,102944101,DunkShot,Grant Nelson made Dunk. Assisted by Mark Sears.,67,83,2nd Half,5:58,True,333,2025-01-22T01:51:18Z
401708341102946301,102946301,JumpShot,Tyler Tanner made Jumper.,69,83,2nd Half,5:36,True,238,2025-01-22T01:51:40Z
401708341102948401,102948401,LayUpShot,Mark Sears made Layup.,69,85,2nd Half,5:15,True,333,2025-01-22T01:52:02Z
401708341102954201,102954201,JumpShot,Tyler Tanner made Three Point Jumper. Assisted by MJ Collins Jr..,72,85,2nd Half,4:57,True,238,2025-01-22T01:52:20Z
401708341102955201,102955201,PersonalFoul,Foul on Tyler Tanner.,72,85,2nd Half,4:47,False,238,2025-01-22T01:52:29Z
401708341102955202,102955202,MadeFreeThrow,Mark Sears made Free Throw.,72,86,2nd Half,4:47,True,333,2025-01-22T01:52:29Z
401708341102955203,102955203,MadeFreeThrow,Mark Sears made Free Throw.,72,87,2nd Half,4:47,True,333,2025-01-22T01:52:29Z
401708341102956301,102956301,JumpShot,Tyler Tanner missed Jumper.,72,87,2nd Half,4:36,False,238,2025-01-22T01:53:26Z
401708341102956601,102956601,Defensive Rebound,Mouhamed Dioubate Defensive Rebound.,72,87,2nd Half,4:33,False,333,2025-01-22T01:53:26Z
401708341102957701,102957701,PersonalFoul,Foul on Grant Nelson.,72,87,2nd Half,4:22,False,333,2025-01-22T01:56:25Z
401708341102957702,102957702,Lost Ball Turnover,Grant Nelson Turnover.,72,87,2nd Half,4:22,False,333,2025-01-22T01:53:39Z
401708341102957703,102957703,OfficialTVTimeOut, Official TV Timeout,72,87,2nd Half,4:22,False,,2025-01-22T01:53:39Z
401708341102957704,102957704,MadeFreeThrow,Tyler Nickel made Free Throw.,73,87,2nd Half,4:22,True,238,2025-01-22T01:56:25Z
401708341102957705,102957705,MadeFreeThrow,Tyler Nickel made Free Throw.,74,87,2nd Half,4:22,True,238,2025-01-22T01:56:25Z
401708341102958701,102958701,JumpShot,Jason Edwards missed Three Point Jumper.,74,87,2nd Half,4:12,False,238,2025-01-22T01:57:25Z
401708341102958702,102958702,Block Shot,Mouhamed Dioubate Block.,74,87,2nd Half,4:12,False,333,2025-01-22T01:57:25Z
401708341102958704,102958704,Offensive Rebound,Vanderbilt Offensive Rebound.,74,87,2nd Half,4:12,False,238,2025-01-22T01:57:25Z
401708341102958705,102958705,PersonalFoul,Foul on Jason Edwards.,74,87,2nd Half,4:12,False,238,2025-01-22T01:57:25Z
401708341102958706,102958706,Lost Ball Turnover,Jason Edwards Turnover.,74,87,2nd Half,4:12,False,238,2025-01-22T01:57:25Z
401708341102958901,102958901,PersonalFoul,Foul on Chris Manon.,74,87,2nd Half,4:10,False,238,2025-01-22T01:58:05Z
401708341102958902,102958902,MadeFreeThrow,Mouhamed Dioubate made Free Throw.,74,88,2nd Half,4:10,True,333,2025-01-22T01:58:05Z
401708341102958903,102958903,MadeFreeThrow,Mouhamed Dioubate made Free Throw.,74,89,2nd Half,4:10,True,333,2025-01-22T01:58:05Z
401708341102964101,102964101,JumpShot,Tyler Nickel made Three Point Jumper. Assisted by AJ Hoggard.,77,89,2nd Half,3:58,True,238,2025-01-22T01:59:12Z
401708341102965601,102965601,JumpShot,Mouhamed Dioubate made Jumper.,77,91,2nd Half,3:43,True,333,2025-01-22T01:59:25Z
401708341102966701,102966701,JumpShot,Jason Edwards made Three Point Jumper. Assisted by Tyler Tanner.,80,91,2nd Half,3:32,True,238,2025-01-22T01:59:37Z
401708341102966901,102966901,ShortTimeOut,Vanderbilt  Timeout,80,91,2nd Half,3:30,False,238,2025-01-22T01:59:42Z
401708341102969101,102969101,LayUpShot,Mouhamed Dioubate missed Layup.,80,91,2nd Half,3:08,False,333,2025-01-22T02:01:26Z
401708341102969401,102969401,Defensive Rebound,Chris Manon Defensive Rebound.,80,91,2nd Half,3:05,False,238,2025-01-22T02:01:26Z
401708341102974501,102974501,JumpShot,AJ Hoggard made Three Point Jumper. Assisted by Devin McGlockton.,83,91,2nd Half,2:54,True,238,2025-01-22T02:01:41Z
401708341102975401,102975401,PersonalFoul,Foul on Tyler Tanner.,83,91,2nd Half,2:45,False,238,2025-01-22T02:01:48Z
401708341102975402,102975402,MadeFreeThrow,Mark Sears made Free Throw.,83,92,2nd Half,2:45,True,333,2025-01-22T02:01:48Z
401708341102975403,102975403,MadeFreeThrow,Mark Sears made Free Throw.,83,93,2nd Half,2:45,True,333,2025-01-22T02:01:48Z
401708341102976401,102976401,JumpShot,Devin McGlockton missed Three Point Jumper.,83,93,2nd Half,2:35,False,238,2025-01-22T02:02:50Z
401708341102976801,102976801,Defensive Rebound,Mouhamed Dioubate Defensive Rebound.,83,93,2nd Half,2:31,False,333,2025-01-22T02:02:54Z
401708341102978101,102978101,PersonalFoul,Foul on Chris Manon.,83,93,2nd Half,2:18,False,238,2025-01-22T02:03:05Z
401708341102978102,102978102,MadeFreeThrow,Mark Sears made Free Throw.,83,94,2nd Half,2:18,True,333,2025-01-22T02:03:05Z
401708341102978103,102978103,MadeFreeThrow,Mark Sears made Free Throw.,83,95,2nd Half,2:18,True,333,2025-01-22T02:03:05Z
401708341102979101,102979101,JumpShot,Tyler Nickel missed Three Point Jumper.,83,95,2nd Half,2:08,False,238,2025-01-22T02:04:44Z
401708341102979401,102979401,Defensive Rebound,Aden Holloway Defensive Rebound.,83,95,2nd Half,2:05,False,333,2025-01-22T02:04:44Z
401708341102984201,102984201,LayUpShot,Mark Sears missed Layup.,83,95,2nd Half,1:57,False,333,2025-01-22T02:04:55Z
401708341102984701,102984701,Offensive Rebound,Grant Nelson Offensive Rebound.,83,95,2nd Half,1:52,False,333,2025-01-22T02:04:59Z
401708341102984702,102984702,JumpShot,Grant Nelson made Jumper.,83,97,2nd Half,1:52,True,333,2025-01-22T02:04:59Z
401708341102985601,102985601,LayUpShot,Jason Edwards missed Layup.,83,97,2nd Half,1:43,False,238,2025-01-22T02:05:09Z
401708341102985801,102985801,Defensive Rebound,Aden Holloway Defensive Rebound.,83,97,2nd Half,1:41,False,333,2025-01-22T02:05:09Z
401708341102987501,102987501,LayUpShot,Mark Sears made Layup.,83,99,2nd Half,1:24,True,333,2025-01-22T02:05:28Z
401708341102988701,102988701,LayUpShot,Tyler Tanner missed Layup.,83,99,2nd Half,1:12,False,238,2025-01-22T02:06:04Z
401708341102989001,102989001,Offensive Rebound,Devin McGlockton Offensive Rebound.,83,99,2nd Half,1:09,False,238,2025-01-22T02:06:04Z
401708341102989201,102989201,JumpShot,MJ Collins Jr. missed Three Point Jumper.,83,99,2nd Half,1:07,False,238,2025-01-22T02:06:08Z
401708341102989401,102989401,Defensive Rebound,Mouhamed Dioubate Defensive Rebound.,83,99,2nd Half,1:05,False,333,2025-01-22T02:06:08Z
401708341102995301,102995301,LayUpShot,Mouhamed Dioubate made Layup. Assisted by Mark Sears.,83,101,2nd Half,0:46,True,333,2025-01-22T02:06:29Z
401708341102996401,102996401,LayUpShot,Jason Edwards made Layup.,85,101,2nd Half,0:35,True,238,2025-01-22T02:06:44Z
401708341102996402,102996402,RegularTimeOut,Vanderbilt  Timeout,85,101,2nd Half,0:35,False,238,2025-01-22T02:06:44Z
401708341102996701,102996701,DunkShot,Grant Nelson made Dunk. Assisted by Chris Youngblood.,85,103,2nd Half,0:32,True,333,2025-01-22T02:08:45Z
401708341102997101,102997101,LayUpShot,Jason Edwards made Layup.,87,103,2nd Half,0:28,True,238,2025-01-22T02:08:52Z
401708341102999901,102999901,End Period,End of 2nd half,87,103,2nd Half,0:00,False,,2025-01-22T02:08:52Z
401708341102999902,102999902,End Game,End of Game,87,103,2nd Half,0:00,False,,2025-01-22T02:08:52Z
