play_id,sequence_number,type,description,away_score,home_score,period,clock,scoring_play,team_id,timestamp_utc
401715636101807001,101807001,JumpShot,Brayon Freeman made Jumper.,2,0,1st Half,19:29,True,2065,2024-11-06T01:02:23Z
401715636101808901,101808901,DunkShot,JT Toppin made Dunk. Assisted by Darrion Williams.,2,2,1st Half,19:10,True,2641,2024-11-06T01:02:42Z
401715636101815001,101815001,JumpShot,Brayon Freeman missed Three Point Jumper.,2,2,1st Half,18:49,False,2065,2024-11-06T01:03:04Z
401715636101815301,101815301,Defensive Rebound,Darrion Williams Defensive Rebound.,2,2,1st Half,18:46,False,2641,2024-11-06T01:03:04Z
401715636101815701,101815701,JumpShot,Kerwin Walton made Three Point Jumper. Assisted by Darrion Williams.,2,5,1st Half,18:42,True,2641,2024-11-06T01:03:10Z
401715636101817901,101817901,LayUpShot,Reggie Ward Jr. made Layup.,4,5,1st Half,18:20,True,2065,2024-11-06T01:03:30Z
401715636101819701,101819701,PersonalFoul,Foul on Daniel Rouzan.,4,5,1st Half,18:02,False,2065,2024-11-06T01:03:50Z
401715636101824201,101824201,JumpShot,JT Toppin made Jumper.,4,7,1st Half,17:57,True,2641,2024-11-06T01:04:15Z
401715636101826201,101826201,LayUpShot,Daniel Rouzan made Layup.,6,7,1st Half,17:37,True,2065,2024-11-06T01:04:34Z
401715636101827601,101827601,JumpShot,Chance McMillian made Three Point Jumper.,6,10,1st Half,17:23,True,2641,2024-11-06T01:04:48Z
401715636101829901,101829901,PersonalFoul,Foul on Kerwin Walton.,6,10,1st Half,17:00,False,2641,2024-11-06T01:05:10Z
401715636101829902,101829902,MadeFreeThrow,Reggie Ward Jr. made Free Throw.,7,10,1st Half,17:00,True,2065,2024-11-06T01:05:10Z
401715636101829903,101829903,MadeFreeThrow,Reggie Ward Jr. missed Free Throw.,7,10,1st Half,17:00,False,2065,2024-11-06T01:05:10Z
401715636101834101,101834101,Defensive Rebound,JT Toppin Defensive Rebound.,7,10,1st Half,16:58,False,2641,2024-11-06T01:05:59Z
401715636101835201,101835201,LayUpShot,JT Toppin made Layup.,7,12,1st Half,16:47,True,2641,2024-11-06T01:06:11Z
401715636101835901,101835901,JumpShot,Gianni Hunt missed Jumper.,7,12,1st Half,16:40,False,2065,2024-11-06T01:06:18Z
401715636101836601,101836601,Defensive Rebound,JT Toppin Defensive Rebound.,7,12,1st Half,16:33,False,2641,2024-11-06T01:06:25Z
401715636101836901,101836901,JumpShot,Darrion Williams missed Three Point Jumper.,7,12,1st Half,16:30,False,2641,2024-11-06T01:06:29Z
401715636101837201,101837201,Defensive Rebound,Reggie Ward Jr. Defensive Rebound.,7,12,1st Half,16:27,False,2065,2024-11-06T01:06:29Z
401715636101839601,101839601,PersonalFoul,Foul on Kevin Overton.,7,12,1st Half,16:03,False,2641,2024-11-06T01:06:54Z
401715636101839602,101839602,MadeFreeThrow,Reggie Ward Jr. missed Free Throw.,7,12,1st Half,16:03,False,2065,2024-11-06T01:06:54Z
401715636101839603,101839603,Offensive Rebound,Bethune-Cookman Offensive Rebound.,7,12,1st Half,16:03,False,2065,2024-11-06T01:06:54Z
401715636101839604,101839604,MadeFreeThrow,Reggie Ward Jr. missed Free Throw.,7,12,1st Half,16:03,False,2065,2024-11-06T01:06:54Z
401715636101839801,101839801,Defensive Rebound,Devan Cambridge Defensive Rebound.,7,12,1st Half,16:01,False,2641,2024-11-06T01:07:53Z
401715636101845701,101845701,JumpShot,Devan Cambridge missed Jumper.,7,12,1st Half,15:42,False,2641,2024-11-06T01:08:13Z
401715636101846001,101846001,Defensive Rebound,Reggie Ward Jr. Defensive Rebound.,7,12,1st Half,15:39,False,2065,2024-11-06T01:08:15Z
401715636101847101,101847101,JumpShot,Antwann Jones made Three Point Jumper. Assisted by Gianni Hunt.,10,12,1st Half,15:28,True,2065,2024-11-06T01:08:27Z
401715636101849801,101849801,PersonalFoul,Foul on Reggie Ward Jr..,10,12,1st Half,15:01,False,2065,2024-11-06T01:08:54Z
401715636101849802,101849802,OfficialTVTimeOut, Official TV Timeout,10,12,1st Half,15:01,False,,2024-11-06T01:08:54Z
401715636101849803,101849803,MadeFreeThrow,Darrion Williams made Free Throw.,10,13,1st Half,15:01,True,2641,2024-11-06T01:12:17Z
401715636101849901,101849901,MadeFreeThrow,Darrion Williams missed Free Throw.,10,13,1st Half,15:00,False,2641,2024-11-06T01:12:54Z
401715636101854001,101854001,Defensive Rebound,Reggie Ward Jr. Defensive Rebound.,10,13,1st Half,14:59,False,2065,2024-11-06T01:12:54Z
401715636101856401,101856401,JumpShot,Antwann Jones made Jumper.,12,13,1st Half,14:35,True,2065,2024-11-06T01:13:22Z
401715636101858101,101858101,PersonalFoul,Foul on Jarrell Love.,12,13,1st Half,14:18,False,2065,2024-11-06T01:14:10Z
401715636101858701,101858701,JumpShot,Darrion Williams made Jumper.,12,15,1st Half,14:12,True,2641,2024-11-06T01:14:33Z
401715636101864501,101864501,Lost Ball Turnover,Brayon Freeman Turnover.,12,15,1st Half,13:54,False,2065,2024-11-06T01:14:48Z
401715636101865801,101865801,JumpShot,Darrion Williams made Three Point Jumper.,12,18,1st Half,13:41,True,2641,2024-11-06T01:15:15Z
401715636101868002,101868002,Lost Ball Turnover,Brayon Freeman Turnover.,12,18,1st Half,13:19,False,2065,2024-11-06T01:15:40Z
401715636101868003,101868003,Steal,Kevin Overton Steal.,12,18,1st Half,13:19,False,2641,2024-11-06T01:15:43Z
401715636101868701,101868701,Lost Ball Turnover,Darrion Williams Turnover.,12,18,1st Half,13:12,False,2641,2024-11-06T01:15:43Z
401715636101869601,101869601,JumpShot,David Onanina made Jumper. Assisted by Brayon Freeman.,14,18,1st Half,13:03,True,2065,2024-11-06T01:16:19Z
401715636101876201,101876201,JumpShot,JT Toppin made Jumper.,14,20,1st Half,12:37,True,2641,2024-11-06T01:16:45Z
401715636101877901,101877901,JumpShot,Brayon Freeman missed Jumper.,14,20,1st Half,12:20,False,2065,2024-11-06T01:17:01Z
401715636101878101,101878101,Defensive Rebound,Devan Cambridge Defensive Rebound.,14,20,1st Half,12:18,False,2641,2024-11-06T01:17:01Z
401715636101878501,101878501,PersonalFoul,Foul on Jarrell Love.,14,20,1st Half,12:14,False,2065,2024-11-06T01:17:07Z
401715636101879401,101879401,JumpShot,Darrion Williams made Jumper.,14,22,1st Half,12:05,True,2641,2024-11-06T01:17:42Z
401715636101885801,101885801,JumpShot,Gianni Hunt missed Three Point Jumper.,14,22,1st Half,11:41,False,2065,2024-11-06T01:18:05Z
401715636101886101,101886101,Defensive Rebound,Devan Cambridge Defensive Rebound.,14,22,1st Half,11:38,False,2641,2024-11-06T01:18:05Z
401715636101886501,101886501,JumpShot,Chance McMillian missed Three Point Jumper.,14,22,1st Half,11:34,False,2641,2024-11-06T01:18:12Z
401715636101887101,101887101,Defensive Rebound,Brayon Freeman Defensive Rebound.,14,22,1st Half,11:28,False,2065,2024-11-06T01:18:18Z
401715636101889001,101889001,Lost Ball Turnover,Brayon Freeman Turnover.,14,22,1st Half,11:09,False,2065,2024-11-06T01:18:37Z
401715636101889002,101889002,Steal,Devan Cambridge Steal.,14,22,1st Half,11:09,False,2641,2024-11-06T01:18:37Z
401715636101889701,101889701,Lost Ball Turnover,Devan Cambridge Turnover.,14,22,1st Half,11:02,False,2641,2024-11-06T01:18:45Z
401715636101889702,101889702,Steal,Jesus Carralero Martin Steal.,14,22,1st Half,11:02,False,2065,2024-11-06T01:18:45Z
401715636101895101,101895101,PersonalFoul,Foul on Darrion Williams.,14,22,1st Half,10:48,False,2641,2024-11-06T01:18:58Z
401715636101895102,101895102,OfficialTVTimeOut, Official TV Timeout,14,22,1st Half,10:48,False,,2024-11-06T01:18:58Z
401715636101897001,101897001,JumpShot,Trey Thomas missed Jumper.,14,22,1st Half,10:29,False,2065,2024-11-06T01:23:06Z
401715636101897002,101897002,Defensive Rebound,Chance McMillian Defensive Rebound.,14,22,1st Half,10:29,False,2641,2024-11-06T01:23:06Z
401715636101897003,101897003,Lost Ball Turnover,Chance McMillian Turnover.,14,22,1st Half,10:29,False,2641,2024-11-06T01:23:06Z
401715636101897004,101897004,Steal,Trey Thomas Steal.,14,22,1st Half,10:29,False,2065,2024-11-06T01:23:06Z
401715636101897005,101897005,PersonalFoul,Foul on Chance McMillian.,14,22,1st Half,10:29,False,2641,2024-11-06T01:23:06Z
401715636101897006,101897006,MadeFreeThrow,Trey Thomas made Free Throw.,15,22,1st Half,10:29,True,2065,2024-11-06T01:23:06Z
401715636101897007,101897007,MadeFreeThrow,Trey Thomas made Free Throw.,16,22,1st Half,10:29,True,2065,2024-11-06T01:23:06Z
401715636101898901,101898901,JumpShot,JT Toppin missed Jumper.,16,22,1st Half,10:10,False,2641,2024-11-06T01:24:14Z
401715636101899301,101899301,Defensive Rebound,Jesus Carralero Martin Defensive Rebound.,16,22,1st Half,10:06,False,2065,2024-11-06T01:24:17Z
401715636101905101,101905101,JumpShot,Jesus Carralero Martin made Three Point Jumper. Assisted by Gianni Hunt.,19,22,1st Half,9:48,True,2065,2024-11-06T01:24:35Z
401715636101907201,101907201,JumpShot,Darrion Williams made Jumper.,19,24,1st Half,9:27,True,2641,2024-11-06T01:24:57Z
401715636101908501,101908501,JumpShot,Trey Thomas made Three Point Jumper. Assisted by Gianni Hunt.,22,24,1st Half,9:14,True,2065,2024-11-06T01:25:11Z
401715636101914601,101914601,JumpShot,Kerwin Walton missed Jumper.,22,24,1st Half,8:53,False,2641,2024-11-06T01:25:31Z
401715636101914901,101914901,Defensive Rebound,Reggie Ward Jr. Defensive Rebound.,22,24,1st Half,8:50,False,2065,2024-11-06T01:25:31Z
401715636101916201,101916201,LayUpShot,Trey Thomas missed Layup.,22,24,1st Half,8:37,False,2065,2024-11-06T01:25:46Z
401715636101916501,101916501,Defensive Rebound,JT Toppin Defensive Rebound.,22,24,1st Half,8:34,False,2641,2024-11-06T01:25:49Z
401715636101917101,101917101,JumpShot,Kerwin Walton made Three Point Jumper. Assisted by Kevin Overton.,22,27,1st Half,8:28,True,2641,2024-11-06T01:25:56Z
401715636101919201,101919201,JumpShot,Trey Thomas missed Three Point Jumper.,22,27,1st Half,8:07,False,2065,2024-11-06T01:26:16Z
401715636101919501,101919501,Defensive Rebound,Texas Tech Defensive Rebound.,22,27,1st Half,8:04,False,2641,2024-11-06T01:26:16Z
401715636101925101,101925101,JumpShot,Kerwin Walton missed Three Point Jumper.,22,27,1st Half,7:48,False,2641,2024-11-06T01:26:54Z
401715636101925401,101925401,Offensive Rebound,Chance McMillian Offensive Rebound.,22,27,1st Half,7:45,False,2641,2024-11-06T01:26:54Z
401715636101925701,101925701,JumpShot,Chance McMillian made Three Point Jumper. Assisted by Darrion Williams.,22,30,1st Half,7:42,True,2641,2024-11-06T01:26:59Z
401715636101928501,101928501,LayUpShot,Reggie Ward Jr. made Layup. Assisted by Jerome Beya.,24,30,1st Half,7:14,True,2065,2024-11-06T01:27:27Z
401715636101929901,101929901,JumpShot,Kevin Overton missed Three Point Jumper.,24,30,1st Half,7:00,False,2641,2024-11-06T01:27:41Z
401715636101934201,101934201,Offensive Rebound,JT Toppin Offensive Rebound.,24,30,1st Half,6:57,False,2641,2024-11-06T01:27:41Z
401715636101934601,101934601,OfficialTVTimeOut, Official TV Timeout,24,30,1st Half,6:53,False,,2024-11-06T01:27:48Z
401715636101935001,101935001,Lost Ball Turnover,Kerwin Walton Turnover.,24,30,1st Half,6:49,False,2641,2024-11-06T01:31:44Z
401715636101935002,101935002,Steal,Seneca Willoughby Steal.,24,30,1st Half,6:49,False,2065,2024-11-06T01:31:44Z
401715636101935601,101935601,JumpShot,Trey Thomas missed Jumper.,24,30,1st Half,6:43,False,2065,2024-11-06T01:31:52Z
401715636101935801,101935801,Defensive Rebound,JT Toppin Defensive Rebound.,24,30,1st Half,6:41,False,2641,2024-11-06T01:31:52Z
401715636101936101,101936101,PersonalFoul,Foul on Jerome Beya.,24,30,1st Half,6:38,False,2065,2024-11-06T01:32:08Z
401715636101936102,101936102,MadeFreeThrow,Kevin Overton missed Free Throw.,24,30,1st Half,6:38,False,2641,2024-11-06T01:32:08Z
401715636101936103,101936103,Offensive Rebound,Texas Tech Offensive Rebound.,24,30,1st Half,6:38,False,2641,2024-11-06T01:32:08Z
401715636101936104,101936104,MadeFreeThrow,Kevin Overton made Free Throw.,24,31,1st Half,6:38,True,2641,2024-11-06T01:32:08Z
401715636101937901,101937901,LayUpShot,Reggie Ward Jr. made Layup.,26,31,1st Half,6:20,True,2065,2024-11-06T01:33:01Z
401715636101944001,101944001,JumpShot,Darrion Williams made Jumper.,26,33,1st Half,5:59,True,2641,2024-11-06T01:33:20Z
401715636101947101,101947101,JumpShot,Reggie Ward Jr. missed Jumper.,26,33,1st Half,5:28,False,2065,2024-11-06T01:33:52Z
401715636101947301,101947301,Defensive Rebound,JT Toppin Defensive Rebound.,26,33,1st Half,5:26,False,2641,2024-11-06T01:33:52Z
401715636101947901,101947901,PersonalFoul,Foul on JT Toppin.,26,33,1st Half,5:20,False,2641,2024-11-06T01:33:59Z
401715636101947902,101947902,Lost Ball Turnover,JT Toppin Turnover.,26,33,1st Half,5:20,False,2641,2024-11-06T01:33:59Z
401715636101954901,101954901,LayUpShot,Reggie Ward Jr. made Layup. Assisted by Jesus Carralero Martin.,28,33,1st Half,4:50,True,2065,2024-11-06T01:34:49Z
401715636101957001,101957001,PersonalFoul,Foul on Kevin Overton.,28,33,1st Half,4:29,False,2641,2024-11-06T01:35:10Z
401715636101957002,101957002,Lost Ball Turnover,Kevin Overton Turnover.,28,33,1st Half,4:29,False,2641,2024-11-06T01:35:10Z
401715636101959301,101959301,JumpShot,Jesus Carralero Martin missed Jumper.,28,33,1st Half,4:06,False,2065,2024-11-06T01:35:51Z
401715636101959601,101959601,Defensive Rebound,Devan Cambridge Defensive Rebound.,28,33,1st Half,4:03,False,2641,2024-11-06T01:35:51Z
401715636101964601,101964601,LayUpShot,Devan Cambridge missed Layup.,28,33,1st Half,3:53,False,2641,2024-11-06T01:36:05Z
401715636101964701,101964701,Offensive Rebound,Devan Cambridge Offensive Rebound.,28,33,1st Half,3:52,False,2641,2024-11-06T01:36:05Z
401715636101964702,101964702,OfficialTVTimeOut, Official TV Timeout,28,33,1st Half,3:52,False,,2024-11-06T01:36:05Z
401715636101965401,101965401,JumpShot,Devan Cambridge made Three Point Jumper. Assisted by Chance McMillian.,28,36,1st Half,3:45,True,2641,2024-11-06T01:39:58Z
401715636101967401,101967401,JumpShot,Daniel Rouzan missed Jumper.,28,36,1st Half,3:25,False,2065,2024-11-06T01:40:18Z
401715636101967801,101967801,Defensive Rebound,Darrion Williams Defensive Rebound.,28,36,1st Half,3:21,False,2641,2024-11-06T01:40:20Z
401715636101968001,101968001,JumpShot,Darrion Williams made Three Point Jumper.,28,39,1st Half,3:19,True,2641,2024-11-06T01:40:23Z
401715636101974901,101974901,JumpShot,Seneca Willoughby missed Three Point Jumper.,28,39,1st Half,2:50,False,2065,2024-11-06T01:40:53Z
401715636101975101,101975101,Defensive Rebound,Devan Cambridge Defensive Rebound.,28,39,1st Half,2:48,False,2641,2024-11-06T01:40:53Z
401715636101975601,101975601,JumpShot,Chance McMillian made Three Point Jumper. Assisted by Darrion Williams.,28,42,1st Half,2:43,True,2641,2024-11-06T01:41:03Z
401715636101976001,101976001,ShortTimeOut,Bethune-Cookman  Timeout,28,42,1st Half,2:39,False,2065,2024-11-06T01:41:03Z
401715636101977901,101977901,PersonalFoul,Foul on Federiko Federiko.,28,42,1st Half,2:20,False,2641,2024-11-06T01:43:50Z
401715636101977902,101977902,MadeFreeThrow,Daniel Rouzan missed Free Throw.,28,42,1st Half,2:20,False,2065,2024-11-06T01:43:50Z
401715636101977903,101977903,Offensive Rebound,Bethune-Cookman Offensive Rebound.,28,42,1st Half,2:20,False,2065,2024-11-06T01:43:50Z
401715636101977904,101977904,MadeFreeThrow,Daniel Rouzan missed Free Throw.,28,42,1st Half,2:20,False,2065,2024-11-06T01:43:50Z
401715636101977905,101977905,Defensive Rebound,Texas Tech Defensive Rebound.,28,42,1st Half,2:20,False,2641,2024-11-06T01:43:50Z
401715636101979301,101979301,JumpShot,Darrion Williams missed Three Point Jumper.,28,42,1st Half,2:06,False,2641,2024-11-06T01:45:10Z
401715636101979701,101979701,Defensive Rebound,Brayon Freeman Defensive Rebound.,28,42,1st Half,2:02,False,2065,2024-11-06T01:45:12Z
401715636101984101,101984101,JumpShot,Brayon Freeman missed Jumper.,28,42,1st Half,1:58,False,2065,2024-11-06T01:45:18Z
401715636101984601,101984601,Defensive Rebound,Darrion Williams Defensive Rebound.,28,42,1st Half,1:53,False,2641,2024-11-06T01:45:21Z
401715636101984901,101984901,JumpShot,Chance McMillian missed Three Point Jumper.,28,42,1st Half,1:50,False,2641,2024-11-06T01:45:26Z
401715636101985201,101985201,Offensive Rebound,Federiko Federiko Offensive Rebound.,28,42,1st Half,1:47,False,2641,2024-11-06T01:45:26Z
401715636101985401,101985401,PersonalFoul,Foul on Reggie Ward Jr..,28,42,1st Half,1:45,False,2065,2024-11-06T01:45:29Z
401715636101985402,101985402,MadeFreeThrow,Federiko Federiko missed Free Throw.,28,42,1st Half,1:45,False,2641,2024-11-06T01:45:29Z
401715636101985403,101985403,Offensive Rebound,Texas Tech Offensive Rebound.,28,42,1st Half,1:45,False,2641,2024-11-06T01:45:29Z
401715636101985404,101985404,MadeFreeThrow,Federiko Federiko made Free Throw.,28,43,1st Half,1:45,True,2641,2024-11-06T01:45:29Z
401715636101987101,101987101,Lost Ball Turnover,Reggie Ward Jr. Turnover.,28,43,1st Half,1:28,False,2065,2024-11-06T01:46:31Z
401715636101988901,101988901,JumpShot,Kerwin Walton made Three Point Jumper. Assisted by Darrion Williams.,28,46,1st Half,1:10,True,2641,2024-11-06T01:47:11Z
401715636101995701,101995701,LayUpShot,Brayon Freeman missed Layup.,28,46,1st Half,0:42,False,2065,2024-11-06T01:47:40Z
401715636101995702,101995702,Block Shot,Federiko Federiko Block.,28,46,1st Half,0:42,False,2641,2024-11-06T01:47:42Z
401715636101996101,101996101,Defensive Rebound,Kerwin Walton Defensive Rebound.,28,46,1st Half,0:38,False,2641,2024-11-06T01:47:42Z
401715636101996401,101996401,JumpShot,Darrion Williams missed Jumper.,28,46,1st Half,0:35,False,2641,2024-11-06T01:47:51Z
401715636101996701,101996701,Offensive Rebound,Kerwin Walton Offensive Rebound.,28,46,1st Half,0:32,False,2641,2024-11-06T01:47:48Z
401715636101996901,101996901,LayUpShot,Darrion Williams made Layup.,28,48,1st Half,0:30,True,2641,2024-11-06T01:47:51Z
401715636101996902,101996902,ShortTimeOut,Texas Tech  Timeout,28,48,1st Half,0:30,False,2641,2024-11-06T01:47:51Z
401715636101999301,101999301,Lost Ball Turnover,Jesus Carralero Martin Turnover.,28,48,1st Half,0:06,False,2065,2024-11-06T01:49:39Z
401715636101999302,101999302,Steal,JT Toppin Steal.,28,48,1st Half,0:06,False,2641,2024-11-06T01:49:39Z
401715636101999901,101999901,DunkShot,Federiko Federiko made Dunk. Assisted by Darrion Williams.,28,50,1st Half,0:00,True,2641,2024-11-06T01:49:39Z
401715636101999902,101999902,End Period,End of 1st half,28,50,1st Half,0:00,False,,2024-11-06T01:49:39Z
401715636102806601,102806601,LayUpShot,Daniel Rouzan made Layup. Assisted by Brayon Freeman.,30,50,2nd Half,19:33,True,2065,2024-11-06T02:06:46Z
401715636102808401,102808401,LayUpShot,Kevin Overton made Layup.,30,52,2nd Half,19:15,True,2641,2024-11-06T02:07:03Z
401715636102809201,102809201,JumpShot,Daniel Rouzan missed Jumper.,30,52,2nd Half,19:07,False,2065,2024-11-06T02:07:13Z
401715636102809601,102809601,Defensive Rebound,Darrion Williams Defensive Rebound.,30,52,2nd Half,19:03,False,2641,2024-11-06T02:07:13Z
401715636102814801,102814801,JumpShot,Kerwin Walton missed Three Point Jumper.,30,52,2nd Half,18:51,False,2641,2024-11-06T02:07:44Z
401715636102815301,102815301,Defensive Rebound,Daniel Rouzan Defensive Rebound.,30,52,2nd Half,18:46,False,2065,2024-11-06T02:07:47Z
401715636102816101,102816101,JumpShot,Brayon Freeman made Jumper.,32,52,2nd Half,18:38,True,2065,2024-11-06T02:07:57Z
401715636102817801,102817801,JumpShot,Chance McMillian made Three Point Jumper.,32,55,2nd Half,18:21,True,2641,2024-11-06T02:08:16Z
401715636102824501,102824501,JumpShot,Brayon Freeman missed Jumper.,32,55,2nd Half,17:54,False,2065,2024-11-06T02:08:42Z
401715636102824502,102824502,Block Shot,JT Toppin Block.,32,55,2nd Half,17:54,False,2641,2024-11-06T02:08:42Z
401715636102824601,102824601,Defensive Rebound,Texas Tech Defensive Rebound.,32,55,2nd Half,17:53,False,2641,2024-11-06T02:08:42Z
401715636102826001,102826001,PersonalFoul,Foul on Daniel Rouzan.,32,55,2nd Half,17:39,False,2065,2024-11-06T02:09:09Z
401715636102826701,102826701,JumpShot,Chance McMillian missed Three Point Jumper.,32,55,2nd Half,17:32,False,2641,2024-11-06T02:09:28Z
401715636102827001,102827001,Offensive Rebound,Darrion Williams Offensive Rebound.,32,55,2nd Half,17:29,False,2641,2024-11-06T02:09:28Z
401715636102827101,102827101,PersonalFoul,Foul on Jesus Carralero Martin.,32,55,2nd Half,17:28,False,2065,2024-11-06T02:09:28Z
401715636102827102,102827102,MadeFreeThrow,Chance McMillian missed Free Throw.,32,55,2nd Half,17:28,False,2641,2024-11-06T02:09:28Z
401715636102827103,102827103,Offensive Rebound,Texas Tech Offensive Rebound.,32,55,2nd Half,17:28,False,2641,2024-11-06T02:09:28Z
401715636102827104,102827104,MadeFreeThrow,Chance McMillian made Free Throw.,32,56,2nd Half,17:28,True,2641,2024-11-06T02:09:28Z
401715636102829101,102829101,Lost Ball Turnover,Reggie Ward Jr. Turnover.,32,56,2nd Half,17:08,False,2065,2024-11-06T02:10:42Z
401715636102829102,102829102,Steal,Kerwin Walton Steal.,32,56,2nd Half,17:08,False,2641,2024-11-06T02:10:46Z
401715636102829401,102829401,PersonalFoul,Foul on Brayon Freeman.,32,56,2nd Half,17:05,False,2065,2024-11-06T02:10:46Z
401715636102829402,102829402,MadeFreeThrow,JT Toppin made Free Throw.,32,57,2nd Half,17:05,True,2641,2024-11-06T02:10:46Z
401715636102829403,102829403,MadeFreeThrow,JT Toppin made Free Throw.,32,58,2nd Half,17:05,True,2641,2024-11-06T02:10:46Z
401715636102835801,102835801,LayUpShot,Daniel Rouzan missed Layup.,32,58,2nd Half,16:41,False,2065,2024-11-06T02:12:12Z
401715636102836201,102836201,Defensive Rebound,Darrion Williams Defensive Rebound.,32,58,2nd Half,16:37,False,2641,2024-11-06T02:12:12Z
401715636102837101,102837101,LayUpShot,Kevin Overton missed Layup.,32,58,2nd Half,16:28,False,2641,2024-11-06T02:12:23Z
401715636102837201,102837201,Offensive Rebound,Texas Tech Offensive Rebound.,32,58,2nd Half,16:27,False,2641,2024-11-06T02:12:23Z
401715636102837701,102837701,JumpShot,Chance McMillian made Jumper.,32,60,2nd Half,16:22,True,2641,2024-11-06T02:12:56Z
401715636102839501,102839501,JumpShot,Daniel Rouzan made Jumper. Assisted by Trey Thomas.,34,60,2nd Half,16:04,True,2065,2024-11-06T02:13:12Z
401715636102845201,102845201,JumpShot,JT Toppin missed Three Point Jumper.,34,60,2nd Half,15:47,False,2641,2024-11-06T02:13:30Z
401715636102845501,102845501,Defensive Rebound,Bethune-Cookman Defensive Rebound.,34,60,2nd Half,15:44,False,2065,2024-11-06T02:17:24Z
401715636102845502,102845502,OfficialTVTimeOut, Official TV Timeout,34,60,2nd Half,15:44,False,,2024-11-06T02:17:24Z
401715636102847001,102847001,JumpShot,Gianni Hunt missed Three Point Jumper.,34,60,2nd Half,15:29,False,2065,2024-11-06T02:17:24Z
401715636102847301,102847301,Defensive Rebound,Chance McMillian Defensive Rebound.,34,60,2nd Half,15:26,False,2641,2024-11-06T02:17:24Z
401715636102848901,102848901,JumpShot,Kerwin Walton made Three Point Jumper. Assisted by Chance McMillian.,34,63,2nd Half,15:10,True,2641,2024-11-06T02:17:44Z
401715636102855101,102855101,LayUpShot,Gianni Hunt missed Layup.,34,63,2nd Half,14:48,False,2065,2024-11-06T02:18:06Z
401715636102855102,102855102,Defensive Rebound,Texas Tech Defensive Rebound.,34,63,2nd Half,14:48,False,2641,2024-11-06T02:18:06Z
401715636102857001,102857001,LayUpShot,Kevin Overton made Layup.,34,65,2nd Half,14:29,True,2641,2024-11-06T02:18:48Z
401715636102858301,102858301,LayUpShot,Brayon Freeman missed Layup.,34,65,2nd Half,14:16,False,2065,2024-11-06T02:19:00Z
401715636102858302,102858302,Block Shot,JT Toppin Block.,34,65,2nd Half,14:16,False,2641,2024-11-06T02:19:03Z
401715636102858701,102858701,Defensive Rebound,Chance McMillian Defensive Rebound.,34,65,2nd Half,14:12,False,2641,2024-11-06T02:19:03Z
401715636102858901,102858901,Lost Ball Turnover,Devan Cambridge Turnover.,34,65,2nd Half,14:10,False,2641,2024-11-06T02:19:17Z
401715636102858902,102858902,Steal,Trey Thomas Steal.,34,65,2nd Half,14:10,False,2065,2024-11-06T02:19:08Z
401715636102859801,102859801,JumpShot,Trey Thomas made Jumper.,36,65,2nd Half,14:01,True,2065,2024-11-06T02:19:17Z
401715636102865401,102865401,PersonalFoul,Foul on Daniel Rouzan.,36,65,2nd Half,13:45,False,2065,2024-11-06T02:19:31Z
401715636102866101,102866101,JumpShot,JT Toppin made Jumper.,36,67,2nd Half,13:38,True,2641,2024-11-06T02:20:03Z
401715636102867001,102867001,LayUpShot,Brayon Freeman missed Layup.,36,67,2nd Half,13:29,False,2065,2024-11-06T02:20:13Z
401715636102867002,102867002,Block Shot,Chance McMillian Block.,36,67,2nd Half,13:29,False,2641,2024-11-06T02:20:16Z
401715636102867401,102867401,Defensive Rebound,Chance McMillian Defensive Rebound.,36,67,2nd Half,13:25,False,2641,2024-11-06T02:20:16Z
401715636102867601,102867601,LayUpShot,Devan Cambridge made Layup. Assisted by Chance McMillian.,36,69,2nd Half,13:23,True,2641,2024-11-06T02:20:18Z
401715636102869901,102869901,JumpShot,David Onanina missed Jumper.,36,69,2nd Half,13:00,False,2065,2024-11-06T02:20:42Z
401715636102874401,102874401,Offensive Rebound,Reggie Ward Jr. Offensive Rebound.,36,69,2nd Half,12:55,False,2065,2024-11-06T02:20:45Z
401715636102874501,102874501,LayUpShot,Reggie Ward Jr. missed Layup.,36,69,2nd Half,12:54,False,2065,2024-11-06T02:20:45Z
401715636102874801,102874801,Defensive Rebound,Kerwin Walton Defensive Rebound.,36,69,2nd Half,12:51,False,2641,2024-11-06T02:20:49Z
401715636102874802,102874802,Lost Ball Turnover,Kerwin Walton Turnover.,36,69,2nd Half,12:51,False,2641,2024-11-06T02:20:49Z
401715636102874803,102874803,Steal,Trey Thomas Steal.,36,69,2nd Half,12:51,False,2065,2024-11-06T02:20:49Z
401715636102875901,102875901,LayUpShot,Trey Thomas missed Layup.,36,69,2nd Half,12:40,False,2065,2024-11-06T02:21:32Z
401715636102876601,102876601,Offensive Rebound,David Onanina Offensive Rebound.,36,69,2nd Half,12:33,False,2065,2024-11-06T02:21:39Z
401715636102876602,102876602,JumpShot,Seneca Willoughby missed Three Point Jumper.,36,69,2nd Half,12:33,False,2065,2024-11-06T02:21:39Z
401715636102876603,102876603,Offensive Rebound,Bethune-Cookman Offensive Rebound.,36,69,2nd Half,12:33,False,2065,2024-11-06T02:21:39Z
401715636102876604,102876604,PersonalFoul,Foul on Darrion Williams.,36,69,2nd Half,12:33,False,2641,2024-11-06T02:21:39Z
401715636102876801,102876801,LayUpShot,Seneca Willoughby missed Layup.,36,69,2nd Half,12:31,False,2065,2024-11-06T02:22:04Z
401715636102877101,102877101,Defensive Rebound,Federiko Federiko Defensive Rebound.,36,69,2nd Half,12:28,False,2641,2024-11-06T02:22:06Z
