play_id,sequence_number,type,description,away_score,home_score,period,clock,scoring_play,team_id,timestamp_utc
401715310101807001,101807001,LayUpShot,Mark Mitchell missed Layup.,0,0,1st Half,19:29,False,142,2024-11-15T00:32:10Z
401715310101807002,101807002,Block Shot,Walter Hamilton Block.,0,0,1st Half,19:29,False,2400,2024-11-15T00:32:13Z
401715310101807003,101807003,Offensive Rebound,Missouri Offensive Rebound.,0,0,1st Half,19:29,False,142,2024-11-15T00:32:13Z
401715310101807201,101807201,Lost Ball Turnover,Missouri  Turnover.,0,0,1st Half,19:27,False,142,2024-11-15T00:32:29Z
401715310101809101,101809101,JumpShot,Alvin Stredic made Jumper.,2,0,1st Half,19:08,True,2400,2024-11-15T00:32:29Z
401715310101815401,101815401,JumpShot,Anthony Robinson II missed Three Point Jumper.,2,0,1st Half,18:45,False,142,2024-11-15T00:33:20Z
401715310101815701,101815701,Offensive Rebound,Mark Mitchell Offensive Rebound.,2,0,1st Half,18:42,False,142,2024-11-15T00:33:20Z
401715310101817201,101817201,JumpShot,Tamar Bates made Three Point Jumper. Assisted by Josh Gray.,2,3,1st Half,18:27,True,142,2024-11-15T00:33:37Z
401715310101819101,101819101,JumpShot,Donovan Sanders missed Jumper.,2,3,1st Half,18:08,False,2400,2024-11-15T00:33:56Z
401715310101819301,101819301,Defensive Rebound,Josh Gray Defensive Rebound.,2,3,1st Half,18:06,False,142,2024-11-15T00:33:56Z
401715310101819701,101819701,PersonalFoul,Foul on Walter Hamilton.,2,3,1st Half,18:02,False,2400,2024-11-15T00:34:01Z
401715310101819702,101819702,MadeFreeThrow,Mark Mitchell made Free Throw.,2,4,1st Half,18:02,True,142,2024-11-15T00:34:01Z
401715310101819703,101819703,MadeFreeThrow,Mark Mitchell made Free Throw.,2,5,1st Half,18:02,True,142,2024-11-15T00:34:01Z
401715310101825901,101825901,Lost Ball Turnover,Jair Horton Turnover.,2,5,1st Half,17:40,False,2400,2024-11-15T00:35:26Z
401715310101825902,101825902,Steal,Anthony Robinson II Steal.,2,5,1st Half,17:40,False,142,2024-11-15T00:35:26Z
401715310101826401,101826401,Lost Ball Turnover,Tamar Bates Turnover.,2,5,1st Half,17:35,False,142,2024-11-15T00:35:32Z
401715310101826402,101826402,Steal,Walter Hamilton Steal.,2,5,1st Half,17:35,False,2400,2024-11-15T00:35:32Z
401715310101826901,101826901,Lost Ball Turnover,Donovan Sanders Turnover.,2,5,1st Half,17:30,False,2400,2024-11-15T00:35:37Z
401715310101826902,101826902,Steal,Anthony Robinson II Steal.,2,5,1st Half,17:30,False,142,2024-11-15T00:35:37Z
401715310101827401,101827401,LayUpShot,Annor Boateng made Layup. Assisted by Tamar Bates.,2,7,1st Half,17:25,True,142,2024-11-15T00:35:41Z
401715310101834601,101834601,LayUpShot,Donovan Sanders missed Layup.,2,7,1st Half,16:53,False,2400,2024-11-15T00:36:14Z
401715310101834801,101834801,Defensive Rebound,Anthony Robinson II Defensive Rebound.,2,7,1st Half,16:51,False,142,2024-11-15T00:36:14Z
401715310101835001,101835001,PersonalFoul,Foul on George Ivory III.,2,7,1st Half,16:49,False,2400,2024-11-15T00:36:16Z
401715310101835002,101835002,MadeFreeThrow,Mark Mitchell missed Free Throw.,2,7,1st Half,16:49,False,142,2024-11-15T00:36:16Z
401715310101835003,101835003,Offensive Rebound,Missouri Offensive Rebound.,2,7,1st Half,16:49,False,142,2024-11-15T00:36:16Z
401715310101835004,101835004,MadeFreeThrow,Mark Mitchell missed Free Throw.,2,7,1st Half,16:49,False,142,2024-11-15T00:36:56Z
401715310101835101,101835101,Defensive Rebound,Mississippi Valley State Defensive Rebound.,2,7,1st Half,16:48,False,2400,2024-11-15T00:37:09Z
401715310101837501,101837501,JumpShot,Alvin Stredic missed Jumper.,2,7,1st Half,16:24,False,2400,2024-11-15T00:37:46Z
401715310101837901,101837901,Defensive Rebound,Mark Mitchell Defensive Rebound.,2,7,1st Half,16:20,False,142,2024-11-15T00:37:49Z
401715310101837902,101837902,PersonalFoul,Foul on Alvin Stredic.,2,7,1st Half,16:20,False,2400,2024-11-15T00:37:49Z
401715310101837903,101837903,MadeFreeThrow,Trent Pierce made Free Throw.,2,8,1st Half,16:20,True,142,2024-11-15T00:37:49Z
401715310101837904,101837904,MadeFreeThrow,Trent Pierce made Free Throw.,2,9,1st Half,16:20,True,142,2024-11-15T00:37:49Z
401715310101844301,101844301,Lost Ball Turnover,Arthur Tate Turnover.,2,9,1st Half,15:56,False,2400,2024-11-15T00:39:08Z
401715310101844302,101844302,OfficialTVTimeOut, Official TV Timeout,2,9,1st Half,15:56,False,,2024-11-15T00:39:08Z
401715310101846301,101846301,JumpShot,Marques Warrick made Three Point Jumper.,2,12,1st Half,15:36,True,142,2024-11-15T00:42:26Z
401715310101849901,101849901,JumpShot,Antonio Sisk missed Three Point Jumper.,2,12,1st Half,15:00,False,2400,2024-11-15T00:43:32Z
401715310101854101,101854101,Defensive Rebound,Caleb Grill Defensive Rebound.,2,12,1st Half,14:58,False,142,2024-11-15T00:43:32Z
401715310101854601,101854601,JumpShot,Trent Pierce missed Three Point Jumper.,2,12,1st Half,14:53,False,142,2024-11-15T00:43:39Z
401715310101854901,101854901,Defensive Rebound,Donovan Sanders Defensive Rebound.,2,12,1st Half,14:50,False,2400,2024-11-15T00:43:41Z
401715310101855601,101855601,JumpShot,Arthur Tate missed Three Point Jumper.,2,12,1st Half,14:43,False,2400,2024-11-15T00:43:50Z
401715310101856001,101856001,Defensive Rebound,Marcus Allen Defensive Rebound.,2,12,1st Half,14:39,False,142,2024-11-15T00:43:52Z
401715310101857901,101857901,JumpShot,Trent Pierce missed Three Point Jumper.,2,12,1st Half,14:20,False,142,2024-11-15T00:44:11Z
401715310101857902,101857902,Offensive Rebound,Marcus Allen Offensive Rebound.,2,12,1st Half,14:20,False,142,2024-11-15T00:44:11Z
401715310101857903,101857903,PersonalFoul,Foul on Jair Horton.,2,12,1st Half,14:20,False,2400,2024-11-15T00:44:11Z
401715310101858301,101858301,LayUpShot,Marcus Allen made Layup.,2,14,1st Half,14:16,True,142,2024-11-15T00:44:44Z
401715310101859801,101859801,PersonalFoul,Foul on Peyton Marshall.,2,14,1st Half,14:01,False,142,2024-11-15T00:44:59Z
401715310101859802,101859802,MadeFreeThrow,Donovan Sanders made Free Throw.,3,14,1st Half,14:01,True,2400,2024-11-15T00:45:37Z
401715310101859803,101859803,MadeFreeThrow,Donovan Sanders made Free Throw.,4,14,1st Half,14:01,True,2400,2024-11-15T00:45:37Z
401715310101864801,101864801,JumpShot,Marques Warrick made Three Point Jumper.,4,17,1st Half,13:51,True,142,2024-11-15T00:46:14Z
401715310101866001,101866001,JumpShot,Donovan Sanders made Jumper.,6,17,1st Half,13:39,True,2400,2024-11-15T00:46:25Z
401715310101868501,101868501,JumpShot,Marcus Allen made Jumper.,6,19,1st Half,13:14,True,142,2024-11-15T00:46:49Z
401715310101875801,101875801,JumpShot,Antonio Sisk missed Jumper.,6,19,1st Half,12:41,False,2400,2024-11-15T00:47:24Z
401715310101875802,101875802,Block Shot,Peyton Marshall Block.,6,19,1st Half,12:41,False,142,2024-11-15T00:47:28Z
401715310101876401,101876401,Defensive Rebound,Peyton Marshall Defensive Rebound.,6,19,1st Half,12:35,False,142,2024-11-15T00:47:28Z
401715310101876601,101876601,JumpShot,Jacob Crews missed Three Point Jumper.,6,19,1st Half,12:33,False,142,2024-11-15T00:47:30Z
401715310101876901,101876901,Defensive Rebound,Alvin Stredic Defensive Rebound.,6,19,1st Half,12:30,False,2400,2024-11-15T00:47:33Z
401715310101879101,101879101,JumpShot,Arthur Tate missed Jumper.,6,19,1st Half,12:08,False,2400,2024-11-15T00:47:55Z
401715310101879301,101879301,Defensive Rebound,Marcus Allen Defensive Rebound.,6,19,1st Half,12:06,False,142,2024-11-15T00:47:55Z
401715310101879901,101879901,JumpShot,Caleb Grill missed Three Point Jumper.,6,19,1st Half,12:00,False,142,2024-11-15T00:48:04Z
401715310101884201,101884201,Defensive Rebound,Arthur Tate Defensive Rebound.,6,19,1st Half,11:57,False,2400,2024-11-15T00:48:04Z
401715310101886201,101886201,JumpShot,Darrion Salery missed Jumper.,6,19,1st Half,11:37,False,2400,2024-11-15T00:48:27Z
401715310101886401,101886401,Defensive Rebound,Marcus Allen Defensive Rebound.,6,19,1st Half,11:35,False,142,2024-11-15T00:48:27Z
401715310101887401,101887401,JumpShot,Jacob Crews made Three Point Jumper. Assisted by Caleb Grill.,6,22,1st Half,11:25,True,142,2024-11-15T00:48:40Z
401715310101889401,101889401,LayUpShot,Donovan Sanders missed Layup.,6,22,1st Half,11:05,False,2400,2024-11-15T00:49:01Z
401715310101889701,101889701,Offensive Rebound,Donovan Sanders Offensive Rebound.,6,22,1st Half,11:02,False,2400,2024-11-15T00:49:01Z
401715310101889702,101889702,JumpShot,Donovan Sanders missed Jumper.,6,22,1st Half,11:02,False,2400,2024-11-15T00:49:01Z
401715310101889801,101889801,Defensive Rebound,Jacob Crews Defensive Rebound.,6,22,1st Half,11:01,False,142,2024-11-15T00:49:01Z
401715310101894201,101894201,PersonalFoul,Foul on Darrion Salery.,6,22,1st Half,10:57,False,2400,2024-11-15T00:49:15Z
401715310101894202,101894202,OfficialTVTimeOut, Official TV Timeout,6,22,1st Half,10:57,False,,2024-11-15T00:49:15Z
401715310101894203,101894203,MadeFreeThrow,Marcus Allen made Free Throw.,6,23,1st Half,10:57,True,142,2024-11-15T00:49:15Z
401715310101894204,101894204,MadeFreeThrow,Marcus Allen made Free Throw.,6,24,1st Half,10:57,True,142,2024-11-15T00:49:15Z
401715310101896801,101896801,JumpShot,George Ivory III made Jumper. Assisted by Arthur Tate.,8,24,1st Half,10:31,True,2400,2024-11-15T00:53:09Z
401715310101898201,101898201,JumpShot,Marques Warrick made Three Point Jumper.,8,27,1st Half,10:17,True,142,2024-11-15T00:53:24Z
401715310101899401,101899401,LayUpShot,Donovan Sanders missed Layup.,8,27,1st Half,10:05,False,2400,2024-11-15T00:53:35Z
401715310101899402,101899402,Defensive Rebound,Missouri Defensive Rebound.,8,27,1st Half,10:05,False,142,2024-11-15T00:53:35Z
401715310101906001,101906001,LayUpShot,Marques Warrick made Layup.,8,29,1st Half,9:39,True,142,2024-11-15T00:54:11Z
401715310101908001,101908001,JumpShot,Arthur Tate made Three Point Jumper.,11,29,1st Half,9:19,True,2400,2024-11-15T00:54:32Z
401715310101909501,101909501,JumpShot,Caleb Grill made Three Point Jumper. Assisted by Marques Warrick.,11,32,1st Half,9:04,True,142,2024-11-15T00:54:49Z
401715310101916901,101916901,JumpShot,Arthur Tate missed Three Point Jumper.,11,32,1st Half,8:30,False,2400,2024-11-15T00:55:23Z
401715310101917201,101917201,Defensive Rebound,Annor Boateng Defensive Rebound.,11,32,1st Half,8:27,False,142,2024-11-15T00:55:23Z
401715310101917301,101917301,JumpShot,Jacob Crews missed Three Point Jumper.,11,32,1st Half,8:26,False,142,2024-11-15T00:55:24Z
401715310101917501,101917501,Defensive Rebound,George Ivory III Defensive Rebound.,11,32,1st Half,8:24,False,2400,2024-11-15T00:55:26Z
401715310101918001,101918001,Lost Ball Turnover,Donovan Sanders Turnover.,11,32,1st Half,8:19,False,2400,2024-11-15T00:55:31Z
401715310101918002,101918002,Steal,Annor Boateng Steal.,11,32,1st Half,8:19,False,142,2024-11-15T00:55:31Z
401715310101918601,101918601,LayUpShot,Marques Warrick missed Layup.,11,32,1st Half,8:13,False,142,2024-11-15T00:55:37Z
401715310101918901,101918901,Defensive Rebound,George Ivory III Defensive Rebound.,11,32,1st Half,8:10,False,2400,2024-11-15T00:55:39Z
401715310101924601,101924601,Lost Ball Turnover,Greg Moore Turnover.,11,32,1st Half,7:53,False,2400,2024-11-15T00:55:58Z
401715310101924602,101924602,Steal,Mark Mitchell Steal.,11,32,1st Half,7:53,False,142,2024-11-15T00:55:58Z
401715310101925001,101925001,LayUpShot,Annor Boateng made Layup. Assisted by Marques Warrick.,11,34,1st Half,7:49,True,142,2024-11-15T00:56:01Z
401715310101926501,101926501,JumpShot,Alvin Stredic missed Jumper.,11,34,1st Half,7:34,False,2400,2024-11-15T00:56:16Z
401715310101926502,101926502,Block Shot,Mark Mitchell Block.,11,34,1st Half,7:34,False,142,2024-11-15T00:56:19Z
401715310101926901,101926901,Defensive Rebound,Marques Warrick Defensive Rebound.,11,34,1st Half,7:30,False,142,2024-11-15T00:56:19Z
401715310101927501,101927501,JumpShot,Jacob Crews made Three Point Jumper. Assisted by Mark Mitchell.,11,37,1st Half,7:24,True,142,2024-11-15T00:56:25Z
401715310101927601,101927601,ShortTimeOut,Mississippi Valley State  Timeout,11,37,1st Half,7:23,False,2400,2024-11-15T00:56:38Z
401715310101927602,101927602,Lost Ball Turnover,Moses Horne Turnover.,11,37,1st Half,7:23,False,2400,2024-11-15T00:56:38Z
401715310101934801,101934801,PersonalFoul,Foul on Moses Horne.,11,37,1st Half,6:51,False,2400,2024-11-15T01:00:38Z
401715310101935101,101935101,JumpShot,Tamar Bates made Three Point Jumper. Assisted by Anthony Robinson II.,11,40,1st Half,6:48,True,142,2024-11-15T01:01:31Z
401715310101935901,101935901,Lost Ball Turnover,Donovan Sanders Turnover.,11,40,1st Half,6:40,False,2400,2024-11-15T01:01:40Z
401715310101935902,101935902,Steal,Anthony Robinson II Steal.,11,40,1st Half,6:40,False,142,2024-11-15T01:01:40Z
401715310101936101,101936101,PersonalFoul,Foul on Darrion Salery.,11,40,1st Half,6:38,False,2400,2024-11-15T01:02:03Z
401715310101936102,101936102,MadeFreeThrow,Trent Pierce missed Free Throw.,11,40,1st Half,6:38,False,142,2024-11-15T01:02:07Z
401715310101936103,101936103,Offensive Rebound,Missouri Offensive Rebound.,11,40,1st Half,6:38,False,142,2024-11-15T01:02:07Z
401715310101936104,101936104,MadeFreeThrow,Trent Pierce made Free Throw.,11,41,1st Half,6:38,True,142,2024-11-15T01:02:07Z
401715310101937901,101937901,JumpShot,Arthur Tate made Jumper. Assisted by Donovan Sanders.,13,41,1st Half,6:20,True,2400,2024-11-15T01:03:20Z
401715310101938901,101938901,JumpShot,Tamar Bates missed Three Point Jumper.,13,41,1st Half,6:10,False,142,2024-11-15T01:03:31Z
401715310101938902,101938902,Block Shot,Darrion Salery Block.,13,41,1st Half,6:10,False,2400,2024-11-15T01:03:33Z
401715310101939301,101939301,Offensive Rebound,Tamar Bates Offensive Rebound.,13,41,1st Half,6:06,False,142,2024-11-15T01:03:33Z
401715310101939401,101939401,LayUpShot,Tamar Bates missed Layup.,13,41,1st Half,6:05,False,142,2024-11-15T01:03:33Z
401715310101939801,101939801,Offensive Rebound,Tamar Bates Offensive Rebound.,13,41,1st Half,6:01,False,142,2024-11-15T01:03:38Z
401715310101944101,101944101,Lost Ball Turnover,Tamar Bates Turnover.,13,41,1st Half,5:58,False,142,2024-11-15T01:03:41Z
401715310101944102,101944102,Steal,Arthur Tate Steal.,13,41,1st Half,5:58,False,2400,2024-11-15T01:03:41Z
401715310101944103,101944103,ShortTimeOut,Mississippi Valley State  Timeout,13,41,1st Half,5:58,False,2400,2024-11-15T01:03:41Z
401715310101946801,101946801,LayUpShot,Donovan Sanders missed Layup.,13,41,1st Half,5:31,False,2400,2024-11-15T01:05:22Z
401715310101947101,101947101,Defensive Rebound,Anthony Robinson II Defensive Rebound.,13,41,1st Half,5:28,False,142,2024-11-15T01:05:22Z
401715310101948001,101948001,JumpShot,Jacob Crews missed Three Point Jumper.,13,41,1st Half,5:19,False,142,2024-11-15T01:05:58Z
401715310101948301,101948301,Defensive Rebound,Donovan Sanders Defensive Rebound.,13,41,1st Half,5:16,False,2400,2024-11-15T01:06:06Z
401715310101954501,101954501,LayUpShot,Alvin Stredic missed Layup.,13,41,1st Half,4:54,False,2400,2024-11-15T01:06:48Z
401715310101954502,101954502,Offensive Rebound,Mississippi Valley State Offensive Rebound.,13,41,1st Half,4:54,False,2400,2024-11-15T01:06:48Z
401715310101955001,101955001,JumpShot,Arthur Tate missed Three Point Jumper.,13,41,1st Half,4:49,False,2400,2024-11-15T01:07:15Z
401715310101955201,101955201,Defensive Rebound,Josh Gray Defensive Rebound.,13,41,1st Half,4:47,False,142,2024-11-15T01:07:15Z
401715310101957001,101957001,LayUpShot,Marques Warrick missed Layup.,13,41,1st Half,4:29,False,142,2024-11-15T01:07:35Z
401715310101957201,101957201,Offensive Rebound,Josh Gray Offensive Rebound.,13,41,1st Half,4:27,False,142,2024-11-15T01:07:35Z
401715310101957301,101957301,JumpShot,Tamar Bates made Three Point Jumper. Assisted by Caleb Grill.,13,44,1st Half,4:26,True,142,2024-11-15T01:07:37Z
401715310101964301,101964301,PersonalFoul,Foul on Tamar Bates.,13,44,1st Half,3:56,False,142,2024-11-15T01:08:08Z
401715310101964302,101964302,OfficialTVTimeOut, Official TV Timeout,13,44,1st Half,3:56,False,,2024-11-15T01:08:08Z
401715310101964303,101964303,MadeFreeThrow,Alvin Stredic missed Free Throw.,13,44,1st Half,3:56,False,2400,2024-11-15T01:08:08Z
401715310101964304,101964304,Offensive Rebound,Mississippi Valley State Offensive Rebound.,13,44,1st Half,3:56,False,2400,2024-11-15T01:08:08Z
401715310101964305,101964305,MadeFreeThrow,Alvin Stredic made Free Throw.,14,44,1st Half,3:56,True,2400,2024-11-15T01:08:08Z
401715310101964901,101964901,JumpShot,Caleb Grill missed Three Point Jumper.,14,44,1st Half,3:50,False,142,2024-11-15T01:11:52Z
401715310101965101,101965101,Offensive Rebound,Josh Gray Offensive Rebound.,14,44,1st Half,3:48,False,142,2024-11-15T01:11:52Z
401715310101967101,101967101,JumpShot,Tamar Bates missed Jumper.,14,44,1st Half,3:28,False,142,2024-11-15T01:12:14Z
401715310101967301,101967301,Defensive Rebound,Alvin Stredic Defensive Rebound.,14,44,1st Half,3:26,False,2400,2024-11-15T01:12:14Z
401715310101968401,101968401,PersonalFoul,Foul on Caleb Grill.,14,44,1st Half,3:15,False,142,2024-11-15T01:12:26Z
401715310101969901,101969901,JumpShot,Donovan Sanders made Jumper.,16,44,1st Half,3:00,True,2400,2024-11-15T01:12:57Z
401715310101975501,101975501,PersonalFoul,Foul on Alvin Stredic.,16,44,1st Half,2:44,False,2400,2024-11-15T01:13:15Z
401715310101975502,101975502,MadeFreeThrow,Caleb Grill made Free Throw.,16,45,1st Half,2:44,True,142,2024-11-15T01:13:15Z
401715310101975503,101975503,MadeFreeThrow,Caleb Grill made Free Throw.,16,46,1st Half,2:44,True,142,2024-11-15T01:14:10Z
401715310101978001,101978001,PersonalFoul,Foul on Trent Pierce.,16,46,1st Half,2:19,False,142,2024-11-15T01:14:40Z
401715310101978002,101978002,MadeFreeThrow,Arthur Tate missed Free Throw.,16,46,1st Half,2:19,False,2400,2024-11-15T01:14:40Z
401715310101978003,101978003,Offensive Rebound,Mississippi Valley State Offensive Rebound.,16,46,1st Half,2:19,False,2400,2024-11-15T01:14:40Z
401715310101978004,101978004,MadeFreeThrow,Arthur Tate made Free Throw.,17,46,1st Half,2:19,True,2400,2024-11-15T01:15:28Z
401715310101984001,101984001,PersonalFoul,Foul on Jair Horton.,17,46,1st Half,1:59,False,2400,2024-11-15T01:15:49Z
401715310101984002,101984002,MadeFreeThrow,Trent Pierce missed Free Throw.,17,46,1st Half,1:59,False,142,2024-11-15T01:15:49Z
401715310101984003,101984003,Offensive Rebound,Missouri Offensive Rebound.,17,46,1st Half,1:59,False,142,2024-11-15T01:15:49Z
401715310101984004,101984004,MadeFreeThrow,Trent Pierce made Free Throw.,17,47,1st Half,1:59,True,142,2024-11-15T01:15:49Z
401715310101984005,101984005,MadeFreeThrow,Trent Pierce missed Free Throw.,17,47,1st Half,1:59,False,142,2024-11-15T01:15:49Z
401715310101984301,101984301,Offensive Rebound,Annor Boateng Offensive Rebound.,17,47,1st Half,1:56,False,142,2024-11-15T01:16:58Z
401715310101984401,101984401,JumpShot,Annor Boateng missed Jumper.,17,47,1st Half,1:55,False,142,2024-11-15T01:16:58Z
401715310101984402,101984402,Block Shot,Darrion Salery Block.,17,47,1st Half,1:55,False,2400,2024-11-15T01:16:58Z
401715310101984501,101984501,Offensive Rebound,Annor Boateng Offensive Rebound.,17,47,1st Half,1:54,False,142,2024-11-15T01:16:58Z
401715310101984502,101984502,PersonalFoul,Foul on Darrion Salery.,17,47,1st Half,1:54,False,2400,2024-11-15T01:16:58Z
401715310101984503,101984503,MadeFreeThrow,Annor Boateng made Free Throw.,17,48,1st Half,1:54,True,142,2024-11-15T01:16:58Z
401715310101984504,101984504,MadeFreeThrow,Annor Boateng missed Free Throw.,17,48,1st Half,1:54,False,142,2024-11-15T01:17:55Z
401715310101984505,101984505,Defensive Rebound,Kendal Parker Defensive Rebound.,17,48,1st Half,1:54,False,2400,2024-11-15T01:17:55Z
401715310101987501,101987501,Lost Ball Turnover,Mississippi Valley State  Turnover.,17,48,1st Half,1:24,False,2400,2024-11-15T01:18:54Z
401715310101989701,101989701,LayUpShot,Trent Pierce made Layup. Assisted by Peyton Marshall.,17,50,1st Half,1:02,True,142,2024-11-15T01:19:25Z
401715310101995101,101995101,LayUpShot,Kendal Parker missed Layup.,17,50,1st Half,0:48,False,2400,2024-11-15T01:19:41Z
401715310101995401,101995401,Defensive Rebound,Trent Pierce Defensive Rebound.,17,50,1st Half,0:45,False,142,2024-11-15T01:19:41Z
401715310101995601,101995601,PersonalFoul,Foul on Donovan Sanders.,17,50,1st Half,0:43,False,2400,2024-11-15T01:19:44Z
401715310101995602,101995602,MadeFreeThrow,Peyton Marshall made Free Throw.,17,51,1st Half,0:43,True,142,2024-11-15T01:19:44Z
401715310101995701,101995701,MadeFreeThrow,Peyton Marshall missed Free Throw.,17,51,1st Half,0:42,False,142,2024-11-15T01:20:35Z
401715310101995901,101995901,Defensive Rebound,Kendal Parker Defensive Rebound.,17,51,1st Half,0:40,False,2400,2024-11-15T01:20:38Z
401715310101998201,101998201,PersonalFoul,Foul on Anthony Robinson II.,17,51,1st Half,0:17,False,142,2024-11-15T01:21:22Z
401715310101999801,101999801,JumpShot,Kendal Parker missed Jumper.,17,51,1st Half,0:01,False,2400,2024-11-15T01:21:22Z
401715310101999802,101999802,Offensive Rebound,Daniel Umoh Offensive Rebound.,17,51,1st Half,0:01,False,2400,2024-11-15T01:21:22Z
401715310101999803,101999803,LayUpShot,Walter Hamilton made Layup.,19,51,1st Half,0:01,True,2400,2024-11-15T01:21:22Z
401715310101999901,101999901,End Period,End of 1st half,19,51,1st Half,0:00,False,,2024-11-15T01:21:22Z
401715310102804901,102804901,LayUpShot,Tamar Bates made Layup.,19,53,2nd Half,19:50,True,142,
401715310102805501,102805501,Lost Ball Turnover,Arthur Tate Turnover.,19,53,2nd Half,19:44,False,2400,2024-11-15T01:39:15Z
401715310102805502,102805502,Steal,Mark Mitchell Steal.,19,53,2nd Half,19:44,False,142,2024-11-15T01:39:15Z
401715310102805901,102805901,PersonalFoul,Foul on Arthur Tate.,19,53,2nd Half,19:40,False,2400,2024-11-15T01:39:41Z
401715310102805902,102805902,MadeFreeThrow,Mark Mitchell made Free Throw.,19,54,2nd Half,19:40,True,142,2024-11-15T01:40:30Z
401715310102805903,102805903,MadeFreeThrow,Mark Mitchell missed Free Throw.,19,54,2nd Half,19:40,False,142,2024-11-15T01:40:30Z
401715310102805904,102805904,Offensive Rebound,Missouri Offensive Rebound.,19,54,2nd Half,19:40,False,142,2024-11-15T01:40:30Z
401715310102808102,102808102,JumpShot,Caleb Grill missed Jumper.,19,54,2nd Half,19:18,False,142,2024-11-15T01:40:30Z
401715310102808103,102808103,Defensive Rebound,Donovan Sanders Defensive Rebound.,19,54,2nd Half,19:18,False,2400,2024-11-15T01:40:30Z
401715310102808104,102808104,PersonalFoul,Foul on Tamar Bates.,19,54,2nd Half,19:18,False,142,2024-11-15T01:40:30Z
401715310102808105,102808105,JumpShot,Donovan Sanders missed Jumper.,19,54,2nd Half,19:18,False,2400,2024-11-15T01:40:30Z
401715310102808106,102808106,Defensive Rebound,Caleb Grill Defensive Rebound.,19,54,2nd Half,19:18,False,142,2024-11-15T01:40:30Z
401715310102808107,102808107,LayUpShot,Anthony Robinson II made Layup.,19,56,2nd Half,19:18,True,142,2024-11-15T01:40:30Z
401715310102817601,102817601,Lost Ball Turnover,George Ivory III Turnover.,19,56,2nd Half,18:23,False,2400,2024-11-15T01:41:53Z
401715310102817602,102817602,Steal,Anthony Robinson II Steal.,19,56,2nd Half,18:23,False,142,2024-11-15T01:41:53Z
401715310102817901,102817901,JumpShot,Jacob Crews missed Three Point Jumper.,19,56,2nd Half,18:20,False,142,2024-11-15T01:41:59Z
401715310102818301,102818301,Offensive Rebound,Anthony Robinson II Offensive Rebound.,19,56,2nd Half,18:16,False,142,2024-11-15T01:42:01Z
401715310102818501,102818501,PersonalFoul,Foul on Alvin Stredic.,19,56,2nd Half,18:14,False,2400,2024-11-15T01:42:05Z
401715310102818502,102818502,MadeFreeThrow,Caleb Grill made Free Throw.,19,57,2nd Half,18:14,True,142,2024-11-15T01:42:36Z
401715310102818503,102818503,MadeFreeThrow,Caleb Grill made Free Throw.,19,58,2nd Half,18:14,True,142,2024-11-15T01:42:36Z
401715310102818504,102818504,MadeFreeThrow,Caleb Grill made Free Throw.,19,59,2nd Half,18:14,True,142,2024-11-15T01:42:36Z
401715310102824401,102824401,JumpShot,Darrion Salery missed Jumper.,19,59,2nd Half,17:55,False,2400,2024-11-15T01:43:41Z
401715310102824601,102824601,Defensive Rebound,Anthony Robinson II Defensive Rebound.,19,59,2nd Half,17:53,False,142,2024-11-15T01:43:41Z
401715310102826201,102826201,JumpShot,Annor Boateng missed Three Point Jumper.,19,59,2nd Half,17:37,False,142,2024-11-15T01:43:58Z
401715310102826202,102826202,Offensive Rebound,Anthony Robinson II Offensive Rebound.,19,59,2nd Half,17:37,False,142,2024-11-15T01:43:58Z
401715310102826203,102826203,JumpShot,Anthony Robinson II made Jumper.,19,61,2nd Half,17:37,True,142,2024-11-15T01:43:58Z
401715310102826204,102826204,PersonalFoul,Foul on Darrion Salery.,19,61,2nd Half,17:37,False,2400,2024-11-15T01:43:58Z
401715310102826205,102826205,MadeFreeThrow,Anthony Robinson II made Free Throw.,19,62,2nd Half,17:37,True,142,2024-11-15T01:44:33Z
401715310102828801,102828801,Lost Ball Turnover,Donovan Sanders Turnover.,19,62,2nd Half,17:11,False,2400,2024-11-15T01:45:19Z
401715310102828802,102828802,Steal,Mark Mitchell Steal.,19,62,2nd Half,17:11,False,142,2024-11-15T01:45:19Z
401715310102829101,102829101,DunkShot,Mark Mitchell made Dunk.,19,64,2nd Half,17:08,True,142,2024-11-15T01:45:21Z
401715310102836101,102836101,JumpShot,Donovan Sanders missed Three Point Jumper.,19,64,2nd Half,16:38,False,2400,2024-11-15T01:45:51Z
401715310102836102,102836102,Defensive Rebound,Missouri Defensive Rebound.,19,64,2nd Half,16:38,False,142,2024-11-15T01:45:51Z
401715310102836401,102836401,PersonalFoul,Foul on Antonio Sisk.,19,64,2nd Half,16:35,False,2400,2024-11-15T01:46:20Z
401715310102837601,102837601,LayUpShot,Caleb Grill made Layup.,19,66,2nd Half,16:23,True,142,2024-11-15T01:46:41Z
401715310102837602,102837602,JumpShot,Antonio Sisk made Jumper.,21,66,2nd Half,16:23,True,2400,2024-11-15T01:46:41Z
401715310102845001,102845001,PersonalFoul,Foul on Antonio Sisk.,21,66,2nd Half,15:49,False,2400,2024-11-15T01:47:21Z
401715310102845002,102845002,OfficialTVTimeOut, Official TV Timeout,21,66,2nd Half,15:49,False,,2024-11-15T01:47:28Z
401715310102845301,102845301,DunkShot,Josh Gray made Dunk. Assisted by Caleb Grill.,21,68,2nd Half,15:46,True,142,2024-11-15T01:47:21Z
401715310102845302,102845302,Technical Foul,Technical Foul on Josh Gray.,21,68,2nd Half,15:46,False,142,2024-11-15T01:47:21Z
