play_id,sequence_number,type,description,away_score,home_score,period,clock,scoring_play,team_id,timestamp_utc
401724900112591705,112591705,Jumpball,Start game,0,0,1st Half,20:00,False,,2025-02-27T07:05:59Z
401724900112591727,112591727,Jumpball,Jump Ball won by Stanford,0,0,1st Half,19:59,False,24,2025-02-27T07:06:00Z
401724900112591729,112591729,Jumpball,Jump Ball lost by Boston College,0,0,1st Half,19:59,False,103,2025-02-27T07:06:00Z
401724900112591762,112591762,PersonalFoul,Foul on Chad Venning.,0,0,1st Half,19:43,False,103,2025-02-27T07:06:31Z
401724900112591878,112591878,JumpShot,Maxime Raynaud missed Jumper.,0,0,1st Half,19:36,False,24,2025-02-27T07:07:00Z
401724900112591880,112591880,Offensive Rebound,Donavin Young Offensive Rebound.,0,0,1st Half,19:33,False,24,2025-02-27T07:07:02Z
401724900112591911,112591911,JumpShot,Maxime Raynaud made Jumper.,0,2,1st Half,19:25,True,24,2025-02-27T07:07:10Z
401724900112591968,112591968,Lost Ball Turnover,Chad Venning Turnover.,0,2,1st Half,19:00,False,103,2025-02-27T07:07:36Z
401724900112591969,112591969,Steal,Ryan Agarwal Steal.,0,2,1st Half,19:00,False,24,2025-02-27T07:07:36Z
401724900112592006,112592006,JumpShot,Jaylen Blakes missed Three Point Jumper.,0,2,1st Half,18:45,False,24,2025-02-27T07:07:52Z
401724900112592008,112592008,Defensive Rebound,Roger McFarlane Defensive Rebound.,0,2,1st Half,18:40,False,103,2025-02-27T07:07:55Z
401724900112592020,112592020,Lost Ball Turnover,Chad Venning Turnover.,0,2,1st Half,18:29,False,103,2025-02-27T07:08:09Z
401724900112592036,112592036,Steal,Ryan Agarwal Steal.,0,2,1st Half,18:29,False,24,2025-02-27T07:08:09Z
401724900112592037,112592037,LayUpShot,Oziyah Sellers missed Layup.,0,2,1st Half,18:18,False,24,2025-02-27T07:08:18Z
401724900112592083,112592083,Defensive Rebound,Roger McFarlane Defensive Rebound.,0,2,1st Half,18:15,False,103,2025-02-27T07:08:20Z
401724900112592084,112592084,JumpShot,Donald Hand Jr. made Three Point Jumper. Assisted by Chas Kelley III.,3,2,1st Half,18:08,True,103,2025-02-27T07:08:28Z
401724900112592141,112592141,JumpShot,Maxime Raynaud made Jumper.,3,4,1st Half,17:47,True,24,2025-02-27T07:08:49Z
401724900112592236,112592236,JumpShot,Dion Brown missed Jumper.,3,4,1st Half,17:27,False,103,2025-02-27T07:09:10Z
401724900112592240,112592240,Defensive Rebound,Maxime Raynaud Defensive Rebound.,3,4,1st Half,17:20,False,24,2025-02-27T07:09:15Z
401724900112592399,112592399,JumpShot,Ryan Agarwal missed Three Point Jumper.,3,4,1st Half,17:13,False,24,2025-02-27T07:09:23Z
401724900112592400,112592400,Defensive Rebound,Dion Brown Defensive Rebound.,3,4,1st Half,17:11,False,103,2025-02-27T07:09:25Z
401724900112592401,112592401,LayUpShot,Dion Brown made Layup.,5,4,1st Half,17:09,True,103,2025-02-27T07:09:28Z
401724900112592416,112592416,PersonalFoul,Foul on Ryan Agarwal.,5,4,1st Half,17:09,False,24,2025-02-27T07:09:33Z
401724900112592447,112592447,Substitution,Ryan Agarwal subbing out for Stanford,5,4,1st Half,17:09,False,24,2025-02-27T07:09:44Z
401724900112592449,112592449,Substitution,Benny Gealer subbing in for Stanford,5,4,1st Half,17:09,False,24,2025-02-27T07:09:44Z
401724900112592463,112592463,MadeFreeThrow,Dion Brown made Free Throw.,6,4,1st Half,17:09,True,103,2025-02-27T07:09:56Z
401724900112592560,112592560,Lost Ball Turnover,Maxime Raynaud Turnover.,6,4,1st Half,16:52,False,24,2025-02-27T07:10:20Z
401724900112592650,112592650,Lost Ball Turnover,Donald Hand Jr. Turnover.,6,4,1st Half,16:33,False,103,2025-02-27T07:10:47Z
401724900112592726,112592726,JumpShot,Maxime Raynaud made Three Point Jumper. Assisted by Benny Gealer.,6,7,1st Half,16:26,True,24,2025-02-27T07:11:05Z
401724900112592780,112592780,Lost Ball Turnover,Chad Venning Turnover.,6,7,1st Half,16:09,False,103,2025-02-27T07:11:29Z
401724900112592832,112592832,Substitution,Donavin Young subbing out for Stanford,6,7,1st Half,16:09,False,24,2025-02-27T07:11:39Z
401724900112592833,112592833,Substitution,Chisom Okpara subbing in for Stanford,6,7,1st Half,16:09,False,24,2025-02-27T07:11:39Z
401724900112592882,112592882,JumpShot,Oziyah Sellers missed Three Point Jumper.,6,7,1st Half,15:55,False,24,2025-02-27T07:11:59Z
401724900112592913,112592913,Defensive Rebound,Dion Brown Defensive Rebound.,6,7,1st Half,15:52,False,103,2025-02-27T07:12:01Z
401724900112592914,112592914,JumpShot,Chad Venning missed Jumper.,6,7,1st Half,15:45,False,103,2025-02-27T07:12:08Z
401724900112592925,112592925,Offensive Rebound,Chad Venning Offensive Rebound.,6,7,1st Half,15:41,False,103,2025-02-27T07:12:12Z
401724900112592966,112592966,Lost Ball Turnover,Chad Venning Turnover.,6,7,1st Half,15:40,False,103,2025-02-27T07:12:13Z
401724900112592967,112592967,Steal,Benny Gealer Steal.,6,7,1st Half,15:40,False,24,2025-02-27T07:12:13Z
401724900112592989,112592989,PersonalFoul,Foul on Donald Hand Jr..,6,7,1st Half,15:29,False,103,2025-02-27T07:12:28Z
401724900112592991,112592991,OfficialTVTimeOut,Official TV Timeout,6,7,1st Half,15:29,False,,2025-02-27T07:12:33Z
401724900112593666,112593666,Substitution,Chad Venning subbing out for Boston College,6,7,1st Half,15:29,False,103,2025-02-27T07:16:04Z
401724900112593668,112593668,Substitution,Jayden Hastings subbing in for Boston College,6,7,1st Half,15:29,False,103,2025-02-27T07:16:04Z
401724900112593759,112593759,MadeFreeThrow,Oziyah Sellers made Free Throw.,6,8,1st Half,15:29,True,24,2025-02-27T07:16:21Z
401724900112593814,112593814,MadeFreeThrow,Oziyah Sellers made Free Throw.,6,9,1st Half,15:29,True,24,2025-02-27T07:16:36Z
401724900112593884,112593884,LayUpShot,Dion Brown missed Layup.,6,9,1st Half,15:05,False,103,2025-02-27T07:17:03Z
401724900112593936,112593936,Defensive Rebound,Chisom Okpara Defensive Rebound.,6,9,1st Half,14:53,False,24,2025-02-27T07:17:15Z
401724900112594013,112594013,JumpShot,Oziyah Sellers made Three Point Jumper. Assisted by Maxime Raynaud.,6,12,1st Half,14:35,True,24,2025-02-27T07:17:34Z
401724900112594073,112594073,JumpShot,Roger McFarlane missed Three Point Jumper.,6,12,1st Half,14:07,False,103,2025-02-27T07:18:01Z
401724900112594126,112594126,Substitution,Chas Kelley III subbing out for Boston College,6,12,1st Half,14:05,False,103,2025-02-27T07:18:18Z
401724900112594129,112594129,Substitution,Roger McFarlane subbing out for Boston College,6,12,1st Half,14:05,False,103,2025-02-27T07:18:18Z
401724900112594131,112594131,Substitution,Joshua Beadle subbing in for Boston College,6,12,1st Half,14:05,False,103,2025-02-27T07:18:18Z
401724900112594132,112594132,Substitution,Elijah Strong subbing in for Boston College,6,12,1st Half,14:05,False,103,2025-02-27T07:18:18Z
401724900112594075,112594075,Defensive Rebound,Stanford Defensive Rebound.,6,12,1st Half,14:04,False,24,2025-02-27T07:18:03Z
401724900112595097,112595097,PersonalFoul,Foul on Maxime Raynaud.,6,12,1st Half,13:50,False,24,2025-02-27T07:25:18Z
401724900112595099,112595099,Lost Ball Turnover,Maxime Raynaud Turnover.,6,12,1st Half,13:50,False,24,2025-02-27T07:25:18Z
401724900112594220,112594220,Substitution,Maxime Raynaud subbing out for Stanford,6,12,1st Half,13:49,False,24,2025-02-27T07:19:05Z
401724900112594221,112594221,Substitution,Aidan Cammann subbing in for Stanford,6,12,1st Half,13:49,False,24,2025-02-27T07:19:05Z
401724900112594260,112594260,Substitution,Jaylen Blakes subbing out for Stanford,6,12,1st Half,13:32,False,24,2025-02-27T07:19:27Z
401724900112594261,112594261,Substitution,Ryan Agarwal subbing in for Stanford,6,12,1st Half,13:32,False,24,2025-02-27T07:19:27Z
401724900112594317,112594317,JumpShot,Dion Brown made Jumper.,8,12,1st Half,13:20,True,103,2025-02-27T07:19:51Z
401724900112594353,112594353,PersonalFoul,Foul on Elijah Strong.,8,12,1st Half,13:01,False,103,2025-02-27T07:20:13Z
401724900112594414,112594414,LayUpShot,Aidan Cammann made Layup. Assisted by Ryan Agarwal.,8,14,1st Half,12:55,True,24,2025-02-27T07:20:36Z
401724900112594461,112594461,Substitution,Donald Hand Jr. subbing out for Boston College,8,14,1st Half,12:44,False,103,2025-02-27T07:20:56Z
401724900112594462,112594462,Substitution,Fred Payne subbing in for Boston College,8,14,1st Half,12:44,False,103,2025-02-27T07:20:56Z
401724900112594505,112594505,Lost Ball Turnover,Dion Brown Turnover.,8,14,1st Half,12:26,False,103,2025-02-27T07:21:19Z
401724900112594536,112594536,Steal,Benny Gealer Steal.,8,14,1st Half,12:26,False,24,2025-02-27T07:21:19Z
401724900112594587,112594587,LayUpShot,Chisom Okpara made Layup.,8,16,1st Half,12:05,True,24,2025-02-27T07:21:40Z
401724900112594646,112594646,JumpShot,Elijah Strong missed Jumper.,8,16,1st Half,11:35,False,103,2025-02-27T07:22:10Z
401724900112594648,112594648,Defensive Rebound,Aidan Cammann Defensive Rebound.,8,16,1st Half,11:31,False,24,2025-02-27T07:22:13Z
401724900112594664,112594664,Lost Ball Turnover,Aidan Cammann Turnover.,8,16,1st Half,11:30,False,24,2025-02-27T07:22:20Z
401724900112594665,112594665,OfficialTVTimeOut,Official TV Timeout,8,16,1st Half,11:30,False,,2025-02-27T07:22:23Z
401724900112595195,112595195,Substitution,Oziyah Sellers subbing out for Stanford,8,16,1st Half,11:30,False,24,2025-02-27T07:25:51Z
401724900112595198,112595198,Substitution,Jaylen Blakes subbing in for Stanford,8,16,1st Half,11:30,False,24,2025-02-27T07:25:51Z
401724900112595199,112595199,Substitution,Jayden Hastings subbing out for Boston College,8,16,1st Half,11:30,False,103,2025-02-27T07:25:51Z
401724900112595200,112595200,Substitution,Chad Venning subbing in for Boston College,8,16,1st Half,11:30,False,103,2025-02-27T07:25:51Z
401724900112595240,112595240,PersonalFoul,Foul on Chisom Okpara.,8,16,1st Half,11:28,False,24,2025-02-27T07:26:08Z
401724900112595300,112595300,JumpShot,Fred Payne missed Three Point Jumper.,8,16,1st Half,11:23,False,103,2025-02-27T07:26:48Z
401724900112595333,112595333,Defensive Rebound,Chisom Okpara Defensive Rebound.,8,16,1st Half,11:20,False,24,2025-02-27T07:26:50Z
401724900112595380,112595380,PersonalFoul,Foul on Fred Payne.,8,16,1st Half,11:09,False,103,2025-02-27T07:27:12Z
401724900112595396,112595396,Substitution,Dion Brown subbing out for Boston College,8,16,1st Half,11:09,False,103,2025-02-27T07:27:20Z
401724900112595397,112595397,Substitution,Donald Hand Jr. subbing in for Boston College,8,16,1st Half,11:09,False,103,2025-02-27T07:27:20Z
401724900112595435,112595435,JumpShot,Ryan Agarwal missed Jumper.,8,16,1st Half,10:57,False,24,2025-02-27T07:27:32Z
401724900112595436,112595436,Offensive Rebound,Chisom Okpara Offensive Rebound.,8,16,1st Half,10:51,False,24,2025-02-27T07:27:38Z
401724900112595478,112595478,JumpShot,Jaylen Blakes made Three Point Jumper. Assisted by Aidan Cammann.,8,19,1st Half,10:48,True,24,2025-02-27T07:27:41Z
401724900112595539,112595539,LayUpShot,Joshua Beadle made Layup.,10,19,1st Half,10:30,True,103,2025-02-27T07:28:14Z
401724900112596613,112596613,JumpShot,Chisom Okpara missed Three Point Jumper.,10,19,1st Half,10:29,False,24,2025-02-27T07:35:21Z
401724900112596614,112596614,Offensive Rebound,Aidan Cammann Offensive Rebound.,10,19,1st Half,10:29,False,24,2025-02-27T07:35:21Z
401724900112596741,112596741,Lost Ball Turnover,Benny Gealer Turnover.,10,19,1st Half,10:25,False,24,2025-02-27T07:36:22Z
401724900112595728,112595728,Substitution,Benny Gealer subbing out for Stanford,10,19,1st Half,10:21,False,24,2025-02-27T07:43:27Z
401724900112595730,112595730,Substitution,Chisom Okpara subbing out for Stanford,10,19,1st Half,10:21,False,24,2025-02-27T07:43:27Z
401724900112595732,112595732,Substitution,Aidan Cammann subbing out for Stanford,10,19,1st Half,10:21,False,24,2025-02-27T07:43:27Z
401724900112595734,112595734,Substitution,Donavin Young subbing in for Stanford,10,19,1st Half,10:21,False,24,2025-02-27T07:43:27Z
401724900112595737,112595737,Substitution,Oziyah Sellers subbing in for Stanford,10,19,1st Half,10:21,False,24,2025-02-27T07:43:27Z
401724900112595739,112595739,Substitution,Maxime Raynaud subbing in for Stanford,10,19,1st Half,10:21,False,24,2025-02-27T07:43:27Z
401724900112598152,112598152,LayUpShot,Chad Venning missed Layup.,10,19,1st Half,10:05,False,103,2025-02-27T07:46:41Z
401724900112598154,112598154,Defensive Rebound,Maxime Raynaud Defensive Rebound.,10,19,1st Half,10:05,False,24,2025-02-27T07:46:41Z
401724900112598409,112598409,JumpShot,Maxime Raynaud missed Three Point Jumper.,10,19,1st Half,9:55,False,24,2025-02-27T07:48:42Z
401724900112598410,112598410,Defensive Rebound,Donald Hand Jr. Defensive Rebound.,10,19,1st Half,9:55,False,103,2025-02-27T07:48:42Z
401724900112598546,112598546,JumpShot,Donald Hand Jr. missed Three Point Jumper.,10,19,1st Half,9:46,False,103,2025-02-27T07:49:23Z
401724900112598548,112598548,Offensive Rebound,Fred Payne Offensive Rebound.,10,19,1st Half,9:46,False,103,2025-02-27T07:49:23Z
401724900112597740,112597740,JumpShot,Fred Payne made Jumper.,12,19,1st Half,9:43,True,103,2025-02-27T07:44:09Z
401724900112595742,112595742,JumpShot,Maxime Raynaud made Three Point Jumper.,12,22,1st Half,9:03,True,24,2025-02-27T07:29:27Z
401724900112595810,112595810,Lost Ball Turnover,Joshua Beadle Turnover.,12,22,1st Half,8:55,False,103,2025-02-27T07:29:51Z
401724900112595812,112595812,Steal,Donavin Young Steal.,12,22,1st Half,8:55,False,24,2025-02-27T07:29:51Z
401724900112595822,112595822,PersonalFoul,Foul on Chad Venning.,12,22,1st Half,8:46,False,103,2025-02-27T07:30:03Z
401724900112595898,112595898,MadeFreeThrow,Maxime Raynaud missed Free Throw.,12,22,1st Half,8:46,False,24,2025-02-27T07:30:36Z
401724900112595900,112595900,Dead Ball Rebound,Stanford Deadball Team Rebound.,12,22,1st Half,8:46,False,24,2025-02-27T07:30:36Z
401724900112595938,112595938,Substitution,Joshua Beadle subbing out for Boston College,12,22,1st Half,8:46,False,103,2025-02-27T07:30:42Z
401724900112595940,112595940,Substitution,Chas Kelley III subbing in for Boston College,12,22,1st Half,8:46,False,103,2025-02-27T07:30:42Z
401724900112595958,112595958,MadeFreeThrow,Maxime Raynaud made Free Throw.,12,23,1st Half,8:46,True,24,2025-02-27T07:30:56Z
401724900112595991,112595991,Substitution,Chad Venning subbing out for Boston College,12,23,1st Half,8:46,False,103,2025-02-27T07:31:00Z
401724900112595993,112595993,Substitution,Jayden Hastings subbing in for Boston College,12,23,1st Half,8:46,False,103,2025-02-27T07:31:00Z
401724900112596045,112596045,PersonalFoul,Foul on Jaylen Blakes.,12,23,1st Half,8:39,False,24,2025-02-27T07:31:20Z
401724900112596128,112596128,JumpShot,Elijah Strong missed Three Point Jumper.,12,23,1st Half,8:32,False,103,2025-02-27T07:31:51Z
401724900112596129,112596129,Offensive Rebound,Jayden Hastings Offensive Rebound.,12,23,1st Half,8:29,False,103,2025-02-27T07:31:54Z
401724900112596130,112596130,JumpShot,Chas Kelley III made Three Point Jumper. Assisted by Jayden Hastings.,15,23,1st Half,8:27,True,103,2025-02-27T07:31:56Z
401724900112596163,112596163,PersonalFoul,Foul on Jayden Hastings.,15,23,1st Half,8:14,False,103,2025-02-27T07:32:11Z
401724900112596197,112596197,Substitution,Ryan Agarwal subbing out for Stanford,15,23,1st Half,8:14,False,24,2025-02-27T07:32:24Z
401724900112596198,112596198,Substitution,Evan Stinson subbing in for Stanford,15,23,1st Half,8:14,False,24,2025-02-27T07:32:24Z
401724900112596199,112596199,Substitution,Elijah Strong subbing out for Boston College,15,23,1st Half,8:14,False,103,2025-02-27T07:32:24Z
401724900112596200,112596200,Substitution,Dion Brown subbing in for Boston College,15,23,1st Half,8:14,False,103,2025-02-27T07:32:24Z
401724900112596276,112596276,PersonalFoul,Foul on Maxime Raynaud.,15,23,1st Half,8:09,False,24,2025-02-27T07:32:51Z
401724900112596277,112596277,Lost Ball Turnover,Maxime Raynaud Turnover.,15,23,1st Half,8:09,False,24,2025-02-27T07:32:51Z
401724900112596280,112596280,Substitution,Maxime Raynaud subbing out for Stanford,15,23,1st Half,8:09,False,24,2025-02-27T07:32:59Z
401724900112596282,112596282,Substitution,Aidan Cammann subbing in for Stanford,15,23,1st Half,8:09,False,24,2025-02-27T07:32:59Z
401724900112596303,112596303,LayUpShot,Chas Kelley III missed Layup.,15,23,1st Half,7:57,False,103,2025-02-27T07:33:20Z
401724900112596330,112596330,Defensive Rebound,Stanford Defensive Rebound.,15,23,1st Half,7:56,False,24,2025-02-27T07:33:22Z
401724900112596331,112596331,OfficialTVTimeOut,Official TV Timeout,15,23,1st Half,7:55,False,,2025-02-27T07:33:27Z
401724900112596814,112596814,Substitution,Donavin Young subbing out for Stanford,15,23,1st Half,7:55,False,24,2025-02-27T07:36:41Z
401724900112596816,112596816,Substitution,Chisom Okpara subbing in for Stanford,15,23,1st Half,7:55,False,24,2025-02-27T07:36:41Z
401724900112596914,112596914,Lost Ball Turnover,Oziyah Sellers Turnover.,15,23,1st Half,7:34,False,24,2025-02-27T07:37:21Z
401724900112596916,112596916,Steal,Dion Brown Steal.,15,23,1st Half,7:34,False,103,2025-02-27T07:37:21Z
401724900112596962,112596962,JumpShot,Donald Hand Jr. missed Jumper.,15,23,1st Half,7:12,False,103,2025-02-27T07:37:43Z
401724900112596963,112596963,Offensive Rebound,Boston College Offensive Rebound.,15,23,1st Half,7:11,False,103,2025-02-27T07:37:46Z
401724900112597022,112597022,Lost Ball Turnover,Chas Kelley III Turnover.,15,23,1st Half,7:06,False,103,2025-02-27T07:38:19Z
401724900112597052,112597052,Lost Ball Turnover,Jaylen Blakes Turnover.,15,23,1st Half,7:00,False,24,2025-02-27T07:38:25Z
401724900112597053,112597053,Steal,Jayden Hastings Steal.,15,23,1st Half,7:00,False,103,2025-02-27T07:38:25Z
401724900112597180,112597180,JumpShot,Fred Payne missed Three Point Jumper.,15,23,1st Half,6:31,False,103,2025-02-27T07:39:14Z
401724900112597181,112597181,Defensive Rebound,Evan Stinson Defensive Rebound.,15,23,1st Half,6:28,False,24,2025-02-27T07:39:16Z
401724900112597212,112597212,LayUpShot,Chisom Okpara made Layup.,15,25,1st Half,6:15,True,24,2025-02-27T07:39:29Z
401724900112597283,112597283,PersonalFoul,Foul on Dion Brown.,15,25,1st Half,5:56,False,103,2025-02-27T07:39:53Z
401724900112597284,112597284,Lost Ball Turnover,Dion Brown Turnover.,15,25,1st Half,5:56,False,103,2025-02-27T07:39:53Z
401724900112597292,112597292,Substitution,Chas Kelley III subbing out for Boston College,15,25,1st Half,5:56,False,103,2025-02-27T07:40:01Z
401724900112597293,112597293,Substitution,Joshua Beadle subbing in for Boston College,15,25,1st Half,5:56,False,103,2025-02-27T07:40:01Z
401724900112597365,112597365,Substitution,Dion Brown subbing out for Boston College,15,25,1st Half,5:55,False,103,2025-02-27T07:40:32Z
401724900112597366,112597366,Substitution,Elijah Strong subbing in for Boston College,15,25,1st Half,5:55,False,103,2025-02-27T07:40:32Z
401724900112597367,112597367,JumpShot,Oziyah Sellers made Jumper.,15,27,1st Half,5:55,True,24,2025-02-27T07:40:35Z
401724900112597380,112597380,JumpShot,Joshua Beadle missed Three Point Jumper.,15,27,1st Half,5:26,False,103,2025-02-27T07:40:47Z
401724900112597381,112597381,Defensive Rebound,Oziyah Sellers Defensive Rebound.,15,27,1st Half,5:23,False,24,2025-02-27T07:40:49Z
401724900112597422,112597422,JumpShot,Chisom Okpara made Three Point Jumper.,15,30,1st Half,5:13,True,24,2025-02-27T07:41:00Z
401724900112597467,112597467,PersonalFoul,Foul on Jayden Hastings.,15,30,1st Half,4:53,False,103,2025-02-27T07:41:21Z
401724900112597468,112597468,Lost Ball Turnover,Jayden Hastings Turnover.,15,30,1st Half,4:53,False,103,2025-02-27T07:41:21Z
401724900112597485,112597485,Substitution,Jaylen Blakes subbing out for Stanford,15,30,1st Half,4:53,False,24,2025-02-27T07:41:32Z
401724900112597506,112597506,Substitution,Benny Gealer subbing in for Stanford,15,30,1st Half,4:53,False,24,2025-02-27T07:41:32Z
401724900112597517,112597517,Substitution,Jayden Hastings subbing out for Boston College,15,30,1st Half,4:53,False,103,2025-02-27T07:41:44Z
401724900112597518,112597518,Substitution,Chad Venning subbing in for Boston College,15,30,1st Half,4:53,False,103,2025-02-27T07:41:44Z
401724900112597529,112597529,PersonalFoul,Foul on Chisom Okpara.,15,30,1st Half,4:43,False,24,2025-02-27T07:42:05Z
401724900112597531,112597531,Lost Ball Turnover,Chisom Okpara Turnover.,15,30,1st Half,4:43,False,24,2025-02-27T07:42:05Z
401724900112597834,112597834,LayUpShot,Chad Venning missed Layup.,15,30,1st Half,4:26,False,103,2025-02-27T07:44:34Z
401724900112597836,112597836,Offensive Rebound,Elijah Strong Offensive Rebound.,15,30,1st Half,4:24,False,103,2025-02-27T07:44:36Z
401724900112597837,112597837,LayUpShot,Elijah Strong missed Layup.,15,30,1st Half,4:24,False,103,2025-02-27T07:44:38Z
401724900112597871,112597871,Block Shot,Evan Stinson Block.,15,30,1st Half,4:24,False,24,2025-02-27T07:44:38Z
401724900112597872,112597872,Offensive Rebound,Boston College Offensive Rebound.,15,30,1st Half,4:24,False,103,2025-02-27T07:44:42Z
401724900112597920,112597920,JumpShot,Donald Hand Jr. missed Jumper.,15,30,1st Half,4:13,False,103,2025-02-27T07:45:03Z
401724900112597921,112597921,Defensive Rebound,Oziyah Sellers Defensive Rebound.,15,30,1st Half,4:09,False,24,2025-02-27T07:45:06Z
401724900112598156,112598156,OfficialTVTimeOut,Official TV Timeout,15,30,1st Half,3:53,False,,2025-02-27T07:46:47Z
401724900112598625,112598625,JumpShot,Chisom Okpara missed Three Point Jumper.,15,30,1st Half,3:41,False,24,2025-02-27T07:50:14Z
401724900112598626,112598626,Defensive Rebound,Donald Hand Jr. Defensive Rebound.,15,30,1st Half,3:37,False,103,2025-02-27T07:50:16Z
401724900112598691,112598691,PersonalFoul,Foul on Evan Stinson.,15,30,1st Half,3:21,False,24,2025-02-27T07:50:37Z
401724900112598739,112598739,MadeFreeThrow,Elijah Strong made Free Throw.,16,30,1st Half,3:21,True,103,2025-02-27T07:51:03Z
401724900112598743,112598743,Substitution,Chisom Okpara subbing out for Stanford,16,30,1st Half,3:21,False,24,2025-02-27T07:51:11Z
401724900112598745,112598745,Substitution,Evan Stinson subbing out for Stanford,16,30,1st Half,3:21,False,24,2025-02-27T07:51:11Z
401724900112598787,112598787,Substitution,Ryan Agarwal subbing in for Stanford,16,30,1st Half,3:21,False,24,2025-02-27T07:51:11Z
401724900112598789,112598789,Substitution,Maxime Raynaud subbing in for Stanford,16,30,1st Half,3:21,False,24,2025-02-27T07:51:11Z
401724900112598807,112598807,MadeFreeThrow,Elijah Strong made Free Throw.,17,30,1st Half,3:21,True,103,2025-02-27T07:51:27Z
401724900112598872,112598872,JumpShot,Benny Gealer missed Three Point Jumper.,17,30,1st Half,2:55,False,24,2025-02-27T07:51:58Z
401724900112598874,112598874,Defensive Rebound,Boston College Defensive Rebound.,17,30,1st Half,2:53,False,103,2025-02-27T07:52:00Z
401724900112598885,112598885,Substitution,Oziyah Sellers subbing out for Stanford,17,30,1st Half,2:53,False,24,2025-02-27T07:52:07Z
401724900112598886,112598886,Substitution,Jaylen Blakes subbing in for Stanford,17,30,1st Half,2:53,False,24,2025-02-27T07:52:07Z
401724900112598930,112598930,JumpShot,Fred Payne made Jumper.,19,30,1st Half,2:28,True,103,2025-02-27T07:52:39Z
401724900112598969,112598969,LayUpShot,Ryan Agarwal missed Layup.,19,30,1st Half,2:09,False,24,2025-02-27T07:53:00Z
401724900112598977,112598977,Offensive Rebound,Maxime Raynaud Offensive Rebound.,19,30,1st Half,2:04,False,24,2025-02-27T07:53:03Z
401724900112598978,112598978,LayUpShot,Maxime Raynaud made Layup.,19,32,1st Half,2:04,True,24,2025-02-27T07:53:04Z
401724900112599001,112599001,JumpShot,Donald Hand Jr. missed Three Point Jumper.,19,32,1st Half,1:40,False,103,2025-02-27T07:53:29Z
401724900112599027,112599027,Defensive Rebound,Jaylen Blakes Defensive Rebound.,19,32,1st Half,1:36,False,24,2025-02-27T07:53:31Z
401724900112599034,112599034,JumpShot,Maxime Raynaud made Three Point Jumper. Assisted by Jaylen Blakes.,19,35,1st Half,1:25,True,24,2025-02-27T07:53:43Z
401724900112599046,112599046,Lost Ball Turnover,Joshua Beadle Turnover.,19,35,1st Half,1:09,False,103,2025-02-27T07:53:58Z
401724900112599052,112599052,Steal,Jaylen Blakes Steal.,19,35,1st Half,1:09,False,24,2025-02-27T07:53:58Z
401724900112599053,112599053,DunkShot,Jaylen Blakes made Dunk.,19,37,1st Half,1:04,True,24,2025-02-27T07:54:04Z
401724900112599062,112599062,ShortTimeOut,Boston College Timeout,19,37,1st Half,1:04,False,103,2025-02-27T07:54:12Z
401724900112599125,112599125,Substitution,Maxime Raynaud subbing out for Stanford,19,37,1st Half,1:04,False,24,2025-02-27T07:55:00Z
401724900112599146,112599146,Substitution,Donavin Young subbing in for Stanford,19,37,1st Half,1:04,False,24,2025-02-27T07:55:00Z
401724900112599148,112599148,Substitution,Joshua Beadle subbing out for Boston College,19,37,1st Half,1:04,False,103,2025-02-27T07:55:00Z
401724900112599149,112599149,Substitution,Dion Brown subbing in for Boston College,19,37,1st Half,1:04,False,103,2025-02-27T07:55:00Z
401724900112599188,112599188,JumpShot,Fred Payne missed Three Point Jumper.,19,37,1st Half,0:49,False,103,2025-02-27T07:55:28Z
401724900112599189,112599189,Defensive Rebound,Aidan Cammann Defensive Rebound.,19,37,1st Half,0:46,False,24,2025-02-27T07:55:30Z
401724900112599231,112599231,JumpShot,Ryan Agarwal missed Jumper.,19,37,1st Half,0:17,False,24,2025-02-27T07:56:00Z
401724900112599247,112599247,Defensive Rebound,Dion Brown Defensive Rebound.,19,37,1st Half,0:14,False,103,2025-02-27T07:56:02Z
401724900112599255,112599255,JumpShot,Donald Hand Jr. missed Three Point Jumper.,19,37,1st Half,0:01,False,103,2025-02-27T07:56:16Z
401724900112599257,112599257,Defensive Rebound,Stanford Defensive Rebound.,19,37,1st Half,0:00,False,24,2025-02-27T07:56:19Z
401724900112600469,112600469,End Period,End of 1st half,19,37,1st Half,0:00,False,,2025-02-27T08:12:05Z
401724900112600484,112600484,Substitution,Benny Gealer subbing out for Stanford,19,37,2nd Half,20:00,False,24,2025-02-27T08:12:25Z
401724900112600485,112600485,Substitution,Aidan Cammann subbing out for Stanford,19,37,2nd Half,20:00,False,24,2025-02-27T08:12:25Z
401724900112600507,112600507,Substitution,Oziyah Sellers subbing in for Stanford,19,37,2nd Half,20:00,False,24,2025-02-27T08:12:25Z
401724900112600509,112600509,Substitution,Maxime Raynaud subbing in for Stanford,19,37,2nd Half,20:00,False,24,2025-02-27T08:12:25Z
