play_id,sequence_number,type,description,away_score,home_score,period,clock,scoring_play,team_id,timestamp_utc
401724900112600510,112600510,Substitution,Fred Payne subbing out for Boston College,19,37,2nd Half,20:00,False,103,2025-02-27T08:12:25Z
401724900112600511,112600511,Substitution,Elijah Strong subbing out for Boston College,19,37,2nd Half,20:00,False,103,2025-02-27T08:12:25Z
401724900112600513,112600513,Substitution,Chas Kelley III subbing in for Boston College,19,37,2nd Half,20:00,False,103,2025-02-27T08:12:25Z
401724900112600514,112600514,Substitution,Roger McFarlane subbing in for Boston College,19,37,2nd Half,20:00,False,103,2025-02-27T08:12:25Z
401724900112600523,112600523,JumpShot,Jaylen Blakes made Jumper.,19,39,2nd Half,19:46,True,24,2025-02-27T08:12:50Z
401724900112600535,112600535,LayUpShot,Chad Venning missed Layup.,19,39,2nd Half,19:27,False,103,2025-02-27T08:13:08Z
401724900112600536,112600536,Defensive Rebound,Maxime Raynaud Defensive Rebound.,19,39,2nd Half,19:24,False,24,2025-02-27T08:13:11Z
401724900112600557,112600557,JumpShot,Oziyah Sellers missed Jumper.,19,39,2nd Half,19:08,False,24,2025-02-27T08:13:29Z
401724900112600566,112600566,Offensive Rebound,Maxime Raynaud Offensive Rebound.,19,39,2nd Half,19:05,False,24,2025-02-27T08:13:33Z
401724900112600583,112600583,LayUpShot,Ryan Agarwal made Layup. Assisted by Jaylen Blakes.,19,41,2nd Half,18:57,True,24,2025-02-27T08:13:53Z
401724900112600594,112600594,JumpShot,Roger McFarlane made Jumper.,21,41,2nd Half,18:30,True,103,2025-02-27T08:14:20Z
401724900112600666,112600666,PersonalFoul,Foul on Dion Brown.,21,41,2nd Half,18:12,False,103,2025-02-27T08:14:47Z
401724900112600675,112600675,MadeFreeThrow,Oziyah Sellers made Free Throw.,21,42,2nd Half,18:12,True,24,2025-02-27T08:14:59Z
401724900112600687,112600687,MadeFreeThrow,Oziyah Sellers made Free Throw.,21,43,2nd Half,18:12,True,24,2025-02-27T08:15:11Z
401724900112600698,112600698,JumpShot,Roger McFarlane made Three Point Jumper. Assisted by Chas Kelley III.,24,43,2nd Half,17:52,True,103,2025-02-27T08:15:36Z
401724900112600713,112600713,Lost Ball Turnover,Ryan Agarwal Turnover.,24,43,2nd Half,17:34,False,24,2025-02-27T08:15:53Z
401724900112600715,112600715,Steal,Donald Hand Jr. Steal.,24,43,2nd Half,17:34,False,103,2025-02-27T08:15:53Z
401724900112600743,112600743,DunkShot,Dion Brown missed Dunk.,24,43,2nd Half,17:20,False,103,2025-02-27T08:16:36Z
401724900112600744,112600744,Defensive Rebound,Ryan Agarwal Defensive Rebound.,24,43,2nd Half,17:17,False,24,2025-02-27T08:16:39Z
401724900112600767,112600767,LayUpShot,Ryan Agarwal made Layup. Assisted by Jaylen Blakes.,24,45,2nd Half,17:07,True,24,2025-02-27T08:16:49Z
401724900112600774,112600774,Lost Ball Turnover,Chas Kelley III Turnover.,24,45,2nd Half,17:03,False,103,2025-02-27T08:16:54Z
401724900112600776,112600776,Steal,Jaylen Blakes Steal.,24,45,2nd Half,17:03,False,24,2025-02-27T08:16:54Z
401724900112600787,112600787,PersonalFoul,Foul on Chas Kelley III.,24,45,2nd Half,17:01,False,103,2025-02-27T08:17:00Z
401724900112600809,112600809,MadeFreeThrow,Jaylen Blakes made Free Throw.,24,46,2nd Half,17:01,True,24,2025-02-27T08:17:22Z
401724900112600826,112600826,MadeFreeThrow,Jaylen Blakes made Free Throw.,24,47,2nd Half,17:01,True,24,2025-02-27T08:17:32Z
401724900112600846,112600846,PersonalFoul,Foul on Ryan Agarwal.,24,47,2nd Half,16:45,False,24,2025-02-27T08:17:57Z
401724900112600891,112600891,JumpShot,Chad Venning made Jumper.,26,47,2nd Half,16:38,True,103,2025-02-27T08:18:19Z
401724900112600947,112600947,JumpShot,Maxime Raynaud made Jumper.,26,49,2nd Half,16:12,True,24,2025-02-27T08:19:10Z
401724900112600958,112600958,LayUpShot,Chad Venning made Layup. Assisted by Chas Kelley III.,28,49,2nd Half,15:59,True,103,2025-02-27T08:19:24Z
401724900112600960,112600960,PersonalFoul,Foul on Ryan Agarwal.,28,49,2nd Half,15:59,False,24,2025-02-27T08:19:29Z
401724900112600970,112600970,OfficialTVTimeOut,Official TV Timeout,28,49,2nd Half,15:59,False,,2025-02-27T08:19:35Z
401724900112601142,112601142,Substitution,Donavin Young subbing out for Stanford,28,49,2nd Half,15:59,False,24,2025-02-27T08:22:43Z
401724900112601143,112601143,Substitution,Ryan Agarwal subbing out for Stanford,28,49,2nd Half,15:59,False,24,2025-02-27T08:22:43Z
401724900112601144,112601144,Substitution,Chisom Okpara subbing in for Stanford,28,49,2nd Half,15:59,False,24,2025-02-27T08:22:43Z
401724900112601146,112601146,Substitution,Evan Stinson subbing in for Stanford,28,49,2nd Half,15:59,False,24,2025-02-27T08:22:43Z
401724900112601163,112601163,MadeFreeThrow,Chad Venning missed Free Throw.,28,49,2nd Half,15:59,False,103,2025-02-27T08:23:25Z
401724900112601164,112601164,Defensive Rebound,Maxime Raynaud Defensive Rebound.,28,49,2nd Half,15:58,False,24,2025-02-27T08:23:26Z
401724900112601194,112601194,LayUpShot,Oziyah Sellers made Layup. Assisted by Maxime Raynaud.,28,51,2nd Half,15:43,True,24,2025-02-27T08:23:42Z
401724900112601233,112601233,JumpShot,Donald Hand Jr. missed Three Point Jumper.,28,51,2nd Half,15:13,False,103,2025-02-27T08:24:12Z
401724900112601234,112601234,Defensive Rebound,Maxime Raynaud Defensive Rebound.,28,51,2nd Half,15:09,False,24,2025-02-27T08:24:15Z
401724900112601270,112601270,JumpShot,Oziyah Sellers missed Jumper.,28,51,2nd Half,14:50,False,24,2025-02-27T08:24:35Z
401724900112601271,112601271,Offensive Rebound,Jaylen Blakes Offensive Rebound.,28,51,2nd Half,14:47,False,24,2025-02-27T08:24:38Z
401724900112601272,112601272,JumpShot,Oziyah Sellers made Three Point Jumper. Assisted by Jaylen Blakes.,28,54,2nd Half,14:45,True,24,2025-02-27T08:24:40Z
401724900112601279,112601279,Substitution,Jaylen Blakes subbing out for Stanford,28,54,2nd Half,14:40,False,24,2025-02-27T08:24:58Z
401724900112601280,112601280,Substitution,Benny Gealer subbing in for Stanford,28,54,2nd Half,14:40,False,24,2025-02-27T08:24:58Z
401724900112601283,112601283,Substitution,Donald Hand Jr. subbing out for Boston College,28,54,2nd Half,14:40,False,103,2025-02-27T08:25:04Z
401724900112601284,112601284,Substitution,Fred Payne subbing in for Boston College,28,54,2nd Half,14:40,False,103,2025-02-27T08:25:04Z
401724900112601346,112601346,JumpShot,Chad Venning made Jumper.,30,54,2nd Half,14:27,True,103,2025-02-27T08:25:58Z
401724900112601361,112601361,JumpShot,Maxime Raynaud made Three Point Jumper. Assisted by Benny Gealer.,30,57,2nd Half,14:11,True,24,2025-02-27T08:26:17Z
401724900112601389,112601389,PersonalFoul,Foul on Benny Gealer.,30,57,2nd Half,13:54,False,24,2025-02-27T08:26:35Z
401724900112601400,112601400,JumpShot,Roger McFarlane made Three Point Jumper. Assisted by Fred Payne.,33,57,2nd Half,13:43,True,103,2025-02-27T08:27:01Z
401724900112601429,112601429,JumpShot,Maxime Raynaud missed Three Point Jumper.,33,57,2nd Half,13:24,False,24,2025-02-27T08:27:18Z
401724900112601430,112601430,Defensive Rebound,Fred Payne Defensive Rebound.,33,57,2nd Half,13:21,False,103,2025-02-27T08:27:21Z
401724900112601438,112601438,JumpShot,Fred Payne missed Three Point Jumper.,33,57,2nd Half,13:09,False,103,2025-02-27T08:27:35Z
401724900112601439,112601439,Defensive Rebound,Chisom Okpara Defensive Rebound.,33,57,2nd Half,13:06,False,24,2025-02-27T08:27:37Z
401724900112601445,112601445,PersonalFoul,Foul on Dion Brown.,33,57,2nd Half,13:06,False,103,2025-02-27T08:27:41Z
401724900112601467,112601467,Substitution,Oziyah Sellers subbing out for Stanford,33,57,2nd Half,13:06,False,24,2025-02-27T08:28:01Z
401724900112601468,112601468,Substitution,Maxime Raynaud subbing out for Stanford,33,57,2nd Half,13:06,False,24,2025-02-27T08:28:01Z
401724900112601469,112601469,Substitution,Jaylen Blakes subbing in for Stanford,33,57,2nd Half,13:06,False,24,2025-02-27T08:28:01Z
401724900112601471,112601471,Substitution,Aidan Cammann subbing in for Stanford,33,57,2nd Half,13:06,False,24,2025-02-27T08:28:01Z
401724900112601473,112601473,Substitution,Dion Brown subbing out for Boston College,33,57,2nd Half,13:06,False,103,2025-02-27T08:28:01Z
401724900112601474,112601474,Substitution,Donald Hand Jr. subbing in for Boston College,33,57,2nd Half,13:06,False,103,2025-02-27T08:28:01Z
401724900112601482,112601482,LayUpShot,Jaylen Blakes missed Layup.,33,57,2nd Half,12:56,False,24,2025-02-27T08:28:19Z
401724900112601530,112601530,Substitution,Chas Kelley III subbing out for Boston College,33,57,2nd Half,12:54,False,103,2025-02-27T08:28:37Z
401724900112601531,112601531,Substitution,Luka Toews subbing in for Boston College,33,57,2nd Half,12:54,False,103,2025-02-27T08:28:37Z
401724900112601800,112601800,JumpShot,Aidan Cammann missed Jumper.,33,57,2nd Half,12:54,False,24,2025-02-27T08:32:36Z
401724900112601801,112601801,Block Shot,Chad Venning Block.,33,57,2nd Half,12:54,False,103,2025-02-27T08:32:36Z
401724900112601802,112601802,Defensive Rebound,Boston College Defensive Rebound.,33,57,2nd Half,12:54,False,103,2025-02-27T08:32:36Z
401724900112601528,112601528,Offensive Rebound,Aidan Cammann Offensive Rebound.,33,57,2nd Half,12:52,False,24,2025-02-27T08:28:25Z
401724900112601540,112601540,LayUpShot,Chad Venning made Layup.,35,57,2nd Half,12:40,True,103,2025-02-27T08:28:58Z
401724900112601543,112601543,LayUpShot,Chisom Okpara made Layup.,35,59,2nd Half,12:18,True,24,2025-02-27T08:29:19Z
401724900112601588,112601588,PersonalFoul,Foul on Aidan Cammann.,35,59,2nd Half,12:05,False,24,2025-02-27T08:29:35Z
401724900112601594,112601594,MadeFreeThrow,Chad Venning missed Free Throw.,35,59,2nd Half,12:05,False,103,2025-02-27T08:29:57Z
401724900112601595,112601595,Dead Ball Rebound,Boston College Deadball Team Rebound.,35,59,2nd Half,12:05,False,103,2025-02-27T08:29:57Z
401724900112601602,112601602,Substitution,Roger McFarlane subbing out for Boston College,35,59,2nd Half,12:05,False,103,2025-02-27T08:30:03Z
401724900112601604,112601604,Substitution,Elijah Strong subbing in for Boston College,35,59,2nd Half,12:05,False,103,2025-02-27T08:30:03Z
401724900112601657,112601657,MadeFreeThrow,Chad Venning made Free Throw.,36,59,2nd Half,12:05,True,103,2025-02-27T08:30:18Z
401724900112601667,112601667,LayUpShot,Chisom Okpara missed Layup.,36,59,2nd Half,11:44,False,24,2025-02-27T08:30:43Z
401724900112601668,112601668,Block Shot,Chad Venning Block.,36,59,2nd Half,11:44,False,103,2025-02-27T08:30:43Z
401724900112601669,112601669,Defensive Rebound,Donald Hand Jr. Defensive Rebound.,36,59,2nd Half,11:39,False,103,2025-02-27T08:30:48Z
401724900112601680,112601680,PersonalFoul,Foul on Aidan Cammann.,36,59,2nd Half,11:34,False,24,2025-02-27T08:30:56Z
401724900112601683,112601683,OfficialTVTimeOut,Official TV Timeout,36,59,2nd Half,11:34,False,,2025-02-27T08:31:07Z
401724900112601869,112601869,Substitution,Aidan Cammann subbing out for Stanford,36,59,2nd Half,11:34,False,24,2025-02-27T08:33:57Z
401724900112601870,112601870,Substitution,Maxime Raynaud subbing in for Stanford,36,59,2nd Half,11:34,False,24,2025-02-27T08:33:57Z
401724900112601882,112601882,MadeFreeThrow,Chad Venning made Free Throw.,37,59,2nd Half,11:34,True,103,2025-02-27T08:34:30Z
401724900112601938,112601938,MadeFreeThrow,Chad Venning made Free Throw.,38,59,2nd Half,11:34,True,103,2025-02-27T08:34:42Z
401724900112601970,112601970,LayUpShot,Jaylen Blakes missed Layup.,38,59,2nd Half,11:20,False,24,2025-02-27T08:35:02Z
401724900112601971,112601971,Block Shot,Chad Venning Block.,38,59,2nd Half,11:20,False,103,2025-02-27T08:35:02Z
401724900112601973,112601973,Defensive Rebound,Elijah Strong Defensive Rebound.,38,59,2nd Half,11:15,False,103,2025-02-27T08:35:07Z
401724900112601975,112601975,JumpShot,Luka Toews made Three Point Jumper. Assisted by Elijah Strong.,41,59,2nd Half,11:12,True,103,2025-02-27T08:35:11Z
401724900112602023,112602023,LayUpShot,Jaylen Blakes missed Layup.,41,59,2nd Half,10:49,False,24,2025-02-27T08:35:33Z
401724900112602024,112602024,Defensive Rebound,Chad Venning Defensive Rebound.,41,59,2nd Half,10:46,False,103,2025-02-27T08:35:36Z
401724900112602031,112602031,PersonalFoul,Foul on Jaylen Blakes.,41,59,2nd Half,10:38,False,24,2025-02-27T08:35:46Z
401724900112602037,112602037,Substitution,Jaylen Blakes subbing out for Stanford,41,59,2nd Half,10:38,False,24,2025-02-27T08:35:55Z
401724900112602038,112602038,Substitution,Evan Stinson subbing out for Stanford,41,59,2nd Half,10:38,False,24,2025-02-27T08:35:55Z
401724900112602040,112602040,Substitution,Oziyah Sellers subbing in for Stanford,41,59,2nd Half,10:38,False,24,2025-02-27T08:35:55Z
401724900112602041,112602041,Substitution,Ryan Agarwal subbing in for Stanford,41,59,2nd Half,10:38,False,24,2025-02-27T08:35:55Z
401724900112602074,112602074,Lost Ball Turnover,Elijah Strong Turnover.,41,59,2nd Half,10:18,False,103,2025-02-27T08:36:25Z
401724900112602077,112602077,Steal,Chisom Okpara Steal.,41,59,2nd Half,10:18,False,24,2025-02-27T08:36:25Z
401724900112602078,112602078,LayUpShot,Chisom Okpara made Layup.,41,61,2nd Half,10:15,True,24,2025-02-27T08:36:28Z
401724900112602109,112602109,JumpShot,Chad Venning missed Jumper.,41,61,2nd Half,9:55,False,103,2025-02-27T08:36:50Z
401724900112602111,112602111,Defensive Rebound,Maxime Raynaud Defensive Rebound.,41,61,2nd Half,9:51,False,24,2025-02-27T08:36:52Z
401724900112602116,112602116,JumpShot,Oziyah Sellers missed Three Point Jumper.,41,61,2nd Half,9:40,False,24,2025-02-27T08:37:05Z
401724900112602117,112602117,Offensive Rebound,Chisom Okpara Offensive Rebound.,41,61,2nd Half,9:36,False,24,2025-02-27T08:37:06Z
401724900112602118,112602118,JumpShot,Oziyah Sellers made Jumper. Assisted by Chisom Okpara.,41,63,2nd Half,9:34,True,24,2025-02-27T08:37:09Z
401724900112602134,112602134,JumpShot,Luka Toews made Jumper.,43,63,2nd Half,9:21,True,103,2025-02-27T08:37:23Z
401724900112602140,112602140,JumpShot,Oziyah Sellers missed Three Point Jumper.,43,63,2nd Half,8:59,False,24,2025-02-27T08:37:45Z
401724900112602141,112602141,Defensive Rebound,Chad Venning Defensive Rebound.,43,63,2nd Half,8:56,False,103,2025-02-27T08:37:47Z
401724900112602173,112602173,JumpShot,Fred Payne missed Three Point Jumper.,43,63,2nd Half,8:44,False,103,2025-02-27T08:38:01Z
401724900112602177,112602177,Defensive Rebound,Maxime Raynaud Defensive Rebound.,43,63,2nd Half,8:40,False,24,2025-02-27T08:38:02Z
401724900112602183,112602183,JumpShot,Ryan Agarwal made Three Point Jumper. Assisted by Benny Gealer.,43,66,2nd Half,8:30,True,24,2025-02-27T08:38:13Z
401724900112602214,112602214,LayUpShot,Chad Venning made Layup.,45,66,2nd Half,8:10,True,103,2025-02-27T08:38:32Z
401724900112602219,112602219,JumpShot,Maxime Raynaud missed Jumper.,45,66,2nd Half,7:55,False,24,2025-02-27T08:38:48Z
401724900112602220,112602220,Defensive Rebound,Chad Venning Defensive Rebound.,45,66,2nd Half,7:51,False,103,2025-02-27T08:38:52Z
401724900112602250,112602250,JumpShot,Donald Hand Jr. made Three Point Jumper. Assisted by Luka Toews.,48,66,2nd Half,7:43,True,103,2025-02-27T08:39:01Z
401724900112602262,112602262,ShortTimeOut,Stanford Timeout,48,66,2nd Half,7:41,False,24,2025-02-27T08:39:06Z
401724900112602447,112602447,Substitution,Chisom Okpara subbing out for Stanford,48,66,2nd Half,7:41,False,24,2025-02-27T08:41:30Z
401724900112602448,112602448,Substitution,Donavin Young subbing in for Stanford,48,66,2nd Half,7:41,False,24,2025-02-27T08:41:30Z
401724900112602449,112602449,Substitution,Donald Hand Jr. subbing out for Boston College,48,66,2nd Half,7:41,False,103,2025-02-27T08:41:30Z
401724900112602450,112602450,Substitution,Chad Venning subbing out for Boston College,48,66,2nd Half,7:41,False,103,2025-02-27T08:41:30Z
401724900112602451,112602451,Substitution,Roger McFarlane subbing in for Boston College,48,66,2nd Half,7:41,False,103,2025-02-27T08:41:30Z
401724900112602452,112602452,Substitution,Jayden Hastings subbing in for Boston College,48,66,2nd Half,7:41,False,103,2025-02-27T08:41:30Z
401724900112602567,112602567,JumpShot,Benny Gealer missed Three Point Jumper.,48,66,2nd Half,7:20,False,24,2025-02-27T08:42:55Z
401724900112602568,112602568,Offensive Rebound,Ryan Agarwal Offensive Rebound.,48,66,2nd Half,7:15,False,24,2025-02-27T08:42:57Z
401724900112602564,112602564,OfficialTVTimeOut,Official TV Timeout,48,66,2nd Half,7:12,False,,2025-02-27T08:43:08Z
401724900112602812,112602812,Substitution,Benny Gealer subbing out for Stanford,48,66,2nd Half,7:11,False,24,2025-02-27T08:45:55Z
401724900112602813,112602813,Substitution,Jaylen Blakes subbing in for Stanford,48,66,2nd Half,7:11,False,24,2025-02-27T08:45:55Z
401724900112602860,112602860,JumpShot,Maxime Raynaud made Jumper.,48,68,2nd Half,7:06,True,24,2025-02-27T08:46:35Z
401724900112602901,112602901,JumpShot,Elijah Strong made Jumper.,50,68,2nd Half,6:49,True,103,2025-02-27T08:46:53Z
401724900112602905,112602905,Lost Ball Turnover,Oziyah Sellers Turnover.,50,68,2nd Half,6:37,False,24,2025-02-27T08:47:04Z
401724900112602926,112602926,Steal,Luka Toews Steal.,50,68,2nd Half,6:37,False,103,2025-02-27T08:47:04Z
401724900112602963,112602963,LayUpShot,Elijah Strong made Layup.,52,68,2nd Half,6:23,True,103,2025-02-27T08:47:41Z
401724900112602978,112602978,LayUpShot,Maxime Raynaud missed Layup.,52,68,2nd Half,5:59,False,24,2025-02-27T08:48:06Z
401724900112602979,112602979,Offensive Rebound,Donavin Young Offensive Rebound.,52,68,2nd Half,5:54,False,24,2025-02-27T08:48:10Z
401724900112602980,112602980,TipShot,Donavin Young missed Two Point Tip Shot.,52,68,2nd Half,5:54,False,24,2025-02-27T08:48:10Z
401724900112602981,112602981,Offensive Rebound,Donavin Young Offensive Rebound.,52,68,2nd Half,5:51,False,24,2025-02-27T08:48:12Z
401724900112603011,112603011,JumpShot,Donavin Young missed Jumper.,52,68,2nd Half,5:50,False,24,2025-02-27T08:48:14Z
401724900112603017,112603017,Defensive Rebound,Elijah Strong Defensive Rebound.,52,68,2nd Half,5:40,False,103,2025-02-27T08:48:23Z
401724900112603018,112603018,LayUpShot,Fred Payne missed Layup.,52,68,2nd Half,5:37,False,103,2025-02-27T08:48:27Z
401724900112603019,112603019,Offensive Rebound,Luka Toews Offensive Rebound.,52,68,2nd Half,5:36,False,103,2025-02-27T08:48:32Z
401724900112603048,112603048,Substitution,Donavin Young subbing out for Stanford,52,68,2nd Half,5:36,False,24,2025-02-27T08:48:41Z
401724900112603049,112603049,Substitution,Chisom Okpara subbing in for Stanford,52,68,2nd Half,5:36,False,24,2025-02-27T08:48:41Z
401724900112603068,112603068,DunkShot,Jayden Hastings missed Dunk.,52,68,2nd Half,5:28,False,103,2025-02-27T08:49:03Z
401724900112603069,112603069,Offensive Rebound,Roger McFarlane Offensive Rebound.,52,68,2nd Half,5:24,False,103,2025-02-27T08:49:06Z
401724900112603070,112603070,TipShot,Roger McFarlane missed Two Point Tip Shot.,52,68,2nd Half,5:24,False,103,2025-02-27T08:49:06Z
401724900112603071,112603071,Defensive Rebound,Maxime Raynaud Defensive Rebound.,52,68,2nd Half,5:22,False,24,2025-02-27T08:49:08Z
401724900112603076,112603076,PersonalFoul,Foul on Jayden Hastings.,52,68,2nd Half,5:22,False,103,2025-02-27T08:49:13Z
401724900112603113,112603113,JumpShot,Jaylen Blakes missed Three Point Jumper.,52,68,2nd Half,5:09,False,24,2025-02-27T08:49:49Z
401724900112603114,112603114,Defensive Rebound,Fred Payne Defensive Rebound.,52,68,2nd Half,5:05,False,103,2025-02-27T08:49:52Z
401724900112603118,112603118,PersonalFoul,Foul on Jaylen Blakes.,52,68,2nd Half,5:03,False,24,2025-02-27T08:49:58Z
401724900112603150,112603150,MadeFreeThrow,Elijah Strong missed Free Throw.,52,68,2nd Half,5:03,False,103,2025-02-27T08:50:28Z
401724900112603151,112603151,Dead Ball Rebound,Boston College Deadball Team Rebound.,52,68,2nd Half,5:03,False,103,2025-02-27T08:50:28Z
401724900112603155,112603155,Substitution,Ryan Agarwal subbing out for Stanford,52,68,2nd Half,5:03,False,24,2025-02-27T08:50:33Z
401724900112603156,112603156,Substitution,Benny Gealer subbing in for Stanford,52,68,2nd Half,5:03,False,24,2025-02-27T08:50:33Z
401724900112603162,112603162,MadeFreeThrow,Elijah Strong made Free Throw.,53,68,2nd Half,5:03,True,103,2025-02-27T08:50:44Z
401724900112603197,112603197,PersonalFoul,Foul on Fred Payne.,53,68,2nd Half,4:52,False,103,2025-02-27T08:51:10Z
401724900112603246,112603246,MadeFreeThrow,Jaylen Blakes made Free Throw.,53,69,2nd Half,4:50,True,24,2025-02-27T08:51:34Z
401724900112603247,112603247,Substitution,Fred Payne subbing out for Boston College,53,69,2nd Half,4:50,False,103,2025-02-27T08:51:38Z
401724900112603248,112603248,Substitution,Dion Brown subbing in for Boston College,53,69,2nd Half,4:50,False,103,2025-02-27T08:51:38Z
401724900112603254,112603254,MadeFreeThrow,Jaylen Blakes made Free Throw.,53,70,2nd Half,4:50,True,24,2025-02-27T08:51:47Z
401724900112603287,112603287,LayUpShot,Elijah Strong made Layup.,55,70,2nd Half,4:22,True,103,2025-02-27T08:52:14Z
401724900112603297,112603297,LayUpShot,Chisom Okpara made Layup.,55,72,2nd Half,4:00,True,24,2025-02-27T08:52:36Z
401724900112603335,112603335,DunkShot,Jayden Hastings made Dunk. Assisted by Dion Brown.,57,72,2nd Half,3:43,True,103,2025-02-27T08:52:54Z
401724900112603337,112603337,LayUpShot,Chisom Okpara made Layup.,57,74,2nd Half,3:17,True,24,2025-02-27T08:53:19Z
401724900112603338,112603338,JumpShot,Roger McFarlane made Three Point Jumper. Assisted by Luka Toews.,60,74,2nd Half,3:01,True,103,2025-02-27T08:53:35Z
401724900112603340,112603340,OfficialTVTimeOut,Official TV Timeout,60,74,2nd Half,2:53,False,,2025-02-27T08:53:55Z
401724900112603422,112603422,Substitution,Benny Gealer subbing out for Stanford,60,74,2nd Half,2:53,False,24,2025-02-27T08:56:06Z
401724900112603423,112603423,Substitution,Ryan Agarwal subbing in for Stanford,60,74,2nd Half,2:53,False,24,2025-02-27T08:56:06Z
401724900112603513,112603513,Substitution,Elijah Strong subbing out for Boston College,60,74,2nd Half,2:53,False,103,2025-02-27T08:56:24Z
401724900112603514,112603514,Substitution,Donald Hand Jr. subbing in for Boston College,60,74,2nd Half,2:53,False,103,2025-02-27T08:56:24Z
401724900112603556,112603556,PersonalFoul,Foul on Jayden Hastings.,60,74,2nd Half,2:41,False,103,2025-02-27T08:57:22Z
401724900112603610,112603610,PersonalFoul,Foul on Jayden Hastings.,60,74,2nd Half,2:27,False,103,2025-02-27T08:57:57Z
401724900112603617,112603617,Substitution,Jayden Hastings subbing out for Boston College,60,74,2nd Half,2:27,False,103,2025-02-27T08:58:27Z
401724900112603618,112603618,Substitution,Chad Venning subbing in for Boston College,60,74,2nd Half,2:27,False,103,2025-02-27T08:58:27Z
401724900112603620,112603620,MadeFreeThrow,Oziyah Sellers made Free Throw.,60,75,2nd Half,2:27,True,24,2025-02-27T08:58:38Z
401724900112603623,112603623,MadeFreeThrow,Oziyah Sellers made Free Throw.,60,76,2nd Half,2:27,True,24,2025-02-27T08:58:49Z
401724900112603624,112603624,Lost Ball Turnover,Luka Toews Turnover.,60,76,2nd Half,2:12,False,103,2025-02-27T08:59:07Z
401724900112603946,112603946,Steal,Oziyah Sellers Steal.,60,76,2nd Half,2:12,False,24,2025-02-27T08:59:07Z
401724900112603671,112603671,LayUpShot,Oziyah Sellers missed Layup.,60,76,2nd Half,2:06,False,24,2025-02-27T08:59:13Z
401724900112603672,112603672,Defensive Rebound,Roger McFarlane Defensive Rebound.,60,76,2nd Half,2:03,False,103,2025-02-27T08:59:15Z
401724900112603685,112603685,LayUpShot,Dion Brown missed Layup.,60,76,2nd Half,1:48,False,103,2025-02-27T08:59:43Z
401724900112603706,112603706,Defensive Rebound,Jaylen Blakes Defensive Rebound.,60,76,2nd Half,1:48,False,24,2025-02-27T08:59:45Z
401724900112603955,112603955,Block Shot,Maxime Raynaud Block.,60,76,2nd Half,1:48,False,24,2025-02-27T08:59:43Z
401724900112603713,112603713,Substitution,Maxime Raynaud subbing out for Stanford,60,76,2nd Half,1:46,False,24,2025-02-27T09:00:03Z
401724900112603714,112603714,Substitution,Tallis Toure subbing in for Stanford,60,76,2nd Half,1:46,False,24,2025-02-27T09:00:03Z
401724900112603717,112603717,Substitution,Luka Toews subbing out for Boston College,60,76,2nd Half,1:46,False,103,2025-02-27T09:00:10Z
401724900112603718,112603718,Substitution,Fred Payne subbing in for Boston College,60,76,2nd Half,1:46,False,103,2025-02-27T09:00:10Z
401724900112603767,112603767,LayUpShot,Tallis Toure missed Layup.,60,76,2nd Half,1:22,False,24,2025-02-27T09:00:45Z
401724900112603768,112603768,Defensive Rebound,Dion Brown Defensive Rebound.,60,76,2nd Half,1:20,False,103,2025-02-27T09:00:46Z
401724900112603771,112603771,JumpShot,Roger McFarlane missed Jumper.,60,76,2nd Half,1:15,False,103,2025-02-27T09:00:53Z
401724900112603772,112603772,Defensive Rebound,Tallis Toure Defensive Rebound.,60,76,2nd Half,1:11,False,24,2025-02-27T09:00:56Z
401724900112603777,112603777,JumpShot,Tallis Toure missed Three Point Jumper.,60,76,2nd Half,1:01,False,24,2025-02-27T09:01:07Z
401724900112603778,112603778,Defensive Rebound,Roger McFarlane Defensive Rebound.,60,76,2nd Half,0:56,False,103,2025-02-27T09:01:10Z
401724900112603779,112603779,ShortTimeOut,Boston College Timeout,60,76,2nd Half,0:56,False,103,2025-02-27T09:01:16Z
401724900112603781,112603781,Substitution,Roger McFarlane subbing out for Boston College,60,76,2nd Half,0:56,False,103,2025-02-27T09:01:23Z
401724900112603782,112603782,Substitution,Kany Tchanda subbing in for Boston College,60,76,2nd Half,0:56,False,103,2025-02-27T09:01:23Z
401724900112603826,112603826,Substitution,Oziyah Sellers subbing out for Stanford,60,76,2nd Half,0:56,False,24,2025-02-27T09:01:51Z
401724900112603827,112603827,Substitution,Chisom Okpara subbing out for Stanford,60,76,2nd Half,0:56,False,24,2025-02-27T09:01:51Z
401724900112603828,112603828,Substitution,Jaylen Blakes subbing out for Stanford,60,76,2nd Half,0:56,False,24,2025-02-27T09:01:51Z
401724900112603829,112603829,Substitution,Cameron Grant subbing in for Stanford,60,76,2nd Half,0:56,False,24,2025-02-27T09:01:51Z
401724900112603830,112603830,Substitution,Jaylen Thompson subbing in for Stanford,60,76,2nd Half,0:56,False,24,2025-02-27T09:01:51Z
401724900112603831,112603831,Substitution,Evan Stinson subbing in for Stanford,60,76,2nd Half,0:56,False,24,2025-02-27T09:01:51Z
401724900112603832,112603832,JumpShot,Fred Payne missed Three Point Jumper.,60,76,2nd Half,0:45,False,103,2025-02-27T09:01:59Z
