play_id,sequence_number,type,description,away_score,home_score,period,clock,scoring_play,team_id,timestamp_utc
401744203113170140,113170140,OfficialTVTimeOut,Official TV Timeout,29,25,1st Half,2:49,False,,2025-03-09T09:21:36Z
401744203113170209,113170209,Substitution,Carter Bjerke subbing out for St. Thomas-Minnesota,29,25,1st Half,2:49,False,2900,2025-03-09T09:24:03Z
401744203113170210,113170210,Substitution,Ben Oosterbaan subbing out for St. Thomas-Minnesota,29,25,1st Half,2:49,False,2900,2025-03-09T09:24:03Z
401744203113170211,113170211,Substitution,Nolan Minessale subbing in for St. Thomas-Minnesota,29,25,1st Half,2:49,False,2900,2025-03-09T09:24:03Z
401744203113170213,113170213,Substitution,Rich Byhre subbing in for St. Thomas-Minnesota,29,25,1st Half,2:49,False,2900,2025-03-09T09:24:03Z
401744203113170214,113170214,Substitution,Treysen Eaglestaff subbing out for North Dakota,29,25,1st Half,2:49,False,155,2025-03-09T09:24:03Z
401744203113170215,113170215,Substitution,Mier Panoam subbing in for North Dakota,29,25,1st Half,2:49,False,155,2025-03-09T09:24:03Z
401744203113170221,113170221,MadeFreeThrow,Kendall Blue missed Free Throw.,29,25,1st Half,2:48,False,2900,2025-03-09T09:24:21Z
401744203113170222,113170222,Defensive Rebound,Eli King Defensive Rebound.,29,25,1st Half,2:48,False,155,2025-03-09T09:24:21Z
401744203113170248,113170248,Lost Ball Turnover,Amar Kuljuhovic Turnover.,29,25,1st Half,2:30,False,155,2025-03-09T09:24:40Z
401744203113170250,113170250,Steal,Kendall Blue Steal.,29,25,1st Half,2:30,False,2900,2025-03-09T09:24:40Z
401744203113170251,113170251,JumpShot,Kendall Blue made Three Point Jumper. Assisted by Miles Barnstable.,29,28,1st Half,2:22,True,2900,2025-03-09T09:24:48Z
401744203113170264,113170264,LayUpShot,Eli King made Layup. Assisted by Amar Kuljuhovic.,31,28,1st Half,1:51,True,155,2025-03-09T09:25:19Z
401744203113170296,113170296,JumpShot,Kendall Blue made Jumper.,31,30,1st Half,1:38,True,2900,2025-03-09T09:25:31Z
401744203113170307,113170307,JumpShot,Amar Kuljuhovic made Jumper.,33,30,1st Half,1:14,True,155,2025-03-09T09:25:55Z
401744203113170308,113170308,JumpShot,Kendall Blue missed Three Point Jumper.,33,30,1st Half,1:01,False,2900,2025-03-09T09:26:09Z
401744203113170311,113170311,Defensive Rebound,Mier Panoam Defensive Rebound.,33,30,1st Half,0:58,False,155,2025-03-09T09:26:11Z
401744203113170318,113170318,PersonalFoul,Foul on Mier Panoam.,33,30,1st Half,0:35,False,155,2025-03-09T09:26:37Z
401744203113170319,113170319,Lost Ball Turnover,Mier Panoam Turnover.,33,30,1st Half,0:35,False,155,2025-03-09T09:26:37Z
401744203113170348,113170348,Substitution,Zach Kraft subbing out for North Dakota,33,30,1st Half,0:35,False,155,2025-03-09T09:26:51Z
401744203113170349,113170349,Substitution,Amar Kuljuhovic subbing out for North Dakota,33,30,1st Half,0:35,False,155,2025-03-09T09:26:51Z
401744203113170350,113170350,Substitution,Mambourou Mara subbing in for North Dakota,33,30,1st Half,0:35,False,155,2025-03-09T09:26:51Z
401744203113170351,113170351,Substitution,Treysen Eaglestaff subbing in for North Dakota,33,30,1st Half,0:35,False,155,2025-03-09T09:26:51Z
401744203113170518,113170518,Substitution,Carter Bjerke subbing in for St. Thomas-Minnesota,33,30,1st Half,0:35,False,2900,2025-03-09T09:30:57Z
401744203113170519,113170519,Substitution,Rich Byhre subbing out for St. Thomas-Minnesota,33,30,1st Half,0:35,False,2900,2025-03-09T09:30:57Z
401744203113170360,113170360,JumpShot,Carter Bjerke made Three Point Jumper. Assisted by Drake Dobbs.,33,33,1st Half,0:13,True,2900,2025-03-09T09:27:25Z
401744203113170393,113170393,LayUpShot,Treysen Eaglestaff missed Layup.,33,33,1st Half,0:00,False,155,2025-03-09T09:27:38Z
401744203113170394,113170394,Dead Ball Rebound,North Dakota Deadball Team Rebound.,33,33,1st Half,0:00,False,155,2025-03-09T09:27:42Z
401744203113170395,113170395,End Period,End of 1st half,33,33,1st Half,0:00,False,,2025-03-09T09:27:43Z
401744203113170583,113170583,Substitution,Deng Mayar subbing out for North Dakota,33,33,2nd Half,20:00,False,155,2025-03-09T09:33:06Z
401744203113170584,113170584,Substitution,Amar Kuljuhovic subbing in for North Dakota,33,33,2nd Half,20:00,False,155,2025-03-09T09:33:06Z
401744203113170911,113170911,JumpShot,Miles Barnstable missed Three Point Jumper.,33,33,2nd Half,19:38,False,2900,2025-03-09T09:45:38Z
401744203113170912,113170912,Defensive Rebound,Eli King Defensive Rebound.,33,33,2nd Half,19:34,False,155,2025-03-09T09:45:41Z
401744203113170914,113170914,PersonalFoul,Foul on Carter Bjerke.,33,33,2nd Half,19:18,False,2900,2025-03-09T09:46:01Z
401744203113170920,113170920,MadeFreeThrow,Amar Kuljuhovic made Free Throw.,34,33,2nd Half,19:18,True,155,2025-03-09T09:46:30Z
401744203113170921,113170921,MadeFreeThrow,Amar Kuljuhovic missed Free Throw.,34,33,2nd Half,19:16,False,155,2025-03-09T09:46:49Z
401744203113170923,113170923,Offensive Rebound,Eli King Offensive Rebound.,34,33,2nd Half,19:14,False,155,2025-03-09T09:46:51Z
401744203113170924,113170924,LayUpShot,Eli King made Layup.,36,33,2nd Half,19:12,True,155,2025-03-09T09:46:53Z
401744203113170931,113170931,JumpShot,Carter Bjerke made Three Point Jumper. Assisted by Nolan Minessale.,36,36,2nd Half,18:59,True,2900,2025-03-09T09:47:07Z
401744203113170935,113170935,LayUpShot,Amar Kuljuhovic missed Layup.,36,36,2nd Half,18:41,False,155,2025-03-09T09:47:26Z
401744203113170936,113170936,Block Shot,Nolan Minessale Block.,36,36,2nd Half,18:41,False,2900,2025-03-09T09:47:26Z
401744203113170971,113170971,Offensive Rebound,Amar Kuljuhovic Offensive Rebound.,36,36,2nd Half,18:40,False,155,2025-03-09T09:47:31Z
401744203113170981,113170981,JumpShot,Mambourou Mara missed Jumper.,36,36,2nd Half,18:24,False,155,2025-03-09T09:47:53Z
401744203113170982,113170982,Block Shot,Nolan Minessale Block.,36,36,2nd Half,18:24,False,2900,2025-03-09T09:47:53Z
401744203113170983,113170983,Offensive Rebound,Mambourou Mara Offensive Rebound.,36,36,2nd Half,18:24,False,155,2025-03-09T09:47:56Z
401744203113171006,113171006,Lost Ball Turnover,North Dakota  Turnover.,36,36,2nd Half,18:24,False,155,2025-03-09T09:48:00Z
401744203113171011,113171011,PersonalFoul,Foul on Mier Panoam.,36,36,2nd Half,18:14,False,155,2025-03-09T09:48:19Z
401744203113171015,113171015,MadeFreeThrow,Drake Dobbs made Free Throw.,36,37,2nd Half,18:14,True,2900,2025-03-09T09:48:42Z
401744203113171017,113171017,MadeFreeThrow,Drake Dobbs made Free Throw.,36,38,2nd Half,18:14,True,2900,2025-03-09T09:48:53Z
401744203113171020,113171020,MadeFreeThrow,Drake Dobbs made Free Throw.,36,39,2nd Half,18:14,True,2900,2025-03-09T09:49:05Z
401744203113171047,113171047,LayUpShot,Eli King made Layup. Assisted by Amar Kuljuhovic.,38,39,2nd Half,18:00,True,155,2025-03-09T09:49:23Z
401744203113171052,113171052,JumpShot,Kendall Blue made Three Point Jumper. Assisted by Nolan Minessale.,38,42,2nd Half,17:44,True,2900,2025-03-09T09:49:40Z
401744203113171061,113171061,Lost Ball Turnover,Treysen Eaglestaff Turnover.,38,42,2nd Half,17:23,False,155,2025-03-09T09:50:00Z
401744203113171062,113171062,Steal,Kendall Blue Steal.,38,42,2nd Half,17:23,False,2900,2025-03-09T09:50:00Z
401744203113171063,113171063,LayUpShot,Drake Dobbs made Layup.,38,44,2nd Half,17:19,True,2900,2025-03-09T09:50:04Z
401744203113171065,113171065,LayUpShot,Amar Kuljuhovic made Layup. Assisted by Treysen Eaglestaff.,40,44,2nd Half,16:59,True,155,2025-03-09T09:50:25Z
401744203113171087,113171087,JumpShot,Carter Bjerke missed Three Point Jumper.,40,44,2nd Half,16:47,False,2900,2025-03-09T09:50:38Z
401744203113171088,113171088,Defensive Rebound,Amar Kuljuhovic Defensive Rebound.,40,44,2nd Half,16:43,False,155,2025-03-09T09:50:39Z
401744203113171090,113171090,Lost Ball Turnover,Treysen Eaglestaff Turnover.,40,44,2nd Half,16:37,False,155,2025-03-09T09:50:46Z
401744203113171091,113171091,Steal,Miles Barnstable Steal.,40,44,2nd Half,16:37,False,2900,2025-03-09T09:50:46Z
401744203113171092,113171092,LayUpShot,Carter Bjerke made Layup. Assisted by Drake Dobbs.,40,46,2nd Half,16:33,True,2900,2025-03-09T09:50:50Z
401744203113171071,113171071,PersonalFoul,Foul on Nolan Minessale.,40,46,2nd Half,16:10,False,2900,2025-03-09T09:51:16Z
401744203113171098,113171098,MadeFreeThrow,Mier Panoam missed Free Throw.,40,46,2nd Half,16:10,False,155,2025-03-09T09:51:40Z
401744203113171101,113171101,Dead Ball Rebound,North Dakota Deadball Team Rebound.,40,46,2nd Half,16:10,False,155,2025-03-09T09:51:40Z
401744203113171106,113171106,Substitution,Kendall Blue subbing out for St. Thomas-Minnesota,40,46,2nd Half,16:10,False,2900,2025-03-09T09:51:56Z
401744203113171107,113171107,Substitution,Carter Bjerke subbing out for St. Thomas-Minnesota,40,46,2nd Half,16:10,False,2900,2025-03-09T09:51:56Z
401744203113171108,113171108,Substitution,Ben Nau subbing in for St. Thomas-Minnesota,40,46,2nd Half,16:10,False,2900,2025-03-09T09:51:56Z
401744203113171109,113171109,Substitution,Rich Byhre subbing in for St. Thomas-Minnesota,40,46,2nd Half,16:10,False,2900,2025-03-09T09:51:56Z
401744203113171110,113171110,Substitution,Amar Kuljuhovic subbing out for North Dakota,40,46,2nd Half,16:10,False,155,2025-03-09T09:51:56Z
401744203113171111,113171111,Substitution,Mambourou Mara subbing out for North Dakota,40,46,2nd Half,16:10,False,155,2025-03-09T09:51:56Z
401744203113171112,113171112,Substitution,Dariyus Woodson subbing in for North Dakota,40,46,2nd Half,16:10,False,155,2025-03-09T09:51:56Z
401744203113171113,113171113,Substitution,Deng Mayar subbing in for North Dakota,40,46,2nd Half,16:10,False,155,2025-03-09T09:51:56Z
401744203113171116,113171116,MadeFreeThrow,Mier Panoam made Free Throw.,41,46,2nd Half,16:10,True,155,2025-03-09T09:52:03Z
401744203113171117,113171117,Substitution,Mier Panoam subbing out for North Dakota,41,46,2nd Half,16:10,False,155,2025-03-09T09:52:07Z
401744203113171118,113171118,Substitution,Zach Kraft subbing in for North Dakota,41,46,2nd Half,16:10,False,155,2025-03-09T09:52:07Z
401744203113171131,113171131,DunkShot,Nolan Minessale made Dunk.,41,48,2nd Half,15:50,True,2900,2025-03-09T09:52:38Z
401744203113171151,113171151,JumpShot,Deng Mayar missed Jumper.,41,48,2nd Half,15:30,False,155,2025-03-09T09:52:58Z
401744203113171152,113171152,Defensive Rebound,Ben Nau Defensive Rebound.,41,48,2nd Half,15:27,False,2900,2025-03-09T09:53:00Z
401744203113171153,113171153,PersonalFoul,Foul on Eli King.,41,48,2nd Half,15:16,False,155,2025-03-09T09:53:14Z
401744203113171155,113171155,OfficialTVTimeOut,Official TV Timeout,41,48,2nd Half,15:16,False,,2025-03-09T09:53:20Z
401744203113171156,113171156,Substitution,Nolan Minessale subbing out for St. Thomas-Minnesota,41,48,2nd Half,15:16,False,2900,2025-03-09T09:55:48Z
401744203113171157,113171157,Substitution,Miles Barnstable subbing out for St. Thomas-Minnesota,41,48,2nd Half,15:16,False,2900,2025-03-09T09:55:48Z
401744203113171158,113171158,Substitution,Kendall Blue subbing in for St. Thomas-Minnesota,41,48,2nd Half,15:16,False,2900,2025-03-09T09:55:48Z
401744203113171159,113171159,Substitution,Ben Oosterbaan subbing in for St. Thomas-Minnesota,41,48,2nd Half,15:16,False,2900,2025-03-09T09:55:48Z
401744203113171160,113171160,MadeFreeThrow,Rich Byhre made Free Throw.,41,49,2nd Half,15:16,True,2900,2025-03-09T09:56:24Z
401744203113171161,113171161,MadeFreeThrow,Rich Byhre made Free Throw.,41,50,2nd Half,15:16,True,2900,2025-03-09T09:56:37Z
401744203113171162,113171162,LayUpShot,Treysen Eaglestaff made Layup.,43,50,2nd Half,15:04,True,155,2025-03-09T09:56:52Z
401744203113171163,113171163,JumpShot,Rich Byhre missed Jumper.,43,50,2nd Half,14:42,False,2900,2025-03-09T09:57:14Z
401744203113171164,113171164,Defensive Rebound,Zach Kraft Defensive Rebound.,43,50,2nd Half,14:39,False,155,2025-03-09T09:57:17Z
401744203113171165,113171165,LayUpShot,Treysen Eaglestaff made Layup.,45,50,2nd Half,14:21,True,155,2025-03-09T09:57:35Z
401744203113171306,113171306,JumpShot,Ben Oosterbaan missed Three Point Jumper.,45,50,2nd Half,14:01,False,2900,2025-03-09T09:57:56Z
401744203113171307,113171307,Offensive Rebound,Rich Byhre Offensive Rebound.,45,50,2nd Half,13:57,False,2900,2025-03-09T09:57:59Z
401744203113171310,113171310,LayUpShot,Ben Oosterbaan made Layup. Assisted by Rich Byhre.,45,52,2nd Half,13:56,True,2900,2025-03-09T09:58:00Z
401744203113171312,113171312,Lost Ball Turnover,Zach Kraft Turnover.,45,52,2nd Half,13:41,False,155,2025-03-09T09:58:18Z
401744203113171314,113171314,Substitution,Ben Nau subbing out for St. Thomas-Minnesota,45,52,2nd Half,13:41,False,2900,2025-03-09T09:58:39Z
401744203113171316,113171316,Substitution,Drake Dobbs subbing out for St. Thomas-Minnesota,45,52,2nd Half,13:41,False,2900,2025-03-09T09:58:39Z
401744203113171317,113171317,Substitution,Rich Byhre subbing out for St. Thomas-Minnesota,45,52,2nd Half,13:41,False,2900,2025-03-09T09:58:39Z
401744203113171318,113171318,Substitution,Ryan Dufault subbing in for St. Thomas-Minnesota,45,52,2nd Half,13:41,False,2900,2025-03-09T09:58:39Z
401744203113171319,113171319,Substitution,Miles Barnstable subbing in for St. Thomas-Minnesota,45,52,2nd Half,13:41,False,2900,2025-03-09T09:58:39Z
401744203113171320,113171320,Substitution,Carter Bjerke subbing in for St. Thomas-Minnesota,45,52,2nd Half,13:41,False,2900,2025-03-09T09:58:39Z
401744203113171322,113171322,LayUpShot,Miles Barnstable made Layup.,45,54,2nd Half,13:25,True,2900,2025-03-09T09:59:05Z
401744203113171348,113171348,LayUpShot,Eli King made Layup.,47,54,2nd Half,13:05,True,155,2025-03-09T09:59:24Z
401744203113171349,113171349,LayUpShot,Kendall Blue made Layup.,47,56,2nd Half,12:54,True,2900,2025-03-09T09:59:36Z
401744203113171353,113171353,JumpShot,Eli King missed Three Point Jumper.,47,56,2nd Half,12:34,False,155,2025-03-09T09:59:57Z
401744203113171354,113171354,Defensive Rebound,Ben Oosterbaan Defensive Rebound.,47,56,2nd Half,12:29,False,2900,2025-03-09T10:00:00Z
401744203113171357,113171357,JumpShot,Kendall Blue made Jumper.,47,58,2nd Half,12:12,True,2900,2025-03-09T10:00:18Z
401744203113171363,113171363,JumpShot,Zach Kraft missed Three Point Jumper.,47,58,2nd Half,11:50,False,155,2025-03-09T10:00:41Z
401744203113171364,113171364,Defensive Rebound,Miles Barnstable Defensive Rebound.,47,58,2nd Half,11:47,False,2900,2025-03-09T10:00:42Z
401744203113171365,113171365,LayUpShot,Ryan Dufault missed Layup.,47,58,2nd Half,11:42,False,2900,2025-03-09T10:00:48Z
401744203113171386,113171386,Defensive Rebound,Dariyus Woodson Defensive Rebound.,47,58,2nd Half,11:40,False,155,2025-03-09T10:00:50Z
401744203113171387,113171387,Lost Ball Turnover,Dariyus Woodson Turnover.,47,58,2nd Half,11:36,False,155,2025-03-09T10:00:54Z
401744203113171388,113171388,Steal,Ryan Dufault Steal.,47,58,2nd Half,11:36,False,2900,2025-03-09T10:00:54Z
401744203113171389,113171389,LayUpShot,Ben Oosterbaan made Layup.,47,60,2nd Half,11:32,True,2900,2025-03-09T10:00:58Z
401744203113171391,113171391,Lost Ball Turnover,Treysen Eaglestaff Turnover.,47,60,2nd Half,11:18,False,155,2025-03-09T10:01:14Z
401744203113171392,113171392,Steal,Ryan Dufault Steal.,47,60,2nd Half,11:18,False,2900,2025-03-09T10:01:14Z
401744203113171393,113171393,OfficialTVTimeOut,Official TV Timeout,47,60,2nd Half,11:18,False,,2025-03-09T10:01:18Z
401744203113171398,113171398,Substitution,Dariyus Woodson subbing out for North Dakota,47,60,2nd Half,11:18,False,155,2025-03-09T10:04:07Z
401744203113171399,113171399,Substitution,Treysen Eaglestaff subbing out for North Dakota,47,60,2nd Half,11:18,False,155,2025-03-09T10:04:07Z
401744203113171400,113171400,Substitution,Mier Panoam subbing in for North Dakota,47,60,2nd Half,11:18,False,155,2025-03-09T10:04:07Z
401744203113171401,113171401,Substitution,Amar Kuljuhovic subbing in for North Dakota,47,60,2nd Half,11:18,False,155,2025-03-09T10:04:07Z
401744203113171403,113171403,LayUpShot,Carter Bjerke made Layup.,47,62,2nd Half,11:05,True,2900,2025-03-09T10:04:28Z
401744203113171405,113171405,Lost Ball Turnover,Deng Mayar Turnover.,47,62,2nd Half,10:55,False,155,2025-03-09T10:04:38Z
401744203113171446,113171446,Steal,Ryan Dufault Steal.,47,62,2nd Half,10:55,False,2900,2025-03-09T10:04:38Z
401744203113171459,113171459,LayUpShot,Ben Oosterbaan made Layup. Assisted by Ryan Dufault.,47,64,2nd Half,10:52,True,2900,2025-03-09T10:04:42Z
401744203113171463,113171463,JumpShot,Mier Panoam missed Jumper.,47,64,2nd Half,10:33,False,155,2025-03-09T10:05:00Z
401744203113171465,113171465,Offensive Rebound,North Dakota Offensive Rebound.,47,64,2nd Half,10:32,False,155,2025-03-09T10:05:03Z
401744203113171469,113171469,Substitution,Ryan Dufault subbing out for St. Thomas-Minnesota,47,64,2nd Half,10:32,False,2900,2025-03-09T10:05:22Z
401744203113171470,113171470,Substitution,Carter Bjerke subbing out for St. Thomas-Minnesota,47,64,2nd Half,10:32,False,2900,2025-03-09T10:05:22Z
401744203113171471,113171471,Substitution,Drake Dobbs subbing in for St. Thomas-Minnesota,47,64,2nd Half,10:32,False,2900,2025-03-09T10:05:22Z
401744203113171472,113171472,Substitution,Rich Byhre subbing in for St. Thomas-Minnesota,47,64,2nd Half,10:32,False,2900,2025-03-09T10:05:22Z
401744203113171473,113171473,Substitution,Zach Kraft subbing out for North Dakota,47,64,2nd Half,10:32,False,155,2025-03-09T10:05:22Z
401744203113171475,113171475,Substitution,Deng Mayar subbing out for North Dakota,47,64,2nd Half,10:32,False,155,2025-03-09T10:05:22Z
401744203113171477,113171477,Substitution,Mambourou Mara subbing in for North Dakota,47,64,2nd Half,10:32,False,155,2025-03-09T10:05:22Z
401744203113171478,113171478,Substitution,Treysen Eaglestaff subbing in for North Dakota,47,64,2nd Half,10:32,False,155,2025-03-09T10:05:22Z
401744203113171479,113171479,Lost Ball Turnover,Mier Panoam Turnover.,47,64,2nd Half,10:32,False,155,2025-03-09T10:05:29Z
401744203113171482,113171482,Substitution,Ben Oosterbaan subbing out for St. Thomas-Minnesota,47,64,2nd Half,10:32,False,2900,2025-03-09T10:05:46Z
401744203113171483,113171483,Substitution,Nolan Minessale subbing in for St. Thomas-Minnesota,47,64,2nd Half,10:32,False,2900,2025-03-09T10:05:46Z
401744203113171493,113171493,JumpShot,Kendall Blue missed Three Point Jumper.,47,64,2nd Half,10:17,False,2900,2025-03-09T10:06:08Z
401744203113171494,113171494,Defensive Rebound,Amar Kuljuhovic Defensive Rebound.,47,64,2nd Half,10:14,False,155,2025-03-09T10:06:10Z
401744203113171496,113171496,LayUpShot,Mier Panoam made Layup.,49,64,2nd Half,10:03,True,155,2025-03-09T10:06:22Z
401744203113171499,113171499,LayUpShot,Nolan Minessale made Layup.,49,66,2nd Half,9:41,True,2900,2025-03-09T10:06:43Z
401744203113171526,113171526,LayUpShot,Amar Kuljuhovic missed Layup.,49,66,2nd Half,9:22,False,155,2025-03-09T10:07:02Z
401744203113171527,113171527,Offensive Rebound,Eli King Offensive Rebound.,49,66,2nd Half,9:22,False,155,2025-03-09T10:07:06Z
401744203113171528,113171528,TipShot,Eli King made Two Point Tip Shot.,51,66,2nd Half,9:22,True,155,2025-03-09T10:07:06Z
401744203113171533,113171533,PersonalFoul,Foul on Rich Byhre.,51,66,2nd Half,9:22,False,2900,2025-03-09T10:07:07Z
401744203113171537,113171537,Substitution,Kendall Blue subbing out for St. Thomas-Minnesota,51,66,2nd Half,9:22,False,2900,2025-03-09T10:07:47Z
401744203113171538,113171538,Substitution,Ben Nau subbing in for St. Thomas-Minnesota,51,66,2nd Half,9:22,False,2900,2025-03-09T10:07:47Z
401744203113171539,113171539,MadeFreeThrow,Eli King missed Free Throw.,51,66,2nd Half,9:21,False,155,2025-03-09T10:07:28Z
401744203113171541,113171541,Offensive Rebound,Mambourou Mara Offensive Rebound.,51,66,2nd Half,9:21,False,155,2025-03-09T10:07:29Z
401744203113171545,113171545,LayUpShot,Mambourou Mara made Layup.,53,66,2nd Half,9:18,True,155,2025-03-09T10:07:32Z
401744203113171548,113171548,JumpShot,Ben Nau missed Three Point Jumper.,53,66,2nd Half,8:56,False,2900,2025-03-09T10:07:54Z
401744203113171549,113171549,Defensive Rebound,Mambourou Mara Defensive Rebound.,53,66,2nd Half,8:54,False,155,2025-03-09T10:07:56Z
401744203113171573,113171573,LayUpShot,Mier Panoam made Layup. Assisted by Amar Kuljuhovic.,55,66,2nd Half,8:41,True,155,2025-03-09T10:08:11Z
401744203113171575,113171575,PersonalFoul,Foul on Nolan Minessale.,55,66,2nd Half,8:41,False,2900,2025-03-09T10:08:14Z
401744203113171578,113171578,Substitution,Rich Byhre subbing out for St. Thomas-Minnesota,55,66,2nd Half,8:41,False,2900,2025-03-09T10:08:29Z
401744203113171579,113171579,Substitution,Carter Bjerke subbing in for St. Thomas-Minnesota,55,66,2nd Half,8:41,False,2900,2025-03-09T10:08:29Z
401744203113171581,113171581,MadeFreeThrow,Mier Panoam made Free Throw.,56,66,2nd Half,8:41,True,155,2025-03-09T10:08:40Z
401744203113171591,113171591,JumpShot,Miles Barnstable made Three Point Jumper.,56,69,2nd Half,8:18,True,2900,2025-03-09T10:09:08Z
401744203113171599,113171599,Lost Ball Turnover,Mier Panoam Turnover.,56,69,2nd Half,8:01,False,155,2025-03-09T10:09:25Z
401744203113171601,113171601,Steal,Miles Barnstable Steal.,56,69,2nd Half,8:01,False,2900,2025-03-09T10:09:25Z
401744203113171604,113171604,ShortTimeOut,St. Thomas-Minnesota Timeout,56,69,2nd Half,7:56,False,2900,2025-03-09T10:09:35Z
401744203113171605,113171605,OfficialTVTimeOut,Official TV Timeout,56,69,2nd Half,7:56,False,,2025-03-09T10:09:37Z
401744203113171692,113171692,Substitution,Amar Kuljuhovic subbing out for North Dakota,56,69,2nd Half,7:56,False,155,2025-03-09T10:12:00Z
401744203113171693,113171693,Substitution,Deng Mayar subbing in for North Dakota,56,69,2nd Half,7:56,False,155,2025-03-09T10:12:00Z
401744203113171702,113171702,DunkShot,Miles Barnstable made Dunk. Assisted by Drake Dobbs.,56,71,2nd Half,7:48,True,2900,2025-03-09T10:12:19Z
401744203113171727,113171727,JumpShot,Treysen Eaglestaff missed Three Point Jumper.,56,71,2nd Half,7:24,False,155,2025-03-09T10:12:43Z
401744203113171728,113171728,Defensive Rebound,Miles Barnstable Defensive Rebound.,56,71,2nd Half,7:20,False,2900,2025-03-09T10:12:46Z
401744203113171729,113171729,PersonalFoul,Foul on Mambourou Mara.,56,71,2nd Half,7:09,False,155,2025-03-09T10:13:08Z
401744203113171734,113171734,OfficialTVTimeOut,Official TV Timeout,56,71,2nd Half,7:09,False,,2025-03-09T10:13:12Z
401744203113171790,113171790,Substitution,Ben Nau subbing out for St. Thomas-Minnesota,56,71,2nd Half,7:09,False,2900,2025-03-09T10:15:30Z
401744203113171791,113171791,Substitution,Kendall Blue subbing in for St. Thomas-Minnesota,56,71,2nd Half,7:09,False,2900,2025-03-09T10:15:30Z
401744203113171792,113171792,Substitution,Deng Mayar subbing out for North Dakota,56,71,2nd Half,7:09,False,155,2025-03-09T10:15:30Z
401744203113171793,113171793,Substitution,Amar Kuljuhovic subbing in for North Dakota,56,71,2nd Half,7:09,False,155,2025-03-09T10:15:30Z
401744203113171798,113171798,LayUpShot,Kendall Blue made Layup.,56,73,2nd Half,6:53,True,2900,2025-03-09T10:16:04Z
401744203113171800,113171800,Lost Ball Turnover,Amar Kuljuhovic Turnover.,56,73,2nd Half,6:32,False,155,2025-03-09T10:16:26Z
401744203113171801,113171801,Steal,Nolan Minessale Steal.,56,73,2nd Half,6:32,False,2900,2025-03-09T10:16:26Z
401744203113171802,113171802,JumpShot,Miles Barnstable made Three Point Jumper. Assisted by Carter Bjerke.,56,76,2nd Half,6:17,True,2900,2025-03-09T10:16:50Z
401744203113171804,113171804,PersonalFoul,Foul on Mambourou Mara.,56,76,2nd Half,6:17,False,155,2025-03-09T10:16:53Z
401744203113171846,113171846,MadeFreeThrow,Miles Barnstable made Free Throw.,56,77,2nd Half,6:17,True,2900,2025-03-09T10:17:14Z
401744203113171847,113171847,JumpShot,Amar Kuljuhovic made Jumper. Assisted by Eli King.,58,77,2nd Half,6:02,True,155,2025-03-09T10:17:33Z
401744203113171849,113171849,PersonalFoul,Foul on Nolan Minessale.,58,77,2nd Half,6:02,False,2900,2025-03-09T10:17:36Z
401744203113171851,113171851,Substitution,Mambourou Mara subbing out for North Dakota,58,77,2nd Half,6:02,False,155,2025-03-09T10:17:46Z
401744203113171852,113171852,Substitution,Dariyus Woodson subbing in for North Dakota,58,77,2nd Half,6:02,False,155,2025-03-09T10:17:46Z
401744203113171853,113171853,MadeFreeThrow,Amar Kuljuhovic made Free Throw.,59,77,2nd Half,6:02,True,155,2025-03-09T10:18:01Z
401744203113171857,113171857,JumpShot,Kendall Blue missed Jumper.,59,77,2nd Half,5:37,False,2900,2025-03-09T10:18:30Z
401744203113171860,113171860,Defensive Rebound,Amar Kuljuhovic Defensive Rebound.,59,77,2nd Half,5:34,False,155,2025-03-09T10:18:32Z
401744203113171861,113171861,JumpShot,Mier Panoam missed Jumper.,59,77,2nd Half,5:27,False,155,2025-03-09T10:18:39Z
401744203113171862,113171862,Offensive Rebound,Mier Panoam Offensive Rebound.,59,77,2nd Half,5:22,False,155,2025-03-09T10:18:44Z
401744203113171863,113171863,TipShot,Mier Panoam missed Two Point Tip Shot.,59,77,2nd Half,5:22,False,155,2025-03-09T10:18:44Z
401744203113171864,113171864,Block Shot,Kendall Blue Block.,59,77,2nd Half,5:22,False,2900,2025-03-09T10:18:44Z
401744203113171865,113171865,Offensive Rebound,Dariyus Woodson Offensive Rebound.,59,77,2nd Half,5:20,False,155,2025-03-09T10:18:46Z
401744203113171886,113171886,LayUpShot,Dariyus Woodson missed Layup.,59,77,2nd Half,5:19,False,155,2025-03-09T10:18:48Z
401744203113171887,113171887,Defensive Rebound,Carter Bjerke Defensive Rebound.,59,77,2nd Half,5:16,False,2900,2025-03-09T10:18:50Z
401744203113171892,113171892,Lost Ball Turnover,Nolan Minessale Turnover.,59,77,2nd Half,4:53,False,2900,2025-03-09T10:19:16Z
401744203113171895,113171895,Substitution,Nolan Minessale subbing out for St. Thomas-Minnesota,59,77,2nd Half,4:53,False,2900,2025-03-09T10:19:37Z
401744203113171896,113171896,Substitution,Drake Dobbs subbing out for St. Thomas-Minnesota,59,77,2nd Half,4:53,False,2900,2025-03-09T10:19:37Z
401744203113171897,113171897,Substitution,Miles Barnstable subbing out for St. Thomas-Minnesota,59,77,2nd Half,4:53,False,2900,2025-03-09T10:19:37Z
401744203113171898,113171898,Substitution,Ben Nau subbing in for St. Thomas-Minnesota,59,77,2nd Half,4:53,False,2900,2025-03-09T10:19:37Z
401744203113171899,113171899,Substitution,Ryan Dufault subbing in for St. Thomas-Minnesota,59,77,2nd Half,4:53,False,2900,2025-03-09T10:19:37Z
