play_id,sequence_number,type,description,away_score,home_score,period,clock,scoring_play,team_id,timestamp_utc
401711753102855001,102855001,LayUpShot,Josh Massey missed Layup.,52,53,2nd Half,14:49,False,56,2024-11-05T01:14:29Z
401711753102855002,102855002,Offensive Rebound,Daniel Macgregor Offensive Rebound.,52,53,2nd Half,14:49,False,56,2024-11-05T01:14:29Z
401711753102855003,102855003,PersonalFoul,Foul on Jordan Clark.,52,53,2nd Half,14:49,False,128550,2024-11-05T01:14:29Z
401711753102855601,102855601,JumpShot,Jamie Phillips Jr. made Jumper. Assisted by Josh Massey.,52,55,2nd Half,14:43,True,56,2024-11-05T01:16:28Z
401711753102858701,102858701,JumpShot,Caleb Kozinski missed Three Point Jumper.,52,55,2nd Half,14:12,False,128550,2024-11-05T01:16:28Z
401711753102859101,102859101,Defensive Rebound,Daniel Macgregor Defensive Rebound.,52,55,2nd Half,14:08,False,56,2024-11-05T01:16:28Z
401711753102859701,102859701,JumpShot,Josh Massey made Three Point Jumper.,52,58,2nd Half,14:02,True,56,2024-11-05T01:16:28Z
401711753102867101,102867101,JumpShot,Jack Scott missed Jumper.,52,58,2nd Half,13:28,False,128550,2024-11-05T01:16:28Z
401711753102867501,102867501,Defensive Rebound,Josh Massey Defensive Rebound.,52,58,2nd Half,13:24,False,56,2024-11-05T01:16:28Z
401711753102867901,102867901,LayUpShot,Alex Doyle made Layup.,52,60,2nd Half,13:20,True,56,2024-11-05T01:16:28Z
401711753102874201,102874201,JumpShot,Adrian Moore made Jumper.,54,60,2nd Half,12:57,True,128550,2024-11-05T01:16:28Z
401711753102874301,102874301,ShortTimeOut,New College (FL)  Timeout,54,60,2nd Half,12:56,False,128550,2024-11-05T01:16:28Z
401711753102875601,102875601,JumpShot,Josh Massey missed Three Point Jumper.,54,60,2nd Half,12:43,False,56,2024-11-05T01:20:27Z
401711753102876201,102876201,Offensive Rebound,Jamie Phillips Jr. Offensive Rebound.,54,60,2nd Half,12:37,False,56,2024-11-05T01:20:27Z
401711753102876202,102876202,JumpShot,Jamie Phillips Jr. made Jumper.,54,62,2nd Half,12:37,True,56,2024-11-05T01:20:27Z
401711753102878201,102878201,JumpShot,Charlie Yoder missed Three Point Jumper.,54,62,2nd Half,12:17,False,128550,2024-11-05T01:20:27Z
401711753102878601,102878601,Defensive Rebound,Jamie Phillips Jr. Defensive Rebound.,54,62,2nd Half,12:13,False,56,2024-11-05T01:20:27Z
401711753102879101,102879101,JumpShot,Daniel Macgregor missed Three Point Jumper.,54,62,2nd Half,12:08,False,56,2024-11-05T01:20:27Z
401711753102879201,102879201,Offensive Rebound,Alex Doyle Offensive Rebound.,54,62,2nd Half,12:07,False,56,2024-11-05T01:20:27Z
401711753102879202,102879202,PersonalFoul,Foul on Adrian Moore.,54,62,2nd Half,12:07,False,128550,2024-11-05T01:20:27Z
401711753102879501,102879501,PersonalFoul,Foul on Jack Scott.,54,62,2nd Half,12:04,False,128550,2024-11-05T01:20:27Z
401711753102879502,102879502,MadeFreeThrow,Jamie Phillips Jr. made Free Throw.,54,63,2nd Half,12:04,True,56,2024-11-05T01:20:27Z
401711753102879503,102879503,MadeFreeThrow,Jamie Phillips Jr. missed Free Throw.,54,63,2nd Half,12:04,False,56,2024-11-05T01:20:27Z
401711753102879801,102879801,Defensive Rebound,Jordan Clark Defensive Rebound.,54,63,2nd Half,12:01,False,128550,2024-11-05T01:20:27Z
401711753102884501,102884501,JumpShot,Charlie Yoder made Three Point Jumper. Assisted by Jordan Clark.,57,63,2nd Half,11:54,True,128550,2024-11-05T01:20:27Z
401711753102886901,102886901,JumpShot,Alex Doyle made Jumper.,57,65,2nd Half,11:30,True,56,2024-11-05T01:20:27Z
401711753102889501,102889501,JumpShot,Charlie Yoder missed Jumper.,57,65,2nd Half,11:04,False,128550,2024-11-05T01:22:56Z
401711753102889901,102889901,Defensive Rebound,Jamie Phillips Jr. Defensive Rebound.,57,65,2nd Half,11:00,False,56,2024-11-05T01:22:56Z
401711753102895401,102895401,JumpShot,Jamie Phillips Jr. made Jumper.,57,67,2nd Half,10:45,True,56,2024-11-05T01:22:56Z
401711753102895402,102895402,PersonalFoul,Foul on Caleb Kozinski.,57,67,2nd Half,10:45,False,128550,2024-11-05T01:22:56Z
401711753102895403,102895403,OfficialTVTimeOut, Official TV Timeout,57,67,2nd Half,10:45,False,,2024-11-05T01:22:56Z
401711753102895404,102895404,MadeFreeThrow,Jamie Phillips Jr. made Free Throw.,57,68,2nd Half,10:45,True,56,2024-11-05T01:22:56Z
401711753102898101,102898101,JumpShot,Diego Eslava missed Three Point Jumper.,57,68,2nd Half,10:18,False,128550,2024-11-05T01:24:33Z
401711753102898401,102898401,Defensive Rebound,Tristan Gross Defensive Rebound.,57,68,2nd Half,10:15,False,56,2024-11-05T01:24:33Z
401711753102899101,102899101,JumpShot,Tristan Gross made Three Point Jumper.,57,71,2nd Half,10:08,True,56,2024-11-05T01:24:33Z
401711753102906101,102906101,JumpShot,Jack Scott missed Jumper.,57,71,2nd Half,9:38,False,128550,2024-11-05T01:26:29Z
401711753102906401,102906401,Defensive Rebound,Josh Massey Defensive Rebound.,57,71,2nd Half,9:35,False,56,2024-11-05T01:26:29Z
401711753102906801,102906801,JumpShot,Josh Massey made Jumper.,57,73,2nd Half,9:31,True,56,2024-11-05T01:26:29Z
401711753102908401,102908401,JumpShot,Jack Scott missed Three Point Jumper.,57,73,2nd Half,9:15,False,128550,2024-11-05T01:26:29Z
401711753102908701,102908701,Defensive Rebound,Daniel Macgregor Defensive Rebound.,57,73,2nd Half,9:12,False,56,2024-11-05T01:26:29Z
401711753102909001,102909001,LayUpShot,Tristan Gross made Layup. Assisted by Daniel Macgregor.,57,75,2nd Half,9:09,True,56,2024-11-05T01:26:29Z
401711753102909601,102909601,PersonalFoul,Foul on Daniel Macgregor.,57,75,2nd Half,9:03,False,56,2024-11-05T01:26:29Z
401711753102914501,102914501,JumpShot,Adrian Moore missed Three Point Jumper.,57,75,2nd Half,8:54,False,128550,2024-11-05T01:26:29Z
401711753102914801,102914801,Defensive Rebound,Jamie Phillips Jr. Defensive Rebound.,57,75,2nd Half,8:51,False,56,2024-11-05T01:26:29Z
401711753102915201,102915201,JumpShot,Josh Massey missed Three Point Jumper.,57,75,2nd Half,8:47,False,56,2024-11-05T01:26:29Z
401711753102915601,102915601,Defensive Rebound,Jordan Clark Defensive Rebound.,57,75,2nd Half,8:43,False,128550,2024-11-05T01:26:29Z
401711753102916301,102916301,LayUpShot,Jordan Clark missed Layup.,57,75,2nd Half,8:36,False,128550,2024-11-05T01:26:29Z
401711753102916302,102916302,Block Shot,Alex Doyle Block.,57,75,2nd Half,8:36,False,56,2024-11-05T01:26:29Z
401711753102916601,102916601,Defensive Rebound,Josh Massey Defensive Rebound.,57,75,2nd Half,8:33,False,56,2024-11-05T01:26:29Z
401711753102916602,102916602,PersonalFoul,Foul on Diego Eslava.,57,75,2nd Half,8:33,False,128550,2024-11-05T01:26:29Z
401711753102916603,102916603,MadeFreeThrow,Josh Massey made Free Throw.,57,76,2nd Half,8:33,True,56,2024-11-05T01:26:29Z
401711753102916604,102916604,MadeFreeThrow,Josh Massey made Free Throw.,57,77,2nd Half,8:33,True,56,2024-11-05T01:26:29Z
401711753102918201,102918201,JumpShot,Jordan Clark made Three Point Jumper. Assisted by Zach Close.,60,77,2nd Half,8:17,True,128550,2024-11-05T01:28:28Z
401711753102919701,102919701,JumpShot,Mehki Ellison missed Jumper.,60,77,2nd Half,8:02,False,56,2024-11-05T01:28:28Z
401711753102924401,102924401,Offensive Rebound,Jordan Wood Offensive Rebound.,60,77,2nd Half,7:55,False,56,2024-11-05T01:28:28Z
401711753102924402,102924402,JumpShot,Jordan Wood made Jumper.,60,79,2nd Half,7:55,True,56,2024-11-05T01:28:28Z
401711753102926101,102926101,JumpShot,Jordan Clark made Three Point Jumper. Assisted by Charlie Yoder.,63,79,2nd Half,7:38,True,128550,2024-11-05T01:33:56Z
401711753102928401,102928401,LayUpShot,Jamie Phillips Jr. made Layup.,63,81,2nd Half,7:15,True,56,2024-11-05T01:33:56Z
401711753102929801,102929801,JumpShot,Jordan Clark missed Three Point Jumper.,63,81,2nd Half,7:01,False,128550,2024-11-05T01:33:56Z
401711753102934301,102934301,Offensive Rebound,Charlie Yoder Offensive Rebound.,63,81,2nd Half,6:56,False,128550,2024-11-05T01:33:56Z
401711753102934401,102934401,LayUpShot,Charlie Yoder missed Layup.,63,81,2nd Half,6:55,False,128550,2024-11-05T01:33:56Z
401711753102934701,102934701,Offensive Rebound,Charlie Yoder Offensive Rebound.,63,81,2nd Half,6:52,False,128550,2024-11-05T01:33:56Z
401711753102934901,102934901,LayUpShot,Charlie Yoder made Layup.,65,81,2nd Half,6:50,True,128550,2024-11-05T01:33:56Z
401711753102935301,102935301,LayUpShot,Mehki Ellison missed Layup.,65,81,2nd Half,6:46,False,56,2024-11-05T01:33:56Z
401711753102935302,102935302,Block Shot,Zach Close Block.,65,81,2nd Half,6:46,False,128550,2024-11-05T01:33:56Z
401711753102935801,102935801,Defensive Rebound,Charlie Yoder Defensive Rebound.,65,81,2nd Half,6:41,False,128550,2024-11-05T01:33:56Z
401711753102935901,102935901,Lost Ball Turnover,Zach Close Turnover.,65,81,2nd Half,6:40,False,128550,2024-11-05T01:33:56Z
401711753102935902,102935902,OfficialTVTimeOut, Official TV Timeout,65,81,2nd Half,6:40,False,,2024-11-05T01:33:56Z
401711753102937801,102937801,Lost Ball Turnover,Jordan Wood Turnover.,65,81,2nd Half,6:21,False,56,2024-11-05T01:33:56Z
401711753102937802,102937802,Steal,Jordan Clark Steal.,65,81,2nd Half,6:21,False,128550,2024-11-05T01:33:56Z
401711753102938401,102938401,LayUpShot,Charlie Yoder missed Layup.,65,81,2nd Half,6:15,False,128550,2024-11-05T01:33:56Z
401711753102938402,102938402,Block Shot,Tristan Gross Block.,65,81,2nd Half,6:15,False,56,2024-11-05T01:33:56Z
401711753102938901,102938901,Defensive Rebound,Abramo Canka Defensive Rebound.,65,81,2nd Half,6:10,False,56,2024-11-05T01:33:56Z
401711753102944801,102944801,JumpShot,Tristan Gross missed Three Point Jumper.,65,81,2nd Half,5:51,False,56,2024-11-05T01:33:56Z
401711753102945001,102945001,Offensive Rebound,Abramo Canka Offensive Rebound.,65,81,2nd Half,5:49,False,56,2024-11-05T01:33:56Z
401711753102945101,102945101,LayUpShot,Abramo Canka missed Layup.,65,81,2nd Half,5:48,False,56,2024-11-05T01:33:56Z
401711753102945401,102945401,Defensive Rebound,Adrian Moore Defensive Rebound.,65,81,2nd Half,5:45,False,128550,2024-11-05T01:33:56Z
401711753102945501,102945501,Lost Ball Turnover,Charlie Yoder Turnover.,65,81,2nd Half,5:44,False,128550,2024-11-05T01:33:05Z
401711753102946801,102946801,JumpShot,Mehki Ellison made Jumper.,65,83,2nd Half,5:31,True,56,2024-11-05T01:33:56Z
401711753102948201,102948201,JumpShot,Adrian Moore missed Jumper.,65,83,2nd Half,5:17,False,128550,2024-11-05T01:33:56Z
401711753102948601,102948601,Defensive Rebound,Abramo Canka Defensive Rebound.,65,83,2nd Half,5:13,False,56,2024-11-05T01:33:56Z
401711753102949501,102949501,JumpShot,Abramo Canka missed Three Point Jumper.,65,83,2nd Half,5:04,False,56,2024-11-05T01:33:56Z
401711753102954001,102954001,Offensive Rebound,Alex Doyle Offensive Rebound.,65,83,2nd Half,4:59,False,56,2024-11-05T01:33:56Z
401711753102954002,102954002,JumpShot,Alex Doyle missed Jumper.,65,83,2nd Half,4:59,False,56,2024-11-05T01:33:56Z
401711753102954101,102954101,Offensive Rebound,Alex Doyle Offensive Rebound.,65,83,2nd Half,4:58,False,56,2024-11-05T01:33:56Z
401711753102954401,102954401,LayUpShot,Abramo Canka made Layup.,65,85,2nd Half,4:55,True,56,2024-11-05T01:33:56Z
401711753102956001,102956001,Lost Ball Turnover,Jordan Clark Turnover.,65,85,2nd Half,4:39,False,128550,2024-11-05T01:33:56Z
401711753102956002,102956002,Steal,Mehki Ellison Steal.,65,85,2nd Half,4:39,False,56,2024-11-05T01:33:56Z
401711753102957301,102957301,Lost Ball Turnover,Mehki Ellison Turnover.,65,85,2nd Half,4:26,False,56,2024-11-05T01:35:03Z
401711753102958601,102958601,JumpShot,Adonis Caneris missed Three Point Jumper.,65,85,2nd Half,4:13,False,128550,2024-11-05T01:36:30Z
401711753102958901,102958901,Defensive Rebound,Mehki Ellison Defensive Rebound.,65,85,2nd Half,4:10,False,56,2024-11-05T01:36:30Z
401711753102958902,102958902,PersonalFoul,Foul on Jonathan Olodude.,65,85,2nd Half,4:10,False,128550,2024-11-05T01:36:30Z
401711753102958903,102958903,MadeFreeThrow,Mehki Ellison missed Free Throw.,65,85,2nd Half,4:10,False,56,2024-11-05T01:36:30Z
401711753102959101,102959101,Defensive Rebound,Jonathan Olodude Defensive Rebound.,65,85,2nd Half,4:08,False,128550,2024-11-05T01:36:30Z
401711753102965101,102965101,Lost Ball Turnover,Diego Eslava Turnover.,65,85,2nd Half,3:48,False,128550,2024-11-05T01:37:05Z
401711753102965102,102965102,Steal,Jordan Wood Steal.,65,85,2nd Half,3:48,False,56,2024-11-05T01:37:05Z
401711753102965601,102965601,JumpShot,Tristan Gross made Jumper. Assisted by Jordan Wood.,65,87,2nd Half,3:43,True,56,2024-11-05T01:37:05Z
401711753102967101,102967101,PersonalFoul,Foul on Josh Massey.,65,87,2nd Half,3:28,False,56,2024-11-05T01:37:05Z
401711753102968101,102968101,JumpShot,Adonis Caneris missed Three Point Jumper.,65,87,2nd Half,3:18,False,128550,2024-11-05T01:40:28Z
401711753102968401,102968401,Defensive Rebound,Abramo Canka Defensive Rebound.,65,87,2nd Half,3:15,False,56,2024-11-05T01:40:28Z
401711753102968901,102968901,DunkShot,Josh Massey made Dunk. Assisted by Abramo Canka.,65,89,2nd Half,3:10,True,56,2024-11-05T01:40:28Z
401711753102974601,102974601,PersonalFoul,Foul on Abramo Canka.,65,89,2nd Half,2:53,False,56,2024-11-05T01:40:28Z
401711753102975001,102975001,JumpShot,Ben Walker made Three Point Jumper.,68,89,2nd Half,2:49,True,128550,2024-11-05T01:40:28Z
401711753102975901,102975901,ShortTimeOut,Stetson  Timeout,68,89,2nd Half,2:40,False,56,2024-11-05T01:40:28Z
401711753102976501,102976501,Lost Ball Turnover,Daniel Macgregor Turnover.,68,89,2nd Half,2:34,False,56,2024-11-05T01:41:04Z
401711753102976502,102976502,Steal,Adonis Caneris Steal.,68,89,2nd Half,2:34,False,128550,2024-11-05T01:41:04Z
401711753102977401,102977401,Lost Ball Turnover,Ben Walker Turnover.,68,89,2nd Half,2:25,False,128550,2024-11-05T01:42:33Z
401711753102979301,102979301,LayUpShot,Josh Massey missed Layup.,68,89,2nd Half,2:06,False,56,2024-11-05T01:42:33Z
401711753102979501,102979501,Offensive Rebound,Josh Massey Offensive Rebound.,68,89,2nd Half,2:04,False,56,2024-11-05T01:42:33Z
401711753102984101,102984101,JumpShot,Abramo Canka missed Three Point Jumper.,68,89,2nd Half,1:58,False,56,2024-11-05T01:42:33Z
401711753102984601,102984601,Defensive Rebound,Caleb Kozinski Defensive Rebound.,68,89,2nd Half,1:53,False,128550,2024-11-05T01:42:33Z
401711753102985001,102985001,JumpShot,Ben Walker made Three Point Jumper. Assisted by Caleb Kozinski.,71,89,2nd Half,1:49,True,128550,2024-11-05T01:42:33Z
401711753102985301,102985301,RegularTimeOut,New College (FL)  Timeout,71,89,2nd Half,1:46,False,128550,2024-11-05T01:42:33Z
401711753102985601,102985601,PersonalFoul,Foul on Caleb Kozinski.,71,89,2nd Half,1:43,False,128550,2024-11-05T01:44:27Z
401711753102985602,102985602,MadeFreeThrow,Daniel Macgregor made Free Throw.,71,90,2nd Half,1:43,True,56,2024-11-05T01:44:27Z
401711753102985603,102985603,MadeFreeThrow,Daniel Macgregor made Free Throw.,71,91,2nd Half,1:43,True,56,2024-11-05T01:44:27Z
401711753102986801,102986801,Lost Ball Turnover,Jonathan Olodude Turnover.,71,91,2nd Half,1:31,False,128550,2024-11-05T01:46:29Z
401711753102986802,102986802,Steal,Abramo Canka Steal.,71,91,2nd Half,1:31,False,56,2024-11-05T01:46:29Z
401711753102986901,102986901,Lost Ball Turnover,Abramo Canka Turnover.,71,91,2nd Half,1:30,False,56,2024-11-05T01:46:29Z
401711753102988401,102988401,JumpShot,Jonathan Olodude missed Jumper.,71,91,2nd Half,1:15,False,128550,2024-11-05T01:46:29Z
401711753102988801,102988801,Offensive Rebound,Jonathan Olodude Offensive Rebound.,71,91,2nd Half,1:11,False,128550,2024-11-05T01:46:29Z
401711753102988802,102988802,PersonalFoul,Foul on Stefano Alesso.,71,91,2nd Half,1:11,False,56,2024-11-05T01:46:29Z
401711753102988803,102988803,MadeFreeThrow,Caden Dewey made Free Throw.,72,91,2nd Half,1:11,True,128550,2024-11-05T01:46:29Z
401711753102988804,102988804,MadeFreeThrow,Caden Dewey missed Free Throw.,72,91,2nd Half,1:11,False,128550,2024-11-05T01:46:29Z
401711753102988901,102988901,Defensive Rebound,Stefano Alesso Defensive Rebound.,72,91,2nd Half,1:10,False,56,2024-11-05T01:46:29Z
401711753102989501,102989501,Lost Ball Turnover,Stefano Alesso Turnover.,72,91,2nd Half,1:04,False,56,2024-11-05T01:46:29Z
401711753102994701,102994701,PersonalFoul,Foul on Landen Babusiak.,72,91,2nd Half,0:52,False,56,2024-11-05T01:47:04Z
401711753102994702,102994702,MadeFreeThrow,Jonathan Olodude made Free Throw.,73,91,2nd Half,0:52,True,128550,2024-11-05T01:47:04Z
401711753102994703,102994703,MadeFreeThrow,Jonathan Olodude missed Free Throw.,73,91,2nd Half,0:52,False,128550,2024-11-05T01:47:04Z
401711753102994901,102994901,Defensive Rebound,Stefano Alesso Defensive Rebound.,73,91,2nd Half,0:50,False,56,2024-11-05T01:48:28Z
401711753102996001,102996001,Lost Ball Turnover,Landen Babusiak Turnover.,73,91,2nd Half,0:39,False,56,2024-11-05T01:48:28Z
401711753102997501,102997501,JumpShot,Giovanni Toscanini made Jumper. Assisted by Ben Walker.,75,91,2nd Half,0:24,True,128550,2024-11-05T01:48:28Z
401711753102997502,102997502,PersonalFoul,Foul on Caleb Kozinski.,75,91,2nd Half,0:24,False,128550,2024-11-05T01:48:28Z
401711753102997601,102997601,MadeFreeThrow,Daniel Macgregor missed Free Throw.,75,91,2nd Half,0:23,False,56,2024-11-05T01:48:28Z
401711753102997602,102997602,Offensive Rebound,Stetson Offensive Rebound.,75,91,2nd Half,0:23,False,56,2024-11-05T01:48:28Z
