play_id,sequence_number,type,description,away_score,home_score,period,clock,scoring_play,team_id,timestamp_utc
401721246111996303,111996303,MadeFreeThrow,Greg Moore made Free Throw.,59,46,2nd Half,7:54,True,2400,2025-02-16T07:11:33Z
401721246111996305,111996305,Substitution,Angok Anyang subbing out for Alabama A&M,59,46,2nd Half,7:45,False,2010,2025-02-16T07:11:47Z
401721246111996306,111996306,Substitution,Chad Moodie subbing in for Alabama A&M,59,46,2nd Half,7:45,False,2010,2025-02-16T07:11:47Z
401721246111996308,111996308,JumpShot,Lorenzo Downey made Three Point Jumper. Assisted by Bilal Abdur-Rahman.,62,46,2nd Half,7:36,True,2010,2025-02-16T07:11:54Z
401721246111996311,111996311,JumpShot,Jair Horton missed Three Point Jumper.,62,46,2nd Half,7:04,False,2400,2025-02-16T07:12:26Z
401721246111996312,111996312,Defensive Rebound,Lorenzo Downey Defensive Rebound.,62,46,2nd Half,7:01,False,2010,2025-02-16T07:12:29Z
401721246111996313,111996313,Lost Ball Turnover,Lorenzo Downey Turnover.,62,46,2nd Half,7:00,False,2010,2025-02-16T07:12:31Z
401721246111996314,111996314,Steal,Moses Horne Steal.,62,46,2nd Half,7:00,False,2400,2025-02-16T07:12:31Z
401721246111996315,111996315,LayUpShot,Moses Horne made Layup.,62,48,2nd Half,6:53,True,2400,2025-02-16T07:12:36Z
401721246111996317,111996317,Substitution,George Ivory III subbing out for Mississippi Valley State,62,48,2nd Half,6:44,False,2400,2025-02-16T07:12:55Z
401721246111996318,111996318,Substitution,Antonio Sisk subbing in for Mississippi Valley State,62,48,2nd Half,6:44,False,2400,2025-02-16T07:12:55Z
401721246111996320,111996320,JumpShot,AC Bryant made Three Point Jumper. Assisted by Bilal Abdur-Rahman.,65,48,2nd Half,6:29,True,2010,2025-02-16T07:13:18Z
401721246111996322,111996322,JumpShot,Raeshun McGregory made Three Point Jumper. Assisted by Antonio Sisk.,65,51,2nd Half,6:04,True,2400,2025-02-16T07:13:42Z
401721246111996324,111996324,Lost Ball Turnover,Saliou Seye Turnover.,65,51,2nd Half,5:52,False,2010,2025-02-16T07:13:55Z
401721246111996325,111996325,Steal,Raeshun McGregory Steal.,65,51,2nd Half,5:52,False,2400,2025-02-16T07:13:55Z
401721246111996346,111996346,Lost Ball Turnover,Greg Moore Turnover.,65,51,2nd Half,5:37,False,2400,2025-02-16T07:14:10Z
401721246111996347,111996347,Steal,Bilal Abdur-Rahman Steal.,65,51,2nd Half,5:37,False,2010,2025-02-16T07:14:10Z
401721246111996348,111996348,LayUpShot,Bilal Abdur-Rahman made Layup.,67,51,2nd Half,5:32,True,2010,2025-02-16T07:14:14Z
401721246111996349,111996349,JumpShot,Moses Horne made Three Point Jumper. Assisted by Antonio Sisk.,67,54,2nd Half,5:16,True,2400,2025-02-16T07:14:30Z
401721246111990075,111990075,Substitution,Greg Moore subbing out for Mississippi Valley State,67,54,2nd Half,5:11,False,2400,2025-02-16T07:16:31Z
401721246111990076,111990076,Substitution,Arthur Tate subbing in for Mississippi Valley State,67,54,2nd Half,5:11,False,2400,2025-02-16T07:16:31Z
401721246111990077,111990077,Substitution,Bilal Abdur-Rahman subbing out for Alabama A&M,67,54,2nd Half,5:11,False,2010,2025-02-16T07:16:31Z
401721246111990078,111990078,Substitution,Saliou Seye subbing out for Alabama A&M,67,54,2nd Half,5:11,False,2010,2025-02-16T07:16:31Z
401721246111990079,111990079,Substitution,London Riley subbing in for Alabama A&M,67,54,2nd Half,5:11,False,2010,2025-02-16T07:16:31Z
401721246111990080,111990080,Substitution,Darius Ford subbing in for Alabama A&M,67,54,2nd Half,5:11,False,2010,2025-02-16T07:16:31Z
401721246111996352,111996352,ShortTimeOut,Mississippi Valley State Timeout,67,54,2nd Half,5:11,False,2400,2025-02-16T07:14:44Z
401721246111990131,111990131,LayUpShot,Chad Moodie made Layup.,69,54,2nd Half,4:50,True,2010,2025-02-16T07:16:57Z
401721246111990142,111990142,LayUpShot,Raeshun McGregory made Layup.,69,56,2nd Half,4:40,True,2400,2025-02-16T07:17:06Z
401721246111990203,111990203,LayUpShot,Chad Moodie made Layup.,71,56,2nd Half,4:19,True,2010,2025-02-16T07:17:28Z
401721246111990259,111990259,JumpShot,Arthur Tate made Jumper.,71,58,2nd Half,3:55,True,2400,2025-02-16T07:17:51Z
401721246111990293,111990293,LayUpShot,AC Bryant missed Layup.,71,58,2nd Half,3:33,False,2010,2025-02-16T07:18:14Z
401721246111990295,111990295,Defensive Rebound,Mississippi Valley State Defensive Rebound.,71,58,2nd Half,3:28,False,2400,2025-02-16T07:18:21Z
401721246111990330,111990330,Substitution,Jair Horton subbing out for Mississippi Valley State,71,58,2nd Half,3:28,False,2400,2025-02-16T07:18:32Z
401721246111990331,111990331,Substitution,Daniel Umoh subbing in for Mississippi Valley State,71,58,2nd Half,3:28,False,2400,2025-02-16T07:18:32Z
401721246111990332,111990332,Substitution,London Riley subbing out for Alabama A&M,71,58,2nd Half,3:28,False,2010,2025-02-16T07:18:32Z
401721246111990333,111990333,Substitution,Dylan Mclean subbing in for Alabama A&M,71,58,2nd Half,3:28,False,2010,2025-02-16T07:18:32Z
401721246111990342,111990342,OfficialTVTimeOut,Official TV Timeout,71,58,2nd Half,3:28,False,,2025-02-16T07:18:44Z
401721246111990650,111990650,JumpShot,Antonio Sisk made Jumper.,71,60,2nd Half,2:59,True,2400,2025-02-16T07:21:00Z
401721246111990734,111990734,PersonalFoul,Foul on Daniel Umoh.,71,60,2nd Half,2:36,False,2400,2025-02-16T07:21:29Z
401721246111990813,111990813,Substitution,Daniel Umoh subbing out for Mississippi Valley State,71,60,2nd Half,2:36,False,2400,2025-02-16T07:21:59Z
401721246111990814,111990814,Substitution,Moses Horne subbing out for Mississippi Valley State,71,60,2nd Half,2:36,False,2400,2025-02-16T07:21:59Z
401721246111990815,111990815,Substitution,Markell Petro subbing in for Mississippi Valley State,71,60,2nd Half,2:36,False,2400,2025-02-16T07:21:59Z
401721246111990816,111990816,Substitution,Jair Horton subbing in for Mississippi Valley State,71,60,2nd Half,2:36,False,2400,2025-02-16T07:21:59Z
401721246111990817,111990817,MadeFreeThrow,Chad Moodie missed Free Throw.,71,60,2nd Half,2:36,False,2010,2025-02-16T07:22:00Z
401721246111990818,111990818,Dead Ball Rebound,Alabama A&M Deadball Team Rebound.,71,60,2nd Half,2:36,False,2010,2025-02-16T07:22:00Z
401721246111990850,111990850,MadeFreeThrow,Chad Moodie made Free Throw.,72,60,2nd Half,2:36,True,2010,2025-02-16T07:22:20Z
401721246111990902,111990902,Lost Ball Turnover,Raeshun McGregory Turnover.,72,60,2nd Half,2:32,False,2400,2025-02-16T07:22:36Z
401721246111990903,111990903,Steal,Dylan Mclean Steal.,72,60,2nd Half,2:32,False,2010,2025-02-16T07:22:36Z
401721246111990904,111990904,LayUpShot,Dylan Mclean missed Layup.,72,60,2nd Half,2:27,False,2010,2025-02-16T07:22:40Z
401721246111990917,111990917,Offensive Rebound,Chad Moodie Offensive Rebound.,72,60,2nd Half,2:23,False,2010,2025-02-16T07:22:43Z
401721246111990918,111990918,LayUpShot,Chad Moodie made Layup.,74,60,2nd Half,2:22,True,2010,2025-02-16T07:22:44Z
401721246111990958,111990958,PersonalFoul,Foul on Chad Moodie.,74,60,2nd Half,2:13,False,2010,2025-02-16T07:22:56Z
401721246111991024,111991024,MadeFreeThrow,Raeshun McGregory missed Free Throw.,74,60,2nd Half,2:13,False,2400,2025-02-16T07:23:25Z
401721246111991026,111991026,Dead Ball Rebound,Mississippi Valley State Deadball Team Rebound.,74,60,2nd Half,2:13,False,2400,2025-02-16T07:23:25Z
401721246111991081,111991081,Substitution,AC Bryant subbing out for Alabama A&M,74,60,2nd Half,2:13,False,2010,2025-02-16T07:23:58Z
401721246111991082,111991082,Substitution,Dylan Mclean subbing out for Alabama A&M,74,60,2nd Half,2:13,False,2010,2025-02-16T07:23:58Z
401721246111991085,111991085,Substitution,Lorenzo Downey subbing out for Alabama A&M,74,60,2nd Half,2:13,False,2010,2025-02-16T07:23:58Z
401721246111991106,111991106,Substitution,Joshua Hughley subbing in for Alabama A&M,74,60,2nd Half,2:13,False,2010,2025-02-16T07:23:58Z
401721246111991107,111991107,Substitution,Warren Yeh subbing in for Alabama A&M,74,60,2nd Half,2:13,False,2010,2025-02-16T07:23:58Z
401721246111991108,111991108,Substitution,Aaron Smith subbing in for Alabama A&M,74,60,2nd Half,2:13,False,2010,2025-02-16T07:23:58Z
401721246111991181,111991181,MadeFreeThrow,Raeshun McGregory missed Free Throw.,74,60,2nd Half,2:13,False,2400,2025-02-16T07:24:20Z
401721246111991203,111991203,Defensive Rebound,Aaron Smith Defensive Rebound.,74,60,2nd Half,2:13,False,2010,2025-02-16T07:24:21Z
401721246111991206,111991206,JumpShot,Warren Yeh missed Three Point Jumper.,74,60,2nd Half,2:05,False,2010,2025-02-16T07:24:31Z
401721246111991220,111991220,Defensive Rebound,Markell Petro Defensive Rebound.,74,60,2nd Half,2:01,False,2400,2025-02-16T07:24:34Z
401721246111991256,111991256,LayUpShot,Antonio Sisk missed Layup.,74,60,2nd Half,1:51,False,2400,2025-02-16T07:24:45Z
401721246111991259,111991259,Block Shot,Aaron Smith Block.,74,60,2nd Half,1:51,False,2010,2025-02-16T07:24:45Z
401721246111991261,111991261,Offensive Rebound,Jair Horton Offensive Rebound.,74,60,2nd Half,1:51,False,2400,2025-02-16T07:24:50Z
401721246111991283,111991283,LayUpShot,Jair Horton made Layup.,74,62,2nd Half,1:51,True,2400,2025-02-16T07:24:55Z
401721246111991310,111991310,PersonalFoul,Foul on Joshua Hughley.,74,62,2nd Half,1:51,False,2010,2025-02-16T07:25:01Z
401721246111991359,111991359,MadeFreeThrow,Jair Horton made Free Throw.,74,63,2nd Half,1:51,True,2400,2025-02-16T07:25:12Z
401721246111991363,111991363,Substitution,Arthur Tate subbing out for Mississippi Valley State,74,63,2nd Half,1:51,False,2400,2025-02-16T07:25:20Z
401721246111991365,111991365,Substitution,Moses Horne subbing in for Mississippi Valley State,74,63,2nd Half,1:51,False,2400,2025-02-16T07:25:20Z
401721246111991422,111991422,PersonalFoul,Foul on Moses Horne.,74,63,2nd Half,1:42,False,2400,2025-02-16T07:25:39Z
401721246111991515,111991515,MadeFreeThrow,Darius Ford missed Free Throw.,74,63,2nd Half,1:42,False,2010,2025-02-16T07:26:12Z
401721246111991516,111991516,Dead Ball Rebound,Alabama A&M Deadball Team Rebound.,74,63,2nd Half,1:42,False,2010,2025-02-16T07:26:12Z
401721246111991517,111991517,Substitution,Markell Petro subbing out for Mississippi Valley State,74,63,2nd Half,1:42,False,2400,2025-02-16T07:26:18Z
401721246111991519,111991519,Substitution,Arthur Tate subbing in for Mississippi Valley State,74,63,2nd Half,1:42,False,2400,2025-02-16T07:26:18Z
401721246111991536,111991536,MadeFreeThrow,Darius Ford made Free Throw.,75,63,2nd Half,1:42,True,2010,2025-02-16T07:26:30Z
401721246111991590,111991590,PersonalFoul,Foul on Joshua Hughley.,75,63,2nd Half,1:40,False,2010,2025-02-16T07:26:41Z
401721246111991627,111991627,MadeFreeThrow,Antonio Sisk made Free Throw.,75,64,2nd Half,1:40,True,2400,2025-02-16T07:27:09Z
401721246111991666,111991666,Substitution,Chad Moodie subbing out for Alabama A&M,75,64,2nd Half,1:40,False,2010,2025-02-16T07:27:15Z
401721246111991667,111991667,Substitution,Ademola Oladipo subbing in for Alabama A&M,75,64,2nd Half,1:40,False,2010,2025-02-16T07:27:15Z
401721246111991679,111991679,MadeFreeThrow,Antonio Sisk made Free Throw.,75,65,2nd Half,1:40,True,2400,2025-02-16T07:27:26Z
401721246111991685,111991685,Substitution,Arthur Tate subbing out for Mississippi Valley State,75,65,2nd Half,1:40,False,2400,2025-02-16T07:27:34Z
401721246111991686,111991686,Substitution,Markell Petro subbing in for Mississippi Valley State,75,65,2nd Half,1:40,False,2400,2025-02-16T07:27:34Z
401721246111991687,111991687,Substitution,Warren Yeh subbing out for Alabama A&M,75,65,2nd Half,1:40,False,2010,2025-02-16T07:27:34Z
401721246111991688,111991688,Substitution,Bilal Abdur-Rahman subbing in for Alabama A&M,75,65,2nd Half,1:40,False,2010,2025-02-16T07:27:34Z
401721246111991713,111991713,Substitution,Darius Ford subbing out for Alabama A&M,75,65,2nd Half,1:40,False,2010,2025-02-16T07:27:43Z
401721246111991714,111991714,Substitution,Jaylen Colon subbing in for Alabama A&M,75,65,2nd Half,1:40,False,2010,2025-02-16T07:27:43Z
401721246111991790,111991790,PersonalFoul,Foul on Antonio Sisk.,75,65,2nd Half,1:23,False,2400,2025-02-16T07:28:14Z
401721246111991817,111991817,MadeFreeThrow,Bilal Abdur-Rahman made Free Throw.,76,65,2nd Half,1:23,True,2010,2025-02-16T07:28:28Z
401721246111991834,111991834,Substitution,Markell Petro subbing out for Mississippi Valley State,76,65,2nd Half,1:23,False,2400,2025-02-16T07:28:36Z
401721246111991835,111991835,Substitution,Arthur Tate subbing in for Mississippi Valley State,76,65,2nd Half,1:23,False,2400,2025-02-16T07:28:36Z
401721246111991848,111991848,MadeFreeThrow,Bilal Abdur-Rahman made Free Throw.,77,65,2nd Half,1:23,True,2010,2025-02-16T07:28:49Z
401721246111991883,111991883,PersonalFoul,Foul on Ademola Oladipo.,77,65,2nd Half,1:12,False,2010,2025-02-16T07:29:05Z
401721246111991955,111991955,MadeFreeThrow,Jair Horton missed Free Throw.,77,65,2nd Half,1:12,False,2400,2025-02-16T07:29:32Z
401721246111991958,111991958,Dead Ball Rebound,Mississippi Valley State Deadball Team Rebound.,77,65,2nd Half,1:12,False,2400,2025-02-16T07:29:32Z
401721246111991973,111991973,Substitution,Arthur Tate subbing out for Mississippi Valley State,77,65,2nd Half,1:12,False,2400,2025-02-16T07:29:50Z
401721246111991976,111991976,Substitution,Moses Horne subbing out for Mississippi Valley State,77,65,2nd Half,1:12,False,2400,2025-02-16T07:29:50Z
401721246111991977,111991977,Substitution,Markell Petro subbing in for Mississippi Valley State,77,65,2nd Half,1:12,False,2400,2025-02-16T07:29:50Z
401721246111991978,111991978,Substitution,George Ivory III subbing in for Mississippi Valley State,77,65,2nd Half,1:12,False,2400,2025-02-16T07:29:50Z
401721246111991979,111991979,Substitution,Ademola Oladipo subbing out for Alabama A&M,77,65,2nd Half,1:12,False,2010,2025-02-16T07:29:50Z
401721246111991980,111991980,Substitution,Darius Ford subbing in for Alabama A&M,77,65,2nd Half,1:12,False,2010,2025-02-16T07:29:50Z
401721246111991994,111991994,MadeFreeThrow,Jair Horton missed Free Throw.,77,65,2nd Half,1:12,False,2400,2025-02-16T07:29:56Z
401721246111991995,111991995,Defensive Rebound,Jaylen Colon Defensive Rebound.,77,65,2nd Half,1:12,False,2010,2025-02-16T07:29:57Z
401721246111992026,111992026,PersonalFoul,Foul on Antonio Sisk.,77,65,2nd Half,0:58,False,2400,2025-02-16T07:30:14Z
401721246111992083,111992083,Substitution,Antonio Sisk subbing out for Mississippi Valley State,77,65,2nd Half,0:58,False,2400,2025-02-16T07:30:45Z
401721246111992084,111992084,Substitution,Markell Petro subbing out for Mississippi Valley State,77,65,2nd Half,0:58,False,2400,2025-02-16T07:30:45Z
401721246111992106,111992106,Substitution,Arthur Tate subbing in for Mississippi Valley State,77,65,2nd Half,0:58,False,2400,2025-02-16T07:30:45Z
401721246111992107,111992107,Substitution,Moses Horne subbing in for Mississippi Valley State,77,65,2nd Half,0:58,False,2400,2025-02-16T07:30:45Z
401721246111992108,111992108,Substitution,Darius Ford subbing out for Alabama A&M,77,65,2nd Half,0:58,False,2010,2025-02-16T07:30:45Z
401721246111992109,111992109,Substitution,Ademola Oladipo subbing in for Alabama A&M,77,65,2nd Half,0:58,False,2010,2025-02-16T07:30:45Z
401721246111992128,111992128,MadeFreeThrow,Bilal Abdur-Rahman missed Free Throw.,77,65,2nd Half,0:58,False,2010,2025-02-16T07:30:53Z
401721246111992129,111992129,Dead Ball Rebound,Alabama A&M Deadball Team Rebound.,77,65,2nd Half,0:58,False,2010,2025-02-16T07:30:53Z
401721246111992140,111992140,MadeFreeThrow,Bilal Abdur-Rahman made Free Throw.,78,65,2nd Half,0:58,True,2010,2025-02-16T07:31:07Z
401721246111992161,111992161,LayUpShot,Arthur Tate made Layup.,78,67,2nd Half,0:48,True,2400,2025-02-16T07:31:20Z
401721246111992228,111992228,ShortTimeOut,Mississippi Valley State Timeout,78,67,2nd Half,0:46,False,2400,2025-02-16T07:31:37Z
401721246111992366,111992366,Substitution,Jair Horton subbing out for Mississippi Valley State,78,67,2nd Half,0:46,False,2400,2025-02-16T07:32:29Z
401721246111992367,111992367,Substitution,Markell Petro subbing in for Mississippi Valley State,78,67,2nd Half,0:46,False,2400,2025-02-16T07:32:29Z
401721246111992368,111992368,Substitution,Ademola Oladipo subbing out for Alabama A&M,78,67,2nd Half,0:46,False,2010,2025-02-16T07:32:29Z
401721246111992369,111992369,Substitution,Darius Ford subbing in for Alabama A&M,78,67,2nd Half,0:46,False,2010,2025-02-16T07:32:29Z
401721246111992433,111992433,Substitution,Markell Petro subbing out for Mississippi Valley State,78,67,2nd Half,0:46,False,2400,2025-02-16T07:33:09Z
401721246111992434,111992434,Substitution,Jair Horton subbing in for Mississippi Valley State,78,67,2nd Half,0:46,False,2400,2025-02-16T07:33:09Z
401721246111992437,111992437,Substitution,Bilal Abdur-Rahman subbing out for Alabama A&M,78,67,2nd Half,0:46,False,2010,2025-02-16T07:33:09Z
401721246111992438,111992438,Substitution,Ademola Oladipo subbing in for Alabama A&M,78,67,2nd Half,0:46,False,2010,2025-02-16T07:33:09Z
401721246111992506,111992506,PersonalFoul,Foul on Arthur Tate.,78,67,2nd Half,0:45,False,2400,2025-02-16T07:33:24Z
401721246111992522,111992522,Substitution,Jair Horton subbing out for Mississippi Valley State,78,67,2nd Half,0:45,False,2400,2025-02-16T07:33:38Z
401721246111992523,111992523,Substitution,Markell Petro subbing in for Mississippi Valley State,78,67,2nd Half,0:45,False,2400,2025-02-16T07:33:38Z
401721246111992545,111992545,Substitution,Ademola Oladipo subbing out for Alabama A&M,78,67,2nd Half,0:45,False,2010,2025-02-16T07:33:42Z
401721246111992547,111992547,Substitution,Bilal Abdur-Rahman subbing in for Alabama A&M,78,67,2nd Half,0:45,False,2010,2025-02-16T07:33:42Z
401721246111992587,111992587,PersonalFoul,Foul on George Ivory III.,78,67,2nd Half,0:40,False,2400,2025-02-16T07:34:01Z
401721246111992642,111992642,MadeFreeThrow,Joshua Hughley made Free Throw.,79,67,2nd Half,0:40,True,2010,2025-02-16T07:34:28Z
401721246111992715,111992715,Substitution,Markell Petro subbing out for Mississippi Valley State,79,67,2nd Half,0:40,False,2400,2025-02-16T07:34:56Z
401721246111992717,111992717,Substitution,Jair Horton subbing in for Mississippi Valley State,79,67,2nd Half,0:40,False,2400,2025-02-16T07:34:56Z
401721246111992718,111992718,Substitution,Bilal Abdur-Rahman subbing out for Alabama A&M,79,67,2nd Half,0:40,False,2010,2025-02-16T07:34:56Z
401721246111992719,111992719,Substitution,Ademola Oladipo subbing in for Alabama A&M,79,67,2nd Half,0:40,False,2010,2025-02-16T07:34:56Z
401721246111992720,111992720,MadeFreeThrow,Joshua Hughley made Free Throw.,80,67,2nd Half,0:40,True,2010,2025-02-16T07:34:59Z
401721246111992773,111992773,LayUpShot,Moses Horne made Layup.,80,69,2nd Half,0:36,True,2400,2025-02-16T07:35:15Z
401721246111992807,111992807,PersonalFoul,Foul on Arthur Tate.,80,69,2nd Half,0:36,False,2400,2025-02-16T07:35:34Z
401721246111992809,111992809,MadeFreeThrow,Joshua Hughley made Free Throw.,81,69,2nd Half,0:36,True,2010,2025-02-16T07:35:42Z
401721246111992855,111992855,MadeFreeThrow,Joshua Hughley made Free Throw.,82,69,2nd Half,0:36,True,2010,2025-02-16T07:35:42Z
401721246111992915,111992915,PersonalFoul,Foul on Joshua Hughley.,82,69,2nd Half,0:24,False,2010,2025-02-16T07:35:59Z
401721246111992917,111992917,MadeFreeThrow,Moses Horne missed Free Throw.,82,69,2nd Half,0:24,False,2400,2025-02-16T07:36:09Z
401721246111992918,111992918,Dead Ball Rebound,Mississippi Valley State Deadball Team Rebound.,82,69,2nd Half,0:24,False,2400,2025-02-16T07:36:09Z
401721246111992927,111992927,Substitution,Ademola Oladipo subbing out for Alabama A&M,82,69,2nd Half,0:24,False,2010,2025-02-16T07:36:16Z
401721246111992929,111992929,Substitution,Bilal Abdur-Rahman subbing in for Alabama A&M,82,69,2nd Half,0:24,False,2010,2025-02-16T07:36:16Z
401721246111992967,111992967,MadeFreeThrow,Moses Horne made Free Throw.,82,70,2nd Half,0:24,True,2400,2025-02-16T07:36:33Z
401721246111993046,111993046,End Period,End of 2nd half,82,70,2nd Half,0:00,False,,2025-02-16T07:37:03Z
401721246111998012,111998012,End Game,End of Game,82,70,2nd Half,0:00,False,,2025-02-16T07:50:01Z
