play_id,sequence_number,type,description,away_score,home_score,period,clock,scoring_play,team_id,timestamp_utc
401724798102888901,102888901,LayUpShot,Jaquan Carlos made Layup.,63,46,2nd Half,11:10,True,183,2025-01-15T01:20:46Z
401724798102889001,102889001,OfficialTVTimeOut, Official TV Timeout,63,46,2nd Half,11:09,False,,2025-01-15T01:20:44Z
401724798102889002,102889002,RegularTimeOut,Louisville  Timeout,63,46,2nd Half,11:09,False,97,2025-01-15T01:20:44Z
401724798102889401,102889401,Lost Ball Turnover,J'Vonne Hadley Turnover.,63,46,2nd Half,11:05,False,97,2025-01-15T01:24:48Z
401724798102894201,102894201,OfficialTVTimeOut, Official TV Timeout,63,46,2nd Half,10:57,False,,2025-01-15T01:25:05Z
401724798102895301,102895301,LayUpShot,Kyle Cuffe Jr. missed Layup.,63,46,2nd Half,10:46,False,183,2025-01-15T01:28:40Z
401724798102895302,102895302,Block Shot,Frank Anselem-Ibe Block.,63,46,2nd Half,10:46,False,97,2025-01-15T01:28:47Z
401724798102896001,102896001,Defensive Rebound,J'Vonne Hadley Defensive Rebound.,63,46,2nd Half,10:39,False,97,2025-01-15T01:28:47Z
401724798102896101,102896101,PersonalFoul,Foul on Petar Majstorovic.,63,46,2nd Half,10:38,False,183,2025-01-15T01:28:47Z
401724798102896102,102896102,MadeFreeThrow,Frank Anselem-Ibe made Free Throw.,64,46,2nd Half,10:38,True,97,2025-01-15T01:28:47Z
401724798102896103,102896103,MadeFreeThrow,Frank Anselem-Ibe made Free Throw.,65,46,2nd Half,10:38,True,97,2025-01-15T01:28:47Z
401724798102899001,102899001,JumpShot,Kyle Cuffe Jr. missed Three Point Jumper.,65,46,2nd Half,10:09,False,183,2025-01-15T01:30:29Z
401724798102899301,102899301,Defensive Rebound,Frank Anselem-Ibe Defensive Rebound.,65,46,2nd Half,10:06,False,97,2025-01-15T01:30:52Z
401724798102905301,102905301,LayUpShot,Terrence Edwards Jr. made Layup.,67,46,2nd Half,9:46,True,97,2025-01-15T01:31:38Z
401724798102908001,102908001,JumpShot,J.J. Starling missed Three Point Jumper.,67,46,2nd Half,9:19,False,183,2025-01-15T01:32:03Z
401724798102908301,102908301,Defensive Rebound,Reyne Smith Defensive Rebound.,67,46,2nd Half,9:16,False,97,2025-01-15T01:32:07Z
401724798102909201,102909201,Lost Ball Turnover,Chucky Hepburn Turnover.,67,46,2nd Half,9:07,False,97,2025-01-15T01:32:16Z
401724798102914101,102914101,Lost Ball Turnover,J.J. Starling Turnover.,67,46,2nd Half,8:58,False,183,2025-01-15T01:32:52Z
401724798102915601,102915601,JumpShot,Terrence Edwards Jr. made Three Point Jumper. Assisted by Chucky Hepburn.,70,46,2nd Half,8:43,True,97,2025-01-15T01:33:19Z
401724798102917001,102917001,RegularTimeOut,Syracuse  Timeout,70,46,2nd Half,8:29,False,183,2025-01-15T01:33:32Z
401724798102917401,102917401,PersonalFoul,Foul on Kyle Cuffe Jr..,70,46,2nd Half,8:25,False,183,2025-01-15T01:37:28Z
401724798102917402,102917402,Lost Ball Turnover,Kyle Cuffe Jr. Turnover.,70,46,2nd Half,8:25,False,183,2025-01-15T01:37:28Z
401724798102918901,102918901,Lost Ball Turnover,Chucky Hepburn Turnover.,70,46,2nd Half,8:10,False,97,2025-01-15T01:37:56Z
401724798102918902,102918902,Steal,Eddie Lampkin Jr. Steal.,70,46,2nd Half,8:10,False,183,2025-01-15T01:37:56Z
401724798102924901,102924901,JumpShot,Chris Bell made Three Point Jumper. Assisted by Kyle Cuffe Jr..,70,49,2nd Half,7:50,True,183,2025-01-15T01:38:31Z
401724798102925801,102925801,LayUpShot,Terrence Edwards Jr. made Layup.,72,49,2nd Half,7:41,True,97,2025-01-15T01:38:40Z
401724798102926601,102926601,JumpShot,Chris Bell made Three Point Jumper. Assisted by J.J. Starling.,72,52,2nd Half,7:33,True,183,2025-01-15T01:38:53Z
401724798102929601,102929601,JumpShot,Terrence Edwards Jr. missed Three Point Jumper.,72,52,2nd Half,7:03,False,97,2025-01-15T01:39:05Z
401724798102934001,102934001,Defensive Rebound,Eddie Lampkin Jr. Defensive Rebound.,72,52,2nd Half,6:59,False,183,2025-01-15T01:39:09Z
401724798102934101,102934101,Lost Ball Turnover,J.J. Starling Turnover.,72,52,2nd Half,6:58,False,183,2025-01-15T01:39:09Z
401724798102934102,102934102,Steal,Khani Rooths Steal.,72,52,2nd Half,6:58,False,97,2025-01-15T01:39:09Z
401724798102934801,102934801,JumpShot,Reyne Smith missed Three Point Jumper.,72,52,2nd Half,6:51,False,97,2025-01-15T01:39:18Z
401724798102935201,102935201,Defensive Rebound,J.J. Starling Defensive Rebound.,72,52,2nd Half,6:47,False,183,2025-01-15T01:39:20Z
401724798102936701,102936701,Lost Ball Turnover,J.J. Starling Turnover.,72,52,2nd Half,6:32,False,183,2025-01-15T01:39:36Z
401724798102936702,102936702,Steal,Khani Rooths Steal.,72,52,2nd Half,6:32,False,97,2025-01-15T01:39:40Z
401724798102938001,102938001,PersonalFoul,Foul on Kyle Cuffe Jr..,72,52,2nd Half,6:19,False,183,2025-01-15T01:40:04Z
401724798102938002,102938002,MadeFreeThrow,James Scott made Free Throw.,73,52,2nd Half,6:19,True,97,2025-01-15T01:40:04Z
401724798102938003,102938003,MadeFreeThrow,James Scott made Free Throw.,74,52,2nd Half,6:19,True,97,2025-01-15T01:40:04Z
401724798102938201,102938201,JumpShot,Chucky Hepburn made Three Point Jumper. Assisted by Reyne Smith.,77,52,2nd Half,6:17,True,97,2025-01-15T01:42:41Z
401724798102945001,102945001,PersonalFoul,Foul on Reyne Smith.,77,52,2nd Half,5:49,False,97,2025-01-15T01:43:09Z
401724798102945002,102945002,MadeFreeThrow,Chris Bell made Free Throw.,77,53,2nd Half,5:49,True,183,2025-01-15T01:43:09Z
401724798102945003,102945003,MadeFreeThrow,Chris Bell made Free Throw.,77,54,2nd Half,5:49,True,183,2025-01-15T01:43:09Z
401724798102945004,102945004,ShortTimeOut,Syracuse  Timeout,77,54,2nd Half,5:49,False,183,2025-01-15T01:43:09Z
401724798102947101,102947101,JumpShot,J'Vonne Hadley made Jumper.,79,54,2nd Half,5:28,True,97,2025-01-15T01:45:32Z
401724798102949001,102949001,JumpShot,Eddie Lampkin Jr. made Jumper.,79,56,2nd Half,5:09,True,183,2025-01-15T01:45:50Z
401724798102955001,102955001,LayUpShot,J'Vonne Hadley made Layup.,81,56,2nd Half,4:49,True,97,2025-01-15T01:46:11Z
401724798102957301,102957301,LayUpShot,Eddie Lampkin Jr. made Layup. Assisted by Jaquan Carlos.,81,58,2nd Half,4:26,True,183,2025-01-15T01:46:31Z
401724798102957302,102957302,PersonalFoul,Foul on Chucky Hepburn.,81,58,2nd Half,4:26,False,97,2025-01-15T01:46:31Z
401724798102957303,102957303,MadeFreeThrow,Eddie Lampkin Jr. made Free Throw.,81,59,2nd Half,4:26,True,183,2025-01-15T01:46:31Z
401724798102958201,102958201,JumpShot,Terrence Edwards Jr. missed Three Point Jumper.,81,59,2nd Half,4:17,False,97,2025-01-15T01:47:47Z
401724798102958601,102958601,Defensive Rebound,Syracuse Defensive Rebound.,81,59,2nd Half,4:13,False,183,2025-01-15T01:47:47Z
401724798102964301,102964301,PersonalFoul,Foul on Chucky Hepburn.,81,59,2nd Half,3:56,False,97,2025-01-15T01:48:17Z
401724798102964601,102964601,OfficialTVTimeOut, Official TV Timeout,81,59,2nd Half,3:53,False,,2025-01-15T01:48:30Z
401724798102965201,102965201,JumpShot,Chris Bell missed Jumper.,81,59,2nd Half,3:47,False,183,2025-01-15T01:51:55Z
401724798102965701,102965701,Defensive Rebound,James Scott Defensive Rebound.,81,59,2nd Half,3:42,False,97,2025-01-15T01:51:59Z
401724798102968101,102968101,LayUpShot,J'Vonne Hadley made Layup.,83,59,2nd Half,3:18,True,97,2025-01-15T01:52:25Z
401724798102969701,102969701,LayUpShot,Chris Bell missed Layup.,83,59,2nd Half,3:02,False,183,2025-01-15T01:52:40Z
401724798102974001,102974001,Defensive Rebound,James Scott Defensive Rebound.,83,59,2nd Half,2:59,False,97,2025-01-15T01:52:45Z
401724798102974701,102974701,JumpShot,Chucky Hepburn missed Three Point Jumper.,83,59,2nd Half,2:52,False,97,2025-01-15T01:52:52Z
401724798102975301,102975301,Offensive Rebound,J'Vonne Hadley Offensive Rebound.,83,59,2nd Half,2:46,False,97,2025-01-15T01:52:52Z
401724798102977101,102977101,JumpShot,J'Vonne Hadley missed Three Point Jumper.,83,59,2nd Half,2:28,False,97,2025-01-15T01:53:14Z
401724798102977501,102977501,Defensive Rebound,Eddie Lampkin Jr. Defensive Rebound.,83,59,2nd Half,2:24,False,183,2025-01-15T01:53:17Z
401724798102978001,102978001,JumpShot,Jaquan Carlos missed Jumper.,83,59,2nd Half,2:19,False,183,2025-01-15T01:53:24Z
401724798102978401,102978401,Defensive Rebound,Aboubacar Traore Defensive Rebound.,83,59,2nd Half,2:15,False,97,2025-01-15T01:53:27Z
401724798102984701,102984701,Lost Ball Turnover,J'Vonne Hadley Turnover.,83,59,2nd Half,1:52,False,97,2025-01-15T01:53:53Z
401724798102984702,102984702,Steal,Petar Majstorovic Steal.,83,59,2nd Half,1:52,False,183,2025-01-15T01:53:53Z
401724798102985501,102985501,JumpShot,Kyle Cuffe Jr. missed Three Point Jumper.,83,59,2nd Half,1:44,False,183,2025-01-15T01:53:59Z
401724798102985901,102985901,Defensive Rebound,Aboubacar Traore Defensive Rebound.,83,59,2nd Half,1:40,False,97,2025-01-15T01:54:02Z
401724798102988401,102988401,JumpShot,Terrence Edwards Jr. missed Jumper.,83,59,2nd Half,1:15,False,97,2025-01-15T01:55:11Z
401724798102988801,102988801,Defensive Rebound,Petar Majstorovic Defensive Rebound.,83,59,2nd Half,1:11,False,183,2025-01-15T01:55:15Z
401724798102989401,102989401,PersonalFoul,Foul on Aboubacar Traore.,83,59,2nd Half,1:05,False,97,2025-01-15T01:55:20Z
401724798102989402,102989402,MadeFreeThrow,Naheem McLeod missed Free Throw.,83,59,2nd Half,1:05,False,183,2025-01-15T01:55:20Z
401724798102989403,102989403,Offensive Rebound,Syracuse Offensive Rebound.,83,59,2nd Half,1:05,False,183,2025-01-15T01:55:20Z
401724798102989404,102989404,MadeFreeThrow,Naheem McLeod missed Free Throw.,83,59,2nd Half,1:05,False,183,2025-01-15T01:55:20Z
401724798102989405,102989405,Defensive Rebound,Frank Anselem-Ibe Defensive Rebound.,83,59,2nd Half,1:05,False,97,2025-01-15T01:55:20Z
401724798102995401,102995401,PersonalFoul,Foul on Elijah Moore.,83,59,2nd Half,0:45,False,183,2025-01-15T01:56:22Z
401724798102995402,102995402,MadeFreeThrow,Aboubacar Traore made Free Throw.,84,59,2nd Half,0:45,True,97,2025-01-15T01:56:22Z
401724798102995403,102995403,MadeFreeThrow,Aboubacar Traore made Free Throw.,85,59,2nd Half,0:45,True,97,2025-01-15T01:56:22Z
401724798102996901,102996901,JumpShot,Jaquan Carlos missed Three Point Jumper.,85,59,2nd Half,0:30,False,183,2025-01-15T01:57:30Z
401724798102997401,102997401,Offensive Rebound,Petar Majstorovic Offensive Rebound.,85,59,2nd Half,0:25,False,183,2025-01-15T01:57:34Z
401724798102997402,102997402,JumpShot,Petar Majstorovic missed Jumper.,85,59,2nd Half,0:25,False,183,2025-01-15T01:57:34Z
401724798102997403,102997403,Offensive Rebound,Syracuse Offensive Rebound.,85,59,2nd Half,0:25,False,183,2025-01-15T01:57:34Z
401724798102998001,102998001,DunkShot,Naheem McLeod made Dunk. Assisted by Jaquan Carlos.,85,61,2nd Half,0:19,True,183,2025-01-15T01:57:52Z
401724798102999901,102999901,End Period,End of 2nd half,85,61,2nd Half,0:00,False,,2025-01-15T01:57:52Z
401724798102999902,102999902,End Game,End of Game,85,61,2nd Half,0:00,False,,2025-01-15T01:57:52Z
