play_id,sequence_number,type,description,away_score,home_score,period,clock,scoring_play,team_id,timestamp_utc
401715942102904501,102904501,Lost Ball Turnover,Jakevion Buckley Turnover.,35,60,2nd Half,9:54,False,2545,2024-12-31T01:21:18Z
401715942102907201,102907201,PersonalFoul,Foul on Kyle Edison.,35,60,2nd Half,9:27,False,2545,2024-12-31T01:22:03Z
401715942102907202,102907202,MadeFreeThrow,Javohn Garcia made Free Throw.,35,61,2nd Half,9:27,True,2377,2024-12-31T01:22:03Z
401715942102907203,102907203,MadeFreeThrow,Javohn Garcia missed Free Throw.,35,61,2nd Half,9:27,False,2377,2024-12-31T01:22:03Z
401715942102907301,102907301,Defensive Rebound,SE Louisiana Defensive Rebound.,35,61,2nd Half,9:26,False,2545,2024-12-31T01:22:50Z
401715942102908101,102908101,PersonalFoul,Foul on Bryant Selebangue.,35,61,2nd Half,9:18,False,2377,2024-12-31T01:23:30Z
401715942102908102,102908102,MadeFreeThrow,Kam Burton made Free Throw.,36,61,2nd Half,9:18,True,2545,2024-12-31T01:23:30Z
401715942102908103,102908103,MadeFreeThrow,Kam Burton missed Free Throw.,36,61,2nd Half,9:18,False,2545,2024-12-31T01:23:30Z
401715942102908301,102908301,Defensive Rebound,Joe Charles Defensive Rebound.,36,61,2nd Half,9:16,False,2377,2024-12-31T01:24:12Z
401715942102909701,102909701,PersonalFoul,Foul on Jaiden Lawrence.,36,61,2nd Half,9:02,False,2545,2024-12-31T01:24:16Z
401715942102909702,102909702,MadeFreeThrow,Javohn Garcia made Free Throw.,36,62,2nd Half,9:02,True,2377,2024-12-31T01:24:16Z
401715942102909703,102909703,MadeFreeThrow,Javohn Garcia made Free Throw.,36,63,2nd Half,9:02,True,2377,2024-12-31T01:24:16Z
401715942102914701,102914701,JumpShot,Sam Hines Jr. made Jumper. Assisted by Kyle Edison.,38,63,2nd Half,8:52,True,2545,2024-12-31T01:25:56Z
401715942102916601,102916601,JumpShot,Joe Charles missed Three Point Jumper.,38,63,2nd Half,8:33,False,2377,2024-12-31T01:25:56Z
401715942102916901,102916901,Defensive Rebound,Jakevion Buckley Defensive Rebound.,38,63,2nd Half,8:30,False,2545,2024-12-31T01:25:56Z
401715942102917701,102917701,JumpShot,Jakevion Buckley missed Three Point Jumper.,38,63,2nd Half,8:22,False,2545,2024-12-31T01:26:35Z
401715942102918201,102918201,Offensive Rebound,Kyle Edison Offensive Rebound.,38,63,2nd Half,8:17,False,2545,2024-12-31T01:26:35Z
401715942102918401,102918401,JumpShot,Kam Burton missed Three Point Jumper.,38,63,2nd Half,8:15,False,2545,2024-12-31T01:26:37Z
401715942102918701,102918701,Offensive Rebound,Sam Hines Jr. Offensive Rebound.,38,63,2nd Half,8:12,False,2545,2024-12-31T01:26:37Z
401715942102918702,102918702,LayUpShot,Sam Hines Jr. made Layup.,40,63,2nd Half,8:12,True,2545,2024-12-31T01:26:37Z
401715942102918703,102918703,PersonalFoul,Foul on Joe Charles.,40,63,2nd Half,8:12,False,2377,2024-12-31T01:26:37Z
401715942102918704,102918704,MadeFreeThrow,Sam Hines Jr. missed Free Throw.,40,63,2nd Half,8:12,False,2545,2024-12-31T01:26:37Z
401715942102918801,102918801,Defensive Rebound,Bryant Selebangue Defensive Rebound.,40,63,2nd Half,8:11,False,2377,2024-12-31T01:26:37Z
401715942102925201,102925201,LayUpShot,Quadir Copeland missed Layup.,40,63,2nd Half,7:47,False,2377,2024-12-31T01:27:28Z
401715942102925401,102925401,Defensive Rebound,Jaiden Lawrence Defensive Rebound.,40,63,2nd Half,7:45,False,2545,2024-12-31T01:27:28Z
401715942102926101,102926101,PersonalFoul,Foul on DJ Richards Jr..,40,63,2nd Half,7:38,False,2377,2024-12-31T01:27:30Z
401715942102926102,102926102,OfficialTVTimeOut, Official TV Timeout,40,63,2nd Half,7:38,False,,2024-12-31T01:27:30Z
401715942102928001,102928001,Lost Ball Turnover,Jakevion Buckley Turnover.,40,63,2nd Half,7:19,False,2545,2024-12-31T01:30:18Z
401715942102928002,102928002,Steal,Bryant Selebangue Steal.,40,63,2nd Half,7:19,False,2377,2024-12-31T01:30:18Z
401715942102928701,102928701,Lost Ball Turnover,Quadir Copeland Turnover.,40,63,2nd Half,7:12,False,2377,2024-12-31T01:30:18Z
401715942102929601,102929601,JumpShot,Kyle Edison missed Three Point Jumper.,40,63,2nd Half,7:03,False,2545,2024-12-31T01:31:10Z
401715942102934101,102934101,Defensive Rebound,Bryant Selebangue Defensive Rebound.,40,63,2nd Half,6:58,False,2377,2024-12-31T01:31:10Z
401715942102934901,102934901,Lost Ball Turnover,Quadir Copeland Turnover.,40,63,2nd Half,6:50,False,2377,2024-12-31T01:31:10Z
401715942102936601,102936601,JumpShot,Kam Burton made Three Point Jumper. Assisted by Jakevion Buckley.,43,63,2nd Half,6:33,True,2545,2024-12-31T01:31:25Z
401715942102939001,102939001,PersonalFoul,Foul on Kyle Edison.,43,63,2nd Half,6:09,False,2545,2024-12-31T01:32:12Z
401715942102939002,102939002,MadeFreeThrow,Javohn Garcia made Free Throw.,43,64,2nd Half,6:09,True,2377,2024-12-31T01:32:12Z
401715942102939003,102939003,MadeFreeThrow,Javohn Garcia missed Free Throw.,43,64,2nd Half,6:09,False,2377,2024-12-31T01:32:12Z
401715942102939401,102939401,Defensive Rebound,Jakevion Buckley Defensive Rebound.,43,64,2nd Half,6:05,False,2545,2024-12-31T01:33:17Z
401715942102944601,102944601,LayUpShot,Jaiden Lawrence missed Layup.,43,64,2nd Half,5:53,False,2545,2024-12-31T01:33:17Z
401715942102944901,102944901,Defensive Rebound,Joe Charles Defensive Rebound.,43,64,2nd Half,5:50,False,2377,2024-12-31T01:33:18Z
401715942102945101,102945101,PersonalFoul,Foul on Jakevion Buckley.,43,64,2nd Half,5:48,False,2545,2024-12-31T01:33:18Z
401715942102945102,102945102,MadeFreeThrow,Javohn Garcia made Free Throw.,43,65,2nd Half,5:48,True,2377,2024-12-31T01:33:18Z
401715942102945103,102945103,MadeFreeThrow,Javohn Garcia made Free Throw.,43,66,2nd Half,5:48,True,2377,2024-12-31T01:33:58Z
401715942102947101,102947101,JumpShot,Jaiden Lawrence missed Three Point Jumper.,43,66,2nd Half,5:28,False,2545,2024-12-31T01:34:43Z
401715942102947401,102947401,Defensive Rebound,Christian Shumate Defensive Rebound.,43,66,2nd Half,5:25,False,2377,2024-12-31T01:34:43Z
401715942102949301,102949301,LayUpShot,T'Johnn Brown missed Layup.,43,66,2nd Half,5:06,False,2377,2024-12-31T01:34:48Z
401715942102949701,102949701,Defensive Rebound,Kam Burton Defensive Rebound.,43,66,2nd Half,5:02,False,2545,2024-12-31T01:34:48Z
401715942102954401,102954401,JumpShot,Kam Burton missed Three Point Jumper.,43,66,2nd Half,4:55,False,2545,2024-12-31T01:35:35Z
401715942102954801,102954801,Defensive Rebound,Christian Shumate Defensive Rebound.,43,66,2nd Half,4:51,False,2377,2024-12-31T01:35:35Z
401715942102955701,102955701,LayUpShot,Quadir Copeland missed Layup.,43,66,2nd Half,4:42,False,2377,2024-12-31T01:35:37Z
401715942102956201,102956201,Offensive Rebound,Joe Charles Offensive Rebound.,43,66,2nd Half,4:37,False,2377,2024-12-31T01:35:37Z
401715942102956202,102956202,JumpShot,Joe Charles made Jumper.,43,68,2nd Half,4:37,True,2377,2024-12-31T01:35:37Z
401715942102958201,102958201,LayUpShot,Kyle Edison made Layup. Assisted by Carlos Paez.,45,68,2nd Half,4:17,True,2545,2024-12-31T01:36:03Z
401715942102964101,102964101,LayUpShot,Joe Charles missed Layup.,45,68,2nd Half,3:58,False,2377,2024-12-31T01:36:53Z
401715942102964301,102964301,Offensive Rebound,Christian Shumate Offensive Rebound.,45,68,2nd Half,3:56,False,2377,2024-12-31T01:36:53Z
401715942102964801,102964801,PersonalFoul,Foul on Christian Shumate.,45,68,2nd Half,3:51,False,2377,2024-12-31T01:36:57Z
401715942102964802,102964802,Lost Ball Turnover,Christian Shumate Turnover.,45,68,2nd Half,3:51,False,2377,2024-12-31T01:36:57Z
401715942102964803,102964803,OfficialTVTimeOut, Official TV Timeout,45,68,2nd Half,3:51,False,,2024-12-31T01:36:57Z
401715942102967801,102967801,JumpShot,Sam Hines Jr. missed Three Point Jumper.,45,68,2nd Half,3:21,False,2545,2024-12-31T01:39:19Z
401715942102968201,102968201,Defensive Rebound,Joe Charles Defensive Rebound.,45,68,2nd Half,3:17,False,2377,2024-12-31T01:39:21Z
401715942102969101,102969101,LayUpShot,T'Johnn Brown made Layup.,45,70,2nd Half,3:08,True,2377,2024-12-31T01:40:07Z
401715942102969701,102969701,PersonalFoul,Foul on Joe Charles.,45,70,2nd Half,3:02,False,2377,2024-12-31T01:40:11Z
401715942102969702,102969702,MadeFreeThrow,Carlos Paez missed Free Throw.,45,70,2nd Half,3:02,False,2545,2024-12-31T01:40:11Z
401715942102969801,102969801,Defensive Rebound,Javohn Garcia Defensive Rebound.,45,70,2nd Half,3:01,False,2377,2024-12-31T01:40:15Z
401715942102974601,102974601,LayUpShot,Bryant Selebangue made Layup. Assisted by Quadir Copeland.,45,72,2nd Half,2:53,True,2377,2024-12-31T01:41:00Z
401715942102975701,102975701,JumpShot,Jeremy Elyzee missed Jumper.,45,72,2nd Half,2:42,False,2545,2024-12-31T01:41:02Z
401715942102975901,102975901,Defensive Rebound,Bryant Selebangue Defensive Rebound.,45,72,2nd Half,2:40,False,2377,2024-12-31T01:41:02Z
401715942102976501,102976501,Lost Ball Turnover,Quadir Copeland Turnover.,45,72,2nd Half,2:34,False,2377,2024-12-31T01:41:02Z
401715942102976502,102976502,Steal,Jakevion Buckley Steal.,45,72,2nd Half,2:34,False,2545,2024-12-31T01:41:02Z
401715942102977301,102977301,Lost Ball Turnover,Carlos Paez Turnover.,45,72,2nd Half,2:26,False,2545,2024-12-31T01:41:02Z
401715942102978501,102978501,Lost Ball Turnover,Joe Charles Turnover.,45,72,2nd Half,2:14,False,2377,2024-12-31T01:41:29Z
401715942102978502,102978502,Steal,Jeremy Elyzee Steal.,45,72,2nd Half,2:14,False,2545,2024-12-31T01:41:29Z
401715942102978801,102978801,PersonalFoul,Foul on Joe Charles.,45,72,2nd Half,2:11,False,2377,2024-12-31T01:41:30Z
401715942102978802,102978802,MadeFreeThrow,Jeremy Elyzee made Free Throw.,46,72,2nd Half,2:11,True,2545,2024-12-31T01:41:30Z
401715942102978803,102978803,MadeFreeThrow,Jeremy Elyzee made Free Throw.,47,72,2nd Half,2:11,True,2545,2024-12-31T01:42:28Z
401715942102985001,102985001,LayUpShot,Javohn Garcia made Layup.,47,74,2nd Half,1:49,True,2377,2024-12-31T01:43:24Z
401715942102986101,102986101,PersonalFoul,Foul on T'Johnn Brown.,47,74,2nd Half,1:38,False,2377,2024-12-31T01:43:24Z
401715942102986102,102986102,MadeFreeThrow,Jeremy Elyzee missed Free Throw.,47,74,2nd Half,1:38,False,2545,2024-12-31T01:43:24Z
401715942102986103,102986103,Offensive Rebound,SE Louisiana Offensive Rebound.,47,74,2nd Half,1:38,False,2545,2024-12-31T01:43:24Z
401715942102986104,102986104,MadeFreeThrow,Jeremy Elyzee missed Free Throw.,47,74,2nd Half,1:38,False,2545,2024-12-31T01:43:24Z
401715942102986201,102986201,Defensive Rebound,Bryant Selebangue Defensive Rebound.,47,74,2nd Half,1:37,False,2377,2024-12-31T01:44:11Z
401715942102987201,102987201,LayUpShot,Javohn Garcia missed Layup.,47,74,2nd Half,1:27,False,2377,2024-12-31T01:44:11Z
401715942102987202,102987202,Block Shot,Jeremy Elyzee Block.,47,74,2nd Half,1:27,False,2545,2024-12-31T01:44:11Z
401715942102987401,102987401,Offensive Rebound,Javohn Garcia Offensive Rebound.,47,74,2nd Half,1:25,False,2377,2024-12-31T01:44:11Z
401715942102987402,102987402,PersonalFoul,Foul on Carlos Paez.,47,74,2nd Half,1:25,False,2545,2024-12-31T01:44:11Z
401715942102987403,102987403,MadeFreeThrow,Javohn Garcia made Free Throw.,47,75,2nd Half,1:25,True,2377,2024-12-31T01:44:11Z
401715942102987404,102987404,MadeFreeThrow,Javohn Garcia made Free Throw.,47,76,2nd Half,1:25,True,2377,2024-12-31T01:44:11Z
401715942102989301,102989301,PersonalFoul,Foul on Bryant Selebangue.,47,76,2nd Half,1:06,False,2377,2024-12-31T01:46:14Z
401715942102989302,102989302,MadeFreeThrow,Jeremy Elyzee made Free Throw.,48,76,2nd Half,1:06,True,2545,2024-12-31T01:46:14Z
401715942102989303,102989303,MadeFreeThrow,Jeremy Elyzee made Free Throw.,49,76,2nd Half,1:06,True,2545,2024-12-31T01:46:14Z
401715942102995001,102995001,LayUpShot,T'Johnn Brown missed Layup.,49,76,2nd Half,0:49,False,2377,2024-12-31T01:47:22Z
401715942102995401,102995401,Offensive Rebound,Bryant Selebangue Offensive Rebound.,49,76,2nd Half,0:45,False,2377,2024-12-31T01:47:22Z
401715942102995402,102995402,JumpShot,Bryant Selebangue missed Jumper.,49,76,2nd Half,0:45,False,2377,2024-12-31T01:47:22Z
401715942102995501,102995501,Defensive Rebound,Jeremy Elyzee Defensive Rebound.,49,76,2nd Half,0:44,False,2545,2024-12-31T01:47:22Z
401715942102995701,102995701,LayUpShot,Jeremy Elyzee made Layup.,51,76,2nd Half,0:42,True,2545,2024-12-31T01:47:22Z
401715942102997901,102997901,JumpShot,Lamont Evans IV made Three Point Jumper. Assisted by Quadir Copeland.,51,79,2nd Half,0:20,True,2377,2024-12-31T01:47:30Z
401715942102999501,102999501,JumpShot,Jeremy Elyzee missed Three Point Jumper.,51,79,2nd Half,0:04,False,2545,2024-12-31T01:47:30Z
401715942102999901,102999901,Offensive Rebound,Ahmed Essahaty Offensive Rebound.,51,79,2nd Half,0:00,False,2545,2024-12-31T01:47:30Z
401715942102999902,102999902,JumpShot,Ahmed Essahaty missed Jumper.,51,79,2nd Half,0:00,False,2545,2024-12-31T01:47:30Z
401715942102999903,102999903,Defensive Rebound,Quadir Copeland Defensive Rebound.,51,79,2nd Half,0:00,False,2377,2024-12-31T01:47:30Z
401715942102999904,102999904,End Game,End of Game,51,79,2nd Half,0:00,False,,2024-12-31T01:47:30Z
