play_id,sequence_number,type,description,away_score,home_score,period,clock,scoring_play,team_id,timestamp_utc
401744228113149661,113149661,Defensive Rebound,Kobe Julien Defensive Rebound.,32,32,1st Half,2:34,False,2032,2025-03-09T05:13:54Z
401744228113149740,113149740,JumpShot,Joseph Pinion made Jumper.,32,34,1st Half,2:19,True,2032,2025-03-09T05:14:32Z
401744228113149755,113149755,JumpShot,Obinna Anochili-Killen made Jumper.,34,34,1st Half,2:04,True,276,2025-03-09T05:14:47Z
401744228113149828,113149828,JumpShot,Kobe Julien made Jumper. Assisted by Taryn Todd.,34,36,1st Half,1:41,True,2032,2025-03-09T05:15:10Z
401744228113149852,113149852,JumpShot,Dezayne Mingo missed Jumper.,34,36,1st Half,1:30,False,276,2025-03-09T05:15:21Z
401744228113149854,113149854,Offensive Rebound,Marshall Offensive Rebound.,34,36,1st Half,1:28,False,276,2025-03-09T05:15:27Z
401744228113149892,113149892,PersonalFoul,Foul on Kobe Julien.,34,36,1st Half,1:28,False,2032,2025-03-09T05:15:40Z
401744228113149940,113149940,Substitution,Izaiyah Nelson subbing out for Arkansas State,34,36,1st Half,1:25,False,2032,2025-03-09T05:16:10Z
401744228113149941,113149941,Substitution,Rashaud Marshall subbing in for Arkansas State,34,36,1st Half,1:25,False,2032,2025-03-09T05:16:10Z
401744228113149978,113149978,JumpShot,Jalen Speer missed Three Point Jumper.,34,36,1st Half,1:12,False,276,2025-03-09T05:16:31Z
401744228113149980,113149980,Defensive Rebound,Terrance Ford Jr. Defensive Rebound.,34,36,1st Half,1:07,False,2032,2025-03-09T05:16:34Z
401744228113150002,113150002,JumpShot,Terrance Ford Jr. made Three Point Jumper.,34,39,1st Half,1:02,True,2032,2025-03-09T05:16:41Z
401744228113150028,113150028,PersonalFoul,Foul on Rashaud Marshall.,34,39,1st Half,0:46,False,2032,2025-03-09T05:17:04Z
401744228113150054,113150054,Substitution,Mikal Dawson subbing out for Marshall,34,39,1st Half,0:46,False,276,2025-03-09T05:17:12Z
401744228113150056,113150056,Substitution,Jakob Gibbs subbing in for Marshall,34,39,1st Half,0:46,False,276,2025-03-09T05:17:12Z
401744228113150084,113150084,LayUpShot,Obinna Anochili-Killen made Layup. Assisted by Dezayne Mingo.,36,39,1st Half,0:34,True,276,2025-03-09T05:17:35Z
401744228113150136,113150136,LayUpShot,Terrance Ford Jr. missed Layup.,36,39,1st Half,0:01,False,2032,2025-03-09T05:18:08Z
401744228113150157,113150157,Offensive Rebound,Rashaud Marshall Offensive Rebound.,36,39,1st Half,0:01,False,2032,2025-03-09T05:18:13Z
401744228113150182,113150182,PersonalFoul,Foul on Dezayne Mingo.,36,39,1st Half,0:01,False,276,2025-03-09T05:18:20Z
401744228113150232,113150232,MadeFreeThrow,Rashaud Marshall missed Free Throw.,36,39,1st Half,0:01,False,2032,2025-03-09T05:18:39Z
401744228113150234,113150234,Dead Ball Rebound,Arkansas State Deadball Team Rebound.,36,39,1st Half,0:01,False,2032,2025-03-09T05:18:39Z
401744228113150236,113150236,Substitution,Joseph Pinion subbing out for Arkansas State,36,39,1st Half,0:01,False,2032,2025-03-09T05:18:45Z
401744228113150238,113150238,Substitution,Derrian Ford subbing in for Arkansas State,36,39,1st Half,0:01,False,2032,2025-03-09T05:18:45Z
401744228113150255,113150255,MadeFreeThrow,Rashaud Marshall missed Free Throw.,36,39,1st Half,0:00,False,2032,2025-03-09T05:18:59Z
401744228113150256,113150256,Defensive Rebound,Obinna Anochili-Killen Defensive Rebound.,36,39,1st Half,0:00,False,276,2025-03-09T05:19:00Z
401744228113150901,113150901,End Period,End of 1st half,36,39,1st Half,0:00,False,,2025-03-09T05:24:58Z
401744228113151899,113151899,Substitution,Rashaud Marshall subbing out for Arkansas State,36,39,2nd Half,20:00,False,2032,2025-03-09T05:35:04Z
401744228113151900,113151900,Substitution,Derrian Ford subbing out for Arkansas State,36,39,2nd Half,20:00,False,2032,2025-03-09T05:35:04Z
401744228113151901,113151901,Substitution,Joseph Pinion subbing in for Arkansas State,36,39,2nd Half,20:00,False,2032,2025-03-09T05:35:04Z
401744228113151902,113151902,Substitution,Izaiyah Nelson subbing in for Arkansas State,36,39,2nd Half,20:00,False,2032,2025-03-09T05:35:04Z
401744228113151903,113151903,Substitution,Jakob Gibbs subbing out for Marshall,36,39,2nd Half,20:00,False,276,2025-03-09T05:35:04Z
401744228113151904,113151904,Substitution,Cade Gibbs subbing out for Marshall,36,39,2nd Half,20:00,False,276,2025-03-09T05:35:04Z
401744228113151905,113151905,Substitution,Mikal Dawson subbing in for Marshall,36,39,2nd Half,20:00,False,276,2025-03-09T05:35:04Z
401744228113151926,113151926,Substitution,Nate Martin subbing in for Marshall,36,39,2nd Half,20:00,False,276,2025-03-09T05:35:04Z
401744228113152033,113152033,LayUpShot,Jalen Speer missed Layup.,36,39,2nd Half,19:36,False,276,2025-03-09T05:35:48Z
401744228113152034,113152034,Offensive Rebound,Obinna Anochili-Killen Offensive Rebound.,36,39,2nd Half,19:32,False,276,2025-03-09T05:35:52Z
401744228113152035,113152035,TipShot,Obinna Anochili-Killen missed Two Point Tip Shot.,36,39,2nd Half,19:32,False,276,2025-03-09T05:35:52Z
401744228113152036,113152036,Defensive Rebound,Taryn Todd Defensive Rebound.,36,39,2nd Half,19:31,False,2032,2025-03-09T05:35:53Z
401744228113152091,113152091,Lost Ball Turnover,Kobe Julien Turnover.,36,39,2nd Half,19:10,False,2032,2025-03-09T05:36:14Z
401744228113152092,113152092,Steal,Obinna Anochili-Killen Steal.,36,39,2nd Half,19:10,False,276,2025-03-09T05:36:14Z
401744228113152130,113152130,JumpShot,Mikal Dawson made Three Point Jumper. Assisted by Nate Martin.,39,39,2nd Half,18:55,True,276,2025-03-09T05:36:30Z
401744228113152171,113152171,LayUpShot,Terrance Ford Jr. missed Layup.,39,39,2nd Half,18:37,False,2032,2025-03-09T05:36:48Z
401744228113152191,113152191,Defensive Rebound,Obinna Anochili-Killen Defensive Rebound.,39,39,2nd Half,18:34,False,276,2025-03-09T05:36:50Z
401744228113152213,113152213,Lost Ball Turnover,Dezayne Mingo Turnover.,39,39,2nd Half,18:25,False,276,2025-03-09T05:37:02Z
401744228113152224,113152224,Substitution,Kobe Julien subbing out for Arkansas State,39,39,2nd Half,18:25,False,2032,2025-03-09T05:37:10Z
401744228113152225,113152225,Substitution,Derrian Ford subbing in for Arkansas State,39,39,2nd Half,18:25,False,2032,2025-03-09T05:37:10Z
401744228113152269,113152269,JumpShot,Joseph Pinion missed Three Point Jumper.,39,39,2nd Half,18:13,False,2032,2025-03-09T05:37:31Z
401744228113152270,113152270,Offensive Rebound,Izaiyah Nelson Offensive Rebound.,39,39,2nd Half,18:12,False,2032,2025-03-09T05:37:33Z
401744228113152285,113152285,PersonalFoul,Foul on Jalen Speer.,39,39,2nd Half,18:12,False,276,2025-03-09T05:37:40Z
401744228113152334,113152334,MadeFreeThrow,Izaiyah Nelson made Free Throw.,39,40,2nd Half,18:12,True,2032,2025-03-09T05:38:06Z
401744228113152350,113152350,MadeFreeThrow,Izaiyah Nelson made Free Throw.,39,41,2nd Half,18:12,True,2032,2025-03-09T05:38:20Z
401744228113152361,113152361,LayUpShot,Dezayne Mingo missed Layup.,39,41,2nd Half,18:02,False,276,2025-03-09T05:38:31Z
401744228113152362,113152362,Block Shot,Izaiyah Nelson Block.,39,41,2nd Half,18:02,False,2032,2025-03-09T05:38:31Z
401744228113152363,113152363,Defensive Rebound,Taryn Todd Defensive Rebound.,39,41,2nd Half,17:58,False,2032,2025-03-09T05:38:35Z
401744228113152401,113152401,LayUpShot,Taryn Todd missed Layup.,39,41,2nd Half,17:50,False,2032,2025-03-09T05:38:44Z
401744228113152403,113152403,Block Shot,Obinna Anochili-Killen Block.,39,41,2nd Half,17:50,False,276,2025-03-09T05:38:44Z
401744228113152429,113152429,Defensive Rebound,Obinna Anochili-Killen Defensive Rebound.,39,41,2nd Half,17:46,False,276,2025-03-09T05:38:48Z
401744228113152442,113152442,Lost Ball Turnover,Jalen Speer Turnover.,39,41,2nd Half,17:34,False,276,2025-03-09T05:39:00Z
401744228113152443,113152443,Steal,Taryn Todd Steal.,39,41,2nd Half,17:34,False,2032,2025-03-09T05:39:00Z
401744228113152474,113152474,PersonalFoul,Foul on Jalen Speer.,39,41,2nd Half,17:30,False,276,2025-03-09T05:39:06Z
401744228113152539,113152539,MadeFreeThrow,Taryn Todd missed Free Throw.,39,41,2nd Half,17:30,False,2032,2025-03-09T05:39:50Z
401744228113152540,113152540,Dead Ball Rebound,Arkansas State Deadball Team Rebound.,39,41,2nd Half,17:30,False,2032,2025-03-09T05:39:50Z
401744228113152541,113152541,Substitution,Jalen Speer subbing out for Marshall,39,41,2nd Half,17:30,False,276,2025-03-09T05:39:54Z
401744228113152542,113152542,Substitution,Jakob Gibbs subbing in for Marshall,39,41,2nd Half,17:30,False,276,2025-03-09T05:39:54Z
401744228113152607,113152607,MadeFreeThrow,Taryn Todd missed Free Throw.,39,41,2nd Half,17:29,False,2032,2025-03-09T05:40:11Z
401744228113152608,113152608,Defensive Rebound,Dezayne Mingo Defensive Rebound.,39,41,2nd Half,17:27,False,276,2025-03-09T05:40:13Z
401744228113152633,113152633,PersonalFoul,Foul on Joseph Pinion.,39,41,2nd Half,17:12,False,2032,2025-03-09T05:40:30Z
401744228113152690,113152690,MadeFreeThrow,Mikal Dawson made Free Throw.,40,41,2nd Half,17:12,True,276,2025-03-09T05:40:54Z
401744228113152727,113152727,MadeFreeThrow,Mikal Dawson made Free Throw.,41,41,2nd Half,17:12,True,276,2025-03-09T05:41:12Z
401744228113152737,113152737,JumpShot,Izaiyah Nelson missed Jumper.,41,41,2nd Half,17:01,False,2032,2025-03-09T05:41:31Z
401744228113152738,113152738,Block Shot,Obinna Anochili-Killen Block.,41,41,2nd Half,17:01,False,276,2025-03-09T05:41:31Z
401744228113152739,113152739,Defensive Rebound,Nate Martin Defensive Rebound.,41,41,2nd Half,16:58,False,276,2025-03-09T05:41:35Z
401744228113152786,113152786,JumpShot,Mikal Dawson made Three Point Jumper. Assisted by Nate Martin.,44,41,2nd Half,16:54,True,276,2025-03-09T05:41:40Z
401744228113152803,113152803,PersonalFoul,Foul on Jakob Gibbs.,44,41,2nd Half,16:38,False,276,2025-03-09T05:41:58Z
401744228113152859,113152859,JumpShot,Terrance Ford Jr. made Three Point Jumper. Assisted by Izaiyah Nelson.,44,44,2nd Half,16:32,True,2032,2025-03-09T05:42:20Z
401744228113152909,113152909,JumpShot,Mikal Dawson made Jumper.,46,44,2nd Half,16:11,True,276,2025-03-09T05:42:40Z
401744228113152920,113152920,LayUpShot,Izaiyah Nelson missed Layup.,46,44,2nd Half,16:01,False,2032,2025-03-09T05:42:50Z
401744228113152921,113152921,Defensive Rebound,Dezayne Mingo Defensive Rebound.,46,44,2nd Half,15:58,False,276,2025-03-09T05:42:52Z
401744228113152974,113152974,PersonalFoul,Foul on Taryn Todd.,46,44,2nd Half,15:56,False,2032,2025-03-09T05:42:59Z
401744228113153018,113153018,OfficialTVTimeOut,Official TV Timeout,46,44,2nd Half,15:56,False,,2025-03-09T05:43:35Z
401744228113153233,113153233,Substitution,Taryn Todd subbing out for Arkansas State,46,44,2nd Half,15:56,False,2032,2025-03-09T05:45:42Z
401744228113153235,113153235,Substitution,Kobe Julien subbing in for Arkansas State,46,44,2nd Half,15:56,False,2032,2025-03-09T05:45:42Z
401744228113153284,113153284,MadeFreeThrow,Dezayne Mingo made Free Throw.,47,44,2nd Half,15:56,True,276,2025-03-09T05:46:01Z
401744228113153315,113153315,MadeFreeThrow,Dezayne Mingo missed Free Throw.,47,44,2nd Half,15:55,False,276,2025-03-09T05:46:16Z
401744228113153316,113153316,Defensive Rebound,Izaiyah Nelson Defensive Rebound.,47,44,2nd Half,15:53,False,2032,2025-03-09T05:46:17Z
401744228113153328,113153328,JumpShot,Joseph Pinion missed Three Point Jumper.,47,44,2nd Half,15:48,False,2032,2025-03-09T05:46:24Z
401744228113153329,113153329,Defensive Rebound,Nate Martin Defensive Rebound.,47,44,2nd Half,15:45,False,276,2025-03-09T05:46:26Z
401744228113153410,113153410,JumpShot,Dezayne Mingo made Jumper. Assisted by Nate Martin.,49,44,2nd Half,15:29,True,276,2025-03-09T05:47:03Z
401744228113153449,113153449,JumpShot,Kobe Julien made Jumper.,49,46,2nd Half,15:06,True,2032,2025-03-09T05:47:25Z
401744228113153508,113153508,JumpShot,Obinna Anochili-Killen missed Three Point Jumper.,49,46,2nd Half,14:41,False,276,2025-03-09T05:48:08Z
401744228113153523,113153523,Offensive Rebound,Marshall Offensive Rebound.,49,46,2nd Half,14:39,False,276,2025-03-09T05:48:12Z
401744228113153558,113153558,JumpShot,Mikal Dawson made Three Point Jumper. Assisted by Dezayne Mingo.,52,46,2nd Half,14:37,True,276,2025-03-09T05:48:33Z
401744228113153573,113153573,JumpShot,Terrance Ford Jr. missed Three Point Jumper.,52,46,2nd Half,14:24,False,2032,2025-03-09T05:48:46Z
401744228113153607,113153607,Defensive Rebound,Nate Martin Defensive Rebound.,52,46,2nd Half,14:21,False,276,2025-03-09T05:48:49Z
401744228113153624,113153624,LayUpShot,Nate Martin missed Layup.,52,46,2nd Half,14:08,False,276,2025-03-09T05:49:02Z
401744228113153625,113153625,Defensive Rebound,Izaiyah Nelson Defensive Rebound.,52,46,2nd Half,14:05,False,2032,2025-03-09T05:49:05Z
401744228113153628,113153628,JumpShot,Derrian Ford missed Three Point Jumper.,52,46,2nd Half,14:03,False,2032,2025-03-09T05:49:08Z
401744228113153634,113153634,Defensive Rebound,Dezayne Mingo Defensive Rebound.,52,46,2nd Half,14:00,False,276,2025-03-09T05:49:12Z
401744228113153834,113153834,PersonalFoul,Foul on Nate Martin.,52,46,2nd Half,13:58,False,276,2025-03-09T05:51:29Z
401744228113153835,113153835,Lost Ball Turnover,Nate Martin Turnover.,52,46,2nd Half,13:58,False,276,2025-03-09T05:51:29Z
401744228113153874,113153874,MadeFreeThrow,Kobe Julien made Free Throw.,52,47,2nd Half,13:58,True,2032,2025-03-09T05:52:09Z
401744228113153885,113153885,MadeFreeThrow,Kobe Julien missed Free Throw.,52,47,2nd Half,13:58,False,2032,2025-03-09T05:52:18Z
401744228113153919,113153919,Dead Ball Rebound,Arkansas State Deadball Team Rebound.,52,47,2nd Half,13:58,False,2032,2025-03-09T05:52:39Z
401744228113154008,113154008,Substitution,Nate Martin subbing out for Marshall,52,46,2nd Half,13:58,False,276,2025-03-09T05:53:27Z
401744228113154009,113154009,Substitution,Cade Gibbs subbing in for Marshall,52,46,2nd Half,13:58,False,276,2025-03-09T05:53:27Z
401744228113153949,113153949,LayUpShot,Izaiyah Nelson made Layup.,52,49,2nd Half,13:56,True,2032,2025-03-09T05:52:56Z
401744228113154024,113154024,PersonalFoul,Foul on Izaiyah Nelson.,52,49,2nd Half,13:52,False,2032,2025-03-09T05:53:32Z
401744228113154050,113154050,MadeFreeThrow,Mikal Dawson made Free Throw.,53,49,2nd Half,13:52,True,276,2025-03-09T05:53:51Z
401744228113154091,113154091,PersonalFoul,Foul on Kobe Julien.,53,49,2nd Half,13:30,False,2032,2025-03-09T05:54:33Z
401744228113154128,113154128,MadeFreeThrow,Obinna Anochili-Killen missed Free Throw.,53,49,2nd Half,13:30,False,276,2025-03-09T05:54:56Z
401744228113154129,113154129,Dead Ball Rebound,Marshall Deadball Team Rebound.,53,49,2nd Half,13:30,False,276,2025-03-09T05:54:56Z
401744228113154142,113154142,Substitution,Joseph Pinion subbing out for Arkansas State,53,49,2nd Half,13:30,False,2032,2025-03-09T05:55:05Z
401744228113154143,113154143,Substitution,Taryn Todd subbing in for Arkansas State,53,49,2nd Half,13:30,False,2032,2025-03-09T05:55:05Z
401744228113154151,113154151,MadeFreeThrow,Obinna Anochili-Killen missed Free Throw.,53,49,2nd Half,13:29,False,276,2025-03-09T05:55:17Z
401744228113154152,113154152,Defensive Rebound,Kobe Julien Defensive Rebound.,53,49,2nd Half,13:28,False,2032,2025-03-09T05:55:18Z
401744228113154192,113154192,JumpShot,Taryn Todd made Jumper.,53,51,2nd Half,13:08,True,2032,2025-03-09T05:55:39Z
401744228113154245,113154245,Lost Ball Turnover,Mikal Dawson Turnover.,53,51,2nd Half,12:48,False,276,2025-03-09T05:56:06Z
401744228113154246,113154246,Steal,Terrance Ford Jr. Steal.,53,51,2nd Half,12:48,False,2032,2025-03-09T05:56:06Z
401744228113154308,113154308,PersonalFoul,Foul on Cade Gibbs.,53,51,2nd Half,12:30,False,276,2025-03-09T05:57:10Z
401744228113154330,113154330,JumpShot,Taryn Todd missed Three Point Jumper.,53,51,2nd Half,12:24,False,2032,2025-03-09T05:57:35Z
401744228113154331,113154331,Defensive Rebound,Mikal Dawson Defensive Rebound.,53,51,2nd Half,12:21,False,276,2025-03-09T05:57:38Z
401744228113154341,113154341,LayUpShot,Jakob Gibbs made Layup.,55,51,2nd Half,12:18,True,276,2025-03-09T05:57:43Z
401744228113154375,113154375,PersonalFoul,Foul on Terrance Ford Jr..,55,51,2nd Half,12:18,False,2032,2025-03-09T05:57:48Z
401744228113154659,113154659,MadeFreeThrow,Jakob Gibbs missed Free Throw.,55,51,2nd Half,12:17,False,276,2025-03-09T06:01:33Z
401744228113154663,113154663,Defensive Rebound,Kobe Julien Defensive Rebound.,55,51,2nd Half,12:16,False,2032,2025-03-09T06:01:34Z
401744228113154693,113154693,JumpShot,Izaiyah Nelson missed Jumper.,55,51,2nd Half,12:00,False,2032,2025-03-09T06:01:50Z
401744228113154697,113154697,Offensive Rebound,Arkansas State Offensive Rebound.,55,51,2nd Half,11:59,False,2032,2025-03-09T06:01:54Z
401744228113154722,113154722,JumpShot,Izaiyah Nelson made Jumper.,55,53,2nd Half,11:54,True,2032,2025-03-09T06:02:15Z
401744228113154776,113154776,Lost Ball Turnover,Dezayne Mingo Turnover.,55,53,2nd Half,11:36,False,276,2025-03-09T06:02:33Z
401744228113154778,113154778,Steal,Taryn Todd Steal.,55,53,2nd Half,11:36,False,2032,2025-03-09T06:02:33Z
401744228113154806,113154806,JumpShot,Taryn Todd missed Three Point Jumper.,55,53,2nd Half,11:09,False,2032,2025-03-09T06:03:00Z
401744228113154808,113154808,Offensive Rebound,Derrian Ford Offensive Rebound.,55,53,2nd Half,11:05,False,2032,2025-03-09T06:03:02Z
401744228113154809,113154809,LayUpShot,Taryn Todd missed Layup.,55,53,2nd Half,11:00,False,2032,2025-03-09T06:03:08Z
401744228113154818,113154818,Defensive Rebound,Cade Gibbs Defensive Rebound.,55,53,2nd Half,10:57,False,276,2025-03-09T06:03:11Z
401744228113154847,113154847,JumpShot,Obinna Anochili-Killen missed Jumper.,55,53,2nd Half,10:41,False,276,2025-03-09T06:03:27Z
401744228113154864,113154864,Offensive Rebound,Obinna Anochili-Killen Offensive Rebound.,55,53,2nd Half,10:38,False,276,2025-03-09T06:03:30Z
401744228113154866,113154866,JumpShot,Obinna Anochili-Killen missed Jumper.,55,53,2nd Half,10:37,False,276,2025-03-09T06:03:31Z
401744228113154876,113154876,Offensive Rebound,Obinna Anochili-Killen Offensive Rebound.,55,53,2nd Half,10:37,False,276,2025-03-09T06:03:41Z
401744228113154878,113154878,PersonalFoul,Foul on Terrance Ford Jr..,55,53,2nd Half,10:37,False,2032,2025-03-09T06:03:42Z
401744228113154890,113154890,Substitution,Kobe Julien subbing out for Arkansas State,55,53,2nd Half,10:37,False,2032,2025-03-09T06:03:54Z
401744228113154892,113154892,Substitution,Joseph Pinion subbing in for Arkansas State,55,53,2nd Half,10:37,False,2032,2025-03-09T06:03:54Z
401744228113154931,113154931,OfficialTVTimeOut,Official TV Timeout,55,53,2nd Half,10:37,False,,2025-03-09T06:04:13Z
401744228113155433,113155433,JumpShot,Mikal Dawson missed Jumper.,55,53,2nd Half,10:22,False,276,2025-03-09T06:08:16Z
401744228113155434,113155434,Defensive Rebound,Terrance Ford Jr. Defensive Rebound.,55,53,2nd Half,10:19,False,2032,2025-03-09T06:08:18Z
401744228113155495,113155495,LayUpShot,Terrance Ford Jr. made Layup.,55,55,2nd Half,10:01,True,2032,2025-03-09T06:08:36Z
401744228113155588,113155588,JumpShot,Cade Gibbs missed Three Point Jumper.,55,55,2nd Half,9:31,False,276,2025-03-09T06:09:07Z
401744228113155604,113155604,Defensive Rebound,Derrian Ford Defensive Rebound.,55,55,2nd Half,9:28,False,2032,2025-03-09T06:09:09Z
401744228113155658,113155658,PersonalFoul,Foul on Obinna Anochili-Killen.,55,55,2nd Half,9:07,False,276,2025-03-09T06:09:32Z
401744228113155723,113155723,MadeFreeThrow,Izaiyah Nelson made Free Throw.,55,56,2nd Half,9:07,True,2032,2025-03-09T06:10:03Z
401744228113155770,113155770,Substitution,Derrian Ford subbing out for Arkansas State,55,56,2nd Half,9:07,False,2032,2025-03-09T06:10:15Z
401744228113155771,113155771,Substitution,Kobe Julien subbing in for Arkansas State,55,56,2nd Half,9:07,False,2032,2025-03-09T06:10:15Z
401744228113155772,113155772,Substitution,Jakob Gibbs subbing out for Marshall,55,56,2nd Half,9:07,False,276,2025-03-09T06:10:15Z
401744228113155773,113155773,Substitution,Cade Gibbs subbing out for Marshall,55,56,2nd Half,9:07,False,276,2025-03-09T06:10:15Z
401744228113155774,113155774,Substitution,Wyatt Fricks subbing in for Marshall,55,56,2nd Half,9:07,False,276,2025-03-09T06:10:15Z
401744228113155777,113155777,Substitution,Jalen Speer subbing in for Marshall,55,56,2nd Half,9:07,False,276,2025-03-09T06:10:15Z
401744228113155784,113155784,MadeFreeThrow,Izaiyah Nelson made Free Throw.,55,57,2nd Half,9:07,True,2032,2025-03-09T06:10:22Z
401744228113155870,113155870,LayUpShot,Dezayne Mingo missed Layup.,55,57,2nd Half,8:43,False,276,2025-03-09T06:11:12Z
401744228113155872,113155872,Offensive Rebound,Obinna Anochili-Killen Offensive Rebound.,55,57,2nd Half,8:39,False,276,2025-03-09T06:11:16Z
401744228113155873,113155873,TipShot,Obinna Anochili-Killen made Two Point Tip Shot.,57,57,2nd Half,8:39,True,276,2025-03-09T06:11:16Z
401744228113155906,113155906,LayUpShot,Kobe Julien missed Layup.,57,57,2nd Half,8:30,False,2032,2025-03-09T06:11:25Z
401744228113155907,113155907,Defensive Rebound,Mikal Dawson Defensive Rebound.,57,57,2nd Half,8:26,False,276,2025-03-09T06:11:28Z
401744228113155921,113155921,Lost Ball Turnover,Mikal Dawson Turnover.,57,57,2nd Half,8:18,False,276,2025-03-09T06:11:37Z
401744228113155956,113155956,Steal,Taryn Todd Steal.,57,57,2nd Half,8:18,False,2032,2025-03-09T06:11:37Z
401744228113155957,113155957,DunkShot,Taryn Todd made Dunk.,57,59,2nd Half,8:14,True,2032,2025-03-09T06:11:42Z
401744228113156014,113156014,PersonalFoul,Foul on Izaiyah Nelson.,57,59,2nd Half,7:54,False,2032,2025-03-09T06:12:09Z
401744228113156048,113156048,OfficialTVTimeOut,Official TV Timeout,57,59,2nd Half,7:54,False,,2025-03-09T06:12:25Z
401744228113156345,113156345,MadeFreeThrow,Dezayne Mingo missed Free Throw.,57,59,2nd Half,7:54,False,276,2025-03-09T06:15:29Z
401744228113156347,113156347,Dead Ball Rebound,Marshall Deadball Team Rebound.,57,59,2nd Half,7:54,False,276,2025-03-09T06:15:29Z
401744228113156378,113156378,MadeFreeThrow,Dezayne Mingo made Free Throw.,58,59,2nd Half,7:54,True,276,2025-03-09T06:15:45Z
401744228113156453,113156453,Lost Ball Turnover,Terrance Ford Jr. Turnover.,58,59,2nd Half,7:30,False,2032,2025-03-09T06:16:14Z
401744228113156508,113156508,JumpShot,Jalen Speer missed Jumper.,58,59,2nd Half,7:17,False,276,2025-03-09T06:16:36Z
401744228113156532,113156532,Defensive Rebound,Joseph Pinion Defensive Rebound.,58,59,2nd Half,7:13,False,2032,2025-03-09T06:16:40Z
401744228113156534,113156534,LayUpShot,Kobe Julien made Layup.,58,61,2nd Half,7:09,True,2032,2025-03-09T06:16:45Z
401744228113156602,113156602,PersonalFoul,Foul on Taryn Todd.,58,61,2nd Half,6:48,False,2032,2025-03-09T06:17:14Z
401744228113156658,113156658,MadeFreeThrow,Dezayne Mingo made Free Throw.,59,61,2nd Half,6:48,True,276,2025-03-09T06:17:41Z
401744228113156672,113156672,MadeFreeThrow,Dezayne Mingo made Free Throw.,60,61,2nd Half,6:48,True,276,2025-03-09T06:17:58Z
401744228113156743,113156743,JumpShot,Kobe Julien missed Three Point Jumper.,60,61,2nd Half,6:25,False,2032,2025-03-09T06:18:24Z
401744228113156744,113156744,Offensive Rebound,Izaiyah Nelson Offensive Rebound.,60,61,2nd Half,6:22,False,2032,2025-03-09T06:18:26Z
401744228113157047,113157047,JumpShot,Joseph Pinion missed Three Point Jumper.,60,61,2nd Half,6:17,False,2032,2025-03-09T06:21:08Z
401744228113157058,113157058,Block Shot,Wyatt Fricks Block.,60,61,2nd Half,6:17,False,276,2025-03-09T06:21:08Z
401744228113157059,113157059,Defensive Rebound,Wyatt Fricks Defensive Rebound.,60,61,2nd Half,6:11,False,276,2025-03-09T06:21:14Z
401744228113157061,113157061,Lost Ball Turnover,Wyatt Fricks Turnover.,60,61,2nd Half,6:10,False,276,2025-03-09T06:21:15Z
401744228113157062,113157062,Steal,Terrance Ford Jr. Steal.,60,61,2nd Half,6:10,False,2032,2025-03-09T06:21:15Z
401744228113157064,113157064,JumpShot,Joseph Pinion made Three Point Jumper. Assisted by Terrance Ford Jr..,60,64,2nd Half,6:06,True,2032,2025-03-09T06:21:19Z
401744228113157092,113157092,JumpShot,Dezayne Mingo missed Jumper.,60,64,2nd Half,5:47,False,276,2025-03-09T06:21:37Z
401744228113157130,113157130,Block Shot,Joseph Pinion Block.,60,64,2nd Half,5:47,False,2032,2025-03-09T06:21:37Z
401744228113157132,113157132,Offensive Rebound,Dezayne Mingo Offensive Rebound.,60,64,2nd Half,5:46,False,276,2025-03-09T06:21:42Z
401744228113157155,113157155,PersonalFoul,Foul on Joseph Pinion.,60,64,2nd Half,5:43,False,2032,2025-03-09T06:22:13Z
401744228113157271,113157271,MadeFreeThrow,Obinna Anochili-Killen missed Free Throw.,60,64,2nd Half,5:43,False,276,2025-03-09T06:22:56Z
401744228113157272,113157272,Dead Ball Rebound,Marshall Deadball Team Rebound.,60,64,2nd Half,5:43,False,276,2025-03-09T06:22:56Z
401744228113157278,113157278,Substitution,Wyatt Fricks subbing out for Marshall,60,64,2nd Half,5:43,False,276,2025-03-09T06:23:00Z
401744228113157279,113157279,Substitution,Cade Gibbs subbing in for Marshall,60,64,2nd Half,5:43,False,276,2025-03-09T06:23:00Z
401744228113157291,113157291,MadeFreeThrow,Obinna Anochili-Killen made Free Throw.,61,64,2nd Half,5:43,True,276,2025-03-09T06:23:14Z
401744228113157300,113157300,LayUpShot,Taryn Todd made Layup.,61,66,2nd Half,5:30,True,2032,2025-03-09T06:23:29Z
401744228113157329,113157329,JumpShot,Dezayne Mingo missed Jumper.,61,66,2nd Half,5:14,False,276,2025-03-09T06:23:46Z
401744228113157330,113157330,Defensive Rebound,Kobe Julien Defensive Rebound.,61,66,2nd Half,5:11,False,2032,2025-03-09T06:23:48Z
401744228113157349,113157349,PersonalFoul,Foul on Dezayne Mingo.,61,66,2nd Half,4:58,False,276,2025-03-09T06:24:06Z
401744228113157402,113157402,MadeFreeThrow,Taryn Todd made Free Throw.,61,67,2nd Half,4:58,True,2032,2025-03-09T06:24:36Z
401744228113157427,113157427,MadeFreeThrow,Taryn Todd missed Free Throw.,61,67,2nd Half,4:58,False,2032,2025-03-09T06:24:52Z
401744228113157428,113157428,Defensive Rebound,Cade Gibbs Defensive Rebound.,61,67,2nd Half,4:57,False,276,2025-03-09T06:24:53Z
401744228113157440,113157440,LayUpShot,Cade Gibbs made Layup.,63,67,2nd Half,4:31,True,276,2025-03-09T06:25:19Z
401744228113157461,113157461,PersonalFoul,Foul on Joseph Pinion.,63,67,2nd Half,4:31,False,2032,2025-03-09T06:25:25Z
401744228113157470,113157470,Substitution,Joseph Pinion subbing out for Arkansas State,63,67,2nd Half,4:30,False,2032,2025-03-09T06:44:15Z
