play_id,sequence_number,type,description,away_score,home_score,period,clock,scoring_play,team_id,timestamp_utc
401719664102916001,102916001,PersonalFoul,Foul on Kelcy Phipps.,59,70,2nd Half,8:39,False,2502,2025-01-31T03:25:53Z
401719664102916002,102916002,MadeFreeThrow,Malik Moore made Free Throw.,59,71,2nd Half,8:39,True,149,2025-01-31T03:25:53Z
401719664102916003,102916003,MadeFreeThrow,Malik Moore made Free Throw.,59,72,2nd Half,8:39,True,149,2025-01-31T03:25:53Z
401719664102917601,102917601,LayUpShot,Jaylin Henderson made Layup.,61,72,2nd Half,8:23,True,2502,2025-01-31T03:26:59Z
401719664102924301,102924301,LayUpShot,Joe Pridgen missed Layup.,61,72,2nd Half,7:56,False,149,2025-01-31T03:27:27Z
401719664102924601,102924601,Defensive Rebound,Terri Miller Jr. Defensive Rebound.,61,72,2nd Half,7:53,False,2502,2025-01-31T03:27:27Z
401719664102925801,102925801,JumpShot,Terri Miller Jr. missed Three Point Jumper.,61,72,2nd Half,7:41,False,2502,2025-01-31T03:27:41Z
401719664102926101,102926101,Defensive Rebound,Joe Pridgen Defensive Rebound.,61,72,2nd Half,7:38,False,149,2025-01-31T03:27:45Z
401719664102926901,102926901,JumpShot,Te'Jon Sawyer made Three Point Jumper. Assisted by Joe Pridgen.,61,75,2nd Half,7:30,True,149,2025-01-31T03:27:53Z
401719664102928901,102928901,LayUpShot,Qiant Myers made Layup.,63,75,2nd Half,7:10,True,2502,2025-01-31T03:28:13Z
401719664102929101,102929101,OfficialTVTimeOut,Official TV Timeout,63,75,2nd Half,7:08,False,,2025-01-31T03:28:13Z
401719664102934401,102934401,LayUpShot,Malik Moore missed Layup.,63,75,2nd Half,6:55,False,149,2025-01-31T03:31:08Z
401719664102934601,102934601,Defensive Rebound,Tre-Vaughn Minott Defensive Rebound.,63,75,2nd Half,6:53,False,2502,2025-01-31T03:31:08Z
401719664102935901,102935901,JumpShot,Isaiah Johnson missed Jumper.,63,75,2nd Half,6:40,False,2502,2025-01-31T03:31:23Z
401719664102936401,102936401,Offensive Rebound,Isaiah Johnson Offensive Rebound.,63,75,2nd Half,6:35,False,2502,2025-01-31T03:31:31Z
401719664102936402,102936402,JumpShot,Isaiah Johnson made Jumper.,65,75,2nd Half,6:35,True,2502,2025-01-31T03:31:31Z
401719664102938801,102938801,PersonalFoul,Foul on Shane Nowell.,65,75,2nd Half,6:11,False,2502,2025-01-31T03:31:51Z
401719664102938802,102938802,OfficialTVTimeOut,Official TV Timeout,65,75,2nd Half,6:11,False,,2025-01-31T03:31:51Z
401719664102938803,102938803,MadeFreeThrow,Brandon Whitney made Free Throw.,65,76,2nd Half,6:11,True,149,2025-01-31T03:31:51Z
401719664102938804,102938804,MadeFreeThrow,Brandon Whitney missed Free Throw.,65,76,2nd Half,6:11,False,149,2025-01-31T03:31:51Z
401719664102939001,102939001,Defensive Rebound,Tre-Vaughn Minott Defensive Rebound.,65,76,2nd Half,6:09,False,2502,2025-01-31T03:35:03Z
401719664102944101,102944101,JumpShot,Jaylin Henderson missed Three Point Jumper.,65,76,2nd Half,5:58,False,2502,2025-01-31T03:35:15Z
401719664102944601,102944601,Defensive Rebound,Joe Pridgen Defensive Rebound.,65,76,2nd Half,5:53,False,149,2025-01-31T03:35:18Z
401719664102946201,102946201,LayUpShot,Brandon Whitney made Layup.,65,78,2nd Half,5:37,True,149,2025-01-31T03:35:33Z
401719664102947501,102947501,PersonalFoul,Foul on Brandon Whitney.,65,78,2nd Half,5:24,False,149,2025-01-31T03:36:20Z
401719664102947901,102947901,PersonalFoul,Foul on Amari Jedkins.,65,78,2nd Half,5:20,False,149,2025-01-31T03:36:49Z
401719664102947902,102947902,MadeFreeThrow,Terri Miller Jr. made Free Throw.,66,78,2nd Half,5:20,True,2502,2025-01-31T03:36:49Z
401719664102947903,102947903,MadeFreeThrow,Terri Miller Jr. made Free Throw.,67,78,2nd Half,5:20,True,2502,2025-01-31T03:36:49Z
401719664102954501,102954501,JumpShot,Brandon Whitney made Jumper.,67,80,2nd Half,4:54,True,149,2025-01-31T03:38:25Z
401719664102956001,102956001,JumpShot,Jaylin Henderson made Three Point Jumper. Assisted by Qiant Myers.,70,80,2nd Half,4:39,True,2502,2025-01-31T03:38:41Z
401719664102958001,102958001,DunkShot,Joe Pridgen made Dunk. Assisted by Brandon Whitney.,70,82,2nd Half,4:19,True,149,2025-01-31T03:38:59Z
401719664102959501,102959501,JumpShot,Shane Nowell missed Three Point Jumper.,70,82,2nd Half,4:04,False,2502,2025-01-31T03:39:16Z
401719664102964001,102964001,Defensive Rebound,Money Williams Defensive Rebound.,70,82,2nd Half,3:59,False,149,2025-01-31T03:39:19Z
401719664102966401,102966401,JumpShot,Brandon Whitney made Jumper.,70,84,2nd Half,3:35,True,149,2025-01-31T03:39:43Z
401719664102967601,102967601,PersonalFoul,Foul on Kai Johnson.,70,84,2nd Half,3:23,False,149,2025-01-31T03:39:54Z
401719664102967602,102967602,OfficialTVTimeOut,Official TV Timeout,70,84,2nd Half,3:23,False,,2025-01-31T03:39:54Z
401719664102967603,102967603,MadeFreeThrow,Qiant Myers made Free Throw.,71,84,2nd Half,3:23,True,2502,2025-01-31T03:39:54Z
401719664102967604,102967604,MadeFreeThrow,Qiant Myers missed Free Throw.,71,84,2nd Half,3:23,False,2502,2025-01-31T03:43:08Z
401719664102967801,102967801,Defensive Rebound,Joe Pridgen Defensive Rebound.,71,84,2nd Half,3:21,False,149,2025-01-31T03:43:08Z
401719664102969601,102969601,LayUpShot,Brandon Whitney made Layup.,71,86,2nd Half,3:03,True,149,2025-01-31T03:43:28Z
401719664102969602,102969602,PersonalFoul,Foul on Qiant Myers.,71,86,2nd Half,3:03,False,2502,2025-01-31T03:43:28Z
401719664102969603,102969603,MadeFreeThrow,Brandon Whitney made Free Throw.,71,87,2nd Half,3:03,True,149,2025-01-31T03:43:28Z
401719664102975001,102975001,JumpShot,Terri Miller Jr. missed Jumper.,71,87,2nd Half,2:49,False,2502,2025-01-31T03:44:15Z
401719664102976001,102976001,Offensive Rebound,Isaiah Johnson Offensive Rebound.,71,87,2nd Half,2:39,False,2502,2025-01-31T03:44:28Z
401719664102976002,102976002,JumpShot,Isaiah Johnson missed Jumper.,71,87,2nd Half,2:39,False,2502,2025-01-31T03:44:28Z
401719664102976201,102976201,Defensive Rebound,Money Williams Defensive Rebound.,71,87,2nd Half,2:37,False,149,2025-01-31T03:44:28Z
401719664102978001,102978001,JumpShot,Money Williams missed Jumper.,71,87,2nd Half,2:19,False,149,2025-01-31T03:44:46Z
401719664102978301,102978301,Defensive Rebound,Terri Miller Jr. Defensive Rebound.,71,87,2nd Half,2:16,False,2502,2025-01-31T03:44:49Z
401719664102979401,102979401,JumpShot,Qiant Myers made Jumper.,73,87,2nd Half,2:05,True,2502,2025-01-31T03:44:59Z
401719664102986501,102986501,JumpShot,Brandon Whitney made Jumper.,73,89,2nd Half,1:34,True,149,2025-01-31T03:45:30Z
401719664102986502,102986502,PersonalFoul,Foul on Isaiah Johnson.,73,89,2nd Half,1:34,False,2502,2025-01-31T03:45:30Z
401719664102986503,102986503,MadeFreeThrow,Brandon Whitney made Free Throw.,73,90,2nd Half,1:34,True,149,2025-01-31T03:45:51Z
401719664102986504,102986504,ShortTimeOut,Montana Timeout,73,90,2nd Half,1:34,False,149,2025-01-31T03:45:51Z
401719664102987101,102987101,PersonalFoul,Foul on Amari Jedkins.,73,90,2nd Half,1:28,False,149,2025-01-31T03:47:24Z
401719664102987102,102987102,MadeFreeThrow,Jaylin Henderson missed Free Throw.,73,90,2nd Half,1:28,False,2502,2025-01-31T03:47:24Z
401719664102987103,102987103,Offensive Rebound,Portland State Offensive Rebound.,73,90,2nd Half,1:28,False,2502,2025-01-31T03:47:24Z
401719664102987104,102987104,MadeFreeThrow,Jaylin Henderson made Free Throw.,74,90,2nd Half,1:28,True,2502,2025-01-31T03:47:24Z
401719664102994001,102994001,LayUpShot,Joe Pridgen made Layup. Assisted by Brandon Whitney.,74,92,2nd Half,0:59,True,149,2025-01-31T03:48:45Z
401719664102995901,102995901,JumpShot,Shane Nowell made Jumper.,76,92,2nd Half,0:40,True,2502,2025-01-31T03:49:05Z
401719664102997101,102997101,ShortTimeOut,Montana Timeout,76,92,2nd Half,0:28,False,149,2025-01-31T03:49:17Z
401719664102997301,102997301,Lost Ball Turnover,Money Williams Turnover.,76,92,2nd Half,0:26,False,149,2025-01-31T03:49:51Z
401719664102997302,102997302,Steal,Shane Nowell Steal.,76,92,2nd Half,0:26,False,2502,2025-01-31T03:49:51Z
401719664102997701,102997701,LayUpShot,Shane Nowell made Layup.,78,92,2nd Half,0:22,True,2502,2025-01-31T03:49:51Z
401719664102999901,102999901,End Period,End of 2nd half,78,92,2nd Half,0:00,False,,2025-01-31T03:50:06Z
401719664102999902,102999902,End Game,End of Game,78,92,2nd Half,0:00,False,,2025-01-31T03:50:06Z
