play_id,sequence_number,type,description,away_score,home_score,period,clock,scoring_play,team_id,timestamp_utc
401719654101805601,101805601,JumpShot,Jaylin Henderson made Jumper.,0,2,1st Half,19:43,True,2502,2024-12-07T22:00:43Z
401719654101808301,101808301,LayUpShot,Nicholas Shogbonyo made Layup. Assisted by Pedro Lopez-Sanvicente.,2,2,1st Half,19:16,True,2172,2024-12-07T22:01:11Z
401719654101814401,101814401,Lost Ball Turnover,Tre-Vaughn Minott Turnover.,2,2,1st Half,18:55,False,2502,2024-12-07T22:01:31Z
401719654101814402,101814402,Steal,Isaiah Addo-Ankrah Steal.,2,2,1st Half,18:55,False,2172,2024-12-07T22:01:31Z
401719654101816701,101816701,JumpShot,Josh Lee missed Jumper.,2,2,1st Half,18:32,False,2172,2024-12-07T22:02:09Z
401719654101817101,101817101,Offensive Rebound,Josh Lee Offensive Rebound.,2,2,1st Half,18:28,False,2172,2024-12-07T22:02:10Z
401719654101817301,101817301,JumpShot,Isaiah Addo-Ankrah made Three Point Jumper. Assisted by Josh Lee.,5,2,1st Half,18:26,True,2172,2024-12-07T22:02:15Z
401719654101819101,101819101,JumpShot,Isaiah Johnson missed Three Point Jumper.,5,2,1st Half,18:08,False,2502,2024-12-07T22:02:34Z
401719654101819301,101819301,Offensive Rebound,Portland State Offensive Rebound.,5,2,1st Half,18:06,False,2502,2024-12-07T22:02:34Z
401719654101819302,101819302,PersonalFoul,Foul on Pedro Lopez-Sanvicente.,5,2,1st Half,18:06,False,2172,2024-12-07T22:02:34Z
401719654101824101,101824101,Lost Ball Turnover,Qiant Myers Turnover.,5,2,1st Half,17:58,False,2502,2024-12-07T22:02:34Z
401719654101824102,101824102,Steal,Pedro Lopez-Sanvicente Steal.,5,2,1st Half,17:58,False,2172,2024-12-07T22:03:03Z
401719654101824601,101824601,LayUpShot,Nicholas Shogbonyo made Layup. Assisted by Pedro Lopez-Sanvicente.,7,2,1st Half,17:53,True,2172,2024-12-07T22:03:07Z
401719654101827101,101827101,JumpShot,Isaiah Johnson missed Jumper.,7,2,1st Half,17:28,False,2502,2024-12-07T22:03:32Z
401719654101827501,101827501,Offensive Rebound,Qiant Myers Offensive Rebound.,7,2,1st Half,17:24,False,2502,2024-12-07T22:03:32Z
401719654101827701,101827701,JumpShot,Shane Nowell missed Three Point Jumper.,7,2,1st Half,17:22,False,2502,2024-12-07T22:03:40Z
401719654101828001,101828001,Defensive Rebound,Nicholas Shogbonyo Defensive Rebound.,7,2,1st Half,17:19,False,2172,2024-12-07T22:03:40Z
401719654101828401,101828401,LayUpShot,DeAndre Craig missed Layup.,7,2,1st Half,17:15,False,2172,2024-12-07T22:03:45Z
401719654101828402,101828402,Block Shot,Tre-Vaughn Minott Block.,7,2,1st Half,17:15,False,2502,2024-12-07T22:03:45Z
401719654101828501,101828501,Defensive Rebound,Jaylin Henderson Defensive Rebound.,7,2,1st Half,17:14,False,2502,2024-12-07T22:03:45Z
401719654101829801,101829801,JumpShot,Jaylin Henderson made Three Point Jumper. Assisted by Cole Farrell.,7,5,1st Half,17:01,True,2502,2024-12-07T22:04:29Z
401719654101835101,101835101,PersonalFoul,Foul on Isaiah Johnson.,7,5,1st Half,16:48,False,2502,2024-12-07T22:04:41Z
401719654101835102,101835102,MadeFreeThrow,Josh Lee missed Free Throw.,7,5,1st Half,16:48,False,2172,2024-12-07T22:04:41Z
401719654101835103,101835103,Offensive Rebound,Denver Offensive Rebound.,7,5,1st Half,16:48,False,2172,2024-12-07T22:04:41Z
401719654101835104,101835104,MadeFreeThrow,Josh Lee made Free Throw.,8,5,1st Half,16:48,True,2172,2024-12-07T22:04:41Z
401719654101836601,101836601,Lost Ball Turnover,Jaylin Henderson Turnover.,8,5,1st Half,16:33,False,2502,2024-12-07T22:04:41Z
401719654101836602,101836602,Steal,Nicholas Shogbonyo Steal.,8,5,1st Half,16:33,False,2172,2024-12-07T22:06:04Z
401719654101837401,101837401,JumpShot,Isaiah Addo-Ankrah made Three Point Jumper. Assisted by Josh Lee.,11,5,1st Half,16:25,True,2172,2024-12-07T22:06:29Z
401719654101844401,101844401,PersonalFoul,Foul on Josh Pickett.,11,5,1st Half,15:55,False,2172,2024-12-07T22:06:57Z
401719654101844402,101844402,OfficialTVTimeOut, Official TV Timeout,11,5,1st Half,15:55,False,,2024-12-07T22:06:57Z
401719654101844403,101844403,MadeFreeThrow,Isaiah Johnson missed Free Throw.,11,5,1st Half,15:55,False,2502,2024-12-07T22:09:22Z
401719654101844404,101844404,Offensive Rebound,Portland State Offensive Rebound.,11,5,1st Half,15:55,False,2502,2024-12-07T22:09:22Z
401719654101844405,101844405,MadeFreeThrow,Isaiah Johnson made Free Throw.,11,6,1st Half,15:55,True,2502,2024-12-07T22:09:22Z
401719654101845901,101845901,Lost Ball Turnover,Sebastian Akins Turnover.,11,6,1st Half,15:40,False,2172,2024-12-07T22:10:36Z
401719654101845902,101845902,Steal,Terri Miller Jr. Steal.,11,6,1st Half,15:40,False,2502,2024-12-07T22:10:36Z
401719654101846501,101846501,LayUpShot,Jaylin Henderson missed Layup.,11,6,1st Half,15:34,False,2502,2024-12-07T22:10:40Z
401719654101847001,101847001,Offensive Rebound,Hayden Curtiss Offensive Rebound.,11,6,1st Half,15:29,False,2502,2024-12-07T22:10:45Z
401719654101847002,101847002,JumpShot,Hayden Curtiss made Jumper.,11,8,1st Half,15:29,True,2502,2024-12-07T22:10:45Z
401719654101849801,101849801,JumpShot,Josh Lee made Jumper.,13,8,1st Half,15:01,True,2172,2024-12-07T22:11:15Z
401719654101855301,101855301,Lost Ball Turnover,Qiant Myers Turnover.,13,8,1st Half,14:46,False,2502,2024-12-07T22:11:29Z
401719654101857801,101857801,JumpShot,Isaiah Addo-Ankrah missed Three Point Jumper.,13,8,1st Half,14:21,False,2172,2024-12-07T22:12:05Z
401719654101858101,101858101,Defensive Rebound,Terri Miller Jr. Defensive Rebound.,13,8,1st Half,14:18,False,2502,2024-12-07T22:12:06Z
401719654101859301,101859301,LayUpShot,Isaiah Johnson made Layup. Assisted by Qiant Myers.,13,10,1st Half,14:06,True,2502,2024-12-07T22:12:19Z
401719654101865201,101865201,JumpShot,DeAndre Craig made Jumper.,15,10,1st Half,13:47,True,2172,2024-12-07T22:12:38Z
401719654101866601,101866601,JumpShot,Hayden Curtiss made Three Point Jumper. Assisted by Qiant Myers.,15,13,1st Half,13:33,True,2502,2024-12-07T22:12:54Z
401719654101868801,101868801,JumpShot,Isaiah Addo-Ankrah made Three Point Jumper. Assisted by Sebastian Akins.,18,13,1st Half,13:11,True,2172,2024-12-07T22:13:14Z
401719654101874901,101874901,LayUpShot,Terri Miller Jr. made Layup. Assisted by Hayden Curtiss.,18,15,1st Half,12:50,True,2502,2024-12-07T22:13:35Z
401719654101877801,101877801,JumpShot,Josh Lee missed Jumper.,18,15,1st Half,12:21,False,2172,2024-12-07T22:14:05Z
401719654101878101,101878101,Defensive Rebound,Terri Miller Jr. Defensive Rebound.,18,15,1st Half,12:18,False,2502,2024-12-07T22:14:07Z
401719654101878901,101878901,JumpShot,Hayden Curtiss missed Three Point Jumper.,18,15,1st Half,12:10,False,2502,2024-12-07T22:14:16Z
401719654101879201,101879201,Defensive Rebound,Josh Pickett Defensive Rebound.,18,15,1st Half,12:07,False,2172,2024-12-07T22:14:19Z
401719654101884101,101884101,JumpShot,Isaiah Addo-Ankrah made Three Point Jumper. Assisted by Sebastian Akins.,21,15,1st Half,11:58,True,2172,2024-12-07T22:14:28Z
401719654101886001,101886001,JumpShot,Jaylin Henderson missed Three Point Jumper.,21,15,1st Half,11:39,False,2502,2024-12-07T22:14:48Z
401719654101886401,101886401,Defensive Rebound,Sebastian Akins Defensive Rebound.,21,15,1st Half,11:35,False,2172,2024-12-07T22:14:51Z
401719654101887001,101887001,JumpShot,Isaiah Addo-Ankrah missed Three Point Jumper.,21,15,1st Half,11:29,False,2172,2024-12-07T22:14:51Z
401719654101887201,101887201,Defensive Rebound,Terri Miller Jr. Defensive Rebound.,21,15,1st Half,11:27,False,2502,2024-12-07T22:14:51Z
401719654101889201,101889201,JumpShot,Hayden Curtiss made Three Point Jumper. Assisted by Qiant Myers.,21,18,1st Half,11:07,True,2502,2024-12-07T22:15:19Z
401719654101896401,101896401,JumpShot,DeAndre Craig missed Three Point Jumper.,21,18,1st Half,10:35,False,2172,2024-12-07T22:15:51Z
401719654101896701,101896701,Defensive Rebound,Hayden Curtiss Defensive Rebound.,21,18,1st Half,10:32,False,2502,2024-12-07T22:15:53Z
401719654101897201,101897201,PersonalFoul,Foul on DeAndre Craig.,21,18,1st Half,10:27,False,2172,2024-12-07T22:15:58Z
401719654101897202,101897202,OfficialTVTimeOut, Official TV Timeout,21,18,1st Half,10:27,False,,2024-12-07T22:15:58Z
401719654101897203,101897203,MadeFreeThrow,Terri Miller Jr. made Free Throw.,21,19,1st Half,10:27,True,2502,2024-12-07T22:15:58Z
401719654101897204,101897204,MadeFreeThrow,Terri Miller Jr. made Free Throw.,21,20,1st Half,10:27,True,2502,2024-12-07T22:15:58Z
401719654101899101,101899101,JumpShot,Sebastian Akins missed Jumper.,21,20,1st Half,10:08,False,2172,2024-12-07T22:19:35Z
401719654101899401,101899401,Defensive Rebound,Tre-Vaughn Minott Defensive Rebound.,21,20,1st Half,10:05,False,2502,2024-12-07T22:19:39Z
401719654101904101,101904101,DunkShot,Tre-Vaughn Minott made Dunk. Assisted by Qiant Myers.,21,22,1st Half,9:58,True,2502,2024-12-07T22:19:46Z
401719654101905201,101905201,PersonalFoul,Foul on Shane Nowell.,21,22,1st Half,9:47,False,2502,2024-12-07T22:19:56Z
401719654101906001,101906001,JumpShot,Isaiah Addo-Ankrah made Three Point Jumper. Assisted by Sebastian Akins.,24,22,1st Half,9:39,True,2172,2024-12-07T22:20:21Z
401719654101907601,101907601,PersonalFoul,Foul on Nicholas Shogbonyo.,24,22,1st Half,9:23,False,2172,2024-12-07T22:20:36Z
401719654101907602,101907602,MadeFreeThrow,Qiant Myers missed Free Throw.,24,22,1st Half,9:23,False,2502,2024-12-07T22:20:36Z
401719654101907603,101907603,Offensive Rebound,Portland State Offensive Rebound.,24,22,1st Half,9:23,False,2502,2024-12-07T22:20:36Z
401719654101907604,101907604,MadeFreeThrow,Qiant Myers made Free Throw.,24,23,1st Half,9:23,True,2502,2024-12-07T22:20:36Z
401719654101909601,101909601,JumpShot,DeAndre Craig missed Jumper.,24,23,1st Half,9:03,False,2172,2024-12-07T22:21:38Z
401719654101914001,101914001,Defensive Rebound,Tre-Vaughn Minott Defensive Rebound.,24,23,1st Half,8:59,False,2502,2024-12-07T22:21:40Z
401719654101914301,101914301,PersonalFoul,Foul on Jon Mani.,24,23,1st Half,8:56,False,2172,2024-12-07T22:21:43Z
401719654101914302,101914302,MadeFreeThrow,Shane Nowell made Free Throw.,24,24,1st Half,8:56,True,2502,2024-12-07T22:21:43Z
401719654101914303,101914303,MadeFreeThrow,Shane Nowell made Free Throw.,24,25,1st Half,8:56,True,2502,2024-12-07T22:21:43Z
401719654101916101,101916101,JumpShot,Nicholas Shogbonyo missed Three Point Jumper.,24,25,1st Half,8:38,False,2172,2024-12-07T22:22:54Z
401719654101916501,101916501,Defensive Rebound,Cole Farrell Defensive Rebound.,24,25,1st Half,8:34,False,2502,2024-12-07T22:22:56Z
401719654101917101,101917101,JumpShot,Shane Nowell missed Three Point Jumper.,24,25,1st Half,8:28,False,2502,2024-12-07T22:23:04Z
401719654101917301,101917301,Offensive Rebound,Tre-Vaughn Minott Offensive Rebound.,24,25,1st Half,8:26,False,2502,2024-12-07T22:23:04Z
401719654101917302,101917302,Lost Ball Turnover,Tre-Vaughn Minott Turnover.,24,25,1st Half,8:26,False,2502,2024-12-07T22:23:04Z
401719654101924001,101924001,JumpShot,Nicholas Shogbonyo made Jumper.,26,25,1st Half,7:59,True,2172,2024-12-07T22:23:52Z
401719654101925401,101925401,JumpShot,Shane Nowell made Jumper. Assisted by Cole Farrell.,26,27,1st Half,7:45,True,2502,2024-12-07T22:24:06Z
401719654101926101,101926101,Lost Ball Turnover,Nicholas Shogbonyo Turnover.,26,27,1st Half,7:38,False,2172,2024-12-07T22:24:13Z
401719654101926102,101926102,Steal,Cole Farrell Steal.,26,27,1st Half,7:38,False,2502,2024-12-07T22:24:13Z
401719654101926103,101926103,OfficialTVTimeOut, Official TV Timeout,26,27,1st Half,7:38,False,,2024-12-07T22:24:13Z
401719654101927401,101927401,Lost Ball Turnover,Shane Nowell Turnover.,26,27,1st Half,7:25,False,2502,2024-12-07T22:27:10Z
401719654101928301,101928301,DunkShot,Jon Mani made Dunk. Assisted by Josh Lee.,28,27,1st Half,7:16,True,2172,2024-12-07T22:27:28Z
401719654101935401,101935401,JumpShot,Jaylin Henderson made Three Point Jumper. Assisted by Terri Miller Jr..,28,30,1st Half,6:45,True,2502,2024-12-07T22:28:00Z
401719654101937701,101937701,JumpShot,Jon Mani missed Three Point Jumper.,28,30,1st Half,6:22,False,2172,2024-12-07T22:28:22Z
401719654101938001,101938001,Defensive Rebound,Terri Miller Jr. Defensive Rebound.,28,30,1st Half,6:19,False,2502,2024-12-07T22:28:25Z
401719654101944301,101944301,LayUpShot,Terri Miller Jr. made Layup. Assisted by Shane Nowell.,28,32,1st Half,5:56,True,2502,2024-12-07T22:29:41Z
401719654101945901,101945901,LayUpShot,Pedro Lopez-Sanvicente made Layup. Assisted by Nicholas Shogbonyo.,30,32,1st Half,5:40,True,2172,2024-12-07T22:29:57Z
401719654101946601,101946601,JumpShot,Jaylin Henderson missed Three Point Jumper.,30,32,1st Half,5:33,False,2502,2024-12-07T22:30:05Z
401719654101946701,101946701,Defensive Rebound,Denver Defensive Rebound.,30,32,1st Half,5:32,False,2172,2024-12-07T22:30:05Z
401719654101948501,101948501,JumpShot,DeAndre Craig made Jumper.,32,32,1st Half,5:14,True,2172,2024-12-07T22:30:44Z
401719654101955701,101955701,JumpShot,Terri Miller Jr. made Jumper. Assisted by Qiant Myers.,32,34,1st Half,4:42,True,2502,2024-12-07T22:33:41Z
401719654101957501,101957501,PersonalFoul,Foul on Shane Nowell.,32,34,1st Half,4:24,False,2502,2024-12-07T22:31:49Z
401719654101959101,101959101,PersonalFoul,Foul on Jaylin Henderson.,32,34,1st Half,4:08,False,2502,2024-12-07T22:32:29Z
401719654101959102,101959102,MadeFreeThrow,Sebastian Akins missed Free Throw.,32,34,1st Half,4:08,False,2172,2024-12-07T22:32:29Z
401719654101959103,101959103,Offensive Rebound,Denver Offensive Rebound.,32,34,1st Half,4:08,False,2172,2024-12-07T22:32:29Z
401719654101959104,101959104,MadeFreeThrow,Sebastian Akins made Free Throw.,33,34,1st Half,4:08,True,2172,2024-12-07T22:32:29Z
401719654101964101,101964101,LayUpShot,Jaylin Henderson missed Layup.,33,34,1st Half,3:58,False,2502,2024-12-07T22:33:24Z
401719654101964501,101964501,Defensive Rebound,DeAndre Craig Defensive Rebound.,33,34,1st Half,3:54,False,2172,2024-12-07T22:33:24Z
401719654101964601,101964601,LayUpShot,DeAndre Craig made Layup.,35,34,1st Half,3:53,True,2172,2024-12-07T22:33:27Z
401719654101966001,101966001,PersonalFoul,Foul on Sebastian Akins.,35,34,1st Half,3:39,False,2172,2024-12-07T22:33:41Z
401719654101966002,101966002,OfficialTVTimeOut, Official TV Timeout,35,34,1st Half,3:39,False,,2024-12-07T22:33:41Z
401719654101967301,101967301,PersonalFoul,Foul on Pedro Lopez-Sanvicente.,35,34,1st Half,3:26,False,2172,2024-12-07T22:36:52Z
401719654101967302,101967302,MadeFreeThrow,Isaiah Johnson missed Free Throw.,35,34,1st Half,3:26,False,2502,2024-12-07T22:37:52Z
401719654101967303,101967303,Offensive Rebound,Portland State Offensive Rebound.,35,34,1st Half,3:26,False,2502,2024-12-07T22:37:52Z
401719654101967304,101967304,MadeFreeThrow,Isaiah Johnson made Free Throw.,35,35,1st Half,3:26,True,2502,2024-12-07T22:37:52Z
401719654101968501,101968501,JumpShot,Nicholas Shogbonyo made Three Point Jumper. Assisted by DeAndre Craig.,38,35,1st Half,3:14,True,2172,2024-12-07T22:38:36Z
401719654101975701,101975701,JumpShot,Qiant Myers missed Three Point Jumper.,38,35,1st Half,2:42,False,2502,2024-12-07T22:39:07Z
401719654101975901,101975901,Defensive Rebound,Denver Defensive Rebound.,38,35,1st Half,2:40,False,2172,2024-12-07T22:39:07Z
401719654101976801,101976801,JumpShot,DeAndre Craig missed Three Point Jumper.,38,35,1st Half,2:31,False,2172,2024-12-07T22:39:37Z
401719654101977201,101977201,Defensive Rebound,Isaiah Johnson Defensive Rebound.,38,35,1st Half,2:27,False,2502,2024-12-07T22:39:40Z
401719654101978701,101978701,JumpShot,Qiant Myers missed Three Point Jumper.,38,35,1st Half,2:12,False,2502,2024-12-07T22:39:56Z
401719654101979001,101979001,Offensive Rebound,Tre-Vaughn Minott Offensive Rebound.,38,35,1st Half,2:09,False,2502,2024-12-07T22:39:59Z
401719654101979601,101979601,JumpShot,Qiant Myers missed Jumper.,38,35,1st Half,2:03,False,2502,2024-12-07T22:40:05Z
401719654101979901,101979901,Offensive Rebound,Tre-Vaughn Minott Offensive Rebound.,38,35,1st Half,2:00,False,2502,2024-12-07T22:40:07Z
401719654101979902,101979902,PersonalFoul,Foul on Sebastian Akins.,38,35,1st Half,2:00,False,2172,2024-12-07T22:40:07Z
401719654101979903,101979903,MadeFreeThrow,Tre-Vaughn Minott made Free Throw.,38,36,1st Half,2:00,True,2502,2024-12-07T22:40:44Z
401719654101979904,101979904,MadeFreeThrow,Tre-Vaughn Minott made Free Throw.,38,37,1st Half,2:00,True,2502,2024-12-07T22:40:44Z
401719654101985001,101985001,LayUpShot,DeAndre Craig missed Layup.,38,37,1st Half,1:49,False,2172,2024-12-07T22:41:25Z
401719654101985002,101985002,Block Shot,Tre-Vaughn Minott Block.,38,37,1st Half,1:49,False,2502,2024-12-07T22:41:30Z
401719654101985801,101985801,Offensive Rebound,Josh Pickett Offensive Rebound.,38,37,1st Half,1:41,False,2172,2024-12-07T22:41:30Z
401719654101985802,101985802,JumpShot,Josh Pickett made Jumper.,40,37,1st Half,1:41,True,2172,2024-12-07T22:41:30Z
401719654101986101,101986101,JumpShot,Hayden Curtiss missed Three Point Jumper.,40,37,1st Half,1:38,False,2502,2024-12-07T22:41:35Z
401719654101986401,101986401,Defensive Rebound,Josh Lee Defensive Rebound.,40,37,1st Half,1:35,False,2172,2024-12-07T22:41:37Z
401719654101988201,101988201,JumpShot,Josh Pickett missed Jumper.,40,37,1st Half,1:17,False,2172,2024-12-07T22:41:55Z
401719654101988501,101988501,Defensive Rebound,Jaylin Henderson Defensive Rebound.,40,37,1st Half,1:14,False,2502,2024-12-07T22:41:59Z
401719654101994101,101994101,JumpShot,Jaylin Henderson made Jumper.,40,39,1st Half,0:58,True,2502,2024-12-07T22:42:13Z
401719654101994102,101994102,PersonalFoul,Foul on Josh Lee.,40,39,1st Half,0:58,False,2172,2024-12-07T22:42:13Z
401719654101994103,101994103,MadeFreeThrow,Jaylin Henderson made Free Throw.,40,40,1st Half,0:58,True,2502,2024-12-07T22:42:13Z
401719654101995601,101995601,JumpShot,Nicholas Shogbonyo missed Jumper.,40,40,1st Half,0:43,False,2172,2024-12-07T22:43:09Z
401719654101995602,101995602,Block Shot,Jaylin Henderson Block.,40,40,1st Half,0:43,False,2502,2024-12-07T22:43:09Z
401719654101996001,101996001,Defensive Rebound,Kelcy Phipps Defensive Rebound.,40,40,1st Half,0:39,False,2502,2024-12-07T22:43:12Z
401719654101998501,101998501,JumpShot,Jaylin Henderson missed Jumper.,40,40,1st Half,0:14,False,2502,2024-12-07T22:44:05Z
401719654101998901,101998901,Offensive Rebound,Tre-Vaughn Minott Offensive Rebound.,40,40,1st Half,0:10,False,2502,2024-12-07T22:44:07Z
401719654101999101,101999101,JumpShot,Tre-Vaughn Minott missed Jumper.,40,40,1st Half,0:08,False,2502,2024-12-07T22:44:10Z
401719654101999102,101999102,Block Shot,Isaiah Addo-Ankrah Block.,40,40,1st Half,0:08,False,2172,2024-12-07T22:44:10Z
401719654101999201,101999201,Offensive Rebound,Isaiah Johnson Offensive Rebound.,40,40,1st Half,0:07,False,2502,2024-12-07T22:44:10Z
401719654101999202,101999202,PersonalFoul,Foul on Isaiah Addo-Ankrah.,40,40,1st Half,0:07,False,2172,2024-12-07T22:44:10Z
401719654101999203,101999203,MadeFreeThrow,Isaiah Johnson missed Free Throw.,40,40,1st Half,0:07,False,2502,2024-12-07T22:44:10Z
401719654101999204,101999204,Offensive Rebound,Portland State Offensive Rebound.,40,40,1st Half,0:07,False,2502,2024-12-07T22:44:10Z
401719654101999205,101999205,ShortTimeOut,Denver  Timeout,40,40,1st Half,0:07,False,2172,2024-12-07T22:44:10Z
401719654101999206,101999206,MadeFreeThrow,Isaiah Johnson made Free Throw.,40,41,1st Half,0:07,True,2502,2024-12-07T22:44:10Z
401719654101999902,101999902,JumpShot,DeAndre Craig missed Three Point Jumper.,40,41,1st Half,0:00,False,2172,2024-12-07T22:46:17Z
401719654101999904,101999904,Offensive Rebound,Denver Offensive Rebound.,40,41,1st Half,0:00,False,2172,2024-12-07T22:46:17Z
401719654101999901,101999901,End Period,End of 1st half,40,41,1st Half,0:00,False,,2024-12-07T22:46:17Z
401719654102805401,102805401,LayUpShot,Jaylin Henderson missed Layup.,40,41,2nd Half,19:45,False,2502,
401719654102805402,102805402,Block Shot,Pedro Lopez-Sanvicente Block.,40,41,2nd Half,19:45,False,2172,
401719654102806001,102806001,Defensive Rebound,Nicholas Shogbonyo Defensive Rebound.,40,41,2nd Half,19:39,False,2172,2024-12-07T23:02:39Z
401719654102807001,102807001,PersonalFoul,Foul on Jaylin Henderson.,40,41,2nd Half,19:29,False,2502,2024-12-07T23:02:48Z
401719654102808901,102808901,JumpShot,DeAndre Craig missed Three Point Jumper.,40,41,2nd Half,19:10,False,2172,2024-12-07T23:03:27Z
401719654102809201,102809201,Defensive Rebound,Shane Nowell Defensive Rebound.,40,41,2nd Half,19:07,False,2502,2024-12-07T23:03:30Z
401719654102814601,102814601,JumpShot,Shane Nowell missed Jumper.,40,41,2nd Half,18:53,False,2502,2024-12-07T23:03:44Z
401719654102815001,102815001,Defensive Rebound,Josh Lee Defensive Rebound.,40,41,2nd Half,18:49,False,2172,2024-12-07T23:03:46Z
401719654102817701,102817701,JumpShot,Pedro Lopez-Sanvicente missed Three Point Jumper.,40,41,2nd Half,18:22,False,2172,2024-12-07T23:05:10Z
401719654102818001,102818001,Offensive Rebound,Josh Lee Offensive Rebound.,40,41,2nd Half,18:19,False,2172,2024-12-07T23:05:12Z
401719654102819801,102819801,JumpShot,Nicholas Shogbonyo missed Jumper.,40,41,2nd Half,18:01,False,2172,2024-12-07T23:05:12Z
401719654102824101,102824101,Defensive Rebound,Tre-Vaughn Minott Defensive Rebound.,40,41,2nd Half,17:58,False,2502,2024-12-07T23:05:32Z
401719654102824901,102824901,DunkShot,Tre-Vaughn Minott made Dunk. Assisted by Qiant Myers.,40,43,2nd Half,17:50,True,2502,2024-12-07T23:05:42Z
401719654102826201,102826201,Lost Ball Turnover,Pedro Lopez-Sanvicente Turnover.,40,43,2nd Half,17:37,False,2172,2024-12-07T23:05:54Z
401719654102827901,102827901,PersonalFoul,Foul on Josh Lee.,40,43,2nd Half,17:20,False,2172,2024-12-07T23:06:21Z
401719654102827902,102827902,MadeFreeThrow,Shane Nowell made Free Throw.,40,44,2nd Half,17:20,True,2502,2024-12-07T23:06:21Z
401719654102827903,102827903,MadeFreeThrow,Shane Nowell made Free Throw.,40,45,2nd Half,17:20,True,2502,2024-12-07T23:06:21Z
401719654102829401,102829401,JumpShot,Isaiah Addo-Ankrah missed Three Point Jumper.,40,45,2nd Half,17:05,False,2172,2024-12-07T23:07:35Z
401719654102829801,102829801,Offensive Rebound,Josh Lee Offensive Rebound.,40,45,2nd Half,17:01,False,2172,2024-12-07T23:07:35Z
401719654102835501,102835501,Lost Ball Turnover,Sebastian Akins Turnover.,40,45,2nd Half,16:44,False,2172,2024-12-07T23:08:13Z
401719654102835502,102835502,Steal,Qiant Myers Steal.,40,45,2nd Half,16:44,False,2502,2024-12-07T23:08:13Z
401719654102835701,102835701,PersonalFoul,Foul on DeAndre Craig.,40,45,2nd Half,16:42,False,2172,2024-12-07T23:08:13Z
401719654102835702,102835702,MadeFreeThrow,Jaylin Henderson missed Free Throw.,40,45,2nd Half,16:42,False,2502,2024-12-07T23:08:13Z
401719654102835703,102835703,Offensive Rebound,Portland State Offensive Rebound.,40,45,2nd Half,16:42,False,2502,2024-12-07T23:08:13Z
401719654102835704,102835704,MadeFreeThrow,Jaylin Henderson made Free Throw.,40,46,2nd Half,16:42,True,2502,2024-12-07T23:09:01Z
401719654102837401,102837401,PersonalFoul,Foul on Isaiah Johnson.,40,46,2nd Half,16:25,False,2502,2024-12-07T23:09:25Z
401719654102837402,102837402,MadeFreeThrow,DeAndre Craig made Free Throw.,41,46,2nd Half,16:25,True,2172,2024-12-07T23:09:25Z
401719654102837403,102837403,MadeFreeThrow,DeAndre Craig made Free Throw.,42,46,2nd Half,16:25,True,2172,2024-12-07T23:09:25Z
401719654102838901,102838901,PersonalFoul,Foul on Josh Lee.,42,46,2nd Half,16:10,False,2172,2024-12-07T23:10:45Z
401719654102839201,102839201,LayUpShot,Shane Nowell made Layup. Assisted by Qiant Myers.,42,48,2nd Half,16:07,True,2502,2024-12-07T23:11:05Z
401719654102845401,102845401,JumpShot,Sebastian Akins missed Three Point Jumper.,42,48,2nd Half,15:45,False,2172,2024-12-07T23:11:29Z
401719654102845701,102845701,Offensive Rebound,Josh Lee Offensive Rebound.,42,48,2nd Half,15:42,False,2172,2024-12-07T23:11:32Z
401719654102846001,102846001,LayUpShot,Nicholas Shogbonyo missed Layup.,42,48,2nd Half,15:39,False,2172,2024-12-07T23:11:34Z
401719654102846002,102846002,Block Shot,Tre-Vaughn Minott Block.,42,48,2nd Half,15:39,False,2502,2024-12-07T23:11:34Z
401719654102846401,102846401,Defensive Rebound,Shane Nowell Defensive Rebound.,42,48,2nd Half,15:35,False,2502,2024-12-07T23:11:37Z
401719654102846801,102846801,JumpShot,Isaiah Johnson missed Three Point Jumper.,42,48,2nd Half,15:31,False,2502,2024-12-07T23:11:44Z
401719654102847201,102847201,Defensive Rebound,Nicholas Shogbonyo Defensive Rebound.,42,48,2nd Half,15:27,False,2172,2024-12-07T23:11:46Z
401719654102847601,102847601,LayUpShot,Nicholas Shogbonyo missed Layup.,42,48,2nd Half,15:23,False,2172,2024-12-07T23:11:52Z
401719654102847901,102847901,Defensive Rebound,Isaiah Johnson Defensive Rebound.,42,48,2nd Half,15:20,False,2502,2024-12-07T23:11:52Z
401719654102849401,102849401,DunkShot,Tre-Vaughn Minott made Dunk. Assisted by Qiant Myers.,42,50,2nd Half,15:05,True,2502,2024-12-07T23:12:08Z
401719654102854601,102854601,JumpShot,Pedro Lopez-Sanvicente missed Three Point Jumper.,42,50,2nd Half,14:53,False,2172,2024-12-07T23:12:21Z
401719654102855001,102855001,Offensive Rebound,Josh Lee Offensive Rebound.,42,50,2nd Half,14:49,False,2172,2024-12-07T23:12:25Z
401719654102855201,102855201,LayUpShot,Josh Lee made Layup.,44,50,2nd Half,14:47,True,2172,2024-12-07T23:12:26Z
401719654102857001,102857001,Lost Ball Turnover,Qiant Myers Turnover.,44,50,2nd Half,14:29,False,2502,2024-12-07T23:12:45Z
401719654102857002,102857002,Steal,Sebastian Akins Steal.,44,50,2nd Half,14:29,False,2172,2024-12-07T23:12:45Z
401719654102857601,102857601,LayUpShot,DeAndre Craig missed Layup.,44,50,2nd Half,14:23,False,2172,2024-12-07T23:12:50Z
401719654102858001,102858001,Offensive Rebound,Sebastian Akins Offensive Rebound.,44,50,2nd Half,14:19,False,2172,2024-12-07T23:12:50Z
401719654102859601,102859601,PersonalFoul,Foul on Jaylin Henderson.,44,50,2nd Half,14:03,False,2502,2024-12-07T23:13:09Z
401719654102859602,102859602,OfficialTVTimeOut, Official TV Timeout,44,50,2nd Half,14:03,False,,2024-12-07T23:13:09Z
401719654102865501,102865501,PersonalFoul,Foul on Terri Miller Jr..,44,50,2nd Half,13:44,False,2502,2024-12-07T23:16:33Z
401719654102865502,102865502,MadeFreeThrow,Pedro Lopez-Sanvicente made Free Throw.,45,50,2nd Half,13:44,True,2172,2024-12-07T23:16:44Z
