play_id,sequence_number,type,description,away_score,home_score,period,clock,scoring_play,team_id,timestamp_utc
401708397111987781,111987781,LayUpShot,Cam Carter made Layup. Assisted by Vyctorius Miller.,67,69,2nd Half,4:14,True,99,2025-02-16T05:59:11Z
401708397111987868,111987868,PersonalFoul,Foul on Jeremiah Fears.,67,69,2nd Half,4:14,False,201,2025-02-16T05:59:14Z
401708397111987921,111987921,Substitution,Glenn Taylor Jr. subbing out for Oklahoma,67,69,2nd Half,4:14,False,201,2025-02-16T05:59:38Z
401708397111987949,111987949,Substitution,Brycen Goodine subbing in for Oklahoma,67,69,2nd Half,4:14,False,201,2025-02-16T05:59:38Z
401708397111987960,111987960,MadeFreeThrow,Cam Carter made Free Throw.,68,69,2nd Half,4:14,True,99,2025-02-16T05:59:49Z
401708397111988017,111988017,JumpShot,Jeremiah Fears missed Three Point Jumper.,68,69,2nd Half,3:48,False,201,2025-02-16T06:00:21Z
401708397111988037,111988037,Offensive Rebound,Duke Miles Offensive Rebound.,68,69,2nd Half,3:44,False,201,2025-02-16T06:00:25Z
401708397111988084,111988084,LayUpShot,Duke Miles made Layup.,68,71,2nd Half,3:44,True,201,2025-02-16T06:00:27Z
401708397111988120,111988120,PersonalFoul,Foul on Daimion Collins.,68,71,2nd Half,3:44,False,99,2025-02-16T06:00:31Z
401708397111988154,111988154,OfficialTVTimeOut,Official TV Timeout,68,71,2nd Half,3:44,False,,2025-02-16T06:02:06Z
401708397111988169,111988169,Substitution,Brycen Goodine subbing out for Oklahoma,68,71,2nd Half,3:44,False,201,2025-02-16T06:03:47Z
401708397111988179,111988179,Substitution,Glenn Taylor Jr. subbing in for Oklahoma,68,71,2nd Half,3:44,False,201,2025-02-16T06:03:47Z
401708397111988210,111988210,Substitution,Daimion Collins subbing out for LSU,68,71,2nd Half,3:44,False,99,2025-02-16T06:03:47Z
401708397111988221,111988221,Substitution,Mike Williams III subbing in for LSU,68,71,2nd Half,3:44,False,99,2025-02-16T06:03:47Z
401708397111988298,111988298,MadeFreeThrow,Duke Miles made Free Throw.,68,72,2nd Half,3:44,True,201,2025-02-16T06:04:03Z
401708397111988360,111988360,JumpShot,Cam Carter missed Jumper.,68,72,2nd Half,3:20,False,99,2025-02-16T06:04:30Z
401708397111988404,111988404,Defensive Rebound,Duke Miles Defensive Rebound.,68,72,2nd Half,3:16,False,201,2025-02-16T06:04:33Z
401708397111988418,111988418,JumpShot,Jeremiah Fears missed Jumper.,68,72,2nd Half,3:02,False,201,2025-02-16T06:04:47Z
401708397111988452,111988452,Defensive Rebound,Mike Williams III Defensive Rebound.,68,72,2nd Half,2:59,False,99,2025-02-16T06:04:50Z
401708397111988597,111988597,JumpShot,Curtis Givens III missed Three Point Jumper.,68,72,2nd Half,2:41,False,99,2025-02-16T06:05:41Z
401708397111988621,111988621,Dead Ball Rebound,LSU Deadball Team Rebound.,68,72,2nd Half,2:40,False,99,2025-02-16T06:05:48Z
401708397111988680,111988680,PersonalFoul,Foul on Dayton Forsythe.,68,72,2nd Half,2:40,False,201,2025-02-16T06:05:50Z
401708397111988809,111988809,MadeFreeThrow,Vyctorius Miller made Free Throw.,69,72,2nd Half,2:40,True,99,2025-02-16T06:06:12Z
401708397111988930,111988930,MadeFreeThrow,Vyctorius Miller missed Free Throw.,69,72,2nd Half,2:40,False,99,2025-02-16T06:06:27Z
401708397111989030,111989030,Defensive Rebound,Dayton Forsythe Defensive Rebound.,69,72,2nd Half,2:39,False,201,2025-02-16T06:06:28Z
401708397111989164,111989164,PersonalFoul,Foul on Cam Carter.,69,72,2nd Half,2:22,False,99,2025-02-16T06:06:50Z
401708397111989312,111989312,MadeFreeThrow,Glenn Taylor Jr. missed Free Throw.,69,72,2nd Half,2:22,False,201,2025-02-16T06:07:15Z
401708397111989376,111989376,Dead Ball Rebound,Oklahoma Deadball Team Rebound.,69,72,2nd Half,2:22,False,201,2025-02-16T06:07:15Z
401708397111989437,111989437,MadeFreeThrow,Glenn Taylor Jr. made Free Throw.,69,73,2nd Half,2:22,True,201,2025-02-16T06:07:34Z
401708397111989519,111989519,JumpShot,Mike Williams III made Three Point Jumper. Assisted by Vyctorius Miller.,72,73,2nd Half,2:04,True,99,2025-02-16T06:07:55Z
401708397111989667,111989667,LayUpShot,Dayton Forsythe missed Layup.,72,73,2nd Half,1:44,False,201,2025-02-16T06:08:15Z
401708397111989700,111989700,Offensive Rebound,Jalon Moore Offensive Rebound.,72,73,2nd Half,1:44,False,201,2025-02-16T06:08:18Z
401708397111989713,111989713,PersonalFoul,Foul on Mike Williams III.,72,73,2nd Half,1:44,False,99,2025-02-16T06:08:20Z
401708397111989807,111989807,MadeFreeThrow,Jalon Moore made Free Throw.,72,74,2nd Half,1:44,True,201,2025-02-16T06:08:45Z
401708397111989823,111989823,MadeFreeThrow,Jalon Moore made Free Throw.,72,75,2nd Half,1:44,True,201,2025-02-16T06:08:58Z
401708397111989903,111989903,LayUpShot,Cam Carter made Layup.,74,75,2nd Half,1:34,True,99,2025-02-16T06:09:12Z
401708397111989965,111989965,ShortTimeOut,Oklahoma Timeout,74,75,2nd Half,1:21,False,201,2025-02-16T06:09:37Z
401708397111990047,111990047,JumpShot,Dayton Forsythe made Jumper.,74,77,2nd Half,1:05,True,201,2025-02-16T06:11:14Z
401708397112016130,112016130,JumpShot,Curtis Givens III missed Three Point Jumper.,74,77,2nd Half,0:51,False,99,2025-02-16T06:11:28Z
401708397112016203,112016203,Defensive Rebound,Jeremiah Fears Defensive Rebound.,74,77,2nd Half,0:48,False,201,2025-02-16T06:11:30Z
401708397112016258,112016258,Lost Ball Turnover,Jeremiah Fears Turnover.,74,77,2nd Half,0:46,False,201,2025-02-16T06:11:34Z
401708397112016314,112016314,Steal,Mike Williams III Steal.,74,77,2nd Half,0:46,False,99,2025-02-16T06:11:34Z
401708397112016344,112016344,JumpShot,Cam Carter missed Three Point Jumper.,74,77,2nd Half,0:40,False,99,2025-02-16T06:11:39Z
401708397112016364,112016364,Defensive Rebound,Jalon Moore Defensive Rebound.,74,77,2nd Half,0:37,False,201,2025-02-16T06:11:42Z
401708397112016421,112016421,PersonalFoul,Foul on Dji Bailey.,74,77,2nd Half,0:35,False,99,2025-02-16T06:11:50Z
401708397112016482,112016482,MadeFreeThrow,Jalon Moore made Free Throw.,74,78,2nd Half,0:35,True,201,2025-02-16T06:12:27Z
401708397112016539,112016539,MadeFreeThrow,Jalon Moore made Free Throw.,74,79,2nd Half,0:35,True,201,2025-02-16T06:12:41Z
401708397112016674,112016674,ShortTimeOut,LSU Timeout,74,79,2nd Half,0:24,False,99,2025-02-16T06:13:11Z
401708397112016820,112016820,JumpShot,Cam Carter made Three Point Jumper. Assisted by Dji Bailey.,77,79,2nd Half,0:20,True,99,2025-02-16T06:14:22Z
401708397112016983,112016983,PersonalFoul,Foul on Jalon Moore.,77,79,2nd Half,0:20,False,201,2025-02-16T06:14:30Z
401708397112017060,112017060,MadeFreeThrow,Cam Carter made Free Throw.,78,79,2nd Half,0:20,True,99,2025-02-16T06:14:47Z
401708397112017282,112017282,Lost Ball Turnover,Jalon Moore Turnover.,78,79,2nd Half,0:15,False,201,2025-02-16T06:15:05Z
401708397112017353,112017353,Steal,Curtis Givens III Steal.,78,79,2nd Half,0:15,False,99,2025-02-16T06:15:05Z
401708397112017408,112017408,LayUpShot,Cam Carter made Layup.,80,79,2nd Half,0:08,True,99,2025-02-16T06:15:13Z
401708397112017462,112017462,PersonalFoul,Foul on Duke Miles.,80,79,2nd Half,0:08,False,201,2025-02-16T06:15:16Z
401708397112017544,112017544,Substitution,Glenn Taylor Jr. subbing out for Oklahoma,80,79,2nd Half,0:08,False,201,2025-02-16T06:15:33Z
401708397112017613,112017613,Substitution,Brycen Goodine subbing in for Oklahoma,80,79,2nd Half,0:08,False,201,2025-02-16T06:15:33Z
401708397112017643,112017643,RegularTimeOut,Oklahoma Timeout,80,79,2nd Half,0:08,False,201,2025-02-16T06:16:04Z
401708397112017671,112017671,MadeFreeThrow,Cam Carter made Free Throw.,81,79,2nd Half,0:08,True,99,2025-02-16T06:17:56Z
401708397112017765,112017765,LayUpShot,Jeremiah Fears missed Layup.,81,79,2nd Half,0:00,False,201,2025-02-16T06:18:11Z
401708397112017809,112017809,Defensive Rebound,Vyctorius Miller Defensive Rebound.,81,79,2nd Half,0:00,False,99,2025-02-16T06:18:21Z
401708397112017843,112017843,PersonalFoul,Foul on Jeremiah Fears.,81,79,2nd Half,0:00,False,201,2025-02-16T06:19:29Z
401708397112017911,112017911,MadeFreeThrow,Vyctorius Miller missed Free Throw.,81,79,2nd Half,0:00,False,99,2025-02-16T06:19:55Z
401708397112017949,112017949,Dead Ball Rebound,LSU Deadball Team Rebound.,81,79,2nd Half,0:00,False,99,2025-02-16T06:19:55Z
401708397112018023,112018023,MadeFreeThrow,Vyctorius Miller made Free Throw.,82,79,2nd Half,0:00,True,99,2025-02-16T06:20:10Z
401708397112018102,112018102,Substitution,Duke Miles subbing out for Oklahoma,82,79,2nd Half,0:00,False,201,2025-02-16T06:20:33Z
401708397112018174,112018174,Substitution,Luke Northweather subbing in for Oklahoma,82,79,2nd Half,0:00,False,201,2025-02-16T06:20:33Z
401708397112018436,112018436,End Period,End of 2nd half,82,79,2nd Half,0:00,False,,2025-02-16T06:20:39Z
401708397112018511,112018511,End Game,End of Game,82,79,2nd Half,0:00,False,,2025-02-16T06:20:46Z
