play_id,sequence_number,type,description,away_score,home_score,period,clock,scoring_play,team_id,timestamp_utc
401727120101805501,101805501,JumpShot,Niyi Olabode missed Jumper.,0,0,1st Half,19:44,False,27,2024-12-29T22:03:58Z
401727120101805801,101805801,Defensive Rebound,Nolan Minessale Defensive Rebound.,0,0,1st Half,19:41,False,2900,2024-12-29T22:03:58Z
401727120101807401,101807401,Lost Ball Turnover,Drake Dobbs Turnover.,0,0,1st Half,19:25,False,2900,2024-12-29T22:03:58Z
401727120101807402,101807402,Steal,Barrington Hargress Steal.,0,0,1st Half,19:25,False,27,2024-12-29T22:03:58Z
401727120101807901,101807901,LayUpShot,Niyi Olabode made Layup. Assisted by Barrington Hargress.,0,2,1st Half,19:20,True,27,2024-12-29T22:03:58Z
401727120101814101,101814101,LayUpShot,Kendall Blue missed Layup.,0,2,1st Half,18:58,False,2900,2024-12-29T22:03:58Z
401727120101814501,101814501,Defensive Rebound,Niyi Olabode Defensive Rebound.,0,2,1st Half,18:54,False,27,2024-12-29T22:03:58Z
401727120101815501,101815501,JumpShot,Barrington Hargress made Jumper.,0,4,1st Half,18:44,True,27,2024-12-29T22:03:58Z
401727120101816801,101816801,JumpShot,Carter Bjerke missed Three Point Jumper.,0,4,1st Half,18:31,False,2900,2024-12-29T22:05:13Z
401727120101817101,101817101,Defensive Rebound,Joel Armotrading Defensive Rebound.,0,4,1st Half,18:28,False,27,2024-12-29T22:05:13Z
401727120101817901,101817901,JumpShot,Niyi Olabode missed Three Point Jumper.,0,4,1st Half,18:20,False,27,2024-12-29T22:05:13Z
401727120101818401,101818401,Offensive Rebound,Kaleb Smith Offensive Rebound.,0,4,1st Half,18:15,False,27,2024-12-29T22:05:28Z
401727120101818501,101818501,JumpShot,Barrington Hargress missed Three Point Jumper.,0,4,1st Half,18:14,False,27,2024-12-29T22:05:41Z
401727120101818901,101818901,Defensive Rebound,Nolan Minessale Defensive Rebound.,0,4,1st Half,18:10,False,2900,2024-12-29T22:05:41Z
401727120101824201,101824201,JumpShot,Carter Bjerke missed Three Point Jumper.,0,4,1st Half,17:57,False,2900,2024-12-29T22:05:41Z
401727120101824501,101824501,Defensive Rebound,Joel Armotrading Defensive Rebound.,0,4,1st Half,17:54,False,27,2024-12-29T22:06:08Z
401727120101826801,101826801,JumpShot,Kaleb Smith made Three Point Jumper. Assisted by Nate Pickens.,0,7,1st Half,17:31,True,27,2024-12-29T22:07:11Z
401727120101829901,101829901,LayUpShot,Kendall Blue missed Layup.,0,7,1st Half,17:00,False,2900,2024-12-29T22:07:11Z
401727120101829902,101829902,Block Shot,Joel Armotrading Block.,0,7,1st Half,17:00,False,27,2024-12-29T22:07:11Z
401727120101835001,101835001,Offensive Rebound,Nolan Minessale Offensive Rebound.,0,7,1st Half,16:49,False,2900,2024-12-29T22:07:11Z
401727120101835101,101835101,LayUpShot,Nolan Minessale made Layup.,2,7,1st Half,16:48,True,2900,2024-12-29T22:07:11Z
401727120101836101,101836101,JumpShot,Niyi Olabode made Three Point Jumper. Assisted by Barrington Hargress.,2,10,1st Half,16:38,True,27,2024-12-29T22:07:28Z
401727120101837101,101837101,LayUpShot,Carter Bjerke missed Layup.,2,10,1st Half,16:28,False,2900,2024-12-29T22:07:58Z
401727120101837401,101837401,Defensive Rebound,Joel Armotrading Defensive Rebound.,2,10,1st Half,16:25,False,27,2024-12-29T22:07:58Z
401727120101837402,101837402,PersonalFoul,Foul on Carter Bjerke.,2,10,1st Half,16:25,False,2900,2024-12-29T22:07:58Z
401727120101839001,101839001,PersonalFoul,Foul on Kendall Blue.,2,10,1st Half,16:09,False,2900,2024-12-29T22:07:58Z
401727120101839002,101839002,MadeFreeThrow,Niyi Olabode made Free Throw.,2,11,1st Half,16:09,True,27,2024-12-29T22:09:13Z
401727120101839003,101839003,MadeFreeThrow,Niyi Olabode made Free Throw.,2,12,1st Half,16:09,True,27,2024-12-29T22:09:13Z
401727120101846301,101846301,Lost Ball Turnover,St. Thomas-Minnesota  Turnover.,2,12,1st Half,15:36,False,2900,2024-12-29T22:09:13Z
401727120101846401,101846401,OfficialTVTimeOut, Official TV Timeout,2,12,1st Half,15:35,False,,2024-12-29T22:09:13Z
401727120101848601,101848601,JumpShot,Parker Strauss made Three Point Jumper. Assisted by Nate Pickens.,2,15,1st Half,15:13,True,27,2024-12-29T22:15:11Z
401727120101854701,101854701,JumpShot,Rich Byhre missed Three Point Jumper.,2,15,1st Half,14:52,False,2900,2024-12-29T22:15:11Z
401727120101855101,101855101,Defensive Rebound,Jack Whitbourn Defensive Rebound.,2,15,1st Half,14:48,False,27,2024-12-29T22:15:11Z
401727120101856601,101856601,Lost Ball Turnover,Parker Strauss Turnover.,2,15,1st Half,14:33,False,27,2024-12-29T22:15:11Z
401727120101859801,101859801,JumpShot,Drake Dobbs missed Jumper.,2,15,1st Half,14:01,False,2900,2024-12-29T22:15:41Z
401727120101864301,101864301,Defensive Rebound,Jack Whitbourn Defensive Rebound.,2,15,1st Half,13:56,False,27,2024-12-29T22:15:41Z
401727120101866201,101866201,JumpShot,Jack Whitbourn missed Jumper.,2,15,1st Half,13:37,False,27,2024-12-29T22:15:57Z
401727120101866601,101866601,Offensive Rebound,Parker Strauss Offensive Rebound.,2,15,1st Half,13:33,False,27,2024-12-29T22:15:57Z
401727120101866602,101866602,Lost Ball Turnover,Parker Strauss Turnover.,2,15,1st Half,13:33,False,27,2024-12-29T22:15:57Z
401727120101868601,101868601,LayUpShot,Miles Barnstable made Layup.,4,15,1st Half,13:13,True,2900,2024-12-29T22:17:11Z
401727120101874501,101874501,JumpShot,Isaiah Moses missed Jumper.,4,15,1st Half,12:54,False,27,2024-12-29T22:17:28Z
401727120101874901,101874901,Defensive Rebound,Ryan Dufault Defensive Rebound.,4,15,1st Half,12:50,False,2900,2024-12-29T22:17:28Z
401727120101875301,101875301,JumpShot,Rich Byhre missed Three Point Jumper.,4,15,1st Half,12:46,False,2900,2024-12-29T22:17:28Z
401727120101875801,101875801,Defensive Rebound,Jack Whitbourn Defensive Rebound.,4,15,1st Half,12:41,False,27,2024-12-29T22:17:42Z
401727120101876701,101876701,Lost Ball Turnover,Isaiah Moses Turnover.,4,15,1st Half,12:32,False,27,2024-12-29T22:17:42Z
401727120101876702,101876702,Steal,Ryan Dufault Steal.,4,15,1st Half,12:32,False,2900,2024-12-29T22:17:42Z
401727120101877501,101877501,PersonalFoul,Foul on Jack Whitbourn.,4,15,1st Half,12:24,False,27,2024-12-29T22:17:42Z
401727120101877502,101877502,MadeFreeThrow,Rich Byhre made Free Throw.,5,15,1st Half,12:24,True,2900,2024-12-29T22:17:42Z
401727120101877503,101877503,MadeFreeThrow,Rich Byhre made Free Throw.,6,15,1st Half,12:24,True,2900,2024-12-29T22:17:42Z
401727120101879401,101879401,Lost Ball Turnover,Rikus Schulte Turnover.,6,15,1st Half,12:05,False,27,2024-12-29T22:21:15Z
401727120101879402,101879402,Steal,Nolan Minessale Steal.,6,15,1st Half,12:05,False,2900,2024-12-29T22:21:15Z
401727120101885301,101885301,JumpShot,Ryan Dufault made Jumper.,8,15,1st Half,11:46,True,2900,2024-12-29T22:21:29Z
401727120101887001,101887001,Lost Ball Turnover,Barrington Hargress Turnover.,8,15,1st Half,11:29,False,27,2024-12-29T22:21:41Z
401727120101887002,101887002,Steal,Miles Barnstable Steal.,8,15,1st Half,11:29,False,2900,2024-12-29T22:21:41Z
401727120101887401,101887401,LayUpShot,Ryan Dufault made Layup. Assisted by Miles Barnstable.,10,15,1st Half,11:25,True,2900,2024-12-29T22:21:41Z
401727120101887501,101887501,RegularTimeOut,UC Riverside  Timeout,10,15,1st Half,11:24,False,27,2024-12-29T22:21:41Z
401727120101889601,101889601,JumpShot,Kaleb Smith missed Jumper.,10,15,1st Half,11:03,False,27,2024-12-29T22:25:38Z
401727120101894001,101894001,Defensive Rebound,Ryan Dufault Defensive Rebound.,10,15,1st Half,10:59,False,2900,2024-12-29T22:25:38Z
401727120101894701,101894701,PersonalFoul,Foul on Joel Armotrading.,10,15,1st Half,10:52,False,27,2024-12-29T22:25:38Z
401727120101894702,101894702,MadeFreeThrow,Nolan Minessale made Free Throw.,11,15,1st Half,10:52,True,2900,2024-12-29T22:25:38Z
401727120101894703,101894703,MadeFreeThrow,Nolan Minessale made Free Throw.,12,15,1st Half,10:52,True,2900,2024-12-29T22:25:38Z
401727120101894704,101894704,Lost Ball Turnover,UC Riverside  Turnover.,12,15,1st Half,10:52,False,27,2024-12-29T22:25:38Z
401727120101895201,101895201,JumpShot,Drake Dobbs made Jumper.,14,15,1st Half,10:47,True,2900,2024-12-29T22:27:26Z
401727120101898601,101898601,JumpShot,Barrington Hargress missed Three Point Jumper.,14,15,1st Half,10:13,False,27,2024-12-29T22:28:03Z
401727120101898801,101898801,Defensive Rebound,Ryan Dufault Defensive Rebound.,14,15,1st Half,10:11,False,2900,2024-12-29T22:28:03Z
401727120101904301,101904301,LayUpShot,Nolan Minessale missed Layup.,14,15,1st Half,9:56,False,2900,2024-12-29T22:29:14Z
401727120101904601,101904601,Defensive Rebound,Joel Armotrading Defensive Rebound.,14,15,1st Half,9:53,False,27,2024-12-29T22:29:14Z
401727120101904901,101904901,PersonalFoul,Foul on Drake Dobbs.,14,15,1st Half,9:50,False,2900,2024-12-29T22:29:14Z
401727120101906901,101906901,JumpShot,Kaleb Smith missed Jumper.,14,15,1st Half,9:30,False,27,2024-12-29T22:29:26Z
401727120101907201,101907201,Offensive Rebound,Kaleb Smith Offensive Rebound.,14,15,1st Half,9:27,False,27,2024-12-29T22:29:26Z
401727120101907202,101907202,JumpShot,Kaleb Smith missed Jumper.,14,15,1st Half,9:27,False,27,2024-12-29T22:29:26Z
401727120101907203,101907203,Defensive Rebound,St. Thomas-Minnesota Defensive Rebound.,14,15,1st Half,9:27,False,2900,2024-12-29T22:29:26Z
401727120101909601,101909601,Lost Ball Turnover,Drake Dobbs Turnover.,14,15,1st Half,9:03,False,2900,2024-12-29T22:30:09Z
401727120101909602,101909602,Steal,Niyi Olabode Steal.,14,15,1st Half,9:03,False,27,2024-12-29T22:30:09Z
401727120101914201,101914201,JumpShot,Barrington Hargress made Three Point Jumper. Assisted by Niyi Olabode.,14,18,1st Half,8:57,True,27,2024-12-29T22:31:12Z
401727120101916401,101916401,Lost Ball Turnover,Rich Byhre Turnover.,14,18,1st Half,8:35,False,2900,2024-12-29T22:31:12Z
401727120101916402,101916402,Steal,Barrington Hargress Steal.,14,18,1st Half,8:35,False,27,2024-12-29T22:31:12Z
401727120101916701,101916701,PersonalFoul,Foul on Ben Oosterbaan.,14,18,1st Half,8:32,False,2900,2024-12-29T22:48:03Z
401727120101917301,101917301,JumpShot,Barrington Hargress made Three Point Jumper. Assisted by Joel Armotrading.,14,21,1st Half,8:26,True,27,2024-12-29T22:31:26Z
401727120101924301,101924301,LayUpShot,Ryan Dufault missed Layup.,14,21,1st Half,7:56,False,2900,2024-12-29T22:31:26Z
401727120101924601,101924601,Defensive Rebound,Niyi Olabode Defensive Rebound.,14,21,1st Half,7:53,False,27,2024-12-29T22:31:26Z
401727120101924901,101924901,JumpShot,Barrington Hargress missed Jumper.,14,21,1st Half,7:50,False,27,2024-12-29T22:31:26Z
401727120101925301,101925301,Offensive Rebound,Niyi Olabode Offensive Rebound.,14,21,1st Half,7:46,False,27,2024-12-29T22:31:26Z
401727120101925401,101925401,JumpShot,Nate Pickens made Three Point Jumper. Assisted by Niyi Olabode.,14,24,1st Half,7:45,True,27,2024-12-29T22:31:26Z
401727120101926001,101926001,OfficialTVTimeOut, Official TV Timeout,14,24,1st Half,7:39,False,,2024-12-29T22:32:07Z
401727120101927801,101927801,JumpShot,Rich Byhre missed Three Point Jumper.,14,24,1st Half,7:21,False,2900,2024-12-29T22:35:12Z
401727120101928301,101928301,Defensive Rebound,Joel Armotrading Defensive Rebound.,14,24,1st Half,7:16,False,27,2024-12-29T22:35:12Z
401727120101929301,101929301,JumpShot,Joel Armotrading made Jumper. Assisted by Isaiah Moses.,14,26,1st Half,7:06,True,27,2024-12-29T22:35:24Z
401727120101935201,101935201,JumpShot,Rich Byhre missed Three Point Jumper.,14,26,1st Half,6:47,False,2900,2024-12-29T22:35:38Z
401727120101935701,101935701,Defensive Rebound,Isaiah Moses Defensive Rebound.,14,26,1st Half,6:42,False,27,2024-12-29T22:35:38Z
401727120101937001,101937001,JumpShot,Isaiah Moses missed Three Point Jumper.,14,26,1st Half,6:29,False,27,2024-12-29T22:36:08Z
401727120101937601,101937601,Defensive Rebound,Ben Oosterbaan Defensive Rebound.,14,26,1st Half,6:23,False,2900,2024-12-29T22:36:08Z
401727120101939801,101939801,JumpShot,Rich Byhre missed Three Point Jumper.,14,26,1st Half,6:01,False,2900,2024-12-29T22:36:08Z
401727120101944201,101944201,Defensive Rebound,Barrington Hargress Defensive Rebound.,14,26,1st Half,5:57,False,27,2024-12-29T22:36:08Z
401727120101944601,101944601,LayUpShot,Barrington Hargress made Layup.,14,28,1st Half,5:53,True,27,2024-12-29T22:36:08Z
401727120101946201,101946201,PersonalFoul,Foul on Ben Oosterbaan.,14,28,1st Half,5:37,False,2900,2024-12-29T22:36:08Z
401727120101946202,101946202,Lost Ball Turnover,Ben Oosterbaan Turnover.,14,28,1st Half,5:37,False,2900,2024-12-29T22:36:08Z
401727120101948001,101948001,JumpShot,Nate Pickens missed Three Point Jumper.,14,28,1st Half,5:19,False,27,2024-12-29T22:37:39Z
401727120101948501,101948501,Defensive Rebound,Ben Nau Defensive Rebound.,14,28,1st Half,5:14,False,2900,2024-12-29T22:37:39Z
401727120101949101,101949101,JumpShot,Carter Bjerke missed Three Point Jumper.,14,28,1st Half,5:08,False,2900,2024-12-29T22:37:39Z
401727120101949501,101949501,Defensive Rebound,Isaiah Moses Defensive Rebound.,14,28,1st Half,5:04,False,27,2024-12-29T22:37:39Z
401727120101955801,101955801,LayUpShot,Barrington Hargress missed Layup.,14,28,1st Half,4:41,False,27,2024-12-29T22:39:12Z
401727120101956001,101956001,Defensive Rebound,Kendall Blue Defensive Rebound.,14,28,1st Half,4:39,False,2900,2024-12-29T22:39:12Z
401727120101956002,101956002,Lost Ball Turnover,Kendall Blue Turnover.,14,28,1st Half,4:39,False,2900,2024-12-29T22:39:12Z
401727120101956701,101956701,JumpShot,Barrington Hargress missed Jumper.,14,28,1st Half,4:32,False,27,2024-12-29T22:39:12Z
401727120101957001,101957001,Defensive Rebound,Ben Nau Defensive Rebound.,14,28,1st Half,4:29,False,2900,2024-12-29T22:39:12Z
401727120101958501,101958501,JumpShot,Nolan Minessale missed Three Point Jumper.,14,28,1st Half,4:14,False,2900,2024-12-29T22:39:12Z
401727120101958701,101958701,Defensive Rebound,UC Riverside Defensive Rebound.,14,28,1st Half,4:12,False,27,2024-12-29T22:39:12Z
401727120101964901,101964901,Lost Ball Turnover,Niyi Olabode Turnover.,14,28,1st Half,3:50,False,27,2024-12-29T22:40:03Z
401727120101964902,101964902,Steal,Ben Nau Steal.,14,28,1st Half,3:50,False,2900,2024-12-29T22:40:03Z
401727120101965301,101965301,PersonalFoul,Foul on Isaiah Moses.,14,28,1st Half,3:46,False,27,2024-12-29T22:40:03Z
401727120101965302,101965302,OfficialTVTimeOut, Official TV Timeout,14,28,1st Half,3:46,False,,2024-12-29T22:40:03Z
401727120101966901,101966901,LayUpShot,Nolan Minessale made Layup.,16,28,1st Half,3:30,True,2900,2024-12-29T22:43:11Z
401727120101969401,101969401,PersonalFoul,Foul on Ben Nau.,16,28,1st Half,3:05,False,2900,2024-12-29T22:43:11Z
401727120101969402,101969402,MadeFreeThrow,Nate Pickens missed Free Throw.,16,28,1st Half,3:05,False,27,2024-12-29T22:43:11Z
401727120101969403,101969403,Offensive Rebound,UC Riverside Offensive Rebound.,16,28,1st Half,3:05,False,27,2024-12-29T22:43:11Z
401727120101969404,101969404,MadeFreeThrow,Nate Pickens made Free Throw.,16,29,1st Half,3:05,True,27,2024-12-29T22:43:11Z
401727120101974601,101974601,JumpShot,Miles Barnstable made Jumper.,18,29,1st Half,2:53,True,2900,2024-12-29T22:44:05Z
401727120101974602,101974602,PersonalFoul,Foul on Nate Pickens.,18,29,1st Half,2:53,False,27,2024-12-29T22:44:05Z
401727120101974603,101974603,MadeFreeThrow,Miles Barnstable made Free Throw.,19,29,1st Half,2:53,True,2900,2024-12-29T22:44:05Z
401727120101976801,101976801,JumpShot,Isaiah Moses made Jumper.,19,31,1st Half,2:31,True,27,2024-12-29T22:44:05Z
401727120101978601,101978601,JumpShot,Nolan Minessale made Three Point Jumper. Assisted by Ben Nau.,22,31,1st Half,2:13,True,2900,2024-12-29T22:46:02Z
401727120101979901,101979901,PersonalFoul,Foul on Nolan Minessale.,22,31,1st Half,2:00,False,2900,2024-12-29T22:46:02Z
401727120101979902,101979902,MadeFreeThrow,Isaiah Moses made Free Throw.,22,32,1st Half,2:00,True,27,2024-12-29T22:46:02Z
401727120101979903,101979903,MadeFreeThrow,Isaiah Moses made Free Throw.,22,33,1st Half,2:00,True,27,2024-12-29T22:46:02Z
401727120101985601,101985601,JumpShot,Kendall Blue made Jumper.,24,33,1st Half,1:43,True,2900,2024-12-29T22:47:33Z
401727120101987201,101987201,JumpShot,Barrington Hargress made Three Point Jumper. Assisted by Kaleb Smith.,24,36,1st Half,1:27,True,27,2024-12-29T22:47:47Z
401727120101989701,101989701,JumpShot,Miles Barnstable missed Three Point Jumper.,24,36,1st Half,1:02,False,2900,2024-12-29T22:48:03Z
401727120101994001,101994001,Defensive Rebound,Kaleb Smith Defensive Rebound.,24,36,1st Half,0:59,False,27,2024-12-29T22:48:03Z
401727120101996601,101996601,JumpShot,Barrington Hargress missed Three Point Jumper.,24,36,1st Half,0:33,False,27,2024-12-29T22:48:03Z
401727120101996901,101996901,Defensive Rebound,Nolan Minessale Defensive Rebound.,24,36,1st Half,0:30,False,2900,2024-12-29T22:48:03Z
401727120101999601,101999601,LayUpShot,Miles Barnstable made Layup.,26,36,1st Half,0:03,True,2900,2024-12-29T22:48:03Z
401727120101999904,101999904,Lost Ball Turnover,Barrington Hargress Turnover.,26,36,1st Half,0:00,False,27,2024-12-29T22:48:03Z
401727120101999905,101999905,Steal,Miles Barnstable Steal.,26,36,1st Half,0:00,False,2900,2024-12-29T22:48:03Z
401727120101999901,101999901,End Period,End of 1st half,26,36,1st Half,0:00,False,,2024-12-29T22:48:03Z
401727120102805701,102805701,LayUpShot,Kaleb Smith missed Layup.,26,36,2nd Half,19:42,False,27,
401727120102806301,102806301,Offensive Rebound,Joel Armotrading Offensive Rebound.,26,36,2nd Half,19:36,False,27,
401727120102806302,102806302,JumpShot,Joel Armotrading made Jumper.,26,38,2nd Half,19:36,True,27,
401727120102807201,102807201,JumpShot,Carter Bjerke missed Three Point Jumper.,26,38,2nd Half,19:27,False,2900,
401727120102807601,102807601,Offensive Rebound,Drake Dobbs Offensive Rebound.,26,38,2nd Half,19:23,False,2900,
401727120102808201,102808201,DunkShot,Nolan Minessale missed Dunk.,26,38,2nd Half,19:17,False,2900,
401727120102808202,102808202,Block Shot,Joel Armotrading Block.,26,38,2nd Half,19:17,False,27,
401727120102808901,102808901,Defensive Rebound,Barrington Hargress Defensive Rebound.,26,38,2nd Half,19:10,False,27,
401727120102809001,102809001,Lost Ball Turnover,Barrington Hargress Turnover.,26,38,2nd Half,19:09,False,27,
401727120102814101,102814101,Lost Ball Turnover,Miles Barnstable Turnover.,26,38,2nd Half,18:58,False,2900,2024-12-29T23:09:35Z
401727120102815201,102815201,PersonalFoul,Foul on Carter Bjerke.,26,38,2nd Half,18:47,False,2900,2024-12-29T23:09:37Z
401727120102816701,102816701,JumpShot,Barrington Hargress missed Three Point Jumper.,26,38,2nd Half,18:32,False,27,2024-12-29T23:11:12Z
401727120102817101,102817101,Offensive Rebound,Niyi Olabode Offensive Rebound.,26,38,2nd Half,18:28,False,27,2024-12-29T23:11:12Z
401727120102818601,102818601,JumpShot,Kaleb Smith missed Jumper.,26,38,2nd Half,18:13,False,27,2024-12-29T23:11:12Z
401727120102818901,102818901,Defensive Rebound,Carter Bjerke Defensive Rebound.,26,38,2nd Half,18:10,False,2900,2024-12-29T23:11:12Z
401727120102819901,102819901,JumpShot,Drake Dobbs made Three Point Jumper.,29,38,2nd Half,18:00,True,2900,2024-12-29T23:11:12Z
401727120102826601,102826601,PersonalFoul,Foul on Miles Barnstable.,29,38,2nd Half,17:33,False,2900,2024-12-29T23:11:31Z
401727120102826602,102826602,MadeFreeThrow,Isaiah Moses made Free Throw.,29,39,2nd Half,17:33,True,27,2024-12-29T23:11:31Z
401727120102826603,102826603,MadeFreeThrow,Isaiah Moses made Free Throw.,29,40,2nd Half,17:33,True,27,2024-12-29T23:11:31Z
401727120102827701,102827701,PersonalFoul,Foul on Isaiah Moses.,29,40,2nd Half,17:22,False,27,2024-12-29T23:13:12Z
401727120102827702,102827702,MadeFreeThrow,Drake Dobbs made Free Throw.,30,40,2nd Half,17:22,True,2900,2024-12-29T23:13:12Z
401727120102827703,102827703,MadeFreeThrow,Drake Dobbs made Free Throw.,31,40,2nd Half,17:22,True,2900,2024-12-29T23:13:12Z
401727120102827704,102827704,MadeFreeThrow,Drake Dobbs made Free Throw.,32,40,2nd Half,17:22,True,2900,2024-12-29T23:13:12Z
401727120102834901,102834901,Lost Ball Turnover,UC Riverside  Turnover.,32,40,2nd Half,16:50,False,27,2024-12-29T23:13:27Z
401727120102836401,102836401,LayUpShot,Nolan Minessale made Layup.,34,40,2nd Half,16:35,True,2900,2024-12-29T23:15:12Z
401727120102838101,102838101,JumpShot,Nate Pickens missed Three Point Jumper.,34,40,2nd Half,16:18,False,27,2024-12-29T23:15:12Z
401727120102838401,102838401,Defensive Rebound,Drake Dobbs Defensive Rebound.,34,40,2nd Half,16:15,False,2900,2024-12-29T23:15:12Z
401727120102838901,102838901,JumpShot,Drake Dobbs missed Three Point Jumper.,34,40,2nd Half,16:10,False,2900,2024-12-29T23:15:12Z
401727120102839301,102839301,Defensive Rebound,Kaleb Smith Defensive Rebound.,34,40,2nd Half,16:06,False,27,2024-12-29T23:15:12Z
401727120102844601,102844601,LayUpShot,Kaleb Smith made Layup. Assisted by Nate Pickens.,34,42,2nd Half,15:53,True,27,2024-12-29T23:15:12Z
401727120102846301,102846301,JumpShot,Nolan Minessale made Three Point Jumper.,37,42,2nd Half,15:36,True,2900,2024-12-29T23:15:29Z
401727120102847901,102847901,JumpShot,Kaleb Smith made Jumper. Assisted by Isaiah Moses.,37,44,2nd Half,15:20,True,27,2024-12-29T23:15:44Z
401727120102849701,102849701,JumpShot,Drake Dobbs made Three Point Jumper. Assisted by Nolan Minessale.,40,44,2nd Half,15:02,True,2900,2024-12-29T23:16:01Z
401727120102854901,102854901,JumpShot,Kaleb Smith missed Three Point Jumper.,40,44,2nd Half,14:50,False,27,2024-12-29T23:16:01Z
401727120102855301,102855301,Defensive Rebound,Drake Dobbs Defensive Rebound.,40,44,2nd Half,14:46,False,2900,2024-12-29T23:16:01Z
401727120102856001,102856001,LayUpShot,Miles Barnstable missed Layup.,40,44,2nd Half,14:39,False,2900,2024-12-29T23:17:12Z
401727120102856301,102856301,Defensive Rebound,Kaleb Smith Defensive Rebound.,40,44,2nd Half,14:36,False,27,2024-12-29T23:17:12Z
401727120102858001,102858001,JumpShot,Nate Pickens missed Three Point Jumper.,40,44,2nd Half,14:19,False,27,2024-12-29T23:17:12Z
401727120102858401,102858401,Defensive Rebound,Drake Dobbs Defensive Rebound.,40,44,2nd Half,14:15,False,2900,2024-12-29T23:17:12Z
401727120102859601,102859601,JumpShot,Kendall Blue missed Three Point Jumper.,40,44,2nd Half,14:03,False,2900,2024-12-29T23:17:12Z
401727120102859901,102859901,Defensive Rebound,Kaleb Smith Defensive Rebound.,40,44,2nd Half,14:00,False,27,2024-12-29T23:17:12Z
401727120102865801,102865801,JumpShot,Kaleb Smith made Jumper.,40,46,2nd Half,13:41,True,27,2024-12-29T23:17:29Z
401727120102865802,102865802,PersonalFoul,Foul on Nolan Minessale.,40,46,2nd Half,13:41,False,2900,2024-12-29T23:17:29Z
401727120102865803,102865803,OfficialTVTimeOut, Official TV Timeout,40,46,2nd Half,13:41,False,,2024-12-29T23:17:29Z
401727120102865804,102865804,MadeFreeThrow,Kaleb Smith made Free Throw.,40,47,2nd Half,13:41,True,27,2024-12-29T23:17:29Z
401727120102866701,102866701,JumpShot,Ben Nau missed Three Point Jumper.,40,47,2nd Half,13:32,False,2900,2024-12-29T23:21:12Z
401727120102867301,102867301,Defensive Rebound,Nate Pickens Defensive Rebound.,40,47,2nd Half,13:26,False,27,2024-12-29T23:21:12Z
401727120102867801,102867801,LayUpShot,Barrington Hargress made Layup.,40,49,2nd Half,13:21,True,27,2024-12-29T23:21:12Z
401727120102869601,102869601,JumpShot,Ben Oosterbaan missed Three Point Jumper.,40,49,2nd Half,13:03,False,2900,2024-12-29T23:21:26Z
401727120102869901,102869901,Defensive Rebound,Rikus Schulte Defensive Rebound.,40,49,2nd Half,13:00,False,27,2024-12-29T23:21:26Z
401727120102876301,102876301,Lost Ball Turnover,Jack Whitbourn Turnover.,40,49,2nd Half,12:36,False,27,2024-12-29T23:22:08Z
401727120102876302,102876302,Steal,Ryan Dufault Steal.,40,49,2nd Half,12:36,False,2900,2024-12-29T23:22:08Z
401727120102878101,102878101,PersonalFoul,Foul on Barrington Hargress.,40,49,2nd Half,12:18,False,27,2024-12-29T23:23:13Z
401727120102878102,102878102,MadeFreeThrow,Ryan Dufault missed Free Throw.,40,49,2nd Half,12:18,False,2900,2024-12-29T23:23:13Z
401727120102878103,102878103,Offensive Rebound,St. Thomas-Minnesota Offensive Rebound.,40,49,2nd Half,12:18,False,2900,2024-12-29T23:23:13Z
401727120102878104,102878104,MadeFreeThrow,Ryan Dufault made Free Throw.,41,49,2nd Half,12:18,True,2900,2024-12-29T23:23:13Z
401727120102879101,102879101,PersonalFoul,Foul on Ryan Dufault.,41,49,2nd Half,12:08,False,2900,2024-12-29T23:23:49Z
401727120102879102,102879102,MadeFreeThrow,Nate Pickens made Free Throw.,41,50,2nd Half,12:08,True,27,2024-12-29T23:23:49Z
401727120102879103,102879103,MadeFreeThrow,Nate Pickens made Free Throw.,41,51,2nd Half,12:08,True,27,2024-12-29T23:23:49Z
401727120102884101,102884101,LayUpShot,Miles Barnstable missed Layup.,41,51,2nd Half,11:58,False,2900,2024-12-29T23:25:11Z
401727120102884401,102884401,Offensive Rebound,Ryan Dufault Offensive Rebound.,41,51,2nd Half,11:55,False,2900,2024-12-29T23:25:11Z
401727120102885001,102885001,JumpShot,Miles Barnstable made Three Point Jumper. Assisted by Ben Nau.,44,51,2nd Half,11:49,True,2900,2024-12-29T23:25:11Z
401727120102886101,102886101,PersonalFoul,Foul on Ryan Dufault.,44,51,2nd Half,11:38,False,2900,2024-12-29T23:25:11Z
401727120102886102,102886102,OfficialTVTimeOut, Official TV Timeout,44,51,2nd Half,11:38,False,,2024-12-29T23:25:11Z
401727120102887901,102887901,JumpShot,Barrington Hargress made Jumper.,44,53,2nd Half,11:20,True,27,2024-12-29T23:28:00Z
401727120102889701,102889701,LayUpShot,Miles Barnstable missed Layup.,44,53,2nd Half,11:02,False,2900,2024-12-29T23:29:13Z
401727120102894101,102894101,Defensive Rebound,Jack Whitbourn Defensive Rebound.,44,53,2nd Half,10:58,False,27,2024-12-29T23:29:13Z
401727120102894401,102894401,JumpShot,Parker Strauss missed Three Point Jumper.,44,53,2nd Half,10:55,False,27,2024-12-29T23:29:13Z
401727120102894801,102894801,Offensive Rebound,Rikus Schulte Offensive Rebound.,44,53,2nd Half,10:51,False,27,2024-12-29T23:29:13Z
401727120102894901,102894901,LayUpShot,Rikus Schulte made Layup.,44,55,2nd Half,10:50,True,27,2024-12-29T23:29:13Z
401727120102896101,102896101,JumpShot,Nolan Minessale made Jumper.,46,55,2nd Half,10:38,True,2900,2024-12-29T23:29:13Z
401727120102898801,102898801,JumpShot,Rikus Schulte made Jumper.,46,57,2nd Half,10:11,True,27,2024-12-29T23:29:29Z
