play_id,sequence_number,type,description,away_score,home_score,period,clock,scoring_play,team_id,timestamp_utc
401721246111980921,111980921,MadeFreeThrow,Jair Horton made Free Throw.,29,16,1st Half,2:04,True,2400,2025-02-16T06:14:56Z
401721246111981076,111981076,JumpShot,Austin Harvell made Three Point Jumper. Assisted by Chad Moodie.,32,16,1st Half,1:42,True,2010,2025-02-16T06:15:21Z
401721246111981156,111981156,LayUpShot,Daniel Umoh missed Layup.,32,16,1st Half,1:26,False,2400,2025-02-16T06:15:38Z
401721246111981259,111981259,Defensive Rebound,London Riley Defensive Rebound.,32,16,1st Half,1:22,False,2010,2025-02-16T06:15:40Z
401721246111981330,111981330,LayUpShot,Quincy McGriff missed Layup.,32,16,1st Half,0:54,False,2010,2025-02-16T06:16:08Z
401721246111981427,111981427,Defensive Rebound,Jair Horton Defensive Rebound.,32,16,1st Half,0:52,False,2400,2025-02-16T06:16:12Z
401721246111981481,111981481,PersonalFoul,Foul on Quincy McGriff.,32,16,1st Half,0:52,False,2010,2025-02-16T06:16:16Z
401721246111981568,111981568,MadeFreeThrow,Jair Horton made Free Throw.,32,17,1st Half,0:52,True,2400,2025-02-16T06:16:46Z
401721246111981582,111981582,MadeFreeThrow,Jair Horton made Free Throw.,32,18,1st Half,0:52,True,2400,2025-02-16T06:17:02Z
401721246111981703,111981703,JumpShot,Austin Harvell missed Three Point Jumper.,32,18,1st Half,0:38,False,2010,2025-02-16T06:17:20Z
401721246111981817,111981817,Defensive Rebound,Arthur Tate Defensive Rebound.,32,18,1st Half,0:35,False,2400,2025-02-16T06:17:23Z
401721246111981997,111981997,JumpShot,George Ivory III missed Three Point Jumper.,32,18,1st Half,0:27,False,2400,2025-02-16T06:17:35Z
401721246111981999,111981999,Defensive Rebound,Chad Moodie Defensive Rebound.,32,18,1st Half,0:18,False,2010,2025-02-16T06:17:39Z
401721246111982163,111982163,PersonalFoul,Foul on Daniel Umoh.,32,18,1st Half,0:16,False,2400,2025-02-16T06:17:50Z
401721246111982304,111982304,MadeFreeThrow,Chad Moodie missed Free Throw.,32,18,1st Half,0:16,False,2010,2025-02-16T06:18:11Z
401721246111982382,111982382,Dead Ball Rebound,Alabama A&M Deadball Team Rebound.,32,18,1st Half,0:16,False,2010,2025-02-16T06:18:11Z
401721246111982454,111982454,Substitution,Daniel Umoh subbing out for Mississippi Valley State,32,18,1st Half,0:16,False,2400,2025-02-16T06:18:34Z
401721246111982583,111982583,Substitution,Greg Moore subbing in for Mississippi Valley State,32,18,1st Half,0:16,False,2400,2025-02-16T06:18:34Z
401721246111982643,111982643,MadeFreeThrow,Chad Moodie missed Free Throw.,32,18,1st Half,0:16,False,2010,2025-02-16T06:18:35Z
401721246111982745,111982745,Offensive Rebound,London Riley Offensive Rebound.,32,18,1st Half,0:16,False,2010,2025-02-16T06:18:38Z
401721246111982897,111982897,Substitution,Chad Moodie subbing out for Alabama A&M,32,18,1st Half,0:11,False,2010,2025-02-16T06:19:00Z
401721246111982940,111982940,Substitution,AC Bryant subbing in for Alabama A&M,32,18,1st Half,0:11,False,2010,2025-02-16T06:19:00Z
401721246111982984,111982984,ShortTimeOut,Alabama A&M Timeout,32,18,1st Half,0:11,False,2010,2025-02-16T06:19:06Z
401721246111983463,111983463,JumpShot,Darius Ford missed Three Point Jumper.,32,18,1st Half,0:00,False,2010,2025-02-16T06:20:21Z
401721246111983492,111983492,Defensive Rebound,Mississippi Valley State Defensive Rebound.,32,18,1st Half,0:00,False,2400,2025-02-16T06:20:26Z
401721246111995784,111995784,End Period,End of 1st half,32,18,1st Half,0:00,False,,2025-02-16T06:31:47Z
401721246111995785,111995785,Substitution,Greg Moore subbing out for Mississippi Valley State,32,18,2nd Half,20:00,False,2400,2025-02-16T06:36:12Z
401721246111995806,111995806,Substitution,George Ivory III subbing out for Mississippi Valley State,32,18,2nd Half,20:00,False,2400,2025-02-16T06:36:12Z
401721246111995807,111995807,Substitution,Raeshun McGregory subbing in for Mississippi Valley State,32,18,2nd Half,20:00,False,2400,2025-02-16T06:36:12Z
401721246111995808,111995808,Substitution,Daniel Umoh subbing in for Mississippi Valley State,32,18,2nd Half,20:00,False,2400,2025-02-16T06:36:12Z
401721246111995809,111995809,Substitution,London Riley subbing out for Alabama A&M,32,18,2nd Half,20:00,False,2010,2025-02-16T06:36:12Z
401721246111995810,111995810,Substitution,Austin Harvell subbing out for Alabama A&M,32,18,2nd Half,20:00,False,2010,2025-02-16T06:36:12Z
401721246111995811,111995811,Substitution,Darius Ford subbing out for Alabama A&M,32,18,2nd Half,20:00,False,2010,2025-02-16T06:36:12Z
401721246111995812,111995812,Substitution,Bilal Abdur-Rahman subbing in for Alabama A&M,32,18,2nd Half,20:00,False,2010,2025-02-16T06:36:12Z
401721246111995813,111995813,Substitution,Saliou Seye subbing in for Alabama A&M,32,18,2nd Half,20:00,False,2010,2025-02-16T06:36:12Z
401721246111995814,111995814,Substitution,Lorenzo Downey subbing in for Alabama A&M,32,18,2nd Half,20:00,False,2010,2025-02-16T06:36:12Z
401721246111995817,111995817,Lost Ball Turnover,Jair Horton Turnover.,32,18,2nd Half,19:57,False,2400,2025-02-16T06:36:16Z
401721246111995818,111995818,Steal,Lorenzo Downey Steal.,32,18,2nd Half,19:57,False,2010,2025-02-16T06:36:16Z
401721246111995819,111995819,Lost Ball Turnover,Bilal Abdur-Rahman Turnover.,32,18,2nd Half,19:52,False,2010,2025-02-16T06:36:21Z
401721246111995820,111995820,Steal,Arthur Tate Steal.,32,18,2nd Half,19:52,False,2400,2025-02-16T06:36:21Z
401721246111995821,111995821,LayUpShot,Jair Horton made Layup.,32,20,2nd Half,19:47,True,2400,2025-02-16T06:36:26Z
401721246111995822,111995822,JumpShot,Lorenzo Downey made Three Point Jumper.,35,20,2nd Half,19:27,True,2010,2025-02-16T06:36:46Z
401721246111995823,111995823,LayUpShot,Antonio Sisk made Layup.,35,22,2nd Half,18:56,True,2400,2025-02-16T06:37:18Z
401721246111995824,111995824,JumpShot,Lorenzo Downey missed Three Point Jumper.,35,22,2nd Half,18:34,False,2010,2025-02-16T06:37:39Z
401721246111995825,111995825,Defensive Rebound,Raeshun McGregory Defensive Rebound.,35,22,2nd Half,18:31,False,2400,2025-02-16T06:37:42Z
401721246111995826,111995826,JumpShot,Arthur Tate missed Three Point Jumper.,35,22,2nd Half,18:19,False,2400,2025-02-16T06:37:54Z
401721246111995827,111995827,Defensive Rebound,AC Bryant Defensive Rebound.,35,22,2nd Half,18:13,False,2010,2025-02-16T06:38:00Z
401721246111995829,111995829,LayUpShot,AC Bryant missed Layup.,35,22,2nd Half,18:11,False,2010,2025-02-16T06:38:03Z
401721246111995833,111995833,Offensive Rebound,Quincy McGriff Offensive Rebound.,35,22,2nd Half,18:08,False,2010,2025-02-16T06:38:07Z
401721246111995835,111995835,PersonalFoul,Foul on Jair Horton.,35,22,2nd Half,18:08,False,2400,2025-02-16T06:38:10Z
401721246111995837,111995837,MadeFreeThrow,Quincy McGriff made Free Throw.,36,22,2nd Half,18:08,True,2010,2025-02-16T06:38:29Z
401721246111995838,111995838,MadeFreeThrow,Quincy McGriff made Free Throw.,37,22,2nd Half,18:08,True,2010,2025-02-16T06:38:41Z
401721246111995841,111995841,PersonalFoul,Foul on Lorenzo Downey.,37,22,2nd Half,17:55,False,2010,2025-02-16T06:38:59Z
401721246111995843,111995843,MadeFreeThrow,Antonio Sisk made Free Throw.,37,23,2nd Half,17:55,True,2400,2025-02-16T06:39:30Z
401721246111995844,111995844,MadeFreeThrow,Antonio Sisk missed Free Throw.,37,23,2nd Half,17:55,False,2400,2025-02-16T06:39:45Z
401721246111995845,111995845,Defensive Rebound,Saliou Seye Defensive Rebound.,37,23,2nd Half,17:55,False,2010,2025-02-16T06:39:46Z
401721246111995872,111995872,PersonalFoul,Foul on Saliou Seye.,37,23,2nd Half,17:46,False,2010,2025-02-16T06:39:58Z
401721246111995876,111995876,Lost Ball Turnover,Saliou Seye Turnover.,37,23,2nd Half,17:46,False,2010,2025-02-16T06:39:58Z
401721246111995880,111995880,Substitution,Saliou Seye subbing out for Alabama A&M,37,23,2nd Half,17:46,False,2010,2025-02-16T06:40:20Z
401721246111995881,111995881,Substitution,Clance Crosby subbing in for Alabama A&M,37,23,2nd Half,17:46,False,2010,2025-02-16T06:40:20Z
401721246111995884,111995884,JumpShot,Antonio Sisk made Jumper.,37,25,2nd Half,17:31,True,2400,2025-02-16T06:40:39Z
401721246111995885,111995885,Lost Ball Turnover,Bilal Abdur-Rahman Turnover.,37,25,2nd Half,17:11,False,2010,2025-02-16T06:41:01Z
401721246111995907,111995907,Steal,Daniel Umoh Steal.,37,25,2nd Half,17:11,False,2400,2025-02-16T06:41:01Z
401721246111995910,111995910,Lost Ball Turnover,Antonio Sisk Turnover.,37,25,2nd Half,17:01,False,2400,2025-02-16T06:41:09Z
401721246111995911,111995911,Steal,Bilal Abdur-Rahman Steal.,37,25,2nd Half,17:01,False,2010,2025-02-16T06:41:09Z
401721246111995913,111995913,Substitution,Bilal Abdur-Rahman subbing out for Alabama A&M,37,25,2nd Half,16:57,False,2010,2025-02-16T06:41:30Z
401721246111995914,111995914,Substitution,Darius Ford subbing in for Alabama A&M,37,25,2nd Half,16:57,False,2010,2025-02-16T06:41:30Z
401721246111995920,111995920,JumpShot,Quincy McGriff missed Three Point Jumper.,37,25,2nd Half,16:50,False,2010,2025-02-16T06:41:46Z
401721246111995921,111995921,Offensive Rebound,Darius Ford Offensive Rebound.,37,25,2nd Half,16:50,False,2010,2025-02-16T06:41:55Z
401721246111995922,111995922,PersonalFoul,Foul on Daniel Umoh.,37,25,2nd Half,16:50,False,2400,2025-02-16T06:41:57Z
401721246111995925,111995925,LayUpShot,Quincy McGriff missed Layup.,37,25,2nd Half,16:44,False,2010,2025-02-16T06:42:08Z
401721246111995926,111995926,Offensive Rebound,AC Bryant Offensive Rebound.,37,25,2nd Half,16:41,False,2010,2025-02-16T06:42:10Z
401721246111995928,111995928,PersonalFoul,Foul on Daniel Umoh.,37,25,2nd Half,16:40,False,2400,2025-02-16T06:42:18Z
401721246111995930,111995930,MadeFreeThrow,AC Bryant made Free Throw.,38,25,2nd Half,16:40,True,2010,2025-02-16T06:42:45Z
401721246111995931,111995931,Substitution,Daniel Umoh subbing out for Mississippi Valley State,38,25,2nd Half,16:40,False,2400,2025-02-16T06:42:51Z
401721246111995932,111995932,Substitution,Moses Horne subbing in for Mississippi Valley State,38,25,2nd Half,16:40,False,2400,2025-02-16T06:42:51Z
401721246111995935,111995935,MadeFreeThrow,AC Bryant made Free Throw.,39,25,2nd Half,16:39,True,2010,2025-02-16T06:43:17Z
401721246111995937,111995937,JumpShot,Antonio Sisk made Three Point Jumper. Assisted by Jair Horton.,39,28,2nd Half,16:24,True,2400,2025-02-16T06:43:34Z
401721246111995940,111995940,PersonalFoul,Foul on Moses Horne.,39,28,2nd Half,16:12,False,2400,2025-02-16T06:43:50Z
401721246111995942,111995942,Substitution,Quincy McGriff subbing out for Alabama A&M,39,28,2nd Half,16:12,False,2010,2025-02-16T06:44:03Z
401721246111995943,111995943,Substitution,London Riley subbing in for Alabama A&M,39,28,2nd Half,16:12,False,2010,2025-02-16T06:44:03Z
401721246111995966,111995966,PersonalFoul,Foul on Moses Horne.,39,28,2nd Half,16:08,False,2400,2025-02-16T06:44:14Z
401721246111995968,111995968,MadeFreeThrow,AC Bryant made Free Throw.,40,28,2nd Half,16:08,True,2010,2025-02-16T06:44:49Z
401721246111995969,111995969,MadeFreeThrow,AC Bryant missed Free Throw.,40,28,2nd Half,16:08,False,2010,2025-02-16T06:45:16Z
401721246111995970,111995970,Defensive Rebound,Moses Horne Defensive Rebound.,40,28,2nd Half,16:08,False,2400,2025-02-16T06:45:18Z
401721246111995973,111995973,PersonalFoul,Foul on Clance Crosby.,40,28,2nd Half,15:55,False,2010,2025-02-16T06:45:34Z
401721246111995975,111995975,OfficialTVTimeOut,Official TV Timeout,40,28,2nd Half,15:55,False,,2025-02-16T06:45:53Z
401721246111995976,111995976,Substitution,Clance Crosby subbing out for Alabama A&M,40,28,2nd Half,15:55,False,2010,2025-02-16T06:47:52Z
401721246111995978,111995978,Substitution,Angok Anyang subbing in for Alabama A&M,40,28,2nd Half,15:55,False,2010,2025-02-16T06:47:52Z
401721246111995980,111995980,MadeFreeThrow,Jair Horton made Free Throw.,40,29,2nd Half,15:55,True,2400,2025-02-16T06:47:55Z
401721246111995982,111995982,MadeFreeThrow,Jair Horton missed Free Throw.,40,29,2nd Half,15:55,False,2400,2025-02-16T06:48:03Z
401721246111995984,111995984,Defensive Rebound,Angok Anyang Defensive Rebound.,40,29,2nd Half,15:55,False,2010,2025-02-16T06:48:04Z
401721246111995987,111995987,Lost Ball Turnover,Angok Anyang Turnover.,40,29,2nd Half,15:30,False,2010,2025-02-16T06:48:34Z
401721246111995988,111995988,Substitution,Moses Horne subbing out for Mississippi Valley State,40,29,2nd Half,15:30,False,2400,2025-02-16T06:48:41Z
401721246111995989,111995989,Substitution,Jonathan Pace subbing in for Mississippi Valley State,40,29,2nd Half,15:30,False,2400,2025-02-16T06:48:41Z
401721246111995991,111995991,Lost Ball Turnover,Jonathan Pace Turnover.,40,29,2nd Half,15:18,False,2400,2025-02-16T06:49:02Z
401721246111995992,111995992,Steal,Darius Ford Steal.,40,29,2nd Half,15:18,False,2010,2025-02-16T06:49:02Z
401721246111995994,111995994,LayUpShot,AC Bryant made Layup.,42,29,2nd Half,15:15,True,2010,2025-02-16T06:49:12Z
401721246111995995,111995995,PersonalFoul,Foul on Jair Horton.,42,29,2nd Half,15:15,False,2400,2025-02-16T06:49:21Z
401721246111995999,111995999,MadeFreeThrow,AC Bryant missed Free Throw.,42,29,2nd Half,15:15,False,2010,2025-02-16T06:49:50Z
401721246111996001,111996001,Defensive Rebound,Antonio Sisk Defensive Rebound.,42,29,2nd Half,15:15,False,2400,2025-02-16T06:49:54Z
401721246111996003,111996003,JumpShot,Jonathan Pace missed Jumper.,42,29,2nd Half,15:03,False,2400,2025-02-16T06:50:07Z
401721246111996004,111996004,Defensive Rebound,AC Bryant Defensive Rebound.,42,29,2nd Half,14:59,False,2010,2025-02-16T06:50:11Z
401721246111996028,111996028,PersonalFoul,Foul on Jair Horton.,42,29,2nd Half,14:48,False,2400,2025-02-16T06:50:41Z
401721246111996033,111996033,MadeFreeThrow,AC Bryant made Free Throw.,43,29,2nd Half,14:48,True,2010,2025-02-16T06:51:16Z
401721246111996040,111996040,MadeFreeThrow,AC Bryant made Free Throw.,44,29,2nd Half,14:48,True,2010,2025-02-16T06:51:33Z
401721246111996061,111996061,LayUpShot,Arthur Tate missed Layup.,44,29,2nd Half,14:21,False,2400,2025-02-16T06:51:52Z
401721246111996062,111996062,Defensive Rebound,London Riley Defensive Rebound.,44,29,2nd Half,14:17,False,2010,2025-02-16T06:51:55Z
401721246111996063,111996063,JumpShot,London Riley missed Three Point Jumper.,44,29,2nd Half,14:08,False,2010,2025-02-16T06:52:05Z
401721246111996064,111996064,Offensive Rebound,Lorenzo Downey Offensive Rebound.,44,29,2nd Half,14:02,False,2010,2025-02-16T06:52:11Z
401721246111996065,111996065,LayUpShot,London Riley made Layup. Assisted by Lorenzo Downey.,46,29,2nd Half,13:59,True,2010,2025-02-16T06:52:14Z
401721246111996067,111996067,LayUpShot,Raeshun McGregory missed Layup.,46,29,2nd Half,13:43,False,2400,2025-02-16T06:52:29Z
401721246111996068,111996068,Block Shot,Angok Anyang Block.,46,29,2nd Half,13:43,False,2010,2025-02-16T06:52:29Z
401721246111996069,111996069,Defensive Rebound,Angok Anyang Defensive Rebound.,46,29,2nd Half,13:35,False,2010,2025-02-16T06:52:38Z
401721246111996070,111996070,Substitution,Arthur Tate subbing out for Mississippi Valley State,46,29,2nd Half,13:32,False,2400,2025-02-16T06:52:58Z
401721246111996071,111996071,Substitution,Jonathan Pace subbing out for Mississippi Valley State,46,29,2nd Half,13:32,False,2400,2025-02-16T06:52:58Z
401721246111996072,111996072,Substitution,Greg Moore subbing in for Mississippi Valley State,46,29,2nd Half,13:32,False,2400,2025-02-16T06:52:58Z
401721246111996073,111996073,Substitution,George Ivory III subbing in for Mississippi Valley State,46,29,2nd Half,13:32,False,2400,2025-02-16T06:52:58Z
401721246111996074,111996074,Substitution,Lorenzo Downey subbing out for Alabama A&M,46,29,2nd Half,13:32,False,2010,2025-02-16T06:52:58Z
401721246111996075,111996075,Substitution,Aaron Smith subbing in for Alabama A&M,46,29,2nd Half,13:32,False,2010,2025-02-16T06:52:58Z
401721246111996079,111996079,PersonalFoul,Foul on Greg Moore.,46,29,2nd Half,13:11,False,2400,2025-02-16T06:53:19Z
401721246111996081,111996081,MadeFreeThrow,Aaron Smith made Free Throw.,47,29,2nd Half,13:11,True,2010,2025-02-16T06:53:46Z
401721246111996082,111996082,Substitution,AC Bryant subbing out for Alabama A&M,47,29,2nd Half,13:11,False,2010,2025-02-16T06:53:59Z
401721246111996083,111996083,Substitution,Quincy McGriff subbing in for Alabama A&M,47,29,2nd Half,13:11,False,2010,2025-02-16T06:53:59Z
401721246111996084,111996084,MadeFreeThrow,Aaron Smith missed Free Throw.,47,29,2nd Half,13:11,False,2010,2025-02-16T06:54:06Z
401721246111996085,111996085,Defensive Rebound,Jair Horton Defensive Rebound.,47,29,2nd Half,13:11,False,2400,2025-02-16T06:54:07Z
401721246111996112,111996112,LayUpShot,Greg Moore made Layup.,47,31,2nd Half,12:52,True,2400,2025-02-16T06:54:57Z
401721246111996113,111996113,PersonalFoul,Foul on Quincy McGriff.,47,31,2nd Half,12:52,False,2010,2025-02-16T06:55:02Z
401721246111996115,111996115,MadeFreeThrow,Greg Moore made Free Throw.,47,32,2nd Half,12:52,True,2400,2025-02-16T06:55:31Z
401721246111996116,111996116,Substitution,Quincy McGriff subbing out for Alabama A&M,47,32,2nd Half,12:52,False,2010,2025-02-16T06:55:39Z
401721246111996117,111996117,Substitution,Dylan Mclean subbing in for Alabama A&M,47,32,2nd Half,12:52,False,2010,2025-02-16T06:55:39Z
401721246111996120,111996120,PersonalFoul,Foul on Antonio Sisk.,47,32,2nd Half,12:42,False,2400,2025-02-16T06:55:54Z
401721246111996122,111996122,MadeFreeThrow,Darius Ford made Free Throw.,48,32,2nd Half,12:42,True,2010,2025-02-16T06:56:13Z
401721246111996123,111996123,MadeFreeThrow,Darius Ford made Free Throw.,49,32,2nd Half,12:42,True,2010,2025-02-16T06:56:22Z
401721246111996126,111996126,LayUpShot,Jair Horton missed Layup.,49,32,2nd Half,12:34,False,2400,2025-02-16T06:56:36Z
401721246111996127,111996127,Offensive Rebound,Jair Horton Offensive Rebound.,49,32,2nd Half,12:31,False,2400,2025-02-16T06:56:39Z
401721246111996128,111996128,JumpShot,Jair Horton made Jumper. Assisted by Greg Moore.,49,34,2nd Half,12:22,True,2400,2025-02-16T06:56:48Z
401721246111996130,111996130,LayUpShot,Angok Anyang missed Layup.,49,34,2nd Half,12:18,False,2010,2025-02-16T06:56:53Z
401721246111996131,111996131,Defensive Rebound,George Ivory III Defensive Rebound.,49,34,2nd Half,12:15,False,2400,2025-02-16T06:56:56Z
401721246111996133,111996133,PersonalFoul,Foul on Dylan Mclean.,49,34,2nd Half,11:54,False,2010,2025-02-16T06:57:23Z
401721246111996135,111996135,OfficialTVTimeOut,Official TV Timeout,49,34,2nd Half,11:54,False,,2025-02-16T06:57:35Z
401721246111996139,111996139,LayUpShot,Jair Horton missed Layup.,49,34,2nd Half,11:36,False,2400,2025-02-16T06:59:35Z
401721246111996140,111996140,Block Shot,Aaron Smith Block.,49,34,2nd Half,11:36,False,2010,2025-02-16T06:59:35Z
401721246111996142,111996142,Offensive Rebound,Raeshun McGregory Offensive Rebound.,49,34,2nd Half,11:31,False,2400,2025-02-16T06:59:39Z
401721246111996166,111996166,LayUpShot,Raeshun McGregory made Layup.,49,36,2nd Half,11:30,True,2400,2025-02-16T06:59:40Z
401721246111996167,111996167,LayUpShot,Dylan Mclean made Layup. Assisted by Angok Anyang.,51,36,2nd Half,11:09,True,2010,2025-02-16T07:00:01Z
401721246111996169,111996169,LayUpShot,Greg Moore made Layup.,51,38,2nd Half,10:52,True,2400,2025-02-16T07:00:18Z
401721246111996170,111996170,LayUpShot,Darius Ford made Layup.,53,38,2nd Half,10:43,True,2010,2025-02-16T07:00:27Z
401721246111996172,111996172,PersonalFoul,Foul on Aaron Smith.,53,38,2nd Half,10:33,False,2010,2025-02-16T07:00:43Z
401721246111996174,111996174,Substitution,Angok Anyang subbing out for Alabama A&M,53,38,2nd Half,10:33,False,2010,2025-02-16T07:01:01Z
401721246111996175,111996175,Substitution,Clance Crosby subbing in for Alabama A&M,53,38,2nd Half,10:33,False,2010,2025-02-16T07:01:01Z
401721246111996177,111996177,JumpShot,Raeshun McGregory made Three Point Jumper. Assisted by Jair Horton.,53,41,2nd Half,10:24,True,2400,2025-02-16T07:01:13Z
401721246111996180,111996180,PersonalFoul,Foul on Antonio Sisk.,53,41,2nd Half,9:58,False,2400,2025-02-16T07:01:46Z
401721246111996182,111996182,MadeFreeThrow,Darius Ford made Free Throw.,54,41,2nd Half,9:58,True,2010,2025-02-16T07:02:11Z
401721246111996183,111996183,Substitution,Antonio Sisk subbing out for Mississippi Valley State,54,41,2nd Half,9:58,False,2400,2025-02-16T07:02:20Z
401721246111996184,111996184,Substitution,Moses Horne subbing in for Mississippi Valley State,54,41,2nd Half,9:58,False,2400,2025-02-16T07:02:20Z
401721246111996186,111996186,Substitution,Aaron Smith subbing out for Alabama A&M,54,41,2nd Half,9:58,False,2010,2025-02-16T07:02:20Z
401721246111996188,111996188,Substitution,Chad Moodie subbing in for Alabama A&M,54,41,2nd Half,9:58,False,2010,2025-02-16T07:02:20Z
401721246111996189,111996189,MadeFreeThrow,Darius Ford made Free Throw.,55,41,2nd Half,9:58,True,2010,2025-02-16T07:02:31Z
401721246111996190,111996190,Substitution,Raeshun McGregory subbing out for Mississippi Valley State,55,41,2nd Half,9:58,False,2400,2025-02-16T07:02:39Z
401721246111996191,111996191,Substitution,Arthur Tate subbing in for Mississippi Valley State,55,41,2nd Half,9:58,False,2400,2025-02-16T07:02:39Z
401721246111996192,111996192,Substitution,Darius Ford subbing out for Alabama A&M,55,41,2nd Half,9:58,False,2010,2025-02-16T07:02:39Z
401721246111996193,111996193,Substitution,AC Bryant subbing in for Alabama A&M,55,41,2nd Half,9:58,False,2010,2025-02-16T07:02:39Z
401721246111996196,111996196,LayUpShot,Greg Moore made Layup.,55,43,2nd Half,9:39,True,2400,2025-02-16T07:03:02Z
401721246111996197,111996197,PersonalFoul,Foul on Clance Crosby.,55,43,2nd Half,9:39,False,2010,2025-02-16T07:03:11Z
401721246111996199,111996199,Substitution,Dylan Mclean subbing out for Alabama A&M,55,43,2nd Half,9:39,False,2010,2025-02-16T07:03:26Z
401721246111996200,111996200,Substitution,Clance Crosby subbing out for Alabama A&M,55,43,2nd Half,9:39,False,2010,2025-02-16T07:03:26Z
401721246111996201,111996201,Substitution,Bilal Abdur-Rahman subbing in for Alabama A&M,55,43,2nd Half,9:39,False,2010,2025-02-16T07:03:26Z
401721246111996202,111996202,Substitution,Lorenzo Downey subbing in for Alabama A&M,55,43,2nd Half,9:39,False,2010,2025-02-16T07:03:26Z
401721246111996203,111996203,Substitution,AC Bryant subbing out for Alabama A&M,55,43,2nd Half,9:39,False,2010,2025-02-16T07:03:49Z
401721246111996204,111996204,Substitution,Clance Crosby subbing in for Alabama A&M,55,43,2nd Half,9:39,False,2010,2025-02-16T07:03:49Z
401721246111996205,111996205,MadeFreeThrow,Greg Moore missed Free Throw.,55,43,2nd Half,9:39,False,2400,2025-02-16T07:03:53Z
401721246111996226,111996226,Defensive Rebound,Bilal Abdur-Rahman Defensive Rebound.,55,43,2nd Half,9:39,False,2010,2025-02-16T07:03:55Z
401721246111996228,111996228,JumpShot,Lorenzo Downey made Three Point Jumper. Assisted by Bilal Abdur-Rahman.,58,43,2nd Half,9:18,True,2010,2025-02-16T07:04:17Z
401721246111996231,111996231,PersonalFoul,Foul on Lorenzo Downey.,58,43,2nd Half,9:12,False,2010,2025-02-16T07:04:30Z
401721246111996233,111996233,Substitution,Clance Crosby subbing out for Alabama A&M,58,43,2nd Half,9:12,False,2010,2025-02-16T07:04:44Z
401721246111996234,111996234,Substitution,Saliou Seye subbing in for Alabama A&M,58,43,2nd Half,9:12,False,2010,2025-02-16T07:04:44Z
401721246111996235,111996235,MadeFreeThrow,Moses Horne made Free Throw.,58,44,2nd Half,9:12,True,2400,2025-02-16T07:04:56Z
401721246111996236,111996236,MadeFreeThrow,Moses Horne missed Free Throw.,58,44,2nd Half,9:12,False,2400,2025-02-16T07:05:11Z
401721246111996237,111996237,Defensive Rebound,Chad Moodie Defensive Rebound.,58,44,2nd Half,9:12,False,2010,2025-02-16T07:05:12Z
401721246111996239,111996239,LayUpShot,Chad Moodie missed Layup.,58,44,2nd Half,8:54,False,2010,2025-02-16T07:05:31Z
401721246111996241,111996241,Offensive Rebound,Alabama A&M Offensive Rebound.,58,44,2nd Half,8:51,False,2010,2025-02-16T07:05:34Z
401721246111996245,111996245,PersonalFoul,Foul on George Ivory III.,58,44,2nd Half,8:40,False,2400,2025-02-16T07:06:17Z
401721246111996247,111996247,MadeFreeThrow,Lorenzo Downey missed Free Throw.,58,44,2nd Half,8:40,False,2010,2025-02-16T07:06:43Z
401721246111996248,111996248,Dead Ball Rebound,Alabama A&M Deadball Team Rebound.,58,44,2nd Half,8:40,False,2010,2025-02-16T07:06:43Z
401721246111996249,111996249,MadeFreeThrow,Lorenzo Downey made Free Throw.,59,44,2nd Half,8:40,True,2010,2025-02-16T07:06:58Z
401721246111996250,111996250,Substitution,London Riley subbing out for Alabama A&M,59,44,2nd Half,8:40,False,2010,2025-02-16T07:07:05Z
401721246111996251,111996251,Substitution,Darius Ford subbing in for Alabama A&M,59,44,2nd Half,8:40,False,2010,2025-02-16T07:07:05Z
401721246111996253,111996253,JumpShot,Greg Moore missed Jumper.,59,44,2nd Half,8:16,False,2400,2025-02-16T07:07:34Z
401721246111996254,111996254,Defensive Rebound,Darius Ford Defensive Rebound.,59,44,2nd Half,8:11,False,2010,2025-02-16T07:07:37Z
401721246111996256,111996256,Lost Ball Turnover,Darius Ford Turnover.,59,44,2nd Half,8:10,False,2010,2025-02-16T07:07:41Z
401721246111996259,111996259,PersonalFoul,Foul on Darius Ford.,59,44,2nd Half,7:54,False,2010,2025-02-16T07:08:11Z
401721246111996265,111996265,Substitution,Darius Ford subbing out for Alabama A&M,59,44,2nd Half,7:54,False,2010,2025-02-16T07:08:27Z
401721246111996286,111996286,Substitution,AC Bryant subbing in for Alabama A&M,59,44,2nd Half,7:54,False,2010,2025-02-16T07:08:27Z
401721246111996289,111996289,OfficialTVTimeOut,Official TV Timeout,59,44,2nd Half,7:54,False,,2025-02-16T07:08:32Z
401721246111996292,111996292,Substitution,Arthur Tate subbing out for Mississippi Valley State,59,44,2nd Half,7:54,False,2400,2025-02-16T07:11:03Z
401721246111996294,111996294,Substitution,Raeshun McGregory subbing in for Mississippi Valley State,59,44,2nd Half,7:54,False,2400,2025-02-16T07:11:03Z
401721246111996296,111996296,Substitution,Chad Moodie subbing out for Alabama A&M,59,44,2nd Half,7:54,False,2010,2025-02-16T07:11:24Z
401721246111996300,111996300,Substitution,Angok Anyang subbing in for Alabama A&M,59,44,2nd Half,7:54,False,2010,2025-02-16T07:11:24Z
401721246111996302,111996302,MadeFreeThrow,Greg Moore made Free Throw.,59,45,2nd Half,7:54,True,2400,2025-02-16T07:11:25Z
