play_id,sequence_number,type,description,away_score,home_score,period,clock,scoring_play,team_id,timestamp_utc
401715970101805901,101805901,LayUpShot,Jamond Vincent missed Layup.,0,0,1st Half,19:40,False,2443,2025-01-25T23:01:07Z
401715970101806201,101806201,Defensive Rebound,Peyton Rogers Defensive Rebound.,0,0,1st Half,19:37,False,2277,2025-01-25T23:01:07Z
401715970101807701,101807701,JumpShot,Bryson Dawkins made Jumper.,2,0,1st Half,19:22,True,2277,2025-01-25T23:01:07Z
401715970101814401,101814401,JumpShot,Jah Short missed Three Point Jumper.,2,0,1st Half,18:55,False,2443,2025-01-25T23:01:54Z
401715970101814701,101814701,Defensive Rebound,Bryson Dawkins Defensive Rebound.,2,0,1st Half,18:52,False,2277,2025-01-25T23:01:54Z
401715970101816701,101816701,JumpShot,Bryson Dawkins missed Three Point Jumper.,2,0,1st Half,18:32,False,2277,2025-01-25T23:03:20Z
401715970101817001,101817001,Offensive Rebound,Peyton Rogers Offensive Rebound.,2,0,1st Half,18:29,False,2277,2025-01-25T23:03:20Z
401715970101817401,101817401,Lost Ball Turnover,Peyton Rogers Turnover.,2,0,1st Half,18:25,False,2277,2025-01-25T23:03:20Z
401715970101817402,101817402,Steal,MJ Thomas Steal.,2,0,1st Half,18:25,False,2443,2025-01-25T23:03:20Z
401715970101818301,101818301,LayUpShot,MJ Thomas made Layup. Assisted by Jah Short.,2,2,1st Half,18:16,True,2443,2025-01-25T23:03:20Z
401715970101818302,101818302,PersonalFoul,Foul on Elijah Brooks.,2,2,1st Half,18:16,False,2277,2025-01-25T23:03:20Z
401715970101818303,101818303,MadeFreeThrow,MJ Thomas made Free Throw.,2,3,1st Half,18:16,True,2443,2025-01-25T23:03:20Z
401715970101819401,101819401,JumpShot,Julian Mackey missed Three Point Jumper.,2,3,1st Half,18:05,False,2277,2025-01-25T23:03:20Z
401715970101819701,101819701,Defensive Rebound,Jamond Vincent Defensive Rebound.,2,3,1st Half,18:02,False,2443,2025-01-25T23:03:20Z
401715970101824201,101824201,JumpShot,James White made Three Point Jumper. Assisted by Jah Short.,2,6,1st Half,17:57,True,2443,2025-01-25T23:03:44Z
401715970101825801,101825801,PersonalFoul,Foul on MJ Thomas.,2,6,1st Half,17:41,False,2443,2025-01-25T23:03:44Z
401715970101826501,101826501,JumpShot,Porter Bazil made Three Point Jumper. Assisted by Julian Mackey.,5,6,1st Half,17:34,True,2277,2025-01-25T23:04:00Z
401715970101827601,101827601,LayUpShot,Jah Short made Layup. Assisted by James White.,5,8,1st Half,17:23,True,2443,2025-01-25T23:05:16Z
401715970101829201,101829201,JumpShot,Porter Bazil made Three Point Jumper. Assisted by Julian Mackey.,8,8,1st Half,17:07,True,2277,2025-01-25T23:05:16Z
401715970101835401,101835401,JumpShot,James White missed Three Point Jumper.,8,8,1st Half,16:45,False,2443,2025-01-25T23:05:16Z
401715970101835701,101835701,Defensive Rebound,Elijah Brooks Defensive Rebound.,8,8,1st Half,16:42,False,2277,2025-01-25T23:05:16Z
401715970101836701,101836701,JumpShot,Porter Bazil missed ,8,8,1st Half,16:32,False,2277,2025-01-25T23:05:16Z
401715970101837201,101837201,Defensive Rebound,Jamond Vincent Defensive Rebound.,8,8,1st Half,16:27,False,2443,2025-01-25T23:05:16Z
401715970101837801,101837801,LayUpShot,Jah Short made Layup. Assisted by Dae Dae Hunter.,8,10,1st Half,16:21,True,2443,2025-01-25T23:05:16Z
401715970101839601,101839601,LayUpShot,Julian Mackey made Layup.,10,10,1st Half,16:03,True,2277,2025-01-25T23:05:32Z
401715970101845301,101845301,Lost Ball Turnover,Jamond Vincent Turnover.,10,10,1st Half,15:46,False,2443,2025-01-25T23:05:32Z
401715970101845302,101845302,Steal,Julian Mackey Steal.,10,10,1st Half,15:46,False,2277,2025-01-25T23:05:32Z
401715970101845303,101845303,OfficialTVTimeOut, Official TV Timeout,10,10,1st Half,15:46,False,,2025-01-25T23:05:32Z
401715970101847901,101847901,JumpShot,Trent Johnson made Jumper. Assisted by Elijah Brooks.,12,10,1st Half,15:20,True,2277,2025-01-25T23:09:13Z
401715970101854901,101854901,JumpShot,Dae Dae Hunter made Three Point Jumper.,12,13,1st Half,14:50,True,2443,2025-01-25T23:09:13Z
401715970101856601,101856601,LayUpShot,Porter Bazil made Layup. Assisted by D'Aundre Samuels.,14,13,1st Half,14:33,True,2277,2025-01-25T23:09:30Z
401715970101859301,101859301,LayUpShot,James White made Layup.,14,15,1st Half,14:06,True,2443,2025-01-25T23:09:30Z
401715970101865301,101865301,LayUpShot,Elijah Brooks made Layup.,16,15,1st Half,13:46,True,2277,2025-01-25T23:09:52Z
401715970101865302,101865302,PersonalFoul,Foul on Luke Davis.,16,15,1st Half,13:46,False,2443,2025-01-25T23:09:52Z
401715970101865303,101865303,MadeFreeThrow,Elijah Brooks missed Free Throw.,16,15,1st Half,13:46,False,2277,2025-01-25T23:09:52Z
401715970101865701,101865701,Offensive Rebound,Elijah Brooks Offensive Rebound.,16,15,1st Half,13:42,False,2277,2025-01-25T23:11:16Z
401715970101866001,101866001,DunkShot,Bryson Dawkins made Dunk.,18,15,1st Half,13:39,True,2277,2025-01-25T23:11:16Z
401715970101867501,101867501,Lost Ball Turnover,James White Turnover.,18,15,1st Half,13:24,False,2443,2025-01-25T23:11:16Z
401715970101867502,101867502,Steal,Bryson Dawkins Steal.,18,15,1st Half,13:24,False,2277,2025-01-25T23:11:16Z
401715970101868001,101868001,LayUpShot,Bryson Dawkins made Layup.,20,15,1st Half,13:19,True,2277,2025-01-25T23:11:16Z
401715970101874301,101874301,PersonalFoul,Foul on Porter Bazil.,20,15,1st Half,12:56,False,2277,2025-01-25T23:11:31Z
401715970101874302,101874302,MadeFreeThrow,MJ Thomas made Free Throw.,20,16,1st Half,12:56,True,2443,2025-01-25T23:11:31Z
401715970101874303,101874303,MadeFreeThrow,MJ Thomas made Free Throw.,20,17,1st Half,12:56,True,2443,2025-01-25T23:11:31Z
401715970101875501,101875501,JumpShot,Porter Bazil made Three Point Jumper. Assisted by D'Aundre Samuels.,23,17,1st Half,12:44,True,2277,2025-01-25T23:13:33Z
401715970101876801,101876801,LayUpShot,James White made Layup.,23,19,1st Half,12:31,True,2443,2025-01-25T23:13:33Z
401715970101878101,101878101,LayUpShot,Bryson Dawkins missed Layup.,23,19,1st Half,12:18,False,2277,2025-01-25T23:13:33Z
401715970101878301,101878301,Offensive Rebound,Porter Bazil Offensive Rebound.,23,19,1st Half,12:16,False,2277,2025-01-25T23:13:33Z
401715970101878401,101878401,JumpShot,D'Aundre Samuels made Three Point Jumper. Assisted by Porter Bazil.,26,19,1st Half,12:15,True,2277,2025-01-25T23:13:33Z
401715970101885401,101885401,LayUpShot,MJ Thomas missed Layup.,26,19,1st Half,11:45,False,2443,2025-01-25T23:13:33Z
401715970101885801,101885801,Defensive Rebound,D'Aundre Samuels Defensive Rebound.,26,19,1st Half,11:41,False,2277,2025-01-25T23:13:33Z
401715970101888001,101888001,LayUpShot,Elijah Brooks made Layup. Assisted by Peyton Rogers.,28,19,1st Half,11:19,True,2277,2025-01-25T23:17:17Z
401715970101889701,101889701,PersonalFoul,Foul on Peyton Rogers.,28,19,1st Half,11:02,False,2277,2025-01-25T23:17:17Z
401715970101889702,101889702,OfficialTVTimeOut, Official TV Timeout,28,19,1st Half,11:02,False,,2025-01-25T23:17:17Z
401715970101889703,101889703,MadeFreeThrow,James White made Free Throw.,28,20,1st Half,11:02,True,2443,2025-01-25T23:17:17Z
401715970101889704,101889704,MadeFreeThrow,James White made Free Throw.,28,21,1st Half,11:02,True,2443,2025-01-25T23:17:17Z
401715970101897001,101897001,Lost Ball Turnover,Julian Mackey Turnover.,28,21,1st Half,10:29,False,2277,2025-01-25T23:17:54Z
401715970101897002,101897002,Steal,JR Jacobs Steal.,28,21,1st Half,10:29,False,2443,2025-01-25T23:19:31Z
401715970101898501,101898501,JumpShot,James White missed Three Point Jumper.,28,21,1st Half,10:14,False,2443,2025-01-25T23:19:31Z
401715970101899001,101899001,Defensive Rebound,Julian Mackey Defensive Rebound.,28,21,1st Half,10:09,False,2277,2025-01-25T23:19:31Z
401715970101899801,101899801,PersonalFoul,Foul on JR Jacobs.,28,21,1st Half,10:01,False,2443,2025-01-25T23:19:31Z
401715970101905001,101905001,JumpShot,D'Aundre Samuels missed Three Point Jumper.,28,21,1st Half,9:49,False,2277,2025-01-25T23:19:31Z
401715970101905201,101905201,Defensive Rebound,James White Defensive Rebound.,28,21,1st Half,9:47,False,2443,2025-01-25T23:19:31Z
401715970101906601,101906601,DunkShot,James White made Dunk. Assisted by JR Jacobs.,28,23,1st Half,9:33,True,2443,2025-01-25T23:19:31Z
401715970101909101,101909101,LayUpShot,Elijah Brooks missed Layup.,28,23,1st Half,9:08,False,2277,2025-01-25T23:19:31Z
401715970101909401,101909401,Offensive Rebound,Porter Bazil Offensive Rebound.,28,23,1st Half,9:05,False,2277,2025-01-25T23:19:31Z
401715970101909501,101909501,LayUpShot,Porter Bazil missed Layup.,28,23,1st Half,9:04,False,2277,2025-01-25T23:19:31Z
401715970101909901,101909901,Defensive Rebound,MJ Thomas Defensive Rebound.,28,23,1st Half,9:00,False,2443,2025-01-25T23:19:31Z
401715970101914501,101914501,Lost Ball Turnover,Kohen Rowbatham Turnover.,28,23,1st Half,8:54,False,2443,2025-01-25T23:19:48Z
401715970101917001,101917001,LayUpShot,Julian Mackey missed Layup.,28,23,1st Half,8:29,False,2277,2025-01-25T23:23:15Z
401715970101917002,101917002,Block Shot,MJ Thomas Block.,28,23,1st Half,8:29,False,2443,2025-01-25T23:23:15Z
401715970101917401,101917401,Defensive Rebound,James White Defensive Rebound.,28,23,1st Half,8:25,False,2443,2025-01-25T23:23:15Z
401715970101917601,101917601,LayUpShot,James White made Layup.,28,25,1st Half,8:23,True,2443,2025-01-25T23:23:15Z
401715970101918101,101918101,ShortTimeOut,Houston Christian  Timeout,28,25,1st Half,8:18,False,2277,2025-01-25T23:23:15Z
401715970101918102,101918102,OfficialTVTimeOut, Official TV Timeout,28,25,1st Half,8:18,False,,2025-01-25T23:23:15Z
401715970101919701,101919701,JumpShot,Bryson Dawkins missed Three Point Jumper.,28,25,1st Half,8:02,False,2277,2025-01-25T23:27:30Z
401715970101924001,101924001,Defensive Rebound,MJ Thomas Defensive Rebound.,28,25,1st Half,7:59,False,2443,2025-01-25T23:27:30Z
401715970101925701,101925701,JumpShot,JR Jacobs made Three Point Jumper. Assisted by MJ Thomas.,28,28,1st Half,7:42,True,2443,2025-01-25T23:27:30Z
401715970101928201,101928201,JumpShot,Porter Bazil missed Three Point Jumper.,28,28,1st Half,7:17,False,2277,2025-01-25T23:27:30Z
401715970101928501,101928501,Defensive Rebound,Kohen Rowbatham Defensive Rebound.,28,28,1st Half,7:14,False,2443,2025-01-25T23:27:30Z
401715970101929101,101929101,Lost Ball Turnover,James White Turnover.,28,28,1st Half,7:08,False,2443,2025-01-25T23:27:30Z
401715970101929102,101929102,Steal,Elijah Brooks Steal.,28,28,1st Half,7:08,False,2277,2025-01-25T23:27:30Z
401715970101929701,101929701,LayUpShot,Bryson Dawkins made Layup. Assisted by Elijah Brooks.,30,28,1st Half,7:02,True,2277,2025-01-25T23:27:30Z
401715970101934701,101934701,LayUpShot,MJ Thomas made Layup. Assisted by JR Jacobs.,30,30,1st Half,6:52,True,2443,2025-01-25T23:27:30Z
401715970101936601,101936601,JumpShot,Pierce Bazil missed Three Point Jumper.,30,30,1st Half,6:33,False,2277,2025-01-25T23:29:31Z
401715970101936901,101936901,Defensive Rebound,James White Defensive Rebound.,30,30,1st Half,6:30,False,2443,2025-01-25T23:29:31Z
401715970101938601,101938601,Lost Ball Turnover,MJ Thomas Turnover.,30,30,1st Half,6:13,False,2443,2025-01-25T23:29:31Z
401715970101938602,101938602,Steal,Peyton Rogers Steal.,30,30,1st Half,6:13,False,2277,2025-01-25T23:29:31Z
401715970101944101,101944101,DunkShot,Elijah Brooks made Dunk.,32,30,1st Half,5:58,True,2277,2025-01-25T23:29:31Z
401715970101946501,101946501,LayUpShot,James White missed Layup.,32,30,1st Half,5:34,False,2443,2025-01-25T23:29:31Z
401715970101946901,101946901,Defensive Rebound,Elijah Brooks Defensive Rebound.,32,30,1st Half,5:30,False,2277,2025-01-25T23:29:31Z
401715970101947301,101947301,JumpShot,Pierce Bazil missed Three Point Jumper.,32,30,1st Half,5:26,False,2277,2025-01-25T23:29:31Z
401715970101947701,101947701,Defensive Rebound,Jah Short Defensive Rebound.,32,30,1st Half,5:22,False,2443,2025-01-25T23:29:31Z
401715970101954001,101954001,LayUpShot,Kohen Rowbatham missed Layup.,32,30,1st Half,4:59,False,2443,2025-01-25T23:31:33Z
401715970101954002,101954002,Block Shot,Elijah Brooks Block.,32,30,1st Half,4:59,False,2277,2025-01-25T23:31:33Z
401715970101954301,101954301,Defensive Rebound,Bryson Dawkins Defensive Rebound.,32,30,1st Half,4:56,False,2277,2025-01-25T23:31:33Z
401715970101955501,101955501,LayUpShot,Elijah Brooks made Layup.,34,30,1st Half,4:44,True,2277,2025-01-25T23:31:33Z
401715970101955502,101955502,ShortTimeOut,New Orleans  Timeout,34,30,1st Half,4:44,False,2443,2025-01-25T23:31:33Z
401715970101956901,101956901,LayUpShot,MJ Thomas missed Layup.,34,30,1st Half,4:30,False,2443,2025-01-25T23:31:48Z
401715970101957201,101957201,Offensive Rebound,MJ Thomas Offensive Rebound.,34,30,1st Half,4:27,False,2443,2025-01-25T23:31:48Z
401715970101957601,101957601,LayUpShot,MJ Thomas missed Layup.,34,30,1st Half,4:23,False,2443,2025-01-25T23:31:48Z
401715970101957701,101957701,Offensive Rebound,MJ Thomas Offensive Rebound.,34,30,1st Half,4:22,False,2443,2025-01-25T23:31:48Z
401715970101957702,101957702,Lost Ball Turnover,MJ Thomas Turnover.,34,30,1st Half,4:22,False,2443,2025-01-25T23:31:48Z
401715970101964301,101964301,JumpShot,Mason McBride made Three Point Jumper. Assisted by Julian Mackey.,37,30,1st Half,3:56,True,2277,2025-01-25T23:35:14Z
401715970101966401,101966401,Lost Ball Turnover,James White Turnover.,37,30,1st Half,3:35,False,2443,2025-01-25T23:35:14Z
401715970101966402,101966402,OfficialTVTimeOut, Official TV Timeout,37,30,1st Half,3:35,False,,2025-01-25T23:35:14Z
401715970101968301,101968301,LayUpShot,Elijah Brooks missed Layup.,37,30,1st Half,3:16,False,2277,2025-01-25T23:35:28Z
401715970101968601,101968601,Defensive Rebound,James White Defensive Rebound.,37,30,1st Half,3:13,False,2443,2025-01-25T23:35:28Z
401715970101974301,101974301,LayUpShot,MJ Thomas missed Layup.,37,30,1st Half,2:56,False,2443,2025-01-25T23:35:46Z
401715970101974601,101974601,Offensive Rebound,MJ Thomas Offensive Rebound.,37,30,1st Half,2:53,False,2443,2025-01-25T23:35:46Z
401715970101974602,101974602,TipShot,MJ Thomas missed Two Point Tip Shot.,37,30,1st Half,2:53,False,2443,2025-01-25T23:35:46Z
401715970101974801,101974801,Offensive Rebound,MJ Thomas Offensive Rebound.,37,30,1st Half,2:51,False,2443,2025-01-25T23:35:46Z
401715970101974802,101974802,TipShot,MJ Thomas missed Two Point Tip Shot.,37,30,1st Half,2:51,False,2443,2025-01-25T23:35:46Z
401715970101975001,101975001,Defensive Rebound,Julian Mackey Defensive Rebound.,37,30,1st Half,2:49,False,2277,2025-01-25T23:35:46Z
401715970101977801,101977801,Lost Ball Turnover,Houston Christian  Turnover.,37,30,1st Half,2:21,False,2277,2025-01-25T23:35:46Z
401715970101979201,101979201,JumpShot,Dae Dae Hunter made Three Point Jumper. Assisted by Jah Short.,37,33,1st Half,2:07,True,2443,2025-01-25T23:35:46Z
401715970101986001,101986001,JumpShot,Bryson Dawkins missed ,37,33,1st Half,1:39,False,2277,2025-01-25T23:35:46Z
401715970101986201,101986201,Defensive Rebound,New Orleans Defensive Rebound.,37,33,1st Half,1:37,False,2443,2025-01-25T23:35:46Z
401715970101987901,101987901,Lost Ball Turnover,Luke Davis Turnover.,37,33,1st Half,1:20,False,2443,2025-01-25T23:35:46Z
401715970101987902,101987902,Steal,Mason McBride Steal.,37,33,1st Half,1:20,False,2277,2025-01-25T23:35:46Z
401715970101988901,101988901,JumpShot,D'Aundre Samuels missed Jumper.,37,33,1st Half,1:10,False,2277,2025-01-25T23:35:46Z
401715970101989301,101989301,Defensive Rebound,James White Defensive Rebound.,37,33,1st Half,1:06,False,2443,2025-01-25T23:35:46Z
401715970101989601,101989601,LayUpShot,James White missed Layup.,37,33,1st Half,1:03,False,2443,2025-01-25T23:35:46Z
401715970101994301,101994301,Defensive Rebound,D'Aundre Samuels Defensive Rebound.,37,33,1st Half,0:56,False,2277,2025-01-25T23:35:46Z
401715970101995901,101995901,JumpShot,D'Aundre Samuels missed Jumper.,37,33,1st Half,0:40,False,2277,2025-01-25T23:35:46Z
401715970101996101,101996101,Defensive Rebound,James White Defensive Rebound.,37,33,1st Half,0:38,False,2443,2025-01-25T23:35:46Z
401715970101997101,101997101,JumpShot,Jamond Vincent made Three Point Jumper. Assisted by Jah Short.,37,36,1st Half,0:28,True,2443,2025-01-25T23:35:46Z
401715970101999501,101999501,Lost Ball Turnover,Julian Mackey Turnover.,37,36,1st Half,0:04,False,2277,2025-01-25T23:35:46Z
401715970101999502,101999502,Steal,Jah Short Steal.,37,36,1st Half,0:04,False,2443,2025-01-25T23:35:46Z
401715970101999801,101999801,LayUpShot,James White made Layup.,37,38,1st Half,0:01,True,2443,2025-01-25T23:35:46Z
401715970101999901,101999901,End Period,End of 1st half,37,38,1st Half,0:00,False,,2025-01-25T23:35:46Z
401715970102805301,102805301,PersonalFoul,Foul on Trent Johnson.,37,38,2nd Half,19:46,False,2277,2025-01-25T23:55:44Z
401715970102805302,102805302,MadeFreeThrow,Jamond Vincent made Free Throw.,37,39,2nd Half,19:46,True,2443,2025-01-25T23:55:44Z
401715970102805303,102805303,MadeFreeThrow,Jamond Vincent made Free Throw.,37,40,2nd Half,19:46,True,2443,2025-01-25T23:55:44Z
401715970102806901,102806901,Lost Ball Turnover,Trent Johnson Turnover.,37,40,2nd Half,19:30,False,2277,2025-01-25T23:55:44Z
401715970102806902,102806902,Steal,Dae Dae Hunter Steal.,37,40,2nd Half,19:30,False,2443,2025-01-25T23:55:44Z
401715970102807301,102807301,JumpShot,Dae Dae Hunter missed Three Point Jumper.,37,40,2nd Half,19:26,False,2443,2025-01-25T23:57:24Z
401715970102807302,102807302,Defensive Rebound,Houston Christian Defensive Rebound.,37,40,2nd Half,19:26,False,2277,2025-01-25T23:57:24Z
401715970102809801,102809801,LayUpShot,Bryson Dawkins missed Layup.,37,40,2nd Half,19:01,False,2277,2025-01-25T23:57:49Z
401715970102814101,102814101,Offensive Rebound,Trent Johnson Offensive Rebound.,37,40,2nd Half,18:58,False,2277,2025-01-25T23:57:49Z
401715970102815701,102815701,LayUpShot,Mason McBride missed Layup.,37,40,2nd Half,18:42,False,2277,2025-01-25T23:59:14Z
401715970102815901,102815901,Offensive Rebound,Trent Johnson Offensive Rebound.,37,40,2nd Half,18:40,False,2277,2025-01-25T23:59:14Z
401715970102816401,102816401,LayUpShot,Elijah Brooks missed Layup.,37,40,2nd Half,18:35,False,2277,2025-01-25T23:59:14Z
401715970102816701,102816701,Defensive Rebound,Dae Dae Hunter Defensive Rebound.,37,40,2nd Half,18:32,False,2443,2025-01-25T23:59:14Z
401715970102818201,102818201,JumpShot,James White made Jumper. Assisted by Jamond Vincent.,37,42,2nd Half,18:17,True,2443,2025-01-25T23:59:14Z
401715970102825001,102825001,PersonalFoul,Foul on MJ Thomas.,37,42,2nd Half,17:49,False,2443,2025-01-25T23:59:14Z
401715970102825601,102825601,JumpShot,,39,42,2nd Half,17:43,True,2277,2025-01-25T23:59:53Z
401715970102826801,102826801,LayUpShot,Jah Short missed Layup.,39,42,2nd Half,17:31,False,2443,2025-01-25T23:59:53Z
401715970102827101,102827101,Offensive Rebound,James White Offensive Rebound.,39,42,2nd Half,17:28,False,2443,2025-01-25T23:59:53Z
401715970102828001,102828001,JumpShot,Dae Dae Hunter made Jumper.,39,44,2nd Half,17:19,True,2443,2025-01-25T23:59:53Z
401715970102834401,102834401,JumpShot,Mason McBride made Three Point Jumper.,42,44,2nd Half,16:55,True,2277,2025-01-26T00:01:39Z
401715970102835701,102835701,LayUpShot,Jamond Vincent made Layup.,42,46,2nd Half,16:42,True,2443,2025-01-26T00:01:39Z
401715970102837601,102837601,PersonalFoul,Foul on Dae Dae Hunter.,42,46,2nd Half,16:23,False,2443,2025-01-26T00:01:39Z
401715970102839401,102839401,Lost Ball Turnover,Elijah Brooks Turnover.,42,46,2nd Half,16:05,False,2277,2025-01-26T00:01:39Z
401715970102839402,102839402,Steal,Dae Dae Hunter Steal.,42,46,2nd Half,16:05,False,2443,2025-01-26T00:01:39Z
401715970102839901,102839901,LayUpShot,Jamond Vincent made Layup. Assisted by Jah Short.,42,48,2nd Half,16:00,True,2443,2025-01-26T00:01:39Z
401715970102845801,102845801,JumpShot,Peyton Rogers made Three Point Jumper. Assisted by Elijah Brooks.,45,48,2nd Half,15:41,True,2277,2025-01-26T00:02:06Z
401715970102847101,102847101,JumpShot,MJ Thomas missed ,45,48,2nd Half,15:28,False,2443,2025-01-26T00:05:13Z
401715970102847501,102847501,Defensive Rebound,Peyton Rogers Defensive Rebound.,45,48,2nd Half,15:24,False,2277,2025-01-26T00:05:13Z
401715970102848201,102848201,LayUpShot,Bryson Dawkins made Layup. Assisted by D'Aundre Samuels.,47,48,2nd Half,15:17,True,2277,2025-01-26T00:05:13Z
401715970102849701,102849701,OfficialTVTimeOut, Official TV Timeout,47,48,2nd Half,15:02,False,,2025-01-26T00:05:13Z
401715970102849703,102849703,PersonalFoul,Foul on MJ Thomas.,47,48,2nd Half,15:02,False,2443,2025-01-26T00:05:13Z
401715970102849704,102849704,Lost Ball Turnover,MJ Thomas Turnover.,47,48,2nd Half,15:02,False,2443,2025-01-26T00:05:13Z
401715970102849705,102849705,MadeFreeThrow,Elijah Brooks made Free Throw.,48,48,2nd Half,15:02,True,2277,2025-01-26T00:06:09Z
401715970102849706,102849706,MadeFreeThrow,Elijah Brooks missed Free Throw.,48,48,2nd Half,15:02,False,2277,2025-01-26T00:06:09Z
401715970102849707,102849707,Dead Ball Rebound,Houston Christian Deadball Team Rebound.,48,48,2nd Half,15:02,False,2277,2025-01-26T00:06:09Z
401715970102855201,102855201,JumpShot,Bryson Dawkins missed Three Point Jumper.,48,48,2nd Half,14:47,False,2277,2025-01-26T00:07:12Z
401715970102855701,102855701,Defensive Rebound,Luke Davis Defensive Rebound.,48,48,2nd Half,14:42,False,2443,2025-01-26T00:07:12Z
401715970102856801,102856801,Lost Ball Turnover,Jah Short Turnover.,48,48,2nd Half,14:31,False,2443,2025-01-26T00:07:12Z
401715970102856802,102856802,Steal,Peyton Rogers Steal.,48,48,2nd Half,14:31,False,2277,2025-01-26T00:07:12Z
401715970102856901,102856901,PersonalFoul,Foul on Jamond Vincent.,48,48,2nd Half,14:30,False,2443,2025-01-26T00:07:12Z
401715970102858701,102858701,PersonalFoul,Foul on Luke Davis.,48,48,2nd Half,14:12,False,2443,2025-01-26T00:07:55Z
401715970102858801,102858801,Lost Ball Turnover,Julian Mackey Turnover.,48,48,2nd Half,14:11,False,2277,2025-01-26T00:08:09Z
401715970102858802,102858802,Steal,Jah Short Steal.,48,48,2nd Half,14:11,False,2443,2025-01-26T00:08:09Z
401715970102859301,102859301,DunkShot,James White made Dunk. Assisted by Jamond Vincent.,48,50,2nd Half,14:06,True,2443,2025-01-26T00:08:09Z
401715970102859302,102859302,PersonalFoul,Foul on D'Aundre Samuels.,48,50,2nd Half,14:06,False,2277,2025-01-26T00:08:09Z
401715970102859303,102859303,MadeFreeThrow,James White made Free Throw.,48,51,2nd Half,14:06,True,2443,2025-01-26T00:08:09Z
401715970102864601,102864601,JumpShot,Julian Mackey missed Three Point Jumper.,48,51,2nd Half,13:53,False,2277,2025-01-26T00:09:54Z
401715970102864901,102864901,Defensive Rebound,James White Defensive Rebound.,48,51,2nd Half,13:50,False,2443,2025-01-26T00:09:54Z
401715970102867101,102867101,JumpShot,Kohen Rowbatham missed Three Point Jumper.,48,51,2nd Half,13:28,False,2443,2025-01-26T00:09:54Z
401715970102867401,102867401,Offensive Rebound,Jah Short Offensive Rebound.,48,51,2nd Half,13:25,False,2443,2025-01-26T00:09:54Z
401715970102867402,102867402,PersonalFoul,Foul on Peyton Rogers.,48,51,2nd Half,13:25,False,2277,2025-01-26T00:09:54Z
401715970102867901,102867901,JumpShot,James White missed Three Point Jumper.,48,51,2nd Half,13:20,False,2443,2025-01-26T00:10:09Z
401715970102868201,102868201,Defensive Rebound,Julian Mackey Defensive Rebound.,48,51,2nd Half,13:17,False,2277,2025-01-26T00:10:09Z
401715970102868901,102868901,LayUpShot,Bryson Dawkins made Layup. Assisted by Julian Mackey.,50,51,2nd Half,13:10,True,2277,2025-01-26T00:10:09Z
401715970102868902,102868902,PersonalFoul,Foul on Luke Davis.,50,51,2nd Half,13:10,False,2443,2025-01-26T00:10:09Z
401715970102868903,102868903,MadeFreeThrow,Bryson Dawkins made Free Throw.,51,51,2nd Half,13:10,True,2277,2025-01-26T00:10:09Z
401715970102874101,102874101,PersonalFoul,Foul on Luke Davis.,51,51,2nd Half,12:58,False,2443,2025-01-26T00:11:28Z
401715970102874102,102874102,Lost Ball Turnover,Luke Davis Turnover.,51,51,2nd Half,12:58,False,2443,2025-01-26T00:11:28Z
401715970102876401,102876401,JumpShot,Trent Johnson made Jumper. Assisted by Julian Mackey.,53,51,2nd Half,12:35,True,2277,2025-01-26T00:11:42Z
401715970102878201,102878201,LayUpShot,Jamond Vincent made Layup. Assisted by JR Jacobs.,53,53,2nd Half,12:17,True,2443,2025-01-26T00:12:12Z
401715970102884601,102884601,JumpShot,D'Aundre Samuels made Jumper.,55,53,2nd Half,11:53,True,2277,2025-01-26T00:13:54Z
401715970102886501,102886501,JumpShot,Dae Dae Hunter made Three Point Jumper. Assisted by James White.,55,56,2nd Half,11:34,True,2443,2025-01-26T00:13:54Z
401715970102888701,102888701,LayUpShot,Julian Mackey missed Layup.,55,56,2nd Half,11:12,False,2277,2025-01-26T00:13:54Z
401715970102888702,102888702,Block Shot,Dae Dae Hunter Block.,55,56,2nd Half,11:12,False,2443,2025-01-26T00:13:54Z
401715970102889201,102889201,Offensive Rebound,Trent Johnson Offensive Rebound.,55,56,2nd Half,11:07,False,2277,2025-01-26T00:13:54Z
401715970102889202,102889202,TipShot,Trent Johnson made Two Point Tip Shot.,57,56,2nd Half,11:07,True,2277,2025-01-26T00:13:54Z
401715970102895201,102895201,DunkShot,Jamond Vincent made Dunk.,57,58,2nd Half,10:47,True,2443,2025-01-26T00:13:54Z
401715970102896001,102896001,LayUpShot,Bryson Dawkins missed Layup.,57,58,2nd Half,10:39,False,2277,2025-01-26T00:13:54Z
401715970102896301,102896301,Offensive Rebound,Trent Johnson Offensive Rebound.,57,58,2nd Half,10:36,False,2277,2025-01-26T00:13:54Z
401715970102896501,102896501,PersonalFoul,Foul on JR Jacobs.,57,58,2nd Half,10:34,False,2443,2025-01-26T00:13:54Z
401715970102896502,102896502,OfficialTVTimeOut, Official TV Timeout,57,58,2nd Half,10:34,False,,2025-01-26T00:13:54Z
401715970102896503,102896503,MadeFreeThrow,Julian Mackey made Free Throw.,58,58,2nd Half,10:34,True,2277,2025-01-26T00:13:54Z
401715970102896504,102896504,MadeFreeThrow,Julian Mackey missed Free Throw.,58,58,2nd Half,10:34,False,2277,2025-01-26T00:13:54Z
401715970102896701,102896701,Offensive Rebound,Trent Johnson Offensive Rebound.,58,58,2nd Half,10:32,False,2277,2025-01-26T00:17:14Z
401715970102897801,102897801,Lost Ball Turnover,Elijah Brooks Turnover.,58,58,2nd Half,10:21,False,2277,2025-01-26T00:17:56Z
401715970102897802,102897802,Steal,Jamond Vincent Steal.,58,58,2nd Half,10:21,False,2443,2025-01-26T00:17:56Z
