play_id,sequence_number,type,description,away_score,home_score,period,clock,scoring_play,team_id,timestamp_utc
401719654102865503,102865503,MadeFreeThrow,Pedro Lopez-Sanvicente made Free Throw.,46,50,2nd Half,13:44,True,2172,2024-12-07T23:16:44Z
401719654102868201,102868201,PersonalFoul,Foul on Sebastian Akins.,46,50,2nd Half,13:17,False,2172,2024-12-07T23:17:49Z
401719654102874301,102874301,JumpShot,Terri Miller Jr. missed Three Point Jumper.,46,50,2nd Half,12:56,False,2502,2024-12-07T23:18:33Z
401719654102874601,102874601,Defensive Rebound,DeAndre Craig Defensive Rebound.,46,50,2nd Half,12:53,False,2172,2024-12-07T23:18:33Z
401719654102875501,102875501,JumpShot,Jon Mani missed Jumper.,46,50,2nd Half,12:44,False,2172,2024-12-07T23:18:46Z
401719654102875901,102875901,Defensive Rebound,Terri Miller Jr. Defensive Rebound.,46,50,2nd Half,12:40,False,2502,2024-12-07T23:18:48Z
401719654102876201,102876201,PersonalFoul,Foul on DeAndre Craig.,46,50,2nd Half,12:37,False,2172,2024-12-07T23:18:51Z
401719654102876202,102876202,MadeFreeThrow,Cole Farrell missed Free Throw.,46,50,2nd Half,12:37,False,2502,2024-12-07T23:18:51Z
401719654102876203,102876203,Offensive Rebound,Portland State Offensive Rebound.,46,50,2nd Half,12:37,False,2502,2024-12-07T23:18:51Z
401719654102876204,102876204,MadeFreeThrow,Cole Farrell missed Free Throw.,46,50,2nd Half,12:37,False,2502,2024-12-07T23:18:51Z
401719654102876401,102876401,Defensive Rebound,Josh Pickett Defensive Rebound.,46,50,2nd Half,12:35,False,2172,2024-12-07T23:19:43Z
401719654102878501,102878501,JumpShot,Nicholas Shogbonyo missed Three Point Jumper.,46,50,2nd Half,12:14,False,2172,2024-12-07T23:20:04Z
401719654102878901,102878901,Defensive Rebound,Terri Miller Jr. Defensive Rebound.,46,50,2nd Half,12:10,False,2502,2024-12-07T23:20:07Z
401719654102884101,102884101,Lost Ball Turnover,Qiant Myers Turnover.,46,50,2nd Half,11:58,False,2502,2024-12-07T23:20:22Z
401719654102884102,102884102,Steal,Josh Pickett Steal.,46,50,2nd Half,11:58,False,2172,2024-12-07T23:20:22Z
401719654102885401,102885401,JumpShot,Isaiah Addo-Ankrah made Three Point Jumper. Assisted by Jon Mani.,49,50,2nd Half,11:45,True,2172,2024-12-07T23:20:34Z
401719654102887401,102887401,LayUpShot,Terri Miller Jr. made Layup. Assisted by Qiant Myers.,49,52,2nd Half,11:25,True,2502,2024-12-07T23:20:53Z
401719654102889301,102889301,JumpShot,Sebastian Akins missed Jumper.,49,52,2nd Half,11:06,False,2172,2024-12-07T23:21:12Z
401719654102889601,102889601,Defensive Rebound,Isaiah Johnson Defensive Rebound.,49,52,2nd Half,11:03,False,2502,2024-12-07T23:21:15Z
401719654102895601,102895601,JumpShot,Qiant Myers missed Three Point Jumper.,49,52,2nd Half,10:43,False,2502,2024-12-07T23:21:35Z
401719654102895901,102895901,Defensive Rebound,Nicholas Shogbonyo Defensive Rebound.,49,52,2nd Half,10:40,False,2172,2024-12-07T23:21:37Z
401719654102897101,102897101,PersonalFoul,Foul on Terri Miller Jr..,49,52,2nd Half,10:28,False,2502,2024-12-07T23:21:50Z
401719654102897102,102897102,OfficialTVTimeOut, Official TV Timeout,49,52,2nd Half,10:28,False,,2024-12-07T23:21:50Z
401719654102897103,102897103,MadeFreeThrow,Nicholas Shogbonyo missed Free Throw.,49,52,2nd Half,10:28,False,2172,2024-12-07T23:21:50Z
401719654102897104,102897104,Offensive Rebound,Denver Offensive Rebound.,49,52,2nd Half,10:28,False,2172,2024-12-07T23:21:50Z
401719654102897105,102897105,MadeFreeThrow,Nicholas Shogbonyo made Free Throw.,50,52,2nd Half,10:28,True,2172,2024-12-07T23:21:50Z
401719654102899401,102899401,LayUpShot,Cole Farrell missed Layup.,50,52,2nd Half,10:05,False,2502,2024-12-07T23:25:43Z
401719654102899501,102899501,Defensive Rebound,Denver Defensive Rebound.,50,52,2nd Half,10:04,False,2172,2024-12-07T23:25:43Z
401719654102904901,102904901,LayUpShot,Sebastian Akins missed Layup.,50,52,2nd Half,9:50,False,2172,2024-12-07T23:26:18Z
401719654102904902,102904902,Block Shot,Cole Farrell Block.,50,52,2nd Half,9:50,False,2502,2024-12-07T23:26:18Z
401719654102905601,102905601,Offensive Rebound,Josh Pickett Offensive Rebound.,50,52,2nd Half,9:43,False,2172,2024-12-07T23:26:23Z
401719654102905602,102905602,JumpShot,Josh Pickett missed Jumper.,50,52,2nd Half,9:43,False,2172,2024-12-07T23:26:26Z
401719654102905801,102905801,Defensive Rebound,Hayden Curtiss Defensive Rebound.,50,52,2nd Half,9:41,False,2502,2024-12-07T23:26:26Z
401719654102906001,102906001,JumpShot,Hayden Curtiss made Three Point Jumper. Assisted by Jaylin Henderson.,50,55,2nd Half,9:39,True,2502,2024-12-07T23:26:28Z
401719654102907401,102907401,JumpShot,Nicholas Shogbonyo made Three Point Jumper. Assisted by Isaiah Addo-Ankrah.,53,55,2nd Half,9:25,True,2172,2024-12-07T23:26:44Z
401719654102914201,102914201,JumpShot,Jaylin Henderson missed Three Point Jumper.,53,55,2nd Half,8:57,False,2502,2024-12-07T23:27:30Z
401719654102914401,102914401,Offensive Rebound,Portland State Offensive Rebound.,53,55,2nd Half,8:55,False,2502,2024-12-07T23:27:30Z
401719654102915801,102915801,JumpShot,Hayden Curtiss missed Jumper.,53,55,2nd Half,8:41,False,2502,2024-12-07T23:28:04Z
401719654102916201,102916201,Defensive Rebound,Jon Mani Defensive Rebound.,53,55,2nd Half,8:37,False,2172,2024-12-07T23:28:06Z
401719654102917701,102917701,JumpShot,DeAndre Craig missed Jumper.,53,55,2nd Half,8:22,False,2172,2024-12-07T23:28:23Z
401719654102918001,102918001,Defensive Rebound,Tre-Vaughn Minott Defensive Rebound.,53,55,2nd Half,8:19,False,2502,2024-12-07T23:28:25Z
401719654102919001,102919001,DunkShot,Jaylin Henderson made Dunk.,53,57,2nd Half,8:09,True,2502,2024-12-07T23:28:38Z
401719654102919501,102919501,ShortTimeOut,Denver  Timeout,53,57,2nd Half,8:04,False,2172,2024-12-07T23:28:38Z
401719654102925501,102925501,JumpShot,Sebastian Akins missed Jumper.,53,57,2nd Half,7:44,False,2172,2024-12-07T23:32:09Z
401719654102925801,102925801,Defensive Rebound,Shane Nowell Defensive Rebound.,53,57,2nd Half,7:41,False,2502,2024-12-07T23:32:12Z
401719654102927001,102927001,PersonalFoul,Foul on Sebastian Akins.,53,57,2nd Half,7:29,False,2172,2024-12-07T23:32:25Z
401719654102927002,102927002,OfficialTVTimeOut, Official TV Timeout,53,57,2nd Half,7:29,False,,2024-12-07T23:32:25Z
401719654102927701,102927701,JumpShot,Shane Nowell made Jumper.,53,59,2nd Half,7:22,True,2502,2024-12-07T23:35:21Z
401719654102934701,102934701,JumpShot,DeAndre Craig missed Jumper.,53,59,2nd Half,6:52,False,2172,2024-12-07T23:35:51Z
401719654102934702,102934702,Block Shot,Tre-Vaughn Minott Block.,53,59,2nd Half,6:52,False,2502,2024-12-07T23:35:54Z
401719654102935201,102935201,Defensive Rebound,Kelcy Phipps Defensive Rebound.,53,59,2nd Half,6:47,False,2502,2024-12-07T23:35:54Z
401719654102937001,102937001,JumpShot,Jaylin Henderson missed Jumper.,53,59,2nd Half,6:29,False,2502,2024-12-07T23:36:14Z
401719654102937301,102937301,Defensive Rebound,Pedro Lopez-Sanvicente Defensive Rebound.,53,59,2nd Half,6:26,False,2172,2024-12-07T23:36:17Z
401719654102938501,102938501,JumpShot,Isaiah Addo-Ankrah made Three Point Jumper. Assisted by DeAndre Craig.,56,59,2nd Half,6:14,True,2172,2024-12-07T23:36:30Z
401719654102945301,102945301,LayUpShot,Jaylin Henderson missed Layup.,56,59,2nd Half,5:46,False,2502,2024-12-07T23:36:58Z
401719654102945601,102945601,Defensive Rebound,Pedro Lopez-Sanvicente Defensive Rebound.,56,59,2nd Half,5:43,False,2172,2024-12-07T23:37:00Z
401719654102946401,102946401,JumpShot,DeAndre Craig missed Three Point Jumper.,56,59,2nd Half,5:35,False,2172,2024-12-07T23:37:08Z
401719654102946701,102946701,Defensive Rebound,Shane Nowell Defensive Rebound.,56,59,2nd Half,5:32,False,2502,2024-12-07T23:37:12Z
401719654102947501,102947501,ShortTimeOut,Portland State  Timeout,56,59,2nd Half,5:24,False,2502,2024-12-07T23:37:19Z
401719654102948601,102948601,JumpShot,Terri Miller Jr. missed Jumper.,56,59,2nd Half,5:13,False,2502,2024-12-07T23:38:39Z
401719654102948901,102948901,Defensive Rebound,Isaiah Addo-Ankrah Defensive Rebound.,56,59,2nd Half,5:10,False,2172,2024-12-07T23:38:41Z
401719654102954501,102954501,LayUpShot,DeAndre Craig missed Layup.,56,59,2nd Half,4:54,False,2172,2024-12-07T23:38:58Z
401719654102954502,102954502,Block Shot,Qiant Myers Block.,56,59,2nd Half,4:54,False,2502,2024-12-07T23:38:58Z
401719654102954503,102954503,Defensive Rebound,Portland State Defensive Rebound.,56,59,2nd Half,4:54,False,2502,2024-12-07T23:38:58Z
401719654102956101,102956101,PersonalFoul,Foul on Pedro Lopez-Sanvicente.,56,59,2nd Half,4:38,False,2172,2024-12-07T23:39:26Z
401719654102956102,102956102,MadeFreeThrow,Terri Miller Jr. missed Free Throw.,56,59,2nd Half,4:38,False,2502,2024-12-07T23:39:26Z
401719654102956103,102956103,Offensive Rebound,Portland State Offensive Rebound.,56,59,2nd Half,4:38,False,2502,2024-12-07T23:39:26Z
401719654102956104,102956104,MadeFreeThrow,Terri Miller Jr. missed Free Throw.,56,59,2nd Half,4:38,False,2502,2024-12-07T23:39:26Z
401719654102956401,102956401,Offensive Rebound,Hayden Curtiss Offensive Rebound.,56,59,2nd Half,4:35,False,2502,2024-12-07T23:40:15Z
401719654102957101,102957101,LayUpShot,Terri Miller Jr. made Layup. Assisted by Shane Nowell.,56,61,2nd Half,4:28,True,2502,2024-12-07T23:40:22Z
401719654102958401,102958401,JumpShot,DeAndre Craig made Jumper. Assisted by Isaiah Addo-Ankrah.,58,61,2nd Half,4:15,True,2172,2024-12-07T23:40:35Z
401719654102964701,102964701,LayUpShot,Jaylin Henderson made Layup.,58,63,2nd Half,3:52,True,2502,2024-12-07T23:41:27Z
401719654102965501,102965501,PersonalFoul,Foul on Shane Nowell.,58,63,2nd Half,3:44,False,2502,2024-12-07T23:41:34Z
401719654102965502,102965502,OfficialTVTimeOut, Official TV Timeout,58,63,2nd Half,3:44,False,,2024-12-07T23:41:34Z
401719654102967401,102967401,PersonalFoul,Foul on Terri Miller Jr..,58,63,2nd Half,3:25,False,2502,2024-12-07T23:44:37Z
401719654102967402,102967402,MadeFreeThrow,Nicholas Shogbonyo made Free Throw.,59,63,2nd Half,3:25,True,2172,2024-12-07T23:44:37Z
401719654102967403,102967403,MadeFreeThrow,Nicholas Shogbonyo made Free Throw.,60,63,2nd Half,3:25,True,2172,2024-12-07T23:44:37Z
401719654102968701,102968701,PersonalFoul,Foul on Nicholas Shogbonyo.,60,63,2nd Half,3:12,False,2172,2024-12-07T23:45:42Z
401719654102968901,102968901,MadeFreeThrow,Shane Nowell missed Free Throw.,60,63,2nd Half,3:10,False,2502,2024-12-07T23:46:24Z
401719654102969001,102969001,Defensive Rebound,Nicholas Shogbonyo Defensive Rebound.,60,63,2nd Half,3:09,False,2172,2024-12-07T23:46:26Z
401719654102974401,102974401,PersonalFoul,Foul on Qiant Myers.,60,63,2nd Half,2:55,False,2502,2024-12-07T23:46:40Z
401719654102974402,102974402,MadeFreeThrow,Nicholas Shogbonyo made Free Throw.,61,63,2nd Half,2:55,True,2172,2024-12-07T23:46:40Z
401719654102974403,102974403,MadeFreeThrow,Nicholas Shogbonyo made Free Throw.,62,63,2nd Half,2:55,True,2172,2024-12-07T23:46:40Z
401719654102977401,102977401,PersonalFoul,Foul on Josh Lee.,62,63,2nd Half,2:25,False,2172,2024-12-07T23:48:15Z
401719654102977402,102977402,MadeFreeThrow,Terri Miller Jr. missed Free Throw.,62,63,2nd Half,2:25,False,2502,2024-12-07T23:48:15Z
401719654102977403,102977403,Offensive Rebound,Portland State Offensive Rebound.,62,63,2nd Half,2:25,False,2502,2024-12-07T23:48:15Z
401719654102977404,102977404,MadeFreeThrow,Terri Miller Jr. missed Free Throw.,62,63,2nd Half,2:25,False,2502,2024-12-07T23:48:15Z
401719654102977701,102977701,Defensive Rebound,Nicholas Shogbonyo Defensive Rebound.,62,63,2nd Half,2:22,False,2172,2024-12-07T23:49:03Z
401719654102984101,102984101,DunkShot,Pedro Lopez-Sanvicente made Dunk. Assisted by Isaiah Addo-Ankrah.,64,63,2nd Half,1:58,True,2172,2024-12-07T23:49:28Z
401719654102985501,102985501,LayUpShot,Qiant Myers missed Layup.,64,63,2nd Half,1:44,False,2502,2024-12-07T23:49:43Z
401719654102985801,102985801,Offensive Rebound,Terri Miller Jr. Offensive Rebound.,64,63,2nd Half,1:41,False,2502,2024-12-07T23:49:46Z
401719654102985802,102985802,ShortTimeOut,Portland State  Timeout,64,63,2nd Half,1:41,False,2502,2024-12-07T23:49:46Z
401719654102986901,102986901,JumpShot,Jaylin Henderson missed Three Point Jumper.,64,63,2nd Half,1:30,False,2502,2024-12-07T23:51:32Z
401719654102987201,102987201,Defensive Rebound,Josh Lee Defensive Rebound.,64,63,2nd Half,1:27,False,2172,2024-12-07T23:51:35Z
401719654102988201,102988201,LayUpShot,DeAndre Craig made Layup.,66,63,2nd Half,1:17,True,2172,2024-12-07T23:51:45Z
401719654102989201,102989201,LayUpShot,Terri Miller Jr. made Layup. Assisted by Qiant Myers.,66,65,2nd Half,1:07,True,2502,2024-12-07T23:51:56Z
401719654102995701,102995701,LayUpShot,Nicholas Shogbonyo made Layup.,68,65,2nd Half,0:42,True,2172,2024-12-07T23:52:18Z
401719654102996201,102996201,LayUpShot,Shane Nowell made Layup. Assisted by Jaylin Henderson.,68,67,2nd Half,0:37,True,2502,2024-12-07T23:52:27Z
401719654102996202,102996202,RegularTimeOut,Portland State  Timeout,68,67,2nd Half,0:37,False,2502,2024-12-07T23:52:27Z
401719654102998002,102998002,RegularTimeOut,Denver  Timeout,68,67,2nd Half,0:19,False,2172,2024-12-07T23:54:40Z
401719654102998901,102998901,Lost Ball Turnover,Sebastian Akins Turnover.,68,67,2nd Half,0:10,False,2172,2024-12-07T23:56:48Z
401719654102998902,102998902,Steal,Shane Nowell Steal.,68,67,2nd Half,0:10,False,2502,2024-12-07T23:56:48Z
401719654102999401,102999401,LayUpShot,Shane Nowell missed Layup.,68,67,2nd Half,0:05,False,2502,2024-12-07T23:56:48Z
401719654102999801,102999801,JumpShot,Jaylin Henderson missed Three Point Jumper.,68,67,2nd Half,0:01,False,2502,2024-12-07T23:56:48Z
401719654102999906,102999906,Offensive Rebound,Jaylin Henderson Offensive Rebound.,68,67,2nd Half,0:00,False,2502,2024-12-07T23:56:48Z
401719654102999909,102999909,Defensive Rebound,Denver Defensive Rebound.,68,67,2nd Half,0:00,False,2172,2024-12-07T23:56:48Z
401719654102999901,102999901,End Period,End of 2nd half,68,67,2nd Half,0:00,False,,2024-12-07T23:56:48Z
401719654102999910,102999910,End Game,End of Game,68,67,2nd Half,0:00,False,,2024-12-07T23:56:48Z
