play_id,sequence_number,type,description,away_score,home_score,period,clock,scoring_play,team_id,timestamp_utc
401706728102874603,102874603,MadeFreeThrow,Marcus Williams made Free Throw.,50,45,2nd Half,12:53,True,2539,2025-02-09T03:26:57Z
401706728102874604,102874604,MadeFreeThrow,Marcus Williams made Free Throw.,51,45,2nd Half,12:53,True,2539,2025-02-09T03:26:57Z
401706728102874605,102874605,MadeFreeThrow,Marcus Williams made Free Throw.,52,45,2nd Half,12:53,True,2539,2025-02-09T03:26:57Z
401706728102874606,102874606,MadeFreeThrow,Marcus Williams made Free Throw.,53,45,2nd Half,12:53,True,2539,2025-02-09T03:26:57Z
401706728102876601,102876601,LayUpShot,Jan Vide made Layup. Assisted by Aaron McBride.,53,47,2nd Half,12:33,True,2351,2025-02-09T03:30:00Z
401706728102876602,102876602,PersonalFoul,Foul on Junjie Wang.,53,47,2nd Half,12:33,False,2539,2025-02-09T03:30:00Z
401706728102876603,102876603,MadeFreeThrow,Jan Vide made Free Throw.,53,48,2nd Half,12:33,True,2351,2025-02-09T03:30:00Z
401706728102879101,102879101,LayUpShot,Junjie Wang missed Layup.,53,48,2nd Half,12:08,False,2539,2025-02-09T03:31:08Z
401706728102879102,102879102,Block Shot,Aaron McBride Block.,53,48,2nd Half,12:08,False,2351,2025-02-09T03:31:08Z
401706728102879601,102879601,Defensive Rebound,Myron Amey Jr. Defensive Rebound.,53,48,2nd Half,12:03,False,2351,2025-02-09T03:31:08Z
401706728102879602,102879602,Lost Ball Turnover,Myron Amey Jr. Turnover.,53,48,2nd Half,12:03,False,2351,2025-02-09T03:31:08Z
401706728102885101,102885101,JumpShot,Malik Thomas missed Three Point Jumper.,53,48,2nd Half,11:48,False,2539,2025-02-09T03:31:39Z
401706728102885401,102885401,Defensive Rebound,Alex Merkviladze Defensive Rebound.,53,48,2nd Half,11:45,False,2351,2025-02-09T03:31:44Z
401706728102887801,102887801,JumpShot,Alex Merkviladze made Jumper.,53,50,2nd Half,11:21,True,2351,2025-02-09T03:32:04Z
401706728102889901,102889901,PersonalFoul,Foul on Alex Merkviladze.,53,50,2nd Half,11:00,False,2351,2025-02-09T03:32:26Z
401706728102889902,102889902,OfficialTVTimeOut,Official TV Timeout,53,50,2nd Half,11:00,False,,2025-02-09T03:32:26Z
401706728102889903,102889903,JumpShot,Ryan Beasley missed Three Point Jumper.,53,50,2nd Half,11:00,False,2539,2025-02-09T03:35:05Z
401706728102889904,102889904,Defensive Rebound,Alex Merkviladze Defensive Rebound.,53,50,2nd Half,11:00,False,2351,2025-02-09T03:35:05Z
401706728102889905,102889905,JumpShot,Jan Vide missed Jumper.,53,50,2nd Half,11:00,False,2351,2025-02-09T03:35:05Z
401706728102889906,102889906,Defensive Rebound,Tyrone Riley IV Defensive Rebound.,53,50,2nd Half,11:00,False,2539,2025-02-09T03:35:05Z
401706728102889907,102889907,LayUpShot,Marcus Williams made Layup.,55,50,2nd Half,11:00,True,2539,2025-02-09T03:35:05Z
401706728102904301,102904301,JumpShot,Alex Merkviladze missed Three Point Jumper.,55,50,2nd Half,9:56,False,2351,2025-02-09T03:36:25Z
401706728102904601,102904601,Defensive Rebound,Marcus Williams Defensive Rebound.,55,50,2nd Half,9:53,False,2539,2025-02-09T03:36:29Z
401706728102905101,102905101,PersonalFoul,Foul on Jevon Porter.,55,50,2nd Half,9:48,False,2351,2025-02-09T03:36:34Z
401706728102905102,102905102,MadeFreeThrow,Tyrone Riley IV made Free Throw.,56,50,2nd Half,9:48,True,2539,2025-02-09T03:36:34Z
401706728102905103,102905103,MadeFreeThrow,Tyrone Riley IV made Free Throw.,57,50,2nd Half,9:48,True,2539,2025-02-09T03:36:34Z
401706728102907402,102907402,JumpShot,Caleb Stone-Carrawell made Jumper.,57,52,2nd Half,9:25,True,2351,2025-02-09T03:37:59Z
401706728102914501,102914501,JumpShot,Ryan Beasley missed Three Point Jumper.,57,52,2nd Half,8:54,False,2539,2025-02-09T03:38:25Z
401706728102914801,102914801,Defensive Rebound,Jan Vide Defensive Rebound.,57,52,2nd Half,8:51,False,2351,2025-02-09T03:38:30Z
401706728102915201,102915201,LayUpShot,Jan Vide made Layup.,57,54,2nd Half,8:47,True,2351,2025-02-09T03:38:35Z
401706728102915202,102915202,PersonalFoul,Foul on Marcus Williams.,57,54,2nd Half,8:47,False,2539,2025-02-09T03:38:35Z
401706728102915203,102915203,MadeFreeThrow,Jan Vide missed Free Throw.,57,54,2nd Half,8:47,False,2351,2025-02-09T03:38:35Z
401706728102915204,102915204,Defensive Rebound,Ryan Beasley Defensive Rebound.,57,54,2nd Half,8:47,False,2539,2025-02-09T03:38:35Z
401706728102917101,102917101,JumpShot,Junjie Wang missed Three Point Jumper.,57,54,2nd Half,8:28,False,2539,2025-02-09T03:39:26Z
401706728102917501,102917501,Defensive Rebound,Alex Merkviladze Defensive Rebound.,57,54,2nd Half,8:24,False,2351,2025-02-09T03:39:30Z
401706728102919101,102919101,PersonalFoul,Foul on Junjie Wang.,57,54,2nd Half,8:08,False,2539,2025-02-09T03:41:01Z
401706728102919102,102919102,MadeFreeThrow,Jan Vide made Free Throw.,57,55,2nd Half,8:08,True,2351,2025-02-09T03:41:01Z
401706728102919103,102919103,MadeFreeThrow,Jan Vide made Free Throw.,57,56,2nd Half,8:08,True,2351,2025-02-09T03:41:01Z
401706728102919801,102919801,JumpShot,Junjie Wang missed Three Point Jumper.,57,56,2nd Half,8:01,False,2539,2025-02-09T03:41:06Z
401706728102924201,102924201,Offensive Rebound,Carlton Linguard Jr. Offensive Rebound.,57,56,2nd Half,7:57,False,2539,2025-02-09T03:41:06Z
401706728102924401,102924401,PersonalFoul,Foul on Junjie Wang.,57,56,2nd Half,7:55,False,2539,2025-02-09T03:41:06Z
401706728102924402,102924402,Lost Ball Turnover,Junjie Wang Turnover.,57,56,2nd Half,7:55,False,2539,2025-02-09T03:41:06Z
401706728102924403,102924403,OfficialTVTimeOut,Official TV Timeout,57,56,2nd Half,7:55,False,,2025-02-09T03:41:06Z
401706728102926101,102926101,JumpShot,Caleb Stone-Carrawell made Jumper.,57,58,2nd Half,7:38,True,2351,2025-02-09T03:44:29Z
401706728102927701,102927701,PersonalFoul,Foul on Myron Amey Jr..,57,58,2nd Half,7:22,False,2351,2025-02-09T03:44:48Z
401706728102927702,102927702,MadeFreeThrow,Malik Thomas made Free Throw.,58,58,2nd Half,7:22,True,2539,2025-02-09T03:44:48Z
401706728102927901,102927901,MadeFreeThrow,Malik Thomas missed Free Throw.,58,58,2nd Half,7:20,False,2539,2025-02-09T03:44:48Z
401706728102928001,102928001,Defensive Rebound,Alex Merkviladze Defensive Rebound.,58,58,2nd Half,7:19,False,2351,2025-02-09T03:44:48Z
401706728102934101,102934101,ShortTimeOut,Loyola Marymount Timeout,58,58,2nd Half,6:58,False,2351,2025-02-09T03:46:10Z
401706728102934301,102934301,JumpShot,Caleb Stone-Carrawell missed Three Point Jumper.,58,58,2nd Half,6:56,False,2351,2025-02-09T03:47:51Z
401706728102934701,102934701,Defensive Rebound,Malik Thomas Defensive Rebound.,58,58,2nd Half,6:52,False,2539,2025-02-09T03:47:56Z
401706728102937101,102937101,LayUpShot,Malik Thomas made Layup.,60,58,2nd Half,6:28,True,2539,2025-02-09T03:48:17Z
401706728102939101,102939101,Lost Ball Turnover,Myron Amey Jr. Turnover.,60,58,2nd Half,6:08,False,2351,2025-02-09T03:48:36Z
401706728102945601,102945601,JumpShot,Ryan Beasley made Three Point Jumper.,63,58,2nd Half,5:43,True,2539,2025-02-09T03:49:31Z
401706728102948401,102948401,JumpShot,Will Johnston missed Three Point Jumper.,63,58,2nd Half,5:15,False,2351,2025-02-09T03:49:59Z
401706728102948801,102948801,Defensive Rebound,Marcus Williams Defensive Rebound.,63,58,2nd Half,5:11,False,2539,2025-02-09T03:50:04Z
401706728102954401,102954401,PersonalFoul,Foul on Jan Vide.,63,58,2nd Half,4:55,False,2351,2025-02-09T03:50:18Z
401706728102954402,102954402,MadeFreeThrow,Marcus Williams made Free Throw.,64,58,2nd Half,4:55,True,2539,2025-02-09T03:50:51Z
401706728102954403,102954403,MadeFreeThrow,Marcus Williams made Free Throw.,65,58,2nd Half,4:55,True,2539,2025-02-09T03:50:51Z
401706728102955901,102955901,PersonalFoul,Foul on Malik Thomas.,65,58,2nd Half,4:40,False,2539,2025-02-09T03:51:38Z
401706728102955902,102955902,MadeFreeThrow,Will Johnston made Free Throw.,65,59,2nd Half,4:40,True,2351,2025-02-09T03:51:38Z
401706728102955903,102955903,MadeFreeThrow,Will Johnston made Free Throw.,65,60,2nd Half,4:40,True,2351,2025-02-09T03:51:38Z
401706728102957801,102957801,LayUpShot,Malik Thomas missed Layup.,65,60,2nd Half,4:21,False,2539,2025-02-09T03:53:00Z
401706728102958101,102958101,Defensive Rebound,Will Johnston Defensive Rebound.,65,60,2nd Half,4:18,False,2351,2025-02-09T03:53:00Z
401706728102958901,102958901,PersonalFoul,Foul on Will Johnston.,65,60,2nd Half,4:10,False,2351,2025-02-09T03:53:42Z
401706728102958902,102958902,Lost Ball Turnover,Will Johnston Turnover.,65,60,2nd Half,4:10,False,2351,2025-02-09T03:53:42Z
401706728102965101,102965101,LayUpShot,Tyrone Riley IV missed Layup.,65,60,2nd Half,3:48,False,2539,2025-02-09T04:09:45Z
401706728102965102,102965102,Block Shot,Caleb Stone-Carrawell Block.,65,60,2nd Half,3:48,False,2351,2025-02-09T04:09:45Z
401706728102965301,102965301,Offensive Rebound,Tyrone Riley IV Offensive Rebound.,65,60,2nd Half,3:46,False,2539,2025-02-09T04:09:45Z
401706728102967701,102967701,LayUpShot,Will Johnston made Layup.,65,62,2nd Half,3:22,True,2351,2025-02-09T03:54:49Z
401706728102967702,102967702,LayUpShot,Tyrone Riley IV missed Layup.,65,62,2nd Half,3:22,False,2539,2025-02-09T04:09:45Z
401706728102967703,102967703,Defensive Rebound,Jan Vide Defensive Rebound.,65,62,2nd Half,3:22,False,2351,2025-02-09T04:09:45Z
401706728102968301,102968301,LayUpShot,Marcus Williams missed Layup.,65,62,2nd Half,3:16,False,2539,2025-02-09T03:54:54Z
401706728102968302,102968302,Block Shot,Jan Vide Block.,65,62,2nd Half,3:16,False,2351,2025-02-09T03:54:54Z
401706728102968701,102968701,Offensive Rebound,Marcus Williams Offensive Rebound.,65,62,2nd Half,3:12,False,2539,2025-02-09T03:54:54Z
401706728102968801,102968801,JumpShot,Ryan Beasley made Three Point Jumper. Assisted by Marcus Williams.,68,62,2nd Half,3:11,True,2539,2025-02-09T03:54:54Z
401706728102975501,102975501,DunkShot,Jevon Porter missed Dunk.,68,62,2nd Half,2:44,False,2351,2025-02-09T03:55:21Z
401706728102975901,102975901,Defensive Rebound,Junjie Wang Defensive Rebound.,68,62,2nd Half,2:40,False,2539,2025-02-09T03:55:26Z
401706728102978001,102978001,JumpShot,Tyrone Riley IV missed Three Point Jumper.,68,62,2nd Half,2:19,False,2539,2025-02-09T03:55:47Z
401706728102978301,102978301,Defensive Rebound,Jan Vide Defensive Rebound.,68,62,2nd Half,2:16,False,2351,2025-02-09T03:55:52Z
401706728102979702,102979702,OfficialTVTimeOut,Official TV Timeout,68,62,2nd Half,2:02,False,,2025-02-09T03:56:03Z
401706728102979704,102979704,MadeFreeThrow,Will Johnston made Free Throw.,68,63,2nd Half,2:02,True,2351,2025-02-09T03:56:03Z
401706728102979707,102979707,PersonalFoul,Foul on Veniamin Abosi.,68,62,2nd Half,2:02,False,2539,2025-02-09T03:56:03Z
401706728102979708,102979708,MadeFreeThrow,Will Johnston made Free Throw.,68,64,2nd Half,2:02,True,2351,2025-02-09T03:56:03Z
401706728102986601,102986601,LayUpShot,Malik Thomas missed Layup.,68,64,2nd Half,1:33,False,2539,2025-02-09T03:59:54Z
401706728102986901,102986901,Defensive Rebound,Alex Merkviladze Defensive Rebound.,68,64,2nd Half,1:30,False,2351,2025-02-09T03:59:54Z
401706728102989001,102989001,LayUpShot,Alex Merkviladze made Layup. Assisted by Jevon Porter.,68,66,2nd Half,1:09,True,2351,2025-02-09T04:00:17Z
401706728102989801,102989801,RegularTimeOut,San Francisco Timeout,68,66,2nd Half,1:01,False,2539,2025-02-09T04:00:22Z
401706728102995301,102995301,Lost Ball Turnover,Junjie Wang Turnover.,68,66,2nd Half,0:46,False,2539,2025-02-09T04:02:29Z
401706728102995801,102995801,RegularTimeOut,Loyola Marymount Timeout,68,66,2nd Half,0:41,False,2351,2025-02-09T04:03:02Z
401706728102998001,102998001,PersonalFoul,Foul on Jevon Porter.,68,66,2nd Half,0:19,False,2351,2025-02-09T04:05:38Z
401706728102998002,102998002,Lost Ball Turnover,Jevon Porter Turnover.,68,66,2nd Half,0:19,False,2351,2025-02-09T04:05:38Z
401706728102998401,102998401,PersonalFoul,Foul on Will Johnston.,68,66,2nd Half,0:15,False,2351,2025-02-09T04:06:46Z
401706728102998402,102998402,MadeFreeThrow,Ryan Beasley made Free Throw.,69,66,2nd Half,0:15,True,2539,2025-02-09T04:06:46Z
401706728102998403,102998403,MadeFreeThrow,Ryan Beasley made Free Throw.,70,66,2nd Half,0:15,True,2539,2025-02-09T04:06:46Z
401706728102999001,102999001,JumpShot,Will Johnston missed Three Point Jumper.,70,66,2nd Half,0:09,False,2351,2025-02-09T04:08:12Z
401706728102999301,102999301,Defensive Rebound,Ryan Beasley Defensive Rebound.,70,66,2nd Half,0:06,False,2539,2025-02-09T04:08:12Z
401706728102999401,102999401,PersonalFoul,Foul on Will Johnston.,70,66,2nd Half,0:05,False,2351,2025-02-09T04:08:12Z
401706728102999402,102999402,MadeFreeThrow,Ryan Beasley made Free Throw.,71,66,2nd Half,0:05,True,2539,2025-02-09T04:08:12Z
401706728102999403,102999403,MadeFreeThrow,Ryan Beasley made Free Throw.,72,66,2nd Half,0:05,True,2539,2025-02-09T04:08:12Z
401706728102999701,102999701,JumpShot,Myron Amey Jr. missed Three Point Jumper.,72,66,2nd Half,0:02,False,2351,2025-02-09T04:09:45Z
401706728102999902,102999902,Dead Ball Rebound,Loyola Marymount Deadball Team Rebound.,72,66,2nd Half,0:00,False,2351,2025-02-09T04:09:45Z
401706728102999901,102999901,End Period,End of 2nd half,72,66,2nd Half,0:00,False,,2025-02-09T04:09:45Z
401706728102999903,102999903,End Game,End of Game,72,66,2nd Half,0:00,False,,2025-02-09T04:09:45Z
