play_id,sequence_number,type,description,away_score,home_score,period,clock,scoring_play,team_id,timestamp_utc
401721246111949340,111949340,Jumpball,Start game,0,0,1st Half,20:00,False,,2025-02-16T05:32:18Z
401721246111949389,111949389,Jumpball,Jump Ball won by Alabama A&M,0,0,1st Half,19:58,False,2010,2025-02-16T05:32:20Z
401721246111949391,111949391,Jumpball,Jump Ball lost by Mississippi Valley State,0,0,1st Half,19:58,False,2400,2025-02-16T05:32:20Z
401721246111949405,111949405,JumpShot,AC Bryant missed Three Point Jumper.,0,0,1st Half,19:30,False,2010,2025-02-16T05:32:49Z
401721246111949474,111949474,Defensive Rebound,Jair Horton Defensive Rebound.,0,0,1st Half,19:27,False,2400,2025-02-16T05:32:51Z
401721246111949585,111949585,JumpShot,Antonio Sisk missed Jumper.,0,0,1st Half,18:57,False,2400,2025-02-16T05:33:39Z
401721246111949614,111949614,Defensive Rebound,Alabama A&M Defensive Rebound.,0,0,1st Half,18:57,False,2010,2025-02-16T05:33:42Z
401721246111949735,111949735,PersonalFoul,Foul on Antonio Sisk.,0,0,1st Half,18:43,False,2400,2025-02-16T05:34:05Z
401721246111949815,111949815,PersonalFoul,Foul on Saliou Seye.,0,0,1st Half,18:43,False,2010,2025-02-16T05:34:29Z
401721246111949816,111949816,Lost Ball Turnover,Saliou Seye Turnover.,0,0,1st Half,18:43,False,2010,2025-02-16T05:34:29Z
401721246111949903,111949903,Lost Ball Turnover,Arthur Tate Turnover.,0,0,1st Half,18:23,False,2400,2025-02-16T05:35:03Z
401721246111950020,111950020,Lost Ball Turnover,Saliou Seye Turnover.,0,0,1st Half,18:19,False,2010,2025-02-16T05:35:21Z
401721246111950021,111950021,Steal,Raeshun McGregory Steal.,0,0,1st Half,18:19,False,2400,2025-02-16T05:35:21Z
401721246111950123,111950123,JumpShot,Arthur Tate missed Three Point Jumper.,0,0,1st Half,17:51,False,2400,2025-02-16T05:35:50Z
401721246111950124,111950124,Defensive Rebound,Bilal Abdur-Rahman Defensive Rebound.,0,0,1st Half,17:48,False,2010,2025-02-16T05:35:52Z
401721246111950232,111950232,Substitution,Daniel Umoh subbing out for Mississippi Valley State,0,0,1st Half,17:43,False,2400,2025-02-16T05:36:21Z
401721246111950233,111950233,Substitution,Jonathan Pace subbing in for Mississippi Valley State,0,0,1st Half,17:43,False,2400,2025-02-16T05:36:21Z
401721246111950238,111950238,JumpShot,Quincy McGriff missed Three Point Jumper.,0,0,1st Half,17:40,False,2010,2025-02-16T05:36:28Z
401721246111950280,111950280,Defensive Rebound,Jonathan Pace Defensive Rebound.,0,0,1st Half,17:35,False,2400,2025-02-16T05:36:31Z
401721246111950297,111950297,JumpShot,Arthur Tate missed Three Point Jumper.,0,0,1st Half,17:19,False,2400,2025-02-16T05:36:47Z
401721246111950344,111950344,Offensive Rebound,Arthur Tate Offensive Rebound.,0,0,1st Half,17:17,False,2400,2025-02-16T05:36:49Z
401721246111950345,111950345,JumpShot,Arthur Tate missed Three Point Jumper.,0,0,1st Half,17:13,False,2400,2025-02-16T05:36:54Z
401721246111950366,111950366,Offensive Rebound,Jonathan Pace Offensive Rebound.,0,0,1st Half,17:10,False,2400,2025-02-16T05:36:56Z
401721246111950441,111950441,Lost Ball Turnover,Antonio Sisk Turnover.,0,0,1st Half,16:59,False,2400,2025-02-16T05:37:13Z
401721246111950567,111950567,JumpShot,Bilal Abdur-Rahman missed Jumper.,0,0,1st Half,16:41,False,2010,2025-02-16T05:37:41Z
401721246111950584,111950584,Offensive Rebound,Saliou Seye Offensive Rebound.,0,0,1st Half,16:41,False,2010,2025-02-16T05:37:49Z
401721246111950626,111950626,Lost Ball Turnover,Saliou Seye Turnover.,0,0,1st Half,16:41,False,2010,2025-02-16T05:37:59Z
401721246111950643,111950643,Steal,Arthur Tate Steal.,0,0,1st Half,16:41,False,2400,2025-02-16T05:37:59Z
401721246111950683,111950683,PersonalFoul,Foul on Saliou Seye.,0,0,1st Half,16:41,False,2010,2025-02-16T05:38:05Z
401721246111950723,111950723,JumpShot,Jair Horton made Three Point Jumper. Assisted by Antonio Sisk.,0,3,1st Half,16:31,True,2400,2025-02-16T05:38:20Z
401721246111950744,111950744,Lost Ball Turnover,Alabama A&M  Turnover.,0,3,1st Half,16:06,False,2010,2025-02-16T05:38:37Z
401721246111950830,111950830,JumpShot,Jair Horton missed Jumper.,0,3,1st Half,15:51,False,2400,2025-02-16T05:38:52Z
401721246111950832,111950832,Defensive Rebound,Lorenzo Downey Defensive Rebound.,0,3,1st Half,15:48,False,2010,2025-02-16T05:38:55Z
401721246111950900,111950900,Substitution,Bilal Abdur-Rahman subbing out for Alabama A&M,0,3,1st Half,15:44,False,2010,2025-02-16T05:41:10Z
401721246111950901,111950901,Substitution,Saliou Seye subbing out for Alabama A&M,0,3,1st Half,15:44,False,2010,2025-02-16T05:41:10Z
401721246111950902,111950902,Substitution,Clance Crosby subbing in for Alabama A&M,0,3,1st Half,15:44,False,2010,2025-02-16T05:41:10Z
401721246111950903,111950903,Substitution,Darius Ford subbing in for Alabama A&M,0,3,1st Half,15:44,False,2010,2025-02-16T05:41:10Z
401721246111950836,111950836,JumpShot,AC Bryant missed Jumper.,0,3,1st Half,15:43,False,2010,2025-02-16T05:39:00Z
401721246111950837,111950837,Offensive Rebound,Clance Crosby Offensive Rebound.,0,3,1st Half,15:38,False,2010,2025-02-16T05:39:05Z
401721246111950838,111950838,LayUpShot,Clance Crosby made Layup.,2,3,1st Half,15:36,True,2010,2025-02-16T05:39:07Z
401721246111950934,111950934,LayUpShot,Arthur Tate made Layup.,2,5,1st Half,15:21,True,2400,2025-02-16T05:39:22Z
401721246111951006,111951006,JumpShot,Quincy McGriff missed Jumper.,2,5,1st Half,15:02,False,2010,2025-02-16T05:39:42Z
401721246111951007,111951007,Defensive Rebound,Raeshun McGregory Defensive Rebound.,2,5,1st Half,14:58,False,2400,2025-02-16T05:39:45Z
401721246111951097,111951097,Lost Ball Turnover,Raeshun McGregory Turnover.,2,5,1st Half,14:48,False,2400,2025-02-16T05:40:15Z
401721246111951098,111951098,Steal,AC Bryant Steal.,2,5,1st Half,14:48,False,2010,2025-02-16T05:40:15Z
401721246111951138,111951138,OfficialTVTimeOut,Official TV Timeout,2,5,1st Half,14:48,False,,2025-02-16T05:40:19Z
401721246111951379,111951379,Substitution,Raeshun McGregory subbing out for Mississippi Valley State,2,5,1st Half,14:42,False,2400,2025-02-16T05:41:56Z
401721246111951380,111951380,Substitution,Markell Petro subbing in for Mississippi Valley State,2,5,1st Half,14:42,False,2400,2025-02-16T05:41:56Z
401721246111951435,111951435,JumpShot,Darius Ford made Jumper.,4,5,1st Half,14:35,True,2010,2025-02-16T05:42:04Z
401721246111951589,111951589,Lost Ball Turnover,Mississippi Valley State  Turnover.,4,5,1st Half,13:58,False,2400,2025-02-16T05:42:32Z
401721246111951644,111951644,JumpShot,Clance Crosby missed Jumper.,4,5,1st Half,13:42,False,2010,2025-02-16T05:42:59Z
401721246111951698,111951698,Offensive Rebound,Clance Crosby Offensive Rebound.,4,5,1st Half,13:39,False,2010,2025-02-16T05:43:02Z
401721246111951699,111951699,JumpShot,Clance Crosby missed Jumper.,4,5,1st Half,13:38,False,2010,2025-02-16T05:43:03Z
401721246111951700,111951700,Block Shot,Jonathan Pace Block.,4,5,1st Half,13:38,False,2400,2025-02-16T05:43:03Z
401721246111951702,111951702,Defensive Rebound,Mississippi Valley State Defensive Rebound.,4,5,1st Half,13:34,False,2400,2025-02-16T05:43:10Z
401721246111951836,111951836,JumpShot,Arthur Tate missed Jumper.,4,5,1st Half,12:58,False,2400,2025-02-16T05:43:50Z
401721246111951855,111951855,Defensive Rebound,Darius Ford Defensive Rebound.,4,5,1st Half,12:53,False,2010,2025-02-16T05:43:54Z
401721246111951888,111951888,PersonalFoul,Foul on Arthur Tate.,4,5,1st Half,12:52,False,2400,2025-02-16T05:44:00Z
401721246111951957,111951957,Substitution,Lorenzo Downey subbing out for Alabama A&M,4,5,1st Half,12:45,False,2010,2025-02-16T05:44:21Z
401721246111951958,111951958,Substitution,London Riley subbing in for Alabama A&M,4,5,1st Half,12:45,False,2010,2025-02-16T05:44:21Z
401721246111951960,111951960,JumpShot,London Riley missed Jumper.,4,5,1st Half,12:32,False,2010,2025-02-16T05:44:28Z
401721246111951991,111951991,Offensive Rebound,AC Bryant Offensive Rebound.,4,5,1st Half,12:32,False,2010,2025-02-16T05:44:40Z
401721246111952086,111952086,Substitution,Jonathan Pace subbing out for Mississippi Valley State,4,5,1st Half,12:32,False,2400,2025-02-16T05:44:53Z
401721246111952087,111952087,Substitution,Daniel Umoh subbing in for Mississippi Valley State,4,5,1st Half,12:32,False,2400,2025-02-16T05:44:53Z
401721246111952105,111952105,PersonalFoul,Foul on Daniel Umoh.,4,5,1st Half,12:29,False,2400,2025-02-16T05:45:05Z
401721246111952122,111952122,MadeFreeThrow,AC Bryant made Free Throw.,5,5,1st Half,12:29,True,2010,2025-02-16T05:45:13Z
401721246111952123,111952123,MadeFreeThrow,AC Bryant missed Free Throw.,5,5,1st Half,12:29,False,2010,2025-02-16T05:45:14Z
401721246111952124,111952124,Defensive Rebound,Jair Horton Defensive Rebound.,5,5,1st Half,12:29,False,2400,2025-02-16T05:45:15Z
401721246111952187,111952187,PersonalFoul,Foul on Clance Crosby.,5,5,1st Half,12:24,False,2010,2025-02-16T05:45:28Z
401721246111952265,111952265,Lost Ball Turnover,Markell Petro Turnover.,5,5,1st Half,12:22,False,2400,2025-02-16T05:46:07Z
401721246111952393,111952393,JumpShot,Darius Ford made Three Point Jumper. Assisted by Clance Crosby.,8,5,1st Half,11:58,True,2010,2025-02-16T05:46:35Z
401721246111952409,111952409,Lost Ball Turnover,Markell Petro Turnover.,8,5,1st Half,11:45,False,2400,2025-02-16T05:46:48Z
401721246111952422,111952422,Steal,Darius Ford Steal.,8,5,1st Half,11:45,False,2010,2025-02-16T05:46:48Z
401721246111952423,111952423,LayUpShot,AC Bryant made Layup. Assisted by Darius Ford.,10,5,1st Half,11:38,True,2010,2025-02-16T05:46:55Z
401721246111952461,111952461,ShortTimeOut,Mississippi Valley State Timeout,10,5,1st Half,11:34,False,2400,2025-02-16T05:47:03Z
401721246111952711,111952711,Substitution,Markell Petro subbing out for Mississippi Valley State,10,5,1st Half,11:34,False,2400,2025-02-16T05:49:03Z
401721246111952712,111952712,Substitution,Jonathan Pace subbing in for Mississippi Valley State,10,5,1st Half,11:34,False,2400,2025-02-16T05:49:03Z
401721246111952713,111952713,Substitution,Quincy McGriff subbing out for Alabama A&M,10,5,1st Half,11:34,False,2010,2025-02-16T05:49:03Z
401721246111952714,111952714,Substitution,Bilal Abdur-Rahman subbing in for Alabama A&M,10,5,1st Half,11:34,False,2010,2025-02-16T05:49:03Z
401721246111952722,111952722,Substitution,Jonathan Pace subbing out for Mississippi Valley State,10,5,1st Half,11:21,False,2400,2025-02-16T05:49:22Z
401721246111952723,111952723,Substitution,Moses Horne subbing in for Mississippi Valley State,10,5,1st Half,11:21,False,2400,2025-02-16T05:49:22Z
401721246111952743,111952743,JumpShot,Moses Horne missed Jumper.,10,5,1st Half,11:09,False,2400,2025-02-16T05:49:36Z
401721246111952744,111952744,Defensive Rebound,Bilal Abdur-Rahman Defensive Rebound.,10,5,1st Half,11:05,False,2010,2025-02-16T05:49:39Z
401721246111952892,111952892,Substitution,AC Bryant subbing out for Alabama A&M,10,5,1st Half,11:04,False,2010,2025-02-16T06:22:12Z
401721246111952894,111952894,Substitution,Dylan Mclean subbing in for Alabama A&M,10,5,1st Half,11:04,False,2010,2025-02-16T06:22:12Z
401721246111952745,111952745,JumpShot,Dylan Mclean missed Jumper.,10,5,1st Half,11:01,False,2010,2025-02-16T05:49:44Z
401721246111952766,111952766,Block Shot,Moses Horne Block.,10,5,1st Half,11:01,False,2400,2025-02-16T05:49:44Z
401721246111952767,111952767,Defensive Rebound,Moses Horne Defensive Rebound.,10,5,1st Half,10:58,False,2400,2025-02-16T05:49:56Z
401721246111952771,111952771,JumpShot,Arthur Tate missed Jumper.,10,5,1st Half,10:53,False,2400,2025-02-16T05:52:08Z
401721246111952772,111952772,Defensive Rebound,Alabama A&M Defensive Rebound.,10,5,1st Half,10:53,False,2010,2025-02-16T05:52:13Z
401721246111952773,111952773,PersonalFoul,Foul on Mississippi Valley State.,10,5,1st Half,10:53,False,2400,2025-02-16T05:52:21Z
401721246111952774,111952774,MadeFreeThrow,Darius Ford missed Free Throw.,10,5,1st Half,10:53,False,2010,2025-02-16T05:52:47Z
401721246111952775,111952775,Offensive Rebound,Alabama A&M Offensive Rebound.,10,5,1st Half,10:53,False,2010,2025-02-16T05:53:04Z
401721246111952787,111952787,JumpShot,London Riley missed Three Point Jumper.,10,5,1st Half,10:39,False,2010,2025-02-16T05:53:20Z
401721246111952809,111952809,Defensive Rebound,Moses Horne Defensive Rebound.,10,5,1st Half,10:36,False,2400,2025-02-16T05:53:25Z
401721246111968108,111968108,PersonalFoul,Foul on Dylan Mclean.,10,5,1st Half,10:31,False,2010,2025-02-16T05:53:50Z
401721246111968406,111968406,Substitution,Darius Ford subbing out for Alabama A&M,10,5,1st Half,10:22,False,2010,2025-02-16T05:54:11Z
401721246111968435,111968435,Substitution,Warren Yeh subbing in for Alabama A&M,10,5,1st Half,10:22,False,2010,2025-02-16T05:54:11Z
401721246111968593,111968593,Substitution,Arthur Tate subbing out for Mississippi Valley State,10,5,1st Half,10:22,False,2400,2025-02-16T05:54:20Z
401721246111968646,111968646,Substitution,George Ivory III subbing in for Mississippi Valley State,10,5,1st Half,10:22,False,2400,2025-02-16T05:54:20Z
401721246111968730,111968730,Lost Ball Turnover,Jair Horton Turnover.,10,5,1st Half,10:22,False,2400,2025-02-16T05:54:25Z
401721246111968844,111968844,JumpShot,Dylan Mclean made Jumper.,12,5,1st Half,10:10,True,2010,2025-02-16T05:54:41Z
401721246111968930,111968930,Substitution,Daniel Umoh subbing out for Mississippi Valley State,12,5,1st Half,9:39,False,2400,2025-02-16T05:55:36Z
401721246111968963,111968963,Substitution,Greg Moore subbing in for Mississippi Valley State,12,5,1st Half,9:39,False,2400,2025-02-16T05:55:36Z
401721246111969053,111969053,PersonalFoul,Foul on Clance Crosby.,12,5,1st Half,9:38,False,2010,2025-02-16T05:55:43Z
401721246111969125,111969125,MadeFreeThrow,Greg Moore missed Free Throw.,12,5,1st Half,9:38,False,2400,2025-02-16T05:55:49Z
401721246111969197,111969197,Dead Ball Rebound,Mississippi Valley State Deadball Team Rebound.,12,5,1st Half,9:38,False,2400,2025-02-16T05:55:49Z
401721246111969264,111969264,Substitution,Clance Crosby subbing out for Alabama A&M,12,5,1st Half,9:38,False,2010,2025-02-16T05:55:55Z
401721246111969348,111969348,Substitution,Angok Anyang subbing in for Alabama A&M,12,5,1st Half,9:38,False,2010,2025-02-16T05:55:55Z
401721246111969387,111969387,MadeFreeThrow,Greg Moore made Free Throw.,12,6,1st Half,9:38,True,2400,2025-02-16T05:55:57Z
401721246111969408,111969408,LayUpShot,Bilal Abdur-Rahman made Layup.,14,6,1st Half,9:24,True,2010,2025-02-16T05:56:13Z
401721246111969574,111969574,Lost Ball Turnover,Jair Horton Turnover.,14,6,1st Half,9:00,False,2400,2025-02-16T05:56:42Z
401721246111969672,111969672,Substitution,London Riley subbing out for Alabama A&M,14,6,1st Half,9:00,False,2010,2025-02-16T05:57:00Z
401721246111969716,111969716,Substitution,Aaron Smith subbing in for Alabama A&M,14,6,1st Half,9:00,False,2010,2025-02-16T05:57:00Z
401721246111970396,111970396,PersonalFoul,Foul on Moses Horne.,14,6,1st Half,8:34,False,2400,2025-02-16T05:57:41Z
401721246111970417,111970417,MadeFreeThrow,Bilal Abdur-Rahman missed Free Throw.,14,6,1st Half,8:34,False,2010,2025-02-16T05:58:01Z
401721246111970565,111970565,Dead Ball Rebound,Alabama A&M Deadball Team Rebound.,14,6,1st Half,8:34,False,2010,2025-02-16T05:58:01Z
401721246111970576,111970576,Substitution,Moses Horne subbing out for Mississippi Valley State,14,6,1st Half,8:34,False,2400,2025-02-16T05:58:10Z
401721246111970734,111970734,Substitution,Raeshun McGregory subbing in for Mississippi Valley State,14,6,1st Half,8:34,False,2400,2025-02-16T05:58:10Z
401721246111970840,111970840,Substitution,Dylan Mclean subbing out for Alabama A&M,14,6,1st Half,8:34,False,2010,2025-02-16T05:58:10Z
401721246111970903,111970903,Substitution,Lorenzo Downey subbing in for Alabama A&M,14,6,1st Half,8:34,False,2010,2025-02-16T05:58:10Z
401721246111971031,111971031,MadeFreeThrow,Bilal Abdur-Rahman made Free Throw.,15,6,1st Half,8:34,True,2010,2025-02-16T05:58:20Z
401721246111971044,111971044,Substitution,Bilal Abdur-Rahman subbing out for Alabama A&M,15,6,1st Half,8:34,False,2010,2025-02-16T05:58:25Z
401721246111971050,111971050,Substitution,Jaylen Colon subbing in for Alabama A&M,15,6,1st Half,8:34,False,2010,2025-02-16T05:58:25Z
401721246111971369,111971369,PersonalFoul,Foul on Lorenzo Downey.,15,6,1st Half,8:10,False,2010,2025-02-16T05:58:57Z
401721246111971498,111971498,MadeFreeThrow,Raeshun McGregory missed Free Throw.,15,6,1st Half,8:10,False,2400,2025-02-16T05:59:26Z
401721246111971501,111971501,Dead Ball Rebound,Mississippi Valley State Deadball Team Rebound.,15,6,1st Half,8:10,False,2400,2025-02-16T05:59:26Z
401721246111971563,111971563,MadeFreeThrow,Raeshun McGregory made Free Throw.,15,7,1st Half,8:10,True,2400,2025-02-16T05:59:45Z
401721246111971923,111971923,PersonalFoul,Foul on George Ivory III.,15,7,1st Half,7:56,False,2400,2025-02-16T06:00:12Z
401721246111972095,111972095,OfficialTVTimeOut,Official TV Timeout,15,7,1st Half,7:56,False,,2025-02-16T06:00:28Z
401721246111972156,111972156,Substitution,Warren Yeh subbing out for Alabama A&M,15,7,1st Half,7:56,False,2010,2025-02-16T06:02:21Z
401721246111972375,111972375,Substitution,Joshua Hughley subbing in for Alabama A&M,15,7,1st Half,7:56,False,2010,2025-02-16T06:24:12Z
401721246111972427,111972427,MadeFreeThrow,Lorenzo Downey made Free Throw.,16,7,1st Half,7:56,True,2010,2025-02-16T06:02:23Z
401721246111972549,111972549,MadeFreeThrow,Lorenzo Downey made Free Throw.,17,7,1st Half,7:56,True,2010,2025-02-16T06:02:23Z
401721246111972624,111972624,Lost Ball Turnover,Greg Moore Turnover.,17,7,1st Half,7:45,False,2400,2025-02-16T06:02:38Z
401721246111972895,111972895,Steal,Joshua Hughley Steal.,17,7,1st Half,7:45,False,2010,2025-02-16T06:02:38Z
401721246111972936,111972936,LayUpShot,Aaron Smith made Layup. Assisted by Angok Anyang.,19,7,1st Half,7:37,True,2010,2025-02-16T06:02:46Z
401721246111973194,111973194,LayUpShot,Greg Moore made Layup.,19,9,1st Half,7:09,True,2400,2025-02-16T06:03:14Z
401721246111973287,111973287,JumpShot,Lorenzo Downey made Three Point Jumper. Assisted by Angok Anyang.,22,9,1st Half,6:27,True,2010,2025-02-16T06:03:57Z
401721246111973616,111973616,PersonalFoul,Foul on Angok Anyang.,22,9,1st Half,6:21,False,2010,2025-02-16T06:04:04Z
401721246111973802,111973802,MadeFreeThrow,George Ivory III missed Free Throw.,22,9,1st Half,6:21,False,2400,2025-02-16T06:04:25Z
401721246111973859,111973859,Dead Ball Rebound,Mississippi Valley State Deadball Team Rebound.,22,9,1st Half,6:21,False,2400,2025-02-16T06:04:25Z
401721246111973903,111973903,MadeFreeThrow,George Ivory III made Free Throw.,22,10,1st Half,6:21,True,2400,2025-02-16T06:04:45Z
401721246111974036,111974036,LayUpShot,Lorenzo Downey made Layup.,24,10,1st Half,6:10,True,2010,2025-02-16T06:05:05Z
401721246111974244,111974244,Substitution,Raeshun McGregory subbing out for Mississippi Valley State,24,10,1st Half,5:59,False,2400,2025-02-16T06:05:35Z
401721246111974349,111974349,Substitution,Arthur Tate subbing in for Mississippi Valley State,24,10,1st Half,5:59,False,2400,2025-02-16T06:05:35Z
401721246111974395,111974395,Substitution,Angok Anyang subbing out for Alabama A&M,24,10,1st Half,5:59,False,2010,2025-02-16T06:05:35Z
401721246111974439,111974439,Substitution,Aaron Smith subbing out for Alabama A&M,24,10,1st Half,5:59,False,2010,2025-02-16T06:05:35Z
401721246111974523,111974523,Substitution,AC Bryant subbing in for Alabama A&M,24,10,1st Half,5:59,False,2010,2025-02-16T06:05:35Z
401721246111974592,111974592,Substitution,Chad Moodie subbing in for Alabama A&M,24,10,1st Half,5:59,False,2010,2025-02-16T06:05:35Z
401721246111974678,111974678,PersonalFoul,Foul on Joshua Hughley.,24,10,1st Half,5:59,False,2010,2025-02-16T06:05:40Z
401721246111974797,111974797,MadeFreeThrow,Greg Moore made Free Throw.,24,11,1st Half,5:59,True,2400,2025-02-16T06:05:47Z
401721246111974862,111974862,MadeFreeThrow,Greg Moore made Free Throw.,24,12,1st Half,5:59,True,2400,2025-02-16T06:06:03Z
401721246111975066,111975066,Lost Ball Turnover,Chad Moodie Turnover.,24,12,1st Half,5:56,False,2010,2025-02-16T06:06:12Z
401721246111975159,111975159,JumpShot,Greg Moore missed Three Point Jumper.,24,12,1st Half,5:27,False,2400,2025-02-16T06:06:55Z
401721246111975267,111975267,Defensive Rebound,AC Bryant Defensive Rebound.,24,12,1st Half,5:25,False,2010,2025-02-16T06:06:57Z
401721246111975276,111975276,Lost Ball Turnover,Joshua Hughley Turnover.,24,12,1st Half,5:18,False,2010,2025-02-16T06:07:04Z
401721246111975357,111975357,Steal,George Ivory III Steal.,24,12,1st Half,5:18,False,2400,2025-02-16T06:07:04Z
401721246111975361,111975361,Lost Ball Turnover,Greg Moore Turnover.,24,12,1st Half,5:12,False,2400,2025-02-16T06:07:10Z
401721246111975466,111975466,Substitution,Greg Moore subbing out for Mississippi Valley State,24,12,1st Half,5:08,False,2400,2025-02-16T06:07:20Z
401721246111975552,111975552,Substitution,Moses Horne subbing in for Mississippi Valley State,24,12,1st Half,5:08,False,2400,2025-02-16T06:07:20Z
401721246111975618,111975618,Lost Ball Turnover,Chad Moodie Turnover.,24,12,1st Half,5:07,False,2010,2025-02-16T06:07:49Z
401721246111975682,111975682,Steal,Jair Horton Steal.,24,12,1st Half,5:07,False,2400,2025-02-16T06:07:49Z
401721246111976488,111976488,DunkShot,Arthur Tate made Dunk. Assisted by Jair Horton.,24,14,1st Half,4:50,True,2400,2025-02-16T06:08:01Z
401721246111976573,111976573,JumpShot,AC Bryant made Three Point Jumper. Assisted by Jaylen Colon.,27,14,1st Half,4:36,True,2010,2025-02-16T06:08:16Z
401721246111977287,111977287,Lost Ball Turnover,Arthur Tate Turnover.,27,14,1st Half,4:12,False,2400,2025-02-16T06:08:37Z
401721246111977293,111977293,Steal,Lorenzo Downey Steal.,27,14,1st Half,4:12,False,2010,2025-02-16T06:08:37Z
401721246111977372,111977372,JumpShot,AC Bryant missed Three Point Jumper.,27,14,1st Half,4:04,False,2010,2025-02-16T06:08:43Z
401721246111977527,111977527,Offensive Rebound,AC Bryant Offensive Rebound.,27,14,1st Half,4:00,False,2010,2025-02-16T06:08:46Z
401721246111977597,111977597,JumpShot,AC Bryant missed Three Point Jumper.,27,14,1st Half,3:58,False,2010,2025-02-16T06:08:49Z
401721246111977660,111977660,Defensive Rebound,Arthur Tate Defensive Rebound.,27,14,1st Half,3:55,False,2400,2025-02-16T06:08:51Z
401721246111977904,111977904,PersonalFoul,Foul on AC Bryant.,27,14,1st Half,3:41,False,2010,2025-02-16T06:09:11Z
401721246111978112,111978112,OfficialTVTimeOut,Official TV Timeout,27,14,1st Half,3:41,False,,2025-02-16T06:09:30Z
401721246111978220,111978220,Substitution,AC Bryant subbing out for Alabama A&M,27,14,1st Half,3:41,False,2010,2025-02-16T06:11:18Z
401721246111978301,111978301,Substitution,Lorenzo Downey subbing out for Alabama A&M,27,14,1st Half,3:41,False,2010,2025-02-16T06:11:18Z
401721246111978370,111978370,Substitution,Quincy McGriff subbing in for Alabama A&M,27,14,1st Half,3:41,False,2010,2025-02-16T06:11:18Z
401721246111978448,111978448,Substitution,London Riley subbing in for Alabama A&M,27,14,1st Half,3:41,False,2010,2025-02-16T06:11:18Z
401721246111978565,111978565,Substitution,Darius Ford subbing in for Alabama A&M,27,14,1st Half,3:41,False,2010,2025-02-16T06:11:18Z
401721246111978699,111978699,MadeFreeThrow,Jair Horton missed Free Throw.,27,14,1st Half,3:41,False,2400,2025-02-16T06:11:25Z
401721246111978769,111978769,Dead Ball Rebound,Mississippi Valley State Deadball Team Rebound.,27,14,1st Half,3:41,False,2400,2025-02-16T06:11:25Z
401721246111978907,111978907,MadeFreeThrow,Jair Horton missed Free Throw.,27,14,1st Half,3:41,False,2400,2025-02-16T06:11:44Z
401721246111978955,111978955,Defensive Rebound,Chad Moodie Defensive Rebound.,27,14,1st Half,3:41,False,2010,2025-02-16T06:11:48Z
401721246111995660,111995660,Substitution,Joshua Hughley subbing out for Alabama A&M,27,14,1st Half,3:41,False,2010,2025-02-16T07:45:26Z
401721246111979127,111979127,JumpShot,Chad Moodie missed Jumper.,27,14,1st Half,3:17,False,2010,2025-02-16T06:12:12Z
401721246111979177,111979177,Defensive Rebound,Arthur Tate Defensive Rebound.,27,14,1st Half,3:11,False,2400,2025-02-16T06:12:18Z
401721246111979254,111979254,JumpShot,Arthur Tate missed Jumper.,27,14,1st Half,2:48,False,2400,2025-02-16T06:12:42Z
401721246111979316,111979316,Defensive Rebound,London Riley Defensive Rebound.,27,14,1st Half,2:43,False,2010,2025-02-16T06:12:46Z
401721246111979383,111979383,LayUpShot,Jaylen Colon missed Layup.,27,14,1st Half,2:37,False,2010,2025-02-16T06:12:53Z
401721246111979457,111979457,Offensive Rebound,Chad Moodie Offensive Rebound.,27,14,1st Half,2:33,False,2010,2025-02-16T06:12:57Z
401721246111979635,111979635,LayUpShot,Chad Moodie made Layup.,29,14,1st Half,2:32,True,2010,2025-02-16T06:12:58Z
401721246111979658,111979658,Lost Ball Turnover,Antonio Sisk Turnover.,29,14,1st Half,2:25,False,2400,2025-02-16T06:13:06Z
401721246111979798,111979798,Substitution,Jaylen Colon subbing out for Alabama A&M,29,14,1st Half,2:25,False,2010,2025-02-16T06:13:18Z
401721246111979870,111979870,Substitution,Angok Anyang subbing in for Alabama A&M,29,14,1st Half,2:25,False,2010,2025-02-16T06:13:18Z
401721246111980016,111980016,JumpShot,Quincy McGriff missed Three Point Jumper.,29,14,1st Half,2:06,False,2010,2025-02-16T06:13:39Z
401721246111980101,111980101,Defensive Rebound,Jair Horton Defensive Rebound.,29,14,1st Half,2:04,False,2400,2025-02-16T06:13:43Z
401721246111980276,111980276,PersonalFoul,Foul on Angok Anyang.,29,14,1st Half,2:04,False,2010,2025-02-16T06:13:45Z
401721246111980395,111980395,MadeFreeThrow,Jair Horton made Free Throw.,29,15,1st Half,2:04,True,2400,2025-02-16T06:14:21Z
401721246111980444,111980444,Substitution,Angok Anyang subbing out for Alabama A&M,29,15,1st Half,2:04,False,2010,2025-02-16T06:14:27Z
401721246111980540,111980540,Substitution,Austin Harvell subbing in for Alabama A&M,29,15,1st Half,2:04,False,2010,2025-02-16T06:14:27Z
401721246111980614,111980614,Substitution,Moses Horne subbing out for Mississippi Valley State,29,15,1st Half,2:04,False,2400,2025-02-16T06:14:44Z
401721246111980781,111980781,Substitution,Daniel Umoh subbing in for Mississippi Valley State,29,15,1st Half,2:04,False,2400,2025-02-16T06:14:44Z
