play_id,sequence_number,type,description,away_score,home_score,period,clock,scoring_play,team_id,timestamp_utc
401722301101805401,101805401,LayUpShot,Harlond Beverly missed Layup.,0,0,1st Half,19:45,False,2724,2024-11-19T00:32:14Z
401722301101805402,101805402,Block Shot,Madison Durr Block.,0,0,1st Half,19:45,False,2405,2024-11-19T00:32:14Z
401722301101805601,101805601,Defensive Rebound,Madison Durr Defensive Rebound.,0,0,1st Half,19:43,False,2405,2024-11-19T00:32:14Z
401722301101805602,101805602,PersonalFoul,Foul on Harlond Beverly.,0,0,1st Half,19:43,False,2724,2024-11-19T00:32:14Z
401722301101806801,101806801,JumpShot,Abdi Bashir Jr. missed Three Point Jumper.,0,0,1st Half,19:31,False,2405,2024-11-19T00:32:46Z
401722301101807201,101807201,Offensive Rebound,Chris Morgan Offensive Rebound.,0,0,1st Half,19:27,False,2405,2024-11-19T00:32:46Z
401722301101807301,101807301,JumpShot,Chris Morgan made Jumper.,2,0,1st Half,19:26,True,2405,2024-11-19T00:32:51Z
401722301101809201,101809201,JumpShot,Bijan Cortes missed Three Point Jumper.,2,0,1st Half,19:07,False,2724,2024-11-19T00:33:11Z
401722301101809601,101809601,Offensive Rebound,Corey Washington Offensive Rebound.,2,0,1st Half,19:03,False,2724,2024-11-19T00:33:13Z
401722301101814001,101814001,JumpShot,Corey Washington missed Three Point Jumper.,2,0,1st Half,18:59,False,2724,2024-11-19T00:33:18Z
401722301101814201,101814201,Offensive Rebound,Wichita State Offensive Rebound.,2,0,1st Half,18:57,False,2724,2024-11-19T00:33:18Z
401722301101814202,101814202,PersonalFoul,Foul on Chris Morgan.,2,0,1st Half,18:57,False,2405,2024-11-19T00:33:18Z
401722301101814901,101814901,LayUpShot,Corey Washington missed Layup.,2,0,1st Half,18:50,False,2724,2024-11-19T00:33:44Z
401722301101815201,101815201,Defensive Rebound,Chris Morgan Defensive Rebound.,2,0,1st Half,18:47,False,2405,2024-11-19T00:33:48Z
401722301101815701,101815701,LayUpShot,Cornelius Robinson III made Layup. Assisted by Madison Durr.,4,0,1st Half,18:42,True,2405,2024-11-19T00:33:53Z
401722301101817201,101817201,Lost Ball Turnover,Bijan Cortes Turnover.,4,0,1st Half,18:27,False,2724,2024-11-19T00:34:08Z
401722301101817202,101817202,Steal,Chris Morgan Steal.,4,0,1st Half,18:27,False,2405,2024-11-19T00:34:08Z
401722301101819701,101819701,Lost Ball Turnover,Madison Durr Turnover.,4,0,1st Half,18:02,False,2405,2024-11-19T00:34:33Z
401722301101819702,101819702,Steal,Harlond Beverly Steal.,4,0,1st Half,18:02,False,2724,2024-11-19T00:34:33Z
401722301101824901,101824901,JumpShot,Corey Washington made Three Point Jumper. Assisted by Bijan Cortes.,4,3,1st Half,17:50,True,2724,2024-11-19T00:34:45Z
401722301101828201,101828201,Lost Ball Turnover,Monmouth  Turnover.,4,3,1st Half,17:17,False,2405,2024-11-19T00:35:17Z
401722301101829701,101829701,Lost Ball Turnover,Corey Washington Turnover.,4,3,1st Half,17:02,False,2724,2024-11-19T00:35:44Z
401722301101829702,101829702,Steal,Chris Morgan Steal.,4,3,1st Half,17:02,False,2405,2024-11-19T00:35:44Z
401722301101836501,101836501,JumpShot,Abdi Bashir Jr. made Three Point Jumper.,7,3,1st Half,16:34,True,2405,2024-11-19T00:36:48Z
401722301101837701,101837701,LayUpShot,Bijan Cortes missed Layup.,7,3,1st Half,16:22,False,2724,2024-11-19T00:37:01Z
401722301101838101,101838101,Defensive Rebound,Jaret Valencia Defensive Rebound.,7,3,1st Half,16:18,False,2405,2024-11-19T00:37:03Z
401722301101838601,101838601,JumpShot,Abdi Bashir Jr. missed Three Point Jumper.,7,3,1st Half,16:13,False,2405,2024-11-19T00:37:09Z
401722301101838901,101838901,Defensive Rebound,Justin Hill Defensive Rebound.,7,3,1st Half,16:10,False,2724,2024-11-19T00:37:12Z
401722301101844501,101844501,JumpShot,Justin Hill missed Three Point Jumper.,7,3,1st Half,15:54,False,2724,2024-11-19T00:37:28Z
401722301101844801,101844801,Defensive Rebound,Madison Durr Defensive Rebound.,7,3,1st Half,15:51,False,2405,2024-11-19T00:37:31Z
401722301101845501,101845501,LayUpShot,Cornelius Robinson III made Layup. Assisted by Jack Collins.,9,3,1st Half,15:44,True,2405,2024-11-19T00:37:40Z
401722301101846801,101846801,LayUpShot,Justin Hill made Layup.,9,5,1st Half,15:31,True,2724,2024-11-19T00:37:52Z
401722301101848101,101848101,JumpShot,Abdi Bashir Jr. missed Three Point Jumper.,9,5,1st Half,15:18,False,2405,2024-11-19T00:38:05Z
401722301101848301,101848301,Defensive Rebound,Wichita State Defensive Rebound.,9,5,1st Half,15:16,False,2724,2024-11-19T00:38:05Z
401722301101848302,101848302,OfficialTVTimeOut, Official TV Timeout,9,5,1st Half,15:16,False,,2024-11-19T00:38:05Z
401722301101854401,101854401,LayUpShot,Corey Washington made Layup.,9,7,1st Half,14:55,True,2724,2024-11-19T00:41:29Z
401722301101854402,101854402,PersonalFoul,Foul on Dok Muordar.,9,7,1st Half,14:55,False,2405,2024-11-19T00:41:29Z
401722301101854403,101854403,MadeFreeThrow,Corey Washington missed Free Throw.,9,7,1st Half,14:55,False,2724,2024-11-19T00:41:29Z
401722301101854404,101854404,Defensive Rebound,Dok Muordar Defensive Rebound.,9,7,1st Half,14:55,False,2405,2024-11-19T00:41:29Z
401722301101855901,101855901,JumpShot,Jaret Valencia missed Jumper.,9,7,1st Half,14:40,False,2405,2024-11-19T00:42:14Z
401722301101856201,101856201,Defensive Rebound,Xavier Bell Defensive Rebound.,9,7,1st Half,14:37,False,2724,2024-11-19T00:42:16Z
401722301101857001,101857001,LayUpShot,Matej Bosnjak made Layup. Assisted by Harlond Beverly.,9,9,1st Half,14:29,True,2724,2024-11-19T00:42:25Z
401722301101859501,101859501,JumpShot,Madison Durr missed Jumper.,9,9,1st Half,14:04,False,2405,2024-11-19T00:42:50Z
401722301101859801,101859801,Offensive Rebound,Jaret Valencia Offensive Rebound.,9,9,1st Half,14:01,False,2405,2024-11-19T00:42:52Z
401722301101865301,101865301,LayUpShot,Madison Durr missed Layup.,9,9,1st Half,13:46,False,2405,2024-11-19T00:43:07Z
401722301101865601,101865601,Defensive Rebound,Xavier Bell Defensive Rebound.,9,9,1st Half,13:43,False,2724,2024-11-19T00:43:11Z
401722301101866101,101866101,DunkShot,Matej Bosnjak made Dunk. Assisted by Harlond Beverly.,9,11,1st Half,13:38,True,2724,2024-11-19T00:43:16Z
401722301101868101,101868101,LayUpShot,Jack Collins missed Layup.,9,11,1st Half,13:18,False,2405,2024-11-19T00:43:36Z
401722301101868701,101868701,Defensive Rebound,Xavier Bell Defensive Rebound.,9,11,1st Half,13:12,False,2724,2024-11-19T00:43:41Z
401722301101869301,101869301,JumpShot,Justin Hill made Jumper.,9,13,1st Half,13:06,True,2724,2024-11-19T00:43:48Z
401722301101875801,101875801,LayUpShot,Abdi Bashir Jr. missed Layup.,9,13,1st Half,12:41,False,2405,2024-11-19T00:44:12Z
401722301101875802,101875802,Offensive Rebound,Monmouth Offensive Rebound.,9,13,1st Half,12:41,False,2405,2024-11-19T00:44:12Z
401722301101875803,101875803,PersonalFoul,Foul on Justin Hill.,9,13,1st Half,12:41,False,2724,2024-11-19T00:44:12Z
401722301101876301,101876301,LayUpShot,Abdi Bashir Jr. made Layup. Assisted by Chris Morgan.,11,13,1st Half,12:36,True,2405,2024-11-19T00:44:46Z
401722301101877901,101877901,LayUpShot,Xavier Bell missed Layup.,11,13,1st Half,12:20,False,2724,2024-11-19T00:45:03Z
401722301101878301,101878301,Defensive Rebound,Chris Morgan Defensive Rebound.,11,13,1st Half,12:16,False,2405,2024-11-19T00:45:06Z
401722301101878801,101878801,Lost Ball Turnover,Abdi Bashir Jr. Turnover.,11,13,1st Half,12:11,False,2405,2024-11-19T00:45:12Z
401722301101878802,101878802,Steal,Xavier Bell Steal.,11,13,1st Half,12:11,False,2724,2024-11-19T00:45:12Z
401722301101879301,101879301,LayUpShot,Justin Hill made Layup. Assisted by AJ McGinnis.,11,15,1st Half,12:06,True,2724,2024-11-19T00:45:17Z
401722301101885401,101885401,OfficialTVTimeOut, Official TV Timeout,11,15,1st Half,11:45,False,,2024-11-19T00:45:38Z
401722301101886701,101886701,PersonalFoul,Foul on Joy Ighovodja.,11,15,1st Half,11:32,False,2724,2024-11-19T00:49:15Z
401722301101886702,101886702,MadeFreeThrow,Madison Durr missed Free Throw.,11,15,1st Half,11:32,False,2405,2024-11-19T00:49:15Z
401722301101886703,101886703,Offensive Rebound,Monmouth Offensive Rebound.,11,15,1st Half,11:32,False,2405,2024-11-19T00:49:15Z
401722301101886704,101886704,MadeFreeThrow,Madison Durr made Free Throw.,12,15,1st Half,11:32,True,2405,2024-11-19T00:49:15Z
401722301101888401,101888401,LayUpShot,Xavier Bell missed Layup.,12,15,1st Half,11:15,False,2724,2024-11-19T00:50:20Z
401722301101888402,101888402,Block Shot,Andrew Ball Block.,12,15,1st Half,11:15,False,2405,2024-11-19T00:50:23Z
401722301101888801,101888801,Defensive Rebound,Chris Morgan Defensive Rebound.,12,15,1st Half,11:11,False,2405,2024-11-19T00:50:23Z
401722301101889101,101889101,PersonalFoul,Foul on Bijan Cortes.,12,15,1st Half,11:08,False,2724,2024-11-19T00:50:25Z
401722301101894001,101894001,JumpShot,Chris Morgan missed Jumper.,12,15,1st Half,10:59,False,2405,2024-11-19T00:51:06Z
401722301101894201,101894201,Offensive Rebound,Jack Collins Offensive Rebound.,12,15,1st Half,10:57,False,2405,2024-11-19T00:51:09Z
401722301101895401,101895401,Lost Ball Turnover,Andrew Ball Turnover.,12,15,1st Half,10:45,False,2405,2024-11-19T00:51:19Z
401722301101896101,101896101,Lost Ball Turnover,Corey Washington Turnover.,12,15,1st Half,10:38,False,2724,2024-11-19T00:51:38Z
401722301101896102,101896102,Steal,Jack Collins Steal.,12,15,1st Half,10:38,False,2405,2024-11-19T00:51:41Z
401722301101896501,101896501,LayUpShot,Jack Collins made Layup.,14,15,1st Half,10:34,True,2405,2024-11-19T00:51:41Z
401722301101898201,101898201,JumpShot,Ronnie DeGray III missed Three Point Jumper.,14,15,1st Half,10:17,False,2724,2024-11-19T00:51:58Z
401722301101898701,101898701,Defensive Rebound,Jack Collins Defensive Rebound.,14,15,1st Half,10:12,False,2405,2024-11-19T00:52:01Z
401722301101899701,101899701,JumpShot,Chris Morgan made Jumper.,16,15,1st Half,10:02,True,2405,2024-11-19T00:52:13Z
401722301101905901,101905901,LayUpShot,Corey Washington missed Layup.,16,15,1st Half,9:40,False,2724,2024-11-19T00:52:35Z
401722301101906301,101906301,Offensive Rebound,Corey Washington Offensive Rebound.,16,15,1st Half,9:36,False,2724,2024-11-19T00:52:38Z
401722301101906302,101906302,JumpShot,Corey Washington missed Jumper.,16,15,1st Half,9:36,False,2724,2024-11-19T00:52:38Z
401722301101906401,101906401,Defensive Rebound,Andrew Ball Defensive Rebound.,16,15,1st Half,9:35,False,2405,2024-11-19T00:52:38Z
401722301101907601,101907601,PersonalFoul,Foul on Bijan Cortes.,16,15,1st Half,9:23,False,2724,2024-11-19T00:52:51Z
401722301101909601,101909601,LayUpShot,Andrew Ball missed Layup.,16,15,1st Half,9:03,False,2405,2024-11-19T00:53:45Z
401722301101914201,101914201,Offensive Rebound,Andrew Ball Offensive Rebound.,16,15,1st Half,8:57,False,2405,2024-11-19T00:53:52Z
401722301101914202,101914202,JumpShot,Andrew Ball missed Jumper.,16,15,1st Half,8:57,False,2405,2024-11-19T00:53:52Z
401722301101914401,101914401,Offensive Rebound,Andrew Ball Offensive Rebound.,16,15,1st Half,8:55,False,2405,2024-11-19T00:53:52Z
401722301101914501,101914501,Lost Ball Turnover,Andrew Ball Turnover.,16,15,1st Half,8:54,False,2405,2024-11-19T00:53:52Z
401722301101914502,101914502,Steal,Matej Bosnjak Steal.,16,15,1st Half,8:54,False,2724,2024-11-19T00:53:52Z
401722301101915501,101915501,JumpShot,Corey Washington missed Jumper.,16,15,1st Half,8:44,False,2724,2024-11-19T00:54:02Z
401722301101916001,101916001,Defensive Rebound,Andrew Ball Defensive Rebound.,16,15,1st Half,8:39,False,2405,2024-11-19T00:54:08Z
401722301101916601,101916601,Lost Ball Turnover,Abdi Bashir Jr. Turnover.,16,15,1st Half,8:33,False,2405,2024-11-19T00:54:14Z
401722301101916602,101916602,Steal,Corey Washington Steal.,16,15,1st Half,8:33,False,2724,2024-11-19T00:54:14Z
401722301101918901,101918901,LayUpShot,Corey Washington missed Layup.,16,15,1st Half,8:10,False,2724,2024-11-19T00:55:20Z
401722301101919201,101919201,Defensive Rebound,Andrew Ball Defensive Rebound.,16,15,1st Half,8:07,False,2405,2024-11-19T00:55:22Z
401722301101919501,101919501,JumpShot,Andrew Ball missed Jumper.,16,15,1st Half,8:04,False,2405,2024-11-19T00:55:25Z
401722301101919801,101919801,Defensive Rebound,Xavier Bell Defensive Rebound.,16,15,1st Half,8:01,False,2724,2024-11-19T00:55:28Z
401722301101924301,101924301,PersonalFoul,Foul on Jaret Valencia.,16,15,1st Half,7:56,False,2405,2024-11-19T00:55:32Z
401722301101924302,101924302,OfficialTVTimeOut, Official TV Timeout,16,15,1st Half,7:56,False,,2024-11-19T00:55:32Z
401722301101924303,101924303,MadeFreeThrow,Ronnie DeGray III missed Free Throw.,16,15,1st Half,7:56,False,2724,2024-11-19T00:58:47Z
401722301101924304,101924304,Offensive Rebound,Wichita State Offensive Rebound.,16,15,1st Half,7:56,False,2724,2024-11-19T00:58:47Z
401722301101924305,101924305,MadeFreeThrow,Ronnie DeGray III missed Free Throw.,16,15,1st Half,7:56,False,2724,2024-11-19T00:58:47Z
401722301101924306,101924306,Defensive Rebound,Monmouth Defensive Rebound.,16,15,1st Half,7:56,False,2405,2024-11-19T00:58:47Z
401722301101926501,101926501,LayUpShot,Jaret Valencia made Layup.,18,15,1st Half,7:34,True,2405,2024-11-19T00:59:46Z
401722301101927401,101927401,PersonalFoul,Foul on Abdi Bashir Jr..,18,15,1st Half,7:25,False,2405,2024-11-19T00:59:56Z
401722301101927402,101927402,MadeFreeThrow,Xavier Bell made Free Throw.,18,16,1st Half,7:25,True,2724,2024-11-19T00:59:56Z
401722301101927403,101927403,MadeFreeThrow,Xavier Bell made Free Throw.,18,17,1st Half,7:25,True,2724,2024-11-19T00:59:56Z
401722301101928901,101928901,LayUpShot,Aric Demings missed Layup.,18,17,1st Half,7:10,False,2405,2024-11-19T01:00:56Z
401722301101928902,101928902,Block Shot,Matej Bosnjak Block.,18,17,1st Half,7:10,False,2724,2024-11-19T01:00:56Z
401722301101929301,101929301,Defensive Rebound,Corey Washington Defensive Rebound.,18,17,1st Half,7:06,False,2724,2024-11-19T01:00:56Z
401722301101929901,101929901,PersonalFoul,Foul on Aric Demings.,18,17,1st Half,7:00,False,2405,2024-11-19T01:01:06Z
401722301101929902,101929902,MadeFreeThrow,Justin Hill made Free Throw.,18,18,1st Half,7:00,True,2724,2024-11-19T01:01:06Z
401722301101929903,101929903,MadeFreeThrow,Justin Hill missed Free Throw.,18,18,1st Half,7:00,False,2724,2024-11-19T01:01:06Z
401722301101929904,101929904,Defensive Rebound,Jaret Valencia Defensive Rebound.,18,18,1st Half,7:00,False,2405,2024-11-19T01:01:06Z
401722301101936501,101936501,JumpShot,Abdi Bashir Jr. missed Three Point Jumper.,18,18,1st Half,6:34,False,2405,2024-11-19T01:02:12Z
401722301101936901,101936901,Defensive Rebound,Harlond Beverly Defensive Rebound.,18,18,1st Half,6:30,False,2724,2024-11-19T01:02:15Z
401722301101937701,101937701,LayUpShot,Harlond Beverly missed Layup.,18,18,1st Half,6:22,False,2724,2024-11-19T01:02:23Z
401722301101938001,101938001,Defensive Rebound,Cornelius Robinson III Defensive Rebound.,18,18,1st Half,6:19,False,2405,2024-11-19T01:02:26Z
401722301101938501,101938501,Lost Ball Turnover,Madison Durr Turnover.,18,18,1st Half,6:14,False,2405,2024-11-19T01:02:31Z
401722301101938502,101938502,Steal,Harlond Beverly Steal.,18,18,1st Half,6:14,False,2724,2024-11-19T01:02:34Z
401722301101939001,101939001,PersonalFoul,Foul on Cornelius Robinson III.,18,18,1st Half,6:09,False,2405,2024-11-19T01:02:34Z
401722301101939002,101939002,MadeFreeThrow,Harlond Beverly made Free Throw.,18,19,1st Half,6:09,True,2724,2024-11-19T01:02:34Z
401722301101939003,101939003,MadeFreeThrow,Harlond Beverly missed Free Throw.,18,19,1st Half,6:09,False,2724,2024-11-19T01:02:34Z
401722301101939004,101939004,Defensive Rebound,Jaret Valencia Defensive Rebound.,18,19,1st Half,6:09,False,2405,2024-11-19T01:02:34Z
401722301101945001,101945001,LayUpShot,Chris Morgan missed Layup.,18,19,1st Half,5:49,False,2405,2024-11-19T01:03:46Z
401722301101945301,101945301,Defensive Rebound,Corey Washington Defensive Rebound.,18,19,1st Half,5:46,False,2724,2024-11-19T01:03:48Z
401722301101945901,101945901,JumpShot,Justin Hill missed Three Point Jumper.,18,19,1st Half,5:40,False,2724,2024-11-19T01:03:55Z
401722301101946201,101946201,Defensive Rebound,Madison Durr Defensive Rebound.,18,19,1st Half,5:37,False,2405,2024-11-19T01:03:58Z
401722301101948201,101948201,PersonalFoul,Foul on Matej Bosnjak.,18,19,1st Half,5:17,False,2724,2024-11-19T01:04:17Z
401722301101948202,101948202,MadeFreeThrow,Madison Durr missed Free Throw.,18,19,1st Half,5:17,False,2405,2024-11-19T01:04:47Z
401722301101948203,101948203,Offensive Rebound,Monmouth Offensive Rebound.,18,19,1st Half,5:17,False,2405,2024-11-19T01:04:47Z
401722301101948204,101948204,MadeFreeThrow,Madison Durr made Free Throw.,19,19,1st Half,5:17,True,2405,2024-11-19T01:04:47Z
401722301101949501,101949501,JumpShot,Justin Hill missed Jumper.,19,19,1st Half,5:04,False,2724,2024-11-19T01:05:21Z
401722301101949801,101949801,Defensive Rebound,Justin Ray Defensive Rebound.,19,19,1st Half,5:01,False,2405,2024-11-19T01:05:25Z
401722301101954901,101954901,PersonalFoul,Foul on AJ McGinnis.,19,19,1st Half,4:50,False,2724,2024-11-19T01:05:35Z
401722301101954902,101954902,MadeFreeThrow,Jaret Valencia missed Free Throw.,19,19,1st Half,4:50,False,2405,2024-11-19T01:05:35Z
401722301101954903,101954903,Defensive Rebound,Matej Bosnjak Defensive Rebound.,19,19,1st Half,4:50,False,2724,2024-11-19T01:05:35Z
401722301101956701,101956701,JumpShot,AJ McGinnis missed Three Point Jumper.,19,19,1st Half,4:32,False,2724,2024-11-19T01:06:29Z
401722301101957101,101957101,Defensive Rebound,Chris Morgan Defensive Rebound.,19,19,1st Half,4:28,False,2405,2024-11-19T01:06:31Z
401722301101964401,101964401,JumpShot,Jack Collins missed Three Point Jumper.,19,19,1st Half,3:55,False,2405,2024-11-19T01:07:16Z
401722301101964402,101964402,Defensive Rebound,Wichita State Defensive Rebound.,19,19,1st Half,3:55,False,2724,2024-11-19T01:07:16Z
401722301101964403,101964403,PersonalFoul,Foul on Chris Morgan.,19,19,1st Half,3:55,False,2405,2024-11-19T01:07:16Z
401722301101964404,101964404,OfficialTVTimeOut, Official TV Timeout,19,19,1st Half,3:55,False,,2024-11-19T01:07:16Z
401722301101964405,101964405,MadeFreeThrow,Matej Bosnjak missed Free Throw.,19,19,1st Half,3:55,False,2724,2024-11-19T01:07:16Z
401722301101964406,101964406,Offensive Rebound,Corey Washington Offensive Rebound.,19,19,1st Half,3:55,False,2724,2024-11-19T01:07:16Z
401722301101964407,101964407,PersonalFoul,Foul on Cornelius Robinson III.,19,19,1st Half,3:55,False,2405,2024-11-19T01:07:16Z
401722301101964408,101964408,MadeFreeThrow,Corey Washington made Free Throw.,19,20,1st Half,3:55,True,2724,2024-11-19T01:07:16Z
401722301101964409,101964409,MadeFreeThrow,Corey Washington missed Free Throw.,19,20,1st Half,3:55,False,2724,2024-11-19T01:07:16Z
401722301101964410,101964410,Defensive Rebound,Cornelius Robinson III Defensive Rebound.,19,20,1st Half,3:55,False,2405,2024-11-19T01:07:16Z
401722301101966201,101966201,LayUpShot,Jaret Valencia made Layup.,21,20,1st Half,3:37,True,2405,2024-11-19T01:11:39Z
401722301101966901,101966901,PersonalFoul,Foul on Jaret Valencia.,21,20,1st Half,3:30,False,2405,2024-11-19T01:11:46Z
401722301101966902,101966902,MadeFreeThrow,Corey Washington missed Free Throw.,21,20,1st Half,3:30,False,2724,2024-11-19T01:11:46Z
401722301101966903,101966903,Offensive Rebound,Wichita State Offensive Rebound.,21,20,1st Half,3:30,False,2724,2024-11-19T01:11:46Z
401722301101966904,101966904,MadeFreeThrow,Corey Washington made Free Throw.,21,21,1st Half,3:30,True,2724,2024-11-19T01:11:46Z
401722301101968301,101968301,JumpShot,Jaret Valencia made Jumper. Assisted by Abdi Bashir Jr..,23,21,1st Half,3:16,True,2405,2024-11-19T01:13:16Z
401722301101975201,101975201,PersonalFoul,Foul on Madison Durr.,23,21,1st Half,2:47,False,2405,2024-11-19T01:13:43Z
401722301101975202,101975202,MadeFreeThrow,Corey Washington missed Free Throw.,23,21,1st Half,2:47,False,2724,2024-11-19T01:13:43Z
401722301101975203,101975203,Offensive Rebound,Wichita State Offensive Rebound.,23,21,1st Half,2:47,False,2724,2024-11-19T01:13:43Z
401722301101975204,101975204,MadeFreeThrow,Corey Washington made Free Throw.,23,22,1st Half,2:47,True,2724,2024-11-19T01:13:43Z
401722301101975205,101975205,MadeFreeThrow,Corey Washington made Free Throw.,23,23,1st Half,2:47,True,2724,2024-11-19T01:13:43Z
401722301101977101,101977101,LayUpShot,Jack Collins missed Layup.,23,23,1st Half,2:28,False,2405,2024-11-19T01:15:06Z
401722301101977401,101977401,Defensive Rebound,Corey Washington Defensive Rebound.,23,23,1st Half,2:25,False,2724,2024-11-19T01:15:09Z
401722301101977402,101977402,Lost Ball Turnover,Corey Washington Turnover.,23,23,1st Half,2:25,False,2724,2024-11-19T01:15:09Z
401722301101977403,101977403,Steal,Madison Durr Steal.,23,23,1st Half,2:25,False,2405,2024-11-19T01:15:09Z
401722301101978001,101978001,JumpShot,Jack Collins made Three Point Jumper. Assisted by Cornelius Robinson III.,26,23,1st Half,2:19,True,2405,2024-11-19T01:15:16Z
401722301101984101,101984101,PersonalFoul,Foul on Jack Collins.,26,23,1st Half,1:58,False,2405,2024-11-19T01:15:36Z
401722301101984102,101984102,MadeFreeThrow,Matej Bosnjak made Free Throw.,26,24,1st Half,1:58,True,2724,2024-11-19T01:15:36Z
401722301101984103,101984103,MadeFreeThrow,Matej Bosnjak made Free Throw.,26,25,1st Half,1:58,True,2724,2024-11-19T01:15:36Z
401722301101985801,101985801,JumpShot,Jack Collins missed Three Point Jumper.,26,25,1st Half,1:41,False,2405,2024-11-19T01:16:44Z
401722301101986001,101986001,Defensive Rebound,Justin Hill Defensive Rebound.,26,25,1st Half,1:39,False,2724,2024-11-19T01:16:48Z
401722301101986401,101986401,PersonalFoul,Foul on Abdi Bashir Jr..,26,25,1st Half,1:35,False,2405,2024-11-19T01:16:51Z
401722301101986402,101986402,MadeFreeThrow,Justin Hill made Free Throw.,26,26,1st Half,1:35,True,2724,2024-11-19T01:16:51Z
401722301101986403,101986403,MadeFreeThrow,Justin Hill missed Free Throw.,26,26,1st Half,1:35,False,2724,2024-11-19T01:16:51Z
401722301101986404,101986404,Defensive Rebound,Cornelius Robinson III Defensive Rebound.,26,26,1st Half,1:35,False,2405,2024-11-19T01:16:51Z
401722301101988001,101988001,Lost Ball Turnover,Cornelius Robinson III Turnover.,26,26,1st Half,1:19,False,2405,2024-11-19T01:17:52Z
401722301101988002,101988002,Steal,Xavier Bell Steal.,26,26,1st Half,1:19,False,2724,2024-11-19T01:17:52Z
401722301101988501,101988501,LayUpShot,Harlond Beverly made Layup. Assisted by Xavier Bell.,26,28,1st Half,1:14,True,2724,2024-11-19T01:17:59Z
401722301101988601,101988601,ShortTimeOut,Monmouth  Timeout,26,28,1st Half,1:13,False,2405,2024-11-19T01:17:59Z
401722301101989701,101989701,LayUpShot,Jaret Valencia made Layup. Assisted by Justin Ray.,28,28,1st Half,1:02,True,2405,2024-11-19T01:19:24Z
401722301101995301,101995301,Lost Ball Turnover,Justin Hill Turnover.,28,28,1st Half,0:46,False,2724,2024-11-19T01:19:41Z
401722301101995302,101995302,Steal,Madison Durr Steal.,28,28,1st Half,0:46,False,2405,2024-11-19T01:19:43Z
401722301101995801,101995801,PersonalFoul,Foul on Harlond Beverly.,28,28,1st Half,0:41,False,2724,2024-11-19T01:19:53Z
401722301101995802,101995802,MadeFreeThrow,Madison Durr missed Free Throw.,28,28,1st Half,0:41,False,2405,2024-11-19T01:19:53Z
401722301101995803,101995803,Offensive Rebound,Monmouth Offensive Rebound.,28,28,1st Half,0:41,False,2405,2024-11-19T01:19:53Z
401722301101995804,101995804,MadeFreeThrow,Madison Durr made Free Throw.,29,28,1st Half,0:41,True,2405,2024-11-19T01:19:53Z
401722301101996601,101996601,DunkShot,Harlond Beverly made Dunk. Assisted by Justin Hill.,29,30,1st Half,0:33,True,2724,2024-11-19T01:21:04Z
401722301101999201,101999201,JumpShot,Justin Ray made Jumper.,31,30,1st Half,0:07,True,2405,2024-11-19T01:21:30Z
401722301101999902,101999902,JumpShot,Ronnie DeGray III missed Three Point Jumper.,31,30,1st Half,0:00,False,2724,2024-11-19T01:21:30Z
401722301101999903,101999903,Defensive Rebound,Dok Muordar Defensive Rebound.,31,30,1st Half,0:00,False,2405,2024-11-19T01:21:30Z
401722301101999901,101999901,End Period,End of 1st half,31,30,1st Half,0:00,False,,2024-11-19T01:21:30Z
401722301102805301,102805301,JumpShot,Madison Durr made Three Point Jumper. Assisted by Jack Collins.,34,30,2nd Half,19:46,True,2405,2024-11-19T01:38:18Z
401722301102806801,102806801,LayUpShot,Corey Washington made Layup.,34,32,2nd Half,19:31,True,2724,2024-11-19T01:38:30Z
401722301102814501,102814501,JumpShot,Cornelius Robinson III made Jumper.,36,32,2nd Half,18:54,True,2405,2024-11-19T01:39:29Z
401722301102816201,102816201,JumpShot,Matej Bosnjak made Jumper. Assisted by Harlond Beverly.,36,34,2nd Half,18:37,True,2724,2024-11-19T01:39:47Z
401722301102819001,102819001,JumpShot,Cornelius Robinson III missed Jumper.,36,34,2nd Half,18:09,False,2405,2024-11-19T01:40:14Z
401722301102819401,102819401,Defensive Rebound,Corey Washington Defensive Rebound.,36,34,2nd Half,18:05,False,2724,2024-11-19T01:40:17Z
401722301102825201,102825201,Lost Ball Turnover,Harlond Beverly Turnover.,36,34,2nd Half,17:47,False,2724,2024-11-19T01:41:21Z
401722301102825202,102825202,Steal,Chris Morgan Steal.,36,34,2nd Half,17:47,False,2405,2024-11-19T01:41:21Z
401722301102827601,102827601,PersonalFoul,Foul on Corey Washington.,36,34,2nd Half,17:23,False,2724,2024-11-19T01:42:01Z
401722301102827602,102827602,MadeFreeThrow,Chris Morgan missed Free Throw.,36,34,2nd Half,17:23,False,2405,2024-11-19T01:42:01Z
401722301102827603,102827603,Offensive Rebound,Monmouth Offensive Rebound.,36,34,2nd Half,17:23,False,2405,2024-11-19T01:42:01Z
401722301102827604,102827604,MadeFreeThrow,Chris Morgan made Free Throw.,37,34,2nd Half,17:23,True,2405,2024-11-19T01:42:01Z
401722301102829001,102829001,Lost Ball Turnover,Corey Washington Turnover.,37,34,2nd Half,17:09,False,2724,2024-11-19T01:43:04Z
401722301102834701,102834701,Lost Ball Turnover,Chris Morgan Turnover.,37,34,2nd Half,16:52,False,2405,2024-11-19T01:43:30Z
401722301102834702,102834702,Steal,Matej Bosnjak Steal.,37,34,2nd Half,16:52,False,2724,2024-11-19T01:43:30Z
401722301102834801,102834801,PersonalFoul,Foul on Madison Durr.,37,34,2nd Half,16:51,False,2405,2024-11-19T01:43:30Z
401722301102835301,102835301,Lost Ball Turnover,Bijan Cortes Turnover.,37,34,2nd Half,16:46,False,2724,2024-11-19T01:43:57Z
