play_id,sequence_number,type,description,away_score,home_score,period,clock,scoring_play,team_id,timestamp_utc
401744203113168628,113168628,Jumpball,Start game,0,0,1st Half,20:00,False,,2025-03-09T08:48:28Z
401744203113168637,113168637,Jumpball,Jump Ball won by North Dakota,0,0,1st Half,19:57,False,155,2025-03-09T08:48:30Z
401744203113168638,113168638,Jumpball,Jump Ball lost by St. Thomas-Minnesota,0,0,1st Half,19:57,False,2900,2025-03-09T08:48:30Z
401744203113168642,113168642,LayUpShot,Eli King missed Layup.,0,0,1st Half,19:47,False,155,2025-03-09T08:48:41Z
401744203113168643,113168643,Defensive Rebound,St. Thomas-Minnesota Defensive Rebound.,0,0,1st Half,19:46,False,2900,2025-03-09T08:48:43Z
401744203113168664,113168664,JumpShot,Carter Bjerke made Three Point Jumper. Assisted by Drake Dobbs.,0,3,1st Half,19:37,True,2900,2025-03-09T08:49:00Z
401744203113168674,113168674,LayUpShot,Mier Panoam missed Layup.,0,3,1st Half,19:22,False,155,2025-03-09T08:49:15Z
401744203113168680,113168680,Offensive Rebound,Mier Panoam Offensive Rebound.,0,3,1st Half,19:17,False,155,2025-03-09T08:49:19Z
401744203113168681,113168681,TipShot,Mier Panoam made Two Point Tip Shot.,2,3,1st Half,19:17,True,155,2025-03-09T08:49:19Z
401744203113168711,113168711,JumpShot,Kendall Blue missed Three Point Jumper.,2,3,1st Half,18:58,False,2900,2025-03-09T08:49:40Z
401744203113168712,113168712,Offensive Rebound,Drake Dobbs Offensive Rebound.,2,3,1st Half,18:54,False,2900,2025-03-09T08:49:43Z
401744203113168723,113168723,PersonalFoul,Foul on Mier Panoam.,2,3,1st Half,18:39,False,155,2025-03-09T08:50:02Z
401744203113168740,113168740,MadeFreeThrow,Kendall Blue made Free Throw.,2,4,1st Half,18:39,True,2900,2025-03-09T08:50:24Z
401744203113168766,113168766,MadeFreeThrow,Kendall Blue made Free Throw.,2,5,1st Half,18:39,True,2900,2025-03-09T08:50:38Z
401744203113168778,113168778,Lost Ball Turnover,Amar Kuljuhovic Turnover.,2,5,1st Half,18:16,False,155,2025-03-09T08:51:08Z
401744203113168808,113168808,Steal,Nolan Minessale Steal.,2,5,1st Half,18:16,False,2900,2025-03-09T08:51:08Z
401744203113168814,113168814,Lost Ball Turnover,Carter Bjerke Turnover.,2,5,1st Half,18:08,False,2900,2025-03-09T08:51:21Z
401744203113168816,113168816,Steal,Treysen Eaglestaff Steal.,2,5,1st Half,18:08,False,155,2025-03-09T08:51:21Z
401744203113168830,113168830,JumpShot,Eli King made Three Point Jumper. Assisted by Treysen Eaglestaff.,5,5,1st Half,17:56,True,155,2025-03-09T08:51:43Z
401744203113168841,113168841,Lost Ball Turnover,Kendall Blue Turnover.,5,5,1st Half,17:32,False,2900,2025-03-09T08:52:06Z
401744203113168842,113168842,Steal,Amar Kuljuhovic Steal.,5,5,1st Half,17:32,False,155,2025-03-09T08:52:06Z
401744203113168868,113168868,Lost Ball Turnover,Amar Kuljuhovic Turnover.,5,5,1st Half,17:27,False,155,2025-03-09T08:52:11Z
401744203113168869,113168869,Steal,Nolan Minessale Steal.,5,5,1st Half,17:27,False,2900,2025-03-09T08:52:11Z
401744203113168870,113168870,Lost Ball Turnover,Nolan Minessale Turnover.,5,5,1st Half,17:23,False,2900,2025-03-09T08:52:15Z
401744203113168871,113168871,Steal,Mier Panoam Steal.,5,5,1st Half,17:23,False,155,2025-03-09T08:52:15Z
401744203113168877,113168877,DunkShot,Mier Panoam made Dunk.,7,5,1st Half,17:18,True,155,2025-03-09T08:52:20Z
401744203113168884,113168884,JumpShot,Carter Bjerke missed Three Point Jumper.,7,5,1st Half,17:05,False,2900,2025-03-09T08:52:34Z
401744203113168885,113168885,Defensive Rebound,Mier Panoam Defensive Rebound.,7,5,1st Half,17:02,False,155,2025-03-09T08:52:36Z
401744203113168910,113168910,LayUpShot,Mambourou Mara made Layup.,9,5,1st Half,16:49,True,155,2025-03-09T08:52:50Z
401744203113168912,113168912,JumpShot,Carter Bjerke missed Three Point Jumper.,9,5,1st Half,16:39,False,2900,2025-03-09T08:53:00Z
401744203113168913,113168913,Defensive Rebound,Eli King Defensive Rebound.,9,5,1st Half,16:35,False,155,2025-03-09T08:53:03Z
401744203113168928,113168928,JumpShot,Eli King missed Three Point Jumper.,9,5,1st Half,16:23,False,155,2025-03-09T08:53:16Z
401744203113168940,113168940,Dead Ball Rebound,North Dakota Deadball Team Rebound.,9,5,1st Half,16:23,False,155,2025-03-09T08:53:21Z
401744203113168941,113168941,PersonalFoul,Foul on Kendall Blue.,9,5,1st Half,16:23,False,2900,2025-03-09T08:53:23Z
401744203113168950,113168950,Substitution,Miles Barnstable subbing out for St. Thomas-Minnesota,9,5,1st Half,16:23,False,2900,2025-03-09T08:53:47Z
401744203113168952,113168952,Substitution,Carter Bjerke subbing out for St. Thomas-Minnesota,9,5,1st Half,16:23,False,2900,2025-03-09T08:53:47Z
401744203113168954,113168954,Substitution,Ben Nau subbing in for St. Thomas-Minnesota,9,5,1st Half,16:23,False,2900,2025-03-09T08:53:47Z
401744203113168955,113168955,Substitution,Rich Byhre subbing in for St. Thomas-Minnesota,9,5,1st Half,16:23,False,2900,2025-03-09T08:53:47Z
401744203113168956,113168956,Substitution,Amar Kuljuhovic subbing out for North Dakota,9,5,1st Half,16:23,False,155,2025-03-09T08:53:47Z
401744203113168957,113168957,Substitution,Deng Mayar subbing in for North Dakota,9,5,1st Half,16:23,False,155,2025-03-09T08:53:47Z
401744203113168961,113168961,PersonalFoul,Foul on Ben Nau.,9,5,1st Half,16:15,False,2900,2025-03-09T08:53:55Z
401744203113168990,113168990,JumpShot,Deng Mayar made Three Point Jumper. Assisted by Treysen Eaglestaff.,12,5,1st Half,16:12,True,155,2025-03-09T08:54:11Z
401744203113168996,113168996,JumpShot,Ben Nau missed Three Point Jumper.,12,5,1st Half,15:34,False,2900,2025-03-09T08:54:48Z
401744203113168999,113168999,Defensive Rebound,Eli King Defensive Rebound.,12,5,1st Half,15:31,False,155,2025-03-09T08:54:50Z
401744203113169000,113169000,JumpShot,Mambourou Mara missed Three Point Jumper.,12,5,1st Half,15:14,False,155,2025-03-09T08:55:08Z
401744203113169004,113169004,Defensive Rebound,Drake Dobbs Defensive Rebound.,12,5,1st Half,15:11,False,2900,2025-03-09T08:55:10Z
401744203113169005,113169005,JumpShot,Kendall Blue missed Three Point Jumper.,12,5,1st Half,14:57,False,2900,2025-03-09T08:55:26Z
401744203113169046,113169046,Defensive Rebound,Treysen Eaglestaff Defensive Rebound.,12,5,1st Half,14:53,False,155,2025-03-09T08:55:28Z
401744203113169052,113169052,Lost Ball Turnover,Treysen Eaglestaff Turnover.,12,5,1st Half,14:46,False,155,2025-03-09T08:55:40Z
401744203113169053,113169053,Steal,Nolan Minessale Steal.,12,5,1st Half,14:46,False,2900,2025-03-09T08:55:40Z
401744203113169054,113169054,PersonalFoul,Foul on Mambourou Mara.,12,5,1st Half,14:46,False,155,2025-03-09T08:55:43Z
401744203113169058,113169058,OfficialTVTimeOut,Official TV Timeout,12,5,1st Half,14:46,False,,2025-03-09T08:55:53Z
401744203113169123,113169123,Substitution,Kendall Blue subbing out for St. Thomas-Minnesota,12,5,1st Half,14:46,False,2900,2025-03-09T08:58:15Z
401744203113169124,113169124,Substitution,Nolan Minessale subbing out for St. Thomas-Minnesota,12,5,1st Half,14:46,False,2900,2025-03-09T08:58:15Z
401744203113169146,113169146,Substitution,Miles Barnstable subbing in for St. Thomas-Minnesota,12,5,1st Half,14:46,False,2900,2025-03-09T08:58:15Z
401744203113169147,113169147,Substitution,Ben Oosterbaan subbing in for St. Thomas-Minnesota,12,5,1st Half,14:46,False,2900,2025-03-09T08:58:15Z
401744203113169157,113169157,JumpShot,Ben Nau missed Three Point Jumper.,12,5,1st Half,14:30,False,2900,2025-03-09T08:58:53Z
401744203113169158,113169158,Defensive Rebound,Mambourou Mara Defensive Rebound.,12,5,1st Half,14:27,False,155,2025-03-09T08:58:55Z
401744203113169161,113169161,Lost Ball Turnover,Treysen Eaglestaff Turnover.,12,5,1st Half,14:20,False,155,2025-03-09T08:59:03Z
401744203113169162,113169162,Steal,Ben Nau Steal.,12,5,1st Half,14:20,False,2900,2025-03-09T08:59:03Z
401744203113169163,113169163,LayUpShot,Ben Oosterbaan missed Layup.,12,5,1st Half,14:14,False,2900,2025-03-09T08:59:08Z
401744203113169167,113169167,Block Shot,Mambourou Mara Block.,12,5,1st Half,14:14,False,155,2025-03-09T08:59:08Z
401744203113169168,113169168,Offensive Rebound,Ben Oosterbaan Offensive Rebound.,12,5,1st Half,14:11,False,2900,2025-03-09T08:59:11Z
401744203113169169,113169169,JumpShot,Miles Barnstable missed Three Point Jumper.,12,5,1st Half,14:05,False,2900,2025-03-09T08:59:18Z
401744203113169172,113169172,Defensive Rebound,Mambourou Mara Defensive Rebound.,12,5,1st Half,14:02,False,155,2025-03-09T08:59:20Z
401744203113169179,113169179,Lost Ball Turnover,Treysen Eaglestaff Turnover.,12,5,1st Half,13:42,False,155,2025-03-09T08:59:40Z
401744203113169180,113169180,Steal,Ben Nau Steal.,12,5,1st Half,13:42,False,2900,2025-03-09T08:59:40Z
401744203113169181,113169181,JumpShot,Ben Nau missed Three Point Jumper.,12,5,1st Half,13:38,False,2900,2025-03-09T08:59:44Z
401744203113169182,113169182,Defensive Rebound,Deng Mayar Defensive Rebound.,12,5,1st Half,13:36,False,155,2025-03-09T08:59:46Z
401744203113169185,113169185,JumpShot,Mier Panoam missed Three Point Jumper.,12,5,1st Half,13:25,False,155,2025-03-09T08:59:58Z
401744203113169207,113169207,Offensive Rebound,Deng Mayar Offensive Rebound.,12,5,1st Half,13:21,False,155,2025-03-09T09:00:01Z
401744203113169208,113169208,JumpShot,Mambourou Mara missed Three Point Jumper.,12,5,1st Half,13:19,False,155,2025-03-09T09:00:04Z
401744203113169209,113169209,Defensive Rebound,Drake Dobbs Defensive Rebound.,12,5,1st Half,13:16,False,2900,2025-03-09T09:00:06Z
401744203113169212,113169212,Lost Ball Turnover,Rich Byhre Turnover.,12,5,1st Half,13:06,False,2900,2025-03-09T09:00:20Z
401744203113169213,113169213,Steal,Mier Panoam Steal.,12,5,1st Half,13:06,False,155,2025-03-09T09:00:20Z
401744203113169218,113169218,Substitution,Ben Nau subbing out for St. Thomas-Minnesota,12,5,1st Half,13:06,False,2900,2025-03-09T09:00:44Z
401744203113169219,113169219,Substitution,Drake Dobbs subbing out for St. Thomas-Minnesota,12,5,1st Half,13:06,False,2900,2025-03-09T09:00:44Z
401744203113169220,113169220,Substitution,Rich Byhre subbing out for St. Thomas-Minnesota,12,5,1st Half,13:06,False,2900,2025-03-09T09:00:44Z
401744203113169222,113169222,Substitution,Kendall Blue subbing in for St. Thomas-Minnesota,12,5,1st Half,13:06,False,2900,2025-03-09T09:00:44Z
401744203113169223,113169223,Substitution,Ryan Dufault subbing in for St. Thomas-Minnesota,12,5,1st Half,13:06,False,2900,2025-03-09T09:00:44Z
401744203113169224,113169224,Substitution,Carter Bjerke subbing in for St. Thomas-Minnesota,12,5,1st Half,13:06,False,2900,2025-03-09T09:00:44Z
401744203113169225,113169225,Substitution,Mier Panoam subbing out for North Dakota,12,5,1st Half,13:06,False,155,2025-03-09T09:00:44Z
401744203113169246,113169246,Substitution,Mambourou Mara subbing out for North Dakota,12,5,1st Half,13:06,False,155,2025-03-09T09:00:44Z
401744203113169247,113169247,Substitution,Zach Kraft subbing in for North Dakota,12,5,1st Half,13:06,False,155,2025-03-09T09:00:44Z
401744203113169248,113169248,Substitution,Dariyus Woodson subbing in for North Dakota,12,5,1st Half,13:06,False,155,2025-03-09T09:00:44Z
401744203113169255,113169255,JumpShot,Dariyus Woodson missed Three Point Jumper.,12,5,1st Half,12:46,False,155,2025-03-09T09:01:01Z
401744203113169256,113169256,Defensive Rebound,Miles Barnstable Defensive Rebound.,12,5,1st Half,12:43,False,2900,2025-03-09T09:01:03Z
401744203113169290,113169290,Substitution,Miles Barnstable subbing out for St. Thomas-Minnesota,12,5,1st Half,12:28,False,2900,2025-03-09T09:01:33Z
401744203113169291,113169291,Substitution,Drake Dobbs subbing in for St. Thomas-Minnesota,12,5,1st Half,12:28,False,2900,2025-03-09T09:01:33Z
401744203113169299,113169299,LayUpShot,Ryan Dufault missed Layup.,12,5,1st Half,12:21,False,2900,2025-03-09T09:01:55Z
401744203113169300,113169300,Offensive Rebound,Carter Bjerke Offensive Rebound.,12,5,1st Half,12:17,False,2900,2025-03-09T09:01:58Z
401744203113169301,113169301,TipShot,Carter Bjerke missed Two Point Tip Shot.,12,5,1st Half,12:17,False,2900,2025-03-09T09:01:58Z
401744203113169304,113169304,Offensive Rebound,Carter Bjerke Offensive Rebound.,12,5,1st Half,12:16,False,2900,2025-03-09T09:01:59Z
401744203113169305,113169305,TipShot,Carter Bjerke made Two Point Tip Shot.,12,7,1st Half,12:16,True,2900,2025-03-09T09:01:59Z
401744203113169312,113169312,LayUpShot,Treysen Eaglestaff missed Layup.,12,7,1st Half,12:04,False,155,2025-03-09T09:02:12Z
401744203113169313,113169313,Defensive Rebound,Ryan Dufault Defensive Rebound.,12,7,1st Half,12:02,False,2900,2025-03-09T09:02:14Z
401744203113169317,113169317,LayUpShot,Ryan Dufault missed Layup.,12,7,1st Half,11:45,False,2900,2025-03-09T09:02:31Z
401744203113169318,113169318,Defensive Rebound,Eli King Defensive Rebound.,12,7,1st Half,11:43,False,155,2025-03-09T09:02:33Z
401744203113169319,113169319,JumpShot,Eli King missed Three Point Jumper.,12,7,1st Half,11:33,False,155,2025-03-09T09:02:45Z
401744203113169320,113169320,Defensive Rebound,Ben Oosterbaan Defensive Rebound.,12,7,1st Half,11:29,False,2900,2025-03-09T09:02:46Z
401744203113169369,113169369,JumpShot,Carter Bjerke missed Jumper.,12,7,1st Half,11:19,False,2900,2025-03-09T09:02:56Z
401744203113169370,113169370,Defensive Rebound,Eli King Defensive Rebound.,12,7,1st Half,11:17,False,155,2025-03-09T09:02:58Z
401744203113169375,113169375,PersonalFoul,Foul on Dariyus Woodson.,12,7,1st Half,11:06,False,155,2025-03-09T09:03:26Z
401744203113169376,113169376,Lost Ball Turnover,Dariyus Woodson Turnover.,12,7,1st Half,11:06,False,155,2025-03-09T09:03:26Z
401744203113169389,113169389,Technical Foul,Technical Foul on Ben Oosterbaan.,12,7,1st Half,11:06,False,2900,2025-03-09T09:04:09Z
401744203113169396,113169396,Technical Foul,Technical Foul on Dariyus Woodson.,12,7,1st Half,11:06,False,155,2025-03-09T09:04:19Z
401744203113169397,113169397,OfficialTVTimeOut,Official TV Timeout,12,7,1st Half,11:06,False,,2025-03-09T09:04:29Z
401744203113169494,113169494,Substitution,Ryan Dufault subbing out for St. Thomas-Minnesota,12,7,1st Half,11:06,False,2900,2025-03-09T09:06:03Z
401744203113169495,113169495,Substitution,Ben Oosterbaan subbing out for St. Thomas-Minnesota,12,7,1st Half,11:06,False,2900,2025-03-09T09:06:03Z
401744203113169496,113169496,Substitution,Nolan Minessale subbing in for St. Thomas-Minnesota,12,7,1st Half,11:06,False,2900,2025-03-09T09:06:03Z
401744203113169497,113169497,Substitution,Miles Barnstable subbing in for St. Thomas-Minnesota,12,7,1st Half,11:06,False,2900,2025-03-09T09:06:03Z
401744203113169498,113169498,Substitution,Deng Mayar subbing out for North Dakota,12,7,1st Half,11:06,False,155,2025-03-09T09:06:03Z
401744203113169499,113169499,Substitution,Treysen Eaglestaff subbing out for North Dakota,12,7,1st Half,11:06,False,155,2025-03-09T09:06:03Z
401744203113169500,113169500,Substitution,Mier Panoam subbing in for North Dakota,12,7,1st Half,11:06,False,155,2025-03-09T09:06:03Z
401744203113169501,113169501,Substitution,Amar Kuljuhovic subbing in for North Dakota,12,7,1st Half,11:06,False,155,2025-03-09T09:06:03Z
401744203113169510,113169510,PersonalFoul,Foul on Amar Kuljuhovic.,12,7,1st Half,10:56,False,155,2025-03-09T09:06:22Z
401744203113169532,113169532,JumpShot,Drake Dobbs made Jumper.,12,9,1st Half,10:44,True,2900,2025-03-09T09:07:04Z
401744203113169542,113169542,JumpShot,Zach Kraft made Three Point Jumper. Assisted by Mier Panoam.,15,9,1st Half,10:23,True,155,2025-03-09T09:07:25Z
401744203113169549,113169549,LayUpShot,Drake Dobbs made Layup.,15,11,1st Half,10:08,True,2900,2025-03-09T09:07:39Z
401744203113169556,113169556,Lost Ball Turnover,Mier Panoam Turnover.,15,11,1st Half,9:47,False,155,2025-03-09T09:08:00Z
401744203113169557,113169557,Steal,Kendall Blue Steal.,15,11,1st Half,9:47,False,2900,2025-03-09T09:08:00Z
401744203113169558,113169558,LayUpShot,Kendall Blue made Layup.,15,13,1st Half,9:46,True,2900,2025-03-09T09:08:03Z
401744203113169562,113169562,PersonalFoul,Foul on Dariyus Woodson.,15,13,1st Half,9:46,False,155,2025-03-09T09:08:06Z
401744203113169564,113169564,Substitution,Zach Kraft subbing out for North Dakota,15,13,1st Half,9:46,False,155,2025-03-09T09:08:24Z
401744203113169565,113169565,Substitution,Dariyus Woodson subbing out for North Dakota,15,13,1st Half,9:46,False,155,2025-03-09T09:08:24Z
401744203113169587,113169587,Substitution,Mambourou Mara subbing in for North Dakota,15,13,1st Half,9:46,False,155,2025-03-09T09:08:24Z
401744203113169588,113169588,Substitution,Treysen Eaglestaff subbing in for North Dakota,15,13,1st Half,9:46,False,155,2025-03-09T09:08:24Z
401744203113169596,113169596,MadeFreeThrow,Kendall Blue made Free Throw.,15,14,1st Half,9:46,True,2900,2025-03-09T09:08:40Z
401744203113169599,113169599,JumpShot,Amar Kuljuhovic missed Three Point Jumper.,15,14,1st Half,9:33,False,155,2025-03-09T09:08:57Z
401744203113169600,113169600,Defensive Rebound,Miles Barnstable Defensive Rebound.,15,14,1st Half,9:30,False,2900,2025-03-09T09:08:59Z
401744203113169628,113169628,Lost Ball Turnover,Kendall Blue Turnover.,15,14,1st Half,9:18,False,2900,2025-03-09T09:09:12Z
401744203113169629,113169629,Steal,Eli King Steal.,15,14,1st Half,9:18,False,155,2025-03-09T09:09:12Z
401744203113169643,113169643,JumpShot,Eli King missed Three Point Jumper.,15,14,1st Half,8:49,False,155,2025-03-09T09:09:44Z
401744203113169671,113169671,Dead Ball Rebound,North Dakota Deadball Team Rebound.,15,14,1st Half,8:48,False,155,2025-03-09T09:09:58Z
401744203113169673,113169673,PersonalFoul,Foul on Carter Bjerke.,15,14,1st Half,8:48,False,2900,2025-03-09T09:10:00Z
401744203113169686,113169686,Substitution,Kendall Blue subbing out for St. Thomas-Minnesota,15,14,1st Half,8:48,False,2900,2025-03-09T09:10:14Z
401744203113169687,113169687,Substitution,Drake Dobbs subbing out for St. Thomas-Minnesota,15,14,1st Half,8:48,False,2900,2025-03-09T09:10:14Z
401744203113169688,113169688,Substitution,Carter Bjerke subbing out for St. Thomas-Minnesota,15,14,1st Half,8:48,False,2900,2025-03-09T09:10:14Z
401744203113169689,113169689,Substitution,Ben Nau subbing in for St. Thomas-Minnesota,15,14,1st Half,8:48,False,2900,2025-03-09T09:10:14Z
401744203113169690,113169690,Substitution,Ryan Dufault subbing in for St. Thomas-Minnesota,15,14,1st Half,8:48,False,2900,2025-03-09T09:10:14Z
401744203113169691,113169691,Substitution,Rich Byhre subbing in for St. Thomas-Minnesota,15,14,1st Half,8:48,False,2900,2025-03-09T09:10:14Z
401744203113169694,113169694,PersonalFoul,Foul on Ben Nau.,15,14,1st Half,8:46,False,2900,2025-03-09T09:10:19Z
401744203113169707,113169707,DunkShot,Mier Panoam missed Dunk.,15,14,1st Half,8:34,False,155,2025-03-09T09:10:42Z
401744203113169708,113169708,Offensive Rebound,Mambourou Mara Offensive Rebound.,15,14,1st Half,8:31,False,155,2025-03-09T09:10:44Z
401744203113169709,113169709,JumpShot,Mambourou Mara made Three Point Jumper. Assisted by Treysen Eaglestaff.,18,14,1st Half,8:29,True,155,2025-03-09T09:10:48Z
401744203113169718,113169718,JumpShot,Nolan Minessale missed Three Point Jumper.,18,14,1st Half,8:11,False,2900,2025-03-09T09:11:06Z
401744203113169719,113169719,Defensive Rebound,Mier Panoam Defensive Rebound.,18,14,1st Half,8:07,False,155,2025-03-09T09:11:08Z
401744203113169727,113169727,JumpShot,Amar Kuljuhovic made Three Point Jumper. Assisted by Treysen Eaglestaff.,21,14,1st Half,7:53,True,155,2025-03-09T09:11:23Z
401744203113169745,113169745,JumpShot,Ryan Dufault missed Jumper.,21,14,1st Half,7:18,False,2900,2025-03-09T09:12:00Z
401744203113169746,113169746,Defensive Rebound,Mambourou Mara Defensive Rebound.,21,14,1st Half,7:13,False,155,2025-03-09T09:12:02Z
401744203113169751,113169751,JumpShot,Amar Kuljuhovic missed Three Point Jumper.,21,14,1st Half,7:05,False,155,2025-03-09T09:12:11Z
401744203113169752,113169752,Offensive Rebound,Mier Panoam Offensive Rebound.,21,14,1st Half,7:00,False,155,2025-03-09T09:12:15Z
401744203113169753,113169753,TipShot,Mier Panoam made Two Point Tip Shot.,23,14,1st Half,7:00,True,155,2025-03-09T09:12:15Z
401744203113169787,113169787,JumpShot,Miles Barnstable missed Three Point Jumper.,23,14,1st Half,6:45,False,2900,2025-03-09T09:12:32Z
401744203113169788,113169788,Offensive Rebound,Rich Byhre Offensive Rebound.,23,14,1st Half,6:41,False,2900,2025-03-09T09:12:35Z
401744203113169789,113169789,TipShot,Rich Byhre missed Two Point Tip Shot.,23,14,1st Half,6:41,False,2900,2025-03-09T09:12:35Z
401744203113169790,113169790,Offensive Rebound,Rich Byhre Offensive Rebound.,23,14,1st Half,6:40,False,2900,2025-03-09T09:12:39Z
401744203113169803,113169803,OfficialTVTimeOut,Official TV Timeout,23,14,1st Half,6:40,False,,2025-03-09T09:12:51Z
401744203113169890,113169890,Substitution,Nolan Minessale subbing out for St. Thomas-Minnesota,23,14,1st Half,6:40,False,2900,2025-03-09T09:15:30Z
401744203113169891,113169891,Substitution,Ryan Dufault subbing out for St. Thomas-Minnesota,23,14,1st Half,6:40,False,2900,2025-03-09T09:15:30Z
401744203113169892,113169892,Substitution,Miles Barnstable subbing out for St. Thomas-Minnesota,23,14,1st Half,6:40,False,2900,2025-03-09T09:15:30Z
401744203113169893,113169893,Substitution,Rich Byhre subbing out for St. Thomas-Minnesota,23,14,1st Half,6:40,False,2900,2025-03-09T09:15:30Z
401744203113169894,113169894,Substitution,Kendall Blue subbing in for St. Thomas-Minnesota,23,14,1st Half,6:40,False,2900,2025-03-09T09:15:30Z
401744203113169895,113169895,Substitution,Drake Dobbs subbing in for St. Thomas-Minnesota,23,14,1st Half,6:40,False,2900,2025-03-09T09:15:30Z
401744203113169896,113169896,Substitution,Carter Bjerke subbing in for St. Thomas-Minnesota,23,14,1st Half,6:40,False,2900,2025-03-09T09:15:30Z
401744203113169897,113169897,Substitution,Ben Oosterbaan subbing in for St. Thomas-Minnesota,23,14,1st Half,6:40,False,2900,2025-03-09T09:15:30Z
401744203113169898,113169898,Substitution,Amar Kuljuhovic subbing out for North Dakota,23,14,1st Half,6:40,False,155,2025-03-09T09:15:30Z
401744203113169899,113169899,Substitution,Deng Mayar subbing in for North Dakota,23,14,1st Half,6:40,False,155,2025-03-09T09:15:30Z
401744203113169904,113169904,Lost Ball Turnover,Ben Oosterbaan Turnover.,23,14,1st Half,6:33,False,2900,2025-03-09T09:15:47Z
401744203113169911,113169911,LayUpShot,Deng Mayar made Layup. Assisted by Mambourou Mara.,25,14,1st Half,6:05,True,155,2025-03-09T09:16:26Z
401744203113169921,113169921,JumpShot,Ben Nau made Three Point Jumper. Assisted by Kendall Blue.,25,17,1st Half,5:53,True,2900,2025-03-09T09:16:40Z
401744203113169925,113169925,LayUpShot,Deng Mayar missed Layup.,25,17,1st Half,5:35,False,155,2025-03-09T09:16:57Z
401744203113169947,113169947,Offensive Rebound,Mier Panoam Offensive Rebound.,25,17,1st Half,5:31,False,155,2025-03-09T09:17:00Z
401744203113169948,113169948,Lost Ball Turnover,Eli King Turnover.,25,17,1st Half,5:21,False,155,2025-03-09T09:17:11Z
401744203113169949,113169949,JumpShot,Ben Nau made Three Point Jumper. Assisted by Drake Dobbs.,25,20,1st Half,5:14,True,2900,2025-03-09T09:17:19Z
401744203113169960,113169960,Substitution,Kendall Blue subbing out for St. Thomas-Minnesota,25,20,1st Half,5:10,False,2900,2025-03-09T09:17:39Z
401744203113169962,113169962,Substitution,Miles Barnstable subbing in for St. Thomas-Minnesota,25,20,1st Half,5:10,False,2900,2025-03-09T09:17:39Z
401744203113169973,113169973,JumpShot,Mambourou Mara missed Three Point Jumper.,25,20,1st Half,4:50,False,155,2025-03-09T09:18:04Z
401744203113169974,113169974,Defensive Rebound,Miles Barnstable Defensive Rebound.,25,20,1st Half,4:47,False,2900,2025-03-09T09:18:06Z
401744203113170016,113170016,PersonalFoul,Foul on Deng Mayar.,25,20,1st Half,4:39,False,155,2025-03-09T09:18:35Z
401744203113170022,113170022,Substitution,Mier Panoam subbing out for North Dakota,25,20,1st Half,4:39,False,155,2025-03-09T09:18:47Z
401744203113170023,113170023,Substitution,Mambourou Mara subbing out for North Dakota,25,20,1st Half,4:39,False,155,2025-03-09T09:18:47Z
401744203113170024,113170024,Substitution,Zach Kraft subbing in for North Dakota,25,20,1st Half,4:39,False,155,2025-03-09T09:18:47Z
401744203113170025,113170025,Substitution,Amar Kuljuhovic subbing in for North Dakota,25,20,1st Half,4:39,False,155,2025-03-09T09:18:47Z
401744203113170033,113170033,MadeFreeThrow,Ben Nau made Free Throw.,25,21,1st Half,4:39,True,2900,2025-03-09T09:18:57Z
401744203113170041,113170041,MadeFreeThrow,Ben Nau made Free Throw.,25,22,1st Half,4:39,True,2900,2025-03-09T09:19:12Z
401744203113170045,113170045,PersonalFoul,Foul on Ben Nau.,25,22,1st Half,4:33,False,2900,2025-03-09T09:19:26Z
401744203113170062,113170062,Substitution,Ben Nau subbing out for St. Thomas-Minnesota,25,22,1st Half,4:33,False,2900,2025-03-09T09:19:41Z
401744203113170066,113170066,Substitution,Kendall Blue subbing in for St. Thomas-Minnesota,25,22,1st Half,4:33,False,2900,2025-03-09T09:19:41Z
401744203113170074,113170074,JumpShot,Eli King made Jumper.,27,22,1st Half,4:18,True,155,2025-03-09T09:20:00Z
401744203113170112,113170112,JumpShot,Miles Barnstable made Three Point Jumper.,27,25,1st Half,3:57,True,2900,2025-03-09T09:20:22Z
401744203113170118,113170118,JumpShot,Treysen Eaglestaff missed Three Point Jumper.,27,25,1st Half,3:38,False,155,2025-03-09T09:20:40Z
401744203113170119,113170119,Offensive Rebound,Amar Kuljuhovic Offensive Rebound.,27,25,1st Half,3:35,False,155,2025-03-09T09:20:43Z
401744203113170120,113170120,TipShot,Amar Kuljuhovic made Two Point Tip Shot.,29,25,1st Half,3:35,True,155,2025-03-09T09:20:43Z
401744203113170124,113170124,LayUpShot,Miles Barnstable missed Layup.,29,25,1st Half,3:11,False,2900,2025-03-09T09:21:07Z
401744203113170130,113170130,Defensive Rebound,Amar Kuljuhovic Defensive Rebound.,29,25,1st Half,3:08,False,155,2025-03-09T09:21:10Z
401744203113170131,113170131,JumpShot,Zach Kraft missed Three Point Jumper.,29,25,1st Half,3:00,False,155,2025-03-09T09:21:18Z
401744203113170135,113170135,Defensive Rebound,Ben Oosterbaan Defensive Rebound.,29,25,1st Half,2:58,False,2900,2025-03-09T09:21:20Z
401744203113170137,113170137,PersonalFoul,Foul on Zach Kraft.,29,25,1st Half,2:49,False,155,2025-03-09T09:21:31Z
