play_id,sequence_number,type,description,away_score,home_score,period,clock,scoring_play,team_id,timestamp_utc
401708397111940567,111940567,LayUpShot,Curtis Givens III missed Layup.,29,35,1st Half,0:33,False,99,2025-02-16T04:49:15Z
401708397111940569,111940569,Block Shot,Jalon Moore Block.,29,35,1st Half,0:33,False,201,2025-02-16T04:49:15Z
401708397111940572,111940572,Defensive Rebound,Kobe Elvis Defensive Rebound.,29,35,1st Half,0:29,False,201,2025-02-16T04:49:19Z
401708397111940767,111940767,PersonalFoul,Foul on Robert Miller III.,29,35,1st Half,0:08,False,99,2025-02-16T04:49:47Z
401708397111940794,111940794,Substitution,Robert Miller III subbing out for LSU,29,35,1st Half,0:08,False,99,2025-02-16T04:49:59Z
401708397111940796,111940796,Substitution,Daimion Collins subbing in for LSU,29,35,1st Half,0:08,False,99,2025-02-16T04:49:59Z
401708397111940891,111940891,JumpShot,Kobe Elvis missed Three Point Jumper.,29,35,1st Half,0:00,False,201,2025-02-16T04:50:23Z
401708397111940895,111940895,Dead Ball Rebound,Oklahoma Deadball Team Rebound.,29,35,1st Half,0:00,False,201,2025-02-16T04:50:26Z
401708397111940902,111940902,End Period,End of 1st half,29,35,1st Half,0:00,False,,2025-02-16T04:50:30Z
401708397111943049,111943049,Substitution,Kobe Elvis subbing out for Oklahoma,29,35,2nd Half,20:00,False,201,2025-02-16T05:04:33Z
401708397111943050,111943050,Substitution,Mohamed Wague subbing out for Oklahoma,29,35,2nd Half,20:00,False,201,2025-02-16T05:04:33Z
401708397111943051,111943051,Substitution,Jeremiah Fears subbing in for Oklahoma,29,35,2nd Half,20:00,False,201,2025-02-16T05:04:33Z
401708397111943052,111943052,Substitution,Sam Godwin subbing in for Oklahoma,29,35,2nd Half,20:00,False,201,2025-02-16T05:04:33Z
401708397111943053,111943053,Substitution,Curtis Givens III subbing out for LSU,29,35,2nd Half,20:00,False,99,2025-02-16T05:04:33Z
401708397111943054,111943054,Substitution,Jordan Sears subbing in for LSU,29,35,2nd Half,20:00,False,99,2025-02-16T05:04:33Z
401708397111943639,111943639,PersonalFoul,Foul on Brycen Goodine.,29,35,2nd Half,19:50,False,201,2025-02-16T05:07:16Z
401708397111943732,111943732,MadeFreeThrow,Daimion Collins missed Free Throw.,29,35,2nd Half,19:50,False,99,2025-02-16T05:07:36Z
401708397111943733,111943733,Dead Ball Rebound,LSU Deadball Team Rebound.,29,35,2nd Half,19:50,False,99,2025-02-16T05:07:36Z
401708397111943809,111943809,MadeFreeThrow,Daimion Collins missed Free Throw.,29,35,2nd Half,19:50,False,99,2025-02-16T05:07:52Z
401708397111943811,111943811,Defensive Rebound,Jalon Moore Defensive Rebound.,29,35,2nd Half,19:49,False,201,2025-02-16T05:07:53Z
401708397111943877,111943877,LayUpShot,Jeremiah Fears missed Layup.,29,35,2nd Half,19:28,False,201,2025-02-16T05:08:14Z
401708397111943880,111943880,Block Shot,Cam Carter Block.,29,35,2nd Half,19:28,False,99,2025-02-16T05:08:14Z
401708397111943884,111943884,Offensive Rebound,Jeremiah Fears Offensive Rebound.,29,35,2nd Half,19:27,False,201,2025-02-16T05:08:21Z
401708397111943886,111943886,TipShot,Jeremiah Fears made Two Point Tip Shot.,29,37,2nd Half,19:27,True,201,2025-02-16T05:08:21Z
401708397111943933,111943933,PersonalFoul,Foul on Cam Carter.,29,37,2nd Half,19:27,False,99,2025-02-16T05:08:23Z
401708397111943995,111943995,MadeFreeThrow,Jeremiah Fears made Free Throw.,29,38,2nd Half,19:27,True,201,2025-02-16T05:08:42Z
401708397111944112,111944112,JumpShot,Daimion Collins missed Three Point Jumper.,29,38,2nd Half,19:06,False,99,2025-02-16T05:09:21Z
401708397111944155,111944155,Defensive Rebound,Jeremiah Fears Defensive Rebound.,29,38,2nd Half,19:04,False,201,2025-02-16T05:09:23Z
401708397111944132,111944132,LayUpShot,Jalon Moore missed Layup.,29,38,2nd Half,18:55,False,201,2025-02-16T05:09:34Z
401708397111944133,111944133,Block Shot,Daimion Collins Block.,29,38,2nd Half,18:55,False,99,2025-02-16T05:09:34Z
401708397111944134,111944134,Offensive Rebound,Oklahoma Offensive Rebound.,29,38,2nd Half,18:55,False,201,2025-02-16T05:09:38Z
401708397111944144,111944144,PersonalFoul,Foul on Sam Godwin.,29,38,2nd Half,18:52,False,201,2025-02-16T05:09:56Z
401708397111944247,111944247,Lost Ball Turnover,Sam Godwin Turnover.,29,38,2nd Half,18:52,False,201,2025-02-16T05:09:56Z
401708397111944263,111944263,LayUpShot,Vyctorius Miller made Layup.,31,38,2nd Half,18:41,True,99,2025-02-16T05:10:17Z
401708397111944265,111944265,JumpShot,Sam Godwin missed Jumper.,31,38,2nd Half,18:31,False,201,2025-02-16T05:10:27Z
401708397111944326,111944326,Defensive Rebound,Vyctorius Miller Defensive Rebound.,31,38,2nd Half,18:28,False,99,2025-02-16T05:10:30Z
401708397111944328,111944328,JumpShot,Jordan Sears missed Three Point Jumper.,31,38,2nd Half,18:21,False,99,2025-02-16T05:10:37Z
401708397111944330,111944330,Defensive Rebound,Oklahoma Defensive Rebound.,31,38,2nd Half,18:21,False,201,2025-02-16T05:10:41Z
401708397111944345,111944345,LayUpShot,Jeremiah Fears missed Layup.,31,38,2nd Half,18:01,False,201,2025-02-16T05:11:10Z
401708397111944449,111944449,Block Shot,Daimion Collins Block.,31,38,2nd Half,18:01,False,99,2025-02-16T05:11:10Z
401708397111944450,111944450,Offensive Rebound,Oklahoma Offensive Rebound.,31,38,2nd Half,18:01,False,201,2025-02-16T05:11:15Z
401708397111944459,111944459,JumpShot,Jalon Moore made Jumper.,31,40,2nd Half,17:49,True,201,2025-02-16T05:11:31Z
401708397111944556,111944556,Lost Ball Turnover,Daimion Collins Turnover.,31,40,2nd Half,17:40,False,99,2025-02-16T05:11:42Z
401708397111944646,111944646,LayUpShot,Jeremiah Fears made Layup.,31,42,2nd Half,17:22,True,201,2025-02-16T05:12:09Z
401708397111944711,111944711,Lost Ball Turnover,Vyctorius Miller Turnover.,31,42,2nd Half,17:06,False,99,2025-02-16T05:12:30Z
401708397111944778,111944778,Substitution,Daimion Collins subbing out for LSU,31,42,2nd Half,17:06,False,99,2025-02-16T05:12:44Z
401708397111944779,111944779,Substitution,Robert Miller III subbing in for LSU,31,42,2nd Half,17:06,False,99,2025-02-16T05:12:44Z
401708397111944870,111944870,JumpShot,Jalon Moore missed Three Point Jumper.,31,42,2nd Half,16:46,False,201,2025-02-16T05:13:09Z
401708397111944881,111944881,Defensive Rebound,Vyctorius Miller Defensive Rebound.,31,42,2nd Half,16:43,False,99,2025-02-16T05:13:12Z
401708397111944882,111944882,Lost Ball Turnover,Jordan Sears Turnover.,31,42,2nd Half,16:35,False,99,2025-02-16T05:13:20Z
401708397111944919,111944919,Steal,Duke Miles Steal.,31,42,2nd Half,16:35,False,201,2025-02-16T05:13:20Z
401708397111944995,111944995,PersonalFoul,Foul on Cam Carter.,31,42,2nd Half,16:22,False,99,2025-02-16T05:13:41Z
401708397111945042,111945042,MadeFreeThrow,Duke Miles made Free Throw.,31,43,2nd Half,16:22,True,201,2025-02-16T05:14:05Z
401708397111945044,111945044,Substitution,Sam Godwin subbing out for Oklahoma,31,43,2nd Half,16:22,False,201,2025-02-16T05:14:09Z
401708397111945067,111945067,Substitution,Mohamed Wague subbing in for Oklahoma,31,43,2nd Half,16:22,False,201,2025-02-16T05:14:09Z
401708397111945094,111945094,MadeFreeThrow,Duke Miles made Free Throw.,31,44,2nd Half,16:22,True,201,2025-02-16T05:14:27Z
401708397111945214,111945214,Defensive Rebound,Brycen Goodine Defensive Rebound.,31,44,2nd Half,15:58,False,201,2025-02-16T05:14:56Z
401708397111945242,111945242,JumpShot,Jeremiah Fears missed Three Point Jumper.,31,44,2nd Half,15:52,False,201,2025-02-16T05:15:03Z
401708397111945267,111945267,Defensive Rebound,LSU Defensive Rebound.,31,44,2nd Half,15:51,False,99,2025-02-16T05:15:06Z
401708397111945270,111945270,OfficialTVTimeOut,Official TV Timeout,31,44,2nd Half,15:51,False,,2025-02-16T05:15:09Z
401708397111946550,111946550,JumpShot,Robert Miller III missed Jumper.,31,44,2nd Half,15:32,False,99,2025-02-16T05:18:30Z
401708397111946576,111946576,Defensive Rebound,Jeremiah Fears Defensive Rebound.,31,44,2nd Half,15:29,False,201,2025-02-16T05:18:33Z
401708397111946755,111946755,PersonalFoul,Foul on Robert Miller III.,31,44,2nd Half,15:12,False,99,2025-02-16T05:19:14Z
401708397111946824,111946824,MadeFreeThrow,Mohamed Wague missed Free Throw.,31,44,2nd Half,15:12,False,201,2025-02-16T05:19:40Z
401708397111946825,111946825,Dead Ball Rebound,Oklahoma Deadball Team Rebound.,31,44,2nd Half,15:12,False,201,2025-02-16T05:19:40Z
401708397111946866,111946866,Substitution,Jordan Sears subbing out for LSU,31,44,2nd Half,15:12,False,99,2025-02-16T05:19:47Z
401708397111946867,111946867,Substitution,Robert Miller III subbing out for LSU,31,44,2nd Half,15:12,False,99,2025-02-16T05:19:47Z
401708397111946868,111946868,Substitution,Curtis Givens III subbing in for LSU,31,44,2nd Half,15:12,False,99,2025-02-16T05:19:47Z
401708397111946869,111946869,Substitution,Daimion Collins subbing in for LSU,31,44,2nd Half,15:12,False,99,2025-02-16T05:19:47Z
401708397111946929,111946929,MadeFreeThrow,Mohamed Wague missed Free Throw.,31,44,2nd Half,15:12,False,201,2025-02-16T05:20:04Z
401708397111946931,111946931,Defensive Rebound,Cam Carter Defensive Rebound.,31,44,2nd Half,15:11,False,99,2025-02-16T05:20:05Z
401708397111947013,111947013,LayUpShot,Brycen Goodine made Layup.,33,46,2nd Half,14:33,True,201,2025-02-16T05:20:42Z
401708397111947067,111947067,JumpShot,Vyctorius Miller made Three Point Jumper.,36,46,2nd Half,14:15,True,99,2025-02-16T05:21:00Z
401708397111947101,111947101,PersonalFoul,Foul on Mohamed Wague.,36,46,2nd Half,14:05,False,201,2025-02-16T05:21:15Z
401708397111947103,111947103,Lost Ball Turnover,Mohamed Wague Turnover.,36,46,2nd Half,14:05,False,201,2025-02-16T05:21:15Z
401708397111947261,111947261,Substitution,Jeremiah Fears subbing out for Oklahoma,36,46,2nd Half,14:05,False,201,2025-02-16T05:21:57Z
401708397111947262,111947262,Substitution,Brycen Goodine subbing out for Oklahoma,36,46,2nd Half,14:05,False,201,2025-02-16T05:21:57Z
401708397111947263,111947263,Substitution,Mohamed Wague subbing out for Oklahoma,36,46,2nd Half,14:05,False,201,2025-02-16T05:21:57Z
401708397111947264,111947264,Substitution,Duke Miles subbing out for Oklahoma,36,46,2nd Half,14:05,False,201,2025-02-16T05:21:57Z
401708397111947265,111947265,Substitution,Kobe Elvis subbing in for Oklahoma,36,46,2nd Half,14:05,False,201,2025-02-16T05:21:57Z
401708397111947286,111947286,Substitution,Dayton Forsythe subbing in for Oklahoma,36,46,2nd Half,14:05,False,201,2025-02-16T05:21:57Z
401708397111947287,111947287,Substitution,Sam Godwin subbing in for Oklahoma,36,46,2nd Half,14:05,False,201,2025-02-16T05:21:57Z
401708397111947288,111947288,Substitution,Glenn Taylor Jr. subbing in for Oklahoma,36,46,2nd Half,14:05,False,201,2025-02-16T05:21:57Z
401708397111947365,111947365,LayUpShot,Daimion Collins made Layup. Assisted by Vyctorius Miller.,38,46,2nd Half,13:51,True,99,2025-02-16T05:22:17Z
401708397111947386,111947386,PersonalFoul,Foul on Dayton Forsythe.,38,46,2nd Half,13:51,False,201,2025-02-16T05:22:21Z
401708397111947441,111947441,MadeFreeThrow,Daimion Collins made Free Throw.,39,46,2nd Half,13:51,True,99,2025-02-16T05:22:43Z
401708397111947539,111947539,JumpShot,Kobe Elvis missed Three Point Jumper.,39,46,2nd Half,13:26,False,201,2025-02-16T05:23:13Z
401708397111947540,111947540,Offensive Rebound,Sam Godwin Offensive Rebound.,39,46,2nd Half,13:25,False,201,2025-02-16T05:23:15Z
401708397111947542,111947542,PersonalFoul,Foul on Dji Bailey.,39,46,2nd Half,13:25,False,99,2025-02-16T05:23:17Z
401708397111947686,111947686,JumpShot,Kobe Elvis made Jumper.,39,48,2nd Half,13:09,True,201,2025-02-16T05:23:54Z
401708397111947741,111947741,PersonalFoul,Foul on Kobe Elvis.,39,48,2nd Half,12:56,False,201,2025-02-16T05:24:16Z
401708397111947837,111947837,MadeFreeThrow,Daimion Collins made Free Throw.,40,48,2nd Half,12:56,True,99,2025-02-16T05:24:34Z
401708397111947873,111947873,MadeFreeThrow,Daimion Collins made Free Throw.,41,48,2nd Half,12:56,True,99,2025-02-16T05:24:49Z
401708397111947929,111947929,JumpShot,Dayton Forsythe made Jumper.,41,50,2nd Half,12:42,True,201,2025-02-16T05:25:10Z
401708397111948019,111948019,PersonalFoul,Foul on Kobe Elvis.,41,50,2nd Half,12:25,False,201,2025-02-16T05:25:32Z
401708397111948848,111948848,MadeFreeThrow,Vyctorius Miller missed Free Throw.,41,50,2nd Half,12:25,False,99,2025-02-16T05:25:55Z
401708397111948851,111948851,Dead Ball Rebound,LSU Deadball Team Rebound.,41,50,2nd Half,12:25,False,99,2025-02-16T05:25:55Z
401708397111948853,111948853,Substitution,Jalon Moore subbing out for Oklahoma,41,50,2nd Half,12:25,False,201,2025-02-16T05:26:07Z
401708397111948856,111948856,Substitution,Jeremiah Fears subbing in for Oklahoma,41,50,2nd Half,12:25,False,201,2025-02-16T05:26:07Z
401708397111948858,111948858,MadeFreeThrow,Vyctorius Miller missed Free Throw.,41,50,2nd Half,12:25,False,99,2025-02-16T05:26:23Z
401708397111948862,111948862,Defensive Rebound,Glenn Taylor Jr. Defensive Rebound.,41,50,2nd Half,12:24,False,201,2025-02-16T05:26:24Z
401708397111948866,111948866,LayUpShot,Dayton Forsythe missed Layup.,41,50,2nd Half,12:17,False,201,2025-02-16T05:26:31Z
401708397111948868,111948868,Offensive Rebound,Sam Godwin Offensive Rebound.,41,50,2nd Half,12:15,False,201,2025-02-16T05:26:37Z
401708397111948878,111948878,PersonalFoul,Foul on Daimion Collins.,41,50,2nd Half,12:10,False,99,2025-02-16T05:27:08Z
401708397111948883,111948883,JumpShot,Kobe Elvis missed Jumper.,41,50,2nd Half,12:00,False,201,2025-02-16T05:27:30Z
401708397111948884,111948884,Offensive Rebound,Sam Godwin Offensive Rebound.,41,50,2nd Half,11:56,False,201,2025-02-16T05:27:33Z
401708397111948885,111948885,JumpShot,Glenn Taylor Jr. missed Three Point Jumper.,41,50,2nd Half,11:48,False,201,2025-02-16T05:27:42Z
401708397111948906,111948906,Offensive Rebound,Sam Godwin Offensive Rebound.,41,50,2nd Half,11:45,False,201,2025-02-16T05:27:44Z
401708397111948908,111948908,JumpShot,Sam Godwin missed Jumper.,41,50,2nd Half,11:43,False,201,2025-02-16T05:27:47Z
401708397111948910,111948910,Defensive Rebound,Vyctorius Miller Defensive Rebound.,41,50,2nd Half,11:40,False,99,2025-02-16T05:27:50Z
401708397111948912,111948912,JumpShot,Daimion Collins made Three Point Jumper. Assisted by Dji Bailey.,44,50,2nd Half,11:33,True,99,2025-02-16T05:27:57Z
401708397111948917,111948917,Lost Ball Turnover,Kobe Elvis Turnover.,44,50,2nd Half,11:23,False,201,2025-02-16T05:28:11Z
401708397111948918,111948918,OfficialTVTimeOut,Official TV Timeout,44,50,2nd Half,11:23,False,,2025-02-16T05:28:14Z
401708397111949174,111949174,Substitution,Kobe Elvis subbing out for Oklahoma,44,50,2nd Half,11:23,False,201,2025-02-16T05:31:12Z
401708397111949175,111949175,Substitution,Dayton Forsythe subbing out for Oklahoma,44,50,2nd Half,11:23,False,201,2025-02-16T05:31:12Z
401708397111949176,111949176,Substitution,Sam Godwin subbing out for Oklahoma,44,50,2nd Half,11:23,False,201,2025-02-16T05:31:12Z
401708397111949177,111949177,Substitution,Brycen Goodine subbing in for Oklahoma,44,50,2nd Half,11:23,False,201,2025-02-16T05:31:12Z
401708397111949180,111949180,Substitution,Mohamed Wague subbing in for Oklahoma,44,50,2nd Half,11:23,False,201,2025-02-16T05:31:12Z
401708397111949184,111949184,Substitution,Duke Miles subbing in for Oklahoma,44,50,2nd Half,11:23,False,201,2025-02-16T05:31:12Z
401708397111949416,111949416,Lost Ball Turnover,Curtis Givens III Turnover.,44,50,2nd Half,10:55,False,99,2025-02-16T05:32:22Z
401708397111949418,111949418,Steal,Duke Miles Steal.,44,50,2nd Half,10:55,False,201,2025-02-16T05:32:22Z
401708397111949434,111949434,Lost Ball Turnover,Jeremiah Fears Turnover.,44,50,2nd Half,10:39,False,201,2025-02-16T05:32:38Z
401708397111949455,111949455,Substitution,Vyctorius Miller subbing out for LSU,44,50,2nd Half,10:39,False,99,2025-02-16T05:32:50Z
401708397111949457,111949457,Substitution,Mike Williams III subbing in for LSU,44,50,2nd Half,10:39,False,99,2025-02-16T05:32:50Z
401708397111949588,111949588,JumpShot,Daimion Collins made Jumper.,46,50,2nd Half,10:14,True,99,2025-02-16T05:33:25Z
401708397111949604,111949604,LayUpShot,Mohamed Wague made Layup.,46,52,2nd Half,10:04,True,201,2025-02-16T05:33:35Z
401708397111949673,111949673,Substitution,Daimion Collins subbing out for LSU,46,52,2nd Half,10:02,False,99,2025-02-16T05:33:54Z
401708397111949676,111949676,Substitution,Robert Miller III subbing in for LSU,46,52,2nd Half,10:02,False,99,2025-02-16T05:33:54Z
401708397111949711,111949711,Substitution,Glenn Taylor Jr. subbing out for Oklahoma,46,52,2nd Half,10:02,False,201,2025-02-16T05:34:03Z
401708397111949712,111949712,Substitution,Jalon Moore subbing in for Oklahoma,46,52,2nd Half,10:02,False,201,2025-02-16T05:34:03Z
401708397111949793,111949793,LayUpShot,Cam Carter made Layup.,48,52,2nd Half,9:51,True,99,2025-02-16T05:34:23Z
401708397111949861,111949861,JumpShot,Jeremiah Fears made Three Point Jumper. Assisted by Mohamed Wague.,48,55,2nd Half,9:35,True,201,2025-02-16T05:34:40Z
401708397111949910,111949910,JumpShot,Cam Carter made Three Point Jumper.,51,55,2nd Half,9:23,True,99,2025-02-16T05:34:52Z
401708397111949956,111949956,ShortTimeOut,LSU Timeout,51,55,2nd Half,9:23,False,99,2025-02-16T05:35:03Z
401708397111950563,111950563,Substitution,Mohamed Wague subbing out for Oklahoma,51,55,2nd Half,9:23,False,201,2025-02-16T05:37:48Z
401708397111950564,111950564,Substitution,Sam Godwin subbing in for Oklahoma,51,55,2nd Half,9:23,False,201,2025-02-16T05:37:48Z
401708397111950701,111950701,PersonalFoul,Foul on Mike Williams III.,51,55,2nd Half,9:13,False,99,2025-02-16T05:38:24Z
401708397111950868,111950868,PersonalFoul,Foul on Dji Bailey.,51,55,2nd Half,9:04,False,99,2025-02-16T05:39:02Z
401708397111950916,111950916,MadeFreeThrow,Duke Miles made Free Throw.,51,56,2nd Half,9:04,True,201,2025-02-16T05:39:29Z
401708397111950988,111950988,MadeFreeThrow,Duke Miles made Free Throw.,51,57,2nd Half,9:04,True,201,2025-02-16T05:39:48Z
401708397111951113,111951113,Lost Ball Turnover,Robert Miller III Turnover.,51,57,2nd Half,8:37,False,99,2025-02-16T05:40:18Z
401708397111951156,111951156,Steal,Duke Miles Steal.,51,57,2nd Half,8:37,False,201,2025-02-16T05:40:18Z
401708397111951157,111951157,LayUpShot,Sam Godwin missed Layup.,51,57,2nd Half,8:32,False,201,2025-02-16T05:40:23Z
401708397111951158,111951158,Defensive Rebound,Robert Miller III Defensive Rebound.,51,57,2nd Half,8:28,False,99,2025-02-16T05:40:27Z
401708397111951215,111951215,JumpShot,Cam Carter made Three Point Jumper. Assisted by Mike Williams III.,54,57,2nd Half,8:25,True,99,2025-02-16T05:40:43Z
401708397111951237,111951237,PersonalFoul,Foul on Brycen Goodine.,54,57,2nd Half,8:25,False,201,2025-02-16T05:40:50Z
401708397111951293,111951293,MadeFreeThrow,Cam Carter made Free Throw.,55,57,2nd Half,8:25,True,99,2025-02-16T05:41:14Z
401708397111951324,111951324,PersonalFoul,Foul on Robert Miller III.,55,57,2nd Half,8:15,False,99,2025-02-16T05:41:32Z
401708397111951406,111951406,MadeFreeThrow,Jeremiah Fears made Free Throw.,55,58,2nd Half,8:15,True,201,2025-02-16T05:41:59Z
401708397111951487,111951487,MadeFreeThrow,Jeremiah Fears made Free Throw.,55,59,2nd Half,8:15,True,201,2025-02-16T05:42:19Z
401708397111951545,111951545,Substitution,Robert Miller III subbing out for LSU,55,59,2nd Half,8:15,False,99,2025-02-16T05:42:26Z
401708397111951546,111951546,Substitution,Daimion Collins subbing in for LSU,55,59,2nd Half,8:15,False,99,2025-02-16T05:42:26Z
401708397111951614,111951614,LayUpShot,Daimion Collins made Layup. Assisted by Curtis Givens III.,57,59,2nd Half,7:58,True,99,2025-02-16T05:42:47Z
401708397111951655,111951655,JumpShot,Jeremiah Fears missed Three Point Jumper.,57,59,2nd Half,7:46,False,201,2025-02-16T05:42:59Z
401708397111951718,111951718,Defensive Rebound,Daimion Collins Defensive Rebound.,57,59,2nd Half,7:45,False,99,2025-02-16T05:43:02Z
401708397111951719,111951719,PersonalFoul,Foul on Sam Godwin.,57,59,2nd Half,7:45,False,201,2025-02-16T05:43:07Z
401708397111951754,111951754,OfficialTVTimeOut,Official TV Timeout,57,59,2nd Half,7:45,False,,2025-02-16T05:43:12Z
401708397111952342,111952342,MadeFreeThrow,Daimion Collins made Free Throw.,58,59,2nd Half,7:45,True,99,2025-02-16T05:46:23Z
401708397111952374,111952374,MadeFreeThrow,Daimion Collins made Free Throw.,59,59,2nd Half,7:45,True,99,2025-02-16T05:46:37Z
401708397111952478,111952478,JumpShot,Jeremiah Fears missed Jumper.,59,59,2nd Half,7:19,False,201,2025-02-16T05:47:07Z
401708397111952479,111952479,Defensive Rebound,Daimion Collins Defensive Rebound.,59,59,2nd Half,7:15,False,99,2025-02-16T05:47:09Z
401708397111952504,111952504,JumpShot,Cam Carter made Three Point Jumper. Assisted by Mike Williams III.,62,59,2nd Half,7:02,True,99,2025-02-16T05:47:24Z
401708397111952552,111952552,ShortTimeOut,Oklahoma Timeout,62,59,2nd Half,6:54,False,201,2025-02-16T05:47:36Z
401708397111985200,111985200,JumpShot,Sam Godwin missed Jumper.,62,59,2nd Half,6:45,False,201,2025-02-16T05:48:58Z
401708397111985282,111985282,Defensive Rebound,Mike Williams III Defensive Rebound.,62,59,2nd Half,6:41,False,99,2025-02-16T05:49:01Z
401708397111985453,111985453,LayUpShot,Daimion Collins missed Layup.,62,59,2nd Half,6:17,False,99,2025-02-16T05:49:31Z
401708397111985525,111985525,Offensive Rebound,Dji Bailey Offensive Rebound.,62,59,2nd Half,6:17,False,99,2025-02-16T05:49:40Z
401708397111985590,111985590,PersonalFoul,Foul on Brycen Goodine.,62,59,2nd Half,6:17,False,201,2025-02-16T05:49:46Z
401708397111985634,111985634,Substitution,Brycen Goodine subbing out for Oklahoma,62,59,2nd Half,6:17,False,201,2025-02-16T05:50:21Z
401708397111985674,111985674,Substitution,Sam Godwin subbing out for Oklahoma,62,59,2nd Half,6:17,False,201,2025-02-16T05:50:21Z
401708397111985786,111985786,Substitution,Dayton Forsythe subbing in for Oklahoma,62,59,2nd Half,6:17,False,201,2025-02-16T05:50:21Z
401708397111985801,111985801,Substitution,Glenn Taylor Jr. subbing in for Oklahoma,62,59,2nd Half,6:17,False,201,2025-02-16T05:50:21Z
401708397111985843,111985843,MadeFreeThrow,Dji Bailey made Free Throw.,63,59,2nd Half,6:17,True,99,2025-02-16T05:50:32Z
401708397111985958,111985958,MadeFreeThrow,Dji Bailey missed Free Throw.,63,59,2nd Half,6:17,False,99,2025-02-16T05:50:48Z
401708397111985966,111985966,Defensive Rebound,Dayton Forsythe Defensive Rebound.,63,59,2nd Half,6:16,False,201,2025-02-16T05:50:50Z
401708397111985975,111985975,PersonalFoul,Foul on Daimion Collins.,63,59,2nd Half,6:16,False,99,2025-02-16T05:50:52Z
401708397111986006,111986006,MadeFreeThrow,Dayton Forsythe made Free Throw.,63,60,2nd Half,6:16,True,201,2025-02-16T05:51:28Z
401708397111986096,111986096,MadeFreeThrow,Dayton Forsythe made Free Throw.,63,61,2nd Half,6:16,True,201,2025-02-16T05:51:45Z
401708397111986171,111986171,LayUpShot,Cam Carter missed Layup.,63,61,2nd Half,5:52,False,99,2025-02-16T05:52:12Z
401708397111986225,111986225,Defensive Rebound,Jalon Moore Defensive Rebound.,63,61,2nd Half,5:49,False,201,2025-02-16T05:52:14Z
401708397111986254,111986254,LayUpShot,Jeremiah Fears made Layup.,63,63,2nd Half,5:46,True,201,2025-02-16T05:52:18Z
401708397111986262,111986262,JumpShot,Cam Carter missed Three Point Jumper.,63,63,2nd Half,5:21,False,99,2025-02-16T05:52:44Z
401708397111986295,111986295,Defensive Rebound,Jalon Moore Defensive Rebound.,63,63,2nd Half,5:18,False,201,2025-02-16T05:52:46Z
401708397111986471,111986471,PersonalFoul,Foul on Daimion Collins.,63,63,2nd Half,5:06,False,99,2025-02-16T05:53:02Z
401708397111986536,111986536,MadeFreeThrow,Jalon Moore made Free Throw.,63,64,2nd Half,5:06,True,201,2025-02-16T05:53:32Z
401708397111986542,111986542,Substitution,Mike Williams III subbing out for LSU,63,64,2nd Half,5:06,False,99,2025-02-16T05:53:37Z
401708397111986602,111986602,Substitution,Vyctorius Miller subbing in for LSU,63,64,2nd Half,5:06,False,99,2025-02-16T05:53:37Z
401708397111986674,111986674,MadeFreeThrow,Jalon Moore made Free Throw.,63,65,2nd Half,5:06,True,201,2025-02-16T05:53:51Z
401708397111986821,111986821,PersonalFoul,Foul on Jalon Moore.,63,65,2nd Half,4:45,False,201,2025-02-16T05:54:24Z
401708397111986884,111986884,MadeFreeThrow,Dji Bailey made Free Throw.,64,65,2nd Half,4:45,True,99,2025-02-16T05:55:00Z
401708397111986927,111986927,MadeFreeThrow,Dji Bailey missed Free Throw.,64,65,2nd Half,4:45,False,99,2025-02-16T05:55:26Z
401708397111986993,111986993,Defensive Rebound,Oklahoma Defensive Rebound.,64,65,2nd Half,4:45,False,201,2025-02-16T05:55:29Z
401708397111987047,111987047,PersonalFoul,Foul on Daimion Collins.,64,65,2nd Half,4:45,False,99,2025-02-16T05:55:31Z
401708397111987148,111987148,MadeFreeThrow,Dayton Forsythe made Free Throw.,64,66,2nd Half,4:45,True,201,2025-02-16T05:56:13Z
401708397111987161,111987161,MadeFreeThrow,Dayton Forsythe made Free Throw.,64,67,2nd Half,4:45,True,201,2025-02-16T05:56:29Z
401708397111987207,111987207,PersonalFoul,Foul on Dayton Forsythe.,64,67,2nd Half,4:28,False,201,2025-02-16T05:57:00Z
401708397111987224,111987224,MadeFreeThrow,Curtis Givens III made Free Throw.,65,67,2nd Half,4:28,True,99,2025-02-16T05:57:24Z
401708397111987262,111987262,Substitution,Daimion Collins subbing out for LSU,65,67,2nd Half,4:28,False,99,2025-02-16T05:57:31Z
401708397111987340,111987340,Substitution,Robert Miller III subbing in for LSU,65,67,2nd Half,4:28,False,99,2025-02-16T05:57:31Z
401708397111987406,111987406,MadeFreeThrow,Curtis Givens III missed Free Throw.,65,67,2nd Half,4:28,False,99,2025-02-16T05:57:45Z
401708397111987474,111987474,Dead Ball Rebound,Oklahoma Deadball Team Rebound.,65,67,2nd Half,4:28,False,201,2025-02-16T05:57:59Z
401708397111987540,111987540,PersonalFoul,Foul on Robert Miller III.,65,67,2nd Half,4:28,False,99,2025-02-16T05:58:01Z
401708397111987618,111987618,MadeFreeThrow,Jalon Moore made Free Throw.,65,68,2nd Half,4:28,True,201,2025-02-16T05:58:30Z
401708397111987657,111987657,Substitution,Robert Miller III subbing out for LSU,65,68,2nd Half,4:28,False,99,2025-02-16T05:58:38Z
401708397111987708,111987708,Substitution,Daimion Collins subbing in for LSU,65,68,2nd Half,4:28,False,99,2025-02-16T05:58:38Z
401708397111987720,111987720,MadeFreeThrow,Jalon Moore made Free Throw.,65,69,2nd Half,4:28,True,201,2025-02-16T05:58:47Z
