play_id,sequence_number,type,description,away_score,home_score,period,clock,scoring_play,team_id,timestamp_utc
401700469101805201,101805201,JumpShot,Mark Freeman made Jumper.,2,0,1st Half,19:47,True,256,2024-12-18T00:02:14Z
401700469101807401,101807401,JumpShot,Hunter Sallis missed Jumper.,2,0,1st Half,19:25,False,154,2024-12-18T00:02:31Z
401700469101807403,101807403,Defensive Rebound,James Madison Defensive Rebound.,2,0,1st Half,19:25,False,256,2024-12-18T00:02:31Z
401700469101807404,101807404,Block Shot,Xavier Brown Block.,2,0,1st Half,19:25,False,256,2024-12-18T00:03:18Z
401700469101808801,101808801,LayUpShot,Elijah Hutchins-Everett made Layup. Assisted by Eddie Ricks III.,4,0,1st Half,19:11,True,256,2024-12-18T00:02:58Z
401700469101809701,101809701,JumpShot,Davin Cosby missed Three Point Jumper.,4,0,1st Half,19:02,False,154,2024-12-18T00:03:08Z
401700469101814001,101814001,Defensive Rebound,Mark Freeman Defensive Rebound.,4,0,1st Half,18:59,False,256,2024-12-18T00:03:08Z
401700469101814901,101814901,PersonalFoul,Foul on Efton Reid III.,4,0,1st Half,18:50,False,154,2024-12-18T00:03:21Z
401700469101816401,101816401,LayUpShot,AJ Smith missed Layup.,4,0,1st Half,18:35,False,256,2024-12-18T00:03:56Z
401700469101816402,101816402,Block Shot,Tre'Von Spillers Block.,4,0,1st Half,18:35,False,154,2024-12-18T00:03:56Z
401700469101816701,101816701,Defensive Rebound,Hunter Sallis Defensive Rebound.,4,0,1st Half,18:32,False,154,2024-12-18T00:03:56Z
401700469101817001,101817001,Lost Ball Turnover,Hunter Sallis Turnover.,4,0,1st Half,18:29,False,154,2024-12-18T00:03:56Z
401700469101817002,101817002,Steal,Eddie Ricks III Steal.,4,0,1st Half,18:29,False,256,2024-12-18T00:03:56Z
401700469101817501,101817501,JumpShot,Xavier Brown missed Three Point Jumper.,4,0,1st Half,18:24,False,256,2024-12-18T00:04:01Z
401700469101817801,101817801,Defensive Rebound,Hunter Sallis Defensive Rebound.,4,0,1st Half,18:21,False,154,2024-12-18T00:04:04Z
401700469101819401,101819401,JumpShot,Davin Cosby made Three Point Jumper.,4,3,1st Half,18:05,True,154,2024-12-18T00:04:21Z
401700469101825501,101825501,LayUpShot,Eddie Ricks III made Layup. Assisted by Elijah Hutchins-Everett.,6,3,1st Half,17:44,True,256,2024-12-18T00:04:47Z
401700469101827201,101827201,Lost Ball Turnover,Efton Reid III Turnover.,6,3,1st Half,17:27,False,154,2024-12-18T00:04:59Z
401700469101827202,101827202,Steal,Elijah Hutchins-Everett Steal.,6,3,1st Half,17:27,False,256,2024-12-18T00:04:59Z
401700469101827901,101827901,JumpShot,Eddie Ricks III made Three Point Jumper. Assisted by Xavier Brown.,9,3,1st Half,17:20,True,256,2024-12-18T00:05:07Z
401700469101828201,101828201,ShortTimeOut,Wake Forest  Timeout,9,3,1st Half,17:17,False,154,2024-12-18T00:05:07Z
401700469101835301,101835301,JumpShot,Efton Reid III missed Jumper.,9,3,1st Half,16:46,False,154,2024-12-18T00:06:56Z
401700469101835501,101835501,Offensive Rebound,Hunter Sallis Offensive Rebound.,9,3,1st Half,16:44,False,154,2024-12-18T00:06:58Z
401700469101835601,101835601,LayUpShot,Hunter Sallis made Layup.,9,5,1st Half,16:43,True,154,2024-12-18T00:06:58Z
401700469101838301,101838301,JumpShot,Elijah Hutchins-Everett made ,11,5,1st Half,16:16,True,256,2024-12-18T00:07:26Z
401700469101839101,101839101,PersonalFoul,Foul on Mark Freeman.,11,5,1st Half,16:08,False,256,2024-12-18T00:07:33Z
401700469101839501,101839501,JumpShot,Davin Cosby missed Three Point Jumper.,11,5,1st Half,16:04,False,154,2024-12-18T00:08:04Z
401700469101839901,101839901,Offensive Rebound,Wake Forest Offensive Rebound.,11,5,1st Half,16:00,False,154,2024-12-18T00:08:06Z
401700469101839902,101839902,OfficialTVTimeOut, Official TV Timeout,11,5,1st Half,16:00,False,,2024-12-18T00:08:06Z
401700469101844001,101844001,JumpShot,Parker Friedrichsen missed Jumper.,11,5,1st Half,15:59,False,154,2024-12-18T00:11:40Z
401700469101844401,101844401,Offensive Rebound,Hunter Sallis Offensive Rebound.,11,5,1st Half,15:55,False,154,2024-12-18T00:11:42Z
401700469101845101,101845101,JumpShot,Cameron Hildreth made Jumper.,11,7,1st Half,15:48,True,154,2024-12-18T00:11:50Z
401700469101846501,101846501,JumpShot,Bryce Lindsay made Three Point Jumper. Assisted by Eddie Ricks III.,14,7,1st Half,15:34,True,256,2024-12-18T00:12:05Z
401700469101848701,101848701,JumpShot,Parker Friedrichsen made Jumper.,14,9,1st Half,15:12,True,154,2024-12-18T00:12:25Z
401700469101855201,101855201,JumpShot,Xavier Brown missed Jumper.,14,9,1st Half,14:47,False,256,2024-12-18T00:12:50Z
401700469101855401,101855401,Offensive Rebound,Ebenezer Dowuona Offensive Rebound.,14,9,1st Half,14:45,False,256,2024-12-18T00:12:53Z
401700469101856801,101856801,LayUpShot,Ebenezer Dowuona missed Layup.,14,9,1st Half,14:31,False,256,2024-12-18T00:13:08Z
401700469101856901,101856901,Offensive Rebound,Ebenezer Dowuona Offensive Rebound.,14,9,1st Half,14:30,False,256,2024-12-18T00:13:08Z
401700469101856902,101856902,Lost Ball Turnover,Ebenezer Dowuona Turnover.,14,9,1st Half,14:30,False,256,2024-12-18T00:13:11Z
401700469101858801,101858801,JumpShot,Hunter Sallis made Jumper.,14,11,1st Half,14:11,True,154,2024-12-18T00:13:42Z
401700469101865501,101865501,JumpShot,Xavier Brown missed Three Point Jumper.,14,11,1st Half,13:44,False,256,2024-12-18T00:14:09Z
401700469101865801,101865801,Defensive Rebound,Tre'Von Spillers Defensive Rebound.,14,11,1st Half,13:41,False,154,2024-12-18T00:14:12Z
401700469101866801,101866801,JumpShot,Hunter Sallis made Jumper.,14,13,1st Half,13:31,True,154,2024-12-18T00:14:21Z
401700469101868701,101868701,PersonalFoul,Foul on Parker Friedrichsen.,14,13,1st Half,13:12,False,154,2024-12-18T00:14:40Z
401700469101874401,101874401,JumpShot,Mark Freeman missed Jumper.,14,13,1st Half,12:55,False,256,2024-12-18T00:15:33Z
401700469101874901,101874901,Offensive Rebound,Justin Taylor Offensive Rebound.,14,13,1st Half,12:50,False,256,2024-12-18T00:15:36Z
401700469101874902,101874902,TipShot,Justin Taylor missed Two Point Tip Shot.,14,13,1st Half,12:50,False,256,2024-12-18T00:15:36Z
401700469101874903,101874903,Defensive Rebound,Tre'Von Spillers Defensive Rebound.,14,13,1st Half,12:50,False,154,2024-12-18T00:15:36Z
401700469101877701,101877701,JumpShot,Cameron Hildreth missed Jumper.,14,13,1st Half,12:22,False,154,2024-12-18T00:16:54Z
401700469101878001,101878001,Offensive Rebound,Hunter Sallis Offensive Rebound.,14,13,1st Half,12:19,False,154,2024-12-18T00:16:57Z
401700469101879001,101879001,Lost Ball Turnover,Ty-Laur Johnson Turnover.,14,13,1st Half,12:09,False,154,2024-12-18T00:17:07Z
401700469101879002,101879002,Steal,Mark Freeman Steal.,14,13,1st Half,12:09,False,256,2024-12-18T00:17:07Z
401700469101879501,101879501,LayUpShot,Justin Taylor made Layup. Assisted by Mark Freeman.,16,13,1st Half,12:04,True,256,2024-12-18T00:17:12Z
401700469101885601,101885601,Lost Ball Turnover,Cameron Hildreth Turnover.,16,13,1st Half,11:43,False,154,2024-12-18T00:17:33Z
401700469101885602,101885602,Steal,Mark Freeman Steal.,16,13,1st Half,11:43,False,256,2024-12-18T00:17:33Z
401700469101886101,101886101,JumpShot,Bryce Lindsay missed Three Point Jumper.,16,13,1st Half,11:38,False,256,2024-12-18T00:17:39Z
401700469101886401,101886401,Offensive Rebound,AJ Smith Offensive Rebound.,16,13,1st Half,11:35,False,256,2024-12-18T00:17:39Z
401700469101886601,101886601,JumpShot,Bryce Lindsay made Jumper. Assisted by AJ Smith.,18,13,1st Half,11:33,True,256,2024-12-18T00:17:44Z
401700469101889301,101889301,JumpShot,Hunter Sallis missed Jumper.,18,13,1st Half,11:06,False,154,2024-12-18T00:18:11Z
401700469101889601,101889601,Defensive Rebound,AJ Smith Defensive Rebound.,18,13,1st Half,11:03,False,256,2024-12-18T00:18:15Z
401700469101894401,101894401,JumpShot,Mark Freeman made Three Point Jumper. Assisted by Bryce Lindsay.,21,13,1st Half,10:55,True,256,2024-12-18T00:18:22Z
401700469101897101,101897101,JumpShot,Ty-Laur Johnson missed Three Point Jumper.,21,13,1st Half,10:28,False,154,2024-12-18T00:18:48Z
401700469101897102,101897102,Block Shot,Mark Freeman Block.,21,13,1st Half,10:28,False,256,2024-12-18T00:18:48Z
401700469101897104,101897104,Offensive Rebound,Wake Forest Offensive Rebound.,21,13,1st Half,10:28,False,154,2024-12-18T00:18:48Z
401700469101897105,101897105,OfficialTVTimeOut, Official TV Timeout,21,13,1st Half,10:28,False,,2024-12-18T00:18:48Z
401700469101897106,101897106,PersonalFoul,Foul on Elijah Hutchins-Everett.,21,13,1st Half,10:28,False,256,2024-12-18T00:18:48Z
401700469101897301,101897301,LayUpShot,Churchill Abass missed Layup.,21,13,1st Half,10:26,False,154,2024-12-18T00:22:53Z
401700469101897501,101897501,Defensive Rebound,AJ Smith Defensive Rebound.,21,13,1st Half,10:24,False,256,2024-12-18T00:22:55Z
401700469101899101,101899101,JumpShot,Bryce Lindsay missed Three Point Jumper.,21,13,1st Half,10:08,False,256,2024-12-18T00:23:30Z
401700469101899401,101899401,Defensive Rebound,Churchill Abass Defensive Rebound.,21,13,1st Half,10:05,False,154,2024-12-18T00:23:32Z
401700469101904101,101904101,DunkShot,Tre'Von Spillers made Dunk. Assisted by Hunter Sallis.,21,15,1st Half,9:58,True,154,2024-12-18T00:23:39Z
401700469101907501,101907501,PersonalFoul,Foul on Juke Harris.,21,15,1st Half,9:24,False,154,2024-12-18T00:24:13Z
401700469101908101,101908101,JumpShot,Mark Freeman missed Jumper.,21,15,1st Half,9:18,False,256,2024-12-18T00:24:52Z
401700469101908201,101908201,Defensive Rebound,Hunter Sallis Defensive Rebound.,21,15,1st Half,9:17,False,154,2024-12-18T00:24:52Z
401700469101914501,101914501,JumpShot,Cameron Hildreth made Three Point Jumper. Assisted by Hunter Sallis.,21,18,1st Half,8:54,True,154,2024-12-18T00:25:48Z
401700469101916501,101916501,LayUpShot,Eddie Ricks III missed Layup.,21,18,1st Half,8:34,False,256,2024-12-18T00:26:05Z
401700469101916502,101916502,Block Shot,Tre'Von Spillers Block.,21,18,1st Half,8:34,False,154,2024-12-18T00:26:05Z
401700469101916601,101916601,Offensive Rebound,James Madison Offensive Rebound.,21,18,1st Half,8:33,False,256,2024-12-18T00:26:05Z
401700469101917101,101917101,LayUpShot,Ebenezer Dowuona made Layup. Assisted by Xavier Brown.,23,18,1st Half,8:28,True,256,2024-12-18T00:26:41Z
401700469101919601,101919601,PersonalFoul,Foul on Eddie Ricks III.,23,18,1st Half,8:03,False,256,2024-12-18T00:27:44Z
401700469101919602,101919602,MadeFreeThrow,Cameron Hildreth missed Free Throw.,23,18,1st Half,8:03,False,154,2024-12-18T00:27:44Z
401700469101919603,101919603,Dead Ball Rebound,Wake Forest Deadball Team Rebound.,23,18,1st Half,8:03,False,154,2024-12-18T00:27:44Z
401700469101919604,101919604,MadeFreeThrow,Cameron Hildreth made Free Throw.,23,19,1st Half,8:03,True,154,2024-12-18T00:27:44Z
401700469101926301,101926301,LayUpShot,AJ Smith missed Layup.,23,19,1st Half,7:36,False,256,2024-12-18T00:29:02Z
401700469101926302,101926302,Block Shot,Tre'Von Spillers Block.,23,19,1st Half,7:36,False,154,2024-12-18T00:29:02Z
401700469101926701,101926701,Defensive Rebound,Efton Reid III Defensive Rebound.,23,19,1st Half,7:32,False,154,2024-12-18T00:29:06Z
401700469101927901,101927901,PersonalFoul,Foul on Ebenezer Dowuona.,23,19,1st Half,7:20,False,256,2024-12-18T00:29:17Z
401700469101927902,101927902,OfficialTVTimeOut, Official TV Timeout,23,19,1st Half,7:20,False,,2024-12-18T00:29:17Z
401700469101927903,101927903,MadeFreeThrow,Cameron Hildreth missed Free Throw.,23,19,1st Half,7:20,False,154,2024-12-18T00:29:17Z
401700469101927904,101927904,Dead Ball Rebound,Wake Forest Deadball Team Rebound.,23,19,1st Half,7:20,False,154,2024-12-18T00:29:17Z
401700469101927905,101927905,MadeFreeThrow,Cameron Hildreth made Free Throw.,23,20,1st Half,7:20,True,154,2024-12-18T00:29:17Z
401700469101929301,101929301,LayUpShot,Justin Taylor made Layup.,25,20,1st Half,7:06,True,256,2024-12-18T00:33:37Z
401700469101935301,101935301,JumpShot,Tre'Von Spillers made ,25,22,1st Half,6:46,True,154,2024-12-18T00:33:54Z
401700469101937301,101937301,JumpShot,Elijah Hutchins-Everett missed Three Point Jumper.,25,22,1st Half,6:26,False,256,2024-12-18T00:34:15Z
401700469101937601,101937601,Defensive Rebound,Tre'Von Spillers Defensive Rebound.,25,22,1st Half,6:23,False,154,2024-12-18T00:34:17Z
401700469101939601,101939601,JumpShot,Cameron Hildreth missed Three Point Jumper.,25,22,1st Half,6:03,False,154,2024-12-18T00:34:39Z
401700469101944001,101944001,Defensive Rebound,Bryce Lindsay Defensive Rebound.,25,22,1st Half,5:59,False,256,2024-12-18T00:34:41Z
401700469101944601,101944601,JumpShot,Elijah Hutchins-Everett missed Three Point Jumper.,25,22,1st Half,5:53,False,256,2024-12-18T00:34:48Z
401700469101944801,101944801,Defensive Rebound,Cameron Hildreth Defensive Rebound.,25,22,1st Half,5:51,False,154,2024-12-18T00:34:51Z
401700469101945801,101945801,JumpShot,Parker Friedrichsen missed Three Point Jumper.,25,22,1st Half,5:41,False,154,2024-12-18T00:35:00Z
401700469101946201,101946201,Defensive Rebound,Justin Taylor Defensive Rebound.,25,22,1st Half,5:37,False,256,2024-12-18T00:35:00Z
401700469101947001,101947001,JumpShot,Xavier Brown missed Three Point Jumper.,25,22,1st Half,5:29,False,256,2024-12-18T00:35:12Z
401700469101947301,101947301,Offensive Rebound,Elijah Hutchins-Everett Offensive Rebound.,25,22,1st Half,5:26,False,256,2024-12-18T00:35:15Z
401700469101947601,101947601,LayUpShot,Elijah Hutchins-Everett missed Layup.,25,22,1st Half,5:23,False,256,2024-12-18T00:35:22Z
401700469101947901,101947901,Defensive Rebound,Efton Reid III Defensive Rebound.,25,22,1st Half,5:20,False,154,2024-12-18T00:35:22Z
401700469101948701,101948701,PersonalFoul,Foul on Davin Cosby.,25,22,1st Half,5:12,False,154,2024-12-18T00:35:28Z
401700469101948702,101948702,Lost Ball Turnover,Davin Cosby Turnover.,25,22,1st Half,5:12,False,154,2024-12-18T00:35:28Z
401700469101949901,101949901,JumpShot,Bryce Lindsay missed Jumper.,25,22,1st Half,5:00,False,256,2024-12-18T00:36:07Z
401700469101954301,101954301,Defensive Rebound,Hunter Sallis Defensive Rebound.,25,22,1st Half,4:56,False,154,2024-12-18T00:36:07Z
401700469101955801,101955801,DunkShot,Churchill Abass made Dunk. Assisted by Parker Friedrichsen.,25,24,1st Half,4:41,True,154,2024-12-18T00:36:22Z
401700469101955802,101955802,PersonalFoul,Foul on Ebenezer Dowuona.,25,24,1st Half,4:41,False,256,2024-12-18T00:36:22Z
401700469101955803,101955803,MadeFreeThrow,Churchill Abass missed Free Throw.,25,24,1st Half,4:41,False,154,2024-12-18T00:37:03Z
401700469101955804,101955804,Defensive Rebound,Elijah Hutchins-Everett Defensive Rebound.,25,24,1st Half,4:41,False,256,2024-12-18T00:37:03Z
401700469101957601,101957601,JumpShot,Elijah Hutchins-Everett made Jumper.,27,24,1st Half,4:23,True,256,2024-12-18T00:37:20Z
401700469101957602,101957602,PersonalFoul,Foul on Churchill Abass.,27,24,1st Half,4:23,False,154,2024-12-18T00:37:20Z
401700469101957603,101957603,MadeFreeThrow,Elijah Hutchins-Everett made Free Throw.,28,24,1st Half,4:23,True,256,2024-12-18T00:37:20Z
401700469101959401,101959401,LayUpShot,Hunter Sallis missed Layup.,28,24,1st Half,4:05,False,154,2024-12-18T00:38:07Z
401700469101959601,101959601,Offensive Rebound,Hunter Sallis Offensive Rebound.,28,24,1st Half,4:03,False,154,2024-12-18T00:38:11Z
401700469101964201,101964201,JumpShot,Davin Cosby made Jumper.,28,26,1st Half,3:57,True,154,2024-12-18T00:38:15Z
401700469101966201,101966201,LayUpShot,Elijah Hutchins-Everett made Layup.,30,26,1st Half,3:37,True,256,2024-12-18T00:38:37Z
401700469101968801,101968801,JumpShot,Hunter Sallis missed Three Point Jumper.,30,26,1st Half,3:11,False,154,2024-12-18T00:39:03Z
401700469101969001,101969001,Defensive Rebound,Mark Freeman Defensive Rebound.,30,26,1st Half,3:09,False,256,2024-12-18T00:39:03Z
401700469101969901,101969901,LayUpShot,Mark Freeman made Layup.,32,26,1st Half,3:00,True,256,2024-12-18T00:39:13Z
401700469101974801,101974801,PersonalFoul,Foul on Mark Freeman.,32,26,1st Half,2:51,False,256,2024-12-18T00:39:21Z
401700469101974802,101974802,OfficialTVTimeOut, Official TV Timeout,32,26,1st Half,2:51,False,,2024-12-18T00:39:21Z
401700469101976401,101976401,PersonalFoul,Foul on Ebenezer Dowuona.,32,26,1st Half,2:35,False,256,2024-12-18T00:43:04Z
401700469101976402,101976402,MadeFreeThrow,Efton Reid III missed Free Throw.,32,26,1st Half,2:35,False,154,2024-12-18T00:43:04Z
401700469101976403,101976403,Dead Ball Rebound,Wake Forest Deadball Team Rebound.,32,26,1st Half,2:35,False,154,2024-12-18T00:43:04Z
401700469101976404,101976404,MadeFreeThrow,Efton Reid III made Free Throw.,32,27,1st Half,2:35,True,154,2024-12-18T00:43:04Z
401700469101977101,101977101,Lost Ball Turnover,Justin Taylor Turnover.,32,27,1st Half,2:28,False,256,2024-12-18T00:44:08Z
401700469101979501,101979501,JumpShot,Efton Reid III missed Jumper.,32,27,1st Half,2:04,False,154,2024-12-18T00:44:41Z
401700469101979701,101979701,Defensive Rebound,Xavier Brown Defensive Rebound.,32,27,1st Half,2:02,False,256,2024-12-18T00:44:44Z
401700469101985101,101985101,LayUpShot,Justin Taylor missed Layup.,32,27,1st Half,1:48,False,256,2024-12-18T00:45:00Z
401700469101985301,101985301,Defensive Rebound,Davin Cosby Defensive Rebound.,32,27,1st Half,1:46,False,154,2024-12-18T00:45:00Z
401700469101985601,101985601,JumpShot,Hunter Sallis missed Three Point Jumper.,32,27,1st Half,1:43,False,154,2024-12-18T00:45:03Z
401700469101985901,101985901,Defensive Rebound,James Madison Defensive Rebound.,32,27,1st Half,1:40,False,256,2024-12-18T00:45:06Z
401700469101988701,101988701,Lost Ball Turnover,Xavier Brown Turnover.,32,27,1st Half,1:12,False,256,2024-12-18T00:45:45Z
401700469101994801,101994801,LayUpShot,Hunter Sallis made Layup.,32,29,1st Half,0:51,True,154,2024-12-18T00:46:21Z
401700469101996901,101996901,Lost Ball Turnover,Bryce Lindsay Turnover.,32,29,1st Half,0:30,False,256,2024-12-18T00:46:42Z
401700469101996902,101996902,Steal,Efton Reid III Steal.,32,29,1st Half,0:30,False,154,2024-12-18T00:46:42Z
401700469101999801,101999801,JumpShot,Hunter Sallis made Jumper.,32,31,1st Half,0:01,True,154,2024-12-18T00:47:07Z
401700469101999901,101999901,End Period,End of 1st half,32,31,1st Half,0:00,False,,2024-12-18T00:47:07Z
401700469102805701,102805701,PersonalFoul,Foul on Eddie Ricks III.,32,31,2nd Half,19:42,False,256,2024-12-18T01:04:00Z
401700469102805702,102805702,MadeFreeThrow,Cameron Hildreth made Free Throw.,32,32,2nd Half,19:42,True,154,2024-12-18T01:04:08Z
401700469102805703,102805703,MadeFreeThrow,Cameron Hildreth made Free Throw.,32,33,2nd Half,19:42,True,154,2024-12-18T01:04:08Z
401700469102806901,102806901,PersonalFoul,Foul on Efton Reid III.,32,33,2nd Half,19:30,False,154,2024-12-18T01:05:20Z
401700469102808501,102808501,JumpShot,Mark Freeman made Three Point Jumper.,35,33,2nd Half,19:14,True,256,2024-12-18T01:05:55Z
401700469102814201,102814201,PersonalFoul,Foul on Elijah Hutchins-Everett.,35,33,2nd Half,18:57,False,256,2024-12-18T01:06:09Z
401700469102815101,102815101,JumpShot,Efton Reid III missed Three Point Jumper.,35,33,2nd Half,18:48,False,154,2024-12-18T01:06:38Z
401700469102815301,102815301,Defensive Rebound,Elijah Hutchins-Everett Defensive Rebound.,35,33,2nd Half,18:46,False,256,2024-12-18T01:06:41Z
401700469102816201,102816201,JumpShot,Eddie Ricks III missed Three Point Jumper.,35,33,2nd Half,18:37,False,256,2024-12-18T01:06:51Z
401700469102816401,102816401,Defensive Rebound,Hunter Sallis Defensive Rebound.,35,33,2nd Half,18:35,False,154,2024-12-18T01:06:50Z
401700469102817001,102817001,JumpShot,Hunter Sallis made Jumper.,35,35,2nd Half,18:29,True,154,2024-12-18T01:06:57Z
401700469102824201,102824201,JumpShot,Elijah Hutchins-Everett missed Jumper.,35,35,2nd Half,17:57,False,256,2024-12-18T01:07:29Z
401700469102824202,102824202,Block Shot,Efton Reid III Block.,35,35,2nd Half,17:57,False,154,2024-12-18T01:07:29Z
401700469102824501,102824501,Defensive Rebound,Tre'Von Spillers Defensive Rebound.,35,35,2nd Half,17:54,False,154,2024-12-18T01:07:33Z
401700469102824701,102824701,JumpShot,Parker Friedrichsen missed Three Point Jumper.,35,35,2nd Half,17:52,False,154,2024-12-18T01:07:36Z
401700469102825001,102825001,Defensive Rebound,Eddie Ricks III Defensive Rebound.,35,35,2nd Half,17:49,False,256,2024-12-18T01:07:36Z
401700469102826201,102826201,PersonalFoul,Foul on Tre'Von Spillers.,35,35,2nd Half,17:37,False,154,2024-12-18T01:07:49Z
401700469102826202,102826202,MadeFreeThrow,Elijah Hutchins-Everett missed Free Throw.,35,35,2nd Half,17:37,False,256,2024-12-18T01:08:06Z
401700469102826203,102826203,Dead Ball Rebound,James Madison Deadball Team Rebound.,35,35,2nd Half,17:37,False,256,2024-12-18T01:08:06Z
401700469102826204,102826204,MadeFreeThrow,Elijah Hutchins-Everett made Free Throw.,36,35,2nd Half,17:37,True,256,2024-12-18T01:08:06Z
401700469102827701,102827701,JumpShot,Efton Reid III missed Three Point Jumper.,36,35,2nd Half,17:22,False,154,2024-12-18T01:09:25Z
401700469102828001,102828001,Defensive Rebound,Eddie Ricks III Defensive Rebound.,36,35,2nd Half,17:19,False,256,2024-12-18T01:09:25Z
401700469102829401,102829401,LayUpShot,Ebenezer Dowuona missed Layup.,36,35,2nd Half,17:05,False,256,2024-12-18T01:09:29Z
401700469102829402,102829402,Block Shot,Efton Reid III Block.,36,35,2nd Half,17:05,False,154,2024-12-18T01:09:29Z
401700469102829601,102829601,Defensive Rebound,Hunter Sallis Defensive Rebound.,36,35,2nd Half,17:03,False,154,2024-12-18T01:09:29Z
401700469102834501,102834501,JumpShot,Efton Reid III made Jumper. Assisted by Hunter Sallis.,36,37,2nd Half,16:54,True,154,2024-12-18T01:09:29Z
401700469102834502,102834502,PersonalFoul,Foul on Ebenezer Dowuona.,36,37,2nd Half,16:54,False,256,2024-12-18T01:09:34Z
401700469102834503,102834503,MadeFreeThrow,Efton Reid III missed Free Throw.,36,37,2nd Half,16:54,False,154,2024-12-18T01:10:15Z
401700469102834701,102834701,Offensive Rebound,Wake Forest Offensive Rebound.,36,37,2nd Half,16:52,False,154,2024-12-18T01:10:16Z
401700469102834801,102834801,JumpShot,Parker Friedrichsen missed Three Point Jumper.,36,37,2nd Half,16:51,False,154,2024-12-18T01:10:18Z
401700469102835201,102835201,Defensive Rebound,Mark Freeman Defensive Rebound.,36,37,2nd Half,16:47,False,256,2024-12-18T01:10:45Z
401700469102836401,102836401,JumpShot,Mark Freeman made Jumper.,38,37,2nd Half,16:35,True,256,2024-12-18T01:11:18Z
401700469102837701,102837701,Lost Ball Turnover,Cameron Hildreth Turnover.,38,37,2nd Half,16:22,False,154,2024-12-18T01:11:30Z
401700469102838701,102838701,LayUpShot,Elijah Hutchins-Everett missed Layup.,38,37,2nd Half,16:12,False,256,2024-12-18T01:11:52Z
401700469102838702,102838702,Block Shot,Efton Reid III Block.,38,37,2nd Half,16:12,False,154,2024-12-18T01:11:52Z
401700469102838901,102838901,Defensive Rebound,Tre'Von Spillers Defensive Rebound.,38,37,2nd Half,16:10,False,154,2024-12-18T01:11:55Z
401700469102839401,102839401,LayUpShot,Cameron Hildreth made Layup.,38,39,2nd Half,16:05,True,154,2024-12-18T01:11:59Z
401700469102839901,102839901,OfficialTVTimeOut, Official TV Timeout,38,39,2nd Half,16:00,False,,2024-12-18T01:12:05Z
401700469102845101,102845101,LayUpShot,AJ Smith missed Layup.,38,39,2nd Half,15:48,False,256,2024-12-18T01:16:10Z
401700469102845102,102845102,Block Shot,Hunter Sallis Block.,38,39,2nd Half,15:48,False,154,2024-12-18T01:16:10Z
401700469102845401,102845401,Defensive Rebound,Cameron Hildreth Defensive Rebound.,38,39,2nd Half,15:45,False,154,2024-12-18T01:16:13Z
401700469102846601,102846601,PersonalFoul,Foul on Mark Freeman.,38,39,2nd Half,15:33,False,256,2024-12-18T01:16:26Z
401700469102846602,102846602,MadeFreeThrow,Cameron Hildreth made Free Throw.,38,40,2nd Half,15:33,True,154,2024-12-18T01:16:26Z
401700469102846603,102846603,MadeFreeThrow,Cameron Hildreth made Free Throw.,38,41,2nd Half,15:33,True,154,2024-12-18T01:16:26Z
401700469102848101,102848101,JumpShot,Mark Freeman missed Jumper.,38,41,2nd Half,15:18,False,256,2024-12-18T01:17:34Z
401700469102848401,102848401,Defensive Rebound,Tre'Von Spillers Defensive Rebound.,38,41,2nd Half,15:15,False,154,2024-12-18T01:17:36Z
401700469102849101,102849101,JumpShot,Hunter Sallis made Jumper.,38,43,2nd Half,15:08,True,154,2024-12-18T01:17:41Z
401700469102849102,102849102,PersonalFoul,Foul on Justin Taylor.,38,43,2nd Half,15:08,False,256,2024-12-18T01:17:41Z
401700469102849103,102849103,MadeFreeThrow,Hunter Sallis made Free Throw.,38,44,2nd Half,15:08,True,154,2024-12-18T01:17:41Z
401700469102855701,102855701,Lost Ball Turnover,Elijah Hutchins-Everett Turnover.,38,44,2nd Half,14:42,False,256,2024-12-18T01:18:49Z
401700469102855702,102855702,Steal,Efton Reid III Steal.,38,44,2nd Half,14:42,False,154,2024-12-18T01:18:49Z
401700469102858401,102858401,Lost Ball Turnover,Cameron Hildreth Turnover.,38,44,2nd Half,14:15,False,154,2024-12-18T01:19:14Z
401700469102858402,102858402,Steal,Justin Taylor Steal.,38,44,2nd Half,14:15,False,256,2024-12-18T01:19:17Z
401700469102858601,102858601,PersonalFoul,Foul on Davin Cosby.,38,44,2nd Half,14:13,False,154,2024-12-18T01:19:17Z
401700469102859401,102859401,LayUpShot,Bryce Lindsay missed Layup.,38,44,2nd Half,14:05,False,256,2024-12-18T01:19:48Z
401700469102859402,102859402,Block Shot,Efton Reid III Block.,38,44,2nd Half,14:05,False,154,2024-12-18T01:19:48Z
401700469102859501,102859501,Offensive Rebound,James Madison Offensive Rebound.,38,44,2nd Half,14:04,False,256,2024-12-18T01:19:48Z
401700469102864701,102864701,JumpShot,Bryce Lindsay missed Three Point Jumper.,38,44,2nd Half,13:52,False,256,2024-12-18T01:20:28Z
401700469102864901,102864901,Defensive Rebound,Wake Forest Defensive Rebound.,38,44,2nd Half,13:50,False,154,2024-12-18T01:20:28Z
401700469102866201,102866201,JumpShot,Cameron Hildreth made Three Point Jumper. Assisted by Churchill Abass.,38,47,2nd Half,13:37,True,154,2024-12-18T01:21:07Z
401700469102866801,102866801,ShortTimeOut,James Madison  Timeout,38,47,2nd Half,13:31,False,256,2024-12-18T01:21:12Z
401700469102866802,102866802,OfficialTVTimeOut, Official TV Timeout,38,47,2nd Half,13:31,False,,2024-12-18T01:21:12Z
401700469102868901,102868901,LayUpShot,Xavier Brown missed Layup.,38,47,2nd Half,13:10,False,256,2024-12-18T01:25:19Z
