play_id,sequence_number,type,description,away_score,home_score,period,clock,scoring_play,team_id,timestamp_utc
401721207101997301,101997301,LayUpShot,DK Thorn missed Layup.,21,48,1st Half,0:26,False,292,2024-11-11T01:09:42Z
401721207101997601,101997601,Defensive Rebound,Damian Bohlman Defensive Rebound.,21,48,1st Half,0:23,False,3134,2024-11-11T01:09:42Z
401721207101998401,101998401,JumpShot,EJ Anderson missed Jumper.,21,48,1st Half,0:15,False,3134,2024-11-11T01:09:42Z
401721207101998701,101998701,Defensive Rebound,Tommy Gankhuyag Defensive Rebound.,21,48,1st Half,0:12,False,292,2024-11-11T01:09:42Z
401721207101999901,101999901,JumpShot,K.T. Raimey missed Three Point Jumper.,21,48,1st Half,0:00,False,292,2024-11-11T01:09:42Z
401721207101999902,101999902,Defensive Rebound,Champion Christian Defensive Rebound.,21,48,1st Half,0:00,False,3134,2024-11-11T01:09:42Z
401721207101999903,101999903,End Period,End of 1st half,21,48,1st Half,0:00,False,,2024-11-11T01:09:42Z
401721207102805501,102805501,JumpShot,KJ Younge made Three Point Jumper.,24,48,2nd Half,19:44,True,3134,2024-11-11T01:55:31Z
401721207102807901,102807901,JumpShot,Trey Miller made Jumper.,24,50,2nd Half,19:20,True,292,2024-11-11T01:55:31Z
401721207102809601,102809601,JumpShot,EJ Anderson missed Jumper.,24,50,2nd Half,19:03,False,3134,2024-11-11T01:55:31Z
401721207102809801,102809801,Defensive Rebound,Hasan Abdul Hakim Defensive Rebound.,24,50,2nd Half,19:01,False,292,2024-11-11T01:55:31Z
401721207102815101,102815101,JumpShot,Cliff Davis missed Three Point Jumper.,24,50,2nd Half,18:48,False,292,2024-11-11T01:55:31Z
401721207102815601,102815601,Defensive Rebound,Chad Milne Defensive Rebound.,24,50,2nd Half,18:43,False,3134,2024-11-11T01:55:31Z
401721207102816501,102816501,JumpShot,Damian Bohlman made Three Point Jumper. Assisted by EJ Anderson.,27,50,2nd Half,18:34,True,3134,2024-11-11T01:55:31Z
401721207102816901,102816901,ShortTimeOut,UT Rio Grande Valley  Timeout,27,50,2nd Half,18:30,False,292,2024-11-11T01:55:31Z
401721207102816902,102816902,OfficialTVTimeOut, Official TV Timeout,27,50,2nd Half,18:30,False,,2024-11-11T01:55:31Z
401721207102818401,102818401,JumpShot,Tommy Gankhuyag made Jumper.,27,52,2nd Half,18:15,True,292,2024-11-11T01:55:31Z
401721207102819801,102819801,LayUpShot,Joshua Walpole missed Layup.,27,52,2nd Half,18:01,False,3134,2024-11-11T01:55:31Z
401721207102824101,102824101,Defensive Rebound,Hasan Abdul Hakim Defensive Rebound.,27,52,2nd Half,17:58,False,292,2024-11-11T01:55:31Z
401721207102824501,102824501,PersonalFoul,Foul on Hasan Abdul Hakim.,27,52,2nd Half,17:54,False,292,2024-11-11T01:55:31Z
401721207102824502,102824502,Lost Ball Turnover,Hasan Abdul Hakim Turnover.,27,52,2nd Half,17:54,False,292,2024-11-11T01:55:31Z
401721207102827001,102827001,JumpShot,KJ Younge missed Three Point Jumper.,27,52,2nd Half,17:29,False,3134,2024-11-11T01:55:31Z
401721207102827301,102827301,Defensive Rebound,Tommy Gankhuyag Defensive Rebound.,27,52,2nd Half,17:26,False,292,2024-11-11T01:55:31Z
401721207102829101,102829101,JumpShot,Tommy Gankhuyag missed Three Point Jumper.,27,52,2nd Half,17:08,False,292,2024-11-11T01:55:31Z
401721207102829501,102829501,Offensive Rebound,Cliff Davis Offensive Rebound.,27,52,2nd Half,17:04,False,292,2024-11-11T01:36:40Z
401721207102834001,102834001,LayUpShot,Tommy Gankhuyag made Layup. Assisted by Jaylen Washington.,27,54,2nd Half,16:59,True,292,2024-11-11T01:55:31Z
401721207102834701,102834701,PersonalFoul,Foul on DK Thorn.,27,54,2nd Half,16:52,False,292,2024-11-11T01:37:27Z
401721207102834702,102834702,MadeFreeThrow,KJ Younge missed Free Throw.,27,54,2nd Half,16:52,False,3134,2024-11-11T01:37:27Z
401721207102834703,102834703,Offensive Rebound,Champion Christian Offensive Rebound.,27,54,2nd Half,16:52,False,3134,2024-11-11T01:37:27Z
401721207102834704,102834704,MadeFreeThrow,KJ Younge made Free Throw.,28,54,2nd Half,16:52,True,3134,2024-11-11T01:37:27Z
401721207102836701,102836701,Lost Ball Turnover,Tommy Gankhuyag Turnover.,28,54,2nd Half,16:32,False,292,2024-11-11T01:55:31Z
401721207102836702,102836702,Steal,Chad Milne Steal.,28,54,2nd Half,16:32,False,3134,2024-11-11T01:55:31Z
401721207102837101,102837101,JumpShot,Joshua Walpole made Jumper. Assisted by Damian Bohlman.,30,54,2nd Half,16:28,True,3134,2024-11-11T01:55:31Z
401721207102837901,102837901,JumpShot,K.T. Raimey missed Three Point Jumper.,30,54,2nd Half,16:20,False,292,2024-11-11T01:55:31Z
401721207102838301,102838301,Defensive Rebound,Champion Christian Defensive Rebound.,30,54,2nd Half,16:16,False,3134,2024-11-11T01:55:31Z
401721207102839201,102839201,PersonalFoul,Foul on EJ Anderson.,30,54,2nd Half,16:07,False,3134,2024-11-11T01:39:10Z
401721207102839202,102839202,Lost Ball Turnover,EJ Anderson Turnover.,30,54,2nd Half,16:07,False,3134,2024-11-11T01:39:10Z
401721207102844001,102844001,JumpShot,Jaylen Washington made Jumper.,30,56,2nd Half,15:59,True,292,2024-11-11T01:55:31Z
401721207102844601,102844601,Lost Ball Turnover,KJ Younge Turnover.,30,56,2nd Half,15:53,False,3134,2024-11-11T01:55:31Z
401721207102844602,102844602,Steal,Cliff Davis Steal.,30,56,2nd Half,15:53,False,292,2024-11-11T01:55:31Z
401721207102846501,102846501,JumpShot,Howie Fleming Jr. made Three Point Jumper. Assisted by Cliff Davis.,30,59,2nd Half,15:34,True,292,2024-11-11T01:55:31Z
401721207102848201,102848201,JumpShot,KJ Younge made Three Point Jumper. Assisted by EJ Anderson.,33,59,2nd Half,15:17,True,3134,2024-11-11T01:55:31Z
401721207102849301,102849301,JumpShot,Cliff Davis made Three Point Jumper. Assisted by Howie Fleming Jr..,33,62,2nd Half,15:06,True,292,2024-11-11T01:55:31Z
401721207102855101,102855101,JumpShot,EJ Anderson missed Three Point Jumper.,33,62,2nd Half,14:48,False,3134,2024-11-11T01:55:31Z
401721207102855301,102855301,Defensive Rebound,Howie Fleming Jr. Defensive Rebound.,33,62,2nd Half,14:46,False,292,2024-11-11T01:55:31Z
401721207102855901,102855901,JumpShot,Cliff Davis missed Three Point Jumper.,33,62,2nd Half,14:40,False,292,2024-11-11T01:55:31Z
401721207102856201,102856201,Defensive Rebound,Chad Milne Defensive Rebound.,33,62,2nd Half,14:37,False,3134,2024-11-11T01:55:31Z
401721207102858301,102858301,LayUpShot,Chad Milne made Layup. Assisted by Damian Bohlman.,35,62,2nd Half,14:16,True,3134,2024-11-11T01:55:31Z
401721207102859001,102859001,JumpShot,K.T. Raimey made Three Point Jumper. Assisted by Howie Fleming Jr..,35,65,2nd Half,14:09,True,292,2024-11-11T01:55:31Z
401721207102859801,102859801,OfficialTVTimeOut, Official TV Timeout,35,65,2nd Half,14:01,False,,2024-11-11T01:41:37Z
401721207102864501,102864501,JumpShot,Christian Blair missed Jumper.,35,65,2nd Half,13:54,False,3134,2024-11-11T01:55:31Z
401721207102864502,102864502,Block Shot,Marshal Destremau Block.,35,65,2nd Half,13:54,False,292,2024-11-11T01:55:31Z
401721207102864801,102864801,Defensive Rebound,K.T. Raimey Defensive Rebound.,35,65,2nd Half,13:51,False,292,2024-11-11T01:55:31Z
401721207102865201,102865201,JumpShot,K.T. Raimey made Three Point Jumper. Assisted by Howie Fleming Jr..,35,68,2nd Half,13:47,True,292,2024-11-11T01:55:31Z
401721207102866801,102866801,JumpShot,Adrian Brown missed Three Point Jumper.,35,68,2nd Half,13:31,False,3134,2024-11-11T01:55:31Z
401721207102867001,102867001,Defensive Rebound,Marshal Destremau Defensive Rebound.,35,68,2nd Half,13:29,False,292,2024-11-11T01:55:31Z
401721207102867601,102867601,JumpShot,Jaylen Washington made Jumper.,35,70,2nd Half,13:23,True,292,2024-11-11T01:55:31Z
401721207102868201,102868201,LayUpShot,Trevor Vertiz missed Layup.,35,70,2nd Half,13:17,False,3134,2024-11-11T01:55:31Z
401721207102868401,102868401,Defensive Rebound,Marshal Destremau Defensive Rebound.,35,70,2nd Half,13:15,False,292,2024-11-11T01:55:31Z
401721207102868901,102868901,JumpShot,K.T. Raimey missed Three Point Jumper.,35,70,2nd Half,13:10,False,292,2024-11-11T01:55:31Z
401721207102869201,102869201,Defensive Rebound,Adrian Brown Defensive Rebound.,35,70,2nd Half,13:07,False,3134,2024-11-11T01:55:31Z
401721207102869601,102869601,Lost Ball Turnover,KJ Younge Turnover.,35,70,2nd Half,13:03,False,3134,2024-11-11T01:45:11Z
401721207102875001,102875001,JumpShot,Marshal Destremau made Jumper. Assisted by Howie Fleming Jr..,35,72,2nd Half,12:49,True,292,2024-11-11T01:55:31Z
401721207102876701,102876701,PersonalFoul,Foul on Trey Miller.,35,72,2nd Half,12:32,False,292,2024-11-11T01:46:02Z
401721207102877301,102877301,JumpShot,KJ Younge missed Jumper.,35,72,2nd Half,12:26,False,3134,2024-11-11T01:55:31Z
401721207102877501,102877501,Defensive Rebound,Marshal Destremau Defensive Rebound.,35,72,2nd Half,12:24,False,292,2024-11-11T01:55:31Z
401721207102877601,102877601,PersonalFoul,Foul on Adrian Brown.,35,72,2nd Half,12:23,False,3134,2024-11-11T01:55:31Z
401721207102879101,102879101,JumpShot,Trey Miller missed Jumper.,35,72,2nd Half,12:08,False,292,2024-11-11T01:55:31Z
401721207102879301,102879301,Defensive Rebound,Christian Blair Defensive Rebound.,35,72,2nd Half,12:06,False,3134,2024-11-11T01:55:31Z
401721207102879901,102879901,JumpShot,Adrian Brown missed Three Point Jumper.,35,72,2nd Half,12:00,False,3134,2024-11-11T01:55:31Z
401721207102884201,102884201,Defensive Rebound,Trey Miller Defensive Rebound.,35,72,2nd Half,11:57,False,292,2024-11-11T01:55:31Z
401721207102884401,102884401,JumpShot,K.T. Raimey made Three Point Jumper. Assisted by Trey Miller.,35,75,2nd Half,11:55,True,292,2024-11-11T01:55:31Z
401721207102887001,102887001,JumpShot,Chad Milne missed Jumper.,35,75,2nd Half,11:29,False,3134,2024-11-11T01:55:31Z
401721207102887201,102887201,Defensive Rebound,Jaylen Washington Defensive Rebound.,35,75,2nd Half,11:27,False,292,2024-11-11T01:55:31Z
401721207102887601,102887601,JumpShot,Marshal Destremau missed Three Point Jumper.,35,75,2nd Half,11:23,False,292,2024-11-11T01:55:31Z
401721207102888001,102888001,Defensive Rebound,KJ Younge Defensive Rebound.,35,75,2nd Half,11:19,False,3134,2024-11-11T01:55:31Z
401721207102889201,102889201,JumpShot,Christian Blair missed Jumper.,35,75,2nd Half,11:07,False,3134,2024-11-11T01:55:31Z
401721207102889501,102889501,Defensive Rebound,Marshal Destremau Defensive Rebound.,35,75,2nd Half,11:04,False,292,2024-11-11T01:55:31Z
401721207102895201,102895201,JumpShot,K.T. Raimey made Three Point Jumper. Assisted by Jaylen Washington.,35,78,2nd Half,10:47,True,292,2024-11-11T01:55:31Z
401721207102896201,102896201,JumpShot,KJ Younge missed Three Point Jumper.,35,78,2nd Half,10:37,False,3134,2024-11-11T01:55:31Z
401721207102896501,102896501,Offensive Rebound,Chad Milne Offensive Rebound.,35,78,2nd Half,10:34,False,3134,2024-11-11T01:55:31Z
401721207102897001,102897001,JumpShot,Adrian Brown missed Three Point Jumper.,35,78,2nd Half,10:29,False,3134,2024-11-11T01:55:31Z
401721207102897201,102897201,Defensive Rebound,Howie Fleming Jr. Defensive Rebound.,35,78,2nd Half,10:27,False,292,2024-11-11T01:55:31Z
401721207102898201,102898201,JumpShot,Howie Fleming Jr. made Jumper. Assisted by K.T. Raimey.,35,80,2nd Half,10:17,True,292,2024-11-11T01:55:31Z
401721207102898501,102898501,ShortTimeOut,Champion Christian  Timeout,35,80,2nd Half,10:14,False,3134,2024-11-11T01:51:32Z
401721207102898502,102898502,OfficialTVTimeOut, Official TV Timeout,35,80,2nd Half,10:14,False,,2024-11-11T01:51:32Z
401721207102899701,102899701,DunkShot,Christian Blair missed Dunk.,35,80,2nd Half,10:02,False,3134,2024-11-11T01:55:31Z
401721207102904001,102904001,Defensive Rebound,RJ Nance Defensive Rebound.,35,80,2nd Half,9:59,False,292,2024-11-11T01:55:31Z
401721207102904301,102904301,LayUpShot,RJ Nance made Layup.,35,82,2nd Half,9:56,True,292,2024-11-11T01:55:31Z
401721207102904501,102904501,PersonalFoul,Foul on RJ Nance.,35,82,2nd Half,9:54,False,292,2024-11-11T01:55:31Z
401721207102904502,102904502,MadeFreeThrow,KJ Younge made Free Throw.,36,82,2nd Half,9:54,True,3134,2024-11-11T01:55:31Z
401721207102904503,102904503,MadeFreeThrow,KJ Younge made Free Throw.,37,82,2nd Half,9:54,True,3134,2024-11-11T01:55:31Z
401721207102906401,102906401,JumpShot,KJ Younge made Three Point Jumper. Assisted by Trevor Vertiz.,40,82,2nd Half,9:35,True,3134,2024-11-11T01:55:31Z
401721207102908101,102908101,JumpShot,RJ Nance made Jumper. Assisted by K.T. Raimey.,40,84,2nd Half,9:18,True,292,2024-11-11T01:55:31Z
401721207102909401,102909401,JumpShot,Christian Blair made Jumper.,42,84,2nd Half,9:05,True,3134,2024-11-11T01:55:31Z
401721207102915801,102915801,JumpShot,RJ Nance made Three Point Jumper. Assisted by Kwo Agwa.,42,87,2nd Half,8:41,True,292,2024-11-11T01:55:31Z
401721207102916701,102916701,JumpShot,KJ Younge missed Three Point Jumper.,42,87,2nd Half,8:32,False,3134,2024-11-11T01:55:31Z
401721207102917001,102917001,Defensive Rebound,UT Rio Grande Valley Defensive Rebound.,42,87,2nd Half,8:29,False,292,2024-11-11T01:55:31Z
401721207102918001,102918001,JumpShot,RJ Nance made Three Point Jumper. Assisted by Kwo Agwa.,42,90,2nd Half,8:19,True,292,2024-11-11T01:55:31Z
401721207102919401,102919401,Lost Ball Turnover,Adrian Brown Turnover.,42,90,2nd Half,8:05,False,3134,2024-11-11T01:54:51Z
401721207102924801,102924801,LayUpShot,Kwo Agwa made Layup. Assisted by K.T. Raimey.,42,92,2nd Half,7:51,True,292,2024-11-11T01:55:31Z
401721207102926201,102926201,JumpShot,Christian Blair made Jumper.,44,92,2nd Half,7:37,True,3134,2024-11-11T01:55:31Z
401721207102927101,102927101,DunkShot,Trey Miller made Dunk.,44,94,2nd Half,7:28,True,292,2024-11-11T01:55:31Z
401721207102928301,102928301,PersonalFoul,Foul on Kwo Agwa.,44,94,2nd Half,7:16,False,292,2024-11-11T01:55:31Z
401721207102928302,102928302,OfficialTVTimeOut, Official TV Timeout,44,94,2nd Half,7:16,False,,2024-11-11T01:55:31Z
401721207102928303,102928303,MadeFreeThrow,Adrian Brown made Free Throw.,45,94,2nd Half,7:16,True,3134,2024-11-11T01:56:23Z
401721207102928304,102928304,MadeFreeThrow,Adrian Brown made Free Throw.,46,94,2nd Half,7:16,True,3134,2024-11-11T01:56:23Z
401721207102929601,102929601,JumpShot,Kwo Agwa made Three Point Jumper. Assisted by Trey Miller.,46,97,2nd Half,7:03,True,292,2024-11-11T02:02:03Z
401721207102935201,102935201,JumpShot,Adrian Brown made Three Point Jumper.,49,97,2nd Half,6:47,True,3134,2024-11-11T02:02:03Z
401721207102936801,102936801,JumpShot,Justin Mitchell missed Three Point Jumper.,49,97,2nd Half,6:31,False,292,2024-11-11T02:02:03Z
401721207102937201,102937201,Defensive Rebound,Chad Milne Defensive Rebound.,49,97,2nd Half,6:27,False,3134,2024-11-11T02:02:03Z
401721207102938301,102938301,JumpShot,KJ Younge missed Three Point Jumper.,49,97,2nd Half,6:16,False,3134,2024-11-11T02:02:03Z
401721207102938501,102938501,Defensive Rebound,Fadi Mougharbel Defensive Rebound.,49,97,2nd Half,6:14,False,292,2024-11-11T02:02:03Z
401721207102944001,102944001,JumpShot,Trey Miller made Three Point Jumper. Assisted by Fadi Mougharbel.,49,100,2nd Half,5:59,True,292,2024-11-11T02:02:03Z
401721207102945601,102945601,JumpShot,Trevor Vertiz missed Three Point Jumper.,49,100,2nd Half,5:43,False,3134,2024-11-11T02:02:03Z
401721207102945801,102945801,Defensive Rebound,Kwo Agwa Defensive Rebound.,49,100,2nd Half,5:41,False,292,2024-11-11T02:02:03Z
401721207102946301,102946301,JumpShot,RJ Nance missed Three Point Jumper.,49,100,2nd Half,5:36,False,292,2024-11-11T02:02:03Z
401721207102946601,102946601,Defensive Rebound,Christian Blair Defensive Rebound.,49,100,2nd Half,5:33,False,3134,2024-11-11T02:02:03Z
401721207102948001,102948001,LayUpShot,Chad Milne made Layup.,51,100,2nd Half,5:19,True,3134,2024-11-11T02:02:03Z
401721207102948801,102948801,JumpShot,Justin Mitchell missed Jumper.,51,100,2nd Half,5:11,False,292,2024-11-11T02:02:03Z
401721207102948802,102948802,Block Shot,Chad Milne Block.,51,100,2nd Half,5:11,False,3134,2024-11-11T02:02:03Z
401721207102949101,102949101,Defensive Rebound,Chad Milne Defensive Rebound.,51,100,2nd Half,5:08,False,3134,2024-11-11T02:02:03Z
401721207102949501,102949501,JumpShot,Trevor Vertiz made Jumper. Assisted by Adrian Brown.,53,100,2nd Half,5:04,True,3134,2024-11-11T02:02:03Z
401721207102954901,102954901,ShortTimeOut,UT Rio Grande Valley  Timeout,53,100,2nd Half,4:50,False,292,2024-11-11T02:02:03Z
401721207102956701,102956701,JumpShot,RJ Nance missed Three Point Jumper.,53,100,2nd Half,4:32,False,292,2024-11-11T02:02:03Z
401721207102957001,102957001,Offensive Rebound,Kwo Agwa Offensive Rebound.,53,100,2nd Half,4:29,False,292,2024-11-11T02:02:03Z
401721207102957101,102957101,LayUpShot,Kwo Agwa made Layup.,53,102,2nd Half,4:28,True,292,2024-11-11T02:02:03Z
401721207102958801,102958801,JumpShot,Christian Blair made Jumper.,55,102,2nd Half,4:11,True,3134,2024-11-11T02:02:03Z
401721207102965201,102965201,JumpShot,RJ Nance missed Three Point Jumper.,55,102,2nd Half,3:47,False,292,2024-11-11T02:04:00Z
401721207102965501,102965501,Offensive Rebound,Justin Mitchell Offensive Rebound.,55,102,2nd Half,3:44,False,292,2024-11-11T02:04:00Z
401721207102965701,102965701,JumpShot,RJ Nance made Jumper. Assisted by Justin Mitchell.,55,104,2nd Half,3:42,True,292,2024-11-11T02:04:00Z
401721207102966901,102966901,JumpShot,Christian Blair made Jumper. Assisted by Damian Bohlman.,57,104,2nd Half,3:30,True,3134,2024-11-11T02:04:00Z
401721207102968401,102968401,JumpShot,Kwo Agwa made Jumper. Assisted by Jaylen Washington.,57,106,2nd Half,3:15,True,292,2024-11-11T02:04:00Z
401721207102969601,102969601,PersonalFoul,Foul on Fadi Mougharbel.,57,106,2nd Half,3:03,False,292,2024-11-11T02:04:00Z
401721207102969602,102969602,OfficialTVTimeOut, Official TV Timeout,57,106,2nd Half,3:03,False,,2024-11-11T02:04:00Z
401721207102969603,102969603,MadeFreeThrow,Christian Blair missed Free Throw.,57,106,2nd Half,3:03,False,3134,2024-11-11T02:04:00Z
401721207102969604,102969604,Offensive Rebound,Champion Christian Offensive Rebound.,57,106,2nd Half,3:03,False,3134,2024-11-11T02:04:00Z
401721207102969605,102969605,MadeFreeThrow,Christian Blair missed Free Throw.,57,106,2nd Half,3:03,False,3134,2024-11-11T02:04:00Z
401721207102969801,102969801,Defensive Rebound,Jaylen Washington Defensive Rebound.,57,106,2nd Half,3:01,False,292,2024-11-11T02:08:07Z
401721207102976001,102976001,JumpShot,Justin Mitchell missed Jumper.,57,106,2nd Half,2:39,False,292,2024-11-11T02:08:07Z
401721207102976301,102976301,Offensive Rebound,RJ Nance Offensive Rebound.,57,106,2nd Half,2:36,False,292,2024-11-11T02:08:07Z
401721207102976302,102976302,LayUpShot,RJ Nance missed Layup.,57,106,2nd Half,2:36,False,292,2024-11-11T02:08:07Z
401721207102976501,102976501,Offensive Rebound,RJ Nance Offensive Rebound.,57,106,2nd Half,2:34,False,292,2024-11-11T02:08:07Z
401721207102976601,102976601,Lost Ball Turnover,RJ Nance Turnover.,57,106,2nd Half,2:33,False,292,2024-11-11T02:07:24Z
401721207102976602,102976602,Steal,EJ Anderson Steal.,57,106,2nd Half,2:33,False,3134,2024-11-11T02:07:24Z
401721207102977201,102977201,PersonalFoul,Foul on RJ Nance.,57,106,2nd Half,2:27,False,292,2024-11-11T02:08:07Z
401721207102977202,102977202,MadeFreeThrow,EJ Anderson made Free Throw.,58,106,2nd Half,2:27,True,3134,2024-11-11T02:08:07Z
401721207102977203,102977203,MadeFreeThrow,EJ Anderson missed Free Throw.,58,106,2nd Half,2:27,False,3134,2024-11-11T02:08:07Z
401721207102977301,102977301,Defensive Rebound,Fadi Mougharbel Defensive Rebound.,58,106,2nd Half,2:26,False,292,2024-11-11T02:08:07Z
401721207102977801,102977801,Lost Ball Turnover,Jaylen Washington Turnover.,58,106,2nd Half,2:21,False,292,2024-11-11T02:08:07Z
401721207102979101,102979101,Lost Ball Turnover,EJ Anderson Turnover.,58,106,2nd Half,2:08,False,3134,2024-11-11T02:10:04Z
401721207102979102,102979102,Steal,Justin Mitchell Steal.,58,106,2nd Half,2:08,False,292,2024-11-11T02:10:04Z
401721207102979501,102979501,LayUpShot,EJ Avelar made Layup. Assisted by Justin Mitchell.,58,108,2nd Half,2:04,True,292,2024-11-11T02:10:04Z
401721207102984601,102984601,Lost Ball Turnover,EJ Anderson Turnover.,58,108,2nd Half,1:53,False,3134,2024-11-11T02:10:04Z
401721207102984602,102984602,Steal,Jaylen Washington Steal.,58,108,2nd Half,1:53,False,292,2024-11-11T02:10:04Z
401721207102985001,102985001,JumpShot,Jaylen Washington missed Jumper.,58,108,2nd Half,1:49,False,292,2024-11-11T02:10:04Z
401721207102985002,102985002,Block Shot,Damian Bohlman Block.,58,108,2nd Half,1:49,False,3134,2024-11-11T02:10:04Z
401721207102985401,102985401,Defensive Rebound,Damian Bohlman Defensive Rebound.,58,108,2nd Half,1:45,False,3134,2024-11-11T02:10:04Z
401721207102985601,102985601,JumpShot,Christian Blair missed Three Point Jumper.,58,108,2nd Half,1:43,False,3134,2024-11-11T02:10:04Z
401721207102985901,102985901,Defensive Rebound,RJ Nance Defensive Rebound.,58,108,2nd Half,1:40,False,292,2024-11-11T02:10:04Z
401721207102986601,102986601,LayUpShot,EJ Avelar missed Layup.,58,108,2nd Half,1:33,False,292,2024-11-11T02:09:26Z
401721207102986602,102986602,Block Shot,Damian Bohlman Block.,58,108,2nd Half,1:33,False,3134,2024-11-11T02:09:26Z
401721207102986603,102986603,Offensive Rebound,UT Rio Grande Valley Offensive Rebound.,58,108,2nd Half,1:33,False,292,2024-11-11T02:09:26Z
401721207102988601,102988601,JumpShot,Jaylen Washington missed Three Point Jumper.,58,108,2nd Half,1:13,False,292,2024-11-11T02:10:04Z
401721207102989001,102989001,Defensive Rebound,EJ Anderson Defensive Rebound.,58,108,2nd Half,1:09,False,3134,2024-11-11T02:10:04Z
401721207102989601,102989601,LayUpShot,EJ Anderson made Layup.,60,108,2nd Half,1:03,True,3134,2024-11-11T02:10:04Z
401721207102995601,102995601,JumpShot,Fadi Mougharbel missed Jumper.,60,108,2nd Half,0:43,False,292,2024-11-11T02:11:15Z
401721207102995801,102995801,Defensive Rebound,Damian Bohlman Defensive Rebound.,60,108,2nd Half,0:41,False,3134,2024-11-11T02:11:15Z
401721207102996001,102996001,Lost Ball Turnover,Damian Bohlman Turnover.,60,108,2nd Half,0:39,False,3134,2024-11-11T02:11:15Z
401721207102996002,102996002,Steal,Justin Mitchell Steal.,60,108,2nd Half,0:39,False,292,2024-11-11T02:11:15Z
401721207102996601,102996601,JumpShot,Justin Mitchell made Jumper.,60,110,2nd Half,0:33,True,292,2024-11-11T02:11:15Z
401721207102998201,102998201,JumpShot,Christian Blair missed Jumper.,60,110,2nd Half,0:17,False,3134,2024-11-11T02:11:15Z
401721207102998501,102998501,Defensive Rebound,Fadi Mougharbel Defensive Rebound.,60,110,2nd Half,0:14,False,292,2024-11-11T02:11:15Z
401721207102999901,102999901,End Game,End of Game,60,110,2nd Half,0:00,False,,2024-11-11T02:11:15Z
