play_id,sequence_number,type,description,away_score,home_score,period,clock,scoring_play,team_id,timestamp_utc
401715655102838101,102838101,Offensive Rebound,Bostyn Holt Offensive Rebound.,38,45,2nd Half,16:18,False,52,2024-11-22T23:17:18Z
401715655102838102,102838102,JumpShot,Bostyn Holt missed Jumper.,38,45,2nd Half,16:18,False,52,2024-11-22T23:17:18Z
401715655102838301,102838301,Offensive Rebound,Malique Ewin Offensive Rebound.,38,45,2nd Half,16:16,False,52,2024-11-22T23:17:18Z
401715655102838302,102838302,JumpShot,Malique Ewin made Jumper.,38,47,2nd Half,16:16,True,52,2024-11-22T23:17:18Z
401715655102844101,102844101,PersonalFoul,Foul on Malique Ewin.,38,47,2nd Half,15:58,False,52,2024-11-22T23:17:39Z
401715655102844102,102844102,OfficialTVTimeOut, Official TV Timeout,38,47,2nd Half,15:58,False,,2024-11-22T23:17:39Z
401715655102845601,102845601,JumpShot,Shane Dezonie missed Three Point Jumper.,38,47,2nd Half,15:43,False,218,2024-11-22T23:21:17Z
401715655102845801,102845801,Defensive Rebound,Bostyn Holt Defensive Rebound.,38,47,2nd Half,15:41,False,52,2024-11-22T23:21:17Z
401715655102846901,102846901,LayUpShot,Malique Ewin made Layup.,38,49,2nd Half,15:30,True,52,2024-11-22T23:21:29Z
401715655102848501,102848501,LayUpShot,Jamal Mashburn Jr. made Layup.,40,49,2nd Half,15:14,True,218,2024-11-22T23:21:45Z
401715655102848502,102848502,PersonalFoul,Foul on Bostyn Holt.,40,49,2nd Half,15:14,False,52,2024-11-22T23:21:45Z
401715655102848503,102848503,MadeFreeThrow,Jamal Mashburn Jr. missed Free Throw.,40,49,2nd Half,15:14,False,218,2024-11-22T23:21:59Z
401715655102848601,102848601,Defensive Rebound,Taylor Bol Bowen Defensive Rebound.,40,49,2nd Half,15:13,False,52,2024-11-22T23:22:19Z
401715655102854801,102854801,JumpShot,Chandler Jackson made Jumper. Assisted by Jamir Watkins.,40,51,2nd Half,14:51,True,52,2024-11-22T23:22:42Z
401715655102856701,102856701,PersonalFoul,Foul on Malique Ewin.,40,51,2nd Half,14:32,False,52,2024-11-22T23:23:01Z
401715655102856702,102856702,Technical Foul,Technical Foul on Malique Ewin.,40,51,2nd Half,14:32,False,52,2024-11-22T23:23:01Z
401715655102856703,102856703,MadeFreeThrow,Jamal Mashburn Jr. missed Free Throw.,40,51,2nd Half,14:32,False,218,2024-11-22T23:23:01Z
401715655102856704,102856704,Offensive Rebound,Temple Offensive Rebound.,40,51,2nd Half,14:32,False,218,2024-11-22T23:23:01Z
401715655102856705,102856705,MadeFreeThrow,Jamal Mashburn Jr. missed Free Throw.,40,51,2nd Half,14:32,False,218,2024-11-22T23:23:01Z
401715655102856706,102856706,Offensive Rebound,Temple Offensive Rebound.,40,51,2nd Half,14:32,False,218,2024-11-22T23:23:01Z
401715655102856707,102856707,MadeFreeThrow,Zion Stanford made Free Throw.,41,51,2nd Half,14:32,True,218,2024-11-22T23:23:01Z
401715655102856708,102856708,MadeFreeThrow,Zion Stanford made Free Throw.,42,51,2nd Half,14:32,True,218,2024-11-22T23:23:01Z
401715655102858101,102858101,JumpShot,Taylor Bol Bowen made Three Point Jumper. Assisted by Daquan Davis.,42,54,2nd Half,14:18,True,52,2024-11-22T23:24:56Z
401715655102864001,102864001,JumpShot,Steve Settle III missed Jumper.,42,54,2nd Half,13:59,False,218,2024-11-22T23:25:16Z
401715655102864002,102864002,Block Shot,Taylor Bol Bowen Block.,42,54,2nd Half,13:59,False,52,2024-11-22T23:25:19Z
401715655102864401,102864401,Defensive Rebound,Daquan Davis Defensive Rebound.,42,54,2nd Half,13:55,False,52,2024-11-22T23:25:19Z
401715655102864601,102864601,LayUpShot,Alier Maluk missed Layup.,42,54,2nd Half,13:53,False,52,2024-11-22T23:25:19Z
401715655102864602,102864602,Offensive Rebound,Daquan Davis Offensive Rebound.,42,54,2nd Half,13:53,False,52,2024-11-22T23:25:19Z
401715655102864603,102864603,PersonalFoul,Foul on Shane Dezonie.,42,54,2nd Half,13:53,False,218,2024-11-22T23:25:19Z
401715655102864604,102864604,MadeFreeThrow,Daquan Davis missed Free Throw.,42,54,2nd Half,13:53,False,52,2024-11-22T23:25:19Z
401715655102864605,102864605,Offensive Rebound,Florida State Offensive Rebound.,42,54,2nd Half,13:53,False,52,2024-11-22T23:25:19Z
401715655102864606,102864606,MadeFreeThrow,Daquan Davis made Free Throw.,42,55,2nd Half,13:53,True,52,2024-11-22T23:25:19Z
401715655102866201,102866201,Lost Ball Turnover,Quante Berry Turnover.,42,55,2nd Half,13:37,False,218,2024-11-22T23:26:34Z
401715655102866202,102866202,Steal,Taylor Bol Bowen Steal.,42,55,2nd Half,13:37,False,52,2024-11-22T23:26:34Z
401715655102866701,102866701,JumpShot,Daquan Davis missed Jumper.,42,55,2nd Half,13:32,False,52,2024-11-22T23:26:37Z
401715655102867001,102867001,Offensive Rebound,Daquan Davis Offensive Rebound.,42,55,2nd Half,13:29,False,52,2024-11-22T23:26:40Z
401715655102868701,102868701,JumpShot,Daquan Davis missed Jumper.,42,55,2nd Half,13:12,False,52,2024-11-22T23:26:59Z
401715655102869001,102869001,Defensive Rebound,Zion Stanford Defensive Rebound.,42,55,2nd Half,13:09,False,218,2024-11-22T23:27:03Z
401715655102874001,102874001,LayUpShot,Zion Stanford missed Layup.,42,55,2nd Half,12:59,False,218,2024-11-22T23:27:11Z
401715655102874002,102874002,Block Shot,Taylor Bol Bowen Block.,42,55,2nd Half,12:59,False,52,2024-11-22T23:27:14Z
401715655102874301,102874301,Defensive Rebound,Taylor Bol Bowen Defensive Rebound.,42,55,2nd Half,12:56,False,52,2024-11-22T23:27:14Z
401715655102874601,102874601,LayUpShot,Jamir Watkins made Layup. Assisted by Taylor Bol Bowen.,42,57,2nd Half,12:53,True,52,2024-11-22T23:27:18Z
401715655102876501,102876501,JumpShot,Jameel Brown made Three Point Jumper. Assisted by Quante Berry.,45,57,2nd Half,12:34,True,218,2024-11-22T23:27:37Z
401715655102876801,102876801,ShortTimeOut,Temple  Timeout,45,57,2nd Half,12:31,False,218,2024-11-22T23:27:37Z
401715655102876802,102876802,OfficialTVTimeOut, Official TV Timeout,45,57,2nd Half,12:31,False,,2024-11-22T23:27:37Z
401715655102878401,102878401,LayUpShot,Daquan Davis made Layup.,45,59,2nd Half,12:15,True,52,2024-11-22T23:30:47Z
401715655102884001,102884001,PersonalFoul,Foul on Elijah Gray.,45,59,2nd Half,11:59,False,218,2024-11-22T23:31:02Z
401715655102884002,102884002,Lost Ball Turnover,Elijah Gray Turnover.,45,59,2nd Half,11:59,False,218,2024-11-22T23:31:02Z
401715655102884003,102884003,OfficialTVTimeOut, Official TV Timeout,45,59,2nd Half,11:59,False,,2024-11-22T23:31:02Z
401715655102885901,102885901,JumpShot,Jerry Deng missed Three Point Jumper.,45,59,2nd Half,11:40,False,52,2024-11-22T23:34:10Z
401715655102886001,102886001,Offensive Rebound,Florida State Offensive Rebound.,45,59,2nd Half,11:39,False,52,2024-11-22T23:34:10Z
401715655102886005,102886005,PersonalFoul,Foul on Jameel Brown.,45,59,2nd Half,11:39,False,218,2024-11-22T23:34:10Z
401715655102886006,102886006,MadeFreeThrow,Alier Maluk missed Free Throw.,45,59,2nd Half,11:39,False,52,2024-11-22T23:34:10Z
401715655102886101,102886101,Defensive Rebound,Babatunde Durodola Defensive Rebound.,45,59,2nd Half,11:38,False,218,2024-11-22T23:34:52Z
401715655102887701,102887701,JumpShot,Steve Settle III missed Three Point Jumper.,45,59,2nd Half,11:22,False,218,2024-11-22T23:35:11Z
401715655102888101,102888101,Offensive Rebound,Babatunde Durodola Offensive Rebound.,45,59,2nd Half,11:18,False,218,2024-11-22T23:35:14Z
401715655102888301,102888301,JumpShot,Jameel Brown missed Three Point Jumper.,45,59,2nd Half,11:16,False,218,2024-11-22T23:35:16Z
401715655102888501,102888501,Defensive Rebound,Jerry Deng Defensive Rebound.,45,59,2nd Half,11:14,False,52,2024-11-22T23:35:16Z
401715655102889201,102889201,Lost Ball Turnover,Daquan Davis Turnover.,45,59,2nd Half,11:07,False,52,2024-11-22T23:35:24Z
401715655102889202,102889202,Steal,Jameel Brown Steal.,45,59,2nd Half,11:07,False,218,2024-11-22T23:35:24Z
401715655102889501,102889501,LayUpShot,Jameel Brown made Layup.,47,59,2nd Half,11:04,True,218,2024-11-22T23:35:27Z
401715655102895001,102895001,Lost Ball Turnover,Jerry Deng Turnover.,47,59,2nd Half,10:49,False,52,2024-11-22T23:35:42Z
401715655102895002,102895002,Steal,Steve Settle III Steal.,47,59,2nd Half,10:49,False,218,2024-11-22T23:35:42Z
401715655102895301,102895301,DunkShot,Steve Settle III made Dunk.,49,59,2nd Half,10:46,True,218,2024-11-22T23:35:45Z
401715655102897501,102897501,JumpShot,Daquan Davis missed Three Point Jumper.,49,59,2nd Half,10:24,False,52,2024-11-22T23:36:08Z
401715655102897801,102897801,Defensive Rebound,Jameel Brown Defensive Rebound.,49,59,2nd Half,10:21,False,218,2024-11-22T23:36:08Z
401715655102898501,102898501,LayUpShot,Shane Dezonie missed Layup.,49,59,2nd Half,10:14,False,218,2024-11-22T23:36:17Z
401715655102898502,102898502,Offensive Rebound,Temple Offensive Rebound.,49,59,2nd Half,10:14,False,218,2024-11-22T23:36:17Z
401715655102898503,102898503,ShortTimeOut,Florida State  Timeout,49,59,2nd Half,10:14,False,52,2024-11-22T23:36:17Z
401715655102904101,102904101,JumpShot,Jamal Mashburn Jr. missed Three Point Jumper.,49,59,2nd Half,9:58,False,218,2024-11-22T23:38:14Z
401715655102904301,102904301,Defensive Rebound,Florida State Defensive Rebound.,49,59,2nd Half,9:56,False,52,2024-11-22T23:38:14Z
401715655102906501,102906501,JumpShot,Taylor Bol Bowen missed Three Point Jumper.,49,59,2nd Half,9:34,False,52,2024-11-22T23:39:39Z
401715655102906901,102906901,Defensive Rebound,Jameel Brown Defensive Rebound.,49,59,2nd Half,9:30,False,218,2024-11-22T23:39:42Z
401715655102907301,102907301,LayUpShot,Shane Dezonie missed Layup.,49,59,2nd Half,9:26,False,218,2024-11-22T23:39:45Z
401715655102907302,102907302,Block Shot,Jamir Watkins Block.,49,59,2nd Half,9:26,False,52,2024-11-22T23:39:45Z
401715655102907401,102907401,Offensive Rebound,Temple Offensive Rebound.,49,59,2nd Half,9:25,False,218,2024-11-22T23:39:45Z
401715655102907901,102907901,LayUpShot,Babatunde Durodola made Layup.,51,59,2nd Half,9:20,True,218,2024-11-22T23:40:05Z
401715655102914801,102914801,JumpShot,Jamir Watkins missed Three Point Jumper.,51,59,2nd Half,8:51,False,52,2024-11-22T23:40:35Z
401715655102915101,102915101,Defensive Rebound,Babatunde Durodola Defensive Rebound.,51,59,2nd Half,8:48,False,218,2024-11-22T23:40:38Z
401715655102917301,102917301,JumpShot,Steve Settle III made Jumper.,53,59,2nd Half,8:26,True,218,2024-11-22T23:41:05Z
401715655102918501,102918501,PersonalFoul,Foul on Babatunde Durodola.,53,59,2nd Half,8:14,False,218,2024-11-22T23:41:12Z
401715655102918502,102918502,MadeFreeThrow,Jamir Watkins made Free Throw.,53,60,2nd Half,8:14,True,52,2024-11-22T23:41:12Z
401715655102918503,102918503,MadeFreeThrow,Jamir Watkins made Free Throw.,53,61,2nd Half,8:14,True,52,2024-11-22T23:41:12Z
401715655102924501,102924501,PersonalFoul,Foul on Jamir Watkins.,53,61,2nd Half,7:54,False,52,2024-11-22T23:42:33Z
401715655102924502,102924502,OfficialTVTimeOut, Official TV Timeout,53,61,2nd Half,7:54,False,,2024-11-22T23:42:33Z
401715655102924503,102924503,MadeFreeThrow,Jamal Mashburn Jr. made Free Throw.,54,61,2nd Half,7:54,True,218,2024-11-22T23:45:37Z
401715655102924504,102924504,MadeFreeThrow,Jamal Mashburn Jr. made Free Throw.,55,61,2nd Half,7:54,True,218,2024-11-22T23:45:37Z
401715655102926001,102926001,JumpShot,Taylor Bol Bowen made Jumper. Assisted by Jamir Watkins.,55,63,2nd Half,7:39,True,52,2024-11-22T23:46:09Z
401715655102928101,102928101,JumpShot,Shane Dezonie missed Three Point Jumper.,55,63,2nd Half,7:18,False,218,2024-11-22T23:46:30Z
401715655102928102,102928102,Defensive Rebound,Florida State Defensive Rebound.,55,63,2nd Half,7:18,False,52,2024-11-22T23:46:30Z
401715655102934201,102934201,DunkShot,Malique Ewin missed Dunk.,55,63,2nd Half,6:57,False,52,2024-11-22T23:48:07Z
401715655102934501,102934501,Offensive Rebound,Bostyn Holt Offensive Rebound.,55,63,2nd Half,6:54,False,52,2024-11-22T23:48:10Z
401715655102934801,102934801,Lost Ball Turnover,Malique Ewin Turnover.,55,63,2nd Half,6:51,False,52,2024-11-22T23:48:15Z
401715655102934802,102934802,Steal,Steve Settle III Steal.,55,63,2nd Half,6:51,False,218,2024-11-22T23:48:15Z
401715655102935901,102935901,JumpShot,Jamal Mashburn Jr. missed Jumper.,55,63,2nd Half,6:40,False,218,2024-11-22T23:48:25Z
401715655102936201,102936201,Defensive Rebound,Taylor Bol Bowen Defensive Rebound.,55,63,2nd Half,6:37,False,52,2024-11-22T23:48:30Z
401715655102936701,102936701,PersonalFoul,Foul on Zion Stanford.,55,63,2nd Half,6:32,False,218,2024-11-22T23:48:33Z
401715655102936702,102936702,MadeFreeThrow,Jamir Watkins made Free Throw.,55,64,2nd Half,6:32,True,52,2024-11-22T23:48:33Z
401715655102936703,102936703,MadeFreeThrow,Jamir Watkins made Free Throw.,55,65,2nd Half,6:32,True,52,2024-11-22T23:48:33Z
401715655102938401,102938401,PersonalFoul,Foul on Steve Settle III.,55,65,2nd Half,6:15,False,218,2024-11-22T23:50:16Z
401715655102938402,102938402,Lost Ball Turnover,Steve Settle III Turnover.,55,65,2nd Half,6:15,False,218,2024-11-22T23:50:16Z
401715655102939301,102939301,LayUpShot,Jamir Watkins missed Layup.,55,65,2nd Half,6:06,False,52,2024-11-22T23:50:50Z
401715655102939501,102939501,Offensive Rebound,Malique Ewin Offensive Rebound.,55,65,2nd Half,6:04,False,52,2024-11-22T23:50:50Z
401715655102944401,102944401,JumpShot,Chandler Jackson made Jumper.,55,67,2nd Half,5:55,True,52,2024-11-22T23:51:02Z
401715655102946401,102946401,PersonalFoul,Foul on Bostyn Holt.,55,67,2nd Half,5:35,False,52,2024-11-22T23:51:20Z
401715655102946402,102946402,MadeFreeThrow,Elijah Gray made Free Throw.,56,67,2nd Half,5:35,True,218,2024-11-22T23:51:20Z
401715655102946403,102946403,MadeFreeThrow,Elijah Gray missed Free Throw.,56,67,2nd Half,5:35,False,218,2024-11-22T23:51:20Z
401715655102946501,102946501,Defensive Rebound,Malique Ewin Defensive Rebound.,56,67,2nd Half,5:34,False,52,2024-11-22T23:52:25Z
401715655102947301,102947301,JumpShot,Chandler Jackson missed Three Point Jumper.,56,67,2nd Half,5:26,False,52,2024-11-22T23:52:35Z
401715655102947601,102947601,Defensive Rebound,Jameel Brown Defensive Rebound.,56,67,2nd Half,5:23,False,218,2024-11-22T23:52:38Z
401715655102949001,102949001,PersonalFoul,Foul on Jamir Watkins.,56,67,2nd Half,5:09,False,52,2024-11-22T23:53:18Z
401715655102949002,102949002,MadeFreeThrow,Zion Stanford made Free Throw.,57,67,2nd Half,5:09,True,218,2024-11-22T23:53:18Z
401715655102949003,102949003,MadeFreeThrow,Zion Stanford made Free Throw.,58,67,2nd Half,5:09,True,218,2024-11-22T23:53:18Z
401715655102954101,102954101,DunkShot,Malique Ewin made Dunk. Assisted by Taylor Bol Bowen.,58,69,2nd Half,4:58,True,52,2024-11-22T23:54:26Z
401715655102957101,102957101,LayUpShot,Babatunde Durodola missed Layup.,58,69,2nd Half,4:28,False,218,2024-11-22T23:54:56Z
401715655102957201,102957201,Offensive Rebound,Temple Offensive Rebound.,58,69,2nd Half,4:27,False,218,2024-11-22T23:54:56Z
401715655102958301,102958301,JumpShot,Zion Stanford missed Jumper.,58,69,2nd Half,4:16,False,218,2024-11-22T23:55:27Z
401715655102958701,102958701,Offensive Rebound,Babatunde Durodola Offensive Rebound.,58,69,2nd Half,4:12,False,218,2024-11-22T23:55:31Z
401715655102958801,102958801,LayUpShot,Babatunde Durodola made Layup.,60,69,2nd Half,4:11,True,218,2024-11-22T23:55:31Z
401715655102965501,102965501,JumpShot,Daquan Davis missed Jumper.,60,69,2nd Half,3:44,False,52,2024-11-22T23:55:58Z
401715655102966301,102966301,Offensive Rebound,Chandler Jackson Offensive Rebound.,60,69,2nd Half,3:36,False,52,2024-11-22T23:56:05Z
401715655102966302,102966302,JumpShot,Chandler Jackson made Jumper.,60,71,2nd Half,3:36,True,52,2024-11-22T23:56:05Z
401715655102966801,102966801,JumpShot,Zion Stanford missed Three Point Jumper.,60,71,2nd Half,3:31,False,218,2024-11-22T23:56:11Z
401715655102967101,102967101,Defensive Rebound,Malique Ewin Defensive Rebound.,60,71,2nd Half,3:28,False,52,2024-11-22T23:56:15Z
401715655102967401,102967401,Lost Ball Turnover,Malique Ewin Turnover.,60,71,2nd Half,3:25,False,52,2024-11-22T23:56:15Z
401715655102967402,102967402,OfficialTVTimeOut, Official TV Timeout,60,71,2nd Half,3:25,False,,2024-11-22T23:56:15Z
401715655102969301,102969301,JumpShot,Jamal Mashburn Jr. missed Jumper.,60,71,2nd Half,3:06,False,218,2024-11-22T23:59:48Z
401715655102969701,102969701,Offensive Rebound,Steve Settle III Offensive Rebound.,60,71,2nd Half,3:02,False,218,2024-11-22T23:59:51Z
401715655102969702,102969702,PersonalFoul,Foul on Taylor Bol Bowen.,60,71,2nd Half,3:02,False,52,2024-11-22T23:59:51Z
401715655102969703,102969703,MadeFreeThrow,Steve Settle III missed Free Throw.,60,71,2nd Half,3:02,False,218,2024-11-22T23:59:51Z
401715655102969704,102969704,Offensive Rebound,Temple Offensive Rebound.,60,71,2nd Half,3:02,False,218,2024-11-22T23:59:51Z
401715655102969705,102969705,MadeFreeThrow,Steve Settle III made Free Throw.,61,71,2nd Half,3:02,True,218,2024-11-23T00:00:34Z
401715655102974801,102974801,DunkShot,Malique Ewin made Dunk.,61,73,2nd Half,2:51,True,52,2024-11-23T00:00:53Z
401715655102976301,102976301,LayUpShot,Jamal Mashburn Jr. made Layup.,63,73,2nd Half,2:36,True,218,2024-11-23T00:01:06Z
401715655102976302,102976302,PersonalFoul,Foul on Justin Thomas.,63,73,2nd Half,2:36,False,52,2024-11-23T00:01:06Z
401715655102976303,102976303,MadeFreeThrow,Jamal Mashburn Jr. made Free Throw.,64,73,2nd Half,2:36,True,218,2024-11-23T00:01:06Z
401715655102979101,102979101,JumpShot,Malique Ewin missed Jumper.,64,73,2nd Half,2:08,False,52,2024-11-23T00:02:34Z
401715655102979601,102979601,Defensive Rebound,Shane Dezonie Defensive Rebound.,64,73,2nd Half,2:03,False,218,2024-11-23T00:02:37Z
401715655102979701,102979701,Lost Ball Turnover,Shane Dezonie Turnover.,64,73,2nd Half,2:02,False,218,2024-11-23T00:02:47Z
401715655102979702,102979702,Steal,Daquan Davis Steal.,64,73,2nd Half,2:02,False,52,2024-11-23T00:02:47Z
401715655102986401,102986401,JumpShot,Daquan Davis missed Jumper.,64,73,2nd Half,1:35,False,52,2024-11-23T00:03:20Z
401715655102986901,102986901,Defensive Rebound,Steve Settle III Defensive Rebound.,64,73,2nd Half,1:30,False,218,2024-11-23T00:03:27Z
401715655102987401,102987401,DunkShot,Steve Settle III made Dunk. Assisted by Zion Stanford.,66,73,2nd Half,1:25,True,218,2024-11-23T00:03:30Z
401715655102987402,102987402,ShortTimeOut,Temple  Timeout,66,73,2nd Half,1:25,False,218,2024-11-23T00:03:30Z
401715655102987601,102987601,Lost Ball Turnover,Taylor Bol Bowen Turnover.,66,73,2nd Half,1:23,False,52,2024-11-23T00:05:04Z
401715655102987602,102987602,Steal,Shane Dezonie Steal.,66,73,2nd Half,1:23,False,218,2024-11-23T00:05:04Z
401715655102987901,102987901,Lost Ball Turnover,Zion Stanford Turnover.,66,73,2nd Half,1:20,False,218,2024-11-23T00:05:04Z
401715655102988901,102988901,PersonalFoul,Foul on Justin Thomas.,66,73,2nd Half,1:10,False,52,2024-11-23T00:05:28Z
401715655102988902,102988902,Lost Ball Turnover,Justin Thomas Turnover.,66,73,2nd Half,1:10,False,52,2024-11-23T00:05:28Z
401715655102994101,102994101,JumpShot,Jameel Brown missed Three Point Jumper.,66,73,2nd Half,0:58,False,218,2024-11-23T00:06:43Z
401715655102994401,102994401,Defensive Rebound,Jamir Watkins Defensive Rebound.,66,73,2nd Half,0:55,False,52,2024-11-23T00:06:43Z
401715655102994402,102994402,PersonalFoul,Foul on Zion Stanford.,66,73,2nd Half,0:55,False,218,2024-11-23T00:06:43Z
401715655102994403,102994403,MadeFreeThrow,Jamir Watkins made Free Throw.,66,74,2nd Half,0:55,True,52,2024-11-23T00:07:24Z
401715655102994404,102994404,MadeFreeThrow,Jamir Watkins made Free Throw.,66,75,2nd Half,0:55,True,52,2024-11-23T00:07:24Z
401715655102996101,102996101,Lost Ball Turnover,Shane Dezonie Turnover.,66,75,2nd Half,0:38,False,218,2024-11-23T00:08:11Z
401715655102996102,102996102,Steal,Chandler Jackson Steal.,66,75,2nd Half,0:38,False,52,2024-11-23T00:08:11Z
401715655102996901,102996901,PersonalFoul,Foul on Steve Settle III.,66,75,2nd Half,0:30,False,218,2024-11-23T00:08:23Z
401715655102996902,102996902,MadeFreeThrow,Taylor Bol Bowen made Free Throw.,66,76,2nd Half,0:30,True,52,2024-11-23T00:08:23Z
401715655102996903,102996903,MadeFreeThrow,Taylor Bol Bowen made Free Throw.,66,77,2nd Half,0:30,True,52,2024-11-23T00:08:23Z
401715655102997801,102997801,JumpShot,Jamal Mashburn Jr. made Three Point Jumper.,69,77,2nd Half,0:21,True,218,2024-11-23T00:09:35Z
401715655102997901,102997901,RegularTimeOut,Temple  Timeout,69,77,2nd Half,0:20,False,218,2024-11-23T00:09:35Z
401715655102998101,102998101,PersonalFoul,Foul on Shane Dezonie.,69,77,2nd Half,0:18,False,218,2024-11-23T00:11:34Z
401715655102998102,102998102,MadeFreeThrow,Jamir Watkins missed Free Throw.,69,77,2nd Half,0:18,False,52,2024-11-23T00:12:10Z
401715655102998103,102998103,Offensive Rebound,Florida State Offensive Rebound.,69,77,2nd Half,0:18,False,52,2024-11-23T00:12:10Z
401715655102998104,102998104,MadeFreeThrow,Jamir Watkins made Free Throw.,69,78,2nd Half,0:18,True,52,2024-11-23T00:12:10Z
401715655102999101,102999101,JumpShot,Shane Dezonie missed Three Point Jumper.,69,78,2nd Half,0:08,False,218,2024-11-23T00:12:45Z
401715655102999401,102999401,Defensive Rebound,Jamir Watkins Defensive Rebound.,69,78,2nd Half,0:05,False,52,2024-11-23T00:12:45Z
401715655102999901,102999901,End Period,End of 2nd half,69,78,2nd Half,0:00,False,,2024-11-23T00:12:45Z
401715655102999902,102999902,End Game,End of Game,69,78,2nd Half,0:00,False,,2024-11-23T00:12:45Z
