play_id,sequence_number,type,description,away_score,home_score,period,clock,scoring_play,team_id,timestamp_utc
401706176102909802,102909802,Lost Ball Turnover,Travis Roberts Turnover.,45,44,2nd Half,9:01,False,2368,2024-12-07T01:27:06Z
401706176102915301,102915301,JumpShot,Xavier Lipscomb missed Three Point Jumper.,45,44,2nd Half,8:46,False,116,2024-12-07T01:27:43Z
401706176102915601,102915601,Offensive Rebound,Terrell Ard Jr. Offensive Rebound.,45,44,2nd Half,8:43,False,116,2024-12-07T01:27:46Z
401706176102915602,102915602,Lost Ball Turnover,Terrell Ard Jr. Turnover.,45,44,2nd Half,8:43,False,116,2024-12-07T01:27:46Z
401706176102917501,102917501,LayUpShot,Elijah Lewis missed Layup.,45,44,2nd Half,8:24,False,2368,2024-12-07T01:28:34Z
401706176102917701,102917701,PersonalFoul,Foul on Javon Ervin.,45,44,2nd Half,8:22,False,116,2024-12-07T01:29:11Z
401706176102917801,102917801,Offensive Rebound,Elijah Lewis Offensive Rebound.,45,44,2nd Half,8:21,False,2368,2024-12-07T01:28:34Z
401706176102918401,102918401,LayUpShot,Jackson Price missed Layup.,45,44,2nd Half,8:15,False,2368,2024-12-07T01:29:11Z
401706176102919001,102919001,Defensive Rebound,Terrell Ard Jr. Defensive Rebound.,45,44,2nd Half,8:09,False,116,2024-12-07T01:29:18Z
401706176102924301,102924301,Lost Ball Turnover,Terrell Ard Jr. Turnover.,45,44,2nd Half,7:56,False,116,2024-12-07T01:29:30Z
401706176102924302,102924302,Steal,Jackson Price Steal.,45,44,2nd Half,7:56,False,2368,2024-12-07T01:29:30Z
401706176102924801,102924801,Lost Ball Turnover,Jadin Collins-Roberts Turnover.,45,44,2nd Half,7:51,False,2368,2024-12-07T01:29:36Z
401706176102924802,102924802,Steal,Xavier Lipscomb Steal.,45,44,2nd Half,7:51,False,116,2024-12-07T01:29:40Z
401706176102925401,102925401,LayUpShot,Terrell Ard Jr. missed Layup.,45,44,2nd Half,7:45,False,116,2024-12-07T01:29:40Z
401706176102925601,102925601,Defensive Rebound,Elijah Lewis Defensive Rebound.,45,44,2nd Half,7:43,False,2368,2024-12-07T01:29:43Z
401706176102927401,102927401,JumpShot,Caleb Mackrey missed Three Point Jumper.,45,44,2nd Half,7:25,False,2368,2024-12-07T01:30:00Z
401706176102927701,102927701,Defensive Rebound,Jedy Cordilia Defensive Rebound.,45,44,2nd Half,7:22,False,116,2024-12-07T01:30:04Z
401706176102934301,102934301,LayUpShot,Javon Ervin missed Layup.,45,44,2nd Half,6:56,False,116,2024-12-07T01:30:33Z
401706176102934302,102934302,Block Shot,Jackson Price Block.,45,44,2nd Half,6:56,False,2368,2024-12-07T01:30:33Z
401706176102934701,102934701,Defensive Rebound,Caleb Mackrey Defensive Rebound.,45,44,2nd Half,6:52,False,2368,2024-12-07T01:30:33Z
401706176102935201,102935201,LayUpShot,Jadin Collins-Roberts made Layup.,45,46,2nd Half,6:47,True,2368,2024-12-07T01:30:42Z
401706176102938101,102938101,Lost Ball Turnover,Carmelo Pacheco Turnover.,45,46,2nd Half,6:18,False,116,2024-12-07T01:31:09Z
401706176102938102,102938102,Steal,Josh Pascarelli Steal.,45,46,2nd Half,6:18,False,2368,2024-12-07T01:31:09Z
401706176102938701,102938701,LayUpShot,Josh Pascarelli missed Layup.,45,46,2nd Half,6:12,False,2368,2024-12-07T01:31:15Z
401706176102938901,102938901,Offensive Rebound,Elijah Lewis Offensive Rebound.,45,46,2nd Half,6:10,False,2368,2024-12-07T01:31:15Z
401706176102944801,102944801,JumpShot,Jadin Collins-Roberts missed Three Point Jumper.,45,46,2nd Half,5:51,False,2368,2024-12-07T01:31:35Z
401706176102944802,102944802,Dead Ball Rebound,Marist Deadball Team Rebound.,45,46,2nd Half,5:51,False,2368,2024-12-07T01:31:35Z
401706176102944803,102944803,Lost Ball Turnover,Marist  Turnover.,45,46,2nd Half,5:51,False,2368,2024-12-07T01:31:35Z
401706176102944901,102944901,OfficialTVTimeOut, Official TV Timeout,45,46,2nd Half,5:50,False,,2024-12-07T01:31:42Z
401706176102946001,102946001,LayUpShot,Terrell Ard Jr. made Layup. Assisted by Dallas Hobbs.,47,46,2nd Half,5:39,True,116,2024-12-07T01:34:33Z
401706176102949501,102949501,JumpShot,Josh Pascarelli missed Three Point Jumper.,47,46,2nd Half,5:04,False,2368,2024-12-07T01:35:13Z
401706176102949502,102949502,Defensive Rebound,Dola Adebayo Defensive Rebound.,47,46,2nd Half,5:04,False,116,2024-12-07T01:35:13Z
401706176102956201,102956201,JumpShot,Dallas Hobbs made Jumper.,49,46,2nd Half,4:37,True,116,2024-12-07T01:36:03Z
401706176102957501,102957501,LayUpShot,Elijah Lewis made Layup.,49,48,2nd Half,4:24,True,2368,2024-12-07T01:36:15Z
401706176102958701,102958701,JumpShot,Dallas Hobbs missed Jumper.,49,48,2nd Half,4:12,False,116,2024-12-07T01:36:29Z
401706176102959201,102959201,Defensive Rebound,Elijah Lewis Defensive Rebound.,49,48,2nd Half,4:07,False,2368,2024-12-07T01:36:29Z
401706176102959501,102959501,JumpShot,Josh Pascarelli missed Three Point Jumper.,49,48,2nd Half,4:04,False,2368,2024-12-07T01:36:35Z
401706176102959901,102959901,Offensive Rebound,Jackson Price Offensive Rebound.,49,48,2nd Half,4:00,False,2368,2024-12-07T01:36:37Z
401706176102964701,102964701,LayUpShot,Jackson Price made Layup.,49,50,2nd Half,3:52,True,2368,2024-12-07T01:36:55Z
401706176102964702,102964702,PersonalFoul,Foul on Dola Adebayo.,49,50,2nd Half,3:52,False,116,2024-12-07T01:36:55Z
401706176102964703,102964703,OfficialTVTimeOut, Official TV Timeout,49,50,2nd Half,3:52,False,,2024-12-07T01:36:55Z
401706176102964704,102964704,MadeFreeThrow,Jackson Price made Free Throw.,49,51,2nd Half,3:52,True,2368,2024-12-07T01:36:55Z
401706176102967701,102967701,JumpShot,Terrell Ard Jr. missed Jumper.,49,51,2nd Half,3:22,False,116,2024-12-07T01:41:03Z
401706176102968301,102968301,Defensive Rebound,Jaden Daughtry Defensive Rebound.,49,51,2nd Half,3:16,False,2368,2024-12-07T01:41:03Z
401706176102974301,102974301,JumpShot,Josh Pascarelli missed Jumper.,49,51,2nd Half,2:56,False,2368,2024-12-07T01:41:24Z
401706176102974501,102974501,Defensive Rebound,Terrell Ard Jr. Defensive Rebound.,49,51,2nd Half,2:54,False,116,2024-12-07T01:41:28Z
401706176102975301,102975301,JumpShot,Dallas Hobbs missed Jumper.,49,51,2nd Half,2:46,False,116,2024-12-07T01:41:34Z
401706176102975302,102975302,Offensive Rebound,Terrell Ard Jr. Offensive Rebound.,49,51,2nd Half,2:46,False,116,2024-12-07T01:41:34Z
401706176102975401,102975401,PersonalFoul,Foul on Jackson Price.,49,51,2nd Half,2:45,False,2368,2024-12-07T01:41:40Z
401706176102977101,102977101,LayUpShot,Terrell Ard Jr. missed Layup.,49,51,2nd Half,2:28,False,116,2024-12-07T01:42:25Z
401706176102977102,102977102,Offensive Rebound,Jedy Cordilia Offensive Rebound.,49,51,2nd Half,2:28,False,116,2024-12-07T01:42:25Z
401706176102977103,102977103,PersonalFoul,Foul on Jackson Price.,49,51,2nd Half,2:28,False,2368,2024-12-07T01:42:25Z
401706176102979001,102979001,JumpShot,Xavier Lipscomb missed Jumper.,49,51,2nd Half,2:09,False,116,2024-12-07T01:43:16Z
401706176102979301,102979301,Defensive Rebound,Jaden Daughtry Defensive Rebound.,49,51,2nd Half,2:06,False,2368,2024-12-07T01:43:16Z
401706176102985101,102985101,JumpShot,Josh Pascarelli missed Three Point Jumper.,49,51,2nd Half,1:48,False,2368,2024-12-07T01:43:36Z
401706176102985401,102985401,Defensive Rebound,Jedy Cordilia Defensive Rebound.,49,51,2nd Half,1:45,False,116,2024-12-07T01:43:36Z
401706176102987401,102987401,Lost Ball Turnover,Xavier Lipscomb Turnover.,49,51,2nd Half,1:25,False,116,2024-12-07T01:43:57Z
401706176102987402,102987402,Steal,Jaden Daughtry Steal.,49,51,2nd Half,1:25,False,2368,2024-12-07T01:43:57Z
401706176102988201,102988201,Lost Ball Turnover,Jaden Daughtry Turnover.,49,51,2nd Half,1:17,False,2368,2024-12-07T01:44:03Z
401706176102988202,102988202,RegularTimeOut,Marist  Timeout,49,51,2nd Half,1:17,False,2368,2024-12-07T01:44:03Z
401706176102995001,102995001,JumpShot,Dallas Hobbs missed Three Point Jumper.,49,51,2nd Half,0:49,False,116,2024-12-07T01:47:07Z
401706176102995101,102995101,Defensive Rebound,Jaden Daughtry Defensive Rebound.,49,51,2nd Half,0:48,False,2368,2024-12-07T01:47:21Z
401706176102996201,102996201,DunkShot,Jaden Daughtry made Dunk. Assisted by Jackson Price.,49,53,2nd Half,0:37,True,2368,2024-12-07T01:47:47Z
401706176102997401,102997401,PersonalFoul,Foul on Jaden Daughtry.,49,53,2nd Half,0:25,False,2368,2024-12-07T01:49:05Z
401706176102997402,102997402,MadeFreeThrow,Dallas Hobbs missed Free Throw.,49,53,2nd Half,0:25,False,116,2024-12-07T01:49:05Z
401706176102997403,102997403,Dead Ball Rebound,Mount St. Mary's Deadball Team Rebound.,49,53,2nd Half,0:25,False,116,2024-12-07T01:49:05Z
401706176102997404,102997404,MadeFreeThrow,Dallas Hobbs made Free Throw.,50,53,2nd Half,0:25,True,116,2024-12-07T01:49:05Z
401706176102998301,102998301,Lost Ball Turnover,Jackson Price Turnover.,50,53,2nd Half,0:16,False,2368,2024-12-07T01:50:28Z
401706176102998302,102998302,Steal,Terrell Ard Jr. Steal.,50,53,2nd Half,0:16,False,116,2024-12-07T01:50:28Z
401706176102998901,102998901,RegularTimeOut,Mount St. Mary's  Timeout,50,53,2nd Half,0:10,False,116,2024-12-07T01:51:14Z
401706176102999701,102999701,JumpShot,Dallas Hobbs missed Three Point Jumper.,50,53,2nd Half,0:02,False,116,2024-12-07T01:52:48Z
401706176102999903,102999903,JumpShot,Terrell Ard Jr. missed Three Point Jumper.,50,53,2nd Half,0:00,False,116,2024-12-07T01:52:48Z
401706176102999904,102999904,Offensive Rebound,Terrell Ard Jr. Offensive Rebound.,50,53,2nd Half,0:00,False,116,2024-12-07T01:52:48Z
401706176102999905,102999905,Dead Ball Rebound,Marist Deadball Team Rebound.,50,53,2nd Half,0:00,False,2368,2024-12-07T01:52:48Z
401706176102999902,102999902,End Period,End of 2nd half,50,53,2nd Half,0:00,False,,2024-12-07T01:52:48Z
401706176102999906,102999906,End Game,End of Game,50,53,2nd Half,0:00,False,,2024-12-07T01:52:48Z
