play_id,sequence_number,type,description,away_score,home_score,period,clock,scoring_play,team_id,timestamp_utc
401727152101805901,101805901,JumpShot,Alex Crawford missed Three Point Jumper.,0,0,1st Half,19:40,False,278,2025-02-01T21:05:48Z
401727152101806301,101806301,Defensive Rebound,Tyson Degenhart Defensive Rebound.,0,0,1st Half,19:36,False,68,2025-02-01T21:05:48Z
401727152101808901,101808901,JumpShot,Alvaro Cardenas missed Three Point Jumper.,0,0,1st Half,19:10,False,68,2025-02-01T21:06:14Z
401727152101809501,101809501,Defensive Rebound,Mor Seck Defensive Rebound.,0,0,1st Half,19:04,False,278,2025-02-01T21:06:21Z
401727152101809502,101809502,PersonalFoul,Foul on RJ Keene II.,0,0,1st Half,19:04,False,68,2025-02-01T21:06:21Z
401727152101815301,101815301,JumpShot,Zaon Collins made Three Point Jumper. Assisted by Alex Crawford.,3,0,1st Half,18:46,True,278,2025-02-01T21:06:52Z
401727152101818101,101818101,JumpShot,Tyson Degenhart missed Three Point Jumper.,3,0,1st Half,18:18,False,68,2025-02-01T21:07:37Z
401727152101818501,101818501,Offensive Rebound,RJ Keene II Offensive Rebound.,3,0,1st Half,18:14,False,68,2025-02-01T21:07:40Z
401727152101819601,101819601,JumpShot,Andrew Meadow missed Three Point Jumper.,3,0,1st Half,18:03,False,68,2025-02-01T21:07:51Z
401727152101824101,101824101,Dead Ball Rebound,Fresno State Deadball Team Rebound.,3,0,1st Half,17:58,False,278,2025-02-01T21:07:58Z
401727152101824102,101824102,PersonalFoul,Foul on Andrew Meadow.,3,0,1st Half,17:58,False,68,2025-02-01T21:07:58Z
401727152101825701,101825701,JumpShot,Elijah Price missed Jumper.,3,0,1st Half,17:42,False,278,2025-02-01T21:08:30Z
401727152101826001,101826001,Defensive Rebound,RJ Keene II Defensive Rebound.,3,0,1st Half,17:39,False,68,2025-02-01T21:08:30Z
401727152101826401,101826401,LayUpShot,Andrew Meadow made Layup. Assisted by RJ Keene II.,3,2,1st Half,17:35,True,68,2025-02-01T21:08:34Z
401727152101827901,101827901,LayUpShot,Jalen Weaver missed Layup.,3,2,1st Half,17:20,False,278,2025-02-01T21:08:50Z
401727152101828301,101828301,Defensive Rebound,Emmanuel Ugbo Defensive Rebound.,3,2,1st Half,17:16,False,68,2025-02-01T21:08:53Z
401727152101835101,101835101,JumpShot,Javan Buchanan made Three Point Jumper. Assisted by Alvaro Cardenas.,3,5,1st Half,16:48,True,68,2025-02-01T21:10:06Z
401727152101836801,101836801,JumpShot,Elijah Price made Jumper.,5,5,1st Half,16:31,True,278,2025-02-01T21:10:22Z
401727152101838201,101838201,Lost Ball Turnover,Alvaro Cardenas Turnover.,5,5,1st Half,16:17,False,68,2025-02-01T21:10:36Z
401727152101838202,101838202,Steal,Jalen Weaver Steal.,5,5,1st Half,16:17,False,278,2025-02-01T21:14:34Z
401727152101838801,101838801,LayUpShot,Jalen Weaver made Layup.,7,5,1st Half,16:11,True,278,2025-02-01T21:10:41Z
401727152101844201,101844201,LayUpShot,Tyson Degenhart made Layup. Assisted by Javan Buchanan.,7,7,1st Half,15:57,True,68,2025-02-01T21:10:56Z
401727152101845801,101845801,JumpShot,Zaon Collins missed Three Point Jumper.,7,7,1st Half,15:41,False,278,2025-02-01T21:11:13Z
401727152101846201,101846201,Offensive Rebound,Elijah Price Offensive Rebound.,7,7,1st Half,15:37,False,278,2025-02-01T21:11:15Z
401727152101846301,101846301,LayUpShot,Elijah Price missed Layup.,7,7,1st Half,15:36,False,278,2025-02-01T21:11:15Z
401727152101846302,101846302,PersonalFoul,Foul on RJ Keene II.,7,7,1st Half,15:36,False,68,2025-02-01T21:11:15Z
401727152101846303,101846303,OfficialTVTimeOut,Official TV Timeout,7,7,1st Half,15:36,False,,2025-02-01T21:11:15Z
401727152101846304,101846304,MadeFreeThrow,Elijah Price missed Free Throw.,7,7,1st Half,15:36,False,278,2025-02-01T21:11:15Z
401727152101846305,101846305,Dead Ball Rebound,Fresno State Deadball Team Rebound.,7,7,1st Half,15:36,False,278,2025-02-01T21:11:15Z
401727152101846306,101846306,MadeFreeThrow,Elijah Price made Free Throw.,8,7,1st Half,15:36,True,278,2025-02-01T21:11:15Z
401727152101846501,101846501,Offensive Rebound,Elijah Price Offensive Rebound.,8,7,1st Half,15:34,False,278,2025-02-01T21:11:20Z
401727152101847101,101847101,JumpShot,Julian Bowie missed Three Point Jumper.,8,7,1st Half,15:28,False,68,2025-02-01T21:14:34Z
401727152101847601,101847601,Offensive Rebound,Javan Buchanan Offensive Rebound.,8,7,1st Half,15:23,False,68,2025-02-01T21:14:37Z
401727152101847602,101847602,TipShot,Javan Buchanan made Two Point Tip Shot.,8,9,1st Half,15:23,True,68,2025-02-01T21:14:37Z
401727152101848701,101848701,JumpShot,Zaon Collins missed Jumper.,8,9,1st Half,15:12,False,278,2025-02-01T21:14:49Z
401727152101849001,101849001,Defensive Rebound,Andrew Meadow Defensive Rebound.,8,9,1st Half,15:09,False,68,2025-02-01T21:14:52Z
401727152101854001,101854001,LayUpShot,Tyson Degenhart missed Layup.,8,9,1st Half,14:59,False,68,2025-02-01T21:15:03Z
401727152101854201,101854201,Offensive Rebound,Tyson Degenhart Offensive Rebound.,8,9,1st Half,14:57,False,68,2025-02-01T21:15:03Z
401727152101854202,101854202,PersonalFoul,Foul on Brian Amuneke.,8,9,1st Half,14:57,False,278,2025-02-01T21:15:03Z
401727152101854203,101854203,MadeFreeThrow,Tyson Degenhart made Free Throw.,8,10,1st Half,14:57,True,68,2025-02-01T21:15:34Z
401727152101854204,101854204,MadeFreeThrow,Tyson Degenhart made Free Throw.,8,11,1st Half,14:57,True,68,2025-02-01T21:15:34Z
401727152101856101,101856101,LayUpShot,Brian Amuneke missed Layup.,8,11,1st Half,14:38,False,278,2025-02-01T21:16:27Z
401727152101856501,101856501,Defensive Rebound,Javan Buchanan Defensive Rebound.,8,11,1st Half,14:34,False,68,2025-02-01T21:16:31Z
401727152101857701,101857701,JumpShot,Andrew Meadow made Three Point Jumper. Assisted by Alvaro Cardenas.,8,14,1st Half,14:22,True,68,2025-02-01T21:16:44Z
401727152101859401,101859401,JumpShot,Mor Seck missed Jumper.,8,14,1st Half,14:05,False,278,2025-02-01T21:17:00Z
401727152101859701,101859701,Defensive Rebound,Julian Bowie Defensive Rebound.,8,14,1st Half,14:02,False,68,2025-02-01T21:17:04Z
401727152101866101,101866101,JumpShot,Tyson Degenhart missed Three Point Jumper.,8,14,1st Half,13:38,False,68,2025-02-01T21:17:28Z
401727152101866501,101866501,Defensive Rebound,Mor Seck Defensive Rebound.,8,14,1st Half,13:34,False,278,2025-02-01T21:17:30Z
401727152101867601,101867601,LayUpShot,Brian Amuneke missed Layup.,8,14,1st Half,13:23,False,278,2025-02-01T21:17:42Z
401727152101867602,101867602,Block Shot,Andrew Meadow Block.,8,14,1st Half,13:23,False,68,2025-02-01T21:17:46Z
401727152101868001,101868001,Offensive Rebound,Brian Amuneke Offensive Rebound.,8,14,1st Half,13:19,False,278,2025-02-01T21:17:46Z
401727152101868101,101868101,LayUpShot,Brian Amuneke made Layup.,10,14,1st Half,13:18,True,278,2025-02-01T21:17:46Z
401727152101869401,101869401,LayUpShot,Javan Buchanan missed Layup.,10,14,1st Half,13:05,False,68,2025-02-01T21:18:00Z
401727152101869601,101869601,Defensive Rebound,Zaon Collins Defensive Rebound.,10,14,1st Half,13:03,False,278,2025-02-01T21:18:02Z
401727152101874001,101874001,JumpShot,Brian Amuneke missed Three Point Jumper.,10,14,1st Half,12:59,False,278,2025-02-01T21:18:07Z
401727152101874301,101874301,Defensive Rebound,Julian Bowie Defensive Rebound.,10,14,1st Half,12:56,False,68,2025-02-01T21:18:09Z
401727152101875001,101875001,JumpShot,Alvaro Cardenas missed Jumper.,10,14,1st Half,12:49,False,68,2025-02-01T21:18:19Z
401727152101875401,101875401,Defensive Rebound,Mor Seck Defensive Rebound.,10,14,1st Half,12:45,False,278,2025-02-01T21:18:19Z
401727152101876701,101876701,JumpShot,Alex Crawford made Jumper.,12,14,1st Half,12:32,True,278,2025-02-01T21:18:33Z
401727152101878901,101878901,LayUpShot,Andrew Meadow made Layup.,12,16,1st Half,12:10,True,68,2025-02-01T21:18:56Z
401727152101878902,101878902,PersonalFoul,Foul on Alex Crawford.,12,16,1st Half,12:10,False,278,2025-02-01T21:18:56Z
401727152101878903,101878903,MadeFreeThrow,Andrew Meadow made Free Throw.,12,17,1st Half,12:10,True,68,2025-02-01T21:18:56Z
401727152101885301,101885301,JumpShot,Brian Amuneke missed Jumper.,12,17,1st Half,11:46,False,278,2025-02-01T21:20:07Z
401727152101885601,101885601,Defensive Rebound,O'Mar Stanley Defensive Rebound.,12,17,1st Half,11:43,False,68,2025-02-01T21:20:07Z
401727152101886601,101886601,LayUpShot,O'Mar Stanley made Layup. Assisted by Alvaro Cardenas.,12,19,1st Half,11:33,True,68,2025-02-01T21:20:17Z
401727152101887801,101887801,PersonalFoul,Foul on O'Mar Stanley.,12,19,1st Half,11:21,False,68,2025-02-01T21:20:31Z
401727152101887802,101887802,OfficialTVTimeOut,Official TV Timeout,12,19,1st Half,11:21,False,,2025-02-01T21:20:31Z
401727152101888901,101888901,Lost Ball Turnover,Alex Crawford Turnover.,12,19,1st Half,11:10,False,278,2025-02-01T21:23:25Z
401727152101888902,101888902,Steal,Javan Buchanan Steal.,12,19,1st Half,11:10,False,68,2025-02-01T21:23:25Z
401727152101895701,101895701,JumpShot,Julian Bowie missed Three Point Jumper.,12,19,1st Half,10:42,False,68,2025-02-01T21:23:53Z
401727152101896101,101896101,Offensive Rebound,O'Mar Stanley Offensive Rebound.,12,19,1st Half,10:38,False,68,2025-02-01T21:23:56Z
401727152101896301,101896301,LayUpShot,O'Mar Stanley made Layup.,12,21,1st Half,10:36,True,68,2025-02-01T21:23:59Z
401727152101897701,101897701,Lost Ball Turnover,Jasir Tremble Turnover.,12,21,1st Half,10:22,False,278,2025-02-01T21:24:15Z
401727152101904201,101904201,JumpShot,Javan Buchanan missed Jumper.,12,21,1st Half,9:57,False,68,2025-02-01T21:25:20Z
401727152101904501,101904501,Defensive Rebound,Zaon Collins Defensive Rebound.,12,21,1st Half,9:54,False,278,2025-02-01T21:25:24Z
401727152101905201,101905201,JumpShot,Jalen Weaver missed Three Point Jumper.,12,21,1st Half,9:47,False,278,2025-02-01T21:25:32Z
401727152101905701,101905701,Defensive Rebound,RJ Keene II Defensive Rebound.,12,21,1st Half,9:42,False,68,2025-02-01T21:25:34Z
401727152101906001,101906001,LayUpShot,Pearson Carmichael made Layup. Assisted by RJ Keene II.,12,23,1st Half,9:39,True,68,2025-02-01T21:25:38Z
401727152101907301,101907301,JumpShot,Alex Crawford missed Jumper.,12,23,1st Half,9:26,False,278,2025-02-01T21:25:51Z
401727152101907302,101907302,Block Shot,Javan Buchanan Block.,12,23,1st Half,9:26,False,68,2025-02-01T21:25:51Z
401727152101907701,101907701,Defensive Rebound,O'Mar Stanley Defensive Rebound.,12,23,1st Half,9:22,False,68,2025-02-01T21:25:55Z
401727152101908601,101908601,JumpShot,Alvaro Cardenas made Three Point Jumper. Assisted by O'Mar Stanley.,12,26,1st Half,9:13,True,68,2025-02-01T21:26:05Z
401727152101909301,101909301,ShortTimeOut,Fresno State Timeout,12,26,1st Half,9:06,False,278,2025-02-01T21:26:11Z
401727152101914601,101914601,JumpShot,Joshua Bonga missed Three Point Jumper.,12,26,1st Half,8:53,False,278,2025-02-01T21:27:37Z
401727152101915101,101915101,Defensive Rebound,RJ Keene II Defensive Rebound.,12,26,1st Half,8:48,False,68,2025-02-01T21:27:42Z
401727152101915701,101915701,PersonalFoul,Foul on Joshua Bonga.,12,26,1st Half,8:42,False,278,2025-02-01T21:27:48Z
401727152101916801,101916801,Lost Ball Turnover,O'Mar Stanley Turnover.,12,26,1st Half,8:31,False,68,2025-02-01T21:28:22Z
401727152101918801,101918801,JumpShot,Mor Seck missed ,12,26,1st Half,8:11,False,278,2025-02-01T21:28:55Z
401727152101919201,101919201,Defensive Rebound,RJ Keene II Defensive Rebound.,12,26,1st Half,8:07,False,68,2025-02-01T21:28:59Z
401727152101919501,101919501,PersonalFoul,Foul on Mor Seck.,12,26,1st Half,8:04,False,278,2025-02-01T21:29:00Z
401727152101919601,101919601,JumpShot,Pearson Carmichael made Three Point Jumper. Assisted by Alvaro Cardenas.,12,29,1st Half,8:03,True,68,2025-02-01T21:29:41Z
401727152101926001,101926001,PersonalFoul,Foul on O'Mar Stanley.,12,29,1st Half,7:39,False,68,2025-02-01T21:30:04Z
401727152101926002,101926002,OfficialTVTimeOut,Official TV Timeout,12,29,1st Half,7:39,False,,2025-02-01T21:30:04Z
401727152101926003,101926003,MadeFreeThrow,Mor Seck made Free Throw.,13,29,1st Half,7:39,True,278,2025-02-01T21:32:30Z
401727152101926004,101926004,MadeFreeThrow,Mor Seck missed Free Throw.,13,29,1st Half,7:39,False,278,2025-02-01T21:32:30Z
401727152101926101,101926101,Defensive Rebound,Pearson Carmichael Defensive Rebound.,13,29,1st Half,7:38,False,68,2025-02-01T21:33:19Z
401727152101927301,101927301,LayUpShot,Tyson Degenhart made Layup. Assisted by Alvaro Cardenas.,13,31,1st Half,7:26,True,68,2025-02-01T21:33:30Z
401727152101929701,101929701,JumpShot,Brian Amuneke made Three Point Jumper. Assisted by Zaon Collins.,16,31,1st Half,7:02,True,278,2025-02-01T21:33:55Z
401727152101935901,101935901,PersonalFoul,Foul on Brian Amuneke.,16,31,1st Half,6:40,False,278,2025-02-01T21:34:16Z
401727152101936701,101936701,JumpShot,Pearson Carmichael missed Three Point Jumper.,16,31,1st Half,6:32,False,68,2025-02-01T21:34:46Z
401727152101937001,101937001,Defensive Rebound,Zaon Collins Defensive Rebound.,16,31,1st Half,6:29,False,278,2025-02-01T21:34:49Z
401727152101937401,101937401,JumpShot,Zaon Collins missed Jumper.,16,31,1st Half,6:25,False,278,2025-02-01T21:34:52Z
401727152101937801,101937801,Defensive Rebound,Andrew Meadow Defensive Rebound.,16,31,1st Half,6:21,False,68,2025-02-01T21:34:57Z
401727152101938101,101938101,Lost Ball Turnover,Alvaro Cardenas Turnover.,16,31,1st Half,6:18,False,68,2025-02-01T21:35:00Z
401727152101938102,101938102,Steal,Jasir Tremble Steal.,16,31,1st Half,6:18,False,278,2025-02-01T21:39:15Z
401727152101938701,101938701,LayUpShot,Brian Amuneke made Layup. Assisted by Alex Crawford.,18,31,1st Half,6:12,True,278,2025-02-01T21:39:15Z
401727152101944601,101944601,JumpShot,Andrew Meadow missed Three Point Jumper.,18,31,1st Half,5:53,False,68,2025-02-01T21:35:25Z
401727152101944901,101944901,Defensive Rebound,Zaon Collins Defensive Rebound.,18,31,1st Half,5:50,False,278,2025-02-01T21:35:29Z
401727152101947201,101947201,LayUpShot,Elijah Price missed Layup.,18,31,1st Half,5:27,False,278,2025-02-01T21:35:53Z
401727152101947401,101947401,Defensive Rebound,Javan Buchanan Defensive Rebound.,18,31,1st Half,5:25,False,68,2025-02-01T21:35:53Z
401727152101948001,101948001,JumpShot,Alvaro Cardenas made Three Point Jumper. Assisted by Andrew Meadow.,18,34,1st Half,5:19,True,68,2025-02-01T21:36:00Z
401727152101949901,101949901,JumpShot,Brian Amuneke made Three Point Jumper. Assisted by Zaon Collins.,21,34,1st Half,5:00,True,278,2025-02-01T21:36:18Z
401727152101956001,101956001,LayUpShot,Tyson Degenhart made Layup.,21,36,1st Half,4:39,True,68,2025-02-01T21:36:39Z
401727152101956301,101956301,ShortTimeOut,Boise State Timeout,21,36,1st Half,4:36,False,68,2025-02-01T21:36:45Z
401727152101957801,101957801,JumpShot,Alex Crawford missed Three Point Jumper.,21,36,1st Half,4:21,False,278,2025-02-01T21:38:11Z
401727152101958201,101958201,Defensive Rebound,Tyson Degenhart Defensive Rebound.,21,36,1st Half,4:17,False,68,2025-02-01T21:38:16Z
401727152101958202,101958202,PersonalFoul,Foul on Mor Seck.,21,36,1st Half,4:17,False,278,2025-02-01T21:38:16Z
401727152101964801,101964801,Lost Ball Turnover,Tyson Degenhart Turnover.,21,36,1st Half,3:51,False,68,2025-02-01T21:39:08Z
401727152101965101,101965101,OfficialTVTimeOut,Official TV Timeout,21,36,1st Half,3:48,False,,2025-02-01T21:39:13Z
401727152101966601,101966601,Lost Ball Turnover,Brian Amuneke Turnover.,21,36,1st Half,3:33,False,278,2025-02-01T21:41:51Z
401727152101966602,101966602,Steal,Andrew Meadow Steal.,21,36,1st Half,3:33,False,68,2025-02-01T21:41:51Z
401727152101967901,101967901,JumpShot,Andrew Meadow made Three Point Jumper. Assisted by Alvaro Cardenas.,21,39,1st Half,3:20,True,68,2025-02-01T21:42:04Z
401727152101969601,101969601,PersonalFoul,Foul on Alvaro Cardenas.,21,39,1st Half,3:03,False,68,2025-02-01T21:42:20Z
401727152101974501,101974501,JumpShot,Brian Amuneke missed Three Point Jumper.,21,39,1st Half,2:54,False,278,2025-02-01T21:42:58Z
401727152101974901,101974901,Defensive Rebound,Tyson Degenhart Defensive Rebound.,21,39,1st Half,2:50,False,68,2025-02-01T21:43:01Z
401727152101975701,101975701,JumpShot,Andrew Meadow missed Three Point Jumper.,21,39,1st Half,2:42,False,68,2025-02-01T21:43:10Z
401727152101976001,101976001,Defensive Rebound,Jalen Weaver Defensive Rebound.,21,39,1st Half,2:39,False,278,2025-02-01T21:43:13Z
401727152101976601,101976601,PersonalFoul,Foul on Tyson Degenhart.,21,39,1st Half,2:33,False,68,2025-02-01T21:43:18Z
401727152101976602,101976602,MadeFreeThrow,Alex Crawford made Free Throw.,22,39,1st Half,2:33,True,278,2025-02-01T21:43:18Z
401727152101976603,101976603,MadeFreeThrow,Alex Crawford made Free Throw.,23,39,1st Half,2:33,True,278,2025-02-01T21:43:18Z
401727152101976604,101976604,MadeFreeThrow,Alex Crawford made Free Throw.,24,39,1st Half,2:33,True,278,2025-02-01T21:43:18Z
401727152101978504,101978504,LayUpShot,Javan Buchanan made Layup.,24,41,1st Half,2:14,True,68,2025-02-01T21:45:12Z
401727152101978505,101978505,PersonalFoul,Foul on Alex Crawford.,24,41,1st Half,2:14,False,278,2025-02-01T21:45:12Z
401727152101978506,101978506,MadeFreeThrow,Javan Buchanan made Free Throw.,24,42,1st Half,2:14,True,68,2025-02-01T21:45:12Z
401727152101984101,101984101,LayUpShot,Alex Crawford made Layup.,26,42,1st Half,1:58,True,278,2025-02-01T21:45:42Z
401727152101986101,101986101,LayUpShot,Alvaro Cardenas made Layup.,26,44,1st Half,1:38,True,68,2025-02-01T21:45:51Z
401727152101986801,101986801,Lost Ball Turnover,Jalen Weaver Turnover.,26,44,1st Half,1:31,False,278,2025-02-01T21:45:59Z
401727152101989501,101989501,JumpShot,Andrew Meadow missed Three Point Jumper.,26,44,1st Half,1:04,False,68,2025-02-01T21:46:45Z
401727152101989801,101989801,Offensive Rebound,Javan Buchanan Offensive Rebound.,26,44,1st Half,1:01,False,68,2025-02-01T21:46:48Z
401727152101994801,101994801,LayUpShot,Andrew Meadow missed Layup.,26,44,1st Half,0:51,False,68,2025-02-01T21:46:56Z
401727152101994802,101994802,Block Shot,Alex Crawford Block.,26,44,1st Half,0:51,False,278,2025-02-01T21:46:59Z
401727152101995101,101995101,Defensive Rebound,Zaon Collins Defensive Rebound.,26,44,1st Half,0:48,False,278,2025-02-01T21:47:01Z
401727152101995301,101995301,LayUpShot,Jalen Weaver missed Layup.,26,44,1st Half,0:46,False,278,2025-02-01T21:47:03Z
401727152101995701,101995701,Defensive Rebound,Tyson Degenhart Defensive Rebound.,26,44,1st Half,0:42,False,68,2025-02-01T21:47:06Z
401727152101996301,101996301,JumpShot,Julian Bowie missed Three Point Jumper.,26,44,1st Half,0:36,False,68,2025-02-01T21:47:12Z
401727152101996302,101996302,Block Shot,Elijah Price Block.,26,44,1st Half,0:36,False,278,2025-02-01T21:47:18Z
401727152101996901,101996901,Defensive Rebound,Zaon Collins Defensive Rebound.,26,44,1st Half,0:30,False,278,2025-02-01T21:47:18Z
401727152101999601,101999601,JumpShot,Brian Amuneke missed Three Point Jumper.,26,44,1st Half,0:03,False,278,2025-02-01T21:47:45Z
401727152101999901,101999901,Defensive Rebound,Tyson Degenhart Defensive Rebound.,26,44,1st Half,0:00,False,68,2025-02-01T21:47:45Z
401727152101999902,101999902,End Period,End of 1st half,26,44,1st Half,0:00,False,,2025-02-01T21:47:45Z
401727152102806101,102806101,JumpShot,Emmanuel Ugbo missed ,26,44,2nd Half,19:38,False,68,2025-02-01T22:04:23Z
401727152102806501,102806501,Defensive Rebound,Mor Seck Defensive Rebound.,26,44,2nd Half,19:34,False,278,2025-02-01T22:04:27Z
401727152102808401,102808401,JumpShot,Elijah Price missed Three Point Jumper.,26,44,2nd Half,19:15,False,278,2025-02-01T22:04:49Z
401727152102808801,102808801,Defensive Rebound,Tyson Degenhart Defensive Rebound.,26,44,2nd Half,19:11,False,68,2025-02-01T22:04:49Z
401727152102814001,102814001,LayUpShot,Emmanuel Ugbo made Layup. Assisted by Tyson Degenhart.,26,46,2nd Half,18:59,True,68,2025-02-01T22:05:03Z
401727152102816301,102816301,PersonalFoul,Foul on Andrew Meadow.,26,46,2nd Half,18:36,False,68,2025-02-01T22:05:26Z
401727152102816302,102816302,MadeFreeThrow,Zaon Collins made Free Throw.,27,46,2nd Half,18:36,True,278,2025-02-01T22:05:26Z
401727152102816303,102816303,MadeFreeThrow,Zaon Collins made Free Throw.,28,46,2nd Half,18:36,True,278,2025-02-01T22:05:26Z
401727152102819101,102819101,JumpShot,Alvaro Cardenas made Jumper.,28,48,2nd Half,18:08,True,68,2025-02-01T22:06:36Z
401727152102825001,102825001,JumpShot,Jalen Weaver made Three Point Jumper. Assisted by Alex Crawford.,31,48,2nd Half,17:49,True,278,2025-02-01T22:06:56Z
401727152102826701,102826701,JumpShot,Alvaro Cardenas missed Three Point Jumper.,31,48,2nd Half,17:32,False,68,2025-02-01T22:07:19Z
401727152102827001,102827001,Defensive Rebound,Zaon Collins Defensive Rebound.,31,48,2nd Half,17:29,False,278,2025-02-01T22:07:19Z
401727152102827401,102827401,PersonalFoul,Foul on Jalen Weaver.,31,48,2nd Half,17:25,False,278,2025-02-01T22:07:21Z
401727152102827402,102827402,Lost Ball Turnover,Jalen Weaver Turnover.,31,48,2nd Half,17:25,False,278,2025-02-01T22:07:21Z
401727152102828401,102828401,JumpShot,RJ Keene II missed Three Point Jumper.,31,48,2nd Half,17:15,False,68,2025-02-01T22:07:52Z
401727152102828801,102828801,Defensive Rebound,Fresno State Defensive Rebound.,31,48,2nd Half,17:11,False,278,2025-02-01T22:07:55Z
401727152102835601,102835601,LayUpShot,Jalen Weaver missed Layup.,31,48,2nd Half,16:43,False,278,2025-02-01T22:08:40Z
401727152102836001,102836001,Offensive Rebound,Mor Seck Offensive Rebound.,31,48,2nd Half,16:39,False,278,2025-02-01T22:08:47Z
401727152102836101,102836101,JumpShot,Mor Seck missed Jumper.,31,48,2nd Half,16:38,False,278,2025-02-01T22:08:47Z
401727152102836102,102836102,Block Shot,RJ Keene II Block.,31,48,2nd Half,16:38,False,68,2025-02-01T22:08:47Z
401727152102836501,102836501,Defensive Rebound,Javan Buchanan Defensive Rebound.,31,48,2nd Half,16:34,False,68,2025-02-01T22:08:52Z
401727152102837401,102837401,JumpShot,Andrew Meadow missed Three Point Jumper.,31,48,2nd Half,16:25,False,68,2025-02-01T22:09:00Z
401727152102837901,102837901,Defensive Rebound,Mor Seck Defensive Rebound.,31,48,2nd Half,16:20,False,278,2025-02-01T22:09:04Z
401727152102839001,102839001,PersonalFoul,Foul on Javan Buchanan.,31,48,2nd Half,16:09,False,68,2025-02-01T22:09:18Z
401727152102844201,102844201,LayUpShot,Alex Crawford made Layup.,33,48,2nd Half,15:57,True,278,2025-02-01T22:10:51Z
401727152102846601,102846601,LayUpShot,Tyson Degenhart missed Layup.,33,48,2nd Half,15:33,False,68,2025-02-01T22:10:21Z
401727152102846602,102846602,Block Shot,Elijah Price Block.,33,48,2nd Half,15:33,False,278,2025-02-01T22:10:21Z
401727152102847101,102847101,Offensive Rebound,Tyson Degenhart Offensive Rebound.,33,48,2nd Half,15:28,False,68,2025-02-01T22:10:28Z
401727152102847102,102847102,LayUpShot,Tyson Degenhart made Layup.,33,50,2nd Half,15:28,True,68,2025-02-01T22:10:28Z
401727152102848801,102848801,Lost Ball Turnover,Elijah Price Turnover.,33,50,2nd Half,15:11,False,278,2025-02-01T22:10:45Z
401727152102849501,102849501,PersonalFoul,Foul on Javan Buchanan.,33,50,2nd Half,15:04,False,68,2025-02-01T22:10:51Z
401727152102849502,102849502,Lost Ball Turnover,Javan Buchanan Turnover.,33,50,2nd Half,15:04,False,68,2025-02-01T22:10:51Z
401727152102849503,102849503,OfficialTVTimeOut,Official TV Timeout,33,50,2nd Half,15:04,False,,2025-02-01T22:10:51Z
401727152102855401,102855401,LayUpShot,Alex Crawford made Layup. Assisted by Brian Amuneke.,35,50,2nd Half,14:45,True,278,2025-02-01T22:51:25Z
401727152102857501,102857501,PersonalFoul,Foul on Mor Seck.,35,50,2nd Half,14:24,False,278,2025-02-01T22:14:06Z
401727152102857502,102857502,MadeFreeThrow,Javan Buchanan made Free Throw.,35,51,2nd Half,14:24,True,68,2025-02-01T22:14:11Z
401727152102857503,102857503,MadeFreeThrow,Javan Buchanan made Free Throw.,35,52,2nd Half,14:24,True,68,2025-02-01T22:14:11Z
401727152102859601,102859601,LayUpShot,Alex Crawford made Layup. Assisted by Elijah Price.,37,52,2nd Half,14:03,True,278,2025-02-01T22:15:22Z
401727152102867101,102867101,JumpShot,Pearson Carmichael missed Three Point Jumper.,37,52,2nd Half,13:28,False,68,2025-02-01T22:15:51Z
401727152102867102,102867102,Dead Ball Rebound,Boise State Deadball Team Rebound.,37,52,2nd Half,13:28,False,68,2025-02-01T22:15:51Z
401727152102867103,102867103,Lost Ball Turnover,Boise State  Turnover.,37,52,2nd Half,13:28,False,68,2025-02-01T22:15:51Z
401727152102868601,102868601,JumpShot,Brian Amuneke made Jumper.,39,52,2nd Half,13:13,True,278,2025-02-01T22:16:17Z
401727152102869301,102869301,ShortTimeOut,Boise State Timeout,39,52,2nd Half,13:06,False,68,2025-02-01T22:16:35Z
401727152102869302,102869302,OfficialTVTimeOut,Official TV Timeout,39,52,2nd Half,13:06,False,,2025-02-01T22:16:35Z
401727152102875201,102875201,LayUpShot,O'Mar Stanley made Layup.,39,54,2nd Half,12:47,True,68,2025-02-01T22:19:08Z
401727152102876401,102876401,PersonalFoul,Foul on Javan Buchanan.,39,54,2nd Half,12:35,False,68,2025-02-01T22:19:19Z
401727152102877701,102877701,JumpShot,Elijah Price missed Three Point Jumper.,39,54,2nd Half,12:22,False,278,2025-02-01T22:20:05Z
401727152102878201,102878201,Offensive Rebound,Brian Amuneke Offensive Rebound.,39,54,2nd Half,12:17,False,278,2025-02-01T22:20:08Z
401727152102878301,102878301,LayUpShot,Brian Amuneke made Layup.,41,54,2nd Half,12:16,True,278,2025-02-01T22:20:12Z
401727152102884101,102884101,PersonalFoul,Foul on Zaon Collins.,41,54,2nd Half,11:58,False,278,2025-02-01T22:20:27Z
401727152102884102,102884102,OfficialTVTimeOut,Official TV Timeout,41,54,2nd Half,11:58,False,,2025-02-01T22:20:27Z
401727152102885601,102885601,PersonalFoul,Foul on Elijah Price.,41,54,2nd Half,11:43,False,278,2025-02-01T22:23:21Z
401727152102885602,102885602,MadeFreeThrow,Tyson Degenhart made Free Throw.,41,55,2nd Half,11:43,True,68,2025-02-01T22:23:21Z
401727152102885603,102885603,MadeFreeThrow,Tyson Degenhart missed Free Throw.,41,55,2nd Half,11:43,False,68,2025-02-01T22:23:21Z
401727152102885701,102885701,Defensive Rebound,Jalen Weaver Defensive Rebound.,41,55,2nd Half,11:42,False,278,2025-02-01T22:24:15Z
401727152102887201,102887201,Lost Ball Turnover,Elijah Price Turnover.,41,55,2nd Half,11:27,False,278,2025-02-01T22:24:29Z
401727152102888701,102888701,JumpShot,Julian Bowie made Three Point Jumper. Assisted by O'Mar Stanley.,41,58,2nd Half,11:12,True,68,2025-02-01T22:24:57Z
