play_id,sequence_number,type,description,away_score,home_score,period,clock,scoring_play,team_id,timestamp_utc
401715428101806901,101806901,LayUpShot,Jeremiah Williams made Layup.,0,2,1st Half,19:30,True,164,2024-12-30T22:05:51Z
401715428101808401,101808401,JumpShot,Blair Thompson missed Three Point Jumper.,0,2,1st Half,19:15,False,171,2024-12-30T22:06:07Z
401715428101808601,101808601,Defensive Rebound,Dylan Harper Defensive Rebound.,0,2,1st Half,19:13,False,164,2024-12-30T22:06:07Z
401715428101808801,101808801,DunkShot,Ace Bailey made Dunk. Assisted by Dylan Harper.,0,4,1st Half,19:11,True,164,2024-12-30T22:06:10Z
401715428101816101,101816101,JumpShot,Zine Eddine Bedri made Jumper.,2,4,1st Half,18:38,True,171,2024-12-30T22:07:00Z
401715428101817501,101817501,JumpShot,Ace Bailey missed Jumper.,2,4,1st Half,18:24,False,164,2024-12-30T22:07:01Z
401715428101817701,101817701,Offensive Rebound,Jeremiah Williams Offensive Rebound.,2,4,1st Half,18:22,False,164,2024-12-30T22:07:01Z
401715428101818101,101818101,JumpShot,Jeremiah Williams made Jumper.,2,6,1st Half,18:18,True,164,2024-12-30T22:07:18Z
401715428101819801,101819801,LayUpShot,Geronimo Rubio De La Rosa made Layup. Assisted by Zine Eddine Bedri.,4,6,1st Half,18:01,True,171,2024-12-30T22:07:21Z
401715428101825401,101825401,JumpShot,Ace Bailey made Three Point Jumper.,4,9,1st Half,17:45,True,164,2024-12-30T22:08:13Z
401715428101826701,101826701,JumpShot,Zine Eddine Bedri missed Jumper.,4,9,1st Half,17:32,False,171,2024-12-30T22:07:54Z
401715428101826901,101826901,Defensive Rebound,Ace Bailey Defensive Rebound.,4,9,1st Half,17:30,False,164,2024-12-30T22:07:54Z
401715428101827401,101827401,JumpShot,Dylan Harper made Three Point Jumper.,4,12,1st Half,17:25,True,164,2024-12-30T22:08:09Z
401715428101829001,101829001,PersonalFoul,Foul on Dylan Harper.,4,12,1st Half,17:09,False,164,2024-12-30T22:08:13Z
401715428101829002,101829002,MadeFreeThrow,Zine Eddine Bedri made Free Throw.,5,12,1st Half,17:09,True,171,2024-12-30T22:08:13Z
401715428101829003,101829003,MadeFreeThrow,Zine Eddine Bedri made Free Throw.,6,12,1st Half,17:09,True,171,2024-12-30T22:08:13Z
401715428101834201,101834201,JumpShot,Jamichael Davis missed Three Point Jumper.,6,12,1st Half,16:57,False,164,2024-12-30T22:09:46Z
401715428101834401,101834401,Defensive Rebound,Geronimo Rubio De La Rosa Defensive Rebound.,6,12,1st Half,16:55,False,171,2024-12-30T22:09:46Z
401715428101835401,101835401,JumpShot,Geronimo Rubio De La Rosa missed Three Point Jumper.,6,12,1st Half,16:45,False,171,2024-12-30T22:10:02Z
401715428101835801,101835801,Defensive Rebound,Dylan Harper Defensive Rebound.,6,12,1st Half,16:41,False,164,2024-12-30T22:10:02Z
401715428101836201,101836201,JumpShot,Dylan Harper missed Three Point Jumper.,6,12,1st Half,16:37,False,164,2024-12-30T22:10:03Z
401715428101836202,101836202,Offensive Rebound,Emmanuel Ogbole Offensive Rebound.,6,12,1st Half,16:37,False,164,2024-12-30T22:10:03Z
401715428101836203,101836203,PersonalFoul,Foul on Geronimo Rubio De La Rosa.,6,12,1st Half,16:37,False,171,2024-12-30T22:10:03Z
401715428101836204,101836204,MadeFreeThrow,Emmanuel Ogbole missed Free Throw.,6,12,1st Half,16:37,False,164,2024-12-30T22:10:03Z
401715428101836205,101836205,Offensive Rebound,Rutgers Offensive Rebound.,6,12,1st Half,16:37,False,164,2024-12-30T22:10:03Z
401715428101836206,101836206,MadeFreeThrow,Emmanuel Ogbole made Free Throw.,6,13,1st Half,16:37,True,164,2024-12-30T22:10:03Z
401715428101838901,101838901,LayUpShot,Avery Brown missed Layup.,6,13,1st Half,16:10,False,171,2024-12-30T22:11:42Z
401715428101839501,101839501,Defensive Rebound,Jamichael Davis Defensive Rebound.,6,13,1st Half,16:04,False,164,2024-12-30T22:11:46Z
401715428101839601,101839601,LayUpShot,Ace Bailey made Layup. Assisted by Jamichael Davis.,6,15,1st Half,16:03,True,164,2024-12-30T22:11:46Z
401715428101845301,101845301,Lost Ball Turnover,Avery Brown Turnover.,6,15,1st Half,15:46,False,171,2024-12-30T22:12:06Z
401715428101845302,101845302,Steal,Ace Bailey Steal.,6,15,1st Half,15:46,False,164,2024-12-30T22:12:06Z
401715428101847801,101847801,JumpShot,Jamichael Davis made Three Point Jumper. Assisted by Dylan Harper.,6,18,1st Half,15:21,True,164,2024-12-30T22:12:32Z
401715428101854001,101854001,LayUpShot,Kenny Noland made Layup.,8,18,1st Half,14:59,True,171,2024-12-30T22:13:01Z
401715428101856001,101856001,JumpShot,Jamichael Davis missed Jumper.,8,18,1st Half,14:39,False,164,2024-12-30T22:13:12Z
401715428101856301,101856301,Defensive Rebound,Kenny Noland Defensive Rebound.,8,18,1st Half,14:36,False,171,2024-12-30T22:13:27Z
401715428101856801,101856801,JumpShot,Geronimo Rubio De La Rosa missed Three Point Jumper.,8,18,1st Half,14:31,False,171,2024-12-30T22:13:28Z
401715428101856901,101856901,Defensive Rebound,Rutgers Defensive Rebound.,8,18,1st Half,14:30,False,164,2024-12-30T22:13:28Z
401715428101856902,101856902,OfficialTVTimeOut, Official TV Timeout,8,18,1st Half,14:30,False,,2024-12-30T22:13:28Z
401715428101859001,101859001,LayUpShot,Jordan Derkack missed Layup.,8,18,1st Half,14:09,False,164,2024-12-30T22:16:39Z
401715428101859002,101859002,Offensive Rebound,Rutgers Offensive Rebound.,8,18,1st Half,14:09,False,164,2024-12-30T22:16:39Z
401715428101864701,101864701,JumpShot,Jordan Derkack missed Jumper.,8,18,1st Half,13:52,False,164,2024-12-30T22:17:19Z
401715428101864901,101864901,Defensive Rebound,Kenny Noland Defensive Rebound.,8,18,1st Half,13:50,False,171,2024-12-30T22:17:19Z
401715428101865501,101865501,JumpShot,Kenny Noland made Three Point Jumper.,11,18,1st Half,13:44,True,171,2024-12-30T22:17:19Z
401715428101867501,101867501,JumpShot,Dylan Harper missed Jumper.,11,18,1st Half,13:24,False,164,2024-12-30T22:17:44Z
401715428101867502,101867502,Defensive Rebound,Noah Robledo Defensive Rebound.,11,18,1st Half,13:24,False,171,2024-12-30T22:17:49Z
401715428101869501,101869501,Lost Ball Turnover,Kenny Noland Turnover.,11,18,1st Half,13:04,False,171,2024-12-30T22:18:23Z
401715428101869502,101869502,Steal,Jordan Derkack Steal.,11,18,1st Half,13:04,False,164,2024-12-30T22:18:57Z
401715428101874801,101874801,JumpShot,Tyson Acuff missed Three Point Jumper.,11,18,1st Half,12:51,False,164,2024-12-30T22:18:38Z
401715428101875001,101875001,Defensive Rebound,Noah Robledo Defensive Rebound.,11,18,1st Half,12:49,False,171,2024-12-30T22:18:38Z
401715428101876301,101876301,JumpShot,Noah Robledo missed Three Point Jumper.,11,18,1st Half,12:36,False,171,2024-12-30T22:20:54Z
401715428101876501,101876501,Defensive Rebound,Dylan Harper Defensive Rebound.,11,18,1st Half,12:34,False,164,2024-12-30T22:18:57Z
401715428101876601,101876601,LayUpShot,Lathan Sommerville made Layup. Assisted by Dylan Harper.,11,20,1st Half,12:33,True,164,2024-12-30T22:18:57Z
401715428101876602,101876602,PersonalFoul,Foul on Noah Robledo.,11,20,1st Half,12:33,False,171,2024-12-30T22:18:57Z
401715428101876603,101876603,MadeFreeThrow,Lathan Sommerville made Free Throw.,11,21,1st Half,12:33,True,164,2024-12-30T22:18:57Z
401715428101879201,101879201,LayUpShot,Blair Thompson made Layup. Assisted by Nicolo Romanelli.,13,21,1st Half,12:07,True,171,2024-12-30T22:20:03Z
401715428101885701,101885701,JumpShot,Jeremiah Williams missed Three Point Jumper.,13,21,1st Half,11:42,False,164,2024-12-30T22:20:37Z
401715428101886001,101886001,Defensive Rebound,Kenny Noland Defensive Rebound.,13,21,1st Half,11:39,False,171,2024-12-30T22:20:37Z
401715428101887901,101887901,Lost Ball Turnover,Mason Ritter Turnover.,13,21,1st Half,11:20,False,171,2024-12-30T22:20:54Z
401715428101887902,101887902,Steal,Jordan Derkack Steal.,13,21,1st Half,11:20,False,164,2024-12-30T22:20:54Z
401715428101887903,101887903,PersonalFoul,Foul on Mason Ritter.,13,21,1st Half,11:20,False,171,2024-12-30T22:20:54Z
401715428101887904,101887904,OfficialTVTimeOut, Official TV Timeout,13,21,1st Half,11:20,False,,2024-12-30T22:20:54Z
401715428101894101,101894101,JumpShot,Jeremiah Williams missed Jumper.,13,21,1st Half,10:58,False,164,2024-12-30T22:24:35Z
401715428101894102,101894102,Block Shot,Avery Brown Block.,13,21,1st Half,10:58,False,171,2024-12-30T22:24:36Z
401715428101894501,101894501,Offensive Rebound,Jordan Derkack Offensive Rebound.,13,21,1st Half,10:54,False,164,2024-12-30T22:24:36Z
401715428101894502,101894502,LayUpShot,Jordan Derkack missed Layup.,13,21,1st Half,10:54,False,164,2024-12-30T22:24:36Z
401715428101894801,101894801,Defensive Rebound,Jake Tavroff Defensive Rebound.,13,21,1st Half,10:51,False,171,2024-12-30T22:24:37Z
401715428101894802,101894802,LayUpShot,Geronimo Rubio De La Rosa made Layup. Assisted by Jake Tavroff.,15,21,1st Half,10:51,True,171,2024-12-30T22:24:37Z
401715428101896401,101896401,JumpShot,Ace Bailey missed Jumper.,15,21,1st Half,10:35,False,164,2024-12-30T22:25:28Z
401715428101896601,101896601,Defensive Rebound,Blair Thompson Defensive Rebound.,15,21,1st Half,10:33,False,171,2024-12-30T22:25:28Z
401715428101898401,101898401,Lost Ball Turnover,Jake Tavroff Turnover.,15,21,1st Half,10:15,False,171,2024-12-30T22:25:45Z
401715428101898402,101898402,Steal,Dylan Harper Steal.,15,21,1st Half,10:15,False,164,2024-12-30T22:25:45Z
401715428101904101,101904101,JumpShot,Ace Bailey made Jumper. Assisted by Dylan Harper.,15,23,1st Half,9:58,True,164,2024-12-30T22:26:19Z
401715428101905301,101905301,LayUpShot,Geronimo Rubio De La Rosa missed Layup.,15,23,1st Half,9:46,False,171,2024-12-30T22:26:36Z
401715428101905302,101905302,Block Shot,Dylan Harper Block.,15,23,1st Half,9:46,False,164,2024-12-30T22:26:36Z
401715428101905801,101905801,Defensive Rebound,Lathan Sommerville Defensive Rebound.,15,23,1st Half,9:41,False,164,2024-12-30T22:28:46Z
401715428101906001,101906001,JumpShot,PJ Hayes IV missed Three Point Jumper.,15,23,1st Half,9:39,False,164,2024-12-30T22:28:46Z
401715428101906501,101906501,Defensive Rebound,Kenny Noland Defensive Rebound.,15,23,1st Half,9:34,False,171,2024-12-30T22:28:46Z
401715428101907901,101907901,JumpShot,Geronimo Rubio De La Rosa made Three Point Jumper.,18,23,1st Half,9:20,True,171,2024-12-30T22:27:00Z
401715428101914201,101914201,JumpShot,Ace Bailey made Jumper. Assisted by Tyson Acuff.,18,25,1st Half,8:57,True,164,2024-12-30T22:27:33Z
401715428101915401,101915401,JumpShot,Kenny Noland missed Three Point Jumper.,18,25,1st Half,8:45,False,171,2024-12-30T22:27:35Z
401715428101915601,101915601,Defensive Rebound,Dylan Harper Defensive Rebound.,18,25,1st Half,8:43,False,164,2024-12-30T22:27:35Z
401715428101916401,101916401,JumpShot,Ace Bailey made Jumper. Assisted by Dylan Harper.,18,27,1st Half,8:35,True,164,2024-12-30T22:27:42Z
401715428101917701,101917701,LayUpShot,Kenny Noland made Layup.,20,27,1st Half,8:22,True,171,2024-12-30T22:28:04Z
401715428101919401,101919401,JumpShot,Tyson Acuff missed Three Point Jumper.,20,27,1st Half,8:05,False,164,2024-12-30T22:28:11Z
401715428101919701,101919701,Offensive Rebound,PJ Hayes IV Offensive Rebound.,20,27,1st Half,8:02,False,164,2024-12-30T22:28:27Z
401715428101924701,101924701,JumpShot,Lathan Sommerville made Jumper. Assisted by Ace Bailey.,20,29,1st Half,7:52,True,164,2024-12-30T22:28:28Z
401715428101925901,101925901,JumpShot,Blair Thompson missed Three Point Jumper.,20,29,1st Half,7:40,False,171,2024-12-30T22:28:46Z
401715428101925902,101925902,Defensive Rebound,Lathan Sommerville Defensive Rebound.,20,29,1st Half,7:40,False,164,2024-12-30T22:28:46Z
401715428101925903,101925903,PersonalFoul,Foul on Jake Tavroff.,20,29,1st Half,7:40,False,171,2024-12-30T22:28:46Z
401715428101925904,101925904,OfficialTVTimeOut, Official TV Timeout,20,29,1st Half,7:40,False,,2024-12-30T22:28:46Z
401715428101927801,101927801,LayUpShot,Emmanuel Ogbole made Layup. Assisted by PJ Hayes IV.,20,31,1st Half,7:21,True,164,2024-12-30T22:32:33Z
401715428101929801,101929801,JumpShot,Geronimo Rubio De La Rosa made Jumper.,22,31,1st Half,7:01,True,171,2024-12-30T22:32:51Z
401715428101935301,101935301,DunkShot,Ace Bailey made Dunk. Assisted by Dylan Harper.,22,33,1st Half,6:46,True,164,2024-12-30T22:33:11Z
401715428101936801,101936801,JumpShot,Zine Eddine Bedri missed Jumper.,22,33,1st Half,6:31,False,171,2024-12-30T22:33:28Z
401715428101937101,101937101,Defensive Rebound,Dylan Harper Defensive Rebound.,22,33,1st Half,6:28,False,164,2024-12-30T22:33:28Z
401715428101938401,101938401,JumpShot,PJ Hayes IV missed Three Point Jumper.,22,33,1st Half,6:15,False,164,2024-12-30T22:33:33Z
401715428101938601,101938601,Offensive Rebound,Emmanuel Ogbole Offensive Rebound.,22,33,1st Half,6:13,False,164,2024-12-30T22:33:33Z
401715428101939301,101939301,JumpShot,Ace Bailey made Jumper. Assisted by PJ Hayes IV.,22,35,1st Half,6:06,True,164,2024-12-30T22:33:42Z
401715428101944501,101944501,JumpShot,Noah Robledo made Three Point Jumper. Assisted by Avery Brown.,25,35,1st Half,5:54,True,171,2024-12-30T22:33:53Z
401715428101946501,101946501,JumpShot,PJ Hayes IV made Three Point Jumper. Assisted by Jamichael Davis.,25,38,1st Half,5:34,True,164,2024-12-30T22:34:17Z
401715428101947301,101947301,LayUpShot,Josiah Cunningham missed Layup.,25,38,1st Half,5:26,False,171,2024-12-30T22:34:21Z
401715428101947302,101947302,Offensive Rebound,Columbia Offensive Rebound.,25,38,1st Half,5:26,False,171,2024-12-30T22:34:21Z
401715428101947401,101947401,PersonalFoul,Foul on PJ Hayes IV.,25,38,1st Half,5:25,False,164,2024-12-30T22:34:56Z
401715428101948001,101948001,Lost Ball Turnover,Zine Eddine Bedri Turnover.,25,38,1st Half,5:19,False,171,2024-12-30T22:34:56Z
401715428101948002,101948002,ShortTimeOut,Columbia  Timeout,25,38,1st Half,5:19,False,171,2024-12-30T22:34:56Z
401715428101949601,101949601,JumpShot,PJ Hayes IV missed Three Point Jumper.,25,38,1st Half,5:03,False,164,2024-12-30T22:36:42Z
401715428101949602,101949602,Defensive Rebound,Zine Eddine Bedri Defensive Rebound.,25,38,1st Half,5:03,False,171,2024-12-30T22:36:42Z
401715428101949603,101949603,PersonalFoul,Foul on Emmanuel Ogbole.,25,38,1st Half,5:03,False,164,2024-12-30T22:36:42Z
401715428101955201,101955201,LayUpShot,Geronimo Rubio De La Rosa made Layup.,27,38,1st Half,4:47,True,171,2024-12-30T22:37:05Z
401715428101956401,101956401,Lost Ball Turnover,PJ Hayes IV Turnover.,27,38,1st Half,4:35,False,164,2024-12-30T22:37:25Z
401715428101956402,101956402,Steal,Kenny Noland Steal.,27,38,1st Half,4:35,False,171,2024-12-30T22:37:25Z
401715428101957001,101957001,JumpShot,Avery Brown made Three Point Jumper. Assisted by Kenny Noland.,30,38,1st Half,4:29,True,171,2024-12-30T22:37:26Z
401715428101959801,101959801,JumpShot,Dylan Harper missed Three Point Jumper.,30,38,1st Half,4:01,False,164,2024-12-30T22:37:48Z
401715428101959802,101959802,Offensive Rebound,Rutgers Offensive Rebound.,30,38,1st Half,4:01,False,164,2024-12-30T22:37:48Z
401715428101959803,101959803,PersonalFoul,Foul on Geronimo Rubio De La Rosa.,30,38,1st Half,4:01,False,171,2024-12-30T22:37:48Z
401715428101964701,101964701,JumpShot,Jeremiah Williams missed Three Point Jumper.,30,38,1st Half,3:52,False,164,2024-12-30T22:38:44Z
401715428101965001,101965001,Defensive Rebound,Noah Robledo Defensive Rebound.,30,38,1st Half,3:49,False,171,2024-12-30T22:38:44Z
401715428101965901,101965901,Lost Ball Turnover,Noah Robledo Turnover.,30,38,1st Half,3:40,False,171,2024-12-30T22:39:05Z
401715428101965902,101965902,Steal,Jamichael Davis Steal.,30,38,1st Half,3:40,False,164,2024-12-30T22:39:05Z
401715428101966201,101966201,DunkShot,Jamichael Davis made Dunk.,30,40,1st Half,3:37,True,164,2024-12-30T22:39:05Z
401715428101966801,101966801,Lost Ball Turnover,Avery Brown Turnover.,30,40,1st Half,3:31,False,171,2024-12-30T22:39:07Z
401715428101966802,101966802,Steal,Jamichael Davis Steal.,30,40,1st Half,3:31,False,164,2024-12-30T22:39:12Z
401715428101967501,101967501,JumpShot,Zach Martini missed Three Point Jumper.,30,40,1st Half,3:24,False,164,2024-12-30T22:39:12Z
401715428101967601,101967601,Defensive Rebound,Zine Eddine Bedri Defensive Rebound.,30,40,1st Half,3:23,False,171,2024-12-30T22:39:12Z
401715428101967602,101967602,PersonalFoul,Foul on Emmanuel Ogbole.,30,40,1st Half,3:23,False,164,2024-12-30T22:39:12Z
401715428101967603,101967603,OfficialTVTimeOut, Official TV Timeout,30,40,1st Half,3:23,False,,2024-12-30T22:39:12Z
401715428101968701,101968701,Lost Ball Turnover,Josiah Cunningham Turnover.,30,40,1st Half,3:12,False,171,2024-12-30T22:42:41Z
401715428101968702,101968702,Steal,PJ Hayes IV Steal.,30,40,1st Half,3:12,False,164,2024-12-30T22:42:41Z
401715428101975301,101975301,JumpShot,Jeremiah Williams missed Jumper.,30,40,1st Half,2:46,False,164,2024-12-30T22:42:59Z
401715428101975302,101975302,Offensive Rebound,Jamichael Davis Offensive Rebound.,30,40,1st Half,2:46,False,164,2024-12-30T22:42:59Z
401715428101975303,101975303,PersonalFoul,Foul on Nicolo Romanelli.,30,40,1st Half,2:46,False,171,2024-12-30T22:42:59Z
401715428101975304,101975304,MadeFreeThrow,Jamichael Davis made Free Throw.,30,41,1st Half,2:46,True,164,2024-12-30T22:42:59Z
401715428101975305,101975305,MadeFreeThrow,Jamichael Davis missed Free Throw.,30,41,1st Half,2:46,False,164,2024-12-30T22:42:59Z
401715428101975602,101975602,Defensive Rebound,Zine Eddine Bedri Defensive Rebound.,30,41,1st Half,2:43,False,171,2024-12-30T22:44:48Z
401715428101978301,101978301,JumpShot,Nicolo Romanelli made Three Point Jumper. Assisted by Geronimo Rubio De La Rosa.,33,41,1st Half,2:16,True,171,2024-12-30T22:44:24Z
401715428101984301,101984301,JumpShot,PJ Hayes IV missed Three Point Jumper.,33,41,1st Half,1:56,False,164,2024-12-30T22:44:44Z
401715428101984501,101984501,Defensive Rebound,Kenny Noland Defensive Rebound.,33,41,1st Half,1:54,False,171,2024-12-30T22:44:44Z
401715428101985701,101985701,LayUpShot,Zine Eddine Bedri made Layup. Assisted by Geronimo Rubio De La Rosa.,35,41,1st Half,1:42,True,171,2024-12-30T22:44:48Z
401715428101985702,101985702,ShortTimeOut,Rutgers  Timeout,35,41,1st Half,1:42,False,164,2024-12-30T22:44:48Z
401715428101987401,101987401,JumpShot,Ace Bailey missed Three Point Jumper.,35,41,1st Half,1:25,False,164,2024-12-30T22:46:20Z
401715428101987801,101987801,Defensive Rebound,Kenny Noland Defensive Rebound.,35,41,1st Half,1:21,False,171,2024-12-30T22:46:22Z
401715428101988301,101988301,JumpShot,Geronimo Rubio De La Rosa missed Three Point Jumper.,35,41,1st Half,1:16,False,171,2024-12-30T22:46:22Z
401715428101988501,101988501,Defensive Rebound,Ace Bailey Defensive Rebound.,35,41,1st Half,1:14,False,164,2024-12-30T22:46:22Z
401715428101994201,101994201,JumpShot,Jamichael Davis made Three Point Jumper. Assisted by Jeremiah Williams.,35,44,1st Half,0:57,True,164,2024-12-30T22:46:40Z
401715428101996301,101996301,LayUpShot,Zine Eddine Bedri missed Layup.,35,44,1st Half,0:36,False,171,2024-12-30T22:47:00Z
401715428101996302,101996302,Block Shot,Ace Bailey Block.,35,44,1st Half,0:36,False,164,2024-12-30T22:47:18Z
401715428101996601,101996601,Defensive Rebound,Dylan Harper Defensive Rebound.,35,44,1st Half,0:33,False,164,2024-12-30T22:47:18Z
401715428101997401,101997401,JumpShot,Jamichael Davis missed Three Point Jumper.,35,44,1st Half,0:25,False,164,2024-12-30T22:47:20Z
401715428101997701,101997701,Defensive Rebound,Mason Ritter Defensive Rebound.,35,44,1st Half,0:22,False,171,2024-12-30T22:47:20Z
401715428101999601,101999601,LayUpShot,Kenny Noland missed Layup.,35,44,1st Half,0:03,False,171,2024-12-30T22:47:20Z
401715428101999801,101999801,Defensive Rebound,Dylan Harper Defensive Rebound.,35,44,1st Half,0:01,False,164,2024-12-30T22:47:20Z
401715428101999901,101999901,End Period,End of 1st half,35,44,1st Half,0:00,False,,2024-12-30T22:47:20Z
401715428102806401,102806401,LayUpShot,Avery Brown missed Layup.,35,44,2nd Half,19:35,False,171,2024-12-30T23:04:29Z
401715428102806601,102806601,Defensive Rebound,Emmanuel Ogbole Defensive Rebound.,35,44,2nd Half,19:33,False,164,2024-12-30T23:04:29Z
401715428102809301,102809301,JumpShot,Dylan Harper made Three Point Jumper. Assisted by Jamichael Davis.,35,47,2nd Half,19:06,True,164,2024-12-30T23:05:29Z
401715428102815001,102815001,JumpShot,Geronimo Rubio De La Rosa missed Three Point Jumper.,35,47,2nd Half,18:49,False,171,2024-12-30T23:05:48Z
401715428102815002,102815002,Defensive Rebound,Rutgers Defensive Rebound.,35,47,2nd Half,18:49,False,164,2024-12-30T23:05:48Z
401715428102816801,102816801,JumpShot,Ace Bailey missed Three Point Jumper.,35,47,2nd Half,18:31,False,164,2024-12-30T23:06:07Z
401715428102817001,102817001,Defensive Rebound,Avery Brown Defensive Rebound.,35,47,2nd Half,18:29,False,171,2024-12-30T23:06:07Z
401715428102817801,102817801,LayUpShot,Kenny Noland missed Layup.,35,47,2nd Half,18:21,False,171,2024-12-30T23:06:16Z
401715428102818101,102818101,Defensive Rebound,Jeremiah Williams Defensive Rebound.,35,47,2nd Half,18:18,False,164,2024-12-30T23:06:16Z
401715428102819201,102819201,LayUpShot,Jeremiah Williams missed Layup.,35,47,2nd Half,18:07,False,164,2024-12-30T23:06:37Z
401715428102819501,102819501,Defensive Rebound,Geronimo Rubio De La Rosa Defensive Rebound.,35,47,2nd Half,18:04,False,171,2024-12-30T23:06:37Z
401715428102825301,102825301,JumpShot,Blair Thompson made Three Point Jumper. Assisted by Zine Eddine Bedri.,38,47,2nd Half,17:46,True,171,2024-12-30T23:06:59Z
401715428102827901,102827901,JumpShot,Dylan Harper missed Three Point Jumper.,38,47,2nd Half,17:20,False,164,2024-12-30T23:07:51Z
401715428102827902,102827902,Offensive Rebound,Ace Bailey Offensive Rebound.,38,47,2nd Half,17:20,False,164,2024-12-30T23:07:51Z
401715428102827903,102827903,PersonalFoul,Foul on Avery Brown.,38,47,2nd Half,17:20,False,171,2024-12-30T23:07:51Z
401715428102828901,102828901,Lost Ball Turnover,Ace Bailey Turnover.,38,47,2nd Half,17:10,False,164,2024-12-30T23:08:12Z
401715428102828902,102828902,Steal,Blair Thompson Steal.,38,47,2nd Half,17:10,False,171,2024-12-30T23:08:12Z
401715428102834201,102834201,JumpShot,Avery Brown missed Three Point Jumper.,38,47,2nd Half,16:57,False,171,2024-12-30T23:08:35Z
401715428102834501,102834501,Defensive Rebound,Emmanuel Ogbole Defensive Rebound.,38,47,2nd Half,16:54,False,164,2024-12-30T23:08:35Z
401715428102835201,102835201,PersonalFoul,Foul on Blair Thompson.,38,47,2nd Half,16:47,False,171,2024-12-30T23:08:36Z
401715428102836101,102836101,PersonalFoul,Foul on Jake Tavroff.,38,47,2nd Half,16:38,False,171,2024-12-30T23:09:35Z
401715428102836102,102836102,MadeFreeThrow,Jordan Derkack made Free Throw.,38,48,2nd Half,16:38,True,164,2024-12-30T23:09:35Z
401715428102836103,102836103,MadeFreeThrow,Jordan Derkack made Free Throw.,38,49,2nd Half,16:38,True,164,2024-12-30T23:09:35Z
401715428102837801,102837801,LayUpShot,Avery Brown missed Layup.,38,49,2nd Half,16:21,False,171,2024-12-30T23:10:32Z
401715428102838001,102838001,Defensive Rebound,Emmanuel Ogbole Defensive Rebound.,38,49,2nd Half,16:19,False,164,2024-12-30T23:10:32Z
401715428102838101,102838101,Lost Ball Turnover,Dylan Harper Turnover.,38,49,2nd Half,16:18,False,164,2024-12-30T23:10:34Z
401715428102838102,102838102,Steal,Avery Brown Steal.,38,49,2nd Half,16:18,False,171,2024-12-30T23:10:34Z
401715428102838501,102838501,LayUpShot,Avery Brown made Layup.,40,49,2nd Half,16:14,True,171,2024-12-30T23:10:34Z
401715428102839601,102839601,PersonalFoul,Foul on Avery Brown.,40,49,2nd Half,16:03,False,171,2024-12-30T23:11:00Z
401715428102844401,102844401,JumpShot,Ace Bailey made Jumper.,40,51,2nd Half,15:55,True,164,2024-12-30T23:11:30Z
401715428102845301,102845301,PersonalFoul,Foul on Ace Bailey.,40,51,2nd Half,15:46,False,164,2024-12-30T23:11:30Z
401715428102845302,102845302,OfficialTVTimeOut, Official TV Timeout,40,51,2nd Half,15:46,False,,2024-12-30T23:11:30Z
401715428102846401,102846401,JumpShot,Geronimo Rubio De La Rosa made Three Point Jumper. Assisted by Kenny Noland.,43,51,2nd Half,15:35,True,171,2024-12-30T23:14:56Z
401715428102848801,102848801,JumpShot,Jordan Derkack missed Three Point Jumper.,43,51,2nd Half,15:11,False,164,2024-12-30T23:15:10Z
401715428102848802,102848802,Defensive Rebound,Geronimo Rubio De La Rosa Defensive Rebound.,43,51,2nd Half,15:11,False,171,2024-12-30T23:15:10Z
401715428102848803,102848803,PersonalFoul,Foul on Ace Bailey.,43,51,2nd Half,15:11,False,164,2024-12-30T23:15:10Z
401715428102855101,102855101,JumpShot,Nicolo Romanelli missed Three Point Jumper.,43,51,2nd Half,14:48,False,171,2024-12-30T23:16:01Z
401715428102855301,102855301,Defensive Rebound,Jamichael Davis Defensive Rebound.,43,51,2nd Half,14:46,False,164,2024-12-30T23:16:01Z
401715428102856501,102856501,JumpShot,Dylan Harper made Three Point Jumper. Assisted by Jamichael Davis.,43,54,2nd Half,14:34,True,164,2024-12-30T23:16:25Z
401715428102858901,102858901,JumpShot,Kenny Noland missed Jumper.,43,54,2nd Half,14:10,False,171,2024-12-30T23:16:46Z
401715428102859201,102859201,Offensive Rebound,Zine Eddine Bedri Offensive Rebound.,43,54,2nd Half,14:07,False,171,2024-12-30T23:16:47Z
401715428102859202,102859202,JumpShot,Kenny Noland made Three Point Jumper. Assisted by Zine Eddine Bedri.,46,54,2nd Half,14:07,True,171,2024-12-30T23:16:47Z
401715428102859203,102859203,ShortTimeOut,Columbia  Timeout,46,54,2nd Half,14:07,False,171,2024-12-30T23:16:47Z
401715428102859204,102859204,OfficialTVTimeOut, Official TV Timeout,46,54,2nd Half,14:07,False,,2024-12-30T23:16:47Z
401715428102865501,102865501,LayUpShot,Dylan Harper made Layup. Assisted by Jamichael Davis.,46,56,2nd Half,13:44,True,164,2024-12-30T23:20:12Z
401715428102866901,102866901,Lost Ball Turnover,Geronimo Rubio De La Rosa Turnover.,46,56,2nd Half,13:30,False,171,2024-12-30T23:20:25Z
401715428102866902,102866902,Steal,Dylan Harper Steal.,46,56,2nd Half,13:30,False,164,2024-12-30T23:20:28Z
401715428102867301,102867301,LayUpShot,Dylan Harper made Layup.,46,58,2nd Half,13:26,True,164,2024-12-30T23:20:28Z
401715428102868601,102868601,Lost Ball Turnover,Jake Tavroff Turnover.,46,58,2nd Half,13:13,False,171,2024-12-30T23:20:57Z
401715428102868602,102868602,Steal,Dylan Harper Steal.,46,58,2nd Half,13:13,False,164,2024-12-30T23:20:57Z
401715428102869101,102869101,LayUpShot,Ace Bailey missed Layup.,46,58,2nd Half,13:08,False,164,2024-12-30T23:20:58Z
