play_id,sequence_number,type,description,away_score,home_score,period,clock,scoring_play,team_id,timestamp_utc
401714569101806001,101806001,LayUpShot,Tyson Brown missed Layup.,0,0,1st Half,19:39,False,290,2025-01-25T20:03:40Z
401714569101806101,101806101,Offensive Rebound,Georgia Southern Offensive Rebound.,0,0,1st Half,19:38,False,290,2025-01-25T20:03:40Z
401714569101806601,101806601,JumpShot,Nate Brafford made Three Point Jumper. Assisted by Adante' Holiman.,0,3,1st Half,19:33,True,290,2025-01-25T20:04:10Z
401714569101808701,101808701,LayUpShot,Obinna Anochili-Killen missed Layup.,0,3,1st Half,19:12,False,276,2025-01-25T20:04:29Z
401714569101808702,101808702,Block Shot,Nate Brafford Block.,0,3,1st Half,19:12,False,290,2025-01-25T20:04:29Z
401714569101809901,101809901,Defensive Rebound,Braylhan Thomas Defensive Rebound.,0,3,1st Half,19:00,False,290,2025-01-25T20:04:41Z
401714569101815001,101815001,PersonalFoul,Foul on Tyson Brown.,0,3,1st Half,18:49,False,290,2025-01-25T20:04:51Z
401714569101815002,101815002,Lost Ball Turnover,Tyson Brown Turnover.,0,3,1st Half,18:49,False,290,2025-01-25T20:04:51Z
401714569101816401,101816401,JumpShot,Obinna Anochili-Killen missed Jumper.,0,3,1st Half,18:35,False,276,2025-01-25T20:05:24Z
401714569101816801,101816801,Defensive Rebound,Tyson Brown Defensive Rebound.,0,3,1st Half,18:31,False,290,2025-01-25T20:05:28Z
401714569101818001,101818001,PersonalFoul,Foul on Mikal Dawson.,0,3,1st Half,18:19,False,276,2025-01-25T20:05:43Z
401714569101819101,101819101,LayUpShot,Braylhan Thomas missed Layup.,0,3,1st Half,18:08,False,290,2025-01-25T20:06:21Z
401714569101819401,101819401,Defensive Rebound,Obinna Anochili-Killen Defensive Rebound.,0,3,1st Half,18:05,False,276,2025-01-25T20:06:24Z
401714569101825001,101825001,JumpShot,Dezayne Mingo missed Three Point Jumper.,0,3,1st Half,17:49,False,276,2025-01-25T20:06:41Z
401714569101825301,101825301,Defensive Rebound,Tyson Brown Defensive Rebound.,0,3,1st Half,17:46,False,290,2025-01-25T20:06:43Z
401714569101826301,101826301,Lost Ball Turnover,Adante' Holiman Turnover.,0,3,1st Half,17:36,False,290,2025-01-25T20:06:53Z
401714569101826302,101826302,Steal,Nate Martin Steal.,0,3,1st Half,17:36,False,276,2025-01-25T20:06:53Z
401714569101828001,101828001,PersonalFoul,Foul on Obinna Anochili-Killen.,0,3,1st Half,17:19,False,276,2025-01-25T20:07:45Z
401714569101828002,101828002,Lost Ball Turnover,Obinna Anochili-Killen Turnover.,0,3,1st Half,17:19,False,276,2025-01-25T20:07:45Z
401714569101828801,101828801,LayUpShot,Adante' Holiman made Layup.,0,5,1st Half,17:11,True,290,2025-01-25T20:08:09Z
401714569101828802,101828802,PersonalFoul,Foul on Jalen Speer.,0,5,1st Half,17:11,False,276,2025-01-25T20:08:23Z
401714569101828803,101828803,MadeFreeThrow,Adante' Holiman made Free Throw.,0,6,1st Half,17:11,True,290,2025-01-25T20:08:23Z
401714569101835201,101835201,JumpShot,Jalen Speer made Jumper.,2,6,1st Half,16:47,True,276,2025-01-25T20:09:16Z
401714569101836301,101836301,PersonalFoul,Foul on Nate Brafford.,2,6,1st Half,16:36,False,290,2025-01-25T20:09:25Z
401714569101836302,101836302,Lost Ball Turnover,Nate Brafford Turnover.,2,6,1st Half,16:36,False,290,2025-01-25T20:09:25Z
401714569101838301,101838301,PersonalFoul,Foul on Obinna Anochili-Killen.,2,6,1st Half,16:16,False,276,2025-01-25T20:10:01Z
401714569101838302,101838302,Lost Ball Turnover,Obinna Anochili-Killen Turnover.,2,6,1st Half,16:16,False,276,2025-01-25T20:10:01Z
401714569101839501,101839501,JumpShot,Adante' Holiman made Three Point Jumper.,2,9,1st Half,16:04,True,290,2025-01-25T20:10:37Z
401714569101844701,101844701,LayUpShot,Nate Martin made Layup.,4,9,1st Half,15:52,True,276,2025-01-25T20:10:49Z
401714569101847601,101847601,LayUpShot,Tyson Brown made Layup. Assisted by Adante' Holiman.,4,11,1st Half,15:23,True,290,2025-01-25T20:11:19Z
401714569101849501,101849501,JumpShot,Jalen Speer missed Jumper.,4,11,1st Half,15:04,False,276,2025-01-25T20:11:40Z
401714569101849801,101849801,Defensive Rebound,Georgia Southern Defensive Rebound.,4,11,1st Half,15:01,False,290,2025-01-25T20:11:40Z
401714569101849802,101849802,OfficialTVTimeOut, Official TV Timeout,4,11,1st Half,15:01,False,,2025-01-25T20:11:40Z
401714569101855601,101855601,PersonalFoul,Foul on Jalen Speer.,4,11,1st Half,14:43,False,276,2025-01-25T20:14:34Z
401714569101855602,101855602,MadeFreeThrow,Eren Banks made Free Throw.,4,12,1st Half,14:43,True,290,2025-01-25T20:15:02Z
401714569101855603,101855603,MadeFreeThrow,Eren Banks made Free Throw.,4,13,1st Half,14:43,True,290,2025-01-25T20:15:02Z
401714569101857501,101857501,JumpShot,Dezayne Mingo missed Jumper.,4,13,1st Half,14:24,False,276,2025-01-25T20:15:53Z
401714569101857901,101857901,Offensive Rebound,Nate Martin Offensive Rebound.,4,13,1st Half,14:20,False,276,2025-01-25T20:15:53Z
401714569101858201,101858201,JumpShot,Dezayne Mingo missed Three Point Jumper.,4,13,1st Half,14:17,False,276,2025-01-25T20:16:02Z
401714569101858901,101858901,Defensive Rebound,Bradley Douglas Defensive Rebound.,4,13,1st Half,14:10,False,290,2025-01-25T20:16:07Z
401714569101858902,101858902,Lost Ball Turnover,Avantae Parker Turnover.,4,13,1st Half,14:10,False,290,2025-01-25T20:16:07Z
401714569101864201,101864201,LayUpShot,Jakob Gibbs missed Layup.,4,13,1st Half,13:57,False,276,2025-01-25T20:16:50Z
401714569101864202,101864202,Block Shot,Avantae Parker Block.,4,13,1st Half,13:57,False,290,2025-01-25T20:16:50Z
401714569101864301,101864301,Offensive Rebound,Nate Martin Offensive Rebound.,4,13,1st Half,13:56,False,276,2025-01-25T20:16:51Z
401714569101864302,101864302,PersonalFoul,Foul on Avantae Parker.,4,13,1st Half,13:56,False,290,2025-01-25T20:16:51Z
401714569101864901,101864901,JumpShot,Mikal Dawson made Three Point Jumper. Assisted by Cade Gibbs.,7,13,1st Half,13:50,True,276,2025-01-25T20:17:19Z
401714569101867201,101867201,JumpShot,Avantae Parker missed Jumper.,7,13,1st Half,13:27,False,290,2025-01-25T20:17:42Z
401714569101867601,101867601,Defensive Rebound,Nate Martin Defensive Rebound.,7,13,1st Half,13:23,False,276,2025-01-25T20:17:46Z
401714569101867901,101867901,PersonalFoul,Foul on Avantae Parker.,7,13,1st Half,13:20,False,290,2025-01-25T20:17:48Z
401714569101869201,101869201,LayUpShot,Cade Gibbs made Layup. Assisted by Dezayne Mingo.,9,13,1st Half,13:07,True,276,2025-01-25T20:18:32Z
401714569101874101,101874101,PersonalFoul,Foul on Cade Gibbs.,9,13,1st Half,12:58,False,276,2025-01-25T20:18:38Z
401714569101875101,101875101,LayUpShot,Bradley Douglas missed Layup.,9,13,1st Half,12:48,False,290,2025-01-25T20:19:26Z
401714569101875401,101875401,Offensive Rebound,Eugene Brown III Offensive Rebound.,9,13,1st Half,12:45,False,290,2025-01-25T20:19:28Z
401714569101875501,101875501,JumpShot,Eugene Brown III missed Jumper.,9,13,1st Half,12:44,False,290,2025-01-25T20:19:28Z
401714569101875502,101875502,Block Shot,Wyatt Fricks Block.,9,13,1st Half,12:44,False,276,2025-01-25T20:19:28Z
401714569101875503,101875503,Defensive Rebound,Marshall Defensive Rebound.,9,13,1st Half,12:44,False,276,2025-01-25T20:19:28Z
401714569101876701,101876701,LayUpShot,Cade Gibbs made Layup. Assisted by Dezayne Mingo.,11,13,1st Half,12:32,True,276,2025-01-25T20:19:55Z
401714569101878501,101878501,JumpShot,Bradley Douglas missed Three Point Jumper.,11,13,1st Half,12:14,False,290,2025-01-25T20:20:15Z
401714569101879101,101879101,Defensive Rebound,Mikal Dawson Defensive Rebound.,11,13,1st Half,12:08,False,276,2025-01-25T20:20:18Z
401714569101879501,101879501,PersonalFoul,Foul on Bradley Douglas.,11,13,1st Half,12:04,False,290,2025-01-25T20:20:28Z
401714569101879502,101879502,MadeFreeThrow,Jakob Gibbs missed Free Throw.,11,13,1st Half,12:04,False,276,2025-01-25T20:20:28Z
401714569101879503,101879503,Dead Ball Rebound,Marshall Deadball Team Rebound.,11,13,1st Half,12:04,False,276,2025-01-25T20:20:28Z
401714569101879504,101879504,MadeFreeThrow,Jakob Gibbs made Free Throw.,12,13,1st Half,12:04,True,276,2025-01-25T20:20:28Z
401714569101885001,101885001,JumpShot,Nakavieon White missed Three Point Jumper.,12,13,1st Half,11:49,False,290,2025-01-25T20:21:33Z
401714569101885401,101885401,Defensive Rebound,Kai Spears Defensive Rebound.,12,13,1st Half,11:45,False,276,2025-01-25T20:21:36Z
401714569101887301,101887301,JumpShot,Mikal Dawson missed Three Point Jumper.,12,13,1st Half,11:26,False,276,2025-01-25T20:21:56Z
401714569101887701,101887701,Defensive Rebound,Collin Kuhl Defensive Rebound.,12,13,1st Half,11:22,False,290,2025-01-25T20:21:59Z
401714569101888101,101888101,PersonalFoul,Foul on Wyatt Fricks.,12,13,1st Half,11:18,False,276,2025-01-25T20:22:03Z
401714569101888102,101888102,OfficialTVTimeOut, Official TV Timeout,12,13,1st Half,11:18,False,,2025-01-25T20:22:03Z
401714569101888103,101888103,MadeFreeThrow,Bradley Douglas missed Free Throw.,12,13,1st Half,11:18,False,290,2025-01-25T20:22:03Z
401714569101888104,101888104,Dead Ball Rebound,Georgia Southern Deadball Team Rebound.,12,13,1st Half,11:18,False,290,2025-01-25T20:22:03Z
401714569101888105,101888105,MadeFreeThrow,Bradley Douglas missed Free Throw.,12,13,1st Half,11:18,False,290,2025-01-25T20:22:03Z
401714569101888201,101888201,Defensive Rebound,Mikal Dawson Defensive Rebound.,12,13,1st Half,11:17,False,276,2025-01-25T20:25:00Z
401714569101889501,101889501,Lost Ball Turnover,Kai Spears Turnover.,12,13,1st Half,11:04,False,276,2025-01-25T20:27:02Z
401714569101889502,101889502,Steal,Adante' Holiman Steal.,12,13,1st Half,11:04,False,290,2025-01-25T20:27:04Z
401714569101894401,101894401,LayUpShot,Adante' Holiman made Layup.,12,15,1st Half,10:55,True,290,2025-01-25T20:25:48Z
401714569101895701,101895701,PersonalFoul,Foul on Cade Gibbs.,12,15,1st Half,10:42,False,276,2025-01-25T20:26:02Z
401714569101895702,101895702,Lost Ball Turnover,Cade Gibbs Turnover.,12,15,1st Half,10:42,False,276,2025-01-25T20:26:02Z
401714569101897101,101897101,Lost Ball Turnover,Adante' Holiman Turnover.,12,15,1st Half,10:28,False,290,2025-01-25T20:26:36Z
401714569101898701,101898701,PersonalFoul,Foul on Eren Banks.,12,15,1st Half,10:12,False,290,2025-01-25T20:27:06Z
401714569101898702,101898702,MadeFreeThrow,Jakob Gibbs made Free Throw.,13,15,1st Half,10:12,True,276,2025-01-25T20:27:06Z
401714569101898703,101898703,MadeFreeThrow,Jakob Gibbs made Free Throw.,14,15,1st Half,10:12,True,276,2025-01-25T20:27:06Z
401714569101904501,101904501,JumpShot,Eren Banks missed Jumper.,14,15,1st Half,9:54,False,290,2025-01-25T20:28:08Z
401714569101904502,101904502,Block Shot,Nate Martin Block.,14,15,1st Half,9:54,False,276,2025-01-25T20:28:13Z
401714569101905001,101905001,Defensive Rebound,Wyatt Fricks Defensive Rebound.,14,15,1st Half,9:49,False,276,2025-01-25T20:28:13Z
401714569101907401,101907401,LayUpShot,Dezayne Mingo missed Layup.,14,15,1st Half,9:25,False,276,2025-01-25T20:30:51Z
401714569101907701,101907701,Defensive Rebound,Bradley Douglas Defensive Rebound.,14,15,1st Half,9:22,False,290,2025-01-25T20:28:53Z
401714569101907702,101907702,LayUpShot,Tyson Brown missed Layup.,14,15,1st Half,9:22,False,290,2025-01-25T20:28:53Z
401714569101908101,101908101,Defensive Rebound,Nate Martin Defensive Rebound.,14,15,1st Half,9:18,False,276,2025-01-25T20:28:57Z
401714569101908701,101908701,JumpShot,Mikal Dawson missed Three Point Jumper.,14,15,1st Half,9:12,False,276,2025-01-25T20:29:22Z
401714569101908901,101908901,Defensive Rebound,Bradley Douglas Defensive Rebound.,14,15,1st Half,9:10,False,290,2025-01-25T20:29:25Z
401714569101909801,101909801,LayUpShot,Tyson Brown missed Layup.,14,15,1st Half,9:01,False,290,2025-01-25T20:29:35Z
401714569101914001,101914001,Offensive Rebound,Georgia Southern Offensive Rebound.,14,15,1st Half,8:59,False,290,2025-01-25T20:29:35Z
401714569101914002,101914002,PersonalFoul,Foul on Dezayne Mingo.,14,15,1st Half,8:59,False,276,2025-01-25T20:29:35Z
401714569101914003,101914003,MadeFreeThrow,Tyson Brown made Free Throw.,14,16,1st Half,8:59,True,290,2025-01-25T20:29:35Z
401714569101914004,101914004,MadeFreeThrow,Tyson Brown missed Free Throw.,14,16,1st Half,8:59,False,290,2025-01-25T20:30:31Z
401714569101914101,101914101,Defensive Rebound,Dezayne Mingo Defensive Rebound.,14,16,1st Half,8:58,False,276,2025-01-25T20:30:33Z
401714569101916501,101916501,Lost Ball Turnover,Nate Martin Turnover.,14,16,1st Half,8:34,False,276,2025-01-25T20:31:13Z
401714569101918401,101918401,PersonalFoul,Foul on Wyatt Fricks.,14,16,1st Half,8:15,False,276,2025-01-25T20:31:44Z
401714569101918402,101918402,MadeFreeThrow,Tyson Brown missed Free Throw.,14,16,1st Half,8:15,False,290,2025-01-25T20:31:44Z
401714569101918403,101918403,Dead Ball Rebound,Georgia Southern Deadball Team Rebound.,14,16,1st Half,8:15,False,290,2025-01-25T20:31:44Z
401714569101918404,101918404,MadeFreeThrow,Tyson Brown missed Free Throw.,14,16,1st Half,8:15,False,290,2025-01-25T20:32:36Z
401714569101918601,101918601,Defensive Rebound,Nate Martin Defensive Rebound.,14,16,1st Half,8:13,False,276,2025-01-25T20:32:37Z
401714569101919001,101919001,JumpShot,Mikal Dawson missed Three Point Jumper.,14,16,1st Half,8:09,False,276,2025-01-25T20:32:42Z
401714569101919201,101919201,Offensive Rebound,Jakob Gibbs Offensive Rebound.,14,16,1st Half,8:07,False,276,2025-01-25T20:32:45Z
401714569101919202,101919202,PersonalFoul,Foul on Tyson Brown.,14,16,1st Half,8:07,False,290,2025-01-25T20:32:45Z
401714569101919203,101919203,MadeFreeThrow,Jakob Gibbs made Free Throw.,15,16,1st Half,8:07,True,276,2025-01-25T20:32:45Z
401714569101919204,101919204,MadeFreeThrow,Jakob Gibbs made Free Throw.,16,16,1st Half,8:07,True,276,2025-01-25T20:32:45Z
401714569101924601,101924601,PersonalFoul,Foul on Collin Kuhl.,16,16,1st Half,7:53,False,290,2025-01-25T20:33:51Z
401714569101924602,101924602,Lost Ball Turnover,Collin Kuhl Turnover.,16,16,1st Half,7:53,False,290,2025-01-25T20:33:51Z
401714569101924603,101924603,OfficialTVTimeOut, Official TV Timeout,16,16,1st Half,7:53,False,,2025-01-25T20:33:51Z
401714569101926601,101926601,JumpShot,Nate Martin made Jumper.,18,16,1st Half,7:33,True,276,2025-01-25T20:37:11Z
401714569101928501,101928501,JumpShot,Adante' Holiman missed Three Point Jumper.,18,16,1st Half,7:14,False,290,2025-01-25T20:37:30Z
401714569101928801,101928801,Offensive Rebound,Nate Brafford Offensive Rebound.,18,16,1st Half,7:11,False,290,2025-01-25T20:37:34Z
401714569101929001,101929001,JumpShot,Eren Banks made Three Point Jumper. Assisted by Braylhan Thomas.,18,19,1st Half,7:09,True,290,2025-01-25T20:37:36Z
401714569101934901,101934901,PersonalFoul,Foul on Braylhan Thomas.,18,19,1st Half,6:50,False,290,2025-01-25T20:37:53Z
401714569101935001,101935001,MadeFreeThrow,Nate Martin missed Free Throw.,18,19,1st Half,6:49,False,276,2025-01-25T20:38:24Z
401714569101935201,101935201,Offensive Rebound,Wyatt Fricks Offensive Rebound.,18,19,1st Half,6:47,False,276,2025-01-25T20:38:24Z
401714569101936301,101936301,PersonalFoul,Foul on Adante' Holiman.,18,19,1st Half,6:36,False,290,2025-01-25T20:38:36Z
401714569101936302,101936302,MadeFreeThrow,Jakob Gibbs made Free Throw.,19,19,1st Half,6:36,True,276,2025-01-25T20:38:36Z
401714569101936303,101936303,MadeFreeThrow,Jakob Gibbs made Free Throw.,20,19,1st Half,6:36,True,276,2025-01-25T20:38:36Z
401714569101937201,101937201,LayUpShot,Eren Banks missed Layup.,20,19,1st Half,6:27,False,290,2025-01-25T20:39:31Z
401714569101937501,101937501,Offensive Rebound,Nate Brafford Offensive Rebound.,20,19,1st Half,6:24,False,290,2025-01-25T20:39:34Z
401714569101938301,101938301,JumpShot,Braylhan Thomas missed Three Point Jumper.,20,19,1st Half,6:16,False,290,2025-01-25T20:39:42Z
401714569101938601,101938601,Defensive Rebound,Wyatt Fricks Defensive Rebound.,20,19,1st Half,6:13,False,276,2025-01-25T20:39:48Z
401714569101939601,101939601,JumpShot,Mikal Dawson missed Three Point Jumper.,20,19,1st Half,6:03,False,276,2025-01-25T20:39:55Z
401714569101944001,101944001,Defensive Rebound,Adante' Holiman Defensive Rebound.,20,19,1st Half,5:59,False,290,2025-01-25T20:39:59Z
401714569101944201,101944201,JumpShot,Adante' Holiman missed Three Point Jumper.,20,19,1st Half,5:57,False,290,2025-01-25T20:40:03Z
401714569101944401,101944401,Defensive Rebound,Marshall Defensive Rebound.,20,19,1st Half,5:55,False,276,2025-01-25T20:40:03Z
401714569101944402,101944402,PersonalFoul,Foul on Nate Brafford.,20,19,1st Half,5:55,False,290,2025-01-25T20:40:03Z
401714569101944403,101944403,MadeFreeThrow,Wyatt Fricks made Free Throw.,21,19,1st Half,5:55,True,276,2025-01-25T20:40:29Z
401714569101944404,101944404,MadeFreeThrow,Wyatt Fricks made Free Throw.,22,19,1st Half,5:55,True,276,2025-01-25T20:40:29Z
401714569101946201,101946201,JumpShot,Avantae Parker missed Three Point Jumper.,22,19,1st Half,5:37,False,290,2025-01-25T20:41:28Z
401714569101946501,101946501,Defensive Rebound,Jakob Gibbs Defensive Rebound.,22,19,1st Half,5:34,False,276,2025-01-25T20:41:31Z
401714569101947101,101947101,PersonalFoul,Foul on Avantae Parker.,22,19,1st Half,5:28,False,290,2025-01-25T20:41:36Z
401714569101947102,101947102,MadeFreeThrow,Nate Martin made Free Throw.,23,19,1st Half,5:28,True,276,2025-01-25T20:41:36Z
401714569101947103,101947103,MadeFreeThrow,Nate Martin made Free Throw.,24,19,1st Half,5:28,True,276,2025-01-25T20:42:22Z
401714569101948501,101948501,LayUpShot,Adante' Holiman missed Layup.,24,19,1st Half,5:14,False,290,2025-01-25T20:42:57Z
401714569101948801,101948801,Offensive Rebound,Collin Kuhl Offensive Rebound.,24,19,1st Half,5:11,False,290,2025-01-25T20:43:01Z
401714569101948802,101948802,Lost Ball Turnover,Collin Kuhl Turnover.,24,19,1st Half,5:11,False,290,2025-01-25T20:43:23Z
401714569101948803,101948803,Steal,Wyatt Fricks Steal.,24,19,1st Half,5:11,False,276,2025-01-25T20:43:23Z
401714569101955601,101955601,PersonalFoul,Foul on Collin Kuhl.,24,19,1st Half,4:43,False,290,2025-01-25T20:44:03Z
401714569101955602,101955602,MadeFreeThrow,Nate Martin made Free Throw.,25,19,1st Half,4:43,True,276,2025-01-25T20:44:32Z
401714569101955603,101955603,MadeFreeThrow,Nate Martin made Free Throw.,26,19,1st Half,4:43,True,276,2025-01-25T20:44:32Z
401714569101957101,101957101,JumpShot,Adante' Holiman made Three Point Jumper. Assisted by Bradley Douglas.,26,22,1st Half,4:28,True,290,2025-01-25T20:45:04Z
401714569101958801,101958801,JumpShot,Kai Spears made Three Point Jumper. Assisted by Mikal Dawson.,29,22,1st Half,4:11,True,276,2025-01-25T20:45:23Z
401714569101964101,101964101,JumpShot,Adante' Holiman made Three Point Jumper.,29,25,1st Half,3:58,True,290,2025-01-25T20:45:34Z
401714569101965501,101965501,PersonalFoul,Foul on Collin Kuhl.,29,25,1st Half,3:44,False,290,2025-01-25T20:45:47Z
401714569101965502,101965502,OfficialTVTimeOut, Official TV Timeout,29,25,1st Half,3:44,False,,2025-01-25T20:45:47Z
401714569101965503,101965503,MadeFreeThrow,Nate Martin missed Free Throw.,29,25,1st Half,3:44,False,276,2025-01-25T20:45:47Z
401714569101965504,101965504,Dead Ball Rebound,Marshall Deadball Team Rebound.,29,25,1st Half,3:44,False,276,2025-01-25T20:45:47Z
401714569101965601,101965601,MadeFreeThrow,Nate Martin missed Free Throw.,29,25,1st Half,3:43,False,276,2025-01-25T20:48:53Z
401714569101965701,101965701,Defensive Rebound,Tyson Brown Defensive Rebound.,29,25,1st Half,3:42,False,290,2025-01-25T20:48:53Z
401714569101967101,101967101,JumpShot,Adante' Holiman missed Three Point Jumper.,29,25,1st Half,3:28,False,290,2025-01-25T20:49:08Z
401714569101967401,101967401,Defensive Rebound,Wyatt Fricks Defensive Rebound.,29,25,1st Half,3:25,False,276,2025-01-25T20:49:12Z
401714569101968801,101968801,LayUpShot,Mikal Dawson missed Layup.,29,25,1st Half,3:11,False,276,2025-01-25T20:49:26Z
401714569101968802,101968802,Block Shot,Eugene Brown III Block.,29,25,1st Half,3:11,False,290,2025-01-25T20:49:26Z
401714569101969301,101969301,Defensive Rebound,Nakavieon White Defensive Rebound.,29,25,1st Half,3:06,False,290,2025-01-25T20:49:29Z
401714569101969601,101969601,LayUpShot,Nakavieon White missed Layup.,29,25,1st Half,3:03,False,290,2025-01-25T20:49:34Z
401714569101969801,101969801,Offensive Rebound,Tyson Brown Offensive Rebound.,29,25,1st Half,3:01,False,290,2025-01-25T20:49:34Z
401714569101969901,101969901,LayUpShot,Tyson Brown missed Layup.,29,25,1st Half,3:00,False,290,2025-01-25T20:49:34Z
401714569101969902,101969902,Block Shot,Wyatt Fricks Block.,29,25,1st Half,3:00,False,276,2025-01-25T20:49:34Z
401714569101974602,101974602,Lost Ball Turnover,Nate Martin Turnover.,29,25,1st Half,2:53,False,276,2025-01-25T20:49:41Z
401714569101974603,101974603,Defensive Rebound,Kai Spears Defensive Rebound.,29,25,1st Half,2:53,False,276,2025-01-25T20:49:41Z
401714569101975801,101975801,LayUpShot,Adante' Holiman made Layup.,29,27,1st Half,2:41,True,290,2025-01-25T20:50:25Z
401714569101977201,101977201,Technical Foul,Technical Foul on Dezayne Mingo.,29,27,1st Half,2:27,False,276,2025-01-25T20:51:21Z
401714569101977202,101977202,Lost Ball Turnover,Dezayne Mingo Turnover.,29,27,1st Half,2:27,False,276,2025-01-25T20:51:21Z
401714569101977203,101977203,MadeFreeThrow,Adante' Holiman made Free Throw.,29,28,1st Half,2:27,True,290,2025-01-25T20:51:21Z
401714569101977204,101977204,MadeFreeThrow,Adante' Holiman made Free Throw.,29,29,1st Half,2:27,True,290,2025-01-25T20:51:21Z
401714569101977205,101977205,PersonalFoul,Foul on Adante' Holiman.,29,29,1st Half,2:27,False,290,2025-01-25T20:51:21Z
401714569101977206,101977206,MadeFreeThrow,Dezayne Mingo made Free Throw.,30,29,1st Half,2:27,True,276,2025-01-25T20:51:21Z
401714569101977207,101977207,MadeFreeThrow,Dezayne Mingo made Free Throw.,31,29,1st Half,2:27,True,276,2025-01-25T20:51:21Z
401714569101978301,101978301,PersonalFoul,Foul on Nate Martin.,31,29,1st Half,2:16,False,276,2025-01-25T20:52:54Z
401714569101978302,101978302,MadeFreeThrow,Tyson Brown missed Free Throw.,31,29,1st Half,2:16,False,290,2025-01-25T20:52:54Z
401714569101978303,101978303,Dead Ball Rebound,Georgia Southern Deadball Team Rebound.,31,29,1st Half,2:16,False,290,2025-01-25T20:52:54Z
401714569101978401,101978401,MadeFreeThrow,Tyson Brown missed Free Throw.,31,29,1st Half,2:15,False,290,2025-01-25T20:53:51Z
401714569101978402,101978402,Dead Ball Rebound,Georgia Southern Deadball Team Rebound.,31,29,1st Half,2:15,False,290,2025-01-25T20:53:51Z
401714569101978403,101978403,PersonalFoul,Foul on Nate Martin.,31,29,1st Half,2:15,False,276,2025-01-25T20:53:51Z
401714569101978404,101978404,MadeFreeThrow,Nakavieon White made Free Throw.,31,30,1st Half,2:15,True,290,2025-01-25T20:53:51Z
401714569101978405,101978405,MadeFreeThrow,Nakavieon White made Free Throw.,31,31,1st Half,2:15,True,290,2025-01-25T20:53:51Z
401714569101985001,101985001,JumpShot,Dezayne Mingo missed Jumper.,31,31,1st Half,1:49,False,276,2025-01-25T20:54:59Z
401714569101985301,101985301,Defensive Rebound,Bradley Douglas Defensive Rebound.,31,31,1st Half,1:46,False,290,2025-01-25T20:55:04Z
401714569101985701,101985701,JumpShot,Bradley Douglas made Three Point Jumper.,31,34,1st Half,1:42,True,290,2025-01-25T20:55:07Z
401714569101987201,101987201,DunkShot,Nate Martin made Dunk. Assisted by Dezayne Mingo.,33,34,1st Half,1:27,True,276,2025-01-25T20:55:21Z
401714569101989801,101989801,JumpShot,Eugene Brown III made Three Point Jumper. Assisted by Tyson Brown.,33,37,1st Half,1:01,True,290,2025-01-25T20:55:50Z
401714569101995101,101995101,PersonalFoul,Foul on Bradley Douglas.,33,37,1st Half,0:48,False,290,2025-01-25T20:56:04Z
401714569101995102,101995102,MadeFreeThrow,Dezayne Mingo made Free Throw.,34,37,1st Half,0:48,True,276,2025-01-25T20:56:04Z
401714569101995103,101995103,MadeFreeThrow,Dezayne Mingo made Free Throw.,35,37,1st Half,0:48,True,276,2025-01-25T20:56:04Z
401714569101995501,101995501,ShortTimeOut,Georgia Southern  Timeout,35,37,1st Half,0:44,False,290,2025-01-25T20:56:57Z
401714569101996801,101996801,Lost Ball Turnover,Eugene Brown III Turnover.,35,37,1st Half,0:31,False,290,2025-01-25T20:58:18Z
401714569101999701,101999701,JumpShot,Dezayne Mingo missed Jumper.,35,37,1st Half,0:02,False,276,2025-01-25T20:58:18Z
401714569101999902,101999902,Defensive Rebound,Georgia Southern Defensive Rebound.,35,37,1st Half,0:00,False,290,2025-01-25T20:58:18Z
401714569101999901,101999901,End Period,End of 1st half,35,37,1st Half,0:00,False,,2025-01-25T20:58:18Z
401714569102805001,102805001,LayUpShot,Nate Martin missed Layup.,35,37,2nd Half,19:49,False,276,
401714569102805002,102805002,Block Shot,Nate Brafford Block.,35,37,2nd Half,19:49,False,290,
401714569102805003,102805003,Defensive Rebound,Georgia Southern Defensive Rebound.,35,37,2nd Half,19:49,False,290,
401714569102807301,102807301,JumpShot,Eren Banks missed Jumper.,35,37,2nd Half,19:26,False,290,2025-01-25T21:15:55Z
401714569102807302,102807302,Block Shot,Obinna Anochili-Killen Block.,35,37,2nd Half,19:26,False,276,2025-01-25T21:15:55Z
401714569102807701,102807701,Defensive Rebound,Dezayne Mingo Defensive Rebound.,35,37,2nd Half,19:22,False,276,2025-01-25T21:16:00Z
401714569102808401,102808401,LayUpShot,Obinna Anochili-Killen missed Layup.,35,37,2nd Half,19:15,False,276,2025-01-25T21:16:07Z
401714569102808601,102808601,Defensive Rebound,Braylhan Thomas Defensive Rebound.,35,37,2nd Half,19:13,False,290,2025-01-25T21:16:07Z
401714569102815401,102815401,LayUpShot,Adante' Holiman missed Layup.,35,37,2nd Half,18:45,False,290,2025-01-25T21:16:35Z
401714569102815402,102815402,Block Shot,Nate Martin Block.,35,37,2nd Half,18:45,False,276,2025-01-25T21:16:35Z
401714569102815801,102815801,Defensive Rebound,Mikal Dawson Defensive Rebound.,35,37,2nd Half,18:41,False,276,2025-01-25T21:16:40Z
401714569102816101,102816101,PersonalFoul,Foul on Tyson Brown.,35,37,2nd Half,18:38,False,290,2025-01-25T21:16:41Z
401714569102816102,102816102,MadeFreeThrow,Obinna Anochili-Killen made Free Throw.,36,37,2nd Half,18:38,True,276,2025-01-25T21:17:16Z
401714569102816103,102816103,MadeFreeThrow,Obinna Anochili-Killen made Free Throw.,37,37,2nd Half,18:38,True,276,2025-01-25T21:17:16Z
401714569102818501,102818501,LayUpShot,Adante' Holiman missed Layup.,37,37,2nd Half,18:14,False,290,2025-01-25T21:18:02Z
