play_id,sequence_number,type,description,away_score,home_score,period,clock,scoring_play,team_id,timestamp_utc
401715970102898101,102898101,PersonalFoul,Foul on Julian Mackey.,58,58,2nd Half,10:18,False,2277,2025-01-26T00:17:56Z
401715970102898901,102898901,LayUpShot,James White made Layup. Assisted by JR Jacobs.,58,60,2nd Half,10:10,True,2443,2025-01-26T00:17:56Z
401715970102905201,102905201,JumpShot,Bryson Dawkins missed Three Point Jumper.,58,60,2nd Half,9:47,False,2277,2025-01-26T00:19:12Z
401715970102905601,102905601,Defensive Rebound,Luke Davis Defensive Rebound.,58,60,2nd Half,9:43,False,2443,2025-01-26T00:19:12Z
401715970102906101,102906101,LayUpShot,Jamond Vincent missed Layup.,58,60,2nd Half,9:38,False,2443,2025-01-26T00:19:12Z
401715970102906301,102906301,Defensive Rebound,Julian Mackey Defensive Rebound.,58,60,2nd Half,9:36,False,2277,2025-01-26T00:19:12Z
401715970102906701,102906701,Lost Ball Turnover,Bryson Dawkins Turnover.,58,60,2nd Half,9:32,False,2277,2025-01-26T00:19:12Z
401715970102906702,102906702,Steal,James White Steal.,58,60,2nd Half,9:32,False,2443,2025-01-26T00:19:12Z
401715970102908601,102908601,JumpShot,Dae Dae Hunter missed Three Point Jumper.,58,60,2nd Half,9:13,False,2443,2025-01-26T00:19:12Z
401715970102908801,102908801,Defensive Rebound,Pierce Bazil Defensive Rebound.,58,60,2nd Half,9:11,False,2277,2025-01-26T00:19:12Z
401715970102909601,102909601,JumpShot,Porter Bazil missed Three Point Jumper.,58,60,2nd Half,9:03,False,2277,2025-01-26T00:19:27Z
401715970102909701,102909701,Dead Ball Rebound,Houston Christian Deadball Team Rebound.,58,60,2nd Half,9:02,False,2277,2025-01-26T00:19:27Z
401715970102914401,102914401,PersonalFoul,Foul on James White.,58,60,2nd Half,8:55,False,2443,2025-01-26T00:20:09Z
401715970102914402,102914402,MadeFreeThrow,Elijah Brooks made Free Throw.,59,60,2nd Half,8:55,True,2277,2025-01-26T00:20:09Z
401715970102914403,102914403,MadeFreeThrow,Elijah Brooks made Free Throw.,60,60,2nd Half,8:55,True,2277,2025-01-26T00:20:09Z
401715970102917001,102917001,JumpShot,Luke Davis missed ,60,60,2nd Half,8:29,False,2443,2025-01-26T00:21:30Z
401715970102917301,102917301,Defensive Rebound,Pierce Bazil Defensive Rebound.,60,60,2nd Half,8:26,False,2277,2025-01-26T00:21:30Z
401715970102917601,102917601,LayUpShot,Pierce Bazil missed Layup.,60,60,2nd Half,8:23,False,2277,2025-01-26T00:21:30Z
401715970102917602,102917602,Block Shot,Jamond Vincent Block.,60,60,2nd Half,8:23,False,2443,2025-01-26T00:21:30Z
401715970102917701,102917701,Offensive Rebound,Trent Johnson Offensive Rebound.,60,60,2nd Half,8:22,False,2277,2025-01-26T00:21:30Z
401715970102917702,102917702,LayUpShot,Trent Johnson made Layup.,62,60,2nd Half,8:22,True,2277,2025-01-26T00:21:45Z
401715970102919001,102919001,Lost Ball Turnover,Jah Short Turnover.,62,60,2nd Half,8:09,False,2443,2025-01-26T00:21:58Z
401715970102924301,102924301,JumpShot,Pierce Bazil missed Three Point Jumper.,62,60,2nd Half,7:56,False,2277,2025-01-26T00:23:13Z
401715970102924701,102924701,Offensive Rebound,Peyton Rogers Offensive Rebound.,62,60,2nd Half,7:52,False,2277,2025-01-26T00:23:13Z
401715970102925901,102925901,JumpShot,Julian Mackey missed Three Point Jumper.,62,60,2nd Half,7:40,False,2277,2025-01-26T00:23:13Z
401715970102926201,102926201,Offensive Rebound,Trent Johnson Offensive Rebound.,62,60,2nd Half,7:37,False,2277,2025-01-26T00:23:13Z
401715970102926601,102926601,LayUpShot,Julian Mackey missed Layup.,62,60,2nd Half,7:33,False,2277,2025-01-26T00:23:13Z
401715970102926901,102926901,Defensive Rebound,Luke Davis Defensive Rebound.,62,60,2nd Half,7:30,False,2443,2025-01-26T00:23:13Z
401715970102927201,102927201,PersonalFoul,Foul on Trent Johnson.,62,60,2nd Half,7:27,False,2277,2025-01-26T00:23:13Z
401715970102927202,102927202,OfficialTVTimeOut, Official TV Timeout,62,60,2nd Half,7:27,False,,2025-01-26T00:23:13Z
401715970102927203,102927203,MadeFreeThrow,James White made Free Throw.,62,61,2nd Half,7:27,True,2443,2025-01-26T00:23:13Z
401715970102927204,102927204,MadeFreeThrow,James White made Free Throw.,62,62,2nd Half,7:27,True,2443,2025-01-26T00:23:13Z
401715970102929501,102929501,JumpShot,Trent Johnson made Three Point Jumper. Assisted by Elijah Brooks.,65,62,2nd Half,7:04,True,2277,2025-01-26T00:27:54Z
401715970102935301,102935301,DunkShot,Jah Short missed Dunk.,65,62,2nd Half,6:46,False,2443,2025-01-26T00:27:54Z
401715970102935302,102935302,Block Shot,Peyton Rogers Block.,65,62,2nd Half,6:46,False,2277,2025-01-26T00:27:54Z
401715970102935701,102935701,Defensive Rebound,Bryson Dawkins Defensive Rebound.,65,62,2nd Half,6:42,False,2277,2025-01-26T00:27:54Z
401715970102938001,102938001,JumpShot,Bryson Dawkins made Jumper.,67,62,2nd Half,6:19,True,2277,2025-01-26T00:27:54Z
401715970102944501,102944501,LayUpShot,Jamond Vincent made Layup. Assisted by Jah Short.,67,64,2nd Half,5:54,True,2443,2025-01-26T00:31:28Z
401715970102947401,102947401,JumpShot,Bryson Dawkins made Three Point Jumper.,70,64,2nd Half,5:25,True,2277,2025-01-26T00:31:28Z
401715970102949501,102949501,JumpShot,James White missed Three Point Jumper.,70,64,2nd Half,5:04,False,2443,2025-01-26T00:31:28Z
401715970102949801,102949801,Defensive Rebound,Peyton Rogers Defensive Rebound.,70,64,2nd Half,5:01,False,2277,2025-01-26T00:31:28Z
401715970102954601,102954601,ShortTimeOut,Houston Christian  Timeout,70,64,2nd Half,4:53,False,2277,2025-01-26T00:31:28Z
401715970102954602,102954602,OfficialTVTimeOut, Official TV Timeout,70,64,2nd Half,4:53,False,,2025-01-26T00:31:28Z
401715970102956301,102956301,JumpShot,Bryson Dawkins missed Three Point Jumper.,70,64,2nd Half,4:36,False,2277,2025-01-26T00:31:57Z
401715970102956601,102956601,Defensive Rebound,James White Defensive Rebound.,70,64,2nd Half,4:33,False,2443,2025-01-26T00:31:57Z
401715970102957101,102957101,Lost Ball Turnover,James White Turnover.,70,64,2nd Half,4:28,False,2443,2025-01-26T00:31:57Z
401715970102957102,102957102,Steal,Bryson Dawkins Steal.,70,64,2nd Half,4:28,False,2277,2025-01-26T00:31:57Z
401715970102957501,102957501,PersonalFoul,Foul on MJ Thomas.,70,64,2nd Half,4:24,False,2443,2025-01-26T00:33:54Z
401715970102957502,102957502,OfficialTVTimeOut, Official TV Timeout,70,64,2nd Half,4:24,False,,2025-01-26T00:33:54Z
401715970102957503,102957503,Technical Foul,Technical Foul on MJ Thomas.,70,64,2nd Half,4:24,False,2443,2025-01-26T00:37:30Z
401715970102957504,102957504,MadeFreeThrow,Bryson Dawkins made Free Throw.,71,64,2nd Half,4:24,True,2277,2025-01-26T00:37:30Z
401715970102957505,102957505,MadeFreeThrow,Bryson Dawkins missed Free Throw.,71,64,2nd Half,4:24,False,2277,2025-01-26T00:37:30Z
401715970102957506,102957506,Dead Ball Rebound,Houston Christian Deadball Team Rebound.,71,64,2nd Half,4:24,False,2277,2025-01-26T00:37:30Z
401715970102957507,102957507,Technical Foul,Technical Foul on Trent Johnson.,71,64,2nd Half,4:24,False,2277,2025-01-26T00:37:30Z
401715970102957508,102957508,Lost Ball Turnover,Trent Johnson Turnover.,71,64,2nd Half,4:24,False,2277,2025-01-26T00:37:30Z
401715970102957701,102957701,DunkShot,Bryson Dawkins made Dunk. Assisted by Elijah Brooks.,73,64,2nd Half,4:22,True,2277,2025-01-26T00:38:00Z
401715970102964301,102964301,Lost Ball Turnover,Dae Dae Hunter Turnover.,73,64,2nd Half,3:56,False,2443,2025-01-26T00:39:43Z
401715970102964302,102964302,Steal,Peyton Rogers Steal.,73,64,2nd Half,3:56,False,2277,2025-01-26T00:39:43Z
401715970102966301,102966301,Lost Ball Turnover,Elijah Brooks Turnover.,73,64,2nd Half,3:36,False,2277,2025-01-26T00:39:43Z
401715970102968801,102968801,Lost Ball Turnover,James White Turnover.,73,64,2nd Half,3:11,False,2443,2025-01-26T00:39:43Z
401715970102968802,102968802,Steal,Trent Johnson Steal.,73,64,2nd Half,3:11,False,2277,2025-01-26T00:39:43Z
401715970102974701,102974701,LayUpShot,Bryson Dawkins made Layup. Assisted by Trent Johnson.,75,64,2nd Half,2:52,True,2277,2025-01-26T00:39:43Z
401715970102974702,102974702,PersonalFoul,Foul on Jamond Vincent.,75,64,2nd Half,2:52,False,2443,2025-01-26T00:39:43Z
401715970102974703,102974703,MadeFreeThrow,Bryson Dawkins made Free Throw.,76,64,2nd Half,2:52,True,2277,2025-01-26T00:39:43Z
401715970102976101,102976101,PersonalFoul,Foul on Julian Mackey.,76,64,2nd Half,2:38,False,2277,2025-01-26T00:41:13Z
401715970102976102,102976102,MadeFreeThrow,Dae Dae Hunter made Free Throw.,76,65,2nd Half,2:38,True,2443,2025-01-26T00:41:13Z
401715970102976103,102976103,MadeFreeThrow,Dae Dae Hunter made Free Throw.,76,66,2nd Half,2:38,True,2443,2025-01-26T00:41:13Z
401715970102977401,102977401,DunkShot,Elijah Brooks made Dunk.,78,66,2nd Half,2:25,True,2277,2025-01-26T00:41:28Z
401715970102978501,102978501,PersonalFoul,Foul on Peyton Rogers.,78,66,2nd Half,2:14,False,2277,2025-01-26T00:41:58Z
401715970102978502,102978502,MadeFreeThrow,Dae Dae Hunter made Free Throw.,78,67,2nd Half,2:14,True,2443,2025-01-26T00:41:58Z
401715970102978503,102978503,MadeFreeThrow,Dae Dae Hunter made Free Throw.,78,68,2nd Half,2:14,True,2443,2025-01-26T00:41:58Z
401715970102979401,102979401,ShortTimeOut,Houston Christian  Timeout,78,68,2nd Half,2:05,False,2277,2025-01-26T00:43:57Z
401715970102984701,102984701,Lost Ball Turnover,Elijah Brooks Turnover.,78,68,2nd Half,1:52,False,2277,2025-01-26T00:44:11Z
401715970102984702,102984702,Steal,JR Jacobs Steal.,78,68,2nd Half,1:52,False,2443,2025-01-26T00:44:11Z
401715970102985101,102985101,DunkShot,James White made Dunk. Assisted by Dae Dae Hunter.,78,70,2nd Half,1:48,True,2443,2025-01-26T00:45:12Z
401715970102987101,102987101,LayUpShot,Julian Mackey made Layup.,80,70,2nd Half,1:28,True,2277,2025-01-26T00:45:12Z
401715970102988201,102988201,LayUpShot,James White made Layup.,80,72,2nd Half,1:17,True,2443,2025-01-26T00:45:12Z
401715970102989001,102989001,DunkShot,Peyton Rogers made Dunk. Assisted by Trent Johnson.,82,72,2nd Half,1:09,True,2277,2025-01-26T00:45:12Z
401715970102994501,102994501,JumpShot,Dae Dae Hunter missed Three Point Jumper.,82,72,2nd Half,0:54,False,2443,2025-01-26T00:45:28Z
401715970102994901,102994901,Defensive Rebound,Elijah Brooks Defensive Rebound.,82,72,2nd Half,0:50,False,2277,2025-01-26T00:45:28Z
401715970102995501,102995501,Lost Ball Turnover,Elijah Brooks Turnover.,82,72,2nd Half,0:44,False,2277,2025-01-26T00:45:56Z
401715970102996001,102996001,JumpShot,Jamond Vincent made Three Point Jumper. Assisted by JR Jacobs.,82,75,2nd Half,0:39,True,2443,2025-01-26T00:45:56Z
401715970102996101,102996101,ShortTimeOut,New Orleans  Timeout,82,75,2nd Half,0:38,False,2443,2025-01-26T00:45:56Z
401715970102996401,102996401,PersonalFoul,Foul on Dae Dae Hunter.,82,75,2nd Half,0:35,False,2443,2025-01-26T00:47:12Z
401715970102996402,102996402,MadeFreeThrow,Julian Mackey made Free Throw.,83,75,2nd Half,0:35,True,2277,2025-01-26T00:47:12Z
401715970102996403,102996403,MadeFreeThrow,Julian Mackey made Free Throw.,84,75,2nd Half,0:35,True,2277,2025-01-26T00:47:12Z
401715970102997201,102997201,PersonalFoul,Foul on Peyton Rogers.,84,75,2nd Half,0:27,False,2277,2025-01-26T00:49:13Z
401715970102997202,102997202,MadeFreeThrow,James White made Free Throw.,84,76,2nd Half,0:27,True,2443,2025-01-26T00:49:13Z
401715970102997203,102997203,MadeFreeThrow,James White missed Free Throw.,84,76,2nd Half,0:27,False,2443,2025-01-26T00:49:13Z
401715970102997401,102997401,Defensive Rebound,Bryson Dawkins Defensive Rebound.,84,76,2nd Half,0:25,False,2277,2025-01-26T00:49:42Z
401715970102997501,102997501,PersonalFoul,Foul on Jah Short.,84,76,2nd Half,0:24,False,2443,2025-01-26T00:49:42Z
401715970102997502,102997502,MadeFreeThrow,Bryson Dawkins made Free Throw.,85,76,2nd Half,0:24,True,2277,2025-01-26T00:49:42Z
401715970102997503,102997503,MadeFreeThrow,Bryson Dawkins made Free Throw.,86,76,2nd Half,0:24,True,2277,2025-01-26T00:49:42Z
401715970102998501,102998501,LayUpShot,James White missed Layup.,86,76,2nd Half,0:14,False,2443,2025-01-26T00:49:42Z
401715970102998502,102998502,Block Shot,Trent Johnson Block.,86,76,2nd Half,0:14,False,2277,2025-01-26T00:49:42Z
401715970102998503,102998503,Offensive Rebound,New Orleans Offensive Rebound.,86,76,2nd Half,0:14,False,2443,2025-01-26T00:49:42Z
401715970102998601,102998601,JumpShot,Jamond Vincent missed Three Point Jumper.,86,76,2nd Half,0:13,False,2443,2025-01-26T00:49:42Z
401715970102998901,102998901,Defensive Rebound,Bryson Dawkins Defensive Rebound.,86,76,2nd Half,0:10,False,2277,2025-01-26T00:49:42Z
401715970102999901,102999901,End Period,End of 2nd half,86,76,2nd Half,0:00,False,,2025-01-26T00:49:42Z
