play_id,sequence_number,type,description,away_score,home_score,period,clock,scoring_play,team_id,timestamp_utc
401722520102908001,102908001,Lost Ball Turnover,Wesley Oba Turnover.,58,64,2nd Half,9:19,False,2623,2025-02-08T23:20:03Z
401722520102908002,102908002,Steal,Carter Whitt Steal.,58,64,2nd Half,9:19,False,2057,2025-02-08T23:20:03Z
401722520102908201,102908201,JumpShot,Isaiah Walker made Three Point Jumper. Assisted by Carter Whitt.,58,67,2nd Half,9:17,True,2057,2025-02-08T23:23:46Z
401722520102909901,102909901,LayUpShot,Dez White made Layup.,60,67,2nd Half,9:00,True,2623,2025-02-08T23:21:03Z
401722520102917901,102917901,LayUpShot,Isaiah Walker missed Layup.,60,67,2nd Half,8:20,False,2057,2025-02-08T23:21:29Z
401722520102918101,102918101,Defensive Rebound,Dez White Defensive Rebound.,60,67,2nd Half,8:18,False,2623,2025-02-08T23:21:31Z
401722520102918601,102918601,JumpShot,Dez White missed Three Point Jumper.,60,67,2nd Half,8:13,False,2623,2025-02-08T23:23:46Z
401722520102918801,102918801,Defensive Rebound,Tyler Lundblade Defensive Rebound.,60,67,2nd Half,8:11,False,2057,2025-02-08T23:23:46Z
401722520102924201,102924201,Lost Ball Turnover,Jonathan Pierre Turnover.,60,67,2nd Half,7:57,False,2057,2025-02-08T23:23:46Z
401722520102924202,102924202,Steal,Vincent Brady II Steal.,60,67,2nd Half,7:57,False,2623,2025-02-08T23:23:46Z
401722520102925501,102925501,JumpShot,Vincent Brady II made Three Point Jumper. Assisted by Dez White.,63,67,2nd Half,7:44,True,2623,2025-02-08T23:23:46Z
401722520102928501,102928501,JumpShot,Carter Whitt missed Jumper.,63,67,2nd Half,7:14,False,2057,2025-02-08T23:23:46Z
401722520102928801,102928801,Defensive Rebound,Michael Osei-Bonsu Defensive Rebound.,63,67,2nd Half,7:11,False,2623,2025-02-08T23:22:38Z
401722520102934101,102934101,JumpShot,Zaxton King missed Jumper.,63,67,2nd Half,6:58,False,2623,2025-02-08T23:23:46Z
401722520102934601,102934601,Offensive Rebound,Zaxton King Offensive Rebound.,63,67,2nd Half,6:53,False,2623,2025-02-08T23:22:57Z
401722520102934602,102934602,TipShot,Zaxton King made Two Point Tip Shot.,65,67,2nd Half,6:53,True,2623,2025-02-08T23:22:57Z
401722520102936001,102936001,JumpShot,Brody Peebles made Three Point Jumper. Assisted by Carter Whitt.,65,70,2nd Half,6:39,True,2057,2025-02-08T23:23:46Z
401722520102936101,102936101,ShortTimeOut,Belmont Timeout,65,70,2nd Half,6:38,False,2057,2025-02-08T23:23:46Z
401722520102938101,102938101,Lost Ball Turnover,Jalen Hampton Turnover.,65,70,2nd Half,6:18,False,2623,2025-02-08T23:26:37Z
401722520102938102,102938102,OfficialTVTimeOut,Official TV Timeout,65,70,2nd Half,6:18,False,,2025-02-08T23:27:44Z
401722520102944501,102944501,JumpShot,Tyler Lundblade made Three Point Jumper. Assisted by Jake Dykstra.,65,73,2nd Half,5:54,True,2057,2025-02-08T23:30:02Z
401722520102945501,102945501,JumpShot,Dez White missed Jumper.,65,73,2nd Half,5:44,False,2623,2025-02-08T23:30:12Z
401722520102945801,102945801,Offensive Rebound,Wesley Oba Offensive Rebound.,65,73,2nd Half,5:41,False,2623,2025-02-08T23:30:19Z
401722520102947801,102947801,PersonalFoul,Foul on Dez White.,65,73,2nd Half,5:21,False,2623,2025-02-08T23:30:40Z
401722520102954701,102954701,JumpShot,Brigham Rogers made Jumper. Assisted by Aidan Noyes.,65,75,2nd Half,4:52,True,2057,2025-02-08T23:31:06Z
401722520102956901,102956901,Lost Ball Turnover,Chase Martin Turnover.,65,75,2nd Half,4:30,False,2623,2025-02-08T23:31:27Z
401722520102956902,102956902,Steal,Brigham Rogers Steal.,65,75,2nd Half,4:30,False,2057,2025-02-08T23:31:27Z
401722520102959101,102959101,JumpShot,Tyler Lundblade missed Three Point Jumper.,65,75,2nd Half,4:08,False,2057,2025-02-08T23:31:50Z
401722520102959102,102959102,Offensive Rebound,Brigham Rogers Offensive Rebound.,65,75,2nd Half,4:08,False,2057,2025-02-08T23:31:50Z
401722520102959103,102959103,PersonalFoul,Foul on Wesley Oba.,65,75,2nd Half,4:08,False,2623,2025-02-08T23:31:50Z
401722520102959901,102959901,Lost Ball Turnover,Carter Whitt Turnover.,65,75,2nd Half,4:00,False,2057,2025-02-08T23:32:30Z
401722520102959902,102959902,Steal,Zaxton King Steal.,65,75,2nd Half,4:00,False,2623,2025-02-08T23:32:36Z
401722520102964501,102964501,Lost Ball Turnover,Dez White Turnover.,65,75,2nd Half,3:54,False,2623,2025-02-08T23:32:36Z
401722520102966501,102966501,JumpShot,Tyler Lundblade missed Three Point Jumper.,65,75,2nd Half,3:34,False,2057,2025-02-08T23:35:37Z
401722520102966601,102966601,Defensive Rebound,Missouri State Defensive Rebound.,65,75,2nd Half,3:33,False,2623,2025-02-08T23:35:37Z
401722520102968801,102968801,JumpShot,Zaxton King missed Three Point Jumper.,65,75,2nd Half,3:11,False,2623,2025-02-08T23:36:14Z
401722520102969001,102969001,Offensive Rebound,Missouri State Offensive Rebound.,65,75,2nd Half,3:09,False,2623,2025-02-08T23:36:14Z
401722520102974101,102974101,Lost Ball Turnover,Vincent Brady II Turnover.,65,75,2nd Half,2:58,False,2623,2025-02-08T23:36:38Z
401722520102974102,102974102,Steal,Isaiah Walker Steal.,65,75,2nd Half,2:58,False,2057,2025-02-08T23:36:38Z
401722520102976301,102976301,JumpShot,Isaiah Walker made Three Point Jumper. Assisted by Jonathan Pierre.,65,78,2nd Half,2:36,True,2057,2025-02-08T23:37:01Z
401722520102977301,102977301,Lost Ball Turnover,Zaxton King Turnover.,65,78,2nd Half,2:26,False,2623,2025-02-08T23:37:11Z
401722520102977302,102977302,Steal,Brigham Rogers Steal.,65,78,2nd Half,2:26,False,2057,2025-02-08T23:37:11Z
401722520102979501,102979501,LayUpShot,Brigham Rogers made Layup. Assisted by Jonathan Pierre.,65,80,2nd Half,2:04,True,2057,2025-02-08T23:37:33Z
401722520102984701,102984701,LayUpShot,Jalen Hampton made Layup. Assisted by Vincent Brady II.,67,80,2nd Half,1:52,True,2623,2025-02-08T23:37:45Z
401722520102987301,102987301,LayUpShot,Isaiah Walker made Layup. Assisted by Jonathan Pierre.,67,82,2nd Half,1:26,True,2057,2025-02-08T23:38:32Z
401722520102988401,102988401,JumpShot,Vincent Brady II missed Three Point Jumper.,67,82,2nd Half,1:15,False,2623,2025-02-08T23:38:57Z
401722520102988701,102988701,Defensive Rebound,Jonathan Pierre Defensive Rebound.,67,82,2nd Half,1:12,False,2057,2025-02-08T23:38:59Z
401722520102994201,102994201,Lost Ball Turnover,Jonathan Pierre Turnover.,67,82,2nd Half,0:57,False,2057,2025-02-08T23:39:12Z
401722520102994202,102994202,Steal,Michael Osei-Bonsu Steal.,67,82,2nd Half,0:57,False,2623,2025-02-08T23:39:17Z
401722520102994601,102994601,PersonalFoul,Foul on Brigham Rogers.,67,82,2nd Half,0:53,False,2057,2025-02-08T23:39:17Z
401722520102994602,102994602,MadeFreeThrow,Jalen Hampton missed Free Throw.,67,82,2nd Half,0:53,False,2623,2025-02-08T23:39:17Z
401722520102994603,102994603,Dead Ball Rebound,Missouri State Deadball Team Rebound.,67,82,2nd Half,0:53,False,2623,2025-02-08T23:39:17Z
401722520102994604,102994604,MadeFreeThrow,Jalen Hampton made Free Throw.,68,82,2nd Half,0:53,True,2623,2025-02-08T23:39:17Z
401722520102996401,102996401,JumpShot,Brody Peebles made Three Point Jumper. Assisted by Carter Whitt.,68,85,2nd Half,0:35,True,2057,2025-02-08T23:40:31Z
401722520102997301,102997301,LayUpShot,Dez White missed Layup.,68,85,2nd Half,0:26,False,2623,2025-02-08T23:40:40Z
401722520102997501,102997501,Defensive Rebound,Tyler Lundblade Defensive Rebound.,68,85,2nd Half,0:24,False,2057,2025-02-08T23:40:43Z
401722520102999901,102999901,End Period,End of 2nd half,68,85,2nd Half,0:00,False,,2025-02-08T23:40:49Z
401722520102999902,102999902,End Game,End of Game,68,85,2nd Half,0:00,False,,2025-02-08T23:40:49Z
