play_id,sequence_number,type,description,away_score,home_score,period,clock,scoring_play,team_id,timestamp_utc
401721154102866501,102866501,ShortTimeOut,UT Rio Grande Valley  Timeout,44,54,2nd Half,13:34,False,292,2024-11-26T01:57:26Z
401721154102866502,102866502,OfficialTVTimeOut, Official TV Timeout,44,54,2nd Half,13:34,False,,2024-11-26T01:57:26Z
401721154102866503,102866503,MadeFreeThrow,Robby Carmody made Free Throw.,45,54,2nd Half,13:34,True,2330,2024-11-26T01:57:26Z
401721154102866504,102866504,MadeFreeThrow,Robby Carmody made Free Throw.,46,54,2nd Half,13:34,True,2330,2024-11-26T01:57:26Z
401721154102866505,102866505,MadeFreeThrow,Robby Carmody made Free Throw.,47,54,2nd Half,13:34,True,2330,2024-11-26T01:57:26Z
401721154102869701,102869701,JumpShot,Trey Miller missed Jumper.,47,54,2nd Half,13:02,False,292,2024-11-26T02:01:27Z
401721154102869801,102869801,Offensive Rebound,Cliff Davis Offensive Rebound.,47,54,2nd Half,13:01,False,292,2024-11-26T02:01:27Z
401721154102869802,102869802,TipShot,Cliff Davis missed Two Point Tip Shot.,47,54,2nd Half,13:01,False,292,2024-11-26T02:01:27Z
401721154102869803,102869803,Defensive Rebound,Le Moyne Defensive Rebound.,47,54,2nd Half,13:01,False,2330,2024-11-26T02:01:27Z
401721154102875101,102875101,LayUpShot,Zek Tekin made Layup.,49,54,2nd Half,12:48,True,2330,2024-11-26T02:01:27Z
401721154102876001,102876001,LayUpShot,Trey Miller made Layup.,49,56,2nd Half,12:39,True,292,2024-11-26T02:01:43Z
401721154102877401,102877401,JumpShot,Dwayne Koroma missed Three Point Jumper.,49,56,2nd Half,12:25,False,2330,2024-11-26T02:01:58Z
401721154102877601,102877601,Defensive Rebound,Trey Miller Defensive Rebound.,49,56,2nd Half,12:23,False,292,2024-11-26T02:01:58Z
401721154102878201,102878201,PersonalFoul,Foul on Zek Tekin.,49,56,2nd Half,12:17,False,2330,2024-11-26T02:01:58Z
401721154102878801,102878801,PersonalFoul,Foul on Hasan Abdul Hakim.,49,56,2nd Half,12:11,False,292,2024-11-26T02:06:01Z
401721154102878802,102878802,Lost Ball Turnover,Hasan Abdul Hakim Turnover.,49,56,2nd Half,12:11,False,292,2024-11-26T02:06:01Z
401721154102884201,102884201,LayUpShot,Trent Mosquera missed Layup.,49,56,2nd Half,11:57,False,2330,2024-11-26T02:06:01Z
401721154102884501,102884501,Offensive Rebound,Trent Mosquera Offensive Rebound.,49,56,2nd Half,11:54,False,2330,2024-11-26T02:06:01Z
401721154102884502,102884502,LayUpShot,Trent Mosquera made Layup.,51,56,2nd Half,11:54,True,2330,2024-11-26T02:06:01Z
401721154102886501,102886501,JumpShot,Cliff Davis missed Three Point Jumper.,51,56,2nd Half,11:34,False,292,2024-11-26T02:06:01Z
401721154102886801,102886801,Defensive Rebound,Trent Mosquera Defensive Rebound.,51,56,2nd Half,11:31,False,2330,2024-11-26T02:06:01Z
401721154102887501,102887501,JumpShot,Robby Carmody made Three Point Jumper. Assisted by Nate Fouts.,54,56,2nd Half,11:24,True,2330,2024-11-26T02:06:01Z
401721154102889401,102889401,JumpShot,Trey Miller missed Jumper.,54,56,2nd Half,11:05,False,292,2024-11-26T02:06:01Z
401721154102889701,102889701,Offensive Rebound,Cliff Davis Offensive Rebound.,54,56,2nd Half,11:02,False,292,2024-11-26T02:06:01Z
401721154102889702,102889702,PersonalFoul,Foul on Dwayne Koroma.,54,56,2nd Half,11:02,False,2330,2024-11-26T02:06:01Z
401721154102889703,102889703,OfficialTVTimeOut, Official TV Timeout,54,56,2nd Half,11:02,False,,2024-11-26T02:06:01Z
401721154102895201,102895201,JumpShot,Trey Miller missed Three Point Jumper.,54,56,2nd Half,10:47,False,292,2024-11-26T02:07:29Z
401721154102895701,102895701,Offensive Rebound,Cliff Davis Offensive Rebound.,54,56,2nd Half,10:42,False,292,2024-11-26T02:07:29Z
401721154102896101,102896101,PersonalFoul,Foul on Zek Tekin.,54,56,2nd Half,10:38,False,2330,2024-11-26T02:07:29Z
401721154102896102,102896102,MadeFreeThrow,Trey Miller made Free Throw.,54,57,2nd Half,10:38,True,292,2024-11-26T02:07:29Z
401721154102896103,102896103,MadeFreeThrow,Trey Miller made Free Throw.,54,58,2nd Half,10:38,True,292,2024-11-26T02:08:00Z
401721154102898101,102898101,JumpShot,Nate Fouts missed ,54,58,2nd Half,10:18,False,2330,2024-11-26T02:11:13Z
401721154102899401,102899401,Offensive Rebound,Nate Fouts Offensive Rebound.,54,58,2nd Half,10:05,False,2330,2024-11-26T02:11:13Z
401721154102899701,102899701,LayUpShot,Nate Fouts made Layup.,56,58,2nd Half,10:02,True,2330,2024-11-26T02:11:13Z
401721154102904101,102904101,LayUpShot,DK Thorn made Layup.,56,60,2nd Half,9:58,True,292,2024-11-26T02:11:13Z
401721154102905101,102905101,PersonalFoul,Foul on Robby Carmody.,56,60,2nd Half,9:48,False,2330,2024-11-26T02:11:13Z
401721154102905102,102905102,Lost Ball Turnover,Robby Carmody Turnover.,56,60,2nd Half,9:48,False,2330,2024-11-26T02:11:13Z
401721154102907201,102907201,JumpShot,Trey Miller missed Three Point Jumper.,56,60,2nd Half,9:27,False,292,2024-11-26T02:11:43Z
401721154102907701,102907701,Defensive Rebound,Dwayne Koroma Defensive Rebound.,56,60,2nd Half,9:22,False,2330,2024-11-26T02:11:59Z
401721154102908201,102908201,PersonalFoul,Foul on Trey Miller.,56,60,2nd Half,9:17,False,292,2024-11-26T02:11:59Z
401721154102908202,102908202,MadeFreeThrow,Ocypher Owens missed Free Throw.,56,60,2nd Half,9:17,False,2330,2024-11-26T02:11:59Z
401721154102908203,102908203,Dead Ball Rebound,Le Moyne Deadball Team Rebound.,56,60,2nd Half,9:17,False,2330,2024-11-26T02:11:59Z
401721154102908204,102908204,MadeFreeThrow,Ocypher Owens made Free Throw.,57,60,2nd Half,9:17,True,2330,2024-11-26T02:11:59Z
401721154102914001,102914001,LayUpShot,DK Thorn missed Layup.,57,60,2nd Half,8:59,False,292,2024-11-26T02:13:26Z
401721154102914401,102914401,Offensive Rebound,DK Thorn Offensive Rebound.,57,60,2nd Half,8:55,False,292,2024-11-26T02:13:26Z
401721154102914402,102914402,TipShot,DK Thorn made Two Point Tip Shot.,57,62,2nd Half,8:55,True,292,2024-11-26T02:13:26Z
401721154102915401,102915401,JumpShot,Zek Tekin missed Three Point Jumper.,57,62,2nd Half,8:45,False,2330,2024-11-26T02:15:27Z
401721154102915601,102915601,Offensive Rebound,Trent Mosquera Offensive Rebound.,57,62,2nd Half,8:43,False,2330,2024-11-26T02:15:27Z
401721154102915701,102915701,LayUpShot,Trent Mosquera made Layup.,59,62,2nd Half,8:42,True,2330,2024-11-26T02:15:27Z
401721154102917301,102917301,JumpShot,Tommy Gankhuyag made ,59,64,2nd Half,8:26,True,292,2024-11-26T02:15:27Z
401721154102919801,102919801,LayUpShot,Dwayne Koroma made Layup. Assisted by Nate Fouts.,61,64,2nd Half,8:01,True,2330,2024-11-26T02:15:27Z
401721154102924901,102924901,JumpShot,DK Thorn missed Three Point Jumper.,61,64,2nd Half,7:50,False,292,2024-11-26T02:15:27Z
401721154102925201,102925201,Defensive Rebound,Nate Fouts Defensive Rebound.,61,64,2nd Half,7:47,False,2330,2024-11-26T02:15:27Z
401721154102926001,102926001,Lost Ball Turnover,Trent Mosquera Turnover.,61,64,2nd Half,7:39,False,2330,2024-11-26T02:15:27Z
401721154102926002,102926002,Steal,Cliff Davis Steal.,61,64,2nd Half,7:39,False,292,2024-11-26T02:15:27Z
401721154102926601,102926601,LayUpShot,Cliff Davis made Layup. Assisted by Howie Fleming Jr..,61,66,2nd Half,7:33,True,292,2024-11-26T02:15:27Z
401721154102928101,102928101,JumpShot,Ocypher Owens missed Three Point Jumper.,61,66,2nd Half,7:18,False,2330,2024-11-26T02:15:27Z
401721154102928301,102928301,Defensive Rebound,DK Thorn Defensive Rebound.,61,66,2nd Half,7:16,False,292,2024-11-26T02:15:27Z
401721154102934601,102934601,JumpShot,Hasan Abdul Hakim missed Three Point Jumper.,61,66,2nd Half,6:53,False,292,2024-11-26T02:15:27Z
401721154102934801,102934801,Defensive Rebound,Nate Fouts Defensive Rebound.,61,66,2nd Half,6:51,False,2330,2024-11-26T02:15:27Z
401721154102935401,102935401,JumpShot,Trent Mosquera made Three Point Jumper. Assisted by Zek Tekin.,64,66,2nd Half,6:45,True,2330,2024-11-26T02:15:42Z
401721154102936201,102936201,JumpShot,DK Thorn made Three Point Jumper. Assisted by Cliff Davis.,64,69,2nd Half,6:37,True,292,2024-11-26T02:15:42Z
401721154102938001,102938001,PersonalFoul,Foul on Dwayne Koroma.,64,69,2nd Half,6:19,False,2330,2024-11-26T02:19:25Z
401721154102938002,102938002,Lost Ball Turnover,Dwayne Koroma Turnover.,64,69,2nd Half,6:19,False,2330,2024-11-26T02:19:25Z
401721154102938003,102938003,OfficialTVTimeOut, Official TV Timeout,64,69,2nd Half,6:19,False,,2024-11-26T02:19:25Z
401721154102939401,102939401,JumpShot,K.T. Raimey made Three Point Jumper. Assisted by Trey Miller.,64,72,2nd Half,6:05,True,292,2024-11-26T02:19:25Z
401721154102946501,102946501,LayUpShot,Ocypher Owens made Layup. Assisted by AJ Dancler.,66,72,2nd Half,5:34,True,2330,2024-11-26T02:19:53Z
401721154102949701,102949701,Lost Ball Turnover,Hasan Abdul Hakim Turnover.,66,72,2nd Half,5:02,False,292,2024-11-26T02:21:26Z
401721154102949702,102949702,Steal,Zek Tekin Steal.,66,72,2nd Half,5:02,False,2330,2024-11-26T02:21:26Z
401721154102954301,102954301,Lost Ball Turnover,AJ Dancler Turnover.,66,72,2nd Half,4:56,False,2330,2024-11-26T02:21:26Z
401721154102954302,102954302,Steal,K.T. Raimey Steal.,66,72,2nd Half,4:56,False,292,2024-11-26T02:21:26Z
401721154102955101,102955101,LayUpShot,K.T. Raimey made Layup.,66,74,2nd Half,4:48,True,292,2024-11-26T02:21:26Z
401721154102955102,102955102,PersonalFoul,Foul on Trent Mosquera.,66,74,2nd Half,4:48,False,2330,2024-11-26T02:21:26Z
401721154102955103,102955103,MadeFreeThrow,K.T. Raimey made Free Throw.,66,75,2nd Half,4:48,True,292,2024-11-26T02:21:26Z
401721154102956701,102956701,Lost Ball Turnover,Zek Tekin Turnover.,66,75,2nd Half,4:32,False,2330,2024-11-26T02:21:42Z
401721154102956702,102956702,Steal,DK Thorn Steal.,66,75,2nd Half,4:32,False,292,2024-11-26T02:21:42Z
401721154102956703,102956703,PersonalFoul,Foul on Trent Mosquera.,66,75,2nd Half,4:32,False,2330,2024-11-26T02:21:42Z
401721154102956704,102956704,MadeFreeThrow,DK Thorn made Free Throw.,66,76,2nd Half,4:32,True,292,2024-11-26T02:21:42Z
401721154102956705,102956705,MadeFreeThrow,DK Thorn made Free Throw.,66,77,2nd Half,4:32,True,292,2024-11-26T02:21:42Z
401721154102957601,102957601,PersonalFoul,Foul on K.T. Raimey.,66,77,2nd Half,4:23,False,292,2024-11-26T02:23:13Z
401721154102957602,102957602,MadeFreeThrow,Robby Carmody made Free Throw.,67,77,2nd Half,4:23,True,2330,2024-11-26T02:23:13Z
401721154102957603,102957603,MadeFreeThrow,Robby Carmody made Free Throw.,68,77,2nd Half,4:23,True,2330,2024-11-26T02:23:13Z
401721154102959101,102959101,JumpShot,Howie Fleming Jr. made Free Throw.,68,79,2nd Half,4:08,True,292,2024-11-26T02:28:07Z
401721154102964601,102964601,JumpShot,Trent Mosquera missed Three Point Jumper.,68,79,2nd Half,3:53,False,2330,2024-11-26T02:28:07Z
401721154102964801,102964801,Defensive Rebound,Tommy Gankhuyag Defensive Rebound.,68,79,2nd Half,3:51,False,292,2024-11-26T02:28:07Z
401721154102965301,102965301,PersonalFoul,Foul on Robby Carmody.,68,79,2nd Half,3:46,False,2330,2024-11-26T02:28:07Z
401721154102965302,102965302,OfficialTVTimeOut, Official TV Timeout,68,79,2nd Half,3:46,False,,2024-11-26T02:28:07Z
401721154102965303,102965303,MadeFreeThrow,Trey Miller made Free Throw.,68,80,2nd Half,3:46,True,292,2024-11-26T02:28:07Z
401721154102965304,102965304,MadeFreeThrow,Trey Miller made Free Throw.,68,81,2nd Half,3:46,True,292,2024-11-26T02:28:07Z
401721154102966501,102966501,LayUpShot,Zek Tekin made Layup.,70,81,2nd Half,3:34,True,2330,2024-11-26T02:29:26Z
401721154102968601,102968601,JumpShot,DK Thorn made Three Point Jumper. Assisted by Trey Miller.,70,84,2nd Half,3:13,True,292,2024-11-26T02:29:26Z
401721154102974201,102974201,JumpShot,Ocypher Owens missed Three Point Jumper.,70,84,2nd Half,2:57,False,2330,2024-11-26T02:29:26Z
401721154102974501,102974501,Defensive Rebound,K.T. Raimey Defensive Rebound.,70,84,2nd Half,2:54,False,292,2024-11-26T02:29:26Z
401721154102974502,102974502,Technical Foul,Technical Foul on Darrick Jones Jr..,70,84,2nd Half,2:54,False,2330,2024-11-26T02:29:26Z
401721154102974503,102974503,MadeFreeThrow,K.T. Raimey made Free Throw.,70,85,2nd Half,2:54,True,292,2024-11-26T02:29:26Z
401721154102974504,102974504,MadeFreeThrow,K.T. Raimey made Free Throw.,70,86,2nd Half,2:54,True,292,2024-11-26T02:29:26Z
401721154102975701,102975701,JumpShot,Trey Miller missed Three Point Jumper.,70,86,2nd Half,2:42,False,292,2024-11-26T02:31:14Z
401721154102976101,102976101,Offensive Rebound,Hasan Abdul Hakim Offensive Rebound.,70,86,2nd Half,2:38,False,292,2024-11-26T02:31:14Z
401721154102976201,102976201,JumpShot,K.T. Raimey missed Three Point Jumper.,70,86,2nd Half,2:37,False,292,2024-11-26T02:31:14Z
401721154102976501,102976501,Offensive Rebound,Hasan Abdul Hakim Offensive Rebound.,70,86,2nd Half,2:34,False,292,2024-11-26T02:31:14Z
401721154102976601,102976601,JumpShot,DK Thorn missed Three Point Jumper.,70,86,2nd Half,2:33,False,292,2024-11-26T02:31:14Z
401721154102977001,102977001,Offensive Rebound,K.T. Raimey Offensive Rebound.,70,86,2nd Half,2:29,False,292,2024-11-26T02:31:14Z
401721154102978201,102978201,JumpShot,DK Thorn missed Three Point Jumper.,70,86,2nd Half,2:17,False,292,2024-11-26T02:31:14Z
401721154102978701,102978701,Defensive Rebound,Dwayne Koroma Defensive Rebound.,70,86,2nd Half,2:12,False,2330,2024-11-26T02:31:27Z
401721154102979101,102979101,LayUpShot,AJ Dancler made Layup. Assisted by Dwayne Koroma.,72,86,2nd Half,2:08,True,2330,2024-11-26T02:31:27Z
401721154102984101,102984101,ShortTimeOut,Le Moyne  Timeout,72,86,2nd Half,1:58,False,2330,2024-11-26T02:33:26Z
401721154102985001,102985001,JumpShot,Howie Fleming Jr. made Three Point Jumper. Assisted by Hasan Abdul Hakim.,72,89,2nd Half,1:49,True,292,2024-11-26T02:33:26Z
401721154102987201,102987201,JumpShot,Trent Mosquera missed Three Point Jumper.,72,89,2nd Half,1:27,False,2330,2024-11-26T02:35:27Z
401721154102987401,102987401,Offensive Rebound,AJ Dancler Offensive Rebound.,72,89,2nd Half,1:25,False,2330,2024-11-26T02:35:27Z
401721154102987402,102987402,JumpShot,AJ Dancler missed Jumper.,72,89,2nd Half,1:25,False,2330,2024-11-26T02:35:27Z
401721154102987701,102987701,Offensive Rebound,Jakob Blakley Offensive Rebound.,72,89,2nd Half,1:22,False,2330,2024-11-26T02:35:27Z
401721154102988001,102988001,LayUpShot,Dwayne Koroma made Layup. Assisted by Trent Mosquera.,74,89,2nd Half,1:19,True,2330,2024-11-26T02:35:27Z
401721154102988002,102988002,PersonalFoul,Foul on Hasan Abdul Hakim.,74,89,2nd Half,1:19,False,292,2024-11-26T02:35:27Z
401721154102988101,102988101,MadeFreeThrow,Dwayne Koroma missed Free Throw.,74,89,2nd Half,1:18,False,2330,2024-11-26T02:35:27Z
401721154102988102,102988102,Defensive Rebound,UT Rio Grande Valley Defensive Rebound.,74,89,2nd Half,1:18,False,292,2024-11-26T02:35:27Z
401721154102988103,102988103,PersonalFoul,Foul on AJ Dancler.,74,89,2nd Half,1:18,False,2330,2024-11-26T02:35:27Z
401721154102988104,102988104,MadeFreeThrow,Howie Fleming Jr. made Free Throw.,74,90,2nd Half,1:18,True,292,2024-11-26T02:35:27Z
401721154102988105,102988105,MadeFreeThrow,Howie Fleming Jr. made Free Throw.,74,91,2nd Half,1:18,True,292,2024-11-26T02:35:27Z
401721154102988901,102988901,Lost Ball Turnover,Jakob Blakley Turnover.,74,91,2nd Half,1:10,False,2330,2024-11-26T02:35:27Z
401721154102988902,102988902,Steal,K.T. Raimey Steal.,74,91,2nd Half,1:10,False,292,2024-11-26T02:35:27Z
401721154102995801,102995801,JumpShot,Trey Miller made Jumper. Assisted by Hasan Abdul Hakim.,74,93,2nd Half,0:41,True,292,2024-11-26T02:36:11Z
401721154102997101,102997101,LayUpShot,AJ Dancler missed Layup.,74,93,2nd Half,0:28,False,2330,2024-11-26T02:37:26Z
401721154102997102,102997102,Defensive Rebound,K.T. Raimey Defensive Rebound.,74,93,2nd Half,0:28,False,292,2024-11-26T02:37:26Z
401721154102997301,102997301,JumpShot,Hasan Abdul Hakim made Jumper. Assisted by Trey Miller.,74,95,2nd Half,0:26,True,292,2024-11-26T02:37:26Z
401721154102997302,102997302,Technical Foul,Technical Foul on DK Thorn.,74,95,2nd Half,0:26,False,292,2024-11-26T02:39:12Z
401721154102997303,102997303,MadeFreeThrow,Jakob Blakley made Free Throw.,75,95,2nd Half,0:26,True,2330,2024-11-26T02:39:12Z
401721154102997304,102997304,MadeFreeThrow,Jakob Blakley made Free Throw.,76,95,2nd Half,0:26,True,2330,2024-11-26T02:39:12Z
401721154102998205,102998205,MadeFreeThrow,AJ Dancler made Free Throw.,77,95,2nd Half,0:17,True,2330,2024-11-26T02:36:11Z
401721154102998228,102998228,PersonalFoul,Foul on Dwayne Koroma.,77,95,2nd Half,0:17,False,2330,2024-11-26T02:36:11Z
401721154102998229,102998229,MadeFreeThrow,Mustafo Vanjov made Free Throw.,77,96,2nd Half,0:17,True,292,2024-11-26T02:36:11Z
401721154102998230,102998230,MadeFreeThrow,Mustafo Vanjov made Free Throw.,77,97,2nd Half,0:17,True,292,2024-11-26T02:36:11Z
401721154102998231,102998231,PersonalFoul,Foul on EJ Avelar.,76,95,2nd Half,0:17,False,292,2024-11-26T02:36:11Z
401721154102998232,102998232,MadeFreeThrow,AJ Dancler missed Free Throw.,77,95,2nd Half,0:17,False,2330,2024-11-26T02:36:11Z
401721154102998233,102998233,Defensive Rebound,UT Rio Grande Valley Defensive Rebound.,77,95,2nd Half,0:17,False,292,2024-11-26T02:36:11Z
401721154102999101,102999101,Lost Ball Turnover,AJ Dancler Turnover.,77,97,2nd Half,0:08,False,2330,2024-11-26T02:39:12Z
401721154102999901,102999901,End Period,End of 2nd half,77,97,2nd Half,0:00,False,,2024-11-26T02:39:12Z
