play_id,sequence_number,type,description,away_score,home_score,period,clock,scoring_play,team_id,timestamp_utc
401706679102838301,102838301,LayUpShot,Jordan Ross missed Layup.,40,25,2nd Half,16:16,False,2608,2025-01-05T04:14:41Z
401706679102838701,102838701,Offensive Rebound,Mitchell Saxen Offensive Rebound.,40,25,2nd Half,16:12,False,2608,2025-01-05T04:14:44Z
401706679102839101,102839101,JumpShot,Augustas Marciulionis missed Three Point Jumper.,40,25,2nd Half,16:08,False,2608,2025-01-05T04:14:49Z
401706679102839501,102839501,Defensive Rebound,Portland Defensive Rebound.,40,25,2nd Half,16:04,False,2501,2025-01-05T04:14:52Z
401706679102845201,102845201,JumpShot,Jermaine Ballisager Webb made Jumper. Assisted by Vincent Delano.,40,27,2nd Half,15:47,True,2501,2025-01-05T04:15:27Z
401706679102846801,102846801,LayUpShot,Mitchell Saxen made Layup. Assisted by Augustas Marciulionis.,42,27,2nd Half,15:31,True,2608,2025-01-05T04:15:42Z
401706679102848401,102848401,JumpShot,Austin Rapp made Jumper.,42,29,2nd Half,15:15,True,2501,2025-01-05T04:16:00Z
401706679102854201,102854201,LayUpShot,Mitchell Saxen made Layup. Assisted by Ashton Hardaway.,44,29,2nd Half,14:57,True,2608,2025-01-05T04:16:17Z
401706679102856301,102856301,LayUpShot,Jermaine Ballisager Webb made Layup. Assisted by Austin Rapp.,44,31,2nd Half,14:36,True,2501,2025-01-05T04:16:38Z
401706679102857801,102857801,JumpShot,Ashton Hardaway made Jumper. Assisted by Augustas Marciulionis.,46,31,2nd Half,14:21,True,2608,2025-01-05T04:16:53Z
401706679102859901,102859901,JumpShot,Max Mackinnon missed Jumper.,46,31,2nd Half,14:00,False,2501,2025-01-05T04:17:15Z
401706679102864401,102864401,Defensive Rebound,Mitchell Saxen Defensive Rebound.,46,31,2nd Half,13:55,False,2608,2025-01-05T04:17:17Z
401706679102864701,102864701,Lost Ball Turnover,Jordan Ross Turnover.,46,31,2nd Half,13:52,False,2608,2025-01-05T04:21:31Z
401706679102864702,102864702,Steal,Vincent Delano Steal.,46,31,2nd Half,13:52,False,2501,2025-01-05T04:21:31Z
401706679102866001,102866001,JumpShot,Austin Rapp missed Three Point Jumper.,46,31,2nd Half,13:39,False,2501,2025-01-05T04:17:35Z
401706679102866701,102866701,PersonalFoul,Foul on Max Mackinnon.,46,31,2nd Half,13:32,False,2501,2025-01-05T04:21:31Z
401706679102866702,102866702,OfficialTVTimeOut, Official TV Timeout,46,31,2nd Half,13:32,False,,2025-01-05T04:21:31Z
401706679102866703,102866703,MadeFreeThrow,Augustas Marciulionis made Free Throw.,47,31,2nd Half,13:32,True,2608,2025-01-05T04:21:31Z
401706679102866704,102866704,MadeFreeThrow,Augustas Marciulionis made Free Throw.,48,31,2nd Half,13:32,True,2608,2025-01-05T04:21:31Z
401706679102866801,102866801,Defensive Rebound,Augustas Marciulionis Defensive Rebound.,48,31,2nd Half,13:31,False,2608,2025-01-05T04:21:31Z
401706679102867601,102867601,PersonalFoul,Foul on Ashton Hardaway.,48,31,2nd Half,13:23,False,2608,2025-01-05T04:21:31Z
401706679102868301,102868301,PersonalFoul,Foul on Ashton Hardaway.,48,31,2nd Half,13:16,False,2608,2025-01-05T04:21:54Z
401706679102869201,102869201,Lost Ball Turnover,Austin Rapp Turnover.,48,31,2nd Half,13:07,False,2501,2025-01-05T04:22:22Z
401706679102869202,102869202,Steal,Luke Barrett Steal.,48,31,2nd Half,13:07,False,2608,2025-01-05T04:22:22Z
401706679102874401,102874401,JumpShot,Jordan Ross missed Three Point Jumper.,48,31,2nd Half,12:55,False,2608,2025-01-05T04:22:35Z
401706679102875001,102875001,Defensive Rebound,Vincent Delano Defensive Rebound.,48,31,2nd Half,12:49,False,2501,2025-01-05T04:22:38Z
401706679102875201,102875201,PersonalFoul,Foul on Augustas Marciulionis.,48,31,2nd Half,12:47,False,2608,2025-01-05T04:22:42Z
401706679102876501,102876501,JumpShot,Jermaine Ballisager Webb missed Jumper.,48,31,2nd Half,12:34,False,2501,2025-01-05T04:23:21Z
401706679102877001,102877001,Defensive Rebound,Mitchell Saxen Defensive Rebound.,48,31,2nd Half,12:29,False,2608,2025-01-05T04:23:23Z
401706679102878001,102878001,PersonalFoul,Foul on Jermaine Ballisager Webb.,48,31,2nd Half,12:19,False,2501,2025-01-05T04:23:33Z
401706679102879401,102879401,JumpShot,Ashton Hardaway made Jumper.,50,31,2nd Half,12:05,True,2608,2025-01-05T04:24:52Z
401706679102885301,102885301,LayUpShot,Kelson Gebbers missed Layup.,50,31,2nd Half,11:46,False,2501,2025-01-05T04:25:11Z
401706679102885302,102885302,Block Shot,Mitchell Saxen Block.,50,31,2nd Half,11:46,False,2608,2025-01-05T04:25:14Z
401706679102885601,102885601,Defensive Rebound,Mitchell Saxen Defensive Rebound.,50,31,2nd Half,11:43,False,2608,2025-01-05T04:25:14Z
401706679102885901,102885901,JumpShot,Augustas Marciulionis missed Jumper.,50,31,2nd Half,11:40,False,2608,2025-01-05T04:25:17Z
401706679102886201,102886201,Defensive Rebound,Austin Rapp Defensive Rebound.,50,31,2nd Half,11:37,False,2501,2025-01-05T04:25:20Z
401706679102887201,102887201,PersonalFoul,Foul on Mitchell Saxen.,50,31,2nd Half,11:27,False,2608,2025-01-05T04:25:30Z
401706679102888001,102888001,Lost Ball Turnover,Mezziah Oakman Turnover.,50,31,2nd Half,11:19,False,2501,2025-01-05T04:29:05Z
401706679102888002,102888002,Steal,Ashton Hardaway Steal.,50,31,2nd Half,11:19,False,2608,2025-01-05T04:29:05Z
401706679102888201,102888201,PersonalFoul,Foul on Kelson Gebbers.,50,31,2nd Half,11:17,False,2501,2025-01-05T04:29:05Z
401706679102894001,102894001,JumpShot,Mikey Lewis made Three Point Jumper. Assisted by Jordan Ross.,53,31,2nd Half,10:59,True,2608,2025-01-05T04:29:47Z
401706679102895901,102895901,Lost Ball Turnover,Mikah Ballew Turnover.,53,31,2nd Half,10:40,False,2501,2025-01-05T04:30:06Z
401706679102895902,102895902,Steal,Luke Barrett Steal.,53,31,2nd Half,10:40,False,2608,2025-01-05T04:30:06Z
401706679102896201,102896201,LayUpShot,Mikey Lewis made Layup. Assisted by Luke Barrett.,55,31,2nd Half,10:37,True,2608,2025-01-05T04:30:09Z
401706679102896202,102896202,PersonalFoul,Foul on Austin Rapp.,55,31,2nd Half,10:37,False,2501,2025-01-05T04:30:09Z
401706679102896203,102896203,MadeFreeThrow,Mikey Lewis made Free Throw.,56,31,2nd Half,10:37,True,2608,2025-01-05T04:30:09Z
401706679102898501,102898501,JumpShot,Mikah Ballew missed Jumper.,56,31,2nd Half,10:14,False,2501,2025-01-05T04:31:20Z
401706679102898502,102898502,Offensive Rebound,Portland Offensive Rebound.,56,31,2nd Half,10:14,False,2501,2025-01-05T04:31:20Z
401706679102898701,102898701,JumpShot,Vukasin Masic made Three Point Jumper. Assisted by Max Mackinnon.,56,34,2nd Half,10:12,True,2501,2025-01-05T04:31:20Z
401706679102904801,102904801,JumpShot,Mikey Lewis made Jumper. Assisted by Augustas Marciulionis.,58,34,2nd Half,9:51,True,2608,2025-01-05T04:32:08Z
401706679102905901,102905901,Lost Ball Turnover,Austin Rapp Turnover.,58,34,2nd Half,9:40,False,2501,2025-01-05T04:32:16Z
401706679102907001,102907001,JumpShot,Augustas Marciulionis missed Jumper.,58,34,2nd Half,9:29,False,2608,2025-01-05T04:32:59Z
401706679102907201,102907201,Defensive Rebound,Portland Defensive Rebound.,58,34,2nd Half,9:27,False,2501,2025-01-05T04:32:59Z
401706679102907202,102907202,PersonalFoul,Foul on Andrew McKeever.,58,34,2nd Half,9:27,False,2608,2025-01-05T04:32:59Z
401706679102907203,102907203,MadeFreeThrow,Mezziah Oakman missed Free Throw.,58,34,2nd Half,9:27,False,2501,2025-01-05T04:32:59Z
401706679102907204,102907204,Defensive Rebound,Ashton Hardaway Defensive Rebound.,58,34,2nd Half,9:27,False,2608,2025-01-05T04:32:59Z
401706679102908601,102908601,PersonalFoul,Foul on Harry Wessels.,58,34,2nd Half,9:13,False,2608,2025-01-05T04:33:57Z
401706679102908602,102908602,Lost Ball Turnover,Harry Wessels Turnover.,58,34,2nd Half,9:13,False,2608,2025-01-05T04:33:56Z
401706679102914201,102914201,JumpShot,Mezziah Oakman made Jumper.,58,36,2nd Half,8:57,True,2501,2025-01-05T04:34:37Z
401706679102916401,102916401,LayUpShot,Jordan Ross made Layup.,60,36,2nd Half,8:35,True,2608,2025-01-05T04:35:00Z
401706679102917601,102917601,JumpShot,Bol Dengdit made Three Point Jumper. Assisted by Vukasin Masic.,60,39,2nd Half,8:23,True,2501,2025-01-05T04:35:11Z
401706679102919701,102919701,PersonalFoul,Foul on Mikah Ballew.,60,39,2nd Half,8:02,False,2501,2025-01-05T04:35:32Z
401706679102919702,102919702,MadeFreeThrow,Mikey Lewis made Free Throw.,61,39,2nd Half,8:02,True,2608,2025-01-05T04:35:32Z
401706679102919703,102919703,MadeFreeThrow,Mikey Lewis made Free Throw.,62,39,2nd Half,8:02,True,2608,2025-01-05T04:35:32Z
401706679102925101,102925101,LayUpShot,Vukasin Masic missed Layup.,62,39,2nd Half,7:48,False,2501,2025-01-05T04:36:37Z
401706679102925601,102925601,Defensive Rebound,Mikey Lewis Defensive Rebound.,62,39,2nd Half,7:43,False,2608,2025-01-05T04:36:37Z
401706679102925901,102925901,LayUpShot,Harry Wessels made Layup. Assisted by Jordan Ross.,64,39,2nd Half,7:40,True,2608,2025-01-05T04:36:41Z
401706679102927901,102927901,JumpShot,Vukasin Masic missed Jumper.,64,39,2nd Half,7:20,False,2501,2025-01-05T04:37:02Z
401706679102928301,102928301,Defensive Rebound,Ashton Hardaway Defensive Rebound.,64,39,2nd Half,7:16,False,2608,2025-01-05T04:37:05Z
401706679102929501,102929501,LayUpShot,Jordan Ross made Layup.,66,39,2nd Half,7:04,True,2608,2025-01-05T04:37:18Z
401706679102934901,102934901,PersonalFoul,Foul on Jordan Ross.,66,39,2nd Half,6:50,False,2608,2025-01-05T04:37:32Z
401706679102934902,102934902,OfficialTVTimeOut, Official TV Timeout,66,39,2nd Half,6:50,False,,2025-01-05T04:37:32Z
401706679102934903,102934903,MadeFreeThrow,Max Mackinnon made Free Throw.,66,40,2nd Half,6:50,True,2501,2025-01-05T04:37:32Z
401706679102934904,102934904,MadeFreeThrow,Max Mackinnon made Free Throw.,66,41,2nd Half,6:50,True,2501,2025-01-05T04:37:32Z
401706679102937101,102937101,JumpShot,Augustas Marciulionis missed Three Point Jumper.,66,41,2nd Half,6:28,False,2608,2025-01-05T04:41:26Z
401706679102937801,102937801,Offensive Rebound,Harry Wessels Offensive Rebound.,66,41,2nd Half,6:21,False,2608,2025-01-05T04:41:32Z
401706679102938301,102938301,LayUpShot,Mikey Lewis missed Layup.,66,41,2nd Half,6:16,False,2608,2025-01-05T04:41:38Z
401706679102938601,102938601,Defensive Rebound,Todd Jones Defensive Rebound.,66,41,2nd Half,6:13,False,2501,2025-01-05T04:41:41Z
401706679102939001,102939001,LayUpShot,Vincent Delano made Layup.,66,43,2nd Half,6:09,True,2501,2025-01-05T04:41:44Z
401706679102944801,102944801,JumpShot,Augustas Marciulionis made Jumper. Assisted by Paulius Murauskas.,68,43,2nd Half,5:51,True,2608,2025-01-05T04:42:05Z
401706679102946401,102946401,Lost Ball Turnover,Vincent Delano Turnover.,68,43,2nd Half,5:35,False,2501,2025-01-05T04:42:20Z
401706679102948001,102948001,JumpShot,Luke Barrett made Three Point Jumper. Assisted by Paulius Murauskas.,71,43,2nd Half,5:19,True,2608,2025-01-05T04:43:04Z
401706679102949101,102949101,Lost Ball Turnover,Todd Jones Turnover.,71,43,2nd Half,5:08,False,2501,2025-01-05T04:43:15Z
401706679102949102,102949102,Steal,Mikey Lewis Steal.,71,43,2nd Half,5:08,False,2608,2025-01-05T04:43:15Z
401706679102949103,102949103,PersonalFoul,Foul on Todd Jones.,71,43,2nd Half,5:08,False,2501,2025-01-05T04:43:15Z
401706679102949104,102949104,MadeFreeThrow,Mikey Lewis made Free Throw.,72,43,2nd Half,5:08,True,2608,2025-01-05T04:43:15Z
401706679102949105,102949105,MadeFreeThrow,Mikey Lewis made Free Throw.,73,43,2nd Half,5:08,True,2608,2025-01-05T04:43:15Z
401706679102954201,102954201,JumpShot,Mikah Ballew made Three Point Jumper. Assisted by Jermaine Ballisager Webb.,73,46,2nd Half,4:57,True,2501,2025-01-05T04:44:32Z
401706679102956801,102956801,JumpShot,Jordan Ross missed Jumper.,73,46,2nd Half,4:31,False,2608,2025-01-05T04:44:57Z
401706679102957201,102957201,Offensive Rebound,Mitchell Saxen Offensive Rebound.,73,46,2nd Half,4:27,False,2608,2025-01-05T04:45:00Z
401706679102957202,102957202,JumpShot,Mitchell Saxen missed Jumper.,73,46,2nd Half,4:27,False,2608,2025-01-05T04:45:00Z
401706679102957301,102957301,Offensive Rebound,Mitchell Saxen Offensive Rebound.,73,46,2nd Half,4:26,False,2608,2025-01-05T04:45:03Z
401706679102957901,102957901,LayUpShot,Paulius Murauskas missed Layup.,73,46,2nd Half,4:20,False,2608,2025-01-05T04:45:08Z
401706679102957902,102957902,Block Shot,Todd Jones Block.,73,46,2nd Half,4:20,False,2501,2025-01-05T04:45:11Z
401706679102958301,102958301,Defensive Rebound,Mikah Ballew Defensive Rebound.,73,46,2nd Half,4:16,False,2501,2025-01-05T04:45:11Z
401706679102958801,102958801,PersonalFoul,Foul on Luke Barrett.,73,46,2nd Half,4:11,False,2608,2025-01-05T04:45:17Z
401706679102958802,102958802,MadeFreeThrow,Todd Jones made Free Throw.,73,47,2nd Half,4:11,True,2501,2025-01-05T04:45:17Z
401706679102958803,102958803,MadeFreeThrow,Todd Jones made Free Throw.,73,48,2nd Half,4:11,True,2501,2025-01-05T04:45:17Z
401706679102964301,102964301,JumpShot,Paulius Murauskas made Three Point Jumper. Assisted by Joshua Dent.,76,48,2nd Half,3:56,True,2608,2025-01-05T04:46:31Z
401706679102966101,102966101,PersonalFoul,Foul on Vincent Delano.,76,48,2nd Half,3:38,False,2501,2025-01-05T04:46:47Z
401706679102966102,102966102,Lost Ball Turnover,Vincent Delano Turnover.,76,48,2nd Half,3:38,False,2501,2025-01-05T04:46:47Z
401706679102966103,102966103,OfficialTVTimeOut, Official TV Timeout,76,48,2nd Half,3:38,False,,2025-01-05T04:46:47Z
401706679102967301,102967301,PersonalFoul,Foul on Paulius Murauskas.,76,48,2nd Half,3:26,False,2608,2025-01-05T04:49:41Z
401706679102967302,102967302,Lost Ball Turnover,Paulius Murauskas Turnover.,76,48,2nd Half,3:26,False,2608,2025-01-05T04:49:41Z
401706679102968301,102968301,JumpShot,Mikah Ballew missed Jumper.,76,48,2nd Half,3:16,False,2501,2025-01-05T04:50:02Z
401706679102968701,102968701,Defensive Rebound,Luke Barrett Defensive Rebound.,76,48,2nd Half,3:12,False,2608,2025-01-05T04:50:02Z
401706679102969602,102969602,PersonalFoul,Foul on Todd Jones.,76,48,2nd Half,3:03,False,2501,2025-01-05T04:50:19Z
401706679102969603,102969603,MadeFreeThrow,Luke Barrett missed Free Throw.,76,48,2nd Half,3:03,False,2608,2025-01-05T04:50:19Z
401706679102969604,102969604,Offensive Rebound,Saint Mary's Offensive Rebound.,76,48,2nd Half,3:03,False,2608,2025-01-05T04:50:19Z
401706679102969605,102969605,MadeFreeThrow,Luke Barrett made Free Throw.,77,48,2nd Half,3:03,True,2608,2025-01-05T04:50:19Z
401706679102974601,102974601,DunkShot,Vincent Delano made Dunk. Assisted by Austin Rapp.,77,50,2nd Half,2:53,True,2501,2025-01-05T04:51:23Z
401706679102977201,102977201,LayUpShot,Paulius Murauskas missed Layup.,77,50,2nd Half,2:27,False,2608,2025-01-05T04:51:49Z
401706679102977602,102977602,Defensive Rebound,Austin Rapp Defensive Rebound.,77,50,2nd Half,2:23,False,2501,2025-01-05T04:51:59Z
401706679102978301,102978301,JumpShot,Austin Rapp made Three Point Jumper. Assisted by Mikah Ballew.,77,53,2nd Half,2:16,True,2501,2025-01-05T04:52:02Z
401706679102984501,102984501,LayUpShot,Andrew McKeever made Layup. Assisted by Paulius Murauskas.,79,53,2nd Half,1:54,True,2608,2025-01-05T04:52:24Z
401706679102986201,102986201,Lost Ball Turnover,Austin Rapp Turnover.,79,53,2nd Half,1:37,False,2501,2025-01-05T04:52:41Z
401706679102987801,102987801,PersonalFoul,Foul on Mikah Ballew.,79,53,2nd Half,1:21,False,2501,2025-01-05T04:53:18Z
401706679102987802,102987802,MadeFreeThrow,Andrew McKeever missed Free Throw.,79,53,2nd Half,1:21,False,2608,2025-01-05T04:53:18Z
401706679102987803,102987803,Offensive Rebound,Saint Mary's Offensive Rebound.,79,53,2nd Half,1:21,False,2608,2025-01-05T04:53:18Z
401706679102987804,102987804,MadeFreeThrow,Andrew McKeever missed Free Throw.,79,53,2nd Half,1:21,False,2608,2025-01-05T04:53:18Z
401706679102987805,102987805,Defensive Rebound,Kelson Gebbers Defensive Rebound.,79,53,2nd Half,1:21,False,2501,2025-01-05T04:53:18Z
401706679102994001,102994001,JumpShot,Mikah Ballew made Three Point Jumper. Assisted by Vincent Delano.,79,56,2nd Half,0:59,True,2501,2025-01-05T04:54:40Z
401706679102995101,102995101,JumpShot,Andrew McKeever made Jumper. Assisted by Kevin Gad.,81,56,2nd Half,0:48,True,2608,2025-01-05T04:55:08Z
401706679102996501,102996501,JumpShot,Austin Rapp missed Three Point Jumper.,81,56,2nd Half,0:34,False,2501,2025-01-05T04:55:31Z
401706679102996901,102996901,Offensive Rebound,Todd Jones Offensive Rebound.,81,56,2nd Half,0:30,False,2501,2025-01-05T04:55:34Z
401706679102997001,102997001,JumpShot,Kelson Gebbers missed Three Point Jumper.,81,56,2nd Half,0:29,False,2501,2025-01-05T04:55:38Z
401706679102997201,102997201,Offensive Rebound,Vincent Delano Offensive Rebound.,81,56,2nd Half,0:27,False,2501,2025-01-05T04:55:38Z
401706679102997202,102997202,PersonalFoul,Foul on Cade Bennett.,81,56,2nd Half,0:27,False,2608,2025-01-05T04:56:28Z
401706679102997203,102997203,MadeFreeThrow,Mikah Ballew made Free Throw.,81,57,2nd Half,0:27,True,2501,2025-01-05T04:55:38Z
401706679102997204,102997204,MadeFreeThrow,Mikah Ballew made Free Throw.,81,58,2nd Half,0:27,True,2501,2025-01-05T04:55:38Z
401706679102999901,102999901,End Period,End of 2nd half,81,58,2nd Half,0:00,False,,2025-01-05T04:56:28Z
401706679102999902,102999902,End Game,End of Game,81,58,2nd Half,0:00,False,,2025-01-05T04:56:28Z
