play_id,sequence_number,type,description,away_score,home_score,period,clock,scoring_play,team_id,timestamp_utc
401715871102884401,102884401,JumpShot,George Beale Jr. missed Jumper.,41,58,2nd Half,11:55,False,2261,2024-11-24T17:22:49Z
401715871102884801,102884801,Defensive Rebound,Julian Bowie Defensive Rebound.,41,58,2nd Half,11:51,False,68,2024-11-24T17:22:49Z
401715871102885001,102885001,Lost Ball Turnover,Julian Bowie Turnover.,41,58,2nd Half,11:49,False,68,2024-11-24T17:22:49Z
401715871102885002,102885002,Steal,Noah Farrakhan Steal.,41,58,2nd Half,11:49,False,2261,2024-11-24T17:26:12Z
401715871102886201,102886201,JumpShot,Tyler Rice made Three Point Jumper. Assisted by Xzavier Long.,44,58,2nd Half,11:37,True,2261,2024-11-24T17:26:12Z
401715871102886601,102886601,ShortTimeOut,Hampton  Timeout,44,58,2nd Half,11:33,False,2261,2024-11-24T17:26:12Z
401715871102886602,102886602,OfficialTVTimeOut, Official TV Timeout,44,58,2nd Half,11:33,False,,2024-11-24T17:26:12Z
401715871102886801,102886801,Lost Ball Turnover,Alvaro Cardenas Turnover.,44,58,2nd Half,11:31,False,68,2024-11-24T17:26:12Z
401715871102886802,102886802,Steal,Noah Farrakhan Steal.,44,58,2nd Half,11:31,False,2261,2024-11-24T17:26:12Z
401715871102887401,102887401,Lost Ball Turnover,Ryan Hite Turnover.,44,58,2nd Half,11:25,False,2261,2024-11-24T17:26:49Z
401715871102887402,102887402,Steal,RJ Keene II Steal.,44,58,2nd Half,11:25,False,68,2024-11-24T17:26:49Z
401715871102887701,102887701,JumpShot,Tyson Degenhart made Jumper. Assisted by Alvaro Cardenas.,44,60,2nd Half,11:22,True,68,2024-11-24T17:26:49Z
401715871102887702,102887702,PersonalFoul,Foul on Ryan Hite.,44,60,2nd Half,11:22,False,2261,2024-11-24T17:26:49Z
401715871102887703,102887703,MadeFreeThrow,Tyson Degenhart made Free Throw.,44,61,2nd Half,11:22,True,68,2024-11-24T17:26:49Z
401715871102889501,102889501,LayUpShot,Kyrese Mullen missed Layup.,44,61,2nd Half,11:04,False,2261,2024-11-24T17:28:12Z
401715871102894101,102894101,Offensive Rebound,Dan Banister Jr. Offensive Rebound.,44,61,2nd Half,10:58,False,2261,2024-11-24T17:28:12Z
401715871102894102,102894102,PersonalFoul,Foul on Tyson Degenhart.,44,61,2nd Half,10:58,False,68,2024-11-24T17:28:12Z
401715871102895501,102895501,LayUpShot,Kyrese Mullen made Layup.,46,61,2nd Half,10:44,True,2261,2024-11-24T17:28:48Z
401715871102896201,102896201,Lost Ball Turnover,Alvaro Cardenas Turnover.,46,61,2nd Half,10:37,False,68,2024-11-24T17:28:48Z
401715871102896202,102896202,Steal,Dan Banister Jr. Steal.,46,61,2nd Half,10:37,False,2261,2024-11-24T17:28:48Z
401715871102896601,102896601,JumpShot,Dan Banister Jr. missed Jumper.,46,61,2nd Half,10:33,False,2261,2024-11-24T17:28:48Z
401715871102897901,102897901,Offensive Rebound,Noah Farrakhan Offensive Rebound.,46,61,2nd Half,10:20,False,2261,2024-11-24T17:30:12Z
401715871102897902,102897902,JumpShot,Noah Farrakhan made Jumper.,48,61,2nd Half,10:20,True,2261,2024-11-24T17:30:12Z
401715871102898201,102898201,PersonalFoul,Foul on Dan Banister Jr..,48,61,2nd Half,10:17,False,2261,2024-11-24T17:30:12Z
401715871102898202,102898202,MadeFreeThrow,O'Mar Stanley made Free Throw.,48,62,2nd Half,10:17,True,68,2024-11-24T17:30:12Z
401715871102898203,102898203,MadeFreeThrow,O'Mar Stanley made Free Throw.,48,63,2nd Half,10:17,True,68,2024-11-24T17:30:12Z
401715871102899501,102899501,JumpShot,Dan Banister Jr. missed Three Point Jumper.,48,63,2nd Half,10:04,False,2261,2024-11-24T17:30:12Z
401715871102899701,102899701,Defensive Rebound,O'Mar Stanley Defensive Rebound.,48,63,2nd Half,10:02,False,68,2024-11-24T17:30:12Z
401715871102905401,102905401,LayUpShot,O'Mar Stanley missed Layup.,48,63,2nd Half,9:45,False,68,2024-11-24T17:30:37Z
401715871102905701,102905701,Offensive Rebound,Tyson Degenhart Offensive Rebound.,48,63,2nd Half,9:42,False,68,2024-11-24T17:30:37Z
401715871102905801,102905801,LayUpShot,Tyson Degenhart missed Layup.,48,63,2nd Half,9:41,False,68,2024-11-24T17:30:37Z
401715871102905802,102905802,Defensive Rebound,Hampton Defensive Rebound.,48,63,2nd Half,9:41,False,2261,2024-11-24T17:30:37Z
401715871102907101,102907101,JumpShot,Noah Farrakhan made Jumper.,50,63,2nd Half,9:28,True,2261,2024-11-24T17:32:13Z
401715871102909901,102909901,JumpShot,Alvaro Cardenas made Jumper.,50,65,2nd Half,9:00,True,68,2024-11-24T17:32:13Z
401715871102916701,102916701,JumpShot,Kyrese Mullen made Three Point Jumper. Assisted by Tyler Rice.,53,65,2nd Half,8:32,True,2261,2024-11-24T17:32:13Z
401715871102917701,102917701,JumpShot,Andrew Meadow missed Three Point Jumper.,53,65,2nd Half,8:22,False,68,2024-11-24T17:32:13Z
401715871102918201,102918201,Offensive Rebound,Alvaro Cardenas Offensive Rebound.,53,65,2nd Half,8:17,False,68,2024-11-24T17:32:13Z
401715871102918301,102918301,PersonalFoul,Foul on Noah Farrakhan.,53,65,2nd Half,8:16,False,2261,2024-11-24T17:32:13Z
401715871102918302,102918302,MadeFreeThrow,O'Mar Stanley made Free Throw.,53,66,2nd Half,8:16,True,68,2024-11-24T17:32:13Z
401715871102918303,102918303,MadeFreeThrow,O'Mar Stanley missed Free Throw.,53,66,2nd Half,8:16,False,68,2024-11-24T17:32:13Z
401715871102918401,102918401,Defensive Rebound,Kyrese Mullen Defensive Rebound.,53,66,2nd Half,8:15,False,2261,2024-11-24T17:34:12Z
401715871102924601,102924601,JumpShot,Noah Farrakhan missed Three Point Jumper.,53,66,2nd Half,7:53,False,2261,2024-11-24T17:34:12Z
401715871102924801,102924801,Offensive Rebound,Dan Banister Jr. Offensive Rebound.,53,66,2nd Half,7:51,False,2261,2024-11-24T17:34:12Z
401715871102924802,102924802,OfficialTVTimeOut, Official TV Timeout,53,66,2nd Half,7:51,False,,2024-11-24T17:34:12Z
401715871102925101,102925101,JumpShot,Noah Farrakhan missed Three Point Jumper.,53,66,2nd Half,7:48,False,2261,2024-11-24T17:36:38Z
401715871102925102,102925102,PersonalFoul,Foul on Tyson Degenhart.,53,66,2nd Half,7:48,False,68,2024-11-24T17:36:51Z
401715871102925401,102925401,Offensive Rebound,Hampton Offensive Rebound.,53,66,2nd Half,7:45,False,2261,2024-11-24T17:36:38Z
401715871102926201,102926201,JumpShot,Kyrese Mullen missed Three Point Jumper.,53,66,2nd Half,7:37,False,2261,2024-11-24T17:36:51Z
401715871102926501,102926501,Defensive Rebound,Alvaro Cardenas Defensive Rebound.,53,66,2nd Half,7:34,False,68,2024-11-24T17:38:12Z
401715871102927201,102927201,Lost Ball Turnover,Andrew Meadow Turnover.,53,66,2nd Half,7:27,False,68,2024-11-24T17:38:12Z
401715871102927202,102927202,Steal,Kyrese Mullen Steal.,53,66,2nd Half,7:27,False,2261,2024-11-24T17:38:12Z
401715871102928001,102928001,JumpShot,George Beale Jr. missed Jumper.,53,66,2nd Half,7:19,False,2261,2024-11-24T17:38:12Z
401715871102928401,102928401,Defensive Rebound,Emmanuel Ugbo Defensive Rebound.,53,66,2nd Half,7:15,False,68,2024-11-24T17:38:12Z
401715871102929301,102929301,LayUpShot,Tyson Degenhart made Layup. Assisted by Alvaro Cardenas.,53,68,2nd Half,7:06,True,68,2024-11-24T17:38:12Z
401715871102934601,102934601,LayUpShot,Kyrese Mullen missed Layup.,53,68,2nd Half,6:53,False,2261,2024-11-24T17:38:12Z
401715871102934602,102934602,Block Shot,Emmanuel Ugbo Block.,53,68,2nd Half,6:53,False,68,2024-11-24T17:38:12Z
401715871102935001,102935001,Defensive Rebound,Andrew Meadow Defensive Rebound.,53,68,2nd Half,6:49,False,68,2024-11-24T17:38:12Z
401715871102936001,102936001,LayUpShot,Emmanuel Ugbo made Layup. Assisted by RJ Keene II.,53,70,2nd Half,6:39,True,68,2024-11-24T17:38:12Z
401715871102936701,102936701,ShortTimeOut,Hampton  Timeout,53,70,2nd Half,6:32,False,2261,2024-11-24T17:38:12Z
401715871102938301,102938301,JumpShot,George Beale Jr. made Three Point Jumper. Assisted by Kyrese Mullen.,56,70,2nd Half,6:16,True,2261,2024-11-24T17:40:12Z
401715871102944001,102944001,PersonalFoul,Foul on Dan Banister Jr..,56,70,2nd Half,5:59,False,2261,2024-11-24T17:40:12Z
401715871102944002,102944002,MadeFreeThrow,Emmanuel Ugbo made Free Throw.,56,71,2nd Half,5:59,True,68,2024-11-24T17:40:12Z
401715871102944003,102944003,MadeFreeThrow,Emmanuel Ugbo made Free Throw.,56,72,2nd Half,5:59,True,68,2024-11-24T17:40:12Z
401715871102946101,102946101,JumpShot,George Beale Jr. made Jumper.,58,72,2nd Half,5:38,True,2261,2024-11-24T17:42:13Z
401715871102947401,102947401,Lost Ball Turnover,Alvaro Cardenas Turnover.,58,72,2nd Half,5:25,False,68,2024-11-24T17:42:13Z
401715871102947402,102947402,Steal,Tyler Rice Steal.,58,72,2nd Half,5:25,False,2261,2024-11-24T17:42:13Z
401715871102947901,102947901,LayUpShot,Tyler Rice made Layup.,60,72,2nd Half,5:20,True,2261,2024-11-24T17:42:13Z
401715871102948501,102948501,Lost Ball Turnover,Andrew Meadow Turnover.,60,72,2nd Half,5:14,False,68,2024-11-24T17:42:13Z
401715871102948502,102948502,JumpShot,Noah Farrakhan missed Three Point Jumper.,60,72,2nd Half,5:14,False,2261,2024-11-24T17:42:13Z
401715871102948503,102948503,Defensive Rebound,Andrew Meadow Defensive Rebound.,60,72,2nd Half,5:14,False,68,2024-11-24T17:42:13Z
401715871102948504,102948504,JumpShot,RJ Keene II missed Three Point Jumper.,60,72,2nd Half,5:14,False,68,2024-11-24T17:42:13Z
401715871102948505,102948505,Defensive Rebound,Noah Farrakhan Defensive Rebound.,60,72,2nd Half,5:14,False,2261,2024-11-24T17:42:13Z
401715871102948506,102948506,JumpShot,Tyler Rice missed Three Point Jumper.,60,72,2nd Half,5:14,False,2261,2024-11-24T17:42:13Z
401715871102948507,102948507,Defensive Rebound,Emmanuel Ugbo Defensive Rebound.,60,72,2nd Half,5:14,False,68,2024-11-24T17:42:13Z
401715871102957301,102957301,PersonalFoul,Foul on Tyler Rice.,60,72,2nd Half,4:26,False,2261,2024-11-24T17:44:12Z
401715871102957302,102957302,MadeFreeThrow,Tyson Degenhart made Free Throw.,60,73,2nd Half,4:26,True,68,2024-11-24T17:44:12Z
401715871102957303,102957303,MadeFreeThrow,Tyson Degenhart missed Free Throw.,60,73,2nd Half,4:26,False,68,2024-11-24T17:44:12Z
401715871102957501,102957501,Offensive Rebound,RJ Keene II Offensive Rebound.,60,73,2nd Half,4:24,False,68,2024-11-24T17:44:12Z
401715871102958001,102958001,Lost Ball Turnover,Tyson Degenhart Turnover.,60,73,2nd Half,4:19,False,68,2024-11-24T17:44:12Z
401715871102958002,102958002,Steal,Noah Farrakhan Steal.,60,73,2nd Half,4:19,False,2261,2024-11-24T17:44:12Z
401715871102964601,102964601,JumpShot,Tyler Rice made Jumper.,62,73,2nd Half,3:53,True,2261,2024-11-24T17:44:12Z
401715871102965501,102965501,PersonalFoul,Foul on Dan Banister Jr..,62,73,2nd Half,3:44,False,2261,2024-11-24T17:44:36Z
401715871102965502,102965502,OfficialTVTimeOut, Official TV Timeout,62,73,2nd Half,3:44,False,,2024-11-24T17:44:36Z
401715871102965503,102965503,MadeFreeThrow,Tyson Degenhart missed Free Throw.,62,73,2nd Half,3:44,False,68,2024-11-24T17:44:36Z
401715871102965504,102965504,Offensive Rebound,Boise State Offensive Rebound.,62,73,2nd Half,3:44,False,68,2024-11-24T17:44:36Z
401715871102965505,102965505,MadeFreeThrow,Tyson Degenhart made Free Throw.,62,74,2nd Half,3:44,True,68,2024-11-24T17:44:36Z
401715871102966601,102966601,JumpShot,Noah Farrakhan missed Three Point Jumper.,62,74,2nd Half,3:33,False,2261,2024-11-24T17:48:13Z
401715871102966801,102966801,Defensive Rebound,RJ Keene II Defensive Rebound.,62,74,2nd Half,3:31,False,68,2024-11-24T17:48:13Z
401715871102969101,102969101,JumpShot,Tyson Degenhart made Jumper.,62,76,2nd Half,3:08,True,68,2024-11-24T17:48:13Z
401715871102975901,102975901,JumpShot,Noah Farrakhan made Three Point Jumper. Assisted by Tyler Rice.,65,76,2nd Half,2:40,True,2261,2024-11-24T17:48:58Z
401715871102976201,102976201,RegularTimeOut,Hampton  Timeout,65,76,2nd Half,2:37,False,2261,2024-11-24T17:48:58Z
401715871102976801,102976801,PersonalFoul,Foul on Tyler Rice.,65,76,2nd Half,2:31,False,2261,2024-11-24T17:50:57Z
401715871102976802,102976802,MadeFreeThrow,Alvaro Cardenas made Free Throw.,65,77,2nd Half,2:31,True,68,2024-11-24T17:50:57Z
401715871102976803,102976803,MadeFreeThrow,Alvaro Cardenas made Free Throw.,65,78,2nd Half,2:31,True,68,2024-11-24T17:50:57Z
401715871102978201,102978201,JumpShot,Noah Farrakhan missed Jumper.,65,78,2nd Half,2:17,False,2261,2024-11-24T17:52:13Z
401715871102978202,102978202,Block Shot,Emmanuel Ugbo Block.,65,78,2nd Half,2:17,False,68,2024-11-24T17:52:13Z
401715871102978701,102978701,Offensive Rebound,Hampton Offensive Rebound.,65,78,2nd Half,2:12,False,2261,2024-11-24T17:52:13Z
401715871102979601,102979601,LayUpShot,Kyrese Mullen made Layup.,67,78,2nd Half,2:03,True,2261,2024-11-24T17:52:48Z
401715871102986301,102986301,DunkShot,RJ Keene II missed Dunk.,67,78,2nd Half,1:36,False,68,2024-11-24T17:53:10Z
401715871102986302,102986302,Block Shot,Xzavier Long Block.,67,78,2nd Half,1:36,False,2261,2024-11-24T17:53:10Z
401715871102986401,102986401,PersonalFoul,Foul on Noah Farrakhan.,67,78,2nd Half,1:35,False,2261,2024-11-24T17:53:10Z
401715871102986402,102986402,MadeFreeThrow,Tyson Degenhart made Free Throw.,67,79,2nd Half,1:35,True,68,2024-11-24T17:53:10Z
401715871102986403,102986403,MadeFreeThrow,Tyson Degenhart made Free Throw.,67,80,2nd Half,1:35,True,68,2024-11-24T17:53:10Z
401715871102986801,102986801,Offensive Rebound,Tyson Degenhart Offensive Rebound.,67,80,2nd Half,1:31,False,68,2024-11-24T17:54:34Z
401715871102987101,102987101,JumpShot,Noah Farrakhan made Jumper.,69,80,2nd Half,1:28,True,2261,2024-11-24T17:54:34Z
401715871102988401,102988401,DunkShot,Emmanuel Ugbo made Dunk. Assisted by RJ Keene II.,69,82,2nd Half,1:15,True,68,2024-11-24T17:54:57Z
401715871102994301,102994301,PersonalFoul,Foul on Emmanuel Ugbo.,69,82,2nd Half,0:56,False,68,2024-11-24T17:55:08Z
401715871102994901,102994901,Lost Ball Turnover,George Beale Jr. Turnover.,69,82,2nd Half,0:50,False,2261,2024-11-24T17:56:12Z
401715871102994902,102994902,Steal,RJ Keene II Steal.,69,82,2nd Half,0:50,False,68,2024-11-24T17:56:12Z
401715871102996701,102996701,PersonalFoul,Foul on Noah Farrakhan.,69,82,2nd Half,0:32,False,2261,2024-11-24T17:56:12Z
401715871102996702,102996702,MadeFreeThrow,Alvaro Cardenas made Free Throw.,69,83,2nd Half,0:32,True,68,2024-11-24T17:56:12Z
401715871102996703,102996703,MadeFreeThrow,Alvaro Cardenas missed Free Throw.,69,83,2nd Half,0:32,False,68,2024-11-24T17:56:12Z
401715871102996801,102996801,Defensive Rebound,Kyrese Mullen Defensive Rebound.,69,83,2nd Half,0:31,False,2261,2024-11-24T17:56:47Z
401715871102997701,102997701,JumpShot,Trevor Smith missed Three Point Jumper.,69,83,2nd Half,0:22,False,2261,2024-11-24T17:56:47Z
401715871102998001,102998001,Defensive Rebound,Emmanuel Ugbo Defensive Rebound.,69,83,2nd Half,0:19,False,68,2024-11-24T17:57:10Z
