play_id,sequence_number,type,description,away_score,home_score,period,clock,scoring_play,team_id,timestamp_utc
401743879113289302,113289302,Substitution,David Joplin subbing out for Marquette,34,46,1st Half,1:18,False,269,2025-03-13T19:25:20Z
401743879113289303,113289303,Substitution,Zaide Lowery subbing in for Marquette,34,46,1st Half,1:18,False,269,2025-03-13T19:25:20Z
401743879113289304,113289304,Substitution,Kam Jones subbing out for Marquette,34,46,1st Half,1:18,False,269,2025-03-13T19:25:28Z
401743879113289305,113289305,Substitution,Tre Norman subbing in for Marquette,34,46,1st Half,1:18,False,269,2025-03-13T19:25:28Z
401743879113289352,113289352,LayUpShot,Dante Maddox Jr. missed Layup.,34,46,1st Half,1:04,False,2752,2025-03-13T19:25:48Z
401743879113289353,113289353,Block Shot,Royce Parham Block.,34,46,1st Half,1:04,False,269,2025-03-13T19:25:48Z
401743879113289356,113289356,Defensive Rebound,Zaide Lowery Defensive Rebound.,34,46,1st Half,1:02,False,269,2025-03-13T19:25:50Z
401743879113289360,113289360,LayUpShot,Zaide Lowery missed Layup.,34,46,1st Half,0:50,False,269,2025-03-13T19:26:02Z
401743879113289361,113289361,Defensive Rebound,Ryan Conwell Defensive Rebound.,34,46,1st Half,0:48,False,2752,2025-03-13T19:26:04Z
401743879113289406,113289406,PersonalFoul,Foul on John Hugley IV.,34,46,1st Half,0:38,False,2752,2025-03-13T19:26:24Z
401743879113289407,113289407,Lost Ball Turnover,John Hugley IV Turnover.,34,46,1st Half,0:38,False,2752,2025-03-13T19:26:24Z
401743879113289413,113289413,Substitution,John Hugley IV subbing out for Xavier,34,46,1st Half,0:38,False,2752,2025-03-13T19:26:40Z
401743879113289414,113289414,Substitution,Dante Maddox Jr. subbing out for Xavier,34,46,1st Half,0:38,False,2752,2025-03-13T19:26:40Z
401743879113289415,113289415,Substitution,Marcus Foster subbing in for Xavier,34,46,1st Half,0:38,False,2752,2025-03-13T19:26:40Z
401743879113289416,113289416,Substitution,Jerome Hunter subbing in for Xavier,34,46,1st Half,0:38,False,2752,2025-03-13T19:26:40Z
401743879113289417,113289417,Substitution,Stevie Mitchell subbing out for Marquette,34,46,1st Half,0:38,False,269,2025-03-13T19:26:40Z
401743879113289418,113289418,Substitution,Royce Parham subbing out for Marquette,34,46,1st Half,0:38,False,269,2025-03-13T19:26:40Z
401743879113289419,113289419,Substitution,Tre Norman subbing out for Marquette,34,46,1st Half,0:38,False,269,2025-03-13T19:26:40Z
401743879113289420,113289420,Substitution,Kam Jones subbing in for Marquette,34,46,1st Half,0:38,False,269,2025-03-13T19:26:40Z
401743879113289421,113289421,Substitution,Ben Gold subbing in for Marquette,34,46,1st Half,0:38,False,269,2025-03-13T19:26:40Z
401743879113289422,113289422,Substitution,David Joplin subbing in for Marquette,34,46,1st Half,0:38,False,269,2025-03-13T19:26:40Z
401743879113289449,113289449,LayUpShot,Kam Jones made Layup.,36,46,1st Half,0:18,True,269,2025-03-13T19:27:10Z
401743879113289451,113289451,JumpShot,Ryan Conwell missed Three Point Jumper.,36,46,1st Half,0:00,False,2752,2025-03-13T19:27:29Z
401743879113289454,113289454,Dead Ball Rebound,Xavier Deadball Team Rebound.,36,46,1st Half,0:00,False,2752,2025-03-13T19:27:32Z
401743879113289455,113289455,End Period,End of 1st half,36,46,1st Half,0:00,False,,2025-03-13T19:27:33Z
401743879113290071,113290071,Substitution,Jerome Hunter subbing out for Xavier,36,46,2nd Half,20:00,False,2752,2025-03-13T19:42:47Z
401743879113290072,113290072,Substitution,Dailyn Swain subbing in for Xavier,36,46,2nd Half,20:00,False,2752,2025-03-13T19:42:47Z
401743879113290073,113290073,Substitution,Zaide Lowery subbing out for Marquette,36,46,2nd Half,20:00,False,269,2025-03-13T19:42:47Z
401743879113290074,113290074,Substitution,Stevie Mitchell subbing in for Marquette,36,46,2nd Half,20:00,False,269,2025-03-13T19:42:47Z
401743879113290079,113290079,JumpShot,David Joplin missed Three Point Jumper.,36,46,2nd Half,19:35,False,269,2025-03-13T19:44:45Z
401743879113290080,113290080,Defensive Rebound,Dailyn Swain Defensive Rebound.,36,46,2nd Half,19:33,False,2752,2025-03-13T19:44:46Z
401743879113290081,113290081,LayUpShot,Ryan Conwell made Layup.,36,48,2nd Half,19:26,True,2752,2025-03-13T19:44:53Z
401743879113290082,113290082,LayUpShot,Chase Ross made Layup.,38,48,2nd Half,19:19,True,269,2025-03-13T19:45:00Z
401743879113290429,113290429,Lost Ball Turnover,Zach Freemantle Turnover.,38,48,2nd Half,18:58,False,2752,2025-03-13T19:45:41Z
401743879113290430,113290430,Steal,Stevie Mitchell Steal.,38,48,2nd Half,18:58,False,269,2025-03-13T19:45:41Z
401743879113290431,113290431,Lost Ball Turnover,Stevie Mitchell Turnover.,38,48,2nd Half,18:56,False,269,2025-03-13T19:45:46Z
401743879113290432,113290432,JumpShot,Marcus Foster missed Three Point Jumper.,38,48,2nd Half,18:50,False,2752,2025-03-13T19:45:50Z
401743879113290433,113290433,Offensive Rebound,Marcus Foster Offensive Rebound.,38,48,2nd Half,18:47,False,2752,2025-03-13T19:45:52Z
401743879113290435,113290435,LayUpShot,Marcus Foster missed Layup.,38,48,2nd Half,18:34,False,2752,2025-03-13T19:46:06Z
401743879113290436,113290436,Defensive Rebound,David Joplin Defensive Rebound.,38,48,2nd Half,18:31,False,269,2025-03-13T19:46:08Z
401743879113290506,113290506,PersonalFoul,Foul on Dayvion McKnight.,38,48,2nd Half,18:23,False,2752,2025-03-13T19:46:19Z
401743879113290513,113290513,MadeFreeThrow,Kam Jones missed Free Throw.,38,48,2nd Half,18:23,False,269,2025-03-13T19:46:52Z
401743879113290514,113290514,Dead Ball Rebound,Marquette Deadball Team Rebound.,38,48,2nd Half,18:23,False,269,2025-03-13T19:46:52Z
401743879113290516,113290516,MadeFreeThrow,Kam Jones made Free Throw.,39,48,2nd Half,18:23,True,269,2025-03-13T19:47:02Z
401743879113290523,113290523,JumpShot,Ryan Conwell made Three Point Jumper. Assisted by Dayvion McKnight.,39,51,2nd Half,17:54,True,2752,2025-03-13T19:47:37Z
401743879113290589,113290589,JumpShot,Ben Gold missed Three Point Jumper.,39,51,2nd Half,17:40,False,269,2025-03-13T19:47:51Z
401743879113290590,113290590,Defensive Rebound,Dayvion McKnight Defensive Rebound.,39,51,2nd Half,17:38,False,2752,2025-03-13T19:47:52Z
401743879113290594,113290594,PersonalFoul,Foul on David Joplin.,39,51,2nd Half,17:34,False,269,2025-03-13T19:48:08Z
401743879113290602,113290602,MadeFreeThrow,Dayvion McKnight made Free Throw.,39,52,2nd Half,17:34,True,2752,2025-03-13T19:48:24Z
401743879113290604,113290604,MadeFreeThrow,Dayvion McKnight made Free Throw.,39,53,2nd Half,17:34,True,2752,2025-03-13T19:48:38Z
401743879113290631,113290631,JumpShot,Stevie Mitchell missed Three Point Jumper.,39,53,2nd Half,17:22,False,269,2025-03-13T19:48:53Z
401743879113290632,113290632,Defensive Rebound,Zach Freemantle Defensive Rebound.,39,53,2nd Half,17:19,False,2752,2025-03-13T19:48:55Z
401743879113290633,113290633,LayUpShot,Zach Freemantle missed Layup.,39,53,2nd Half,17:10,False,2752,2025-03-13T19:49:05Z
401743879113290634,113290634,Defensive Rebound,David Joplin Defensive Rebound.,39,53,2nd Half,17:08,False,269,2025-03-13T19:49:06Z
401743879113290636,113290636,JumpShot,Kam Jones made Three Point Jumper. Assisted by David Joplin.,42,53,2nd Half,16:59,True,269,2025-03-13T19:49:17Z
401743879113290688,113290688,JumpShot,Dailyn Swain missed Jumper.,42,53,2nd Half,16:30,False,2752,2025-03-13T19:49:44Z
401743879113290689,113290689,Defensive Rebound,Ben Gold Defensive Rebound.,42,53,2nd Half,16:28,False,269,2025-03-13T19:49:46Z
401743879113290713,113290713,JumpShot,Chase Ross made Three Point Jumper. Assisted by Kam Jones.,45,53,2nd Half,16:18,True,269,2025-03-13T19:49:58Z
401743879113290729,113290729,JumpShot,Ryan Conwell made Jumper.,45,55,2nd Half,15:52,True,2752,2025-03-13T19:50:23Z
401743879113290745,113290745,JumpShot,Stevie Mitchell made Three Point Jumper. Assisted by Chase Ross.,48,55,2nd Half,15:43,True,269,2025-03-13T19:50:32Z
401743879113290770,113290770,JumpShot,Ryan Conwell made Three Point Jumper.,48,58,2nd Half,15:13,True,2752,2025-03-13T19:51:03Z
401743879113290778,113290778,ShortTimeOut,Xavier Timeout,48,58,2nd Half,15:09,False,2752,2025-03-13T19:51:11Z
401743879113290779,113290779,OfficialTVTimeOut,Official TV Timeout,48,58,2nd Half,15:09,False,,2025-03-13T19:51:13Z
401743879113291009,113291009,Substitution,Marcus Foster subbing out for Xavier,48,58,2nd Half,15:09,False,2752,2025-03-13T19:54:47Z
401743879113291010,113291010,Substitution,Dailyn Swain subbing out for Xavier,48,58,2nd Half,15:09,False,2752,2025-03-13T19:54:47Z
401743879113291011,113291011,Substitution,Jerome Hunter subbing in for Xavier,48,58,2nd Half,15:09,False,2752,2025-03-13T19:54:47Z
401743879113291012,113291012,Substitution,Dante Maddox Jr. subbing in for Xavier,48,58,2nd Half,15:09,False,2752,2025-03-13T19:54:47Z
401743879113291013,113291013,Substitution,Stevie Mitchell subbing out for Marquette,48,58,2nd Half,15:09,False,269,2025-03-13T19:54:47Z
401743879113291014,113291014,Substitution,Ben Gold subbing out for Marquette,48,58,2nd Half,15:09,False,269,2025-03-13T19:54:47Z
401743879113291016,113291016,Substitution,Zaide Lowery subbing in for Marquette,48,58,2nd Half,15:09,False,269,2025-03-13T19:54:47Z
401743879113291017,113291017,Substitution,Royce Parham subbing in for Marquette,48,58,2nd Half,15:09,False,269,2025-03-13T19:54:47Z
401743879113291029,113291029,LayUpShot,Chase Ross made Layup. Assisted by Kam Jones.,50,58,2nd Half,14:49,True,269,2025-03-13T19:55:09Z
401743879113291053,113291053,LayUpShot,Zach Freemantle missed Layup.,50,58,2nd Half,14:19,False,2752,2025-03-13T19:55:39Z
401743879113291055,113291055,Defensive Rebound,David Joplin Defensive Rebound.,50,58,2nd Half,14:17,False,269,2025-03-13T19:55:40Z
401743879113291077,113291077,JumpShot,Royce Parham made Three Point Jumper. Assisted by Kam Jones.,53,58,2nd Half,13:56,True,269,2025-03-13T19:56:02Z
401743879113291112,113291112,LayUpShot,Dayvion McKnight made Layup.,53,60,2nd Half,13:36,True,2752,2025-03-13T19:56:21Z
401743879113291122,113291122,JumpShot,Kam Jones missed Jumper.,53,60,2nd Half,13:26,False,269,2025-03-13T19:56:32Z
401743879113291123,113291123,Defensive Rebound,Jerome Hunter Defensive Rebound.,53,60,2nd Half,13:24,False,2752,2025-03-13T19:56:33Z
401743879113291124,113291124,LayUpShot,Ryan Conwell made Layup.,53,62,2nd Half,13:20,True,2752,2025-03-13T19:56:38Z
401743879113291148,113291148,PersonalFoul,Foul on Dante Maddox Jr..,53,62,2nd Half,13:04,False,2752,2025-03-13T19:56:58Z
401743879113291170,113291170,OfficialTVTimeOut,Official TV Timeout,53,62,2nd Half,13:04,False,,2025-03-13T19:57:19Z
401743879113291365,113291365,Substitution,Ryan Conwell subbing out for Xavier,53,62,2nd Half,13:04,False,2752,2025-03-13T20:00:24Z
401743879113291367,113291367,Substitution,Zach Freemantle subbing out for Xavier,53,62,2nd Half,13:04,False,2752,2025-03-13T20:00:24Z
401743879113291369,113291369,Substitution,Marcus Foster subbing in for Xavier,53,62,2nd Half,13:04,False,2752,2025-03-13T20:00:24Z
401743879113291371,113291371,Substitution,Dailyn Swain subbing in for Xavier,53,62,2nd Half,13:04,False,2752,2025-03-13T20:00:24Z
401743879113291389,113291389,JumpShot,Royce Parham made Three Point Jumper. Assisted by Kam Jones.,56,62,2nd Half,12:43,True,269,2025-03-13T20:00:49Z
401743879113291420,113291420,PersonalFoul,Foul on Royce Parham.,56,62,2nd Half,12:21,False,269,2025-03-13T20:01:17Z
401743879113291428,113291428,Substitution,David Joplin subbing out for Marquette,56,62,2nd Half,12:21,False,269,2025-03-13T20:01:30Z
401743879113291429,113291429,Substitution,Stevie Mitchell subbing in for Marquette,56,62,2nd Half,12:21,False,269,2025-03-13T20:01:30Z
401743879113291447,113291447,Lost Ball Turnover,Jerome Hunter Turnover.,56,62,2nd Half,12:18,False,2752,2025-03-13T20:01:41Z
401743879113291448,113291448,Steal,Kam Jones Steal.,56,62,2nd Half,12:18,False,269,2025-03-13T20:01:41Z
401743879113291449,113291449,LayUpShot,Kam Jones made Layup.,58,62,2nd Half,12:14,True,269,2025-03-13T20:01:45Z
401743879113291476,113291476,JumpShot,Jerome Hunter missed Jumper.,58,62,2nd Half,11:48,False,2752,2025-03-13T20:02:11Z
401743879113291477,113291477,Defensive Rebound,Zaide Lowery Defensive Rebound.,58,62,2nd Half,11:45,False,269,2025-03-13T20:02:14Z
401743879113291483,113291483,JumpShot,Zaide Lowery missed Three Point Jumper.,58,62,2nd Half,11:36,False,269,2025-03-13T20:02:24Z
401743879113291484,113291484,Defensive Rebound,Dailyn Swain Defensive Rebound.,58,62,2nd Half,11:32,False,2752,2025-03-13T20:02:26Z
401743879113291485,113291485,Lost Ball Turnover,Dailyn Swain Turnover.,58,62,2nd Half,11:29,False,2752,2025-03-13T20:02:30Z
401743879113291490,113291490,Steal,Stevie Mitchell Steal.,58,62,2nd Half,11:29,False,269,2025-03-13T20:02:30Z
401743879113291491,113291491,LayUpShot,Stevie Mitchell made Layup.,60,62,2nd Half,11:25,True,269,2025-03-13T20:02:34Z
401743879113291509,113291509,ShortTimeOut,Xavier Timeout,60,62,2nd Half,11:17,False,2752,2025-03-13T20:02:52Z
401743879113291510,113291510,OfficialTVTimeOut,Official TV Timeout,60,62,2nd Half,11:17,False,,2025-03-13T20:02:54Z
401743879113291635,113291635,Substitution,Jerome Hunter subbing out for Xavier,60,62,2nd Half,11:17,False,2752,2025-03-13T20:06:01Z
401743879113291637,113291637,Substitution,Dayvion McKnight subbing out for Xavier,60,62,2nd Half,11:17,False,2752,2025-03-13T20:06:01Z
401743879113291639,113291639,Substitution,Ryan Conwell subbing in for Xavier,60,62,2nd Half,11:17,False,2752,2025-03-13T20:06:01Z
401743879113291640,113291640,Substitution,Zach Freemantle subbing in for Xavier,60,62,2nd Half,11:17,False,2752,2025-03-13T20:06:01Z
401743879113291689,113291689,PersonalFoul,Foul on Stevie Mitchell.,60,62,2nd Half,10:56,False,269,2025-03-13T20:06:35Z
401743879113291709,113291709,Substitution,Royce Parham subbing out for Marquette,60,62,2nd Half,10:56,False,269,2025-03-13T20:06:51Z
401743879113291711,113291711,Substitution,Ben Gold subbing in for Marquette,60,62,2nd Half,10:56,False,269,2025-03-13T20:06:51Z
401743879113291746,113291746,JumpShot,Dante Maddox Jr. missed Three Point Jumper.,60,62,2nd Half,10:36,False,2752,2025-03-13T20:07:17Z
401743879113291748,113291748,Defensive Rebound,Zaide Lowery Defensive Rebound.,60,62,2nd Half,10:32,False,269,2025-03-13T20:07:18Z
401743879113291756,113291756,JumpShot,Kam Jones made Three Point Jumper. Assisted by Chase Ross.,63,62,2nd Half,10:26,True,269,2025-03-13T20:07:27Z
401743879113291773,113291773,LayUpShot,Dailyn Swain made Layup.,63,64,2nd Half,10:08,True,2752,2025-03-13T20:07:43Z
401743879113291781,113291781,JumpShot,Chase Ross missed Three Point Jumper.,63,64,2nd Half,9:59,False,269,2025-03-13T20:07:53Z
401743879113291783,113291783,Offensive Rebound,Ben Gold Offensive Rebound.,63,64,2nd Half,9:54,False,269,2025-03-13T20:07:57Z
401743879113291785,113291785,LayUpShot,Ben Gold made Layup.,65,64,2nd Half,9:53,True,269,2025-03-13T20:07:58Z
401743879113291805,113291805,JumpShot,Dante Maddox Jr. missed Three Point Jumper.,65,64,2nd Half,9:38,False,2752,2025-03-13T20:08:14Z
401743879113291806,113291806,Defensive Rebound,Chase Ross Defensive Rebound.,65,64,2nd Half,9:35,False,269,2025-03-13T20:08:16Z
401743879113291848,113291848,LayUpShot,Kam Jones missed Layup.,65,64,2nd Half,9:16,False,269,2025-03-13T20:08:35Z
401743879113291850,113291850,Defensive Rebound,Dailyn Swain Defensive Rebound.,65,64,2nd Half,9:14,False,2752,2025-03-13T20:08:37Z
401743879113291851,113291851,DunkShot,Zach Freemantle made Dunk. Assisted by Ryan Conwell.,65,66,2nd Half,9:11,True,2752,2025-03-13T20:08:41Z
401743879113291872,113291872,JumpShot,Kam Jones missed Jumper.,65,66,2nd Half,8:54,False,269,2025-03-13T20:08:57Z
401743879113291873,113291873,Defensive Rebound,Xavier Defensive Rebound.,65,66,2nd Half,8:54,False,2752,2025-03-13T20:09:01Z
401743879113291887,113291887,Substitution,Dailyn Swain subbing out for Xavier,65,66,2nd Half,8:54,False,2752,2025-03-13T20:09:20Z
401743879113291888,113291888,Substitution,Dayvion McKnight subbing in for Xavier,65,66,2nd Half,8:54,False,2752,2025-03-13T20:09:20Z
401743879113291890,113291890,Substitution,Zaide Lowery subbing out for Marquette,65,66,2nd Half,8:54,False,269,2025-03-13T20:09:20Z
401743879113291892,113291892,Substitution,David Joplin subbing in for Marquette,65,66,2nd Half,8:54,False,269,2025-03-13T20:09:20Z
401743879113291948,113291948,JumpShot,Zach Freemantle made Jumper.,65,68,2nd Half,8:26,True,2752,2025-03-13T20:09:54Z
401743879113291952,113291952,JumpShot,Stevie Mitchell missed Three Point Jumper.,65,68,2nd Half,8:11,False,269,2025-03-13T20:10:09Z
401743879113291954,113291954,Defensive Rebound,Ryan Conwell Defensive Rebound.,65,68,2nd Half,8:08,False,2752,2025-03-13T20:10:11Z
401743879113291960,113291960,DunkShot,Zach Freemantle missed Dunk.,65,68,2nd Half,8:04,False,2752,2025-03-13T20:10:15Z
401743879113291962,113291962,Defensive Rebound,David Joplin Defensive Rebound.,65,68,2nd Half,8:02,False,269,2025-03-13T20:10:17Z
401743879113291963,113291963,JumpShot,Kam Jones missed Three Point Jumper.,65,68,2nd Half,8:00,False,269,2025-03-13T20:10:21Z
401743879113291968,113291968,Defensive Rebound,Dante Maddox Jr. Defensive Rebound.,65,68,2nd Half,7:56,False,2752,2025-03-13T20:10:23Z
401743879113291983,113291983,JumpShot,Zach Freemantle missed Three Point Jumper.,65,68,2nd Half,7:29,False,2752,2025-03-13T20:10:52Z
401743879113291984,113291984,Defensive Rebound,Kam Jones Defensive Rebound.,65,68,2nd Half,7:25,False,269,2025-03-13T20:10:53Z
401743879113291990,113291990,Lost Ball Turnover,David Joplin Turnover.,65,68,2nd Half,7:14,False,269,2025-03-13T20:11:07Z
401743879113291991,113291991,OfficialTVTimeOut,Official TV Timeout,65,68,2nd Half,7:14,False,,2025-03-13T20:11:09Z
401743879113292146,113292146,Substitution,Zach Freemantle subbing out for Xavier,65,68,2nd Half,7:14,False,2752,2025-03-13T20:14:12Z
401743879113292147,113292147,Substitution,Jerome Hunter subbing in for Xavier,65,68,2nd Half,7:14,False,2752,2025-03-13T20:14:12Z
401743879113292148,113292148,Substitution,Chase Ross subbing out for Marquette,65,68,2nd Half,7:14,False,269,2025-03-13T20:14:12Z
401743879113292149,113292149,Substitution,Zaide Lowery subbing in for Marquette,65,68,2nd Half,7:14,False,269,2025-03-13T20:14:12Z
401743879113292157,113292157,Lost Ball Turnover,Marcus Foster Turnover.,65,68,2nd Half,6:55,False,2752,2025-03-13T20:14:37Z
401743879113292158,113292158,Steal,Stevie Mitchell Steal.,65,68,2nd Half,6:55,False,269,2025-03-13T20:14:37Z
401743879113292159,113292159,LayUpShot,Stevie Mitchell made Layup.,67,68,2nd Half,6:51,True,269,2025-03-13T20:14:40Z
401743879113292188,113292188,PersonalFoul,Foul on Kam Jones.,67,68,2nd Half,6:40,False,269,2025-03-13T20:14:57Z
401743879113292190,113292190,JumpShot,Ryan Conwell made Three Point Jumper. Assisted by Dayvion McKnight.,67,71,2nd Half,6:39,True,2752,2025-03-13T20:15:18Z
401743879113292207,113292207,PersonalFoul,Foul on Jerome Hunter.,67,71,2nd Half,6:19,False,2752,2025-03-13T20:15:43Z
401743879113292209,113292209,Substitution,Dante Maddox Jr. subbing out for Xavier,67,71,2nd Half,6:19,False,2752,2025-03-13T20:15:50Z
401743879113292210,113292210,Substitution,Dailyn Swain subbing in for Xavier,67,71,2nd Half,6:19,False,2752,2025-03-13T20:15:50Z
401743879113292223,113292223,LayUpShot,Stevie Mitchell made Layup.,69,71,2nd Half,6:04,True,269,2025-03-13T20:16:29Z
401743879113292262,113292262,Lost Ball Turnover,Dailyn Swain Turnover.,69,71,2nd Half,5:48,False,2752,2025-03-13T20:16:46Z
401743879113292265,113292265,Substitution,Jerome Hunter subbing out for Xavier,69,71,2nd Half,5:48,False,2752,2025-03-13T20:16:54Z
401743879113292266,113292266,Substitution,Zach Freemantle subbing in for Xavier,69,71,2nd Half,5:48,False,2752,2025-03-13T20:16:54Z
401743879113292267,113292267,Substitution,Zaide Lowery subbing out for Marquette,69,71,2nd Half,5:48,False,269,2025-03-13T20:16:54Z
401743879113292268,113292268,Substitution,Chase Ross subbing in for Marquette,69,71,2nd Half,5:48,False,269,2025-03-13T20:16:54Z
401743879113292279,113292279,JumpShot,Kam Jones made Three Point Jumper. Assisted by Ben Gold.,72,71,2nd Half,5:31,True,269,2025-03-13T20:17:20Z
401743879113292312,113292312,Lost Ball Turnover,Dailyn Swain Turnover.,72,71,2nd Half,5:10,False,2752,2025-03-13T20:17:40Z
401743879113292323,113292323,Steal,Chase Ross Steal.,72,71,2nd Half,5:10,False,269,2025-03-13T20:17:40Z
401743879113292325,113292325,LayUpShot,Stevie Mitchell made Layup. Assisted by Ben Gold.,74,71,2nd Half,5:00,True,269,2025-03-13T20:17:50Z
401743879113292336,113292336,JumpShot,Ryan Conwell missed Three Point Jumper.,74,71,2nd Half,4:42,False,2752,2025-03-13T20:18:09Z
401743879113292337,113292337,Offensive Rebound,Xavier Offensive Rebound.,74,71,2nd Half,4:41,False,2752,2025-03-13T20:18:12Z
401743879113292343,113292343,Substitution,Marcus Foster subbing out for Xavier,74,71,2nd Half,4:41,False,2752,2025-03-13T20:18:19Z
401743879113292345,113292345,Substitution,Dailyn Swain subbing out for Xavier,74,71,2nd Half,4:41,False,2752,2025-03-13T20:18:19Z
401743879113292347,113292347,Substitution,Jerome Hunter subbing in for Xavier,74,71,2nd Half,4:41,False,2752,2025-03-13T20:18:19Z
401743879113292349,113292349,Substitution,Dante Maddox Jr. subbing in for Xavier,74,71,2nd Half,4:41,False,2752,2025-03-13T20:18:19Z
401743879113292391,113292391,PersonalFoul,Foul on Stevie Mitchell.,74,71,2nd Half,4:38,False,269,2025-03-13T20:18:46Z
401743879113292408,113292408,MadeFreeThrow,Ryan Conwell made Free Throw.,74,72,2nd Half,4:38,True,2752,2025-03-13T20:19:14Z
401743879113292417,113292417,MadeFreeThrow,Ryan Conwell made Free Throw.,74,73,2nd Half,4:38,True,2752,2025-03-13T20:19:27Z
401743879113292447,113292447,JumpShot,David Joplin made Three Point Jumper.,77,73,2nd Half,4:14,True,269,2025-03-13T20:19:54Z
401743879113292462,113292462,PersonalFoul,Foul on David Joplin.,77,73,2nd Half,3:53,False,269,2025-03-13T20:20:19Z
401743879113292493,113292493,OfficialTVTimeOut,Official TV Timeout,77,73,2nd Half,3:53,False,,2025-03-13T20:20:24Z
401743879113292606,113292606,Substitution,Jerome Hunter subbing out for Xavier,77,73,2nd Half,3:53,False,2752,2025-03-13T20:23:22Z
401743879113292607,113292607,Substitution,Dante Maddox Jr. subbing out for Xavier,77,73,2nd Half,3:53,False,2752,2025-03-13T20:23:22Z
401743879113292608,113292608,Substitution,Marcus Foster subbing in for Xavier,77,73,2nd Half,3:53,False,2752,2025-03-13T20:23:22Z
401743879113292609,113292609,Substitution,Dailyn Swain subbing in for Xavier,77,73,2nd Half,3:53,False,2752,2025-03-13T20:23:22Z
401743879113292610,113292610,Substitution,David Joplin subbing out for Marquette,77,73,2nd Half,3:53,False,269,2025-03-13T20:23:22Z
401743879113292611,113292611,Substitution,Zaide Lowery subbing in for Marquette,77,73,2nd Half,3:53,False,269,2025-03-13T20:23:22Z
401743879113292603,113292603,LayUpShot,Ryan Conwell missed Layup.,77,73,2nd Half,3:35,False,2752,2025-03-13T20:23:53Z
401743879113292604,113292604,Offensive Rebound,Dailyn Swain Offensive Rebound.,77,73,2nd Half,3:35,False,2752,2025-03-13T20:23:55Z
401743879113292627,113292627,PersonalFoul,Foul on Chase Ross.,77,73,2nd Half,3:35,False,269,2025-03-13T20:23:58Z
401743879113292632,113292632,MadeFreeThrow,Dailyn Swain made Free Throw.,77,74,2nd Half,3:35,True,2752,2025-03-13T20:24:19Z
401743879113292633,113292633,Substitution,Zaide Lowery subbing out for Marquette,77,74,2nd Half,3:35,False,269,2025-03-13T20:24:23Z
401743879113292634,113292634,Substitution,David Joplin subbing in for Marquette,77,74,2nd Half,3:35,False,269,2025-03-13T20:24:23Z
401743879113292637,113292637,MadeFreeThrow,Dailyn Swain made Free Throw.,77,75,2nd Half,3:35,True,2752,2025-03-13T20:24:38Z
401743879113292686,113292686,JumpShot,Kam Jones missed Three Point Jumper.,77,75,2nd Half,3:10,False,269,2025-03-13T20:25:37Z
401743879113292687,113292687,Defensive Rebound,Dailyn Swain Defensive Rebound.,77,75,2nd Half,3:06,False,2752,2025-03-13T20:25:39Z
401743879113292688,113292688,LayUpShot,Ryan Conwell made Layup. Assisted by Zach Freemantle.,77,77,2nd Half,2:53,True,2752,2025-03-13T20:25:52Z
401743879113292690,113292690,LayUpShot,Kam Jones made Layup.,79,77,2nd Half,2:41,True,269,2025-03-13T20:26:05Z
401743879113292697,113292697,LayUpShot,Dayvion McKnight missed Layup.,79,77,2nd Half,2:22,False,2752,2025-03-13T20:26:24Z
401743879113292698,113292698,Defensive Rebound,Ben Gold Defensive Rebound.,79,77,2nd Half,2:19,False,269,2025-03-13T20:26:26Z
401743879113292702,113292702,JumpShot,David Joplin missed Three Point Jumper.,79,77,2nd Half,1:57,False,269,2025-03-13T20:26:49Z
401743879113292703,113292703,Defensive Rebound,Zach Freemantle Defensive Rebound.,79,77,2nd Half,1:54,False,2752,2025-03-13T20:26:51Z
401743879113292728,113292728,JumpShot,Ryan Conwell made Three Point Jumper. Assisted by Zach Freemantle.,79,80,2nd Half,1:36,True,2752,2025-03-13T20:27:10Z
401743879113292736,113292736,LayUpShot,Kam Jones made Layup.,81,80,2nd Half,1:16,True,269,2025-03-13T20:27:29Z
401743879113292739,113292739,ShortTimeOut,Marquette Timeout,81,80,2nd Half,1:16,False,269,2025-03-13T20:27:36Z
401743879113292921,113292921,Lost Ball Turnover,Zach Freemantle Turnover.,81,80,2nd Half,0:52,False,2752,2025-03-13T20:29:31Z
401743879113292922,113292922,Steal,Chase Ross Steal.,81,80,2nd Half,0:52,False,269,2025-03-13T20:29:31Z
401743879113292933,113292933,JumpShot,David Joplin made Three Point Jumper.,84,80,2nd Half,0:26,True,269,2025-03-13T20:29:58Z
401743879113292940,113292940,LayUpShot,Dayvion McKnight missed Layup.,84,80,2nd Half,0:21,False,2752,2025-03-13T20:30:06Z
401743879113292966,113292966,Block Shot,Ben Gold Block.,84,80,2nd Half,0:21,False,269,2025-03-13T20:30:06Z
401743879113292967,113292967,Offensive Rebound,Xavier Offensive Rebound.,84,80,2nd Half,0:21,False,2752,2025-03-13T20:30:09Z
401743879113292982,113292982,LayUpShot,Dailyn Swain made Layup.,84,82,2nd Half,0:16,True,2752,2025-03-13T20:30:38Z
401743879113292985,113292985,RegularTimeOut,Xavier Timeout,84,82,2nd Half,0:16,False,2752,2025-03-13T20:30:44Z
401743879113293036,113293036,Substitution,Zach Freemantle subbing out for Xavier,84,82,2nd Half,0:15,False,2752,2025-03-13T20:32:33Z
