play_id,sequence_number,type,description,away_score,home_score,period,clock,scoring_play,team_id,timestamp_utc
401715636102877401,102877401,JumpShot,Kerwin Walton made Three Point Jumper.,36,72,2nd Half,12:25,True,2641,2024-11-06T02:22:10Z
401715636102879801,102879801,PersonalFoul,Foul on Kevin Overton.,36,72,2nd Half,12:01,False,2641,2024-11-06T02:22:32Z
401715636102884101,102884101,JumpShot,Trey Thomas missed Jumper.,36,72,2nd Half,11:58,False,2065,2024-11-06T02:22:59Z
401715636102884801,102884801,Offensive Rebound,Jarrell Love Offensive Rebound.,36,72,2nd Half,11:51,False,2065,2024-11-06T02:23:05Z
401715636102884901,102884901,Lost Ball Turnover,Jarrell Love Turnover.,36,72,2nd Half,11:50,False,2065,2024-11-06T02:23:05Z
401715636102884902,102884902,Steal,Kevin Overton Steal.,36,72,2nd Half,11:50,False,2641,2024-11-06T02:23:05Z
401715636102885401,102885401,JumpShot,Kerwin Walton missed Three Point Jumper.,36,72,2nd Half,11:45,False,2641,2024-11-06T02:23:12Z
401715636102885701,102885701,Defensive Rebound,Reggie Ward Jr. Defensive Rebound.,36,72,2nd Half,11:42,False,2065,2024-11-06T02:23:15Z
401715636102885901,102885901,PersonalFoul,Foul on Devan Cambridge.,36,72,2nd Half,11:40,False,2641,2024-11-06T02:23:15Z
401715636102885902,102885902,OfficialTVTimeOut, Official TV Timeout,36,72,2nd Half,11:40,False,,2024-11-06T02:23:15Z
401715636102887401,102887401,JumpShot,Reggie Ward Jr. made Jumper.,38,72,2nd Half,11:25,True,2065,2024-11-06T02:27:13Z
401715636102889901,102889901,LayUpShot,Darrion Williams missed Layup.,38,72,2nd Half,11:00,False,2641,2024-11-06T02:27:40Z
401715636102894301,102894301,Defensive Rebound,Trey Thomas Defensive Rebound.,38,72,2nd Half,10:56,False,2065,2024-11-06T02:27:40Z
401715636102895901,102895901,JumpShot,Trey Thomas missed Three Point Jumper.,38,72,2nd Half,10:40,False,2065,2024-11-06T02:27:57Z
401715636102896301,102896301,Defensive Rebound,Devan Cambridge Defensive Rebound.,38,72,2nd Half,10:36,False,2641,2024-11-06T02:27:57Z
401715636102898301,102898301,JumpShot,Kerwin Walton made Three Point Jumper.,38,75,2nd Half,10:16,True,2641,2024-11-06T02:28:20Z
401715636102899401,102899401,LayUpShot,David Onanina made Layup. Assisted by Seneca Willoughby.,40,75,2nd Half,10:05,True,2065,2024-11-06T02:28:35Z
401715636102899901,102899901,ShortTimeOut,Texas Tech  Timeout,40,75,2nd Half,10:00,False,2641,2024-11-06T02:28:35Z
401715636102906901,102906901,JumpShot,Kevin Overton missed Three Point Jumper.,40,75,2nd Half,9:30,False,2641,2024-11-06T02:32:34Z
401715636102907201,102907201,Defensive Rebound,Jesus Carralero Martin Defensive Rebound.,40,75,2nd Half,9:27,False,2065,2024-11-06T02:32:37Z
401715636102908401,102908401,JumpShot,Jarrell Love missed Three Point Jumper.,40,75,2nd Half,9:15,False,2065,2024-11-06T02:32:49Z
401715636102908801,102908801,Defensive Rebound,Federiko Federiko Defensive Rebound.,40,75,2nd Half,9:11,False,2641,2024-11-06T02:32:52Z
401715636102914601,102914601,JumpShot,Kerwin Walton missed Jumper.,40,75,2nd Half,8:53,False,2641,2024-11-06T02:33:34Z
401715636102914602,102914602,Block Shot,Jarrell Love Block.,40,75,2nd Half,8:53,False,2065,2024-11-06T02:33:34Z
401715636102914603,102914603,Offensive Rebound,Texas Tech Offensive Rebound.,40,75,2nd Half,8:53,False,2641,2024-11-06T02:33:34Z
401715636102915301,102915301,JumpShot,Darrion Williams missed Jumper.,40,75,2nd Half,8:46,False,2641,2024-11-06T02:33:56Z
401715636102915601,102915601,Defensive Rebound,Reggie Ward Jr. Defensive Rebound.,40,75,2nd Half,8:43,False,2065,2024-11-06T02:33:59Z
401715636102916401,102916401,JumpShot,Brayon Freeman missed Three Point Jumper.,40,75,2nd Half,8:35,False,2065,2024-11-06T02:34:07Z
401715636102916701,102916701,Defensive Rebound,Kerwin Walton Defensive Rebound.,40,75,2nd Half,8:32,False,2641,2024-11-06T02:34:07Z
401715636102917601,102917601,JumpShot,Kevin Overton missed Jumper.,40,75,2nd Half,8:23,False,2641,2024-11-06T02:34:19Z
401715636102917602,102917602,Block Shot,Jesus Carralero Martin Block.,40,75,2nd Half,8:23,False,2065,2024-11-06T02:34:19Z
401715636102917603,102917603,Offensive Rebound,Kevin Overton Offensive Rebound.,40,75,2nd Half,8:23,False,2641,2024-11-06T02:34:19Z
401715636102918501,102918501,LayUpShot,JT Toppin made Layup. Assisted by Kevin Overton.,40,77,2nd Half,8:14,True,2641,2024-11-06T02:35:03Z
401715636102925001,102925001,LayUpShot,Jarrell Love made Layup. Assisted by Brayon Freeman.,42,77,2nd Half,7:49,True,2065,2024-11-06T02:35:28Z
401715636102926601,102926601,JumpShot,JT Toppin made Three Point Jumper. Assisted by Chance McMillian.,42,80,2nd Half,7:33,True,2641,2024-11-06T02:35:45Z
401715636102928301,102928301,LayUpShot,Gianni Hunt missed Layup.,42,80,2nd Half,7:16,False,2065,2024-11-06T02:36:02Z
401715636102928601,102928601,Defensive Rebound,JT Toppin Defensive Rebound.,42,80,2nd Half,7:13,False,2641,2024-11-06T02:36:02Z
401715636102928901,102928901,DunkShot,Kevin Overton made Dunk. Assisted by JT Toppin.,42,82,2nd Half,7:10,True,2641,2024-11-06T02:36:07Z
401715636102929503,102929503,OfficialTVTimeOut, Official TV Timeout,42,82,2nd Half,7:04,False,,2024-11-06T02:36:14Z
401715636102929504,102929504,PersonalFoul,Foul on Chance McMillian.,42,82,2nd Half,7:04,False,2641,2024-11-06T02:36:14Z
401715636102929505,102929505,MadeFreeThrow,Jarrell Love made Free Throw.,43,82,2nd Half,7:04,True,2065,2024-11-06T02:36:14Z
401715636102929506,102929506,MadeFreeThrow,Jarrell Love made Free Throw.,44,82,2nd Half,7:04,True,2065,2024-11-06T02:36:14Z
401715636102935801,102935801,JumpShot,Kerwin Walton missed Three Point Jumper.,44,82,2nd Half,6:41,False,2641,2024-11-06T02:40:56Z
401715636102936101,102936101,Offensive Rebound,Kevin Overton Offensive Rebound.,44,82,2nd Half,6:38,False,2641,2024-11-06T02:40:56Z
401715636102937901,102937901,Lost Ball Turnover,Texas Tech  Turnover.,44,82,2nd Half,6:20,False,2641,2024-11-06T02:41:29Z
401715636102939601,102939601,JumpShot,Brayon Freeman missed Three Point Jumper.,44,82,2nd Half,6:03,False,2065,2024-11-06T02:42:01Z
401715636102944101,102944101,Defensive Rebound,Texas Tech Defensive Rebound.,44,82,2nd Half,5:58,False,2641,2024-11-06T02:42:04Z
401715636102946401,102946401,JumpShot,JT Toppin missed Jumper.,44,82,2nd Half,5:35,False,2641,2024-11-06T02:42:51Z
401715636102946402,102946402,Block Shot,Jerome Beya Block.,44,82,2nd Half,5:35,False,2065,2024-11-06T02:42:51Z
401715636102947201,102947201,Offensive Rebound,JT Toppin Offensive Rebound.,44,82,2nd Half,5:27,False,2641,2024-11-06T02:42:58Z
401715636102947202,102947202,JumpShot,JT Toppin made Jumper.,44,84,2nd Half,5:27,True,2641,2024-11-06T02:42:58Z
401715636102948401,102948401,Lost Ball Turnover,Gianni Hunt Turnover.,44,84,2nd Half,5:15,False,2065,2024-11-06T02:43:12Z
401715636102948402,102948402,Steal,JT Toppin Steal.,44,84,2nd Half,5:15,False,2641,2024-11-06T02:43:12Z
401715636102949101,102949101,JumpShot,Kerwin Walton made Three Point Jumper. Assisted by Chance McMillian.,44,87,2nd Half,5:08,True,2641,2024-11-06T02:43:18Z
401715636102954001,102954001,JumpShot,Brayon Freeman made Three Point Jumper.,47,87,2nd Half,4:59,True,2065,2024-11-06T02:43:28Z
401715636102954301,102954301,ShortTimeOut,Texas Tech  Timeout,47,87,2nd Half,4:56,False,2641,2024-11-06T02:43:28Z
401715636102955401,102955401,JumpShot,Kerwin Walton missed Three Point Jumper.,47,87,2nd Half,4:45,False,2641,2024-11-06T02:44:51Z
401715636102955601,102955601,Defensive Rebound,Bethune-Cookman Defensive Rebound.,47,87,2nd Half,4:43,False,2065,2024-11-06T02:44:51Z
401715636102958001,102958001,JumpShot,Brayon Freeman missed Jumper.,47,87,2nd Half,4:19,False,2065,2024-11-06T02:45:24Z
401715636102958201,102958201,Offensive Rebound,Bethune-Cookman Offensive Rebound.,47,87,2nd Half,4:17,False,2065,2024-11-06T02:45:24Z
401715636102958501,102958501,LayUpShot,Reggie Ward Jr. made Layup. Assisted by Jarrell Love.,49,87,2nd Half,4:14,True,2065,2024-11-06T02:45:48Z
401715636102964101,102964101,JumpShot,JT Toppin missed Jumper.,49,87,2nd Half,3:58,False,2641,2024-11-06T02:46:06Z
401715636102964501,102964501,Defensive Rebound,Gianni Hunt Defensive Rebound.,49,87,2nd Half,3:54,False,2065,2024-11-06T02:46:09Z
401715636102964801,102964801,PersonalFoul,Foul on Kerwin Walton.,49,87,2nd Half,3:51,False,2641,2024-11-06T02:46:12Z
401715636102964802,102964802,OfficialTVTimeOut, Official TV Timeout,49,87,2nd Half,3:51,False,,2024-11-06T02:46:12Z
401715636102965601,102965601,LayUpShot,Reggie Ward Jr. missed Layup.,49,87,2nd Half,3:43,False,2065,2024-11-06T02:50:02Z
401715636102965602,102965602,Block Shot,JT Toppin Block.,49,87,2nd Half,3:43,False,2641,2024-11-06T02:50:02Z
401715636102966001,102966001,Defensive Rebound,Federiko Federiko Defensive Rebound.,49,87,2nd Half,3:39,False,2641,2024-11-06T02:50:05Z
401715636102967201,102967201,LayUpShot,Kevin Overton missed Layup.,49,87,2nd Half,3:27,False,2641,2024-11-06T02:50:50Z
401715636102967801,102967801,Offensive Rebound,Federiko Federiko Offensive Rebound.,49,87,2nd Half,3:21,False,2641,2024-11-06T02:50:53Z
401715636102967802,102967802,JumpShot,Federiko Federiko made Jumper.,49,89,2nd Half,3:21,True,2641,2024-11-06T02:50:53Z
401715636102969301,102969301,LayUpShot,Brayon Freeman missed Layup.,49,89,2nd Half,3:06,False,2065,2024-11-06T02:51:10Z
401715636102969302,102969302,Block Shot,JT Toppin Block.,49,89,2nd Half,3:06,False,2641,2024-11-06T02:51:10Z
401715636102969303,102969303,Offensive Rebound,Bethune-Cookman Offensive Rebound.,49,89,2nd Half,3:06,False,2065,2024-11-06T02:51:10Z
401715636102969601,102969601,LayUpShot,Reggie Ward Jr. made Layup.,51,89,2nd Half,3:03,True,2065,2024-11-06T02:51:29Z
401715636102976201,102976201,JumpShot,Chance McMillian made Jumper.,51,91,2nd Half,2:37,True,2641,2024-11-06T02:51:56Z
401715636102978401,102978401,JumpShot,Brayon Freeman made Three Point Jumper. Assisted by Trey Thomas.,54,91,2nd Half,2:15,True,2065,2024-11-06T02:52:18Z
401715636102984401,102984401,JumpShot,Kevin Overton made Three Point Jumper. Assisted by Federiko Federiko.,54,94,2nd Half,1:55,True,2641,2024-11-06T02:52:37Z
401715636102984601,102984601,ShortTimeOut,Texas Tech  Timeout,54,94,2nd Half,1:53,False,2641,2024-11-06T02:52:37Z
401715636102985601,102985601,JumpShot,Jarrell Love made Three Point Jumper. Assisted by Seneca Willoughby.,57,94,2nd Half,1:43,True,2065,2024-11-06T02:53:28Z
401715636102987301,102987301,Lost Ball Turnover,Federiko Federiko Turnover.,57,94,2nd Half,1:26,False,2641,2024-11-06T02:53:45Z
401715636102987302,102987302,Steal,Brayon Freeman Steal.,57,94,2nd Half,1:26,False,2065,2024-11-06T02:53:45Z
401715636102987801,102987801,LayUpShot,Brayon Freeman made Layup.,59,94,2nd Half,1:21,True,2065,2024-11-06T02:53:49Z
401715636102989701,102989701,Lost Ball Turnover,Leon Horner Turnover.,59,94,2nd Half,1:02,False,2641,2024-11-06T02:54:04Z
401715636102995301,102995301,Lost Ball Turnover,Brayon Freeman Turnover.,59,94,2nd Half,0:46,False,2065,2024-11-06T02:54:53Z
401715636102995302,102995302,Steal,Corbin Green Steal.,59,94,2nd Half,0:46,False,2641,2024-11-06T02:54:57Z
401715636102995801,102995801,Lost Ball Turnover,Federiko Federiko Turnover.,59,94,2nd Half,0:41,False,2641,2024-11-06T02:54:57Z
401715636102995802,102995802,Steal,Trey Thomas Steal.,59,94,2nd Half,0:41,False,2065,2024-11-06T02:54:57Z
401715636102996201,102996201,LayUpShot,Trey Thomas made Layup.,61,94,2nd Half,0:37,True,2065,2024-11-06T02:55:05Z
401715636102998001,102998001,JumpShot,Kevin Overton missed Three Point Jumper.,61,94,2nd Half,0:19,False,2641,2024-11-06T02:55:24Z
401715636102998301,102998301,Defensive Rebound,David Onanina Defensive Rebound.,61,94,2nd Half,0:16,False,2065,2024-11-06T02:55:27Z
401715636102999901,102999901,End Period,End of 2nd half,61,94,2nd Half,0:00,False,,2024-11-06T02:55:27Z
401715636102999902,102999902,End Game,End of Game,61,94,2nd Half,0:00,False,,2024-11-06T02:55:27Z
