play_id,sequence_number,type,description,away_score,home_score,period,clock,scoring_play,team_id,timestamp_utc
401714330102899001,102899001,PersonalFoul,Foul on Isaiah Moses.,42,43,2nd Half,10:09,False,27,2025-01-31T04:35:04Z
401714330102899901,102899901,JumpShot,Connor Sevilla missed Jumper.,42,43,2nd Half,10:00,False,302,2025-01-31T04:36:11Z
401714330102899902,102899902,Block Shot,Rikus Schulte Block.,42,43,2nd Half,10:00,False,27,2025-01-31T04:36:11Z
401714330102904301,102904301,Offensive Rebound,Niko Rocak Offensive Rebound.,42,43,2nd Half,9:56,False,302,2025-01-31T04:36:11Z
401714330102904302,102904302,Lost Ball Turnover,Niko Rocak Turnover.,42,43,2nd Half,9:56,False,302,2025-01-31T04:36:53Z
401714330102905101,102905101,Lost Ball Turnover,Nate Pickens Turnover.,42,43,2nd Half,9:48,False,27,2025-01-31T04:36:11Z
401714330102906901,102906901,JumpShot,Carl Daughtery Jr. made Three Point Jumper. Assisted by Niko Rocak.,45,43,2nd Half,9:30,True,302,2025-01-31T04:36:40Z
401714330102908501,102908501,JumpShot,Rikus Schulte made Jumper. Assisted by Gavin Davis.,45,45,2nd Half,9:14,True,27,2025-01-31T04:40:24Z
401714330102915701,102915701,LayUpShot,Niko Rocak missed Layup.,45,45,2nd Half,8:42,False,302,2025-01-31T04:38:11Z
401714330102916001,102916001,Defensive Rebound,Rikus Schulte Defensive Rebound.,45,45,2nd Half,8:39,False,27,2025-01-31T04:38:11Z
401714330102917201,102917201,LayUpShot,Jack Whitbourn missed Layup.,45,45,2nd Half,8:27,False,27,2025-01-31T04:38:11Z
401714330102917202,102917202,Block Shot,Niko Rocak Block.,45,45,2nd Half,8:27,False,302,2025-01-31T04:38:11Z
401714330102918001,102918001,Defensive Rebound,Carl Daughtery Jr. Defensive Rebound.,45,45,2nd Half,8:19,False,302,2025-01-31T04:38:11Z
401714330102924101,102924101,JumpShot,Connor Sevilla made Three Point Jumper. Assisted by TY Johnson.,48,45,2nd Half,7:58,True,302,2025-01-31T04:39:05Z
401714330102925801,102925801,JumpShot,Barrington Hargress made Jumper. Assisted by Jack Whitbourn.,48,47,2nd Half,7:41,True,27,2025-01-31T04:40:24Z
401714330102928301,102928301,Lost Ball Turnover,TY Johnson Turnover.,48,47,2nd Half,7:16,False,302,2025-01-31T04:41:04Z
401714330102928302,102928302,OfficialTVTimeOut,Official TV Timeout,48,47,2nd Half,7:16,False,,2025-01-31T04:41:04Z
401714330102929302,102929302,JumpShot,Barrington Hargress made Jumper.,48,49,2nd Half,7:06,True,27,2025-01-31T04:43:05Z
401714330102929303,102929303,PersonalFoul,Foul on Connor Sevilla.,48,49,2nd Half,7:06,False,302,2025-01-31T04:43:05Z
401714330102929304,102929304,MadeFreeThrow,Barrington Hargress missed Free Throw.,48,49,2nd Half,7:06,False,27,2025-01-31T04:43:05Z
401714330102929305,102929305,Defensive Rebound,Niko Rocak Defensive Rebound.,48,49,2nd Half,7:06,False,302,2025-01-31T04:43:05Z
401714330102935601,102935601,JumpShot,TY Johnson made Jumper.,50,49,2nd Half,6:43,True,302,2025-01-31T04:44:12Z
401714330102938101,102938101,JumpShot,Barrington Hargress missed Three Point Jumper.,50,49,2nd Half,6:18,False,27,2025-01-31T04:44:26Z
401714330102938501,102938501,Defensive Rebound,Niko Rocak Defensive Rebound.,50,49,2nd Half,6:14,False,302,2025-01-31T04:44:26Z
401714330102945101,102945101,JumpShot,Carl Daughtery Jr. made Jumper.,52,49,2nd Half,5:48,True,302,2025-01-31T04:45:05Z
401714330102946901,102946901,JumpShot,Isaiah Moses made Three Point Jumper. Assisted by Barrington Hargress.,52,52,2nd Half,5:30,True,27,2025-01-31T04:46:12Z
401714330102949101,102949101,JumpShot,Carl Daughtery Jr. made Jumper. Assisted by Pablo Tamba.,54,52,2nd Half,5:08,True,302,2025-01-31T04:46:37Z
401714330102955101,102955101,JumpShot,Isaiah Moses missed Jumper.,54,52,2nd Half,4:48,False,27,2025-01-31T04:46:12Z
401714330102955501,102955501,Defensive Rebound,Pablo Tamba Defensive Rebound.,54,52,2nd Half,4:44,False,302,2025-01-31T04:46:12Z
401714330102956601,102956601,LayUpShot,TY Johnson missed Layup.,54,52,2nd Half,4:33,False,302,2025-01-31T04:46:12Z
401714330102956801,102956801,Defensive Rebound,Niyi Olabode Defensive Rebound.,54,52,2nd Half,4:31,False,27,2025-01-31T04:46:24Z
401714330102957301,102957301,JumpShot,Kaleb Smith made Three Point Jumper. Assisted by Barrington Hargress.,54,55,2nd Half,4:26,True,27,2025-01-31T04:46:24Z
401714330102959501,102959501,JumpShot,Carl Daughtery Jr. made Jumper. Assisted by TY Johnson.,56,55,2nd Half,4:04,True,302,2025-01-31T04:48:24Z
401714330102965601,102965601,JumpShot,Barrington Hargress missed Jumper.,56,55,2nd Half,3:43,False,27,2025-01-31T04:47:01Z
401714330102965602,102965602,Defensive Rebound,UC Davis Defensive Rebound.,56,55,2nd Half,3:43,False,302,2025-01-31T04:47:01Z
401714330102965801,102965801,OfficialTVTimeOut,Official TV Timeout,56,55,2nd Half,3:41,False,,2025-01-31T04:48:24Z
401714330102967801,102967801,JumpShot,Carl Daughtery Jr. missed Jumper.,56,55,2nd Half,3:21,False,302,2025-01-31T04:50:24Z
401714330102968201,102968201,Offensive Rebound,TY Johnson Offensive Rebound.,56,55,2nd Half,3:17,False,302,2025-01-31T04:50:24Z
401714330102969301,102969301,LayUpShot,TY Johnson missed Layup.,56,55,2nd Half,3:06,False,302,2025-01-31T04:50:36Z
401714330102969302,102969302,Block Shot,Joel Armotrading Block.,56,55,2nd Half,3:06,False,27,2025-01-31T04:50:36Z
401714330102969801,102969801,Offensive Rebound,Niko Rocak Offensive Rebound.,56,55,2nd Half,3:01,False,302,2025-01-31T04:50:36Z
401714330102975001,102975001,JumpShot,TY Johnson missed Jumper.,56,55,2nd Half,2:49,False,302,2025-01-31T04:50:36Z
401714330102975002,102975002,Block Shot,Nate Pickens Block.,56,55,2nd Half,2:49,False,27,2025-01-31T04:50:36Z
401714330102975101,102975101,Defensive Rebound,UC Riverside Defensive Rebound.,56,55,2nd Half,2:48,False,27,2025-01-31T04:50:36Z
401714330102977101,102977101,LayUpShot,Barrington Hargress missed Layup.,56,55,2nd Half,2:28,False,27,2025-01-31T04:52:12Z
401714330102977401,102977401,Offensive Rebound,Kaleb Smith Offensive Rebound.,56,55,2nd Half,2:25,False,27,2025-01-31T04:52:12Z
401714330102977501,102977501,LayUpShot,Kaleb Smith missed Layup.,56,55,2nd Half,2:24,False,27,2025-01-31T04:52:12Z
401714330102978101,102978101,Defensive Rebound,TY Johnson Defensive Rebound.,56,55,2nd Half,2:18,False,302,2025-01-31T04:52:12Z
401714330102979501,102979501,JumpShot,Carl Daughtery Jr. missed Three Point Jumper.,56,55,2nd Half,2:04,False,302,2025-01-31T04:52:12Z
401714330102979901,102979901,Defensive Rebound,Joel Armotrading Defensive Rebound.,56,55,2nd Half,2:00,False,27,2025-01-31T04:52:12Z
401714330102985701,102985701,JumpShot,Joel Armotrading missed Jumper.,56,55,2nd Half,1:42,False,27,2025-01-31T04:52:23Z
401714330102986001,102986001,Defensive Rebound,TY Johnson Defensive Rebound.,56,55,2nd Half,1:39,False,302,2025-01-31T04:52:23Z
401714330102986401,102986401,RegularTimeOut,UC Davis Timeout,56,55,2nd Half,1:35,False,302,2025-01-31T04:52:23Z
401714330102988201,102988201,JumpShot,TY Johnson missed Jumper.,56,55,2nd Half,1:17,False,302,2025-01-31T04:54:36Z
401714330102988601,102988601,Defensive Rebound,Joel Armotrading Defensive Rebound.,56,55,2nd Half,1:13,False,27,2025-01-31T04:54:36Z
401714330102989201,102989201,RegularTimeOut,UC Riverside Timeout,56,55,2nd Half,1:07,False,27,2025-01-31T04:55:02Z
401714330102994801,102994801,JumpShot,Isaiah Moses missed Three Point Jumper.,56,55,2nd Half,0:51,False,27,2025-01-31T04:59:00Z
401714330102995001,102995001,Defensive Rebound,UC Davis Defensive Rebound.,56,55,2nd Half,0:49,False,302,2025-01-31T04:59:00Z
401714330102996901,102996901,JumpShot,TY Johnson made Jumper.,58,55,2nd Half,0:30,True,302,2025-01-31T05:00:12Z
401714330102996902,102996902,ShortTimeOut,UC Davis Timeout,58,55,2nd Half,0:30,False,302,2025-01-31T05:00:12Z
401714330102998001,102998001,PersonalFoul,Foul on Niko Rocak.,58,55,2nd Half,0:19,False,302,2025-01-31T05:02:10Z
401714330102998301,102998301,PersonalFoul,Foul on Niko Rocak.,58,55,2nd Half,0:16,False,302,2025-01-31T05:02:10Z
401714330102998302,102998302,MadeFreeThrow,Kaleb Smith made Free Throw.,58,56,2nd Half,0:16,True,27,2025-01-31T05:02:10Z
401714330102998303,102998303,MadeFreeThrow,Kaleb Smith made Free Throw.,58,57,2nd Half,0:16,True,27,2025-01-31T05:02:10Z
401714330102998601,102998601,Lost Ball Turnover,TY Johnson Turnover.,58,57,2nd Half,0:13,False,302,2025-01-31T05:03:28Z
401714330102998602,102998602,ShortTimeOut,UC Riverside Timeout,58,57,2nd Half,0:13,False,27,2025-01-31T05:03:28Z
401714330102999501,102999501,JumpShot,Nate Pickens made Three Point Jumper. Assisted by Barrington Hargress.,58,60,2nd Half,0:04,True,27,2025-01-31T05:05:57Z
401714330102999502,102999502,ShortTimeOut,UC Davis Timeout,58,60,2nd Half,0:04,False,302,2025-01-31T05:05:57Z
