play_id,sequence_number,type,description,away_score,home_score,period,clock,scoring_play,team_id,timestamp_utc
401714569102818502,102818502,Block Shot,Nate Martin Block.,37,37,2nd Half,18:14,False,276,2025-01-25T21:18:02Z
401714569102818503,102818503,Offensive Rebound,Georgia Southern Offensive Rebound.,37,37,2nd Half,18:14,False,290,2025-01-25T21:18:02Z
401714569102818901,102818901,JumpShot,Avantae Parker missed Jumper.,37,37,2nd Half,18:10,False,290,2025-01-25T21:18:21Z
401714569102819201,102819201,Defensive Rebound,Nate Martin Defensive Rebound.,37,37,2nd Half,18:07,False,276,2025-01-25T21:18:24Z
401714569102824201,102824201,Lost Ball Turnover,Jalen Speer Turnover.,37,37,2nd Half,17:57,False,276,2025-01-25T21:18:38Z
401714569102825401,102825401,JumpShot,Adante' Holiman missed Three Point Jumper.,37,37,2nd Half,17:45,False,290,2025-01-25T21:19:03Z
401714569102825601,102825601,Offensive Rebound,Braylhan Thomas Offensive Rebound.,37,37,2nd Half,17:43,False,290,2025-01-25T21:19:07Z
401714569102826301,102826301,LayUpShot,Eren Banks missed Layup.,37,37,2nd Half,17:36,False,290,2025-01-25T21:19:38Z
401714569102826501,102826501,Defensive Rebound,Dezayne Mingo Defensive Rebound.,37,37,2nd Half,17:34,False,276,2025-01-25T21:19:40Z
401714569102827701,102827701,JumpShot,Jalen Speer missed Three Point Jumper.,37,37,2nd Half,17:22,False,276,2025-01-25T21:19:52Z
401714569102828101,102828101,Offensive Rebound,Mikal Dawson Offensive Rebound.,37,37,2nd Half,17:18,False,276,2025-01-25T21:19:56Z
401714569102828102,102828102,Lost Ball Turnover,Mikal Dawson Turnover.,37,37,2nd Half,17:18,False,276,2025-01-25T21:19:56Z
401714569102835001,102835001,JumpShot,Nate Brafford made Three Point Jumper. Assisted by Bradley Douglas.,37,40,2nd Half,16:49,True,290,2025-01-25T21:20:37Z
401714569102835301,102835301,JumpShot,Mikal Dawson missed Three Point Jumper.,37,40,2nd Half,16:46,False,276,2025-01-25T21:20:41Z
401714569102835901,102835901,Defensive Rebound,Bradley Douglas Defensive Rebound.,37,40,2nd Half,16:40,False,290,2025-01-25T21:20:46Z
401714569102836801,102836801,PersonalFoul,Foul on Nate Martin.,37,40,2nd Half,16:31,False,276,2025-01-25T21:20:54Z
401714569102836802,102836802,MadeFreeThrow,Nate Brafford missed Free Throw.,37,40,2nd Half,16:31,False,290,2025-01-25T21:21:38Z
401714569102836803,102836803,Dead Ball Rebound,Georgia Southern Deadball Team Rebound.,37,40,2nd Half,16:31,False,290,2025-01-25T21:21:38Z
401714569102836804,102836804,MadeFreeThrow,Nate Brafford made Free Throw.,37,41,2nd Half,16:31,True,290,2025-01-25T21:21:38Z
401714569102837901,102837901,LayUpShot,Mikal Dawson made Layup. Assisted by Jalen Speer.,39,41,2nd Half,16:20,True,276,2025-01-25T21:22:15Z
401714569102839601,102839601,JumpShot,Eren Banks missed Jumper.,39,41,2nd Half,16:03,False,290,2025-01-25T21:22:40Z
401714569102839602,102839602,Block Shot,Obinna Anochili-Killen Block.,39,41,2nd Half,16:03,False,276,2025-01-25T21:22:40Z
401714569102844101,102844101,Defensive Rebound,Dezayne Mingo Defensive Rebound.,39,41,2nd Half,15:58,False,276,2025-01-25T21:22:40Z
401714569102844401,102844401,LayUpShot,Wyatt Fricks missed Layup.,39,41,2nd Half,15:55,False,276,2025-01-25T21:22:41Z
401714569102844601,102844601,Defensive Rebound,Nate Brafford Defensive Rebound.,39,41,2nd Half,15:53,False,290,2025-01-25T21:22:45Z
401714569102845601,102845601,JumpShot,Bradley Douglas missed Three Point Jumper.,39,41,2nd Half,15:43,False,290,2025-01-25T21:22:56Z
401714569102845901,102845901,Offensive Rebound,Braylhan Thomas Offensive Rebound.,39,41,2nd Half,15:40,False,290,2025-01-25T21:22:56Z
401714569102845902,102845902,LayUpShot,Braylhan Thomas missed Layup.,39,41,2nd Half,15:40,False,290,2025-01-25T21:22:56Z
401714569102845903,102845903,Block Shot,Obinna Anochili-Killen Block.,39,41,2nd Half,15:40,False,276,2025-01-25T21:22:56Z
401714569102845904,102845904,Offensive Rebound,Georgia Southern Offensive Rebound.,39,41,2nd Half,15:40,False,290,2025-01-25T21:22:56Z
401714569102845905,102845905,OfficialTVTimeOut, Official TV Timeout,39,41,2nd Half,15:40,False,,2025-01-25T21:22:56Z
401714569102846101,102846101,LayUpShot,Avantae Parker made Layup. Assisted by Bradley Douglas.,39,43,2nd Half,15:38,True,290,2025-01-25T21:26:11Z
401714569102846102,102846102,PersonalFoul,Foul on Obinna Anochili-Killen.,39,43,2nd Half,15:38,False,276,2025-01-25T21:26:11Z
401714569102846301,102846301,MadeFreeThrow,Avantae Parker missed Free Throw.,39,43,2nd Half,15:36,False,290,2025-01-25T21:26:43Z
401714569102846302,102846302,Defensive Rebound,Marshall Defensive Rebound.,39,43,2nd Half,15:36,False,276,2025-01-25T21:26:43Z
401714569102849001,102849001,Lost Ball Turnover,Jakob Gibbs Turnover.,39,43,2nd Half,15:09,False,276,2025-01-25T21:27:37Z
401714569102849002,102849002,Steal,Braylhan Thomas Steal.,39,43,2nd Half,15:09,False,290,2025-01-25T21:27:37Z
401714569102855401,102855401,LayUpShot,Avantae Parker missed Layup.,39,43,2nd Half,14:45,False,290,2025-01-25T21:28:35Z
401714569102855402,102855402,Block Shot,Wyatt Fricks Block.,39,43,2nd Half,14:45,False,276,2025-01-25T21:28:39Z
401714569102855901,102855901,Offensive Rebound,Eugene Brown III Offensive Rebound.,39,43,2nd Half,14:40,False,290,2025-01-25T21:28:39Z
401714569102855902,102855902,JumpShot,Bradley Douglas missed Three Point Jumper.,39,43,2nd Half,14:40,False,290,2025-01-25T21:28:39Z
401714569102856102,102856102,Defensive Rebound,Obinna Anochili-Killen Defensive Rebound.,39,43,2nd Half,14:38,False,276,2025-01-25T21:28:44Z
401714569102856701,102856701,LayUpShot,Jakob Gibbs made Layup. Assisted by Obinna Anochili-Killen.,41,43,2nd Half,14:32,True,276,2025-01-25T21:28:46Z
401714569102858101,102858101,Lost Ball Turnover,Avantae Parker Turnover.,41,43,2nd Half,14:18,False,290,2025-01-25T21:29:00Z
401714569102858801,102858801,JumpShot,Jalen Speer made Jumper.,43,43,2nd Half,14:11,True,276,2025-01-25T21:29:39Z
401714569102864901,102864901,JumpShot,Adante' Holiman made Three Point Jumper. Assisted by Tyson Brown.,43,46,2nd Half,13:50,True,290,2025-01-25T21:30:00Z
401714569102867201,102867201,JumpShot,Kai Spears missed Jumper.,43,46,2nd Half,13:27,False,276,2025-01-25T21:30:27Z
401714569102867401,102867401,Offensive Rebound,Obinna Anochili-Killen Offensive Rebound.,43,46,2nd Half,13:25,False,276,2025-01-25T21:30:27Z
401714569102867501,102867501,LayUpShot,Obinna Anochili-Killen missed Layup.,43,46,2nd Half,13:24,False,276,2025-01-25T21:30:29Z
401714569102867502,102867502,Block Shot,Bradley Douglas Block.,43,46,2nd Half,13:24,False,290,2025-01-25T21:30:29Z
401714569102867901,102867901,Defensive Rebound,Eugene Brown III Defensive Rebound.,43,46,2nd Half,13:20,False,290,2025-01-25T21:30:29Z
401714569102868601,102868601,JumpShot,Bradley Douglas made Jumper.,43,48,2nd Half,13:13,True,290,2025-01-25T21:30:37Z
401714569102869801,102869801,LayUpShot,Obinna Anochili-Killen missed Layup.,43,48,2nd Half,13:01,False,276,2025-01-25T21:30:52Z
401714569102869802,102869802,Block Shot,Adante' Holiman Block.,43,48,2nd Half,13:01,False,290,2025-01-25T21:30:52Z
401714569102874101,102874101,Defensive Rebound,Adante' Holiman Defensive Rebound.,43,48,2nd Half,12:58,False,290,2025-01-25T21:30:52Z
401714569102875601,102875601,LayUpShot,Adante' Holiman missed Layup.,43,48,2nd Half,12:43,False,290,2025-01-25T21:31:29Z
401714569102875602,102875602,Block Shot,Jakob Gibbs Block.,43,48,2nd Half,12:43,False,276,2025-01-25T21:31:29Z
401714569102875603,102875603,Offensive Rebound,Georgia Southern Offensive Rebound.,43,48,2nd Half,12:43,False,290,2025-01-25T21:31:29Z
401714569102877101,102877101,Lost Ball Turnover,Georgia Southern  Turnover.,43,48,2nd Half,12:28,False,290,2025-01-25T21:32:08Z
401714569102879501,102879501,LayUpShot,Cade Gibbs missed Layup.,43,48,2nd Half,12:04,False,276,2025-01-25T21:32:55Z
401714569102884001,102884001,Offensive Rebound,Nate Martin Offensive Rebound.,43,48,2nd Half,11:59,False,276,2025-01-25T21:33:01Z
401714569102884002,102884002,TipShot,Nate Martin made Two Point Tip Shot.,45,48,2nd Half,11:59,True,276,2025-01-25T21:33:01Z
401714569102885201,102885201,OfficialTVTimeOut, Official TV Timeout,45,48,2nd Half,11:47,False,,2025-01-25T21:33:11Z
401714569102886301,102886301,JumpShot,Adante' Holiman made Jumper.,45,50,2nd Half,11:36,True,290,2025-01-25T21:36:14Z
401714569102888801,102888801,LayUpShot,Dezayne Mingo made Layup.,47,50,2nd Half,11:11,True,276,2025-01-25T21:36:37Z
401714569102894301,102894301,JumpShot,Eren Banks missed Three Point Jumper.,47,50,2nd Half,10:56,False,290,2025-01-25T21:36:55Z
401714569102894601,102894601,Defensive Rebound,Cade Gibbs Defensive Rebound.,47,50,2nd Half,10:53,False,276,2025-01-25T21:36:55Z
401714569102896001,102896001,PersonalFoul,Foul on Tyson Brown.,47,50,2nd Half,10:39,False,290,2025-01-25T21:37:09Z
401714569102896002,102896002,MadeFreeThrow,Dezayne Mingo made Free Throw.,48,50,2nd Half,10:39,True,276,2025-01-25T21:37:28Z
401714569102896003,102896003,MadeFreeThrow,Dezayne Mingo made Free Throw.,49,50,2nd Half,10:39,True,276,2025-01-25T21:37:28Z
401714569102898201,102898201,LayUpShot,Adante' Holiman made Layup.,49,52,2nd Half,10:17,True,290,2025-01-25T21:38:26Z
401714569102904101,102904101,JumpShot,Jalen Speer made Jumper. Assisted by Nate Martin.,51,52,2nd Half,9:58,True,276,2025-01-25T21:38:45Z
401714569102906901,102906901,JumpShot,Bradley Douglas missed Three Point Jumper.,51,52,2nd Half,9:30,False,290,2025-01-25T21:39:16Z
401714569102907201,102907201,Defensive Rebound,Marshall Defensive Rebound.,51,52,2nd Half,9:27,False,276,2025-01-25T21:39:16Z
401714569102907202,102907202,PersonalFoul,Foul on Eren Banks.,51,52,2nd Half,9:27,False,290,2025-01-25T21:39:16Z
401714569102908101,102908101,PersonalFoul,Foul on Adante' Holiman.,51,52,2nd Half,9:18,False,290,2025-01-25T21:39:39Z
401714569102908201,102908201,JumpShot,Jalen Speer made Jumper. Assisted by Dezayne Mingo.,53,52,2nd Half,9:17,True,276,2025-01-25T21:40:05Z
401714569102914201,102914201,ShortTimeOut,Marshall  Timeout,53,52,2nd Half,8:57,False,276,2025-01-25T21:40:47Z
401714569102915201,102915201,JumpShot,Nate Brafford missed Three Point Jumper.,53,52,2nd Half,8:47,False,290,2025-01-25T21:43:43Z
401714569102915401,102915401,Defensive Rebound,Jalen Speer Defensive Rebound.,53,52,2nd Half,8:45,False,276,2025-01-25T21:43:43Z
401714569102916901,102916901,JumpShot,Jalen Speer made Three Point Jumper. Assisted by Dezayne Mingo.,56,52,2nd Half,8:30,True,276,2025-01-25T21:43:58Z
401714569102918501,102918501,LayUpShot,Eren Banks missed Layup.,56,52,2nd Half,8:14,False,290,2025-01-25T21:44:13Z
401714569102918701,102918701,Defensive Rebound,Nate Martin Defensive Rebound.,56,52,2nd Half,8:12,False,276,2025-01-25T21:44:17Z
401714569102919401,102919401,LayUpShot,Dezayne Mingo missed Layup.,56,52,2nd Half,8:05,False,276,2025-01-25T21:44:21Z
401714569102919601,102919601,Defensive Rebound,Bradley Douglas Defensive Rebound.,56,52,2nd Half,8:03,False,290,2025-01-25T21:44:24Z
401714569102919901,102919901,JumpShot,Eugene Brown III made Three Point Jumper. Assisted by Bradley Douglas.,56,55,2nd Half,8:00,True,290,2025-01-25T21:44:27Z
401714569102926001,102926001,JumpShot,Jalen Speer made Three Point Jumper. Assisted by Cade Gibbs.,59,55,2nd Half,7:39,True,276,2025-01-25T21:44:48Z
401714569102928101,102928101,LayUpShot,Avantae Parker missed Layup.,59,55,2nd Half,7:18,False,290,2025-01-25T21:45:08Z
401714569102928201,102928201,Defensive Rebound,Dezayne Mingo Defensive Rebound.,59,55,2nd Half,7:17,False,276,2025-01-25T21:45:10Z
401714569102928202,102928202,PersonalFoul,Foul on Nate Brafford.,59,55,2nd Half,7:17,False,290,2025-01-25T21:45:10Z
401714569102928203,102928203,OfficialTVTimeOut, Official TV Timeout,59,55,2nd Half,7:17,False,,2025-01-25T21:45:10Z
401714569102934901,102934901,PersonalFoul,Foul on Bradley Douglas.,59,55,2nd Half,6:50,False,290,2025-01-25T21:48:17Z
401714569102934902,102934902,MadeFreeThrow,Nate Martin made Free Throw.,60,55,2nd Half,6:50,True,276,2025-01-25T21:48:17Z
401714569102934903,102934903,MadeFreeThrow,Nate Martin missed Free Throw.,60,55,2nd Half,6:50,False,276,2025-01-25T21:48:17Z
401714569102935101,102935101,Offensive Rebound,Cade Gibbs Offensive Rebound.,60,55,2nd Half,6:48,False,276,2025-01-25T21:49:01Z
401714569102935201,102935201,Lost Ball Turnover,Cade Gibbs Turnover.,60,55,2nd Half,6:47,False,276,2025-01-25T21:49:01Z
401714569102935202,102935202,Steal,Adante' Holiman Steal.,60,55,2nd Half,6:47,False,290,2025-01-25T21:49:01Z
401714569102936101,102936101,LayUpShot,Eren Banks made Layup.,60,57,2nd Half,6:38,True,290,2025-01-25T21:49:11Z
401714569102938401,102938401,JumpShot,Jalen Speer missed Jumper.,60,57,2nd Half,6:15,False,276,2025-01-25T21:49:33Z
401714569102938801,102938801,Offensive Rebound,Cade Gibbs Offensive Rebound.,60,57,2nd Half,6:11,False,276,2025-01-25T21:49:40Z
401714569102944001,102944001,PersonalFoul,Foul on Cade Gibbs.,60,57,2nd Half,5:59,False,276,2025-01-25T21:49:49Z
401714569102944002,102944002,Lost Ball Turnover,Cade Gibbs Turnover.,60,57,2nd Half,5:59,False,276,2025-01-25T21:49:49Z
401714569102945901,102945901,DunkShot,Tyson Brown made Dunk. Assisted by Bradley Douglas.,60,59,2nd Half,5:40,True,290,2025-01-25T21:50:35Z
401714569102947301,102947301,JumpShot,Jalen Speer missed Three Point Jumper.,60,59,2nd Half,5:26,False,276,2025-01-25T21:50:51Z
401714569102947601,102947601,Defensive Rebound,Tyson Brown Defensive Rebound.,60,59,2nd Half,5:23,False,290,2025-01-25T21:50:51Z
401714569102948101,102948101,PersonalFoul,Foul on Jalen Speer.,60,59,2nd Half,5:18,False,276,2025-01-25T21:50:55Z
401714569102949501,102949501,LayUpShot,Bradley Douglas missed Layup.,60,59,2nd Half,5:04,False,290,2025-01-25T21:51:50Z
401714569102949502,102949502,Block Shot,Obinna Anochili-Killen Block.,60,59,2nd Half,5:04,False,276,2025-01-25T21:51:50Z
401714569102949801,102949801,Defensive Rebound,Marshall Defensive Rebound.,60,59,2nd Half,5:01,False,276,2025-01-25T21:51:50Z
401714569102956101,102956101,PersonalFoul,Foul on Nate Brafford.,60,59,2nd Half,4:38,False,290,2025-01-25T21:52:29Z
401714569102956102,102956102,MadeFreeThrow,Obinna Anochili-Killen made Free Throw.,61,59,2nd Half,4:38,True,276,2025-01-25T21:53:06Z
401714569102956103,102956103,MadeFreeThrow,Obinna Anochili-Killen missed Free Throw.,61,59,2nd Half,4:38,False,276,2025-01-25T21:53:06Z
401714569102956201,102956201,Defensive Rebound,Nate Brafford Defensive Rebound.,61,59,2nd Half,4:37,False,290,2025-01-25T21:53:31Z
401714569102957401,102957401,Lost Ball Turnover,Eren Banks Turnover.,61,59,2nd Half,4:25,False,290,2025-01-25T21:53:42Z
401714569102957402,102957402,Steal,Jakob Gibbs Steal.,61,59,2nd Half,4:25,False,276,2025-01-25T21:53:45Z
401714569102957701,102957701,LayUpShot,Jakob Gibbs made Layup.,63,59,2nd Half,4:22,True,276,2025-01-25T21:53:45Z
401714569102959101,102959101,JumpShot,Bradley Douglas missed Three Point Jumper.,63,59,2nd Half,4:08,False,290,2025-01-25T21:54:02Z
401714569102959501,102959501,Offensive Rebound,Georgia Southern Offensive Rebound.,63,59,2nd Half,4:04,False,290,2025-01-25T21:54:02Z
401714569102959502,102959502,ShortTimeOut,Georgia Southern  Timeout,63,59,2nd Half,4:04,False,290,2025-01-25T21:54:02Z
401714569102959503,102959503,OfficialTVTimeOut, Official TV Timeout,63,59,2nd Half,4:04,False,,2025-01-25T21:54:02Z
401714569102964501,102964501,JumpShot,Nate Brafford made Three Point Jumper. Assisted by Eren Banks.,63,62,2nd Half,3:54,True,290,2025-01-25T21:57:21Z
401714569102967001,102967001,DunkShot,Obinna Anochili-Killen made Dunk. Assisted by Jakob Gibbs.,65,62,2nd Half,3:29,True,276,2025-01-25T21:57:46Z
401714569102969401,102969401,JumpShot,Eren Banks missed Three Point Jumper.,65,62,2nd Half,3:05,False,290,2025-01-25T21:58:14Z
401714569102969801,102969801,Offensive Rebound,Tyson Brown Offensive Rebound.,65,62,2nd Half,3:01,False,290,2025-01-25T21:58:14Z
401714569102969802,102969802,Lost Ball Turnover,Tyson Brown Turnover.,65,62,2nd Half,3:01,False,290,2025-01-25T21:58:14Z
401714569102976101,102976101,JumpShot,Dezayne Mingo made Jumper.,67,62,2nd Half,2:38,True,276,2025-01-25T21:58:57Z
401714569102978102,102978102,PersonalFoul,Foul on Jalen Speer.,67,62,2nd Half,2:18,False,276,2025-01-25T21:59:32Z
401714569102978103,102978103,MadeFreeThrow,Adante' Holiman missed Free Throw.,67,62,2nd Half,2:18,False,290,2025-01-25T21:59:32Z
401714569102978104,102978104,Dead Ball Rebound,Georgia Southern Deadball Team Rebound.,67,62,2nd Half,2:18,False,290,2025-01-25T21:59:32Z
401714569102978105,102978105,MadeFreeThrow,Adante' Holiman made Free Throw.,67,63,2nd Half,2:18,True,290,2025-01-25T21:59:32Z
401714569102984801,102984801,LayUpShot,Nate Martin missed Layup.,67,63,2nd Half,1:51,False,276,2025-01-25T22:03:58Z
401714569102985101,102985101,Defensive Rebound,Eren Banks Defensive Rebound.,67,63,2nd Half,1:48,False,290,2025-01-25T22:03:58Z
401714569102986701,102986701,PersonalFoul,Foul on Dezayne Mingo.,67,63,2nd Half,1:32,False,276,2025-01-25T22:04:13Z
401714569102986702,102986702,MadeFreeThrow,Bradley Douglas missed Free Throw.,67,63,2nd Half,1:32,False,290,2025-01-25T22:04:13Z
401714569102986703,102986703,Dead Ball Rebound,Georgia Southern Deadball Team Rebound.,67,63,2nd Half,1:32,False,290,2025-01-25T22:04:13Z
401714569102986704,102986704,MadeFreeThrow,Bradley Douglas made Free Throw.,67,64,2nd Half,1:32,True,290,2025-01-25T22:04:57Z
401714569102987401,102987401,RegularTimeOut,Marshall  Timeout,67,64,2nd Half,1:25,False,276,2025-01-25T22:05:07Z
401714569102989501,102989501,JumpShot,Dezayne Mingo made Jumper. Assisted by Nate Martin.,69,64,2nd Half,1:04,True,276,2025-01-25T22:07:36Z
401714569102995101,102995101,JumpShot,Nate Brafford made Three Point Jumper. Assisted by Adante' Holiman.,69,67,2nd Half,0:48,True,290,2025-01-25T22:07:52Z
401714569102998101,102998101,JumpShot,Dezayne Mingo missed Jumper.,69,67,2nd Half,0:18,False,276,2025-01-25T22:08:25Z
401714569102998501,102998501,Offensive Rebound,Jakob Gibbs Offensive Rebound.,69,67,2nd Half,0:14,False,276,2025-01-25T22:08:25Z
401714569102998701,102998701,PersonalFoul,Foul on Eren Banks.,69,67,2nd Half,0:12,False,290,2025-01-25T22:08:27Z
401714569102998702,102998702,MadeFreeThrow,Jalen Speer made Free Throw.,70,67,2nd Half,0:12,True,276,2025-01-25T22:09:09Z
401714569102998703,102998703,MadeFreeThrow,Jalen Speer made Free Throw.,71,67,2nd Half,0:12,True,276,2025-01-25T22:09:09Z
401714569102998704,102998704,ShortTimeOut,Marshall  Timeout,71,67,2nd Half,0:12,False,276,2025-01-25T22:09:09Z
401714569102999101,102999101,RegularTimeOut,Georgia Southern  Timeout,71,67,2nd Half,0:08,False,290,2025-01-25T22:10:32Z
401714569102999401,102999401,JumpShot,Adante' Holiman missed Three Point Jumper.,71,67,2nd Half,0:05,False,290,2025-01-25T22:12:16Z
401714569102999801,102999801,Offensive Rebound,Tyson Brown Offensive Rebound.,71,67,2nd Half,0:01,False,290,2025-01-25T22:12:16Z
401714569102999802,102999802,Lost Ball Turnover,Tyson Brown Turnover.,71,67,2nd Half,0:01,False,290,2025-01-25T22:12:16Z
401714569102999803,102999803,Steal,Jakob Gibbs Steal.,71,67,2nd Half,0:01,False,276,2025-01-25T22:12:16Z
401714569102999901,102999901,End Period,End of 2nd half,71,67,2nd Half,0:00,False,,2025-01-25T22:12:16Z
401714569102999902,102999902,End Game,End of Game,71,67,2nd Half,0:00,False,,2025-01-25T22:12:16Z
