play_id,sequence_number,type,description,away_score,home_score,period,clock,scoring_play,team_id,timestamp_utc
401711753101805901,101805901,LayUpShot,Jack Scott made Layup.,2,0,1st Half,19:40,True,128550,2024-11-05T00:04:26Z
401711753101807501,101807501,JumpShot,Mehki Ellison missed Three Point Jumper.,2,0,1st Half,19:24,False,56,2024-11-05T00:04:26Z
401711753101807901,101807901,Defensive Rebound,Charlie Yoder Defensive Rebound.,2,0,1st Half,19:20,False,128550,2024-11-05T00:04:26Z
401711753101809501,101809501,JumpShot,Jack Scott made Three Point Jumper. Assisted by Charlie Yoder.,5,0,1st Half,19:04,True,128550,2024-11-05T00:04:26Z
401711753101815101,101815101,LayUpShot,Treyton Thompson missed Layup.,5,0,1st Half,18:48,False,56,2024-11-05T00:04:26Z
401711753101815601,101815601,Offensive Rebound,Treyton Thompson Offensive Rebound.,5,0,1st Half,18:43,False,56,2024-11-05T00:04:26Z
401711753101815602,101815602,JumpShot,Treyton Thompson missed Jumper.,5,0,1st Half,18:43,False,56,2024-11-05T00:04:26Z
401711753101815701,101815701,Offensive Rebound,Treyton Thompson Offensive Rebound.,5,0,1st Half,18:42,False,56,2024-11-05T00:04:26Z
401711753101815901,101815901,JumpShot,Jamie Phillips Jr. missed Three Point Jumper.,5,0,1st Half,18:40,False,56,2024-11-05T00:04:26Z
401711753101816301,101816301,Offensive Rebound,Jamie Phillips Jr. Offensive Rebound.,5,0,1st Half,18:36,False,56,2024-11-05T00:04:26Z
401711753101816501,101816501,LayUpShot,Jamie Phillips Jr. missed Layup.,5,0,1st Half,18:34,False,56,2024-11-05T00:06:28Z
401711753101816801,101816801,Defensive Rebound,Jordan Clark Defensive Rebound.,5,0,1st Half,18:31,False,128550,2024-11-05T00:06:28Z
401711753101817501,101817501,JumpShot,Diego Eslava missed Three Point Jumper.,5,0,1st Half,18:24,False,128550,2024-11-05T00:06:28Z
401711753101817901,101817901,Defensive Rebound,Mehki Ellison Defensive Rebound.,5,0,1st Half,18:20,False,56,2024-11-05T00:06:28Z
401711753101818501,101818501,JumpShot,Abramo Canka missed Jumper.,5,0,1st Half,18:14,False,56,2024-11-05T00:06:28Z
401711753101818801,101818801,Defensive Rebound,Charlie Yoder Defensive Rebound.,5,0,1st Half,18:11,False,128550,2024-11-05T00:06:28Z
401711753101824001,101824001,JumpShot,Jack Scott missed Three Point Jumper.,5,0,1st Half,17:59,False,128550,2024-11-05T00:06:28Z
401711753101824201,101824201,Defensive Rebound,Stetson Defensive Rebound.,5,0,1st Half,17:57,False,56,2024-11-05T00:06:28Z
401711753101826001,101826001,JumpShot,Jordan Wood made Three Point Jumper. Assisted by Mehki Ellison.,5,3,1st Half,17:39,True,56,2024-11-05T00:06:28Z
401711753101829001,101829001,JumpShot,Jack Scott made Three Point Jumper. Assisted by Adrian Moore.,8,3,1st Half,17:09,True,128550,2024-11-05T00:06:28Z
401711753101834401,101834401,LayUpShot,Treyton Thompson missed Layup.,8,3,1st Half,16:55,False,56,2024-11-05T00:06:28Z
401711753101834501,101834501,Offensive Rebound,Treyton Thompson Offensive Rebound.,8,3,1st Half,16:54,False,56,2024-11-05T00:06:28Z
401711753101834502,101834502,PersonalFoul,Foul on Jack Scott.,8,3,1st Half,16:54,False,128550,2024-11-05T00:06:28Z
401711753101834503,101834503,MadeFreeThrow,Treyton Thompson made Free Throw.,8,4,1st Half,16:54,True,56,2024-11-05T00:06:28Z
401711753101834601,101834601,MadeFreeThrow,Treyton Thompson missed Free Throw.,8,4,1st Half,16:53,False,56,2024-11-05T00:06:59Z
401711753101834701,101834701,Defensive Rebound,Charlie Yoder Defensive Rebound.,8,4,1st Half,16:52,False,128550,2024-11-05T00:06:59Z
401711753101837601,101837601,LayUpShot,Jack Scott missed Layup.,8,4,1st Half,16:23,False,128550,2024-11-05T00:08:28Z
401711753101838001,101838001,Defensive Rebound,Jamie Phillips Jr. Defensive Rebound.,8,4,1st Half,16:19,False,56,2024-11-05T00:08:28Z
401711753101838201,101838201,JumpShot,Jordan Wood missed Three Point Jumper.,8,4,1st Half,16:17,False,56,2024-11-05T00:08:28Z
401711753101838601,101838601,Defensive Rebound,Jordan Clark Defensive Rebound.,8,4,1st Half,16:13,False,128550,2024-11-05T00:08:28Z
401711753101838901,101838901,LayUpShot,Charlie Yoder missed Layup.,8,4,1st Half,16:10,False,128550,2024-11-05T00:08:28Z
401711753101838902,101838902,Block Shot,Abramo Canka Block.,8,4,1st Half,16:10,False,56,2024-11-05T00:08:28Z
401711753101839001,101839001,Defensive Rebound,Stetson Defensive Rebound.,8,4,1st Half,16:09,False,56,2024-11-05T00:08:28Z
401711753101844401,101844401,DunkShot,Jamie Phillips Jr. made Dunk.,8,6,1st Half,15:55,True,56,2024-11-05T00:08:28Z
401711753101846001,101846001,JumpShot,Jack Scott made Three Point Jumper. Assisted by Jordan Clark.,11,6,1st Half,15:39,True,128550,2024-11-05T00:09:04Z
401711753101848201,101848201,PersonalFoul,Foul on Adrian Moore.,11,6,1st Half,15:17,False,128550,2024-11-05T00:09:04Z
401711753101848202,101848202,MadeFreeThrow,Jordan Wood made Free Throw.,11,7,1st Half,15:17,True,56,2024-11-05T00:09:04Z
401711753101848203,101848203,MadeFreeThrow,Jordan Wood made Free Throw.,11,8,1st Half,15:17,True,56,2024-11-05T00:09:04Z
401711753101854701,101854701,LayUpShot,Charlie Yoder missed Layup.,11,8,1st Half,14:52,False,128550,2024-11-05T00:12:27Z
401711753101854702,101854702,Block Shot,Tristan Gross Block.,11,8,1st Half,14:52,False,56,2024-11-05T00:12:27Z
401711753101855301,101855301,Offensive Rebound,Jack Scott Offensive Rebound.,11,8,1st Half,14:46,False,128550,2024-11-05T00:12:27Z
401711753101855401,101855401,LayUpShot,Jack Scott made Layup.,13,8,1st Half,14:45,True,128550,2024-11-05T00:12:27Z
401711753101856901,101856901,JumpShot,Stefano Alesso made Jumper. Assisted by Mehki Ellison.,13,10,1st Half,14:30,True,56,2024-11-05T00:13:23Z
401711753101858701,101858701,JumpShot,Jordan Clark made Jumper.,15,10,1st Half,14:12,True,128550,2024-11-05T00:13:23Z
401711753101864001,101864001,LayUpShot,Stefano Alesso made Layup.,15,12,1st Half,13:59,True,56,2024-11-05T00:13:23Z
401711753101865501,101865501,JumpShot,Jack Scott made Three Point Jumper. Assisted by Jordan Clark.,18,12,1st Half,13:44,True,128550,2024-11-05T00:13:23Z
401711753101867701,101867701,JumpShot,Stefano Alesso missed Three Point Jumper.,18,12,1st Half,13:22,False,56,2024-11-05T00:14:25Z
401711753101868001,101868001,Offensive Rebound,Stefano Alesso Offensive Rebound.,18,12,1st Half,13:19,False,56,2024-11-05T00:14:25Z
401711753101868002,101868002,PersonalFoul,Foul on Adrian Moore.,18,12,1st Half,13:19,False,128550,2024-11-05T00:14:25Z
401711753101868301,101868301,Lost Ball Turnover,Stefano Alesso Turnover.,18,12,1st Half,13:16,False,56,2024-11-05T00:14:25Z
401711753101868302,101868302,Steal,Jordan Clark Steal.,18,12,1st Half,13:16,False,128550,2024-11-05T00:14:25Z
401711753101868801,101868801,LayUpShot,Jordan Clark missed Layup.,18,12,1st Half,13:11,False,128550,2024-11-05T00:14:25Z
401711753101869001,101869001,Offensive Rebound,Jordan Clark Offensive Rebound.,18,12,1st Half,13:09,False,128550,2024-11-05T00:14:25Z
401711753101869101,101869101,LayUpShot,Jordan Clark made Layup.,20,12,1st Half,13:08,True,128550,2024-11-05T00:14:25Z
401711753101869701,101869701,JumpShot,Tristan Gross missed Jumper.,20,12,1st Half,13:02,False,56,2024-11-05T00:14:25Z
401711753101874301,101874301,Defensive Rebound,Jordan Clark Defensive Rebound.,20,12,1st Half,12:56,False,128550,2024-11-05T00:15:22Z
401711753101875001,101875001,JumpShot,Diego Eslava missed Three Point Jumper.,20,12,1st Half,12:49,False,128550,2024-11-05T00:15:22Z
401711753101875301,101875301,Defensive Rebound,Stefano Alesso Defensive Rebound.,20,12,1st Half,12:46,False,56,2024-11-05T00:15:22Z
401711753101875302,101875302,PersonalFoul,Foul on Diego Eslava.,20,12,1st Half,12:46,False,128550,2024-11-05T00:15:22Z
401711753101876001,101876001,LayUpShot,Daniel Macgregor missed Layup.,20,12,1st Half,12:39,False,56,2024-11-05T00:16:29Z
401711753101876401,101876401,Offensive Rebound,Josh Massey Offensive Rebound.,20,12,1st Half,12:35,False,56,2024-11-05T00:16:29Z
401711753101876601,101876601,Lost Ball Turnover,Josh Massey Turnover.,20,12,1st Half,12:33,False,56,2024-11-05T00:16:29Z
401711753101876602,101876602,Steal,Jack Scott Steal.,20,12,1st Half,12:33,False,128550,2024-11-05T00:16:29Z
401711753101878101,101878101,LayUpShot,Charlie Yoder missed Layup.,20,12,1st Half,12:18,False,128550,2024-11-05T00:16:29Z
401711753101878401,101878401,Defensive Rebound,Alex Doyle Defensive Rebound.,20,12,1st Half,12:15,False,56,2024-11-05T00:16:29Z
401711753101878402,101878402,Lost Ball Turnover,Alex Doyle Turnover.,20,12,1st Half,12:15,False,56,2024-11-05T00:16:29Z
401711753101878901,101878901,LayUpShot,Charlie Yoder made Layup.,22,12,1st Half,12:10,True,128550,2024-11-05T00:16:29Z
401711753101884601,101884601,LayUpShot,Alex Doyle made Layup.,22,14,1st Half,11:53,True,56,2024-11-05T00:20:27Z
401711753101886601,101886601,JumpShot,Jack Scott missed Jumper.,22,14,1st Half,11:33,False,128550,2024-11-05T00:20:27Z
401711753101887001,101887001,Defensive Rebound,Tristan Gross Defensive Rebound.,22,14,1st Half,11:29,False,56,2024-11-05T00:20:27Z
401711753101887501,101887501,JumpShot,Tristan Gross made Three Point Jumper. Assisted by Daniel Macgregor.,22,17,1st Half,11:24,True,56,2024-11-05T00:20:27Z
401711753101889001,101889001,PersonalFoul,Foul on Stefano Alesso.,22,17,1st Half,11:09,False,56,2024-11-05T00:20:27Z
401711753101889201,101889201,PersonalFoul,Foul on Daniel Macgregor.,22,17,1st Half,11:07,False,56,2024-11-05T00:20:27Z
401711753101895001,101895001,Lost Ball Turnover,Zach Close Turnover.,22,17,1st Half,10:49,False,128550,2024-11-05T00:20:27Z
401711753101895002,101895002,Steal,Tristan Gross Steal.,22,17,1st Half,10:49,False,56,2024-11-05T00:20:27Z
401711753101895401,101895401,DunkShot,Tristan Gross made Dunk.,22,19,1st Half,10:45,True,56,2024-11-05T00:20:27Z
401711753101898601,101898601,JumpShot,Adonis Caneris missed Three Point Jumper.,22,19,1st Half,10:13,False,128550,2024-11-05T00:22:28Z
401711753101899001,101899001,Defensive Rebound,Finley Sheridan Defensive Rebound.,22,19,1st Half,10:09,False,56,2024-11-05T00:22:28Z
401711753101899201,101899201,PersonalFoul,Foul on Adonis Caneris.,22,19,1st Half,10:07,False,128550,2024-11-05T00:22:28Z
401711753101899301,101899301,MadeFreeThrow,Tristan Gross made Free Throw.,22,20,1st Half,10:06,True,56,2024-11-05T00:22:28Z
401711753101899302,101899302,MadeFreeThrow,Tristan Gross made Free Throw.,22,21,1st Half,10:06,True,56,2024-11-05T00:22:28Z
401711753101899303,101899303,MadeFreeThrow,Tristan Gross made Free Throw.,22,22,1st Half,10:06,True,56,2024-11-05T00:22:28Z
401711753101905301,101905301,LayUpShot,Jack Scott made Layup.,24,22,1st Half,9:46,True,128550,2024-11-05T00:23:26Z
401711753101905302,101905302,PersonalFoul,Foul on Alex Doyle.,24,22,1st Half,9:46,False,56,2024-11-05T00:23:26Z
401711753101905303,101905303,MadeFreeThrow,Jack Scott made Free Throw.,25,22,1st Half,9:46,True,128550,2024-11-05T00:23:26Z
401711753101906801,101906801,Lost Ball Turnover,Finley Sheridan Turnover.,25,22,1st Half,9:31,False,56,2024-11-05T00:23:26Z
401711753101906802,101906802,Steal,Zach Close Steal.,25,22,1st Half,9:31,False,128550,2024-11-05T00:23:26Z
401711753101908901,101908901,Lost Ball Turnover,Jack Scott Turnover.,25,22,1st Half,9:10,False,128550,2024-11-05T00:24:27Z
401711753101908902,101908902,Steal,Alex Doyle Steal.,25,22,1st Half,9:10,False,56,2024-11-05T00:24:27Z
401711753101909501,101909501,Lost Ball Turnover,Abramo Canka Turnover.,25,22,1st Half,9:04,False,56,2024-11-05T00:24:27Z
401711753101909502,101909502,Steal,Jordan Clark Steal.,25,22,1st Half,9:04,False,128550,2024-11-05T00:24:27Z
401711753101915601,101915601,JumpShot,Ben Walker missed Three Point Jumper.,25,22,1st Half,8:43,False,128550,2024-11-05T00:24:27Z
401711753101916001,101916001,Defensive Rebound,Abramo Canka Defensive Rebound.,25,22,1st Half,8:39,False,56,2024-11-05T00:24:27Z
401711753101916401,101916401,JumpShot,Tristan Gross missed Three Point Jumper.,25,22,1st Half,8:35,False,56,2024-11-05T00:24:27Z
401711753101916801,101916801,Defensive Rebound,Ben Walker Defensive Rebound.,25,22,1st Half,8:31,False,128550,2024-11-05T00:24:27Z
401711753101918301,101918301,JumpShot,Jordan Clark made Jumper.,27,22,1st Half,8:16,True,128550,2024-11-05T00:24:55Z
401711753101918901,101918901,JumpShot,Mehki Ellison made Jumper.,27,24,1st Half,8:10,True,56,2024-11-05T00:24:55Z
401711753101925901,101925901,Lost Ball Turnover,Jack Scott Turnover.,27,24,1st Half,7:40,False,128550,2024-11-05T00:25:23Z
401711753101925902,101925902,Steal,Alex Doyle Steal.,27,24,1st Half,7:40,False,56,2024-11-05T00:25:23Z
401711753101927101,101927101,PersonalFoul,Foul on Charlie Yoder.,27,24,1st Half,7:28,False,128550,2024-11-05T00:28:26Z
401711753101927102,101927102,MadeFreeThrow,Jordan Wood made Free Throw.,27,25,1st Half,7:28,True,56,2024-11-05T00:28:26Z
401711753101927103,101927103,MadeFreeThrow,Jordan Wood made Free Throw.,27,26,1st Half,7:28,True,56,2024-11-05T00:28:26Z
401711753101928601,101928601,JumpShot,Jack Scott missed Three Point Jumper.,27,26,1st Half,7:13,False,128550,2024-11-05T00:29:23Z
401711753101928901,101928901,Defensive Rebound,Jordan Wood Defensive Rebound.,27,26,1st Half,7:10,False,56,2024-11-05T00:29:23Z
401711753101934201,101934201,JumpShot,Jamie Phillips Jr. made Jumper.,27,28,1st Half,6:57,True,56,2024-11-05T00:30:27Z
401711753101934202,101934202,PersonalFoul,Foul on Jack Scott.,27,28,1st Half,6:57,False,128550,2024-11-05T00:30:27Z
401711753101934301,101934301,MadeFreeThrow,Jamie Phillips Jr. missed Free Throw.,27,28,1st Half,6:56,False,56,2024-11-05T00:30:27Z
401711753101934401,101934401,Defensive Rebound,Ben Walker Defensive Rebound.,27,28,1st Half,6:55,False,128550,2024-11-05T00:30:27Z
401711753101935801,101935801,LayUpShot,Diego Eslava made Layup.,29,28,1st Half,6:41,True,128550,2024-11-05T00:31:26Z
401711753101936901,101936901,Lost Ball Turnover,Jordan Wood Turnover.,29,28,1st Half,6:30,False,56,2024-11-05T00:31:26Z
401711753101936902,101936902,Steal,Jordan Clark Steal.,29,28,1st Half,6:30,False,128550,2024-11-05T00:31:26Z
401711753101938901,101938901,JumpShot,Ben Walker made Three Point Jumper. Assisted by Diego Eslava.,32,28,1st Half,6:10,True,128550,2024-11-05T00:31:26Z
401711753101944401,101944401,JumpShot,Jordan Wood missed Three Point Jumper.,32,28,1st Half,5:55,False,56,2024-11-05T00:31:26Z
401711753101944801,101944801,Defensive Rebound,Charlie Yoder Defensive Rebound.,32,28,1st Half,5:51,False,128550,2024-11-05T00:31:26Z
401711753101945901,101945901,LayUpShot,Charlie Yoder missed Layup.,32,28,1st Half,5:40,False,128550,2024-11-05T00:31:26Z
401711753101945902,101945902,Block Shot,Abramo Canka Block.,32,28,1st Half,5:40,False,56,2024-11-05T00:31:26Z
401711753101945903,101945903,Offensive Rebound,New College (FL) Offensive Rebound.,32,28,1st Half,5:40,False,128550,2024-11-05T00:31:26Z
401711753101947301,101947301,LayUpShot,Ben Walker missed Layup.,32,28,1st Half,5:26,False,128550,2024-11-05T00:32:27Z
401711753101947401,101947401,Offensive Rebound,New College (FL) Offensive Rebound.,32,28,1st Half,5:25,False,128550,2024-11-05T00:32:27Z
401711753101948901,101948901,PersonalFoul,Foul on Stefano Alesso.,32,28,1st Half,5:10,False,56,2024-11-05T00:35:00Z
401711753101948902,101948902,MadeFreeThrow,Zach Close missed Free Throw.,32,28,1st Half,5:10,False,128550,2024-11-05T00:35:00Z
401711753101948903,101948903,Offensive Rebound,New College (FL) Offensive Rebound.,32,28,1st Half,5:10,False,128550,2024-11-05T00:35:00Z
401711753101948904,101948904,MadeFreeThrow,Zach Close made Free Throw.,33,28,1st Half,5:10,True,128550,2024-11-05T00:35:00Z
401711753101954701,101954701,DunkShot,Jordan Wood made Dunk. Assisted by Stefano Alesso.,33,30,1st Half,4:52,True,56,2024-11-05T00:35:00Z
401711753101956701,101956701,JumpShot,Ben Walker missed Three Point Jumper.,33,30,1st Half,4:32,False,128550,2024-11-05T00:35:00Z
401711753101957001,101957001,Offensive Rebound,Diego Eslava Offensive Rebound.,33,30,1st Half,4:29,False,128550,2024-11-05T00:35:00Z
401711753101958401,101958401,JumpShot,Diego Eslava missed Three Point Jumper.,33,30,1st Half,4:15,False,128550,2024-11-05T00:35:00Z
401711753101958701,101958701,Defensive Rebound,Stefano Alesso Defensive Rebound.,33,30,1st Half,4:12,False,56,2024-11-05T00:35:00Z
401711753101964001,101964001,LayUpShot,Stefano Alesso made Layup. Assisted by Jamie Phillips Jr..,33,32,1st Half,3:59,True,56,2024-11-05T00:35:00Z
401711753101966001,101966001,LayUpShot,Zach Close missed Layup.,33,32,1st Half,3:39,False,128550,2024-11-05T00:38:27Z
401711753101966301,101966301,Defensive Rebound,Jordan Wood Defensive Rebound.,33,32,1st Half,3:36,False,56,2024-11-05T00:38:27Z
401711753101966601,101966601,PersonalFoul,Foul on Ben Walker.,33,32,1st Half,3:33,False,128550,2024-11-05T00:38:27Z
401711753101966602,101966602,MadeFreeThrow,Jordan Wood missed Free Throw.,33,32,1st Half,3:33,False,56,2024-11-05T00:38:27Z
401711753101966603,101966603,Defensive Rebound,New College (FL) Defensive Rebound.,33,32,1st Half,3:33,False,128550,2024-11-05T00:38:27Z
401711753101968302,101968302,Lost Ball Turnover,Tristan Gross Turnover.,33,32,1st Half,3:16,False,56,2024-11-05T00:43:05Z
401711753101968303,101968303,JumpShot,Charlie Yoder missed Three Point Jumper.,33,32,1st Half,3:16,False,128550,2024-11-05T00:43:05Z
401711753101968701,101968701,Defensive Rebound,Jordan Wood Defensive Rebound.,33,32,1st Half,3:12,False,56,2024-11-05T00:39:01Z
401711753101969301,101969301,PersonalFoul,Foul on Zach Close.,33,32,1st Half,3:06,False,128550,2024-11-05T00:39:01Z
401711753101969302,101969302,MadeFreeThrow,Stefano Alesso missed Free Throw.,33,32,1st Half,3:06,False,56,2024-11-05T00:39:01Z
401711753101969303,101969303,Offensive Rebound,Stetson Offensive Rebound.,33,32,1st Half,3:06,False,56,2024-11-05T00:39:01Z
401711753101969304,101969304,MadeFreeThrow,Stefano Alesso missed Free Throw.,33,32,1st Half,3:06,False,56,2024-11-05T00:39:01Z
401711753101969305,101969305,Offensive Rebound,Stetson Offensive Rebound.,33,32,1st Half,3:06,False,56,2024-11-05T00:39:01Z
401711753101974201,101974201,JumpShot,Mehki Ellison made Jumper.,33,34,1st Half,2:57,True,56,2024-11-05T00:40:31Z
401711753101976401,101976401,JumpShot,Zach Close made Three Point Jumper. Assisted by Caleb Kozinski.,36,34,1st Half,2:35,True,128550,2024-11-05T00:42:29Z
401711753101977701,101977701,LayUpShot,Stefano Alesso made Layup. Assisted by Jordan Wood.,36,36,1st Half,2:22,True,56,2024-11-05T00:42:29Z
401711753101979701,101979701,LayUpShot,Jordan Clark missed Layup.,36,36,1st Half,2:02,False,128550,2024-11-05T00:42:29Z
401711753101984001,101984001,Defensive Rebound,Tristan Gross Defensive Rebound.,36,36,1st Half,1:59,False,56,2024-11-05T00:42:29Z
401711753101984501,101984501,JumpShot,Jamie Phillips Jr. missed Three Point Jumper.,36,36,1st Half,1:54,False,56,2024-11-05T00:42:29Z
401711753101984502,101984502,Offensive Rebound,Stefano Alesso Offensive Rebound.,36,36,1st Half,1:54,False,56,2024-11-05T00:42:29Z
401711753101984503,101984503,PersonalFoul,Foul on Caleb Kozinski.,36,36,1st Half,1:54,False,128550,2024-11-05T00:42:29Z
401711753101984504,101984504,MadeFreeThrow,Stefano Alesso missed Free Throw.,36,36,1st Half,1:54,False,56,2024-11-05T00:42:29Z
401711753101984505,101984505,Offensive Rebound,Stetson Offensive Rebound.,36,36,1st Half,1:54,False,56,2024-11-05T00:42:29Z
401711753101984506,101984506,MadeFreeThrow,Stefano Alesso made Free Throw.,36,37,1st Half,1:54,True,56,2024-11-05T00:42:29Z
401711753101986801,101986801,JumpShot,Diego Eslava made Three Point Jumper. Assisted by Charlie Yoder.,39,37,1st Half,1:31,True,128550,2024-11-05T00:43:05Z
401711753101989101,101989101,JumpShot,Jordan Wood missed Three Point Jumper.,39,37,1st Half,1:08,False,56,2024-11-05T00:43:05Z
401711753101989201,101989201,Defensive Rebound,New College (FL) Defensive Rebound.,39,37,1st Half,1:07,False,128550,2024-11-05T00:43:05Z
401711753101996101,101996101,Lost Ball Turnover,Jordan Clark Turnover.,39,37,1st Half,0:38,False,128550,2024-11-05T00:43:05Z
401711753101996102,101996102,Steal,Daniel Macgregor Steal.,39,37,1st Half,0:38,False,56,2024-11-05T00:43:05Z
401711753101997001,101997001,JumpShot,Tristan Gross missed Three Point Jumper.,39,37,1st Half,0:29,False,56,2024-11-05T00:43:05Z
401711753101997601,101997601,Defensive Rebound,Charlie Yoder Defensive Rebound.,39,37,1st Half,0:23,False,128550,2024-11-05T00:43:05Z
401711753101999801,101999801,JumpShot,Jordan Clark missed Three Point Jumper.,39,37,1st Half,0:01,False,128550,2024-11-05T00:43:05Z
401711753101999802,101999802,Defensive Rebound,Alex Doyle Defensive Rebound.,39,37,1st Half,0:01,False,56,2024-11-05T00:43:05Z
401711753101999901,101999901,End Period,End of 1st half,39,37,1st Half,0:00,False,,2024-11-05T00:43:05Z
401711753102805101,102805101,JumpShot,Adrian Moore made Three Point Jumper. Assisted by Jack Scott.,42,37,2nd Half,19:48,True,128550,2024-11-05T01:00:47Z
401711753102806701,102806701,JumpShot,Mehki Ellison made Jumper.,42,39,2nd Half,19:32,True,56,2024-11-05T01:01:09Z
401711753102809501,102809501,JumpShot,Ben Walker made Three Point Jumper. Assisted by Jack Scott.,45,39,2nd Half,19:04,True,128550,2024-11-05T01:02:22Z
401711753102814201,102814201,JumpShot,Jamie Phillips Jr. made Jumper.,45,41,2nd Half,18:57,True,56,2024-11-05T01:02:22Z
401711753102814202,102814202,PersonalFoul,Foul on Diego Eslava.,45,41,2nd Half,18:57,False,128550,2024-11-05T01:02:22Z
401711753102814203,102814203,MadeFreeThrow,Jamie Phillips Jr. made Free Throw.,45,42,2nd Half,18:57,True,56,2024-11-05T01:02:22Z
401711753102815801,102815801,LayUpShot,Jack Scott made Layup. Assisted by Adrian Moore.,47,42,2nd Half,18:41,True,128550,2024-11-05T01:02:45Z
401711753102817001,102817001,JumpShot,Jordan Wood missed Three Point Jumper.,47,42,2nd Half,18:29,False,56,2024-11-05T01:02:45Z
401711753102817401,102817401,Offensive Rebound,Stetson Offensive Rebound.,47,42,2nd Half,18:25,False,56,2024-11-05T01:02:45Z
401711753102817501,102817501,Lost Ball Turnover,Mehki Ellison Turnover.,47,42,2nd Half,18:24,False,56,2024-11-05T01:03:09Z
401711753102817502,102817502,Steal,Jordan Clark Steal.,47,42,2nd Half,18:24,False,128550,2024-11-05T01:03:09Z
401711753102818101,102818101,JumpShot,Diego Eslava made Three Point Jumper. Assisted by Jordan Clark.,50,42,2nd Half,18:18,True,128550,2024-11-05T01:07:08Z
401711753102818201,102818201,ShortTimeOut,Stetson  Timeout,50,42,2nd Half,18:17,False,56,2024-11-05T01:03:09Z
401711753102819201,102819201,Lost Ball Turnover,Mehki Ellison Turnover.,50,42,2nd Half,18:07,False,56,2024-11-05T01:07:08Z
401711753102819202,102819202,Steal,Adrian Moore Steal.,50,42,2nd Half,18:07,False,128550,2024-11-05T01:07:08Z
401711753102824401,102824401,JumpShot,Ben Walker missed Three Point Jumper.,50,42,2nd Half,17:55,False,128550,2024-11-05T01:07:08Z
401711753102824801,102824801,Defensive Rebound,Jordan Wood Defensive Rebound.,50,42,2nd Half,17:51,False,56,2024-11-05T01:07:08Z
401711753102825601,102825601,Lost Ball Turnover,Tristan Gross Turnover.,50,42,2nd Half,17:43,False,56,2024-11-05T01:07:08Z
401711753102825602,102825602,Steal,Jordan Clark Steal.,50,42,2nd Half,17:43,False,128550,2024-11-05T01:07:08Z
401711753102826601,102826601,JumpShot,Diego Eslava missed Three Point Jumper.,50,42,2nd Half,17:33,False,128550,2024-11-05T01:07:08Z
401711753102827101,102827101,Offensive Rebound,Jordan Clark Offensive Rebound.,50,42,2nd Half,17:28,False,128550,2024-11-05T01:07:08Z
401711753102827102,102827102,JumpShot,Jordan Clark made Jumper.,52,42,2nd Half,17:28,True,128550,2024-11-05T01:07:08Z
401711753102829001,102829001,JumpShot,Tristan Gross made Three Point Jumper. Assisted by Jordan Wood.,52,45,2nd Half,17:09,True,56,2024-11-05T01:07:08Z
401711753102836201,102836201,JumpShot,Diego Eslava missed Jumper.,52,45,2nd Half,16:37,False,128550,2024-11-05T01:07:08Z
401711753102836601,102836601,Defensive Rebound,Alex Doyle Defensive Rebound.,52,45,2nd Half,16:33,False,56,2024-11-05T01:08:27Z
401711753102837401,102837401,JumpShot,Tristan Gross missed Three Point Jumper.,52,45,2nd Half,16:25,False,56,2024-11-05T01:08:27Z
401711753102837801,102837801,Offensive Rebound,Jamie Phillips Jr. Offensive Rebound.,52,45,2nd Half,16:21,False,56,2024-11-05T01:08:27Z
401711753102838401,102838401,JumpShot,Alex Doyle missed Three Point Jumper.,52,45,2nd Half,16:15,False,56,2024-11-05T01:08:27Z
401711753102838601,102838601,Defensive Rebound,Jack Scott Defensive Rebound.,52,45,2nd Half,16:13,False,128550,2024-11-05T01:08:27Z
401711753102838602,102838602,PersonalFoul,Foul on Adrian Moore.,52,45,2nd Half,16:13,False,128550,2024-11-05T01:08:27Z
401711753102839801,102839801,JumpShot,Josh Massey made Three Point Jumper. Assisted by Alex Doyle.,52,48,2nd Half,16:01,True,56,2024-11-05T01:09:01Z
401711753102845301,102845301,JumpShot,Jack Scott missed Three Point Jumper.,52,48,2nd Half,15:46,False,128550,2024-11-05T01:09:01Z
401711753102845601,102845601,Defensive Rebound,Josh Massey Defensive Rebound.,52,48,2nd Half,15:43,False,56,2024-11-05T01:09:01Z
401711753102846001,102846001,JumpShot,Alex Doyle made Three Point Jumper. Assisted by Tristan Gross.,52,51,2nd Half,15:39,True,56,2024-11-05T01:09:01Z
401711753102847001,102847001,ShortTimeOut,New College (FL)  Timeout,52,51,2nd Half,15:29,False,128550,2024-11-05T01:12:28Z
401711753102848301,102848301,Lost Ball Turnover,Ben Walker Turnover.,52,51,2nd Half,15:16,False,128550,2024-11-05T01:12:28Z
401711753102848302,102848302,Steal,Josh Massey Steal.,52,51,2nd Half,15:16,False,56,2024-11-05T01:12:28Z
401711753102849301,102849301,PersonalFoul,Foul on Ben Walker.,52,51,2nd Half,15:06,False,128550,2024-11-05T01:12:28Z
401711753102849302,102849302,MadeFreeThrow,Josh Massey made Free Throw.,52,52,2nd Half,15:06,True,56,2024-11-05T01:12:28Z
401711753102849303,102849303,MadeFreeThrow,Josh Massey made Free Throw.,52,53,2nd Half,15:06,True,56,2024-11-05T01:12:28Z
401711753102854501,102854501,Lost Ball Turnover,Ben Walker Turnover.,52,53,2nd Half,14:54,False,128550,2024-11-05T01:14:29Z
401711753102854502,102854502,Steal,Josh Massey Steal.,52,53,2nd Half,14:54,False,56,2024-11-05T01:14:29Z
