play_id,sequence_number,type,description,away_score,home_score,period,clock,scoring_play,team_id,timestamp_utc
401743879113286567,113286567,Jumpball,Start game,0,0,1st Half,20:00,False,,2025-03-13T18:36:38Z
401743879113286569,113286569,Jumpball,Jump Ball won by Marquette,0,0,1st Half,19:59,False,269,2025-03-13T18:36:39Z
401743879113286571,113286571,Jumpball,Jump Ball lost by Xavier,0,0,1st Half,19:59,False,2752,2025-03-13T18:36:39Z
401743879113286582,113286582,JumpShot,David Joplin made Three Point Jumper. Assisted by Kam Jones.,3,0,1st Half,19:38,True,269,2025-03-13T18:37:01Z
401743879113286592,113286592,LayUpShot,Dailyn Swain made Layup. Assisted by Zach Freemantle.,3,2,1st Half,19:06,True,2752,2025-03-13T18:37:33Z
401743879113286605,113286605,JumpShot,Stevie Mitchell made Three Point Jumper.,6,2,1st Half,18:52,True,269,2025-03-13T18:37:46Z
401743879113286652,113286652,PersonalFoul,Foul on Ben Gold.,6,2,1st Half,18:25,False,269,2025-03-13T18:38:30Z
401743879113286657,113286657,MadeFreeThrow,Dailyn Swain made Free Throw.,6,3,1st Half,18:25,True,2752,2025-03-13T18:38:44Z
401743879113286662,113286662,MadeFreeThrow,Dailyn Swain made Free Throw.,6,4,1st Half,18:25,True,2752,2025-03-13T18:38:56Z
401743879113286671,113286671,PersonalFoul,Foul on Marcus Foster.,6,4,1st Half,18:12,False,2752,2025-03-13T18:39:17Z
401743879113286698,113286698,JumpShot,Ben Gold missed Jumper.,6,4,1st Half,17:54,False,269,2025-03-13T18:39:52Z
401743879113286700,113286700,Defensive Rebound,Dayvion McKnight Defensive Rebound.,6,4,1st Half,17:49,False,2752,2025-03-13T18:39:55Z
401743879113286705,113286705,JumpShot,Zach Freemantle missed Jumper.,6,4,1st Half,17:41,False,2752,2025-03-13T18:40:04Z
401743879113286706,113286706,Defensive Rebound,David Joplin Defensive Rebound.,6,4,1st Half,17:38,False,269,2025-03-13T18:40:06Z
401743879113286712,113286712,LayUpShot,Kam Jones missed Layup.,6,4,1st Half,17:29,False,269,2025-03-13T18:40:15Z
401743879113286714,113286714,Defensive Rebound,Zach Freemantle Defensive Rebound.,6,4,1st Half,17:27,False,2752,2025-03-13T18:40:17Z
401743879113286717,113286717,JumpShot,Ryan Conwell missed Three Point Jumper.,6,4,1st Half,17:22,False,2752,2025-03-13T18:40:23Z
401743879113286718,113286718,Defensive Rebound,Marquette Defensive Rebound.,6,4,1st Half,17:20,False,269,2025-03-13T18:40:26Z
401743879113286739,113286739,JumpShot,Kam Jones missed Three Point Jumper.,6,4,1st Half,17:11,False,269,2025-03-13T18:40:48Z
401743879113286744,113286744,Defensive Rebound,Xavier Defensive Rebound.,6,4,1st Half,17:09,False,2752,2025-03-13T18:40:51Z
401743879113286757,113286757,JumpShot,Ryan Conwell made Three Point Jumper. Assisted by Marcus Foster.,6,7,1st Half,16:52,True,2752,2025-03-13T18:41:16Z
401743879113286764,113286764,LayUpShot,Stevie Mitchell missed Layup.,6,7,1st Half,16:43,False,269,2025-03-13T18:41:24Z
401743879113286765,113286765,Defensive Rebound,Zach Freemantle Defensive Rebound.,6,7,1st Half,16:41,False,2752,2025-03-13T18:41:26Z
401743879113286794,113286794,JumpShot,Dailyn Swain missed Jumper.,6,7,1st Half,16:37,False,2752,2025-03-13T18:41:30Z
401743879113286796,113286796,Defensive Rebound,Chase Ross Defensive Rebound.,6,7,1st Half,16:35,False,269,2025-03-13T18:41:32Z
401743879113286810,113286810,JumpShot,David Joplin missed Three Point Jumper.,6,7,1st Half,16:29,False,269,2025-03-13T18:41:40Z
401743879113286811,113286811,Defensive Rebound,Marcus Foster Defensive Rebound.,6,7,1st Half,16:25,False,2752,2025-03-13T18:41:42Z
401743879113286816,113286816,PersonalFoul,Foul on Kam Jones.,6,7,1st Half,16:21,False,269,2025-03-13T18:41:53Z
401743879113286820,113286820,Substitution,Ryan Conwell subbing out for Xavier,6,7,1st Half,16:21,False,2752,2025-03-13T18:42:03Z
401743879113286821,113286821,Substitution,Dante Maddox Jr. subbing in for Xavier,6,7,1st Half,16:21,False,2752,2025-03-13T18:42:03Z
401743879113286830,113286830,Substitution,Kam Jones subbing out for Marquette,6,7,1st Half,16:21,False,269,2025-03-13T18:42:17Z
401743879113286831,113286831,Substitution,Ben Gold subbing out for Marquette,6,7,1st Half,16:21,False,269,2025-03-13T18:42:17Z
401743879113286832,113286832,Substitution,Zaide Lowery subbing in for Marquette,6,7,1st Half,16:21,False,269,2025-03-13T18:42:17Z
401743879113286834,113286834,Substitution,Royce Parham subbing in for Marquette,6,7,1st Half,16:21,False,269,2025-03-13T18:42:17Z
401743879113286851,113286851,JumpShot,Marcus Foster made Three Point Jumper. Assisted by Zach Freemantle.,6,10,1st Half,16:15,True,2752,2025-03-13T18:42:32Z
401743879113286855,113286855,Lost Ball Turnover,Chase Ross Turnover.,6,10,1st Half,16:00,False,269,2025-03-13T18:42:47Z
401743879113286858,113286858,OfficialTVTimeOut,Official TV Timeout,6,10,1st Half,16:00,False,,2025-03-13T18:42:50Z
401743879113286959,113286959,Substitution,Marcus Foster subbing out for Xavier,6,10,1st Half,16:00,False,2752,2025-03-13T18:45:52Z
401743879113286960,113286960,Substitution,Jerome Hunter subbing in for Xavier,6,10,1st Half,16:00,False,2752,2025-03-13T18:45:52Z
401743879113286981,113286981,Substitution,Dayvion McKnight subbing out for Xavier,6,10,1st Half,15:37,False,2752,2025-03-13T18:46:35Z
401743879113286982,113286982,Substitution,Ryan Conwell subbing in for Xavier,6,10,1st Half,15:37,False,2752,2025-03-13T18:46:35Z
401743879113286991,113286991,Substitution,Stevie Mitchell subbing out for Marquette,6,10,1st Half,15:37,False,269,2025-03-13T18:46:47Z
401743879113286992,113286992,Substitution,Kam Jones subbing in for Marquette,6,10,1st Half,15:37,False,269,2025-03-13T18:46:47Z
401743879113287003,113287003,JumpShot,Dailyn Swain missed Jumper.,6,10,1st Half,15:32,False,2752,2025-03-13T18:46:55Z
401743879113287004,113287004,Defensive Rebound,Kam Jones Defensive Rebound.,6,10,1st Half,15:29,False,269,2025-03-13T18:46:58Z
401743879113287034,113287034,LayUpShot,David Joplin made Layup.,8,10,1st Half,15:14,True,269,2025-03-13T18:47:14Z
401743879113287039,113287039,JumpShot,Dante Maddox Jr. made Jumper. Assisted by Zach Freemantle.,8,12,1st Half,14:59,True,2752,2025-03-13T18:47:30Z
401743879113287045,113287045,PersonalFoul,Foul on Dailyn Swain.,8,12,1st Half,14:46,False,2752,2025-03-13T18:47:48Z
401743879113287073,113287073,MadeFreeThrow,Royce Parham made Free Throw.,9,12,1st Half,14:46,True,269,2025-03-13T18:48:06Z
401743879113287074,113287074,Substitution,Dailyn Swain subbing out for Xavier,9,12,1st Half,14:46,False,2752,2025-03-13T18:48:14Z
401743879113287075,113287075,Substitution,Marcus Foster subbing in for Xavier,9,12,1st Half,14:46,False,2752,2025-03-13T18:48:14Z
401743879113287077,113287077,MadeFreeThrow,Royce Parham made Free Throw.,10,12,1st Half,14:46,True,269,2025-03-13T18:48:24Z
401743879113287127,113287127,LayUpShot,Marcus Foster made Layup. Assisted by Jerome Hunter.,10,14,1st Half,14:12,True,2752,2025-03-13T18:49:02Z
401743879113287131,113287131,LayUpShot,Zaide Lowery missed Layup.,10,14,1st Half,13:56,False,269,2025-03-13T18:49:18Z
401743879113287133,113287133,Offensive Rebound,Zaide Lowery Offensive Rebound.,10,14,1st Half,13:54,False,269,2025-03-13T18:49:19Z
401743879113287136,113287136,PersonalFoul,Foul on Ryan Conwell.,10,14,1st Half,13:54,False,2752,2025-03-13T18:49:25Z
401743879113287189,113287189,JumpShot,David Joplin missed Three Point Jumper.,10,14,1st Half,13:36,False,269,2025-03-13T18:50:15Z
401743879113287190,113287190,Defensive Rebound,Zach Freemantle Defensive Rebound.,10,14,1st Half,13:32,False,2752,2025-03-13T18:50:18Z
401743879113287199,113287199,PersonalFoul,Foul on Zaide Lowery.,10,14,1st Half,13:27,False,269,2025-03-13T18:50:27Z
401743879113287205,113287205,MadeFreeThrow,Dante Maddox Jr. made Free Throw.,10,15,1st Half,13:27,True,2752,2025-03-13T18:50:48Z
401743879113287212,113287212,Substitution,Zach Freemantle subbing out for Xavier,10,15,1st Half,13:27,False,2752,2025-03-13T18:51:02Z
401743879113287213,113287213,Substitution,Dailyn Swain subbing in for Xavier,10,15,1st Half,13:27,False,2752,2025-03-13T18:51:02Z
401743879113287214,113287214,Substitution,Chase Ross subbing out for Marquette,10,15,1st Half,13:27,False,269,2025-03-13T18:51:02Z
401743879113287215,113287215,Substitution,David Joplin subbing out for Marquette,10,15,1st Half,13:27,False,269,2025-03-13T18:51:02Z
401743879113287216,113287216,Substitution,Stevie Mitchell subbing in for Marquette,10,15,1st Half,13:27,False,269,2025-03-13T18:51:02Z
401743879113287217,113287217,Substitution,Ben Gold subbing in for Marquette,10,15,1st Half,13:27,False,269,2025-03-13T18:51:02Z
401743879113287220,113287220,MadeFreeThrow,Dante Maddox Jr. made Free Throw.,10,16,1st Half,13:27,True,2752,2025-03-13T18:51:12Z
401743879113287267,113287267,LayUpShot,Kam Jones missed Layup.,10,16,1st Half,13:19,False,269,2025-03-13T18:51:23Z
401743879113287268,113287268,Offensive Rebound,Stevie Mitchell Offensive Rebound.,10,16,1st Half,13:14,False,269,2025-03-13T18:51:27Z
401743879113287269,113287269,ShortTimeOut,Marquette Timeout,10,16,1st Half,13:14,False,269,2025-03-13T18:51:34Z
401743879113287345,113287345,JumpShot,Royce Parham missed Three Point Jumper.,10,16,1st Half,13:00,False,269,2025-03-13T18:53:06Z
401743879113287346,113287346,Defensive Rebound,Marcus Foster Defensive Rebound.,10,16,1st Half,12:58,False,2752,2025-03-13T18:53:08Z
401743879113287347,113287347,LayUpShot,Dailyn Swain missed Layup.,10,16,1st Half,12:50,False,2752,2025-03-13T18:53:16Z
401743879113287348,113287348,Defensive Rebound,Royce Parham Defensive Rebound.,10,16,1st Half,12:48,False,269,2025-03-13T18:53:18Z
401743879113287352,113287352,LayUpShot,Stevie Mitchell missed Layup.,10,16,1st Half,12:39,False,269,2025-03-13T18:53:27Z
401743879113287356,113287356,Defensive Rebound,Dailyn Swain Defensive Rebound.,10,16,1st Half,12:37,False,2752,2025-03-13T18:53:29Z
401743879113287358,113287358,Lost Ball Turnover,Dailyn Swain Turnover.,10,16,1st Half,12:34,False,2752,2025-03-13T18:53:32Z
401743879113287360,113287360,Steal,Stevie Mitchell Steal.,10,16,1st Half,12:34,False,269,2025-03-13T18:53:32Z
401743879113287361,113287361,JumpShot,Stevie Mitchell missed Three Point Jumper.,10,16,1st Half,12:30,False,269,2025-03-13T18:53:37Z
401743879113287363,113287363,Defensive Rebound,Jerome Hunter Defensive Rebound.,10,16,1st Half,12:27,False,2752,2025-03-13T18:53:38Z
401743879113287377,113287377,JumpShot,Jerome Hunter made Three Point Jumper.,10,19,1st Half,11:59,True,2752,2025-03-13T18:54:08Z
401743879113287381,113287381,LayUpShot,Kam Jones made Layup.,12,19,1st Half,11:46,True,269,2025-03-13T18:54:20Z
401743879113287385,113287385,JumpShot,Dante Maddox Jr. missed Three Point Jumper.,12,19,1st Half,11:29,False,2752,2025-03-13T18:54:39Z
401743879113287388,113287388,Defensive Rebound,Stevie Mitchell Defensive Rebound.,12,19,1st Half,11:26,False,269,2025-03-13T18:54:40Z
401743879113287403,113287403,LayUpShot,Zaide Lowery made Layup.,14,19,1st Half,11:10,True,269,2025-03-13T18:54:57Z
401743879113287414,113287414,JumpShot,Ryan Conwell missed Three Point Jumper.,14,19,1st Half,10:41,False,2752,2025-03-13T18:55:26Z
401743879113287415,113287415,Defensive Rebound,Royce Parham Defensive Rebound.,14,19,1st Half,10:38,False,269,2025-03-13T18:55:28Z
401743879113287426,113287426,JumpShot,Kam Jones missed Three Point Jumper.,14,19,1st Half,10:27,False,269,2025-03-13T18:55:39Z
401743879113287427,113287427,Defensive Rebound,Ryan Conwell Defensive Rebound.,14,19,1st Half,10:25,False,2752,2025-03-13T18:55:41Z
401743879113287428,113287428,Lost Ball Turnover,Ryan Conwell Turnover.,14,19,1st Half,10:18,False,2752,2025-03-13T18:55:48Z
401743879113287432,113287432,Steal,Stevie Mitchell Steal.,14,19,1st Half,10:18,False,269,2025-03-13T18:55:48Z
401743879113287435,113287435,DunkShot,Royce Parham made Dunk. Assisted by Zaide Lowery.,16,19,1st Half,10:12,True,269,2025-03-13T18:55:54Z
401743879113287437,113287437,ShortTimeOut,Xavier Timeout,16,19,1st Half,10:12,False,2752,2025-03-13T18:55:59Z
401743879113287438,113287438,OfficialTVTimeOut,Official TV Timeout,16,19,1st Half,10:12,False,,2025-03-13T18:56:01Z
401743879113287575,113287575,Substitution,Marcus Foster subbing out for Xavier,16,19,1st Half,10:12,False,2752,2025-03-13T18:59:27Z
401743879113287576,113287576,Substitution,Jerome Hunter subbing out for Xavier,16,19,1st Half,10:12,False,2752,2025-03-13T18:59:27Z
401743879113287578,113287578,Substitution,Dayvion McKnight subbing in for Xavier,16,19,1st Half,10:12,False,2752,2025-03-13T18:59:27Z
401743879113287580,113287580,Substitution,Zach Freemantle subbing in for Xavier,16,19,1st Half,10:12,False,2752,2025-03-13T18:59:27Z
401743879113287582,113287582,Substitution,Zaide Lowery subbing out for Marquette,16,19,1st Half,10:12,False,269,2025-03-13T18:59:27Z
401743879113287583,113287583,Substitution,Royce Parham subbing out for Marquette,16,19,1st Half,10:12,False,269,2025-03-13T18:59:27Z
401743879113287584,113287584,Substitution,Damarius Owens subbing in for Marquette,16,19,1st Half,10:12,False,269,2025-03-13T18:59:27Z
401743879113287585,113287585,Substitution,David Joplin subbing in for Marquette,16,19,1st Half,10:12,False,269,2025-03-13T18:59:27Z
401743879113287615,113287615,JumpShot,Dayvion McKnight missed Jumper.,16,19,1st Half,9:45,False,2752,2025-03-13T19:00:09Z
401743879113287616,113287616,Defensive Rebound,Ben Gold Defensive Rebound.,16,19,1st Half,9:42,False,269,2025-03-13T19:00:11Z
401743879113287625,113287625,PersonalFoul,Foul on Dayvion McKnight.,16,19,1st Half,9:30,False,2752,2025-03-13T19:00:28Z
401743879113287659,113287659,Substitution,Stevie Mitchell subbing out for Marquette,16,19,1st Half,9:30,False,269,2025-03-13T19:00:46Z
401743879113287660,113287660,Substitution,Chase Ross subbing in for Marquette,16,19,1st Half,9:30,False,269,2025-03-13T19:00:46Z
401743879113287679,113287679,JumpShot,Chase Ross made Jumper. Assisted by Ben Gold.,18,19,1st Half,9:24,True,269,2025-03-13T19:01:14Z
401743879113287694,113287694,PersonalFoul,Foul on Damarius Owens.,18,19,1st Half,9:09,False,269,2025-03-13T19:01:31Z
401743879113287707,113287707,Substitution,Ryan Conwell subbing out for Xavier,18,19,1st Half,9:09,False,2752,2025-03-13T19:01:42Z
401743879113287708,113287708,Substitution,Marcus Foster subbing in for Xavier,18,19,1st Half,9:09,False,2752,2025-03-13T19:01:42Z
401743879113287716,113287716,Substitution,Kam Jones subbing out for Marquette,18,19,1st Half,9:09,False,269,2025-03-13T19:02:03Z
401743879113287717,113287717,Substitution,Stevie Mitchell subbing in for Marquette,18,19,1st Half,9:09,False,269,2025-03-13T19:02:03Z
401743879113287746,113287746,JumpShot,Marcus Foster missed Three Point Jumper.,18,19,1st Half,8:56,False,2752,2025-03-13T19:02:26Z
401743879113287766,113287766,Defensive Rebound,Marquette Defensive Rebound.,18,19,1st Half,8:53,False,269,2025-03-13T19:02:30Z
401743879113287785,113287785,Substitution,Dante Maddox Jr. subbing out for Xavier,18,19,1st Half,8:53,False,2752,2025-03-13T19:02:49Z
401743879113287787,113287787,Substitution,Jerome Hunter subbing in for Xavier,18,19,1st Half,8:53,False,2752,2025-03-13T19:02:49Z
401743879113287789,113287789,Substitution,Damarius Owens subbing out for Marquette,18,19,1st Half,8:53,False,269,2025-03-13T19:02:55Z
401743879113287790,113287790,Substitution,Kam Jones subbing in for Marquette,18,19,1st Half,8:53,False,269,2025-03-13T19:02:55Z
401743879113287825,113287825,JumpShot,Chase Ross missed Three Point Jumper.,18,19,1st Half,8:34,False,269,2025-03-13T19:03:21Z
401743879113287826,113287826,Defensive Rebound,Marcus Foster Defensive Rebound.,18,19,1st Half,8:31,False,2752,2025-03-13T19:03:23Z
401743879113287834,113287834,PersonalFoul,Foul on Chase Ross.,18,19,1st Half,8:28,False,269,2025-03-13T19:03:29Z
401743879113287859,113287859,MadeFreeThrow,Zach Freemantle made Free Throw.,18,20,1st Half,8:28,True,2752,2025-03-13T19:03:53Z
401743879113287870,113287870,MadeFreeThrow,Zach Freemantle made Free Throw.,18,21,1st Half,8:28,True,2752,2025-03-13T19:04:03Z
401743879113287875,113287875,Substitution,Ben Gold subbing out for Marquette,18,21,1st Half,8:28,False,269,2025-03-13T19:04:12Z
401743879113287876,113287876,Substitution,Royce Parham subbing in for Marquette,18,21,1st Half,8:28,False,269,2025-03-13T19:04:12Z
401743879113287942,113287942,Lost Ball Turnover,Marquette  Turnover.,18,21,1st Half,7:58,False,269,2025-03-13T19:04:51Z
401743879113287943,113287943,OfficialTVTimeOut,Official TV Timeout,18,21,1st Half,7:58,False,,2025-03-13T19:04:56Z
401743879113288153,113288153,PersonalFoul,Foul on David Joplin.,18,21,1st Half,7:33,False,269,2025-03-13T19:08:46Z
401743879113288169,113288169,LayUpShot,Dayvion McKnight made Layup.,18,23,1st Half,7:22,True,2752,2025-03-13T19:09:12Z
401743879113288183,113288183,LayUpShot,Kam Jones made Layup.,20,23,1st Half,7:10,True,269,2025-03-13T19:09:33Z
401743879113288200,113288200,PersonalFoul,Foul on David Joplin.,20,23,1st Half,6:47,False,269,2025-03-13T19:09:59Z
401743879113288219,113288219,MadeFreeThrow,Dailyn Swain missed Free Throw.,20,23,1st Half,6:47,False,2752,2025-03-13T19:10:24Z
401743879113288220,113288220,Dead Ball Rebound,Xavier Deadball Team Rebound.,20,23,1st Half,6:47,False,2752,2025-03-13T19:10:24Z
401743879113288240,113288240,Substitution,Jerome Hunter subbing out for Xavier,20,23,1st Half,6:47,False,2752,2025-03-13T19:10:39Z
401743879113288242,113288242,Substitution,Ryan Conwell subbing in for Xavier,20,23,1st Half,6:47,False,2752,2025-03-13T19:10:39Z
401743879113288243,113288243,Substitution,David Joplin subbing out for Marquette,20,23,1st Half,6:47,False,269,2025-03-13T19:10:39Z
401743879113288244,113288244,Substitution,Ben Gold subbing in for Marquette,20,23,1st Half,6:47,False,269,2025-03-13T19:10:39Z
401743879113288245,113288245,MadeFreeThrow,Dailyn Swain made Free Throw.,20,24,1st Half,6:47,True,2752,2025-03-13T19:10:45Z
401743879113288281,113288281,JumpShot,Stevie Mitchell missed Three Point Jumper.,20,24,1st Half,6:36,False,269,2025-03-13T19:11:01Z
401743879113288284,113288284,Defensive Rebound,Dailyn Swain Defensive Rebound.,20,24,1st Half,6:32,False,2752,2025-03-13T19:11:03Z
401743879113288298,113288298,LayUpShot,Ryan Conwell made Layup. Assisted by Marcus Foster.,20,26,1st Half,6:17,True,2752,2025-03-13T19:11:21Z
401743879113288300,113288300,PersonalFoul,Foul on Ben Gold.,20,26,1st Half,6:17,False,269,2025-03-13T19:11:23Z
401743879113288311,113288311,MadeFreeThrow,Ryan Conwell made Free Throw.,20,27,1st Half,6:17,True,2752,2025-03-13T19:11:47Z
401743879113288367,113288367,PersonalFoul,Foul on Dailyn Swain.,20,27,1st Half,6:03,False,2752,2025-03-13T19:12:07Z
401743879113288398,113288398,MadeFreeThrow,Chase Ross made Free Throw.,21,27,1st Half,6:03,True,269,2025-03-13T19:12:35Z
401743879113288403,113288403,Substitution,Dailyn Swain subbing out for Xavier,21,27,1st Half,6:03,False,2752,2025-03-13T19:12:46Z
401743879113288404,113288404,Substitution,Dante Maddox Jr. subbing in for Xavier,21,27,1st Half,6:03,False,2752,2025-03-13T19:12:46Z
401743879113288405,113288405,Substitution,Stevie Mitchell subbing out for Marquette,21,27,1st Half,6:03,False,269,2025-03-13T19:12:46Z
401743879113288406,113288406,Substitution,Ben Gold subbing out for Marquette,21,27,1st Half,6:03,False,269,2025-03-13T19:12:46Z
401743879113288407,113288407,Substitution,Zaide Lowery subbing in for Marquette,21,27,1st Half,6:03,False,269,2025-03-13T19:12:46Z
401743879113288408,113288408,Substitution,Caedin Hamilton subbing in for Marquette,21,27,1st Half,6:03,False,269,2025-03-13T19:12:46Z
401743879113288454,113288454,MadeFreeThrow,Chase Ross made Free Throw.,22,27,1st Half,6:03,True,269,2025-03-13T19:13:01Z
401743879113288468,113288468,JumpShot,Dayvion McKnight missed Three Point Jumper.,22,27,1st Half,5:44,False,2752,2025-03-13T19:13:23Z
401743879113288470,113288470,Offensive Rebound,Zach Freemantle Offensive Rebound.,22,27,1st Half,5:41,False,2752,2025-03-13T19:13:25Z
401743879113288472,113288472,LayUpShot,Zach Freemantle made Layup.,22,29,1st Half,5:40,True,2752,2025-03-13T19:13:26Z
401743879113288481,113288481,JumpShot,Kam Jones made Three Point Jumper.,25,29,1st Half,5:34,True,269,2025-03-13T19:13:34Z
401743879113288492,113288492,LayUpShot,Ryan Conwell made Layup.,25,31,1st Half,5:21,True,2752,2025-03-13T19:13:46Z
401743879113288529,113288529,LayUpShot,Caedin Hamilton missed Layup.,25,31,1st Half,4:58,False,269,2025-03-13T19:14:09Z
401743879113288538,113288538,Defensive Rebound,Marcus Foster Defensive Rebound.,25,31,1st Half,4:54,False,2752,2025-03-13T19:14:13Z
401743879113288567,113288567,JumpShot,Zach Freemantle made Three Point Jumper. Assisted by Ryan Conwell.,25,34,1st Half,4:35,True,2752,2025-03-13T19:14:32Z
401743879113288577,113288577,JumpShot,Chase Ross made Three Point Jumper. Assisted by Zaide Lowery.,28,34,1st Half,4:23,True,269,2025-03-13T19:14:44Z
401743879113288592,113288592,JumpShot,Zach Freemantle made Jumper. Assisted by Marcus Foster.,28,36,1st Half,4:01,True,2752,2025-03-13T19:15:06Z
401743879113288603,113288603,LayUpShot,Caedin Hamilton missed Layup.,28,36,1st Half,3:41,False,269,2025-03-13T19:15:26Z
401743879113288604,113288604,Defensive Rebound,Zach Freemantle Defensive Rebound.,28,36,1st Half,3:39,False,2752,2025-03-13T19:15:27Z
401743879113288608,113288608,JumpShot,Marcus Foster missed Three Point Jumper.,28,36,1st Half,3:34,False,2752,2025-03-13T19:15:34Z
401743879113288610,113288610,Defensive Rebound,Zaide Lowery Defensive Rebound.,28,36,1st Half,3:31,False,269,2025-03-13T19:15:35Z
401743879113288622,113288622,JumpShot,Kam Jones missed Three Point Jumper.,28,36,1st Half,3:23,False,269,2025-03-13T19:15:45Z
401743879113288624,113288624,Offensive Rebound,Zaide Lowery Offensive Rebound.,28,36,1st Half,3:20,False,269,2025-03-13T19:15:46Z
401743879113288646,113288646,JumpShot,Kam Jones made Three Point Jumper. Assisted by Zaide Lowery.,31,36,1st Half,3:19,True,269,2025-03-13T19:15:49Z
401743879113288654,113288654,DunkShot,Zach Freemantle made Dunk. Assisted by Marcus Foster.,31,38,1st Half,3:00,True,2752,2025-03-13T19:16:07Z
401743879113288667,113288667,PersonalFoul,Foul on Zach Freemantle.,31,38,1st Half,2:53,False,2752,2025-03-13T19:16:24Z
401743879113288673,113288673,OfficialTVTimeOut,Official TV Timeout,31,38,1st Half,2:53,False,,2025-03-13T19:16:31Z
401743879113288909,113288909,Substitution,Marcus Foster subbing out for Xavier,31,38,1st Half,2:53,False,2752,2025-03-13T19:19:43Z
401743879113288910,113288910,Substitution,Zach Freemantle subbing out for Xavier,31,38,1st Half,2:53,False,2752,2025-03-13T19:19:43Z
401743879113288911,113288911,Substitution,Jerome Hunter subbing in for Xavier,31,38,1st Half,2:53,False,2752,2025-03-13T19:19:43Z
401743879113288912,113288912,Substitution,John Hugley IV subbing in for Xavier,31,38,1st Half,2:53,False,2752,2025-03-13T19:19:43Z
401743879113288913,113288913,Substitution,Caedin Hamilton subbing out for Marquette,31,38,1st Half,2:53,False,269,2025-03-13T19:19:43Z
401743879113288914,113288914,Substitution,David Joplin subbing in for Marquette,31,38,1st Half,2:53,False,269,2025-03-13T19:19:43Z
401743879113288949,113288949,LayUpShot,Kam Jones missed Layup.,31,38,1st Half,2:50,False,269,2025-03-13T19:20:11Z
401743879113288950,113288950,Defensive Rebound,Dayvion McKnight Defensive Rebound.,31,38,1st Half,2:48,False,2752,2025-03-13T19:20:12Z
401743879113288954,113288954,JumpShot,Dante Maddox Jr. made Three Point Jumper. Assisted by Ryan Conwell.,31,41,1st Half,2:41,True,2752,2025-03-13T19:20:21Z
401743879113288960,113288960,LayUpShot,David Joplin made Layup.,33,41,1st Half,2:30,True,269,2025-03-13T19:20:37Z
401743879113288964,113288964,PersonalFoul,Foul on John Hugley IV.,33,41,1st Half,2:30,False,2752,2025-03-13T19:20:39Z
401743879113288995,113288995,MadeFreeThrow,David Joplin made Free Throw.,34,41,1st Half,2:30,True,269,2025-03-13T19:21:05Z
401743879113288998,113288998,Substitution,David Joplin subbing out for Marquette,34,41,1st Half,2:30,False,269,2025-03-13T19:21:11Z
401743879113288999,113288999,Substitution,Stevie Mitchell subbing in for Marquette,34,41,1st Half,2:30,False,269,2025-03-13T19:21:11Z
401743879113289009,113289009,PersonalFoul,Foul on Kam Jones.,34,41,1st Half,2:16,False,269,2025-03-13T19:21:37Z
401743879113289047,113289047,Substitution,Zaide Lowery subbing out for Marquette,34,41,1st Half,2:16,False,269,2025-03-13T19:21:59Z
401743879113289048,113289048,Substitution,David Joplin subbing in for Marquette,34,41,1st Half,2:16,False,269,2025-03-13T19:21:59Z
401743879113289087,113289087,MadeFreeThrow,John Hugley IV missed Free Throw.,34,41,1st Half,2:16,False,2752,2025-03-13T19:22:23Z
401743879113289088,113289088,Defensive Rebound,David Joplin Defensive Rebound.,34,41,1st Half,2:14,False,269,2025-03-13T19:22:25Z
401743879113289092,113289092,JumpShot,Royce Parham missed Three Point Jumper.,34,41,1st Half,2:05,False,269,2025-03-13T19:22:34Z
401743879113289093,113289093,Defensive Rebound,Dante Maddox Jr. Defensive Rebound.,34,41,1st Half,2:03,False,2752,2025-03-13T19:22:35Z
401743879113289108,113289108,LayUpShot,John Hugley IV made Layup. Assisted by Dayvion McKnight.,34,43,1st Half,1:49,True,2752,2025-03-13T19:22:50Z
401743879113289115,113289115,LayUpShot,Chase Ross missed Layup.,34,43,1st Half,1:35,False,269,2025-03-13T19:23:03Z
401743879113289116,113289116,Defensive Rebound,John Hugley IV Defensive Rebound.,34,43,1st Half,1:33,False,2752,2025-03-13T19:23:05Z
401743879113289117,113289117,JumpShot,Ryan Conwell made Three Point Jumper.,34,46,1st Half,1:31,True,2752,2025-03-13T19:23:09Z
401743879113289147,113289147,ShortTimeOut,Marquette Timeout,34,46,1st Half,1:29,False,269,2025-03-13T19:23:14Z
401743879113289261,113289261,Substitution,Jerome Hunter subbing out for Xavier,34,46,1st Half,1:29,False,2752,2025-03-13T19:24:40Z
401743879113289263,113289263,Substitution,Zach Freemantle subbing in for Xavier,34,46,1st Half,1:29,False,2752,2025-03-13T19:24:40Z
401743879113289295,113289295,LayUpShot,David Joplin missed Layup.,34,46,1st Half,1:19,False,269,2025-03-13T19:25:02Z
401743879113289296,113289296,Defensive Rebound,Xavier Defensive Rebound.,34,46,1st Half,1:18,False,2752,2025-03-13T19:25:05Z
