play_id,sequence_number,type,description,away_score,home_score,period,clock,scoring_play,team_id,timestamp_utc
401725579102885302,102885302,TipShot,Baba Miller missed Two Point Tip Shot.,57,33,2nd Half,11:46,False,2226,2025-02-08T18:28:33Z
401725579102885501,102885501,Offensive Rebound,Baba Miller Offensive Rebound.,57,33,2nd Half,11:44,False,2226,2025-02-08T18:28:33Z
401725579102885502,102885502,TipShot,Baba Miller missed Two Point Tip Shot.,57,33,2nd Half,11:44,False,2226,2025-02-08T18:28:35Z
401725579102885601,102885601,Defensive Rebound,Ian Smikle Defensive Rebound.,57,33,2nd Half,11:43,False,202,2025-02-08T18:28:33Z
401725579102886001,102886001,JumpShot,Keaston Willis missed Three Point Jumper.,57,33,2nd Half,11:39,False,202,2025-02-08T18:28:42Z
401725579102886201,102886201,PersonalFoul,Foul on Braeden Carrington.,57,33,2nd Half,11:37,False,202,2025-02-08T18:28:40Z
401725579102886202,102886202,OfficialTVTimeOut,Official TV Timeout,57,33,2nd Half,11:37,False,,2025-02-08T18:28:40Z
401725579102886301,102886301,Dead Ball Rebound,Florida Atlantic Deadball Team Rebound.,57,33,2nd Half,11:36,False,2226,2025-02-08T18:28:42Z
401725579102888801,102888801,Lost Ball Turnover,KyKy Tandy Turnover.,57,33,2nd Half,11:11,False,2226,2025-02-08T18:33:11Z
401725579102888802,102888802,Steal,Ian Smikle Steal.,57,33,2nd Half,11:11,False,202,2025-02-08T18:33:11Z
401725579102889301,102889301,LayUpShot,Braeden Carrington made Layup. Assisted by Tyshawn Archie.,57,35,2nd Half,11:06,True,202,2025-02-08T18:33:19Z
401725579102896001,102896001,JumpShot,Tre Carroll made Jumper.,59,35,2nd Half,10:39,True,2226,2025-02-08T18:33:44Z
401725579102898801,102898801,LayUpShot,Ian Smikle missed Layup.,59,35,2nd Half,10:11,False,202,2025-02-08T18:34:11Z
401725579102898802,102898802,Block Shot,Kaleb Glenn Block.,59,35,2nd Half,10:11,False,2226,2025-02-08T18:34:15Z
401725579102899201,102899201,Defensive Rebound,Tre Carroll Defensive Rebound.,59,35,2nd Half,10:07,False,2226,2025-02-08T18:34:15Z
401725579102899601,102899601,JumpShot,KyKy Tandy missed Three Point Jumper.,59,35,2nd Half,10:03,False,2226,2025-02-08T18:34:19Z
401725579102904101,102904101,Offensive Rebound,Kaleb Glenn Offensive Rebound.,59,35,2nd Half,9:58,False,2226,2025-02-08T18:34:22Z
401725579102904301,102904301,JumpShot,Kaleb Glenn missed Three Point Jumper.,59,35,2nd Half,9:56,False,2226,2025-02-08T18:34:26Z
401725579102904701,102904701,Defensive Rebound,Ian Smikle Defensive Rebound.,59,35,2nd Half,9:52,False,202,2025-02-08T18:34:30Z
401725579102906701,102906701,JumpShot,Braeden Carrington missed Three Point Jumper.,59,35,2nd Half,9:32,False,202,2025-02-08T18:34:50Z
401725579102907101,102907101,Defensive Rebound,Ken Evans Jr. Defensive Rebound.,59,35,2nd Half,9:28,False,2226,2025-02-08T18:34:54Z
401725579102908301,102908301,JumpShot,Kaleb Glenn missed Jumper.,59,35,2nd Half,9:16,False,2226,2025-02-08T18:35:06Z
401725579102908601,102908601,Defensive Rebound,Ian Smikle Defensive Rebound.,59,35,2nd Half,9:13,False,202,2025-02-08T18:35:10Z
401725579102908602,102908602,PersonalFoul,Foul on Kaleb Glenn.,59,35,2nd Half,9:13,False,2226,2025-02-08T18:35:10Z
401725579102909901,102909901,JumpShot,Matt Reed missed Jumper.,59,35,2nd Half,9:00,False,202,2025-02-08T18:35:56Z
401725579102914301,102914301,Offensive Rebound,Isaiah Barnes Offensive Rebound.,59,35,2nd Half,8:56,False,202,2025-02-08T18:35:56Z
401725579102914401,102914401,JumpShot,Isaiah Barnes missed Jumper.,59,35,2nd Half,8:55,False,202,2025-02-08T18:35:58Z
401725579102914701,102914701,Defensive Rebound,Kaleb Glenn Defensive Rebound.,59,35,2nd Half,8:52,False,2226,2025-02-08T18:36:06Z
401725579102915301,102915301,LayUpShot,Kaleb Glenn made Layup. Assisted by Niccolo Moretti.,61,35,2nd Half,8:46,True,2226,2025-02-08T18:36:06Z
401725579102918401,102918401,PersonalFoul,Foul on Ken Evans Jr..,61,35,2nd Half,8:15,False,2226,2025-02-08T18:36:36Z
401725579102918402,102918402,MadeFreeThrow,Tyshawn Archie made Free Throw.,61,36,2nd Half,8:15,True,202,2025-02-08T18:36:36Z
401725579102918403,102918403,MadeFreeThrow,Tyshawn Archie missed Free Throw.,61,36,2nd Half,8:15,False,202,2025-02-08T18:36:36Z
401725579102918501,102918501,Defensive Rebound,Baba Miller Defensive Rebound.,61,36,2nd Half,8:14,False,2226,2025-02-08T18:37:42Z
401725579102924101,102924101,PersonalFoul,Foul on Matt Reed.,61,36,2nd Half,7:58,False,202,2025-02-08T18:37:58Z
401725579102924102,102924102,OfficialTVTimeOut,Official TV Timeout,61,36,2nd Half,7:58,False,,2025-02-08T18:37:58Z
401725579102925001,102925001,PersonalFoul,Foul on Matt Reed.,61,36,2nd Half,7:49,False,202,2025-02-08T18:42:06Z
401725579102925002,102925002,MadeFreeThrow,Matas Vokietaitis missed Free Throw.,61,36,2nd Half,7:49,False,2226,2025-02-08T18:42:06Z
401725579102925003,102925003,Dead Ball Rebound,Florida Atlantic Deadball Team Rebound.,61,36,2nd Half,7:49,False,2226,2025-02-08T18:42:06Z
401725579102925004,102925004,MadeFreeThrow,Matas Vokietaitis made Free Throw.,62,36,2nd Half,7:49,True,2226,2025-02-08T18:42:06Z
401725579102927301,102927301,LayUpShot,Tyshawn Archie made Layup.,62,38,2nd Half,7:26,True,202,2025-02-08T18:43:24Z
401725579102927302,102927302,PersonalFoul,Foul on Niccolo Moretti.,62,38,2nd Half,7:26,False,2226,2025-02-08T18:43:24Z
401725579102927303,102927303,MadeFreeThrow,Tyshawn Archie made Free Throw.,62,39,2nd Half,7:26,True,202,2025-02-08T18:43:24Z
401725579102929201,102929201,LayUpShot,Matas Vokietaitis made Layup. Assisted by Ken Evans Jr..,64,39,2nd Half,7:07,True,2226,2025-02-08T18:44:16Z
401725579102934601,102934601,PersonalFoul,Foul on Leland Walker.,64,39,2nd Half,6:53,False,2226,2025-02-08T18:44:29Z
401725579102934602,102934602,MadeFreeThrow,Braeden Carrington made Free Throw.,64,40,2nd Half,6:53,True,202,2025-02-08T18:44:29Z
401725579102934603,102934603,MadeFreeThrow,Braeden Carrington made Free Throw.,64,41,2nd Half,6:53,True,202,2025-02-08T18:44:29Z
401725579102935601,102935601,JumpShot,Matas Vokietaitis made Jumper. Assisted by Baba Miller.,66,41,2nd Half,6:43,True,2226,2025-02-08T18:45:38Z
401725579102937701,102937701,Lost Ball Turnover,Jaye Nash Turnover.,66,41,2nd Half,6:22,False,202,2025-02-08T18:45:59Z
401725579102937702,102937702,Steal,Leland Walker Steal.,66,41,2nd Half,6:22,False,2226,2025-02-08T18:45:59Z
401725579102938201,102938201,DunkShot,Baba Miller made Dunk. Assisted by Ken Evans Jr..,68,41,2nd Half,6:17,True,2226,2025-02-08T18:46:07Z
401725579102938401,102938401,RegularTimeOut,Tulsa Timeout,68,41,2nd Half,6:15,False,202,2025-02-08T18:46:07Z
401725579102939801,102939801,JumpShot,Keaston Willis made Three Point Jumper. Assisted by Jaye Nash.,68,44,2nd Half,6:01,True,202,2025-02-08T18:48:21Z
401725579102946001,102946001,JumpShot,Ken Evans Jr. made Jumper.,70,44,2nd Half,5:39,True,2226,2025-02-08T18:48:44Z
401725579102947201,102947201,JumpShot,Tyshawn Archie missed Jumper.,70,44,2nd Half,5:27,False,202,2025-02-08T18:49:00Z
401725579102947501,102947501,Defensive Rebound,Matas Vokietaitis Defensive Rebound.,70,44,2nd Half,5:24,False,2226,2025-02-08T18:49:00Z
401725579102948401,102948401,JumpShot,Ken Evans Jr. missed Three Point Jumper.,70,44,2nd Half,5:15,False,2226,2025-02-08T18:49:08Z
401725579102949101,102949101,Defensive Rebound,Jaye Nash Defensive Rebound.,70,44,2nd Half,5:08,False,202,2025-02-08T18:49:14Z
401725579102949501,102949501,PersonalFoul,Foul on Devin Vanterpool.,70,44,2nd Half,5:04,False,2226,2025-02-08T18:49:17Z
401725579102949502,102949502,MadeFreeThrow,Keaston Willis missed Free Throw.,70,44,2nd Half,5:04,False,202,2025-02-08T18:49:17Z
401725579102949503,102949503,Dead Ball Rebound,Tulsa Deadball Team Rebound.,70,44,2nd Half,5:04,False,202,2025-02-08T18:49:17Z
401725579102949504,102949504,MadeFreeThrow,Keaston Willis missed Free Throw.,70,44,2nd Half,5:04,False,202,2025-02-08T18:49:17Z
401725579102949505,102949505,Dead Ball Rebound,Tulsa Deadball Team Rebound.,70,44,2nd Half,5:04,False,202,2025-02-08T18:49:17Z
401725579102949506,102949506,MadeFreeThrow,Keaston Willis made Free Throw.,70,45,2nd Half,5:04,True,202,2025-02-08T18:49:17Z
401725579102954201,102954201,LayUpShot,Matas Vokietaitis made Layup. Assisted by Baba Miller.,72,45,2nd Half,4:57,True,2226,2025-02-08T18:50:43Z
401725579102956101,102956101,JumpShot,Jesaiah McWright missed Jumper.,72,45,2nd Half,4:38,False,202,2025-02-08T18:51:03Z
401725579102956102,102956102,Block Shot,Matas Vokietaitis Block.,72,45,2nd Half,4:38,False,2226,2025-02-08T18:51:03Z
401725579102956501,102956501,Offensive Rebound,Tyler Behrend Offensive Rebound.,72,45,2nd Half,4:34,False,202,2025-02-08T18:51:09Z
401725579102956601,102956601,JumpShot,Isaiah Barnes missed Three Point Jumper.,72,45,2nd Half,4:33,False,202,2025-02-08T18:51:26Z
401725579102956901,102956901,Defensive Rebound,Baba Miller Defensive Rebound.,72,45,2nd Half,4:30,False,2226,2025-02-08T18:51:26Z
401725579102958401,102958401,PersonalFoul,Foul on Tyler Behrend.,72,45,2nd Half,4:15,False,202,2025-02-08T18:51:26Z
401725579102958402,102958402,MadeFreeThrow,Devin Vanterpool missed Free Throw.,72,45,2nd Half,4:15,False,2226,2025-02-08T18:51:26Z
401725579102958403,102958403,Dead Ball Rebound,Florida Atlantic Deadball Team Rebound.,72,45,2nd Half,4:15,False,2226,2025-02-08T18:51:26Z
401725579102958404,102958404,MadeFreeThrow,Devin Vanterpool made Free Throw.,73,45,2nd Half,4:15,True,2226,2025-02-08T18:51:26Z
401725579102964001,102964001,JumpShot,Tyler Behrend missed ,73,45,2nd Half,3:59,False,202,2025-02-08T18:52:27Z
401725579102964301,102964301,Defensive Rebound,Baba Miller Defensive Rebound.,73,45,2nd Half,3:56,False,2226,2025-02-08T18:52:30Z
401725579102966301,102966301,LayUpShot,Matas Vokietaitis made Layup. Assisted by Baba Miller.,75,45,2nd Half,3:36,True,2226,2025-02-08T18:52:50Z
401725579102967501,102967501,LayUpShot,Jaye Nash made Layup.,75,47,2nd Half,3:24,True,202,2025-02-08T18:53:02Z
401725579102968701,102968701,PersonalFoul,Foul on Jaye Nash.,75,47,2nd Half,3:12,False,202,2025-02-08T18:53:13Z
401725579102968702,102968702,OfficialTVTimeOut,Official TV Timeout,75,47,2nd Half,3:12,False,,2025-02-08T18:53:13Z
401725579102968703,102968703,MadeFreeThrow,Devin Vanterpool made Free Throw.,76,47,2nd Half,3:12,True,2226,2025-02-08T18:56:27Z
401725579102968704,102968704,MadeFreeThrow,Devin Vanterpool made Free Throw.,77,47,2nd Half,3:12,True,2226,2025-02-08T18:56:27Z
401725579102975201,102975201,PersonalFoul,Foul on Matas Vokietaitis.,77,47,2nd Half,2:47,False,2226,2025-02-08T18:57:32Z
401725579102975202,102975202,MadeFreeThrow,Matt Reed missed Free Throw.,77,47,2nd Half,2:47,False,202,2025-02-08T18:57:32Z
401725579102975203,102975203,Dead Ball Rebound,Tulsa Deadball Team Rebound.,77,47,2nd Half,2:47,False,202,2025-02-08T18:57:32Z
401725579102975204,102975204,MadeFreeThrow,Matt Reed made Free Throw.,77,48,2nd Half,2:47,True,202,2025-02-08T18:57:32Z
401725579102976901,102976901,JumpShot,Tre Carroll missed Three Point Jumper.,77,48,2nd Half,2:30,False,2226,2025-02-08T18:58:29Z
401725579102977301,102977301,Defensive Rebound,Tyshawn Archie Defensive Rebound.,77,48,2nd Half,2:26,False,202,2025-02-08T18:58:33Z
401725579102978601,102978601,LayUpShot,Matt Reed missed Layup.,77,48,2nd Half,2:13,False,202,2025-02-08T18:58:48Z
401725579102978901,102978901,Defensive Rebound,Matas Vokietaitis Defensive Rebound.,77,48,2nd Half,2:10,False,2226,2025-02-08T18:58:48Z
401725579102979301,102979301,LayUpShot,Devin Vanterpool made Layup. Assisted by Niccolo Moretti.,79,48,2nd Half,2:06,True,2226,2025-02-08T18:58:52Z
401725579102985201,102985201,LayUpShot,Matt Reed made Layup. Assisted by Jaye Nash.,79,50,2nd Half,1:47,True,202,2025-02-08T18:59:12Z
401725579102987501,102987501,JumpShot,Niccolo Moretti missed Three Point Jumper.,79,50,2nd Half,1:24,False,2226,2025-02-08T18:59:35Z
401725579102987901,102987901,Defensive Rebound,Jesaiah McWright Defensive Rebound.,79,50,2nd Half,1:20,False,202,2025-02-08T18:59:40Z
401725579102988301,102988301,LayUpShot,Jesaiah McWright made Layup.,79,52,2nd Half,1:16,True,202,2025-02-08T18:59:42Z
401725579102988302,102988302,PersonalFoul,Foul on Matas Vokietaitis.,79,52,2nd Half,1:16,False,2226,2025-02-08T18:59:42Z
401725579102988303,102988303,MadeFreeThrow,Jesaiah McWright missed Free Throw.,79,52,2nd Half,1:16,False,202,2025-02-08T19:00:13Z
401725579102988501,102988501,Defensive Rebound,Niccolo Moretti Defensive Rebound.,79,52,2nd Half,1:14,False,2226,2025-02-08T19:00:13Z
401725579102989501,102989501,JumpShot,Jack Johnson missed Three Point Jumper.,79,52,2nd Half,1:04,False,2226,2025-02-08T19:00:45Z
401725579102989801,102989801,Defensive Rebound,Tyler Behrend Defensive Rebound.,79,52,2nd Half,1:01,False,202,2025-02-08T19:00:45Z
401725579102994101,102994101,PersonalFoul,Foul on Niccolo Moretti.,79,52,2nd Half,0:58,False,2226,2025-02-08T19:00:47Z
401725579102994102,102994102,MadeFreeThrow,Jaye Nash made Free Throw.,79,53,2nd Half,0:58,True,202,2025-02-08T19:00:47Z
401725579102994103,102994103,MadeFreeThrow,Jaye Nash missed Free Throw.,79,53,2nd Half,0:58,False,202,2025-02-08T19:00:47Z
401725579102994301,102994301,Defensive Rebound,Kaleb Glenn Defensive Rebound.,79,53,2nd Half,0:56,False,2226,2025-02-08T19:00:47Z
401725579102995301,102995301,PersonalFoul,Foul on Jesaiah McWright.,79,53,2nd Half,0:46,False,202,2025-02-08T19:01:40Z
401725579102995302,102995302,MadeFreeThrow,Devin Vanterpool missed Free Throw.,79,53,2nd Half,0:46,False,2226,2025-02-08T19:01:40Z
401725579102995303,102995303,Defensive Rebound,Matt Reed Defensive Rebound.,79,53,2nd Half,0:46,False,202,2025-02-08T19:01:40Z
401725579102996501,102996501,JumpShot,Tyler Behrend missed Three Point Jumper.,79,53,2nd Half,0:34,False,202,2025-02-08T19:02:21Z
401725579102996901,102996901,Defensive Rebound,Tre Carroll Defensive Rebound.,79,53,2nd Half,0:30,False,2226,2025-02-08T19:02:25Z
401725579102998801,102998801,JumpShot,Jack Johnson missed Jumper.,79,53,2nd Half,0:11,False,2226,2025-02-08T19:02:47Z
401725579102999101,102999101,Defensive Rebound,Jaye Nash Defensive Rebound.,79,53,2nd Half,0:08,False,202,2025-02-08T19:02:47Z
401725579102999501,102999501,LayUpShot,Jaye Nash made Layup.,79,55,2nd Half,0:04,True,202,2025-02-08T19:02:50Z
401725579102999901,102999901,End Period,End of 2nd half,79,55,2nd Half,0:00,False,,2025-02-08T19:02:52Z
401725579102999902,102999902,End Game,End of Game,79,55,2nd Half,0:00,False,,2025-02-08T19:02:52Z
