play_id,sequence_number,type,description,away_score,home_score,period,clock,scoring_play,team_id,timestamp_utc
401744228113157471,113157471,Substitution,Derrian Ford subbing in for Arkansas State,63,67,2nd Half,4:30,False,2032,2025-03-09T06:44:15Z
401744228113157514,113157514,MadeFreeThrow,Cade Gibbs missed Free Throw.,63,67,2nd Half,4:30,False,276,2025-03-09T06:26:05Z
401744228113157515,113157515,Defensive Rebound,Izaiyah Nelson Defensive Rebound.,63,67,2nd Half,4:29,False,2032,2025-03-09T06:26:06Z
401744228113157546,113157546,JumpShot,Taryn Todd missed Jumper.,63,67,2nd Half,4:11,False,2032,2025-03-09T06:26:24Z
401744228113157548,113157548,Block Shot,Obinna Anochili-Killen Block.,63,67,2nd Half,4:11,False,276,2025-03-09T06:26:24Z
401744228113157549,113157549,Offensive Rebound,Izaiyah Nelson Offensive Rebound.,63,67,2nd Half,4:11,False,2032,2025-03-09T06:26:29Z
401744228113157572,113157572,PersonalFoul,Foul on Obinna Anochili-Killen.,63,67,2nd Half,4:11,False,276,2025-03-09T06:26:32Z
401744228113157606,113157606,MadeFreeThrow,Izaiyah Nelson made Free Throw.,63,68,2nd Half,4:11,True,2032,2025-03-09T06:26:54Z
401744228113157622,113157622,MadeFreeThrow,Izaiyah Nelson made Free Throw.,63,69,2nd Half,4:11,True,2032,2025-03-09T06:27:08Z
401744228113157652,113157652,JumpShot,Mikal Dawson missed Three Point Jumper.,63,69,2nd Half,3:54,False,276,2025-03-09T06:27:28Z
401744228113157667,113157667,Offensive Rebound,Cade Gibbs Offensive Rebound.,63,69,2nd Half,3:51,False,276,2025-03-09T06:27:31Z
401744228113157668,113157668,JumpShot,Obinna Anochili-Killen made Jumper. Assisted by Cade Gibbs.,65,69,2nd Half,3:48,True,276,2025-03-09T06:27:35Z
401744228113157681,113157681,ShortTimeOut,Marshall Timeout,65,69,2nd Half,3:48,False,276,2025-03-09T06:27:46Z
401744228113157744,113157744,OfficialTVTimeOut,Official TV Timeout,65,69,2nd Half,3:48,False,,2025-03-09T06:28:13Z
401744228113158076,113158076,LayUpShot,Kobe Julien made Layup.,65,71,2nd Half,3:31,True,2032,2025-03-09T06:31:30Z
401744228113158093,113158093,LayUpShot,Obinna Anochili-Killen made Layup. Assisted by Jalen Speer.,67,71,2nd Half,3:17,True,276,2025-03-09T06:31:45Z
401744228113158129,113158129,PersonalFoul,Foul on Kobe Julien.,67,71,2nd Half,3:17,False,2032,2025-03-09T06:31:50Z
401744228113158167,113158167,MadeFreeThrow,Obinna Anochili-Killen missed Free Throw.,67,71,2nd Half,3:16,False,276,2025-03-09T06:32:23Z
401744228113158169,113158169,Defensive Rebound,Izaiyah Nelson Defensive Rebound.,67,71,2nd Half,3:16,False,2032,2025-03-09T06:32:24Z
401744228113158180,113158180,JumpShot,Derrian Ford missed Three Point Jumper.,67,71,2nd Half,3:02,False,2032,2025-03-09T06:32:39Z
401744228113158193,113158193,Defensive Rebound,Obinna Anochili-Killen Defensive Rebound.,67,71,2nd Half,3:00,False,276,2025-03-09T06:32:45Z
401744228113158238,113158238,PersonalFoul,Foul on Kobe Julien.,67,71,2nd Half,3:00,False,2032,2025-03-09T06:33:16Z
401744228113158255,113158255,MadeFreeThrow,Obinna Anochili-Killen made Free Throw.,68,71,2nd Half,3:00,True,276,2025-03-09T06:33:27Z
401744228113158265,113158265,Substitution,Cade Gibbs subbing out for Marshall,68,71,2nd Half,3:00,False,276,2025-03-09T06:33:32Z
401744228113158266,113158266,Substitution,Jakob Gibbs subbing in for Marshall,68,71,2nd Half,3:00,False,276,2025-03-09T06:33:32Z
401744228113158267,113158267,Substitution,Kobe Julien subbing out for Arkansas State,68,71,2nd Half,3:00,False,2032,2025-03-09T06:33:40Z
401744228113158268,113158268,Substitution,Joseph Pinion subbing in for Arkansas State,68,71,2nd Half,3:00,False,2032,2025-03-09T06:33:40Z
401744228113158290,113158290,MadeFreeThrow,Obinna Anochili-Killen made Free Throw.,69,71,2nd Half,3:00,True,276,2025-03-09T06:33:52Z
401744228113158339,113158339,Lost Ball Turnover,Derrian Ford Turnover.,69,71,2nd Half,2:34,False,2032,2025-03-09T06:34:26Z
401744228113158371,113158371,Substitution,Joseph Pinion subbing out for Arkansas State,69,71,2nd Half,2:34,False,2032,2025-03-09T06:34:42Z
401744228113158372,113158372,Substitution,Kobe Julien subbing in for Arkansas State,69,71,2nd Half,2:34,False,2032,2025-03-09T06:34:42Z
401744228113158403,113158403,LayUpShot,Dezayne Mingo made Layup.,71,71,2nd Half,2:20,True,276,2025-03-09T06:35:06Z
401744228113158419,113158419,JumpShot,Terrance Ford Jr. made Jumper.,71,73,2nd Half,2:05,True,2032,2025-03-09T06:35:18Z
401744228113158444,113158444,ShortTimeOut,Marshall Timeout,71,73,2nd Half,1:54,False,276,2025-03-09T06:35:35Z
401744228113158575,113158575,PersonalFoul,Foul on Taryn Todd.,71,73,2nd Half,1:44,False,2032,2025-03-09T06:36:55Z
401744228113158654,113158654,MadeFreeThrow,Jakob Gibbs missed Free Throw.,71,73,2nd Half,1:44,False,276,2025-03-09T06:37:32Z
401744228113158656,113158656,Dead Ball Rebound,Marshall Deadball Team Rebound.,71,73,2nd Half,1:44,False,276,2025-03-09T06:37:32Z
401744228113158658,113158658,Substitution,Derrian Ford subbing out for Arkansas State,71,73,2nd Half,1:44,False,2032,2025-03-09T06:37:40Z
401744228113158659,113158659,Substitution,Joseph Pinion subbing in for Arkansas State,71,73,2nd Half,1:44,False,2032,2025-03-09T06:37:40Z
401744228113158677,113158677,MadeFreeThrow,Jakob Gibbs made Free Throw.,72,73,2nd Half,1:44,True,276,2025-03-09T06:37:53Z
401744228113158710,113158710,LayUpShot,Taryn Todd missed Layup.,72,73,2nd Half,1:32,False,2032,2025-03-09T06:38:08Z
401744228113158712,113158712,Block Shot,Obinna Anochili-Killen Block.,72,73,2nd Half,1:32,False,276,2025-03-09T06:38:08Z
401744228113158729,113158729,Defensive Rebound,Jakob Gibbs Defensive Rebound.,72,73,2nd Half,1:27,False,276,2025-03-09T06:38:12Z
401744228113158730,113158730,JumpShot,Dezayne Mingo missed Jumper.,72,73,2nd Half,1:25,False,276,2025-03-09T06:38:15Z
401744228113158768,113158768,Offensive Rebound,Obinna Anochili-Killen Offensive Rebound.,72,73,2nd Half,1:22,False,276,2025-03-09T06:38:31Z
401744228113158832,113158832,JumpShot,Dezayne Mingo missed Jumper.,72,73,2nd Half,1:14,False,276,2025-03-09T06:39:06Z
401744228113158842,113158842,Block Shot,Izaiyah Nelson Block.,72,73,2nd Half,1:14,False,2032,2025-03-09T06:39:06Z
401744228113158844,113158844,Offensive Rebound,Dezayne Mingo Offensive Rebound.,72,73,2nd Half,1:08,False,276,2025-03-09T06:39:12Z
401744228113158847,113158847,JumpShot,Mikal Dawson missed Three Point Jumper.,72,73,2nd Half,1:07,False,276,2025-03-09T06:39:14Z
401744228113158849,113158849,Defensive Rebound,Izaiyah Nelson Defensive Rebound.,72,73,2nd Half,1:04,False,2032,2025-03-09T06:39:16Z
401744228113158915,113158915,PersonalFoul,Foul on Obinna Anochili-Killen.,72,73,2nd Half,0:39,False,276,2025-03-09T06:39:49Z
401744228113158966,113158966,MadeFreeThrow,Joseph Pinion missed Free Throw.,72,73,2nd Half,0:39,False,2032,2025-03-09T06:40:22Z
401744228113158967,113158967,Dead Ball Rebound,Arkansas State Deadball Team Rebound.,72,73,2nd Half,0:39,False,2032,2025-03-09T06:40:22Z
401744228113158973,113158973,MadeFreeThrow,Joseph Pinion made Free Throw.,72,74,2nd Half,0:39,True,2032,2025-03-09T06:40:38Z
401744228113159031,113159031,MadeFreeThrow,Joseph Pinion made Free Throw.,72,75,2nd Half,0:39,True,2032,2025-03-09T06:40:53Z
401744228113159039,113159039,LayUpShot,Dezayne Mingo made Layup.,74,75,2nd Half,0:27,True,276,2025-03-09T06:41:10Z
401744228113159083,113159083,PersonalFoul,Foul on Jakob Gibbs.,74,75,2nd Half,0:20,False,276,2025-03-09T06:41:29Z
401744228113159147,113159147,MadeFreeThrow,Terrance Ford Jr. made Free Throw.,74,76,2nd Half,0:20,True,2032,2025-03-09T06:41:54Z
401744228113159155,113159155,MadeFreeThrow,Terrance Ford Jr. made Free Throw.,74,77,2nd Half,0:20,True,2032,2025-03-09T06:42:07Z
401744228113159180,113159180,JumpShot,Dezayne Mingo missed Three Point Jumper.,74,77,2nd Half,0:05,False,276,2025-03-09T06:42:24Z
401744228113159181,113159181,Offensive Rebound,Obinna Anochili-Killen Offensive Rebound.,74,77,2nd Half,0:02,False,276,2025-03-09T06:42:27Z
401744228113159206,113159206,JumpShot,Obinna Anochili-Killen missed Three Point Jumper.,74,77,2nd Half,0:00,False,276,2025-03-09T06:42:38Z
401744228113159207,113159207,Defensive Rebound,Kobe Julien Defensive Rebound.,74,77,2nd Half,0:00,False,2032,2025-03-09T06:42:41Z
401744228113159534,113159534,End Period,End of 2nd half,74,77,2nd Half,0:00,False,,2025-03-09T06:46:02Z
401744228113159619,113159619,End Game,End of Game,74,77,2nd Half,0:00,False,,2025-03-09T06:46:56Z
