play_id,sequence_number,type,description,away_score,home_score,period,clock,scoring_play,team_id,timestamp_utc
401721980102866201,102866201,ShortTimeOut,West Georgia  Timeout,45,56,2nd Half,13:37,False,2698,2024-11-13T01:10:20Z
401721980102866202,102866202,OfficialTVTimeOut, Official TV Timeout,45,56,2nd Half,13:37,False,,2024-11-13T01:10:20Z
401721980102868001,102868001,JumpShot,Jaylon Johnson made Three Point Jumper. Assisted by Ola Ajiboye.,45,59,2nd Half,13:19,True,2635,2024-11-13T01:14:09Z
401721980102869901,102869901,JumpShot,Demetrus Johnson II missed Three Point Jumper.,45,59,2nd Half,13:00,False,2698,2024-11-13T01:14:09Z
401721980102874301,102874301,Defensive Rebound,Grant Slatten Defensive Rebound.,45,59,2nd Half,12:56,False,2635,2024-11-13T01:14:09Z
401721980102876101,102876101,JumpShot,Ray Glasgow made Three Point Jumper. Assisted by Jaylon Johnson.,45,62,2nd Half,12:38,True,2635,2024-11-13T01:14:09Z
401721980102877901,102877901,JumpShot,Kolten Griffin made Three Point Jumper. Assisted by Demetrus Johnson II.,48,62,2nd Half,12:20,True,2698,2024-11-13T01:14:09Z
401721980102884201,102884201,Lost Ball Turnover,Grant Slatten Turnover.,48,62,2nd Half,11:57,False,2635,2024-11-13T01:14:09Z
401721980102884202,102884202,OfficialTVTimeOut, Official TV Timeout,48,62,2nd Half,11:57,False,,2024-11-13T01:14:09Z
401721980102885001,102885001,JumpShot,Kolten Griffin made Jumper. Assisted by Demetrus Johnson II.,50,62,2nd Half,11:49,True,2698,2024-11-13T01:15:49Z
401721980102887101,102887101,JumpShot,Kyle Layton missed Three Point Jumper.,50,62,2nd Half,11:28,False,2635,2024-11-13T01:16:09Z
401721980102887501,102887501,Defensive Rebound,Kyric Davis Defensive Rebound.,50,62,2nd Half,11:24,False,2698,2024-11-13T01:16:11Z
401721980102887901,102887901,PersonalFoul,Foul on Ray Glasgow.,50,62,2nd Half,11:20,False,2635,2024-11-13T01:16:15Z
401721980102889501,102889501,LayUpShot,Kyric Davis made Layup.,52,62,2nd Half,11:04,True,2698,2024-11-13T01:16:35Z
401721980102895801,102895801,PersonalFoul,Foul on Kyric Davis.,52,62,2nd Half,10:41,False,2698,2024-11-13T01:17:17Z
401721980102895802,102895802,MadeFreeThrow,Grant Slatten made Free Throw.,52,63,2nd Half,10:41,True,2635,2024-11-13T01:20:23Z
401721980102895803,102895803,MadeFreeThrow,Grant Slatten made Free Throw.,52,64,2nd Half,10:41,True,2635,2024-11-13T01:20:23Z
401721980102895804,102895804,MadeFreeThrow,Grant Slatten made Free Throw.,52,65,2nd Half,10:41,True,2635,2024-11-13T01:20:23Z
401721980102895805,102895805,Technical Foul,Technical Foul on Grant Slatten.,52,65,2nd Half,10:41,False,2635,2024-11-13T01:20:23Z
401721980102895806,102895806,MadeFreeThrow,Kolten Griffin made Free Throw.,53,65,2nd Half,10:41,True,2698,2024-11-13T01:20:23Z
401721980102895807,102895807,MadeFreeThrow,Kolten Griffin made Free Throw.,54,65,2nd Half,10:41,True,2698,2024-11-13T01:20:23Z
401721980102897001,102897001,JumpShot,Kyric Davis missed Three Point Jumper.,54,65,2nd Half,10:29,False,2698,2024-11-13T01:22:22Z
401721980102897002,102897002,Offensive Rebound,Kolten Griffin Offensive Rebound.,54,65,2nd Half,10:29,False,2698,2024-11-13T01:22:22Z
401721980102897101,102897101,PersonalFoul,Foul on Kolten Griffin.,54,65,2nd Half,10:28,False,2698,2024-11-13T01:22:40Z
401721980102897102,102897102,Lost Ball Turnover,Kolten Griffin Turnover.,54,65,2nd Half,10:28,False,2698,2024-11-13T01:22:40Z
401721980102898901,102898901,JumpShot,Rodney Johnson Jr. made Jumper.,54,67,2nd Half,10:10,True,2635,2024-11-13T01:22:50Z
401721980102904501,102904501,JumpShot,Kolten Griffin made Three Point Jumper. Assisted by Demetrus Johnson II.,57,67,2nd Half,9:54,True,2698,2024-11-13T01:23:05Z
401721980102906801,102906801,JumpShot,Rodney Johnson Jr. missed Three Point Jumper.,57,67,2nd Half,9:31,False,2635,2024-11-13T01:23:42Z
401721980102907101,102907101,Defensive Rebound,Kyric Davis Defensive Rebound.,57,67,2nd Half,9:28,False,2698,2024-11-13T01:23:42Z
401721980102907501,102907501,Lost Ball Turnover,Kyric Davis Turnover.,57,67,2nd Half,9:24,False,2698,2024-11-13T01:23:48Z
401721980102909201,102909201,Lost Ball Turnover,Daniel Egbuniwe Turnover.,57,67,2nd Half,9:07,False,2635,2024-11-13T01:24:21Z
401721980102914401,102914401,LayUpShot,Kolten Griffin missed Layup.,57,67,2nd Half,8:55,False,2698,2024-11-13T01:24:21Z
401721980102914402,102914402,Block Shot,Daniel Egbuniwe Block.,57,67,2nd Half,8:55,False,2635,2024-11-13T01:24:53Z
401721980102914801,102914801,Offensive Rebound,Tamaury Releford Offensive Rebound.,57,67,2nd Half,8:51,False,2698,2024-11-13T01:24:53Z
401721980102915101,102915101,LayUpShot,Tamaury Releford missed Layup.,57,67,2nd Half,8:48,False,2698,2024-11-13T01:26:59Z
401721980102915102,102915102,Defensive Rebound,Rodney Johnson Jr. Defensive Rebound.,57,67,2nd Half,8:48,False,2635,2024-11-13T01:26:59Z
401721980102915103,102915103,Block Shot,Daniel Egbuniwe Block.,57,67,2nd Half,8:48,False,2635,2024-11-13T01:26:59Z
401721980102915701,102915701,JumpShot,Jaylon Johnson missed Three Point Jumper.,57,67,2nd Half,8:42,False,2635,2024-11-13T01:25:02Z
401721980102916001,102916001,Defensive Rebound,Tamaury Releford Defensive Rebound.,57,67,2nd Half,8:39,False,2698,2024-11-13T01:25:07Z
401721980102917301,102917301,Lost Ball Turnover,Rickey Ballard Turnover.,57,67,2nd Half,8:26,False,2698,2024-11-13T01:25:18Z
401721980102917302,102917302,Steal,Matthew Sells Steal.,57,67,2nd Half,8:26,False,2635,2024-11-13T01:25:18Z
401721980102918301,102918301,JumpShot,Rodney Johnson Jr. missed Three Point Jumper.,57,67,2nd Half,8:16,False,2635,2024-11-13T01:25:28Z
401721980102918302,102918302,Defensive Rebound,West Georgia Defensive Rebound.,57,67,2nd Half,8:16,False,2698,2024-11-13T01:25:28Z
401721980102918303,102918303,PersonalFoul,Foul on Daniel Egbuniwe.,57,67,2nd Half,8:16,False,2635,2024-11-13T01:25:28Z
401721980102919801,102919801,PersonalFoul,Foul on Kyle Layton.,57,67,2nd Half,8:01,False,2635,2024-11-13T01:26:09Z
401721980102919901,102919901,Lost Ball Turnover,Brady Hardewig Turnover.,57,67,2nd Half,8:00,False,2698,2024-11-13T01:26:59Z
401721980102919902,102919902,Steal,Jaylon Johnson Steal.,57,67,2nd Half,8:00,False,2635,2024-11-13T01:28:10Z
401721980102919903,102919903,OfficialTVTimeOut, Official TV Timeout,57,67,2nd Half,8:00,False,,2024-11-13T01:26:59Z
401721980102926001,102926001,Lost Ball Turnover,Kyle Layton Turnover.,57,67,2nd Half,7:39,False,2635,2024-11-13T01:30:16Z
401721980102926002,102926002,Steal,Michael Griffin Steal.,57,67,2nd Half,7:39,False,2698,2024-11-13T01:30:16Z
401721980102929001,102929001,Lost Ball Turnover,Kyric Davis Turnover.,57,67,2nd Half,7:09,False,2698,2024-11-13T01:30:49Z
401721980102929002,102929002,Steal,Jaylon Johnson Steal.,57,67,2nd Half,7:09,False,2635,2024-11-13T01:30:49Z
401721980102929501,102929501,Lost Ball Turnover,Rodney Johnson Jr. Turnover.,57,67,2nd Half,7:04,False,2635,2024-11-13T01:30:55Z
401721980102935701,102935701,JumpShot,Kolten Griffin missed Three Point Jumper.,57,67,2nd Half,6:42,False,2698,2024-11-13T01:31:36Z
401721980102936001,102936001,Defensive Rebound,Matthew Sells Defensive Rebound.,57,67,2nd Half,6:39,False,2635,2024-11-13T01:31:36Z
401721980102936101,102936101,Lost Ball Turnover,Kyle Layton Turnover.,57,67,2nd Half,6:38,False,2635,2024-11-13T01:31:39Z
401721980102937001,102937001,JumpShot,Demetrus Johnson II missed Jumper.,57,67,2nd Half,6:29,False,2698,2024-11-13T01:32:30Z
401721980102937401,102937401,Defensive Rebound,Daniel Egbuniwe Defensive Rebound.,57,67,2nd Half,6:25,False,2635,2024-11-13T01:32:36Z
401721980102938601,102938601,PersonalFoul,Foul on Kyric Davis.,57,67,2nd Half,6:13,False,2698,2024-11-13T01:32:52Z
401721980102938602,102938602,MadeFreeThrow,Daniel Egbuniwe missed Free Throw.,57,67,2nd Half,6:13,False,2635,2024-11-13T01:32:52Z
401721980102938603,102938603,Offensive Rebound,Tennessee Tech Offensive Rebound.,57,67,2nd Half,6:13,False,2635,2024-11-13T01:32:52Z
401721980102938604,102938604,MadeFreeThrow,Daniel Egbuniwe missed Free Throw.,57,67,2nd Half,6:13,False,2635,2024-11-13T01:32:52Z
401721980102938701,102938701,Defensive Rebound,Michael Griffin Defensive Rebound.,57,67,2nd Half,6:12,False,2698,2024-11-13T01:33:31Z
401721980102945201,102945201,Lost Ball Turnover,Kyric Davis Turnover.,57,67,2nd Half,5:47,False,2698,2024-11-13T01:33:56Z
401721980102945202,102945202,Steal,Jaylon Johnson Steal.,57,67,2nd Half,5:47,False,2635,2024-11-13T01:33:56Z
401721980102947401,102947401,JumpShot,Matthew Sells missed Three Point Jumper.,57,67,2nd Half,5:25,False,2635,2024-11-13T01:34:35Z
401721980102947701,102947701,Defensive Rebound,Michael Griffin Defensive Rebound.,57,67,2nd Half,5:22,False,2698,2024-11-13T01:34:38Z
401721980102949301,102949301,JumpShot,Shelton Williams-Dryden made Jumper.,59,67,2nd Half,5:06,True,2698,2024-11-13T01:34:54Z
401721980102954201,102954201,ShortTimeOut,Tennessee Tech  Timeout,59,67,2nd Half,4:57,False,2635,2024-11-13T01:35:04Z
401721980102955001,102955001,Lost Ball Turnover,Jaylon Johnson Turnover.,59,67,2nd Half,4:49,False,2635,2024-11-13T01:36:34Z
401721980102955002,102955002,Steal,Shelton Williams-Dryden Steal.,59,67,2nd Half,4:49,False,2698,2024-11-13T01:36:34Z
401721980102955501,102955501,LayUpShot,Kyric Davis made Layup.,61,67,2nd Half,4:44,True,2698,2024-11-13T01:36:49Z
401721980102955502,102955502,PersonalFoul,Foul on Kyle Layton.,61,67,2nd Half,4:44,False,2635,2024-11-13T01:36:49Z
401721980102955503,102955503,MadeFreeThrow,Kyric Davis missed Free Throw.,61,67,2nd Half,4:44,False,2698,2024-11-13T01:36:49Z
401721980102955701,102955701,Offensive Rebound,Shelton Williams-Dryden Offensive Rebound.,61,67,2nd Half,4:42,False,2698,2024-11-13T01:36:49Z
401721980102957601,102957601,JumpShot,Michael Griffin missed Jumper.,61,67,2nd Half,4:23,False,2698,2024-11-13T01:37:37Z
401721980102957701,102957701,Offensive Rebound,West Georgia Offensive Rebound.,61,67,2nd Half,4:22,False,2698,2024-11-13T01:37:37Z
401721980102957702,102957702,PersonalFoul,Foul on Kyle Layton.,61,67,2nd Half,4:22,False,2635,2024-11-13T01:37:37Z
401721980102958801,102958801,Lost Ball Turnover,Kyric Davis Turnover.,61,67,2nd Half,4:11,False,2698,2024-11-13T01:38:17Z
401721980102964701,102964701,LayUpShot,Jaylon Johnson missed Layup.,61,67,2nd Half,3:52,False,2635,2024-11-13T01:38:45Z
401721980102965001,102965001,Defensive Rebound,Demetrus Johnson II Defensive Rebound.,61,67,2nd Half,3:49,False,2698,2024-11-13T01:38:50Z
401721980102965701,102965701,OfficialTVTimeOut, Official TV Timeout,61,67,2nd Half,3:42,False,,2024-11-13T01:38:58Z
401721980102966601,102966601,LayUpShot,Shelton Williams-Dryden missed Layup.,61,67,2nd Half,3:33,False,2698,2024-11-13T01:41:23Z
401721980102966801,102966801,Defensive Rebound,Ola Ajiboye Defensive Rebound.,61,67,2nd Half,3:31,False,2635,2024-11-13T01:41:33Z
401721980102968901,102968901,JumpShot,Ola Ajiboye made Jumper. Assisted by Jaylon Johnson.,61,69,2nd Half,3:10,True,2635,2024-11-13T01:42:17Z
401721980102975101,102975101,JumpShot,Kyric Davis missed Jumper.,61,69,2nd Half,2:48,False,2698,2024-11-13T01:42:17Z
401721980102975401,102975401,Offensive Rebound,Shelton Williams-Dryden Offensive Rebound.,61,69,2nd Half,2:45,False,2698,2024-11-13T01:42:17Z
401721980102975402,102975402,JumpShot,Shelton Williams-Dryden made Jumper.,63,69,2nd Half,2:45,True,2698,2024-11-13T01:42:45Z
401721980102977901,102977901,PersonalFoul,Foul on Kolten Griffin.,63,69,2nd Half,2:20,False,2698,2024-11-13T01:43:11Z
401721980102977902,102977902,MadeFreeThrow,Ola Ajiboye made Free Throw.,63,70,2nd Half,2:20,True,2635,2024-11-13T01:43:17Z
401721980102977903,102977903,MadeFreeThrow,Ola Ajiboye missed Free Throw.,63,70,2nd Half,2:20,False,2635,2024-11-13T01:43:17Z
401721980102978101,102978101,Defensive Rebound,Demetrus Johnson II Defensive Rebound.,63,70,2nd Half,2:18,False,2698,2024-11-13T01:43:54Z
401721980102979301,102979301,JumpShot,Demetrus Johnson II missed Three Point Jumper.,63,70,2nd Half,2:06,False,2698,2024-11-13T01:44:06Z
401721980102979401,102979401,Offensive Rebound,West Georgia Offensive Rebound.,63,70,2nd Half,2:05,False,2698,2024-11-13T01:44:06Z
401721980102979402,102979402,PersonalFoul,Foul on Ola Ajiboye.,63,70,2nd Half,2:05,False,2635,2024-11-13T01:44:06Z
401721980102979403,102979403,MadeFreeThrow,Shelton Williams-Dryden missed Free Throw.,63,70,2nd Half,2:05,False,2698,2024-11-13T01:44:54Z
401721980102979601,102979601,Offensive Rebound,Michael Griffin Offensive Rebound.,63,70,2nd Half,2:03,False,2698,2024-11-13T01:44:54Z
401721980102984901,102984901,Lost Ball Turnover,Kyric Davis Turnover.,63,70,2nd Half,1:50,False,2698,2024-11-13T01:45:12Z
401721980102984902,102984902,Steal,Jaylon Johnson Steal.,63,70,2nd Half,1:50,False,2635,2024-11-13T01:45:12Z
401721980102985201,102985201,LayUpShot,Jaylon Johnson made Layup.,63,72,2nd Half,1:47,True,2635,2024-11-13T01:45:17Z
401721980102985901,102985901,PersonalFoul,Foul on Ola Ajiboye.,63,72,2nd Half,1:40,False,2635,2024-11-13T01:45:21Z
401721980102985902,102985902,MadeFreeThrow,Michael Griffin made Free Throw.,64,72,2nd Half,1:40,True,2698,2024-11-13T01:45:21Z
401721980102985903,102985903,MadeFreeThrow,Michael Griffin made Free Throw.,65,72,2nd Half,1:40,True,2698,2024-11-13T01:46:07Z
401721980102985904,102985904,ShortTimeOut,West Georgia  Timeout,65,72,2nd Half,1:40,False,2698,2024-11-13T01:46:07Z
401721980102986901,102986901,Lost Ball Turnover,Jaylon Johnson Turnover.,65,72,2nd Half,1:30,False,2635,2024-11-13T01:47:38Z
401721980102986902,102986902,Steal,Demetrus Johnson II Steal.,65,72,2nd Half,1:30,False,2698,2024-11-13T01:47:38Z
401721980102987201,102987201,LayUpShot,Kolten Griffin missed Layup.,65,72,2nd Half,1:27,False,2698,2024-11-13T01:47:42Z
401721980102987202,102987202,Block Shot,Daniel Egbuniwe Block.,65,72,2nd Half,1:27,False,2635,2024-11-13T01:47:42Z
401721980102987203,102987203,Offensive Rebound,West Georgia Offensive Rebound.,65,72,2nd Half,1:27,False,2698,2024-11-13T01:47:42Z
401721980102988501,102988501,JumpShot,Kyric Davis missed Jumper.,65,72,2nd Half,1:14,False,2698,2024-11-13T01:48:11Z
401721980102988801,102988801,Defensive Rebound,Ola Ajiboye Defensive Rebound.,65,72,2nd Half,1:11,False,2635,2024-11-13T01:48:11Z
401721980102995901,102995901,JumpShot,Daniel Egbuniwe missed Three Point Jumper.,65,72,2nd Half,0:40,False,2635,2024-11-13T01:48:45Z
401721980102996101,102996101,Defensive Rebound,Shelton Williams-Dryden Defensive Rebound.,65,72,2nd Half,0:38,False,2698,2024-11-13T01:48:48Z
401721980102996601,102996601,Lost Ball Turnover,Demetrus Johnson II Turnover.,65,72,2nd Half,0:33,False,2698,2024-11-13T01:48:59Z
401721980102996602,102996602,Steal,Daniel Egbuniwe Steal.,65,72,2nd Half,0:33,False,2635,2024-11-13T01:48:59Z
401721980102997101,102997101,DunkShot,Daniel Egbuniwe made Dunk.,65,74,2nd Half,0:28,True,2635,2024-11-13T01:48:59Z
401721980102997901,102997901,JumpShot,Kyric Davis made Three Point Jumper. Assisted by Michael Griffin.,68,74,2nd Half,0:20,True,2698,2024-11-13T01:49:22Z
401721980102997902,102997902,RegularTimeOut,West Georgia  Timeout,68,74,2nd Half,0:20,False,2698,2024-11-13T01:49:22Z
401721980102998001,102998001,PersonalFoul,Foul on Michael Griffin.,68,74,2nd Half,0:19,False,2698,2024-11-13T01:49:22Z
401721980102998101,102998101,PersonalFoul,Foul on Kyric Davis.,68,74,2nd Half,0:18,False,2698,2024-11-13T01:51:48Z
401721980102998102,102998102,MadeFreeThrow,Matthew Sells made Free Throw.,68,75,2nd Half,0:18,True,2635,2024-11-13T01:51:48Z
401721980102998103,102998103,MadeFreeThrow,Matthew Sells missed Free Throw.,68,75,2nd Half,0:18,False,2635,2024-11-13T01:52:45Z
401721980102998301,102998301,Defensive Rebound,Shelton Williams-Dryden Defensive Rebound.,68,75,2nd Half,0:16,False,2698,2024-11-13T01:52:45Z
401721980102998801,102998801,JumpShot,Kolten Griffin missed Three Point Jumper.,68,75,2nd Half,0:11,False,2698,2024-11-13T01:52:54Z
401721980102998901,102998901,JumpShot,Kyric Davis made Jumper.,70,75,2nd Half,0:10,True,2698,2024-11-13T01:52:54Z
401721980102999101,102999101,Offensive Rebound,Kyric Davis Offensive Rebound.,70,75,2nd Half,0:08,False,2698,2024-11-13T01:53:00Z
401721980102999102,102999102,PersonalFoul,Foul on Shelton Williams-Dryden.,70,75,2nd Half,0:08,False,2698,2024-11-13T01:53:00Z
401721980102999103,102999103,MadeFreeThrow,Matthew Sells made Free Throw.,70,76,2nd Half,0:08,True,2635,2024-11-13T01:53:00Z
401721980102999104,102999104,MadeFreeThrow,Matthew Sells missed Free Throw.,70,76,2nd Half,0:08,False,2635,2024-11-13T01:53:00Z
401721980102999401,102999401,Defensive Rebound,Michael Griffin Defensive Rebound.,70,76,2nd Half,0:05,False,2698,2024-11-13T01:53:54Z
401721980102999701,102999701,JumpShot,Demetrus Johnson II made Three Point Jumper.,73,76,2nd Half,0:02,True,2698,2024-11-13T01:53:57Z
401721980102999801,102999801,RegularTimeOut,Tennessee Tech  Timeout,73,76,2nd Half,0:01,False,2635,2024-11-13T01:54:02Z
401721980102999802,102999802,PersonalFoul,Foul on Michael Griffin.,73,76,2nd Half,0:01,False,2698,2024-11-13T01:54:02Z
401721980102999803,102999803,MadeFreeThrow,Rodney Johnson Jr. missed Free Throw.,73,76,2nd Half,0:01,False,2635,2024-11-13T01:54:02Z
401721980102999902,102999902,Defensive Rebound,Kyric Davis Defensive Rebound.,73,76,2nd Half,0:00,False,2698,2024-11-13T01:54:02Z
401721980102999901,102999901,End Period,End of 2nd half,73,76,2nd Half,0:00,False,,2024-11-13T01:54:02Z
401721980102999903,102999903,End Game,End of Game,73,76,2nd Half,0:00,False,,2024-11-13T01:54:02Z
