play_id,sequence_number,type,description,away_score,home_score,period,clock,scoring_play,team_id,timestamp_utc
401709975101806401,101806401,JumpShot,Will McClendon missed Three Point Jumper.,0,0,1st Half,19:35,False,23,2024-11-28T03:03:37Z
401709975101806801,101806801,Defensive Rebound,Austin Johnson Defensive Rebound.,0,0,1st Half,19:31,False,299,2024-11-28T03:03:37Z
401709975101809101,101809101,LayUpShot,Austin Johnson missed Layup.,0,0,1st Half,19:08,False,299,2024-11-28T03:03:37Z
401709975101809401,101809401,Offensive Rebound,Derrick Michael Xzavierro Offensive Rebound.,0,0,1st Half,19:05,False,299,2024-11-28T03:03:37Z
401709975101809701,101809701,PersonalFoul,Foul on Robert Vaihola.,0,0,1st Half,19:02,False,23,2024-11-28T03:03:37Z
401709975101809801,101809801,MadeFreeThrow,Austin Johnson made Free Throw.,0,1,1st Half,19:01,True,299,2024-11-28T03:03:37Z
401709975101809802,101809802,MadeFreeThrow,Austin Johnson missed Free Throw.,0,1,1st Half,19:01,False,299,2024-11-28T03:03:37Z
401709975101809901,101809901,Offensive Rebound,Cam Denson Offensive Rebound.,0,1,1st Half,19:00,False,299,2024-11-28T02:57:29Z
401709975101814901,101814901,LayUpShot,Cam Denson made Layup.,0,3,1st Half,18:50,True,299,2024-11-28T03:03:37Z
401709975101816901,101816901,LayUpShot,Josh Uduje made Layup. Assisted by Donavan Yap.,2,3,1st Half,18:30,True,23,2024-11-28T03:03:37Z
401709975101819501,101819501,LayUpShot,Austin Johnson made Layup. Assisted by Cam Denson.,2,5,1st Half,18:04,True,299,2024-11-28T03:03:37Z
401709975101824701,101824701,JumpShot,Donavan Yap made Jumper. Assisted by Robert Vaihola.,4,5,1st Half,17:52,True,23,2024-11-28T02:59:26Z
401709975101824702,101824702,PersonalFoul,Foul on Kam Martin.,4,5,1st Half,17:52,False,299,2024-11-28T02:59:26Z
401709975101824703,101824703,MadeFreeThrow,Donavan Yap missed Free Throw.,4,5,1st Half,17:52,False,23,2024-11-28T02:59:26Z
401709975101824801,101824801,Defensive Rebound,Cam Denson Defensive Rebound.,4,5,1st Half,17:51,False,299,2024-11-28T03:03:37Z
401709975101827701,101827701,JumpShot,Cam Denson missed Three Point Jumper.,4,5,1st Half,17:22,False,299,2024-11-28T03:03:37Z
401709975101827901,101827901,Offensive Rebound,Long Beach State Offensive Rebound.,4,5,1st Half,17:20,False,299,2024-11-28T03:00:32Z
401709975101827902,101827902,Lost Ball Turnover,Long Beach State  Turnover.,4,5,1st Half,17:20,False,299,2024-11-28T03:00:32Z
401709975101834001,101834001,PersonalFoul,Foul on Derrick Michael Xzavierro.,4,5,1st Half,16:59,False,299,2024-11-28T03:01:09Z
401709975101835301,101835301,PersonalFoul,Foul on Austin Johnson.,4,5,1st Half,16:46,False,299,2024-11-28T03:01:35Z
401709975101835302,101835302,MadeFreeThrow,Donavan Yap made Free Throw.,5,5,1st Half,16:46,True,23,2024-11-28T03:01:35Z
401709975101835303,101835303,MadeFreeThrow,Donavan Yap made Free Throw.,6,5,1st Half,16:46,True,23,2024-11-28T03:01:35Z
401709975101835304,101835304,MadeFreeThrow,Donavan Yap made Free Throw.,7,5,1st Half,16:46,True,23,2024-11-28T03:01:35Z
401709975101837701,101837701,DunkShot,Derrick Michael Xzavierro made Dunk. Assisted by Kam Martin.,7,7,1st Half,16:22,True,299,2024-11-28T03:03:37Z
401709975101844101,101844101,LayUpShot,Josh Uduje missed Layup.,7,7,1st Half,15:58,False,23,2024-11-28T03:03:26Z
401709975101844301,101844301,Defensive Rebound,Derrick Michael Xzavierro Defensive Rebound.,7,7,1st Half,15:56,False,299,2024-11-28T03:03:28Z
401709975101845101,101845101,LayUpShot,Devin Askew missed Layup.,7,7,1st Half,15:48,False,299,2024-11-28T03:03:37Z
401709975101845102,101845102,Block Shot,Josh Uduje Block.,7,7,1st Half,15:48,False,23,2024-11-28T03:03:37Z
401709975101845201,101845201,Offensive Rebound,Long Beach State Offensive Rebound.,7,7,1st Half,15:47,False,299,2024-11-28T03:03:37Z
401709975101845202,101845202,OfficialTVTimeOut, Official TV Timeout,7,7,1st Half,15:47,False,,2024-11-28T03:03:37Z
401709975101846001,101846001,PersonalFoul,Foul on Sadaidriene Hall.,7,7,1st Half,15:39,False,23,2024-11-28T03:03:37Z
401709975101846002,101846002,MadeFreeThrow,Devin Askew missed Free Throw.,7,7,1st Half,15:39,False,299,2024-11-28T03:06:30Z
401709975101846003,101846003,Offensive Rebound,Long Beach State Offensive Rebound.,7,7,1st Half,15:39,False,299,2024-11-28T03:06:30Z
401709975101846004,101846004,MadeFreeThrow,Devin Askew made Free Throw.,7,8,1st Half,15:39,True,299,2024-11-28T03:06:30Z
401709975101847501,101847501,Lost Ball Turnover,Will McClendon Turnover.,7,8,1st Half,15:24,False,23,2024-11-28T03:07:10Z
401709975101854501,101854501,JumpShot,Devin Askew missed Jumper.,7,8,1st Half,14:54,False,299,2024-11-28T03:07:48Z
401709975101854801,101854801,Defensive Rebound,Latrell Davis Defensive Rebound.,7,8,1st Half,14:51,False,23,2024-11-28T03:07:52Z
401709975101855201,101855201,PersonalFoul,Foul on Devin Askew.,7,8,1st Half,14:47,False,299,2024-11-28T03:07:53Z
401709975101855202,101855202,MadeFreeThrow,Latrell Davis made Free Throw.,8,8,1st Half,14:47,True,23,2024-11-28T03:07:53Z
401709975101855203,101855203,MadeFreeThrow,Latrell Davis made Free Throw.,9,8,1st Half,14:47,True,23,2024-11-28T03:07:53Z
401709975101857701,101857701,PersonalFoul,Foul on Sadraque NgaNga.,9,8,1st Half,14:22,False,23,2024-11-28T03:09:24Z
401709975101857702,101857702,MadeFreeThrow,Austin Johnson made Free Throw.,9,9,1st Half,14:22,True,299,2024-11-28T03:09:24Z
401709975101857703,101857703,MadeFreeThrow,Austin Johnson made Free Throw.,9,10,1st Half,14:22,True,299,2024-11-28T03:10:07Z
401709975101859701,101859701,PersonalFoul,Foul on Andrew Nagy.,9,10,1st Half,14:02,False,299,2024-11-28T03:10:57Z
401709975101859702,101859702,MadeFreeThrow,Robert Vaihola missed Free Throw.,9,10,1st Half,14:02,False,23,2024-11-28T03:10:57Z
401709975101859703,101859703,Offensive Rebound,San José State Offensive Rebound.,9,10,1st Half,14:02,False,23,2024-11-28T03:10:57Z
401709975101859704,101859704,MadeFreeThrow,Robert Vaihola made Free Throw.,10,10,1st Half,14:02,True,23,2024-11-28T03:10:57Z
401709975101866001,101866001,Lost Ball Turnover,Devin Askew Turnover.,10,10,1st Half,13:39,False,299,2024-11-28T03:12:04Z
401709975101866002,101866002,Steal,Josh Uduje Steal.,10,10,1st Half,13:39,False,23,2024-11-28T03:12:04Z
401709975101866501,101866501,JumpShot,Josh Uduje missed Jumper.,10,10,1st Half,13:34,False,23,2024-11-28T03:12:04Z
401709975101867001,101867001,Offensive Rebound,Jermaine Washington Offensive Rebound.,10,10,1st Half,13:29,False,23,2024-11-28T03:12:10Z
401709975101867002,101867002,JumpShot,Jermaine Washington made Jumper.,12,10,1st Half,13:29,True,23,2024-11-28T03:12:10Z
401709975101868701,101868701,PersonalFoul,Foul on Josh Uduje.,12,10,1st Half,13:12,False,23,2024-11-28T03:12:28Z
401709975101869101,101869101,PersonalFoul,Foul on Jermaine Washington.,12,10,1st Half,13:08,False,23,2024-11-28T03:12:58Z
401709975101874201,101874201,LayUpShot,Kam Martin made Layup.,12,12,1st Half,12:57,True,299,2024-11-28T03:13:29Z
401709975101875701,101875701,JumpShot,Will McClendon missed Jumper.,12,12,1st Half,12:42,False,23,2024-11-28T03:13:45Z
401709975101876001,101876001,Defensive Rebound,Devin Askew Defensive Rebound.,12,12,1st Half,12:39,False,299,2024-11-28T03:13:47Z
401709975101876301,101876301,Lost Ball Turnover,Varick Lewis Turnover.,12,12,1st Half,12:36,False,299,2024-11-28T03:13:49Z
401709975101878101,101878101,LayUpShot,Will McClendon missed Layup.,12,12,1st Half,12:18,False,23,2024-11-28T03:14:17Z
401709975101878301,101878301,Defensive Rebound,Austin Johnson Defensive Rebound.,12,12,1st Half,12:16,False,299,2024-11-28T03:14:17Z
401709975101879801,101879801,JumpShot,Kam Martin made Three Point Jumper. Assisted by Devin Askew.,12,15,1st Half,12:01,True,299,2024-11-28T03:14:36Z
401709975101885201,101885201,JumpShot,Josh Uduje made Jumper.,14,15,1st Half,11:47,True,23,2024-11-28T03:14:49Z
401709975101885301,101885301,PersonalFoul,Foul on Devin Askew.,14,15,1st Half,11:46,False,299,2024-11-28T03:15:04Z
401709975101885302,101885302,OfficialTVTimeOut, Official TV Timeout,14,15,1st Half,11:46,False,,2024-11-28T03:15:04Z
401709975101886001,101886001,JumpShot,Latrell Davis missed Three Point Jumper.,14,15,1st Half,11:39,False,23,2024-11-28T03:17:26Z
401709975101886301,101886301,Offensive Rebound,Robert Vaihola Offensive Rebound.,14,15,1st Half,11:36,False,23,2024-11-28T03:17:26Z
401709975101886501,101886501,LayUpShot,Robert Vaihola made Layup.,16,15,1st Half,11:34,True,23,2024-11-28T03:17:29Z
401709975101888901,101888901,Lost Ball Turnover,Kam Martin Turnover.,16,15,1st Half,11:10,False,299,2024-11-28T03:17:54Z
401709975101888902,101888902,Steal,Latrell Davis Steal.,16,15,1st Half,11:10,False,23,2024-11-28T03:17:54Z
401709975101889201,101889201,PersonalFoul,Foul on Cam Denson.,16,15,1st Half,11:07,False,299,2024-11-28T03:17:56Z
401709975101889202,101889202,MadeFreeThrow,Latrell Davis missed Free Throw.,16,15,1st Half,11:07,False,23,2024-11-28T03:17:56Z
401709975101889203,101889203,Offensive Rebound,San José State Offensive Rebound.,16,15,1st Half,11:07,False,23,2024-11-28T03:17:56Z
401709975101889204,101889204,MadeFreeThrow,Latrell Davis missed Free Throw.,16,15,1st Half,11:07,False,23,2024-11-28T03:17:56Z
401709975101889401,101889401,Defensive Rebound,Cam Denson Defensive Rebound.,16,15,1st Half,11:05,False,299,2024-11-28T03:19:08Z
401709975101895001,101895001,LayUpShot,Cam Denson missed Layup.,16,15,1st Half,10:49,False,299,2024-11-28T03:19:26Z
401709975101895002,101895002,Block Shot,Robert Vaihola Block.,16,15,1st Half,10:49,False,23,2024-11-28T03:19:26Z
401709975101895003,101895003,Offensive Rebound,Long Beach State Offensive Rebound.,16,15,1st Half,10:49,False,299,2024-11-28T03:19:26Z
401709975101895401,101895401,LayUpShot,Cam Denson made Layup. Assisted by Kam Martin.,16,17,1st Half,10:45,True,299,2024-11-28T03:19:49Z
401709975101897601,101897601,PersonalFoul,Foul on Austin Johnson.,16,17,1st Half,10:23,False,299,2024-11-28T03:20:13Z
401709975101897602,101897602,MadeFreeThrow,Robert Vaihola made Free Throw.,17,17,1st Half,10:23,True,23,2024-11-28T03:20:13Z
401709975101897603,101897603,MadeFreeThrow,Robert Vaihola made Free Throw.,18,17,1st Half,10:23,True,23,2024-11-28T03:20:13Z
401709975101899101,101899101,JumpShot,Andrew Nagy made Three Point Jumper. Assisted by Kam Martin.,18,20,1st Half,10:08,True,299,2024-11-28T03:21:22Z
401709975101905201,101905201,JumpShot,Josh Uduje made Jumper.,20,20,1st Half,9:47,True,23,2024-11-28T03:21:42Z
401709975101905701,101905701,JumpShot,Varick Lewis made Three Point Jumper. Assisted by Kam Martin.,20,23,1st Half,9:42,True,299,2024-11-28T03:21:47Z
401709975101907501,101907501,LayUpShot,Josh Uduje missed Layup.,20,23,1st Half,9:24,False,23,2024-11-28T03:22:04Z
401709975101907502,101907502,Block Shot,Cam Denson Block.,20,23,1st Half,9:24,False,299,2024-11-28T03:22:04Z
401709975101907503,101907503,Offensive Rebound,San José State Offensive Rebound.,20,23,1st Half,9:24,False,23,2024-11-28T03:22:04Z
401709975101909101,101909101,PersonalFoul,Foul on Andrew Nagy.,20,23,1st Half,9:08,False,299,2024-11-28T03:22:36Z
401709975101909102,101909102,MadeFreeThrow,Sadaidriene Hall made Free Throw.,21,23,1st Half,9:08,True,23,2024-11-28T03:22:36Z
401709975101909103,101909103,MadeFreeThrow,Sadaidriene Hall made Free Throw.,22,23,1st Half,9:08,True,23,2024-11-28T03:22:36Z
401709975101914601,101914601,JumpShot,Varick Lewis missed Three Point Jumper.,22,23,1st Half,8:53,False,299,2024-11-28T03:23:49Z
401709975101914901,101914901,Offensive Rebound,Derrick Michael Xzavierro Offensive Rebound.,22,23,1st Half,8:50,False,299,2024-11-28T03:23:49Z
401709975101915101,101915101,LayUpShot,Derrick Michael Xzavierro made Layup.,22,25,1st Half,8:48,True,299,2024-11-28T03:23:52Z
401709975101916401,101916401,PersonalFoul,Foul on Sadaidriene Hall.,22,25,1st Half,8:35,False,23,2024-11-28T03:24:05Z
401709975101916402,101916402,Lost Ball Turnover,Sadaidriene Hall Turnover.,22,25,1st Half,8:35,False,23,2024-11-28T03:24:05Z
401709975101918501,101918501,JumpShot,Varick Lewis made Jumper. Assisted by Kam Martin.,22,27,1st Half,8:14,True,299,2024-11-28T03:24:49Z
401709975101924001,101924001,JumpShot,Donavan Yap missed Three Point Jumper.,22,27,1st Half,7:59,False,23,2024-11-28T03:25:05Z
401709975101924501,101924501,Offensive Rebound,Josh Uduje Offensive Rebound.,22,27,1st Half,7:54,False,23,2024-11-28T03:25:08Z
401709975101924502,101924502,JumpShot,Josh Uduje made Jumper.,24,27,1st Half,7:54,True,23,2024-11-28T03:25:08Z
401709975101926501,101926501,JumpShot,Kam Martin made Three Point Jumper. Assisted by Cam Denson.,24,30,1st Half,7:34,True,299,2024-11-28T03:25:30Z
401709975101928601,101928601,Lost Ball Turnover,Donavan Yap Turnover.,24,30,1st Half,7:13,False,23,2024-11-28T03:25:49Z
401709975101928602,101928602,Steal,Cam Denson Steal.,24,30,1st Half,7:13,False,299,2024-11-28T03:25:49Z
401709975101928801,101928801,Lost Ball Turnover,Cam Denson Turnover.,24,30,1st Half,7:11,False,299,2024-11-28T03:25:52Z
401709975101928802,101928802,OfficialTVTimeOut, Official TV Timeout,24,30,1st Half,7:11,False,,2024-11-28T03:25:52Z
401709975101934801,101934801,LayUpShot,Sadraque NgaNga missed Layup.,24,30,1st Half,6:51,False,23,2024-11-28T03:28:33Z
401709975101935201,101935201,Offensive Rebound,Sadraque NgaNga Offensive Rebound.,24,30,1st Half,6:47,False,23,2024-11-28T03:28:36Z
401709975101935202,101935202,JumpShot,Sadraque NgaNga missed Jumper.,24,30,1st Half,6:47,False,23,2024-11-28T03:28:38Z
401709975101935301,101935301,Offensive Rebound,Sadraque NgaNga Offensive Rebound.,24,30,1st Half,6:46,False,23,2024-11-28T03:28:36Z
401709975101935401,101935401,LayUpShot,Sadraque NgaNga made Layup.,26,30,1st Half,6:45,True,23,2024-11-28T03:28:38Z
401709975101937101,101937101,JumpShot,Kam Martin missed Three Point Jumper.,26,30,1st Half,6:28,False,299,2024-11-28T03:28:58Z
401709975101937401,101937401,Defensive Rebound,Josh Uduje Defensive Rebound.,26,30,1st Half,6:25,False,23,2024-11-28T03:28:58Z
401709975101939301,101939301,JumpShot,Sadraque NgaNga made Three Point Jumper. Assisted by Josh Uduje.,29,30,1st Half,6:06,True,23,2024-11-28T03:29:19Z
401709975101944901,101944901,JumpShot,Derrick Michael Xzavierro missed Three Point Jumper.,29,30,1st Half,5:50,False,299,2024-11-28T03:29:35Z
401709975101945201,101945201,Defensive Rebound,Will McClendon Defensive Rebound.,29,30,1st Half,5:47,False,23,2024-11-28T03:29:35Z
401709975101945701,101945701,PersonalFoul,Foul on Latrell Davis.,29,30,1st Half,5:42,False,23,2024-11-28T03:29:41Z
401709975101945702,101945702,Lost Ball Turnover,Latrell Davis Turnover.,29,30,1st Half,5:42,False,23,2024-11-28T03:29:41Z
401709975101948301,101948301,LayUpShot,Kam Martin made Layup.,29,32,1st Half,5:16,True,299,2024-11-28T03:30:31Z
401709975101949601,101949601,PersonalFoul,Foul on Derrick Michael Xzavierro.,29,32,1st Half,5:03,False,299,2024-11-28T03:31:05Z
401709975101949602,101949602,MadeFreeThrow,Sadraque NgaNga missed Free Throw.,29,32,1st Half,5:03,False,23,2024-11-28T03:31:05Z
401709975101949603,101949603,Offensive Rebound,San José State Offensive Rebound.,29,32,1st Half,5:03,False,23,2024-11-28T03:31:05Z
401709975101949604,101949604,MadeFreeThrow,Sadraque NgaNga made Free Throw.,30,32,1st Half,5:03,True,23,2024-11-28T03:31:05Z
401709975101955101,101955101,Lost Ball Turnover,Austin Johnson Turnover.,30,32,1st Half,4:48,False,299,2024-11-28T03:32:15Z
401709975101957401,101957401,DunkShot,Josh Uduje made Dunk. Assisted by Will McClendon.,32,32,1st Half,4:25,True,23,2024-11-28T03:32:51Z
401709975101959201,101959201,DunkShot,Austin Johnson made Dunk. Assisted by Devin Askew.,32,34,1st Half,4:07,True,299,2024-11-28T03:33:09Z
401709975101964801,101964801,LayUpShot,Latrell Davis missed Layup.,32,34,1st Half,3:51,False,23,2024-11-28T03:33:25Z
401709975101964802,101964802,Block Shot,Austin Johnson Block.,32,34,1st Half,3:51,False,299,2024-11-28T03:33:25Z
401709975101965301,101965301,Offensive Rebound,Josh Uduje Offensive Rebound.,32,34,1st Half,3:46,False,23,2024-11-28T03:33:29Z
401709975101965501,101965501,JumpShot,Will McClendon missed Three Point Jumper.,32,34,1st Half,3:44,False,23,2024-11-28T03:33:33Z
401709975101965701,101965701,Offensive Rebound,Sadraque NgaNga Offensive Rebound.,32,34,1st Half,3:42,False,23,2024-11-28T03:33:33Z
401709975101965801,101965801,LayUpShot,Sadraque NgaNga made Layup.,34,34,1st Half,3:41,True,23,2024-11-28T03:33:35Z
401709975101967701,101967701,JumpShot,Varick Lewis missed Three Point Jumper.,34,34,1st Half,3:22,False,299,2024-11-28T03:33:55Z
401709975101968001,101968001,Defensive Rebound,Donavan Yap Defensive Rebound.,34,34,1st Half,3:19,False,23,2024-11-28T03:33:55Z
401709975101968701,101968701,JumpShot,Sadraque NgaNga missed Three Point Jumper.,34,34,1st Half,3:12,False,23,2024-11-28T03:34:05Z
401709975101968801,101968801,Defensive Rebound,Long Beach State Defensive Rebound.,34,34,1st Half,3:11,False,299,2024-11-28T03:34:05Z
401709975101968802,101968802,OfficialTVTimeOut, Official TV Timeout,34,34,1st Half,3:11,False,,2024-11-28T03:34:05Z
401709975101974901,101974901,PersonalFoul,Foul on Cam Denson.,34,34,1st Half,2:50,False,299,2024-11-28T03:36:57Z
401709975101974902,101974902,Lost Ball Turnover,Cam Denson Turnover.,34,34,1st Half,2:50,False,299,2024-11-28T03:36:57Z
401709975101976301,101976301,LayUpShot,Robert Vaihola missed Layup.,34,34,1st Half,2:36,False,23,2024-11-28T03:37:27Z
401709975101976501,101976501,Defensive Rebound,Austin Johnson Defensive Rebound.,34,34,1st Half,2:34,False,299,2024-11-28T03:37:27Z
401709975101977901,101977901,Lost Ball Turnover,Kam Martin Turnover.,34,34,1st Half,2:20,False,299,2024-11-28T03:37:43Z
401709975101984001,101984001,JumpShot,Jermaine Washington missed Three Point Jumper.,34,34,1st Half,1:59,False,23,2024-11-28T03:38:16Z
401709975101984301,101984301,Defensive Rebound,Devin Askew Defensive Rebound.,34,34,1st Half,1:56,False,299,2024-11-28T03:38:16Z
401709975101985201,101985201,PersonalFoul,Foul on Jermaine Washington.,34,34,1st Half,1:47,False,23,2024-11-28T03:38:26Z
401709975101985202,101985202,MadeFreeThrow,Devin Askew made Free Throw.,34,35,1st Half,1:47,True,299,2024-11-28T03:38:26Z
401709975101985203,101985203,MadeFreeThrow,Devin Askew made Free Throw.,34,36,1st Half,1:47,True,299,2024-11-28T03:38:26Z
401709975101986701,101986701,LayUpShot,Robert Vaihola made Layup. Assisted by Donavan Yap.,36,36,1st Half,1:32,True,23,2024-11-28T03:39:42Z
401709975101988301,101988301,LayUpShot,Austin Johnson missed Layup.,36,36,1st Half,1:16,False,299,2024-11-28T03:39:57Z
401709975101988601,101988601,Defensive Rebound,Will McClendon Defensive Rebound.,36,36,1st Half,1:13,False,23,2024-11-28T03:40:00Z
401709975101988801,101988801,Lost Ball Turnover,Latrell Davis Turnover.,36,36,1st Half,1:11,False,23,2024-11-28T03:40:02Z
401709975101994401,101994401,JumpShot,Kam Martin missed Three Point Jumper.,36,36,1st Half,0:55,False,299,2024-11-28T03:40:32Z
401709975101994701,101994701,Defensive Rebound,Will McClendon Defensive Rebound.,36,36,1st Half,0:52,False,23,2024-11-28T03:40:32Z
401709975101995901,101995901,JumpShot,Will McClendon missed Jumper.,36,36,1st Half,0:40,False,23,2024-11-28T03:40:47Z
401709975101996101,101996101,Defensive Rebound,Andrew Nagy Defensive Rebound.,36,36,1st Half,0:38,False,299,2024-11-28T03:40:47Z
401709975101998401,101998401,JumpShot,Andrew Nagy missed Jumper.,36,36,1st Half,0:15,False,299,2024-11-28T03:41:12Z
401709975101998701,101998701,Defensive Rebound,Robert Vaihola Defensive Rebound.,36,36,1st Half,0:12,False,23,2024-11-28T03:41:12Z
401709975101999902,101999902,JumpShot,Donavan Yap made Jumper.,38,36,1st Half,0:00,True,23,2024-11-28T03:41:12Z
401709975101999901,101999901,End Period,End of 1st half,38,36,1st Half,0:00,False,,2024-11-28T03:41:12Z
401709975102805201,102805201,JumpShot,Kam Martin missed Three Point Jumper.,38,36,2nd Half,19:47,False,299,
401709975102805601,102805601,Offensive Rebound,Cam Denson Offensive Rebound.,38,36,2nd Half,19:43,False,299,
401709975102807101,102807101,LayUpShot,Kam Martin missed Layup.,38,36,2nd Half,19:28,False,299,2024-11-28T03:57:54Z
401709975102807102,102807102,Block Shot,Robert Vaihola Block.,38,36,2nd Half,19:28,False,23,2024-11-28T03:57:54Z
401709975102807103,102807103,Offensive Rebound,Long Beach State Offensive Rebound.,38,36,2nd Half,19:28,False,299,2024-11-28T03:57:54Z
401709975102807801,102807801,Lost Ball Turnover,Long Beach State  Turnover.,38,36,2nd Half,19:21,False,299,2024-11-28T03:58:42Z
401709975102809701,102809701,JumpShot,Donavan Yap missed Three Point Jumper.,38,36,2nd Half,19:02,False,23,2024-11-28T03:59:27Z
401709975102814201,102814201,Offensive Rebound,Sadaidriene Hall Offensive Rebound.,38,36,2nd Half,18:57,False,23,2024-11-28T03:59:28Z
401709975102814501,102814501,LayUpShot,Josh Uduje made Layup. Assisted by Robert Vaihola.,40,36,2nd Half,18:54,True,23,2024-11-28T03:59:32Z
401709975102817901,102817901,JumpShot,Austin Johnson made Jumper.,40,38,2nd Half,18:20,True,299,2024-11-28T04:00:06Z
401709975102824201,102824201,JumpShot,Josh Uduje missed Three Point Jumper.,40,38,2nd Half,17:57,False,23,2024-11-28T04:00:31Z
401709975102824601,102824601,Defensive Rebound,Derrick Michael Xzavierro Defensive Rebound.,40,38,2nd Half,17:53,False,299,2024-11-28T04:00:31Z
401709975102825201,102825201,PersonalFoul,Foul on Josh Uduje.,40,38,2nd Half,17:47,False,23,2024-11-28T04:00:39Z
401709975102825202,102825202,MadeFreeThrow,Devin Askew made Free Throw.,40,39,2nd Half,17:47,True,299,2024-11-28T04:00:39Z
401709975102825203,102825203,MadeFreeThrow,Devin Askew made Free Throw.,40,40,2nd Half,17:47,True,299,2024-11-28T04:00:39Z
401709975102827001,102827001,JumpShot,Josh Uduje missed Three Point Jumper.,40,40,2nd Half,17:29,False,23,2024-11-28T04:01:40Z
401709975102827301,102827301,Offensive Rebound,Robert Vaihola Offensive Rebound.,40,40,2nd Half,17:26,False,23,2024-11-28T04:01:40Z
401709975102827401,102827401,LayUpShot,Robert Vaihola made Layup.,42,40,2nd Half,17:25,True,23,2024-11-28T04:01:40Z
401709975102829601,102829601,JumpShot,Kam Martin made Three Point Jumper. Assisted by Devin Askew.,42,43,2nd Half,17:03,True,299,2024-11-28T04:02:06Z
401709975102836601,102836601,LayUpShot,Josh Uduje missed Layup.,42,43,2nd Half,16:33,False,23,2024-11-28T04:02:35Z
401709975102836602,102836602,Block Shot,Derrick Michael Xzavierro Block.,42,43,2nd Half,16:33,False,299,2024-11-28T04:02:35Z
401709975102836603,102836603,Offensive Rebound,San José State Offensive Rebound.,42,43,2nd Half,16:33,False,23,2024-11-28T04:02:35Z
401709975102836901,102836901,JumpShot,Sadaidriene Hall made Jumper. Assisted by Will McClendon.,44,43,2nd Half,16:30,True,23,2024-11-28T04:02:55Z
401709975102838701,102838701,LayUpShot,Cam Denson missed Layup.,44,43,2nd Half,16:12,False,299,2024-11-28T04:03:12Z
401709975102838702,102838702,Block Shot,Robert Vaihola Block.,44,43,2nd Half,16:12,False,23,2024-11-28T04:03:12Z
401709975102839001,102839001,Defensive Rebound,San José State Defensive Rebound.,44,43,2nd Half,16:09,False,23,2024-11-28T04:03:40Z
401709975102846301,102846301,LayUpShot,Donavan Yap made Layup.,46,43,2nd Half,15:36,True,23,2024-11-28T04:04:16Z
401709975102847901,102847901,LayUpShot,Derrick Michael Xzavierro missed Layup.,46,43,2nd Half,15:20,False,299,2024-11-28T04:04:32Z
401709975102848101,102848101,JumpShot,Derrick Michael Xzavierro missed Jumper.,46,43,2nd Half,15:18,False,299,2024-11-28T04:07:39Z
401709975102848102,102848102,PersonalFoul,Foul on Robert Vaihola.,46,43,2nd Half,15:18,False,23,2024-11-28T04:07:39Z
401709975102848103,102848103,OfficialTVTimeOut, Official TV Timeout,46,43,2nd Half,15:18,False,,2024-11-28T04:07:39Z
401709975102848104,102848104,MadeFreeThrow,Derrick Michael Xzavierro missed Free Throw.,46,43,2nd Half,15:18,False,299,2024-11-28T04:07:39Z
401709975102848105,102848105,Offensive Rebound,Long Beach State Offensive Rebound.,46,43,2nd Half,15:18,False,299,2024-11-28T04:07:39Z
401709975102848106,102848106,MadeFreeThrow,Derrick Michael Xzavierro missed Free Throw.,46,43,2nd Half,15:18,False,299,2024-11-28T04:07:39Z
401709975102848201,102848201,Offensive Rebound,Derrick Michael Xzavierro Offensive Rebound.,46,43,2nd Half,15:17,False,299,2024-11-28T04:04:34Z
401709975102848203,102848203,Offensive Rebound,Cam Denson Offensive Rebound.,46,43,2nd Half,15:17,False,299,2024-11-28T04:07:39Z
401709975102848301,102848301,Offensive Rebound,Derrick Michael Xzavierro Offensive Rebound.,46,43,2nd Half,15:16,False,299,2024-11-28T04:07:39Z
401709975102854101,102854101,LayUpShot,Cam Denson made Layup.,46,45,2nd Half,14:58,True,299,2024-11-28T04:07:56Z
401709975102856001,102856001,JumpShot,Donavan Yap made Three Point Jumper.,49,45,2nd Half,14:39,True,23,2024-11-28T04:08:16Z
401709975102856101,102856101,PersonalFoul,Foul on Cam Denson.,49,45,2nd Half,14:38,False,299,2024-11-28T04:08:16Z
401709975102856601,102856601,JumpShot,Donavan Yap made Three Point Jumper. Assisted by Will McClendon.,52,45,2nd Half,14:33,True,23,2024-11-28T04:10:28Z
401709975102858701,102858701,PersonalFoul,Foul on Josh Uduje.,52,45,2nd Half,14:12,False,23,2024-11-28T04:10:48Z
401709975102864301,102864301,JumpShot,Devin Askew missed Jumper.,52,45,2nd Half,13:56,False,299,2024-11-28T04:11:39Z
401709975102864601,102864601,Defensive Rebound,Latrell Davis Defensive Rebound.,52,45,2nd Half,13:53,False,23,2024-11-28T04:11:39Z
401709975102866601,102866601,JumpShot,Donavan Yap made Three Point Jumper.,55,45,2nd Half,13:33,True,23,2024-11-28T04:12:02Z
401709975102867101,102867101,ShortTimeOut,Long Beach State  Timeout,55,45,2nd Half,13:28,False,299,2024-11-28T04:12:05Z
401709975102867102,102867102,OfficialTVTimeOut, Official TV Timeout,55,45,2nd Half,13:28,False,,2024-11-28T04:12:05Z
401709975102868801,102868801,JumpShot,Devin Askew missed Jumper.,55,45,2nd Half,13:11,False,299,2024-11-28T04:14:46Z
401709975102869101,102869101,Defensive Rebound,Sadraque NgaNga Defensive Rebound.,55,45,2nd Half,13:08,False,23,2024-11-28T04:14:46Z
401709975102874801,102874801,JumpShot,Sadraque NgaNga missed Three Point Jumper.,55,45,2nd Half,12:51,False,23,2024-11-28T04:15:07Z
