play_id,sequence_number,type,description,away_score,home_score,period,clock,scoring_play,team_id,timestamp_utc
401700205102844904,102844904,MadeFreeThrow,Lamar Wilkerson made Free Throw.,43,45,2nd Half,15:50,True,2534,2025-01-25T21:42:55Z
401700205102847101,102847101,Lost Ball Turnover,Khristian Lander Turnover.,43,45,2nd Half,15:28,False,98,2025-01-25T21:46:37Z
401700205102847701,102847701,PersonalFoul,Foul on Leeroy Odiahi.,43,45,2nd Half,15:22,False,98,2025-01-25T21:46:44Z
401700205102849701,102849701,Lost Ball Turnover,Kalifa Sakho Turnover.,43,45,2nd Half,15:02,False,2534,2025-01-25T21:47:41Z
401700205102849702,102849702,Steal,Braxton Bayless Steal.,43,45,2nd Half,15:02,False,98,2025-01-25T21:47:41Z
401700205102854301,102854301,JumpShot,Don McHenry made Three Point Jumper. Assisted by Braxton Bayless.,46,45,2nd Half,14:56,True,98,2025-01-25T21:47:49Z
401700205102855701,102855701,JumpShot,Marcus Boykin missed Three Point Jumper.,46,45,2nd Half,14:42,False,2534,2025-01-25T21:48:02Z
401700205102856201,102856201,Defensive Rebound,Enoch Kalambay Defensive Rebound.,46,45,2nd Half,14:37,False,98,2025-01-25T21:48:06Z
401700205102856701,102856701,JumpShot,Don McHenry missed Three Point Jumper.,46,45,2nd Half,14:32,False,98,2025-01-25T21:48:13Z
401700205102857001,102857001,Defensive Rebound,Sam Houston Defensive Rebound.,46,45,2nd Half,14:29,False,2534,2025-01-25T21:48:16Z
401700205102857401,102857401,LayUpShot,Dorian Finister missed Layup.,46,45,2nd Half,14:25,False,2534,2025-01-25T21:48:28Z
401700205102857701,102857701,Defensive Rebound,Leeroy Odiahi Defensive Rebound.,46,45,2nd Half,14:22,False,98,2025-01-25T21:48:28Z
401700205102858401,102858401,Lost Ball Turnover,Enoch Kalambay Turnover.,46,45,2nd Half,14:15,False,98,2025-01-25T21:48:36Z
401700205102864601,102864601,LayUpShot,Marcus Boykin missed Layup.,46,45,2nd Half,13:53,False,2534,2025-01-25T21:49:05Z
401700205102864602,102864602,Block Shot,Leeroy Odiahi Block.,46,45,2nd Half,13:53,False,98,2025-01-25T21:49:05Z
401700205102864701,102864701,Offensive Rebound,Marcus Boykin Offensive Rebound.,46,45,2nd Half,13:52,False,2534,2025-01-25T21:49:05Z
401700205102864702,102864702,PersonalFoul,Foul on Leeroy Odiahi.,46,45,2nd Half,13:52,False,98,2025-01-25T21:49:05Z
401700205102864703,102864703,MadeFreeThrow,Marcus Boykin made Free Throw.,46,46,2nd Half,13:52,True,2534,2025-01-25T21:49:05Z
401700205102864704,102864704,MadeFreeThrow,Marcus Boykin made Free Throw.,46,47,2nd Half,13:52,True,2534,2025-01-25T21:49:48Z
401700205102866301,102866301,PersonalFoul,Foul on Kalifa Sakho.,46,47,2nd Half,13:36,False,2534,2025-01-25T21:50:34Z
401700205102866901,102866901,JumpShot,Khristian Lander missed Three Point Jumper.,46,47,2nd Half,13:30,False,98,2025-01-25T21:51:06Z
401700205102866902,102866902,Block Shot,Dorian Finister Block.,46,47,2nd Half,13:30,False,2534,2025-01-25T21:51:09Z
401700205102867301,102867301,Offensive Rebound,Khristian Lander Offensive Rebound.,46,47,2nd Half,13:26,False,98,2025-01-25T21:51:09Z
401700205102867901,102867901,JumpShot,Don McHenry missed Jumper.,46,47,2nd Half,13:20,False,98,2025-01-25T21:51:16Z
401700205102868201,102868201,Defensive Rebound,Cameron Huefner Defensive Rebound.,46,47,2nd Half,13:17,False,2534,2025-01-25T21:51:20Z
401700205102868701,102868701,Lost Ball Turnover,Lamar Wilkerson Turnover.,46,47,2nd Half,13:12,False,2534,2025-01-25T21:51:22Z
401700205102868702,102868702,Steal,Khristian Lander Steal.,46,47,2nd Half,13:12,False,98,2025-01-25T21:51:22Z
401700205102869302,102869302,PersonalFoul,Foul on Dorian Finister.,46,47,2nd Half,13:06,False,2534,2025-01-25T21:51:28Z
401700205102874901,102874901,JumpShot,Khristian Lander missed Three Point Jumper.,46,47,2nd Half,12:50,False,98,2025-01-25T21:52:21Z
401700205102875301,102875301,Offensive Rebound,Jack Edelen Offensive Rebound.,46,47,2nd Half,12:46,False,98,2025-01-25T21:52:25Z
401700205102875401,102875401,Lost Ball Turnover,Jack Edelen Turnover.,46,47,2nd Half,12:45,False,98,2025-01-25T21:52:28Z
401700205102875402,102875402,Steal,Dorian Finister Steal.,46,47,2nd Half,12:45,False,2534,2025-01-25T21:52:28Z
401700205102875701,102875701,LayUpShot,Dorian Finister made Layup.,46,49,2nd Half,12:42,True,2534,2025-01-25T21:52:28Z
401700205102877501,102877501,JumpShot,Tyrone Marshall Jr. missed Three Point Jumper.,46,49,2nd Half,12:24,False,98,2025-01-25T21:53:37Z
401700205102878001,102878001,Offensive Rebound,Khristian Lander Offensive Rebound.,46,49,2nd Half,12:19,False,98,2025-01-25T21:53:37Z
401700205102878601,102878601,LayUpShot,Braxton Bayless missed Layup.,46,49,2nd Half,12:13,False,98,2025-01-25T21:53:45Z
401700205102878801,102878801,Defensive Rebound,Dorian Finister Defensive Rebound.,46,49,2nd Half,12:11,False,2534,2025-01-25T21:53:45Z
401700205102885001,102885001,JumpShot,Brennen Burns missed Jumper.,46,49,2nd Half,11:49,False,2534,2025-01-25T21:54:09Z
401700205102885301,102885301,Offensive Rebound,Dorian Finister Offensive Rebound.,46,49,2nd Half,11:46,False,2534,2025-01-25T21:54:09Z
401700205102885901,102885901,JumpShot,Dorian Finister missed Jumper.,46,49,2nd Half,11:40,False,2534,2025-01-25T21:54:19Z
401700205102886301,102886301,Defensive Rebound,Tyrone Marshall Jr. Defensive Rebound.,46,49,2nd Half,11:36,False,98,2025-01-25T21:54:19Z
401700205102887101,102887101,LayUpShot,Khristian Lander made Layup.,48,49,2nd Half,11:28,True,98,2025-01-25T21:54:29Z
401700205102887201,102887201,OfficialTVTimeOut, Official TV Timeout,48,49,2nd Half,11:27,False,,2025-01-25T21:54:29Z
401700205102887202,102887202,ShortTimeOut,Western Kentucky  Timeout,48,49,2nd Half,11:27,False,98,2025-01-25T21:54:29Z
401700205102889101,102889101,JumpShot,Lamar Wilkerson made Jumper.,48,51,2nd Half,11:08,True,2534,2025-01-25T21:58:11Z
401700205102894801,102894801,LayUpShot,Don McHenry made Layup.,50,51,2nd Half,10:51,True,98,2025-01-25T21:58:28Z
401700205102896401,102896401,JumpShot,Josiah Hammons made Jumper. Assisted by Brennen Burns.,50,53,2nd Half,10:35,True,2534,2025-01-25T21:58:45Z
401700205102897901,102897901,PersonalFoul,Foul on Cheikh Ndiaye.,50,53,2nd Half,10:20,False,2534,2025-01-25T21:58:59Z
401700205102897902,102897902,MadeFreeThrow,Enoch Kalambay made Free Throw.,51,53,2nd Half,10:20,True,98,2025-01-25T21:58:59Z
401700205102897903,102897903,MadeFreeThrow,Enoch Kalambay made Free Throw.,52,53,2nd Half,10:20,True,98,2025-01-25T21:59:40Z
401700205102905001,102905001,LayUpShot,Josiah Hammons missed Layup.,52,53,2nd Half,9:49,False,2534,2025-01-25T22:00:23Z
401700205102905002,102905002,Offensive Rebound,Cameron Huefner Offensive Rebound.,52,53,2nd Half,9:49,False,2534,2025-01-25T22:00:23Z
401700205102905003,102905003,Lost Ball Turnover,Sam Houston  Turnover.,52,53,2nd Half,9:49,False,2534,2025-01-25T22:00:27Z
401700205102907301,102907301,LayUpShot,Khristian Lander made Layup.,54,53,2nd Half,9:26,True,98,2025-01-25T22:01:03Z
401700205102909701,102909701,JumpShot,Cameron Huefner missed Jumper.,54,53,2nd Half,9:02,False,2534,2025-01-25T22:01:28Z
401700205102914001,102914001,Offensive Rebound,Cameron Huefner Offensive Rebound.,54,53,2nd Half,8:59,False,2534,2025-01-25T22:01:31Z
401700205102914401,102914401,JumpShot,Cameron Huefner missed Jumper.,54,53,2nd Half,8:55,False,2534,2025-01-25T22:01:34Z
401700205102914701,102914701,Defensive Rebound,Western Kentucky Defensive Rebound.,54,53,2nd Half,8:52,False,98,2025-01-25T22:01:38Z
401700205102917401,102917401,Lost Ball Turnover,Tyrone Marshall Jr. Turnover.,54,53,2nd Half,8:25,False,98,2025-01-25T22:02:31Z
401700205102917402,102917402,Steal,Brennen Burns Steal.,54,53,2nd Half,8:25,False,2534,2025-01-25T22:02:31Z
401700205102918801,102918801,LayUpShot,Brennen Burns missed Layup.,54,53,2nd Half,8:11,False,2534,2025-01-25T22:02:44Z
401700205102918802,102918802,Block Shot,Jack Edelen Block.,54,53,2nd Half,8:11,False,98,2025-01-25T22:02:44Z
401700205102918803,102918803,Offensive Rebound,Sam Houston Offensive Rebound.,54,53,2nd Half,8:11,False,2534,2025-01-25T22:02:44Z
401700205102924401,102924401,JumpShot,Marcus Boykin missed Jumper.,54,53,2nd Half,7:55,False,2534,2025-01-25T22:03:28Z
401700205102924901,102924901,Defensive Rebound,Braxton Bayless Defensive Rebound.,54,53,2nd Half,7:50,False,98,2025-01-25T22:03:31Z
401700205102925303,102925303,MadeFreeThrow,Don McHenry made Free Throw.,55,53,2nd Half,7:46,True,98,2025-01-25T22:10:35Z
401700205102925304,102925304,PersonalFoul,Foul on Kalifa Sakho.,54,53,2nd Half,7:46,False,2534,2025-01-25T22:10:35Z
401700205102925305,102925305,OfficialTVTimeOut, Official TV Timeout,54,53,2nd Half,7:46,False,,2025-01-25T22:10:35Z
401700205102925306,102925306,MadeFreeThrow,Don McHenry made Free Throw.,56,53,2nd Half,7:46,True,98,2025-01-25T22:10:35Z
401700205102926401,102926401,Lost Ball Turnover,Marcus Boykin Turnover.,56,53,2nd Half,7:35,False,2534,2025-01-25T22:07:17Z
401700205102928701,102928701,LayUpShot,Tyrone Marshall Jr. made Layup. Assisted by Braxton Bayless.,58,53,2nd Half,7:12,True,98,2025-01-25T22:08:02Z
401700205102936001,102936001,JumpShot,Cameron Huefner missed Jumper.,58,53,2nd Half,6:39,False,2534,2025-01-25T22:08:36Z
401700205102936301,102936301,Defensive Rebound,Braxton Bayless Defensive Rebound.,58,53,2nd Half,6:36,False,98,2025-01-25T22:08:36Z
401700205102936901,102936901,JumpShot,Don McHenry missed Three Point Jumper.,58,53,2nd Half,6:30,False,98,2025-01-25T22:08:48Z
401700205102937301,102937301,Defensive Rebound,Marcus Boykin Defensive Rebound.,58,53,2nd Half,6:26,False,2534,2025-01-25T22:08:48Z
401700205102937801,102937801,PersonalFoul,Foul on Braxton Bayless.,58,53,2nd Half,6:21,False,98,2025-01-25T22:09:09Z
401700205102937802,102937802,MadeFreeThrow,Dorian Finister missed Free Throw.,58,53,2nd Half,6:21,False,2534,2025-01-25T22:09:09Z
401700205102937803,102937803,Offensive Rebound,Sam Houston Offensive Rebound.,58,53,2nd Half,6:21,False,2534,2025-01-25T22:09:09Z
401700205102937804,102937804,MadeFreeThrow,Dorian Finister missed Free Throw.,58,53,2nd Half,6:21,False,2534,2025-01-25T22:09:09Z
401700205102937805,102937805,Defensive Rebound,Tyrone Marshall Jr. Defensive Rebound.,58,53,2nd Half,6:21,False,98,2025-01-25T22:09:09Z
401700205102944201,102944201,JumpShot,Enoch Kalambay made Three Point Jumper. Assisted by Don McHenry.,61,53,2nd Half,5:57,True,98,2025-01-25T22:10:20Z
401700205102945301,102945301,RegularTimeOut,Sam Houston  Timeout,61,53,2nd Half,5:46,False,2534,2025-01-25T22:10:35Z
401700205102947601,102947601,JumpShot,Lamar Wilkerson missed Jumper.,61,53,2nd Half,5:23,False,2534,2025-01-25T22:12:51Z
401700205102947901,102947901,Defensive Rebound,Tyrone Marshall Jr. Defensive Rebound.,61,53,2nd Half,5:20,False,98,2025-01-25T22:12:51Z
401700205102949901,102949901,Lost Ball Turnover,Western Kentucky  Turnover.,61,53,2nd Half,5:00,False,98,2025-01-25T22:13:25Z
401700205102955101,102955101,PersonalFoul,Foul on Braxton Bayless.,61,53,2nd Half,4:48,False,98,2025-01-25T22:13:52Z
401700205102955201,102955201,LayUpShot,Cameron Huefner made Layup. Assisted by Marcus Boykin.,61,55,2nd Half,4:47,True,2534,2025-01-25T22:13:52Z
401700205102956801,102956801,Lost Ball Turnover,Khristian Lander Turnover.,61,55,2nd Half,4:31,False,98,2025-01-25T22:14:51Z
401700205102959501,102959501,JumpShot,Dorian Finister missed Three Point Jumper.,61,55,2nd Half,4:04,False,2534,2025-01-25T22:16:03Z
401700205102959901,102959901,Defensive Rebound,Leeroy Odiahi Defensive Rebound.,61,55,2nd Half,4:00,False,98,2025-01-25T22:16:03Z
401700205102966601,102966601,Lost Ball Turnover,Tyrone Marshall Jr. Turnover.,61,55,2nd Half,3:33,False,98,2025-01-25T22:16:32Z
401700205102966602,102966602,Steal,Josiah Hammons Steal.,61,55,2nd Half,3:33,False,2534,2025-01-25T22:16:35Z
401700205102967101,102967101,PersonalFoul,Foul on Leeroy Odiahi.,61,55,2nd Half,3:28,False,98,2025-01-25T22:16:35Z
401700205102967102,102967102,OfficialTVTimeOut, Official TV Timeout,61,55,2nd Half,3:28,False,,2025-01-25T22:16:35Z
401700205102967103,102967103,MadeFreeThrow,Dorian Finister made Free Throw.,61,56,2nd Half,3:28,True,2534,2025-01-25T22:16:35Z
401700205102967104,102967104,MadeFreeThrow,Dorian Finister missed Free Throw.,61,56,2nd Half,3:28,False,2534,2025-01-25T22:16:35Z
401700205102967201,102967201,Defensive Rebound,Enoch Kalambay Defensive Rebound.,61,56,2nd Half,3:27,False,98,2025-01-25T22:16:35Z
401700205102969701,102969701,JumpShot,Khristian Lander missed Three Point Jumper.,61,56,2nd Half,3:02,False,98,2025-01-25T22:20:47Z
401700205102974101,102974101,Defensive Rebound,Kalifa Sakho Defensive Rebound.,61,56,2nd Half,2:58,False,2534,2025-01-25T22:20:51Z
401700205102976401,102976401,LayUpShot,Marcus Boykin missed Layup.,61,56,2nd Half,2:35,False,2534,2025-01-25T22:21:13Z
401700205102976701,102976701,Defensive Rebound,Enoch Kalambay Defensive Rebound.,61,56,2nd Half,2:32,False,98,2025-01-25T22:21:13Z
401700205102977301,102977301,LayUpShot,Don McHenry made Layup. Assisted by Tyrone Marshall Jr..,63,56,2nd Half,2:26,True,98,2025-01-25T22:21:22Z
401700205102979101,102979101,JumpShot,Lamar Wilkerson made Three Point Jumper.,63,59,2nd Half,2:08,True,2534,2025-01-25T22:21:41Z
401700205102986201,102986201,LayUpShot,Don McHenry made Layup.,65,59,2nd Half,1:37,True,98,2025-01-25T22:22:11Z
401700205102988801,102988801,Lost Ball Turnover,Lamar Wilkerson Turnover.,65,59,2nd Half,1:11,False,2534,2025-01-25T22:22:36Z
401700205102988802,102988802,Steal,Enoch Kalambay Steal.,65,59,2nd Half,1:11,False,98,2025-01-25T22:22:36Z
401700205102988803,102988803,ShortTimeOut,Western Kentucky  Timeout,65,59,2nd Half,1:11,False,98,2025-01-25T22:22:36Z
401700205102989601,102989601,LayUpShot,Braxton Bayless made Layup. Assisted by Enoch Kalambay.,67,59,2nd Half,1:03,True,98,2025-01-25T22:24:02Z
401700205102994601,102994601,LayUpShot,Marcus Boykin missed Layup.,67,59,2nd Half,0:53,False,2534,2025-01-25T22:24:13Z
401700205102994901,102994901,Defensive Rebound,Tyrone Marshall Jr. Defensive Rebound.,67,59,2nd Half,0:50,False,98,2025-01-25T22:24:17Z
401700205102995101,102995101,LayUpShot,Don McHenry made Layup. Assisted by Tyrone Marshall Jr..,69,59,2nd Half,0:48,True,98,2025-01-25T22:24:17Z
401700205102995901,102995901,JumpShot,Cameron Huefner missed Three Point Jumper.,69,59,2nd Half,0:40,False,2534,2025-01-25T22:24:28Z
401700205102995902,102995902,Block Shot,Tyrone Marshall Jr. Block.,69,59,2nd Half,0:40,False,98,2025-01-25T22:24:28Z
401700205102996001,102996001,Offensive Rebound,Cameron Huefner Offensive Rebound.,69,59,2nd Half,0:39,False,2534,2025-01-25T22:24:28Z
401700205102996101,102996101,PersonalFoul,Foul on Don McHenry.,69,59,2nd Half,0:38,False,98,2025-01-25T22:24:35Z
401700205102996102,102996102,MadeFreeThrow,Cameron Huefner missed Free Throw.,69,59,2nd Half,0:38,False,2534,2025-01-25T22:24:35Z
401700205102996201,102996201,Defensive Rebound,Tyrone Marshall Jr. Defensive Rebound.,69,59,2nd Half,0:37,False,98,2025-01-25T22:24:57Z
401700205102996601,102996601,PersonalFoul,Foul on Dorian Finister.,69,59,2nd Half,0:33,False,2534,2025-01-25T22:25:00Z
401700205102996602,102996602,MadeFreeThrow,Don McHenry made Free Throw.,70,59,2nd Half,0:33,True,98,2025-01-25T22:25:00Z
401700205102996603,102996603,MadeFreeThrow,Don McHenry made Free Throw.,71,59,2nd Half,0:33,True,98,2025-01-25T22:25:41Z
401700205102997201,102997201,LayUpShot,Kalifa Sakho made Layup. Assisted by Josiah Hammons.,71,61,2nd Half,0:27,True,2534,2025-01-25T22:26:00Z
401700205102997701,102997701,PersonalFoul,Foul on Josiah Hammons.,71,61,2nd Half,0:22,False,2534,2025-01-25T22:26:07Z
401700205102997702,102997702,MadeFreeThrow,Braxton Bayless made Free Throw.,72,61,2nd Half,0:22,True,98,2025-01-25T22:26:07Z
401700205102997703,102997703,MadeFreeThrow,Braxton Bayless made Free Throw.,73,61,2nd Half,0:22,True,98,2025-01-25T22:26:07Z
401700205102998301,102998301,JumpShot,Marcus Boykin made Three Point Jumper.,73,64,2nd Half,0:16,True,2534,2025-01-25T22:26:53Z
401700205102998601,102998601,PersonalFoul,Foul on Cameron Huefner.,73,64,2nd Half,0:13,False,2534,2025-01-25T22:27:01Z
401700205102998602,102998602,MadeFreeThrow,Tyrone Marshall Jr. made Free Throw.,74,64,2nd Half,0:13,True,98,2025-01-25T22:27:24Z
401700205102998603,102998603,MadeFreeThrow,Tyrone Marshall Jr. made Free Throw.,75,64,2nd Half,0:13,True,98,2025-01-25T22:27:24Z
401700205102999201,102999201,LayUpShot,Lamar Wilkerson made Layup.,75,66,2nd Half,0:07,True,2534,2025-01-25T22:27:42Z
401700205102999901,102999901,End Period,End of 2nd half,75,66,2nd Half,0:00,False,,2025-01-25T22:27:42Z
401700205102999902,102999902,End Game,End of Game,75,66,2nd Half,0:00,False,,2025-01-25T22:27:42Z
