play_id,sequence_number,type,description,away_score,home_score,period,clock,scoring_play,team_id,timestamp_utc
401725579101805301,101805301,Lost Ball Turnover,Baba Miller Turnover.,0,0,1st Half,19:46,False,2226,2025-02-08T17:01:52Z
401725579101805302,101805302,Steal,Isaiah Barnes Steal.,0,0,1st Half,19:46,False,202,2025-02-08T17:01:52Z
401725579101808101,101808101,JumpShot,Keaston Willis missed Three Point Jumper.,0,0,1st Half,19:18,False,202,2025-02-08T17:02:19Z
401725579101808401,101808401,Offensive Rebound,Jesaiah McWright Offensive Rebound.,0,0,1st Half,19:15,False,202,2025-02-08T17:02:21Z
401725579101808801,101808801,JumpShot,Isaiah Barnes made Jumper.,0,2,1st Half,19:11,True,202,2025-02-08T17:02:26Z
401725579101814301,101814301,JumpShot,Tre Carroll missed Three Point Jumper.,0,2,1st Half,18:56,False,2226,2025-02-08T17:02:42Z
401725579101814601,101814601,Defensive Rebound,Jesaiah McWright Defensive Rebound.,0,2,1st Half,18:53,False,202,2025-02-08T17:02:43Z
401725579101815201,101815201,LayUpShot,Dwon Odom made Layup.,0,4,1st Half,18:47,True,202,2025-02-08T17:02:50Z
401725579101817701,101817701,JumpShot,Tre Carroll missed Jumper.,0,4,1st Half,18:22,False,2226,2025-02-08T17:03:15Z
401725579101818101,101818101,Defensive Rebound,Isaiah Barnes Defensive Rebound.,0,4,1st Half,18:18,False,202,2025-02-08T17:03:18Z
401725579101818601,101818601,LayUpShot,Ian Smikle made Layup. Assisted by Dwon Odom.,0,6,1st Half,18:13,True,202,2025-02-08T17:03:24Z
401725579101824201,101824201,JumpShot,KyKy Tandy made Three Point Jumper. Assisted by Tre Carroll.,3,6,1st Half,17:57,True,2226,2025-02-08T17:04:09Z
401725579101826101,101826101,Lost Ball Turnover,Dwon Odom Turnover.,3,6,1st Half,17:38,False,202,2025-02-08T17:04:09Z
401725579101827401,101827401,JumpShot,Leland Walker missed Three Point Jumper.,3,6,1st Half,17:25,False,2226,2025-02-08T17:04:32Z
401725579101827601,101827601,Defensive Rebound,Tulsa Defensive Rebound.,3,6,1st Half,17:23,False,202,2025-02-08T17:04:35Z
401725579101835001,101835001,Lost Ball Turnover,Tulsa  Turnover.,3,6,1st Half,16:49,False,202,2025-02-08T17:05:25Z
401725579101836301,101836301,LayUpShot,Baba Miller made Layup. Assisted by Leland Walker.,5,6,1st Half,16:36,True,2226,2025-02-08T17:06:55Z
401725579101839601,101839601,Lost Ball Turnover,Tulsa  Turnover.,5,6,1st Half,16:03,False,202,2025-02-08T17:07:29Z
401725579101844901,101844901,LayUpShot,Baba Miller made Layup.,7,6,1st Half,15:50,True,2226,2025-02-08T17:08:05Z
401725579101846101,101846101,JumpShot,Isaiah Barnes missed Three Point Jumper.,7,6,1st Half,15:38,False,202,2025-02-08T17:08:18Z
401725579101846501,101846501,Defensive Rebound,Baba Miller Defensive Rebound.,7,6,1st Half,15:34,False,2226,2025-02-08T17:08:19Z
401725579101848101,101848101,JumpShot,Baba Miller made Three Point Jumper. Assisted by Tre Carroll.,10,6,1st Half,15:18,True,2226,2025-02-08T17:08:37Z
401725579101854401,101854401,JumpShot,Jared Garcia missed Jumper.,10,6,1st Half,14:55,False,202,2025-02-08T17:09:00Z
401725579101854402,101854402,Block Shot,Tre Carroll Block.,10,6,1st Half,14:55,False,2226,2025-02-08T17:09:00Z
401725579101854701,101854701,Defensive Rebound,Ken Evans Jr. Defensive Rebound.,10,6,1st Half,14:52,False,2226,2025-02-08T17:09:03Z
401725579101854901,101854901,JumpShot,KyKy Tandy missed Three Point Jumper.,10,6,1st Half,14:50,False,2226,2025-02-08T17:09:06Z
401725579101855201,101855201,Defensive Rebound,Isaiah Barnes Defensive Rebound.,10,6,1st Half,14:47,False,202,2025-02-08T17:09:08Z
401725579101856501,101856501,JumpShot,Jared Garcia missed Three Point Jumper.,10,6,1st Half,14:34,False,202,2025-02-08T17:09:22Z
401725579101856801,101856801,Defensive Rebound,Ken Evans Jr. Defensive Rebound.,10,6,1st Half,14:31,False,2226,2025-02-08T17:09:24Z
401725579101858201,101858201,JumpShot,Tre Carroll made Three Point Jumper. Assisted by Leland Walker.,13,6,1st Half,14:17,True,2226,2025-02-08T17:09:38Z
401725579101858401,101858401,ShortTimeOut,Tulsa Timeout,13,6,1st Half,14:15,False,202,2025-02-08T17:09:38Z
401725579101858402,101858402,OfficialTVTimeOut,Official TV Timeout,13,6,1st Half,14:15,False,,2025-02-08T17:09:38Z
401725579101864001,101864001,LayUpShot,Tyshawn Archie missed Layup.,13,6,1st Half,13:59,False,202,2025-02-08T17:13:48Z
401725579101864002,101864002,Block Shot,Tre Carroll Block.,13,6,1st Half,13:59,False,2226,2025-02-08T17:13:48Z
401725579101864301,101864301,Defensive Rebound,Niccolo Moretti Defensive Rebound.,13,6,1st Half,13:56,False,2226,2025-02-08T17:13:52Z
401725579101864701,101864701,Lost Ball Turnover,Tre Carroll Turnover.,13,6,1st Half,13:52,False,2226,2025-02-08T17:13:55Z
401725579101865601,101865601,JumpShot,Tyshawn Archie made Three Point Jumper. Assisted by Justin Amadi.,13,9,1st Half,13:43,True,202,2025-02-08T17:14:16Z
401725579101867401,101867401,JumpShot,Kaleb Glenn made Three Point Jumper.,16,9,1st Half,13:25,True,2226,2025-02-08T17:14:36Z
401725579101869901,101869901,JumpShot,Tyshawn Archie missed Three Point Jumper.,16,9,1st Half,13:00,False,202,2025-02-08T17:14:59Z
401725579101874401,101874401,Offensive Rebound,Braeden Carrington Offensive Rebound.,16,9,1st Half,12:55,False,202,2025-02-08T17:14:59Z
401725579101874601,101874601,JumpShot,Braeden Carrington made Three Point Jumper. Assisted by Dwon Odom.,16,12,1st Half,12:53,True,202,2025-02-08T17:15:07Z
401725579101876701,101876701,JumpShot,Kaleb Glenn missed Jumper.,16,12,1st Half,12:32,False,2226,2025-02-08T17:15:28Z
401725579101877001,101877001,Defensive Rebound,Dwon Odom Defensive Rebound.,16,12,1st Half,12:29,False,202,2025-02-08T17:15:29Z
401725579101877701,101877701,LayUpShot,Justin Amadi missed Layup.,16,12,1st Half,12:22,False,202,2025-02-08T17:15:36Z
401725579101877801,101877801,Offensive Rebound,Tulsa Offensive Rebound.,16,12,1st Half,12:21,False,202,2025-02-08T17:15:36Z
401725579101879401,101879401,JumpShot,Braeden Carrington missed Three Point Jumper.,16,12,1st Half,12:05,False,202,2025-02-08T17:16:26Z
401725579101879801,101879801,Defensive Rebound,Niccolo Moretti Defensive Rebound.,16,12,1st Half,12:01,False,2226,2025-02-08T17:16:28Z
401725579101884401,101884401,JumpShot,Matas Vokietaitis made Jumper. Assisted by KyKy Tandy.,18,12,1st Half,11:55,True,2226,2025-02-08T17:16:36Z
401725579101886001,101886001,OfficialTVTimeOut,Official TV Timeout,18,12,1st Half,11:39,False,,2025-02-08T17:16:50Z
401725579101888001,101888001,Lost Ball Turnover,Tulsa  Turnover.,18,12,1st Half,11:19,False,202,2025-02-08T17:21:04Z
401725579101889901,101889901,JumpShot,Niccolo Moretti made Three Point Jumper.,21,12,1st Half,11:00,True,2226,2025-02-08T17:21:36Z
401725579101894801,101894801,Lost Ball Turnover,Tyshawn Archie Turnover.,21,12,1st Half,10:51,False,202,2025-02-08T17:21:44Z
401725579101896901,101896901,JumpShot,Niccolo Moretti missed Jumper.,21,12,1st Half,10:30,False,2226,2025-02-08T17:22:22Z
401725579101897101,101897101,Defensive Rebound,Tyshawn Archie Defensive Rebound.,21,12,1st Half,10:28,False,202,2025-02-08T17:22:22Z
401725579101898001,101898001,JumpShot,Keaston Willis missed Three Point Jumper.,21,12,1st Half,10:19,False,202,2025-02-08T17:22:33Z
401725579101898401,101898401,Offensive Rebound,Braeden Carrington Offensive Rebound.,21,12,1st Half,10:15,False,202,2025-02-08T17:22:35Z
401725579101899401,101899401,Lost Ball Turnover,Keaston Willis Turnover.,21,12,1st Half,10:05,False,202,2025-02-08T17:22:44Z
401725579101899402,101899402,Steal,Niccolo Moretti Steal.,21,12,1st Half,10:05,False,2226,2025-02-08T17:22:44Z
401725579101899601,101899601,DunkShot,Baba Miller missed Dunk.,21,12,1st Half,10:03,False,2226,2025-02-08T17:22:48Z
401725579101904001,101904001,Offensive Rebound,Niccolo Moretti Offensive Rebound.,21,12,1st Half,9:59,False,2226,2025-02-08T17:22:51Z
401725579101904002,101904002,DunkShot,Kaleb Glenn made Dunk. Assisted by Niccolo Moretti.,23,12,1st Half,9:59,True,2226,2025-02-08T17:22:51Z
401725579101904101,101904101,ShortTimeOut,Tulsa Timeout,23,12,1st Half,9:58,False,202,2025-02-08T17:22:52Z
401725579101906101,101906101,DunkShot,Jesaiah McWright made Dunk. Assisted by Ian Smikle.,23,14,1st Half,9:38,True,202,2025-02-08T17:24:26Z
401725579101907701,101907701,PersonalFoul,Foul on Kaleb Glenn.,23,14,1st Half,9:22,False,2226,2025-02-08T17:24:41Z
401725579101907702,101907702,Lost Ball Turnover,Kaleb Glenn Turnover.,23,14,1st Half,9:22,False,2226,2025-02-08T17:24:41Z
401725579101909401,101909401,Lost Ball Turnover,Jesaiah McWright Turnover.,23,14,1st Half,9:05,False,202,2025-02-08T17:25:12Z
401725579101909402,101909402,Steal,Niccolo Moretti Steal.,23,14,1st Half,9:05,False,2226,2025-02-08T17:25:12Z
401725579101909801,101909801,PersonalFoul,Foul on Jesaiah McWright.,23,14,1st Half,9:01,False,202,2025-02-08T17:25:16Z
401725579101909802,101909802,MadeFreeThrow,Kaleb Glenn made Free Throw.,24,14,1st Half,9:01,True,2226,2025-02-08T17:25:16Z
401725579101909803,101909803,MadeFreeThrow,Kaleb Glenn made Free Throw.,25,14,1st Half,9:01,True,2226,2025-02-08T17:25:16Z
401725579101916301,101916301,JumpShot,Dwon Odom missed Jumper.,25,14,1st Half,8:36,False,202,2025-02-08T17:26:48Z
401725579101916601,101916601,Offensive Rebound,Ian Smikle Offensive Rebound.,25,14,1st Half,8:33,False,202,2025-02-08T17:26:48Z
401725579101916602,101916602,PersonalFoul,Foul on Matas Vokietaitis.,25,14,1st Half,8:33,False,2226,2025-02-08T17:26:48Z
401725579101917101,101917101,JumpShot,Jared Garcia missed Jumper.,25,14,1st Half,8:28,False,202,2025-02-08T17:27:14Z
401725579101917401,101917401,Defensive Rebound,Matas Vokietaitis Defensive Rebound.,25,14,1st Half,8:25,False,2226,2025-02-08T17:27:17Z
401725579101919201,101919201,JumpShot,Niccolo Moretti missed Three Point Jumper.,25,14,1st Half,8:07,False,2226,2025-02-08T17:27:36Z
401725579101919601,101919601,PersonalFoul,Foul on Jesaiah McWright.,25,14,1st Half,8:03,False,202,2025-02-08T17:28:10Z
401725579101919701,101919701,Offensive Rebound,Matas Vokietaitis Offensive Rebound.,25,14,1st Half,8:02,False,2226,2025-02-08T17:27:39Z
401725579101924001,101924001,JumpShot,Ken Evans Jr. missed Three Point Jumper.,25,14,1st Half,7:59,False,2226,2025-02-08T17:28:10Z
401725579101924301,101924301,Defensive Rebound,Keaston Willis Defensive Rebound.,25,14,1st Half,7:56,False,202,2025-02-08T17:28:12Z
401725579101924901,101924901,OfficialTVTimeOut,Official TV Timeout,25,14,1st Half,7:50,False,,2025-02-08T17:28:18Z
401725579101926101,101926101,PersonalFoul,Foul on Leland Walker.,25,14,1st Half,7:38,False,2226,2025-02-08T17:32:27Z
401725579101927901,101927901,Lost Ball Turnover,Justin Amadi Turnover.,25,14,1st Half,7:20,False,202,2025-02-08T17:33:03Z
401725579101927902,101927902,Steal,Ken Evans Jr. Steal.,25,14,1st Half,7:20,False,2226,2025-02-08T17:33:03Z
401725579101934401,101934401,JumpShot,Ken Evans Jr. made Jumper. Assisted by Tre Carroll.,27,14,1st Half,6:55,True,2226,2025-02-08T17:33:29Z
401725579101937201,101937201,JumpShot,Dwon Odom missed Jumper.,27,14,1st Half,6:27,False,202,2025-02-08T17:34:03Z
401725579101937601,101937601,Defensive Rebound,Leland Walker Defensive Rebound.,27,14,1st Half,6:23,False,2226,2025-02-08T17:34:01Z
401725579101938401,101938401,JumpShot,Tre Carroll missed Jumper.,27,14,1st Half,6:15,False,2226,2025-02-08T17:34:08Z
401725579101938701,101938701,Defensive Rebound,Keaston Willis Defensive Rebound.,27,14,1st Half,6:12,False,202,2025-02-08T17:34:11Z
401725579101939601,101939601,JumpShot,Dwon Odom made Jumper.,27,16,1st Half,6:03,True,202,2025-02-08T17:34:20Z
401725579101939602,101939602,PersonalFoul,Foul on Tre Carroll.,27,16,1st Half,6:03,False,2226,2025-02-08T17:34:20Z
401725579101939603,101939603,MadeFreeThrow,Dwon Odom made Free Throw.,27,17,1st Half,6:03,True,202,2025-02-08T17:34:41Z
401725579101945201,101945201,PersonalFoul,Foul on Justin Amadi.,27,17,1st Half,5:47,False,202,2025-02-08T17:35:19Z
401725579101945401,101945401,LayUpShot,Tre Carroll missed Layup.,27,17,1st Half,5:45,False,2226,2025-02-08T17:35:47Z
401725579101946201,101946201,Defensive Rebound,Jared Garcia Defensive Rebound.,27,17,1st Half,5:37,False,202,2025-02-08T17:35:56Z
401725579101946701,101946701,LayUpShot,Dwon Odom missed Layup.,27,17,1st Half,5:32,False,202,2025-02-08T17:36:04Z
401725579101946901,101946901,Defensive Rebound,Kaleb Glenn Defensive Rebound.,27,17,1st Half,5:30,False,2226,2025-02-08T17:36:04Z
401725579101947701,101947701,LayUpShot,Ken Evans Jr. missed Layup.,27,17,1st Half,5:22,False,2226,2025-02-08T17:36:11Z
401725579101947702,101947702,Block Shot,Keaston Willis Block.,27,17,1st Half,5:22,False,202,2025-02-08T17:36:14Z
401725579101948001,101948001,Offensive Rebound,Tre Carroll Offensive Rebound.,27,17,1st Half,5:19,False,2226,2025-02-08T17:36:14Z
401725579101948002,101948002,LayUpShot,Ken Evans Jr. made Layup. Assisted by Tre Carroll.,29,17,1st Half,5:19,True,2226,2025-02-08T17:36:14Z
401725579101954301,101954301,JumpShot,Jared Garcia missed Jumper.,29,17,1st Half,4:56,False,202,2025-02-08T17:36:36Z
401725579101954501,101954501,Defensive Rebound,Tre Carroll Defensive Rebound.,29,17,1st Half,4:54,False,2226,2025-02-08T17:36:38Z
401725579101955501,101955501,JumpShot,Ken Evans Jr. made Three Point Jumper.,32,17,1st Half,4:44,True,2226,2025-02-08T17:36:50Z
401725579101957701,101957701,LayUpShot,Jared Garcia missed Layup.,32,17,1st Half,4:22,False,202,2025-02-08T17:37:12Z
401725579101957702,101957702,Block Shot,Tre Carroll Block.,32,17,1st Half,4:22,False,2226,2025-02-08T17:37:11Z
401725579101958001,101958001,Defensive Rebound,Niccolo Moretti Defensive Rebound.,32,17,1st Half,4:19,False,2226,2025-02-08T17:37:14Z
401725579101958401,101958401,JumpShot,KyKy Tandy made Three Point Jumper. Assisted by Ken Evans Jr..,35,17,1st Half,4:15,True,2226,2025-02-08T17:37:22Z
401725579101958601,101958601,ShortTimeOut,Tulsa Timeout,35,17,1st Half,4:13,False,202,2025-02-08T17:37:20Z
401725579101958602,101958602,OfficialTVTimeOut,Official TV Timeout,35,17,1st Half,4:13,False,,2025-02-08T17:37:20Z
401725579101964101,101964101,LayUpShot,Tyshawn Archie made Layup. Assisted by Ian Smikle.,35,19,1st Half,3:58,True,202,2025-02-08T17:42:09Z
401725579101966401,101966401,Lost Ball Turnover,Ken Evans Jr. Turnover.,35,19,1st Half,3:35,False,2226,2025-02-08T17:41:34Z
401725579101968401,101968401,JumpShot,Isaiah Barnes missed Three Point Jumper.,35,19,1st Half,3:15,False,202,2025-02-08T17:42:06Z
401725579101968701,101968701,Defensive Rebound,Matas Vokietaitis Defensive Rebound.,35,19,1st Half,3:12,False,2226,2025-02-08T17:42:09Z
401725579101969301,101969301,JumpShot,KyKy Tandy made Three Point Jumper. Assisted by Niccolo Moretti.,38,19,1st Half,3:06,True,2226,2025-02-08T17:42:14Z
401725579101976801,101976801,PersonalFoul,Foul on KyKy Tandy.,38,19,1st Half,2:31,False,2226,2025-02-08T17:43:01Z
401725579101976802,101976802,MadeFreeThrow,Braeden Carrington made Free Throw.,38,20,1st Half,2:31,True,202,2025-02-08T17:43:01Z
401725579101976803,101976803,MadeFreeThrow,Braeden Carrington made Free Throw.,38,21,1st Half,2:31,True,202,2025-02-08T17:43:01Z
401725579101976804,101976804,MadeFreeThrow,Braeden Carrington made Free Throw.,38,22,1st Half,2:31,True,202,2025-02-08T17:43:01Z
401725579101977601,101977601,Lost Ball Turnover,Niccolo Moretti Turnover.,38,22,1st Half,2:23,False,2226,2025-02-08T17:44:50Z
401725579101979201,101979201,LayUpShot,Ian Smikle missed Layup.,38,22,1st Half,2:07,False,202,2025-02-08T17:45:23Z
401725579101979202,101979202,Offensive Rebound,Tulsa Offensive Rebound.,38,22,1st Half,2:07,False,202,2025-02-08T17:45:23Z
401725579101979501,101979501,JumpShot,Braeden Carrington missed Jumper.,38,22,1st Half,2:04,False,202,2025-02-08T17:45:45Z
401725579101979901,101979901,Defensive Rebound,Ken Evans Jr. Defensive Rebound.,38,22,1st Half,2:00,False,2226,2025-02-08T17:45:48Z
401725579101985101,101985101,JumpShot,Kaleb Glenn missed Three Point Jumper.,38,22,1st Half,1:48,False,2226,2025-02-08T17:46:03Z
401725579101985301,101985301,PersonalFoul,Foul on Matas Vokietaitis.,38,22,1st Half,1:46,False,2226,2025-02-08T17:46:01Z
401725579101985401,101985401,Defensive Rebound,Ian Smikle Defensive Rebound.,38,22,1st Half,1:45,False,202,2025-02-08T17:46:03Z
401725579101986901,101986901,JumpShot,Keaston Willis missed Three Point Jumper.,38,22,1st Half,1:30,False,202,2025-02-08T17:47:03Z
401725579101987301,101987301,Defensive Rebound,Leland Walker Defensive Rebound.,38,22,1st Half,1:26,False,2226,2025-02-08T17:47:03Z
401725579101988001,101988001,JumpShot,Tre Carroll missed Three Point Jumper.,38,22,1st Half,1:19,False,2226,2025-02-08T17:47:11Z
401725579101988301,101988301,Defensive Rebound,Isaiah Barnes Defensive Rebound.,38,22,1st Half,1:16,False,202,2025-02-08T17:47:14Z
401725579101988901,101988901,LayUpShot,Dwon Odom missed Layup.,38,22,1st Half,1:10,False,202,2025-02-08T17:47:20Z
401725579101988902,101988902,Block Shot,Tre Carroll Block.,38,22,1st Half,1:10,False,2226,2025-02-08T17:47:20Z
401725579101989201,101989201,Offensive Rebound,Tulsa Offensive Rebound.,38,22,1st Half,1:07,False,202,2025-02-08T17:47:23Z
401725579101994501,101994501,JumpShot,Tyshawn Archie missed Jumper.,38,22,1st Half,0:54,False,202,2025-02-08T17:47:56Z
401725579101994502,101994502,Block Shot,Tre Carroll Block.,38,22,1st Half,0:54,False,2226,2025-02-08T17:47:56Z
401725579101994901,101994901,Offensive Rebound,Tyshawn Archie Offensive Rebound.,38,22,1st Half,0:50,False,202,2025-02-08T17:48:00Z
401725579101995101,101995101,JumpShot,Dwon Odom missed Jumper.,38,22,1st Half,0:48,False,202,2025-02-08T17:48:06Z
401725579101995601,101995601,Defensive Rebound,KyKy Tandy Defensive Rebound.,38,22,1st Half,0:43,False,2226,2025-02-08T17:48:06Z
401725579101996201,101996201,ShortTimeOut,Florida Atlantic Timeout,38,22,1st Half,0:37,False,2226,2025-02-08T17:48:12Z
401725579101996701,101996701,LayUpShot,Leland Walker made Layup.,40,22,1st Half,0:32,True,2226,2025-02-08T17:49:32Z
401725579101999401,101999401,JumpShot,Isaiah Barnes missed Three Point Jumper.,40,22,1st Half,0:05,False,202,2025-02-08T17:50:00Z
401725579101999601,101999601,PersonalFoul,Foul on Dwon Odom.,40,22,1st Half,0:03,False,202,2025-02-08T17:50:03Z
401725579101999701,101999701,Defensive Rebound,KyKy Tandy Defensive Rebound.,40,22,1st Half,0:02,False,2226,2025-02-08T17:50:03Z
401725579101999901,101999901,End Period,End of 1st half,40,22,1st Half,0:00,False,,2025-02-08T17:50:03Z
401725579102806301,102806301,JumpShot,Jesaiah McWright missed Jumper.,40,22,2nd Half,19:36,False,202,
401725579102806601,102806601,Defensive Rebound,Ken Evans Jr. Defensive Rebound.,40,22,2nd Half,19:33,False,2226,
401725579102809001,102809001,LayUpShot,Tre Carroll missed Layup.,40,22,2nd Half,19:09,False,2226,2025-02-08T18:08:17Z
401725579102809301,102809301,Offensive Rebound,Baba Miller Offensive Rebound.,40,22,2nd Half,19:06,False,2226,2025-02-08T18:08:17Z
401725579102809501,102809501,LayUpShot,Baba Miller made Layup.,42,22,2nd Half,19:04,True,2226,2025-02-08T18:08:19Z
401725579102816001,102816001,LayUpShot,Ian Smikle made Layup. Assisted by Dwon Odom.,42,24,2nd Half,18:39,True,202,2025-02-08T18:08:44Z
401725579102816002,102816002,PersonalFoul,Foul on Tre Carroll.,42,24,2nd Half,18:39,False,2226,2025-02-08T18:08:44Z
401725579102816003,102816003,MadeFreeThrow,Ian Smikle missed Free Throw.,42,24,2nd Half,18:39,False,202,2025-02-08T18:08:44Z
401725579102816101,102816101,Defensive Rebound,Baba Miller Defensive Rebound.,42,24,2nd Half,18:38,False,2226,2025-02-08T18:09:20Z
401725579102817501,102817501,JumpShot,Tre Carroll missed Three Point Jumper.,42,24,2nd Half,18:24,False,2226,2025-02-08T18:09:35Z
401725579102817901,102817901,Defensive Rebound,Isaiah Barnes Defensive Rebound.,42,24,2nd Half,18:20,False,202,2025-02-08T18:09:38Z
401725579102818401,102818401,LayUpShot,Dwon Odom made Layup.,42,26,2nd Half,18:15,True,202,2025-02-08T18:09:41Z
401725579102818402,102818402,PersonalFoul,Foul on Ken Evans Jr..,42,26,2nd Half,18:15,False,2226,2025-02-08T18:09:41Z
401725579102818403,102818403,MadeFreeThrow,Dwon Odom made Free Throw.,42,27,2nd Half,18:15,True,202,2025-02-08T18:09:41Z
401725579102824201,102824201,JumpShot,Baba Miller missed Jumper.,42,27,2nd Half,17:57,False,2226,2025-02-08T18:10:34Z
401725579102824301,102824301,Defensive Rebound,Dwon Odom Defensive Rebound.,42,27,2nd Half,17:56,False,202,2025-02-08T18:10:38Z
401725579102824901,102824901,LayUpShot,Dwon Odom missed Layup.,42,27,2nd Half,17:50,False,202,2025-02-08T18:10:41Z
401725579102824902,102824902,PersonalFoul,Foul on Tre Carroll.,42,27,2nd Half,17:50,False,2226,2025-02-08T18:10:41Z
401725579102825001,102825001,Offensive Rebound,Ian Smikle Offensive Rebound.,42,27,2nd Half,17:49,False,202,2025-02-08T18:10:43Z
401725579102825601,102825601,JumpShot,Keaston Willis missed Three Point Jumper.,42,27,2nd Half,17:43,False,202,2025-02-08T18:11:34Z
401725579102826001,102826001,Defensive Rebound,Matas Vokietaitis Defensive Rebound.,42,27,2nd Half,17:39,False,2226,2025-02-08T18:11:38Z
401725579102827001,102827001,PersonalFoul,Foul on Ian Smikle.,42,27,2nd Half,17:29,False,202,2025-02-08T18:11:47Z
401725579102827002,102827002,MadeFreeThrow,Ken Evans Jr. made Free Throw.,43,27,2nd Half,17:29,True,2226,2025-02-08T18:11:47Z
401725579102827003,102827003,MadeFreeThrow,Ken Evans Jr. missed Free Throw.,43,27,2nd Half,17:29,False,2226,2025-02-08T18:11:47Z
401725579102827101,102827101,Defensive Rebound,Ian Smikle Defensive Rebound.,43,27,2nd Half,17:28,False,202,2025-02-08T18:12:51Z
401725579102828401,102828401,PersonalFoul,Foul on Matas Vokietaitis.,43,27,2nd Half,17:15,False,2226,2025-02-08T18:12:51Z
401725579102829301,102829301,JumpShot,Jesaiah McWright missed Three Point Jumper.,43,27,2nd Half,17:06,False,202,2025-02-08T18:13:39Z
401725579102829601,102829601,Defensive Rebound,Kaleb Glenn Defensive Rebound.,43,27,2nd Half,17:03,False,2226,2025-02-08T18:13:39Z
401725579102834901,102834901,PersonalFoul,Foul on Isaiah Barnes.,43,27,2nd Half,16:50,False,202,2025-02-08T18:13:53Z
401725579102835301,102835301,LayUpShot,Kaleb Glenn made Layup.,45,27,2nd Half,16:46,True,2226,2025-02-08T18:14:22Z
401725579102836901,102836901,JumpShot,Keaston Willis missed Three Point Jumper.,45,27,2nd Half,16:30,False,202,2025-02-08T18:14:41Z
401725579102837301,102837301,Defensive Rebound,Kaleb Glenn Defensive Rebound.,45,27,2nd Half,16:26,False,2226,2025-02-08T18:14:41Z
401725579102839101,102839101,Lost Ball Turnover,Baba Miller Turnover.,45,27,2nd Half,16:08,False,2226,2025-02-08T18:15:01Z
401725579102839102,102839102,Steal,Isaiah Barnes Steal.,45,27,2nd Half,16:08,False,202,2025-02-08T18:15:01Z
401725579102844001,102844001,LayUpShot,Jesaiah McWright made Layup.,45,29,2nd Half,15:59,True,202,2025-02-08T18:15:09Z
401725579102845501,102845501,JumpShot,Ken Evans Jr. missed Three Point Jumper.,45,29,2nd Half,15:44,False,2226,2025-02-08T18:15:24Z
401725579102845801,102845801,Offensive Rebound,Baba Miller Offensive Rebound.,45,29,2nd Half,15:41,False,2226,2025-02-08T18:15:27Z
401725579102845901,102845901,JumpShot,Niccolo Moretti made Three Point Jumper. Assisted by Baba Miller.,48,29,2nd Half,15:40,True,2226,2025-02-08T18:15:27Z
401725579102846201,102846201,ShortTimeOut,Florida Atlantic Timeout,48,29,2nd Half,15:37,False,2226,2025-02-08T18:15:31Z
401725579102846202,102846202,OfficialTVTimeOut,Official TV Timeout,48,29,2nd Half,15:37,False,,2025-02-08T18:15:31Z
401725579102848301,102848301,LayUpShot,Jesaiah McWright missed Layup.,48,29,2nd Half,15:16,False,202,2025-02-08T18:19:54Z
401725579102848601,102848601,Defensive Rebound,Kaleb Glenn Defensive Rebound.,48,29,2nd Half,15:13,False,2226,2025-02-08T18:19:54Z
401725579102854001,102854001,JumpShot,Baba Miller made Three Point Jumper. Assisted by Niccolo Moretti.,51,29,2nd Half,14:59,True,2226,2025-02-08T18:20:09Z
401725579102856901,102856901,JumpShot,Dwon Odom made Jumper.,51,31,2nd Half,14:30,True,202,2025-02-08T18:20:36Z
401725579102858501,102858501,JumpShot,Baba Miller made Three Point Jumper. Assisted by Kaleb Glenn.,54,31,2nd Half,14:14,True,2226,2025-02-08T18:21:04Z
401725579102858901,102858901,OfficialTVTimeOut,Official TV Timeout,54,31,2nd Half,14:10,False,,2025-02-08T18:21:04Z
401725579102865001,102865001,JumpShot,Tyshawn Archie missed Three Point Jumper.,54,31,2nd Half,13:49,False,202,2025-02-08T18:25:29Z
401725579102865301,102865301,Offensive Rebound,Dwon Odom Offensive Rebound.,54,31,2nd Half,13:46,False,202,2025-02-08T18:25:33Z
401725579102866101,102866101,Lost Ball Turnover,Tyshawn Archie Turnover.,54,31,2nd Half,13:38,False,202,2025-02-08T18:25:39Z
401725579102868601,102868601,JumpShot,Devin Vanterpool made Three Point Jumper. Assisted by Baba Miller.,57,31,2nd Half,13:13,True,2226,2025-02-08T18:26:20Z
401725579102874901,102874901,JumpShot,Dwon Odom missed Jumper.,57,31,2nd Half,12:50,False,202,2025-02-08T18:26:43Z
401725579102875201,102875201,Defensive Rebound,Baba Miller Defensive Rebound.,57,31,2nd Half,12:47,False,2226,2025-02-08T18:26:57Z
401725579102876401,102876401,PersonalFoul,Foul on Tyshawn Archie.,57,31,2nd Half,12:35,False,202,2025-02-08T18:26:57Z
401725579102877001,102877001,JumpShot,Kaleb Glenn missed Three Point Jumper.,57,31,2nd Half,12:29,False,2226,2025-02-08T18:27:32Z
401725579102877301,102877301,Defensive Rebound,Braeden Carrington Defensive Rebound.,57,31,2nd Half,12:26,False,202,2025-02-08T18:27:36Z
401725579102877302,102877302,PersonalFoul,Foul on Devin Vanterpool.,57,31,2nd Half,12:26,False,2226,2025-02-08T18:27:36Z
401725579102878801,102878801,JumpShot,Keaston Willis missed Three Point Jumper.,57,31,2nd Half,12:11,False,202,2025-02-08T18:28:08Z
401725579102879201,102879201,Offensive Rebound,Tyshawn Archie Offensive Rebound.,57,31,2nd Half,12:07,False,202,2025-02-08T18:28:11Z
401725579102879301,102879301,JumpShot,Tyshawn Archie made Jumper.,57,33,2nd Half,12:06,True,202,2025-02-08T18:28:11Z
401725579102885001,102885001,LayUpShot,Leland Walker missed Layup.,57,33,2nd Half,11:49,False,2226,2025-02-08T18:28:28Z
401725579102885301,102885301,Offensive Rebound,Baba Miller Offensive Rebound.,57,33,2nd Half,11:46,False,2226,2025-02-08T18:28:28Z
