play_id,sequence_number,type,description,away_score,home_score,period,clock,scoring_play,team_id,timestamp_utc
401706303102874901,102874901,Defensive Rebound,Lloyd McVeigh Defensive Rebound.,52,67,2nd Half,12:50,False,2084,2025-01-04T19:21:42Z
401706303102876201,102876201,PersonalFoul,Foul on Reece Potter.,52,67,2nd Half,12:37,False,193,2025-01-04T19:21:54Z
401706303102877601,102877601,Lost Ball Turnover,Ryan Sabol Turnover.,52,67,2nd Half,12:23,False,2084,2025-01-04T19:22:31Z
401706303102877602,102877602,Steal,Brant Byers Steal.,52,67,2nd Half,12:23,False,193,2025-01-04T19:22:31Z
401706303102878901,102878901,JumpShot,Reece Potter missed Three Point Jumper.,52,67,2nd Half,12:10,False,193,2025-01-04T19:22:42Z
401706303102879101,102879101,Defensive Rebound,Lloyd McVeigh Defensive Rebound.,52,67,2nd Half,12:08,False,2084,2025-01-04T19:22:46Z
401706303102884501,102884501,PersonalFoul,Foul on Reece Potter.,52,67,2nd Half,11:54,False,193,2025-01-04T19:22:59Z
401706303102884502,102884502,OfficialTVTimeOut, Official TV Timeout,52,67,2nd Half,11:54,False,,2025-01-04T19:22:59Z
401706303102885201,102885201,LayUpShot,Tim Oboh made Layup.,54,67,2nd Half,11:47,True,2084,2025-01-04T19:26:06Z
401706303102887101,102887101,PersonalFoul,Foul on Tim Oboh.,54,67,2nd Half,11:28,False,2084,2025-01-04T19:26:25Z
401706303102888201,102888201,JumpShot,Brant Byers made Three Point Jumper. Assisted by Mekhi Cooper.,54,70,2nd Half,11:17,True,193,2025-01-04T19:27:04Z
401706303102894801,102894801,JumpShot,Kavon Bradford missed Jumper.,54,70,2nd Half,10:51,False,2084,2025-01-04T19:27:31Z
401706303102895101,102895101,Defensive Rebound,Brant Byers Defensive Rebound.,54,70,2nd Half,10:48,False,193,2025-01-04T19:27:35Z
401706303102896501,102896501,Lost Ball Turnover,Antwone Woolfolk Turnover.,54,70,2nd Half,10:34,False,193,2025-01-04T19:27:47Z
401706303102897101,102897101,Lost Ball Turnover,Kavon Bradford Turnover.,54,70,2nd Half,10:28,False,2084,2025-01-04T19:28:22Z
401706303102897701,102897701,JumpShot,Luke Skaljac missed Three Point Jumper.,54,70,2nd Half,10:22,False,193,2025-01-04T19:28:48Z
401706303102898001,102898001,Defensive Rebound,Kavon Bradford Defensive Rebound.,54,70,2nd Half,10:19,False,2084,2025-01-04T19:28:48Z
401706303102898401,102898401,LayUpShot,Kavon Bradford made Layup.,56,70,2nd Half,10:15,True,2084,2025-01-04T19:28:56Z
401706303102904201,102904201,JumpShot,Brant Byers made Three Point Jumper. Assisted by Mekhi Cooper.,56,73,2nd Half,9:57,True,193,2025-01-04T19:29:14Z
401706303102907201,102907201,JumpShot,Noah Batchelor missed Three Point Jumper.,56,73,2nd Half,9:27,False,2084,2025-01-04T19:29:45Z
401706303102907401,102907401,Defensive Rebound,Brant Byers Defensive Rebound.,56,73,2nd Half,9:25,False,193,2025-01-04T19:29:45Z
401706303102909301,102909301,JumpShot,Peter Suder missed Jumper.,56,73,2nd Half,9:06,False,193,2025-01-04T19:30:09Z
401706303102909501,102909501,Defensive Rebound,Ryan Sabol Defensive Rebound.,56,73,2nd Half,9:04,False,2084,2025-01-04T19:30:09Z
401706303102914201,102914201,JumpShot,Ryan Sabol missed Three Point Jumper.,56,73,2nd Half,8:57,False,2084,2025-01-04T19:30:13Z
401706303102914501,102914501,Defensive Rebound,Miami (OH) Defensive Rebound.,56,73,2nd Half,8:54,False,193,2025-01-04T19:30:45Z
401706303102916801,102916801,LayUpShot,Kam Craft missed Layup.,56,73,2nd Half,8:31,False,193,2025-01-04T19:31:15Z
401706303102917001,102917001,Defensive Rebound,Anquan Boldin Jr. Defensive Rebound.,56,73,2nd Half,8:29,False,2084,2025-01-04T19:31:15Z
401706303102917401,102917401,JumpShot,Kavon Bradford missed Jumper.,56,73,2nd Half,8:25,False,2084,2025-01-04T19:31:17Z
401706303102917901,102917901,Defensive Rebound,Reece Potter Defensive Rebound.,56,73,2nd Half,8:20,False,193,2025-01-04T19:31:23Z
401706303102919801,102919801,JumpShot,Reece Potter missed Jumper.,56,73,2nd Half,8:01,False,193,2025-01-04T19:31:45Z
401706303102919802,102919802,Block Shot,Ben Michaels Block.,56,73,2nd Half,8:01,False,2084,2025-01-04T19:31:45Z
401706303102919803,102919803,Offensive Rebound,Miami (OH) Offensive Rebound.,56,73,2nd Half,8:01,False,193,2025-01-04T19:31:45Z
401706303102924101,102924101,JumpShot,Mekhi Cooper missed Jumper.,56,73,2nd Half,7:58,False,193,2025-01-04T19:32:04Z
401706303102924102,102924102,Block Shot,Kavon Bradford Block.,56,73,2nd Half,7:58,False,2084,2025-01-04T19:32:04Z
401706303102924601,102924601,Defensive Rebound,Kavon Bradford Defensive Rebound.,56,73,2nd Half,7:53,False,2084,2025-01-04T19:32:10Z
401706303102924901,102924901,JumpShot,Anquan Boldin Jr. missed Jumper.,56,73,2nd Half,7:50,False,2084,2025-01-04T19:32:12Z
401706303102924902,102924902,Defensive Rebound,Reece Potter Defensive Rebound.,56,73,2nd Half,7:50,False,193,2025-01-04T19:32:12Z
401706303102924903,102924903,PersonalFoul,Foul on Noah Batchelor.,56,73,2nd Half,7:50,False,2084,2025-01-04T19:32:12Z
401706303102924904,102924904,OfficialTVTimeOut, Official TV Timeout,56,73,2nd Half,7:50,False,,2025-01-04T19:32:12Z
401706303102926101,102926101,JumpShot,Kam Craft made Three Point Jumper. Assisted by Mekhi Cooper.,56,76,2nd Half,7:38,True,193,2025-01-04T19:35:02Z
401706303102927401,102927401,LayUpShot,Ben Michaels missed Layup.,56,76,2nd Half,7:25,False,2084,2025-01-04T19:35:17Z
401706303102927601,102927601,Defensive Rebound,Kam Craft Defensive Rebound.,56,76,2nd Half,7:23,False,193,2025-01-04T19:35:17Z
401706303102929501,102929501,JumpShot,Kam Craft missed Jumper.,56,76,2nd Half,7:04,False,193,2025-01-04T19:35:38Z
401706303102929701,102929701,Offensive Rebound,Eian Elmer Offensive Rebound.,56,76,2nd Half,7:02,False,193,2025-01-04T19:35:38Z
401706303102935301,102935301,JumpShot,Peter Suder missed Jumper.,56,76,2nd Half,6:46,False,193,2025-01-04T19:35:57Z
401706303102935601,102935601,Defensive Rebound,Lloyd McVeigh Defensive Rebound.,56,76,2nd Half,6:43,False,2084,2025-01-04T19:35:57Z
401706303102936301,102936301,JumpShot,Lloyd McVeigh made Three Point Jumper. Assisted by Ryan Sabol.,59,76,2nd Half,6:36,True,2084,2025-01-04T19:36:04Z
401706303102938502,102938502,Lost Ball Turnover,Mekhi Cooper Turnover.,59,76,2nd Half,6:14,False,193,2025-01-04T19:36:26Z
401706303102938503,102938503,Steal,Ryan Sabol Steal.,59,76,2nd Half,6:14,False,2084,2025-01-04T19:36:26Z
401706303102939601,102939601,JumpShot,Lloyd McVeigh missed Three Point Jumper.,59,76,2nd Half,6:03,False,2084,2025-01-04T19:36:39Z
401706303102939801,102939801,Defensive Rebound,Reece Potter Defensive Rebound.,59,76,2nd Half,6:01,False,193,2025-01-04T19:36:39Z
401706303102945201,102945201,LayUpShot,Reece Potter made Layup. Assisted by Kam Craft.,59,78,2nd Half,5:47,True,193,2025-01-04T19:36:53Z
401706303102947401,102947401,LayUpShot,Tyson Dunn made Layup.,61,78,2nd Half,5:25,True,2084,2025-01-04T19:37:14Z
401706303102948001,102948001,Lost Ball Turnover,Peter Suder Turnover.,61,78,2nd Half,5:19,False,193,2025-01-04T19:37:20Z
401706303102948002,102948002,Steal,Ryan Sabol Steal.,61,78,2nd Half,5:19,False,2084,2025-01-04T19:37:24Z
401706303102948301,102948301,LayUpShot,Bryson Wilson made Layup.,63,78,2nd Half,5:16,True,2084,2025-01-04T19:37:24Z
401706303102948302,102948302,PersonalFoul,Foul on Peter Suder.,63,78,2nd Half,5:16,False,193,2025-01-04T19:37:24Z
401706303102948303,102948303,MadeFreeThrow,Bryson Wilson made Free Throw.,64,78,2nd Half,5:16,True,2084,2025-01-04T19:37:24Z
401706303102949501,102949501,JumpShot,Evan Ipsaro missed Three Point Jumper.,64,78,2nd Half,5:04,False,193,2025-01-04T19:38:29Z
401706303102949701,102949701,Defensive Rebound,Lloyd McVeigh Defensive Rebound.,64,78,2nd Half,5:02,False,2084,2025-01-04T19:38:34Z
401706303102955101,102955101,LayUpShot,Noah Batchelor made Layup. Assisted by Ben Michaels.,66,78,2nd Half,4:48,True,2084,2025-01-04T19:38:47Z
401706303102955201,102955201,ShortTimeOut,Miami (OH)  Timeout,66,78,2nd Half,4:47,False,193,2025-01-04T19:38:47Z
401706303102957701,102957701,LayUpShot,Peter Suder missed Layup.,66,78,2nd Half,4:22,False,193,2025-01-04T19:40:23Z
401706303102958001,102958001,Offensive Rebound,Antwone Woolfolk Offensive Rebound.,66,78,2nd Half,4:19,False,193,2025-01-04T19:40:27Z
401706303102958002,102958002,TipShot,Antwone Woolfolk made Two Point Tip Shot.,66,80,2nd Half,4:19,True,193,2025-01-04T19:40:27Z
401706303102958201,102958201,PersonalFoul,Foul on Kam Craft.,66,80,2nd Half,4:17,False,193,2025-01-04T19:40:28Z
401706303102958202,102958202,MadeFreeThrow,Ryan Sabol made Free Throw.,67,80,2nd Half,4:17,True,2084,2025-01-04T19:40:45Z
401706303102958203,102958203,MadeFreeThrow,Ryan Sabol made Free Throw.,68,80,2nd Half,4:17,True,2084,2025-01-04T19:40:45Z
401706303102965201,102965201,JumpShot,Kam Craft missed Three Point Jumper.,68,80,2nd Half,3:47,False,193,2025-01-04T19:42:27Z
401706303102965501,102965501,Offensive Rebound,Antwone Woolfolk Offensive Rebound.,68,80,2nd Half,3:44,False,193,2025-01-04T19:42:27Z
401706303102965601,102965601,Lost Ball Turnover,Antwone Woolfolk Turnover.,68,80,2nd Half,3:43,False,193,2025-01-04T19:42:27Z
401706303102965602,102965602,Steal,Tyson Dunn Steal.,68,80,2nd Half,3:43,False,2084,2025-01-04T19:42:27Z
401706303102966501,102966501,PersonalFoul,Foul on Antwone Woolfolk.,68,80,2nd Half,3:34,False,193,2025-01-04T19:42:36Z
401706303102966502,102966502,OfficialTVTimeOut, Official TV Timeout,68,80,2nd Half,3:34,False,,2025-01-04T19:42:36Z
401706303102966503,102966503,MadeFreeThrow,Tyson Dunn made Free Throw.,69,80,2nd Half,3:34,True,2084,2025-01-04T19:42:36Z
401706303102966504,102966504,MadeFreeThrow,Tyson Dunn made Free Throw.,70,80,2nd Half,3:34,True,2084,2025-01-04T19:42:36Z
401706303102969501,102969501,JumpShot,Mekhi Cooper made Three Point Jumper. Assisted by Evan Ipsaro.,70,83,2nd Half,3:04,True,193,2025-01-04T19:46:34Z
401706303102975101,102975101,LayUpShot,Ryan Sabol missed Layup.,70,83,2nd Half,2:48,False,2084,2025-01-04T19:46:54Z
401706303102975401,102975401,Offensive Rebound,Ben Michaels Offensive Rebound.,70,83,2nd Half,2:45,False,2084,2025-01-04T19:46:54Z
401706303102975402,102975402,TipShot,Ben Michaels made Two Point Tip Shot.,72,83,2nd Half,2:45,True,2084,2025-01-04T19:46:54Z
401706303102978401,102978401,JumpShot,Mekhi Cooper missed Jumper.,72,83,2nd Half,2:15,False,193,2025-01-04T19:48:19Z
401706303102978901,102978901,Offensive Rebound,Antwone Woolfolk Offensive Rebound.,72,83,2nd Half,2:10,False,193,2025-01-04T19:48:19Z
401706303102978902,102978902,TipShot,Antwone Woolfolk missed Two Point Tip Shot.,72,83,2nd Half,2:10,False,193,2025-01-04T19:48:19Z
401706303102979001,102979001,Offensive Rebound,Antwone Woolfolk Offensive Rebound.,72,83,2nd Half,2:09,False,193,2025-01-04T19:48:19Z
401706303102979002,102979002,TipShot,Antwone Woolfolk missed Two Point Tip Shot.,72,83,2nd Half,2:09,False,193,2025-01-04T19:48:22Z
401706303102979301,102979301,Offensive Rebound,Antwone Woolfolk Offensive Rebound.,72,83,2nd Half,2:06,False,193,2025-01-04T19:48:22Z
401706303102979302,102979302,TipShot,Antwone Woolfolk made Two Point Tip Shot.,72,85,2nd Half,2:06,True,193,2025-01-04T19:48:22Z
401706303102984301,102984301,LayUpShot,Ryan Sabol made Layup.,74,85,2nd Half,1:56,True,2084,2025-01-04T19:48:30Z
401706303102984302,102984302,ShortTimeOut,Buffalo  Timeout,74,85,2nd Half,1:56,False,2084,2025-01-04T19:48:30Z
401706303102984702,102984702,PersonalFoul,Foul on Anquan Boldin Jr..,74,85,2nd Half,1:52,False,2084,2025-01-04T19:50:04Z
401706303102984703,102984703,MadeFreeThrow,Mekhi Cooper missed Free Throw.,74,85,2nd Half,1:52,False,193,2025-01-04T19:50:25Z
401706303102984704,102984704,Defensive Rebound,Ben Michaels Defensive Rebound.,74,85,2nd Half,1:52,False,2084,2025-01-04T19:50:25Z
401706303102985401,102985401,DunkShot,Anquan Boldin Jr. made Dunk.,76,85,2nd Half,1:45,True,2084,2025-01-04T19:50:54Z
401706303102987101,102987101,JumpShot,Kam Craft made Three Point Jumper. Assisted by Mekhi Cooper.,76,88,2nd Half,1:28,True,193,2025-01-04T19:51:10Z
401706303102987901,102987901,PersonalFoul,Foul on Kam Craft.,76,88,2nd Half,1:20,False,193,2025-01-04T19:51:19Z
401706303102987902,102987902,MadeFreeThrow,Ryan Sabol made Free Throw.,77,88,2nd Half,1:20,True,2084,2025-01-04T19:51:19Z
401706303102987903,102987903,MadeFreeThrow,Ryan Sabol missed Free Throw.,77,88,2nd Half,1:20,False,2084,2025-01-04T19:51:19Z
401706303102988601,102988601,Defensive Rebound,Peter Suder Defensive Rebound.,77,88,2nd Half,1:13,False,193,2025-01-04T19:52:20Z
401706303102989901,102989901,JumpShot,Kam Craft made Three Point Jumper. Assisted by Evan Ipsaro.,77,91,2nd Half,1:00,True,193,2025-01-04T19:52:33Z
401706303102995501,102995501,Lost Ball Turnover,Ben Michaels Turnover.,77,91,2nd Half,0:44,False,2084,2025-01-04T19:53:26Z
401706303102995901,102995901,PersonalFoul,Foul on Bryson Wilson.,77,91,2nd Half,0:40,False,2084,2025-01-04T19:53:52Z
401706303102995902,102995902,MadeFreeThrow,Mekhi Cooper made Free Throw.,77,92,2nd Half,0:40,True,193,2025-01-04T19:53:52Z
401706303102995903,102995903,MadeFreeThrow,Mekhi Cooper missed Free Throw.,77,92,2nd Half,0:40,False,193,2025-01-04T19:53:52Z
401706303102996101,102996101,Defensive Rebound,Lloyd McVeigh Defensive Rebound.,77,92,2nd Half,0:38,False,2084,2025-01-04T19:55:22Z
401706303102996501,102996501,PersonalFoul,Foul on Ben Michaels.,77,92,2nd Half,0:34,False,2084,2025-01-04T19:55:28Z
401706303102996502,102996502,Lost Ball Turnover,Ben Michaels Turnover.,77,92,2nd Half,0:34,False,2084,2025-01-04T19:55:28Z
401706303102997101,102997101,ShortTimeOut,Miami (OH)  Timeout,77,92,2nd Half,0:28,False,193,2025-01-04T19:55:56Z
401706303102997701,102997701,PersonalFoul,Foul on Anquan Boldin Jr..,77,92,2nd Half,0:22,False,2084,2025-01-04T19:57:27Z
401706303102997702,102997702,MadeFreeThrow,Mekhi Cooper made Free Throw.,77,93,2nd Half,0:22,True,193,2025-01-04T19:57:27Z
401706303102997703,102997703,MadeFreeThrow,Mekhi Cooper missed Free Throw.,77,93,2nd Half,0:22,False,193,2025-01-04T19:57:27Z
401706303102997901,102997901,Defensive Rebound,Bryson Wilson Defensive Rebound.,77,93,2nd Half,0:20,False,2084,2025-01-04T19:58:12Z
401706303102998601,102998601,LayUpShot,Ryan Sabol made Layup. Assisted by Lloyd McVeigh.,79,93,2nd Half,0:13,True,2084,2025-01-04T19:58:17Z
401706303102999901,102999901,End Period,End of 2nd half,79,93,2nd Half,0:00,False,,2025-01-04T19:58:31Z
401706303102999902,102999902,End Game,End of Game,79,93,2nd Half,0:00,False,,2025-01-04T19:58:31Z
