play_id,sequence_number,type,description,away_score,home_score,period,clock,scoring_play,team_id,timestamp_utc
401706176101804801,101804801,LayUpShot,Dola Adebayo made Layup. Assisted by Xavier Lipscomb.,2,0,1st Half,19:51,True,116,2024-12-07T00:03:25Z
401706176101807501,101807501,JumpShot,Jaden Daughtry made Three Point Jumper. Assisted by Jackson Price.,2,3,1st Half,19:24,True,2368,2024-12-07T00:03:56Z
401706176101809001,101809001,LayUpShot,Jedy Cordilia made Layup. Assisted by Dola Adebayo.,4,3,1st Half,19:09,True,116,2024-12-07T00:04:07Z
401706176101815201,101815201,LayUpShot,Jackson Price made Layup. Assisted by Jaden Daughtry.,4,5,1st Half,18:47,True,2368,2024-12-07T00:04:30Z
401706176101816201,101816201,Lost Ball Turnover,Dola Adebayo Turnover.,4,5,1st Half,18:37,False,116,2024-12-07T00:04:41Z
401706176101818701,101818701,JumpShot,Jackson Price made Three Point Jumper. Assisted by Elijah Lewis.,4,8,1st Half,18:12,True,2368,2024-12-07T00:05:21Z
401706176101824501,101824501,Lost Ball Turnover,Dola Adebayo Turnover.,4,8,1st Half,17:54,False,116,2024-12-07T00:05:38Z
401706176101824502,101824502,Steal,Jaden Daughtry Steal.,4,8,1st Half,17:54,False,2368,2024-12-07T00:05:38Z
401706176101824901,101824901,LayUpShot,Jaden Daughtry missed Layup.,4,8,1st Half,17:50,False,2368,2024-12-07T00:05:45Z
401706176101825201,101825201,Defensive Rebound,Jedy Cordilia Defensive Rebound.,4,8,1st Half,17:47,False,116,2024-12-07T00:05:45Z
401706176101827101,101827101,JumpShot,Dola Adebayo missed Jumper.,4,8,1st Half,17:28,False,116,2024-12-07T00:06:08Z
401706176101827401,101827401,Defensive Rebound,Jaden Daughtry Defensive Rebound.,4,8,1st Half,17:25,False,2368,2024-12-07T00:06:08Z
401706176101828901,101828901,LayUpShot,Jackson Price missed Layup.,4,8,1st Half,17:10,False,2368,2024-12-07T00:06:25Z
401706176101829201,101829201,Defensive Rebound,Xavier Lipscomb Defensive Rebound.,4,8,1st Half,17:07,False,116,2024-12-07T00:06:25Z
401706176101829501,101829501,LayUpShot,Dallas Hobbs made Layup. Assisted by Xavier Lipscomb.,6,8,1st Half,17:04,True,116,2024-12-07T00:06:29Z
401706176101835601,101835601,JumpShot,Josh Pascarelli missed Jumper.,6,8,1st Half,16:43,False,2368,2024-12-07T00:06:52Z
401706176101835801,101835801,Defensive Rebound,Dallas Hobbs Defensive Rebound.,6,8,1st Half,16:41,False,116,2024-12-07T00:06:52Z
401706176101836101,101836101,JumpShot,Xavier Lipscomb missed Three Point Jumper.,6,8,1st Half,16:38,False,116,2024-12-07T00:06:55Z
401706176101836501,101836501,Defensive Rebound,Jadin Collins-Roberts Defensive Rebound.,6,8,1st Half,16:34,False,2368,2024-12-07T00:06:58Z
401706176101837601,101837601,JumpShot,Josh Pascarelli missed Three Point Jumper.,6,8,1st Half,16:23,False,2368,2024-12-07T00:07:10Z
401706176101837901,101837901,Defensive Rebound,Dola Adebayo Defensive Rebound.,6,8,1st Half,16:20,False,116,2024-12-07T00:07:13Z
401706176101839701,101839701,JumpShot,Terrell Ard Jr. missed Jumper.,6,8,1st Half,16:02,False,116,2024-12-07T00:08:02Z
401706176101844101,101844101,Defensive Rebound,Parby Kabamba Defensive Rebound.,6,8,1st Half,15:58,False,2368,2024-12-07T00:08:02Z
401706176101846401,101846401,JumpShot,Elijah Lewis missed Jumper.,6,8,1st Half,15:35,False,2368,2024-12-07T00:08:30Z
401706176101846901,101846901,Defensive Rebound,Jedy Cordilia Defensive Rebound.,6,8,1st Half,15:30,False,116,2024-12-07T00:08:30Z
401706176101847901,101847901,JumpShot,Dallas Hobbs missed Jumper.,6,8,1st Half,15:20,False,116,2024-12-07T00:08:41Z
401706176101847902,101847902,Block Shot,Martin Kawa Block.,6,8,1st Half,15:20,False,2368,2024-12-07T00:08:41Z
401706176101848401,101848401,Defensive Rebound,Martin Kawa Defensive Rebound.,6,8,1st Half,15:15,False,2368,2024-12-07T00:08:48Z
401706176101848601,101848601,PersonalFoul,Foul on Dallas Hobbs.,6,8,1st Half,15:13,False,116,2024-12-07T00:08:51Z
401706176101848602,101848602,OfficialTVTimeOut, Official TV Timeout,6,8,1st Half,15:13,False,,2024-12-07T00:08:51Z
401706176101849301,101849301,JumpShot,Parby Kabamba made Three Point Jumper. Assisted by Martin Kawa.,6,11,1st Half,15:06,True,2368,2024-12-07T00:11:47Z
401706176101854801,101854801,LayUpShot,Terrell Ard Jr. made Layup. Assisted by Dallas Hobbs.,8,11,1st Half,14:51,True,116,2024-12-07T00:11:59Z
401706176101857901,101857901,Lost Ball Turnover,Parby Kabamba Turnover.,8,11,1st Half,14:20,False,2368,2024-12-07T00:12:54Z
401706176101864501,101864501,JumpShot,Javon Ervin missed Three Point Jumper.,8,11,1st Half,13:54,False,116,2024-12-07T00:13:47Z
401706176101864801,101864801,Defensive Rebound,Elijah Lewis Defensive Rebound.,8,11,1st Half,13:51,False,2368,2024-12-07T00:13:47Z
401706176101865401,101865401,PersonalFoul,Foul on Abdou Khadre Kebe.,8,11,1st Half,13:45,False,116,2024-12-07T00:13:55Z
401706176101866501,101866501,Lost Ball Turnover,Parby Kabamba Turnover.,8,11,1st Half,13:34,False,2368,2024-12-07T00:14:21Z
401706176101868101,101868101,PersonalFoul,Foul on Jaden Daughtry.,8,11,1st Half,13:18,False,2368,2024-12-07T00:14:54Z
401706176101868102,101868102,MadeFreeThrow,Dola Adebayo missed Free Throw.,8,11,1st Half,13:18,False,116,2024-12-07T00:14:54Z
401706176101868103,101868103,Dead Ball Rebound,Mount St. Mary's Deadball Team Rebound.,8,11,1st Half,13:18,False,116,2024-12-07T00:14:54Z
401706176101868104,101868104,MadeFreeThrow,Dola Adebayo made Free Throw.,9,11,1st Half,13:18,True,116,2024-12-07T00:15:35Z
401706176101869301,101869301,Lost Ball Turnover,Martin Kawa Turnover.,9,11,1st Half,13:06,False,2368,2024-12-07T00:16:09Z
401706176101869302,101869302,Steal,Terrell Ard Jr. Steal.,9,11,1st Half,13:06,False,116,2024-12-07T00:16:09Z
401706176101869303,101869303,PersonalFoul,Foul on Jadin Collins-Roberts.,9,11,1st Half,13:06,False,2368,2024-12-07T00:16:09Z
401706176101869304,101869304,MadeFreeThrow,Terrell Ard Jr. missed Free Throw.,9,11,1st Half,13:06,False,116,2024-12-07T00:16:09Z
401706176101869305,101869305,Dead Ball Rebound,Mount St. Mary's Deadball Team Rebound.,9,11,1st Half,13:06,False,116,2024-12-07T00:16:09Z
401706176101869501,101869501,MadeFreeThrow,Terrell Ard Jr. missed Free Throw.,9,11,1st Half,13:04,False,116,2024-12-07T00:17:10Z
401706176101869601,101869601,Defensive Rebound,Jaden Daughtry Defensive Rebound.,9,11,1st Half,13:03,False,2368,2024-12-07T00:17:10Z
401706176101876101,101876101,JumpShot,Travis Roberts made Three Point Jumper. Assisted by Jackson Price.,9,14,1st Half,12:38,True,2368,2024-12-07T00:17:36Z
401706176101878501,101878501,JumpShot,Xavier Lipscomb made Three Point Jumper.,12,14,1st Half,12:14,True,116,2024-12-07T00:17:59Z
401706176101884501,101884501,LayUpShot,Jadin Collins-Roberts missed Layup.,12,14,1st Half,11:54,False,2368,2024-12-07T00:18:21Z
401706176101884801,101884801,Offensive Rebound,Travis Roberts Offensive Rebound.,12,14,1st Half,11:51,False,2368,2024-12-07T00:18:21Z
401706176101885001,101885001,JumpShot,Jackson Price missed Three Point Jumper.,12,14,1st Half,11:49,False,2368,2024-12-07T00:18:25Z
401706176101885301,101885301,Defensive Rebound,Terrell Ard Jr. Defensive Rebound.,12,14,1st Half,11:46,False,116,2024-12-07T00:18:28Z
401706176101886601,101886601,LayUpShot,Terrell Ard Jr. made Layup. Assisted by Javon Ervin.,14,14,1st Half,11:33,True,116,2024-12-07T00:18:39Z
401706176101889101,101889101,JumpShot,Josh Pascarelli made Jumper.,14,16,1st Half,11:08,True,2368,2024-12-07T00:19:04Z
401706176101895301,101895301,Lost Ball Turnover,Dola Adebayo Turnover.,14,16,1st Half,10:46,False,116,2024-12-07T00:19:27Z
401706176101895302,101895302,Steal,Josh Pascarelli Steal.,14,16,1st Half,10:46,False,2368,2024-12-07T00:19:27Z
401706176101896401,101896401,JumpShot,Josh Pascarelli made Jumper.,14,18,1st Half,10:35,True,2368,2024-12-07T00:19:38Z
401706176101898701,101898701,LayUpShot,Terrell Ard Jr. made Layup.,16,18,1st Half,10:12,True,116,2024-12-07T00:20:01Z
401706176101905301,101905301,JumpShot,Josh Pascarelli missed Three Point Jumper.,16,18,1st Half,9:46,False,2368,2024-12-07T00:20:31Z
401706176101905601,101905601,Defensive Rebound,Javon Ervin Defensive Rebound.,16,18,1st Half,9:43,False,116,2024-12-07T00:20:31Z
401706176101906501,101906501,JumpShot,Javon Ervin made Jumper.,18,18,1st Half,9:34,True,116,2024-12-07T00:20:39Z
401706176101908601,101908601,JumpShot,Travis Roberts missed Three Point Jumper.,18,18,1st Half,9:13,False,2368,2024-12-07T00:21:04Z
401706176101908901,101908901,Defensive Rebound,Dola Adebayo Defensive Rebound.,18,18,1st Half,9:10,False,116,2024-12-07T00:21:04Z
401706176101914601,101914601,JumpShot,Xavier Lipscomb missed Three Point Jumper.,18,18,1st Half,8:53,False,116,2024-12-07T00:21:22Z
401706176101915001,101915001,Defensive Rebound,Jackson Price Defensive Rebound.,18,18,1st Half,8:49,False,2368,2024-12-07T00:21:24Z
401706176101915901,101915901,JumpShot,Jaden Daughtry missed ,18,18,1st Half,8:40,False,2368,2024-12-07T00:21:32Z
401706176101916201,101916201,Defensive Rebound,Terrell Ard Jr. Defensive Rebound.,18,18,1st Half,8:37,False,116,2024-12-07T00:21:36Z
401706176101916901,101916901,JumpShot,Javon Ervin missed Jumper.,18,18,1st Half,8:30,False,116,2024-12-07T00:21:46Z
401706176101917201,101917201,Defensive Rebound,Jackson Price Defensive Rebound.,18,18,1st Half,8:27,False,2368,2024-12-07T00:21:46Z
401706176101919601,101919601,JumpShot,Josh Pascarelli made Jumper.,18,20,1st Half,8:03,True,2368,2024-12-07T00:22:11Z
401706176101926201,101926201,Lost Ball Turnover,Dola Adebayo Turnover.,18,20,1st Half,7:37,False,116,2024-12-07T00:22:35Z
401706176101926202,101926202,Steal,Josh Pascarelli Steal.,18,20,1st Half,7:37,False,2368,2024-12-07T00:23:10Z
401706176101926801,101926801,JumpShot,Travis Roberts missed Three Point Jumper.,18,20,1st Half,7:31,False,2368,2024-12-07T00:22:42Z
401706176101927101,101927101,Defensive Rebound,Dola Adebayo Defensive Rebound.,18,20,1st Half,7:28,False,116,2024-12-07T00:22:46Z
401706176101928701,101928701,PersonalFoul,Foul on Josh Pascarelli.,18,20,1st Half,7:12,False,2368,2024-12-07T00:23:10Z
401706176101928702,101928702,OfficialTVTimeOut, Official TV Timeout,18,20,1st Half,7:12,False,,2024-12-07T00:23:10Z
401706176101934601,101934601,JumpShot,Carmelo Pacheco missed Three Point Jumper.,18,20,1st Half,6:53,False,116,2024-12-07T00:26:20Z
401706176101934701,101934701,Offensive Rebound,Jedy Cordilia Offensive Rebound.,18,20,1st Half,6:52,False,116,2024-12-07T00:26:20Z
401706176101934702,101934702,Lost Ball Turnover,Jedy Cordilia Turnover.,18,20,1st Half,6:52,False,116,2024-12-07T00:26:20Z
401706176101934703,101934703,OfficialTVTimeOut, Official TV Timeout,18,20,1st Half,6:52,False,,2024-12-07T00:26:20Z
401706176101936201,101936201,JumpShot,Josh Pascarelli missed Jumper.,18,20,1st Half,6:37,False,2368,2024-12-07T00:29:52Z
401706176101936202,101936202,Defensive Rebound,Jedy Cordilia Defensive Rebound.,18,20,1st Half,6:37,False,116,2024-12-07T00:29:52Z
401706176101938101,101938101,JumpShot,Dallas Hobbs made Jumper.,20,20,1st Half,6:18,True,116,2024-12-07T00:30:22Z
401706176101944701,101944701,JumpShot,Elijah Lewis missed Three Point Jumper.,20,20,1st Half,5:52,False,2368,2024-12-07T00:30:49Z
401706176101944801,101944801,Defensive Rebound,Jedy Cordilia Defensive Rebound.,20,20,1st Half,5:51,False,116,2024-12-07T00:30:49Z
401706176101944802,101944802,Lost Ball Turnover,Jedy Cordilia Turnover.,20,20,1st Half,5:51,False,116,2024-12-07T00:30:49Z
401706176101945301,101945301,JumpShot,Tarik Watson missed ,20,20,1st Half,5:46,False,2368,2024-12-07T00:31:18Z
401706176101945601,101945601,Defensive Rebound,Dallas Hobbs Defensive Rebound.,20,20,1st Half,5:43,False,116,2024-12-07T00:31:22Z
401706176101947001,101947001,JumpShot,Dallas Hobbs missed ,20,20,1st Half,5:29,False,116,2024-12-07T00:31:35Z
401706176101947301,101947301,Defensive Rebound,Elijah Lewis Defensive Rebound.,20,20,1st Half,5:26,False,2368,2024-12-07T00:31:39Z
401706176101948001,101948001,PersonalFoul,Foul on Carmelo Pacheco.,20,20,1st Half,5:19,False,116,2024-12-07T00:31:46Z
401706176101949901,101949901,JumpShot,Jadin Collins-Roberts missed Jumper.,20,20,1st Half,5:00,False,2368,2024-12-07T00:32:38Z
401706176101954301,101954301,Offensive Rebound,Jackson Price Offensive Rebound.,20,20,1st Half,4:56,False,2368,2024-12-07T00:32:38Z
401706176101954501,101954501,JumpShot,Jackson Price missed Three Point Jumper.,20,20,1st Half,4:54,False,2368,2024-12-07T00:32:41Z
401706176101954801,101954801,Offensive Rebound,Jaden Daughtry Offensive Rebound.,20,20,1st Half,4:51,False,2368,2024-12-07T00:32:44Z
401706176101956501,101956501,JumpShot,Josh Pascarelli made Jumper.,20,22,1st Half,4:34,True,2368,2024-12-07T00:33:00Z
401706176101957801,101957801,LayUpShot,Jedy Cordilia made Layup. Assisted by Dallas Hobbs.,22,22,1st Half,4:21,True,116,2024-12-07T00:33:12Z
401706176101959601,101959601,JumpShot,Josh Pascarelli made Jumper.,22,24,1st Half,4:03,True,2368,2024-12-07T00:33:30Z
401706176101965201,101965201,JumpShot,Dallas Hobbs missed Jumper.,22,24,1st Half,3:47,False,116,2024-12-07T00:33:50Z
401706176101965501,101965501,Defensive Rebound,Josh Pascarelli Defensive Rebound.,22,24,1st Half,3:44,False,2368,2024-12-07T00:33:50Z
401706176101966301,101966301,JumpShot,Josh Pascarelli missed Jumper.,22,24,1st Half,3:36,False,2368,2024-12-07T00:34:01Z
401706176101966601,101966601,Defensive Rebound,Jedy Cordilia Defensive Rebound.,22,24,1st Half,3:33,False,116,2024-12-07T00:34:01Z
401706176101968801,101968801,JumpShot,Dallas Hobbs missed Jumper.,22,24,1st Half,3:11,False,116,2024-12-07T00:34:27Z
401706176101969101,101969101,Defensive Rebound,Elijah Lewis Defensive Rebound.,22,24,1st Half,3:08,False,2368,2024-12-07T00:34:27Z
401706176101975001,101975001,LayUpShot,Elijah Lewis made Layup.,22,26,1st Half,2:49,True,2368,2024-12-07T00:34:45Z
401706176101975601,101975601,ShortTimeOut,Mount St. Mary's  Timeout,22,26,1st Half,2:43,False,116,2024-12-07T00:34:52Z
401706176101975602,101975602,OfficialTVTimeOut, Official TV Timeout,22,26,1st Half,2:43,False,,2024-12-07T00:34:52Z
401706176101976901,101976901,JumpShot,Carmelo Pacheco made Three Point Jumper. Assisted by Xavier Lipscomb.,25,26,1st Half,2:30,True,116,2024-12-07T00:38:21Z
401706176101978201,101978201,Lost Ball Turnover,Trace Salton Turnover.,25,26,1st Half,2:17,False,2368,2024-12-07T00:38:36Z
401706176101978202,101978202,Steal,Dallas Hobbs Steal.,25,26,1st Half,2:17,False,116,2024-12-07T00:38:36Z
401706176101978701,101978701,LayUpShot,Dallas Hobbs made Layup.,27,26,1st Half,2:12,True,116,2024-12-07T00:38:40Z
401706176101979901,101979901,Lost Ball Turnover,Jadin Collins-Roberts Turnover.,27,26,1st Half,2:00,False,2368,2024-12-07T00:38:50Z
401706176101986901,101986901,LayUpShot,Dallas Hobbs missed Layup.,27,26,1st Half,1:30,False,116,2024-12-07T00:40:06Z
401706176101987201,101987201,Defensive Rebound,Jason Schofield Defensive Rebound.,27,26,1st Half,1:27,False,2368,2024-12-07T00:40:06Z
401706176101988101,101988101,JumpShot,,27,28,1st Half,1:18,True,2368,2024-12-07T00:40:15Z
401706176101989201,101989201,PersonalFoul,Foul on Caleb Mackrey.,27,28,1st Half,1:07,False,2368,2024-12-07T00:40:28Z
401706176101989202,101989202,MadeFreeThrow,Xavier Lipscomb made Free Throw.,28,28,1st Half,1:07,True,116,2024-12-07T00:40:28Z
401706176101989203,101989203,MadeFreeThrow,Xavier Lipscomb made Free Throw.,29,28,1st Half,1:07,True,116,2024-12-07T00:40:28Z
401706176101994501,101994501,Lost Ball Turnover,Caleb Mackrey Turnover.,29,28,1st Half,0:54,False,2368,2024-12-07T00:41:47Z
401706176101996501,101996501,Lost Ball Turnover,Dallas Hobbs Turnover.,29,28,1st Half,0:34,False,116,2024-12-07T00:42:17Z
401706176101999001,101999001,JumpShot,Josh Pascarelli made Three Point Jumper.,29,31,1st Half,0:09,True,2368,2024-12-07T00:43:09Z
401706176101999901,101999901,End Period,End of 1st half,29,31,1st Half,0:00,False,,2024-12-07T00:43:09Z
401706176102805501,102805501,JumpShot,Josh Pascarelli missed Three Point Jumper.,29,31,2nd Half,19:44,False,2368,
401706176102805601,102805601,Defensive Rebound,Mount St. Mary's Defensive Rebound.,29,31,2nd Half,19:43,False,116,
401706176102808301,102808301,JumpShot,Dallas Hobbs missed Three Point Jumper.,29,31,2nd Half,19:16,False,116,2024-12-07T01:00:51Z
401706176102809001,102809001,Offensive Rebound,Jedy Cordilia Offensive Rebound.,29,31,2nd Half,19:09,False,116,2024-12-07T01:00:57Z
401706176102809401,102809401,LayUpShot,Dola Adebayo made Layup. Assisted by Jedy Cordilia.,31,31,2nd Half,19:05,True,116,2024-12-07T01:01:01Z
401706176102815401,102815401,JumpShot,Jackson Price made Three Point Jumper. Assisted by Josh Pascarelli.,31,34,2nd Half,18:45,True,2368,2024-12-07T01:01:20Z
401706176102818101,102818101,JumpShot,Xavier Lipscomb missed Jumper.,31,34,2nd Half,18:18,False,116,2024-12-07T01:01:52Z
401706176102818401,102818401,Defensive Rebound,Jaden Daughtry Defensive Rebound.,31,34,2nd Half,18:15,False,2368,2024-12-07T01:01:52Z
401706176102819801,102819801,Lost Ball Turnover,Elijah Lewis Turnover.,31,34,2nd Half,18:01,False,2368,2024-12-07T01:02:05Z
401706176102826701,102826701,JumpShot,Xavier Lipscomb missed Three Point Jumper.,31,34,2nd Half,17:32,False,116,2024-12-07T01:02:34Z
401706176102826901,102826901,Defensive Rebound,Marist Defensive Rebound.,31,34,2nd Half,17:30,False,2368,2024-12-07T01:02:38Z
401706176102826902,102826902,PersonalFoul,Foul on Dola Adebayo.,31,34,2nd Half,17:30,False,116,2024-12-07T01:02:38Z
401706176102827501,102827501,JumpShot,Elijah Lewis missed Three Point Jumper.,31,34,2nd Half,17:24,False,2368,2024-12-07T01:03:07Z
401706176102827801,102827801,Defensive Rebound,Dallas Hobbs Defensive Rebound.,31,34,2nd Half,17:21,False,116,2024-12-07T01:03:07Z
401706176102834201,102834201,Lost Ball Turnover,Dallas Hobbs Turnover.,31,34,2nd Half,16:57,False,116,2024-12-07T01:03:31Z
401706176102834202,102834202,Steal,Elijah Lewis Steal.,31,34,2nd Half,16:57,False,2368,2024-12-07T01:03:31Z
401706176102836901,102836901,LayUpShot,Jadin Collins-Roberts made Layup.,31,36,2nd Half,16:30,True,2368,2024-12-07T01:04:01Z
401706176102837101,102837101,ShortTimeOut,Mount St. Mary's  Timeout,31,36,2nd Half,16:28,False,116,2024-12-07T01:04:04Z
401706176102837102,102837102,OfficialTVTimeOut, Official TV Timeout,31,36,2nd Half,16:28,False,,2024-12-07T01:04:04Z
401706176102839301,102839301,JumpShot,Xavier Lipscomb missed Three Point Jumper.,31,36,2nd Half,16:06,False,116,2024-12-07T01:08:04Z
401706176102839501,102839501,Defensive Rebound,Josh Pascarelli Defensive Rebound.,31,36,2nd Half,16:04,False,2368,2024-12-07T01:08:08Z
401706176102844701,102844701,JumpShot,Jadin Collins-Roberts made Three Point Jumper. Assisted by Jaden Daughtry.,31,39,2nd Half,15:52,True,2368,2024-12-07T01:08:18Z
401706176102847301,102847301,JumpShot,Javon Ervin made Jumper.,33,39,2nd Half,15:26,True,116,2024-12-07T01:08:44Z
401706176102854501,102854501,LayUpShot,Jaden Daughtry missed Layup.,33,39,2nd Half,14:54,False,2368,2024-12-07T01:09:20Z
401706176102854901,102854901,Defensive Rebound,Javon Ervin Defensive Rebound.,33,39,2nd Half,14:50,False,116,2024-12-07T01:09:20Z
401706176102856001,102856001,LayUpShot,Javon Ervin missed Layup.,33,39,2nd Half,14:39,False,116,2024-12-07T01:09:35Z
401706176102856301,102856301,Offensive Rebound,Javon Ervin Offensive Rebound.,33,39,2nd Half,14:36,False,116,2024-12-07T01:09:35Z
401706176102856701,102856701,LayUpShot,Terrell Ard Jr. missed Layup.,33,39,2nd Half,14:32,False,116,2024-12-07T01:09:41Z
401706176102857001,102857001,Offensive Rebound,Jedy Cordilia Offensive Rebound.,33,39,2nd Half,14:29,False,116,2024-12-07T01:09:41Z
401706176102857601,102857601,LayUpShot,Xavier Lipscomb made Layup.,35,39,2nd Half,14:23,True,116,2024-12-07T01:09:45Z
401706176102857602,102857602,PersonalFoul,Foul on Jaden Daughtry.,35,39,2nd Half,14:23,False,2368,2024-12-07T01:10:05Z
401706176102857603,102857603,OfficialTVTimeOut, Official TV Timeout,35,39,2nd Half,14:23,False,,2024-12-07T01:10:09Z
401706176102857604,102857604,MadeFreeThrow,Xavier Lipscomb made Free Throw.,36,39,2nd Half,14:23,True,116,2024-12-07T01:10:09Z
401706176102858701,102858701,Lost Ball Turnover,Marist  Turnover.,36,39,2nd Half,14:12,False,2368,2024-12-07T01:13:32Z
401706176102859601,102859601,JumpShot,Javon Ervin missed Three Point Jumper.,36,39,2nd Half,14:03,False,116,2024-12-07T01:14:03Z
401706176102859701,102859701,Defensive Rebound,Marist Defensive Rebound.,36,39,2nd Half,14:02,False,2368,2024-12-07T01:14:03Z
401706176102864701,102864701,Lost Ball Turnover,Josh Pascarelli Turnover.,36,39,2nd Half,13:52,False,2368,2024-12-07T01:14:28Z
401706176102864702,102864702,Steal,Javon Ervin Steal.,36,39,2nd Half,13:52,False,116,2024-12-07T01:14:32Z
401706176102865201,102865201,PersonalFoul,Foul on Josh Pascarelli.,36,39,2nd Half,13:47,False,2368,2024-12-07T01:14:37Z
401706176102865801,102865801,JumpShot,Dola Adebayo missed Three Point Jumper.,36,39,2nd Half,13:41,False,116,2024-12-07T01:15:16Z
401706176102866201,102866201,Offensive Rebound,Terrell Ard Jr. Offensive Rebound.,36,39,2nd Half,13:37,False,116,2024-12-07T01:15:16Z
401706176102866501,102866501,LayUpShot,Javon Ervin made Layup. Assisted by Terrell Ard Jr..,38,39,2nd Half,13:34,True,116,2024-12-07T01:15:20Z
401706176102867601,102867601,PersonalFoul,Foul on Abdou Khadre Kebe.,38,39,2nd Half,13:23,False,116,2024-12-07T01:15:32Z
401706176102867602,102867602,PersonalFoul,Foul on Javon Ervin.,38,39,2nd Half,13:23,False,116,2024-12-07T01:15:52Z
401706176102869901,102869901,Lost Ball Turnover,Tarik Watson Turnover.,38,39,2nd Half,13:00,False,2368,2024-12-07T01:16:31Z
401706176102869902,102869902,Steal,Dola Adebayo Steal.,38,39,2nd Half,13:00,False,116,2024-12-07T01:16:31Z
401706176102874601,102874601,LayUpShot,Dallas Hobbs missed Layup.,38,39,2nd Half,12:53,False,116,2024-12-07T01:16:37Z
401706176102874701,102874701,Defensive Rebound,Marist Defensive Rebound.,38,39,2nd Half,12:52,False,2368,2024-12-07T01:16:37Z
401706176102875701,102875701,LayUpShot,Tarik Watson made Layup. Assisted by Josh Pascarelli.,38,41,2nd Half,12:42,True,2368,2024-12-07T01:17:06Z
401706176102875903,102875903,PersonalFoul,Foul on Terrell Ard Jr..,38,41,2nd Half,12:40,False,116,2024-12-07T01:17:17Z
401706176102876101,102876101,MadeFreeThrow,Tarik Watson missed Free Throw.,38,41,2nd Half,12:38,False,2368,2024-12-07T01:17:53Z
401706176102876102,102876102,Defensive Rebound,Mount St. Mary's Defensive Rebound.,38,41,2nd Half,12:38,False,116,2024-12-07T01:17:53Z
401706176102878201,102878201,JumpShot,Javon Ervin missed Jumper.,38,41,2nd Half,12:17,False,116,2024-12-07T01:18:22Z
401706176102878202,102878202,Defensive Rebound,Marist Defensive Rebound.,38,41,2nd Half,12:17,False,2368,2024-12-07T01:18:22Z
401706176102879501,102879501,PersonalFoul,Foul on Tarik Watson.,38,41,2nd Half,12:04,False,2368,2024-12-07T01:19:05Z
401706176102879502,102879502,Lost Ball Turnover,Tarik Watson Turnover.,38,41,2nd Half,12:04,False,2368,2024-12-07T01:19:05Z
401706176102885201,102885201,JumpShot,Dola Adebayo made Jumper.,40,41,2nd Half,11:47,True,116,2024-12-07T01:19:35Z
401706176102887201,102887201,JumpShot,Caleb Mackrey missed Three Point Jumper.,40,41,2nd Half,11:27,False,2368,2024-12-07T01:19:56Z
401706176102887501,102887501,Defensive Rebound,Xavier Lipscomb Defensive Rebound.,40,41,2nd Half,11:24,False,116,2024-12-07T01:19:59Z
401706176102889301,102889301,JumpShot,Dallas Hobbs missed Jumper.,40,41,2nd Half,11:06,False,116,2024-12-07T01:20:20Z
401706176102889701,102889701,Offensive Rebound,Jedy Cordilia Offensive Rebound.,40,41,2nd Half,11:02,False,116,2024-12-07T01:20:20Z
401706176102889901,102889901,JumpShot,Dallas Hobbs missed Three Point Jumper.,40,41,2nd Half,11:00,False,116,2024-12-07T01:20:23Z
401706176102894401,102894401,Defensive Rebound,Jaden Daughtry Defensive Rebound.,40,41,2nd Half,10:55,False,2368,2024-12-07T01:20:26Z
401706176102894901,102894901,PersonalFoul,Foul on Jedy Cordilia.,40,41,2nd Half,10:50,False,116,2024-12-07T01:20:31Z
401706176102894902,102894902,OfficialTVTimeOut, Official TV Timeout,40,41,2nd Half,10:50,False,,2024-12-07T01:20:31Z
401706176102894903,102894903,MadeFreeThrow,Tarik Watson made Free Throw.,40,42,2nd Half,10:50,True,2368,2024-12-07T01:20:31Z
401706176102895001,102895001,MadeFreeThrow,Tarik Watson missed Free Throw.,40,42,2nd Half,10:49,False,2368,2024-12-07T01:24:14Z
401706176102895101,102895101,Offensive Rebound,Josh Pascarelli Offensive Rebound.,40,42,2nd Half,10:48,False,2368,2024-12-07T01:24:14Z
401706176102896701,102896701,JumpShot,Jadin Collins-Roberts missed Three Point Jumper.,40,42,2nd Half,10:32,False,2368,2024-12-07T01:24:32Z
401706176102897001,102897001,Offensive Rebound,Tarik Watson Offensive Rebound.,40,42,2nd Half,10:29,False,2368,2024-12-07T01:24:32Z
401706176102897101,102897101,LayUpShot,Tarik Watson made Layup.,40,44,2nd Half,10:28,True,2368,2024-12-07T01:24:32Z
401706176102898201,102898201,Lost Ball Turnover,Dallas Hobbs Turnover.,40,44,2nd Half,10:17,False,116,2024-12-07T01:24:45Z
401706176102899301,102899301,Lost Ball Turnover,Jaden Daughtry Turnover.,40,44,2nd Half,10:06,False,2368,2024-12-07T01:24:54Z
401706176102899302,102899302,Steal,Carmelo Pacheco Steal.,40,44,2nd Half,10:06,False,116,2024-12-07T01:24:54Z
401706176102904301,102904301,PersonalFoul,Foul on Tarik Watson.,40,44,2nd Half,9:56,False,2368,2024-12-07T01:25:07Z
401706176102904302,102904302,MadeFreeThrow,Dallas Hobbs made Free Throw.,41,44,2nd Half,9:56,True,116,2024-12-07T01:25:17Z
401706176102904303,102904303,MadeFreeThrow,Dallas Hobbs made Free Throw.,42,44,2nd Half,9:56,True,116,2024-12-07T01:25:17Z
401706176102906701,102906701,LayUpShot,Jadin Collins-Roberts missed Layup.,42,44,2nd Half,9:32,False,2368,2024-12-07T01:26:35Z
401706176102906702,102906702,Block Shot,Terrell Ard Jr. Block.,42,44,2nd Half,9:32,False,116,2024-12-07T01:26:35Z
401706176102907201,102907201,Defensive Rebound,Xavier Lipscomb Defensive Rebound.,42,44,2nd Half,9:27,False,116,2024-12-07T01:26:42Z
401706176102908101,102908101,JumpShot,Carmelo Pacheco made Three Point Jumper. Assisted by Terrell Ard Jr..,45,44,2nd Half,9:18,True,116,2024-12-07T01:26:49Z
