play_id,sequence_number,type,description,away_score,home_score,period,clock,scoring_play,team_id,timestamp_utc
401715655101805201,101805201,Lost Ball Turnover,Malique Ewin Turnover.,0,0,1st Half,19:47,False,52,2024-11-22T22:02:46Z
401715655101805202,101805202,Steal,Babatunde Durodola Steal.,0,0,1st Half,19:47,False,218,2024-11-22T22:02:46Z
401715655101807301,101807301,LayUpShot,Babatunde Durodola missed Layup.,0,0,1st Half,19:26,False,218,2024-11-22T22:03:06Z
401715655101807302,101807302,Block Shot,Taylor Bol Bowen Block.,0,0,1st Half,19:26,False,52,2024-11-22T22:03:06Z
401715655101807601,101807601,Defensive Rebound,Bostyn Holt Defensive Rebound.,0,0,1st Half,19:23,False,52,2024-11-22T22:03:09Z
401715655101808001,101808001,PersonalFoul,Foul on Babatunde Durodola.,0,0,1st Half,19:19,False,218,2024-11-22T22:03:12Z
401715655101808701,101808701,PersonalFoul,Foul on Babatunde Durodola.,0,0,1st Half,19:12,False,218,2024-11-22T22:03:36Z
401715655101809801,101809801,JumpShot,Jamir Watkins missed Three Point Jumper.,0,0,1st Half,19:01,False,52,2024-11-22T22:04:14Z
401715655101814101,101814101,Offensive Rebound,Florida State Offensive Rebound.,0,0,1st Half,18:58,False,52,2024-11-22T22:04:14Z
401715655101815101,101815101,LayUpShot,Malique Ewin made Layup. Assisted by Bostyn Holt.,0,2,1st Half,18:48,True,52,2024-11-22T22:04:42Z
401715655101817001,101817001,JumpShot,Jamal Mashburn Jr. made Jumper.,2,2,1st Half,18:29,True,218,2024-11-22T22:05:01Z
401715655101818601,101818601,Lost Ball Turnover,Malique Ewin Turnover.,2,2,1st Half,18:13,False,52,2024-11-22T22:05:17Z
401715655101824201,101824201,JumpShot,Elijah Gray missed Jumper.,2,2,1st Half,17:57,False,218,2024-11-22T22:05:49Z
401715655101824501,101824501,Defensive Rebound,Jamir Watkins Defensive Rebound.,2,2,1st Half,17:54,False,52,2024-11-22T22:05:49Z
401715655101825201,101825201,Lost Ball Turnover,Jamir Watkins Turnover.,2,2,1st Half,17:47,False,52,2024-11-22T22:05:56Z
401715655101827201,101827201,PersonalFoul,Foul on Chandler Jackson.,2,2,1st Half,17:27,False,52,2024-11-22T22:06:40Z
401715655101827801,101827801,LayUpShot,Zion Stanford made Layup. Assisted by Elijah Gray.,4,2,1st Half,17:21,True,218,2024-11-22T22:07:06Z
401715655101829701,101829701,Lost Ball Turnover,Jamir Watkins Turnover.,4,2,1st Half,17:02,False,52,2024-11-22T22:07:26Z
401715655101829702,101829702,Steal,Jamal Mashburn Jr. Steal.,4,2,1st Half,17:02,False,218,2024-11-22T22:07:26Z
401715655101834101,101834101,LayUpShot,Jamal Mashburn Jr. missed Layup.,4,2,1st Half,16:58,False,218,2024-11-22T22:07:29Z
401715655101834102,101834102,Block Shot,Jamir Watkins Block.,4,2,1st Half,16:58,False,52,2024-11-22T22:07:29Z
401715655101834201,101834201,Offensive Rebound,Temple Offensive Rebound.,4,2,1st Half,16:57,False,218,2024-11-22T22:07:29Z
401715655101835501,101835501,JumpShot,Steve Settle III made Three Point Jumper. Assisted by Zion Stanford.,7,2,1st Half,16:44,True,218,2024-11-22T22:08:00Z
401715655101836101,101836101,PersonalFoul,Foul on Bostyn Holt.,7,2,1st Half,16:38,False,52,2024-11-22T22:08:06Z
401715655101836102,101836102,Lost Ball Turnover,Bostyn Holt Turnover.,7,2,1st Half,16:38,False,52,2024-11-22T22:08:06Z
401715655101837401,101837401,JumpShot,Jamal Mashburn Jr. made Jumper.,9,2,1st Half,16:25,True,218,2024-11-22T22:09:03Z
401715655101839601,101839601,JumpShot,Alier Maluk made Jumper.,9,4,1st Half,16:03,True,52,2024-11-22T22:09:25Z
401715655101845801,101845801,PersonalFoul,Foul on Jerry Deng.,9,4,1st Half,15:41,False,52,2024-11-22T22:09:45Z
401715655101845802,101845802,OfficialTVTimeOut, Official TV Timeout,9,4,1st Half,15:41,False,,2024-11-22T22:09:45Z
401715655101847701,101847701,Lost Ball Turnover,Zion Stanford Turnover.,9,4,1st Half,15:22,False,218,2024-11-22T22:13:33Z
401715655101847702,101847702,Steal,Daquan Davis Steal.,9,4,1st Half,15:22,False,52,2024-11-22T22:13:33Z
401715655101848301,101848301,Lost Ball Turnover,Daquan Davis Turnover.,9,4,1st Half,15:16,False,52,2024-11-22T22:13:37Z
401715655101848302,101848302,Steal,Jameel Brown Steal.,9,4,1st Half,15:16,False,218,2024-11-22T22:13:37Z
401715655101848801,101848801,LayUpShot,Zion Stanford missed Layup.,9,4,1st Half,15:11,False,218,2024-11-22T22:13:44Z
401715655101848802,101848802,Block Shot,Alier Maluk Block.,9,4,1st Half,15:11,False,52,2024-11-22T22:13:46Z
401715655101849201,101849201,Offensive Rebound,Jameel Brown Offensive Rebound.,9,4,1st Half,15:07,False,218,2024-11-22T22:13:46Z
401715655101849501,101849501,LayUpShot,Jameel Brown missed Layup.,9,4,1st Half,15:04,False,218,2024-11-22T22:13:52Z
401715655101849701,101849701,Defensive Rebound,Jerry Deng Defensive Rebound.,9,4,1st Half,15:02,False,52,2024-11-22T22:13:52Z
401715655101855001,101855001,JumpShot,Justin Thomas made Three Point Jumper. Assisted by Daquan Davis.,9,7,1st Half,14:49,True,52,2024-11-22T22:14:06Z
401715655101857401,101857401,JumpShot,Steve Settle III missed Three Point Jumper.,9,7,1st Half,14:25,False,218,2024-11-22T22:14:31Z
401715655101857801,101857801,Defensive Rebound,Daquan Davis Defensive Rebound.,9,7,1st Half,14:21,False,52,2024-11-22T22:14:33Z
401715655101859501,101859501,JumpShot,Jerry Deng missed Three Point Jumper.,9,7,1st Half,14:04,False,52,2024-11-22T22:14:51Z
401715655101859701,101859701,Defensive Rebound,Steve Settle III Defensive Rebound.,9,7,1st Half,14:02,False,218,2024-11-22T22:14:51Z
401715655101865201,101865201,JumpShot,Jamal Mashburn Jr. missed Three Point Jumper.,9,7,1st Half,13:47,False,218,2024-11-22T22:15:09Z
401715655101865601,101865601,Offensive Rebound,Steve Settle III Offensive Rebound.,9,7,1st Half,13:43,False,218,2024-11-22T22:15:09Z
401715655101865701,101865701,JumpShot,Jameel Brown made Three Point Jumper. Assisted by Steve Settle III.,12,7,1st Half,13:42,True,218,2024-11-22T22:15:12Z
401715655101868001,101868001,JumpShot,Daquan Davis missed Three Point Jumper.,12,7,1st Half,13:19,False,52,2024-11-22T22:15:36Z
401715655101868201,101868201,Defensive Rebound,Jameel Brown Defensive Rebound.,12,7,1st Half,13:17,False,218,2024-11-22T22:15:36Z
401715655101869201,101869201,PersonalFoul,Foul on AJ Swinton.,12,7,1st Half,13:07,False,52,2024-11-22T22:15:47Z
401715655101869202,101869202,MadeFreeThrow,Zion Stanford missed Free Throw.,12,7,1st Half,13:07,False,218,2024-11-22T22:15:47Z
401715655101869203,101869203,Offensive Rebound,Temple Offensive Rebound.,12,7,1st Half,13:07,False,218,2024-11-22T22:15:47Z
401715655101869204,101869204,MadeFreeThrow,Zion Stanford missed Free Throw.,12,7,1st Half,13:07,False,218,2024-11-22T22:15:47Z
401715655101869401,101869401,Defensive Rebound,Christian Nitu Defensive Rebound.,12,7,1st Half,13:05,False,52,2024-11-22T22:16:43Z
401715655101874901,101874901,JumpShot,Christian Nitu missed Jumper.,12,7,1st Half,12:50,False,52,2024-11-22T22:17:01Z
401715655101875201,101875201,Defensive Rebound,Zion Stanford Defensive Rebound.,12,7,1st Half,12:47,False,218,2024-11-22T22:17:04Z
401715655101877901,101877901,PersonalFoul,Foul on Christian Nitu.,12,7,1st Half,12:20,False,52,2024-11-22T22:17:30Z
401715655101877902,101877902,MadeFreeThrow,Zion Stanford missed Free Throw.,12,7,1st Half,12:20,False,218,2024-11-22T22:18:03Z
401715655101877903,101877903,Offensive Rebound,Temple Offensive Rebound.,12,7,1st Half,12:20,False,218,2024-11-22T22:18:03Z
401715655101877904,101877904,MadeFreeThrow,Zion Stanford made Free Throw.,13,7,1st Half,12:20,True,218,2024-11-22T22:18:03Z
401715655101878501,101878501,LayUpShot,Bostyn Holt made Layup.,13,9,1st Half,12:14,True,52,2024-11-22T22:18:40Z
401715655101878502,101878502,PersonalFoul,Foul on Shane Dezonie.,13,9,1st Half,12:14,False,218,2024-11-22T22:18:40Z
401715655101878503,101878503,MadeFreeThrow,Bostyn Holt missed Free Throw.,13,9,1st Half,12:14,False,52,2024-11-22T22:18:40Z
401715655101878601,101878601,Defensive Rebound,Jameel Brown Defensive Rebound.,13,9,1st Half,12:13,False,218,2024-11-22T22:19:14Z
401715655101884701,101884701,JumpShot,Jameel Brown missed Three Point Jumper.,13,9,1st Half,11:52,False,218,2024-11-22T22:19:38Z
401715655101885401,101885401,Offensive Rebound,Shane Dezonie Offensive Rebound.,13,9,1st Half,11:45,False,218,2024-11-22T22:19:42Z
401715655101885501,101885501,PersonalFoul,Foul on Taylor Bol Bowen.,13,9,1st Half,11:44,False,52,2024-11-22T22:19:42Z
401715655101885502,101885502,OfficialTVTimeOut, Official TV Timeout,13,9,1st Half,11:44,False,,2024-11-22T22:19:42Z
401715655101885503,101885503,MadeFreeThrow,Shane Dezonie missed Free Throw.,13,9,1st Half,11:44,False,218,2024-11-22T22:19:42Z
401715655101885504,101885504,Offensive Rebound,Temple Offensive Rebound.,13,9,1st Half,11:44,False,218,2024-11-22T22:19:42Z
401715655101885505,101885505,MadeFreeThrow,Shane Dezonie made Free Throw.,14,9,1st Half,11:44,True,218,2024-11-22T22:23:25Z
401715655101887401,101887401,JumpShot,Jamir Watkins made Jumper.,14,11,1st Half,11:25,True,52,2024-11-22T22:23:45Z
401715655101887402,101887402,PersonalFoul,Foul on Shane Dezonie.,14,11,1st Half,11:25,False,218,2024-11-22T22:23:45Z
401715655101887403,101887403,MadeFreeThrow,Jamir Watkins missed Free Throw.,14,11,1st Half,11:25,False,52,2024-11-22T22:23:45Z
401715655101887601,101887601,Defensive Rebound,Jamal Mashburn Jr. Defensive Rebound.,14,11,1st Half,11:23,False,218,2024-11-22T22:24:44Z
401715655101888301,101888301,LayUpShot,Jamal Mashburn Jr. missed Layup.,14,11,1st Half,11:16,False,218,2024-11-22T22:24:50Z
401715655101888501,101888501,Offensive Rebound,Dillon Battie Offensive Rebound.,14,11,1st Half,11:14,False,218,2024-11-22T22:24:50Z
401715655101889501,101889501,Lost Ball Turnover,Quante Berry Turnover.,14,11,1st Half,11:04,False,218,2024-11-22T22:25:26Z
401715655101894601,101894601,LayUpShot,Chandler Jackson made Layup. Assisted by Malique Ewin.,14,13,1st Half,10:53,True,52,2024-11-22T22:25:47Z
401715655101897201,101897201,LayUpShot,Elijah Gray made Layup. Assisted by Steve Settle III.,16,13,1st Half,10:27,True,218,2024-11-22T22:26:14Z
401715655101899801,101899801,LayUpShot,Taylor Bol Bowen missed Layup.,16,13,1st Half,10:01,False,52,2024-11-22T22:26:39Z
401715655101904001,101904001,Defensive Rebound,Zion Stanford Defensive Rebound.,16,13,1st Half,9:59,False,218,2024-11-22T22:26:39Z
401715655101904501,101904501,LayUpShot,Zion Stanford made Layup.,18,13,1st Half,9:54,True,218,2024-11-22T22:26:47Z
401715655101906301,101906301,PersonalFoul,Foul on Quante Berry.,18,13,1st Half,9:36,False,218,2024-11-22T22:27:05Z
401715655101906302,101906302,MadeFreeThrow,Malique Ewin missed Free Throw.,18,13,1st Half,9:36,False,52,2024-11-22T22:27:34Z
401715655101906303,101906303,Offensive Rebound,Florida State Offensive Rebound.,18,13,1st Half,9:36,False,52,2024-11-22T22:27:34Z
401715655101906304,101906304,MadeFreeThrow,Malique Ewin made Free Throw.,18,14,1st Half,9:36,True,52,2024-11-22T22:27:34Z
401715655101907801,101907801,JumpShot,Zion Stanford made Three Point Jumper.,21,14,1st Half,9:21,True,218,2024-11-22T22:28:14Z
401715655101908801,101908801,LayUpShot,Jamir Watkins missed Layup.,21,14,1st Half,9:11,False,52,2024-11-22T22:28:22Z
401715655101908802,101908802,Block Shot,Elijah Gray Block.,21,14,1st Half,9:11,False,218,2024-11-22T22:28:25Z
401715655101909101,101909101,Offensive Rebound,Jamir Watkins Offensive Rebound.,21,14,1st Half,9:08,False,52,2024-11-22T22:31:50Z
401715655101914103,101914103,JumpShot,Jamir Watkins made Jumper.,21,16,1st Half,8:58,True,52,2024-11-22T22:29:49Z
401715655101915801,101915801,JumpShot,Jamal Mashburn Jr. missed Jumper.,21,16,1st Half,8:41,False,218,2024-11-22T22:28:52Z
401715655101916101,101916101,Defensive Rebound,Malique Ewin Defensive Rebound.,21,16,1st Half,8:38,False,52,2024-11-22T22:28:55Z
401715655101916701,101916701,JumpShot,Chandler Jackson made Jumper.,21,18,1st Half,8:32,True,52,2024-11-22T22:29:01Z
401715655101918901,101918901,LayUpShot,Zion Stanford missed Layup.,21,18,1st Half,8:10,False,218,2024-11-22T22:29:23Z
401715655101919101,101919101,Defensive Rebound,Malique Ewin Defensive Rebound.,21,18,1st Half,8:08,False,52,2024-11-22T22:29:23Z
401715655101919701,101919701,LayUpShot,Malique Ewin missed Layup.,21,18,1st Half,8:02,False,52,2024-11-22T22:29:31Z
401715655101924101,101924101,Defensive Rebound,Zion Stanford Defensive Rebound.,21,18,1st Half,7:58,False,218,2024-11-22T22:29:34Z
401715655101925801,101925801,JumpShot,Matteo Picarelli missed Three Point Jumper.,21,18,1st Half,7:41,False,218,2024-11-22T22:29:52Z
401715655101926001,101926001,Offensive Rebound,Elijah Gray Offensive Rebound.,21,18,1st Half,7:39,False,218,2024-11-22T22:29:54Z
401715655101926002,101926002,JumpShot,Elijah Gray made Jumper.,23,18,1st Half,7:39,True,218,2024-11-22T22:29:54Z
401715655101926003,101926003,ShortTimeOut,Temple  Timeout,23,18,1st Half,7:39,False,218,2024-11-22T22:29:54Z
401715655101926004,101926004,OfficialTVTimeOut, Official TV Timeout,23,18,1st Half,7:39,False,,2024-11-22T22:29:54Z
401715655101927901,101927901,JumpShot,Jamir Watkins made Three Point Jumper. Assisted by Alier Maluk.,23,21,1st Half,7:20,True,52,2024-11-22T22:33:25Z
401715655101934101,101934101,PersonalFoul,Foul on Chandler Jackson.,23,21,1st Half,6:58,False,52,2024-11-22T22:33:46Z
401715655101934102,101934102,MadeFreeThrow,Jamal Mashburn Jr. made Free Throw.,24,21,1st Half,6:58,True,218,2024-11-22T22:33:46Z
401715655101934103,101934103,MadeFreeThrow,Jamal Mashburn Jr. made Free Throw.,25,21,1st Half,6:58,True,218,2024-11-22T22:34:41Z
401715655101936801,101936801,JumpShot,Alier Maluk missed Jumper.,25,21,1st Half,6:31,False,52,2024-11-22T22:35:12Z
401715655101937101,101937101,Defensive Rebound,Quante Berry Defensive Rebound.,25,21,1st Half,6:28,False,218,2024-11-22T22:35:12Z
401715655101938501,101938501,Lost Ball Turnover,Elijah Gray Turnover.,25,21,1st Half,6:14,False,218,2024-11-22T22:35:28Z
401715655101938502,101938502,Steal,Alier Maluk Steal.,25,21,1st Half,6:14,False,52,2024-11-22T22:35:28Z
401715655101939301,101939301,JumpShot,Daquan Davis made Three Point Jumper. Assisted by Justin Thomas.,25,24,1st Half,6:06,True,52,2024-11-22T22:35:36Z
401715655101944901,101944901,PersonalFoul,Foul on Justin Thomas.,25,24,1st Half,5:50,False,52,2024-11-22T22:35:52Z
401715655101944902,101944902,MadeFreeThrow,Jamal Mashburn Jr. made Free Throw.,26,24,1st Half,5:50,True,218,2024-11-22T22:35:52Z
401715655101944903,101944903,MadeFreeThrow,Jamal Mashburn Jr. missed Free Throw.,26,24,1st Half,5:50,False,218,2024-11-22T22:35:52Z
401715655101945001,101945001,Defensive Rebound,Alier Maluk Defensive Rebound.,26,24,1st Half,5:49,False,52,2024-11-22T22:36:36Z
401715655101947101,101947101,JumpShot,Jerry Deng made Three Point Jumper. Assisted by Justin Thomas.,26,27,1st Half,5:28,True,52,2024-11-22T22:37:00Z
401715655101948701,101948701,JumpShot,Jamal Mashburn Jr. missed Jumper.,26,27,1st Half,5:12,False,218,2024-11-22T22:37:15Z
401715655101949001,101949001,Defensive Rebound,Daquan Davis Defensive Rebound.,26,27,1st Half,5:09,False,52,2024-11-22T22:37:15Z
401715655101949401,101949401,JumpShot,AJ Swinton made Three Point Jumper. Assisted by Daquan Davis.,26,30,1st Half,5:05,True,52,2024-11-22T22:37:23Z
401715655101955401,101955401,PersonalFoul,Foul on Daquan Davis.,26,30,1st Half,4:45,False,52,2024-11-22T22:37:40Z
401715655101955402,101955402,MadeFreeThrow,Quante Berry made Free Throw.,27,30,1st Half,4:45,True,218,2024-11-22T22:37:40Z
401715655101955403,101955403,MadeFreeThrow,Quante Berry made Free Throw.,28,30,1st Half,4:45,True,218,2024-11-22T22:37:40Z
401715655101956001,101956001,Lost Ball Turnover,AJ Swinton Turnover.,28,30,1st Half,4:39,False,52,2024-11-22T22:38:38Z
401715655101956002,101956002,Steal,Jameel Brown Steal.,28,30,1st Half,4:39,False,218,2024-11-22T22:38:41Z
401715655101956501,101956501,Lost Ball Turnover,Jameel Brown Turnover.,28,30,1st Half,4:34,False,218,2024-11-22T22:38:41Z
401715655101958101,101958101,LayUpShot,Alier Maluk missed Layup.,28,30,1st Half,4:18,False,52,2024-11-22T22:39:08Z
401715655101958401,101958401,Defensive Rebound,Dillon Battie Defensive Rebound.,28,30,1st Half,4:15,False,218,2024-11-22T22:39:11Z
401715655101959701,101959701,Lost Ball Turnover,Quante Berry Turnover.,28,30,1st Half,4:02,False,218,2024-11-22T22:39:25Z
401715655101959702,101959702,Steal,Justin Thomas Steal.,28,30,1st Half,4:02,False,52,2024-11-22T22:39:25Z
401715655101966101,101966101,LayUpShot,Justin Thomas made Layup.,28,32,1st Half,3:38,True,52,2024-11-22T22:39:48Z
401715655101968901,101968901,LayUpShot,Steve Settle III made Layup. Assisted by Zion Stanford.,30,32,1st Half,3:10,True,218,2024-11-22T22:40:25Z
401715655101969901,101969901,PersonalFoul,Foul on Dillon Battie.,30,32,1st Half,3:00,False,218,2024-11-22T22:40:25Z
401715655101969902,101969902,OfficialTVTimeOut, Official TV Timeout,30,32,1st Half,3:00,False,,2024-11-22T22:40:25Z
401715655101974401,101974401,PersonalFoul,Foul on Steve Settle III.,30,32,1st Half,2:55,False,218,2024-11-22T22:43:44Z
401715655101974402,101974402,MadeFreeThrow,Christian Nitu missed Free Throw.,30,32,1st Half,2:55,False,52,2024-11-22T22:43:44Z
401715655101974501,101974501,Defensive Rebound,Steve Settle III Defensive Rebound.,30,32,1st Half,2:54,False,218,2024-11-22T22:44:12Z
401715655101976801,101976801,JumpShot,Steve Settle III missed Three Point Jumper.,30,32,1st Half,2:31,False,218,2024-11-22T22:44:37Z
401715655101977101,101977101,Defensive Rebound,Jerry Deng Defensive Rebound.,30,32,1st Half,2:28,False,52,2024-11-22T22:44:37Z
401715655101977901,101977901,PersonalFoul,Foul on Christian Nitu.,30,32,1st Half,2:20,False,52,2024-11-22T22:44:47Z
401715655101977902,101977902,Lost Ball Turnover,Christian Nitu Turnover.,30,32,1st Half,2:20,False,52,2024-11-22T22:44:47Z
401715655101984201,101984201,PersonalFoul,Foul on Jamir Watkins.,30,32,1st Half,1:57,False,52,2024-11-22T22:45:29Z
401715655101984301,101984301,MadeFreeThrow,Zion Stanford missed Free Throw.,30,32,1st Half,1:56,False,218,2024-11-22T22:52:33Z
401715655101984302,101984302,MadeFreeThrow,Zion Stanford made Free Throw.,31,32,1st Half,1:56,True,218,2024-11-22T22:52:33Z
401715655101984303,101984303,Offensive Rebound,Temple Offensive Rebound.,31,32,1st Half,1:56,False,218,2024-11-22T22:52:33Z
401715655101985406,101985406,JumpShot,Jerry Deng made Three Point Jumper.,31,35,1st Half,1:45,True,52,2024-11-22T22:46:32Z
401715655101985407,101985407,PersonalFoul,Foul on Elijah Gray.,31,35,1st Half,1:45,False,218,2024-11-22T22:46:32Z
401715655101985408,101985408,MadeFreeThrow,Jerry Deng made Free Throw.,31,36,1st Half,1:45,True,52,2024-11-22T22:46:32Z
401715655101986901,101986901,JumpShot,Jamal Mashburn Jr. made Jumper.,33,36,1st Half,1:30,True,218,2024-11-22T22:47:32Z
401715655101987901,101987901,Lost Ball Turnover,Daquan Davis Turnover.,33,36,1st Half,1:20,False,52,2024-11-22T22:47:42Z
401715655101987902,101987902,Steal,Jameel Brown Steal.,33,36,1st Half,1:20,False,218,2024-11-22T22:47:42Z
401715655101987903,101987903,Lost Ball Turnover,Jameel Brown Turnover.,33,36,1st Half,1:20,False,218,2024-11-22T22:47:42Z
401715655101987904,101987904,Steal,Daquan Davis Steal.,33,36,1st Half,1:20,False,52,2024-11-22T22:47:42Z
401715655101988501,101988501,JumpShot,Daquan Davis made Jumper.,33,38,1st Half,1:14,True,52,2024-11-22T22:48:19Z
401715655101988502,101988502,PersonalFoul,Foul on Jamal Mashburn Jr..,33,38,1st Half,1:14,False,218,2024-11-22T22:48:19Z
401715655101988503,101988503,MadeFreeThrow,Daquan Davis missed Free Throw.,33,38,1st Half,1:14,False,52,2024-11-22T22:48:19Z
401715655101988701,101988701,Defensive Rebound,Elijah Gray Defensive Rebound.,33,38,1st Half,1:12,False,218,2024-11-22T22:48:44Z
401715655101995701,101995701,Lost Ball Turnover,Elijah Gray Turnover.,33,38,1st Half,0:42,False,218,2024-11-22T22:49:16Z
401715655101995702,101995702,Steal,Justin Thomas Steal.,33,38,1st Half,0:42,False,52,2024-11-22T22:49:16Z
401715655101996001,101996001,LayUpShot,Jerry Deng missed Layup.,33,38,1st Half,0:39,False,52,2024-11-22T22:49:19Z
401715655101996002,101996002,Block Shot,Steve Settle III Block.,33,38,1st Half,0:39,False,218,2024-11-22T22:49:19Z
401715655101996003,101996003,Offensive Rebound,Florida State Offensive Rebound.,33,38,1st Half,0:39,False,52,2024-11-22T22:49:19Z
401715655101996004,101996004,PersonalFoul,Foul on Elijah Gray.,33,38,1st Half,0:39,False,218,2024-11-22T22:49:19Z
401715655101996005,101996005,MadeFreeThrow,Jamir Watkins missed Free Throw.,33,38,1st Half,0:39,False,52,2024-11-22T22:49:19Z
401715655101996006,101996006,Offensive Rebound,Florida State Offensive Rebound.,33,38,1st Half,0:39,False,52,2024-11-22T22:49:19Z
401715655101996007,101996007,MadeFreeThrow,Jamir Watkins made Free Throw.,33,39,1st Half,0:39,True,52,2024-11-22T22:49:19Z
401715655101998401,101998401,JumpShot,Zion Stanford missed Jumper.,33,39,1st Half,0:15,False,218,2024-11-22T22:52:30Z
401715655101998701,101998701,Defensive Rebound,Justin Thomas Defensive Rebound.,33,39,1st Half,0:12,False,52,2024-11-22T22:52:33Z
401715655101999901,101999901,JumpShot,Justin Thomas missed Three Point Jumper.,33,39,1st Half,0:00,False,52,2024-11-22T22:52:33Z
401715655101999903,101999903,Offensive Rebound,Florida State Offensive Rebound.,33,39,1st Half,0:00,False,52,2024-11-22T22:52:33Z
401715655101999902,101999902,End Period,End of 1st half,33,39,1st Half,0:00,False,,2024-11-22T22:52:33Z
401715655102805501,102805501,Lost Ball Turnover,Jamal Mashburn Jr. Turnover.,33,39,2nd Half,19:44,False,218,
401715655102805502,102805502,Steal,Jamir Watkins Steal.,33,39,2nd Half,19:44,False,52,
401715655102806401,102806401,LayUpShot,Chandler Jackson missed Layup.,33,39,2nd Half,19:35,False,52,
401715655102806901,102806901,Offensive Rebound,Malique Ewin Offensive Rebound.,33,39,2nd Half,19:30,False,52,
401715655102806902,102806902,JumpShot,Malique Ewin made Jumper.,33,41,2nd Half,19:30,True,52,
401715655102808201,102808201,LayUpShot,Zion Stanford made Layup.,35,41,2nd Half,19:17,True,218,
401715655102809901,102809901,JumpShot,Chandler Jackson missed Jumper.,35,41,2nd Half,19:00,False,52,
401715655102814201,102814201,Offensive Rebound,Chandler Jackson Offensive Rebound.,35,41,2nd Half,18:57,False,52,
401715655102815001,102815001,LayUpShot,Malique Ewin made Layup.,35,43,2nd Half,18:49,True,52,
401715655102816101,102816101,JumpShot,Quante Berry missed Three Point Jumper.,35,43,2nd Half,18:38,False,218,
401715655102816501,102816501,Defensive Rebound,Bostyn Holt Defensive Rebound.,35,43,2nd Half,18:34,False,52,2024-11-22T23:10:37Z
401715655102817201,102817201,JumpShot,Taylor Bol Bowen missed Three Point Jumper.,35,43,2nd Half,18:27,False,52,2024-11-22T23:10:43Z
401715655102817501,102817501,Offensive Rebound,Malique Ewin Offensive Rebound.,35,43,2nd Half,18:24,False,52,2024-11-22T23:10:46Z
401715655102817701,102817701,JumpShot,Chandler Jackson missed Three Point Jumper.,35,43,2nd Half,18:22,False,52,2024-11-22T23:10:49Z
401715655102817901,102817901,Defensive Rebound,Babatunde Durodola Defensive Rebound.,35,43,2nd Half,18:20,False,218,2024-11-22T23:10:49Z
401715655102818601,102818601,JumpShot,Zion Stanford missed Three Point Jumper.,35,43,2nd Half,18:13,False,218,2024-11-22T23:10:58Z
401715655102818901,102818901,Defensive Rebound,Bostyn Holt Defensive Rebound.,35,43,2nd Half,18:10,False,52,2024-11-22T23:10:58Z
401715655102819201,102819201,PersonalFoul,Foul on Jamal Mashburn Jr..,35,43,2nd Half,18:07,False,218,2024-11-22T23:11:01Z
401715655102819202,102819202,MadeFreeThrow,Jamir Watkins made Free Throw.,35,44,2nd Half,18:07,True,52,2024-11-22T23:11:01Z
401715655102819203,102819203,MadeFreeThrow,Jamir Watkins made Free Throw.,35,45,2nd Half,18:07,True,52,2024-11-22T23:11:01Z
401715655102824801,102824801,PersonalFoul,Foul on Taylor Bol Bowen.,35,45,2nd Half,17:51,False,52,2024-11-22T23:12:22Z
401715655102824802,102824802,MadeFreeThrow,Jamal Mashburn Jr. made Free Throw.,36,45,2nd Half,17:51,True,218,2024-11-22T23:12:50Z
401715655102824803,102824803,MadeFreeThrow,Jamal Mashburn Jr. missed Free Throw.,36,45,2nd Half,17:51,False,218,2024-11-22T23:12:50Z
401715655102825001,102825001,Defensive Rebound,Malique Ewin Defensive Rebound.,36,45,2nd Half,17:49,False,52,2024-11-22T23:13:05Z
401715655102826601,102826601,JumpShot,Taylor Bol Bowen missed Jumper.,36,45,2nd Half,17:33,False,52,2024-11-22T23:13:23Z
401715655102826801,102826801,Defensive Rebound,Shane Dezonie Defensive Rebound.,36,45,2nd Half,17:31,False,218,2024-11-22T23:13:23Z
401715655102828301,102828301,JumpShot,Jamal Mashburn Jr. missed Three Point Jumper.,36,45,2nd Half,17:16,False,218,2024-11-22T23:13:41Z
401715655102828302,102828302,Defensive Rebound,Florida State Defensive Rebound.,36,45,2nd Half,17:16,False,52,2024-11-22T23:13:41Z
401715655102828303,102828303,PersonalFoul,Foul on Elijah Gray.,36,45,2nd Half,17:16,False,218,2024-11-22T23:13:41Z
401715655102829301,102829301,JumpShot,Bostyn Holt missed Jumper.,36,45,2nd Half,17:06,False,52,2024-11-22T23:14:14Z
401715655102829801,102829801,Defensive Rebound,Shane Dezonie Defensive Rebound.,36,45,2nd Half,17:01,False,218,2024-11-22T23:14:17Z
401715655102834001,102834001,PersonalFoul,Foul on Jamir Watkins.,36,45,2nd Half,16:59,False,52,2024-11-22T23:14:17Z
401715655102834701,102834701,PersonalFoul,Foul on Malique Ewin.,36,45,2nd Half,16:52,False,52,2024-11-22T23:14:53Z
401715655102834702,102834702,MadeFreeThrow,Steve Settle III made Free Throw.,37,45,2nd Half,16:52,True,218,2024-11-22T23:14:53Z
401715655102834703,102834703,MadeFreeThrow,Steve Settle III made Free Throw.,38,45,2nd Half,16:52,True,218,2024-11-22T23:14:53Z
401715655102836401,102836401,PersonalFoul,Foul on Dillon Battie.,38,45,2nd Half,16:35,False,218,2024-11-22T23:16:07Z
401715655102836901,102836901,JumpShot,Jamir Watkins missed Three Point Jumper.,38,45,2nd Half,16:30,False,52,2024-11-22T23:16:35Z
401715655102837101,102837101,Offensive Rebound,Florida State Offensive Rebound.,38,45,2nd Half,16:28,False,52,2024-11-22T23:16:35Z
401715655102837102,102837102,PersonalFoul,Foul on Dillon Battie.,38,45,2nd Half,16:28,False,218,2024-11-22T23:16:35Z
401715655102837301,102837301,JumpShot,Jamir Watkins missed Jumper.,38,45,2nd Half,16:26,False,52,2024-11-22T23:17:11Z
