play_id,sequence_number,type,description,away_score,home_score,period,clock,scoring_play,team_id,timestamp_utc
401714459102858302,102858302,Defensive Rebound,IU Indianapolis Defensive Rebound.,35,65,2nd Half,14:16,False,85,2025-01-10T00:46:13Z
401714459102858304,102858304,PersonalFoul,Foul on Timaris Brown.,35,65,2nd Half,14:16,False,85,2025-01-10T00:46:13Z
401714459102859801,102859801,JumpShot,TJ Nadeau missed Three Point Jumper.,35,65,2nd Half,14:01,False,2174,2025-01-10T00:46:34Z
401714459102864001,102864001,Defensive Rebound,Alec Millender Defensive Rebound.,35,65,2nd Half,13:59,False,85,2025-01-10T00:46:34Z
401714459102865201,102865201,PersonalFoul,Foul on Miles Mitchell.,35,65,2nd Half,13:47,False,2174,2025-01-10T00:46:48Z
401714459102865202,102865202,MadeFreeThrow,Sean Craig made Free Throw.,35,66,2nd Half,13:47,True,85,2025-01-10T00:46:48Z
401714459102865203,102865203,MadeFreeThrow,Sean Craig missed Free Throw.,35,66,2nd Half,13:47,False,85,2025-01-10T00:46:48Z
401714459102865204,102865204,Defensive Rebound,Miles Mitchell Defensive Rebound.,35,66,2nd Half,13:47,False,2174,2025-01-10T00:46:48Z
401714459102868501,102868501,Lost Ball Turnover,Detroit Mercy  Turnover.,35,66,2nd Half,13:14,False,2174,2025-01-10T00:48:16Z
401714459102869701,102869701,LayUpShot,Keenan Garner missed Layup.,35,66,2nd Half,13:02,False,85,2025-01-10T00:48:30Z
401714459102869702,102869702,Block Shot,Ryan Kalambay Block.,35,66,2nd Half,13:02,False,2174,2025-01-10T00:48:49Z
401714459102874001,102874001,Defensive Rebound,Ryan Kalambay Defensive Rebound.,35,66,2nd Half,12:59,False,2174,2025-01-10T00:48:49Z
401714459102874301,102874301,PersonalFoul,Foul on Sean Craig.,35,66,2nd Half,12:56,False,85,2025-01-10T00:48:49Z
401714459102876001,102876001,JumpShot,Grant Gondrezick II made Jumper.,37,66,2nd Half,12:39,True,2174,2025-01-10T00:49:06Z
401714459102877701,102877701,JumpShot,Sean Craig made Jumper. Assisted by Alec Millender.,37,68,2nd Half,12:22,True,85,2025-01-10T00:50:11Z
401714459102877702,102877702,PersonalFoul,Foul on Chase Kuiper.,37,68,2nd Half,12:22,False,2174,2025-01-10T00:50:11Z
401714459102877703,102877703,MadeFreeThrow,Sean Craig made Free Throw.,37,69,2nd Half,12:22,True,85,2025-01-10T00:50:11Z
401714459102879801,102879801,JumpShot,Nate Johnson missed Three Point Jumper.,37,69,2nd Half,12:01,False,2174,2025-01-10T00:50:28Z
401714459102884001,102884001,Defensive Rebound,IU Indianapolis Defensive Rebound.,37,69,2nd Half,11:59,False,85,2025-01-10T00:50:28Z
401714459102884002,102884002,OfficialTVTimeOut, Official TV Timeout,37,69,2nd Half,11:59,False,,2025-01-10T00:50:28Z
401714459102886801,102886801,Lost Ball Turnover,Caleb Hannah Turnover.,37,69,2nd Half,11:31,False,85,2025-01-10T00:54:15Z
401714459102887301,102887301,JumpShot,Emmanuel Kuac missed Three Point Jumper.,37,69,2nd Half,11:26,False,2174,2025-01-10T00:54:15Z
401714459102887701,102887701,Defensive Rebound,Keenan Garner Defensive Rebound.,37,69,2nd Half,11:22,False,85,2025-01-10T00:54:15Z
401714459102889201,102889201,JumpShot,DeSean Goode missed Three Point Jumper.,37,69,2nd Half,11:07,False,85,2025-01-10T00:54:49Z
401714459102889501,102889501,Offensive Rebound,Keenan Garner Offensive Rebound.,37,69,2nd Half,11:04,False,85,2025-01-10T00:54:49Z
401714459102894401,102894401,LayUpShot,Keenan Garner missed Layup.,37,69,2nd Half,10:55,False,85,2025-01-10T00:54:49Z
401714459102894402,102894402,Block Shot,Emmanuel Kuac Block.,37,69,2nd Half,10:55,False,2174,2025-01-10T00:54:49Z
401714459102894801,102894801,Offensive Rebound,DeSean Goode Offensive Rebound.,37,69,2nd Half,10:51,False,85,2025-01-10T00:56:14Z
401714459102894901,102894901,LayUpShot,DeSean Goode made Layup.,37,71,2nd Half,10:50,True,85,2025-01-10T00:56:14Z
401714459102897201,102897201,PersonalFoul,Foul on Caleb Hannah.,37,71,2nd Half,10:27,False,85,2025-01-10T00:56:14Z
401714459102898501,102898501,PersonalFoul,Foul on Ron Rutland III.,37,71,2nd Half,10:14,False,85,2025-01-10T00:56:14Z
401714459102898701,102898701,JumpShot,TJ Nadeau missed Jumper.,37,71,2nd Half,10:12,False,2174,2025-01-10T00:56:30Z
401714459102898901,102898901,Defensive Rebound,Sean Craig Defensive Rebound.,37,71,2nd Half,10:10,False,85,2025-01-10T00:56:30Z
401714459102904001,102904001,Lost Ball Turnover,Sean Craig Turnover.,37,71,2nd Half,9:59,False,85,2025-01-10T00:57:00Z
401714459102904002,102904002,Steal,Grant Gondrezick II Steal.,37,71,2nd Half,9:59,False,2174,2025-01-10T00:57:00Z
401714459102904401,102904401,LayUpShot,Grant Gondrezick II made Layup.,39,71,2nd Half,9:55,True,2174,2025-01-10T00:57:00Z
401714459102907801,102907801,JumpShot,Sean Craig made Three Point Jumper. Assisted by Ron Rutland III.,39,74,2nd Half,9:21,True,85,2025-01-10T00:58:14Z
401714459102914301,102914301,Lost Ball Turnover,Grant Gondrezick II Turnover.,39,74,2nd Half,8:56,False,2174,2025-01-10T00:58:14Z
401714459102914302,102914302,Steal,Keenan Garner Steal.,39,74,2nd Half,8:56,False,85,2025-01-10T00:58:14Z
401714459102914701,102914701,LayUpShot,Keenan Garner made Layup.,39,76,2nd Half,8:52,True,85,2025-01-10T00:58:14Z
401714459102914702,102914702,PersonalFoul,Foul on TJ Nadeau.,39,76,2nd Half,8:52,False,2174,2025-01-10T00:58:14Z
401714459102914703,102914703,MadeFreeThrow,Keenan Garner missed Free Throw.,39,76,2nd Half,8:52,False,85,2025-01-10T00:58:14Z
401714459102914704,102914704,Defensive Rebound,Miles Mitchell Defensive Rebound.,39,76,2nd Half,8:52,False,2174,2025-01-10T00:58:14Z
401714459102916101,102916101,Lost Ball Turnover,Peter Fuchs Jr. Turnover.,39,76,2nd Half,8:38,False,2174,2025-01-10T00:58:33Z
401714459102916102,102916102,Steal,Keenan Garner Steal.,39,76,2nd Half,8:38,False,85,2025-01-10T00:58:33Z
401714459102916601,102916601,DunkShot,Keenan Garner made Dunk.,39,78,2nd Half,8:33,True,85,2025-01-10T00:59:03Z
401714459102916602,102916602,PersonalFoul,Foul on Peter Fuchs Jr..,39,78,2nd Half,8:33,False,2174,2025-01-10T00:59:03Z
401714459102916603,102916603,PersonalFoul,Foul on Keenan Garner.,39,78,2nd Half,8:33,False,85,2025-01-10T00:59:03Z
401714459102916604,102916604,Lost Ball Turnover,Keenan Garner Turnover.,39,78,2nd Half,8:33,False,85,2025-01-10T00:59:03Z
401714459102916605,102916605,MadeFreeThrow,Emmanuel Kuac made Free Throw.,40,78,2nd Half,8:33,True,2174,2025-01-10T00:59:03Z
401714459102916606,102916606,MadeFreeThrow,Keenan Garner made Free Throw.,40,79,2nd Half,8:33,True,85,2025-01-10T00:59:03Z
401714459102916801,102916801,Lost Ball Turnover,Peter Fuchs Jr. Turnover.,40,79,2nd Half,8:31,False,2174,2025-01-10T01:00:32Z
401714459102918101,102918101,JumpShot,Ron Rutland III made Three Point Jumper. Assisted by Alec Millender.,40,82,2nd Half,8:18,True,85,2025-01-10T01:02:16Z
401714459102919601,102919601,PersonalFoul,Foul on Timaris Brown.,40,82,2nd Half,8:03,False,85,2025-01-10T01:02:16Z
401714459102919602,102919602,MadeFreeThrow,Chase Kuiper made Free Throw.,41,82,2nd Half,8:03,True,2174,2025-01-10T01:02:16Z
401714459102919603,102919603,MadeFreeThrow,Chase Kuiper made Free Throw.,42,82,2nd Half,8:03,True,2174,2025-01-10T01:02:16Z
401714459102926101,102926101,LayUpShot,Keenan Garner missed Layup.,42,82,2nd Half,7:38,False,85,2025-01-10T01:02:48Z
401714459102926201,102926201,Offensive Rebound,Keenan Garner Offensive Rebound.,42,82,2nd Half,7:37,False,85,2025-01-10T01:02:48Z
401714459102926202,102926202,PersonalFoul,Foul on Emmanuel Kuac.,42,82,2nd Half,7:37,False,2174,2025-01-10T01:02:48Z
401714459102926301,102926301,OfficialTVTimeOut, Official TV Timeout,42,82,2nd Half,7:36,False,,2025-01-10T01:02:48Z
401714459102926302,102926302,MadeFreeThrow,Keenan Garner missed Free Throw.,42,82,2nd Half,7:36,False,85,2025-01-10T01:02:48Z
401714459102926303,102926303,Offensive Rebound,IU Indianapolis Offensive Rebound.,42,82,2nd Half,7:36,False,85,2025-01-10T01:02:48Z
401714459102926304,102926304,MadeFreeThrow,Keenan Garner made Free Throw.,42,83,2nd Half,7:36,True,85,2025-01-10T01:02:48Z
401714459102927201,102927201,JumpShot,Emmanuel Kuac made Three Point Jumper. Assisted by Grant Gondrezick II.,45,83,2nd Half,7:27,True,2174,2025-01-10T01:06:14Z
401714459102929501,102929501,JumpShot,Ajay Holubar made Three Point Jumper. Assisted by Ron Rutland III.,45,86,2nd Half,7:04,True,85,2025-01-10T01:06:35Z
401714459102937301,102937301,JumpShot,Emmanuel Kuac missed Jumper.,45,86,2nd Half,6:26,False,2174,2025-01-10T01:08:12Z
401714459102937501,102937501,Defensive Rebound,Keenan Garner Defensive Rebound.,45,86,2nd Half,6:24,False,85,2025-01-10T01:08:12Z
401714459102938201,102938201,JumpShot,Caleb Hannah missed Three Point Jumper.,45,86,2nd Half,6:17,False,85,2025-01-10T01:08:12Z
401714459102938701,102938701,Defensive Rebound,Emmanuel Kuac Defensive Rebound.,45,86,2nd Half,6:12,False,2174,2025-01-10T01:08:12Z
401714459102944501,102944501,JumpShot,Emmanuel Kuac missed Three Point Jumper.,45,86,2nd Half,5:54,False,2174,2025-01-10T01:08:12Z
401714459102944801,102944801,Offensive Rebound,Miles Mitchell Offensive Rebound.,45,86,2nd Half,5:51,False,2174,2025-01-10T01:08:12Z
401714459102944901,102944901,DunkShot,Miles Mitchell made Dunk.,47,86,2nd Half,5:50,True,2174,2025-01-10T01:08:12Z
401714459102944902,102944902,ShortTimeOut,Detroit Mercy  Timeout,47,86,2nd Half,5:50,False,2174,2025-01-10T01:08:12Z
401714459102944903,102944903,OfficialTVTimeOut, Official TV Timeout,47,86,2nd Half,5:50,False,,2025-01-10T01:08:12Z
401714459102947101,102947101,JumpShot,Ron Rutland III made Three Point Jumper. Assisted by DeSean Goode.,47,89,2nd Half,5:28,True,85,2025-01-10T01:12:17Z
401714459102954401,102954401,JumpShot,TJ Nadeau made Jumper.,49,89,2nd Half,4:55,True,2174,2025-01-10T01:12:17Z
401714459102956701,102956701,JumpShot,Nathan Dudukovich missed Three Point Jumper.,49,89,2nd Half,4:32,False,85,2025-01-10T01:12:17Z
401714459102957001,102957001,Offensive Rebound,DeSean Goode Offensive Rebound.,49,89,2nd Half,4:29,False,85,2025-01-10T01:12:17Z
401714459102957301,102957301,JumpShot,Nathan Dudukovich missed Three Point Jumper.,49,89,2nd Half,4:26,False,85,2025-01-10T01:12:17Z
401714459102957601,102957601,Offensive Rebound,DeSean Goode Offensive Rebound.,49,89,2nd Half,4:23,False,85,2025-01-10T01:12:17Z
401714459102957901,102957901,JumpShot,Alec Millender made Three Point Jumper. Assisted by DeSean Goode.,49,92,2nd Half,4:20,True,85,2025-01-10T01:12:17Z
401714459102964001,102964001,JumpShot,Grant Gondrezick II made Three Point Jumper.,52,92,2nd Half,3:59,True,2174,2025-01-10T01:12:38Z
401714459102965401,102965401,ShortTimeOut,IU Indianapolis  Timeout,52,92,2nd Half,3:45,False,85,2025-01-10T01:12:56Z
401714459102965402,102965402,OfficialTVTimeOut, Official TV Timeout,52,92,2nd Half,3:45,False,,2025-01-10T01:12:56Z
401714459102967201,102967201,JumpShot,Ajay Holubar missed Three Point Jumper.,52,92,2nd Half,3:27,False,85,2025-01-10T01:15:08Z
401714459102967401,102967401,Defensive Rebound,Peter Fuchs Jr. Defensive Rebound.,52,92,2nd Half,3:25,False,2174,2025-01-10T01:15:08Z
401714459102969001,102969001,PersonalFoul,Foul on Ron Rutland III.,52,92,2nd Half,3:09,False,85,2025-01-10T01:16:13Z
401714459102969002,102969002,MadeFreeThrow,Grant Gondrezick II made Free Throw.,53,92,2nd Half,3:09,True,2174,2025-01-10T01:16:13Z
401714459102969003,102969003,MadeFreeThrow,Grant Gondrezick II missed Free Throw.,53,92,2nd Half,3:09,False,2174,2025-01-10T01:16:13Z
401714459102969101,102969101,Defensive Rebound,Keenan Garner Defensive Rebound.,53,92,2nd Half,3:08,False,85,2025-01-10T01:16:53Z
401714459102969401,102969401,PersonalFoul,Foul on Ryan Kalambay.,53,92,2nd Half,3:05,False,2174,2025-01-10T01:16:53Z
401714459102969402,102969402,MadeFreeThrow,Keenan Garner made Free Throw.,53,93,2nd Half,3:05,True,85,2025-01-10T01:16:53Z
401714459102969403,102969403,MadeFreeThrow,Keenan Garner missed Free Throw.,53,93,2nd Half,3:05,False,85,2025-01-10T01:16:53Z
401714459102969404,102969404,Defensive Rebound,Peter Fuchs Jr. Defensive Rebound.,53,93,2nd Half,3:05,False,2174,2025-01-10T01:16:53Z
401714459102974401,102974401,PersonalFoul,Foul on Ron Rutland III.,53,93,2nd Half,2:55,False,85,2025-01-10T01:18:14Z
401714459102974402,102974402,MadeFreeThrow,Grant Gondrezick II made Free Throw.,54,93,2nd Half,2:55,True,2174,2025-01-10T01:18:14Z
401714459102974403,102974403,MadeFreeThrow,Grant Gondrezick II made Free Throw.,55,93,2nd Half,2:55,True,2174,2025-01-10T01:18:14Z
401714459102975701,102975701,PersonalFoul,Foul on Miles Mitchell.,55,93,2nd Half,2:42,False,2174,2025-01-10T01:18:54Z
401714459102975702,102975702,MadeFreeThrow,Ajay Holubar made Free Throw.,55,94,2nd Half,2:42,True,85,2025-01-10T01:18:54Z
401714459102975703,102975703,MadeFreeThrow,Ajay Holubar made Free Throw.,55,95,2nd Half,2:42,True,85,2025-01-10T01:18:54Z
401714459102977101,102977101,JumpShot,Miles Mitchell made Jumper. Assisted by Chase Kuiper.,57,95,2nd Half,2:28,True,2174,2025-01-10T01:20:16Z
401714459102979601,102979601,JumpShot,Caleb Hannah missed Jumper.,57,95,2nd Half,2:03,False,85,2025-01-10T01:20:16Z
401714459102984501,102984501,Defensive Rebound,Ryan Kalambay Defensive Rebound.,57,95,2nd Half,1:54,False,2174,2025-01-10T01:20:16Z
401714459102985101,102985101,JumpShot,Peter Fuchs Jr. missed Three Point Jumper.,57,95,2nd Half,1:48,False,2174,2025-01-10T01:20:16Z
401714459102985201,102985201,Offensive Rebound,Ryan Kalambay Offensive Rebound.,57,95,2nd Half,1:47,False,2174,2025-01-10T01:20:16Z
401714459102985202,102985202,PersonalFoul,Foul on DeSean Goode.,57,95,2nd Half,1:47,False,85,2025-01-10T01:20:16Z
401714459102985203,102985203,MadeFreeThrow,Ryan Kalambay missed Free Throw.,57,95,2nd Half,1:47,False,2174,2025-01-10T01:20:34Z
401714459102985204,102985204,Offensive Rebound,Detroit Mercy Offensive Rebound.,57,95,2nd Half,1:47,False,2174,2025-01-10T01:20:34Z
401714459102985205,102985205,MadeFreeThrow,Ryan Kalambay missed Free Throw.,57,95,2nd Half,1:47,False,2174,2025-01-10T01:20:34Z
401714459102985401,102985401,Offensive Rebound,Miles Mitchell Offensive Rebound.,57,95,2nd Half,1:45,False,2174,2025-01-10T01:21:09Z
401714459102986701,102986701,PersonalFoul,Foul on Ajay Holubar.,57,95,2nd Half,1:32,False,85,2025-01-10T01:22:17Z
401714459102986702,102986702,MadeFreeThrow,Ryan Kalambay made Free Throw.,58,95,2nd Half,1:32,True,2174,2025-01-10T01:22:17Z
401714459102986703,102986703,MadeFreeThrow,Ryan Kalambay made Free Throw.,59,95,2nd Half,1:32,True,2174,2025-01-10T01:22:17Z
401714459102988801,102988801,JumpShot,Caleb Hannah missed Jumper.,59,95,2nd Half,1:11,False,85,2025-01-10T01:22:34Z
401714459102989001,102989001,Defensive Rebound,Miles Mitchell Defensive Rebound.,59,95,2nd Half,1:09,False,2174,2025-01-10T01:22:53Z
401714459102994401,102994401,PersonalFoul,Foul on Ajay Holubar.,59,95,2nd Half,0:55,False,85,2025-01-10T01:23:09Z
401714459102994402,102994402,MadeFreeThrow,Peter Fuchs Jr. made Free Throw.,60,95,2nd Half,0:55,True,2174,2025-01-10T01:23:09Z
401714459102994403,102994403,MadeFreeThrow,Peter Fuchs Jr. made Free Throw.,61,95,2nd Half,0:55,True,2174,2025-01-10T01:23:09Z
401714459102997001,102997001,JumpShot,Keenan Garner missed Jumper.,61,95,2nd Half,0:29,False,85,2025-01-10T01:24:12Z
401714459102997201,102997201,Defensive Rebound,Ryan Kalambay Defensive Rebound.,61,95,2nd Half,0:27,False,2174,2025-01-10T01:24:12Z
401714459102997901,102997901,JumpShot,Miles Mitchell missed Three Point Jumper.,61,95,2nd Half,0:20,False,2174,2025-01-10T01:24:12Z
401714459102998201,102998201,Defensive Rebound,DeSean Goode Defensive Rebound.,61,95,2nd Half,0:17,False,85,2025-01-10T01:24:12Z
401714459102999901,102999901,End Game,End of Game,61,95,2nd Half,0:00,False,,2025-01-10T01:24:12Z
