play_id,sequence_number,type,description,away_score,home_score,period,clock,scoring_play,team_id,timestamp_utc
401715428102869601,102869601,Defensive Rebound,Zine Eddine Bedri Defensive Rebound.,46,58,2nd Half,13:03,False,171,2024-12-30T23:20:58Z
401715428102874901,102874901,LayUpShot,Avery Brown made Layup.,48,58,2nd Half,12:50,True,171,2024-12-30T23:21:23Z
401715428102877601,102877601,LayUpShot,Jordan Derkack made Layup.,48,60,2nd Half,12:23,True,164,2024-12-30T23:21:51Z
401715428102877602,102877602,PersonalFoul,Foul on Zine Eddine Bedri.,48,60,2nd Half,12:23,False,171,2024-12-30T23:21:51Z
401715428102877603,102877603,MadeFreeThrow,Jordan Derkack made Free Throw.,48,61,2nd Half,12:23,True,164,2024-12-30T23:21:51Z
401715428102879402,102879402,Block Shot,Jamichael Davis Block.,48,61,2nd Half,12:05,False,164,2024-12-30T23:22:36Z
401715428102879406,102879406,JumpShot,Avery Brown missed Jumper.,48,61,2nd Half,12:05,False,171,2024-12-30T23:22:36Z
401715428102879407,102879407,Defensive Rebound,Dylan Harper Defensive Rebound.,48,61,2nd Half,12:05,False,164,2024-12-30T23:22:36Z
401715428102884201,102884201,JumpShot,Dylan Harper made Three Point Jumper. Assisted by Jeremiah Williams.,48,64,2nd Half,11:57,True,164,2024-12-30T23:22:36Z
401715428102884301,102884301,ShortTimeOut,Columbia  Timeout,48,64,2nd Half,11:56,False,171,2024-12-30T23:22:36Z
401715428102884302,102884302,OfficialTVTimeOut, Official TV Timeout,48,64,2nd Half,11:56,False,,2024-12-30T23:22:36Z
401715428102886201,102886201,PersonalFoul,Foul on Lathan Sommerville.,48,64,2nd Half,11:37,False,164,2024-12-30T23:26:43Z
401715428102886202,102886202,MadeFreeThrow,Mason Ritter missed Free Throw.,48,64,2nd Half,11:37,False,171,2024-12-30T23:26:43Z
401715428102886203,102886203,Offensive Rebound,Columbia Offensive Rebound.,48,64,2nd Half,11:37,False,171,2024-12-30T23:26:43Z
401715428102886204,102886204,MadeFreeThrow,Mason Ritter made Free Throw.,49,64,2nd Half,11:37,True,171,2024-12-30T23:26:43Z
401715428102887601,102887601,DunkShot,Lathan Sommerville made Dunk. Assisted by Dylan Harper.,49,66,2nd Half,11:23,True,164,2024-12-30T23:27:46Z
401715428102889501,102889501,JumpShot,Kenny Noland made Three Point Jumper. Assisted by Blair Thompson.,52,66,2nd Half,11:04,True,171,2024-12-30T23:28:08Z
401715428102895501,102895501,JumpShot,Lathan Sommerville missed Jumper.,52,66,2nd Half,10:44,False,164,2024-12-30T23:28:15Z
401715428102895801,102895801,Defensive Rebound,Blair Thompson Defensive Rebound.,52,66,2nd Half,10:41,False,171,2024-12-30T23:28:36Z
401715428102897801,102897801,JumpShot,Kenny Noland made Three Point Jumper. Assisted by Geronimo Rubio De La Rosa.,55,66,2nd Half,10:21,True,171,2024-12-30T23:28:38Z
401715428102904901,102904901,JumpShot,Jeremiah Williams missed Jumper.,55,66,2nd Half,9:50,False,164,2024-12-30T23:29:28Z
401715428102905001,102905001,Offensive Rebound,Lathan Sommerville Offensive Rebound.,55,66,2nd Half,9:49,False,164,2024-12-30T23:29:28Z
401715428102905002,102905002,Lost Ball Turnover,Lathan Sommerville Turnover.,55,66,2nd Half,9:49,False,164,2024-12-30T23:29:28Z
401715428102906001,102906001,Lost Ball Turnover,Avery Brown Turnover.,55,66,2nd Half,9:39,False,171,2024-12-30T23:29:55Z
401715428102907701,102907701,JumpShot,Jeremiah Williams made Jumper. Assisted by Dylan Harper.,55,68,2nd Half,9:22,True,164,2024-12-30T23:30:23Z
401715428102909401,102909401,JumpShot,Blair Thompson missed Three Point Jumper.,55,68,2nd Half,9:05,False,171,2024-12-30T23:30:44Z
401715428102909402,102909402,Block Shot,Ace Bailey Block.,55,68,2nd Half,9:05,False,164,2024-12-30T23:30:44Z
401715428102909701,102909701,Defensive Rebound,Ace Bailey Defensive Rebound.,55,68,2nd Half,9:02,False,164,2024-12-30T23:30:44Z
401715428102915501,102915501,LayUpShot,Lathan Sommerville made Layup. Assisted by Dylan Harper.,55,70,2nd Half,8:44,True,164,2024-12-30T23:31:06Z
401715428102917601,102917601,JumpShot,Geronimo Rubio De La Rosa missed Three Point Jumper.,55,70,2nd Half,8:23,False,171,2024-12-30T23:31:38Z
401715428102917901,102917901,Defensive Rebound,Dylan Harper Defensive Rebound.,55,70,2nd Half,8:20,False,164,2024-12-30T23:31:38Z
401715428102918301,102918301,LayUpShot,Ace Bailey missed Layup.,55,70,2nd Half,8:16,False,164,2024-12-30T23:31:40Z
401715428102918302,102918302,Block Shot,Mason Ritter Block.,55,70,2nd Half,8:16,False,171,2024-12-30T23:31:40Z
401715428102918303,102918303,Offensive Rebound,Ace Bailey Offensive Rebound.,55,70,2nd Half,8:16,False,164,2024-12-30T23:31:40Z
401715428102919101,102919101,LayUpShot,Tyson Acuff missed Layup.,55,70,2nd Half,8:08,False,164,2024-12-30T23:32:29Z
401715428102919701,102919701,Offensive Rebound,Lathan Sommerville Offensive Rebound.,55,70,2nd Half,8:02,False,164,2024-12-30T23:32:29Z
401715428102919702,102919702,JumpShot,Lathan Sommerville missed Jumper.,55,70,2nd Half,8:02,False,164,2024-12-30T23:32:29Z
401715428102924001,102924001,Defensive Rebound,Jake Tavroff Defensive Rebound.,55,70,2nd Half,7:59,False,171,2024-12-30T23:32:50Z
401715428102924101,102924101,JumpShot,Avery Brown missed Jumper.,55,70,2nd Half,7:58,False,171,2024-12-30T23:32:29Z
401715428102924701,102924701,Defensive Rebound,Jeremiah Williams Defensive Rebound.,55,70,2nd Half,7:52,False,164,2024-12-30T23:32:29Z
401715428102926401,102926401,PersonalFoul,Foul on Avery Brown.,55,70,2nd Half,7:35,False,171,2024-12-30T23:32:50Z
401715428102926402,102926402,OfficialTVTimeOut, Official TV Timeout,55,70,2nd Half,7:35,False,,2024-12-30T23:32:50Z
401715428102927501,102927501,JumpShot,Zach Martini missed Three Point Jumper.,55,70,2nd Half,7:24,False,164,2024-12-30T23:36:09Z
401715428102927701,102927701,Offensive Rebound,Tyson Acuff Offensive Rebound.,55,70,2nd Half,7:22,False,164,2024-12-30T23:36:09Z
401715428102927901,102927901,PersonalFoul,Foul on Jake Tavroff.,55,70,2nd Half,7:20,False,171,2024-12-30T23:36:09Z
401715428102927902,102927902,MadeFreeThrow,Jeremiah Williams missed Free Throw.,55,70,2nd Half,7:20,False,164,2024-12-30T23:36:09Z
401715428102927903,102927903,Offensive Rebound,Rutgers Offensive Rebound.,55,70,2nd Half,7:20,False,164,2024-12-30T23:36:09Z
401715428102927904,102927904,MadeFreeThrow,Jeremiah Williams made Free Throw.,55,71,2nd Half,7:20,True,164,2024-12-30T23:36:09Z
401715428102929701,102929701,PersonalFoul,Foul on Tyson Acuff.,55,71,2nd Half,7:02,False,164,2024-12-30T23:37:09Z
401715428102934601,102934601,Lost Ball Turnover,Jake Tavroff Turnover.,55,71,2nd Half,6:53,False,171,2024-12-30T23:37:36Z
401715428102934602,102934602,Steal,Jamichael Davis Steal.,55,71,2nd Half,6:53,False,164,2024-12-30T23:37:36Z
401715428102936801,102936801,LayUpShot,Jeremiah Williams made Layup.,55,73,2nd Half,6:31,True,164,2024-12-30T23:38:05Z
401715428102938401,102938401,JumpShot,Geronimo Rubio De La Rosa made Three Point Jumper. Assisted by Kenny Noland.,58,73,2nd Half,6:15,True,171,2024-12-30T23:38:28Z
401715428102939501,102939501,JumpShot,Tyson Acuff missed Jumper.,58,73,2nd Half,6:04,False,164,2024-12-30T23:38:30Z
401715428102939502,102939502,Defensive Rebound,Columbia Defensive Rebound.,58,73,2nd Half,6:04,False,171,2024-12-30T23:38:30Z
401715428102939503,102939503,PersonalFoul,Foul on Lathan Sommerville.,58,73,2nd Half,6:04,False,164,2024-12-30T23:38:30Z
401715428102944701,102944701,JumpShot,Geronimo Rubio De La Rosa missed Three Point Jumper.,58,73,2nd Half,5:52,False,171,2024-12-30T23:39:21Z
401715428102944801,102944801,Defensive Rebound,Tyson Acuff Defensive Rebound.,58,73,2nd Half,5:51,False,164,2024-12-30T23:39:21Z
401715428102947001,102947001,JumpShot,Jamichael Davis missed Three Point Jumper.,58,73,2nd Half,5:29,False,164,2024-12-30T23:39:45Z
401715428102947201,102947201,Offensive Rebound,Tyson Acuff Offensive Rebound.,58,73,2nd Half,5:27,False,164,2024-12-30T23:39:45Z
401715428102947801,102947801,JumpShot,Tyson Acuff missed Three Point Jumper.,58,73,2nd Half,5:21,False,164,2024-12-30T23:39:47Z
401715428102948001,102948001,Defensive Rebound,Kenny Noland Defensive Rebound.,58,73,2nd Half,5:19,False,171,2024-12-30T23:39:47Z
401715428102949401,102949401,JumpShot,Geronimo Rubio De La Rosa missed Three Point Jumper.,58,73,2nd Half,5:05,False,171,2024-12-30T23:40:11Z
401715428102949601,102949601,Defensive Rebound,Dylan Harper Defensive Rebound.,58,73,2nd Half,5:03,False,164,2024-12-30T23:40:11Z
401715428102954701,102954701,LayUpShot,Ace Bailey made Layup. Assisted by Dylan Harper.,58,75,2nd Half,4:52,True,164,2024-12-30T23:40:13Z
401715428102956001,102956001,PersonalFoul,Foul on Jamichael Davis.,58,75,2nd Half,4:39,False,164,2024-12-30T23:40:41Z
401715428102956002,102956002,RegularTimeOut,Rutgers  Timeout,58,75,2nd Half,4:39,False,164,2024-12-30T23:40:41Z
401715428102957601,102957601,JumpShot,Geronimo Rubio De La Rosa missed Three Point Jumper.,58,75,2nd Half,4:23,False,171,2024-12-30T23:43:01Z
401715428102957901,102957901,Defensive Rebound,Ace Bailey Defensive Rebound.,58,75,2nd Half,4:20,False,164,2024-12-30T23:43:01Z
401715428102957902,102957902,PersonalFoul,Foul on Zine Eddine Bedri.,58,75,2nd Half,4:20,False,171,2024-12-30T23:43:01Z
401715428102957903,102957903,MadeFreeThrow,Ace Bailey made Free Throw.,58,76,2nd Half,4:20,True,164,2024-12-30T23:43:01Z
401715428102958001,102958001,MadeFreeThrow,Ace Bailey missed Free Throw.,58,76,2nd Half,4:19,False,164,2024-12-30T23:43:57Z
401715428102958101,102958101,Defensive Rebound,Blair Thompson Defensive Rebound.,58,76,2nd Half,4:18,False,171,2024-12-30T23:43:57Z
401715428102959001,102959001,JumpShot,Avery Brown missed Three Point Jumper.,58,76,2nd Half,4:09,False,171,2024-12-30T23:44:01Z
401715428102959301,102959301,Defensive Rebound,Dylan Harper Defensive Rebound.,58,76,2nd Half,4:06,False,164,2024-12-30T23:44:01Z
401715428102959601,102959601,LayUpShot,Lathan Sommerville made Layup. Assisted by Dylan Harper.,58,78,2nd Half,4:03,True,164,2024-12-30T23:44:04Z
401715428102964201,102964201,OfficialTVTimeOut, Official TV Timeout,58,78,2nd Half,3:57,False,,2024-12-30T23:44:28Z
401715428102965301,102965301,JumpShot,Zine Eddine Bedri missed Jumper.,58,78,2nd Half,3:46,False,171,2024-12-30T23:47:45Z
401715428102965501,102965501,Defensive Rebound,Ace Bailey Defensive Rebound.,58,78,2nd Half,3:44,False,164,2024-12-30T23:47:45Z
401715428102966301,102966301,JumpShot,Ace Bailey made Jumper. Assisted by Dylan Harper.,58,80,2nd Half,3:36,True,164,2024-12-30T23:47:48Z
401715428102967001,102967001,LayUpShot,Zine Eddine Bedri missed Layup.,58,80,2nd Half,3:29,False,171,2024-12-30T23:47:48Z
401715428102967201,102967201,Defensive Rebound,Lathan Sommerville Defensive Rebound.,58,80,2nd Half,3:27,False,164,2024-12-30T23:47:48Z
401715428102967901,102967901,JumpShot,Jamichael Davis made Jumper.,58,82,2nd Half,3:20,True,164,2024-12-30T23:47:55Z
401715428102968701,102968701,JumpShot,Avery Brown missed Jumper.,58,82,2nd Half,3:12,False,171,2024-12-30T23:48:02Z
401715428102969001,102969001,Offensive Rebound,Zine Eddine Bedri Offensive Rebound.,58,82,2nd Half,3:09,False,171,2024-12-30T23:48:27Z
401715428102969002,102969002,JumpShot,Zine Eddine Bedri made Jumper.,60,82,2nd Half,3:09,True,171,2024-12-30T23:48:27Z
401715428102975901,102975901,JumpShot,Tyson Acuff made Three Point Jumper. Assisted by Jamichael Davis.,60,85,2nd Half,2:40,True,164,2024-12-30T23:48:53Z
401715428102976701,102976701,JumpShot,Avery Brown missed Three Point Jumper.,60,85,2nd Half,2:32,False,171,2024-12-30T23:48:53Z
401715428102977101,102977101,Defensive Rebound,Ace Bailey Defensive Rebound.,60,85,2nd Half,2:28,False,164,2024-12-30T23:48:53Z
401715428102979201,102979201,JumpShot,Ace Bailey missed Three Point Jumper.,60,85,2nd Half,2:07,False,164,2024-12-30T23:49:18Z
401715428102979501,102979501,Defensive Rebound,Kenny Noland Defensive Rebound.,60,85,2nd Half,2:04,False,171,2024-12-30T23:49:18Z
401715428102979901,102979901,PersonalFoul,Foul on Ace Bailey.,60,85,2nd Half,2:00,False,164,2024-12-30T23:49:18Z
401715428102979902,102979902,MadeFreeThrow,Avery Brown made Free Throw.,61,85,2nd Half,2:00,True,171,2024-12-30T23:49:18Z
401715428102979903,102979903,MadeFreeThrow,Avery Brown made Free Throw.,62,85,2nd Half,2:00,True,171,2024-12-30T23:49:18Z
401715428102985401,102985401,JumpShot,Tyson Acuff made Three Point Jumper. Assisted by Jamichael Davis.,62,88,2nd Half,1:45,True,164,2024-12-30T23:51:52Z
401715428102987201,102987201,JumpShot,Nicolo Romanelli missed Jumper.,62,88,2nd Half,1:27,False,171,2024-12-30T23:51:54Z
401715428102987501,102987501,Offensive Rebound,Mason Ritter Offensive Rebound.,62,88,2nd Half,1:24,False,171,2024-12-30T23:51:54Z
401715428102987801,102987801,Lost Ball Turnover,Mason Ritter Turnover.,62,88,2nd Half,1:21,False,171,2024-12-30T23:51:54Z
401715428102989201,102989201,JumpShot,Max Fradkin missed Three Point Jumper.,62,88,2nd Half,1:07,False,164,2024-12-30T23:52:25Z
401715428102989401,102989401,Defensive Rebound,Gerard O'Keefe Defensive Rebound.,62,88,2nd Half,1:05,False,171,2024-12-30T23:52:25Z
401715428102994301,102994301,Lost Ball Turnover,Josiah Cunningham Turnover.,62,88,2nd Half,0:56,False,171,2024-12-30T23:52:51Z
401715428102994302,102994302,Steal,Max Fradkin Steal.,62,88,2nd Half,0:56,False,164,2024-12-30T23:52:51Z
401715428102995301,102995301,JumpShot,Peter Noble missed Three Point Jumper.,62,88,2nd Half,0:46,False,164,2024-12-30T23:52:51Z
401715428102995302,102995302,Defensive Rebound,Columbia Defensive Rebound.,62,88,2nd Half,0:46,False,171,2024-12-30T23:52:51Z
401715428102995801,102995801,LayUpShot,Josiah Cunningham made Layup. Assisted by Nicolo Romanelli.,64,88,2nd Half,0:41,True,171,2024-12-30T23:53:16Z
401715428102998901,102998901,JumpShot,Peter Noble made Three Point Jumper. Assisted by Jordan Derkack.,64,91,2nd Half,0:10,True,164,2024-12-30T23:53:43Z
401715428102999701,102999701,JumpShot,Nicolo Romanelli missed Jumper.,64,91,2nd Half,0:02,False,171,2024-12-30T23:54:08Z
401715428102999901,102999901,Defensive Rebound,PJ Hayes IV Defensive Rebound.,64,91,2nd Half,0:00,False,164,2024-12-30T23:54:08Z
401715428102999902,102999902,End Period,End of 2nd half,64,91,2nd Half,0:00,False,,2024-12-30T23:54:08Z
401715428102999903,102999903,End Game,End of Game,64,91,2nd Half,0:00,False,,2024-12-30T23:54:08Z
