play_id,sequence_number,type,description,away_score,home_score,period,clock,scoring_play,team_id,timestamp_utc
401706333102875302,102875302,Lost Ball Turnover,Braelon Green Turnover.,54,53,2nd Half,12:46,False,189,2025-01-22T01:20:36Z
401706333102876801,102876801,JumpShot,Reece Potter made Three Point Jumper. Assisted by Evan Ipsaro.,54,56,2nd Half,12:31,True,193,2025-01-22T01:21:10Z
401706333102878301,102878301,PersonalFoul,Foul on Reece Potter.,54,56,2nd Half,12:16,False,193,2025-01-22T01:21:25Z
401706333102878302,102878302,MadeFreeThrow,Trey Thomas made Free Throw.,55,56,2nd Half,12:16,True,189,2025-01-22T01:21:25Z
401706333102878303,102878303,MadeFreeThrow,Trey Thomas made Free Throw.,56,56,2nd Half,12:16,True,189,2025-01-22T01:21:25Z
401706333102884101,102884101,JumpShot,Eian Elmer made Jumper.,56,58,2nd Half,11:58,True,193,2025-01-22T01:22:33Z
401706333102886101,102886101,JumpShot,Trey Thomas missed Three Point Jumper.,56,58,2nd Half,11:38,False,189,2025-01-22T01:22:52Z
401706333102886401,102886401,Offensive Rebound,Jamai Felt Offensive Rebound.,56,58,2nd Half,11:35,False,189,2025-01-22T01:22:56Z
401706333102886501,102886501,JumpShot,Derrick Butler missed Three Point Jumper.,56,58,2nd Half,11:34,False,189,2025-01-22T01:22:56Z
401706333102886801,102886801,Defensive Rebound,Eian Elmer Defensive Rebound.,56,58,2nd Half,11:31,False,193,2025-01-22T01:22:59Z
401706333102888101,102888101,Lost Ball Turnover,Eian Elmer Turnover.,56,58,2nd Half,11:18,False,193,2025-01-22T01:23:12Z
401706333102888102,102888102,Steal,DaJion Humphrey Steal.,56,58,2nd Half,11:18,False,189,2025-01-22T01:23:12Z
401706333102888103,102888103,OfficialTVTimeOut, Official TV Timeout,56,58,2nd Half,11:18,False,,2025-01-22T01:23:12Z
401706333102894201,102894201,Lost Ball Turnover,Marcus Johnson Turnover.,56,58,2nd Half,10:57,False,189,2025-01-22T01:26:30Z
401706333102894202,102894202,Steal,Evan Ipsaro Steal.,56,58,2nd Half,10:57,False,193,2025-01-22T01:26:34Z
401706333102894601,102894601,DunkShot,Mekhi Cooper made Dunk. Assisted by Evan Ipsaro.,56,60,2nd Half,10:53,True,193,2025-01-22T01:26:34Z
401706333102896201,102896201,PersonalFoul,Foul on Jamai Felt.,56,60,2nd Half,10:37,False,189,2025-01-22T01:26:49Z
401706333102896202,102896202,Lost Ball Turnover,Jamai Felt Turnover.,56,60,2nd Half,10:37,False,189,2025-01-22T01:26:49Z
401706333102897501,102897501,PersonalFoul,Foul on Jamai Felt.,56,60,2nd Half,10:24,False,189,2025-01-22T01:27:29Z
401706333102897502,102897502,MadeFreeThrow,Antwone Woolfolk made Free Throw.,56,61,2nd Half,10:24,True,193,2025-01-22T01:27:29Z
401706333102897503,102897503,MadeFreeThrow,Antwone Woolfolk made Free Throw.,56,62,2nd Half,10:24,True,193,2025-01-22T01:27:29Z
401706333102898701,102898701,LayUpShot,Marcus Johnson missed Layup.,56,62,2nd Half,10:12,False,189,2025-01-22T01:28:36Z
401706333102898702,102898702,Block Shot,Antwone Woolfolk Block.,56,62,2nd Half,10:12,False,193,2025-01-22T01:29:43Z
401706333102899301,102899301,Offensive Rebound,Marcus Johnson Offensive Rebound.,56,62,2nd Half,10:06,False,189,2025-01-22T01:28:41Z
401706333102899401,102899401,LayUpShot,Marcus Johnson missed Layup.,56,62,2nd Half,10:05,False,189,2025-01-22T01:28:41Z
401706333102899402,102899402,Block Shot,Antwone Woolfolk Block.,56,62,2nd Half,10:05,False,193,2025-01-22T01:28:41Z
401706333102904001,102904001,Defensive Rebound,Evan Ipsaro Defensive Rebound.,56,62,2nd Half,9:59,False,193,2025-01-22T01:28:48Z
401706333102904801,102904801,Lost Ball Turnover,Brant Byers Turnover.,56,62,2nd Half,9:51,False,193,2025-01-22T01:28:55Z
401706333102904802,102904802,Steal,Trey Thomas Steal.,56,62,2nd Half,9:51,False,189,2025-01-22T01:28:55Z
401706333102906701,102906701,Lost Ball Turnover,Trey Thomas Turnover.,56,62,2nd Half,9:32,False,189,2025-01-22T01:29:28Z
401706333102906702,102906702,Steal,Mekhi Cooper Steal.,56,62,2nd Half,9:32,False,193,2025-01-22T01:29:28Z
401706333102907401,102907401,JumpShot,Brant Byers missed Three Point Jumper.,56,62,2nd Half,9:25,False,193,2025-01-22T01:29:34Z
401706333102907601,102907601,Offensive Rebound,Antwone Woolfolk Offensive Rebound.,56,62,2nd Half,9:23,False,193,2025-01-22T01:29:37Z
401706333102907701,102907701,LayUpShot,Antwone Woolfolk made Layup.,56,64,2nd Half,9:22,True,193,2025-01-22T01:29:37Z
401706333102908101,102908101,ShortTimeOut,Bowling Green  Timeout,56,64,2nd Half,9:18,False,189,2025-01-22T01:29:45Z
401706333102908102,102908102,OfficialTVTimeOut, Official TV Timeout,56,64,2nd Half,9:18,False,,2025-01-22T01:29:43Z
401706333102909201,102909201,PersonalFoul,Foul on Eian Elmer.,56,64,2nd Half,9:07,False,193,2025-01-22T01:32:53Z
401706333102909202,102909202,MadeFreeThrow,Derrick Butler missed Free Throw.,56,64,2nd Half,9:07,False,189,2025-01-22T01:32:53Z
401706333102909401,102909401,Defensive Rebound,Antwone Woolfolk Defensive Rebound.,56,64,2nd Half,9:05,False,193,2025-01-22T01:33:21Z
401706333102914801,102914801,LayUpShot,Brant Byers missed Layup.,56,64,2nd Half,8:51,False,193,2025-01-22T01:33:35Z
401706333102914802,102914802,Block Shot,Javontae Campbell Block.,56,64,2nd Half,8:51,False,189,2025-01-22T01:33:35Z
401706333102915202,102915202,Defensive Rebound,Javontae Campbell Defensive Rebound.,56,64,2nd Half,8:47,False,189,2025-01-22T01:33:46Z
401706333102915601,102915601,JumpShot,Marcus Johnson missed Three Point Jumper.,56,64,2nd Half,8:43,False,189,2025-01-22T01:33:42Z
401706333102915801,102915801,Defensive Rebound,Antwone Woolfolk Defensive Rebound.,56,64,2nd Half,8:41,False,193,2025-01-22T01:33:46Z
401706333102917301,102917301,JumpShot,Eian Elmer missed Three Point Jumper.,56,64,2nd Half,8:26,False,193,2025-01-22T01:34:00Z
401706333102917501,102917501,Defensive Rebound,Marcus Johnson Defensive Rebound.,56,64,2nd Half,8:24,False,189,2025-01-22T01:34:02Z
401706333102918501,102918501,LayUpShot,DaJion Humphrey missed Layup.,56,64,2nd Half,8:14,False,189,2025-01-22T01:34:14Z
401706333102918801,102918801,Defensive Rebound,Evan Ipsaro Defensive Rebound.,56,64,2nd Half,8:11,False,193,2025-01-22T01:34:14Z
401706333102919201,102919201,LayUpShot,Mekhi Cooper missed Layup.,56,64,2nd Half,8:07,False,193,2025-01-22T01:34:19Z
401706333102919301,102919301,Offensive Rebound,Miami (OH) Offensive Rebound.,56,64,2nd Half,8:06,False,193,2025-01-22T01:34:19Z
401706333102924201,102924201,OfficialTVTimeOut, Official TV Timeout,56,64,2nd Half,7:57,False,,2025-01-22T01:34:50Z
401706333102924901,102924901,LayUpShot,Mekhi Cooper made Layup.,56,66,2nd Half,7:50,True,193,2025-01-22T01:37:22Z
401706333102927001,102927001,JumpShot,Derrick Butler missed Three Point Jumper.,56,66,2nd Half,7:29,False,189,2025-01-22T01:37:46Z
401706333102927201,102927201,Defensive Rebound,Antwone Woolfolk Defensive Rebound.,56,66,2nd Half,7:27,False,193,2025-01-22T01:37:46Z
401706333102928501,102928501,Lost Ball Turnover,Antwone Woolfolk Turnover.,56,66,2nd Half,7:14,False,193,2025-01-22T01:38:00Z
401706333102928502,102928502,Steal,Jamai Felt Steal.,56,66,2nd Half,7:14,False,189,2025-01-22T01:38:00Z
401706333102929201,102929201,JumpShot,Trey Thomas missed Three Point Jumper.,56,66,2nd Half,7:07,False,189,2025-01-22T01:38:08Z
401706333102929401,102929401,Defensive Rebound,Eian Elmer Defensive Rebound.,56,66,2nd Half,7:05,False,193,2025-01-22T01:38:08Z
401706333102935001,102935001,JumpShot,Mekhi Cooper made Three Point Jumper. Assisted by Antwone Woolfolk.,56,69,2nd Half,6:49,True,193,2025-01-22T01:38:24Z
401706333102937401,102937401,DunkShot,Jamai Felt made Dunk. Assisted by Marcus Johnson.,58,69,2nd Half,6:25,True,189,2025-01-22T01:38:48Z
401706333102939901,102939901,Lost Ball Turnover,Eian Elmer Turnover.,58,69,2nd Half,6:00,False,193,2025-01-22T01:39:14Z
401706333102939902,102939902,Steal,Derrick Butler Steal.,58,69,2nd Half,6:00,False,189,2025-01-22T01:39:19Z
401706333102944401,102944401,PersonalFoul,Foul on Jamai Felt.,58,69,2nd Half,5:55,False,189,2025-01-22T01:39:19Z
401706333102944402,102944402,Lost Ball Turnover,Jamai Felt Turnover.,58,69,2nd Half,5:55,False,189,2025-01-22T01:39:19Z
401706333102945001,102945001,DunkShot,Brant Byers made Dunk. Assisted by Mekhi Cooper.,58,71,2nd Half,5:49,True,193,2025-01-22T01:41:49Z
401706333102946601,102946601,LayUpShot,Javontae Campbell made Layup.,60,71,2nd Half,5:33,True,189,2025-01-22T01:42:07Z
401706333102947801,102947801,JumpShot,Mekhi Cooper missed Three Point Jumper.,60,71,2nd Half,5:21,False,193,2025-01-22T01:42:20Z
401706333102948201,102948201,Defensive Rebound,Marcus Johnson Defensive Rebound.,60,71,2nd Half,5:17,False,189,2025-01-22T01:42:23Z
401706333102948901,102948901,LayUpShot,Wilguens Jr. Exacte made Layup. Assisted by Marcus Johnson.,62,71,2nd Half,5:10,True,189,2025-01-22T01:42:28Z
401706333102948902,102948902,PersonalFoul,Foul on Brant Byers.,62,71,2nd Half,5:10,False,193,2025-01-22T01:42:28Z
401706333102948903,102948903,MadeFreeThrow,Wilguens Jr. Exacte missed Free Throw.,62,71,2nd Half,5:10,False,189,2025-01-22T01:42:28Z
401706333102948904,102948904,Defensive Rebound,Peter Suder Defensive Rebound.,62,71,2nd Half,5:10,False,193,2025-01-22T01:42:28Z
401706333102955101,102955101,LayUpShot,Kam Craft missed Layup.,62,71,2nd Half,4:48,False,193,2025-01-22T01:43:36Z
401706333102955401,102955401,Offensive Rebound,Reece Potter Offensive Rebound.,62,71,2nd Half,4:45,False,193,2025-01-22T01:43:36Z
401706333102956701,102956701,PersonalFoul,Foul on Trey Thomas.,62,71,2nd Half,4:32,False,189,2025-01-22T01:44:01Z
401706333102956702,102956702,MadeFreeThrow,Mekhi Cooper made Free Throw.,62,72,2nd Half,4:32,True,193,2025-01-22T01:44:01Z
401706333102956703,102956703,MadeFreeThrow,Mekhi Cooper made Free Throw.,62,73,2nd Half,4:32,True,193,2025-01-22T01:44:01Z
401706333102957801,102957801,JumpShot,Derrick Butler made Three Point Jumper. Assisted by Marcus Johnson.,65,73,2nd Half,4:21,True,189,2025-01-22T01:44:44Z
401706333102957802,102957802,PersonalFoul,Foul on Eian Elmer.,65,73,2nd Half,4:21,False,193,2025-01-22T01:44:44Z
401706333102957803,102957803,MadeFreeThrow,Derrick Butler made Free Throw.,66,73,2nd Half,4:21,True,189,2025-01-22T01:44:44Z
401706333102964901,102964901,Lost Ball Turnover,Evan Ipsaro Turnover.,66,73,2nd Half,3:50,False,193,2025-01-22T01:46:03Z
401706333102964902,102964902,Steal,Javontae Campbell Steal.,66,73,2nd Half,3:50,False,189,2025-01-22T01:46:03Z
401706333102965001,102965001,PersonalFoul,Foul on Evan Ipsaro.,66,73,2nd Half,3:49,False,193,2025-01-22T01:46:03Z
401706333102965002,102965002,OfficialTVTimeOut, Official TV Timeout,66,73,2nd Half,3:49,False,,2025-01-22T01:46:03Z
401706333102965003,102965003,MadeFreeThrow,Javontae Campbell made Free Throw.,67,73,2nd Half,3:49,True,189,2025-01-22T01:48:52Z
401706333102965004,102965004,MadeFreeThrow,Javontae Campbell made Free Throw.,68,73,2nd Half,3:49,True,189,2025-01-22T01:48:52Z
401706333102965006,102965006,PersonalFoul,Foul on Derrick Butler.,68,73,2nd Half,3:49,False,189,2025-01-22T01:48:52Z
401706333102965007,102965007,MadeFreeThrow,Evan Ipsaro made Free Throw.,68,74,2nd Half,3:49,True,193,2025-01-22T01:48:52Z
401706333102965008,102965008,MadeFreeThrow,Evan Ipsaro made Free Throw.,68,75,2nd Half,3:49,True,193,2025-01-22T01:48:52Z
401706333102966201,102966201,JumpShot,Marcus Johnson made Three Point Jumper. Assisted by Trey Thomas.,71,75,2nd Half,3:37,True,189,2025-01-22T01:50:43Z
401706333102968201,102968201,LayUpShot,Antwone Woolfolk missed Layup.,71,75,2nd Half,3:17,False,193,2025-01-22T01:51:03Z
401706333102968202,102968202,Block Shot,Jamai Felt Block.,71,75,2nd Half,3:17,False,189,2025-01-22T01:51:03Z
401706333102968401,102968401,Defensive Rebound,Marcus Johnson Defensive Rebound.,71,75,2nd Half,3:15,False,189,2025-01-22T01:51:08Z
401706333102968901,102968901,LayUpShot,Trey Thomas missed Layup.,71,75,2nd Half,3:10,False,189,2025-01-22T01:51:14Z
401706333102969201,102969201,Defensive Rebound,Eian Elmer Defensive Rebound.,71,75,2nd Half,3:07,False,193,2025-01-22T01:51:14Z
401706333102974901,102974901,JumpShot,Eian Elmer missed Three Point Jumper.,71,75,2nd Half,2:50,False,193,2025-01-22T01:51:33Z
401706333102975101,102975101,Defensive Rebound,Jamai Felt Defensive Rebound.,71,75,2nd Half,2:48,False,189,2025-01-22T01:51:33Z
401706333102976701,102976701,JumpShot,Derrick Butler made Three Point Jumper. Assisted by Trey Thomas.,74,75,2nd Half,2:32,True,189,2025-01-22T01:51:49Z
401706333102979601,102979601,JumpShot,Mekhi Cooper made Jumper.,74,77,2nd Half,2:03,True,193,2025-01-22T01:52:17Z
401706333102979602,102979602,ShortTimeOut,Miami (OH)  Timeout,74,77,2nd Half,2:03,False,193,2025-01-22T01:52:17Z
401706333102985601,102985601,JumpShot,Trey Thomas made Jumper.,76,77,2nd Half,1:43,True,189,2025-01-22T01:53:49Z
401706333102987601,102987601,LayUpShot,Peter Suder made Layup. Assisted by Antwone Woolfolk.,76,79,2nd Half,1:23,True,193,2025-01-22T01:54:08Z
401706333102989701,102989701,JumpShot,Javontae Campbell missed Jumper.,76,79,2nd Half,1:02,False,189,2025-01-22T01:54:30Z
401706333102994201,102994201,Defensive Rebound,Antwone Woolfolk Defensive Rebound.,76,79,2nd Half,0:57,False,193,2025-01-22T01:54:36Z
401706333102994701,102994701,RegularTimeOut,Miami (OH)  Timeout,76,79,2nd Half,0:52,False,193,2025-01-22T01:54:41Z
401706333102996401,102996401,JumpShot,Peter Suder made Three Point Jumper.,76,82,2nd Half,0:35,True,193,2025-01-22T01:56:48Z
401706333102996701,102996701,ShortTimeOut,Bowling Green  Timeout,76,82,2nd Half,0:32,False,189,2025-01-22T01:56:56Z
401706333102998501,102998501,JumpShot,Trey Thomas missed Three Point Jumper.,76,82,2nd Half,0:14,False,189,2025-01-22T01:58:29Z
401706333102999001,102999001,Defensive Rebound,Mekhi Cooper Defensive Rebound.,76,82,2nd Half,0:09,False,193,2025-01-22T01:58:34Z
401706333102999301,102999301,PersonalFoul,Foul on Derrick Butler.,76,82,2nd Half,0:06,False,189,2025-01-22T01:58:38Z
401706333102999302,102999302,MadeFreeThrow,Evan Ipsaro made Free Throw.,76,83,2nd Half,0:06,True,193,2025-01-22T01:58:38Z
401706333102999303,102999303,MadeFreeThrow,Evan Ipsaro made Free Throw.,76,84,2nd Half,0:06,True,193,2025-01-22T01:58:38Z
401706333102999901,102999901,End Period,End of 2nd half,76,84,2nd Half,0:00,False,,2025-01-22T01:58:38Z
401706333102999902,102999902,End Game,End of Game,76,84,2nd Half,0:00,False,,2025-01-22T01:58:38Z
