play_id,sequence_number,type,description,away_score,home_score,period,clock,scoring_play,team_id,timestamp_utc
401720809101804901,101804901,JumpShot,Nehemiah Benson missed Jumper.,0,0,1st Half,19:50,False,2066,2025-01-11T18:04:13Z
401720809101805401,101805401,Defensive Rebound,Jawarie Hamelin Defensive Rebound.,0,0,1st Half,19:45,False,160,2025-01-11T18:04:13Z
401720809101806101,101806101,JumpShot,Sami Pissis made Three Point Jumper. Assisted by Jawarie Hamelin.,0,3,1st Half,19:38,True,160,2025-01-11T18:04:13Z
401720809101809301,101809301,PersonalFoul,Foul on Khalil Badru.,0,3,1st Half,19:06,False,160,2025-01-11T18:04:13Z
401720809101814501,101814501,JumpShot,Gavin Walsh missed Jumper.,0,3,1st Half,18:54,False,2066,2025-01-11T18:04:13Z
401720809101815101,101815101,Offensive Rebound,Gavin Walsh Offensive Rebound.,0,3,1st Half,18:48,False,2066,2025-01-11T18:04:27Z
401720809101815401,101815401,JumpShot,Tymu Chenery made Three Point Jumper. Assisted by Gavin Walsh.,3,3,1st Half,18:45,True,2066,2025-01-11T18:04:27Z
401720809101818101,101818101,JumpShot,Khalil Badru missed Jumper.,3,3,1st Half,18:18,False,160,2025-01-11T18:04:56Z
401720809101818501,101818501,Defensive Rebound,Evan Ashe Defensive Rebound.,3,3,1st Half,18:14,False,2066,2025-01-11T18:04:56Z
401720809101819701,101819701,LayUpShot,Nehemiah Benson made Layup. Assisted by Tymu Chenery.,5,3,1st Half,18:02,True,2066,2025-01-11T18:05:12Z
401720809101824301,101824301,JumpShot,Sami Pissis missed Three Point Jumper.,5,3,1st Half,17:56,False,160,2025-01-11T18:05:12Z
401720809101824701,101824701,Defensive Rebound,Gavin Walsh Defensive Rebound.,5,3,1st Half,17:52,False,2066,2025-01-11T18:05:12Z
401720809101826101,101826101,JumpShot,Tymu Chenery made Jumper.,7,3,1st Half,17:38,True,2066,2025-01-11T18:06:17Z
401720809101827301,101827301,JumpShot,Jawarie Hamelin missed Jumper.,7,3,1st Half,17:26,False,160,2025-01-11T18:06:17Z
401720809101827302,101827302,Offensive Rebound,Khalil Badru Offensive Rebound.,7,3,1st Half,17:26,False,160,2025-01-11T18:06:17Z
401720809101827303,101827303,PersonalFoul,Foul on Tymu Chenery.,7,3,1st Half,17:26,False,2066,2025-01-11T18:06:17Z
401720809101828701,101828701,LayUpShot,Emmanuel Okpomo missed Layup.,7,3,1st Half,17:12,False,160,2025-01-11T18:06:32Z
401720809101828702,101828702,Offensive Rebound,New Hampshire Offensive Rebound.,7,3,1st Half,17:12,False,160,2025-01-11T18:06:32Z
401720809101829701,101829701,PersonalFoul,Foul on Tymu Chenery.,7,3,1st Half,17:02,False,2066,2025-01-11T18:07:04Z
401720809101834901,101834901,JumpShot,Sami Pissis missed Jumper.,7,3,1st Half,16:50,False,160,2025-01-11T18:07:04Z
401720809101834902,101834902,Block Shot,Tymu Chenery Block.,7,3,1st Half,16:50,False,2066,2025-01-11T18:07:04Z
401720809101835201,101835201,Offensive Rebound,New Hampshire Offensive Rebound.,7,3,1st Half,16:47,False,160,2025-01-11T18:07:04Z
401720809101836001,101836001,JumpShot,Anthony McComb III missed Jumper.,7,3,1st Half,16:39,False,160,2025-01-11T18:07:04Z
401720809101836501,101836501,Defensive Rebound,Chris Walker Defensive Rebound.,7,3,1st Half,16:34,False,2066,2025-01-11T18:08:15Z
401720809101837501,101837501,JumpShot,Gavin Walsh made Three Point Jumper. Assisted by Chris Walker.,10,3,1st Half,16:24,True,2066,2025-01-11T18:08:30Z
401720809101839001,101839001,Lost Ball Turnover,Jawarie Hamelin Turnover.,10,3,1st Half,16:09,False,160,2025-01-11T18:08:30Z
401720809101839002,101839002,Steal,Nehemiah Benson Steal.,10,3,1st Half,16:09,False,2066,2025-01-11T18:08:30Z
401720809101839501,101839501,LayUpShot,Nehemiah Benson made Layup. Assisted by Tymu Chenery.,12,3,1st Half,16:04,True,2066,2025-01-11T18:08:59Z
401720809101846001,101846001,JumpShot,Jawarie Hamelin made Jumper.,12,5,1st Half,15:39,True,160,2025-01-11T18:10:11Z
401720809101848501,101848501,LayUpShot,Nehemiah Benson made Layup.,14,5,1st Half,15:14,True,2066,2025-01-11T18:10:11Z
401720809101849601,101849601,Lost Ball Turnover,Jawarie Hamelin Turnover.,14,5,1st Half,15:03,False,160,2025-01-11T18:10:11Z
401720809101849602,101849602,Steal,Chris Walker Steal.,14,5,1st Half,15:03,False,2066,2025-01-11T18:10:11Z
401720809101854401,101854401,LayUpShot,Nehemiah Benson made Layup. Assisted by Tymu Chenery.,16,5,1st Half,14:55,True,2066,2025-01-11T18:10:11Z
401720809101855701,101855701,OfficialTVTimeOut, Official TV Timeout,16,5,1st Half,14:42,False,,2025-01-11T18:10:11Z
401720809101857301,101857301,JumpShot,Sami Pissis made Three Point Jumper. Assisted by Davide Poser.,16,8,1st Half,14:26,True,160,2025-01-11T18:14:13Z
401720809101857401,101857401,PersonalFoul,Foul on Evan Ashe.,16,8,1st Half,14:25,False,2066,2025-01-11T18:14:13Z
401720809101857402,101857402,MadeFreeThrow,Sami Pissis missed Free Throw.,16,8,1st Half,14:25,False,160,2025-01-11T18:14:13Z
401720809101857403,101857403,Defensive Rebound,Gavin Walsh Defensive Rebound.,16,8,1st Half,14:25,False,2066,2025-01-11T18:14:13Z
401720809101859501,101859501,PersonalFoul,Foul on Anthony McComb III.,16,8,1st Half,14:04,False,160,2025-01-11T18:14:29Z
401720809101864401,101864401,JumpShot,Evan Ashe made Jumper.,18,8,1st Half,13:55,True,2066,2025-01-11T18:14:57Z
401720809101865801,101865801,JumpShot,Davide Poser missed Jumper.,18,8,1st Half,13:41,False,160,2025-01-11T18:15:13Z
401720809101865901,101865901,Offensive Rebound,Caleb Middleton Offensive Rebound.,18,8,1st Half,13:40,False,160,2025-01-11T18:15:13Z
401720809101865902,101865902,LayUpShot,Caleb Middleton made Layup.,18,10,1st Half,13:40,True,160,2025-01-11T18:15:13Z
401720809101865903,101865903,PersonalFoul,Foul on Jayden Lemond.,18,10,1st Half,13:40,False,2066,2025-01-11T18:15:13Z
401720809101865904,101865904,MadeFreeThrow,Caleb Middleton missed Free Throw.,18,10,1st Half,13:40,False,160,2025-01-11T18:15:13Z
401720809101866001,101866001,Offensive Rebound,Khalil Badru Offensive Rebound.,18,10,1st Half,13:39,False,160,2025-01-11T18:16:15Z
401720809101867401,101867401,JumpShot,Khalil Badru missed Jumper.,18,10,1st Half,13:25,False,160,2025-01-11T18:16:15Z
401720809101867801,101867801,Offensive Rebound,Caleb Middleton Offensive Rebound.,18,10,1st Half,13:21,False,160,2025-01-11T18:16:15Z
401720809101867901,101867901,LayUpShot,Caleb Middleton made Layup.,18,12,1st Half,13:20,True,160,2025-01-11T18:16:15Z
401720809101874701,101874701,JumpShot,Gavin Walsh missed Three Point Jumper.,18,12,1st Half,12:52,False,2066,2025-01-11T18:16:29Z
401720809101875301,101875301,Defensive Rebound,Caleb Middleton Defensive Rebound.,18,12,1st Half,12:46,False,160,2025-01-11T18:16:29Z
401720809101876501,101876501,JumpShot,Antoni Siewruk made Three Point Jumper. Assisted by Sami Pissis.,18,15,1st Half,12:34,True,160,2025-01-11T18:17:00Z
401720809101876901,101876901,ShortTimeOut,Binghamton  Timeout,18,15,1st Half,12:30,False,2066,2025-01-11T18:17:00Z
401720809101878201,101878201,Lost Ball Turnover,Evan Ashe Turnover.,18,15,1st Half,12:17,False,2066,2025-01-11T18:20:13Z
401720809101879301,101879301,JumpShot,Anthony McComb III missed Three Point Jumper.,18,15,1st Half,12:06,False,160,2025-01-11T18:20:29Z
401720809101879801,101879801,Offensive Rebound,Emmanuel Okpomo Offensive Rebound.,18,15,1st Half,12:01,False,160,2025-01-11T18:20:59Z
401720809101884701,101884701,JumpShot,Sami Pissis missed Jumper.,18,15,1st Half,11:52,False,160,2025-01-11T18:20:59Z
401720809101885201,101885201,Defensive Rebound,Gavin Walsh Defensive Rebound.,18,15,1st Half,11:47,False,2066,2025-01-11T18:20:59Z
401720809101886601,101886601,LayUpShot,Gavin Walsh made Layup.,20,15,1st Half,11:33,True,2066,2025-01-11T18:22:14Z
401720809101888301,101888301,JumpShot,Khalil Badru made Jumper.,20,17,1st Half,11:16,True,160,2025-01-11T18:22:14Z
401720809101894601,101894601,PersonalFoul,Foul on Emmanuel Okpomo.,20,17,1st Half,10:53,False,160,2025-01-11T18:22:14Z
401720809101894602,101894602,MadeFreeThrow,Jayden Lemond made Free Throw.,21,17,1st Half,10:53,True,2066,2025-01-11T18:22:14Z
401720809101894603,101894603,MadeFreeThrow,Jayden Lemond made Free Throw.,22,17,1st Half,10:53,True,2066,2025-01-11T18:22:14Z
401720809101895701,101895701,PersonalFoul,Foul on Gavin Walsh.,22,17,1st Half,10:42,False,2066,2025-01-11T18:23:11Z
401720809101895702,101895702,MadeFreeThrow,Sami Pissis made Free Throw.,22,18,1st Half,10:42,True,160,2025-01-11T18:23:11Z
401720809101895703,101895703,MadeFreeThrow,Sami Pissis missed Free Throw.,22,18,1st Half,10:42,False,160,2025-01-11T18:23:11Z
401720809101895704,101895704,Defensive Rebound,Tymu Chenery Defensive Rebound.,22,18,1st Half,10:42,False,2066,2025-01-11T18:23:11Z
401720809101897301,101897301,JumpShot,Tymu Chenery missed Jumper.,22,18,1st Half,10:26,False,2066,2025-01-11T18:24:13Z
401720809101897801,101897801,Defensive Rebound,Sami Pissis Defensive Rebound.,22,18,1st Half,10:21,False,160,2025-01-11T18:24:13Z
401720809101898101,101898101,JumpShot,Sami Pissis missed Three Point Jumper.,22,18,1st Half,10:18,False,160,2025-01-11T18:24:30Z
401720809101898601,101898601,Defensive Rebound,Evan Ashe Defensive Rebound.,22,18,1st Half,10:13,False,2066,2025-01-11T18:24:30Z
401720809101899301,101899301,Lost Ball Turnover,Nehemiah Benson Turnover.,22,18,1st Half,10:06,False,2066,2025-01-11T18:24:30Z
401720809101904301,101904301,Lost Ball Turnover,Antoni Siewruk Turnover.,22,18,1st Half,9:56,False,160,2025-01-11T18:25:12Z
401720809101905301,101905301,JumpShot,Evan Ashe missed Three Point Jumper.,22,18,1st Half,9:46,False,2066,2025-01-11T18:26:15Z
401720809101905701,101905701,Defensive Rebound,Caleb Middleton Defensive Rebound.,22,18,1st Half,9:42,False,160,2025-01-11T18:26:15Z
401720809101906701,101906701,Lost Ball Turnover,Jawarie Hamelin Turnover.,22,18,1st Half,9:32,False,160,2025-01-11T18:26:15Z
401720809101906702,101906702,Steal,Evan Ashe Steal.,22,18,1st Half,9:32,False,2066,2025-01-11T18:26:15Z
401720809101907401,101907401,JumpShot,Nehemiah Benson made Jumper. Assisted by Tymu Chenery.,24,18,1st Half,9:25,True,2066,2025-01-11T18:26:15Z
401720809101908901,101908901,Lost Ball Turnover,Jawarie Hamelin Turnover.,24,18,1st Half,9:10,False,160,2025-01-11T18:26:30Z
401720809101908902,101908902,Steal,Tymu Chenery Steal.,24,18,1st Half,9:10,False,2066,2025-01-11T18:26:30Z
401720809101909401,101909401,DunkShot,Tymu Chenery made Dunk.,26,18,1st Half,9:05,True,2066,2025-01-11T18:26:30Z
401720809101909402,101909402,ShortTimeOut,New Hampshire  Timeout,26,18,1st Half,9:05,False,160,2025-01-11T18:26:30Z
401720809101915201,101915201,JumpShot,Anthony McComb III made Three Point Jumper. Assisted by Sami Pissis.,26,21,1st Half,8:47,True,160,2025-01-11T18:28:15Z
401720809101916801,101916801,JumpShot,Ben Callahan-Gold made Three Point Jumper. Assisted by Tymu Chenery.,29,21,1st Half,8:31,True,2066,2025-01-11T18:28:28Z
401720809101917901,101917901,PersonalFoul,Foul on Nehemiah Benson.,29,21,1st Half,8:20,False,2066,2025-01-11T18:28:28Z
401720809101919301,101919301,LayUpShot,Anthony McComb III made Layup.,29,23,1st Half,8:06,True,160,2025-01-11T18:29:12Z
401720809101919302,101919302,PersonalFoul,Foul on Chris Walker.,29,23,1st Half,8:06,False,2066,2025-01-11T18:29:12Z
401720809101919303,101919303,MadeFreeThrow,Anthony McComb III missed Free Throw.,29,23,1st Half,8:06,False,160,2025-01-11T18:29:12Z
401720809101919304,101919304,Defensive Rebound,Nehemiah Benson Defensive Rebound.,29,23,1st Half,8:06,False,2066,2025-01-11T18:29:12Z
401720809101924201,101924201,JumpShot,Jackson Benigni missed Three Point Jumper.,29,23,1st Half,7:57,False,2066,2025-01-11T18:30:15Z
401720809101924501,101924501,Defensive Rebound,Sami Pissis Defensive Rebound.,29,23,1st Half,7:54,False,160,2025-01-11T18:30:15Z
401720809101924901,101924901,PersonalFoul,Foul on Evan Ashe.,29,23,1st Half,7:50,False,2066,2025-01-11T18:30:15Z
401720809101924902,101924902,OfficialTVTimeOut, Official TV Timeout,29,23,1st Half,7:50,False,,2025-01-11T18:30:15Z
401720809101924903,101924903,MadeFreeThrow,Anthony McComb III made Free Throw.,29,24,1st Half,7:50,True,160,2025-01-11T18:30:15Z
401720809101924904,101924904,MadeFreeThrow,Anthony McComb III made Free Throw.,29,25,1st Half,7:50,True,160,2025-01-11T18:30:15Z
401720809101927001,101927001,PersonalFoul,Foul on Caleb Middleton.,29,25,1st Half,7:29,False,160,2025-01-11T18:34:13Z
401720809101927002,101927002,MadeFreeThrow,Nehemiah Benson made Free Throw.,30,25,1st Half,7:29,True,2066,2025-01-11T18:34:13Z
401720809101927003,101927003,MadeFreeThrow,Nehemiah Benson made Free Throw.,31,25,1st Half,7:29,True,2066,2025-01-11T18:34:13Z
401720809101929701,101929701,JumpShot,Khalil Badru missed Jumper.,31,25,1st Half,7:02,False,160,2025-01-11T18:36:16Z
401720809101934001,101934001,Defensive Rebound,Jayden Lemond Defensive Rebound.,31,25,1st Half,6:59,False,2066,2025-01-11T18:36:16Z
401720809101934501,101934501,LayUpShot,Chris Walker made Layup. Assisted by Nehemiah Benson.,33,25,1st Half,6:54,True,2066,2025-01-11T18:36:16Z
401720809101937201,101937201,JumpShot,Anthony McComb III missed Jumper.,33,25,1st Half,6:27,False,160,2025-01-11T18:36:16Z
401720809101937501,101937501,Defensive Rebound,Nehemiah Benson Defensive Rebound.,33,25,1st Half,6:24,False,2066,2025-01-11T18:36:16Z
401720809101938601,101938601,JumpShot,Nehemiah Benson made Jumper.,35,25,1st Half,6:13,True,2066,2025-01-11T18:36:16Z
401720809101944501,101944501,LayUpShot,Sami Pissis made Layup.,35,27,1st Half,5:54,True,160,2025-01-11T18:36:31Z
401720809101947301,101947301,JumpShot,Chris Walker missed Jumper.,35,27,1st Half,5:26,False,2066,2025-01-11T18:37:14Z
401720809101948001,101948001,Defensive Rebound,Caleb Middleton Defensive Rebound.,35,27,1st Half,5:19,False,160,2025-01-11T18:37:14Z
401720809101948501,101948501,LayUpShot,Caleb Middleton missed Layup.,35,27,1st Half,5:14,False,160,2025-01-11T18:37:14Z
401720809101948601,101948601,Offensive Rebound,New Hampshire Offensive Rebound.,35,27,1st Half,5:13,False,160,2025-01-11T18:37:14Z
401720809101949501,101949501,JumpShot,Sami Pissis made Jumper.,35,29,1st Half,5:04,True,160,2025-01-11T18:38:12Z
401720809101955301,101955301,JumpShot,Ben Callahan-Gold missed Three Point Jumper.,35,29,1st Half,4:46,False,2066,2025-01-11T18:38:12Z
401720809101955701,101955701,Offensive Rebound,Jackson Benigni Offensive Rebound.,35,29,1st Half,4:42,False,2066,2025-01-11T18:38:12Z
401720809101956301,101956301,JumpShot,Tymu Chenery missed Jumper.,35,29,1st Half,4:36,False,2066,2025-01-11T18:38:29Z
401720809101956601,101956601,Defensive Rebound,Jawarie Hamelin Defensive Rebound.,35,29,1st Half,4:33,False,160,2025-01-11T18:38:29Z
401720809101958001,101958001,LayUpShot,Antoni Siewruk made Layup.,35,31,1st Half,4:19,True,160,2025-01-11T18:40:14Z
401720809101964901,101964901,PersonalFoul,Foul on Gavin Walsh.,35,31,1st Half,3:50,False,2066,2025-01-11T18:40:14Z
401720809101964902,101964902,Lost Ball Turnover,Gavin Walsh Turnover.,35,31,1st Half,3:50,False,2066,2025-01-11T18:40:14Z
401720809101964903,101964903,OfficialTVTimeOut, Official TV Timeout,35,31,1st Half,3:50,False,,2025-01-11T18:40:14Z
401720809101965801,101965801,JumpShot,Sami Pissis missed Three Point Jumper.,35,31,1st Half,3:41,False,160,2025-01-11T18:43:03Z
401720809101966001,101966001,Offensive Rebound,New Hampshire Offensive Rebound.,35,31,1st Half,3:39,False,160,2025-01-11T18:43:03Z
401720809101967101,101967101,Lost Ball Turnover,Sami Pissis Turnover.,35,31,1st Half,3:28,False,160,2025-01-11T18:44:14Z
401720809101969401,101969401,JumpShot,Tymu Chenery made Three Point Jumper. Assisted by Chris Walker.,38,31,1st Half,3:05,True,2066,2025-01-11T18:44:14Z
401720809101975101,101975101,JumpShot,Antoni Siewruk made Jumper.,38,33,1st Half,2:48,True,160,2025-01-11T18:44:14Z
401720809101976401,101976401,JumpShot,Jackson Benigni missed Three Point Jumper.,38,33,1st Half,2:35,False,2066,2025-01-11T18:44:28Z
401720809101976801,101976801,Defensive Rebound,Anthony McComb III Defensive Rebound.,38,33,1st Half,2:31,False,160,2025-01-11T18:44:28Z
401720809101977301,101977301,JumpShot,Anthony McComb III made Jumper.,38,35,1st Half,2:26,True,160,2025-01-11T18:44:28Z
401720809101979401,101979401,Lost Ball Turnover,Tymu Chenery Turnover.,38,35,1st Half,2:05,False,2066,2025-01-11T18:44:59Z
401720809101979402,101979402,Steal,Emmanuel Okpomo Steal.,38,35,1st Half,2:05,False,160,2025-01-11T18:44:59Z
401720809101984001,101984001,JumpShot,Antoni Siewruk missed Three Point Jumper.,38,35,1st Half,1:59,False,160,2025-01-11T18:44:59Z
401720809101984201,101984201,Offensive Rebound,Emmanuel Okpomo Offensive Rebound.,38,35,1st Half,1:57,False,160,2025-01-11T18:44:59Z
401720809101984202,101984202,PersonalFoul,Foul on Nehemiah Benson.,38,35,1st Half,1:57,False,2066,2025-01-11T18:44:59Z
401720809101984203,101984203,MadeFreeThrow,Emmanuel Okpomo missed Free Throw.,38,35,1st Half,1:57,False,160,2025-01-11T18:46:14Z
401720809101984204,101984204,Offensive Rebound,New Hampshire Offensive Rebound.,38,35,1st Half,1:57,False,160,2025-01-11T18:46:14Z
401720809101984205,101984205,MadeFreeThrow,Emmanuel Okpomo missed Free Throw.,38,35,1st Half,1:57,False,160,2025-01-11T18:46:14Z
401720809101984301,101984301,Defensive Rebound,Ben Callahan-Gold Defensive Rebound.,38,35,1st Half,1:56,False,2066,2025-01-11T18:44:59Z
401720809101985501,101985501,PersonalFoul,Foul on Anthony McComb III.,38,35,1st Half,1:44,False,160,2025-01-11T18:46:28Z
401720809101986101,101986101,PersonalFoul,Foul on Davide Poser.,38,35,1st Half,1:38,False,160,2025-01-11T18:46:58Z
401720809101987701,101987701,JumpShot,Chris Walker made Three Point Jumper.,41,35,1st Half,1:22,True,2066,2025-01-11T18:47:11Z
401720809101989501,101989501,Lost Ball Turnover,Davide Poser Turnover.,41,35,1st Half,1:04,False,160,2025-01-11T18:48:13Z
401720809101995501,101995501,Lost Ball Turnover,Binghamton  Turnover.,41,35,1st Half,0:44,False,2066,2025-01-11T18:48:13Z
401720809101996501,101996501,JumpShot,Sami Pissis missed Three Point Jumper.,41,35,1st Half,0:34,False,160,2025-01-11T18:48:13Z
401720809101996801,101996801,Defensive Rebound,Jackson Benigni Defensive Rebound.,41,35,1st Half,0:31,False,2066,2025-01-11T18:48:13Z
401720809101997101,101997101,LayUpShot,Jackson Benigni missed Layup.,41,35,1st Half,0:28,False,2066,2025-01-11T18:48:44Z
401720809101997102,101997102,Offensive Rebound,Tymu Chenery Offensive Rebound.,41,35,1st Half,0:28,False,2066,2025-01-11T18:48:44Z
401720809101997103,101997103,PersonalFoul,Foul on Emmanuel Okpomo.,41,35,1st Half,0:28,False,160,2025-01-11T18:48:44Z
401720809101997104,101997104,MadeFreeThrow,Tymu Chenery made Free Throw.,42,35,1st Half,0:28,True,2066,2025-01-11T18:48:44Z
401720809101997105,101997105,MadeFreeThrow,Tymu Chenery missed Free Throw.,42,35,1st Half,0:28,False,2066,2025-01-11T18:48:44Z
401720809101997201,101997201,Defensive Rebound,Antoni Siewruk Defensive Rebound.,42,35,1st Half,0:27,False,160,2025-01-11T18:48:44Z
401720809101999701,101999701,LayUpShot,Sami Pissis made Layup.,42,37,1st Half,0:02,True,160,2025-01-11T18:48:44Z
401720809101999901,101999901,End Period,End of 1st half,42,37,1st Half,0:00,False,,2025-01-11T18:48:44Z
401720809102805101,102805101,JumpShot,Khalil Badru missed Jumper.,42,37,2nd Half,19:48,False,160,
401720809102805401,102805401,Defensive Rebound,Evan Ashe Defensive Rebound.,42,37,2nd Half,19:45,False,2066,
401720809102805701,102805701,LayUpShot,Tymu Chenery made Layup.,44,37,2nd Half,19:42,True,2066,
401720809102808601,102808601,LayUpShot,Davide Poser made Layup.,44,39,2nd Half,19:13,True,160,
401720809102815701,102815701,LayUpShot,Evan Ashe missed Layup.,44,39,2nd Half,18:42,False,2066,
401720809102816001,102816001,Defensive Rebound,Emmanuel Okpomo Defensive Rebound.,44,39,2nd Half,18:39,False,160,
401720809102817001,102817001,JumpShot,Jawarie Hamelin missed Jumper.,44,39,2nd Half,18:29,False,160,
401720809102817401,102817401,Defensive Rebound,Gavin Walsh Defensive Rebound.,44,39,2nd Half,18:25,False,2066,
401720809102819101,102819101,LayUpShot,Nehemiah Benson missed Layup.,44,39,2nd Half,18:08,False,2066,
401720809102819401,102819401,Defensive Rebound,Khalil Badru Defensive Rebound.,44,39,2nd Half,18:05,False,160,
401720809102826001,102826001,JumpShot,Khalil Badru missed Jumper.,44,39,2nd Half,17:39,False,160,2025-01-11T19:10:24Z
401720809102826301,102826301,Offensive Rebound,Emmanuel Okpomo Offensive Rebound.,44,39,2nd Half,17:36,False,160,2025-01-11T19:10:24Z
401720809102826302,102826302,LayUpShot,Emmanuel Okpomo made Layup.,44,41,2nd Half,17:36,True,160,2025-01-11T19:10:24Z
401720809102826303,102826303,PersonalFoul,Foul on Nehemiah Benson.,44,41,2nd Half,17:36,False,2066,2025-01-11T19:10:24Z
401720809102826304,102826304,MadeFreeThrow,Emmanuel Okpomo made Free Throw.,44,42,2nd Half,17:36,True,160,2025-01-11T19:10:24Z
401720809102827401,102827401,DunkShot,Evan Ashe missed Dunk.,44,42,2nd Half,17:25,False,2066,2025-01-11T19:10:24Z
401720809102827402,102827402,Block Shot,Emmanuel Okpomo Block.,44,42,2nd Half,17:25,False,160,2025-01-11T19:10:24Z
401720809102827601,102827601,Offensive Rebound,Binghamton Offensive Rebound.,44,42,2nd Half,17:23,False,2066,2025-01-11T19:10:24Z
401720809102827701,102827701,PersonalFoul,Foul on Sami Pissis.,44,42,2nd Half,17:22,False,160,2025-01-11T19:10:49Z
401720809102829301,102829301,JumpShot,Tymu Chenery missed Jumper.,44,42,2nd Half,17:06,False,2066,2025-01-11T19:12:23Z
401720809102829601,102829601,Offensive Rebound,Nehemiah Benson Offensive Rebound.,44,42,2nd Half,17:03,False,2066,2025-01-11T19:12:23Z
401720809102829602,102829602,JumpShot,Nehemiah Benson missed Jumper.,44,42,2nd Half,17:03,False,2066,2025-01-11T19:12:23Z
401720809102829603,102829603,Offensive Rebound,Nehemiah Benson Offensive Rebound.,44,42,2nd Half,17:03,False,2066,2025-01-11T19:12:23Z
401720809102829604,102829604,PersonalFoul,Foul on Jawarie Hamelin.,44,42,2nd Half,17:03,False,160,2025-01-11T19:12:23Z
401720809102835501,102835501,JumpShot,Nehemiah Benson missed Jumper.,44,42,2nd Half,16:44,False,2066,2025-01-11T19:12:23Z
401720809102835801,102835801,Offensive Rebound,Nehemiah Benson Offensive Rebound.,44,42,2nd Half,16:41,False,2066,2025-01-11T19:12:23Z
401720809102835901,102835901,LayUpShot,Nehemiah Benson missed Layup.,44,42,2nd Half,16:40,False,2066,2025-01-11T19:12:23Z
401720809102835903,102835903,Offensive Rebound,Gavin Walsh Offensive Rebound.,44,42,2nd Half,16:40,False,2066,2025-01-11T19:12:45Z
401720809102835904,102835904,LayUpShot,Gavin Walsh missed Layup.,44,42,2nd Half,16:40,False,2066,2025-01-11T19:12:45Z
401720809102835905,102835905,Defensive Rebound,New Hampshire Defensive Rebound.,44,42,2nd Half,16:40,False,160,2025-01-11T19:12:45Z
401720809102837201,102837201,JumpShot,Khalil Badru made Jumper.,44,44,2nd Half,16:27,True,160,2025-01-11T19:13:08Z
401720809102844201,102844201,LayUpShot,Gavin Walsh missed Layup.,44,44,2nd Half,15:57,False,2066,2025-01-11T19:13:08Z
401720809102844401,102844401,Offensive Rebound,Tymu Chenery Offensive Rebound.,44,44,2nd Half,15:55,False,2066,2025-01-11T19:13:08Z
401720809102844601,102844601,LayUpShot,Tymu Chenery missed Layup.,44,44,2nd Half,15:53,False,2066,2025-01-11T19:13:08Z
401720809102844901,102844901,Defensive Rebound,Emmanuel Okpomo Defensive Rebound.,44,44,2nd Half,15:50,False,160,2025-01-11T19:13:08Z
401720809102845201,102845201,LayUpShot,Sami Pissis made Layup.,44,46,2nd Half,15:47,True,160,2025-01-11T19:13:08Z
401720809102846901,102846901,LayUpShot,Tymu Chenery made Layup.,46,46,2nd Half,15:30,True,2066,2025-01-11T19:13:08Z
401720809102849101,102849101,JumpShot,Sami Pissis missed Jumper.,46,46,2nd Half,15:08,False,160,2025-01-11T19:13:08Z
401720809102849301,102849301,Defensive Rebound,Gavin Walsh Defensive Rebound.,46,46,2nd Half,15:06,False,2066,2025-01-11T19:13:08Z
401720809102849302,102849302,PersonalFoul,Foul on Sami Pissis.,46,46,2nd Half,15:06,False,160,2025-01-11T19:13:08Z
401720809102849303,102849303,OfficialTVTimeOut, Official TV Timeout,46,46,2nd Half,15:06,False,,2025-01-11T19:13:08Z
401720809102855101,102855101,PersonalFoul,Foul on Caleb Middleton.,46,46,2nd Half,14:48,False,160,2025-01-11T19:17:21Z
401720809102855102,102855102,MadeFreeThrow,Gavin Walsh made Free Throw.,47,46,2nd Half,14:48,True,2066,2025-01-11T19:17:21Z
401720809102855103,102855103,MadeFreeThrow,Gavin Walsh made Free Throw.,48,46,2nd Half,14:48,True,2066,2025-01-11T19:17:21Z
401720809102857901,102857901,Lost Ball Turnover,Caleb Middleton Turnover.,48,46,2nd Half,14:20,False,160,2025-01-11T19:18:49Z
401720809102864101,102864101,JumpShot,Gavin Walsh made Jumper.,50,46,2nd Half,13:58,True,2066,2025-01-11T19:20:24Z
401720809102867001,102867001,JumpShot,Anthony McComb III missed Three Point Jumper.,50,46,2nd Half,13:29,False,160,2025-01-11T19:20:24Z
401720809102867201,102867201,Defensive Rebound,Gavin Walsh Defensive Rebound.,50,46,2nd Half,13:27,False,2066,2025-01-11T19:20:24Z
401720809102869201,102869201,PersonalFoul,Foul on Caleb Middleton.,50,46,2nd Half,13:07,False,160,2025-01-11T19:20:24Z
401720809102869202,102869202,MadeFreeThrow,Gavin Walsh missed Free Throw.,50,46,2nd Half,13:07,False,2066,2025-01-11T19:20:48Z
401720809102869203,102869203,Offensive Rebound,Binghamton Offensive Rebound.,50,46,2nd Half,13:07,False,2066,2025-01-11T19:20:48Z
401720809102869204,102869204,MadeFreeThrow,Gavin Walsh missed Free Throw.,50,46,2nd Half,13:07,False,2066,2025-01-11T19:20:48Z
401720809102869301,102869301,Defensive Rebound,Antoni Siewruk Defensive Rebound.,50,46,2nd Half,13:06,False,160,2025-01-11T19:20:48Z
401720809102875101,102875101,JumpShot,Sami Pissis made Three Point Jumper. Assisted by Emmanuel Okpomo.,50,49,2nd Half,12:48,True,160,2025-01-11T19:22:27Z
401720809102877301,102877301,Lost Ball Turnover,Jackson Benigni Turnover.,50,49,2nd Half,12:26,False,2066,2025-01-11T19:20:48Z
401720809102877302,102877302,Steal,Emmanuel Okpomo Steal.,50,49,2nd Half,12:26,False,160,2025-01-11T19:20:48Z
401720809102878101,102878101,JumpShot,Sami Pissis missed Three Point Jumper.,50,49,2nd Half,12:18,False,160,2025-01-11T19:20:48Z
401720809102878601,102878601,Defensive Rebound,Ben Callahan-Gold Defensive Rebound.,50,49,2nd Half,12:13,False,2066,2025-01-11T19:20:48Z
