play_id,sequence_number,type,description,away_score,home_score,period,clock,scoring_play,team_id,timestamp_utc
401722301102835302,102835302,Steal,Chris Morgan Steal.,37,34,2nd Half,16:46,False,2405,2024-11-19T01:43:57Z
401722301102835901,102835901,JumpShot,Abdi Bashir Jr. made Three Point Jumper. Assisted by Madison Durr.,40,34,2nd Half,16:40,True,2405,2024-11-19T01:44:06Z
401722301102837401,102837401,LayUpShot,Matej Bosnjak made Layup. Assisted by Justin Hill.,40,36,2nd Half,16:25,True,2724,2024-11-19T01:44:16Z
401722301102839901,102839901,JumpShot,Chris Morgan missed Jumper.,40,36,2nd Half,16:00,False,2405,2024-11-19T01:45:01Z
401722301102844001,102844001,Offensive Rebound,Monmouth Offensive Rebound.,40,36,2nd Half,15:59,False,2405,2024-11-19T01:45:01Z
401722301102844002,102844002,PersonalFoul,Foul on Corey Washington.,40,36,2nd Half,15:59,False,2724,2024-11-19T01:45:01Z
401722301102844003,102844003,OfficialTVTimeOut, Official TV Timeout,40,36,2nd Half,15:59,False,,2024-11-19T01:45:01Z
401722301102844501,102844501,PersonalFoul,Foul on Xavier Bell.,40,36,2nd Half,15:54,False,2724,2024-11-19T01:48:06Z
401722301102844502,102844502,MadeFreeThrow,Madison Durr made Free Throw.,41,36,2nd Half,15:54,True,2405,2024-11-19T01:48:06Z
401722301102844503,102844503,MadeFreeThrow,Madison Durr missed Free Throw.,41,36,2nd Half,15:54,False,2405,2024-11-19T01:48:06Z
401722301102844504,102844504,Defensive Rebound,Harlond Beverly Defensive Rebound.,41,36,2nd Half,15:54,False,2724,2024-11-19T01:48:06Z
401722301102845501,102845501,JumpShot,Corey Washington missed Jumper.,41,36,2nd Half,15:44,False,2724,2024-11-19T01:48:57Z
401722301102845901,102845901,Offensive Rebound,Ronnie DeGray III Offensive Rebound.,41,36,2nd Half,15:40,False,2724,2024-11-19T01:49:02Z
401722301102846501,102846501,JumpShot,Justin Hill missed Three Point Jumper.,41,36,2nd Half,15:34,False,2724,2024-11-19T01:49:07Z
401722301102846801,102846801,Defensive Rebound,Cornelius Robinson III Defensive Rebound.,41,36,2nd Half,15:31,False,2405,2024-11-19T01:49:10Z
401722301102848401,102848401,LayUpShot,Cornelius Robinson III made Layup.,43,36,2nd Half,15:15,True,2405,2024-11-19T01:49:27Z
401722301102854101,102854101,LayUpShot,Harlond Beverly made Layup.,43,38,2nd Half,14:58,True,2724,2024-11-19T01:49:43Z
401722301102854102,102854102,ShortTimeOut,Wichita State  Timeout,43,38,2nd Half,14:58,False,2724,2024-11-19T01:49:43Z
401722301102856501,102856501,JumpShot,Cornelius Robinson III made Jumper.,45,38,2nd Half,14:34,True,2405,2024-11-19T01:52:54Z
401722301102858701,102858701,LayUpShot,Harlond Beverly made Layup.,45,40,2nd Half,14:12,True,2724,2024-11-19T01:53:31Z
401722301102864201,102864201,Lost Ball Turnover,Abdi Bashir Jr. Turnover.,45,40,2nd Half,13:57,False,2405,2024-11-19T01:53:58Z
401722301102864202,102864202,Steal,Harlond Beverly Steal.,45,40,2nd Half,13:57,False,2724,2024-11-19T01:53:58Z
401722301102864901,102864901,JumpShot,Justin Hill made Jumper. Assisted by Harlond Beverly.,45,42,2nd Half,13:50,True,2724,2024-11-19T01:54:11Z
401722301102865601,102865601,ShortTimeOut,Monmouth  Timeout,45,42,2nd Half,13:43,False,2405,2024-11-19T01:54:11Z
401722301102866501,102866501,JumpShot,Madison Durr missed Three Point Jumper.,45,42,2nd Half,13:34,False,2405,2024-11-19T01:55:29Z
401722301102866801,102866801,Defensive Rebound,Justin Hill Defensive Rebound.,45,42,2nd Half,13:31,False,2724,2024-11-19T01:55:32Z
401722301102867201,102867201,LayUpShot,Justin Hill missed Layup.,45,42,2nd Half,13:27,False,2724,2024-11-19T01:55:39Z
401722301102867202,102867202,Block Shot,Cornelius Robinson III Block.,45,42,2nd Half,13:27,False,2405,2024-11-19T01:55:39Z
401722301102867601,102867601,Defensive Rebound,Cornelius Robinson III Defensive Rebound.,45,42,2nd Half,13:23,False,2405,2024-11-19T01:55:39Z
401722301102868401,102868401,JumpShot,Abdi Bashir Jr. missed Jumper.,45,42,2nd Half,13:15,False,2405,2024-11-19T01:55:47Z
401722301102868701,102868701,Defensive Rebound,Joy Ighovodja Defensive Rebound.,45,42,2nd Half,13:12,False,2724,2024-11-19T01:55:50Z
401722301102869001,102869001,PersonalFoul,Foul on Madison Durr.,45,42,2nd Half,13:09,False,2405,2024-11-19T01:55:53Z
401722301102869002,102869002,MadeFreeThrow,Xavier Bell made Free Throw.,45,43,2nd Half,13:09,True,2724,2024-11-19T01:55:53Z
401722301102869003,102869003,MadeFreeThrow,Xavier Bell made Free Throw.,45,44,2nd Half,13:09,True,2724,2024-11-19T01:55:53Z
401722301102875801,102875801,JumpShot,Jack Collins missed Three Point Jumper.,45,44,2nd Half,12:41,False,2405,2024-11-19T01:57:20Z
401722301102876101,102876101,Defensive Rebound,Harlond Beverly Defensive Rebound.,45,44,2nd Half,12:38,False,2724,2024-11-19T01:57:24Z
401722301102877301,102877301,LayUpShot,Xavier Bell missed Layup.,45,44,2nd Half,12:26,False,2724,2024-11-19T01:57:36Z
401722301102877302,102877302,Block Shot,Justin Ray Block.,45,44,2nd Half,12:26,False,2405,2024-11-19T01:57:39Z
401722301102877701,102877701,Offensive Rebound,Matej Bosnjak Offensive Rebound.,45,44,2nd Half,12:22,False,2724,2024-11-19T01:57:39Z
401722301102878601,102878601,JumpShot,Harlond Beverly missed Three Point Jumper.,45,44,2nd Half,12:13,False,2724,2024-11-19T01:57:48Z
401722301102878602,102878602,Defensive Rebound,Monmouth Defensive Rebound.,45,44,2nd Half,12:13,False,2405,2024-11-19T01:57:48Z
401722301102885101,102885101,JumpShot,Andrew Ball missed Three Point Jumper.,45,44,2nd Half,11:48,False,2405,2024-11-19T01:58:39Z
401722301102885401,102885401,Defensive Rebound,Joy Ighovodja Defensive Rebound.,45,44,2nd Half,11:45,False,2724,2024-11-19T01:58:42Z
401722301102886401,102886401,JumpShot,Bijan Cortes missed Three Point Jumper.,45,44,2nd Half,11:35,False,2724,2024-11-19T01:58:53Z
401722301102886801,102886801,Defensive Rebound,Chris Morgan Defensive Rebound.,45,44,2nd Half,11:31,False,2405,2024-11-19T01:58:56Z
401722301102889801,102889801,JumpShot,Chris Morgan missed Jumper.,45,44,2nd Half,11:01,False,2405,2024-11-19T01:59:27Z
401722301102894101,102894101,Offensive Rebound,Aric Demings Offensive Rebound.,45,44,2nd Half,10:58,False,2405,2024-11-19T01:59:29Z
401722301102894801,102894801,PersonalFoul,Foul on Xavier Bell.,45,44,2nd Half,10:51,False,2724,2024-11-19T01:59:35Z
401722301102894802,102894802,OfficialTVTimeOut, Official TV Timeout,45,44,2nd Half,10:51,False,,2024-11-19T01:59:35Z
401722301102896101,102896101,JumpShot,Andrew Ball made Three Point Jumper. Assisted by Jack Collins.,48,44,2nd Half,10:38,True,2405,2024-11-19T02:02:54Z
401722301102897801,102897801,Lost Ball Turnover,Matej Bosnjak Turnover.,48,44,2nd Half,10:21,False,2724,2024-11-19T02:03:11Z
401722301102897802,102897802,Steal,Justin Ray Steal.,48,44,2nd Half,10:21,False,2405,2024-11-19T02:03:15Z
401722301102898301,102898301,LayUpShot,Aric Demings made Layup. Assisted by Justin Ray.,50,44,2nd Half,10:16,True,2405,2024-11-19T02:03:15Z
401722301102899301,102899301,LayUpShot,Xavier Bell missed Layup.,50,44,2nd Half,10:06,False,2724,2024-11-19T02:03:26Z
401722301102899701,102899701,Offensive Rebound,Xavier Bell Offensive Rebound.,50,44,2nd Half,10:02,False,2724,2024-11-19T02:03:29Z
401722301102904501,102904501,JumpShot,Xavier Bell made Jumper.,50,46,2nd Half,9:54,True,2724,2024-11-19T02:03:38Z
401722301102906201,102906201,PersonalFoul,Foul on Xavier Bell.,50,46,2nd Half,9:37,False,2724,2024-11-19T02:03:54Z
401722301102906501,102906501,LayUpShot,Aric Demings made Layup. Assisted by Jack Collins.,52,46,2nd Half,9:34,True,2405,2024-11-19T02:04:30Z
401722301102908601,102908601,JumpShot,Harlond Beverly missed Three Point Jumper.,52,46,2nd Half,9:13,False,2724,2024-11-19T02:04:51Z
401722301102908901,102908901,Defensive Rebound,Andrew Ball Defensive Rebound.,52,46,2nd Half,9:10,False,2405,2024-11-19T02:04:54Z
401722301102915401,102915401,JumpShot,Chris Morgan missed Jumper.,52,46,2nd Half,8:45,False,2405,2024-11-19T02:05:20Z
401722301102915701,102915701,Defensive Rebound,Harlond Beverly Defensive Rebound.,52,46,2nd Half,8:42,False,2724,2024-11-19T02:05:25Z
401722301102916501,102916501,LayUpShot,Harlond Beverly made Layup.,52,48,2nd Half,8:34,True,2724,2024-11-19T02:05:29Z
401722301102918401,102918401,LayUpShot,Aric Demings missed Layup.,52,48,2nd Half,8:15,False,2405,2024-11-19T02:05:49Z
401722301102918402,102918402,Block Shot,Corey Washington Block.,52,48,2nd Half,8:15,False,2724,2024-11-19T02:05:49Z
401722301102918403,102918403,Offensive Rebound,Monmouth Offensive Rebound.,52,48,2nd Half,8:15,False,2405,2024-11-19T02:05:49Z
401722301102919301,102919301,Lost Ball Turnover,Jack Collins Turnover.,52,48,2nd Half,8:06,False,2405,2024-11-19T02:06:23Z
401722301102919302,102919302,Steal,Xavier Bell Steal.,52,48,2nd Half,8:06,False,2724,2024-11-19T02:06:23Z
401722301102925501,102925501,JumpShot,Corey Washington missed Three Point Jumper.,52,48,2nd Half,7:44,False,2724,2024-11-19T02:07:00Z
401722301102925502,102925502,Offensive Rebound,Wichita State Offensive Rebound.,52,48,2nd Half,7:44,False,2724,2024-11-19T02:07:00Z
401722301102925503,102925503,PersonalFoul,Foul on Madison Durr.,52,48,2nd Half,7:44,False,2405,2024-11-19T02:07:00Z
401722301102925504,102925504,OfficialTVTimeOut, Official TV Timeout,52,48,2nd Half,7:44,False,,2024-11-19T02:07:00Z
401722301102926901,102926901,JumpShot,Harlond Beverly made Jumper. Assisted by Matej Bosnjak.,52,50,2nd Half,7:30,True,2724,2024-11-19T02:10:16Z
401722301102929501,102929501,PersonalFoul,Foul on Corey Washington.,52,50,2nd Half,7:04,False,2724,2024-11-19T02:10:41Z
401722301102929502,102929502,MadeFreeThrow,Madison Durr missed Free Throw.,52,50,2nd Half,7:04,False,2405,2024-11-19T02:11:17Z
401722301102929503,102929503,Offensive Rebound,Monmouth Offensive Rebound.,52,50,2nd Half,7:04,False,2405,2024-11-19T02:11:17Z
401722301102929504,102929504,MadeFreeThrow,Madison Durr missed Free Throw.,52,50,2nd Half,7:04,False,2405,2024-11-19T02:11:17Z
401722301102929505,102929505,Defensive Rebound,Harlond Beverly Defensive Rebound.,52,50,2nd Half,7:04,False,2724,2024-11-19T02:11:17Z
401722301102935301,102935301,JumpShot,Justin Hill missed Jumper.,52,50,2nd Half,6:46,False,2724,2024-11-19T02:11:55Z
401722301102935701,102935701,Defensive Rebound,Jack Collins Defensive Rebound.,52,50,2nd Half,6:42,False,2405,2024-11-19T02:11:58Z
401722301102937601,102937601,JumpShot,Abdi Bashir Jr. missed Three Point Jumper.,52,50,2nd Half,6:23,False,2405,2024-11-19T02:12:18Z
401722301102937901,102937901,Defensive Rebound,Corey Washington Defensive Rebound.,52,50,2nd Half,6:20,False,2724,2024-11-19T02:12:21Z
401722301102939001,102939001,LayUpShot,Xavier Bell made Layup. Assisted by Matej Bosnjak.,52,52,2nd Half,6:09,True,2724,2024-11-19T02:12:32Z
401722301102945501,102945501,JumpShot,Abdi Bashir Jr. made Jumper.,54,52,2nd Half,5:44,True,2405,2024-11-19T02:12:56Z
401722301102946901,102946901,DunkShot,Harlond Beverly made Dunk. Assisted by Justin Hill.,54,54,2nd Half,5:30,True,2724,2024-11-19T02:13:10Z
401722301102949101,102949101,JumpShot,Jaret Valencia missed Jumper.,54,54,2nd Half,5:08,False,2405,2024-11-19T02:13:32Z
401722301102949401,102949401,Defensive Rebound,Matej Bosnjak Defensive Rebound.,54,54,2nd Half,5:05,False,2724,2024-11-19T02:13:36Z
401722301102954001,102954001,JumpShot,Justin Hill missed Three Point Jumper.,54,54,2nd Half,4:59,False,2724,2024-11-19T02:13:42Z
401722301102954101,102954101,Defensive Rebound,Monmouth Defensive Rebound.,54,54,2nd Half,4:58,False,2405,2024-11-19T02:13:42Z
401722301102954102,102954102,PersonalFoul,Foul on Matej Bosnjak.,54,54,2nd Half,4:58,False,2724,2024-11-19T02:13:42Z
401722301102954103,102954103,MadeFreeThrow,Cornelius Robinson III missed Free Throw.,54,54,2nd Half,4:58,False,2405,2024-11-19T02:14:06Z
401722301102954201,102954201,Defensive Rebound,Harlond Beverly Defensive Rebound.,54,54,2nd Half,4:57,False,2724,2024-11-19T02:14:24Z
401722301102956001,102956001,DunkShot,Corey Washington made Dunk. Assisted by Justin Hill.,54,56,2nd Half,4:39,True,2724,2024-11-19T02:14:43Z
401722301102956701,102956701,ShortTimeOut,Monmouth  Timeout,54,56,2nd Half,4:32,False,2405,2024-11-19T02:14:51Z
401722301102958001,102958001,Lost Ball Turnover,Abdi Bashir Jr. Turnover.,54,56,2nd Half,4:19,False,2405,2024-11-19T02:18:08Z
401722301102958002,102958002,Steal,Justin Hill Steal.,54,56,2nd Half,4:19,False,2724,2024-11-19T02:18:11Z
401722301102958401,102958401,LayUpShot,Justin Hill missed Layup.,54,56,2nd Half,4:15,False,2724,2024-11-19T02:18:11Z
401722301102958701,102958701,Defensive Rebound,Jack Collins Defensive Rebound.,54,56,2nd Half,4:12,False,2405,2024-11-19T02:18:15Z
401722301102965501,102965501,JumpShot,Chris Morgan made Jumper.,56,56,2nd Half,3:44,True,2405,2024-11-19T02:18:44Z
401722301102966101,102966101,Lost Ball Turnover,Corey Washington Turnover.,56,56,2nd Half,3:38,False,2724,2024-11-19T02:18:50Z
401722301102966102,102966102,Steal,Cornelius Robinson III Steal.,56,56,2nd Half,3:38,False,2405,2024-11-19T02:18:50Z
401722301102968301,102968301,JumpShot,Cornelius Robinson III made Jumper. Assisted by Chris Morgan.,58,56,2nd Half,3:16,True,2405,2024-11-19T02:19:13Z
401722301102975101,102975101,JumpShot,Corey Washington made Jumper.,58,58,2nd Half,2:48,True,2724,2024-11-19T02:19:38Z
401722301102978101,102978101,PersonalFoul,Foul on Xavier Bell.,58,58,2nd Half,2:18,False,2724,2024-11-19T02:20:08Z
401722301102978102,102978102,MadeFreeThrow,Madison Durr made Free Throw.,59,58,2nd Half,2:18,True,2405,2024-11-19T02:20:44Z
401722301102978103,102978103,MadeFreeThrow,Madison Durr missed Free Throw.,59,58,2nd Half,2:18,False,2405,2024-11-19T02:20:44Z
401722301102978104,102978104,Defensive Rebound,Justin Hill Defensive Rebound.,59,58,2nd Half,2:18,False,2724,2024-11-19T02:20:44Z
401722301102979201,102979201,PersonalFoul,Foul on Cornelius Robinson III.,59,58,2nd Half,2:07,False,2405,2024-11-19T02:21:11Z
401722301102979202,102979202,MadeFreeThrow,Justin Hill made Free Throw.,59,59,2nd Half,2:07,True,2724,2024-11-19T02:21:11Z
401722301102979203,102979203,MadeFreeThrow,Justin Hill missed Free Throw.,59,59,2nd Half,2:07,False,2724,2024-11-19T02:21:11Z
401722301102979301,102979301,Defensive Rebound,Cornelius Robinson III Defensive Rebound.,59,59,2nd Half,2:06,False,2405,2024-11-19T02:22:04Z
401722301102984501,102984501,DunkShot,Jaret Valencia missed Dunk.,59,59,2nd Half,1:54,False,2405,2024-11-19T02:22:22Z
401722301102984801,102984801,Offensive Rebound,Monmouth Offensive Rebound.,59,59,2nd Half,1:51,False,2405,2024-11-19T02:22:22Z
401722301102984802,102984802,PersonalFoul,Foul on Corey Washington.,59,59,2nd Half,1:51,False,2724,2024-11-19T02:22:22Z
401722301102984803,102984803,MadeFreeThrow,Jaret Valencia missed Free Throw.,59,59,2nd Half,1:51,False,2405,2024-11-19T02:22:22Z
401722301102984804,102984804,Offensive Rebound,Monmouth Offensive Rebound.,59,59,2nd Half,1:51,False,2405,2024-11-19T02:22:22Z
401722301102984805,102984805,MadeFreeThrow,Jaret Valencia missed Free Throw.,59,59,2nd Half,1:51,False,2405,2024-11-19T02:22:22Z
401722301102984806,102984806,Defensive Rebound,Justin Hill Defensive Rebound.,59,59,2nd Half,1:51,False,2724,2024-11-19T02:22:22Z
401722301102986001,102986001,JumpShot,Corey Washington made Three Point Jumper. Assisted by Justin Hill.,59,62,2nd Half,1:39,True,2724,2024-11-19T02:23:21Z
401722301102987201,102987201,RegularTimeOut,Monmouth  Timeout,59,62,2nd Half,1:27,False,2405,2024-11-19T02:23:33Z
401722301102988601,102988601,Lost Ball Turnover,Jack Collins Turnover.,59,62,2nd Half,1:13,False,2405,2024-11-19T02:25:26Z
401722301102988602,102988602,Steal,Xavier Bell Steal.,59,62,2nd Half,1:13,False,2724,2024-11-19T02:25:30Z
401722301102989001,102989001,DunkShot,Corey Washington made Dunk. Assisted by Xavier Bell.,59,64,2nd Half,1:09,True,2724,2024-11-19T02:25:30Z
401722301102994501,102994501,Lost Ball Turnover,Jack Collins Turnover.,59,64,2nd Half,0:54,False,2405,2024-11-19T02:25:45Z
401722301102994502,102994502,Steal,Harlond Beverly Steal.,59,64,2nd Half,0:54,False,2724,2024-11-19T02:25:45Z
401722301102996001,102996001,PersonalFoul,Foul on Jack Collins.,59,64,2nd Half,0:39,False,2405,2024-11-19T02:25:59Z
401722301102996101,102996101,PersonalFoul,Foul on Jack Collins.,59,64,2nd Half,0:38,False,2405,2024-11-19T02:26:27Z
401722301102996301,102996301,PersonalFoul,Foul on Jack Collins.,59,64,2nd Half,0:36,False,2405,2024-11-19T02:26:51Z
401722301102996302,102996302,MadeFreeThrow,Matej Bosnjak made Free Throw.,59,65,2nd Half,0:36,True,2724,2024-11-19T02:26:51Z
401722301102996303,102996303,MadeFreeThrow,Matej Bosnjak made Free Throw.,59,66,2nd Half,0:36,True,2724,2024-11-19T02:26:51Z
401722301102997301,102997301,JumpShot,Abdi Bashir Jr. made Three Point Jumper.,62,66,2nd Half,0:26,True,2405,2024-11-19T02:27:51Z
401722301102997501,102997501,PersonalFoul,Foul on Jaret Valencia.,62,66,2nd Half,0:24,False,2405,2024-11-19T02:28:01Z
401722301102997502,102997502,MadeFreeThrow,Xavier Bell made Free Throw.,62,67,2nd Half,0:24,True,2724,2024-11-19T02:28:39Z
401722301102997503,102997503,MadeFreeThrow,Xavier Bell made Free Throw.,62,68,2nd Half,0:24,True,2724,2024-11-19T02:28:39Z
401722301102998301,102998301,LayUpShot,Abdi Bashir Jr. made Layup. Assisted by Madison Durr.,64,68,2nd Half,0:16,True,2405,2024-11-19T02:29:06Z
401722301102998401,102998401,PersonalFoul,Foul on Abdi Bashir Jr..,64,68,2nd Half,0:15,False,2405,2024-11-19T02:29:06Z
401722301102998402,102998402,MadeFreeThrow,Xavier Bell made Free Throw.,64,69,2nd Half,0:15,True,2724,2024-11-19T02:29:06Z
401722301102998403,102998403,MadeFreeThrow,Xavier Bell made Free Throw.,64,70,2nd Half,0:15,True,2724,2024-11-19T02:29:06Z
401722301102999101,102999101,JumpShot,Abdi Bashir Jr. missed Three Point Jumper.,64,70,2nd Half,0:08,False,2405,2024-11-19T02:30:14Z
401722301102999501,102999501,Offensive Rebound,Jack Collins Offensive Rebound.,64,70,2nd Half,0:04,False,2405,2024-11-19T02:30:18Z
401722301102999601,102999601,LayUpShot,Jack Collins made Layup.,66,70,2nd Half,0:03,True,2405,2024-11-19T02:30:18Z
401722301102999901,102999901,End Period,End of 2nd half,66,70,2nd Half,0:00,False,,2024-11-19T02:30:18Z
401722301102999902,102999902,End Game,End of Game,66,70,2nd Half,0:00,False,,2024-11-19T02:30:18Z
