play_id,sequence_number,type,description,away_score,home_score,period,clock,scoring_play,team_id,timestamp_utc
401706303101805201,101805201,LayUpShot,Antwone Woolfolk made Layup. Assisted by Peter Suder.,0,2,1st Half,19:47,True,193,2025-01-04T18:03:13Z
401706303101806301,101806301,LayUpShot,Tyson Dunn made Layup.,2,2,1st Half,19:36,True,2084,2025-01-04T18:03:26Z
401706303101807701,101807701,JumpShot,Kam Craft missed Three Point Jumper.,2,2,1st Half,19:22,False,193,2025-01-04T18:03:39Z
401706303101807901,101807901,Defensive Rebound,Noah Batchelor Defensive Rebound.,2,2,1st Half,19:20,False,2084,2025-01-04T18:03:40Z
401706303101809801,101809801,JumpShot,Tyson Dunn missed Three Point Jumper.,2,2,1st Half,19:01,False,2084,2025-01-04T18:04:01Z
401706303101814001,101814001,Defensive Rebound,Peter Suder Defensive Rebound.,2,2,1st Half,18:59,False,193,2025-01-04T18:04:01Z
401706303101815001,101815001,JumpShot,Peter Suder made Jumper.,2,4,1st Half,18:49,True,193,2025-01-04T18:04:12Z
401706303101817701,101817701,JumpShot,Noah Batchelor made Three Point Jumper. Assisted by Tyson Dunn.,5,4,1st Half,18:22,True,2084,2025-01-04T18:04:40Z
401706303101819801,101819801,JumpShot,Eian Elmer missed Three Point Jumper.,5,4,1st Half,18:01,False,193,2025-01-04T18:05:02Z
401706303101824101,101824101,Defensive Rebound,Tyson Dunn Defensive Rebound.,5,4,1st Half,17:58,False,2084,2025-01-04T18:05:02Z
401706303101826501,101826501,JumpShot,Ben Michaels missed Three Point Jumper.,5,4,1st Half,17:34,False,2084,2025-01-04T18:05:27Z
401706303101826701,101826701,Defensive Rebound,Peter Suder Defensive Rebound.,5,4,1st Half,17:32,False,193,2025-01-04T18:05:30Z
401706303101827201,101827201,PersonalFoul,Foul on Anquan Boldin Jr..,5,4,1st Half,17:27,False,2084,2025-01-04T18:05:33Z
401706303101828401,101828401,JumpShot,Kam Craft missed Three Point Jumper.,5,4,1st Half,17:15,False,193,2025-01-04T18:06:13Z
401706303101828801,101828801,Offensive Rebound,Kam Craft Offensive Rebound.,5,4,1st Half,17:11,False,193,2025-01-04T18:06:16Z
401706303101828901,101828901,LayUpShot,Kam Craft made Layup.,5,6,1st Half,17:10,True,193,2025-01-04T18:06:16Z
401706303101835501,101835501,LayUpShot,Ben Michaels made Layup. Assisted by Tyson Dunn.,7,6,1st Half,16:44,True,2084,2025-01-04T18:06:44Z
401706303101837901,101837901,JumpShot,Mekhi Cooper made Three Point Jumper. Assisted by Eian Elmer.,7,9,1st Half,16:20,True,193,2025-01-04T18:07:09Z
401706303101839801,101839801,LayUpShot,Tyson Dunn missed Layup.,7,9,1st Half,16:01,False,2084,2025-01-04T18:07:27Z
401706303101844001,101844001,Defensive Rebound,Antwone Woolfolk Defensive Rebound.,7,9,1st Half,15:59,False,193,2025-01-04T18:07:29Z
401706303101845901,101845901,JumpShot,Mekhi Cooper missed Three Point Jumper.,7,9,1st Half,15:40,False,193,2025-01-04T18:07:48Z
401706303101846301,101846301,Defensive Rebound,Bryson Wilson Defensive Rebound.,7,9,1st Half,15:36,False,2084,2025-01-04T18:07:51Z
401706303101847601,101847601,Lost Ball Turnover,Ben Michaels Turnover.,7,9,1st Half,15:23,False,2084,2025-01-04T18:08:04Z
401706303101847602,101847602,OfficialTVTimeOut, Official TV Timeout,7,9,1st Half,15:23,False,,2025-01-04T18:08:04Z
401706303101849101,101849101,JumpShot,Evan Ipsaro missed Three Point Jumper.,7,9,1st Half,15:08,False,193,2025-01-04T18:40:56Z
401706303101849402,101849402,Defensive Rebound,Tim Oboh Defensive Rebound.,7,9,1st Half,15:05,False,2084,2025-01-04T18:40:56Z
401706303101854003,101854003,JumpShot,Noah Batchelor made Three Point Jumper. Assisted by Tyson Dunn.,10,9,1st Half,14:59,True,2084,2025-01-04T18:17:35Z
401706303101855701,101855701,JumpShot,Eian Elmer made Three Point Jumper. Assisted by Reece Potter.,10,12,1st Half,14:42,True,193,2025-01-04T18:11:47Z
401706303101857601,101857601,Lost Ball Turnover,Tyson Dunn Turnover.,10,12,1st Half,14:23,False,2084,2025-01-04T18:12:06Z
401706303101857602,101857602,Steal,Peter Suder Steal.,10,12,1st Half,14:23,False,193,2025-01-04T18:12:06Z
401706303101858301,101858301,JumpShot,Luke Skaljac missed Three Point Jumper.,10,12,1st Half,14:16,False,193,2025-01-04T18:12:13Z
401706303101858701,101858701,Defensive Rebound,Noah Batchelor Defensive Rebound.,10,12,1st Half,14:12,False,2084,2025-01-04T18:12:15Z
401706303101864201,101864201,JumpShot,Tyson Dunn made Three Point Jumper. Assisted by Noah Batchelor.,13,12,1st Half,13:57,True,2084,2025-01-04T18:12:31Z
401706303101865001,101865001,PersonalFoul,Foul on Bryson Wilson.,13,12,1st Half,13:49,False,2084,2025-01-04T18:12:39Z
401706303101866101,101866101,JumpShot,Reece Potter missed Jumper.,13,12,1st Half,13:38,False,193,2025-01-04T18:13:18Z
401706303101866301,101866301,Defensive Rebound,Anquan Boldin Jr. Defensive Rebound.,13,12,1st Half,13:36,False,2084,2025-01-04T18:13:22Z
401706303101866901,101866901,PersonalFoul,Foul on Brant Byers.,13,12,1st Half,13:30,False,193,2025-01-04T18:13:28Z
401706303101866902,101866902,MadeFreeThrow,Brayden Jackson made Free Throw.,14,12,1st Half,13:30,True,2084,2025-01-04T18:13:28Z
401706303101866903,101866903,MadeFreeThrow,Brayden Jackson made Free Throw.,15,12,1st Half,13:30,True,2084,2025-01-04T18:13:28Z
401706303101868801,101868801,JumpShot,Peter Suder missed Jumper.,15,12,1st Half,13:11,False,193,2025-01-04T18:14:34Z
401706303101868901,101868901,Offensive Rebound,Miami (OH) Offensive Rebound.,15,12,1st Half,13:10,False,193,2025-01-04T18:14:35Z
401706303101869101,101869101,JumpShot,Luke Skaljac missed Three Point Jumper.,15,12,1st Half,13:08,False,193,2025-01-04T18:14:53Z
401706303101869401,101869401,Offensive Rebound,Peter Suder Offensive Rebound.,15,12,1st Half,13:05,False,193,2025-01-04T18:14:55Z
401706303101875101,101875101,Lost Ball Turnover,Reece Potter Turnover.,15,12,1st Half,12:48,False,193,2025-01-04T18:15:16Z
401706303101875102,101875102,Steal,Lloyd McVeigh Steal.,15,12,1st Half,12:48,False,2084,2025-01-04T18:15:16Z
401706303101875601,101875601,JumpShot,Anquan Boldin Jr. made Jumper. Assisted by Lloyd McVeigh.,17,12,1st Half,12:43,True,2084,2025-01-04T18:15:19Z
401706303101875602,101875602,ShortTimeOut,Miami (OH)  Timeout,17,12,1st Half,12:43,False,193,2025-01-04T18:15:19Z
401706303101876801,101876801,PersonalFoul,Foul on Anquan Boldin Jr..,17,12,1st Half,12:31,False,2084,2025-01-04T18:16:41Z
401706303101877601,101877601,JumpShot,Brant Byers made Three Point Jumper. Assisted by Luke Skaljac.,17,15,1st Half,12:23,True,193,2025-01-04T18:17:11Z
401706303101879601,101879601,Lost Ball Turnover,Ryan Sabol Turnover.,17,15,1st Half,12:03,False,2084,2025-01-04T18:17:31Z
401706303101879602,101879602,Steal,Peter Suder Steal.,17,15,1st Half,12:03,False,193,2025-01-04T18:17:31Z
401706303101879901,101879901,PersonalFoul,Foul on Lloyd McVeigh.,17,15,1st Half,12:00,False,2084,2025-01-04T18:17:35Z
401706303101879902,101879902,OfficialTVTimeOut, Official TV Timeout,17,15,1st Half,12:00,False,,2025-01-04T18:17:35Z
401706303101879903,101879903,MadeFreeThrow,Peter Suder made Free Throw.,17,16,1st Half,12:00,True,193,2025-01-04T18:17:35Z
401706303101879904,101879904,MadeFreeThrow,Peter Suder made Free Throw.,17,17,1st Half,12:00,True,193,2025-01-04T18:17:35Z
401706303101885701,101885701,JumpShot,Lloyd McVeigh missed Three Point Jumper.,17,17,1st Half,11:42,False,2084,2025-01-04T18:21:01Z
401706303101885801,101885801,Offensive Rebound,Noah Batchelor Offensive Rebound.,17,17,1st Half,11:41,False,2084,2025-01-04T18:21:18Z
401706303101886401,101886401,PersonalFoul,Foul on Antwone Woolfolk.,17,17,1st Half,11:35,False,193,2025-01-04T18:21:27Z
401706303101886601,101886601,JumpShot,Noah Batchelor missed Three Point Jumper.,17,17,1st Half,11:33,False,2084,2025-01-04T18:21:43Z
401706303101886901,101886901,Offensive Rebound,Tyson Dunn Offensive Rebound.,17,17,1st Half,11:30,False,2084,2025-01-04T18:21:46Z
401706303101888001,101888001,LayUpShot,Ben Michaels missed Layup.,17,17,1st Half,11:19,False,2084,2025-01-04T18:21:58Z
401706303101888301,101888301,Defensive Rebound,Kam Craft Defensive Rebound.,17,17,1st Half,11:16,False,193,2025-01-04T18:22:00Z
401706303101894201,101894201,JumpShot,Mekhi Cooper made Three Point Jumper. Assisted by Antwone Woolfolk.,17,20,1st Half,10:57,True,193,2025-01-04T18:22:21Z
401706303101895701,101895701,Lost Ball Turnover,Tyson Dunn Turnover.,17,20,1st Half,10:42,False,2084,2025-01-04T18:22:35Z
401706303101895702,101895702,Steal,Eian Elmer Steal.,17,20,1st Half,10:42,False,193,2025-01-04T18:22:35Z
401706303101896001,101896001,DunkShot,Eian Elmer made Dunk.,17,22,1st Half,10:39,True,193,2025-01-04T18:22:37Z
401706303101897401,101897401,JumpShot,Ryan Sabol made Three Point Jumper. Assisted by Tyson Dunn.,20,22,1st Half,10:25,True,2084,2025-01-04T18:22:53Z
401706303101899001,101899001,JumpShot,Eian Elmer made Three Point Jumper. Assisted by Mekhi Cooper.,20,25,1st Half,10:09,True,193,2025-01-04T18:23:07Z
401706303101905501,101905501,LayUpShot,Ryan Sabol made Layup.,22,25,1st Half,9:44,True,2084,2025-01-04T18:23:31Z
401706303101907101,101907101,LayUpShot,Kam Craft made Layup.,22,27,1st Half,9:28,True,193,2025-01-04T18:23:49Z
401706303101909001,101909001,JumpShot,Tyson Dunn made Three Point Jumper. Assisted by Ryan Sabol.,25,27,1st Half,9:09,True,2084,2025-01-04T18:24:07Z
401706303101915601,101915601,Lost Ball Turnover,Antwone Woolfolk Turnover.,25,27,1st Half,8:43,False,193,2025-01-04T18:24:34Z
401706303101915602,101915602,Steal,Ryan Sabol Steal.,25,27,1st Half,8:43,False,2084,2025-01-04T18:24:34Z
401706303101916201,101916201,PersonalFoul,Foul on Brant Byers.,25,27,1st Half,8:37,False,193,2025-01-04T18:24:39Z
401706303101916202,101916202,MadeFreeThrow,Tyson Dunn made Free Throw.,26,27,1st Half,8:37,True,2084,2025-01-04T18:24:39Z
401706303101916203,101916203,MadeFreeThrow,Tyson Dunn missed Free Throw.,26,27,1st Half,8:37,False,2084,2025-01-04T18:25:34Z
401706303101916401,101916401,Defensive Rebound,Peter Suder Defensive Rebound.,26,27,1st Half,8:35,False,193,2025-01-04T18:25:34Z
401706303101916402,101916402,PersonalFoul,Foul on Tyson Dunn.,26,27,1st Half,8:35,False,2084,2025-01-04T18:25:34Z
401706303101918901,101918901,JumpShot,Peter Suder made Three Point Jumper.,26,30,1st Half,8:10,True,193,2025-01-04T18:26:44Z
401706303101925401,101925401,LayUpShot,Ben Michaels missed Layup.,26,30,1st Half,7:45,False,2084,2025-01-04T18:27:09Z
401706303101925701,101925701,Defensive Rebound,Mekhi Cooper Defensive Rebound.,26,30,1st Half,7:42,False,193,2025-01-04T18:27:12Z
401706303101926501,101926501,JumpShot,Reece Potter missed ,26,30,1st Half,7:34,False,193,2025-01-04T18:27:20Z
401706303101926502,101926502,Block Shot,Ben Michaels Block.,26,30,1st Half,7:34,False,2084,2025-01-04T18:27:20Z
401706303101926801,101926801,Defensive Rebound,Ben Michaels Defensive Rebound.,26,30,1st Half,7:31,False,2084,2025-01-04T18:27:24Z
401706303101927801,101927801,JumpShot,Ben Michaels made Three Point Jumper. Assisted by Ryan Sabol.,29,30,1st Half,7:21,True,2084,2025-01-04T18:27:33Z
401706303101929701,101929701,LayUpShot,Eian Elmer missed Layup.,29,30,1st Half,7:02,False,193,2025-01-04T18:27:52Z
401706303101929901,101929901,Offensive Rebound,Eian Elmer Offensive Rebound.,29,30,1st Half,7:00,False,193,2025-01-04T18:27:54Z
401706303101934601,101934601,JumpShot,Kam Craft missed Three Point Jumper.,29,30,1st Half,6:53,False,193,2025-01-04T18:28:01Z
401706303101934701,101934701,Defensive Rebound,Ben Michaels Defensive Rebound.,29,30,1st Half,6:52,False,2084,2025-01-04T18:28:01Z
401706303101936201,101936201,PersonalFoul,Foul on Eian Elmer.,29,30,1st Half,6:37,False,193,2025-01-04T18:28:17Z
401706303101936202,101936202,OfficialTVTimeOut, Official TV Timeout,29,30,1st Half,6:37,False,,2025-01-04T18:28:17Z
401706303101938301,101938301,JumpShot,Kavon Bradford missed Jumper.,29,30,1st Half,6:16,False,2084,2025-01-04T18:31:32Z
401706303101938601,101938601,Defensive Rebound,Peter Suder Defensive Rebound.,29,30,1st Half,6:13,False,193,2025-01-04T18:31:32Z
401706303101938801,101938801,LayUpShot,Peter Suder missed Layup.,29,30,1st Half,6:11,False,193,2025-01-04T18:31:34Z
401706303101939101,101939101,Defensive Rebound,Frederiks Meinarts Defensive Rebound.,29,30,1st Half,6:08,False,2084,2025-01-04T18:31:37Z
401706303101939601,101939601,LayUpShot,Ryan Sabol missed Layup.,29,30,1st Half,6:03,False,2084,2025-01-04T18:31:42Z
401706303101939901,101939901,Defensive Rebound,Reece Potter Defensive Rebound.,29,30,1st Half,6:00,False,193,2025-01-04T18:31:45Z
401706303101945301,101945301,JumpShot,Luke Skaljac missed Jumper.,29,30,1st Half,5:46,False,193,2025-01-04T18:31:59Z
401706303101945501,101945501,Defensive Rebound,Ryan Sabol Defensive Rebound.,29,30,1st Half,5:44,False,2084,2025-01-04T18:32:02Z
401706303101946401,101946401,JumpShot,Noah Batchelor missed Jumper.,29,30,1st Half,5:35,False,2084,2025-01-04T18:32:11Z
401706303101946601,101946601,Defensive Rebound,Evan Ipsaro Defensive Rebound.,29,30,1st Half,5:33,False,193,2025-01-04T18:32:13Z
401706303101947201,101947201,JumpShot,Reece Potter missed Three Point Jumper.,29,30,1st Half,5:27,False,193,2025-01-04T18:32:18Z
401706303101947401,101947401,Defensive Rebound,Kavon Bradford Defensive Rebound.,29,30,1st Half,5:25,False,2084,2025-01-04T18:32:21Z
401706303101948901,101948901,PersonalFoul,Foul on Evan Ipsaro.,29,30,1st Half,5:10,False,193,2025-01-04T18:32:35Z
401706303101949001,101949001,PersonalFoul,Foul on Luke Skaljac.,29,30,1st Half,5:09,False,193,2025-01-04T18:33:30Z
401706303101949002,101949002,MadeFreeThrow,Ryan Sabol made Free Throw.,30,30,1st Half,5:09,True,2084,2025-01-04T18:33:30Z
401706303101949003,101949003,MadeFreeThrow,Ryan Sabol missed Free Throw.,30,30,1st Half,5:09,False,2084,2025-01-04T18:33:30Z
401706303101949101,101949101,Defensive Rebound,Peter Suder Defensive Rebound.,30,30,1st Half,5:08,False,193,2025-01-04T18:34:42Z
401706303101954501,101954501,Lost Ball Turnover,Eian Elmer Turnover.,30,30,1st Half,4:54,False,193,2025-01-04T18:34:55Z
401706303101954502,101954502,Steal,Noah Batchelor Steal.,30,30,1st Half,4:54,False,2084,2025-01-04T18:34:55Z
401706303101955501,101955501,LayUpShot,Bryson Wilson missed Layup.,30,30,1st Half,4:44,False,2084,2025-01-04T18:35:14Z
401706303101955601,101955601,Defensive Rebound,Reece Potter Defensive Rebound.,30,30,1st Half,4:43,False,193,2025-01-04T18:35:17Z
401706303101957201,101957201,LayUpShot,Reece Potter made Layup. Assisted by Peter Suder.,30,32,1st Half,4:27,True,193,2025-01-04T18:35:32Z
401706303101959301,101959301,LayUpShot,Bryson Wilson missed Layup.,30,32,1st Half,4:06,False,2084,2025-01-04T18:35:53Z
401706303101959302,101959302,Block Shot,Reece Potter Block.,30,32,1st Half,4:06,False,193,2025-01-04T18:35:53Z
401706303101959601,101959601,Offensive Rebound,Bryson Wilson Offensive Rebound.,30,32,1st Half,4:03,False,2084,2025-01-04T18:35:57Z
401706303101959901,101959901,JumpShot,Ryan Sabol made Jumper. Assisted by Tyson Dunn.,32,32,1st Half,4:00,True,2084,2025-01-04T18:36:37Z
401706303101965801,101965801,PersonalFoul,Foul on Lloyd McVeigh.,32,32,1st Half,3:41,False,2084,2025-01-04T18:36:58Z
401706303101965802,101965802,OfficialTVTimeOut, Official TV Timeout,32,32,1st Half,3:41,False,,2025-01-04T18:36:58Z
401706303101965901,101965901,DunkShot,Antwone Woolfolk made Dunk. Assisted by Kam Craft.,32,34,1st Half,3:40,True,193,2025-01-04T18:39:53Z
401706303101967501,101967501,PersonalFoul,Foul on Kam Craft.,32,34,1st Half,3:24,False,193,2025-01-04T18:39:58Z
401706303101967502,101967502,MadeFreeThrow,Ryan Sabol made Free Throw.,33,34,1st Half,3:24,True,2084,2025-01-04T18:39:58Z
401706303101967503,101967503,MadeFreeThrow,Ryan Sabol made Free Throw.,34,34,1st Half,3:24,True,2084,2025-01-04T18:39:58Z
401706303101969301,101969301,JumpShot,Peter Suder missed Three Point Jumper.,34,34,1st Half,3:06,False,193,2025-01-04T18:41:00Z
401706303101969501,101969501,Defensive Rebound,Ryan Sabol Defensive Rebound.,34,34,1st Half,3:04,False,2084,2025-01-04T18:41:03Z
401706303101974101,101974101,JumpShot,Ryan Sabol made Three Point Jumper. Assisted by Bryson Wilson.,37,34,1st Half,2:58,True,2084,2025-01-04T18:41:07Z
401706303101975201,101975201,JumpShot,Kam Craft missed Three Point Jumper.,37,34,1st Half,2:47,False,193,2025-01-04T18:41:21Z
401706303101975401,101975401,Offensive Rebound,Peter Suder Offensive Rebound.,37,34,1st Half,2:45,False,193,2025-01-04T18:41:24Z
401706303101976001,101976001,JumpShot,Peter Suder missed Jumper.,37,34,1st Half,2:39,False,193,2025-01-04T18:41:29Z
401706303101976301,101976301,Defensive Rebound,Bryson Wilson Defensive Rebound.,37,34,1st Half,2:36,False,2084,2025-01-04T18:41:31Z
401706303101976701,101976701,LayUpShot,Tyson Dunn missed Layup.,37,34,1st Half,2:32,False,2084,2025-01-04T18:41:38Z
401706303101977001,101977001,Defensive Rebound,Antwone Woolfolk Defensive Rebound.,37,34,1st Half,2:29,False,193,2025-01-04T18:41:38Z
401706303101978101,101978101,JumpShot,Brant Byers made Three Point Jumper. Assisted by Evan Ipsaro.,37,37,1st Half,2:18,True,193,2025-01-04T18:41:50Z
401706303101979601,101979601,PersonalFoul,Foul on Tyson Dunn.,37,37,1st Half,2:03,False,2084,2025-01-04T18:42:04Z
401706303101979602,101979602,Lost Ball Turnover,Tyson Dunn Turnover.,37,37,1st Half,2:03,False,2084,2025-01-04T18:42:04Z
401706303101985201,101985201,JumpShot,Brant Byers made Three Point Jumper. Assisted by Peter Suder.,37,40,1st Half,1:47,True,193,2025-01-04T18:42:44Z
401706303101987201,101987201,JumpShot,Bryson Wilson missed Three Point Jumper.,37,40,1st Half,1:27,False,2084,2025-01-04T18:43:05Z
401706303101987501,101987501,Defensive Rebound,Kam Craft Defensive Rebound.,37,40,1st Half,1:24,False,193,2025-01-04T18:43:07Z
401706303101988601,101988601,PersonalFoul,Foul on Tim Oboh.,37,40,1st Half,1:13,False,2084,2025-01-04T18:43:21Z
401706303101988602,101988602,MadeFreeThrow,Antwone Woolfolk made Free Throw.,37,41,1st Half,1:13,True,193,2025-01-04T18:43:21Z
401706303101988603,101988603,MadeFreeThrow,Antwone Woolfolk made Free Throw.,37,42,1st Half,1:13,True,193,2025-01-04T18:43:21Z
401706303101995001,101995001,PersonalFoul,Foul on Ben Michaels.,37,42,1st Half,0:49,False,2084,2025-01-04T18:44:46Z
401706303101995002,101995002,Lost Ball Turnover,Ben Michaels Turnover.,37,42,1st Half,0:49,False,2084,2025-01-04T18:44:46Z
401706303101996501,101996501,LayUpShot,Peter Suder made Layup.,37,44,1st Half,0:34,True,193,2025-01-04T18:45:22Z
401706303101996701,101996701,ShortTimeOut,Buffalo  Timeout,37,44,1st Half,0:32,False,2084,2025-01-04T18:45:22Z
401706303101999201,101999201,LayUpShot,Ryan Sabol made Layup.,39,44,1st Half,0:07,True,2084,2025-01-04T18:46:56Z
401706303101999801,101999801,PersonalFoul,Foul on Ben Michaels.,39,44,1st Half,0:01,False,2084,2025-01-04T18:47:02Z
401706303101999802,101999802,MadeFreeThrow,Peter Suder made Free Throw.,39,45,1st Half,0:01,True,193,2025-01-04T18:47:02Z
401706303101999803,101999803,MadeFreeThrow,Peter Suder made Free Throw.,39,46,1st Half,0:01,True,193,2025-01-04T18:47:02Z
401706303101999901,101999901,End Period,End of 1st half,39,46,1st Half,0:00,False,,2025-01-04T18:47:02Z
401706303102805101,102805101,JumpShot,Eian Elmer made Three Point Jumper. Assisted by Peter Suder.,39,49,2nd Half,19:48,True,193,
401706303102806801,102806801,JumpShot,Ryan Sabol made Three Point Jumper. Assisted by Tyson Dunn.,42,49,2nd Half,19:31,True,2084,
401706303102808201,102808201,JumpShot,Eian Elmer missed Three Point Jumper.,42,49,2nd Half,19:17,False,193,2025-01-04T19:05:18Z
401706303102808401,102808401,Defensive Rebound,Tyson Dunn Defensive Rebound.,42,49,2nd Half,19:15,False,2084,2025-01-04T19:05:22Z
401706303102809802,102809802,PersonalFoul,Foul on Tyson Dunn.,42,49,2nd Half,19:01,False,2084,2025-01-04T19:05:37Z
401706303102809803,102809803,Lost Ball Turnover,Tyson Dunn Turnover.,42,49,2nd Half,19:01,False,2084,2025-01-04T19:05:37Z
401706303102815401,102815401,PersonalFoul,Foul on Anquan Boldin Jr..,42,49,2nd Half,18:45,False,2084,2025-01-04T19:06:04Z
401706303102815402,102815402,MadeFreeThrow,Peter Suder made Free Throw.,42,50,2nd Half,18:45,True,193,2025-01-04T19:06:04Z
401706303102815403,102815403,MadeFreeThrow,Peter Suder made Free Throw.,42,51,2nd Half,18:45,True,193,2025-01-04T19:06:46Z
401706303102817301,102817301,Lost Ball Turnover,Anquan Boldin Jr. Turnover.,42,51,2nd Half,18:26,False,2084,2025-01-04T19:07:10Z
401706303102818701,102818701,LayUpShot,Peter Suder missed Layup.,42,51,2nd Half,18:12,False,193,2025-01-04T19:07:35Z
401706303102818702,102818702,Block Shot,Ben Michaels Block.,42,51,2nd Half,18:12,False,2084,2025-01-04T19:07:35Z
401706303102819301,102819301,Offensive Rebound,Antwone Woolfolk Offensive Rebound.,42,51,2nd Half,18:06,False,193,2025-01-04T19:07:41Z
401706303102819302,102819302,TipShot,Antwone Woolfolk made Two Point Tip Shot.,42,53,2nd Half,18:06,True,193,2025-01-04T19:07:41Z
401706303102824401,102824401,JumpShot,Ben Michaels missed Three Point Jumper.,42,53,2nd Half,17:55,False,2084,2025-01-04T19:07:53Z
401706303102824701,102824701,Defensive Rebound,Kam Craft Defensive Rebound.,42,53,2nd Half,17:52,False,193,2025-01-04T19:07:54Z
401706303102826502,102826502,JumpShot,Peter Suder missed Jumper.,42,53,2nd Half,17:34,False,193,2025-01-04T19:08:13Z
401706303102826503,102826503,Defensive Rebound,Noah Batchelor Defensive Rebound.,42,53,2nd Half,17:34,False,2084,2025-01-04T19:08:46Z
401706303102826504,102826504,PersonalFoul,Foul on Antwone Woolfolk.,42,53,2nd Half,17:34,False,193,2025-01-04T19:09:00Z
401706303102828401,102828401,JumpShot,Ben Michaels missed Jumper.,42,53,2nd Half,17:15,False,2084,2025-01-04T19:08:56Z
401706303102828402,102828402,Block Shot,Antwone Woolfolk Block.,42,53,2nd Half,17:15,False,193,2025-01-04T19:08:56Z
401706303102828801,102828801,Defensive Rebound,Peter Suder Defensive Rebound.,42,53,2nd Half,17:11,False,193,2025-01-04T19:08:56Z
401706303102828901,102828901,LayUpShot,Peter Suder made Layup.,42,55,2nd Half,17:10,True,193,2025-01-04T19:08:56Z
401706303102829001,102829001,ShortTimeOut,Buffalo  Timeout,42,55,2nd Half,17:09,False,2084,2025-01-04T19:09:00Z
401706303102829002,102829002,OfficialTVTimeOut, Official TV Timeout,42,55,2nd Half,17:09,False,,2025-01-04T19:09:00Z
401706303102834701,102834701,PersonalFoul,Foul on Antwone Woolfolk.,42,55,2nd Half,16:52,False,193,2025-01-04T19:12:09Z
401706303102834702,102834702,MadeFreeThrow,Ben Michaels missed Free Throw.,42,55,2nd Half,16:52,False,2084,2025-01-04T19:12:09Z
401706303102834703,102834703,Dead Ball Rebound,Buffalo Deadball Team Rebound.,42,55,2nd Half,16:52,False,2084,2025-01-04T19:12:09Z
401706303102834704,102834704,MadeFreeThrow,Ben Michaels made Free Throw.,43,55,2nd Half,16:52,True,2084,2025-01-04T19:12:09Z
401706303102836401,102836401,LayUpShot,Reece Potter missed Layup.,43,55,2nd Half,16:35,False,193,2025-01-04T19:13:23Z
401706303102836601,102836601,Defensive Rebound,Lloyd McVeigh Defensive Rebound.,43,55,2nd Half,16:33,False,2084,2025-01-04T19:13:23Z
401706303102837801,102837801,PersonalFoul,Foul on Reece Potter.,43,55,2nd Half,16:21,False,193,2025-01-04T19:13:35Z
401706303102838701,102838701,JumpShot,Ben Michaels missed Jumper.,43,55,2nd Half,16:12,False,2084,2025-01-04T19:14:05Z
401706303102838901,102838901,Defensive Rebound,Reece Potter Defensive Rebound.,43,55,2nd Half,16:10,False,193,2025-01-04T19:14:05Z
401706303102839901,102839901,LayUpShot,Peter Suder made Layup.,43,57,2nd Half,16:00,True,193,2025-01-04T19:14:15Z
401706303102845101,102845101,LayUpShot,Tyson Dunn missed Layup.,43,57,2nd Half,15:48,False,2084,2025-01-04T19:14:27Z
401706303102845401,102845401,Offensive Rebound,Tyson Dunn Offensive Rebound.,43,57,2nd Half,15:45,False,2084,2025-01-04T19:14:31Z
401706303102845402,102845402,TipShot,Tyson Dunn made Two Point Tip Shot.,45,57,2nd Half,15:45,True,2084,2025-01-04T19:14:31Z
401706303102846701,102846701,JumpShot,Eian Elmer missed Jumper.,45,57,2nd Half,15:32,False,193,2025-01-04T19:14:45Z
401706303102846901,102846901,Defensive Rebound,Lloyd McVeigh Defensive Rebound.,45,57,2nd Half,15:30,False,2084,2025-01-04T19:14:45Z
401706303102847401,102847401,Lost Ball Turnover,Ben Michaels Turnover.,45,57,2nd Half,15:25,False,2084,2025-01-04T19:14:49Z
401706303102847402,102847402,OfficialTVTimeOut, Official TV Timeout,45,57,2nd Half,15:25,False,,2025-01-04T19:14:49Z
401706303102849901,102849901,JumpShot,Kam Craft made Jumper.,45,59,2nd Half,15:00,True,193,2025-01-04T19:18:08Z
401706303102855201,102855201,JumpShot,Tyson Dunn made Jumper.,47,59,2nd Half,14:47,True,2084,2025-01-04T19:18:21Z
401706303102857201,102857201,JumpShot,Brant Byers made Three Point Jumper. Assisted by Evan Ipsaro.,47,62,2nd Half,14:27,True,193,2025-01-04T19:18:41Z
401706303102858901,102858901,LayUpShot,Lloyd McVeigh made Layup.,49,62,2nd Half,14:10,True,2084,2025-01-04T19:18:59Z
401706303102859801,102859801,JumpShot,Kam Craft made Three Point Jumper. Assisted by Evan Ipsaro.,49,65,2nd Half,14:01,True,193,2025-01-04T19:19:07Z
401706303102865401,102865401,JumpShot,Tyson Dunn made Three Point Jumper.,52,65,2nd Half,13:45,True,2084,2025-01-04T19:19:24Z
401706303102867301,102867301,PersonalFoul,Foul on Noah Batchelor.,52,65,2nd Half,13:26,False,2084,2025-01-04T19:19:43Z
401706303102867302,102867302,MadeFreeThrow,Kam Craft made Free Throw.,52,66,2nd Half,13:26,True,193,2025-01-04T19:19:43Z
401706303102867303,102867303,MadeFreeThrow,Kam Craft made Free Throw.,52,67,2nd Half,13:26,True,193,2025-01-04T19:19:43Z
401706303102868501,102868501,JumpShot,Noah Batchelor missed Three Point Jumper.,52,67,2nd Half,13:14,False,2084,2025-01-04T19:21:02Z
401706303102868701,102868701,Defensive Rebound,Peter Suder Defensive Rebound.,52,67,2nd Half,13:12,False,193,2025-01-04T19:21:02Z
401706303102874401,102874401,JumpShot,Kam Craft missed Three Point Jumper.,52,67,2nd Half,12:55,False,193,2025-01-04T19:21:02Z
401706303102874402,102874402,Offensive Rebound,Reece Potter Offensive Rebound.,52,67,2nd Half,12:55,False,193,2025-01-04T19:21:02Z
401706303102874403,102874403,PersonalFoul,Foul on Tyson Dunn.,52,67,2nd Half,12:55,False,2084,2025-01-04T19:21:02Z
401706303102874701,102874701,JumpShot,Kam Craft missed Jumper.,52,67,2nd Half,12:52,False,193,2025-01-04T19:21:39Z
