play_id,sequence_number,type,description,away_score,home_score,period,clock,scoring_play,team_id,timestamp_utc
401724798101805801,101805801,LayUpShot,J.J. Starling missed Layup.,0,0,1st Half,19:41,False,183,2025-01-15T00:02:50Z
401724798101806101,101806101,Defensive Rebound,James Scott Defensive Rebound.,0,0,1st Half,19:38,False,97,2025-01-15T00:02:53Z
401724798101806901,101806901,LayUpShot,Reyne Smith missed Layup.,0,0,1st Half,19:30,False,97,2025-01-15T00:03:01Z
401724798101807501,101807501,Defensive Rebound,Jyare Davis Defensive Rebound.,0,0,1st Half,19:24,False,183,2025-01-15T00:03:06Z
401724798101808301,101808301,LayUpShot,Lucas Taylor missed Layup.,0,0,1st Half,19:16,False,183,2025-01-15T00:03:15Z
401724798101808601,101808601,Defensive Rebound,Terrence Edwards Jr. Defensive Rebound.,0,0,1st Half,19:13,False,97,2025-01-15T00:03:18Z
401724798101814801,101814801,JumpShot,Terrence Edwards Jr. missed Jumper.,0,0,1st Half,18:51,False,97,2025-01-15T00:03:39Z
401724798101815101,101815101,Defensive Rebound,Eddie Lampkin Jr. Defensive Rebound.,0,0,1st Half,18:48,False,183,2025-01-15T00:03:43Z
401724798101817001,101817001,JumpShot,Elijah Moore missed Three Point Jumper.,0,0,1st Half,18:29,False,183,2025-01-15T00:04:03Z
401724798101817601,101817601,Offensive Rebound,Jyare Davis Offensive Rebound.,0,0,1st Half,18:23,False,183,2025-01-15T00:04:08Z
401724798101817602,101817602,JumpShot,Jyare Davis made Jumper.,0,2,1st Half,18:23,True,183,2025-01-15T00:04:08Z
401724798101818801,101818801,JumpShot,Chucky Hepburn made Three Point Jumper.,3,2,1st Half,18:11,True,97,2025-01-15T00:04:21Z
401724798101825301,101825301,LayUpShot,Eddie Lampkin Jr. made Layup.,3,4,1st Half,17:46,True,183,2025-01-15T00:04:46Z
401724798101827101,101827101,JumpShot,Terrence Edwards Jr. made Jumper.,5,4,1st Half,17:28,True,97,2025-01-15T00:05:03Z
401724798101828401,101828401,LayUpShot,J.J. Starling missed Layup.,5,4,1st Half,17:15,False,183,2025-01-15T00:05:20Z
401724798101828801,101828801,Defensive Rebound,Terrence Edwards Jr. Defensive Rebound.,5,4,1st Half,17:11,False,97,2025-01-15T00:05:20Z
401724798101834501,101834501,JumpShot,J'Vonne Hadley missed Three Point Jumper.,5,4,1st Half,16:54,False,97,2025-01-15T00:05:37Z
401724798101834901,101834901,Defensive Rebound,Elijah Moore Defensive Rebound.,5,4,1st Half,16:50,False,183,2025-01-15T00:05:40Z
401724798101835401,101835401,JumpShot,Lucas Taylor missed Jumper.,5,4,1st Half,16:45,False,183,2025-01-15T00:05:46Z
401724798101835701,101835701,Defensive Rebound,James Scott Defensive Rebound.,5,4,1st Half,16:42,False,97,2025-01-15T00:05:46Z
401724798101836601,101836601,JumpShot,Terrence Edwards Jr. missed Three Point Jumper.,5,4,1st Half,16:33,False,97,2025-01-15T00:05:59Z
401724798101837001,101837001,Defensive Rebound,Elijah Moore Defensive Rebound.,5,4,1st Half,16:29,False,183,2025-01-15T00:06:01Z
401724798101837201,101837201,JumpShot,J.J. Starling missed Three Point Jumper.,5,4,1st Half,16:27,False,183,2025-01-15T00:06:04Z
401724798101837501,101837501,Defensive Rebound,J'Vonne Hadley Defensive Rebound.,5,4,1st Half,16:24,False,97,2025-01-15T00:06:06Z
401724798101838201,101838201,LayUpShot,J'Vonne Hadley missed Layup.,5,4,1st Half,16:17,False,97,2025-01-15T00:06:14Z
401724798101838501,101838501,Defensive Rebound,Eddie Lampkin Jr. Defensive Rebound.,5,4,1st Half,16:14,False,183,2025-01-15T00:06:17Z
401724798101839601,101839601,JumpShot,Elijah Moore missed Three Point Jumper.,5,4,1st Half,16:03,False,183,2025-01-15T00:06:31Z
401724798101839901,101839901,Defensive Rebound,J'Vonne Hadley Defensive Rebound.,5,4,1st Half,16:00,False,97,2025-01-15T00:06:34Z
401724798101845101,101845101,LayUpShot,James Scott made Layup. Assisted by Chucky Hepburn.,7,4,1st Half,15:48,True,97,2025-01-15T00:06:45Z
401724798101847501,101847501,Lost Ball Turnover,Elijah Moore Turnover.,7,4,1st Half,15:24,False,183,2025-01-15T00:07:07Z
401724798101847502,101847502,Steal,Terrence Edwards Jr. Steal.,7,4,1st Half,15:24,False,97,2025-01-15T00:07:09Z
401724798101847901,101847901,PersonalFoul,Foul on Jyare Davis.,7,4,1st Half,15:20,False,183,2025-01-15T00:07:09Z
401724798101847902,101847902,OfficialTVTimeOut, Official TV Timeout,7,4,1st Half,15:20,False,,2025-01-15T00:07:09Z
401724798101847903,101847903,MadeFreeThrow,Terrence Edwards Jr. made Free Throw.,8,4,1st Half,15:20,True,97,2025-01-15T00:07:09Z
401724798101847904,101847904,MadeFreeThrow,Terrence Edwards Jr. made Free Throw.,9,4,1st Half,15:20,True,97,2025-01-15T00:07:09Z
401724798101849001,101849001,Lost Ball Turnover,Eddie Lampkin Jr. Turnover.,9,4,1st Half,15:09,False,183,2025-01-15T00:11:33Z
401724798101849002,101849002,Steal,Noah Waterman Steal.,9,4,1st Half,15:09,False,97,2025-01-15T00:11:33Z
401724798101849701,101849701,DunkShot,Noah Waterman made Dunk. Assisted by Chucky Hepburn.,11,4,1st Half,15:02,True,97,2025-01-15T00:11:36Z
401724798101855001,101855001,Lost Ball Turnover,J.J. Starling Turnover.,11,4,1st Half,14:49,False,183,2025-01-15T00:11:51Z
401724798101856301,101856301,DunkShot,J'Vonne Hadley made Dunk. Assisted by Chucky Hepburn.,13,4,1st Half,14:36,True,97,2025-01-15T00:12:16Z
401724798101858401,101858401,JumpShot,Lucas Taylor missed Jumper.,13,4,1st Half,14:15,False,183,2025-01-15T00:12:36Z
401724798101858701,101858701,Offensive Rebound,Eddie Lampkin Jr. Offensive Rebound.,13,4,1st Half,14:12,False,183,2025-01-15T00:12:39Z
401724798101859001,101859001,JumpShot,Jyare Davis made Three Point Jumper. Assisted by J.J. Starling.,13,7,1st Half,14:09,True,183,2025-01-15T00:12:52Z
401724798101859002,101859002,JumpShot,Terrence Edwards Jr. missed Jumper.,13,7,1st Half,14:09,False,97,2025-01-15T00:12:52Z
401724798101859003,101859003,Defensive Rebound,Jyare Davis Defensive Rebound.,13,7,1st Half,14:09,False,183,2025-01-15T00:12:52Z
401724798101859101,101859101,Lost Ball Turnover,Chris Bell Turnover.,13,7,1st Half,14:08,False,183,2025-01-15T00:13:43Z
401724798101865801,101865801,JumpShot,Chucky Hepburn missed Three Point Jumper.,13,7,1st Half,13:41,False,97,2025-01-15T00:14:15Z
401724798101866201,101866201,Defensive Rebound,Jyare Davis Defensive Rebound.,13,7,1st Half,13:37,False,183,2025-01-15T00:14:17Z
401724798101874401,101874401,PersonalFoul,Foul on Noah Waterman.,13,7,1st Half,12:55,False,97,2025-01-15T00:14:39Z
401724798101874402,101874402,MadeFreeThrow,Chris Bell missed Free Throw.,13,7,1st Half,12:55,False,183,2025-01-15T00:15:16Z
401724798101874403,101874403,Offensive Rebound,Syracuse Offensive Rebound.,13,7,1st Half,12:55,False,183,2025-01-15T00:15:16Z
401724798101874404,101874404,MadeFreeThrow,Chris Bell missed Free Throw.,13,7,1st Half,12:55,False,183,2025-01-15T00:15:16Z
401724798101874405,101874405,Defensive Rebound,Louisville Defensive Rebound.,13,7,1st Half,12:55,False,97,2025-01-15T00:15:16Z
401724798101875001,101875001,JumpShot,Noah Waterman missed Jumper.,13,7,1st Half,12:49,False,97,2025-01-15T00:15:50Z
401724798101875501,101875501,Defensive Rebound,Petar Majstorovic Defensive Rebound.,13,7,1st Half,12:44,False,183,2025-01-15T00:15:51Z
401724798101876901,101876901,JumpShot,Chris Bell made Three Point Jumper. Assisted by Jyare Davis.,13,10,1st Half,12:30,True,183,2025-01-15T00:16:08Z
401724798101878601,101878601,Lost Ball Turnover,J'Vonne Hadley Turnover.,13,10,1st Half,12:13,False,97,2025-01-15T00:16:25Z
401724798101878602,101878602,Steal,J.J. Starling Steal.,13,10,1st Half,12:13,False,183,2025-01-15T00:16:25Z
401724798101884702,101884702,OfficialTVTimeOut, Official TV Timeout,13,10,1st Half,11:52,False,,2025-01-15T00:16:47Z
401724798101884703,101884703,PersonalFoul,Foul on Petar Majstorovic.,13,10,1st Half,11:52,False,183,2025-01-15T00:16:47Z
401724798101884704,101884704,Lost Ball Turnover,Petar Majstorovic Turnover.,13,10,1st Half,11:52,False,183,2025-01-15T00:16:47Z
401724798101884705,101884705,JumpShot,Reyne Smith missed Three Point Jumper.,13,10,1st Half,11:52,False,97,2025-01-15T00:16:47Z
401724798101884706,101884706,Offensive Rebound,Aboubacar Traore Offensive Rebound.,13,10,1st Half,11:52,False,97,2025-01-15T00:16:47Z
401724798101885001,101885001,Lost Ball Turnover,Aboubacar Traore Turnover.,13,10,1st Half,11:49,False,97,2025-01-15T00:21:03Z
401724798101885002,101885002,Steal,Petar Majstorovic Steal.,13,10,1st Half,11:49,False,183,2025-01-15T00:21:03Z
401724798101885701,101885701,Lost Ball Turnover,Petar Majstorovic Turnover.,13,10,1st Half,11:42,False,183,2025-01-15T00:21:07Z
401724798101885702,101885702,Steal,Aboubacar Traore Steal.,13,10,1st Half,11:42,False,97,2025-01-15T00:21:07Z
401724798101886001,101886001,JumpShot,Reyne Smith missed Three Point Jumper.,13,10,1st Half,11:39,False,97,2025-01-15T00:21:23Z
401724798101886301,101886301,Defensive Rebound,Jyare Davis Defensive Rebound.,13,10,1st Half,11:36,False,183,2025-01-15T00:21:25Z
401724798101889201,101889201,Lost Ball Turnover,J.J. Starling Turnover.,13,10,1st Half,11:07,False,183,2025-01-15T00:21:44Z
401724798101889202,101889202,Steal,Aboubacar Traore Steal.,13,10,1st Half,11:07,False,97,2025-01-15T00:21:44Z
401724798101894601,101894601,JumpShot,Aboubacar Traore missed Jumper.,13,10,1st Half,10:53,False,97,2025-01-15T00:21:57Z
401724798101895101,101895101,Offensive Rebound,James Scott Offensive Rebound.,13,10,1st Half,10:48,False,97,2025-01-15T00:22:02Z
401724798101895102,101895102,JumpShot,James Scott made Jumper.,15,10,1st Half,10:48,True,97,2025-01-15T00:22:02Z
401724798101895501,101895501,JumpShot,Chris Bell made Three Point Jumper. Assisted by Jyare Davis.,15,13,1st Half,10:44,True,183,2025-01-15T00:22:08Z
401724798101896901,101896901,DunkShot,James Scott made Dunk. Assisted by Terrence Edwards Jr..,17,13,1st Half,10:30,True,97,2025-01-15T00:22:23Z
401724798101898901,101898901,JumpShot,Chris Bell missed Three Point Jumper.,17,13,1st Half,10:10,False,183,2025-01-15T00:23:04Z
401724798101899201,101899201,Defensive Rebound,Aboubacar Traore Defensive Rebound.,17,13,1st Half,10:07,False,97,2025-01-15T00:23:07Z
401724798101904201,101904201,LayUpShot,Aboubacar Traore made Layup. Assisted by Chucky Hepburn.,19,13,1st Half,9:57,True,97,2025-01-15T00:23:17Z
401724798101905901,101905901,JumpShot,Kyle Cuffe Jr. missed Jumper.,19,13,1st Half,9:40,False,183,2025-01-15T00:23:33Z
401724798101906301,101906301,Offensive Rebound,Eddie Lampkin Jr. Offensive Rebound.,19,13,1st Half,9:36,False,183,2025-01-15T00:23:36Z
401724798101906501,101906501,JumpShot,Petar Majstorovic missed Three Point Jumper.,19,13,1st Half,9:34,False,183,2025-01-15T00:23:39Z
401724798101907001,101907001,Offensive Rebound,Eddie Lampkin Jr. Offensive Rebound.,19,13,1st Half,9:29,False,183,2025-01-15T00:23:44Z
401724798101907002,101907002,JumpShot,Eddie Lampkin Jr. missed Jumper.,19,13,1st Half,9:29,False,183,2025-01-15T00:23:44Z
401724798101907101,101907101,Defensive Rebound,James Scott Defensive Rebound.,19,13,1st Half,9:28,False,97,2025-01-15T00:23:44Z
401724798101907102,101907102,PersonalFoul,Foul on Kyle Cuffe Jr..,19,13,1st Half,9:28,False,183,2025-01-15T00:23:44Z
401724798101909201,101909201,JumpShot,Chucky Hepburn missed Jumper.,19,13,1st Half,9:07,False,97,2025-01-15T00:24:29Z
401724798101909601,101909601,Defensive Rebound,Eddie Lampkin Jr. Defensive Rebound.,19,13,1st Half,9:03,False,183,2025-01-15T00:24:31Z
401724798101915801,101915801,LayUpShot,Kyle Cuffe Jr. made Layup.,19,15,1st Half,8:41,True,183,2025-01-15T00:24:54Z
401724798101916701,101916701,LayUpShot,Aboubacar Traore made Layup.,21,15,1st Half,8:32,True,97,2025-01-15T00:25:05Z
401724798101918901,101918901,JumpShot,Eddie Lampkin Jr. missed Jumper.,21,15,1st Half,8:10,False,183,2025-01-15T00:25:26Z
401724798101919501,101919501,Offensive Rebound,Petar Majstorovic Offensive Rebound.,21,15,1st Half,8:04,False,183,2025-01-15T00:25:32Z
401724798101919502,101919502,JumpShot,Petar Majstorovic made Jumper.,21,17,1st Half,8:04,True,183,2025-01-15T00:25:32Z
401724798101924001,101924001,JumpShot,Reyne Smith made Three Point Jumper. Assisted by James Scott.,24,17,1st Half,7:59,True,97,2025-01-15T00:25:54Z
401724798101924002,101924002,PersonalFoul,Foul on Jaquan Carlos.,24,17,1st Half,7:59,False,183,2025-01-15T00:25:54Z
401724798101924003,101924003,OfficialTVTimeOut, Official TV Timeout,24,17,1st Half,7:59,False,,2025-01-15T00:25:54Z
401724798101924004,101924004,MadeFreeThrow,Reyne Smith made Free Throw.,25,17,1st Half,7:59,True,97,2025-01-15T00:25:54Z
401724798101925101,101925101,LayUpShot,Jyare Davis missed Layup.,25,17,1st Half,7:48,False,183,2025-01-15T00:29:51Z
401724798101925102,101925102,Block Shot,Noah Waterman Block.,25,17,1st Half,7:48,False,97,2025-01-15T00:29:53Z
401724798101925601,101925601,Defensive Rebound,Reyne Smith Defensive Rebound.,25,17,1st Half,7:43,False,97,2025-01-15T00:29:53Z
401724798101925801,101925801,LayUpShot,Terrence Edwards Jr. missed Layup.,25,17,1st Half,7:41,False,97,2025-01-15T00:29:56Z
401724798101926101,101926101,Offensive Rebound,J'Vonne Hadley Offensive Rebound.,25,17,1st Half,7:38,False,97,2025-01-15T00:29:58Z
401724798101926201,101926201,JumpShot,Chucky Hepburn made Three Point Jumper. Assisted by J'Vonne Hadley.,28,17,1st Half,7:37,True,97,2025-01-15T00:29:58Z
401724798101928801,101928801,JumpShot,Kyle Cuffe Jr. made Three Point Jumper. Assisted by Eddie Lampkin Jr..,28,20,1st Half,7:11,True,183,2025-01-15T00:30:29Z
401724798101934101,101934101,PersonalFoul,Foul on Noah Waterman.,28,20,1st Half,6:58,False,97,2025-01-15T00:30:41Z
401724798101934102,101934102,Lost Ball Turnover,Noah Waterman Turnover.,28,20,1st Half,6:58,False,97,2025-01-15T00:30:41Z
401724798101935901,101935901,JumpShot,Eddie Lampkin Jr. missed Jumper.,28,20,1st Half,6:40,False,183,2025-01-15T00:31:18Z
401724798101936201,101936201,Defensive Rebound,Noah Waterman Defensive Rebound.,28,20,1st Half,6:37,False,97,2025-01-15T00:31:20Z
401724798101936601,101936601,JumpShot,Terrence Edwards Jr. made Three Point Jumper. Assisted by J'Vonne Hadley.,31,20,1st Half,6:33,True,97,2025-01-15T00:31:26Z
401724798101938901,101938901,LayUpShot,Jyare Davis made Layup. Assisted by Eddie Lampkin Jr..,31,22,1st Half,6:10,True,183,2025-01-15T00:31:48Z
401724798101944501,101944501,PersonalFoul,Foul on Reyne Smith.,31,22,1st Half,5:54,False,97,2025-01-15T00:32:04Z
401724798101944502,101944502,Lost Ball Turnover,Reyne Smith Turnover.,31,22,1st Half,5:54,False,97,2025-01-15T00:32:04Z
401724798101946501,101946501,JumpShot,Jyare Davis made Three Point Jumper. Assisted by Kyle Cuffe Jr..,31,25,1st Half,5:34,True,183,2025-01-15T00:32:53Z
401724798101947201,101947201,JumpShot,Noah Waterman missed Three Point Jumper.,31,25,1st Half,5:27,False,97,2025-01-15T00:33:04Z
401724798101948701,101948701,Offensive Rebound,Aboubacar Traore Offensive Rebound.,31,25,1st Half,5:12,False,97,2025-01-15T00:33:14Z
401724798101948901,101948901,DunkShot,Aboubacar Traore missed Dunk.,31,25,1st Half,5:10,False,97,2025-01-15T00:33:14Z
401724798101948902,101948902,Block Shot,Jyare Davis Block.,31,25,1st Half,5:10,False,183,2025-01-15T00:33:14Z
401724798101949501,101949501,Offensive Rebound,J'Vonne Hadley Offensive Rebound.,31,25,1st Half,5:04,False,97,2025-01-15T00:35:45Z
401724798101949601,101949601,LayUpShot,Terrence Edwards Jr. missed Layup.,31,25,1st Half,5:03,False,97,2025-01-15T00:35:45Z
401724798101949901,101949901,Defensive Rebound,Jyare Davis Defensive Rebound.,31,25,1st Half,5:00,False,183,2025-01-15T00:33:25Z
401724798101954201,101954201,LayUpShot,Petar Majstorovic made Layup. Assisted by J.J. Starling.,31,27,1st Half,4:57,True,183,2025-01-15T00:33:29Z
401724798101955201,101955201,LayUpShot,J'Vonne Hadley missed Layup.,31,27,1st Half,4:47,False,97,2025-01-15T00:33:39Z
401724798101955501,101955501,Offensive Rebound,Noah Waterman Offensive Rebound.,31,27,1st Half,4:44,False,97,2025-01-15T00:33:42Z
401724798101957101,101957101,JumpShot,Chucky Hepburn made Three Point Jumper. Assisted by James Scott.,34,27,1st Half,4:28,True,97,2025-01-15T00:35:04Z
401724798101959701,101959701,JumpShot,Kyle Cuffe Jr. missed Three Point Jumper.,34,27,1st Half,4:02,False,183,2025-01-15T00:35:30Z
401724798101964001,101964001,Defensive Rebound,J'Vonne Hadley Defensive Rebound.,34,27,1st Half,3:59,False,97,2025-01-15T00:35:30Z
401724798101964301,101964301,JumpShot,Chucky Hepburn made Three Point Jumper. Assisted by Reyne Smith.,37,27,1st Half,3:56,True,97,2025-01-15T00:35:38Z
401724798101965001,101965001,OfficialTVTimeOut, Official TV Timeout,37,27,1st Half,3:49,False,,2025-01-15T00:35:45Z
401724798101966101,101966101,LayUpShot,J.J. Starling missed Layup.,37,27,1st Half,3:38,False,183,2025-01-15T00:40:06Z
401724798101966401,101966401,Defensive Rebound,James Scott Defensive Rebound.,37,27,1st Half,3:35,False,97,2025-01-15T00:40:08Z
401724798101968401,101968401,JumpShot,Reyne Smith made Three Point Jumper. Assisted by Chucky Hepburn.,40,27,1st Half,3:15,True,97,2025-01-15T00:40:29Z
401724798101975701,101975701,JumpShot,Lucas Taylor missed Three Point Jumper.,40,27,1st Half,2:42,False,183,2025-01-15T00:41:02Z
401724798101976001,101976001,Defensive Rebound,James Scott Defensive Rebound.,40,27,1st Half,2:39,False,97,2025-01-15T00:41:02Z
401724798101977101,101977101,JumpShot,Chucky Hepburn missed Three Point Jumper.,40,27,1st Half,2:28,False,97,2025-01-15T00:41:16Z
401724798101977401,101977401,Defensive Rebound,Petar Majstorovic Defensive Rebound.,40,27,1st Half,2:25,False,183,2025-01-15T00:41:19Z
401724798101978201,101978201,JumpShot,Jyare Davis missed Three Point Jumper.,40,27,1st Half,2:17,False,183,2025-01-15T00:41:27Z
401724798101978601,101978601,Defensive Rebound,Terrence Edwards Jr. Defensive Rebound.,40,27,1st Half,2:13,False,97,2025-01-15T00:41:30Z
401724798101979901,101979901,LayUpShot,J'Vonne Hadley missed Layup.,40,27,1st Half,2:00,False,97,2025-01-15T00:41:43Z
401724798101979902,101979902,Block Shot,Chris Bell Block.,40,27,1st Half,2:00,False,183,2025-01-15T00:41:47Z
401724798101984301,101984301,Defensive Rebound,Petar Majstorovic Defensive Rebound.,40,27,1st Half,1:56,False,183,2025-01-15T00:41:47Z
401724798101984901,101984901,JumpShot,Chris Bell missed Three Point Jumper.,40,27,1st Half,1:50,False,183,2025-01-15T00:41:55Z
401724798101985301,101985301,Defensive Rebound,Reyne Smith Defensive Rebound.,40,27,1st Half,1:46,False,97,2025-01-15T00:41:57Z
401724798101986501,101986501,JumpShot,Chucky Hepburn made Three Point Jumper. Assisted by James Scott.,43,27,1st Half,1:34,True,97,2025-01-15T00:47:46Z
401724798101988001,101988001,PersonalFoul,Foul on James Scott.,43,27,1st Half,1:19,False,97,2025-01-15T00:42:24Z
401724798101994101,101994101,JumpShot,Lucas Taylor missed Three Point Jumper.,43,27,1st Half,0:58,False,183,2025-01-15T00:43:34Z
401724798101994102,101994102,Defensive Rebound,Khani Rooths Defensive Rebound.,43,27,1st Half,0:58,False,97,2025-01-15T00:43:34Z
401724798101994103,101994103,Lost Ball Turnover,Chucky Hepburn Turnover.,43,27,1st Half,0:58,False,97,2025-01-15T00:43:34Z
401724798101995201,101995201,Lost Ball Turnover,J.J. Starling Turnover.,43,27,1st Half,0:47,False,183,2025-01-15T00:44:13Z
401724798101995801,101995801,ShortTimeOut,Louisville  Timeout,43,27,1st Half,0:41,False,97,2025-01-15T00:44:28Z
401724798101997701,101997701,JumpShot,Reyne Smith missed Three Point Jumper.,43,27,1st Half,0:22,False,97,2025-01-15T00:45:51Z
401724798101997901,101997901,Defensive Rebound,Eddie Lampkin Jr. Defensive Rebound.,43,27,1st Half,0:20,False,183,2025-01-15T00:45:51Z
401724798101999901,101999901,End Period,End of 1st half,43,27,1st Half,0:00,False,,2025-01-15T00:47:46Z
401724798102804701,102804701,JumpShot,Jaquan Carlos missed Jumper.,43,27,2nd Half,19:52,False,183,
401724798102805301,102805301,Defensive Rebound,Reyne Smith Defensive Rebound.,43,27,2nd Half,19:46,False,97,
401724798102805901,102805901,JumpShot,Reyne Smith made Three Point Jumper. Assisted by Chucky Hepburn.,46,27,2nd Half,19:40,True,97,
401724798102806901,102806901,PersonalFoul,Foul on Terrence Edwards Jr..,46,27,2nd Half,19:30,False,97,2025-01-15T01:04:59Z
401724798102808401,102808401,JumpShot,J.J. Starling made Jumper.,46,29,2nd Half,19:15,True,183,2025-01-15T01:05:38Z
401724798102809801,102809801,PersonalFoul,Foul on Lucas Taylor.,46,29,2nd Half,19:01,False,183,2025-01-15T01:05:54Z
401724798102809802,102809802,MadeFreeThrow,Chucky Hepburn made Free Throw.,47,29,2nd Half,19:01,True,97,2025-01-15T01:05:54Z
401724798102809803,102809803,MadeFreeThrow,Chucky Hepburn made Free Throw.,48,29,2nd Half,19:01,True,97,2025-01-15T01:05:54Z
401724798102815401,102815401,JumpShot,Jaquan Carlos made Three Point Jumper. Assisted by J.J. Starling.,48,32,2nd Half,18:45,True,183,2025-01-15T01:06:48Z
401724798102817001,102817001,Lost Ball Turnover,James Scott Turnover.,48,32,2nd Half,18:29,False,97,2025-01-15T01:07:05Z
401724798102817002,102817002,Steal,Jyare Davis Steal.,48,32,2nd Half,18:29,False,183,2025-01-15T01:07:05Z
401724798102818201,102818201,LayUpShot,Jaquan Carlos missed Layup.,48,32,2nd Half,18:17,False,183,2025-01-15T01:07:16Z
401724798102818202,102818202,Block Shot,Reyne Smith Block.,48,32,2nd Half,18:17,False,97,2025-01-15T01:07:16Z
401724798102818901,102818901,Offensive Rebound,Jaquan Carlos Offensive Rebound.,48,32,2nd Half,18:10,False,183,2025-01-15T01:07:22Z
401724798102818902,102818902,JumpShot,Jaquan Carlos made Jumper.,48,34,2nd Half,18:10,True,183,2025-01-15T01:07:22Z
401724798102819901,102819901,JumpShot,J'Vonne Hadley made Three Point Jumper. Assisted by Reyne Smith.,51,34,2nd Half,18:00,True,97,2025-01-15T01:07:34Z
401724798102826401,102826401,JumpShot,J.J. Starling missed Three Point Jumper.,51,34,2nd Half,17:35,False,183,2025-01-15T01:07:57Z
401724798102826801,102826801,Defensive Rebound,J'Vonne Hadley Defensive Rebound.,51,34,2nd Half,17:31,False,97,2025-01-15T01:07:59Z
401724798102828801,102828801,LayUpShot,James Scott missed Layup.,51,34,2nd Half,17:11,False,97,2025-01-15T01:08:24Z
401724798102829201,102829201,Defensive Rebound,Lucas Taylor Defensive Rebound.,51,34,2nd Half,17:07,False,183,2025-01-15T01:08:24Z
401724798102835001,102835001,JumpShot,Lucas Taylor missed Jumper.,51,34,2nd Half,16:49,False,183,2025-01-15T01:08:44Z
401724798102835301,102835301,Defensive Rebound,Chucky Hepburn Defensive Rebound.,51,34,2nd Half,16:46,False,97,2025-01-15T01:08:46Z
401724798102837701,102837701,JumpShot,Chucky Hepburn made Jumper.,53,34,2nd Half,16:22,True,97,2025-01-15T01:09:39Z
401724798102844501,102844501,Lost Ball Turnover,Jaquan Carlos Turnover.,53,34,2nd Half,15:54,False,183,2025-01-15T01:10:10Z
401724798102844502,102844502,OfficialTVTimeOut, Official TV Timeout,53,34,2nd Half,15:54,False,,2025-01-15T01:10:10Z
401724798102845901,102845901,LayUpShot,Terrence Edwards Jr. made Layup.,55,34,2nd Half,15:40,True,97,2025-01-15T01:14:08Z
401724798102847901,102847901,JumpShot,Jaquan Carlos missed Three Point Jumper.,55,34,2nd Half,15:20,False,183,2025-01-15T01:14:28Z
401724798102848001,102848001,Offensive Rebound,Syracuse Offensive Rebound.,55,34,2nd Half,15:19,False,183,2025-01-15T01:14:34Z
401724798102848002,102848002,PersonalFoul,Foul on Noah Waterman.,55,34,2nd Half,15:19,False,97,2025-01-15T01:14:34Z
401724798102848003,102848003,JumpShot,Chris Bell made Jumper. Assisted by Petar Majstorovic.,55,36,2nd Half,15:19,True,183,2025-01-15T01:14:34Z
401724798102848004,102848004,JumpShot,Terrence Edwards Jr. missed Three Point Jumper.,55,36,2nd Half,15:19,False,97,2025-01-15T01:14:34Z
401724798102848005,102848005,Offensive Rebound,J'Vonne Hadley Offensive Rebound.,55,36,2nd Half,15:19,False,97,2025-01-15T01:14:34Z
401724798102848006,102848006,JumpShot,Noah Waterman missed Three Point Jumper.,55,36,2nd Half,15:19,False,97,2025-01-15T01:14:34Z
401724798102848201,102848201,Defensive Rebound,Jyare Davis Defensive Rebound.,55,36,2nd Half,15:17,False,183,2025-01-15T01:15:34Z
401724798102855201,102855201,JumpShot,Chris Bell made Jumper.,55,38,2nd Half,14:47,True,183,2025-01-15T01:15:48Z
401724798102856301,102856301,LayUpShot,Noah Waterman missed Layup.,55,38,2nd Half,14:36,False,97,2025-01-15T01:15:54Z
401724798102856701,102856701,Defensive Rebound,Jyare Davis Defensive Rebound.,55,38,2nd Half,14:32,False,183,2025-01-15T01:15:54Z
401724798102857101,102857101,JumpShot,Chris Bell missed Three Point Jumper.,55,38,2nd Half,14:28,False,183,2025-01-15T01:16:07Z
401724798102857501,102857501,Defensive Rebound,J'Vonne Hadley Defensive Rebound.,55,38,2nd Half,14:24,False,97,2025-01-15T01:16:07Z
401724798102864101,102864101,LayUpShot,Aboubacar Traore made Layup.,57,38,2nd Half,13:58,True,97,2025-01-15T01:16:16Z
401724798102866201,102866201,PersonalFoul,Foul on Noah Waterman.,57,38,2nd Half,13:37,False,97,2025-01-15T01:16:38Z
401724798102866202,102866202,MadeFreeThrow,J.J. Starling made Free Throw.,57,39,2nd Half,13:37,True,183,2025-01-15T01:16:38Z
401724798102866203,102866203,MadeFreeThrow,J.J. Starling made Free Throw.,57,40,2nd Half,13:37,True,183,2025-01-15T01:16:38Z
401724798102867701,102867701,LayUpShot,James Scott made Layup. Assisted by J'Vonne Hadley.,59,40,2nd Half,13:22,True,97,2025-01-15T01:18:04Z
401724798102869601,102869601,Lost Ball Turnover,Jaquan Carlos Turnover.,59,40,2nd Half,13:03,False,183,2025-01-15T01:18:31Z
401724798102876301,102876301,PersonalFoul,Foul on Jyare Davis.,59,40,2nd Half,12:36,False,183,2025-01-15T01:19:03Z
401724798102877101,102877101,JumpShot,J'Vonne Hadley made Jumper.,61,40,2nd Half,12:28,True,97,2025-01-15T01:19:28Z
401724798102879101,102879101,LayUpShot,Eddie Lampkin Jr. made Layup. Assisted by Jaquan Carlos.,61,42,2nd Half,12:08,True,183,2025-01-15T01:19:46Z
401724798102884401,102884401,JumpShot,Chucky Hepburn made Jumper.,63,42,2nd Half,11:55,True,97,2025-01-15T01:20:00Z
401724798102886501,102886501,LayUpShot,Eddie Lampkin Jr. made Layup.,63,44,2nd Half,11:34,True,183,2025-01-15T01:20:20Z
401724798102887301,102887301,JumpShot,Chucky Hepburn missed Three Point Jumper.,63,44,2nd Half,11:26,False,97,2025-01-15T01:20:29Z
401724798102887601,102887601,Defensive Rebound,Eddie Lampkin Jr. Defensive Rebound.,63,44,2nd Half,11:23,False,183,2025-01-15T01:20:33Z
